Title,Content,Link,Summary,Preprocessed_Content,Date
逾千三在囚人遷新監獄,保安部門協助過程順利   逾千三在囚人遷新監獄    【本報消息】懲教管理局昨日展開路環監獄搬遷工作，早上在多個警方部門協助下轉移逾千三名在囚人。因應搬遷工作，路環多條馬路臨時交通管制，交通警員在場指揮交通，適時開放路面疏導車流。受封路影響，路環市區一度擠塞，整體交通情況良好。搬遷行動至中午約十二時提早結束，過程順利。    沿途多處交通管制    據懲教局去年的年報顯示，路環監獄共收容了一千三百五十五名在囚人，當中一千〇八十七人是已判刑的犯人，另外二百六十八名被羈押者等候審判。故昨日遷移的在囚人超過一千三百人。    爲協助懲教管理局遷移路環監獄的在囚人往新監獄，治安警轄下多個單位派員協助，包括與相關單位組成押解車隊並執行沿途安保措施、維持押解路線和監獄設施外圍的公共秩序，以及維持路環一帶的交通秩序。昨早現場所見，治安警、司警等安排小巴運載在囚人，在電單車開路和沿途護送下，將在囚人轉移至新監獄。竹灣馬路和黑沙馬路兩側、靠近新監獄一側的九澳高頂馬路部分公共泊位全被圍封，禁止泊車。    車隊途經時，現場警員會呼籲途人離開，以免影響運送，現場氣氛頗為緊張。受措施影響，恩尼斯總統前地、鄉村馬路等周邊道路偶有車龍，為疏導交通，警員適時開放路面，讓現場車輛離開。    多條巴士線須改道    因配合轉移在囚人，交通部門日前向外公佈，路環黑沙馬路、竹灣馬路及九澳堤壩馬路等昨日“朝七晚八”交通管制，路環島全日禁飛無人機。受臨時管制措施影響，多條巴士路線改道，15T路線到達和諧廣場後取道和諧大馬路及竹灣馬路前往黑沙海灘；15、21A及26A路線由九澳或黑沙取道九澳高頂馬路前往聯生圓形地。黑沙馬路往路環市區的乘客，需先乘搭巴士前往聯生圓形地一帶，再轉乘往黑沙路線前往目的地附近站點。    居民配合提早解封    搬遷期間，警方安排警車及膠馬封閉恩尼斯總統前地往竹灣馬路交界，禁止車輛駛入管制區，並安排警員指示途經車輛行車方向。有工程車遇上臨時措施無法駛往竹灣馬路，在警方安排下駛到打纜街等候，避免阻礙其他車輛。鄉村馬路亦一度擠塞，部分司機不清楚臨時措施“響號”表達不滿，亦有乘客下車了解情況，得悉後回車等候放行。轉移過程順利，臨時管制措施昨日中午約十二時提早結束。    舊監獄今停止運作    路環監獄今日起停止運作，所有服務如探訪在囚人、傳遞物品及會見社工等，均遷往九澳堤壩馬路懲教局路環監獄。居民查詢可於辦公時間致電二八八八 · 一二一一。,http://www.macaodaily.com/html/2024-10/20/content_1788685.htm,多條巴士線須改道    因配合轉移在囚人，交通部門日前向外公佈，路環黑沙馬路、竹灣馬路及九澳堤壩馬路等昨日“朝七晚八”交通管制，路環島全日禁飛無人機,保安 部門 協助 過程 順利       逾 千三 在 囚人 遷新 監獄         【 本報 消息 】 懲教 管理局 昨日 展開路 環監獄 搬 遷 工作 ， 早上 在 多個 警方 部門 協助 下 轉移 逾 千 三名 在 囚人 。 因應 搬 遷 工作 ， 路 環多 條馬路 臨時 交通管制 ， 交通警 員在場 指揮 交通 ， 適時 開放 路面 疏導 車流 。 受 封路 影響 ， 路環 市區 一度 擠塞 ， 整體 交通 情況 良好 。 搬遷 行動 至 中午 約 十二 時 提早 結束 ， 過程 順利 。         沿途 多處 交通管制         據懲 教局 去年 的 年 報 顯示 ， 路環 監獄 共 收容 了 一千三百 五 十五名 在 囚人 ， 當中 一千 〇 八十七 人 是 已 判刑 的 犯人 ， 另外 二百六十 八名 被 羈押者 等候 審判 。 故 昨日 遷移 的 在 囚人 超過 一千三百 人 。         爲 協助 懲教 管理局 遷移路 環監獄 的 在 囚人 往新 監獄 ， 治安警 轄 下 多個 單位 派員 協助 ， 包括 與 相關 單位 組成 押解 車隊 並執行 沿途 安保 措施 、 維持 押解 路線 和 監獄 設施 外圍 的 公共秩序 ， 以及 維持 路 環一帶 的 交通秩序 。 昨早 現場 所見 ， 治安警 、 司警 等 安排 小巴 運載 在 囚人 ， 在 電單車 開路 和 沿途 護送 下 ， 將在 囚人 轉 移至 新 監獄 。 竹灣馬路 和 黑沙 馬 路 兩側 、 靠近 新 監獄 一側 的 九 澳高 頂馬路 部分 公共 泊位 全 被 圍封 ， 禁止 泊車 。         車隊 途經時 ， 現場 警員會 呼籲 途人 離開 ， 以免 影響 運送 ， 現場 氣氛 頗 為 緊張 。 受 措施 影響 ， 恩 尼斯 總統 前 地 、 鄉 村馬路 等 周邊 道路 偶有 車龍 ， 為 疏導 交通 ， 警員 適時 開放 路面 ， 讓 現場 車輛 離開 。         多條 巴士 線須 改道         因 配合 轉移 在 囚人 ， 交通部 門 日前 向 外公 佈 ， 路環 黑沙 馬 路 、 竹灣馬路 及 九 澳堤 壩馬路 等 昨日 “ 朝七晚 八 ” 交通管制 ， 路 環島 全日 禁飛 無人機 。 受臨 時 管制 措施 影響 ， 多條 巴士 路線 改道 ， 15T 路線 到 達 和 諧廣場 後 取道 和 諧大馬路 及 竹灣馬路 前往 黑 沙海 灘 ； 15 、 21A 及 26A 路線 由九澳 或 黑沙 取道 九澳高 頂馬路 前往 聯生 圓形 地 。 黑沙 馬 路 往路 環市區 的 乘客 ， 需先 乘 搭 巴士 前往 聯生 圓形 地 一帶 ， 再轉 乘往 黑沙 路線 前往 目的地 附近 站點 。         居民 配合 提早 解封         搬遷 期間 ， 警方 安排 警車 及 膠馬封 閉恩 尼斯 總統 前 地往 竹灣馬路 交界 ， 禁止 車輛 駛入 管制 區 ， 並 安排 警員 指示 途經 車輛 行車 方向 。 有 工程 車 遇上 臨時 措施 無法駛往 竹灣馬路 ， 在 警方 安排 下駛到 打纜 街 等候 ， 避免 阻礙 其他 車輛 。 鄉 村馬路 亦 一度 擠塞 ， 部分 司機 不 清楚 臨時 措施 “ 響號 ” 表達 不滿 ， 亦 有 乘客 下車 了解 情況 ， 得悉 後 回車 等候 放行 。 轉移 過程 順利 ， 臨時 管制 措施 昨日 中午 約 十二 時 提早 結束 。         舊 監獄 今 停止 運作         路環 監獄 今日 起 停止 運作 ， 所有 服務如 探訪 在 囚人 、 傳遞 物品 及會 見 社工 等 ， 均 遷往 九 澳堤 壩馬路懲 教局 路環 監獄 。 居民 查詢 可 於 辦公時間 致電 二八 八八   ·   一二 一一 。,2024-10-20
新監獄歷廿載建成,原計劃一四年末季竣工    多原因延誤    新監獄歷廿載建成    【本報消息】早於〇五年立項的新監獄建造工程，經歷多番波折及延誤，昨正式投用，囚犯遷入，歷程近廿年。    新監獄共分四期施工    新監獄建造早在〇五年立項，一〇年八月十八日正式動工，佔地二萬六千四百二十一平方米，總建築面積約六萬九千二百二十五平方米。工程分四期，原計劃整項工程於一四年第四季完成。但因各種原因而延誤，終在昨日投入運作。    新監獄建設分四期施工。第一期是建造外圍道路、瞭望塔、電力分站及石油氣房；第二期建造工廠、囚倉及綜合大樓；第三期建造行政大樓、保安檢查主樓、員工宿舍及訓練大樓；第四期建造保安系統、通訊系統、網絡系統及弱電工程。    據立法會財政事務跟進委員會跟進《新監獄興建進度及工程支出情況》報告書顯示，新監獄建設工程項目自〇五年立項至一〇年動工，由最初預計一四年竣工，到最新預計今年完成。整項工程延誤長達十年。政府曾表示，工程延誤主因是承建商能力及建造材料質量問題，例如承建商提供的防彈玻璃材料不合標準。    舊監獄或交保安高校    報告書提到，新監獄的最大收容量為二千七百〇四人，截至二二年八月七日，路環監獄收容了一千四百二十六人，約佔新監獄最大收容量的百分之五十三。參考監獄近十年入獄人數平均升幅約百分之二點四，按升幅推算，新監獄能滿足未來二十年需求。    騰空了的路環監獄未來用途，政府未有詳細說明。翻查資料，當局曾在一〇年表示，規劃將路環監獄作為保安高校分校。早年民間亦提議將該幅偌大土地與路環舊區一併規劃活化。保安司司長黃少澤二〇年回覆議員時表示，一〇年規劃的新監獄落成搬遷後，原路環監獄土地交由保安高校使用，但仍待政府高層決定。,http://www.macaodaily.com/html/2024-10/20/content_1788686.htm,原計劃一四年末季竣工    多原因延誤    新監獄歷廿載建成    【本報消息】早於〇五年立項的新監獄建造工程，經歷多番波折及延誤，昨正式投用，囚犯遷入，歷程近廿年,原計劃 一 四年 末季 竣工         多 原因 延誤         新 監獄 歷廿載 建成         【 本報 消息 】 早 於 〇 五年 立項 的 新 監獄 建造 工程 ， 經歷 多番 波折 及延誤 ， 昨 正式 投用 ， 囚犯 遷入 ， 歷程 近 廿年 。         新監 獄共分 四期 施工         新 監獄 建造 早 在 〇 五年 立項 ， 一 〇 年 八月 十八日 正式 動工 ， 佔 地二萬 六千 四百 二十一 平方米 ， 總建築 面積 約 六 萬 九千 二百二十五 平方米 。 工程 分 四期 ， 原計劃 整項 工程 於 一 四年 第四季 完成 。 但 因 各種 原因 而延 誤 ， 終在 昨日 投入 運作 。         新 監獄 建設 分 四期 施工 。 第一期 是 建造 外圍 道路 、 瞭望 塔 、 電力 分站 及 石油 氣房 ； 第二期 建造 工廠 、 囚倉 及 綜合大樓 ； 第三期 建造 行政 大樓 、 保安 檢查 主樓 、 員工 宿舍 及 訓練 大樓 ； 第四期 建造 保安 系統 、 通訊系統 、 網絡系 統及 弱電 工程 。         據 立法 會財 政事 務 跟 進委員會 跟 進 《 新 監獄 興建 進度 及 工程 支出 情況 》 報告 書 顯示 ， 新 監獄 建設 工程 項目 自 〇 五年 立項 至 一 〇 年動工 ， 由 最初 預計 一 四年 竣工 ， 到 最新 預計 今年 完成 。 整項 工程 延誤 長 達 十年 。 政府 曾 表示 ， 工程 延誤 主因 是 承建商 能力 及 建造 材料 質量 問題 ， 例如 承建商 提供 的 防彈 玻璃 材料 不合 標準 。         舊 監獄 或 交 保安 高校         報告 書 提到 ， 新 監獄 的 最大 收 容量 為 二千 七百 〇 四人 ， 截至 二 二年 八月 七日 ， 路環 監獄 收容 了 一千四百 二十六 人 ， 約 佔 新 監獄 最大 收 容量 的 百分之五十 三 。 參考 監獄 近十年 入獄 人數 平均 升幅 約 百分之二 點四 ， 按 升幅 推算 ， 新 監獄 能 滿足 未來 二十年 需求 。         騰空 了 的 路 環監獄 未來 用途 ， 政府 未有 詳細 說明 。 翻查 資料 ， 當局 曾 在 一 〇 年 表示 ， 規劃 將路 環監獄 作為 保安 高校 分校 。 早年 民間 亦 提議 將該 幅 偌大 土地 與 路 環舊區 一 併 規劃 活化 。 保安 司司 長 黃 少澤二 〇 年 回覆 議員時 表示 ， 一 〇 年 規劃 的 新 監獄 落成 搬遷 後 ， 原路 環監獄 土地 交由 保安 高校 使用 ， 但 仍 待 政府 高層 決定 。,2024-10-20
路環街坊讚遷囚快捷有序,路環街坊讚遷囚快捷有序    【本報消息】懲教局昨遷移一千三百多名囚犯至九澳新監獄，路環街坊認為整體安排有序，十分順利，把社區影響減至最低。    信義福利會會長楊景開表示，路環監獄搬遷前夕，當局先後發函通知路環舊城區及九澳、黑沙商戶、街坊，尤其各相關團體，並於本月十八日約見，詳細闡述各項搬遷細節，包括移送時間、安保情況等，希望街坊全力配合，交流氣氛很好。    昨日中午，當局提早完成搬遷工作，很快恢復交通，亦即時向路環街坊及商戶乃至團體等發佈訊息，做法妥當。街坊衷心希望政府與民間加強溝通，進一步善用原路環監獄土地，不妨興建主題公園或大型停車場，致力盤活路環，促進多元旅遊，為舊城區及兩村落發展帶來生機。,http://www.macaodaily.com/html/2024-10/20/content_1788687.htm,信義福利會會長楊景開表示，路環監獄搬遷前夕，當局先後發函通知路環舊城區及九澳、黑沙商戶、街坊，尤其各相關團體，並於本月十八日約見，詳細闡述各項搬遷細節，包括移送時間、安保情況等，希望街坊全力配合，交流氣氛很好,路環 街坊 讚 遷 囚 快捷 有序         【 本報 消息 】 懲 教局 昨遷 移 一千三百 多名 囚犯 至 九 澳新 監獄 ， 路環 街坊 認為 整體 安排 有序 ， 十分 順利 ， 把 社區 影響 減至 最低 。         信義 福利 會會長 楊景開 表示 ， 路環 監獄 搬 遷 前夕 ， 當局 先後發 函 通知 路 環舊 城區 及九澳 、 黑沙 商戶 、 街坊 ， 尤其 各相關 團體 ， 並 於 本月 十八日 約 見 ， 詳細 闡述 各項 搬 遷 細節 ， 包括 移送 時間 、 安保 情況 等 ， 希望 街坊 全力 配合 ， 交流 氣氛 很 好 。         昨日 中午 ， 當局 提早 完成 搬遷 工作 ， 很快 恢 復 交通 ， 亦 即 時 向 路環 街坊 及 商戶 乃至 團體 等 發 佈 訊息 ， 做法 妥當 。 街坊 衷心希望 政府 與民間 加強 溝通 ， 進 一步 善用 原路 環監獄 土地 ， 不妨 興建主題 公園 或 大型 停車場 ， 致力 盤 活路 環 ， 促進 多元 旅遊 ， 為 舊 城區 及 兩 村落 發展 帶來 生機 。,2024-10-20
本澳監獄數度遷址   本報記者,本澳監獄數度遷址    本澳監獄的歷史可追溯至數百年前。最初設在“議事亭”內，即現時的市政署大樓。    隨着社會發展，人口不斷增加，犯罪率上升。一九一二年，當時的澳葡政府在賈伯樂提督街與鏡湖馬路交界的紅毛山頂興建“中央監獄”。“中央監獄”初建及啟用時，所處地段十分荒涼，直至上世紀五十年代，該區迅速發展，民居迭起，“中央監獄”才變成位於市中心監獄，因此俗稱“市牢”。惟被民居包圍的“市牢”不時發生越獄事件，加上“囚滿為患”，澳葡政府決意另起監獄。    一九九〇年五月十八日，“路環監獄”建成啟用後，澳葡政府將“市牢”及路環青年監獄的囚犯遷入，路環監獄便一直沿用至今。“市牢”亦已改建成住宅大廈。    本報記者,http://www.macaodaily.com/html/2024-10/20/content_1788688.htm,“中央監獄”初建及啟用時，所處地段十分荒涼，直至上世紀五十年代，該區迅速發展，民居迭起，“中央監獄”才變成位於市中心監獄，因此俗稱“市牢”,本澳 監獄 數度 遷址         本澳 監獄 的 歷史 可追溯 至數 百年 前 。 最初 設在 “ 議事亭 ” 內 ， 即現 時 的 市政 署大樓 。         隨着 社會 發展 ， 人口 不斷 增加 ， 犯罪率 上升 。 一九一二年 ， 當時 的 澳 葡 政府 在 賈伯樂 提督 街 與 鏡 湖馬路 交界 的 紅毛山 頂興建 “ 中央 監獄 ” 。 “ 中央 監獄 ” 初建 及 啟用 時 ， 所處 地段 十分 荒涼 ， 直至 上世紀 五十年代 ， 該區 迅速 發展 ， 民居 迭起 ， “ 中央 監獄 ” 才 變成位 於 市中心 監獄 ， 因此 俗稱 “ 市牢 ” 。 惟 被 民居 包圍 的 “ 市牢 ” 不時 發生 越獄 事件 ， 加上 “ 囚滿 為 患 ” ， 澳 葡 政府 決意 另 起 監獄 。         一九九 〇 年 五月 十八日 ， “ 路環 監獄 ” 建成 啟用 後 ， 澳 葡 政府 將 “ 市牢 ” 及路環 青年 監獄 的 囚犯 遷入 ， 路環 監獄 便 一直 沿用至今 。 “ 市牢 ” 亦 已 改建 成 住宅 大廈 。         本報 記者,2024-10-20
房局大樓設計連裝修逾1.1億,判給閩建廣建興聯合經營體    房局大樓設計連裝修逾1.1億    【本報消息】房屋局大樓重建工程預計明年一月竣工，房屋局早前着手大樓的設計連裝修工程公開招標工作，目前已判給並處於合同階段，判給金額一億一千六百多萬元。    房屋局大樓因不敷應用，於二○一九年拆卸並在原址重建，大樓重建的樁基礎工程於二○二二年一月完成，同年八月開展大樓的地庫連上蓋工程，預計明年一月竣工。大樓的地庫連上蓋工程判給價為二億五千七百○一萬多元，獲判給實體為新建設-廣建興-閩建合作經營，工程雖曾受新冠疫情影響延誤十四個工作天，但根據最新更新的運輸工務範疇超過一億元工程進度顯示並沒有出現超時，反而價格減少百分之○點三。    根據公共建設局網站提供圖片顯示，去年十二月正進行天面層上蓋結構工程，今年三月、六月、九月公佈的圖片均顯示在進行內部裝修，包括油漆、貼牆磚等。雖然公共建設局正為大樓進行內部裝修，但房屋局今年六月份為“房屋局大樓重建工程——設計連裝修工程”公開招標。    房屋局於網站公佈判給結果，獲判給實體為閩建-廣建興聯合經營體，判給金額為一億一千六百六十八萬四千元，根據標書顯示，裝修工程費用為一億一千三百八十四萬四千元，設計費用為二百八十四萬元，總設計連施工期三百九十八個工作天。目前處於合同階段，暫未公佈開工日期及合約竣工日。    房屋局總部辦公大樓位於澳門沙梨頭北巷一○二號，土地總面積一千四百八十四平方米，座地面積約一千四百三十平方米，樓高二十三層及兩層地庫，總建築面積約二萬六千平方米。按用家工作需求，大樓設接待區、辦公室、會議室及停車場等。,http://www.macaodaily.com/html/2024-10/20/content_1788689.htm,判給閩建廣建興聯合經營體    房局大樓設計連裝修逾1.1億    【本報消息】房屋局大樓重建工程預計明年一月竣工，房屋局早前着手大樓的設計連裝修工程公開招標工作，目前已判給並處於合同階段，判給金額一億一千六百多萬元,判給 閩 建廣建興 聯合 經營體         房局 大樓 設計 連裝修 逾 1.1 億         【 本報 消息 】 房屋 局大樓 重建 工程 預計 明年 一月 竣工 ， 房屋 局 早前 着手 大樓 的 設計 連裝修 工程 公開 招標 工作 ， 目前 已判給 並處 於 合同 階段 ， 判給 金額 一 億 一千六百 多萬元 。         房屋 局大樓 因 不 敷 應用 ， 於 二 ○ 一 九年 拆卸 並在 原址 重建 ， 大樓 重建 的 樁 基礎 工程 於 二 ○ 二 二年 一月 完成 ， 同年 八月 開展 大樓 的 地庫 連上 蓋 工程 ， 預計 明年 一月 竣工 。 大樓 的 地庫 連上 蓋 工程 判給 價為 二 億 五千 七百 ○ 一萬 多元 ， 獲判給 實體 為 新建 設 - 廣建興 - 閩建 合作 經營 ， 工程 雖 曾 受 新冠 疫情 影響 延誤 十四 個 工作 天 ， 但 根據 最新更新 的 運輸 工務範疇 超過 一億元 工程 進度 顯示 並沒有 出現 超時 ， 反而 價格 減少 百分之 ○ 點三 。         根據 公共 建設 局網 站 提供 圖片 顯示 ， 去年 十二月 正進 行天 面層 上 蓋 結構 工程 ， 今年 三月 、 六月 、 九月 公 佈 的 圖片 均 顯示 在 進行 內部 裝修 ， 包括 油漆 、 貼 牆磚 等 。 雖然 公共 建設局 正為 大樓 進行 內部 裝修 ， 但 房屋 局 今年 六月份 為 “ 房屋 局大樓 重建 工程 — — 設計 連裝修 工程 ” 公開 招標 。         房屋 局 於 網站 公 佈 判給 結果 ， 獲判給 實體 為 閩建 - 廣建興 聯合 經營體 ， 判給 金額 為 一 億 一千六百 六十八 萬 四千元 ， 根據 標書 顯示 ， 裝修 工程 費用 為 一 億 一千 三百八十四 萬 四千元 ， 設計費 用 為 二百八十 四萬元 ， 總設 計連 施工期 三百 九十八 個 工作 天 。 目前 處 於 合同 階段 ， 暫未公 佈 開工 日期 及合約 竣工 日 。         房屋 局總部 辦公大樓 位 於 澳門 沙梨 頭北巷 一 ○ 二號 ， 土地 總面積 一千四百 八十四 平方米 ， 座 地面 積約 一千四百 三十 平方米 ， 樓高 二十三 層及 兩層 地庫 ， 總建築 面積 約 二 萬 六千 平方米 。 按用家 工作 需求 ， 大樓 設 接待 區 、 辦 公室 、 會議室 及 停車場 等 。,2024-10-20
山頂醫院火警演習順利,山頂醫院火警演習順利    【本報消息】衛生局訊：仁伯爵綜合醫院聯同消防局及治安警察局昨（十九）日舉行火警疏散演習，透過跨部門合作形式測試醫院應對突發事件及災難發生的反應，以提升應變能力，完善溝通機制，減少人員傷亡及財物損失。    衛生局表示，是次演習由上午十時開始至十時二十分結束，共有約一百三十人參與。演習地點為醫院內外科大樓地庫一層，模擬因該層製藥部電器故障引致火警，醫院即時啟動緊急應變方案及通知消防局，消防局接報後派出四十名消防員趕赴現場，並展開滅火救援行動；同時，院方立即展開疏散行動，並對在院內的患者及求診人士作預先通知及情緒安撫等工作，行動中共疏散了廿六人，其中一名模擬在疏散過程受傷的員工須由消防人員協助撤離。演習過程順利。    仁伯爵綜合醫院醫務主任彭蓬光、曾潭飛，醫院防火委員會代主席蘇健文，消防局代表及治安警察局代表觀察演習後總結，均認為過程暢順並給予肯定，認為多年演習累積的經驗具有成效。,http://www.macaodaily.com/html/2024-10/20/content_1788690.htm,山頂醫院火警演習順利    【本報消息】衛生局訊：仁伯爵綜合醫院聯同消防局及治安警察局昨（十九）日舉行火警疏散演習，透過跨部門合作形式測試醫院應對突發事件及災難發生的反應，以提升應變能力，完善溝通機制，減少人員傷亡及財物損失,山頂 醫院 火警 演習 順利         【 本報 消息 】 衛生 局訊 ： 仁 伯爵 綜合 醫院 聯同 消防局 及 治安 警察局 昨 （ 十九 ） 日舉行 火警 疏散 演習 ， 透過 跨部門 合作 形式 測試 醫院 應 對 突發 事件 及 災難 發生 的 反應 ， 以 提升 應變 能力 ， 完善 溝通 機制 ， 減少 人員 傷亡 及 財物 損失 。         衛生局 表示 ， 是 次 演習 由 上午 十時 開始 至十時 二十分 結束 ， 共有 約 一百三十 人參 與 。 演習 地點 為 醫院 內 外科 大樓 地庫 一層 ， 模擬 因該 層 製 藥 部 電 器 故障 引致 火警 ， 醫院 即 時 啟動 緊急 應變 方案 及 通知 消防局 ， 消防局 接報 後 派出 四十名 消防 員 趕 赴 現場 ， 並展 開滅 火 救援 行動 ； 同時 ， 院方 立即 展開 疏散 行動 ， 並對 在 院內 的 患者 及求診 人士 作 預先 通知 及 情緒安撫 等 工作 ， 行動 中共 疏散 了 廿六 人 ， 其中 一 名模 擬在 疏散 過程 受傷 的 員 工須 由 消防人 員協助 撤離 。 演習 過程 順利 。         仁 伯爵 綜合 醫院 醫務 主任 彭蓬光 、 曾潭飛 ， 醫院 防火 委員會 代主席 蘇健文 ， 消防局 代表 及 治安 警察局 代表 觀察演 習後總結 ， 均 認為 過程 暢順 並給予 肯定 ， 認為 多年 演習 累積 的 經驗 具有 成效 。,2024-10-20
