Title,Content,Link,Summary,Preprocessed_Content,Date
陸促美落實不撐“台獨”承諾,陸促美落實不撐“台獨”承諾    針對“美國在台協會”主席羅森伯格近日竄台時所發表的言論，國務院台辦發言人朱鳳蓮十日表示，我們敦促美方以實際行動恪守一個中國原則和中美三個聯合公報規定，將不支持“台獨”的承諾落到實處，停止向“台獨”分裂勢力發出任何錯誤信號。    有記者問，“美國在台協會”主席羅森伯格近日竄台時稱，今年是“與台灣關係法”“立法”四十五周年，該法與中美三個聯合公報及“六項保證”是美對台政策的基本原則，強調美國須確保台灣有自我防衛能力，很高興看到台在強化自主防衛能力上的動作和投入。對此有何評論？    朱鳳蓮指出，一個中國原則是中美建交和發展外交關係的政治基礎和根本前提。美方所謂“與台灣關係法”及“六項保證”嚴重違反一個中國原則和中美三個聯合公報規定，嚴重違反國際關係基本準則，粗暴干涉中國內政，是完全錯誤和非法、無效的，中國政府從一開始就堅決反對。我們敦促美方以實際行動恪守一個中國原則和中美三個聯合公報規定，將不支持“台獨”的承諾落到實處，停止向“台獨”分裂勢力發出任何錯誤信號。    美官涉台言論危險    美國常務副國務卿坎貝爾日前稱，美英澳之間的“奧庫斯”(AUKUS)潛艇協議將促進台海和平穩定。對此，朱鳳蓮表示，這種言論是非常危險的。美英澳建立所謂“三方安全夥伴關係”，本質上是通過軍事合作挑動軍事對抗，是以別人的不安全為代價來追求自己的安全，只能讓本地區更不安全。任何利用相關軍事合作介入台灣問題的企圖，都是干涉中國內政，違背一個中國原則和國際關係基本準則，危害台海地區和平穩定，我們堅決反對。我們敦促有關國家恪守一個中國原則和對中方作出的嚴肅承諾，在涉台問題上謹言慎行。    反對美台軍事聯繫    台海軍司令近日竄美參加美海軍主辦的相關活動。有外媒稱此行為美方“聯合島嶼防衛概念”的一部分，“美將與日、菲、台等協調在‘第一島鏈’對抗解放軍”。    對此，朱鳳蓮指出，美方不斷炮製各種概念、利用各種藉口加強與中國台灣地區的軍事勾連，是極不負責任的。我們堅決反對美國與中國台灣地區開展任何形式的官方往來和軍事聯繫。民進黨當局勾連外部勢力“以武謀獨”，必遭失敗。    有記者問，台軍預計今年年底開始接裝首批卅八輛M1A2T坦克，據證實這些新採購的坦克均加購了美軍研發的所謂“城鎮戰”升級套件。對此有何評論？    綠“以武謀獨”必敗    朱鳳蓮說，第一，我們堅決反對美國同中國台灣地區進行任何形式的軍事勾連。第二，民進黨當局妄圖“以武謀獨”，不自量力，必遭失敗。    此外，據捷克媒體報道，蕭美琴竄訪期間遭“可疑車輛尾隨”險釀車禍。    對此，朱鳳蓮稱，我們一貫反對建交國與中國台灣地區開展任何形式的官方往來。民進黨當局勾連外部勢力，變着法子搞所謂“外交”突破，改變不了台灣是中國一部分的事實，也無助於台海地區和平穩定。,http://www.macaodaily.com/html/2024-04/11/content_1747508.htm,陸促美落實不撐“台獨”承諾    針對“美國在台協會”主席羅森伯格近日竄台時所發表的言論，國務院台辦發言人朱鳳蓮十日表示，我們敦促美方以實際行動恪守一個中國原則和中美三個聯合公報規定，將不支持“台獨”的承諾落到實處，停止向“台獨”分裂勢力發出任何錯誤信號,陸促 美落 實不撐 “ 台獨 ” 承諾         針對 “ 美國 在 台 協會 ” 主席 羅 森 伯格 近日 竄 台時 所 發表 的 言論 ， 國務院 台辦 發言人 朱鳳蓮 十日 表示 ， 我們 敦促 美方 以實際 行動 恪守 一個 中國 原則 和 中 美三個 聯合 公報 規定 ， 將不 支持 “ 台獨 ” 的 承諾 落到 實處 ， 停止 向 “ 台獨 ” 分裂 勢力 發出 任何 錯誤 信號 。         有 記者問 ， “ 美國 在 台 協會 ” 主席 羅 森 伯格 近日 竄 台 時稱 ， 今年 是 “ 與 台灣關 係 法 ” “ 立法 ” 四十五 周年 ， 該法 與 中 美三個 聯合 公報 及 “ 六項 保證 ” 是 美 對 台 政策 的 基本 原則 ， 強調 美國須 確保 台灣 有 自我 防衛 能力 ， 很 高興 看到 台 在 強化 自主 防衛 能力 上 的 動作 和 投入 。 對此 有何 評論 ？         朱鳳蓮 指出 ， 一個 中國 原則 是 中美 建交 和 發展 外交 關 係 的 政治 基礎 和 根本 前提 。 美方 所謂 “ 與 台灣關 係 法 ” 及 “ 六項 保證 ” 嚴重 違反 一個 中國 原則 和 中 美三個 聯合 公報 規定 ， 嚴重 違反國際關 係 基本 準則 ， 粗暴 干涉 中國 內政 ， 是 完全 錯誤 和 非法 、 無效 的 ， 中國 政府 從 一開始 就 堅決 反對 。 我們 敦促 美方 以實際 行動 恪守 一個 中國 原則 和 中 美三個 聯合 公報 規定 ， 將不 支持 “ 台獨 ” 的 承諾 落到 實處 ， 停止 向 “ 台獨 ” 分裂 勢力 發出 任何 錯誤 信號 。         美官 涉台言論 危險         美國常務 副 國務卿 坎貝爾 日前 稱 ， 美英 澳之間 的 “ 奧庫斯 ” ( AUKUS ) 潛艇 協議將 促進 台海 和平 穩定 。 對此 ， 朱鳳蓮 表示 ， 這種 言論 是 非常 危險 的 。 美英 澳 建立 所謂 “ 三方 安全 夥 伴關 係 ” ， 本質 上 是 通過 軍事 合作 挑動 軍事 對 抗 ， 是 以別 人 的 不 安全 為代價來 追求 自己 的 安全 ， 只能 讓 本地 區更 不 安全 。 任何 利用 相關 軍事 合作 介入 台灣 問題 的 企圖 ， 都 是 干涉 中國 內政 ， 違背 一個 中國 原則 和 國際關 係 基本 準則 ， 危害 台海 地區 和平 穩定 ， 我們 堅決 反對 。 我們 敦促 有 關國家 恪守 一個 中國 原則 和 對 中方 作出 的 嚴肅 承諾 ， 在 涉台 問題 上 謹言 慎行 。         反對 美台 軍事 聯 繫         台海 軍 司令 近日 竄 美 參加 美海 軍主辦 的 相關 活動 。 有外 媒稱 此行 為 美方 “ 聯合島嶼 防衛 概念 ” 的 一部分 ， “ 美將 與 日 、 菲 、 台 等 協調 在 ‘ 第一 島鏈 ’ 對抗 解放 軍 ” 。         對此 ， 朱鳳蓮 指出 ， 美方 不斷 炮 製 各 種 概念 、 利用 各種 藉口 加強 與 中國 台灣 地區 的 軍事 勾連 ， 是 極不負 責任 的 。 我們 堅決 反對 美國 與 中國 台灣 地區 開展 任何 形式 的 官方 往來 和 軍事 聯 繫 。 民進 黨 當局 勾連 外部 勢力 “ 以 武謀獨 ” ， 必遭 失敗 。         有 記者問 ， 台 軍 預計 今年年底 開始 接裝 首批 卅八輛 M1A2T 坦克 ， 據 證實 這些 新 採購 的 坦克 均 加購 了 美 軍 研發 的 所謂 “ 城鎮戰 ” 升級 套件 。 對此 有何 評論 ？         綠 “ 以 武謀獨 ” 必敗         朱鳳蓮 說 ， 第一 ， 我們 堅決 反對 美國同 中國 台灣 地區 進行 任何 形式 的 軍事 勾連 。 第二 ， 民進 黨 當局 妄圖 “ 以 武謀獨 ” ， 不自量力 ， 必遭 失敗 。         此外 ， 據 捷克 媒體 報道 ， 蕭美琴 竄 訪期 間 遭 “ 可疑 車輛 尾 隨 ” 險釀 車禍 。         對此 ， 朱鳳蓮稱 ， 我們 一貫 反對 建交 國與 中國 台灣 地區 開展 任何 形式 的 官方 往來 。 民進 黨 當局 勾連 外部 勢力 ， 變着 法子 搞 所謂 “ 外交 ” 突破 ， 改變 不了 台灣 是 中國 一部分 的 事實 ， 也 無助 於 台海 地區 和平 穩定 。,2024-04-11
陸：台禁陸產品不得民心,陸：台禁陸產品不得民心    國務院台辦發言人朱鳳蓮十日表示，民進黨當局對大陸好用時尚的產品設下諸多障礙，搞“封殺禁用”，不得民心。    有記者問，我們注意到，大陸新能源汽車非常受台灣民眾關注，不少台灣民眾感慨“又好用又時尚”，但是遺憾“買不到”。對於大陸新能源汽車、無人機等產品，民進黨當局一直以各種藉口阻撓入島。對此有何評論？    冀尊重台胞選擇權    朱鳳蓮說，大陸新能源汽車和無人機等產品以技術創新、產品多樣性、產業鏈完善、市場認可度高和全球佈局等優勢，受到台灣消費者的喜愛，是很自然的事。    她說，民進黨當局對大陸好用時尚的產品設下諸多障礙，搞“封殺禁用”，不得民心。希望他們切實尊重台灣民眾的消費選擇權，切實保障台灣民眾的切身利益，讓台灣民眾享受到更多好產品、好服務。    未見台當局“善意”    台交通事務主管部門日前稱，由於少了陸客加持，今年境外旅客來台目標將從一千二百萬人次下調到一千萬人次。島內輿論呼籲民進黨當局尋求解決之道，勿讓台灣觀光業淪為政治犧牲品。對此，朱鳳蓮表示，我們一貫支持兩岸各界各領域交流合作。反觀民進黨當局一直阻撓兩岸各領域交流，他們聲稱從去年開始就一直在釋出善意，但我們看到的是，直到現在仍然沒有正式開放大陸居民赴台交流，也沒有解除台灣居民來大陸團隊旅遊的禁令。所謂的“善意”在哪裡呢？我們沒有看到。    歡迎台胞尋根祭祖    朱鳳蓮介紹“小三通”航線復航情況時表示，“小三通”航線復航為密切兩岸人員交流往來發揮積極作用。據統計，四月一日至六日清明期間，“小三通”航線共計運行一百一十八航次，運送旅客一萬六千八百一十八人次。兩岸同胞是一家人，歡迎台灣鄉親通過“小三通”航線來大陸走走看看，尋根祭祖、走親訪友、交流合作。,http://www.macaodaily.com/html/2024-04/11/content_1747509.htm,反觀民進黨當局一直阻撓兩岸各領域交流，他們聲稱從去年開始就一直在釋出善意，但我們看到的是，直到現在仍然沒有正式開放大陸居民赴台交流，也沒有解除台灣居民來大陸團隊旅遊的禁令,陸 ： 台禁 陸產品 不得 民心         國務院 台辦 發言人 朱鳳蓮 十日 表示 ， 民進 黨 當局 對 大陸 好 用 時尚 的 產品 設下 諸多 障礙 ， 搞 “ 封殺 禁用 ” ， 不得 民心 。         有 記者問 ， 我們 注意 到 ， 大陸 新能源 汽車 非常 受台灣民眾 關注 ， 不少台 灣民眾 感慨 “ 又 好 用 又 時尚 ” ， 但是 遺憾 “ 買 不到 ” 。 對 於 大陸 新能源 汽車 、 無人機 等 產品 ， 民進 黨 當局 一直 以 各種 藉口 阻撓 入島 。 對此 有何 評論 ？         冀 尊重 台胞 選擇權         朱鳳蓮 說 ， 大陸 新能源 汽車 和 無人機 等 產品 以技術 創新 、 產品 多樣 性 、 產業 鏈 完善 、 市場 認可度 高 和 全球 佈 局 等 優勢 ， 受到 台灣 消費者 的 喜 愛 ， 是 很 自然 的 事 。         她 說 ， 民進 黨 當局 對 大陸 好 用 時尚 的 產品 設下 諸多 障礙 ， 搞 “ 封殺 禁用 ” ， 不得 民心 。 希望 他們 切實 尊重 台灣民眾 的 消費 選擇權 ， 切實 保障 台灣民眾 的 切身利益 ， 讓 台灣民眾 享受 到 更 多 好產品 、 好 服務 。         未見 台 當局 “ 善意 ”         台 交通 事務 主管 部門 日前 稱 ， 由 於 少 了 陸客 加持 ， 今年 境外 旅客 來 台目 標將 從 一千二百 萬 人次 下調 到 一千 萬 人次 。 島內 輿論 呼籲民 進黨 當局 尋 求解 決之道 ， 勿 讓 台灣 觀光業 淪為 政治 犧牲品 。 對此 ， 朱鳳蓮 表示 ， 我們 一貫 支持 兩岸 各界 各 領域 交流 合作 。 反觀民 進黨 當局 一直 阻撓 兩岸 各 領域 交流 ， 他們 聲稱 從 去年 開始 就 一直 在 釋出 善意 ， 但 我們 看到 的 是 ， 直到 現在 仍然 沒有 正式 開 放大 陸 居民 赴 台 交流 ， 也 沒 有 解除 台灣 居民 來大陸 團隊 旅遊 的 禁令 。 所謂 的 “ 善意 ” 在 哪裡 呢 ？ 我們 沒有 看到 。         歡迎 台胞 尋根 祭祖         朱鳳蓮 介紹 “ 小三通 ” 航線 復 航情況 時 表示 ， “ 小三通 ” 航線 復 航為 密切 兩岸 人員 交流 往來 發揮 積極 作用 。 據 統計 ， 四月 一日 至 六日 清明 期間 ， “ 小三通 ” 航線 共計 運行 一百一十 八 航次 ， 運送 旅客 一萬六 千八百 一十八 人次 。 兩岸 同胞 是 一家人 ， 歡迎 台灣 鄉親 通過 “ 小三通 ” 航線 來 大陸 走走看看 ， 尋根 祭祖 、 走親 訪友 、 交流 合作 。,2024-04-11
陸：中華兒女共同願望,讓流失海外文物回家    陸：中華兒女共同願望    台灣中華人間佛教聯合總會日前向國家文物局捐贈了三十件流失海外的珍貴文物。國務院台辦發言人朱鳳蓮十日在例行記者會上表示，每一件中國文物都承載着源遠流長的中國歷史。讓流失海外的文物回家，是包括台灣同胞在內的全體中華兒女的共同願望。    朱鳳蓮說，二○一四年，台灣佛光山寺星雲長老將信眾捐贈的一尊國家一級文物北齊釋迦牟尼造像佛首無償捐贈給國家文物局，並於二○一六年三月在國家博物館舉辦儀式，受到兩岸各界廣泛關注。    台胞捐贈彰顯熱愛    她說，近年來，台灣民眾不斷向佛光山寺等台灣寺廟捐贈流失海外佛教文物，希望捐贈回大陸。此次台灣中華人間佛教聯合總會從會員捐贈的文物中精選出三十件宋金至明清時期彩塑造像分批送回大陸，並於三月廿五日在國家博物館舉辦文物捐贈儀式，向國家文物局鄭重捐贈。這些文物承載着中國悠久歷史厚重的積澱，是輝煌燦爛、多姿多彩的中華文化的生動見證，再度彰顯了廣大台灣同胞對中華文化的深摯熱愛和崇高禮敬。,http://www.macaodaily.com/html/2024-04/11/content_1747510.htm,此次台灣中華人間佛教聯合總會從會員捐贈的文物中精選出三十件宋金至明清時期彩塑造像分批送回大陸，並於三月廿五日在國家博物館舉辦文物捐贈儀式，向國家文物局鄭重捐贈,讓 流失 海外 文物 回家         陸 ： 中華兒 女 共同 願望         台灣 中華人間 佛教 聯合 總會 日前 向國家 文物局 捐贈 了 三十件 流失 海外 的 珍貴 文物 。 國務院 台辦 發言人 朱鳳蓮 十日 在 例行 記者 會 上 表示 ， 每一件 中國 文物 都 承載 着 源遠 流長 的 中國 歷史 。 讓 流失 海外 的 文物 回家 ， 是 包括 台灣 同胞 在 內 的 全體 中華兒 女 的 共同 願望 。         朱鳳蓮 說 ， 二 ○ 一 四年 ， 台灣 佛光山 寺 星雲長 老將 信眾 捐贈 的 一尊 國家 一級 文物 北齊釋 迦牟尼 造像 佛首 無償 捐贈 給國家 文物局 ， 並於二 ○ 一 六年 三月 在 國家 博物 館 舉辦 儀式 ， 受到 兩岸 各界 廣泛 關注 。         台胞 捐贈 彰 顯熱愛         她 說 ， 近年 來 ， 台灣民眾 不斷 向 佛光山 寺 等 台灣 寺 廟 捐贈 流失 海外 佛教 文物 ， 希望 捐贈 回大陸 。 此次 台灣 中華人間 佛教 聯合 總會 從會員 捐贈 的 文物 中 精選出 三十件 宋金至 明清 時期 彩塑 造像 分批 送回 大陸 ， 並 於 三月 廿五日 在 國家 博物 館 舉辦 文物 捐贈 儀式 ， 向國家 文物局 鄭重 捐贈 。 這些 文物 承載 着 中國 悠久 歷史 厚重 的 積 澱 ， 是 輝煌 燦爛 、 多姿多彩 的 中華 文化 的 生動 見證 ， 再度 彰顯 了 廣大台灣 同胞 對 中華 文化 的 深摯 熱愛和 崇高 禮敬 。,2024-04-11
虔誠膜拜,虔誠膜拜    台中大甲鎮瀾宮媽祖九天八夜遶境進香，九日舉 行“祝壽大典”，數萬信眾參與，近兩小時的大典 全程依古禮進行，信徒以三跪九叩禮向媽祖虔誠膜 拜。（香港中通社）,http://www.macaodaily.com/html/2024-04/11/content_1747511.htm,虔誠膜拜    台中大甲鎮瀾宮媽祖九天八夜遶境進香，九日舉 行“祝壽大典”，數萬信眾參與，近兩小時的大典 全程依古禮進行，信徒以三跪九叩禮向媽祖虔誠膜 拜,虔 誠 膜拜         台中 大甲鎮 瀾 宮媽祖 九天 八夜 遶 境 進 香 ， 九日 舉   行 “ 祝壽 大典 ” ， 數萬信 眾參 與 ， 近 兩小時 的 大典   全程 依古禮 進行 ， 信徒 以 三跪九叩 禮向 媽祖 虔誠膜   拜 。 （ 香港 中通社 ）,2024-04-11
連勝文將率團參加海峽論壇,連勝文將率團參加海峽論壇    【本報綜合報道】據香港中通社十日消息：中國國民黨主席朱立倫今日宣佈，副主席連勝文將率團參加接下來在大陸舉行的海峽論壇及海峽青年論壇，並表示推動兩岸交流是國民黨一貫路線。    國民黨今天下午召開中常會，朱立倫在會上表示，馬英九正率團訪問大陸，對此表達祝福，期盼順利成功。相信這是推動兩岸和平交流非常重要的一步。    兩岸交流一貫路線    朱立倫稱，推動兩岸務實交流，讓兩岸能夠創造和平環境，共創雙贏，是國民黨一貫路線。接下來的海峽論壇及海峽青年論壇，會請副主席連勝文率團參加，希望推動兩岸穩健、務實、共創雙贏的交流。    此外，朱立倫談及，這段期間，民進黨堅持“反中”、“抗中”路線，甚至惡意攻擊、“抹紅”國民黨。希望候任領導人賴清德思考，五月二十日上台後，兩岸到底要交惡還是交流，要對抗還是對話，都在其一念之間。若民進黨執意推動“台獨”，只會讓台灣百姓深受其害。    賴首公佈人事名單    另外，台灣地區候任領導人賴清德即將在五月二十日就職。據中時新聞網十日報道，賴清德當日上午九時公佈第一批行政機構人事，由民進黨前主席卓榮泰擔任行政機構負責人。卓榮泰隨後宣佈，行政機構副負責人為鄭麗君，行政機構秘書長為龔明鑫，行政機構發言人為陳世凱。    藍民代指了無新意    對於賴清德的首批行政機構人事名單，有國民黨立法機構民意代表評論：了無新意、政治掛帥。國民黨台北市議員游淑慧分析稱，民進黨掌握權力八年，卻面臨人才斷層，因為很多人掌握權力後經不起考驗，“許多青壯世代死在論文門或酒色財中”。她感嘆，民進黨當局鐵打的衙門、流水的官，導致政策不穩定，“馬屁文化”盛行。,http://www.macaodaily.com/html/2024-04/11/content_1747512.htm,連勝文將率團參加海峽論壇    【本報綜合報道】據香港中通社十日消息：中國國民黨主席朱立倫今日宣佈，副主席連勝文將率團參加接下來在大陸舉行的海峽論壇及海峽青年論壇，並表示推動兩岸交流是國民黨一貫路線,連勝文將 率團 參加 海峽 論壇         【 本報 綜合 報道 】 據 香港 中通社 十日 消息 ： 中國 國民黨 主席 朱立倫 今日 宣 佈 ， 副 主席 連勝文將 率團 參加 接下 來 在 大陸 舉行 的 海峽 論壇 及 海峽 青年 論壇 ， 並 表示 推動 兩岸 交流 是 國民黨 一貫 路線 。         國民黨 今天下午 召開 中常 會 ， 朱立倫 在 會 上 表示 ， 馬 英九正率 團訪 問大陸 ， 對 此表達 祝福 ， 期盼 順利 成功 。 相信 這是 推動 兩岸 和平 交流 非常 重要 的 一步 。         兩岸 交流 一貫 路線         朱立倫稱 ， 推動 兩岸務實 交流 ， 讓 兩岸 能夠 創造 和平 環境 ， 共創 雙贏 ， 是 國民黨 一貫 路線 。 接下 來 的 海峽 論壇 及 海峽 青年 論壇 ， 會 請 副 主席 連勝文 率團 參加 ， 希望 推動 兩岸 穩健 、 務實 、 共創 雙贏 的 交流 。         此外 ， 朱立倫談 及 ， 這段 期間 ， 民進 黨 堅持 “ 反中 ” 、 “ 抗中 ” 路線 ， 甚至 惡意 攻擊 、 “ 抹紅 ” 國民黨 。 希望 候任 領導 人賴 清德 思考 ， 五月 二十日 上台 後 ， 兩岸 到底 要交惡 還是 交流 ， 要 對 抗還 是 對 話 ， 都 在 其一 念之間 。 若民 進黨 執意 推動 “ 台獨 ” ， 只會 讓 台灣 百姓 深受其害 。         賴首公 佈 人事 名單         另外 ， 台灣 地區 候任 領導 人賴 清德 即將 在 五月 二十日 就 職 。 據 中時 新聞網 十日 報道 ， 賴清德 當日 上午 九時 公 佈 第一批 行政 機構 人事 ， 由民進 黨前 主席 卓榮泰 擔任 行政 機構 負責人 。 卓榮泰 隨後宣 佈 ， 行政 機構 副 負責人 為 鄭麗君 ， 行政 機構 秘書長 為 龔明鑫 ， 行政 機構 發言人 為 陳 世凱 。         藍民代指 了 無 新意         對 於 賴清德 的 首批 行政 機構 人事 名單 ， 有國民黨 立法 機構 民意代表 評論 ： 了 無 新意 、 政治 掛帥 。 國民黨 台北市 議員游淑慧 分析 稱 ， 民進 黨 掌握 權力 八年 ， 卻 面臨 人才 斷層 ， 因為 很多 人 掌握 權力後經 不起 考驗 ， “ 許多 青壯 世代 死 在 論文門 或 酒色 財中 ” 。 她 感嘆 ， 民進 黨 當局 鐵 打 的 衙門 、 流水 的 官 ， 導致 政策 不 穩定 ， “ 馬 屁 文化 ” 盛行 。,2024-04-11
