Title,Content,Link,Summary,Preprocessed_Content
銀河藝萃呈獻《喜·始：當代藝術裝置之旅》展覽開幕,澳門銀河藝文空間    銀河藝萃呈獻《喜·始：當代藝術裝置之旅》展覽開幕    位於澳門銀河TM綜合度假城內的藝文空間銀河藝萃揭幕至今一直積極配合澳門特區政府開展各類藝文活動。踏入2024年，精彩節目陸續有來，其中由銀河娛樂集團（下稱銀娛）主辦、澳門美術協會協辦，得到澳門特區政府文化局大力支持的《喜·始：當代藝術裝置之旅》展覽於今日正式開幕。由即日起至2024年5月6日，銀河藝萃將成為一個充滿樂趣的沉浸式藝術世界，展出三位澳門新生代藝術家的最新創作，除了窺探澳門豐富多元的當代藝術發展，打造發人深省的難忘體驗，同時也為訪客提供一個藝術表達的平台，鼓勵通過拍照和影像記錄個人經歷，透過創作喚醒藏於心裡的藝術家。    開幕典禮邀請了澳門特別行政區政府文化局局長梁惠敏女士；澳門特別行政區政府旅遊局副局長程衛東先生；銀娛董事程裕昇先生；銀娛零售部行政副總裁黃興齡女士；澳門美術協會會長陸曦先生；策展人林子筠女士等貴賓一同見證展覽開幕，充分展現出銀娛對澳門文化及藝術產業可持續發展的重視，也突顯了澳門銀河對澳門特區政府旅遊＋文化創意跨界融合的鼎力支持，致力將澳門打造成為更多元化的旅遊之都。    銀娛董事程裕昇先生表示：春天象徵新的開始，《喜·始：當代藝術裝置之旅》正好體現了一元復始的新氣象。三位年輕本地藝術家的作品不但展示出澳門獨有的創意才華，訪客更有機會與藝術品進行互動，發掘藝術靈感。    喜·始意指喜悅的泉源、新開始的歡樂起點。三位澳門新生代藝術家吳敏慧女士、蘇凌葑女士和張凱儀女士運用視覺、聽覺和嗅覺的完美結合，打造出自成一體的獨特之境，喚起與新開始和生命奇蹟相關的情感和感觸。走進她們的靈感世界，沉浸在繽紛喜悅之中，充滿驚喜的發現，更誘發你對生活的各種反思。    《喜·始：當代藝術裝置之旅》呈現了一系列豐富多元的藝術創作，三件大型藝術裝置，充分展示出三位藝術家的天賦才華。除了到場觀賞和參加工作坊之外，公眾也可在社交媒體平台與這些藝術品進行互動。    藝術家吳敏慧女士基於對日常平凡物件進行擬真複製，再客觀呈現，引發觀眾聯想，凸顯真實與非真實和複製與變異的思考。她的《第二身︰蘋果》把一個平安、健康的象徵放大解構，並以全新形態呈現，遊走於大蘋果之中，讓你重新審視這為人熟識的果實。    藝術家蘇凌葑女士愛運用陶泥進行立體造型創作，透過不規則的美學形態和獨特原創肌理符號表達她對生命萬物的敏銳感知，同時賦予作品動感及生命力。她的《花季》就是最佳例子。作品由天花懸吊下來，讓大家以新角度感受大自然的澎湃生機。花朵彷彿從空中雲朵延伸出來，一串串看似寶石珠鏈的水滴串如甘露，滋潤著萬物。    藝術家張凱儀女士擅於塑建空間藝術，搭構夢幻氛圍場景。她的大型創作《心花怒放》像拱門，卷曲的幻彩膠片，猶如形態抽象的花朵，鏡面同時反射地上五彩斑斕的地氊，令色彩更鮮艷，讓人宛如穿梭於幻彩燦爛的漩渦之中。    除此之外，《喜·始：當代藝術裝置之旅》還會舉行三個由藝術家主持的主題工作坊，主題包括：第二身蘋果翻模、養分擴香石及幻彩枱燈。訪客可以參加由藝術家主持的工作坊，更深入投身於這個藝術世界，發掘潛藏已久的創造能力。    訪客在參觀《喜·始：當代藝術裝置之旅》展覽期間只需完成與《喜·始》藝術裝置打卡任務並分享至社交平台，即可於銀河藝萃換領限量環保袋！（數量有限，送完即止。）    展覽期間澳門銀河的官方帳號亦將推出粉絲互動遊戲，誠邀你與朋友一起看展，在社交平台更有機會贏取額外獎品，敬請留    《喜·始：當代藝術裝置之旅》    日期：2024年2月2日 - 5月6日    地點：澳門銀河TM銀河時尚匯1樓銀河    (特刋),http://www.macaodaily.com/html/2024-02/03/content_1732949.htm,由即日起至2024年5月6日，銀河藝萃將成為一個充滿樂趣的沉浸式藝術世界，展出三位澳門新生代藝術家的最新創作，除了窺探澳門豐富多元的當代藝術發展，打造發人深省的難忘體驗，同時也為訪客提供一個藝術表達的平台，鼓勵通過拍照和影像記錄個人經歷，透過創作喚醒藏於心裡的藝術家,澳門 銀河 藝文空間         銀河 藝萃 呈 獻 《 喜 · 始 ： 當代藝術 裝置 之 旅 》 展覽 開幕         位 於 澳門 銀河 TM 綜合 度假 城內 的 藝文空間 銀河 藝萃 揭幕 至今 一直 積極 配合 澳門 特區 政府 開展 各類 藝文 活動 。 踏入 2024 年 ， 精彩 節目 陸續 有 來 ， 其中 由銀河 娛樂 集團 （ 下稱 銀娛 ） 主辦 、 澳門 美術 協會 協辦 ， 得到 澳門 特區 政府 文化局 大力支持 的 《 喜 · 始 ： 當代藝術 裝置 之 旅 》 展覽 於 今日 正式 開幕 。 由 即日起 至 2024 年 5 月 6 日 ， 銀河 藝萃 將成 為 一個 充滿樂趣 的 沉浸 式 藝術 世界 ， 展出 三位 澳門 新生代 藝術家 的 最新 創作 ， 除了 窺探 澳門 豐富 多元 的 當代藝術 發展 ， 打造 發人 深省 的 難 忘 體驗 ， 同時 也 為 訪客 提供 一個 藝術表達 的 平台 ， 鼓勵 通過 拍照 和 影像 記錄 個 人 經歷 ， 透過 創作 喚醒 藏 於 心裡 的 藝術家 。         開幕 典禮 邀請 了 澳門 特別 行政 區 政府 文化局 局長 梁惠敏 女士 ； 澳門 特別 行政 區 政府 旅遊局 副 局長 程衛東 先生 ； 銀娛 董事 程裕 昇 先生 ； 銀娛 零售 部 行政 副 總裁 黃 興齡 女士 ； 澳門 美術 協會會長 陸曦 先生 ； 策展 人 林子 筠 女士 等 貴賓 一同 見證 展覽 開幕 ， 充分 展現 出銀娛 對 澳門 文化 及藝術 產業 可持續 發展 的 重視 ， 也 突顯 了 澳門 銀河 對 澳門 特區 政府 旅遊 ＋ 文化 創意 跨界 融合 的 鼎力支持 ， 致力 將澳門 打 造成 為 更 多元化 的 旅遊 之 都 。         銀娛 董事 程裕 昇 先生 表示 ： 春天 象徵新 的 開始 ， 《 喜 · 始 ： 當代藝術 裝置 之 旅 》 正好 體現 了 一元 復 始 的 新氣象 。 三位 年輕 本地 藝術家 的 作品 不但 展示 出澳門 獨有 的 創意 才 華 ， 訪客 更 有 機會 與 藝術品 進行 互動 ， 發掘 藝術 靈感 。         喜 · 始 意指 喜悅 的 泉源 、 新開始 的 歡樂 起點 。 三位 澳門 新生代 藝術家吳 敏慧 女士 、 蘇凌 葑 女士 和 張凱儀 女士 運用 視覺 、 聽覺 和 嗅覺 的 完美 結合 ， 打造出 自成 一體 的 獨特之境 ， 喚起 與 新 開始 和 生命 奇 蹟 相關 的 情感 和 感觸 。 走進 她 們 的 靈感 世界 ， 沉浸 在 繽紛 喜悅 之中 ， 充滿 驚喜 的 發現 ， 更 誘發 你 對 生活 的 各種 反思 。         《 喜 · 始 ： 當代藝術 裝置 之 旅 》 呈現 了 一系列 豐富 多元 的 藝術 創作 ， 三件 大型 藝術 裝置 ， 充分 展示 出 三位 藝術家 的 天賦 才 華 。 除了 到場 觀賞 和 參 加工 作坊 之外 ， 公眾 也 可 在 社交 媒體 平台 與 這些 藝術品 進行 互動 。         藝術家吳 敏慧 女士 基 於 對 日常 平凡 物件 進行擬 真 複 製 ， 再 客觀 呈現 ， 引發 觀眾 聯想 ， 凸顯 真實 與 非 真實 和 複 製 與 變 異 的 思考 。 她 的 《 第二 身 ︰ 蘋果 》 把 一個 平安 、 健康 的 象 徵 放大 解構 ， 並以 全新 形態 呈現 ， 遊走 於 大 蘋果 之中 ， 讓 你 重新 審視 這為 人 熟識 的 果實 。         藝術家 蘇凌 葑 女士 愛運用 陶泥 進行 立體 造型 創作 ， 透過 不 規則 的 美學 形態 和 獨特 原創 肌理 符號 表達 她 對 生命 萬物 的 敏銳 感知 ， 同時 賦予 作品 動感及 生命力 。 她 的 《 花季 》 就是 最佳 例子 。 作品 由 天花 懸 吊下 來 ， 讓 大家 以新 角度 感受 大自然 的 澎湃 生機 。 花朵 彷 彿 從 空中 雲朵 延伸 出來 ， 一串串 看似 寶石珠 鏈 的 水滴 串如 甘露 ， 滋潤 著萬物 。         藝術家 張凱儀 女士 擅 於 塑建空間 藝術 ， 搭構 夢 幻氛 圍場景 。 她 的 大型 創作 《 心花怒放 》 像 拱門 ， 卷曲 的 幻彩 膠片 ， 猶如 形態 抽象 的 花朵 ， 鏡面 同時 反射 地上 五彩 斑斕 的 地 氊 ， 令 色彩 更鮮艷 ， 讓 人 宛如 穿梭 於 幻彩 燦爛 的 漩 渦 之中 。         除此之外 ， 《 喜 · 始 ： 當代藝術 裝置 之 旅 》 還會 舉行 三個 由 藝術家 主持 的 主題 工作坊 ， 主題 包括 ： 第二 身蘋果 翻模 、 養分 擴香 石及 幻彩 枱 燈 。 訪客 可以 參加 由 藝術家 主持 的 工作坊 ， 更 深入 投身 於 這個 藝術 世界 ， 發掘 潛藏 已久 的 創造 能力 。         訪客 在 參觀 《 喜 · 始 ： 當代藝術 裝置 之 旅 》 展覽期 間 只 需 完成 與 《 喜 · 始 》 藝術 裝置 打卡 任務並 分享 至 社交 平台 ， 即可 於 銀河 藝萃 換領 限量 環保袋 ！ （ 數量 有限 ， 送 完 即止 。 ）         展覽 期間 澳門 銀河 的 官方 帳號亦將 推出 粉絲 互動 遊戲 ， 誠邀 你 與 朋友 一起 看展 ， 在 社交 平台 更 有 機會 贏取 額外 獎品 ， 敬請 留         《 喜 · 始 ： 當代藝術 裝置 之 旅 》         日期 ： 2024 年 2 月 2 日   -   5 月 6 日         地點 ： 澳門 銀河 TM 銀河時 尚匯 1 樓銀河         ( 特 刋 )
市署講解街市攤位簽約須知,市署講解街市攤位簽約須知    【本報消息】市署訊：雀仔園街市及沙梨頭街市二樓美食廣場合共十五個攤位公開競投結果日前已公佈，市政署昨日為獲甄選競投者舉行講解會，介紹有關街市攤位注意事項及訂立攤位租賃合同手續等，讓有關競投者為入場開業作準備。    講解會由市政署代表向有關競投者詳細講解訂立攤位租賃合同及後續進場安排日程、有關攤位租賃合同內容、相關法律及指引的規定，以及在申請進行攤位內部裝修或新添設備時須注意事項等。現場設提問環節，由各部門代表回答競投者查詢。    是次公開競投的雀仔園街市五個攤位及沙梨頭美食廣場十個攤位，可供經營十三類商品或菜式。經評審委員會逐一審核投標者提交的競投文件，根據營運策略、經驗及資格、攤位每日經營時間、貨品種類多元性、支付工具便利性等五項主要標準評審，按照甄選條件編製及公佈分配攤位優先次序排名名單。市政署將與有關中標者保持緊密聯繫，並有序安排中標者入場度尺及安裝經營設備等，讓有關經營者盡早開業。,http://www.macaodaily.com/html/2024-02/03/content_1733014.htm,市署講解街市攤位簽約須知    【本報消息】市署訊：雀仔園街市及沙梨頭街市二樓美食廣場合共十五個攤位公開競投結果日前已公佈，市政署昨日為獲甄選競投者舉行講解會，介紹有關街市攤位注意事項及訂立攤位租賃合同手續等，讓有關競投者為入場開業作準備,市署 講解 街市 攤位 簽約須 知         【 本報 消息 】 市署 訊 ： 雀 仔園 街市 及 沙梨 頭 街市 二樓 美食 廣場 合共 十五 個 攤位 公開 競投 結果 日前 已公 佈 ， 市政 署 昨日 為 獲 甄選 競 投者 舉行 講解會 ， 介紹 有關 街市 攤位 注意 事項 及 訂立 攤位 租賃 合同 手續 等 ， 讓 有關 競 投者 為 入場 開業作 準備 。         講解會 由 市政 署 代表 向 有關 競 投者 詳細 講解 訂立 攤位 租賃 合同 及後續 進場 安排 日程 、 有關 攤位 租賃 合同 內容 、 相關 法律 及 指引 的 規定 ， 以及 在 申請 進行 攤位 內部 裝修 或 新添 設備 時須 注意 事項 等 。 現場 設 提問 環節 ， 由 各部 門 代表 回答 競投者 查詢 。         是 次 公開 競投 的 雀 仔園 街市 五個 攤位 及 沙梨 頭 美食 廣場 十個 攤位 ， 可供 經營 十三 類 商品 或 菜式 。 經評 審委員會 逐一 審核 投標者 提交 的 競投 文件 ， 根據 營運 策略 、 經驗 及 資格 、 攤位 每日 經營 時間 、 貨品 種類 多元性 、 支付 工具 便利性 等 五項 主要 標準 評審 ， 按照 甄選 條件 編 製 及 公 佈 分配 攤位 優先 次序 排名 名單 。 市政 署將 與 有 關中 標者 保持 緊密 聯 繫 ， 並 有序 安排 中標者 入場度 尺及 安裝 經營 設備 等 ， 讓 有 關經 營者 盡早 開業 。
女子流感肺炎危重,女子流感肺炎危重    【本報消息】衛局訊：衛生局昨日接獲通報一例流感重症報告。    患者為卅七歲女性，本澳居民，有慢性病病史，一月二十日出現咳嗽及咽痛症狀，曾到私人醫療機構就醫，廿八日因症狀持續並出現氣促及呼吸困難再就醫，三十日症狀加重，由救護車送往鏡湖醫院急診並收治入院。實驗室檢測顯示乙型流感呈陽性，影像學檢測提示雙肺肺炎，目前在深切治療部接受治療，需使用呼吸機。患者無接種季節性流感疫苗，家人沒有出現類似病徵。    兩校十六生流感    另，衛局昨接獲兩宗流感樣疾病群集性感染報告：    第一宗，患者是位於高樓街的海星中學初二義班八名學生，五男三女；第二宗，患者是位於沙維斯街的氹仔坊眾學校P3A班八名學生，三男五女。    上述患者一月廿九日起出現發熱及咳嗽等上呼吸道症狀，部分患者已接受診治，無重症或其他嚴重併發症。有關場所已加強清潔消毒和保持室內空氣流通等感染控制措施，嚴格執行患病學生和員工隔離規定。,http://www.macaodaily.com/html/2024-02/03/content_1733015.htm,兩校十六生流感    另，衛局昨接獲兩宗流感樣疾病群集性感染報告：    第一宗，患者是位於高樓街的海星中學初二義班八名學生，五男三女,女子 流感 肺炎 危重         【 本報 消息 】 衛局 訊 ： 衛生局 昨日 接獲 通報 一例 流感 重症 報告 。         患者 為卅七歲 女性 ， 本澳 居民 ， 有 慢性病 病史 ， 一月 二十日 出現 咳嗽 及咽 痛症 狀 ， 曾到 私人 醫療 機構 就醫 ， 廿八日 因症 狀持續 並出 現氣 促及 呼吸 困難 再 就醫 ， 三十日 症狀 加重 ， 由 救護車 送往 鏡湖 醫院 急 診並 收治 入院 。 實驗室 檢測 顯示 乙型 流感 呈陽性 ， 影像 學檢測 提示 雙肺 肺炎 ， 目前 在 深切 治療 部 接受 治療 ， 需 使用 呼吸 機 。 患者 無接種 季節性 流感疫苗 ， 家人 沒有 出 現類 似病 徵 。         兩校 十六 生 流感         另 ， 衛局 昨接 獲 兩宗 流感 樣 疾病 群集 性 感染 報告 ：         第一 宗 ， 患者 是 位 於 高樓 街 的 海星 中學 初二 義班 八名 學生 ， 五男三女 ； 第二宗 ， 患者 是 位 於 沙維斯街 的 氹 仔坊 眾學校 P3A 班 八名 學生 ， 三 男五女 。         上述 患者 一月 廿九日 起出 現發 熱及 咳嗽 等 上呼吸道 症狀 ， 部分 患者 已 接受 診治 ， 無 重症 或 其他 嚴重 併 發症 。 有 關場 所 已 加強 清潔 消毒 和 保持 室內 空氣 流通 等 感染 控制措施 ， 嚴格 執行 患病 學生 和員工 隔離 規定 。
何厚鏵勉中總婦委發揮優勢,何厚鏵勉中總婦委發揮優勢    澳門中華總商會婦女委員會一行十五人在中總副理事長何佩芬、婦委會主任林燕妮帶領下，日前拜訪全國政協副主席、中總永遠會長何厚鏵。    何佩芬表示，中總已向世界華商大會秘書處申請二○二五年第十八屆世界華商大會在澳舉辦。冀成功申辦，加強全球華商聯繫，促進澳門對外交流合作。    林燕妮介紹婦委會會務工作，今年將擴大對外交流合作，開展包括參訪六大綜合度假休閒企業等一系列活動。同時，計劃加強與東南亞國家婦女工商團體人員往來。    何厚鏵肯定和支持婦委會工作，勉勵婦委會繼續發揮工商界婦女的獨特優勢，助力澳門用好中央惠澳各項政策；助力澳門經濟適度多元化取得新進展，共同為澳門年輕人創造更好的創業環境和就業機會。,http://www.macaodaily.com/html/2024-02/03/content_1733016.htm,何厚鏵勉中總婦委發揮優勢    澳門中華總商會婦女委員會一行十五人在中總副理事長何佩芬、婦委會主任林燕妮帶領下，日前拜訪全國政協副主席、中總永遠會長何厚鏵,何厚鏵 勉中 總婦 委發揮 優勢         澳門 中華 總商會婦 女委員會 一行 十五 人 在 中 總 副 理事 長 何佩芬 、 婦委會 主任 林燕妮 帶 領下 ， 日前 拜訪 全國政協 副 主席 、 中 總永遠會長 何厚鏵 。         何佩芬 表示 ， 中 總 已 向 世界 華商大會 秘書處 申請 二 ○ 二 五年 第十八 屆 世界 華商大會 在 澳舉 辦 。 冀 成功 申辦 ， 加強 全球 華商 聯 繫 ， 促進 澳門 對 外 交流 合作 。         林燕妮 介紹 婦委會 會務 工作 ， 今年 將擴 大 對 外 交流 合作 ， 開展 包括 參訪 六大 綜合 度假 休閒 企業 等 一系列 活動 。 同時 ， 計劃 加強 與 東南亞國家 婦女 工商 團體 人員往 來 。         何厚鏵 肯定 和 支持 婦委會 工作 ， 勉勵 婦委會 繼續 發揮 工商界 婦女 的 獨特 優勢 ， 助力 澳門用 好 中央 惠澳 各項 政策 ； 助力 澳門 經濟 適度 多元化 取得 新 進展 ， 共同 為 澳門 年 輕人 創造 更好 的 創業 環境 和 就業 機會 。
書畫聯誼會斗門助學送暖,書畫聯誼會斗門助學送暖    澳門書畫藝術聯誼會會長李秋平率領一行多人，上月三十日上午前往斗門區蓮洲鎮下欄村開展助學公益行及寫揮春書畫活動，獲區僑聯副主席葉淑儀、鎮委副書記甘顯富、鎮僑聯辦主任郭建文、駐村組及村委幹部等接待。    期間，鎮僑聯辦負責人陪同一行參觀蓮洲“百千萬工程”和綠美生態建設。重頭戲是向村裡共十五名孩子送上助學金及慰問品，冀孩子健康成長，為促進國家發展作應有貢獻。    在寫揮春書畫活動環節，李秋平引領眾成員積極創作，並把書寫的揮春和對聯等贈予村民。該會並向該村捐贈一批黃皮樹果苗，積極動員該會成員及村民等共同植樹，為綠化獻力。    活動結束之際，葉淑儀等向李秋平贈送錦旗，小朋友也向該會成員送上親手裁剪的窗花，以表謝意，場面溫馨。,http://www.macaodaily.com/html/2024-02/03/content_1733017.htm,書畫聯誼會斗門助學送暖    澳門書畫藝術聯誼會會長李秋平率領一行多人，上月三十日上午前往斗門區蓮洲鎮下欄村開展助學公益行及寫揮春書畫活動，獲區僑聯副主席葉淑儀、鎮委副書記甘顯富、鎮僑聯辦主任郭建文、駐村組及村委幹部等接待,書畫 聯誼會 斗門 助學 送暖         澳門書畫 藝術 聯誼 會會長 李秋平 率領 一行 多人 ， 上 月 三十日 上午 前往 斗門區 蓮洲 鎮下 欄村 開展 助學 公益行 及 寫揮春書畫 活動 ， 獲區 僑聯 副 主席 葉淑儀 、 鎮委副書 記甘 顯富 、 鎮僑 聯辦 主任 郭 建文 、 駐村 組及 村委 幹部 等 接待 。         期間 ， 鎮僑 聯辦 負責人 陪同 一行 參觀 蓮洲 “ 百千 萬 工程 ” 和 綠美生態 建設 。 重頭戲 是 向 村裡 共 十五名 孩子 送上 助學金 及慰 問品 ， 冀 孩子 健康 成長 ， 為促 進國家 發展 作應 有 貢獻 。         在 寫揮春書畫 活動 環節 ， 李秋平引 領眾 成員積極 創作 ， 並把書 寫 的 揮春 和 對 聯等 贈予 村民 。 該會 並向 該村 捐贈 一批 黃 皮樹 果苗 ， 積極動員 該會 成員及 村民 等 共同 植樹 ， 為 綠化獻力 。         活動 結束 之際 ， 葉淑儀 等 向 李秋平贈 送錦旗 ， 小朋友 也 向 該 會 成員送 上 親手 裁剪 的 窗花 ， 以表 謝意 ， 場面 溫馨 。
陳族聯誼會訪中聯辦交流,陳族聯誼會訪中聯辦交流    澳門陳族聯誼會會長陳惠卿、常務副會長陳德勝、理事長陳惠容、監事長陳秀燕、秘書長陳國明以及理事陳思進等新一屆主要理監事成員昨日拜訪中聯辦，獲協調部副部長劉冠宇接待。    陳惠卿感謝中聯辦對該會向居民提供義教、義診等重點工作的支持，除扎實做好族群社團工作外，更會加強培育愛國愛澳青年力量，透過開展尋根認識等活動，讓年輕人從潁川歷史源頭開始，逐步加深培育正確價值觀，傳承回饋社會、服務社會的傳統美德。,http://www.macaodaily.com/html/2024-02/03/content_1733018.htm,陳惠卿感謝中聯辦對該會向居民提供義教、義診等重點工作的支持，除扎實做好族群社團工作外，更會加強培育愛國愛澳青年力量，透過開展尋根認識等活動，讓年輕人從潁川歷史源頭開始，逐步加深培育正確價值觀，傳承回饋社會、服務社會的傳統美德,陳 族 聯誼會訪 中聯辦 交流         澳門陳族 聯誼 會會長 陳 惠卿 、 常務 副 會長 陳 德勝 、 理事 長 陳 惠容 、 監事長 陳 秀燕 、 秘書長 陳 國明 以及 理事 陳 思進 等 新 一屆 主要 理監事 成員 昨日 拜訪 中聯辦 ， 獲協調 部副 部長 劉冠宇 接待 。         陳 惠卿 感謝 中聯辦 對 該 會 向 居民 提供 義教 、 義診 等 重點 工作 的 支持 ， 除扎實 做好 族群 社團 工作 外 ， 更會 加強 培育 愛國 愛澳 青年 力量 ， 透過 開展 尋根 認識 等 活動 ， 讓 年 輕人 從 潁川歷 史源 頭開始 ， 逐步 加深 培育 正確 價值觀 ， 傳承 回饋 社會 、 服務 社會 的 傳統 美德 。
川企訪中總促商貿合作,川企訪中總促商貿合作    四川省商業投資集團有限責任公司董事長佘驥一行四人日前訪問澳門中華總商會，獲理事長馬志毅，副理事長葉兆佳，常務理事蔡明威，理事楊靜純，監事李柱坤以及副秘書長梁慶華等接待。    馬志毅表示，特區政府致力建設中國與葡語國家經貿合作平台，冀川企善用澳門平台優勢，結合大灣區以及深合區建設機遇，赴澳投資並積極向海外拓展業務。中總樂意提供力所能及的服務和協助。    佘驥指出，該公司作為省屬唯一現代商貿流通產業投資平台和現代供應鏈保障平台，業務範圍廣。澳門具區位優勢和自由港地位，通過建設中葡平台聯通世界，未來冀與中總建立友好合作關係，進一步促進川澳商貿往來。,http://www.macaodaily.com/html/2024-02/03/content_1733019.htm,川企訪中總促商貿合作    四川省商業投資集團有限責任公司董事長佘驥一行四人日前訪問澳門中華總商會，獲理事長馬志毅，副理事長葉兆佳，常務理事蔡明威，理事楊靜純，監事李柱坤以及副秘書長梁慶華等接待,川 企訪 中 總促 商貿 合作         四川省 商業 投資 集團 有限 責任 公司 董事 長 佘驥 一行 四人 日前 訪問 澳門 中華 總商會 ， 獲 理事 長 馬 志毅 ， 副 理事 長 葉兆佳 ， 常務 理事 蔡明威 ， 理事 楊靜純 ， 監事 李柱 坤 以及 副 秘書長 梁慶華 等 接待 。         馬 志毅 表示 ， 特區 政府 致力 建設 中國 與 葡語 國家 經貿 合作 平台 ， 冀川企 善用 澳門 平台 優勢 ， 結合 大灣區 以及 深合區 建設 機遇 ， 赴 澳 投資 並積 極向 海外 拓展 業務 。 中 總樂意 提供 力所能及 的 服務 和 協助 。         佘驥 指出 ， 該 公司 作為 省屬 唯一 現代 商貿 流通 產業 投資 平台 和 現代供 應鏈 保障 平台 ， 業務範 圍廣 。 澳門 具區位 優勢 和 自由港 地位 ， 通過 建設 中葡 平台 聯通 世界 ， 未來 冀 與 中 總 建立 友好合作 關 係 ， 進 一步 促進川 澳商 貿往 來 。
