Title,Content,Link,Summary,Preprocessed_Content,Date
新型防篡改標籤可驗物品真偽    多  姿,新型防篡改標籤可驗物品真偽    一般市面上流通的防篡改標籤專為安全目的而設計，以保護物品免受篡改和盜竊，一個常見的應用是防篡改標籤包括校準信息，除了確保標籤不被篡改外，校準標籤還提供視覺證據等。美國麻省理工學院日前發佈消息稱，該校研究人員利用太赫茲波開發了一種新型防篡改ID標籤，其驗證物品真假的準確率可達百分之九十九。該標籤具有小巧、廉價和安全等優點。    幾年前，美國麻省理工學院的研究人員發明了一種加密ID標籤，比通常貼在產品上以驗證真實性的傳統射頻標籤（RFID）更小和更便宜。這種微小標籤利用太赫茲波，但它存在一個重大的安全性漏洞：造假者可以將標籤從真品上剝離，再貼在假貨上。研究人員進一步解釋稱，太赫茲波是從上世紀八十年代中後期，才被正式命名的，在此以前科學家們將統稱為“遠紅外射線”。太赫茲波是指頻率在○點一THz（波動頻率單位）到十THz範圍的電磁波，波長大概在○點○三到三毫米範圍，介於微波與紅外之間。    有一次在洗車店，研究人員眼看擋風玻璃上貼了一個 RFID 標籤，以驗證洗車會員資格。研究人員表示，為了提高安全性，標籤是用易碎紙做的，如果一個不誠實的顧客試圖將其撕下並貼到不同的擋風玻璃上，它就會被破壞。 但這並不是一個非常可靠的防止篡改的方法。例如，有人可以用溶液溶解黏合劑，安全移除易碎標籤。 研究人員介紹稱，一個更好的安全解決方案是驗證物品本身，而不是驗證標籤。為了做到這一點，研究團隊製作了一種新的光動力防篡改標籤，尺寸約為四平方毫米。他們將微小的金屬顆粒混入黏貼標籤的膠水中，然後使用太赫茲波檢測這些金屬顆粒在物品表面形成的獨特圖案。這種隨機的膠水圖案類似於指紋，可用來驗證物品真偽。    研究人員指出，新的防篡改標籤具有一系列微槽，使太赫茲波能夠穿過標籤，並擊中混合在膠水中的微小金屬顆粒。太赫茲波有足夠的靈敏度，可以探測到粒子。此外，使用波長為一毫米的太赫茲波，研究人員可以製造出不需要更大片外天線的芯片。在穿過標籤並擊中物體表面後，太赫茲波被反射或反向散射到接收器進行驗證。    研究人員還訓練了一種機器學習模型，用於比較膠水圖案，並計算它們的相似性，進而檢測是否被篡改，準確率超過百分之九十九。    太赫茲標籤的生產成本非常低，有望在整個大規模供應鏈中應用。由於尺寸微小，該標籤能夠貼在傳統RFID無法識別的小尺寸物品上，比如某些醫療器件等設備。    多    姿,http://www.macaodaily.com/html/2024-04/16/content_1748519.htm,美國麻省理工學院日前發佈消息稱，該校研究人員利用太赫茲波開發了一種新型防篡改ID標籤，其驗證物品真假的準確率可達百分之九十九,新型 防 篡改 標 籤 可驗 物品 真偽         一般 市面上 流通 的 防 篡改 標 籤 專為 安全 目的 而 設計 ， 以保護 物品 免受 篡改 和 盜 竊 ， 一個 常見 的 應用 是 防 篡改 標 籤 包括 校準 信息 ， 除了 確保標 籤 不 被 篡改 外 ， 校準標 籤 還 提供 視覺 證據 等 。 美國 麻省理工 學院 日前 發 佈 消息 稱 ， 該校 研究 人員 利用 太赫茲波 開發 了 一種 新型 防 篡改 ID 標 籤 ， 其驗證 物品 真假 的 準確 率 可達 百分之九十九 。 該標 籤 具有 小巧 、 廉價 和 安全 等 優點 。         幾 年前 ， 美國 麻省理工 學院 的 研究 人員 發明 了 一種 加密 ID 標 籤 ， 比 通常 貼 在 產品 上 以驗 證真 實性 的 傳統射 頻標 籤 （ RFID ） 更 小 和 更 便宜 。 這種 微小 標 籤 利用 太赫茲波 ， 但 它 存在 一個 重大 的 安全性 漏洞 ： 造假者 可以 將標 籤 從 真品 上 剝離 ， 再 貼 在 假貨上 。 研究 人員進 一步 解釋 稱 ， 太赫茲波 是 從 上 世紀 八十年代 中後期 ， 才 被 正式 命名 的 ， 在 此 以前 科學家們 將統 稱 為 “ 遠紅外 射線 ” 。 太赫茲波 是 指 頻率 在 ○ 點一 THz （ 波動 頻率 單位 ） 到 十 THz 範圍 的 電磁波 ， 波長 大概 在 ○ 點 ○ 三到 三 毫米 範圍 ， 介 於 微波 與 紅外 之間 。         有 一次 在 洗 車店 ， 研究 人員 眼看 擋風 玻璃 上 貼 了 一個   RFID   標 籤 ， 以驗 證洗 車會員 資格 。 研究 人員 表示 ， 為 了 提高 安全性 ， 標 籤 是 用 易碎 紙做 的 ， 如果 一個 不誠實 的 顧 客試 圖將 其 撕下 並貼 到 不同 的 擋 風 玻璃 上 ， 它 就 會 被 破壞 。   但 這並 不是 一個 非常 可靠 的 防止 篡改 的 方法 。 例如 ， 有人 可以 用 溶液 溶解 黏合 劑 ， 安全 移除 易碎 標 籤 。   研究 人員介紹 稱 ， 一個 更好 的 安全 解決 方案 是 驗證 物品 本身 ， 而 不是 驗證標 籤 。 為 了 做到 這一點 ， 研究 團 隊 製 作 了 一 種 新 的 光 動 力 防 篡改 標 籤 ， 尺寸 約 為 四 平方毫米 。 他們將 微小 的 金屬 顆粒 混入 黏 貼標 籤 的 膠 水中 ， 然 後 使用 太赫茲波 檢測 這些 金屬 顆粒 在 物品 表面 形成 的 獨特 圖案 。 這種 隨機 的 膠水 圖案 類似 於 指紋 ， 可用 來驗證 物品 真偽 。         研究 人員 指出 ， 新 的 防 篡改 標 籤 具有 一系列 微槽 ， 使太赫茲波 能夠 穿 過標 籤 ， 並擊 中 混合 在 膠 水中 的 微小 金屬 顆粒 。 太赫茲波 有 足夠 的靈 敏度 ， 可以 探測 到 粒子 。 此外 ， 使用 波長 為 一 毫米 的 太赫茲波 ， 研究 人員 可以 製 造 出 不 需要 更 大片 外天線 的 芯片 。 在 穿 過標 籤 並擊 中物體 表面 後 ， 太赫茲波 被 反射 或 反向 散射 到 接收器 進行驗證 。         研究 人員 還訓練 了 一種 機器 學習 模型 ， 用 於 比 較 膠水 圖案 ， 並計算 它們 的 相似性 ， 進而 檢測 是否 被 篡改 ， 準確 率 超過 百分之九十九 。         太赫茲標 籤 的 生產 成本 非常低 ， 有望 在 整個 大規 模供 應鏈 中 應用 。 由 於 尺寸 微小 ， 該標 籤 能夠 貼 在 傳統 RFID 無法識別 的 小 尺寸 物品 上 ， 比如 某些 醫療 器件 等 設備 。         多         姿,2024-04-16
黃子華：電影獲獎更圓滿,失落影帝冇氣餒    黃子華：電影獲獎更圓滿    《毒舌大狀》於第四十二屆香港電影金像獎本有十項提名，但各大獎項逐一揭曉該片卻仍未能獲獎，即使角逐最佳男主角的黃子華，也落敗輸給六度稱帝的梁朝偉，到最終才力挽狂瀾奪得終極大獎“最佳電影”。    頒獎禮結束後，《毒舌大狀》台前幕後團隊包括老闆江志強、演員黃子華、謝君豪、王丹妮及何啟華等聯袂《填詞L》團隊齊齊慶功。    黃子華雖失落影帝慶功宴上仍滿場飛，不停被集郵，他直言獲得電影最大獎項感覺比自己拿獎更圓滿。不過他笑言自己的戲縱然是票房冠軍，惟他六年來才拍得四部戲，日子仍很艱難，自己只算是新人一個。記者笑問他是新人，片酬卻非收新人價，他笑答：“梗喺唔喺個班啲片酬，我係半新不舊，不過都好感恩，有戲拍就得。”之前為何不拍《飯戲攻心2》？子華回答：“撞唔啱，答應自己十年唔講呢件事。”    記者問到：“《毒舌大狀》會否拍績集？”子華戲言導演可貴之處是夠堅持，他不想拍續集，但在構思原班人馬拍另一新題材：“高尚嘅人都要開飯，但他就堅持，我睇返今年成績最好嘅西片，十部都係續集，我們票房冠軍就唔拍續集。”    至於子華與許冠文合作的新戲《破 · 地獄》已經殺青，他相信能於今年上映。跟許冠文合作，子華感覺非常愉快：“三十年前他籌拍《神算》時，似上帝般親自打電話嚟找我幫手寫劇本，今次再合作一齊主演，就好似前世嘅賈寶玉咁，感覺緣份嘅奇妙。”,http://www.macaodaily.com/html/2024-04/16/content_1748463.htm,失落影帝冇氣餒    黃子華：電影獲獎更圓滿    《毒舌大狀》於第四十二屆香港電影金像獎本有十項提名，但各大獎項逐一揭曉該片卻仍未能獲獎，即使角逐最佳男主角的黃子華，也落敗輸給六度稱帝的梁朝偉，到最終才力挽狂瀾奪得終極大獎“最佳電影”,失落 影帝 冇 氣餒         黃 子華 ： 電影 獲獎 更 圓滿         《 毒舌大狀 》 於 第四十二 屆 香港 電影 金像 獎本 有十項 提名 ， 但 各大獎 項 逐一 揭曉該 片 卻 仍 未能 獲獎 ， 即使 角逐 最佳 男主角 的 黃 子華 ， 也 落敗 輸給 六度 稱帝 的 梁朝 偉 ， 到 最終 才力 挽狂 瀾 奪得 終極 大獎 “ 最佳 電影 ” 。         頒獎禮 結束 後 ， 《 毒舌大狀 》 台前 幕後團隊 包括 老 闆 江志強 、 演員黃子華 、 謝君豪 、 王丹妮 及何 啟華 等 聯袂 《 填詞 L 》 團隊 齊齊慶功 。         黃 子華 雖 失落 影帝 慶功 宴 上 仍 滿場 飛 ， 不停 被 集郵 ， 他 直言 獲得 電影 最大 獎項 感覺 比 自己 拿獎 更 圓滿 。 不過 他 笑 言 自己 的 戲縱然 是 票房 冠 軍 ， 惟 他 六年 來 才 拍 得 四部 戲 ， 日子 仍 很 艱難 ， 自己 只 算是 新人 一個 。 記者 笑問 他 是 新人 ， 片酬 卻 非收 新人 價 ， 他 笑答 ： “ 梗 喺 唔 喺 個 班 啲 片酬 ， 我 係 半新 不舊 ， 不過 都 好 感恩 ， 有戲 拍 就 得 。 ” 之前 為 何不 拍 《 飯戲 攻心 2 》 ？ 子華 回答 ： “ 撞 唔 啱 ， 答應 自己 十年 唔 講呢 件 事 。 ”         記者 問到 ： “ 《 毒舌大狀 》 會否 拍績 集 ？ ” 子華 戲言導 演可貴 之處 是夠 堅持 ， 他 不想 拍續 集 ， 但 在 構思 原班 人馬 拍 另 一新 題材 ： “ 高尚 嘅 人 都 要 開 飯 ， 但 他 就 堅持 ， 我 睇 返 今年 成績 最好 嘅 西片 ， 十部 都 係 續集 ， 我們 票房 冠 軍 就 唔 拍續 集 。 ”         至於 子華 與 許冠文 合作 的 新戲 《 破   ·   地獄 》 已經 殺青 ， 他 相信 能 於 今年 上映 。 跟 許冠文 合作 ， 子華 感覺 非常 愉快 ： “ 三十年 前 他 籌 拍 《 神算 》 時 ， 似 上帝 般親 自打 電話 嚟 找 我 幫手 寫 劇本 ， 今次 再 合作 一齊 主演 ， 就 好似 前世 嘅 賈 寶 玉 咁 ， 感覺 緣 份 嘅 奇妙 。 ”,2024-04-16
王丹妮願再與黃子華合作,王丹妮願再與黃子華合作    王丹妮同樣失落金像獎影后，她直言沒甚麼失望，開心能從多明尼加拍完戲趕及回香港參加到金像獎，與《毒舌大狀》團隊敘舊已經很滿足：“其實有提名已經好大鼓勵，我會加油，努力增值自己，希望將來拍多啲戲，會有更好表現。”王丹妮希望可以原班人馬再度合作，尤其《毒》片中她演犯人，與黃子華對手戲不多，即使同場也要隔着張枱或欄杆，希望下一次可以近距離接觸。提議合演情侶？她笑說：“睇導演安排，我自己好有義氣，會盡量留定時間。”    何啟華聽到黃子華自認新人，拍戲不夠他多，即自嘲是影壇小幼苗連人都不是，還未脫離植物生活，仍在生長中。子華笑問他有否聽過拔苗助長，何啟華笑說：“呢個成語係負面嘅，但佢想拔就拔，我任佢拔，其實子華神好照顧我哋一班新人，亦唔係必然要做，所以幼苗要爭氣。”    何啟華都希望《毒舌大狀》開續集，但沒有聽聞過，亦想原班人馬再合作，而這個班底老中青都有，能拍的題材很多，大家可以互補。電影拿奬會否加片酬？他笑言也好，但拍戲不是搵錢，收的是正常工資，拍廣告才搵錢：“拍戲好辛苦，大家都拍到爆肝爆腎，少啲夢想都做唔到電影業，要用個心去感動自己同觀眾。”,http://www.macaodaily.com/html/2024-04/16/content_1748464.htm,王丹妮願再與黃子華合作    王丹妮同樣失落金像獎影后，她直言沒甚麼失望，開心能從多明尼加拍完戲趕及回香港參加到金像獎，與《毒舌大狀》團隊敘舊已經很滿足：“其實有提名已經好大鼓勵，我會加油，努力增值自己，希望將來拍多啲戲，會有更好表現,王丹妮 願 再 與 黃 子華 合作         王丹妮 同樣 失落 金像 獎 影后 ， 她 直言 沒 甚麼 失望 ， 開心 能 從 多明尼加 拍 完戲 趕及 回 香港 參加 到 金像 獎 ， 與 《 毒舌大狀 》 團隊 敘舊 已經 很 滿足 ： “ 其實 有 提名 已經 好 大鼓 勵 ， 我會 加油 ， 努力 增值 自己 ， 希望 將來 拍 多 啲 戲 ， 會 有 更好 表現 。 ” 王丹妮 希望 可以 原班 人馬 再度 合作 ， 尤其 《 毒 》 片中 她 演 犯人 ， 與 黃 子華對 手戲 不 多 ， 即使 同場 也 要 隔 着 張 枱 或 欄杆 ， 希望 下 一次 可以 近距 離接觸 。 提議 合演 情侶 ？ 她 笑 說 ： “ 睇 導演 安排 ， 我 自己 好 有義氣 ， 會 盡量 留定 時間 。 ”         何 啟華 聽 到 黃 子華 自認 新人 ， 拍戲 不夠 他 多 ， 即 自嘲 是 影壇 小 幼苗 連人 都 不是 ， 還未 脫離 植物 生活 ， 仍 在 生長 中 。 子華笑 問他 有否 聽 過拔 苗助長 ， 何啟 華笑 說 ： “ 呢 個 成語 係 負 面 嘅 ， 但 佢 想 拔 就 拔 ， 我 任 佢 拔 ， 其實子 華神 好 照顧 我 哋 一班 新人 ， 亦 唔 係 必然 要 做 ， 所以 幼苗 要 爭氣 。 ”         何 啟華 都 希望 《 毒舌大狀 》 開續 集 ， 但 沒 有 聽聞過 ， 亦 想 原班 人馬 再 合作 ， 而 這個 班底 老中青 都 有 ， 能 拍 的 題材 很多 ， 大家 可以 互補 。 電影 拿 奬 會 否 加 片酬 ？ 他 笑 言 也好 ， 但 拍戲 不是 搵 錢 ， 收 的 是 正常 工資 ， 拍廣告 才 搵 錢 ： “ 拍戲 好 辛苦 ， 大家 都 拍 到 爆肝 爆 腎 ， 少 啲 夢 想 都 做 唔 到 電影業 ， 要 用個 心去 感動 自己 同觀眾 。 ”,2024-04-16
周家怡拍片致肋骨撕裂,周家怡拍片致肋骨撕裂    周家怡主演的《金手指》亦有十二金像獎項提名，當她與團隊現身時，因現場大風，多次被所穿的黑色大露背開高衩長裙絆腳，頗為尷尬。豈料還是負傷上陣，她稱最近為新片的動作戲做訓練，因肌肉未能負荷，經醫生診斷後，發現其中一條肋骨裂了、膊頭胶位也出現一級撕裂，若然去到二級撕裂就要做手術。    憑《不日成婚2》角逐最佳女主角的衞詩雅，笑言身穿這條來自法國的白色喱士禮服滿佈裝飾品、十分“掗拃”，不能有人埋身，還要勞煩陳家樂等三位猛男為她擺裙擺；但由於近似婚紗，加上頭紗可於將來結婚時循環再用。黃子華憑《毒舌大狀》首度角逐金像影帝，他笑言沒準備謝詞、玩即興。而片中女主角王丹妮也從外地趕返香港出席盛會。此外，擔任頒獎嘉賓的Angelababy被問到是否已獲內地解封，她就叫傳媒不要問這些。,http://www.macaodaily.com/html/2024-04/16/content_1748465.htm,憑《不日成婚2》角逐最佳女主角的衞詩雅，笑言身穿這條來自法國的白色喱士禮服滿佈裝飾品、十分“掗拃”，不能有人埋身，還要勞煩陳家樂等三位猛男為她擺裙擺,周家 怡 拍片 致 肋骨 撕裂         周家 怡 主演 的 《 金手指 》 亦 有 十二 金像 獎項 提名 ， 當 她 與 團隊 現身 時 ， 因現 場大風 ， 多次 被 所 穿 的 黑色 大 露背 開高 衩 長 裙 絆腳 ， 頗 為 尷尬 。 豈料 還是 負傷 上陣 ， 她 稱 最近 為 新片 的 動作戲 做 訓練 ， 因 肌肉 未能 負荷 ， 經醫生 診斷 後 ， 發現 其中 一條 肋骨 裂 了 、 膊 頭胶位 也 出現 一級 撕裂 ， 若然 去 到 二級 撕裂 就要 做 手術 。         憑 《 不日 成婚 2 》 角逐 最佳 女主角 的 衞 詩 雅 ， 笑 言 身穿 這條 來 自法國 的 白色 喱 士禮 服滿 佈 裝飾品 、 十分 “ 掗 拃 ” ， 不能 有人 埋身 ， 還要 勞煩 陳 家樂 等 三位 猛男 為 她 擺 裙 擺 ； 但 由 於 近似 婚紗 ， 加上 頭紗 可 於 將來 結婚 時 循環 再 用 。 黃 子華 憑 《 毒舌大狀 》 首度 角逐 金像 影帝 ， 他 笑 言 沒 準備 謝詞 、 玩 即興 。 而 片中 女主角 王丹妮 也 從 外地 趕返 香港 出席 盛會 。 此外 ， 擔任 頒獎 嘉賓 的 Angelababy 被 問到 是否 已 獲內 地 解封 ， 她 就 叫 傳媒 不要 問這些 。,2024-04-16
余香凝為戰衣節食,余香凝為戰衣節食    《第42屆香港電影金像獎》頒獎禮昨晚舉行，一眾群星均以華麗戰衣踏上紅地氈。計有“終身成就奬”得主洪金寶與太太高麗虹，來自台灣吳慷仁和許光漢，頒獎嘉賓還有林熙蕾、Angelababy，以及日本名導是枝裕和等。其中角逐影后的余香凝在造型上獲女兒加持，周家怡則負傷到場。而第六度稱帝創下金像獎紀錄的梁朝偉雖然身在外地，但太太劉嘉玲甫亮相即艷壓群芳，更向老公投下信心的一票。    劉嘉玲以白色和香檳色拖尾盛裝亮相紅地氈，一身雍容華貴的打扮的她氣場十足、艷壓全場。獲十六項提名的《白日之下》拉隊到場，包括候選影帝林保怡、女主角余香凝與老公、姜大衛和太太李琳琳等。    余香凝在老公相伴下受訪，還取笑老公緊張得變了機械人。說到她身穿金色裙是否為奪金（影后）造勢，她稱這條裙是囡囡挑選，稱讚囡囡有時裝觸角。在旁的老公指如果太太得獎會請食飯，余香凝即撤嬌說：“仲要食餐好，大魚大肉；因為了穿這條裙，全日只吃了兩粒朱古力。”,http://www.macaodaily.com/html/2024-04/16/content_1748466.htm,獲十六項提名的《白日之下》拉隊到場，包括候選影帝林保怡、女主角余香凝與老公、姜大衛和太太李琳琳等,余香 凝為 戰衣 節食         《 第 42 屆 香港 電影 金像 獎 》 頒獎禮 昨晚 舉行 ， 一眾 群星 均 以華麗 戰衣 踏上 紅地 氈 。 計有 “ 終身 成就 奬 ” 得主 洪金寶與 太太 高麗虹 ， 來 自台灣 吳慷 仁和 許光漢 ， 頒獎 嘉賓 還有 林熙蕾 、 Angelababy ， 以及 日本 名導 是 枝裕 和 等 。 其中 角逐 影后 的 余香 凝在 造型 上 獲 女兒 加持 ， 周家 怡則 負傷 到場 。 而 第六度 稱帝 創下 金像 獎紀錄 的 梁朝 偉雖然 身 在 外地 ， 但 太太 劉嘉玲甫 亮相 即艷壓 群芳 ， 更 向 老公 投 下 信心 的 一票 。         劉嘉玲 以 白色 和 香檳色 拖尾 盛裝 亮相 紅地 氈 ， 一身 雍容 華貴 的 打扮 的 她 氣場 十足 、 艷壓 全場 。 獲 十六 項 提名 的 《 白日 之下 》 拉隊 到場 ， 包括 候選 影帝 林保怡 、 女主角 余香 凝 與 老公 、 姜大衛 和 太太 李琳琳 等 。         余香 凝在 老公 相伴 下 受訪 ， 還 取笑 老公 緊張 得 變 了 機械 人 。 說 到 她 身穿 金色 裙 是否 為 奪金 （ 影后 ） 造勢 ， 她 稱 這條 裙 是 囡 囡 挑選 ， 稱 讚 囡 囡 有 時 裝 觸 角 。 在 旁 的 老公 指 如果 太太 得 獎會 請 食飯 ， 余香 凝即 撤嬌 說 ： “ 仲要 食餐 好 ， 大魚 大肉 ； 因為 了 穿 這條 裙 ， 全日 只 吃 了 兩粒 朱古力 。 ”,2024-04-16
古仔振奮：《九龍城寨之圍城》入選康影,古仔振奮：《九龍城寨之圍城》入選康影    香港動作鉅獻《九龍城寨之圍城》由《智齒》導演鄭保瑞執導，《無間道》監製莊澄及《葉問》導演葉偉信監製，《神劍闖江湖》的知名動作執導谷垣健治共同合作。在上映之前，電影便獲得國際肯定，入選康城影展午夜展映單元，讓主角古天樂覺得很振奮，“證明香港的動作電影依然能打進國際市場。”該片重金打造重現八十年代香港最知名的“三不管”九龍城寨的獨特景色，獲選康城影影午夜展映單元，將與韓國票房導演柳承莞執導，全度妍及池昌旭合作的《辣手神探2》等作品，共同在此影展單元放映。    香港電影上次入選康城影展此單元是十一年前，由杜琪峯執導、劉德華與鄭秀文合作演出的《盲探》。時隔多年，再度入選康城。監製莊澄表示從二○一六年便開始籌備這部作品，經歷很多困難。導演鄭保瑞開心地說：“這部電影充滿了香港獨有的特色，雖然現在已經沒有這個城寨了，但我們用電影保留下來了，希望可以被更多觀眾看見。”古天樂也大感振奮，“香港電影已經十多年沒有入選這個單元了，這次證明了香港電影還是可以打入國際舞台，希望到時候在各地上映都能有好口碑及好成績。”,http://www.macaodaily.com/html/2024-04/16/content_1748469.htm,”該片重金打造重現八十年代香港最知名的“三不管”九龍城寨的獨特景色，獲選康城影影午夜展映單元，將與韓國票房導演柳承莞執導，全度妍及池昌旭合作的《辣手神探2》等作品，共同在此影展單元放映,古仔振奮 ： 《 九龍 城寨 之圍 城 》 入 選康影         香港 動作鉅獻 《 九龍 城寨 之圍 城 》 由 《 智齒 》 導演 鄭保瑞 執導 ， 《 無間 道 》 監 製 莊 澄 及 《 葉問 》 導演 葉偉信 監 製 ， 《 神劍 闖 江湖 》 的 知名 動作 執導 谷垣 健治 共同 合作 。 在 上映 之前 ， 電影 便 獲得 國際 肯定 ， 入 選康城 影展 午夜 展映 單元 ， 讓 主角 古天樂覺 得 很振奮 ， “ 證明 香港 的 動作 電影 依然 能 打 進國際 市場 。 ” 該片 重金 打造 重現 八十年代 香港 最 知名 的 “ 三不管 ” 九龍 城寨 的 獨特 景色 ， 獲選康城 影影 午夜 展映 單元 ， 將與 韓國 票房 導演 柳承莞 執導 ， 全度妍 及 池昌旭 合作 的 《 辣手 神探 2 》 等 作品 ， 共同 在 此 影展 單元 放映 。         香港 電影 上次 入 選康城 影展 此 單元 是 十一年 前 ， 由 杜琪 峯 執導 、 劉德華 與 鄭秀文 合作 演出 的 《 盲探 》 。 時隔 多年 ， 再度 入 選康城 。 監 製 莊 澄 表示 從 二 ○ 一 六年 便 開始 籌備 這部 作品 ， 經歷 很多 困難 。 導演 鄭保瑞開 心地 說 ： “ 這部 電影 充滿 了 香港 獨有 的 特色 ， 雖然現 在 已經 沒有 這個 城寨 了 ， 但 我們 用 電影 保留 下來 了 ， 希望 可以 被 更 多 觀眾 看見 。 ” 古天樂 也 大 感振奮 ， “ 香港 電影 已經 十多年 沒有 入選 這個 單元 了 ， 這次 證明 了 香港 電影 還是 可以 打入 國際 舞台 ， 希望 到 時候 在 各地 上映 都 能 有 好 口碑 及 好 成績 。 ”,2024-04-16
