Title,Content,Link,Summary,Preprocessed_Content,Date
科學館極地展推動保育意識,科學館極地展推動保育意識    南極與北極作為地球兩極，到底有怎樣的景緻和秘密？其在國際交通和戰略中又扮演甚麼角色？極地冰川融化又是怎樣影響到千里之外的我們？通過澳門科學館的“極地科研與可持續發展”特備展覽，各位讀者或許都能找到答案。    南極科考四十周年    二〇二四年標誌着中國南極科考四十周年，我國第四代自主建造並擁有自主知識產權的極地科考船——雪龍二號在南極科考期間，協助成功建設“秦嶺站”，為中國極地科考寫下新篇章。為慶祝這一里程碑，澳門科學館、澳門綠色環境保護協會、綠色未來基金總會及香港極地研究中心聯合舉辦、美高梅贊助的“極地科研與可持續發展特展”於澳門科學館展覽中心中庭展出。    合辦展覽的綠色未來基金總會主席暨香港極地研究中心“紫荊站”創辦人何建宗介紹展覽時表示，“認識極地、保護極地、利用極地”是國家主席習近平提出的主張定向，極地不但含有豐富的淡水資源，冰川之下更蘊藏大量礦物及化石能源，資源豐富外也是維護生物多樣性的重點區域；儘管南北極地理位置遙遠，但極地溫度變化及冰雪溶解卻會牽動全球的氣候轉變、海洋流動和生態平衡，對遠洋漁業和碳匯具有重要影響外，更會影響到千里之外的我們；因此他期望能透過和科學館合辦今次展覽，向澳門公眾傳達環境保護的重要性，同時讓青少年了解國家所取得的極地科研成果及多項關鍵創新技術。    展示採集珍貴樣本    今次極地展覽除展示自一九八四年以來中國的極地考察歷史及考察站點建設歷程外，也展出雪龍二號極地科考船的1:100模型，並且有三段在南北極拍攝的科普影片分別於展場內及科學館的天文館播放，以讓觀眾更立體地認識國家科技進步及在極地考察上取得的種種成就、進展。    同時，展覽也展出多個何建宗赴極地科研時收集並帶回的珍貴樣本，包括企鵝和斯瓦爾巴德群島馴鹿的骨骼、南極磷蝦、企鵝蛋、南極地衣等化石及樣本。同時也展出他在探索極地時所寫下的筆記、所穿著的裝備、用具、採集儀器及化學實驗樣本等，讓觀眾能通過這些展品了解極地生態和環境，以及科學家們在極地進行科研時所面對的艱辛與困難。    澳門科學館展覽中心中庭舉辦的“極地科研與可持續發展特展”將持續至今年十二月一日，等待各位讀者一同探索、了解到新時代國家在科技創新方面的進步，極地可持續發展，以及海洋和極地安全方面的基礎知識，從而 “認識極地、保護極地、利用極地”。,http://www.macaodaily.com/html/2024-11/25/content_1796409.htm,展示採集珍貴樣本    今次極地展覽除展示自一九八四年以來中國的極地考察歷史及考察站點建設歷程外，也展出雪龍二號極地科考船的1:100模型，並且有三段在南北極拍攝的科普影片分別於展場內及科學館的天文館播放，以讓觀眾更立體地認識國家科技進步及在極地考察上取得的種種成就、進展,科學館 極地展 推動 保育 意識         南極 與 北極作 為 地球 兩極 ， 到底 有 怎樣 的 景 緻 和 秘密 ？ 其 在 國際 交通 和 戰略 中 又 扮演 甚麼 角色 ？ 極地 冰川 融化 又 是 怎樣 影響 到 千里 之外 的 我們 ？ 通過 澳門 科學館 的 “ 極地 科研 與 可持續 發展 ” 特備 展覽 ， 各位 讀者 或許 都 能 找到 答案 。         南極 科考 四十周年         二 〇 二 四年 標誌 着 中國 南極 科考 四十周年 ， 我國 第四代 自主 建造 並擁 有 自主 知識產權 的 極地 科考船 — — 雪龍二號 在 南極 科考 期間 ， 協助 成功 建設 “ 秦嶺 站 ” ， 為 中國極 地 科考 寫下 新篇章 。 為慶祝 這一 里程碑 ， 澳門 科學館 、 澳門 綠色 環境 保護 協會 、 綠色 未來 基金 總會 及 香港 極地 研究 中心 聯合 舉辦 、 美高梅 贊助 的 “ 極地 科研 與 可持續 發展 特展 ” 於 澳門 科學館 展覽 中心 中庭 展出 。         合辦 展覽 的 綠色 未來 基金 總會 主席 暨 香港 極地 研究 中心 “ 紫 荊站 ” 創辦 人何 建宗介紹 展覽時 表示 ， “ 認識 極地 、 保護 極地 、 利用 極地 ” 是 國家 主席 習近 平 提出 的 主張 定向 ， 極地 不但 含有 豐富 的 淡水 資源 ， 冰川 之下 更 蘊藏 大量 礦物 及 化石 能源 ， 資源 豐富外 也 是 維護 生物 多樣 性 的 重點 區域 ； 儘 管 南北 極 地理位置 遙遠 ， 但 極地 溫度 變化 及 冰雪 溶解 卻會 牽動 全球 的 氣候 轉變 、 海洋 流動 和 生態 平衡 ， 對遠洋 漁業 和 碳匯 具有 重要 影響 外 ， 更會 影響 到 千里 之外 的 我們 ； 因此 他 期望 能 透過 和 科學館 合辦 今次 展覽 ， 向 澳門 公眾 傳達 環境 保護 的 重要性 ， 同時 讓 青少年 了解 國家 所 取得 的 極地 科研成果 及多項 關鍵 創新 技術 。         展示 採集 珍貴樣 本         今次 極地 展覽除 展示 自 一九八四年 以來 中國 的 極地 考察 歷史 及 考察站 點建設 歷程 外 ， 也 展出 雪龍二號 極地 科考船 的 1 : 100 模型 ， 並且 有 三段 在 南北 極拍 攝 的 科普 影片 分別 於 展場 內及 科學館 的 天文 館 播放 ， 以 讓 觀眾 更 立體 地 認識 國家 科技 進步 及 在 極地 考察 上 取得 的 種種 成就 、 進展 。         同時 ， 展覽 也 展出 多個 何建宗 赴 極地 科研 時 收集 並帶 回 的 珍貴樣 本 ， 包括 企鵝和斯瓦爾 巴德 群島 馴鹿 的 骨骼 、 南極 磷 蝦 、 企鵝蛋 、 南極 地衣 等 化石 及樣 本 。 同時 也 展出 他 在 探索 極地 時 所 寫 下 的 筆記 、 所 穿著 的 裝備 、 用具 、 採集 儀器 及化學 實驗樣 本 等 ， 讓 觀眾 能 通過 這些 展品 了解 極地 生態 和 環境 ， 以及 科學家們 在 極地 進行 科研 時所面 對 的 艱辛 與 困難 。         澳門 科學館 展覽 中心 中庭 舉辦 的 “ 極地 科研 與 可持續 發展 特展 ” 將持續 至今 年 十二月 一日 ， 等待 各位 讀者 一同 探索 、 了解 到 新 時代國家 在 科技 創新 方面 的 進步 ， 極地 可持續 發展 ， 以及 海洋 和 極地 安全 方面 的 基礎 知識 ， 從 而   “ 認識 極地 、 保護 極地 、 利用 極地 ” 。,2024-11-25
藉科普教育基地宣揚環保,藉科普教育基地宣揚環保    環境保護並非短期工作，環保教育更需持之以恆，因此在合作舉辦今次“極地科研與可持續發展特展”之後，綠色未來基金總會主席暨香港極地研究中心“紫荊站”創辦人何建宗期望，未來能與澳門科學館展開更多合作，例如定期舉辦、更新展覽，通過澳門科學館這個“全國科普教育基地”平台，為澳門青少年帶來更多極地及環保知識。    他提及，後續將會和澳門綠色環境保護協會合作，面向澳門青少年舉辦更多科普課程及遊歷考察活動，循不同途徑宣揚環保理念。未來有打算在澳門舉辦“極光盃”STEM教育比賽，讓青年、學生提出可行的環保方案並作評選，大賽優勝者除有機會赴內地登上雪龍號外，甚至有機會跟隨何建宗一同親身探索極地，以此讓青少年更熱衷於科研及環保，亦讓社會各界人士增強意識，將認識、保護及利用極地的精神發揚光大。,http://www.macaodaily.com/html/2024-11/25/content_1796410.htm,藉科普教育基地宣揚環保    環境保護並非短期工作，環保教育更需持之以恆，因此在合作舉辦今次“極地科研與可持續發展特展”之後，綠色未來基金總會主席暨香港極地研究中心“紫荊站”創辦人何建宗期望，未來能與澳門科學館展開更多合作，例如定期舉辦、更新展覽，通過澳門科學館這個“全國科普教育基地”平台，為澳門青少年帶來更多極地及環保知識,藉 科普 教育 基地 宣揚 環保         環境 保護 並非 短期 工作 ， 環保 教育 更 需持 之 以恆 ， 因此 在 合作 舉辦 今次 “ 極地 科研 與 可持續 發展 特展 ” 之 後 ， 綠色 未來 基金 總會 主席 暨 香港 極地 研究 中心 “ 紫 荊站 ” 創辦 人何 建宗 期望 ， 未來 能 與 澳門 科學館 展開 更 多 合作 ， 例如 定期 舉辦 、 更新 展覽 ， 通過 澳門 科學館 這個 “ 全國 科普 教育 基地 ” 平台 ， 為 澳門 青少年 帶來 更 多極 地及 環保 知識 。         他 提及 ， 後 續 將會 和 澳門 綠色 環境 保護 協會 合作 ， 面向 澳門 青少年 舉辦 更 多 科普 課程 及 遊歷 考察 活動 ， 循 不同 途徑 宣揚 環保 理念 。 未來 有 打算 在 澳門 舉辦 “ 極光 盃 ” STEM 教育 比賽 ， 讓 青年 、 學生 提出 可行 的 環保 方案 並作 評選 ， 大賽 優勝者 除 有 機會 赴 內 地 登上 雪龍號 外 ， 甚至 有 機會 跟 隨何 建宗 一同 親身 探索 極地 ， 以此 讓 青少年 更熱衷 於 科研 及 環保 ， 亦 讓 社會 各界人士 增強 意識 ， 將認識 、 保護及 利用 極地 的 精神 發揚 光大 。,2024-11-25
周中降溫或跌至十三度,冷空氣南下北風增強    周中降溫或跌至十三度    【本報消息】本澳再降溫，本周最低溫或跌至攝氏十三度左右，居民宜關注長者及慢性病患者需要，適當添衣保暖。    氣象局預測，受冷鋒前沿暖濕氣流影響，本周初期華南沿岸地區將以陰雨天氣為主。及後，隨着冷空氣於周中抵達，北風將顯著增強，氣溫亦將明顯下降，隨後天氣轉晴。本周天氣及氣溫變化將較為明顯，預計初時和暖有雨，隨後氣溫將快速下降至約十三度，居民應留意最新氣象資訊。    根據廣東天氣微信號消息，新一股中等偏強冷空氣前鋒將於今日傍晚影響粵北，今日夜間到明日早晨到達中南部市縣，受其影響，全省氣溫下降攝氏四至七度，體感寒冷。,http://www.macaodaily.com/html/2024-11/25/content_1796411.htm,根據廣東天氣微信號消息，新一股中等偏強冷空氣前鋒將於今日傍晚影響粵北，今日夜間到明日早晨到達中南部市縣，受其影響，全省氣溫下降攝氏四至七度，體感寒冷,冷空氣 南下 北風 增強         周中 降溫 或 跌 至 十三 度         【 本報 消息 】 本澳 再 降溫 ， 本周 最低 溫 或 跌 至 攝氏 十三 度 左右 ， 居民 宜關 注長 者 及 慢性病 患者 需要 ， 適當 添衣 保暖 。         氣象局 預測 ， 受冷 鋒 前沿 暖 濕氣流 影響 ， 本周 初期 華南 沿岸 地區 將以 陰 雨天 氣為 主 。 及 後 ， 隨着 冷空氣 於 周中 抵達 ， 北風將 顯著 增強 ， 氣溫 亦 將明顯 下降 ， 隨後天氣 轉晴 。 本周 天氣 及 氣溫 變化將 較 為 明顯 ， 預計 初時 和暖 有雨 ， 隨後氣 溫將 快速 下降 至約 十三 度 ， 居民 應 留意 最新 氣象 資訊 。         根據 廣東 天氣 微信號 消息 ， 新 一股 中等 偏強 冷空氣 前鋒將 於 今日 傍晚 影響 粵北 ， 今日 夜間 到 明日 早晨 到 達 中南部 市縣 ， 受其 影響 ， 全省 氣溫 下降 攝氏 四至 七度 ， 體感 寒冷 。,2024-11-25
十人訂“健康餐”被呃七千五,十人訂“健康餐”被呃七千五    【本報消息】近日再有十名居民疑墮網上訂“健康餐”詐騙，合共損失七千五百多元，對方收錢後無送餐，事主才知被騙報警。司警跟進調查案件。    九女一男事主均為本地人，除一名女青年外，其餘均為中年人，損失金額由四百多澳門元至一千三百多澳門元不等，合共損失七千五百六十六澳門元。本月二十一日，十名事主陸續到司警局報案稱懷疑墮訂餐詐騙，經司警調查，各事主分別從本月五日至二十日期間，上網看到優惠價訂健康餐或海鮮的帖文，聯絡對方後，按指示透過MPAY轉帳，最後對方未依約定日期送餐並失去聯絡，事主懷疑被騙報警。案件仍待進一步查明。,http://www.macaodaily.com/html/2024-11/25/content_1796412.htm,本月二十一日，十名事主陸續到司警局報案稱懷疑墮訂餐詐騙，經司警調查，各事主分別從本月五日至二十日期間，上網看到優惠價訂健康餐或海鮮的帖文，聯絡對方後，按指示透過MPAY轉帳，最後對方未依約定日期送餐並失去聯絡，事主懷疑被騙報警,十人訂 “ 健康 餐 ” 被 呃 七千 五         【 本報 消息 】 近日 再有 十名 居民 疑墮網 上訂 “ 健康 餐 ” 詐騙 ， 合共 損失 七千五百 多元 ， 對方收 錢後無送餐 ， 事主 才 知 被 騙 報警 。 司警 跟 進 調查 案件 。         九女 一 男 事主 均 為 本地人 ， 除 一名 女 青年 外 ， 其餘均 為 中年人 ， 損失 金額 由 四百多 澳門元 至 一千三百 多 澳門元 不 等 ， 合共 損失 七千五百 六十六 澳門元 。 本月 二十一日 ， 十名 事主 陸續 到司 警局 報案 稱 懷疑 墮訂 餐詐 騙 ， 經司警 調查 ， 各 事主 分別 從 本月 五日 至 二十 日期 間 ， 上網 看到 優惠價訂 健康 餐 或 海鮮 的 帖 文 ， 聯絡 對方 後 ， 按 指示 透過 MPAY 轉帳 ， 最後對 方未 依約定 日期 送 餐並 失去 聯絡 ， 事主 懷疑 被 騙 報警 。 案件 仍待進 一步 查明 。,2024-11-25
(新聞小語)粵港澳協力辦賽彰灣區共融   夏耘,粵港澳協力辦賽彰灣區共融    二○二四粵港澳公路自行車賽暨第十五屆全國運動會公路自行車測試賽昨日成功舉行，六十七名運動員歷史性跨越粵港澳三地作賽。賽事亦為明年舉辦的十五運該項賽事進行全流程測試，全面檢驗了比賽路線、快速通關及粵港澳三地間的協同運作及應急處理能力。    粵港澳三地由於法律法規、政策及出入境管理程序等各方面存在差異，在共同舉辦各種跨境體育賽事或活動時，對運動員、教練、團隊人員，以至參與運動會工作的所有人員的出入境安排需要統一協調，以免影響賽事的正常運作及參賽人員的出入境安排。測試賽讓三地相關部門及早了解各自情況，做好規劃和組織，充分協商合作，促進賽事成功舉辦。    第十五屆全國運動會定於明年十一月九日至廿一日舉行，是首次由粵港澳三地聯合舉辦的綜合性體育大賽，屆時澳門境內將承辦全運會四個競賽項目及全國第十二屆殘疾人運動會暨第九屆特殊奧林匹克運動會兩項競賽項目。公路自行車男子個人賽，將首次利用港珠澳大橋作為賽道，亦是十五運中唯一跨越粵港澳三地的比賽項目。    全運會是國家最高水平及最大規模的綜合性運動會，其落戶大灣區，並由粵港澳三地共同籌辦，反映國家對本澳的高度重視，有助推動本澳舉辦大型體育賽事，從中汲取經驗，提升舉辦大型綜合活動的水平與能力，對本澳建設“演藝之都”、“體育之城”，是一次不可多得的機會。更加有助澳門與大灣區其他城市緊密聯繫、務實合作，融入國家發展大局。    “旅遊+體育”是澳門特區政府的重要發展方向之一。粵港澳三地在體育運動與旅遊業優勢互補，合作發展潛力巨大。今次測試賽以至明年舉辦的全運會，可以作為三地未來共同舉辦更多跨區大型體育活動或盛事的試金石，只要三地能保持充分的協商與合作，任何障礙都可迎刃而解。大灣區共榮共融，證明三地有能力打造彰顯制度優勢、展示各自風采的精彩跨區大型運動會。    夏耘,http://www.macaodaily.com/html/2024-11/25/content_1796413.htm,全運會是國家最高水平及最大規模的綜合性運動會，其落戶大灣區，並由粵港澳三地共同籌辦，反映國家對本澳的高度重視，有助推動本澳舉辦大型體育賽事，從中汲取經驗，提升舉辦大型綜合活動的水平與能力，對本澳建設“演藝之都”、“體育之城”，是一次不可多得的機會,粵 港澳 協力 辦賽 彰灣區 共融         二 ○ 二四 粵 港澳 公路 自行 車賽 暨 第十五 屆 全國 運動會 公路 自行 車測 試賽 昨日 成功 舉行 ， 六十七 名運動員 歷史性 跨越 粵 港澳 三地 作賽 。 賽事 亦 為 明年 舉辦 的 十五 運該 項賽 事 進行 全 流程 測試 ， 全面 檢驗 了 比賽 路線 、 快速 通關 及粵 港澳 三地間 的 協同 運作 及 應急 處理 能力 。         粵 港澳 三地 由 於 法律 法規 、 政策 及 出入境 管理程序 等 各 方面 存在 差異 ， 在 共同 舉辦 各種 跨境 體育賽 事 或 活動時 ， 對 運動員 、 教練 、 團隊 人員 ， 以至 參與 運動會 工作 的 所有人 員 的 出入境 安排 需要 統一協調 ， 以免 影響 賽事 的 正常 運作 及 參賽 人員 的 出入境 安排 。 測試賽 讓 三地 相關 部門 及早 了解 各自 情況 ， 做好 規劃 和 組織 ， 充分 協商 合作 ， 促進 賽事 成功 舉辦 。         第十五 屆 全國 運動會定 於 明年 十一月 九日 至 廿一日 舉行 ， 是 首次 由粵 港澳 三地 聯合 舉辦 的 綜合性 體育 大賽 ， 屆 時 澳門境 內 將承辦 全運會 四個 競賽 項目 及 全國 第十二 屆 殘疾人 運動會 暨 第九 屆 特殊 奧林匹克 運動會 兩項 競賽 項目 。 公路 自行 車 男子 個 人賽 ， 將 首次 利用 港珠 澳大橋 作為 賽道 ， 亦 是 十五 運中 唯一 跨越 粵 港澳 三地 的 比賽 項目 。         全運會 是 國家 最高 水平 及 最大 規模 的 綜合性 運動會 ， 其落戶 大灣區 ， 並由粵 港澳 三地 共同 籌辦 ， 反映 國家 對 本澳 的 高度 重視 ， 有 助推 動本 澳舉 辦 大型 體育賽 事 ， 從 中 汲取 經驗 ， 提升 舉辦 大型 綜合 活動 的 水平 與 能力 ， 對本 澳建設 “ 演藝 之 都 ” 、 “ 體育 之城 ” ， 是 一次 不可多得 的 機會 。 更加 有助 澳門 與 大灣區 其他 城市 緊密 聯 繫 、 務實 合作 ， 融入 國家 發展 大局 。         “ 旅遊 + 體育 ” 是 澳門 特區 政府 的 重要 發展 方向 之一 。 粵 港澳 三地 在 體育 運動 與 旅遊業 優勢 互補 ， 合作 發展 潛力 巨大 。 今次 測試賽 以至 明年 舉辦 的 全運會 ， 可以 作為 三地 未來 共同 舉辦 更 多 跨區 大型 體育 活動 或 盛事 的 試 金石 ， 只要 三地 能 保持 充分 的 協商 與 合作 ， 任何 障礙 都 可 迎刃而解 。 大灣區 共榮共融 ， 證明 三地 有 能力 打造 彰顯 制度 優勢 、 展示 各自 風采 的 精彩 跨區 大型 運動會 。         夏耘,2024-11-25
今多雲有雨,今多雲有雨    【本報消息】氣象局預測今日多雲，間中有雨，吹三至四級北至東北風，間中五級及有陣風，氣溫攝氏十七至二十一度，相對濕度百分之七十至九十八。    路邊、一般性、高密度住宅區空氣質量水平普通，沿海地區吹三至五級北至東北風及有陣風，視野平常至良好。    預測明日氣溫略降，大致多雲，初時有幾陣雨，吹四至六級偏北風及有陣風，氣溫攝氏十五至二十度，相對濕度為百分之六十至九十五。    昨日大致多雲，有幾陣雨，吹三至四級北至東北風，氣溫介乎攝氏十七至十九度，相對濕度百分之八十二至九十八，錄得最高紫外線指數為三點五，平均為一點二，強度屬於低。,http://www.macaodaily.com/html/2024-11/25/content_1796414.htm,昨日大致多雲，有幾陣雨，吹三至四級北至東北風，氣溫介乎攝氏十七至十九度，相對濕度百分之八十二至九十八，錄得最高紫外線指數為三點五，平均為一點二，強度屬於低,今多雲有 雨         【 本報 消息 】 氣象局 預測 今日 多 雲 ， 間 中 有 雨 ， 吹三至 四級 北至 東北風 ， 間 中五級 及 有 陣風 ， 氣溫 攝氏 十七 至 二十 一度 ， 相對 濕度 百分之七十 至 九十八 。         路邊 、 一般性 、 高密度 住宅 區空氣 質量 水平 普通 ， 沿海 地區 吹 三至 五級 北至 東北風 及 有 陣風 ， 視野 平常 至 良好 。         預測 明日 氣溫略 降 ， 大致 多 雲 ， 初時 有 幾陣雨 ， 吹 四至 六級 偏北 風及 有 陣風 ， 氣溫 攝氏 十五 至 二十度 ， 相對 濕度 為 百分之六十 至 九 十五 。         昨日 大致 多 雲 ， 有 幾陣雨 ， 吹三至 四級 北至 東北風 ， 氣溫 介乎 攝氏 十七 至 十九 度 ， 相對 濕度 百分之八十 二至 九十八 ， 錄得 最高 紫外 線 指數 為 三點 五 ， 平均 為 一點 二 ， 強度屬 於 低 。,2024-11-25
環保局吉祥物美食節推低碳,環保局吉祥物美食節推低碳    【本報消息】環境保護局舉辦“環境保護局吉祥物與您暢遊美食節”活動，組織了綠色學校慈幼中學約三十位師生及家長於澳門美食節共同實踐減少使用一次性餐具、資源垃圾分類回收、廚餘回收、惜食等低碳行為。    活動上，環境保護局吉祥物白雲哥哥及小花妹妹化身為環保導師，帶領師生及家長們以自備的環保袋、餐具及水樽等，於美食節適量購買食物，身體力行實踐源頭減廢及低碳的環保原則。同時，環保局人員並向師生們介紹廚餘回收以及資源垃圾分類回收的流程及相關知識，在歡愉的氣氛下，於美食節現場上了一堂環保課。    環境保護局於澳門美食節推出多項低碳減廢措施，包括繼續回收美食攤位產生的廚餘、設置多組三色資源垃圾分類回收桶，並於美食節現場設置宣傳攤位藉以推動低碳理念。,http://www.macaodaily.com/html/2024-11/25/content_1796415.htm,環保局吉祥物美食節推低碳    【本報消息】環境保護局舉辦“環境保護局吉祥物與您暢遊美食節”活動，組織了綠色學校慈幼中學約三十位師生及家長於澳門美食節共同實踐減少使用一次性餐具、資源垃圾分類回收、廚餘回收、惜食等低碳行為,環保局 吉祥物 美食 節推低 碳         【 本報 消息 】 環境 保護局 舉辦 “ 環境 保護局 吉祥物 與 您 暢遊 美食 節 ” 活動 ， 組織 了 綠色 學校 慈幼 中學約 三十位 師生 及家長 於 澳門 美食 節 共同 實踐 減少 使用 一次性 餐具 、 資源 垃圾 分類 回收 、 廚餘 回收 、 惜食 等 低 碳行 為 。         活動 上 ， 環境 保護局 吉祥物 白 雲 哥哥 及 小花 妹妹 化身 為 環保導師 ， 帶領 師生 及家長 們 以 自備 的 環保袋 、 餐具 及水 樽 等 ， 於 美食 節適量 購買 食物 ， 身體 力行 實踐 源頭 減廢及 低 碳 的 環保 原則 。 同時 ， 環保局 人員 並向師 生們 介紹 廚餘 回收 以及 資源 垃圾 分類 回收 的 流程 及 相關 知識 ， 在 歡愉 的 氣氛 下 ， 於 美食 節現 場上 了 一堂 環保課 。         環境 保護局 於 澳門 美食 節 推出 多項 低 碳 減廢 措施 ， 包括 繼續 回收 美食 攤位 產生 的 廚餘 、 設置 多 組三色 資源 垃圾 分類 回收 桶 ， 並 於 美食 節現場 設置 宣傳 攤位 藉以 推動 低 碳 理念 。,2024-11-25
