Title,Content,Link,Summary,Preprocessed_Content,Date
賀：不競逐連任,昨發聲明因身體健康未復    爲澳長遠發展着想    賀：不競逐連任    【本報消息】現年六十七歲的澳門行政長官賀一誠昨日發表聲明，宣佈因身體健康尚未全面恢復，因此不參加下一任特首選舉。賀一誠是澳門回歸後的第三位行政長官，也是首位不尋求連任的行政長官。    感謝各界五年支持    新聞局昨日下午五時三十分發佈行政長官賀一誠不參選第六任行政長官的聲明。賀一誠在聲明中對過去五年中央、澳門社會各界及廣大居民給予他的充分信任和堅定支持表示衷心感謝，並感謝全體公務人員的密切協作和配合。他和第五屆澳門特區政府秉持“協同奮進、變革創新”的理念，謀劃推動澳門多元發展，努力構建澳門發展新格局、重塑澳門競爭新優勢。    賀一誠表示，對澳門有着深厚感情，為澳門發展已竭盡全力。但因身體健康尚未全面恢復，為了澳門的長遠發展，從大局出發，決定不參加第六任行政長官選舉。並承諾將全力支持第六任行政長官和特區政府依法施政，為“一國兩制”事業和澳門發展繼續作出貢獻。    六月休假逾月體檢    賀一誠自今年六月二十一日起宣佈休假，原定十三天的假期兩度延長，直至上月廿九日，累計休假超過一個月。新聞局曾於七月二十日回應傳媒查詢時表示，賀一誠利用休假檢查身體，並接受必要診療，身體狀況良好。    賀一誠出生於澳門，完成學業後接手家族企業“賀田工業”，並在內地投資設廠。於二〇〇〇年當選澳區全國人大代表，並自二〇〇一年起連續五屆擔任全國人大常委會委員。賀一誠於二〇〇四年出任澳門特區第二屆行政會委員。二〇〇九年循工商金融界別間選進入立法會，並於同年獲選為副主席。    賀一誠自二〇一四年起當選立法會主席，並於二〇一九年七月辭任主席及議員，參選行政長官。二〇一九年八月廿五日，賀一誠以三百九十二票高票當選為澳門特區第五任行政長官，並於同年十二月二十日宣誓就職。,http://www.macaodaily.com/html/2024-08/22/content_1776294.htm,二〇一九年八月廿五日，賀一誠以三百九十二票高票當選為澳門特區第五任行政長官，並於同年十二月二十日宣誓就職,昨發聲 明因 身體 健康 未 復         爲 澳長 遠 發展 着想         賀 ： 不 競逐 連任         【 本報 消息 】 現年 六十七 歲 的 澳門 行政 長 官賀 一 誠 昨日 發表聲明 ， 宣 佈 因 身體 健康 尚未 全面 恢 復 ， 因此 不 參加 下 一任 特首 選舉 。 賀一誠是 澳門 回歸 後 的 第三位 行政 長 官 ， 也 是 首位 不尋求 連任 的 行政 長 官 。         感謝 各界 五年 支持         新聞局 昨日 下午 五時 三十分 發 佈 行政 長 官賀 一誠不 參選 第六任 行政 長 官 的 聲明 。 賀一誠在 聲明 中 對 過去 五年 中央 、 澳門 社會 各界 及廣大 居民 給予 他 的 充分 信任 和 堅定 支持 表示 衷心 感謝 ， 並感謝 全體 公務人員 的 密切 協作 和 配合 。 他 和 第五 屆 澳門 特區 政府 秉持 “ 協同 奮進 、 變革 創新 ” 的 理念 ， 謀劃 推動 澳門 多元 發展 ， 努力 構建 澳門 發展 新格局 、 重塑 澳門 競爭 新 優勢 。         賀一 誠 表示 ， 對 澳門 有着 深厚感情 ， 為 澳門 發展 已竭 盡 全力 。 但 因 身體 健康 尚未 全面 恢 復 ， 為 了 澳門 的 長 遠 發展 ， 從 大局 出發 ， 決定 不 參加 第六任 行政 長 官選舉 。 並承諾將 全力支持 第六任 行政 長 官 和 特區 政府 依法 施政 ， 為 “ 一國 兩制 ” 事業 和 澳門 發展 繼續 作出 貢獻 。         六月 休假 逾 月 體檢         賀一誠自 今年 六月 二十一日 起宣 佈 休假 ， 原定 十三天 的 假期 兩度 延長 ， 直至 上 月 廿九日 ， 累計 休假 超過 一個 月 。 新聞局 曾 於 七月 二十日 回應 傳媒查 詢時 表示 ， 賀一 誠 利用 休假 檢查 身體 ， 並 接受 必要 診療 ， 身體 狀況 良好 。         賀一 誠 出生 於 澳門 ， 完成 學業 後 接手 家族 企業 “ 賀田 工業 ” ， 並在 內地 投資 設廠 。 於 二 〇 〇 〇 年 當選 澳區 全國 人大代表 ， 並自二 〇 〇 一年 起連續 五屆 擔任 全國 人大 常委 會委員 。 賀一 誠 於 二 〇 〇 四年 出任 澳門 特區 第二 屆 行政 會委員 。 二 〇 〇 九年 循 工商 金融界 別間 選進入 立法 會 ， 並 於 同年 獲選為 副 主席 。         賀一誠自二 〇 一 四年 起當選 立法 會 主席 ， 並於二 〇 一 九年 七月 辭任 主席 及議員 ， 參選 行政 長 官 。 二 〇 一 九年 八月 廿五日 ， 賀一誠以 三百 九 十二 票 高票 當選為 澳門 特區 第五任 行政 長 官 ， 並 於 同年 十二月 二十日 宣誓 就 職 。,2024-08-22
