Title,Content,Link,Summary,Preprocessed_Content,Date
麗影曲藝會今永樂響鑼,麗影曲藝會今永樂響鑼    由澳門麗影曲藝會主辦，嘉明曲藝會、春風舞蹈團協辦，澳門文化發展基金、霍英東基金會贊助的“麗影會知音”，今日下午二時假永樂戲院一院演出。    演出內容有：    一、折子戲《跪地》（盧少貞、龐雪霏）；二、《狄青闖三關》（王善松、張婉薇）；三、《錦江詩侶》（黃冠翹、吳鳳彩）；四、《幽媾》（盧少貞、黃慧蘭）；五、《沈園遺恨》（梁月珍、陳金怡）；六、《潞安洲》（張南、鄺燕紅）；七、折子戲《打金枝》（周錦世、陳鳳琼）；八、《雷鳴金鼓戰笳聲》（陳惠蘭、杜煥轉）。,http://www.macaodaily.com/html/2024-07/31/content_1771606.htm,麗影曲藝會今永樂響鑼    由澳門麗影曲藝會主辦，嘉明曲藝會、春風舞蹈團協辦，澳門文化發展基金、霍英東基金會贊助的“麗影會知音”，今日下午二時假永樂戲院一院演出,麗影曲 藝會 今永樂 響鑼         由 澳門麗 影曲 藝會 主辦 ， 嘉明曲 藝會 、 春風 舞蹈 團協辦 ， 澳門 文化 發展 基金 、 霍英東 基金 會 贊助 的 “ 麗影會 知音 ” ， 今日 下午 二時 假永樂 戲院 一院 演出 。         演出 內容 有 ：         一 、 折子 戲 《 跪地 》 （ 盧少貞 、 龐雪霏 ） ； 二 、 《 狄青 闖三關 》 （ 王善松 、 張婉薇 ） ； 三 、 《 錦江 詩侶 》 （ 黃 冠 翹 、 吳鳳彩 ） ； 四 、 《 幽媾 》 （ 盧少貞 、 黃 慧蘭 ） ； 五 、 《 沈園 遺恨 》 （ 梁月珍 、 陳 金怡 ） ； 六 、 《 潞安 洲 》 （ 張南 、 鄺燕紅 ） ； 七 、 折子 戲 《 打 金枝 》 （ 周錦世 、 陳 鳳琼 ） ； 八 、 《 雷鳴 金鼓 戰笳聲 》 （ 陳 惠蘭 、 杜煥轉 ） 。,2024-07-31
《澳門人》介紹阮樂怡作品展,《澳門人》介紹阮樂怡作品展    藝術是人類文明的重要組成部分，它能夠激發人類的情感和創造力，並為人類帶來美的享受。澳視澳門（91台）今晚九時播映的《澳門人 · 澳門事》，將為大家介紹《實驗的思考》阮樂怡作品展。    今次展覽作品分為社會性與思考性兩大類，不同的媒材能帶來不同的效果，也能給觀眾不同的觀感。參展人阮樂怡使用了壓克力、油畫、針管筆、素描幾種不同的媒材進行繪畫的實驗，並享受過程。她期望她的作品既能帶來趣味性和學習價值，也能引起他人的共鳴和思考。,http://www.macaodaily.com/html/2024-07/31/content_1771620.htm,《澳門人》介紹阮樂怡作品展    藝術是人類文明的重要組成部分，它能夠激發人類的情感和創造力，並為人類帶來美的享受,《 澳門 人 》 介紹 阮樂怡 作品展         藝術 是 人類 文明 的 重要 組成 部分 ， 它 能夠 激發 人類 的 情感 和 創造力 ， 並為 人類 帶來 美的 享受 。 澳視 澳門 （ 91 台 ） 今晚 九時 播映 的 《 澳門 人   ·   澳門事 》 ， 將為 大家 介紹 《 實驗 的 思考 》 阮樂怡 作品展 。         今次 展覽 作品 分為 社會性 與 思考性 兩大類 ， 不同 的 媒 材能 帶來 不同 的 效果 ， 也 能給 觀眾 不同 的 觀感 。 參展 人 阮樂怡 使用 了 壓克力 、 油畫 、 針管筆 、 素描 幾種 不同 的 媒材 進行 繪畫 的 實驗 ， 並 享受 過程 。 她 期望 她 的 作品 既能 帶來 趣味性 和 學習 價值 ， 也 能 引起 他人 的 共鳴 和 思考 。,2024-07-31
勝意曲藝社圓滿演出,勝意曲藝社圓滿演出    由澳門勝意曲藝社主辦的“勝意金曲歡樂唱”，已於昨晚六時四十五分假栢蕙活動中心演藝廳演出。    演出者有：伍亞哥、強哥、鄧小雯、吳炳榕、詹成就、華、盧穎兒、謝珍沂、王貞鳳、蘭子、盧桂英、梁惠蓮、Anita小玉、George佐治、Wai in、尹國健。    曲目內容有：《吟盡楚江秋》、《順流逆流》、《東方之珠》、《人生何處不相逢》、《十七歲》、《月半小夜曲》、《好久不見》、《逝去的諾言》等。,http://www.macaodaily.com/html/2024-07/31/content_1771622.htm,勝意曲藝社圓滿演出    由澳門勝意曲藝社主辦的“勝意金曲歡樂唱”，已於昨晚六時四十五分假栢蕙活動中心演藝廳演出,勝意 曲藝 社圓滿 演出         由 澳門 勝意 曲藝 社主辦 的 “ 勝意 金曲 歡樂唱 ” ， 已 於 昨晚 六時 四十五分 假 栢 蕙 活 動 中心 演藝廳 演出 。         演出者 有 ： 伍亞哥 、 強哥 、 鄧小雯 、 吳炳榕 、 詹 成就 、 華 、 盧穎兒 、 謝珍 沂 、 王貞鳳 、 蘭子 、 盧桂英 、 梁惠蓮 、 Anita 小玉 、 George 佐治 、 Wai   in 、 尹國健 。         曲目 內容 有 ： 《 吟 盡 楚江 秋 》 、 《 順流 逆流 》 、 《 東方 之珠 》 、 《 人生 何處 不 相逢 》 、 《 十七 歲 》 、 《 月 半 小夜曲 》 、 《 好久 不見 》 、 《 逝去 的 諾言 》 等 。,2024-07-31
澳門資訊直播立法會會議,澳門資訊直播立法會會議    澳門立法會今日舉行全體會議，澳門資訊（94台）、澳廣視網站及澳廣視App，由下午三時至晚上八時，為觀眾全程現場直播，並以多聲道中葡雙語進行廣播。    今天會議議程包括細則性討論及表決《保險中介業務法》法案；討論及表決關於林宇滔議員分別於二〇二四年六月六日及六月十二日，提交的要求專為辯論公共利益問題召開全體會議的全體會議簡單議決案。觀眾可於直播後，在澳廣視網頁上重溫全體會議全過程及每位議員的發言。,http://www.macaodaily.com/html/2024-07/31/content_1771623.htm,澳門資訊直播立法會會議    澳門立法會今日舉行全體會議，澳門資訊（94台）、澳廣視網站及澳廣視App，由下午三時至晚上八時，為觀眾全程現場直播，並以多聲道中葡雙語進行廣播,澳門 資訊 直播 立法 會會議         澳門 立法 會 今日 舉行 全體 會議 ， 澳門 資訊 （ 94 台 ） 、 澳廣視 網站 及 澳廣視 App ， 由 下午 三時 至 晚上 八時 ， 為 觀眾 全程 現場 直播 ， 並以 多聲 道 中葡 雙語 進行 廣播 。         今天 會議 議程 包括 細則性 討論 及表決 《 保險 中介 業務法 》 法案 ； 討論 及表 決關 於 林宇 滔議員 分別 於 二 〇 二 四年 六月 六日 及 六月 十二日 ， 提交 的 要求 專為 辯論 公共利益 問題 召開 全體 會議 的 全體 會議 簡單議 決案 。 觀眾 可 於 直播 後 ， 在 澳廣視 網頁 上 重溫 全體 會議 全過 程及 每位 議員 的 發言 。,2024-07-31
李準基九月辦粉絲見面會,帶首爾場樂隊來台演出    李準基九月辦粉絲見面會    韓國“凍齡男神”李準基，為回饋劇迷的喜愛，經常透過見面會與粉絲共度美好時光。相隔五年，李準基亞洲巡迴見面會“2024 LEE JOON GI ASIA TOUR JOONGI'S DAY：FESTIVAL”台北站將於九月廿八日舉辦，昨日主辦單位“遠雄創藝”宣佈資訊，門票將於八月十一日開售。    李準基出道二十三年以來，靠演技說話，過去主演的《步步驚心：麗》、《惡之花》等都交出一張亮眼成績單。他對自己要求完美，為了戲劇角色需求維持凍齡外貌與精壯身材，他過去出演談話性節目《劉QUIZ ON THE BLOCK》透露，已經多年不吃碳水化合物，“這是拍動作戲所悟出的秘訣，親自上陣拍動作戲時，常會受傷或是發炎，因為麵粉或碳水化合物容易誘發身體發炎症狀，後來就試着戒掉碳水化合物。”長達七、八年習慣以豆腐為主食，完全不碰澱粉，當時引發不少話題，觀眾讚嘆“太敬業了”。    他的敬業度不只反映在戲劇上，就連對粉絲都是寵粉一百分，時常會安排與劇迷見面的機會。二○一九年到台舉辦粉絲見面會，化身電音DJ帶着全場跳起來，台北國際會議中心宛如變成大型夜店，台下觀眾盡情享受，逾三小時誠意滿分的演出，牢牢收服所有人的心。九月廿八日再次到該場地與粉絲相會，本次巡迴見面會五月搶先在首爾揭開序幕，他精心把Live Band搬到舞台上，表演歌單華麗，無論是抒情歌、勁歌舞曲全都包辦，更在安可時翻唱其他人氣歌手的歌曲，帶來誠意滿滿的舞台。台北站為帶給粉絲最完美的演出，將原汁原味還原樂團演出形式，尤其是歌單會如何安排，令粉絲相當期待。,http://www.macaodaily.com/html/2024-07/31/content_1771602.htm,他對自己要求完美，為了戲劇角色需求維持凍齡外貌與精壯身材，他過去出演談話性節目《劉QUIZ ON THE BLOCK》透露，已經多年不吃碳水化合物，“這是拍動作戲所悟出的秘訣，親自上陣拍動作戲時，常會受傷或是發炎，因為麵粉或碳水化合物容易誘發身體發炎症狀，後來就試着戒掉碳水化合物,帶首爾場 樂隊 來 台 演出         李準 基 九月 辦粉 絲見 面會         韓國 “ 凍齡 男神 ” 李準 基 ， 為 回饋 劇迷 的 喜 愛 ， 經常 透過 見 面會 與 粉絲 共度 美好 時光 。 相隔 五年 ， 李準 基亞洲 巡 迴 見 面會 “ 2024   LEE   JOON   GI   ASIA   TOUR   JOONGI ' S   DAY ： FESTIVAL ” 台北 站將 於 九月 廿八日 舉辦 ， 昨日 主辦 單位 “ 遠雄 創藝 ” 宣 佈 資訊 ， 門票將 於 八月 十一日 開售 。         李準 基出 道 二十三年 以來 ， 靠 演技 說話 ， 過去 主演 的 《 步步 驚心 ： 麗 》 、 《 惡之花 》 等 都 交出 一張 亮眼 成績 單 。 他 對 自己 要求 完美 ， 為 了 戲劇 角色 需求 維持 凍齡 外貌 與 精壯 身材 ， 他過 去 出演 談話性 節目 《 劉 QUIZ   ON   THE   BLOCK 》 透露 ， 已經 多年 不吃 碳水化合物 ， “ 這是 拍動 作戲 所 悟出 的 秘訣 ， 親自上 陣 拍動作 戲時 ， 常會 受傷 或是 發炎 ， 因為 麵 粉 或 碳水化合物 容易 誘發身 體發 炎症 狀 ， 後 來 就 試着 戒掉 碳水化合物 。 ” 長 達 七 、 八年 習慣 以 豆腐 為 主食 ， 完全 不 碰 澱 粉 ， 當時 引發 不少 話題 ， 觀 眾 讚 嘆 “ 太敬業 了 ” 。         他 的 敬業度 不 只 反映 在 戲劇 上 ， 就 連對 粉絲 都 是 寵粉 一百分 ， 時常會 安排 與 劇迷 見面 的 機會 。 二 ○ 一 九年 到 台舉 辦粉 絲見 面會 ， 化身 電音 DJ 帶 着 全場 跳 起來 ， 台北 國際會議 中心 宛如 變成 大型 夜店 ， 台下 觀眾 盡情 享受 ， 逾三小時 誠意 滿分 的 演出 ， 牢牢 收服 所有人 的 心 。 九月 廿八日 再次 到 該場 地 與 粉絲 相會 ， 本次 巡 迴 見 面會 五月 搶先 在 首爾 揭開 序幕 ， 他 精心 把 Live   Band 搬到 舞台 上 ， 表演 歌 單華麗 ， 無論 是 抒情歌 、 勁 歌舞 曲 全都 包辦 ， 更 在 安可時 翻唱 其他人 氣 歌手 的 歌曲 ， 帶來 誠意 滿滿 的 舞台 。 台北 站 為 帶給 粉絲 最 完美 的 演出 ， 將 原汁原味 還原樂團 演出 形式 ， 尤其 是 歌 單會 如何 安排 ， 令粉 絲 相當 期待 。,2024-07-31
占美拒任奧斯卡主持,占美拒任奧斯卡主持    曾幾何時，影視界的頒獎典禮是影迷們最關注的盛事，但近年活動愈來愈多，觀眾眼花繚亂，那些典禮已變成雞肋般的存在。直播節目《Jimmy Kimmel Live》的美國棟篤笑主持人占美(Jimmy Kimmel)都拒絕擔任明年奧斯卡頒獎禮主持人，諧星兼名嘴約翰(John Mulaney)也無意執二攤，搞到大會頭都痕，完全未有備用人選，為此事正十分頭痛。    占美至今已四度擔任過奧斯卡的主持人，包括之前兩屆，好明顯大會是想找他來救場。但占美都好有自知之明，為免做爛市及搞到觀眾視覺疲勞，見好就收是他的最好選擇。對比起奧斯卡的風光日子，九八年因《鐵達尼號》曾吸引超過五千萬名觀眾，去年觀眾僅一千八百萬名，正是花無百日紅，好時光可一不可再。,http://www.macaodaily.com/html/2024-07/31/content_1771605.htm,直播節目《Jimmy Kimmel Live》的美國棟篤笑主持人占美(Jimmy Kimmel)都拒絕擔任明年奧斯卡頒獎禮主持人，諧星兼名嘴約翰(John Mulaney)也無意執二攤，搞到大會頭都痕，完全未有備用人選，為此事正十分頭痛,占美 拒任 奧斯卡 主持         曾 幾何 時 ， 影視界 的 頒獎 典禮 是 影迷 們 最 關注 的 盛事 ， 但 近年 活動 愈來 愈 多 ， 觀眾 眼花 繚亂 ， 那些 典禮 已 變成 雞 肋 般的 存在 。 直播 節目 《 Jimmy   Kimmel   Live 》 的 美國棟 篤 笑 主持人 占美 ( Jimmy   Kimmel ) 都 拒絕 擔任 明年 奧斯卡 頒 獎禮 主持人 ， 諧星 兼 名嘴 約翰 ( John   Mulaney ) 也 無意 執二攤 ， 搞 到 大會頭 都 痕 ， 完全 未有 備 用人 選 ， 為 此事 正 十分 頭痛 。         占美 至今 已 四度 擔任過 奧斯卡 的 主持人 ， 包括 之前 兩屆 ， 好明 顯大會 是 想 找 他 來 救場 。 但 占 美 都 好 有 自知之明 ， 為免 做爛市 及 搞 到 觀眾 視覺 疲勞 ， 見 好 就 收 是 他 的 最好 選擇 。 對 比起 奧斯卡 的 風光 日子 ， 九八年 因 《 鐵達尼號 》 曾 吸引 超過 五千 萬名 觀眾 ， 去年 觀眾僅 一千八百 萬名 ， 正是 花 無 百日 紅 ， 好 時光 可 一 不可 再 。,2024-07-31
卡迪B炫富惹人眼紅,卡迪B炫富惹人眼紅    很多人眼紅他人富貴，三十一歲的歌壇饒舌天后卡迪B(Cardi B)和黑人男歌手老公Offset就是喜愛炫富的表表者。近日有傳她財困，更指她想把位於亞特蘭大的價值五百萬美元的豪宅出售，似乎暗示她的有錢是吹出來的。頓時讓向來串嘴的卡迪B面子盡失，她憤怒地作出反擊，她在X留言道：“那是Offset在一九年買下的物業，現在已值七百萬美元，我老公冇計劃賣掉該大屋。”    其實今年三月，卡迪B曾向媒體Complex公開了自己的財務狀況，並談到了傳聞中八千萬美元的淨資產，這引起了人們的熱烈討論，卡迪B說：“我覺得我實際上已經賺了差不多八千萬美元了，我真的賺了很多錢，很多、很多、很多的錢。”    卡迪B和老公的曬命，讓他們有機會陷入危險。根據警方報告，去年八月有一名來電者聲稱卡迪B的住所遭到槍擊，爆料者甚至暗示卡迪B本人可能被子彈射中，促使警察拉響警報並準備好武器接近現場。警方很快確定這只不過是一場騙局，暫未知是純粹惡作劇，還是真的有人想對卡迪B不利。,http://www.macaodaily.com/html/2024-07/31/content_1771607.htm,頓時讓向來串嘴的卡迪B面子盡失，她憤怒地作出反擊，她在X留言道：“那是Offset在一九年買下的物業，現在已值七百萬美元，我老公冇計劃賣掉該大屋,卡迪 B 炫富 惹人眼 紅         很多 人眼 紅 他人 富貴 ， 三十一 歲 的 歌壇 饒 舌 天后 卡迪 B ( Cardi   B ) 和 黑人 男歌手 老公 Offset 就是 喜愛炫富 的 表表 者 。 近日 有傳 她 財困 ， 更 指 她 想 把 位 於 亞特蘭大 的 價值 五百 萬 美元 的 豪宅 出售 ， 似乎 暗示 她 的 有 錢 是 吹 出來 的 。 頓時 讓 向 來 串 嘴 的 卡迪 B 面子 盡失 ， 她 憤怒 地 作出 反擊 ， 她 在 X 留言 道 ： “ 那 是 Offset 在 一 九年 買下 的 物業 ， 現在 已值 七百 萬 美元 ， 我 老公 冇 計劃 賣 掉 該 大屋 。 ”         其實 今年 三月 ， 卡迪 B 曾 向 媒體 Complex 公開 了 自己 的 財務 狀況 ， 並談 到 了 傳聞 中 八千 萬 美元 的 淨 資產 ， 這 引起 了 人們 的 熱烈 討論 ， 卡迪 B 說 ： “ 我覺 得 我 實際上 已經 賺 了 差不多 八千 萬 美元 了 ， 我 真的 賺 了 很多 錢 ， 很多 、 很多 、 很多 的 錢 。 ”         卡迪 B 和 老公 的 曬命 ， 讓 他們 有 機會 陷入 危險 。 根據 警方 報告 ， 去年 八月 有 一名 來 電者 聲稱 卡迪 B 的 住所 遭到 槍擊 ， 爆料 者 甚至 暗示 卡迪 B 本人 可能 被子 彈 射中 ， 促使 警察 拉響 警報 並準備 好 武器 接近 現場 。 警方 很快 確定 這只 不過 是 一場 騙局 ， 暫 未知 是 純粹 惡作劇 ， 還是 真的 有人 想 對 卡迪 B 不利 。,2024-07-31
珍妹被潑焦油為藝術犧牲,珍妹被潑焦油為藝術犧牲    不經不覺，AppleTV劇集《The Morning Show》已經來到了第四季。該劇繼續由五十五歲的“珍妹”珍妮花安妮絲頓(Jennifer Aniston)及奧斯卡影后莉絲韋特斯潘(Reese Witherspoon)領銜主演，睇到戲迷欲罷不能。    最近，珍妹在紐約市為最新一季開工，她因劇情需要，被潑到渾身沾滿了油，她的白色襯衫和卡其色褲子上，覆蓋着黑色焦油，並從她的手臂上滴下來，半身都是黑漆漆的，為了收視率，珍妹樂意為藝術犧牲。    《The Morning Show》作為珍妹加入AppleTV的重頭戲，備受矚目，第四季的製作仍在進行，可惜首播日期尚未公佈，讓劇迷心急如焚。,http://www.macaodaily.com/html/2024-07/31/content_1771611.htm,最近，珍妹在紐約市為最新一季開工，她因劇情需要，被潑到渾身沾滿了油，她的白色襯衫和卡其色褲子上，覆蓋着黑色焦油，並從她的手臂上滴下來，半身都是黑漆漆的，為了收視率，珍妹樂意為藝術犧牲,珍妹 被 潑 焦油 為 藝術 犧牲         不經 不覺 ， AppleTV 劇集 《 The   Morning   Show 》 已經來 到 了 第四季 。 該劇 繼續 由 五十五 歲 的 “ 珍妹 ” 珍妮花 安妮 絲頓 ( Jennifer   Aniston ) 及 奧斯卡 影后 莉絲韋 特斯 潘 ( Reese   Witherspoon ) 領銜 主演 ， 睇 到 戲迷欲罷 不能 。         最近 ， 珍妹 在 紐約市 為 最新 一季 開工 ， 她 因劇情 需要 ， 被 潑 到 渾身 沾 滿 了 油 ， 她 的 白色 襯衫 和 卡其色 褲子 上 ， 覆蓋 着 黑色 焦油 ， 並從 她 的 手臂 上 滴下 來 ， 半身 都 是 黑漆漆 的 ， 為 了 收視率 ， 珍妹 樂意 為 藝術 犧牲 。         《 The   Morning   Show 》 作為 珍妹 加入 AppleTV 的 重頭戲 ， 備受 矚目 ， 第四季 的 製 作 仍 在 進 行 ， 可惜 首播 日期 尚未 公 佈 ， 讓 劇迷 心急如焚 。,2024-07-31
菊池瑠瑠夫妻相差廿六歲,菊池瑠瑠夫妻相差廿六歲    日本三人偶像女團“Love La Doll”成員菊池瑠瑠（菊池瑠々），二十歲時與大自己廿六歲的IT企業社長結婚。婚後九年共生下四個孩子，她近日在社交平台曬出夫妻合照，為老公慶祝生日，亮麗外形完全不像是四個孩子的媽媽。菊池瑠瑠透露夫妻倆許久沒有晚餐約會，這次因為是老公五十五歲生日，難得到餐廳享用美味的晚餐與一同喝酒。她更透露雖然是老公生日，去的還是她想去的餐廳。    菊池瑠瑠的爸媽都是中國人，她在日本出生，中文、日文都說得非常流暢。婚後育有兩子兩女，並持續活躍網紅圈，由於夫妻年齡相差甚大，坦言常被批評目的是為了錢，對於不能理解的人們也只能說無奈。對於這些批評她其實並不在意，但是如果是針對她的孩子、老公，就會很生氣。,http://www.macaodaily.com/html/2024-07/31/content_1771612.htm,菊池瑠瑠透露夫妻倆許久沒有晚餐約會，這次因為是老公五十五歲生日，難得到餐廳享用美味的晚餐與一同喝酒,菊池 瑠 瑠 夫妻 相差 廿六 歲         日本 三人 偶像 女團 “ Love   La   Doll ” 成員 菊池 瑠 瑠 （ 菊池 瑠 々 ） ， 二十 歲 時 與 大 自己 廿六 歲 的 IT 企業 社長 結婚 。 婚 後 九年 共生 下四個 孩子 ， 她 近日 在 社交 平台 曬出 夫妻 合照 ， 為 老公 慶祝 生日 ， 亮麗 外形 完全 不 像是 四個 孩子 的 媽媽 。 菊池 瑠 瑠 透露 夫妻 倆 許久 沒有 晚餐 約會 ， 這次 因為 是 老公 五十五 歲 生日 ， 難 得到 餐廳 享用 美味 的 晚餐 與 一同 喝酒 。 她 更 透露 雖然 是 老公 生日 ， 去 的 還是 她 想 去 的 餐廳 。         菊池 瑠瑠的 爸媽 都 是 中國人 ， 她 在 日本 出生 ， 中文 、 日文 都 說 得 非常 流暢 。 婚後育 有 兩子 兩女 ， 並持續 活躍網 紅圈 ， 由 於 夫妻 年齡 相差 甚大 ， 坦言 常 被 批評 目的 是 為 了 錢 ， 對 於 不能 理解 的 人們 也 只能 說 無奈 。 對 於 這些 批評 她 其 實並 不在意 ， 但是 如果 是 針對 她 的 孩子 、 老公 ， 就 會 很 生氣 。,2024-07-31
特拉維斯百克賣登機證行善,特拉維斯百克賣登機證行善    Blink-182鼓手特拉維斯百克(Travis Barker)最後以八千美元，售出了他於澳洲旅行的登機證，娶了一個有錢老婆的他絕不缺錢，他的用意是在做慈善。消息指，他把去年世界巡迴演唱會的其他紀念品，以及他最新專輯的錄音均寄放到Trophy網站出售，其中一部分收益將捐給非營利組織Lost But Not Forgotten，行善最樂。    對特拉維斯粉絲來說，那張登機證意義非凡，是代表着特拉維斯必須克服了一個人生的障礙。特拉維斯在證上以全部大寫字母寫道：“我知道有天使在守護着我。”該證顯示了日期是二月七日和座位七號，是人們眼中的幸福數字。在差點喪命的飛機失事後，特拉維斯已經十三年沒有坐過飛機了，這張登機證極為罕見，不僅是一件音樂紀念品，更是Travis Barker本人的真實作品。,http://www.macaodaily.com/html/2024-07/31/content_1771613.htm,特拉維斯百克賣登機證行善    Blink-182鼓手特拉維斯百克(Travis Barker)最後以八千美元，售出了他於澳洲旅行的登機證，娶了一個有錢老婆的他絕不缺錢，他的用意是在做慈善,特拉 維斯 百克 賣 登機證 行善         Blink - 182 鼓手 特拉 維斯 百克 ( Travis   Barker ) 最後以 八千 美元 ， 售出 了 他 於 澳洲 旅行 的 登機證 ， 娶 了 一個 有 錢 老婆 的 他 絕不缺 錢 ， 他 的 用意 是 在 做 慈善 。 消息 指 ， 他 把 去年 世界 巡 迴 演唱 會 的 其他 紀念品 ， 以及 他 最新 專輯 的 錄音 均 寄放 到 Trophy 網站 出售 ， 其中 一部分 收益 將捐給 非營利 組織 Lost   But   Not   Forgotten ， 行善 最樂 。         對 特拉 維斯粉 絲來 說 ， 那張 登機證 意義 非凡 ， 是 代表 着 特拉 維斯 必須 克服 了 一個 人生 的 障礙 。 特拉 維斯 在 證上 以 全部 大寫 字母 寫道 ： “ 我 知道 有 天使 在 守護 着 我 。 ” 該證 顯示 了 日期 是 二月 七日 和 座位 七號 ， 是 人們 眼中 的 幸福 數字 。 在 差點 喪命 的 飛機 失事 後 ， 特拉 維斯 已經 十三年 沒有 坐過 飛機 了 ， 這張 登機 證極 為 罕見 ， 不僅 是 一件 音樂紀念品 ， 更是 Travis   Barker 本人 的 真實 作品 。,2024-07-31
視事關心,視事關心    瓊安娜的宏觀城市之旅：1    有線(51)BBC EARTH晚上九點播映。瓊安娜啟程前往巴黎。她先是搭乘熱汽球出遊、造訪慘遭火吻的巴黎聖母院，接着又會見社交名媛達芙妮吉尼斯、入手整套香奈兒古着。    山地硬漢    有線(54)歷史頻道晚上十點五十分播映。湯姆收到自己心臟狀況的診斷；傑克在夜間捕獵郊狼；歐泰斯重建前往龜島的道路；麥克飛往遙遠的岸邊並爬上高山，捕獵山羊。    全球探險衝衝衝：2    有線(61)BBC Cbeebies下午五點三十分播映。凱恩與福斯能夠使用新的指南針能力進行導航，讓他們逃出探險學院的迷宮嗎？,http://www.macaodaily.com/html/2024-07/31/content_1771614.htm,視事關心    瓊安娜的宏觀城市之旅：1    有線(51)BBC EARTH晚上九點播映,視事 關心         瓊 安娜 的 宏觀 城市 之旅 ： 1         有線 ( 51 ) BBC   EARTH 晚上 九點 播映 。 瓊 安娜 啟程 前往 巴黎 。 她 先是 搭乘 熱 汽球 出遊 、 造訪 慘遭 火吻 的 巴黎 聖母院 ， 接着 又 會 見 社交 名媛 達芙妮 吉尼斯 、 入手 整套 香奈兒 古着 。         山地 硬漢         有線 ( 54 ) 歷史 頻道 晚上十 點五 十分 播映 。 湯姆 收到 自己 心臟 狀況 的 診斷 ； 傑克 在 夜間 捕 獵郊 狼 ； 歐 泰斯 重建 前往 龜島 的 道路 ； 麥克 飛往 遙遠 的 岸邊 並爬 上 高山 ， 捕獵 山羊 。         全球 探險 衝衝衝 ： 2         有線 ( 61 ) BBC   Cbeebies 下午 五點 三十分 播映 。 凱恩 與 福斯 能夠 使用 新 的 指南 針 能力 進行 導航 ， 讓 他們 逃出 探險 學院 的 迷宮 嗎 ？,2024-07-31
