Title,Content,Link,Summary,Preprocessed_Content,Date
住宅火警十二人不適六送院,疑充電設備故障引致    四十六住客疏散暫避    住宅火警十二人不適六送院    【本報消息】黑沙環海邊馬路某十七層高大廈第十四座六樓一單位昨日傍晚發生火警，四十六名住客自行疏散到地面及天台。消防員接報趕至將火撲熄。火警中，有十二人報稱不適，其中六人須送院，包括長者及幼童。火警原因疑一房間的充電設備故障引致。    十六住客避上天台    消防局昨日傍晚六時許接報上址六樓某單位發生火警，立即派員趕至處理。消防員到場後，發現單位有明火，立即開喉外圍灌救，並派煙帽隊進入大廈，內外夾攻，終將火救熄。火警時，有三十名住客自行疏散至地面，另有十六名住客自行疏散到天台暫避。    起火單位多次閃燃    從網上片段可見，起火單位火舌飛捲，並曾發生多次閃燃，濃煙滾滾。附近街坊亦見黑煙直捲上空。    消防表示，現場有十二名男女（七男五女）報稱吸入濃煙不適。其中六名男女，包括三男三女須送往山頂醫院治理，年齡由十歲至八十二歲。除一人持有菲律賓護照外，其餘都是本澳居民。    牆身燻黑一房全燬    消防員經檢查，火警單位牆身被燻黑，其中一個房間完全焚燬。初步相信起火原因是該房間內的充電設備故障引致。    火警期間，治安警到場維持秩序，並拉起封條禁止途人接近，以免發生危險。,http://www.macaodaily.com/html/2024-06/27/content_1764545.htm,疑充電設備故障引致    四十六住客疏散暫避    住宅火警十二人不適六送院    【本報消息】黑沙環海邊馬路某十七層高大廈第十四座六樓一單位昨日傍晚發生火警，四十六名住客自行疏散到地面及天台,疑充 電設備 故障 引致         四十六 住客 疏散 暫避         住宅 火警 十二 人 不 適六送院         【 本報 消息 】 黑沙 環海邊 馬 路 某 十七 層 高大 廈 第十四 座六樓 一 單位 昨日 傍晚 發生 火警 ， 四 十六名 住客 自行 疏散 到 地面 及 天台 。 消防 員 接報 趕至 將火 撲 熄 。 火警 中 ， 有 十二 人報 稱 不適 ， 其中 六人須 送院 ， 包括 長 者 及 幼童 。 火警 原因 疑一 房間 的 充電 設備 故障 引致 。         十六 住客 避上 天台         消防局 昨日 傍晚 六時 許接 報上址 六樓 某 單位 發生 火警 ， 立即 派員 趕至 處理 。 消防 員到場 後 ， 發現 單位 有 明火 ， 立即 開喉 外圍 灌救 ， 並派 煙帽隊 進入 大廈 ， 內外 夾攻 ， 終將 火救 熄 。 火警 時 ， 有 三十名 住客 自行 疏散 至 地面 ， 另有 十六名 住客 自行 疏散 到 天台 暫避 。         起火 單位 多次 閃燃         從 網上 片段 可見 ， 起火 單位 火舌 飛 捲 ， 並曾 發生 多次 閃燃 ， 濃煙 滾 滾 。 附近 街坊 亦 見 黑煙直 捲 上空 。         消防 表示 ， 現場 有 十二名 男女 （ 七 男五女 ） 報稱 吸入 濃煙 不適 。 其中 六名 男女 ， 包括 三 男 三 女須 送往 山頂 醫院 治理 ， 年齡 由十歲 至 八十二 歲 。 除一人 持有 菲律 賓護 照外 ， 其餘 都 是 本澳 居民 。         牆身 燻 黑 一房 全 燬         消防 員經 檢查 ， 火警 單位 牆身 被 燻 黑 ， 其中 一個 房間 完全 焚 燬 。 初步 相信 起火 原因 是 該 房間 內 的 充電 設備 故障 引致 。         火警 期間 ， 治安警 到場 維持 秩序 ， 並拉起 封條 禁止 途人 接近 ， 以免 發生 危險 。,2024-06-27
"兩巴去年賺逾5,200萬","乘車逾二億人次    經濟復常轉虧爲盈    兩巴去年賺逾5,200萬    【本報消息】通關復常，旅客重臨，本澳經濟穩步復甦，旅遊業表現亮眼，巴士公司載客量隨之上升。兩巴昨日刊登二三年業績報告顯示均扭虧為盈，稅後利潤合共五千二百多萬元（澳門元，下同）。其中，新福利稅後利潤為三千八百八十六萬餘元，澳巴為一千三百九十六萬餘元。    去年乘客達疫前九成    新福利和澳巴一九年度營業帳目均錄得盈利，合共一點一七億元。二○年度合共盈利八千六百多萬元。惟疫情期間的二一、二二年均錄得虧損。二一年共虧損七百多萬元，二二年兩巴分別虧損二千多萬元。    去年經濟活動復常，資料顯示，二三年全年總乘車人次二點一四億人次，按年上升百之分二十七點三，對比一九年的二點二九億人次，已恢復至九成三水平，兩巴業務亦大幅改善。    首二月客多疫前半成    新福利業績報告指出，去年稅後利潤為三千八百八十六萬元，已恢復至一九年的八成六。去年載客量超過一億人次，同比增幅百分之二十九點六，日均二十七點九萬人次。營運里程較去年增加百分之十，通過加強加密服務，更好地疏導乘客。去年第四季客量基本已回復疫情前。另外，今年至二月客況更超一九年同期數量，超出近百分之五。    兩巴均更新環保車隊    新福利稱，今年初已購置三十五台增程電動小巴及兩台十八米特大巴士，全部投入營運，以配合客況需求及加強環保服務。按“道路集體客運公共服務合同”，今年完成更新車隊，全面使用環保新能源巴士的合同要求。    澳巴報告提到，去年累計總載客量一點一二億人次，同比增加百分之二十四點九，恢復至一九年總載客量的九成一。二一年至二三年間，澳巴分三批引進四百六十九台增程式新能源電動巴士，已按既定計劃順利完成營運車隊更新工作，標誌着澳巴在助力澳門綠色出行的行動上取得實質進展。    首季乘客同比增一成    交通事務局資料顯示，今年首季兩巴共營運八十六條線路。一至三月總乘車人次五千六百多萬，日均六十一萬人次，較去年同期增長逾一成。",http://www.macaodaily.com/html/2024-06/27/content_1764546.htm,首二月客多疫前半成    新福利業績報告指出，去年稅後利潤為三千八百八十六萬元，已恢復至一九年的八成六,"乘車 逾 二 億 人次         經濟 復 常 轉虧 爲 盈         兩巴 去年 賺 逾 5 , 200 萬         【 本報 消息 】 通關 復 常 ， 旅客 重臨 ， 本澳 經濟 穩步 復 甦 ， 旅遊業 表現 亮眼 ， 巴士 公司 載 客量 隨之 上升 。 兩巴 昨日 刊登 二三年 業績 報告 顯示 均 扭虧 為盈 ， 稅後利潤 合共 五千 二百多 萬元 （ 澳門元 ， 下同 ） 。 其中 ， 新 福利 稅後利潤 為 三千八百 八十六 萬餘元 ， 澳巴為 一千三百 九十六 萬餘元 。         去年 乘客 達疫前 九成         新 福利 和 澳巴 一九 年度 營業 帳目 均 錄得 盈利 ， 合共 一點 一七億元 。 二 ○ 年度 合共 盈利 八千 六百多 萬元 。 惟 疫情 期間 的 二 一 、 二 二 年均 錄得 虧損 。 二 一年 共虧損 七百多 萬元 ， 二 二年 兩巴 分別 虧損 二千多 萬元 。         去年 經濟 活動 復 常 ， 資料 顯示 ， 二三年 全年 總乘車 人次 二點 一四億 人次 ， 按年 上升 百之分 二十七 點三 ， 對 比 一 九年 的 二點 二九 億 人次 ， 已 恢 復 至 九成 三 水平 ， 兩巴業務 亦 大幅 改善 。         首 二月 客多疫 前 半成         新 福利 業績 報告 指出 ， 去年 稅後利潤 為 三千八百 八十六 萬元 ， 已 恢 復 至 一 九年 的 八成 六 。 去年 載 客量 超過 一 億 人次 ， 同比 增幅 百分之二十九 點六 ， 日均 二十七 點九萬 人次 。 營運 里程 較 去年 增加 百分之十 ， 通過 加強 加密 服務 ， 更好 地 疏導 乘客 。 去年 第四季 客量 基本 已回 復 疫情 前 。 另外 ， 今年 至 二月 客況 更 超一 九年 同期 數量 ， 超出 近 百分之五 。         兩巴均 更新 環保車隊         新 福利 稱 ， 今年初 已 購置 三十五 台 增程 電動 小巴 及 兩台 十八 米 特大 巴士 ， 全部 投入 營運 ， 以 配合 客況 需求 及 加強 環保 服務 。 按 “ 道路 集體 客運 公共 服務 合同 ” ， 今年 完成 更新 車隊 ， 全面 使用 環保 新能源 巴士 的 合同 要求 。         澳巴 報告 提到 ， 去年 累計 總載 客量 一點 一二 億 人次 ， 同比增加 百分之二十 四點 九 ， 恢 復 至 一 九年 總載 客量 的 九成 一 。 二 一年 至 二三年 間 ， 澳巴分 三批 引進 四百 六十九 台增 程式 新能源 電動 巴士 ， 已 按 既定 計劃 順利 完成 營運車隊 更新 工作 ， 標誌 着 澳巴 在 助力 澳門 綠色 出行 的 行動 上 取得 實質 進展 。         首季 乘客 同比 增一成         交通 事務局 資料 顯示 ， 今年 首季 兩巴共營運 八十六 條線 路 。 一至 三月 總乘車 人次 五千 六百多 萬 ， 日均 六十一 萬 人次 ， 較 去年同期 增長 逾 一成 。",2024-06-27
外港政府辦公大樓末季動工,上蓋工程收廿一標書最高價七億四    外港政府辦公大樓末季動工    【本報消息】文化中心旁的外港新填海區廿五地段將建公共辦公大樓，建造工程昨日上午九時半在公建局會議室舉行公開開標，共收到二十一份標書。經開標程序後，所有標書被接納，工程造價介乎六億六千三百多萬至七億三千九百多萬澳門元。項目爭取今年第四季動工，施工總工期為七百六十五個工作天。    竣工後毛胚交付    該公共辦公大樓採取“基礎及地庫”和“上蓋”分開招標。“基礎及地庫”工程已於二〇二二年九月委託，預計今年十月竣工。公建局高級技術員朱磊明表示，由於基礎及地庫仍在施工，因此上蓋工程爭取第四季動工。工程落成後將以毛胚交付。    兩大樓設停車場    項目佔地六千四百八十平方米，總建築面積約八萬〇八百平方米，主要興建兩棟樓高十二層及十七層的政府辦公大樓，並設三層地庫停車場，供政府辦公用途。,http://www.macaodaily.com/html/2024-06/27/content_1764547.htm,上蓋工程收廿一標書最高價七億四    外港政府辦公大樓末季動工    【本報消息】文化中心旁的外港新填海區廿五地段將建公共辦公大樓，建造工程昨日上午九時半在公建局會議室舉行公開開標，共收到二十一份標書,上蓋 工程 收 廿一 標書 最高 價七億四         外 港 政府 辦公大樓 末 季動工         【 本報 消息 】 文化 中心 旁 的 外港 新 填海 區 廿五 地段 將建 公共 辦公大樓 ， 建造 工程 昨日 上午 九時 半 在 公建局 會 議室 舉行 公開 開標 ， 共 收到 二十 一份 標書 。 經開標 程序 後 ， 所有 標書 被 接納 ， 工程 造價 介乎 六億 六千 三百多 萬至 七 億 三千 九百多 萬澳門 元 。 項目 爭取 今年 第四季 動工 ， 施工 總 工期 為 七百 六十五 個 工作 天 。         竣工 後 毛 胚 交付         該 公共 辦公大樓 採取 “ 基礎 及 地庫 ” 和 “ 上蓋 ” 分開 招標 。 “ 基礎 及 地庫 ” 工程 已 於 二 〇 二 二年 九月 委 託 ， 預計 今年 十月 竣工 。 公建局 高級 技術員 朱磊明 表示 ， 由 於 基礎 及 地庫 仍 在 施工 ， 因此 上蓋 工程 爭取 第四季 動工 。 工程 落成 後 將以 毛 胚 交付 。         兩大樓 設停 車場         項目 佔 地 六千 四百八十 平方米 ， 總建築 面積 約 八萬 〇 八百 平方米 ， 主要 興建 兩棟樓 高 十二 層及 十七 層 的 政府 辦公大樓 ， 並設 三層 地庫 停車場 ， 供 政府 辦公 用途 。,2024-06-27
男子不法登入亡友網銀竊款,轉走十四萬   事主妻處理遺產發現    男子不法登入亡友網銀竊款    【本報消息】一名中年本地女子去年在處理丈夫的遺產時，發現亡夫的銀行賬戶、有兩筆折合為十四萬澳門元的款項遭人轉走，報案追究。    司警調查後，前日在關閘口岸拘捕一名涉案本地男子，其為事主丈夫的朋友，有人在取得死者的手機後，再以不法手段登入死者的網銀戶口轉走所有款項。    被捕本地男子姓陳，四十四歲，報稱保安員。司警落案控以加重盜竊和不當進入電腦系統罪，案件已移送檢察院偵辦。司警正追查贓款及手機去向。    案情顯示，二〇二〇年八月下旬，事主的丈夫在本澳因病去世。至二〇二三年二月，事主在處理丈夫生前的遺產時，發現丈夫去世後，有一個港元戶口及一個澳門元戶口的存款，分別為七萬〇三百一十四港元及六萬六千九百五十七澳門元遭人轉到其它賬戶，合共損失折合約十四萬澳門元，事主向司警報案追究。    要求取回死者手機    司警經調查，發現早於二〇二〇年九月一日至三日期間，上述款項分十五次轉入一名姓陳本地男子的銀行賬戶內。前日上午，陳某經關閘離境時，被司警截獲再帶返局調查。經調查，陳某與事主的丈夫為朋友關係，在事主丈夫去世當日，陳某到死者生前的住所，在死者家人在場情況下聲稱死者的手機由其付款購買，要求取回。事主等人因認識陳某故沒有異議交還手機。稍後，陳某以不法手段登入死者的網銀戶口，將折合十四萬澳門元分三日多次轉入自己的銀行賬戶。,http://www.macaodaily.com/html/2024-06/27/content_1764548.htm,司警調查後，前日在關閘口岸拘捕一名涉案本地男子，其為事主丈夫的朋友，有人在取得死者的手機後，再以不法手段登入死者的網銀戶口轉走所有款項,轉走 十四 萬       事主 妻處理 遺產 發現         男子 不法 登入 亡友 網銀竊款         【 本報 消息 】 一名 中年 本地 女子 去年 在 處理 丈夫 的 遺產時 ， 發現 亡夫 的 銀行 賬戶 、 有 兩筆 折合 為 十四 萬澳門 元 的 款項 遭人轉 走 ， 報案 追究 。         司警 調查 後 ， 前日 在 關閘 口岸 拘捕 一名 涉案 本地 男子 ， 其為 事主 丈夫 的 朋友 ， 有人 在 取得 死者 的 手機 後 ， 再 以 不法 手段 登入 死者 的 網銀戶 口轉 走 所有 款項 。         被捕 本地 男子 姓 陳 ， 四十四 歲 ， 報稱 保安 員 。 司警 落案 控以 加重 盜竊 和 不當 進入 電腦系 統罪 ， 案件 已 移送 檢 察院 偵辦 。 司警 正 追查 贓款 及 手機 去向 。         案情 顯示 ， 二 〇 二 〇 年 八月 下旬 ， 事主 的 丈夫 在 本澳 因病 去世 。 至 二 〇 二三年 二月 ， 事主 在 處理 丈夫 生前 的 遺產時 ， 發現 丈夫 去世 後 ， 有 一個 港元 戶口 及 一個 澳門元 戶口 的 存款 ， 分別 為 七 萬 〇 三百 一 十四 港元 及六萬 六千 九百 五十七 澳門元 遭人 轉到 其它 賬戶 ， 合共 損失 折合 約 十四 萬澳門 元 ， 事主 向 司警 報案 追究 。         要求 取回 死者 手機         司警經 調查 ， 發現 早 於 二 〇 二 〇 年 九月 一日 至 三 日期 間 ， 上述 款 項分 十五次 轉入 一名 姓 陳 本地 男子 的 銀行 賬戶 內 。 前日 上午 ， 陳 某經 關閘 離境 時 ， 被司 警截 獲 再 帶 返局 調查 。 經調查 ， 陳 某 與 事主 的 丈夫 為 朋友 關 係 ， 在 事主 丈夫 去世 當日 ， 陳 某到 死者 生前 的 住所 ， 在 死者 家人 在場 情況 下聲 稱 死者 的 手機 由 其 付款 購買 ， 要求 取回 。 事主 等 人 因 認識 陳 某 故 沒 有 異議 交還 手機 。 稍 後 ， 陳 某以 不法 手段 登入 死者 的 網銀戶 口 ， 將 折合 十四 萬澳門 元分 三日 多次 轉入 自己 的 銀行 賬戶 。,2024-06-27
內地“馬伕”操控妻子賣淫齊法辦,警拘四男女查幕後涉否集團操控    內地“馬伕”操控妻子賣淫齊法辦    【本報消息】治安警破獲一宗操控賣淫案，拘捕兩男兩女，並揭發有內地男子操控妻子賣淫，自己則負責把風，當局正調查幕後有否涉及集團式操控。    涉操控賣淫的兩名男子均無業，分別姓董，二十多歲；姓王，三十多歲。兩名賣淫的內地女子均無業，分別姓孫，二十多歲，是董某的妻子；姓陳，三十多歲。四人均持中國護照，涉操控賣淫送交檢察院處理。    不停滋擾途人    案情指，治安警於上月二十日接獲居民舉報指有內地女子來澳賣淫。本月十九日晚上九時許，治安警在路氹某酒店外巡查期間發現涉案的孫女及陳女不停滋擾男途人，王某及董某則於酒店外及大堂把風。未幾，警員發現孫女懷疑與一名嫖客上房，同日晚上十一時，兩人步出酒店房即被警員截獲，警員同時拘捕董某、王某及陳女。經盤問，孫女承認收取一千五百港元肉金與該嫖客性交易。警員並在孫女的手袋及房內，起出現金及四十個避孕套。    再度來澳賣淫    陳女供稱上月初在內地認識王某，經對方介紹來澳賣淫，上月中曾透過王某安排來澳開工，王某負責把風及提供房間。本月十五日，陳女再次來澳以相同方式賣淫，聲稱至今賺取三萬港元的肉金，其中一半已交給王某。王某則聲稱知悉董氏夫妻操控賣淫及賣淫，但否認自己犯案。警方正進一步調查案件。,http://www.macaodaily.com/html/2024-06/27/content_1764549.htm,警拘四男女查幕後涉否集團操控    內地“馬伕”操控妻子賣淫齊法辦    【本報消息】治安警破獲一宗操控賣淫案，拘捕兩男兩女，並揭發有內地男子操控妻子賣淫，自己則負責把風，當局正調查幕後有否涉及集團式操控,警拘四 男女 查幕後涉 否集團 操控         內地 “ 馬 伕 ” 操控 妻子 賣淫 齊法辦         【 本報 消息 】 治安警 破獲 一宗 操控 賣淫案 ， 拘捕 兩 男 兩女 ， 並揭 發有 內 地 男子 操控 妻子 賣淫 ， 自己 則負責 把 風 ， 當局 正調 查幕 後 有否 涉及 集團式 操控 。         涉 操控 賣淫 的 兩名 男子 均 無業 ， 分別 姓 董 ， 二十多 歲 ； 姓王 ， 三十多 歲 。 兩名 賣 淫 的 內 地 女子 均 無業 ， 分別 姓孫 ， 二十多 歲 ， 是 董某 的 妻子 ； 姓 陳 ， 三十多 歲 。 四 人均 持中 國護照 ， 涉 操控 賣淫 送交 檢 察院 處理 。         不停 滋擾 途人         案情 指 ， 治安警 於 上 月 二十日 接獲 居民 舉報 指有 內 地 女子 來 澳賣 淫 。 本月 十九日 晚上 九時許 ， 治安警 在 路 氹 某 酒店 外 巡查 期間 發現 涉案 的 孫女 及 陳 女 不停 滋擾 男途 人 ， 王某 及 董 某則 於 酒店 外及 大堂 把 風 。 未 幾 ， 警員 發現 孫女 懷疑 與 一名 嫖客 上房 ， 同日 晚上 十一 時 ， 兩人 步出 酒店 房即 被 警員截 獲 ， 警員同 時 拘捕 董某 、 王某 及 陳 女 。 經盤問 ， 孫女 承認 收取 一千五百 港元 肉金 與 該 嫖客 性交易 。 警員並 在 孫女 的 手袋 及房 內 ， 起出 現金及 四十 個 避孕套 。         再度 來 澳賣 淫         陳 女供 稱 上 月初 在 內 地 認識 王某 ， 經對 方介紹 來 澳賣 淫 ， 上 月 中曾 透過 王某 安排 來 澳開工 ， 王某 負責 把 風及 提供 房間 。 本月 十五日 ， 陳 女 再次 來 澳以 相同 方式 賣淫 ， 聲稱 至今 賺取 三萬 港元 的 肉 金 ， 其中 一半 已交給 王某 。 王 某則 聲稱 知悉 董氏 夫妻 操控 賣淫 及 賣 淫 ， 但 否認 自己 犯案 。 警方正 進 一步 調查 案件 。,2024-06-27
