Title,Content,Link,Summary,Preprocessed_Content,Date
奧地利突不認台國際駕照,奧地利突不認台國際駕照    【本報訊】據聯合新聞網廿二日報道：近日有人在網絡社群表示，台灣旅客無法持國際駕照在奧地利臨時駕車。有致電詢問原因的民眾則說，所得到的回答是“奧地利政府對台灣不太友善。”台對外事務部門今日下午證實相關傳言，並表示，基於平等互惠原則，目前持奧地利國際駕照的外籍人士也無法在台灣駕車。    台不在“交通公約”    有民眾近期在網絡社群反映，“已經不能在奧地利自駕了”，指台灣地區的國際駕照不能在奧地利使用，而且是最近幾日才作出的限制。    對此，有民眾向台媒指出，他有致電向當局部門詢問，得到的回答是，奧地利政府對台灣非常不友善，認為台灣不在“日內瓦道路交通公約”中，而台灣方面是被動得知相關訊息，台駐外辦事處雖然很努力與對方溝通，但沒有辦法得到滿意的結果。    台辦事處接洽無果    此外，亦有近期規劃至奧地利旅遊的台灣民眾表示，他致電台駐當地辦事處詢問，所得到的回答就是，沒有辦法，奧地利政府不承認台灣地區的國際駕照，目前也沒有替代方案可循，只能改其它交通方式，並表示辦事處也是“剛剛才知道”。辦事處方面也表明他們無能為力，無法進一步改善情況。    台停用奧國際駕照    台對外事務部門則對此正式發出回應表示，近日接獲民眾反映，持台灣國際駕照無法在奧地利臨時駕車，當局已指示駐奧地利辦事處持續進洽奧國政府，爭取台灣民眾相關權利。此外，基於平等互惠原則，目前持奧地利國際駕照的外籍人士也無法持該證件在台灣駕車。,http://www.macaodaily.com/html/2024-05/23/content_1757037.htm,台停用奧國際駕照    台對外事務部門則對此正式發出回應表示，近日接獲民眾反映，持台灣國際駕照無法在奧地利臨時駕車，當局已指示駐奧地利辦事處持續進洽奧國政府，爭取台灣民眾相關權利,奧 地利 突不認 台國際 駕照         【 本報 訊 】 據 聯合 新聞網 廿二日 報道 ： 近日 有人 在 網絡 社群 表示 ， 台灣 旅客 無法持 國際 駕照 在 奧 地利 臨時 駕車 。 有致 電詢問 原因 的 民眾則 說 ， 所 得到 的 回答 是 “ 奧 地利 政府 對 台灣 不 太 友善 。 ” 台 對 外事 務部門 今日 下午 證實 相關 傳言 ， 並 表示 ， 基 於 平等互惠 原則 ， 目前 持奧 地利 國際 駕照 的 外籍人士 也 無法 在 台灣 駕車 。         台 不 在 “ 交通 公約 ”         有民眾 近期 在 網絡 社群 反映 ， “ 已經 不能 在 奧 地利 自駕 了 ” ， 指台灣 地區 的 國際 駕照 不能 在 奧 地利 使用 ， 而且 是 最近 幾日 才 作出 的 限制 。         對此 ， 有民眾 向 台媒 指出 ， 他 有致 電向當 局部 門詢問 ， 得到 的 回答 是 ， 奧 地利 政府 對 台灣 非常 不 友善 ， 認為 台灣 不 在 “ 日內瓦 道路交通 公約 ” 中 ， 而 台灣 方面 是 被動 得知 相關訊息 ， 台 駐外 辦事處 雖然 很 努力 與 對方 溝通 ， 但 沒 有 辦法 得到 滿意 的 結果 。         台辦 事處 接洽 無果         此外 ， 亦 有 近期 規劃 至 奧 地利 旅遊 的 台灣民眾 表示 ， 他致 電台 駐 當地 辦事處 詢問 ， 所 得到 的 回答 就是 ， 沒有 辦法 ， 奧 地利 政府 不承認 台灣 地區 的 國際 駕照 ， 目前 也 沒 有 替代 方案 可循 ， 只能 改 其它 交通 方式 ， 並 表示 辦事處 也 是 “ 剛剛 才 知道 ” 。 辦事處 方面 也 表明 他們 無能 為力 ， 無法進 一步 改善 情況 。         台 停用 奧國際 駕照         台 對 外事 務部門則 對 此 正式 發出 回應 表示 ， 近日 接 獲民眾 反映 ， 持台灣 國際 駕照 無法 在 奧 地利 臨時 駕車 ， 當局 已 指示 駐奧 地利 辦事處 持續 進洽 奧國 政府 ， 爭取 台灣民眾 相關 權利 。 此外 ， 基 於 平等互惠 原則 ， 目前 持奧 地利 國際 駕照 的 外籍人士 也 無法持 該 證件 在 台灣 駕車 。,2024-05-23
民進黨難複製“太陽花”    施鑫岳,民進黨難複製“太陽花”    目前在立法機構因人數劣勢而頻頻受挫的民進黨，正鼓動支持者包圍議場，隱隱有十年前“太陽花運動”的味道。所不同的是，二○一四年是中國國民黨執政，而如今則換成民進黨，可謂“當家鬧事”。    立法機構席次劣勢    台立法機構廿一日處理機構改革相關方案，在民進黨民代頻頻提案散會、拖延時間下，歷經十多個小時的表決大戰，到晚上接近十二時才二讀表決通過包括藐視立法機構罪、強化民代人事同意權、擴大立法機構調查權、聽證權等條文。於廿四日的會議將繼續審查相關法案。    若相關修法通過，民進黨當局的行政權將被限縮，“綠色執政”過往一手遮天、蠻幹暴衝的局面有望得到改觀。    綠“賣慘”博取同情    民進黨顯然不會聽之任之，可是目前綠營民代的席次沒有過半，也非立法機構第一大黨。面對藍白陣營提案改革立法機構志在必得，民進黨團在議場內採取抗爭、拖延戰術未果後，使出了“盤外招”。他們鼓動支持者包圍立法機構，試圖重現“太陽花”，通過所謂“民意”來施壓在野陣營。    廿一日晚，台立法機構辦公大樓外人潮漸增，集結了許多綠營支持者。航拍畫面顯示，抗議人潮蔓延至立法機構周邊的幾條道路。    二○一四年的“太陽花運動”，直接改變了台灣的政治版圖，民進黨堪稱這場運動的最大受益者。十年後的今天，眼看自己執政受到挑戰，他們又想故技重施，通過“賣慘”博取同情，干擾立法機構的正常運作。    六成五民眾撐改革    對於立法機構的激烈衝突以及民進黨號召場外抗議的做法，輿情分析機構今日最新出爐的民調值得參考。結果顯示，有六成五民眾支持藍白兩黨、力挺立法機構改革法案，批評藍白陣營或反對立法機構改革法案的僅兩成五；發動杯葛的民進黨民代好感度更被國民黨民代超車，負面聲量暴增。    至於民進黨極力訴求的“程序不正義”，同樣未獲多數民眾認同。有一成八民眾表示支持立法機構改革；贊同綠營論述者僅一成四；還有一成三分別表示下架民進黨和為國民黨民代加油；一成言論批評在立法機構外聲援民進黨的群眾是“職業學生”，甚至諷刺是“大型面試現場”；還有百分之九表態力挺立法機構負責人韓國瑜。    藍抨擊綠操弄群眾    國民黨民代王鴻薇表示，台立法機構要改革是多數民意，綠營過去也支持。希望民進黨不要再顛倒是非、操弄群眾，把台灣民眾當成傻瓜。    過去八年民進黨掌握多數民代席次時，在立法機構強勢碾壓的案子不少，哪裡曾理會在野黨。如今風水輪流轉，綠營沒了人數優勢，遇上在野黨的全面反撲，卻又心不甘情不願，只好控訴對手“黑箱”，企圖訴諸外部力量。難不成民進黨所謂的“民主”，是“民進黨作主”？抑或是“自己贏了才叫民主”？    既已執政當家，又要鬧事，只會輸光好感。“太陽花”名聲已經敗壞，民進黨面對“雙少數”執政的局面，與其想操控群眾力量，搞個“太陽花2.0”，不如改變自己的心態，謙卑面對在野多數民意。議場上的事，就留在議場裡好好商量解決。（香港廿二日電）    香港中通社記者 施鑫岳,http://www.macaodaily.com/html/2024-05/23/content_1757038.htm,立法機構席次劣勢    台立法機構廿一日處理機構改革相關方案，在民進黨民代頻頻提案散會、拖延時間下，歷經十多個小時的表決大戰，到晚上接近十二時才二讀表決通過包括藐視立法機構罪、強化民代人事同意權、擴大立法機構調查權、聽證權等條文,民進 黨 難 複 製 “ 太陽花 ”         目前 在 立法 機構 因人數 劣勢 而 頻頻 受挫 的 民進 黨 ， 正鼓動 支持者 包圍 議場 ， 隱隱 有 十年 前 “ 太陽花 運動 ” 的 味道 。 所 不同 的 是 ， 二 ○ 一 四年 是 中國 國民黨 執政 ， 而 如今 則換 成民進 黨 ， 可謂 “ 當家 鬧 事 ” 。         立法 機構 席次 劣勢         台 立法 機構 廿一日 處理 機構 改革 相關 方案 ， 在 民進 黨民代 頻頻 提案 散會 、 拖延 時間 下 ， 歷經 十多 個小時 的 表決 大戰 ， 到 晚上 接近 十二 時才 二讀 表決 通過 包括 藐視 立法 機構 罪 、 強化民代 人事 同意 權 、 擴大 立法 機構 調查權 、 聽證權 等 條文 。 於 廿四日 的 會議 將繼續 審查 相關 法案 。         若 相關 修法 通過 ， 民進 黨 當局 的 行政 權將 被 限縮 ， “ 綠色 執政 ” 過往 一手遮天 、 蠻幹 暴衝 的 局面 有望 得到 改觀 。         綠 “ 賣慘 ” 博取 同情         民進 黨 顯然 不會 聽 之任 之 ， 可是 目前 綠營民代 的 席次 沒有 過半 ， 也 非 立法 機構 第一 大黨 。 面對 藍白 陣營 提案 改革 立法 機構 志在必得 ， 民進 黨團 在 議場 內 採取 抗爭 、 拖延 戰術 未果 後 ， 使出 了 “ 盤外 招 ” 。 他們 鼓動 支持者 包圍 立法 機構 ， 試圖 重現 “ 太陽花 ” ， 通過 所謂 “ 民意 ” 來施壓 在野 陣營 。         廿一日 晚 ， 台 立法 機構 辦公大樓 外 人潮 漸增 ， 集結 了 許多 綠營 支持者 。 航拍 畫面 顯示 ， 抗議 人潮 蔓延 至 立法 機構 周邊 的 幾條 道路 。         二 ○ 一 四年 的 “ 太陽花 運動 ” ， 直接 改變 了 台灣 的 政治 版圖 ， 民進 黨堪稱 這場 運動 的 最大 受益者 。 十年 後 的 今天 ， 眼看 自己 執政 受到 挑戰 ， 他們 又 想 故技重施 ， 通過 “ 賣慘 ” 博取 同情 ， 干擾 立法 機構 的 正常 運作 。         六成 五民眾 撐 改革         對 於 立法 機構 的 激烈 衝突 以及 民進 黨號 召場 外抗 議 的 做法 ， 輿情 分析 機構 今日 最新 出爐 的 民調 值得 參考 。 結果 顯示 ， 有 六成 五民眾 支持 藍白 兩黨 、 力挺 立法 機構 改革 法案 ， 批評 藍白 陣營 或 反 對 立法 機構 改革 法案 的 僅兩成 五 ； 發動 杯葛 的 民進 黨民代 好感度 更 被 國民黨民代 超車 ， 負面 聲量 暴增 。         至於 民進 黨 極力 訴求 的 “ 程序 不正 義 ” ， 同樣 未 獲多 數民眾 認同 。 有 一成 八民眾 表示 支持 立法 機構 改革 ； 贊同 綠營 論述 者 僅一成 四 ； 還有 一成 三分 別 表示 下架民 進黨 和 為 國民黨民代 加油 ； 一成言論 批評 在 立法 機構 外聲 援民進 黨 的 群眾 是 “ 職業 學生 ” ， 甚至 諷刺 是 “ 大型 面試 現場 ” ； 還有 百分之九 表態力 挺 立法 機構 負責人 韓國瑜 。         藍 抨擊 綠 操弄 群眾         國民黨民 代王 鴻 薇 表示 ， 台 立法 機構 要 改革 是 多數 民意 ， 綠營過 去 也 支持 。 希望 民進 黨 不要 再顛 倒 是非 、 操弄 群眾 ， 把 台灣民眾 當成 傻瓜 。         過去 八年 民進 黨 掌握 多數民代 席次 時 ， 在 立法 機構 強勢 碾壓 的 案子 不少 ， 哪裡 曾理會 在野 黨 。 如今 風水輪 流轉 ， 綠營 沒 了 人數 優勢 ， 遇上 在野 黨 的 全面 反撲 ， 卻 又 心不甘 情不願 ， 只好 控訴 對 手 “ 黑箱 ” ， 企圖 訴諸 外部 力量 。 難 不成 民進 黨 所謂 的 “ 民主 ” ， 是 “ 民進 黨 作主 ” ？ 抑或 是 “ 自己 贏了 才 叫 民主 ” ？         既 已 執政當家 ， 又 要 鬧 事 ， 只會 輸光 好感 。 “ 太陽花 ” 名聲 已 經敗 壞 ， 民進 黨面 對 “ 雙少數 ” 執政 的 局面 ， 與 其 想 操控 群眾 力量 ， 搞個 “ 太陽花 2.0 ” ， 不如 改變 自己 的 心態 ， 謙卑面 對 在野 多數 民意 。 議場 上 的 事 ， 就 留在 議場裡 好好 商量 解決 。 （ 香港 廿二日 電 ）         香港 中通 社記者   施鑫岳,2024-05-23
馬禮遇期滿八警輪班保護,馬禮遇期滿八警輪班保護    【香港中通社廿二日電】台北消息：台灣當局前領導人馬英九卸任後，依規定享有的八年特勤禮遇，五月二十日起正式結束。後續安保工作轉由警政主管部門負責。馬辦表示，最後確認申請八人，採輪班制，馬英九若有公開行程，最多會有四名警察人員保護。    台媒報道，卸任已滿八年的馬英九，現有的警衛特勤人員二十日解除編制。後續安保工作由警政部門派員執行。    體檢被跟安全堪憂    馬英九基金會執行長蕭旭岑表示，當局曾提醒馬辦申請隨扈，並指示警政部門給予至少八名人員。經溝通，最終確認八人的安保編制，採輪班制，接下來馬英九出席公開場合活動，最多會有四名警察隨行保護。    蕭旭岑說，馬英九日前赴醫院體檢時，遭到媒體跟拍，馬辦擔憂卸任禮遇到期後馬英九的人身安全，希望新任領導人賴清德不要坐視不管、縱容綠營政客煽動支持者情緒，甚至暗中鼓動側翼攻擊馬英九。    卸任後享五項禮遇    據了解，台灣當局領導人任期四年，卸任後享有五項禮遇措施，包括每個月可享有廿五萬元（新台幣，下同）禮遇金；當局也會提供卸任領導人辦公室運營費用，第一年八百萬元，之後逐年遞減；其他還有受邀參加重要儀式、保健醫療、派遣安全護衛。除受邀參加重要儀式外，另四項禮遇的有效時間與其任職時間相同。    扁貪定罪取消禮遇    台灣當局卸任領導人的禮遇過去是“終身制”，直到二○○七年實施新規定，改為“做幾年、領幾年”。陳水扁、馬英九以及蔡英文卸任後，均可享有八年禮遇。不過規定同時約束，卸任領導人若犯貪污罪，經判決有罪確定後取消一切禮遇。因此陳水扁在二○一○年涉貪腐案被判決有罪後，其卸任禮遇已經取消。,http://www.macaodaily.com/html/2024-05/23/content_1757039.htm,馬禮遇期滿八警輪班保護    【香港中通社廿二日電】台北消息：台灣當局前領導人馬英九卸任後，依規定享有的八年特勤禮遇，五月二十日起正式結束,馬 禮遇期 滿八警 輪班 保護         【 香港 中通社 廿二日 電 】 台北 消息 ： 台灣 當局 前 領導 人馬英 九 卸任 後 ， 依規定 享有 的 八年 特勤 禮遇 ， 五月 二十日 起 正式 結束 。 後 續 安保 工作 轉由 警政 主管 部門 負責 。 馬 辦 表示 ， 最後確 認申 請八人 ， 採輪班制 ， 馬 英九若 有 公開 行程 ， 最多會 有 四名 警察 人員 保護 。         台媒報 道 ， 卸任 已滿 八年 的 馬 英九 ， 現有 的 警衛 特勤 人員 二十日 解除 編制 。 後 續 安保 工作 由 警政 部門 派員 執行 。         體檢 被 跟 安全 堪憂         馬 英九 基金 會 執行長 蕭旭岑 表示 ， 當局 曾 提醒 馬 辦 申請 隨扈 ， 並 指示 警政 部門 給予 至少 八名 人員 。 經溝通 ， 最 終確 認八人 的 安保 編制 ， 採輪班制 ， 接下 來馬英 九 出席 公開場 合活動 ， 最多會 有 四名 警察 隨行 保護 。         蕭旭岑 說 ， 馬 英九 日前 赴 醫院 體檢時 ， 遭到 媒體 跟 拍 ， 馬 辦 擔憂 卸任 禮 遇到 期後馬英 九 的 人身安全 ， 希望 新任 領導 人賴 清德 不要 坐視 不管 、 縱容 綠營 政客 煽動 支持者 情緒 ， 甚至 暗中 鼓動 側翼 攻擊馬 英九 。         卸任 後 享五項 禮遇         據 了解 ， 台灣 當局 領導人 任期 四年 ， 卸任 後 享有 五項 禮遇 措施 ， 包括 每個 月 可 享有 廿五 萬元 （ 新台幣 ， 下同 ） 禮遇 金 ； 當局 也 會 提供 卸任 領導 人辦 公室 運營費用 ， 第一年 八百 萬元 ， 之 後 逐年 遞減 ； 其他 還有 受邀 參加 重要 儀式 、 保健 醫療 、 派遣 安全 護衛 。 除 受邀 參加 重要 儀式 外 ， 另四項 禮遇 的 有效 時間 與 其任 職時間 相同 。         扁 貪 定罪 取消 禮遇         台灣 當局 卸任 領導 人 的 禮遇 過去 是 “ 終身制 ” ， 直到 二 ○ ○ 七年 實施 新 規定 ， 改為 “ 做 幾年 、 領幾年 ” 。 陳 水扁 、 馬 英九 以及 蔡 英文 卸任 後 ， 均 可 享有 八年 禮遇 。 不過 規定 同時 約束 ， 卸任 領導 人若犯 貪污罪 ， 經判決 有罪 確定 後 取消 一切 禮遇 。 因此 陳 水扁 在 二 ○ 一 ○ 年涉 貪腐案 被判 決 有罪 後 ， 其 卸任 禮遇 已經 取消 。,2024-05-23
經濟低迷,經濟低迷    台灣電價調升帶動萬物齊漲，讓台北高租金的租屋市場雪上加霜，經濟景氣低迷，民眾消費力大減，“租屋”的廣告隨處可見，有商 家買一送一促銷求生存。（香港中通社）,http://www.macaodaily.com/html/2024-05/23/content_1757040.htm,經濟低迷    台灣電價調升帶動萬物齊漲，讓台北高租金的租屋市場雪上加霜，經濟景氣低迷，民眾消費力大減，“租屋”的廣告隨處可見，有商 家買一送一促銷求生存,經濟 低迷         台灣 電價 調升 帶動 萬物 齊漲 ， 讓 台北 高 租金 的 租屋 市場 雪上加霜 ， 經濟景氣 低迷 ， 民眾 消費力 大減 ， “ 租屋 ” 的 廣告 隨處 可見 ， 有商   家買 一送 一 促銷 求生存 。 （ 香港 中通社 ）,2024-05-23
蒼茫大地守護者    新華社  圖／文,蒼茫大地守護者    從五月七日起，西藏那曲市尼瑪縣召集十餘名骨幹野生動物管護隊員，計劃用約兩周時間對尼瑪縣境內三萬多平方公里的羌塘國家級自然保護區核心區域進行集中巡護。    羌塘國家級自然保護區位於西藏自治區北部，核心區絕大部分沒有人類活動，主要保護對象為獨特的高寒生態系統及多種大型有蹄類動物。保護區的尼瑪縣共有十一個野生動物管護站，一百三十五名管護隊員，他們常年頂風冒雪，穿越無人區進行巡護，默默守護着這裡。    新華社  圖／文,http://www.macaodaily.com/html/2024-05/23/content_1757041.htm,蒼茫大地守護者    從五月七日起，西藏那曲市尼瑪縣召集十餘名骨幹野生動物管護隊員，計劃用約兩周時間對尼瑪縣境內三萬多平方公里的羌塘國家級自然保護區核心區域進行集中巡護,蒼茫 大地 守護者         從 五月 七日 起 ， 西藏 那曲 市尼瑪縣 召集 十餘名 骨幹 野生 動物 管護 隊員 ， 計劃 用 約 兩周 時間 對尼瑪 縣境 內三萬 多平方公里 的 羌塘 國家級 自然 保護區 核心 區域 進行 集中 巡護 。         羌塘 國家級 自然 保護區 位 於 西藏自治 區 北部 ， 核心 區絕 大部分 沒 有人 類活動 ， 主要 保護 對象 為 獨特 的 高寒 生態 系統 及 多種 大型 有蹄類 動物 。 保護區 的 尼瑪縣 共有 十一 個 野生 動物 管護 站 ， 一百三十 五名 管護 隊員 ， 他們 常年 頂風 冒雪 ， 穿越 無人區 進行 巡護 ， 默默 守護 着 這裡 。         新華社     圖 ／ 文,2024-05-23
（西窗小語）烏政府搜斷枯腸尋兵源   沈  實,烏政府搜斷枯腸尋兵源    面臨軍隊人員嚴重短缺，俄軍繼續前進，五月八日烏克蘭議會通過法案，允許一些囚犯參軍作戰，基輔長期以來反對讓囚犯上前線，且多次批評莫斯科動員囚犯填補士兵空缺。如今它打倒昨日的我，反過來學莫斯科了。    據說動員是自願的，有性暴力、殺害兩個或以上的人、嚴重腐敗和前高級官員，都沒資格，只有服刑期限還餘三年以下的囚犯才可申請。他們得到假釋而不是赦免待遇。有非政府組織擔心，俄羅斯瓦格納僱傭兵集團把在監獄動員的士兵，編為特種部隊，派遣他們進行類似“絞肉機”式的襲擊，當炮灰的事，會在烏克蘭翻版。烏克蘭軍方近日又取消了入伍服役的年限，有士兵家人對親人留在戰場至戰死方休表示不滿。    BBC訪問了一些大部分時間在挖戰壕、築防禦工事的前線士兵，他們表示，如果他們退下火線，由未受過訓練的新人接手，新兵只會送死。烏克蘭政府最近加強了對逃兵役者處分，把男性徵召入伍年齡由二十七歲降至二十五歲。    由於德國、奧地利、捷克及匈牙利四個歐盟國，引歐洲人權公約，表明不會把適齡當兵男性難民遣返烏克蘭服役，澤連斯基的最高顧問回應，歐盟成員應該統一立場，把逃兵役的烏克蘭男性遣返。目前約有四百多萬烏克蘭人在歐盟國家生活，其中八十六萬為成年男性。烏克蘭外交部近日出台一政策：凡適齡參軍男性五月中旬前，只能在國內更新護照。國家將暫停在海外生活的十八至六十歲本國男性提供領事服務。    《華盛頓郵報》報道，烏克蘭政府這一招海外徵兵，令居住海外的公民倍感壓力和憤怒。    （美“三加一綑綁法案”透視    · 十六）    沈    實,http://www.macaodaily.com/html/2024-05/23/content_1757015.htm,烏政府搜斷枯腸尋兵源    面臨軍隊人員嚴重短缺，俄軍繼續前進，五月八日烏克蘭議會通過法案，允許一些囚犯參軍作戰，基輔長期以來反對讓囚犯上前線，且多次批評莫斯科動員囚犯填補士兵空缺,烏 政府 搜斷 枯腸尋 兵源         面臨 軍隊 人員 嚴重 短缺 ， 俄軍繼續 前進 ， 五月 八日 烏克蘭議 會 通過 法案 ， 允許 一些 囚犯 參軍作戰 ， 基輔長 期以 來 反 對 讓 囚犯 上前 線 ， 且 多次 批評 莫斯科 動員 囚犯 填補 士兵 空缺 。 如今 它 打倒 昨日 的 我 ， 反過 來學 莫斯科 了 。         據 說 動員 是 自願 的 ， 有 性暴力 、 殺害 兩個 或 以上 的 人 、 嚴重 腐敗 和 前 高級 官員 ， 都 沒資格 ， 只有 服刑 期限 還餘 三年 以下 的 囚犯 才 可 申請 。 他們 得到 假釋 而 不是 赦免 待遇 。 有 非政府 組織 擔心 ， 俄羅斯瓦格納 僱傭兵 集團 把 在 監獄 動員 的 士兵 ， 編為 特種 部隊 ， 派遣 他們 進行 類似 “ 絞肉機 ” 式 的 襲擊 ， 當 炮灰 的 事 ， 會 在 烏克蘭 翻版 。 烏克蘭 軍方 近日 又 取消 了 入伍 服役 的 年限 ， 有 士兵 家人 對親 人 留在 戰場 至 戰死 方休 表示 不滿 。         BBC 訪問 了 一些 大部分 時間 在 挖 戰壕 、 築防禦 工事 的 前線 士兵 ， 他們 表示 ， 如果 他們 退下 火線 ， 由 未 受過 訓練 的 新人 接手 ， 新兵 只會 送死 。 烏克蘭 政府 最近 加強 了 對 逃 兵役 者 處分 ， 把 男性 徵召 入伍 年齡 由 二十七 歲 降至 二十五 歲 。         由 於 德國 、 奧 地利 、 捷克 及 匈牙利 四個 歐盟國 ， 引歐洲 人權 公約 ， 表明 不會 把 適齡 當兵 男性 難民 遣返 烏克蘭 服役 ， 澤連斯基 的 最高 顧問 回應 ， 歐盟 成員應 該統 一立場 ， 把 逃 兵役 的 烏克蘭 男性 遣返 。 目前 約 有 四百多 萬 烏克蘭人 在 歐盟 國家 生活 ， 其中 八十六 萬為 成年 男性 。 烏克蘭 外交部 近日 出台 一 政策 ： 凡 適齡 參 軍 男性 五月 中旬 前 ， 只能 在 國內 更新 護照 。 國家將 暫停 在 海外 生活 的 十八 至 六十 歲 本國 男性 提供 領事 服務 。         《 華盛頓 郵報 》 報道 ， 烏克蘭 政府 這 一招 海外 徵兵 ， 令 居住 海外 的 公民 倍感 壓力 和 憤怒 。         （ 美 “ 三加 一 綑 綁 法案 ” 透視         ·   十六 ）         沈         實,2024-05-23
