Title,Content,Link,Summary,Preprocessed_Content,Date
年內樓價續調整  明年初或轉向,美減息效應需時傳遞    年內樓價續調整  明年初或轉向    【本報消息】美聯儲局今日凌晨公佈議息結果，市場普遍預期減息四之一厘或半厘。無論最終減息幅度如何，均意味着美國進入減息周期，結束兩年多的高息環境。本澳地產業者表示，美國減息周期初期，料澳樓市受惠不大，今年內樓價仍處調整期。當美國累計減息三至四次後，預計明年初本澳樓價才有機會轉向。    年內未必重拾升軌    澳門地產業總商會會長鍾小健表示，今年四月底樓市“撤辣”後，發展商普遍以六至七折價格去庫存，加快資金回籠步伐，吸引買家入市。一手住宅單位成交，由“撤辣”首三十天的逾三百宗持續萎縮，業內估計八月一手住宅成交僅為個位數，反映市場已消化“撤辣”政策，物業成交重返低位，樓價仍有壓力。    過去兩年多來，美國為抑制通脹而激進加息，高息環境持續，增加新興市場資金成本，悍衛自身美元霸權，但也是七傷拳，加重自身國債利息負擔。尤其美國國債金額龐大，高息環境持續，利息開支驚人，因此美國減息周期啟動後，後續仍會持續減息。關注減息幅度及持續時間。    美國減息周期下，銀行資金成本減輕，定存利息下調，變相過去幾年儲蓄的資金，需尋求新出路。他表示，減息周期早段，效應尚未傳遞至澳門，故本澳樓價年內未必可重拾升勢。但隨着明年減息趨勢持續，逐步傳遞至全球市場，本澳樓市明年初有機會止跌回升。    減息三次效應始顯    澳門地產發展商會會長陸惠德表示，隨着澳門貴賓廳行業萎縮，相當一部分中高收入人士失業或轉型，收入大不如前，流失部分中高消費群體，加上居民消費外流、旅客消費減少，整體經濟復甦進程未如理想。因此，美國啟動減息周期，本澳樓市也不會立即好轉，但有助穩定樓價，跌勢有望喘定，全年樓價跌幅或會收窄。    美聯儲局減息幅度尚待揭盅，倘減幅只有四分之一厘，對市場幫助不會太大，需要減息三次或以上，累計減息一厘至一厘半，相關效應才會顯現。例如過去兩年因美國加息而進入美國的資金，有部分將會回流亞太地區，降低銀行業資金成本。居民供款負擔進一步減輕，樓市才會見轉機。    除外圍高息環境轉變，明年也是新屆特區政府開局之年，期望新屆政府可以客觀、公正、持平的態度，結合本澳經濟實況，實事求是地推出有效的經濟措施，惠及中小企，為整體經濟、樓市帶來新氣象。,http://www.macaodaily.com/html/2024-09/19/content_1782172.htm,尤其美國國債金額龐大，高息環境持續，利息開支驚人，因此美國減息周期啟動後，後續仍會持續減息,美 減息 效應 需時 傳遞         年 內樓 價續 調整     明年初 或 轉向         【 本報 消息 】 美聯 儲局 今日 凌晨 公 佈 議息 結果 ， 市場 普遍 預期 減息 四 之一 厘 或 半 厘 。 無論 最終 減息 幅度 如何 ， 均 意味着 美國 進入 減息 周期 ， 結束 兩年 多 的 高息 環境 。 本澳 地產業者 表示 ， 美國 減息 周期 初期 ， 料 澳樓 市 受惠 不 大 ， 今年 內樓價 仍 處調 整期 。 當美國 累計 減息 三至 四次 後 ， 預計 明年初 本澳樓 價才 有 機會 轉向 。         年 內 未必 重拾 升軌         澳門 地產業 總商會 會長 鍾 小健 表示 ， 今年 四 月底 樓市 “ 撤辣 ” 後 ， 發 展商 普遍 以六至 七折 價格 去 庫存 ， 加快 資金 回籠 步伐 ， 吸引 買家 入市 。 一手 住宅 單位 成交 ， 由 “ 撤辣 ” 首 三十天 的 逾 三百 宗持續 萎縮 ， 業內 估計 八月 一手 住宅 成交 僅為 個 位數 ， 反映 市場 已 消化 “ 撤辣 ” 政策 ， 物業 成交 重返 低位 ， 樓價 仍 有 壓力 。         過去 兩年 多來 ， 美國為 抑制 通脹 而 激進 加息 ， 高息 環境 持續 ， 增加 新興 市場 資金 成本 ， 悍衛 自身 美元 霸權 ， 但 也 是 七傷 拳 ， 加重 自身 國債 利息 負擔 。 尤其 美國國 債金額 龐大 ， 高息 環境 持續 ， 利息 開支 驚人 ， 因此 美國 減息 周期 啟動 後 ， 後 續 仍會 持續 減息 。 關注 減息 幅度 及持續 時間 。         美國 減息 周期 下 ， 銀行 資金 成本 減輕 ， 定存 利息 下調 ， 變相過 去 幾年 儲蓄 的 資金 ， 需尋 求新 出路 。 他 表示 ， 減息 周期 早段 ， 效應 尚未 傳遞 至 澳門 ， 故本 澳樓 價年 內 未必 可 重拾 升勢 。 但 隨着 明年 減息 趨勢 持續 ， 逐步 傳遞 至 全球 市場 ， 本澳樓 市 明年初 有 機會 止跌回升 。         減息 三次 效應 始顯         澳門 地產發 展商 會會長 陸惠德 表示 ， 隨着 澳門 貴賓廳 行業 萎縮 ， 相當 一部分 中 高 收入 人士 失業 或 轉型 ， 收入 大不如前 ， 流失 部分 中高 消費 群體 ， 加上 居民 消費 外流 、 旅客 消費 減少 ， 整體 經濟 復 甦 進程 未 如 理想 。 因此 ， 美國 啟動 減息 周期 ， 本澳樓 市 也 不會 立即 好轉 ， 但 有助 穩定 樓價 ， 跌勢 有望 喘定 ， 全年 樓價 跌幅 或會 收窄 。         美聯 儲局 減息 幅度 尚待 揭盅 ， 倘減 幅 只有 四分之一 厘 ， 對 市場 幫助 不會 太大 ， 需要 減息 三次 或 以上 ， 累計 減息 一厘 至 一厘 半 ， 相關 效應 才 會 顯現 。 例如 過去 兩年 因美國 加息 而 進入 美國 的 資金 ， 有 部分 將會 回流 亞太地區 ， 降低 銀行業 資金 成本 。 居民 供款 負擔 進 一步 減輕 ， 樓市 才 會 見 轉機 。         除外 圍 高息 環境 轉變 ， 明年 也 是 新屆 特區 政府 開局 之 年 ， 期望 新屆 政府 可以 客觀 、 公正 、 持平 的 態度 ， 結合本 澳經濟 實況 ， 實事求 是 地 推出 有效 的 經濟 措施 ， 惠及 中小 企 ， 為 整體 經濟 、 樓市 帶來 新氣象 。,2024-09-19
地產業冀多措並舉 盤活物業成交,地產業冀多措並舉  盤活物業成交    【本報消息】樓市持續向下，制約經濟復甦步伐。地產業者期望未來特區政府可多措並舉，盤活物業成交，提振市場信心，穩定經濟發展前景。同時應參考香港吸引人才及資金的政策，創設更具吸引力的政策，吸引人才、資金進駐，促進投資、創造就業，推動經濟適度多元化發展。    地總：暫緩建辦公樓    澳門地產業總商會會長鍾小健表示，樓價持續下跌，居民消費意慾大減，繼而消費降級。建議未來特區政府主導以房地產為改善民生經濟的切入點，激活樓市成交量，盤活積壓的資金。當樓市成交恢復活躍，市場信心恢復，將起着化解金融系統性風險、推動就業、增加政府稅收等三大益處。    過去十年，特區政府收逾百幅土地作為土地儲備，有更多土地資源運用，可透過土地供應調控樓市，同時拍賣土地增加財政收入，故政府有充份條件全面放開樓市管控，回歸市場主導。另外，近年政府興建政府辦公大樓，多個部門陸續遷出寫字樓，同時新公司成立及外地進駐公司減少，寫字樓空缺大增，故希望政府暫緩興建辦公大樓，待市場有時間消化。    此外，該會建議重啟投資移民政策，為澳門吸引資金及人才。澳門推動產業適度多元需要人才和資金。港澳在吸引人才、資金方面既有互補，也有競爭關係。因此澳門有需要制訂比香港更吸引的投資及人才引進條件，吸納人才和資金進駐，從而推動澳門經濟多元發展。    地發：重推置業居留    澳門地產發展商會會長陸惠德表示，過去幾年高息環境持續、本澳經濟復甦不平衡，樓市需求放緩，樓價持續下跌，較高位跌近三成。期間政府興建大量公屋，整體住宅供應增加，可回應居民住屋需求。建議未來特區政府暫緩興建公屋步伐，待樓市穩定再作部署。    都市更新進展緩慢，期望未來特區政府可加快進度，並以政府、企業相結合的方式推動都市更新，更貼合居民、市場需求，並提升都更效率。同時借鑒香港過去幾年吸引人才、資金的經驗，重推置業居留、投資移民等政策，但門檻需適當提高，例如在澳門購買一千萬元或以上的商舖，並在澳門或橫琴深合區投資五百萬元或以上，既引入資金，也促進投資、創造就業。    過去幾年政府公共工程多以不同的理由改為邀請招標，而不作公開招標，削弱本地建築工程業界的發展機會。希望未來政府的公共工程可公開招標，確保招標公平、公開、公正。,http://www.macaodaily.com/html/2024-09/19/content_1782173.htm,同時借鑒香港過去幾年吸引人才、資金的經驗，重推置業居留、投資移民等政策，但門檻需適當提高，例如在澳門購買一千萬元或以上的商舖，並在澳門或橫琴深合區投資五百萬元或以上，既引入資金，也促進投資、創造就業,地產業 冀多措 並舉     盤 活物 業 成交         【 本報 消息 】 樓市 持續 向下 ， 制約 經濟 復 甦 步伐 。 地產業者 期望 未來 特區 政府 可多措 並舉 ， 盤 活物 業 成交 ， 提振市場 信心 ， 穩定 經濟 發展 前景 。 同時 應 參考 香港 吸引 人才 及 資金 的 政策 ， 創設 更具 吸引力 的 政策 ， 吸引 人才 、 資金進 駐 ， 促進 投資 、 創 造就 業 ， 推動 經濟 適度 多元化 發展 。         地 總 ： 暫緩 建辦 公樓         澳門 地產業 總商會 會長 鍾 小健 表示 ， 樓價 持續 下跌 ， 居民 消費意 慾 大減 ， 繼而 消費 降級 。 建議 未來 特區 政府 主導 以房 地產為 改善 民生 經濟 的 切入 點 ， 激活 樓市 成交量 ， 盤活 積壓 的 資金 。 當樓 市 成交 恢 復 活躍 ， 市場 信心 恢 復 ， 將起 着 化解 金融系 統性 風險 、 推動 就業 、 增加 政府 稅收 等 三大益 處 。         過去 十年 ， 特區 政府 收 逾 百幅 土地 作為 土地 儲備 ， 有 更 多 土地 資源 運用 ， 可透過 土地 供應調 控樓 市 ， 同時 拍 賣 土地 增加 財政 收入 ， 故 政府 有 充份 條件 全面 放開 樓市 管控 ， 回歸 市場 主導 。 另外 ， 近年 政府 興建 政府 辦公大樓 ， 多個 部門 陸續 遷出 寫字樓 ， 同時 新 公司 成立 及 外地 進駐 公司 減少 ， 寫字樓 空缺 大增 ， 故 希望 政府 暫緩 興建辦 公大樓 ， 待 市場 有 時間 消化 。         此外 ， 該會 建議 重啟 投資 移民 政策 ， 為 澳門 吸引 資金及 人才 。 澳門 推動產業 適度 多元 需要 人才 和 資金 。 港澳 在 吸引 人才 、 資金 方面 既有 互補 ， 也 有 競爭關 係 。 因此 澳門 有 需要 制訂 比 香港 更 吸引 的 投資及 人才 引進 條件 ， 吸納 人才 和 資金進 駐 ， 從 而 推動 澳門 經濟 多元 發展 。         地發 ： 重 推置業 居留         澳門 地產發 展商 會會長 陸惠德 表示 ， 過去 幾年 高息 環境 持續 、 本澳 經濟 復 甦 不 平衡 ， 樓市 需求 放緩 ， 樓價 持續 下跌 ， 較 高位 跌 近三成 。 期間 政府 興建 大量 公屋 ， 整體 住宅 供應 增加 ， 可 回應 居民 住屋 需求 。 建議 未來 特區 政府 暫緩 興建 公屋 步伐 ， 待 樓市 穩定 再作 部署 。         都市 更新 進展 緩慢 ， 期望 未來 特區 政府 可 加快 進度 ， 並以 政府 、 企業 相結合 的 方式 推動 都市 更新 ， 更 貼合 居民 、 市場 需求 ， 並 提升 都 更 效率 。 同時 借 鑒 香港 過去 幾年 吸引 人才 、 資金 的 經驗 ， 重 推置業 居留 、 投資 移民 等 政策 ， 但門檻 需 適當 提高 ， 例如 在 澳門購 買 一千 萬元 或 以上 的 商 舖 ， 並在 澳門 或 橫琴 深合區 投資 五百 萬元 或 以上 ， 既 引入 資金 ， 也 促進 投資 、 創 造就 業 。         過去 幾年 政府 公共 工程 多以 不同 的 理由 改為 邀請 招標 ， 而 不作 公開 招標 ， 削弱 本地 建築 工程 業界 的 發展 機會 。 希望 未來 政府 的 公共 工程 可公開 招標 ， 確保 招標 公平 、 公開 、 公正 。,2024-09-19
八月穗商業地產成交大增,八月穗商業地產成交大增    【本報記者廣州十七日電】合富研究院近日發佈資料顯示，八月廣州商業地產市場成交迎來爆發期，商業地產市場各業態（寫字樓、公寓、商舖）均產生數萬平方米以上規模的大宗交易，成交量能顯著放大。    兩宗上萬平方交易    合富研究院發佈的八月廣州商業地產市場報告，當月全市寫字樓共成交10.5萬平方米，同比升317%，環比升197%。該成交量達到二三年初以來的峰值水準。八月出現兩例上萬平方米級別的大宗交易，分別位於南沙區和天河區。    商舖八月成交11.1萬平方米，同比升456%，環比升340%。其中位於南沙區的星河COCO Park購物中心整體簽約逾7萬平方米。該購物中心已於去年十二月正式開業。黃埔區也有新福港鼎峰等若干社區配套商舖的批量簽約而成交量較高。    公寓成交環比倍升    公寓市場方面，八月成交量為8.3萬平方米，同比升50%，環比升97%。其中白雲區萬科雲都薈的大宗交易，推動本應為公寓市場淡季的八月份創下年度成交量新高。    報告認為，公寓市場日益分化，一方面高端大平層吸引越來越多高淨值買家；另一方面，設計精良的小戶型公寓，憑藉出色的租金表現，在市場中佔據一席之地。    廣州中原研究發展部指出，八月商業市場新增供應量仍偏低，但大宗交易突出，助力各物業成交量走高。近期商業市場批售節奏放緩，新盤不多，開發商以去庫存為主基調，疊加開發商內部資產整合、個別大客戶掃貨，市場整體去化可觀，有利後續市場成交氛圍延續。,http://www.macaodaily.com/html/2024-09/19/content_1782174.htm,八月穗商業地產成交大增    【本報記者廣州十七日電】合富研究院近日發佈資料顯示，八月廣州商業地產市場成交迎來爆發期，商業地產市場各業態（寫字樓、公寓、商舖）均產生數萬平方米以上規模的大宗交易，成交量能顯著放大,八月 穗 商業 地產 成交 大增         【 本報 記者 廣州 十七日 電 】 合富 研究院 近日 發 佈 資料 顯示 ， 八月 廣州 商業 地產 市場 成交 迎來 爆發期 ， 商業 地產 市場 各業態 （ 寫字樓 、 公寓 、 商 舖 ） 均產生 數萬 平方米 以上 規模 的 大宗 交易 ， 成交量 能 顯著 放大 。         兩宗上 萬 平方 交易         合富 研究院 發 佈 的 八月 廣州 商業 地產 市場 報告 ， 當月 全市 寫字樓 共 成交 10.5 萬 平方米 ， 同比 升 317% ， 環比升 197% 。 該 成交量 達到 二三年 初以 來 的 峰值 水準 。 八月 出現 兩例 上 萬 平方米 級別 的 大宗 交易 ， 分別位 於 南沙 區和 天河 區 。         商 舖 八月 成交 11.1 萬 平方米 ， 同比 升 456% ， 環比升 340% 。 其中 位 於 南沙 區的 星河 COCO   Park 購物 中心 整體 簽約 逾 7 萬 平方米 。 該 購物 中心 已 於 去年 十二月 正式 開業 。 黃埔區 也 有 新福港 鼎峰 等 若干 社區 配套 商 舖 的 批量 簽約 而 成交量 較 高 。         公寓 成交 環比倍 升         公寓 市場 方面 ， 八月 成交量 為 8.3 萬 平方米 ， 同比 升 50% ， 環比升 97% 。 其中 白雲區 萬科雲都薈 的 大宗 交易 ， 推動本 應為 公寓 市場 淡季 的 八月份 創下 年度 成交量 新高 。         報告 認為 ， 公寓 市場 日益 分化 ， 一方面 高端 大平 層 吸引 越來 越 多 高淨值 買家 ； 另一方面 ， 設計 精良 的 小戶 型 公寓 ， 憑 藉 出色 的 租金 表現 ， 在 市場 中 佔 據 一席之地 。         廣州 中原 研究 發展部 指出 ， 八月 商業 市場 新增 供應量 仍 偏低 ， 但 大宗 交易 突出 ， 助力 各物業 成交量 走高 。 近期 商業 市場 批售 節奏 放緩 ， 新盤 不 多 ， 開發 商以 去 庫存 為 主基調 ， 疊加開 發商 內部 資產 整合 、 個別 大 客戶 掃貨 ， 市場 整體 去化 可觀 ， 有利 後 續 市場 成交 氛圍 延續 。,2024-09-19
穗個人租賃量價大跌,"穗個人租賃量價大跌    【本報記者廣州十八日電】克而瑞近日發佈廣州租賃市場報告顯示，八月租房熱退散，個人租賃量價大幅下跌。個人租賃成交量基本處於去年同期水平，租金同比降8.75%，個人租賃市場消費力不及去年；分散式和集中式公寓租金企穩上漲，在畢業租房熱潮消退後，按照住房租賃市場周期性規律市場行情轉淡，租金或將逐步回調。    成交環比跌四分一    報告指出，八月全市個人租賃租金每平方米成交均價48元，環比漲8.11%，除南沙、白雲兩區整體租金微跌，其餘各區均保持相對穩定向上。八月全市個人租賃掛牌量為37,938間，環比跌2.58%，成交量15,750間，環比跌25.29%。成交量價持續上漲，在七月畢業租房熱潮攀頂後，個人租賃市場整體回落至正常水平。    八月全市個人租賃成交掛牌價比為84.39%，成交均價同環比下滑明顯，個人租賃市場整體表現消費力偏弱。    個人租賃各房型中，一房的掛牌成交均價遠高於其他房型，每平方米每月成交均價57元，三房的掛牌量最大，超過1.2萬套；二房的成交量最高接近去年同期水平，成交5,520套。    月租四千以內為主    從各租金段掛牌成交情況看，月租金2,000-4,000元為市場主力區間，成交量佔49.39%。從成交掛牌量比看，月租金2,000元以下最高達61.62%，去化流速好，在月租金1.2萬元以上的高端產品中去化流速有待提升。",http://www.macaodaily.com/html/2024-09/19/content_1782175.htm,成交環比跌四分一    報告指出，八月全市個人租賃租金每平方米成交均價48元，環比漲8.11%，除南沙、白雲兩區整體租金微跌，其餘各區均保持相對穩定向上,"穗個 人租賃 量價 大跌         【 本報 記者 廣州 十八日 電 】 克而瑞 近日 發 佈 廣州 租賃 市場 報告 顯示 ， 八月 租房 熱退 散 ， 個 人 租賃 量價 大幅 下跌 。 個 人 租賃 成交量 基本 處 於 去年同期 水平 ， 租金 同比 降 8.75% ， 個 人 租賃 市場 消費力 不及 去年 ； 分散式 和 集中式 公寓 租金 企穩 上 漲 ， 在 畢業 租房 熱潮 消退 後 ， 按照 住 房租 賃 市場 周期性 規律 市場 行情 轉淡 ， 租金 或將 逐步 回調 。         成交 環比跌 四分 一         報告 指出 ， 八月 全市 個 人 租賃 租金 每平方米 成交 均價 48 元 ， 環比漲 8.11% ， 除 南沙 、 白雲兩區 整體 租金 微跌 ， 其餘 各區 均 保持 相對 穩 定向 上 。 八月 全市 個 人 租賃 掛牌量 為 37 , 938 間 ， 環比跌 2.58% ， 成交量 15 , 750 間 ， 環比跌 25.29% 。 成交量 價持續 上 漲 ， 在 七月 畢業 租房 熱潮 攀頂 後 ， 個 人 租賃 市場 整體 回落 至 正常 水平 。         八月 全市 個 人 租賃 成交 掛牌 價比為 84.39% ， 成交 均 價同 環比 下滑 明顯 ， 個 人 租賃 市場 整體 表現 消費力 偏弱 。         個 人 租賃 各 房型 中 ， 一房 的 掛牌 成交 均 價遠 高 於 其他 房型 ， 每平方米 每月 成交 均價 57 元 ， 三房 的 掛牌量 最大 ， 超過 1.2 萬套 ； 二房 的 成交量 最高 接近 去年同期 水平 ， 成交 5 , 520 套 。         月租 四千 以內 為 主         從 各 租金 段掛 牌成 交情 況看 ， 月租金 2 , 000 - 4 , 000 元為 市場 主力 區間 ， 成交量 佔 49.39% 。 從 成交 掛牌量 比 看 ， 月租金 2 , 000 元 以下 最高 達 61.62% ， 去化 流速 好 ， 在 月租金 1.2 萬元 以上 的 高端 產品 中 去化 流速 有待 提升 。",2024-09-19
上月外資配置人幣資產意願穩,"上月外資配置人幣資產意願穩    【中新社北京十八日電】中國國家外匯管理局有關負責人十八日表示，八月份，企業、個人等非銀行部門跨境收支順差153億元（美元，下同）；境內主體購匯節奏回落、結匯需求穩中有升，銀行結售匯差額趨向均衡。在內外部環境持續改善下，近期外匯市場預期更平穩，市場交易保持理性有序。    該負責人稱，中國跨境資金流動更趨穩定，境內外匯供求基本平衡。外匯局當天公佈數據顯示，按美元計值，今年八月，銀行結匯1,902億元，售匯1,914億元。今年一至八月，銀行累計結匯14,385億元，累計售匯16,080億元。    該負責人還提到，中國外貿發展態勢持續向好，八月貨物貿易項下跨境資金淨流入環比增11%；境外機構繼續淨增持境內債券，外資配置人民幣資產意願保持穩定。此外，外商投資企業分紅派息季節性回落，關聯企業跨境融資趨於穩定。    “未來我國外匯市場將繼續保持平穩運行態勢。”該負責人表示，從內部看，中國經濟運行中的積極因素和有利條件不斷積累，經濟回升向好態勢將持續鞏固和增強。同時，中國外匯市場發展與改革持續推進，市場內在韌性提升，將繼續發揮穩定市場預期和交易的積極作用。    從外部看，隨着歐美等發達經濟體貨幣政策進入減息周期，國際金融市場環境有望進一步改善。",http://www.macaodaily.com/html/2024-09/19/content_1782176.htm,同時，中國外匯市場發展與改革持續推進，市場內在韌性提升，將繼續發揮穩定市場預期和交易的積極作用,"上 月 外資 配置 人幣 資產意 願穩         【 中新社 北京 十八日 電 】 中國國家 外匯 管理局 有關 負責人 十八日 表示 ， 八月份 ， 企業 、 個 人 等 非銀行 部門 跨境 收支 順差 153 億元 （ 美元 ， 下同 ） ； 境內 主體 購匯 節奏 回落 、 結匯 需求 穩中 有升 ， 銀行 結售匯 差額 趨向 均衡 。 在 內 外部 環境 持續 改善 下 ， 近期 外匯 市場 預期 更 平穩 ， 市場 交易 保持 理性 有序 。         該 負責 人稱 ， 中國 跨境 資金 流動 更 趨 穩定 ， 境內 外匯 供求 基本 平衡 。 外匯 局當 天公 佈 數據 顯示 ， 按 美元 計值 ， 今年 八月 ， 銀行 結匯 1 , 902 億元 ， 售匯 1 , 914 億元 。 今年 一至 八月 ， 銀行 累計 結匯 14 , 385 億元 ， 累計售匯 16 , 080 億元 。         該 負責 人還 提到 ， 中國 外貿 發展 態勢 持續 向 好 ， 八月 貨物 貿易 項下 跨境 資金淨 流入 環 比增 11% ； 境外 機構 繼續 淨 增持 境內 債券 ， 外資 配置 人民 幣資產 意願 保持 穩定 。 此外 ， 外商 投資 企業 分紅 派息 季節性 回落 ， 關聯 企業 跨境 融資趨 於 穩定 。         “ 未來 我國外 匯市場 將繼續 保持 平穩 運行 態勢 。 ” 該 負責人 表示 ， 從 內部 看 ， 中國 經濟 運行 中 的 積極 因素 和 有利 條件 不斷 積累 ， 經濟 回升 向 好 態勢 將持續 鞏固 和 增強 。 同時 ， 中國外 匯市場 發展 與 改革 持續 推進 ， 市場 內 在 韌性 提升 ， 將繼續 發揮 穩定 市場 預期 和 交易 的 積極 作用 。         從 外部 看 ， 隨着 歐美 等 發達 經濟體 貨幣 政策 進入 減息 周期 ， 國際 金融 市場 環境 有望 進 一步 改善 。",2024-09-19
