Title,Content,Link,Summary,Preprocessed_Content,Date
“澳琴情懷”計劃四萬五人參與,兩月成功組建逾千一旅行團    “澳琴情懷”計劃四萬五人參與    【本報消息】“澳琴情懷資助計劃”的推出吸引眾多澳門居民近期到橫琴旅遊觀光，據初步統計，自六月十五日正式出團以來，已成功組建一千一百多個旅行團，逾四萬五千名遊客參與，讓更多澳門居民感受澳琴融合發展生活工作環境，同時啟發業界開拓更多澳琴遊產品新路徑。    目前，橫琴已擁有多個商圈，融合娛樂、餐飲、住宿等多種業態，為遊客提供豐富的旅遊選擇。橫琴華發商都、澳門新街坊商圈等幾大商圈將於下半年投入使用，橫琴口岸廣場亦將有更多商戶入駐，進一步豐富澳琴“吃喝遊娛購”線路。隨着橫琴逐步實施分線管理、“團進團出”等政策，澳琴文旅生態不斷注入新活力，澳門豐富的旅遊資源與橫琴的生態資源、配套服務有機結合，讓澳琴文旅模式更加立體豐富。    “團進團出”促多元    自內地居民多次往返澳琴“團進團出”政策實施以來，澳琴旅遊元素和空間得到更好發揮和聯動，為內地旅客帶來遊覽澳琴新玩法、新體驗。自五月六日首發團至今，已有三十一家旅行社獲得“琴澳旅遊團”經辦資質認定，超過一千名內地遊客報團參加“琴澳旅遊團”多次往返澳琴旅遊消費。    有業界代表表示，“團進團出”提高內地居民來澳琴旅遊的吸引力，亦帶動客房餐飲景區等眾多產品更加豐富多元。兩地旅遊企業合作更加頻密，促進周邊的餐飲業、酒店業、零售業、運輸業等多行業協同發展，助力打造“旅遊+體育”“旅遊+會展”“旅遊+研學”“旅遊+婚慶”等多項旅遊線路。,http://www.macaodaily.com/html/2024-08/16/content_1775047.htm,兩月成功組建逾千一旅行團    “澳琴情懷”計劃四萬五人參與    【本報消息】“澳琴情懷資助計劃”的推出吸引眾多澳門居民近期到橫琴旅遊觀光，據初步統計，自六月十五日正式出團以來，已成功組建一千一百多個旅行團，逾四萬五千名遊客參與，讓更多澳門居民感受澳琴融合發展生活工作環境，同時啟發業界開拓更多澳琴遊產品新路徑,兩月 成功 組建 逾千一 旅行 團         “ 澳琴 情懷 ” 計劃 四萬五人 參 與         【 本報 消息 】 “ 澳琴情 懷資助 計劃 ” 的 推出 吸引 眾多 澳門 居民 近期 到 橫琴 旅遊 觀光 ， 據 初步 統計 ， 自 六月 十五日 正式 出團 以來 ， 已 成功 組建 一千一百 多個 旅行 團 ， 逾四萬 五千名 遊客 參 與 ， 讓 更 多 澳門 居民 感受 澳琴 融合 發展 生活 工作 環境 ， 同時 啟發業界 開拓 更 多 澳琴 遊產品 新路 徑 。         目前 ， 橫琴 已 擁有 多個 商圈 ， 融合 娛樂 、 餐飲 、 住宿 等 多 種業態 ， 為 遊客 提供 豐富 的 旅遊 選擇 。 橫琴華發 商都 、 澳門 新 街坊 商圈 等 幾大 商圈 將於 下半年 投入使用 ， 橫琴 口岸 廣場 亦 將有 更 多 商戶入 駐 ， 進 一步 豐富 澳琴 “ 吃喝 遊娛購 ” 線路 。 隨着 橫琴 逐步 實施 分線 管理 、 “ 團進 團出 ” 等 政策 ， 澳琴文 旅生態 不斷 注入 新 活力 ， 澳門 豐富 的 旅遊 資源 與 橫琴 的 生態 資源 、 配套 服務有 機結合 ， 讓 澳琴 文旅 模式 更加 立體 豐富 。         “ 團進 團出 ” 促 多元         自內 地 居民 多次 往返 澳琴 “ 團進 團出 ” 政策 實 施以 來 ， 澳琴 旅遊 元素 和 空間 得到 更好 發揮 和 聯動 ， 為 內 地 旅客 帶來 遊覽 澳琴 新 玩法 、 新體驗 。 自 五月 六日 首發團 至今 ， 已有 三十 一家 旅行社 獲得 “ 琴澳 旅遊團 ” 經辦 資質 認定 ， 超過 一千名 內地 遊客 報團 參加 “ 琴澳 旅遊團 ” 多次 往返 澳琴 旅遊 消費 。         有業界 代表 表示 ， “ 團進 團出 ” 提高 內地 居民 來 澳琴 旅遊 的 吸引力 ， 亦 帶動 客房 餐飲景區 等 眾多產品 更加 豐富 多元 。 兩地 旅遊 企業 合作 更加 頻密 ， 促進 周邊 的 餐 飲業 、 酒店 業 、 零售 業 、 運輸業 等 多行 業協同 發展 ， 助力 打造 “ 旅遊 + 體育 ” “ 旅遊 + 會展 ” “ 旅遊 + 研學 ” “ 旅遊 + 婚慶 ” 等 多項 旅遊線 路 。,2024-08-16
(新聞小語)警惕毒品偽裝共築防線   夏耘,警惕毒品偽裝共築防線    司警近日破獲一宗涉及大麻加工食品的販毒案件，一名香港男子涉嫌將大麻偷運來澳，加工成曲奇餅在夜場暗中出售，隱秘犯罪已持續約兩月。該宗案件不僅揭示了毒品犯罪的新動向，也反映毒品加工成食品後的隱蔽性，增加了偵查及監管難度。居民尤其是青年群體必須提高警惕，嚴防各類毒品的侵害。    隨着部分國家和地區將大麻合法化，大麻及其衍生產品漸增，包括“大麻餅乾”。在澳門，法律對大麻及其衍生品維持高壓，帶運、販賣及製造均屬嚴重犯罪。立法會近日通過修改“禁毒法”，進一步把五類國際列管物質包括合成大麻素類物質納入規管，彰顯了對毒品零容忍。    大麻餅乾潛藏的危害不容小覷。大麻含有的複雜化學成份，長期或大量吸食可能損害腦部和中樞神經系統，影響記憶力、注意力，甚至可能導致精神健康問題。更令人擔憂的是，隨着化學合成技術的發展，毒品種類不斷擴展，新型毒品形態各異、五花八門，販毒人員為了去除人們對傳統毒品如冰毒、麻古、搖頭丸的戒心，把新型毒品加工成“奶茶”、“咖啡”等飲料及香煙，又或在電子煙裡“加料”，稱之為“神仙水”、“止咳水”、“彩虹煙”等，糖衣包裝，招搖過市，令人防不勝防。新型毒品高度偽裝和隱蔽，執法部門難監管，青少群體易中招。    廣大居民一定要保持清醒頭腦，警惕毒禍，加強自身防範，堅決向毒品說不，特別是青少年切勿被蠱惑，走出涉毒的危險一步。居民尤其青年在娛樂消遣時，必須加強自我保護意識，勿被酒精麻痺心性，更不要輕信陌生人提供的食品和飲料，遠離可能含有毒品的物品。若發現可疑情況，應適時離場並報案。政府宜加強對夜場的管理，提高從業人員的法律意識和職業道德，防止類似事件的發生。共同築起防線，抵禦毒品的侵害，守護每一個生命的美好未來。    夏耘,http://www.macaodaily.com/html/2024-08/16/content_1775048.htm,警惕毒品偽裝共築防線    司警近日破獲一宗涉及大麻加工食品的販毒案件，一名香港男子涉嫌將大麻偷運來澳，加工成曲奇餅在夜場暗中出售，隱秘犯罪已持續約兩月,警惕 毒品 偽裝共築 防線         司警 近日 破獲 一宗 涉及 大麻 加工 食品 的 販毒 案件 ， 一名 香港 男子 涉嫌 將 大麻 偷運來 澳 ， 加工 成 曲奇 餅在 夜場 暗中 出售 ， 隱秘 犯罪 已持續 約 兩 月 。 該宗 案件 不僅 揭示 了 毒品 犯罪 的 新動 向 ， 也 反映 毒品 加工 成 食品 後 的 隱蔽性 ， 增加 了 偵查 及 監管 難度 。 居民 尤其 是 青年 群體 必須 提高警惕 ， 嚴防 各類 毒品 的 侵害 。         隨着 部分 國家 和 地區將 大麻 合法化 ， 大麻 及其 衍生 產品 漸增 ， 包括 “ 大麻 餅乾 ” 。 在 澳門 ， 法律 對 大麻 及其 衍生品 維持 高壓 ， 帶運 、 販賣 及 製 造 均 屬 嚴 重 犯罪 。 立法 會 近日 通過 修改 “ 禁毒 法 ” ， 進 一步 把 五類 國際 列管 物質 包括 合成 大麻 素類 物質 納入 規管 ， 彰顯 了 對 毒品 零 容忍 。         大麻 餅乾 潛藏 的 危害 不容 小覷 。 大麻 含有 的 複 雜化學 成份 ， 長 期 或 大量 吸食 可能 損害 腦部 和 中樞神 經系統 ， 影響 記憶力 、 注意力 ， 甚至 可能 導致 精神 健康 問題 。 更 令人 擔憂 的 是 ， 隨着 化學 合成 技術 的 發展 ， 毒品 種類 不斷 擴展 ， 新型 毒品 形態 各異 、 五花 八門 ， 販毒 人員為 了 去除 人們 對 傳統 毒品 如 冰毒 、 麻古 、 搖頭 丸 的 戒心 ， 把 新型 毒品 加工 成 “ 奶茶 ” 、 “ 咖啡 ” 等 飲 料及 香煙 ， 又 或 在 電子 煙裡 “ 加料 ” ， 稱之為 “ 神仙 水 ” 、 “ 止咳水 ” 、 “ 彩虹 煙 ” 等 ， 糖衣 包裝 ， 招搖過 市 ， 令人 防不勝防 。 新型 毒品 高度 偽裝 和 隱蔽 ， 執法 部門 難 監管 ， 青少 群體易 中招 。         廣大 居民 一定 要 保持 清醒 頭腦 ， 警惕 毒禍 ， 加強 自身 防範 ， 堅決 向 毒品 說 不 ， 特別 是 青少年 切勿 被 蠱惑 ， 走出 涉毒 的 危險 一步 。 居民 尤其 青年 在 娛樂 消遣 時 ， 必須 加強 自我 保護 意識 ， 勿 被 酒精 麻痺 心性 ， 更 不要 輕信 陌生人 提供 的 食品 和 飲料 ， 遠離 可能 含有 毒品 的 物品 。 若 發現 可疑 情況 ， 應 適時 離場 並報案 。 政府 宜加強 對 夜場 的 管理 ， 提高 從業 人員 的 法律 意識 和 職業 道德 ， 防止 類似 事件 的 發生 。 共同 築起 防線 ， 抵禦 毒品 的 侵害 ， 守護 每 一個 生命 的 美好 未來 。         夏耘,2024-08-16
灣區青年深合區了解橫琴發展,參觀“1+4”多元化產業公司    灣區青年深合區了解橫琴發展    【本報消息】“大灣區青年新興交流計劃”活動前日起一連兩日於深合區開展，粵澳大學生昨日上午參觀深合區內的“1+4”多元化產業公司，了解橫琴發展現狀。下午分組創作藝術作品，在團隊合作中加深情誼，藉作品紀念這段經歷，為大灣區青年交流活動畫上圓滿句號。    交流團一行上午赴分子態中醫藥健康產業發展有限公司以及納金科技有限公司參觀，並在三一南方總部大廈參加橫琴青創政策分享會。橫琴粵澳深度合作區青年創業就業協會秘書長朱潤成出席本次分享會，詳細介紹橫琴對於創業者的支持政策和環境，提到澳門青年可同步享受粵澳兩地扶持政策，澳門青創企業可實現租金直接減免，激勵青年積極投身創業浪潮。青年結合自身發展情況，在會議中踴躍發言，朱潤成從經驗出發，為澳門青年解惑。    就讀於北京中醫藥大學的鄧同學受訪稱，參觀橫琴相關展館後，發現深合區的基礎建設和政策都很完善。作為中醫學專業的學生，未來粵澳中醫藥合作園區可能會成為個人的就業方向，期望橫琴未來可增建中醫院，以豐富澳門居民的醫療選擇。    下午，交流團分組創作藝術作品，通過實踐活動發揮創意才能。交流團青年代表贈送藝術作品給深合區民生事務局文化體育處的代理處長黎義，感謝民生事務局的支持。    澳門大學何同學表示，其是第一次來橫琴參觀，發現本地的民生措施完善，各種惠民政策、福利保證了民眾的幸福感。作為生物醫學專業的學生，他在本次活動中接觸生物科技產業的前沿技術，透過橫琴看到整個大灣區乃至全國高新科技產業如何發展，對自身未來道路更有自信。    對於本次活動，美高梅人力資源執行副總裁余婉瑩表示，粵港澳大灣區建設是國家重大戰略，橫琴粵澳深度合作區建設為澳門青年提供廣闊的舞台。美高梅以多元方式培育本地人才，是次交流計劃讓澳門青年掌握深合區的現況及未來，助他們拓闊視野，從而把握粵港澳大灣區發展機遇，更好融入國家發展大局。,http://www.macaodaily.com/html/2024-08/16/content_1775049.htm,參觀“1+4”多元化產業公司    灣區青年深合區了解橫琴發展    【本報消息】“大灣區青年新興交流計劃”活動前日起一連兩日於深合區開展，粵澳大學生昨日上午參觀深合區內的“1+4”多元化產業公司，了解橫琴發展現狀,參觀 “ 1 + 4 ” 多元化 產業 公司         灣區 青年 深合區 了解 橫琴 發展         【 本報 消息 】 “ 大灣區 青年 新興 交流 計劃 ” 活動 前日 起一連 兩日 於 深合區 開展 ， 粵澳大學生 昨日 上午 參觀 深合區 內 的 “ 1 + 4 ” 多元化 產業 公司 ， 了解 橫琴 發展 現狀 。 下午 分組 創作 藝術 作品 ， 在 團隊 合作 中加 深情 誼 ， 藉 作品 紀念 這段 經歷 ， 為 大灣區 青年 交流 活動畫 上 圓滿 句號 。         交流 團 一行 上午 赴 分子 態中 醫藥 健康 產業 發展 有限公司 以及 納金 科技 有限公司 參觀 ， 並在 三 一 南方 總部 大廈 參加 橫琴 青創 政策 分享 會 。 橫琴粵澳 深度 合作 區 青年 創業 就業 協會 秘書長 朱潤成 出席 本次 分享 會 ， 詳細介紹 橫琴 對 於 創業者 的 支持 政策 和 環境 ， 提到 澳門 青年 可 同步 享受 粵澳 兩地 扶持 政策 ， 澳門 青創 企業 可 實現 租金 直接 減免 ， 激勵 青年 積極 投身 創業 浪潮 。 青年 結合 自身 發展 情況 ， 在 會議 中 踴躍發言 ， 朱潤成 從 經驗 出發 ， 為 澳門 青年 解惑 。         就 讀 於 北京 中醫藥 大學 的 鄧同 學受 訪稱 ， 參觀 橫琴 相關 展館 後 ， 發現 深合區 的 基礎 建設 和 政策 都 很 完善 。 作為 中 醫學 專業 的 學生 ， 未來 粵澳中 醫藥 合作 園區 可能 會成 為 個 人 的 就業 方向 ， 期望 橫琴 未來 可 增建 中醫院 ， 以豐富 澳門 居民 的 醫療 選擇 。         下午 ， 交流 團分組 創作 藝術 作品 ， 通過 實踐 活動 發揮 創意 才能 。 交流 團 青年 代表 贈送 藝術 作品 給深 合區 民生 事務局 文化 體育 處 的 代理 處長 黎義 ， 感謝 民生 事務局 的 支持 。         澳門 大學何 同學 表示 ， 其是 第一次 來 橫琴 參觀 ， 發現 本地 的 民生 措施 完善 ， 各種 惠民 政策 、 福利 保證 了 民眾 的 幸福感 。 作為 生物 醫學 專業 的 學生 ， 他 在 本次 活動 中 接觸 生物科技 產業 的 前沿 技術 ， 透過 橫琴 看到 整個 大灣區 乃至 全國 高新科技 產業 如何 發展 ， 對 自身 未來 道路 更 有 自信 。         對 於 本次 活動 ， 美高梅 人力 資源 執行 副 總裁 余婉瑩 表示 ， 粵 港澳 大灣區 建設 是 國家 重大 戰略 ， 橫琴粵澳 深度 合作 區建設 為 澳門 青年 提供 廣闊 的 舞台 。 美高梅 以 多元 方式 培育 本地 人才 ， 是 次 交流 計劃 讓 澳門 青年 掌握 深合區 的 現況 及 未來 ， 助 他們 拓闊 視野 ， 從 而 把握 粵 港澳 大灣區 發展 機遇 ， 更好 融入 國家 發展 大局 。,2024-08-16
今明持續驟雨雷暴,今明持續驟雨雷暴    【本報消息】氣象局預測今明兩日天氣不穩，持續有驟雨及雷暴，間中雨勢有時頗大，居民應留意最新天氣資訊，適時做好預防措施。    受一道低壓槽影響，氣象局料今日多雲有雨，氣溫攝氏廿四至廿八度，相對濕度百分之八十至九十九，吹三至四級西南風及有陣風，最高紫外線指數約為三，級別屬於中等。空氣質量方面，路邊監測站指數二十五至四十五，高密度住宅區及一般性監測站二十至四十，水平均為良好。    本澳昨日氣溫攝氏二十四至二十八度，相對濕度百分之八十九至九十九，吹二至四級西南風及有陣風。天氣不穩，天色多雲，間中有驟雨及雨勢有時頗大，間中有雷暴。    展望明日天氣不穩定，多雲，有驟雨及初時雨勢有時頗大，間中有雷暴，吹三至四級西南風及有陣風。氣溫攝氏二十四至二十九度，相對濕度百分之八十至九十九。,http://www.macaodaily.com/html/2024-08/16/content_1775050.htm,受一道低壓槽影響，氣象局料今日多雲有雨，氣溫攝氏廿四至廿八度，相對濕度百分之八十至九十九，吹三至四級西南風及有陣風，最高紫外線指數約為三，級別屬於中等,今明 持續 驟雨 雷暴         【 本報 消息 】 氣象局 預測 今明 兩日 天氣 不穩 ， 持續 有 驟雨及 雷暴 ， 間 中雨 勢有 時 頗 大 ， 居民 應 留意 最新 天氣 資訊 ， 適時 做好 預防 措施 。         受 一道 低壓 槽 影響 ， 氣象 局料 今日 多雲有 雨 ， 氣溫 攝氏 廿四 至 廿八 度 ， 相對 濕度 百分之八十 至 九十九 ， 吹三至 四級 西南 風及 有 陣風 ， 最高 紫外 線 指數 約 為 三 ， 級 別屬 於 中等 。 空氣 質量 方面 ， 路邊 監測 站 指數 二十五 至 四十五 ， 高密度 住宅 區及 一般性 監測 站 二十 至 四十 ， 水平 均 為 良好 。         本澳 昨日 氣溫 攝氏 二十四 至 二十八 度 ， 相對 濕度 百分之八十 九至 九十九 ， 吹二至 四級 西南 風及 有 陣風 。 天氣 不穩 ， 天色 多 雲 ， 間 中 有 驟雨及 雨勢 有 時 頗 大 ， 間 中 有 雷暴 。         展望 明日 天氣 不 穩定 ， 多 雲 ， 有 驟雨及 初 時雨勢 有 時 頗 大 ， 間 中 有 雷暴 ， 吹三至 四級 西南 風及 有 陣風 。 氣溫 攝氏 二十四 至 二十九 度 ， 相對 濕度 百分之八十 至 九十九 。,2024-08-16
Q4推全城消費獎賞  料2.2萬企參與,Q4推全城消費獎賞  料2.2萬企參與    【本報消息】政府早前透露計劃把剛結束的“周末北區消費大獎賞”活動擴大規模。經濟及科技發展局長戴建業昨表示，活動達局方預期成效，現正積極籌備把活動延伸至全澳各區舉行，估計將吸引2.2萬家中小企參與，料第四季可落實推出。    戴建業表示，目前局方正與相關商會及機構協商，並與八家支付機構溝通操作事宜。考慮到居民已習慣相關活動模式，在北區先導計劃進行期間亦較為順暢，預計即將推出的同類型活動，會沿用“周一至周五透過消費領券，周末核銷使用”的模式。    數字轉型增至九百名額    除推出促進消費的措施，局方還在北區推出其他措施，以改善及提升該區的消費氛圍。現時正籌備於九月更新“花薈北區”打卡裝置設計，配合北區逛吃打卡路線，帶動人流深入社區玩樂消費。    另外，會配合其他措施，支援中小企革新經營。例如今年計劃支援900家中小企數字化轉型，較原計劃增加約300個名額，長遠提升企業經營能力。,http://www.macaodaily.com/html/2024-08/16/content_1775051.htm,經濟及科技發展局長戴建業昨表示，活動達局方預期成效，現正積極籌備把活動延伸至全澳各區舉行，估計將吸引2.2萬家中小企參與，料第四季可落實推出,Q4 推 全城 消費 獎賞     料 2.2 萬企參 與         【 本報 消息 】 政府 早前 透露 計劃 把 剛結束 的 “ 周末 北區 消費 大獎賞 ” 活動 擴大規模 。 經濟 及 科技 發展 局長 戴建業 昨 表示 ， 活動 達 局方 預期 成效 ， 現正積 極籌備 把 活動 延伸 至 全澳 各區 舉行 ， 估計將 吸引 2.2 萬 家中 小企參 與 ， 料 第四季 可落實 推出 。         戴建業 表示 ， 目前 局方 正 與 相關 商會 及 機構 協商 ， 並與 八家 支付 機構 溝通 操作 事宜 。 考慮 到 居民 已習慣 相關 活動 模式 ， 在 北區 先導 計劃 進 行期 間 亦 較 為 順暢 ， 預計 即將 推出 的 同類 型 活動 ， 會 沿用 “ 周一 至 周五 透過 消費 領券 ， 周末 核銷 使用 ” 的 模式 。         數字 轉型 增至 九百 名額         除 推出 促進 消費 的 措施 ， 局方 還在 北區 推出 其他 措施 ， 以 改善 及 提升 該區 的 消費 氛圍 。 現時 正籌備 於 九月 更新 “ 花薈北區 ” 打卡 裝置 設計 ， 配合 北區 逛 吃 打卡 路線 ， 帶動 人流 深入 社區 玩樂 消費 。         另外 ， 會 配合 其他 措施 ， 支援 中小 企 革新 經營 。 例如 今年 計劃 支援 900 家中 小企數 字化 轉型 ， 較 原計劃 增加 約 300 個 名額 ， 長 遠 提升 企業 經營 能力 。,2024-08-16
