Title,Content,Link,Summary,Preprocessed_Content,Date
我國進口規模世界第二,我國進口規模世界第二    中國海關總署新聞發言人、統計分析司司長呂大良三十日在國新辦發佈會上表示，從海關統計資料看，我國擴大進口取得了突出成效。下一步，中國還將穩妥有序擴大農食產品市場准入。    關稅水平降至7.3%    據介紹，我國進口整體規模多年穩居世界第二，由二○一二年的十一點四九萬億元增長到二○二三年的十七點九九萬億元。消費市場空間日益擴大，帶動消費品累計進口超過了十六萬億元。二○二三年，我國進口來源地覆蓋全球二百多個國家和地區，自最不發達國家進口的農產品和機電產品等，較二○一二年成倍增長。    “我國連續六年舉辦了中國國際進口博覽會，充分彰顯了中國與世界分享發展紅利的決心。”呂大良指出，中國有序擴大市場准入，在科學評估的基礎上，准許了四百七十七種優質農產品輸華。擴大對最不發達國家單邊開放，帶動相關國家共同發展。主動降低關稅，關稅總水平目前已經降至百分之七點三，接近發達國家的平均水平。    呂大良表示，下一步，中國還將穩妥有序擴大農食產品市場准入，創新檢驗檢疫模式，擴大“先放後檢”、第三方採信等試點範圍，為擴大進口提供更優的通關監管和服務，讓中國的大市場成為世界的大機遇。    外貿增長面臨挑戰    另外，針對中國外貿總體形勢，呂大良同時表示，上半年中國外貿經營主體活力充足，傳統動能優勢穩固，新動能也不斷湧現。這與宏觀政策加力推進、外部需求改善等因素有關。但他同時也坦言，當前外部環境複雜性、嚴峻性、不確定性上升，地緣政治風險較高，部分國家推行單邊主義、保護主義，對全球產供鏈造成的干擾也逐步顯現。    此外，紅海危機等導致航運堵塞、運費上漲，進一步增加了企業的成本壓力，下半年外貿保持增長還面臨不少挑戰。    對此，呂大良表示，海關將密切跟蹤形勢變化，加強資料監測分析，做好新一輪通關政策儲備和供給，助力企業減負降本，全力服務外貿質升量穩。    據官方資料統計，今年上半年中國貨物貿易進出口規模歷史同期首超廿一萬億元，同比增長百分之六點一。,http://www.macaodaily.com/html/2024-07/31/content_1771665.htm,呂大良表示，下一步，中國還將穩妥有序擴大農食產品市場准入，創新檢驗檢疫模式，擴大“先放後檢”、第三方採信等試點範圍，為擴大進口提供更優的通關監管和服務，讓中國的大市場成為世界的大機遇,我國 進口 規模 世界 第二         中國海關 總署 新聞 發言人 、 統計 分析 司司 長 呂大良 三十日 在 國新 辦發 佈 會 上 表示 ， 從海關 統計 資料 看 ， 我國 擴大 進口 取得 了 突出 成效 。 下 一步 ， 中國 還將 穩妥 有序 擴大農食 產品 市場 准入 。         關稅 水平 降至 7.3%         據介紹 ， 我國 進口 整體 規模 多年 穩居 世界 第二 ， 由 二 ○ 一二年 的 十一 點 四九 萬億元 增長 到 二 ○ 二三年 的 十七 點 九九 萬億元 。 消費 市場 空間 日益 擴大 ， 帶動 消費品 累計 進口 超過 了 十六 萬億元 。 二 ○ 二三年 ， 我國 進口 來 源地 覆蓋 全球 二百多 個國家 和 地區 ， 自 最 不 發達國家 進口 的 農產品 和 機電產品 等 ， 較 二 ○ 一二年 成 倍增 長 。         “ 我國 連續 六年 舉辦 了 中國國際 進口 博覽會 ， 充分 彰顯 了 中國 與 世界 分享 發展 紅利 的 決心 。 ” 呂大良 指出 ， 中國 有序 擴大市場 准入 ， 在 科學 評估 的 基礎 上 ， 准許 了 四百 七十七 種優質 農產品 輸華 。 擴大 對 最 不 發達國家 單邊 開放 ， 帶動 相關 國家 共同 發展 。 主動 降低 關稅 ， 關稅 總 水平 目前 已經降 至 百分之七 點三 ， 接近 發達國家 的 平均水平 。         呂大良 表示 ， 下 一步 ， 中國 還將 穩妥 有序 擴大農食 產品 市場 准入 ， 創新 檢驗 檢疫 模式 ， 擴大 “ 先放後檢 ” 、 第三方 採信 等 試點 範圍 ， 為 擴大 進口 提供 更優 的 通關 監管 和服 務 ， 讓 中國 的 大 市場 成為 世界 的 大機遇 。         外貿 增長 面臨 挑戰         另外 ， 針對 中國 外貿 總體 形勢 ， 呂大良 同時 表示 ， 上半年 中國外 貿經 營主體 活力 充足 ， 傳統 動能 優勢 穩固 ， 新動 能 也 不斷 湧現 。 這與宏觀 政策 加力 推進 、 外部 需求 改善 等 因素 有關 。 但 他 同時 也 坦言 ， 當前 外部 環境 複 雜性 、 嚴峻性 、 不確 定性 上升 ， 地緣 政治 風險 較 高 ， 部分 國家 推行 單邊 主義 、 保護 主義 ， 對 全球 產供 鏈 造成 的 干擾 也 逐步 顯現 。         此外 ， 紅海 危機 等 導致 航運 堵塞 、 運費 上 漲 ， 進 一步 增加 了 企業 的 成本 壓力 ， 下半年 外貿 保持 增長 還面 臨 不少 挑戰 。         對此 ， 呂大良 表示 ， 海關將 密切 跟 蹤 形 勢 變 化 ， 加強 資料 監測 分析 ， 做好 新一輪 通關 政策 儲備 和 供給 ， 助力 企業 減負 降本 ， 全力 服務外 貿質 升量 穩 。         據 官方 資料 統計 ， 今年 上半年 中國 貨物 貿易進 出口 規模 歷史 同期 首超 廿一 萬億元 ， 同比 增長 百分之六 點一 。,2024-07-31
結束訪問,結束訪問    當地時間七月三十日，執行遠海實習出訪任務的中國海軍艦艇編隊結束為期四天的友好訪問，駛離符拉迪沃斯托克港。（新華社）,http://www.macaodaily.com/html/2024-07/31/content_1771666.htm,結束訪問    當地時間七月三十日，執行遠海實習出訪任務的中國海軍艦艇編隊結束為期四天的友好訪問，駛離符拉迪沃斯托克港,結束 訪問         當地 時間 七月 三十日 ， 執行 遠海 實習 出訪 任務 的 中國海 軍艦艇 編隊 結束 為期 四天 的 友好 訪問 ， 駛離 符拉迪沃斯托克 港 。 （ 新華社 ）,2024-07-31
中方促日履約盡責,日遺華化武銷毀嚴重滯後    中方促日履約盡責    【中新社北京三十日電】中國外交部發言人林劍七月三十日在例行記者會上表示，日本遺棄在華化學武器銷毀進程總體嚴重滯後，中方強烈敦促日方切實履約盡責，全面、完整、準確落實有關銷毀計劃。    有記者提問，今天（七月三十日）是《中華人民共和國政府和日本國政府關於銷毀中國境內日本遺棄化學武器的備忘錄》簽署廿五周年紀念日，發言人能否介紹相關工作進展以及中方關切？    林劍表示，日本遺棄在華化學武器是日本軍國主義在侵華戰爭期間犯下的嚴重罪行之一。時至今日，仍對中國人民的生命財產安全和生態環境安全造成嚴重威脅。中方高度重視日遺化武問題，一直敦促日方按照《禁止化學武器公約》和中日政府間諒解備忘錄規定，早日安全乾淨徹底銷毀日遺化武。    他說，在中方大力協助下，日方迄已挖掘回收了日遺化武約十三萬枚，銷毀近十萬枚。但由於日方投入不充分不平衡，日遺化武銷毀進程總體仍嚴重滯後，銷毀計劃已四次逾期，部分重點難點問題始終未能解決，銷毀進度受到嚴重掣肘和干擾。    林劍還強調，清除日遺化武毒害是日方不容推卸的歷史、政治和法律責任。中方強烈敦促日方嚴肅對待中方關切，切實履約盡責，全方位加大投入，全力加快日遺化武處置進程，全面、完整、準確落實有關銷毀計劃，早日還中國人民以淨土。,http://www.macaodaily.com/html/2024-07/31/content_1771667.htm,日遺華化武銷毀嚴重滯後    中方促日履約盡責    【中新社北京三十日電】中國外交部發言人林劍七月三十日在例行記者會上表示，日本遺棄在華化學武器銷毀進程總體嚴重滯後，中方強烈敦促日方切實履約盡責，全面、完整、準確落實有關銷毀計劃,日 遺華 化武 銷毀 嚴重 滯 後         中方 促日 履約 盡責         【 中新社 北京 三十日 電 】 中國 外交部 發言人林 劍 七月 三十日 在 例行 記者 會 上 表示 ， 日本 遺棄 在 華化學 武器 銷毀 進程 總體 嚴重 滯 後 ， 中方 強烈 敦促 日方 切實 履約 盡責 ， 全面 、 完整 、 準確 落實 有 關銷 毀計劃 。         有 記者 提問 ， 今天 （ 七月 三十日 ） 是 《 中華 人民 共和 國 政府 和 日本 國 政府 關於銷毀 中國境 內 日本 遺棄 化學 武器 的 備忘錄 》 簽署 廿五 周年 紀念 日 ， 發言人 能否 介紹 相關 工作 進展 以及 中方 關切 ？         林劍 表示 ， 日本 遺棄 在 華化學 武器 是 日本 軍國 主義在 侵華戰爭 期間 犯下 的 嚴重 罪行 之一 。 時至 今日 ， 仍 對 中國 人民 的 生命 財產 安全 和 生態 環境 安全 造成 嚴重 威脅 。 中方 高度 重視 日 遺 化武 問題 ， 一直 敦促 日方 按照 《 禁止 化學 武器 公約 》 和 中日 政府 間諒 解備 忘錄 規定 ， 早日 安全 乾淨 徹底 銷毀 日 遺 化武 。         他 說 ， 在 中方 大力 協助 下 ， 日方 迄已 挖掘 回收 了 日 遺 化武 約 十三 萬枚 ， 銷毀 近十萬枚 。 但 由 於 日方 投入 不 充分 不 平衡 ， 日 遺 化武 銷毀 進程 總體 仍 嚴重 滯 後 ， 銷毀 計劃 已 四次 逾期 ， 部分 重點 難點 問題 始終 未能 解決 ， 銷毀 進度 受到 嚴重 掣肘 和 干擾 。         林劍 還強 調 ， 清除 日 遺 化武 毒害 是 日方 不容 推卸 的 歷史 、 政治 和 法律 責任 。 中方 強烈 敦促 日方 嚴肅 對 待 中方 關切 ， 切實 履約 盡責 ， 全方位 加大 投入 ， 全力 加快 日 遺 化武 處置 進程 ， 全面 、 完整 、 準確 落實 有 關銷 毀計劃 ， 早日 還中國 人民 以淨土 。,2024-07-31
華：加劇核擴散核衝突風險,美日召開“延伸威懾”首次部長會議    華：加劇核擴散核衝突風險    【中新社北京三十日電】中國外交部發言人林劍七月三十日在例行記者會上表示，中方奉勸美日摒棄冷戰思維，切實降低核武器在國家和集體安全政策中的作用。    有記者提問，據報道，日美外長防長“2+2”會議廿八日在東京舉行並發表聯合聲明稱，對中國持續快速擴展核武庫表示擔憂。雙方同時召開“延伸威懾”首次部長會議，向國際社會彰顯雙方共享美國“核保護傘”的重要性。美防長奧斯汀還強調，“延伸威懾”是美日同盟的核心。中方對此有何回應？    “中方注意到有關報道，對此表示嚴重關切。”林劍表示，中國奉行不首先使用核武器政策，堅持自衛防禦核戰略，始終將自身核力量維持在國家安全需要的最低水平，不與任何人搞軍備競賽。任何國家只要不對中國使用或威脅使用核武器，就不會受到中國核武器的威脅。    林劍說，“延伸威懾”是冷戰產物，美日強化核威懾合作將刺激地區緊張局勢，加劇核擴散與核衝突風險。日本長期以核爆受害國自居，宣揚建立無核武器世界，實際上卻享受美國的“核保護傘”，強化“延伸威懾”，謀求所謂“核遏制力”。日方有必要就其言行不一給全世界一個交代。    他稱，中方奉勸美日摒棄冷戰思維，切實降低核武器在國家和集體安全政策中的作用，以實際行動促進戰略穩定，維護地區和平與安全。我們敦促日方反躬自省戰略安全政策，切實履行《不擴散核武器條約》規定的無核武器國家義務，遵守“無核三原則”承諾，不以任何形式尋求核武器。,http://www.macaodaily.com/html/2024-07/31/content_1771668.htm,美日召開“延伸威懾”首次部長會議    華：加劇核擴散核衝突風險    【中新社北京三十日電】中國外交部發言人林劍七月三十日在例行記者會上表示，中方奉勸美日摒棄冷戰思維，切實降低核武器在國家和集體安全政策中的作用,美日 召開 “ 延伸 威懾 ” 首次 部長 會議         華 ： 加劇 核 擴散 核衝 突風險         【 中新社 北京 三十日 電 】 中國 外交部 發言人林 劍 七月 三十日 在 例行 記者 會 上 表示 ， 中方 奉 勸 美日 摒棄 冷戰思維 ， 切實 降低 核武器 在 國家 和 集體 安全 政策 中 的 作用 。         有 記者 提問 ， 據 報道 ， 日美 外長 防長 “ 2 + 2 ” 會議 廿八日 在 東京 舉行 並發表 聯合聲 明稱 ， 對 中國 持續 快速 擴展 核武 庫 表示 擔憂 。 雙方 同時 召開 “ 延伸 威懾 ” 首次 部長 會議 ， 向國際 社會彰 顯雙方 共享 美國 “ 核保護傘 ” 的 重要性 。 美防長 奧 斯汀 還強 調 ， “ 延伸 威懾 ” 是 美日 同盟 的 核心 。 中方 對此 有何 回應 ？         “ 中方 注意 到 有 關報 道 ， 對此 表示 嚴重 關切 。 ” 林劍 表示 ， 中國 奉行 不 首先 使用 核武器 政策 ， 堅持 自衛防禦 核戰略 ， 始 終將 自身 核力量 維持 在 國家 安全 需要 的 最低水平 ， 不 與 任何人 搞 軍備 競賽 。 任何 國家 只要 不 對 中國 使用 或 威脅 使用 核武器 ， 就 不會 受到 中國 核武器 的 威脅 。         林劍 說 ， “ 延伸 威懾 ” 是 冷戰產物 ， 美日 強化 核威懾 合作 將 刺激 地區 緊張 局勢 ， 加劇 核 擴散 與 核衝 突風險 。 日本 長 期以 核爆 受害 國 自居 ， 宣揚 建立 無 核武器 世界 ， 實際 上 卻 享受 美國 的 “ 核保護傘 ” ， 強化 “ 延伸 威懾 ” ， 謀求 所謂 “ 核 遏制 力 ” 。 日方 有 必要 就 其 言行不一 給 全世界 一個 交代 。         他稱 ， 中方 奉 勸 美日 摒棄 冷戰思維 ， 切實 降低 核武器 在 國家 和 集體 安全 政策 中 的 作用 ， 以實際 行動 促進 戰略 穩定 ， 維護 地區 和平 與 安全 。 我們 敦促 日方 反躬自省 戰略 安全 政策 ， 切實 履行 《 不 擴散 核武器 條約 》 規定 的 無 核武器 國家義務 ， 遵守 “ 無核 三原 則 ” 承諾 ， 不 以 任何 形式 尋求 核武器 。,2024-07-31
湘三人查看山洪遇難,湘三人查看山洪遇難    【本報綜合報道】據新華社長沙三十日電：記者三十日從湖南省永興縣應急管理局獲悉，受颱風“格美”影響，永興縣近日洪災導致三人死亡。    據了解，廿七日六時，永興縣大布江鄉東坑村驟降暴雨，引發山洪，鄉村道路、電力、通信等中斷。應村民請求，該村鄭家組組長帶領兩名村民進山查看山洪水勢。當日十一時許，村民向鄉村幹部反映三人失聯。    接報後，永興縣、鄉兩級組織應急、公安、消防、衛健等部門三十餘人趕赴東坑村搜救。廿九日上午，已分別找到三名失聯人員遺體。    京首發洪水預警    記者三十日從北京市氣象台獲悉，三十日○時至十八時，全市平均降水量八十點一毫米，達暴雨量級。北京發佈今年首個洪水預警。    根據氣象規定，每小時降雨量十六毫米以上、或連續十二小時降雨量三十毫米以上、廿四小時降水量為五十毫米或以上的雨稱為“暴雨”。    三十日下午，北京升級發佈防洪排澇Ⅲ級應急響應，發佈暴雨黃色預警、山洪災害橙色預警、地質災害氣象風險橙色預警、積水內澇黃色預警，提示民眾遠離山洪溝道，暫停涉山涉水戶外活動，防範山洪災害，科學避險轉移。,http://www.macaodaily.com/html/2024-07/31/content_1771669.htm,三十日下午，北京升級發佈防洪排澇Ⅲ級應急響應，發佈暴雨黃色預警、山洪災害橙色預警、地質災害氣象風險橙色預警、積水內澇黃色預警，提示民眾遠離山洪溝道，暫停涉山涉水戶外活動，防範山洪災害，科學避險轉移,湘三人 查看 山洪 遇難         【 本報 綜合 報道 】 據 新華 社長 沙 三十日 電 ： 記者 三十日 從 湖南省 永興縣 應急 管理局 獲悉 ， 受 颱 風 “ 格美 ” 影響 ， 永興縣 近日 洪災導致 三人 死亡 。         據 了解 ， 廿七日 六時 ， 永興縣 大布 江鄉 東坑 村驟 降 暴雨 ， 引發 山洪 ， 鄉村 道路 、 電力 、 通信 等 中斷 。 應 村民 請求 ， 該村 鄭家 組組長 帶領 兩名 村民 進山 查看 山 洪水 勢 。 當日 十一 時許 ， 村民 向 鄉村 幹部 反映 三人 失聯 。         接報 後 ， 永興縣 、 鄉 兩級 組織 應急 、 公安 、 消防 、 衛健 等 部門 三十 餘人 趕 赴 東坑 村 搜救 。 廿九日 上午 ， 已分別 找到 三名 失聯人員 遺體 。         京首發 洪水 預警         記者 三十日 從 北京市 氣象 台 獲悉 ， 三十日 ○ 時至 十八 時 ， 全市 平均 降水量 八十 點一 毫米 ， 達 暴雨 量級 。 北京 發 佈 今年 首個 洪水 預警 。         根據 氣象 規定 ， 每小時 降雨量 十六 毫米 以上 、 或 連續 十二 小時 降雨量 三十 毫米 以上 、 廿四 小時 降水量 為 五十 毫米 或 以上 的 雨 稱 為 “ 暴雨 ” 。         三十日 下午 ， 北京 升級 發 佈 防洪 排澇 Ⅲ 級 應急響 應 ， 發 佈 暴雨 黃 色 預警 、 山洪 災害 橙色 預警 、 地質 災害 氣象 風險 橙色 預警 、 積水內 澇黃色 預警 ， 提示 民眾 遠離 山洪 溝道 ， 暫停 涉山 涉水 戶外 活動 ， 防範 山洪 災害 ， 科學 避險 轉移 。,2024-07-31
