Title,Content,Link,Summary,Preprocessed_Content,Date
粵港澳單車賽成創舉,十五運全流程測試效果理想    粵港澳單車賽成創舉    【本報消息】二○二四粵港澳公路自行車賽暨第十五屆全國運動會公路自行車測試賽昨日成功舉行。賽事經港珠澳大橋跨越粵港澳三地，為明年十一月舉辦的十五運會該項賽事進行全流程測試，效果大致理想。    內蒙選手郝然奪標    賽事最終衝線時由內蒙古隊的郝然、山東隊的苗城碩、天津隊的王瑞東分別奪得冠亞季軍。奪冠的內蒙古選手郝然賽後分享時表示，能夠在作為世紀工程的跨海大橋上比賽，機會難得，感覺也很震撼，但似乎自己的實力提前暴露了，恐怕以後比賽可能會被盯防。    跨三地二百三公里    比賽昨日上午九時從珠海博物館集結出發，來自內地及港澳的二十二支代表隊和一支個人代表隊合共六十七名專業運動員，展開一場跨越珠海、香港、澳門三地，全程約二百三十公里的激烈角逐。其中，珠海段一百六十點七公里，香港段五十五點八公里，澳門段約十三點五公里。選手昨日上午九時二十分通過港珠澳大橋人工島，進入本澳時開始下雨，途經澳門大橋、北安大馬路，在北安碼頭折返澳門大橋後途經港珠澳大橋人工島，路面濕滑但車速未減，部分車手嘗試領放，隨後續前往香港及珠海完成餘下路段的比賽。    提前做好溝通協調    今次賽事是全國首次貫穿三地的體育賽事，亦是明年十一月由粵港澳共同承辦的第十五屆全運會中公路自行車男子個人賽的測試賽，旨在提前做好各方面的溝通、協調和測試。明年公路自行車男子個人賽將首次利用港珠澳大橋作為賽道連通三地，且是十五運會中唯一跨越粵港澳三地的比賽項目。    本次測試賽透過全流程測試，全面檢驗比賽路線、快速通關及粵港澳三地間的協同運作及應急處理能力。透過此次測試，進一步優化賽事的競賽組織、安全保障、交通管理、醫療救援、志願者服務等各項籌備工作。本次賽事由十五運會及殘特奧委會澳門賽區籌備辦公室邀請中國澳門單車總會參與相關工作，澳門賽區志願者亦積極參與，共同努力保障賽事順暢舉行，為明年十五運會公路自行車賽的舉行做好準備。    人員物料通關暢順    第十五屆全運會珠海賽區執委會辦公室副主任、市文化廣電旅遊體育局副局長袁熊表示，是次賽事測試效果理想，無論是粵港澳三地協調、賽事銜接、安保溝通，還是選手、裁判及保障物料的通關都相當暢順。賽後各部門及所有環節還會全面總結檢討，為明年的賽事舉辦做好精細準備。    澳選手高興本地作賽    本澳三名單車運動員參賽，其中，甘展博獲第三十名、崔慶華居五十三名，鄭丞睎則因機械故障未能完成賽程。    崔慶華稱，多謝有機會參加此次比賽。自己已四十二歲，是所有選手中年紀最大，體力肯定不及年輕人，但可以在自己家門口作賽是寶貴經驗，感覺非常開心，成績也算滿意。希望明年還可以參加正賽，樂意以老帶新，但若成績不達標，也會讓位年輕選手，畢竟年輕人是澳門單車的未來。    甘展博亦滿意自己的成績，稱自己在尾段四十公里曾嘗試突圍，儘管不成功，但結果尚可，也得以提前知悉賽道攻防細節，可為明年全運會做好準備。比賽跨越三地，包括在澳門大橋作賽，感覺非常難得，主辦方也做得很好，對路面接駁位都有預先鋪平處理。    鄭丞睎強調好開心可以參賽，從一個月前開始準備到比賽都學到不少知識，但在北安遭遇機械故障則是自己首次面對，後在教練支援下又繼續堅持較長距離比賽才被“收容”。教訓就是要認真做好車輛保養，期望明年能代表澳門參加全運會比賽。,http://www.macaodaily.com/html/2024-11/25/content_1796358.htm,提前做好溝通協調    今次賽事是全國首次貫穿三地的體育賽事，亦是明年十一月由粵港澳共同承辦的第十五屆全運會中公路自行車男子個人賽的測試賽，旨在提前做好各方面的溝通、協調和測試,十五 運全 流程 測試 效果 理想         粵 港澳 單車 賽成 創舉         【 本報 消息 】 二 ○ 二四 粵 港澳 公路 自行 車賽 暨 第十五 屆 全國 運動會 公路 自行 車測 試賽 昨日 成功 舉行 。 賽事 經港珠 澳大橋 跨越 粵 港澳 三地 ， 為 明年 十一月 舉辦 的 十五 運會 該 項賽 事 進行 全 流程 測試 ， 效果 大致 理想 。         內蒙選手 郝然 奪標         賽事 最終 衝線 時 由 內 蒙古 隊 的 郝然 、 山東隊 的 苗城碩 、 天津 隊 的 王瑞東 分別 奪得 冠亞季 軍 。 奪冠 的 內 蒙古 選手 郝然賽 後 分享 時 表示 ， 能夠 在 作為 世紀 工程 的 跨海 大橋 上 比賽 ， 機會 難得 ， 感覺 也 很 震撼 ， 但 似乎 自己 的 實力 提前 暴露 了 ， 恐怕 以後比賽 可能 會 被 盯防 。         跨三地 二百 三 公里         比賽 昨日 上午 九時 從 珠海 博物 館 集結 出發 ， 來 自內 地及 港澳 的 二十二 支 代表 隊 和 一支 個 人 代表 隊 合共 六十七 名 專業 運動員 ， 展開 一場 跨越 珠海 、 香港 、 澳門 三地 ， 全程 約 二百三十 公里 的 激烈 角逐 。 其中 ， 珠海 段 一百六十 點七 公里 ， 香港 段 五十五 點 八公里 ， 澳門 段 約 十三 點 五公里 。 選手 昨日 上午 九時 二十分 通過 港珠 澳大橋 人工 島 ， 進入 本 澳時 開始 下雨 ， 途經 澳門 大橋 、 北安 大馬路 ， 在 北安 碼頭 折返 澳門 大橋後途 經港珠 澳大橋 人工 島 ， 路面 濕滑 但 車速 未減 ， 部分 車手 嘗試 領放 ， 隨後續 前往 香港 及 珠海 完成 餘下 路段 的 比賽 。         提前 做好 溝通 協調         今次 賽事 是 全國 首次 貫穿 三地 的 體育賽 事 ， 亦 是 明年 十一月 由粵 港澳 共同 承辦 的 第十五 屆 全運會 中 公路 自行 車 男子 個 人賽 的 測試賽 ， 旨在 提前 做好 各 方面 的 溝通 、 協調 和 測試 。 明年 公路 自行 車 男子 個 人 賽將 首次 利用 港珠 澳大橋 作為 賽道 連通 三地 ， 且 是 十五 運會 中 唯一 跨越 粵 港澳 三地 的 比賽 項目 。         本次 測試賽 透過 全 流程 測試 ， 全面 檢驗 比賽 路線 、 快速 通關 及粵 港澳 三地間 的 協同 運作 及 應急 處理 能力 。 透過 此次 測試 ， 進 一步 優化賽 事 的 競賽 組織 、 安全 保障 、 交通管理 、 醫療 救援 、 志願者 服務 等 各項 籌備 工作 。 本次 賽 事由 十五 運會 及 殘特 奧委會 澳門 賽區 籌備 辦 公室 邀請 中國 澳門 單車 總會 參與 相關 工作 ， 澳門賽 區志願者 亦 積極 參 與 ， 共同努力 保障 賽事 順暢 舉行 ， 為 明年 十五 運會 公路 自行 車賽 的 舉行 做好 準備 。         人員 物料 通關 暢順         第十五 屆 全運會 珠海 賽區 執委會 辦 公室 副 主任 、 市 文化 廣電 旅遊 體育局 副 局長 袁熊 表示 ， 是 次 賽事 測試 效果 理想 ， 無論 是粵 港澳 三地 協調 、 賽事 銜接 、 安保 溝通 ， 還是 選手 、 裁判 及 保障 物料 的 通關 都 相當 暢順 。 賽 後 各部 門及 所有 環節 還會 全面 總結 檢討 ， 為 明年 的 賽事 舉辦 做好 精細 準備 。         澳選手 高興 本地 作賽         本澳 三名 單車 運動員 參賽 ， 其中 ， 甘展 博獲 第三 十名 、 崔慶華居 五十三名 ， 鄭丞睎則 因機械 故障 未能 完成 賽程 。         崔慶華稱 ， 多謝 有 機會 參加 此次 比賽 。 自己 已 四十二 歲 ， 是 所有 選 手中 年紀 最大 ， 體力 肯定 不及 年 輕人 ， 但 可以 在 自己 家門口 作賽 是 寶貴 經驗 ， 感覺 非常 開心 ， 成績 也 算 滿意 。 希望 明年 還 可以 參加 正賽 ， 樂意 以 老帶 新 ， 但 若 成績 不達標 ， 也 會 讓 位年 輕選手 ， 畢竟 年 輕人 是 澳門 單車 的 未來 。         甘展 博亦滿意 自己 的 成績 ， 稱 自己 在 尾段 四十公里 曾嘗試 突圍 ， 儘 管 不 成功 ， 但 結果 尚可 ， 也 得以 提前 知悉 賽道 攻防 細節 ， 可為 明年 全運會 做好 準備 。 比賽 跨越 三地 ， 包括 在 澳門 大橋 作賽 ， 感覺 非常 難得 ， 主辦方 也 做 得 很 好 ， 對 路面 接駁位 都 有 預先 鋪 平處理 。         鄭丞睎強 調好 開心 可以 參賽 ， 從 一個 月 前 開始 準備 到 比賽 都 學到 不少 知識 ， 但 在 北安 遭遇 機械 故障 則是 自己 首次 面對 ， 後 在 教練 支援 下 又 繼續 堅持 較長 距離 比賽 才 被 “ 收容 ” 。 教訓 就是 要 認真 做好 車輛 保養 ， 期望 明年 能 代表 澳門 參加 全運會 比賽 。,2024-11-25
潘永權：單車賽創三歷史,三地籌辦   跨境作賽   騎行大橋    潘永權：單車賽創三歷史    【本報消息】二○二四粵港澳公路自行車賽暨第十五屆全國運動會公路自行車測試賽昨日順利舉行，十五運會及殘特奧會澳門賽區籌備辦公室主任潘永權表示，全運會舉辦聯通粵、港、澳三地的跨境單車賽，創下了三地共同籌辦全運會、跨境進行體育賽事，以及首次利用港珠澳大橋作比賽路段的三個歷史。    他表示，為籌辦今次測試賽，三地長期聯繫及實地考察，感謝各地政府部門支持，讓整個賽事運行、運動員參賽及支援車隊的安排等都達到預期效果，為明年第十五屆全國運動會做好準備。    雨中作賽測試更好    車隊在澳門段經歷陣雨，潘永權指賽事會準備不同預案，下雨對測試更好，能令賽會測試到不同的環境效果，相信可為明年全運會正式賽事的舉辦累積經驗。,http://www.macaodaily.com/html/2024-11/25/content_1796359.htm,三地籌辦   跨境作賽   騎行大橋    潘永權：單車賽創三歷史    【本報消息】二○二四粵港澳公路自行車賽暨第十五屆全國運動會公路自行車測試賽昨日順利舉行，十五運會及殘特奧會澳門賽區籌備辦公室主任潘永權表示，全運會舉辦聯通粵、港、澳三地的跨境單車賽，創下了三地共同籌辦全運會、跨境進行體育賽事，以及首次利用港珠澳大橋作比賽路段的三個歷史,三地 籌辦       跨境 作賽       騎行 大橋         潘永權 ： 單車賽 創三 歷史         【 本報 消息 】 二 ○ 二四 粵 港澳 公路 自行 車賽 暨 第十五 屆 全國 運動會 公路 自行 車測 試賽 昨日 順利 舉行 ， 十五 運會 及 殘特奧會 澳門 賽區 籌備 辦公 室主任 潘永權 表示 ， 全運會 舉辦 聯通粵 、 港 、 澳三地 的 跨境 單車賽 ， 創下 了 三地 共同 籌辦 全運會 、 跨境 進行 體育賽 事 ， 以及 首次 利用 港珠 澳大橋 作比賽 路段 的 三個 歷史 。         他 表示 ， 為 籌辦 今次 測試賽 ， 三地長 期 聯 繫 及 實 地 考察 ， 感謝 各地 政府 部門 支持 ， 讓 整個 賽事 運行 、 運動員 參賽 及 支援 車隊 的 安排 等 都 達 到 預期 效果 ， 為 明年 第十五 屆 全國 運動會 做好 準備 。         雨中 作賽 測試 更好         車隊 在 澳門段 經歷 陣雨 ， 潘永權 指賽 事會 準備 不同 預案 ， 下雨 對 測試 更好 ， 能令賽 會 測試 到 不同 的 環境 效果 ， 相信 可為 明年 全運會 正式 賽事 的 舉辦 累積 經驗 。,2024-11-25
外港碼頭客流增秩序好,船公司應對昨早封橋加開航班    外港碼頭客流增秩序好    【本報消息】因應粵港澳公路單車賽，港珠澳大橋昨日上午封閉，不少居民旅客轉經海路來往港澳，早上外港碼頭人流增加，船公司加開班次疏導乘客，整體秩序良好。    離境可購即班船票    昨上午十時許，外港碼頭售票櫃檯偶現人龍，由於船公司加開航班，封橋期間維持十五至三十分鐘一班航班，離境樓層未見有人滯留，基本上都可以購買即班船票；入境樓層有不少旅行團聚集，亦有港客結伴來澳，碼頭人員在場提供協助，整體秩序良好。    居民吳先生一家四口前往香港，打算參觀到訪的“海南艦”。表示前日知道港珠澳大橋封閉，但至昨日早上才得悉封橋時間，故改變計劃由外港碼頭坐船赴港，幸好船公司加開航班，購買船票沒有太大困難，認為船公司的安排有助疏導人流，整體上沒有太大不便。唯獨是改變出行計劃令旅費增加不少，希望日後舉辦同類活動時，可減低對居民出行的影響。    冀局部封路減影響    來自香港的黃先生指原本計劃坐船來澳，早上上環碼頭人流明顯增加，售票處、候船廳、客船乘客都較平日增多，船公司為疏導人流，增加航班及使用大船，整體安排尚算令人滿意。另一港客劉先生表示數日前得知港珠澳大橋封橋的消息，擔心大批旅客坐船會一票難求，遂第一時間上網購買船票。雖然坐船比較方便，但金巴車費較便宜，平時以陸路來往港澳為主。他認為活動對出行有影響，希望主辦單位在可行情況下，採用局部封路方式，減低對居民和旅客的影響。,http://www.macaodaily.com/html/2024-11/25/content_1796360.htm,船公司應對昨早封橋加開航班    外港碼頭客流增秩序好    【本報消息】因應粵港澳公路單車賽，港珠澳大橋昨日上午封閉，不少居民旅客轉經海路來往港澳，早上外港碼頭人流增加，船公司加開班次疏導乘客，整體秩序良好,船 公司 應對 昨早 封橋 加開 航班         外港 碼頭 客流 增 秩序 好         【 本報 消息 】 因應粵 港澳 公路 單車賽 ， 港珠 澳大橋 昨日 上午 封閉 ， 不少 居民 旅客 轉經 海路 來往 港澳 ， 早上 外港 碼頭 人流 增加 ， 船 公司 加開 班次 疏導 乘客 ， 整體 秩序 良好 。         離境 可購 即班 船票         昨 上午 十時許 ， 外港 碼頭 售票 櫃 檯 偶現 人龍 ， 由 於 船 公司 加開 航班 ， 封橋 期間 維持 十五 至 三十分 鐘 一班 航班 ， 離境 樓層 未見 有人 滯留 ， 基本上 都 可以 購買 即班 船票 ； 入境 樓層 有 不少 旅行 團 聚集 ， 亦 有 港客 結伴 來 澳 ， 碼頭 人員在場 提供 協助 ， 整體 秩序 良好 。         居民 吳 先生 一家 四口 前往 香港 ， 打算 參觀 到 訪 的 “ 海南 艦 ” 。 表示 前日 知道 港珠 澳大橋 封閉 ， 但 至 昨日 早上 才 得悉 封橋 時間 ， 故改 變計劃 由 外港 碼頭 坐船 赴 港 ， 幸好 船 公司 加開 航班 ， 購買 船票 沒有 太大困 難 ， 認為 船 公司 的 安排 有助 疏導 人流 ， 整體 上 沒 有 太大 不便 。 唯獨 是 改變 出行 計劃令 旅費 增加 不少 ， 希望 日後舉 辦同類 活動時 ， 可減 低 對 居民 出行 的 影響 。         冀 局部 封路 減影響         來 自 香港 的 黃 先生 指 原本 計劃 坐船 來澳 ， 早上 上 環碼頭 人流 明顯 增加 ， 售票 處 、 候船 廳 、 客船 乘客 都 較 平日 增多 ， 船 公司 為 疏導 人流 ， 增加 航班 及 使用 大船 ， 整體 安排 尚算 令人 滿意 。 另 一 港客 劉 先生 表示 數 日前 得知 港珠 澳大橋 封橋 的 消息 ， 擔心 大批 旅客 坐船 會 一票 難求 ， 遂 第一 時間 上 網購 買 船票 。 雖然 坐船 比較 方便 ， 但 金巴車 費較 便宜 ， 平時 以 陸路 來 往 港澳 為主 。 他 認為 活動 對 出行 有 影響 ， 希望 主辦 單位 在 可 行情 況下 ， 採用 局部 封路 方式 ， 減低 對 居民 和 旅客 的 影響 。,2024-11-25
居琴澳人擬特定通道過關,盼延續深合區稅收優惠政策    居琴澳人擬特定通道過關    【本報消息】橫琴粵澳深度合作區現行的澳人稅收優惠政策明年底屆滿，行政公職局代局長陳子健回覆議員李良汪關於澳門居民在橫琴居住遇到通關、徵稅及郵政問題的書面質詢時表示，政府一直非常重視深合區的澳人稅收優惠政策，積極與內地相關部門溝通。    在“共商共建共管共享”機制下，爭取延續有關澳人稅收優惠政策，以確保在促進兩地融合發展時，澳門居民在橫琴的經濟活動能夠獲得合適的稅收政策支持。    優化學童專道    澳琴通關方面，陳子健引述保安範疇指出，橫琴口岸採用“合作查驗、一次放行”通關模式。根據統計數據，現時經橫琴口岸通關的人數佔總通關人數約一成，人均通關所需時間約三分鐘。    在節假日及出入境繁忙時段，橫琴口岸澳門口岸區出入境事務站會根據實際情況，適時調整動線，便利澳門居民通行，亦與橫琴邊檢協調，加派人員增開通道疏導過關人士。    隨着越來越多澳人在深合區定居，治安警察局已與橫琴邊檢溝通，研究為居住於橫琴的澳門居民設立特定通道的可行性。    至於有關延長“學童專道”開放時間的建議，治安警察局持續留意及評估相關通道的使用情況，並研究優化方案。    至於深合區郵政服務方面，陳子健引述郵電局表示，法律規定該局提供郵政服務的範圍只限本澳之內，深合區郵政服務由中國郵政負責提供，並設有橫琴郵政所，除負責郵件的投寄及派遞工作外，還提供國際及港澳台等多項郵政業務。    郵電局按照寄件人所選擇的郵政服務類別處理及封發郵件往目的地，並由目的地郵政機構按郵件上的地址派遞。目前，本澳金融機構或其他單位從澳門本地投寄至深合區的郵件，均會由郵電局收集後，交付予中國郵政於深合區內派遞。    跨境遙距政務    陳子健表示，今年十月於橫琴“澳門新街坊”開設澳門政務廿四小時自助服務中心，其內設有自助服務機、領證機、“智取易”智能文件櫃，供澳門居民自助辦理澳門政府多個部門的服務及領取政府文件。    同時，當局還設有遙距服務櫃檯，方便澳門居民透過視像跨境辦事，以進一步便利澳門居民在深合區生活和發展，實現政務服務就近辦、跨境辦、自助辦。未來，將推動更多澳門政務服務向深合區延伸，更好地滿足澳門居民的辦事需求，推進澳琴民生融合發展。,http://www.macaodaily.com/html/2024-11/25/content_1796361.htm,盼延續深合區稅收優惠政策    居琴澳人擬特定通道過關    【本報消息】橫琴粵澳深度合作區現行的澳人稅收優惠政策明年底屆滿，行政公職局代局長陳子健回覆議員李良汪關於澳門居民在橫琴居住遇到通關、徵稅及郵政問題的書面質詢時表示，政府一直非常重視深合區的澳人稅收優惠政策，積極與內地相關部門溝通,盼延續 深合區 稅收 優惠 政策         居琴 澳人擬 特定 通道 過關         【 本報 消息 】 橫琴粵澳 深度 合作 區現 行 的 澳人 稅收 優惠 政策 明 年底 屆 滿 ， 行政 公職 局代局 長 陳 子健 回覆 議員 李良 汪關 於 澳門 居民 在 橫琴 居住 遇到 通關 、 徵稅 及 郵政 問題 的 書面 質詢 時 表示 ， 政府 一直 非常 重視 深合區 的 澳人 稅收 優惠 政策 ， 積極 與 內 地 相關 部門 溝通 。         在 “ 共商 共建 共管 共享 ” 機制 下 ， 爭取 延續 有關 澳人 稅收 優惠 政策 ， 以確 保在 促進 兩地 融合 發展 時 ， 澳門 居民 在 橫琴 的 經濟 活動 能夠 獲得 合適 的 稅收 政策 支持 。         優化 學童 專道         澳琴 通關 方面 ， 陳 子健 引述 保安 範疇 指出 ， 橫琴 口岸 採用 “ 合作 查驗 、 一次 放行 ” 通關 模式 。 根據 統計 數據 ， 現時 經橫琴 口岸 通關 的 人數 佔 總通 關人數 約 一成 ， 人均 通關 所 需時間 約 三分 鐘 。         在節 假日 及 出入境 繁忙 時段 ， 橫琴 口岸 澳門 口岸 區 出入境 事務站 會 根據 實際 情況 ， 適時調 整動線 ， 便利 澳門 居民 通行 ， 亦 與 橫琴邊 檢協調 ， 加派 人員 增開 通道 疏導 過關 人士 。         隨着 越來 越 多 澳人 在 深合區 定居 ， 治安 警察局 已 與 橫琴邊 檢溝通 ， 研究 為 居住 於 橫琴 的 澳門 居民 設立 特定 通道 的 可行性 。         至於 有關 延長 “ 學童 專道 ” 開放 時間 的 建議 ， 治安 警察局 持續 留意 及 評估 相關 通道 的 使用 情況 ， 並 研究 優化 方案 。         至於 深合區 郵政 服務 方面 ， 陳 子健 引述 郵電局 表示 ， 法律 規定 該局 提供 郵政 服務 的 範圍 只限 本澳 之 內 ， 深合區 郵政 服務 由 中國 郵政 負責 提供 ， 並設 有 橫琴 郵政所 ， 除 負責 郵件 的 投寄 及 派 遞 工作 外 ， 還 提供 國際及 港澳台 等 多項 郵政業務 。         郵電局 按照 寄件人 所選擇 的 郵政 服務類 別處 理及 封發 郵件 往 目的地 ， 並由 目的地 郵政機構 按 郵件 上 的 地址 派 遞 。 目前 ， 本澳 金融 機構 或 其他 單位 從 澳門 本地 投寄 至 深合區 的 郵件 ， 均會 由 郵電局 收集 後 ， 交付 予中國 郵政 於 深合區 內 派 遞 。         跨境 遙距政務         陳 子健 表示 ， 今年 十月 於 橫琴 “ 澳門 新 街坊 ” 開設 澳門 政務 廿四 小時 自助 服務 中心 ， 其內 設有 自助 服務機 、 領證機 、 “ 智取 易 ” 智能 文件 櫃 ， 供澳門 居民 自助 辦理 澳門 政府 多個 部門 的 服務及 領取 政府 文件 。         同時 ， 當局 還設 有 遙距 服務櫃 檯 ， 方便 澳門 居民 透過 視像 跨境 辦事 ， 以進 一步 便利 澳門 居民 在 深合區 生活 和 發展 ， 實現 政務 服務 就近 辦 、 跨境 辦 、 自助 辦 。 未來 ， 將推動 更 多 澳門 政務 服務向 深合區 延伸 ， 更好 地滿足 澳門 居民 的 辦事 需求 ， 推進 澳琴 民生 融合 發展 。,2024-11-25
街頭偶劇   許文權  攝,街頭偶劇    本地戲劇愛好者昨在路環街巷即興演出偶戲，大受親子歡迎。     許文權   攝,http://www.macaodaily.com/html/2024-11/25/content_1796362.htm,街頭偶劇    本地戲劇愛好者昨在路環街巷即興演出偶戲，大受親子歡迎,街頭 偶劇         本地 戲劇 愛好者 昨在 路環 街巷 即興 演出 偶戲 ， 大受 親子 歡迎 。           許文權       攝,2024-11-25
