Title,Content,Link,Summary,Preprocessed_Content,Date
商僱總赴穗交流促合作,商僱總赴穗交流促合作    澳門商業僱員總會主辦，澳門基金會資助的“商業僱員考察交流活動”於日前舉行。該會理監事一行三十人赴廣州市從化區展開為期二天的學習培訓，獲廣州市總工會及從化區總工會的協助安排和款待。    交流團由該會會長鄧錦富任團長。一行獲廣州市總工會副主席尹宏亮等接待並座談；在辦公室主任何學能帶領下參觀廣州市從化區人大代表工會聯絡站及從化工運史展覽館。    鄧錦富表示，當地工會聯絡站設備多元化，從法律支援到餘暇活動多功能室等，更設從化工運史展覽館，為廣大職工不同的需求全面顧及到，這方面值得工會學習。提出兩地工會架構有所不一樣，但竭誠服務職工的宗旨是一致的。未來定會繼續加強兩地工會合作，探索兩地工會工作的新模式。    交流團還參觀雲台山戰場遺址、千瀧溝大瀑布及溪頭村等。團友表示，交流團行程豐富多元化，收穫甚豐。,http://www.macaodaily.com/html/2024-07/26/content_1770617.htm,鄧錦富表示，當地工會聯絡站設備多元化，從法律支援到餘暇活動多功能室等，更設從化工運史展覽館，為廣大職工不同的需求全面顧及到，這方面值得工會學習,商僱 總 赴 穗 交流 促 合作         澳門 商業 僱員 總會 主辦 ， 澳門 基金 會資助 的 “ 商業 僱員 考察 交流 活動 ” 於 日前 舉行 。 該會理 監事 一行 三十 人赴廣 州市 從化 區展 開為期 二天 的 學習 培訓 ， 獲廣 州市 總工會 及 從化區 總工會 的 協助 安排 和 款待 。         交流 團由該 會會長 鄧錦富 任團長 。 一行 獲廣 州市 總工會 副 主席 尹 宏亮 等 接待 並座 談 ； 在 辦公 室主任 何學能 帶 領下 參觀廣 州市 從化區 人大代表 工會 聯絡 站 及 從 化工 運史 展覽館 。         鄧錦富 表示 ， 當地 工會 聯絡 站 設備 多元化 ， 從 法律 支援 到 餘暇 活動 多功能 室 等 ， 更設 從 化工 運史 展覽館 ， 為 廣大 職工 不同 的 需求 全面 顧及 到 ， 這 方面 值得 工會 學習 。 提出 兩地 工會 架構 有所 不一樣 ， 但 竭誠服務 職工 的 宗旨 是 一致 的 。 未來 定會 繼續 加強 兩地 工會 合作 ， 探索 兩地 工會 工作 的 新 模式 。         交流 團還 參觀 雲 台山 戰場 遺址 、 千 瀧 溝大 瀑布 及溪頭 村 等 。 團友 表示 ， 交流 團 行程 豐富 多元化 ， 收 穫 甚豐 。,2024-07-26
製總網購視頻手機班報名,製總網購視頻手機班報名    澳門製造業總工會八月尾開辦新一期手機班，網購及移動支付篇由八月十九日起，逢星期一、四上課；視頻拍攝編輯製作加強篇由八月二十日起，逢星期二、五上課。上午十時至十一時半上課，全期十五堂，報名及上課地點：於製造業總工會（黑沙環大馬路四十二號福祥樓二樓A─G座）報名及上課。即日起接受報名，額滿即止，查詢電話二八四八 · 一四八三。    網購及移動支付篇課程內容：網上購物平台及移動支付工具的認識及使用、本地購物及外賣平台的使用、安全使用知識等。    視頻拍攝編輯製作加強篇課程內容：手機視頻拍攝運鏡方式、拍攝技巧等，使用剪影應用程式，編輯美化及製作特效視頻等。,http://www.macaodaily.com/html/2024-07/26/content_1770618.htm,製總網購視頻手機班報名    澳門製造業總工會八月尾開辦新一期手機班，網購及移動支付篇由八月十九日起，逢星期一、四上課,製 總 網 購 視 頻 手 機 班 報 名         澳 門 製 造 業 總 工 會 八月 尾開 辦 新一期 手機班 ， 網購 及 移動 支付 篇 由 八月 十九日 起 ， 逢 星期一 、 四上 課 ； 視頻 拍 攝編 輯 製 作 加 強 篇 由 八月 二十日 起 ， 逢 星期二 、 五上 課 。 上午 十時 至 十一 時半上 課 ， 全期 十五 堂 ， 報名 及 上 課 地點 ： 於 製 造 業 總 工 會 （ 黑沙 環大馬路 四十二 號福祥樓 二樓 A ─ G 座 ） 報名 及 上 課 。 即日起 接受 報名 ， 額滿 即止 ， 查詢 電話 二八 四八   ·   一 四八 三 。         網購 及 移動 支付 篇 課程 內容 ： 網上 購物 平台 及 移動 支付 工具 的 認識 及 使用 、 本地 購物 及 外賣 平台 的 使用 、 安全 使用 知識 等 。         視頻 拍 攝編 輯 製 作 加 強 篇 課 程 內 容 ： 手機 視頻 拍 攝運鏡 方式 、 拍攝 技巧 等 ， 使用 剪影 應用 程式 ， 編輯 美化 及 製 作 特效 視頻 等 。,2024-07-26
斷捨離學會成立讀書會,斷捨離學會成立讀書會    澳門斷捨離學會成立讀書會，旨在與居民共享斷捨離知識，探討生命意義。讀書會將於八月一日開始，歡迎居民參加共同閱讀。    斷捨離學會是一個關注於“斷絕不需要的東西、捨去多餘的物品、脫離對物品的執着”的群組，旨在幫助人們減少生活中的負擔，提升生活品質和幸福感。如果想進一步了解斷捨離，歡迎參加工作坊，探討斷捨離與個人成長、輔導技巧以及家庭治療的關係。報名六六九九 · 五六○○陳小姐。,http://www.macaodaily.com/html/2024-07/26/content_1770619.htm,斷捨離學會是一個關注於“斷絕不需要的東西、捨去多餘的物品、脫離對物品的執着”的群組，旨在幫助人們減少生活中的負擔，提升生活品質和幸福感,斷 捨 離學會 成立 讀書會         澳門斷 捨 離學會 成立 讀書會 ， 旨在 與 居民 共享 斷 捨 離 知識 ， 探討 生命 意義 。 讀書會將 於 八月 一日 開始 ， 歡迎 居民 參加 共同 閱讀 。         斷 捨 離學會 是 一個 關注 於 “ 斷絕 不 需要 的 東西 、 捨 去 多 餘 的 物品 、 脫離 對 物品 的 執着 ” 的 群組 ， 旨在 幫 助人 們 減少 生活 中 的 負擔 ， 提升 生活 品質 和 幸福感 。 如果 想進 一步 了解 斷 捨 離 ， 歡迎 參 加工 作坊 ， 探討斷 捨 離 與 個 人 成長 、 輔導 技巧 以及 家庭 治療 的關 係 。 報名 六六 九九   ·   五六 ○ ○ 陳 小姐 。,2024-07-26
婦聯樂頤工作坊宣護眼,婦聯樂頤工作坊宣護眼    澳門社會人口高齡化的問題日益嚴重，患有眼部疾病的長者遍佈在社區中。為此，婦聯樂頤長者日間中心日前舉行“活力長青 · 共享耆年”系列活動“致營之道——齡魂之窗”工作坊，向長者分享關於老年眼疾和保健眼睛的資訊。活動獲社工局贊助。    該活動透過視力遊戲和問答環節等內容，提醒長者在日常生活中保護自己的眼睛，強調眼部疾病要及早治療的重要性。中心特意向長者派發水果，呼應活動上護眼的飲食主題，同時讓長者感受到溫馨的關懷。    該中心期望藉舉行系列活動，鼓勵長者多參與不同的社區健康活動，並以績分方式記錄，推動長者持續參與社會活動，保持健康身體和正向心態。,http://www.macaodaily.com/html/2024-07/26/content_1770620.htm,為此，婦聯樂頤長者日間中心日前舉行“活力長青 · 共享耆年”系列活動“致營之道——齡魂之窗”工作坊，向長者分享關於老年眼疾和保健眼睛的資訊,婦聯樂 頤 工作坊 宣護眼         澳門 社會 人口 高齡化 的 問題 日益 嚴重 ， 患有 眼部 疾病 的 長 者 遍 佈 在 社區 中 。 為 此 ， 婦聯樂 頤長 者 日間 中心 日前 舉行 “ 活力 長 青   ·   共享 耆年 ” 系列 活動 “ 致營 之道 — — 齡魂 之 窗 ” 工作坊 ， 向長 者 分享 關於 老年 眼疾 和 保健 眼睛 的 資訊 。 活動 獲 社工 局贊助 。         該 活動 透過 視力 遊戲 和 問答 環節 等 內容 ， 提醒 長 者 在 日常生活 中保 護 自己 的 眼睛 ， 強調 眼部 疾病 要 及早 治療 的 重要性 。 中心 特意 向長 者 派 發 水果 ， 呼應 活動 上護眼 的 飲 食主題 ， 同時 讓 長 者 感受 到 溫馨 的 關懷 。         該 中心 期望 藉 舉行 系列 活動 ， 鼓勵 長 者 多 參 與 不同 的 社區 健康 活動 ， 並以績 分 方式 記錄 ， 推動長 者 持續 參與 社會 活動 ， 保持 健康 身體 和 正向 心態 。,2024-07-26
工聯北綜參加雙慶宣講活動,工聯北綜參加雙慶宣講活動    工聯北區綜合服務中心日前組織共八十位婦女義工及其家屬參加由澳門工會聯合總會主辦的“家國情 · 百年夢”雙慶主題宣講活動，旨在向社區居民推廣雙慶及弘揚愛國愛澳的精神，並加強其對國家及澳門的現況及未來發展的認識。    活動藉新中國成立七十五周年及澳門特區成立二十五周年的雙慶之際，透過主題宣講，向居民分享祖國、特區政府以及愛國工運事業發展歷程和不同階段的事件，讓居民了解特區政府的發展方向和目標，加強民族認同感和特區建設參與感。    該中心社工曾曉陽表示，該中心持續推出一系列雙慶活動，借此推動社區居民積極參與社會，促進居民對家國的認同感和責任感，弘揚愛國精神，讓更多人參與到這份情懷中。    此外，該中心還定期舉辦義工培訓、探訪服務、技能體驗等，歡迎參加。如需了解更多資訊，致電二八四七 · ○七八九。,http://www.macaodaily.com/html/2024-07/26/content_1770621.htm,工聯北綜參加雙慶宣講活動    工聯北區綜合服務中心日前組織共八十位婦女義工及其家屬參加由澳門工會聯合總會主辦的“家國情 · 百年夢”雙慶主題宣講活動，旨在向社區居民推廣雙慶及弘揚愛國愛澳的精神，並加強其對國家及澳門的現況及未來發展的認識,工聯北 綜參加 雙慶 宣講 活動         工聯北區 綜合 服務 中心 日前 組織 共 八十 位婦 女義工 及其 家屬 參加 由 澳門 工會 聯合 總會 主辦 的 “ 家國情   ·   百年 夢 ” 雙慶主題 宣講 活動 ， 旨在 向 社區 居民 推廣 雙慶及 弘揚 愛國 愛澳 的 精神 ， 並加強 其 對 國家及 澳門 的 現況 及 未來 發展 的 認識 。         活動 藉 新 中國 成立 七十五 周年 及 澳門 特區 成立 二十五 周年 的 雙慶之際 ， 透過 主題 宣講 ， 向 居民 分享 祖國 、 特區 政府 以及 愛國 工運事業 發展 歷程 和 不同 階段 的 事件 ， 讓 居民 了解 特區 政府 的 發展 方向 和 目標 ， 加強 民族 認 同感 和 特區 建設 參與感 。         該 中心 社工 曾曉陽 表示 ， 該 中心 持續 推出 一系列 雙慶 活動 ， 借此 推動 社區 居民 積極 參與 社會 ， 促進 居民 對家國 的 認 同感 和責 任感 ， 弘揚 愛國 精神 ， 讓 更 多 人 參 與 到 這份 情懷中 。         此外 ， 該 中心 還 定期 舉辦 義工 培訓 、 探訪 服務 、 技能 體驗 等 ， 歡迎 參加 。 如需 了解 更多 資訊 ， 致電 二八 四七   ·   ○ 七八 九 。,2024-07-26
長隆飛船樂園全新升級迎暑假,長隆飛船樂園全新升級迎暑假    七月廿八日，全球最大室內樂園，長隆飛船樂園經過為期近一年的試運營，結合市場調研和產品反覆運算需求，推出暑期特別版。全新升級的長隆飛船樂園，新增黑暗騎乘、互動射擊和360 度全景動感海底穿越等近二十項高科技、全景式遊樂專案，採用 VR、AR、4D 和5D 等最新顯示和特效技術，與硬體設備巧妙結合，具有虛擬交互、模擬佈景的沉浸式體驗特色。長隆飛船樂園將以新設備、新玩法、新演藝，帶給遊客耳目一新的極致娛樂體驗。    七月廿八日，近萬名遊客加入飛船變裝派對，把科幻、太空等元素裝扮上身，人潮滙聚之處隨處可見未來感。星河射擊戰隊、奇幻水星戰隊、星際農場戰隊……樂園NPC集體出動，形成五大方陣，視覺衝擊和沉浸互動，打開大家對於太空的想像力。舞台上，海洋霸主“虎鯨”和“蛋仔”們共舞，《超級頭號玩家》舞台劇正式歡樂上演，動感的節奏、激情的舞姿，現場瞬間被點燃。此外，園區還準備了超級盲盒、限定紀念徽章等禮物，派發給參與活動的遊客，歡樂聲浪陣陣起伏！    沉浸式娛樂新體驗    自二三年九月開啟試營業以來，長隆飛船樂園以遊客體驗為核心，陸續對產品進行了反覆運算升級。這個暑假，樂園將首次開放19套全景式遊樂設施，據瞭解，這些新項目利用最新科技手段在遊玩互動體驗上都做到了創新和突破。例如“飛船總動員”融入了爬升、驟降等擺脫地心引力的體感設計，創建了高度逼真的時空穿梭5D場景。“古海幻行”則採用了吊掛式座艙設計，帶着遊客從空中穿越神秘的遠古海洋世界遇見深海鯨豚遊弋的奇幻場景，通過增強現實顯示技術，遊客還可與身邊的海洋生物互動。    為加強沉浸式遊玩體驗，長隆飛船樂園還開放了全新玩法，在入園時，遊客們將受邀加入不同主題的戰隊，開啟闖關和挑戰之旅，同時通過遊戲排名和科普知識問答等，完成積分累計，贏取相應禮品和權益。    長隆飛船樂園總經理劉宏娟表示，希望這些玩法能增強大家的好奇心和探索欲，去主動解鎖不同的遊玩方式，玩得更深入、更盡興。    除了新設備、新玩法，這個暑假，園區還與人氣網遊“蛋仔派對”強強聯合，專設“蛋仔派對”美陳打卡區和特色《蛋仔歡樂親子秀》，實實讓“蛋迷們”過足了癮。    （特刋）,http://www.macaodaily.com/html/2024-07/26/content_1770612.htm,全新升級的長隆飛船樂園，新增黑暗騎乘、互動射擊和360 度全景動感海底穿越等近二十項高科技、全景式遊樂專案，採用 VR、AR、4D 和5D 等最新顯示和特效技術，與硬體設備巧妙結合，具有虛擬交互、模擬佈景的沉浸式體驗特色,長 隆飛 船樂園 全新 升級 迎 暑假         七月 廿八日 ， 全球 最大 室 內樂園 ， 長 隆飛 船樂園 經過 為 期近 一年 的 試運營 ， 結合 市場 調研 和 產品 反覆 運算 需求 ， 推出 暑期 特別 版 。 全新 升級 的 長 隆飛 船樂園 ， 新增 黑暗 騎乘 、 互動射擊 和 360   度 全景 動感 海底 穿越 等 近 二十 項 高科技 、 全景式 遊樂 專案 ， 採用   VR 、 AR 、 4D   和 5D   等 最新 顯示 和 特效 技術 ， 與 硬體 設備 巧妙 結合 ， 具有 虛擬 交互 、 模擬 佈 景 的 沉浸 式 體驗 特色 。 長 隆飛 船樂園 將以 新 設備 、 新 玩法 、 新 演藝 ， 帶給 遊客 耳目一新 的 極致 娛樂 體驗 。         七月 廿八日 ， 近萬名 遊客 加入 飛船 變裝 派 對 ， 把 科幻 、 太空 等 元素 裝扮 上身 ， 人潮 滙 聚之處 隨處 可見 未來 感 。 星河 射擊 戰隊 、 奇幻 水星 戰隊 、 星際 農場 戰隊 … … 樂園 NPC 集體 出動 ， 形成 五 大方 陣 ， 視覺 衝擊 和 沉浸 互動 ， 打開 大家 對 於 太空 的 想像力 。 舞台 上 ， 海洋 霸主 “ 虎鯨 ” 和 “ 蛋仔 ” 們 共舞 ， 《 超級 頭號 玩家 》 舞台 劇 正式 歡樂 上演 ， 動感 的 節奏 、 激情 的 舞姿 ， 現場 瞬間 被 點燃 。 此外 ， 園區 還準備 了 超級 盲盒 、 限定 紀念 徽章 等 禮物 ， 派 發給 參與 活動 的 遊客 ， 歡樂聲 浪陣陣 起伏 ！         沉浸 式 娛樂新 體驗         自 二三年 九月 開啟 試營業 以來 ， 長 隆飛 船樂園 以遊客 體驗 為 核心 ， 陸續 對產品 進行 了 反覆 運算 升級 。 這個 暑假 ， 樂園將 首次 開放 19 套 全景式 遊樂 設施 ， 據 瞭解 ， 這些 新 項目 利用 最新 科技 手段 在 遊玩 互動 體驗 上 都 做到 了 創新 和 突破 。 例如 “ 飛船 總動員 ” 融入 了 爬升 、 驟降 等 擺脫 地心引力 的 體感 設計 ， 創建 了 高度 逼真 的 時空 穿梭 5D 場景 。 “ 古海 幻行 ” 則採用 了 吊 掛式 座 艙 設計 ， 帶 着 遊客 從 空中 穿越 神秘 的 遠古 海洋 世界 遇見 深海 鯨豚 遊弋 的 奇幻 場景 ， 通過 增強 現實 顯示 技術 ， 遊客 還可 與 身邊 的 海洋生物 互動 。         為 加強 沉浸 式 遊玩體驗 ， 長 隆飛 船樂園 還開 放 了 全新 玩法 ， 在 入園 時 ， 遊客們將 受邀 加入 不同 主題 的 戰隊 ， 開啟 闖關 和 挑戰 之 旅 ， 同時 通過 遊戲 排名 和 科普 知識 問答 等 ， 完成 積分 累計 ， 贏取 相應 禮品 和 權益 。         長 隆飛 船樂園 總經理 劉宏娟 表示 ， 希望 這些 玩法 能 增強 大家 的 好奇心 和 探索 欲 ， 去 主動 解鎖 不同 的 遊玩 方式 ， 玩得 更 深入 、 更 盡興 。         除了 新 設備 、 新 玩法 ， 這個 暑假 ， 園區 還與 人氣 網遊 “ 蛋仔派 對 ” 強強 聯合 ， 專設 “ 蛋仔派 對 ” 美陳 打卡 區和 特色 《 蛋仔 歡樂 親子秀 》 ， 實實 讓 “ 蛋迷們 ” 過足 了 癮 。         （ 特 刋 ）,2024-07-26
海洋霸主大巡遊“吸睛”,科普研學吸引人流    海洋霸主大巡遊“吸睛”    樂園採用海洋生態與遊樂交互融合創新模式，將自然生態、遊樂設施、科普知識、情景演藝進行互聯。展示超過400多種近15萬尾各類海洋珍稀動物。    依照“自然”、“生態”、“環保”、“保育”的設計理念，長隆飛船樂園相比傳統主題樂園多為遊玩功能的屬性，將遊玩與科普的佔比從8：2拉升至5：5，設有多間科普教室和公開課堂，針對親子家庭，開設了“珊瑚小小研究員”、“海牛小小保育員”、“虎鯨探索之旅”等豐富的特色科普體驗活動。專業的科普團隊將科學教育、藝術教育、工程思維方法等融入到動物保育課程當中，意在通過寓教於樂的方式，深入淺出的將瀕危動植物的保育理念傳遞給社會大眾。    據介紹，長隆飛船樂園保育有全球單體海洋館最大虎鯨種群。遊值得一提的是，在樂園二樓的“虎鯨科普劇場”，園方還精心編排了時長近四十分鐘的“海洋霸主超級大巡遊”，融合陽光、沙灘、六級海浪以及海洋旗艦物種虎鯨等動物的自然行為展示和生動科普講解，為人們展現生機勃勃的海洋生態景象。    （特刋）,http://www.macaodaily.com/html/2024-07/26/content_1770616.htm,遊值得一提的是，在樂園二樓的“虎鯨科普劇場”，園方還精心編排了時長近四十分鐘的“海洋霸主超級大巡遊”，融合陽光、沙灘、六級海浪以及海洋旗艦物種虎鯨等動物的自然行為展示和生動科普講解，為人們展現生機勃勃的海洋生態景象,科普 研學 吸引 人流         海洋 霸主 大 巡遊 “ 吸睛 ”         樂園 採用 海洋 生態 與 遊樂 交互 融合 創新 模式 ， 將 自然 生態 、 遊樂 設施 、 科普 知識 、 情景 演藝 進行 互聯 。 展示 超過 400 多種 近 15 萬尾 各類 海洋 珍稀 動物 。         依照 “ 自然 ” 、 “ 生態 ” 、 “ 環保 ” 、 “ 保育 ” 的 設計 理念 ， 長 隆飛 船樂園 相比 傳統 主題 樂園 多 為 遊玩 功能 的 屬性 ， 將遊 玩 與 科普 的 佔 比 從 8 ： 2 拉 升至 5 ： 5 ， 設有 多間 科普 教室 和 公開 課堂 ， 針對 親子 家庭 ， 開設 了 “ 珊瑚 小小 研究 員 ” 、 “ 海牛 小小 保育 員 ” 、 “ 虎鯨 探索之旅 ” 等 豐富 的 特色 科普 體驗 活動 。 專業 的 科普 團隊 將科學 教育 、 藝術 教育 、 工程 思維 方法 等 融入 到 動物 保育 課程 當中 ， 意在 通過 寓教 於 樂 的 方式 ， 深入 淺出 的 將瀕 危動 植物 的 保育 理念 傳遞給 社會 大眾 。         據介紹 ， 長 隆飛 船樂園 保育 有 全球 單體 海洋 館 最大 虎鯨種 群 。 遊 值得一提的是 ， 在 樂園 二樓 的 “ 虎鯨 科普 劇場 ” ， 園方還 精心 編排 了 時長 近 四 十分 鐘的 “ 海洋 霸主 超級 大 巡遊 ” ， 融合 陽光 、 沙灘 、 六級 海浪 以及 海洋 旗艦 物種 虎 鯨 等 動物 的 自然 行為 展示 和 生動 科普 講解 ， 為 人們 展現 生機 勃勃的 海洋 生態 景象 。         （ 特 刋 ）,2024-07-26
“格美”烤澳 昨錄36℃,“格美”烤澳  昨錄36℃    今續酷熱慎防中暑    【本報消息】昨日熱帶氣旋“格美”遙距“烤驗”本澳，今年首個橙色高溫提示下，昨多區錄得超過攝氏卅六度高溫，街外猶如烤爐，旅客無懼高溫暢遊景點。料今日天氣持續酷熱，居民應注意防曬補水，慎防中暑。    旅客無懼高溫遊澳    本澳昨日受熱帶氣旋“格美”外圍下沉氣流影響，天氣非常酷熱，但不少居民堅持到西灣湖一帶舒展筋骨，亦有工人頭頂烈日繼續開工。至午間氣溫飆升，根據氣象局資料，外港碼頭錄得卅六點六度最高氣溫，大炮台、澳門污水處理廠、路環分站錄得卅六度，大潭山錄得卅四點二度。不少旅客無懼高溫，紛紛出動雨傘、太陽眼鏡及手提風扇等防曬降溫。媽閣廟、議事亭前地、大三巴一帶人流絡繹，凍飲及雪糕等消暑良品受歡迎。經查詢，衛生局表示，廿三日至昨日均沒有中暑個案。    今起持續驟雨雷暴    氣象局表示，“格美”昨晚約八時已於福建沿岸登陸，隨後向西北方向移入內陸，強度逐漸減弱。此外，受一道低壓槽影響，明日周末至下周初（廿七至卅一日）持續有驟雨及雷暴，呼籲居民留意最新天氣資訊，並適時做好預防措施。    氣象局續發出黃色高溫提示，預測今日天氣酷熱，多雲，短暫時間有陽光，有幾陣驟雨，稍後有幾陣雷暴，吹五至六及西南風及有陣風，氣溫為攝氏廿七至卅三度，相對濕度百分之六十五至九十八。路邊、一般性地區、高密度住宅區空氣質量水平良好至普通，沿海地區吹五至六級西南風及有陣風，視野微弱至平常。,http://www.macaodaily.com/html/2024-07/26/content_1770664.htm,旅客無懼高溫遊澳    本澳昨日受熱帶氣旋“格美”外圍下沉氣流影響，天氣非常酷熱，但不少居民堅持到西灣湖一帶舒展筋骨，亦有工人頭頂烈日繼續開工,“ 格美 ” 烤澳     昨錄 36 ℃         今續 酷熱 慎防 中暑         【 本報 消息 】 昨日 熱帶 氣旋 “ 格美 ” 遙距 “ 烤驗 ” 本澳 ， 今年 首個 橙色 高溫 提示 下 ， 昨多區 錄得 超過 攝氏卅 六度 高溫 ， 街外 猶如 烤 爐 ， 旅客 無懼 高溫 暢遊景點 。 料 今日 天氣 持續 酷熱 ， 居民 應 注意 防曬 補水 ， 慎防 中暑 。         旅客 無懼 高溫 遊澳         本澳 昨日 受熱帶 氣旋 “ 格美 ” 外圍 下沉 氣流 影響 ， 天氣 非常 酷熱 ， 但 不少 居民 堅持 到 西灣 湖一帶 舒展 筋骨 ， 亦 有 工人 頭頂 烈日 繼續 開工 。 至 午間 氣溫 飆升 ， 根據 氣象局 資料 ， 外港 碼頭 錄得卅六點 六度 最高 氣溫 ， 大 炮台 、 澳門 污水 處理廠 、 路環 分站 錄得 卅 六度 ， 大潭 山錄 得卅四點 二度 。 不少 旅客 無懼 高溫 ， 紛紛 出動雨傘 、 太陽 眼鏡 及 手提 風扇 等 防曬 降溫 。 媽閣 廟 、 議事亭 前 地 、 大三巴 一帶 人流 絡繹 ， 凍 飲及 雪糕 等 消暑 良品 受 歡迎 。 經查詢 ， 衛生局 表示 ， 廿三日 至 昨日 均 沒 有 中暑 個案 。         今起 持續 驟雨 雷暴         氣象局 表示 ， “ 格美 ” 昨晚 約八時 已 於 福建 沿岸 登陸 ， 隨後向 西北 方向 移入 內陸 ， 強度 逐漸 減弱 。 此外 ， 受 一道 低壓 槽 影響 ， 明日 周末 至下 周初 （ 廿七 至 卅一日 ） 持續 有 驟雨及 雷暴 ， 呼籲 居民 留意 最新 天氣 資訊 ， 並適 時 做好 預防 措施 。         氣象 局續 發出 黃 色 高溫 提示 ， 預測 今日 天氣 酷熱 ， 多 雲 ， 短暫 時間 有陽光 ， 有 幾陣 驟雨 ， 稍後有 幾陣 雷暴 ， 吹五至 六及 西南 風及 有 陣風 ， 氣溫 為 攝氏 廿七 至 卅三 度 ， 相對 濕度 百分之六十五 至 九十八 。 路邊 、 一般性 地區 、 高密度 住宅 區空氣 質量 水平 良好 至 普通 ， 沿海 地區 吹 五至 六級 西南 風及 有 陣風 ， 視野 微弱 至 平常 。,2024-07-26
