Title,Content,Link,Summary,Preprocessed_Content,Date
颱風“潭美”明入南海,颱風“潭美”明入南海    【本報綜合報道】據中新網、中國天氣網二十二日消息：今年第二十號颱風“潭美”二十二日凌晨在菲律賓以東洋面生成。中央氣象台預計，“潭美”將向西北方向移動，二十四日午後移入南海東部海面。    颱風“潭美”（熱帶風暴級）的中心二十二日下午五時位於菲律賓馬尼拉偏東方向約五百五十公里的西北太平洋洋面上，中心附近最大風力有八級（十八米／秒），中心最低氣壓為九百九十八百帕，七級風圈半徑一百五十至二百五十公里。中央氣象台預計，“潭美”將以每小時十五公里左右的速度向西北方向移動，強度逐漸增強，逐漸向菲律賓呂宋島東北部沿海靠近，西行穿過呂宋島北部後，於二十四日午後移入南海東部海面。    之後，在“潭美”靠近海南島和越南時，路徑可能變得撲朔迷離。據中國天氣網首席氣象分析師信欣介紹，由於二十六日以後，颱風北側副熱帶高壓將斷裂，颱風引導氣流會變弱，二十七日以後的路徑可能出現迴旋。因此，“潭美”是否登陸我國目前尚存懸念，但風雨影響肯定是少不了。    中央氣象台預計，二十三日至二十七日，受南下冷空氣和“潭美”的共同影響，台灣以東洋面、台灣海峽、南海大部海域、華南沿海以及華東南部沿海地區將出現較強的風雨天氣過程。    隨着颱風“潭美”逐漸逼近，福建沿海正全力以赴防抗颱風。目前，福建已啟動防颱風四級應急響應。福州市交通部門披露，連江黃岐至馬祖、馬尾至馬祖兩條“小三通”客運航線二十三日均雙向停航。,http://www.macaodaily.com/html/2024-10/23/content_1789327.htm,中央氣象台預計，“潭美”將以每小時十五公里左右的速度向西北方向移動，強度逐漸增強，逐漸向菲律賓呂宋島東北部沿海靠近，西行穿過呂宋島北部後，於二十四日午後移入南海東部海面,颱 風 “ 潭 美 ” 明入 南海         【 本報 綜合 報道 】 據 中新網 、 中國 天氣網 二十二日 消息 ： 今年 第二十 號 颱 風 “ 潭 美 ” 二十二日 凌晨 在 菲律賓 以東 洋面 生成 。 中央 氣象 台 預計 ， “ 潭 美 ” 將向 西北 方向 移動 ， 二十四日 午 後 移入 南海 東部 海面 。         颱 風 “ 潭 美 ” （ 熱帶 風暴級 ） 的 中心 二十二日 下午 五時位 於 菲律 賓馬 尼拉 偏東 方向 約 五百 五十公里 的 西北 太平洋 洋面 上 ， 中心 附近 最大 風力 有八級 （ 十八 米 ／ 秒 ） ， 中心 最低 氣壓 為 九百九十八 百帕 ， 七級 風圈 半徑 一百五十 至 二百五十 公里 。 中央 氣象 台 預計 ， “ 潭 美 ” 將以 每小時 十五公里 左右 的 速度 向 西北 方向 移動 ， 強度 逐漸 增強 ， 逐漸 向 菲律賓 呂 宋島東 北部 沿海 靠近 ， 西行 穿過 呂宋島 北部 後 ， 於 二十四日 午 後 移入 南海 東部 海面 。         之 後 ， 在 “ 潭 美 ” 靠近 海南 島和 越南 時 ， 路徑 可能 變得 撲 朔 迷離 。 據 中國 天氣網 首席 氣象 分析 師信 欣介紹 ， 由 於 二十六日 以 後 ， 颱 風北側 副 熱帶 高壓 將斷 裂 ， 颱 風 引導氣 流會 變弱 ， 二十七日 以 後 的 路徑 可能 出現 迴 旋 。 因此 ， “ 潭 美 ” 是否 登陸 我國 目前 尚存 懸念 ， 但風 雨影 響 肯定 是 少不了 。         中央 氣象 台 預計 ， 二十三日 至 二十七日 ， 受 南下 冷空氣 和 “ 潭 美 ” 的 共同 影響 ， 台灣 以東 洋面 、 台灣 海峽 、 南海 大部 海域 、 華南 沿海 以及 華東 南部 沿海 地區將 出現 較強 的 風 雨天 氣過程 。         隨着 颱 風 “ 潭 美 ” 逐漸 逼近 ， 福建 沿海 正 全力以赴 防抗 颱 風 。 目前 ， 福建 已 啟動 防颱 風四級 應急響 應 。 福州市 交通部 門 披露 ， 連江 黃 岐 至馬祖 、 馬 尾 至馬祖 兩條 “ 小三通 ” 客運 航線 二十三日 均 雙向 停航 。,2024-10-23
北方多地沿岸突發異常增水,北方多地沿岸突發異常增水    【中新社北京二十二日電】二十二日從中國自然資源部獲悉，二十日傍晚到二十一日下午，渤海和黃海中北部各潮位站在無明顯天氣系統的情況下出現八十厘米到一百六十厘米的增水。自然資源部已啟動海洋災害四級應急響應，並派出五個專家組趕赴遼寧、天津、河北、山東指導地方核查部分岸段異常增水情況，做好災情調查和評估工作。    二十日傍晚到二十一日下午，渤海和黃海中北部各潮位站在無明顯天氣系統的情況下出現八十厘米到一百六十厘米的增水，遼寧省沿岸出現了達到當地紅色警戒潮位的高潮位，河北省秦皇島市、唐山市和山東省煙台市出現了達到當地橙色警戒潮位的高潮位，天津市、河北省滄州市、山東省濰坊市和威海市出現了達到當地黃色警戒潮位的高潮位。此外，十九日中午，江蘇南通沿海還出現了達到當地紅色警戒潮位的高潮位。    雙潮疊加有關    監測顯示，本次異常增水過程強且持續時間長，一米左右的異常增水在渤海沿岸持續時間超過二十小時，疊加天文高潮導致二十一日凌晨前後遼寧省多個潮位站出現破歷史記錄的高潮位，遼寧、河北、天津等多地出現海水倒灌現象。目前，在國內外尚未發現有明確記載的此類案例。    自然資源部有關專家分析認為，此次異常增水主要與外海大範圍風暴潮波的震盪回流和天文高潮的疊加有關。在此次異常增水發生前，受冷空氣和出海氣旋共同影響，十八日至十九日，渤海灣、萊州和山東半島沿岸出現了一次強風暴潮過程。十九日下午至二十日白天，渤海沿岸普遍出現了最大超過一百厘米的持續減水過程，致大量海水在外海堆積，二十日夜間到二十一日早晨，堆積的海水震盪回流正好疊加在當地天文高潮上，導致遼寧、河北和天津等地沿岸普遍潮位較高。    目前，長江口以南沿海尚未發現異常增水，中國乃至全球其他海域同時段也未發現類似異常情況。,http://www.macaodaily.com/html/2024-10/23/content_1789328.htm,雙潮疊加有關    監測顯示，本次異常增水過程強且持續時間長，一米左右的異常增水在渤海沿岸持續時間超過二十小時，疊加天文高潮導致二十一日凌晨前後遼寧省多個潮位站出現破歷史記錄的高潮位，遼寧、河北、天津等多地出現海水倒灌現象,北方 多地 沿岸 突發 異常 增水         【 中新社 北京 二十二日 電 】 二十二日 從 中國 自然 資源部 獲悉 ， 二十日 傍晚 到 二十一日 下午 ， 渤海 和 黃 海 中北部 各 潮位 站 在 無明 顯天 氣系統 的 情況 下 出現 八十 厘米 到 一百六十 厘米 的 增水 。 自然 資源部 已 啟動 海洋 災害 四級 應急響 應 ， 並 派出 五個 專家 組趕 赴 遼寧 、 天津 、 河北 、 山東 指導 地方 核查 部分 岸段 異常增 水情 況 ， 做好 災情 調查 和 評估 工作 。         二十日 傍晚 到 二十一日 下午 ， 渤海 和 黃 海 中北部 各 潮位 站 在 無明 顯天 氣系統 的 情況 下 出現 八十 厘米 到 一百六十 厘米 的 增水 ， 遼寧省 沿岸 出現 了 達 到 當地 紅色 警戒 潮位 的 高潮 位 ， 河北省 秦皇 島市 、 唐山市 和 山東省 煙 台市 出現 了 達 到 當地 橙色 警戒 潮位 的 高潮 位 ， 天津市 、 河北省 滄 州市 、 山東省 濰坊 市 和 威海市 出現 了 達 到 當地黃色 警戒 潮位 的 高潮 位 。 此外 ， 十九日 中午 ， 江蘇 南通 沿海 還出現 了 達 到 當地 紅色 警戒 潮位 的 高潮 位 。         雙潮疊加 有關         監測 顯示 ， 本次 異常 增水 過程 強且 持續 時間 長 ， 一米 左右 的 異常 增水 在 渤海 沿岸 持續 時間 超過 二十 小時 ， 疊加 天文 高潮 導致 二十一日 凌晨 前後遼寧省 多個 潮位 站 出現 破 歷史 記錄 的 高潮 位 ， 遼寧 、 河北 、 天津 等 多 地 出現 海水 倒灌 現象 。 目前 ， 在 國內外 尚未 發現 有 明確 記載 的 此類 案例 。         自然 資源部 有關 專家 分析 認為 ， 此次 異常 增水 主要 與 外海 大範圍 風暴 潮波 的 震盪 回流 和 天文 高潮 的 疊 加有關 。 在 此次 異常 增水發 生前 ， 受冷 空氣 和 出海 氣旋 共同 影響 ， 十八日 至 十九日 ， 渤海 灣 、 萊州 和 山東 半島 沿岸 出現 了 一次 強風 暴潮 過程 。 十九日 下午 至 二十日 白天 ， 渤海 沿岸 普遍 出現 了 最大 超過 一百 厘米 的 持續 減水 過程 ， 致 大量 海水 在 外海 堆積 ， 二十 日夜 間 到 二十一日 早晨 ， 堆積 的 海水 震盪 回流 正好 疊加 在 當地 天文 高潮 上 ， 導致 遼寧 、 河北 和 天津 等 地 沿岸 普遍 潮位 較 高 。         目前 ， 長 江口 以南 沿海 尚未 發現 異常 增水 ， 中國 乃至 全球 其他 海域 同時 段 也 未發 現類 似異 常情 況 。,2024-10-23
天津肯德基被立案調查,使用轉基因大豆油未明示    天津肯德基被立案調查    【香港中通社二十二日電】近日，有內地媒體記者跟隨市場監管執法人員巡查美式連鎖餐廳“肯德基”發現，店內使用轉基因大豆油參與生產加工，卻並沒有對消費者明示。天津市場監管部門表示，多區市場執法人員對這一涉嫌違法行為進行了立案調查。    據多家內地媒體二十二日報道稱，天津市河西區市場監管執法人員在巡查一家“肯德基”時發現，該店內有兩桶“陽光牌”大豆油。該桶裝的顯著位置還標明為“餐飲原料、非零售”。    但是，經執法人員仔細查看該產品的配料表發現，該產品標明加工原料為轉基因大豆。執法人員隨即詢問該店負責人得知，這種使用轉基因大豆製造的大豆油主要用於該店烤製類產品，如豬肉、雞肉，烤翅、烤腿等，防止烤的產品出現“黏連”。    基於該店在餐飲加工環節中使用了轉基因食品，但並沒有向消費者明示。執法人員當即將該食用油封存扣押，並對該店進一步調查、處理。    據悉，為了保證消費者的知情權和選擇權，《食品安全法》第六十九條明確規定：生產經營轉基因食品應當按照規定顯著標示。同時該法第一百二十五條還規定，對於生產經營轉基因食品未按規定顯著標示的，沒收違法生產經營的食品，並可以沒收用於違法生產的工具、設備、原料等物品。,http://www.macaodaily.com/html/2024-10/23/content_1789329.htm,使用轉基因大豆油未明示    天津肯德基被立案調查    【香港中通社二十二日電】近日，有內地媒體記者跟隨市場監管執法人員巡查美式連鎖餐廳“肯德基”發現，店內使用轉基因大豆油參與生產加工，卻並沒有對消費者明示,使用 轉 基因 大豆油 未 明示         天津 肯德基 被 立案 調查         【 香港 中通社 二十二日 電 】 近日 ， 有 內 地 媒體 記者 跟 隨市場 監管執 法人 員 巡查 美式 連鎖 餐廳 “ 肯德基 ” 發現 ， 店內 使用 轉 基因 大豆油 參與 生產 加工 ， 卻並 沒 有 對 消費者 明示 。 天津市 場監 管部門 表示 ， 多區 市場執 法人 員 對 這一 涉嫌 違法行 為 進行 了 立案 調查 。         據 多家 內地 媒體 二十二日 報道 稱 ， 天津市 河西 區市場 監管執 法人 員 在 巡查 一家 “ 肯德基 ” 時 發現 ， 該店 內 有 兩桶 “ 陽光牌 ” 大豆油 。 該桶 裝的 顯著 位置 還標 明為 “ 餐飲 原料 、 非 零售 ” 。         但是 ， 經執 法人 員 仔細 查看 該產品 的 配料表 發現 ， 該產品 標明 加工 原料 為轉 基因 大豆 。 執 法人 員 隨即 詢問 該店 負責人 得知 ， 這種 使用 轉 基因 大豆 製 造 的 大豆油 主要 用 於 該 店 烤 製 類 產 品 ， 如豬 肉 、 雞肉 ， 烤 翅 、 烤 腿 等 ， 防止 烤 的 產品 出現 “ 黏連 ” 。         基 於 該 店 在 餐 飲 加工 環節 中 使用 了轉 基因 食品 ， 但並 沒 有 向 消費者 明示 。 執 法人 員當 即 將該 食用油 封存 扣押 ， 並對 該 店進 一步 調查 、 處理 。         據悉 ， 為 了 保證 消費者 的 知情 權和選擇權 ， 《 食品 安全法 》 第六十九 條明確 規定 ： 生產經 營轉 基因 食品 應當 按照 規定 顯著 標示 。 同時 該法 第 一百二十五 條還 規定 ， 對 於 生產經 營轉 基因 食品 未 按 規定 顯著 標示 的 ， 沒收 違法 生產 經營 的 食品 ， 並 可以 沒收用 於 違法 生產 的 工具 、 設備 、 原料 等 物品 。,2024-10-23
湘菜玩偶   中新社  圖／文,湘菜玩偶    長沙一玩偶店內的湘菜版毛絨玩具受到顧客熱捧。這些擁有表情的可愛玩偶，配上成人“煮飯仔”的烹飪形式，受到了年輕顧客的喜愛。    中新社  圖／文,http://www.macaodaily.com/html/2024-10/23/content_1789330.htm,這些擁有表情的可愛玩偶，配上成人“煮飯仔”的烹飪形式，受到了年輕顧客的喜愛,湘菜 玩偶         長 沙一 玩偶 店內 的 湘菜 版毛絨 玩具 受到 顧客 熱捧 。 這些 擁有 表情 的 可 愛 玩偶 ， 配 上 成人 “ 煮 飯 仔 ” 的 烹飪 形式 ， 受到 了 年 輕顧客 的 喜 愛 。         中新社     圖 ／ 文,2024-10-23
華為原生鴻蒙系統發佈,全球第三大移動操作系統    華為原生鴻蒙系統發佈    【中新社深圳二十二日電】中國首個國產移動操作系統——華為原生鴻蒙操作系統，在二十二日晚舉行的原生鴻蒙之夜暨華為全場景新品發佈會上正式發佈，這也是繼蘋果iOS和安卓系統後，全球第三大移動操作系統。    據介紹，原生鴻蒙已全面突破操作系統核心技術，而此前已經發佈過的鴻蒙系統，由於系統底座仍使用了部分AOSP開放源代碼，而不得不兼容部分安卓應用軟件。此次發佈的原生鴻蒙實現了系統底座的全部自研，系統的流暢度、性能、安全特性等功能提升顯著，也實現了操作系統的自主可控。    據華為常務董事、終端BG董事長、智能汽車解決方案BU董事長余承東介紹，原生鴻蒙在續航時間、安全和隱私保護等方面均屬於行業前列。目前已經有超過一萬五千個鴻蒙原生應用和元服務上架，覆蓋十八個行業，通用辦公應用覆蓋中國三千八百多萬家企業。    同時，原生鴻蒙實現了手機、平板、汽車座艙等多設備、多場景的互聯互通。原生鴻蒙基於全新分佈式軟總線，通過軟硬端雲協同，在更低功耗下跨設備連接速度可提升三倍，最多可同時連接四台設備，可實現跨設備互通掃描、跨設備互通圖庫、跨設備剪貼板等多種跨設備體驗。    在信息無障礙領域，原生鴻蒙首創AI聲音修復功能，實時修復言語障礙者所表達的語句，讓言語障礙者在面對面交流時也能“清晰表達”。    目前，支持鴻蒙系統的設備數量已超過十億，註冊開發者六百七十五萬。同時，華為已經和中國超過三百所高校展開合作，進一步加快技術研發和迭代速度。,http://www.macaodaily.com/html/2024-10/23/content_1789331.htm,據介紹，原生鴻蒙已全面突破操作系統核心技術，而此前已經發佈過的鴻蒙系統，由於系統底座仍使用了部分AOSP開放源代碼，而不得不兼容部分安卓應用軟件,全球 第三 大移動 操作 系統         華為 原生 鴻 蒙系 統發 佈         【 中新社 深圳 二十二日 電 】 中國 首個 國產 移動 操作 系統 — — 華為 原生 鴻 蒙 操作 系統 ， 在 二十二日 晚舉行 的 原生 鴻 蒙之夜 暨華為 全場景 新品 發 佈 會 上 正式 發 佈 ， 這也 是 繼蘋果 iOS 和 安卓系統 後 ， 全球 第三 大移動 操作 系統 。         據介紹 ， 原生 鴻 蒙 已 全面 突破 操作 系統 核心 技術 ， 而 此前 已經發 佈 過的 鴻 蒙系統 ， 由 於 系統 底座 仍 使用 了 部分 AOSP 開放源 代碼 ， 而 不得不 兼容 部分 安卓應 用 軟件 。 此次 發 佈 的 原生 鴻 蒙實現 了 系統 底座 的 全部 自研 ， 系統 的 流 暢度 、 性能 、 安全 特性 等 功能 提升 顯著 ， 也 實現 了 操作 系統 的 自主 可控 。         據華為 常務 董事 、 終端 BG 董事 長 、 智能 汽車 解決 方案 BU 董事 長 余承東 介紹 ， 原生 鴻 蒙在續 航時間 、 安全 和 隱私 保護 等 方面 均屬 於 行業 前列 。 目前 已經 有 超過 一萬 五千 個鴻蒙 原生 應用 和 元 服務 上架 ， 覆蓋 十八 個 行業 ， 通用 辦公應 用 覆蓋 中國 三千八百 多萬家 企業 。         同時 ， 原生 鴻 蒙實現 了 手機 、 平板 、 汽車 座 艙 等 多 設備 、 多場景 的 互聯 互通 。 原生 鴻 蒙基 於 全新 分 佈 式 軟 總線 ， 通過 軟硬端 雲協同 ， 在 更 低功耗 下 跨 設備 連接 速度 可 提升 三倍 ， 最多 可同 時連接 四台 設備 ， 可實現 跨 設備 互通 掃描 、 跨 設備 互通 圖庫 、 跨 設備 剪 貼板 等 多種 跨 設備 體驗 。         在 信息 無障礙 領域 ， 原生 鴻 蒙首創 AI 聲音 修 復 功能 ， 實時 修 復 言語 障礙者 所表達 的 語句 ， 讓言語 障礙者 在 面對面 交流 時 也 能 “ 清晰 表達 ” 。         目前 ， 支持 鴻 蒙系統 的 設備 數量 已 超過 十億 ， 註 冊 開 發 者 六百 七十五 萬 。 同時 ， 華為 已經 和 中國 超過 三百 所 高校 展開 合作 ， 進 一步 加快 技術 研發 和 迭代 速度 。,2024-10-23
賴清德施政滿意度續跌,賴清德施政滿意度續跌    【本報綜合報道】中時新聞網廿二日消息：台灣地區領導人賴清德就任至今已滿五個月，根據今日公佈的最新民調顯示，他的滿意度為三成七，與就職滿百日時相比下降三個百分點；不滿意度則為三成五，與滿意度的差距相當近。台灣網友批，賴清德既無政治實力也無個人魅力，所謂的優勢“人和”，也在賴清德強調不妥協的要求下無用武之地，是既強硬又擺爛。    滿意度僅三成七    根據TVBS民調中心今日公佈的最新民調顯示，賴清德的滿意度為三成七，其中有一成六民眾表示非常滿意，兩成一還算滿意，滿意度與就職滿百日時相比下降三個百分點。不滿意度三成五，其中一成五很不滿意，兩成不太滿意，與就職滿百日相比增加三個百分點，另外有兩成七的民眾未表示意見。    交叉分析結果顯示，八成二民進黨認同者滿意賴清德表現，百分之五不滿意；六成九國民黨認同者不滿意賴，百分之九滿意，兩成二沒意見；民眾黨認同者六成三不滿意賴，一成一滿意，兩成六沒意見，滿意度和不滿意度各增減一成；中立選民三成三不滿意賴，兩成八滿意，三成九沒意見。    卓榮泰滿意度跌    對於行政機構負責人卓榮泰，同一民調顯示，有三成四的民眾滿意卓榮泰表現，其中一成非常滿意，兩成四還算滿意，相較於今年八月廿六日就職百日時下降三個百分點；不滿意度和就職百日時一樣是三成四，其中一成五民眾表示很不滿意，一成九不太滿意，另有三成一的民眾沒有表示意見。    對於卓榮泰領導的行政團隊表現方面，滿意度和不滿意度都呈現下降情形，滿意度方面，由就職百日時的三成六下降三個百分點至三成三（百分之九非常滿意，兩成四還算滿意），不滿意度由四成三下降三個百分點至四成（一成七很不滿意，兩成三不太滿意），未表示意見者上升四個百分點至兩成七。,http://www.macaodaily.com/html/2024-10/23/content_1789332.htm,對於卓榮泰領導的行政團隊表現方面，滿意度和不滿意度都呈現下降情形，滿意度方面，由就職百日時的三成六下降三個百分點至三成三（百分之九非常滿意，兩成四還算滿意），不滿意度由四成三下降三個百分點至四成（一成七很不滿意，兩成三不太滿意），未表示意見者上升四個百分點至兩成七,賴清德 施政 滿意度續 跌         【 本報 綜合 報道 】 中時 新聞網 廿二日 消息 ： 台灣 地區 領導 人賴 清德 就任 至今 已滿 五個 月 ， 根據 今日 公 佈 的 最新 民調 顯示 ， 他 的 滿意度 為 三成 七 ， 與 就 職滿 百日 時 相比 下降 三個 百分 點 ； 不滿 意度則 為 三成 五 ， 與 滿意度 的 差距 相當近 。 台灣 網友批 ， 賴清德 既 無 政治 實力 也 無個 人 魅力 ， 所謂 的 優勢 “ 人 和 ” ， 也 在 賴清德 強調 不妥 協的 要求 下 無 用武之地 ， 是 既強 硬 又 擺爛 。         滿意度僅 三成 七         根據 TVBS 民調 中心 今日 公 佈 的 最新 民調 顯示 ， 賴清德 的 滿意度 為 三成 七 ， 其中 有 一成 六民眾 表示 非常 滿意 ， 兩成 一 還算 滿意 ， 滿意度 與 就 職滿 百日 時 相比 下降 三個 百分 點 。 不滿 意度 三成 五 ， 其中 一成 五 很 不 滿意 ， 兩成 不太滿意 ， 與 就 職滿 百日 相比 增加 三個 百分 點 ， 另外 有 兩成 七 的 民眾 未 表示 意見 。         交叉 分析 結果 顯示 ， 八成 二民 進黨 認同者 滿意賴 清德表現 ， 百分之五 不滿意 ； 六成 九國民黨 認同者 不滿 意賴 ， 百分之九 滿意 ， 兩成 二 沒意 見 ； 民眾 黨 認同者 六成 三不滿 意賴 ， 一成 一滿意 ， 兩成 六 沒意 見 ， 滿意度 和 不滿 意度 各 增減 一成 ； 中立 選民 三成 三不滿 意賴 ， 兩成 八滿意 ， 三成 九 沒意 見 。         卓榮 泰滿 意度 跌         對 於 行政 機構 負責人 卓榮泰 ， 同一 民調 顯示 ， 有 三成 四 的 民眾 滿意 卓榮 泰表現 ， 其中 一 成 非常 滿意 ， 兩成 四 還算 滿意 ， 相較 於 今年 八月 廿六日 就 職 百日 時 下降 三個 百分 點 ； 不滿 意度 和 就 職 百日 時一樣 是 三成 四 ， 其中 一成 五民眾 表示 很 不 滿意 ， 一成 九 不 太 滿意 ， 另有 三成 一 的 民眾 沒有 表示 意見 。         對 於 卓榮泰 領導 的 行政 團隊 表現 方面 ， 滿意度 和 不滿 意度 都 呈現 下降 情形 ， 滿意度 方面 ， 由 就 職 百日 時 的 三成 六 下降 三個 百分 點至 三成 三 （ 百分之九 非常 滿意 ， 兩成 四 還算 滿意 ） ， 不滿 意度 由 四成 三 下降 三個 百分 點至 四成 （ 一成 七 很 不 滿意 ， 兩成 三 不 太 滿意 ） ， 未 表示 意見者 上升 四個 百分 點至 兩成 七 。,2024-10-23
