Title,Content,Link,Summary,Preprocessed_Content,Date
新學年升中同比增千二生,昨多所中小幼校開學順利    新學年升中同比增千二生    【本報消息】約八成非高教學校昨日開學，教青局長龔志明、副局長丁少雄等昨日巡視各區學校，了解開學及各口岸跨境學童通關情況。今年升中學生較上一學年增加約千二人。龔志明表示，已與學校協調加開初一級近三十班，除了十多名學生較後期才報讀，近日安排面試外，其他學生入學基本已解決。    初一級增近三十班    今年非高教學生人數處於高峰，約八萬九千人，主要是初一、初二級學生，原因是十多年前的高出生率及不少學生回流升中，初一級較上一學年增加約一千二百人。龔志明昨日受訪表示，新學年與學校協調加開初一級近三十班，暑假期間已協調學生到校面談，目前基本已解決。現仍有十多名初一學生因較遲才回澳報讀，還在尋找學位，近日會陸續到校面試。    助收生不足校轉型    龔志明稱，現時出生率低，幼一級學生較少，學校整體課室足夠，會與學校協調整合資源，應對不同年級的學額需求。新學年因應收生不足的學校推出“學校發展資助計劃”，資助學校購置設備、轉型發展等，做好教學改革及師資培訓。    昨日開學，闊別校園一個多月的學生再次返校，顯得精神奕奕。龔志明等昨早兵分多路巡視各區學校，了解開學及各口岸跨境學童通關情況。昨日上午，龔志明等到交通控制及訊息中心，與交通事務局長林衍新等了解及協調開學日情況，整體交通順暢。    提前做好開學準備    鏡平學校昨日舉行開學禮，校長黎世祺受訪稱，為應對開學，全校教師提早一周回校準備，並召開家長會或家長學生聯席會議，通知家長協助學生做好開學準備。昨日學生都準時回校參加開學禮，精神面貌良好，開學順利。    勞校中學副校長林倫偉稱，上月中組織工友徹底清潔消毒校園，中學部分班主任通知一些學生提早回校，協助分發文具用品及佈置課室。中小幼三個校部教職員上周陸續回校參與各類會議和培訓，為新學年作準備。勞校多年前率先開展科創及人工智能教育，累積一定經驗。在教青局支持下，進一步完善智慧校園建設。新學年將積極完善校園軟硬件配套，善用網上教育平台、做好大數據收集及科技教學改革，推動教師專業發展。呼籲學生及早訂立目標和志向，調整好身心。    跨境學生通關順利    菜農子弟學校校長王國英稱，昨日開學基本沒有學生遲到，許多跨境生提早過關，學生及家長反饋過關順利，顯見各部門通力合作。新學年共有約二千五百名中、小幼學生，當中一百八十名新生，暫未受出生率影響。    王國英表示，將根據教青局指引做好編程教學，更新不同的資訊科技設備，融入教學，提高教學靈活性，亦着力增強師生互動。勉勵學生繼續努力學習，訂立學習計劃，朝目標進發。主動學習國家奧運健兒不屈不撓的精神，發放更多正能量。,http://www.macaodaily.com/html/2024-09/03/content_1778798.htm,昨多所中小幼校開學順利    新學年升中同比增千二生    【本報消息】約八成非高教學校昨日開學，教青局長龔志明、副局長丁少雄等昨日巡視各區學校，了解開學及各口岸跨境學童通關情況,昨 多所 中小 幼校 開學 順利         新學年 升中 同比 增千二生         【 本報 消息 】 約 八成 非 高教 學校 昨日 開學 ， 教青局 長 龔志明 、 副 局長 丁少雄 等 昨日 巡視 各區 學校 ， 了解 開學及 各口岸 跨境 學童 通關 情況 。 今年 升中學生 較 上 一學年 增加 約 千 二人 。 龔志明 表示 ， 已 與 學校 協調 加開 初一 級 近 三十 班 ， 除了 十多名 學生 較後期 才 報讀 ， 近日 安排 面試 外 ， 其他 學生 入學 基本 已解決 。         初一 級 增近 三十 班         今年 非 高教 學 生人 數處 於 高峰 ， 約八萬 九千 人 ， 主要 是 初一 、 初二 級學生 ， 原因 是 十多年 前 的 高 出生率 及 不少 學生 回流 升中 ， 初一 級 較 上 一學年 增加 約 一千二百 人 。 龔志明 昨日 受訪 表示 ， 新學年 與 學校 協調 加開 初一 級 近 三十 班 ， 暑假 期間 已協 調學生 到校 面談 ， 目前 基本 已解決 。 現 仍 有 十多名 初一 學生 因較 遲才 回澳 報讀 ， 還在 尋找 學位 ， 近日 會陸續 到校 面試 。         助收生 不足 校轉型         龔志明 稱 ， 現時 出生率 低 ， 幼一級 學生 較 少 ， 學校 整體 課室 足夠 ， 會 與 學校 協調 整合 資源 ， 應對 不同 年級 的 學額 需求 。 新學年 因應 收生 不足 的 學校 推出 “ 學校 發展 資助 計劃 ” ， 資助 學校 購置 設備 、 轉型 發展 等 ， 做好 教學 改革 及師 資培訓 。         昨日 開學 ， 闊別 校園 一個 多月 的 學生 再次 返校 ， 顯得 精神 奕奕 。 龔志明 等 昨早 兵分 多路 巡視 各區 學校 ， 了解 開學及 各口岸 跨境 學童 通關 情況 。 昨日 上午 ， 龔志明 等到 交通 控制 及訊息 中心 ， 與 交通 事務局 長 林衍 新 等 了解 及 協調 開學日 情況 ， 整體 交通 順暢 。         提前 做好 開學 準備         鏡平學校 昨日 舉行 開學禮 ， 校長 黎世祺受 訪稱 ， 為 應 對 開學 ， 全校 教師 提早 一周 回校 準備 ， 並召 開家長 會 或家長 學生 聯席會議 ， 通知 家長 協助 學生 做好 開學 準備 。 昨日 學生 都 準時 回校 參加 開學禮 ， 精神面貌 良好 ， 開學 順利 。         勞校 中學 副 校長 林倫偉稱 ， 上 月 中 組織 工友 徹底 清潔 消毒 校園 ， 中學 部分 班主任 通知 一些 學生 提早 回校 ， 協助 分發 文具用品 及 佈 置 課室 。 中小 幼三個 校部教 職員 上周 陸續 回校 參與 各類 會議 和 培訓 ， 為 新學 年作 準備 。 勞校 多年 前 率先 開展科 創及 人工智能 教育 ， 累積 一定 經驗 。 在 教青局 支持 下 ， 進 一步 完善 智慧 校園 建設 。 新學年 將積極 完善 校園 軟 硬件 配套 ， 善用 網上 教育 平台 、 做好 大數據 收集 及 科技 教學 改革 ， 推動 教師 專業 發展 。 呼籲 學生 及早 訂立 目標 和 志向 ， 調 整好 身心 。         跨境 學生 通關 順利         菜農 子弟 學校 校長 王國 英稱 ， 昨日 開學 基本 沒有 學生 遲到 ， 許多 跨境 生 提早 過關 ， 學生 及家長 反饋 過關 順利 ， 顯見 各部 門 通力合作 。 新學年 共有 約 二千五百 名中 、 小幼學生 ， 當中 一百八十 名 新生 ， 暫未受 出生率 影響 。         王國英 表示 ， 將根據 教青局 指引 做好 編程 教學 ， 更新 不同 的 資訊 科技 設備 ， 融入 教學 ， 提高 教學靈 活性 ， 亦 着力 增強 師生 互動 。 勉勵 學生 繼續 努力 學習 ， 訂立 學習 計劃 ， 朝目標 進發 。 主動 學習 國家 奧運健兒 不屈 不撓 的 精神 ， 發放 更 多 正 能量 。,2024-09-03
開學首日交通暢順,警方派員指揮    巴士增班疏導    開學首日交通暢順    【本報消息】大部分中小幼學校昨天開學，早上高士德一帶交通繁忙，警方增員指揮交通，疏導車流。治安警在三個口岸全面開放學生專道，方便跨境學生通關。兩巴亦增加班次、改用大運力車型疏導乘客。據當局資料顯示，開學首天交通大致暢順。    高峰巴士二千八班    開學首日不少學校舉行開學禮，部分學校錯峰開學，早上上學高峰時段稍為延遲。昨日上午八時半過後，高士德一帶車流漸多，高士德、雅廉訪、美副將等出現車龍，基本每個路口都有警員執勤，維持交通秩序。部分學校安排人員在校門外接學生入校，避免車輛長時間停留。鮑思高街、亞馬喇馬路塞車情況較嚴重，鮑思高球場彎位及鮑思高粵華小學門外塞滿車輛，交通警員在場指揮，務求盡快疏導車流。    為應付開學日的交通壓力，交通局、教青局、治安警、交諮委及兩家巴士公司代表，清晨起於交通控制及訊息中心監察開學日的路面交通狀況。根據巴士實時統計數據，昨日上午六時至九時，兩巴共開出超過二千八百班次，對比上周同時段增加五成三，較去年同期增加四成。總體乘客超過十一萬七千人次，對比去年同期下降百分之九，當中近一萬四千人次使用學生卡乘車。兩巴透過增開較大運量的車型及加開班次，加快疏導乘客，交通運作大致順暢。    口岸學童通道全開    據交通局資料，昨早高峰時段羅理基、高士德、河邊新街、氹仔廣東大馬路一帶曾出現短暫塞車，但行車大致暢順。治安警昨日早上啟動開學日交通指揮中心，落實執行預案部署。同時增派警員到交通繁忙路段和學校附近指揮及疏導，整體交通安全有序。    本澳關閘、青茂及橫琴三個口岸昨日早上全面開放學生專道，方便跨境學生通關。治安警亦調配警力在各出入境口岸協助維持秩序，通關暢順。    周內交通仍然繁忙    隨着本周陸續有學校開學及上課，預期出行需求仍會增加。當局呼籲師生及家長留意，及早規劃行程、盡量使用公共交通工具並錯峰出行。如需以車輛接載，要善用學校周邊的上落客區，切勿胡亂停泊加重道路壓力。居民亦要留意天氣狀況及交通資訊，預留充足的出行時間。,http://www.macaodaily.com/html/2024-09/03/content_1778799.htm,警方派員指揮    巴士增班疏導    開學首日交通暢順    【本報消息】大部分中小幼學校昨天開學，早上高士德一帶交通繁忙，警方增員指揮交通，疏導車流,警方 派員 指揮         巴士 增班 疏導         開學 首日 交通 暢順         【 本報 消息 】 大部分 中小 幼學校 昨天 開學 ， 早上 高士 德一帶 交通 繁忙 ， 警方 增員 指揮 交通 ， 疏導 車流 。 治安警 在 三個 口岸 全面 開放學生 專道 ， 方便 跨境 學生 通關 。 兩巴 亦 增加 班次 、 改用 大運力 車型 疏導 乘客 。 據 當局 資料 顯示 ， 開學 首天 交通 大致 暢順 。         高峰 巴士 二千 八班         開學 首日 不少 學校 舉行 開學禮 ， 部分 學校 錯峰 開學 ， 早上 上學 高峰 時段 稍 為 延遲 。 昨日 上午 八時 半過 後 ， 高士 德一帶 車流漸 多 ， 高士 德 、 雅廉訪 、 美副將 等 出現 車龍 ， 基本 每個 路口 都 有 警員 執勤 ， 維持 交通秩序 。 部分 學校 安排 人員 在校 門外 接學生 入校 ， 避免 車輛 長 時間 停留 。 鮑思高街 、 亞馬 喇馬路 塞車 情況 較 嚴重 ， 鮑思 高球 場彎位 及 鮑思 高粵華小學門 外塞滿 車輛 ， 交通警 員在場 指揮 ， 務求 盡快 疏導 車流 。         為 應付 開學日 的 交通 壓力 ， 交通局 、 教青局 、 治安警 、 交諮委及 兩家 巴士 公司 代表 ， 清晨 起 於 交通 控制 及訊息 中心 監察開 學日 的 路面 交通 狀況 。 根據 巴士 實時 統計 數據 ， 昨日 上午 六時 至九時 ， 兩巴共開 出超 過二 千八百 班次 ， 對 比 上周 同時 段 增加 五成 三 ， 較 去年同期 增加 四成 。 總體 乘客 超過 十一 萬 七千 人次 ， 對 比 去年同期 下降 百分之九 ， 當中近 一萬 四千人 次 使用 學生卡 乘車 。 兩巴 透過 增開 較 大運量 的 車型 及 加開 班次 ， 加快 疏導 乘客 ， 交通 運作 大致 順暢 。         口岸 學童 通道 全開         據 交通局 資料 ， 昨早 高峰 時 段羅理基 、 高士 德 、 河邊 新街 、 氹 仔廣東 大馬路 一帶 曾 出現 短 暫塞車 ， 但 行車 大致 暢順 。 治安警 昨日 早上 啟動 開學日 交通 指揮 中心 ， 落實 執行 預案 部署 。 同時 增派 警員到 交通 繁忙 路段 和 學校 附近 指揮及 疏導 ， 整體 交通安全 有序 。         本澳 關閘 、 青茂及 橫琴 三個 口岸 昨日 早上 全面 開放學生 專道 ， 方便 跨境 學生 通關 。 治安警 亦 調配 警力 在 各 出入境 口岸 協助 維持 秩序 ， 通關 暢順 。         周內 交通 仍然 繁忙         隨着 本周 陸續 有 學校 開學及 上 課 ， 預期 出行 需求 仍會 增加 。 當局 呼籲 師生 及家長 留意 ， 及早 規劃 行程 、 盡量 使用 公共 交通工具 並錯峰 出行 。 如 需以 車輛 接載 ， 要 善用 學校 周邊 的 上 落 客區 ， 切勿 胡亂 停泊 加重 道路 壓力 。 居民 亦 要 留意 天氣 狀況 及 交通 資訊 ， 預留 充足 的 出行 時間 。,2024-09-03
培正路環校部昨開學,家長滿意學校設施環境    培正路環校部昨開學    【本報消息】路環石排灣培正中學（路環校部）昨日投入運作。上午九時許，校長高錦輝及副校長郭敬文、楊珮欣等在校外迎接首批入讀該校部的學生。教青局副局長丁少雄等到場，由校方負責人陪同參觀學校設施，了解運作情況。丁少雄等並向學生問好，勉勵努力學習。    逾七成教職員是澳人    家長和學生首次返新校部，不忘於校內“打卡”。有家長表示，居於氹仔區，孩子返學更方便。有家長稱，早前已轉租路環附近屋苑，方便帶孩子上學。現場所見，不少家長駕車送子女返校，秩序良好。    高錦輝等稱，家長滿意新校部設施及環境。現時開設幼稚園初班至小學四年級，以及初中一年級。小一及初一各三班，其他各級兩班，合共十八班。逾一千二百人申請報讀，錄取及入讀學生有四百三十四名，未來會持續增加。學科除中文外採用全英文教學，如有需要，中文教材會以補充形式進行。七成多教職員是澳門人，逾七成教職員能操流利英語、粵語和普通話，個別能操葡語、日語等，為路環校部營造多語的學習環境。校舍八月中旬才進駐，仍有部分地方須增添設施及設備，藉以完善教學環境。    高士德校部同日開學    培正中學高士德校部小學及幼稚園亦於昨日上午開學，中學於下午開學，返校以及放學時間錯峰。    副校長陳敬濂稱，昨早不少家長特意請假接送學生。學生新學年重返校園非常雀躍。今天全校正式上課，中、小、幼的上放學時間亦不同。呼籲家長和學生留意天氣及交通消息，提早出行，並注意道路安全。,http://www.macaodaily.com/html/2024-09/03/content_1778802.htm,家長滿意學校設施環境    培正路環校部昨開學    【本報消息】路環石排灣培正中學（路環校部）昨日投入運作,家長 滿意 學校 設施 環境         培 正路 環校部 昨開學         【 本報 消息 】 路 環石 排灣培 正中 學 （ 路環 校部 ） 昨日 投入 運作 。 上午 九時許 ， 校長 高錦輝 及 副 校長 郭敬文 、 楊珮欣 等 在 校外 迎接 首批 入讀 該 校部 的 學生 。 教青局 副 局長 丁少雄 等到 場 ， 由 校方 負責人 陪同 參觀 學校 設施 ， 了解 運作 情況 。 丁少雄 等 並向 學生 問好 ， 勉勵 努力 學習 。         逾 七成 教職員 是 澳人         家長 和 學生 首次 返新 校部 ， 不 忘 於 校內 “ 打卡 ” 。 有家長 表示 ， 居 於 氹 仔區 ， 孩子 返學 更 方便 。 有家長 稱 ， 早前 已轉 租路環 附近 屋苑 ， 方便 帶 孩子 上學 。 現場 所見 ， 不少 家長 駕車 送 子女 返校 ， 秩序 良好 。         高錦輝 等 稱 ， 家長 滿意 新 校部 設施 及 環境 。 現時 開設 幼稚 園初 班 至 小學 四年 級 ， 以及 初中 一年 級 。 小一及 初一 各 三班 ， 其他 各級 兩班 ， 合共 十八班 。 逾 一千二百 人申 請 報讀 ， 錄取 及入 讀學生 有 四百 三十四 名 ， 未來會 持續 增加 。 學科除 中文 外 採用 全英文 教學 ， 如 有 需要 ， 中文 教材 會以 補充 形式 進行 。 七成 多教 職員 是 澳門 人 ， 逾 七成 教職員能 操 流利 英語 、 粵語 和 普通 話 ， 個別 能 操 葡語 、 日語 等 ， 為路 環校 部營造 多語 的 學習 環境 。 校舍 八月 中旬 才 進駐 ， 仍 有 部分 地方 須 增添 設施 及 設備 ， 藉以 完善 教學 環境 。         高士 德校部 同日 開學         培 正中 學 高士 德校 部小學 及 幼稚 園亦 於 昨日 上午 開學 ， 中學 於 下午 開學 ， 返校 以及 放學 時間 錯峰 。         副 校長 陳 敬 濂 稱 ， 昨早 不少 家長 特意 請假 接送 學生 。 學生 新學年 重返 校園 非常 雀躍 。 今天 全校 正式 上課 ， 中 、 小 、 幼 的 上 放學 時間 亦 不同 。 呼籲家長 和 學生 留意 天氣 及 交通 消息 ， 提早 出行 ， 並 注意 道路 安全 。,2024-09-03
體局：奧運為題展生動愛國敎育,國奧健兒結束三日訪澳行程離澳    體局：奧運為題展生動愛國敎育    【本報消息】國家奧運健兒代表團一連三天的行程豐富。代表團昨日下午結束訪澳行程，分別經機場及港珠澳大橋口岸返回內地。體育局代局長張子軒滿意成果，認為活動能加深本澳居民及青少年的民族自豪感。    學習堅毅不屈精神    張子軒指出，國家一直支持澳門多元發展，包括自回歸後在每屆奧運會後都派出代表團訪澳，體現國家對澳門的支持外，讓普羅大眾近距離觀看運動員的風采。他指代表團運動員在本次訪澳行程出席不同活動，覆蓋本澳多個區域，包括歷史城區、地標景點、不同社區及參與文創等，感受了澳門作為中西方文化特色交匯點的魅力，也鼓勵年輕運動員奮鬥追夢，澳門的青少年也能在奧運健兒身上學習堅毅不屈的體育精神。    他強調，本次奧運健兒代表團訪澳是以“奧運”為題，作一個生動的教育活動，更藉雙慶年及奧運年讓活動別具意義。張子軒感謝支持活動的社會賢達及企業，令活動在更多層面推廣，宣傳澳門的正面形象。    擬實名制杜絕炒賣    對於前晚舉辦的國家奧運健兒聯歡晚會在網上出現炒賣門票的情況，他指出，主辦方無論在門票售賣或派發上，都會作出不同的考量或措施，宗旨是希望有更多居民觀看演出，因而選用適合的場地——東亞運動會體育館，登記也以實名制度進行。對於能否以實名制進場，他指措施主要希望惠及不同階層或年齡層的居民，未來將與相關部門共同研究更多措施或方法，期望杜絕炒賣情況。    此外，粵港澳三地合辦的全運會及殘特奧會將在明年舉行，他稱特區政府重視全運會，及早成立了籌委會進行籌備工作。體育局將全力配合及支持相關工作，包括比賽場館及運動員備戰等。,http://www.macaodaily.com/html/2024-09/03/content_1778759.htm,他指代表團運動員在本次訪澳行程出席不同活動，覆蓋本澳多個區域，包括歷史城區、地標景點、不同社區及參與文創等，感受了澳門作為中西方文化特色交匯點的魅力，也鼓勵年輕運動員奮鬥追夢，澳門的青少年也能在奧運健兒身上學習堅毅不屈的體育精神,國奧健兒 結束 三日 訪澳 行程 離澳         體局 ： 奧運為 題展 生動 愛國 敎 育         【 本報 消息 】 國家 奧運健兒 代表 團一連 三天 的 行程 豐富 。 代表 團 昨日 下午 結束 訪澳 行程 ， 分別 經機場 及 港珠 澳大橋 口岸 返回 內地 。 體育 局代局 長 張子軒 滿意 成果 ， 認為 活動能 加深 本澳 居民 及 青少年 的 民族 自豪感 。         學習 堅毅 不屈 精神         張子軒 指出 ， 國家 一直 支持 澳門 多元 發展 ， 包括 自回 歸後在 每屆 奧運會 後 都 派出 代表 團訪 澳 ， 體現 國家 對 澳門 的 支持 外 ， 讓 普羅大眾 近距 離觀 看 運動員 的 風采 。 他 指 代表 團運動員 在 本次 訪澳 行程 出席 不同 活動 ， 覆蓋本 澳多個 區域 ， 包括 歷史 城區 、 地標 景點 、 不同 社區 及 參 與 文創 等 ， 感受 了 澳門作 為 中 西方 文化 特色 交匯點 的 魅力 ， 也 鼓勵 年 輕運動員 奮鬥 追夢 ， 澳門 的 青少年 也 能 在 奧運健兒 身上 學習 堅毅 不屈 的 體育 精神 。         他 強調 ， 本次 奧運健兒 代表 團訪 澳是 以 “ 奧運 ” 為題 ， 作一個 生動 的 教育 活動 ， 更 藉 雙慶年 及 奧運年 讓 活動別 具意義 。 張子軒 感謝 支持 活動 的 社會賢達 及 企業 ， 令活動 在 更 多 層面 推廣 ， 宣傳 澳門 的 正面 形象 。         擬實 名制 杜絕 炒 賣         對 於 前 晚舉 辦 的 國家 奧運健兒 聯歡 晚會 在 網上 出現 炒 賣門票 的 情況 ， 他 指出 ， 主辦 方無論 在 門票售 賣 或 派 發上 ， 都 會 作出 不同 的 考量 或 措施 ， 宗旨 是 希望 有 更 多 居民 觀看 演出 ， 因而 選用 適合 的 場地 — — 東亞 運動會 體育館 ， 登記 也 以 實名 制度 進行 。 對 於 能否 以實 名制 進場 ， 他 指 措施 主要 希望 惠及 不同 階層 或 年齡層 的 居民 ， 未來將 與 相關 部門 共同 研究 更 多 措施 或 方法 ， 期望 杜絕 炒 賣 情況 。         此外 ， 粵 港澳 三地 合辦 的 全運會 及 殘特 奧會將 在 明年 舉行 ， 他稱 特區 政府 重視 全運會 ， 及早 成立 了 籌委會 進行 籌備 工作 。 體育 局將 全力 配合 及 支持 相關 工作 ， 包括 比賽 場館 及 運動員備 戰等 。,2024-09-03
