Title,Content,Link,Summary,Preprocessed_Content,Date
國家六措撐中葡論壇,國家六措撐中葡論壇    【本報消息】中國——葡語國家經貿合作論壇（澳門）第六屆部長級會議開幕式，昨日上午舉行。中共中央政治局委員、全國人大常委會副委員長李鴻忠、九位葡語國家代表團團長分別致辭。行政長官賀一誠及論壇與會國代表團成員出席開幕式。李鴻忠在開幕式上就中葡論壇提出四點建議，並宣佈六項支持中葡論壇的新舉措。    開幕式昨日上午十時假中國與葡語國家商貿合作服務平台綜合體舉行，李鴻忠，安哥拉工業和貿易部部長魯伊·米根斯，巴西創業、微型企業和小型企業部常務副部長塔德烏·阿倫卡爾，佛得角副總理兼財政、商業發展與數字經濟部長奧拉沃·科雷亞，幾內亞比紹經濟、計劃與區域一體化部長蘇亞雷斯·桑布，赤道幾內亞貿易、工業與企業促進部副部長赫羅尼莫·奧薩，莫桑比克工業和貿易部副部長盧多維娜·貝爾納多，葡萄牙經濟部長佩德羅·雷斯，聖多美和普林西比國民議會副議長阿布尼爾多·德奧利維拉，以及東帝汶副總理兼經濟事務統籌部長、旅遊和環境部長黎發芳先後致辭。國家商務部長王文濤主持開幕式。    中葡論壇拓寬合作    開幕式前，李鴻忠與各葡語國家領導人及代表團團長合影。全國政協副主席何厚鏵、中央港澳工作辦公室副主任周霽、全國人大常委會副秘書長劉俊臣、中聯辦主任鄭新聰，以及崔世安、中央駐澳相關部門領導、澳門特區主要官員、行政會委員、立法議員、特區政府部門官員，以及各界人士等逾一千人出席開幕式。    李鴻忠表示，中葡論壇成立以來，中國與葡語國家的合作領域不斷拓寬，從經貿合作向教育、衛生、文化、體育、旅遊等領域不斷提升，在應對氣候變化、綠色發展、藍色經濟等領域不斷呈現新的合作，已成為不同社會制度、不同文化背景、不同發展階段國家的合作典範，成為推動構建人類命運共同體的力量。    中國正在以中國式現代化，全面推動強國建設、民族復興的偉業，中方願同葡語國家一同推動中葡合作，向更大範圍、更寬領域、更高層次邁進，為構建緊密的人類命運共同體提供更多強勁動能，為全球穩定、世界繁榮注入更多確定性和正能量。對此提出四點建議：    開放包容世界經濟    攜手共建開放包容的世界經濟。中國與葡語國家都是全球化的參與者、貢獻者、受益者，願與葡語國家一道支持以世界貿易組織為核心的多邊貿易體制，維護自由開放的貿易體系，推動世界經濟全球化達到更加開放、普惠、包容、均衡的方向發展。歡迎更多葡語國家加入到共建“一帶一路”倡議，以互聯互通為主線，開展更多合作，為國家經濟合作打造新平台。    促經濟發展現代化    攜手提升中葡經貿合作水平。中國與葡語國家優勢互補，經貿合作潛力巨大，中方已宣佈全面取消製造業領域的外資進入限制措施，將擴大服務領域開放，豐富服務消費，願與更多葡語國家商簽自由貿易協定、投資保護協議，擴大市場開放，促進葡語國家產品出口中國，提升貿易投資便利化水平；願在有意的葡語國家建設經貿合作區和工業園區，共同搭建投資合作平台，加強在設備、電信、能源、農業和自然資源等領域的合作，提高經濟發展的現代化水平。    中葡拓新質生產力    攜手拓展中葡新興領域合作。中葡與葡語國家在新興領域合作的前景廣闊，願與葡語國家加強科技交流合作，加快數字經濟發展，發展新質生產力，培育經濟新增長點；願與葡語國家共同促進綠色發展，在新能源、低碳合作領域開展合作，積極應對氣候變化、自然災害，實現可持續發展；願與葡語國家推動人文交流，歡迎葡語國家成為中國公民組團出境遊的目的地，為中國公民前往葡語國家提供便利。    發揮中葡平台作用    攜手提升澳門的中葡平台作用。澳門中葡平台在中葡論壇中發揮不可替代的作用，今年是澳門回歸廿五周年，中國將全面準確、堅定不移貫徹“一國兩制”、“澳人治澳”、高度自治的方針，保持澳門長期繁榮穩定。願與葡語國家一同提升澳門的中葡平台水平，更好建設葡語國家食品集散中心、中葡中小企業貿易服務中心、中葡經貿合作會展中心，辦好中國葡語國家經貿博覽會，支持澳門發展電商經濟，為葡語國家產品和服務進入中國市場提供便利；願與葡語國家一同不斷豐富澳門中葡商貿合作服務平台的內涵，拓展金融、科技、人文領域的合作，為新興領域提供支撐。,http://www.macaodaily.com/html/2024-04/23/content_1750237.htm,願與葡語國家一同提升澳門的中葡平台水平，更好建設葡語國家食品集散中心、中葡中小企業貿易服務中心、中葡經貿合作會展中心，辦好中國葡語國家經貿博覽會，支持澳門發展電商經濟，為葡語國家產品和服務進入中國市場提供便利,國家 六 措撐 中葡 論壇         【 本報 消息 】 中國 — — 葡語 國家 經貿 合作 論壇 （ 澳門 ） 第六 屆 部長 級 會議 開幕式 ， 昨日 上午 舉行 。 中共中央政治局 委員 、 全國 人大 常委 會 副 委員長 李鴻忠 、 九位 葡語 國家 代表 團團長 分別 致辭 。 行政 長 官賀 一誠及 論壇 與 會國 代表 團成員 出席 開幕式 。 李鴻忠 在 開幕式 上 就 中葡 論壇 提出 四點 建議 ， 並宣 佈 六項 支持 中葡 論壇 的 新 舉措 。         開幕式 昨日 上午 十時 假中國 與 葡語國 家商 貿 合作 服務 平台 綜合體 舉行 ， 李鴻忠 ， 安哥拉 工業 和 貿易 部部長 魯伊 · 米 根斯 ， 巴西 創業 、 微型 企業 和 小型 企業 部常務 副 部長 塔德 烏 · 阿倫卡爾 ， 佛得角 副 總理 兼 財政 、 商業 發展 與 數字 經濟 部長 奧 拉沃 · 科雷亞 ， 幾內亞 比紹 經濟 、 計劃 與 區域 一體化 部長 蘇亞雷斯 · 桑布 ， 赤道 幾內亞 貿易 、 工業 與 企業 促進 部副 部長 赫羅 尼莫 · 奧薩 ， 莫桑比克 工業 和 貿易 部副 部長 盧多維娜 · 貝爾納 多 ， 葡萄牙 經濟 部長 佩德 羅 · 雷斯 ， 聖多美 和 普林西比 國民議 會 副 議長 阿布尼爾多 · 德奧利維拉 ， 以及 東帝 汶 副 總理 兼 經濟 事務統 籌部長 、 旅遊 和 環境 部長 黎發芳 先後致 辭 。 國 家商 務部長 王文濤 主持 開幕式 。         中葡 論壇 拓寬 合作         開幕式 前 ， 李鴻忠 與 各 葡語 國家 領導 人及 代表 團團長 合影 。 全國政協 副 主席 何厚鏵 、 中央 港澳 工作 辦 公室 副 主任 周霽 、 全國 人大 常委 會 副 秘書長 劉俊臣 、 中聯辦 主任 鄭新聰 ， 以及 崔世安 、 中央 駐澳 相關 部門 領導 、 澳門 特區 主要 官員 、 行政 會委員 、 立法 議員 、 特區 政府 部門 官員 ， 以及 各界人士 等 逾 一千 人 出席 開幕式 。         李鴻忠 表示 ， 中葡 論壇 成立 以來 ， 中國 與 葡語 國家 的 合作 領域 不斷 拓寬 ， 從 經貿 合作 向 教育 、 衛生 、 文化 、 體育 、 旅遊 等 領域 不斷 提升 ， 在 應 對 氣候 變化 、 綠色 發展 、 藍色 經濟 等 領域 不斷 呈 現新 的 合作 ， 已成 為 不同 社會 制度 、 不同 文化背景 、 不同 發展 階段 國家 的 合作 典範 ， 成為 推動構 建人類 命運 共同 體的 力量 。         中國 正在 以 中國式 現代化 ， 全面 推動 強國 建設 、 民族 復 興 的 偉業 ， 中方 願同 葡語 國家 一同 推動 中葡 合作 ， 向 更 大範圍 、 更 寬 領域 、 更 高層次 邁進 ， 為 構建 緊密 的 人類 命運 共同 體 提供 更多 強勁動 能 ， 為 全球 穩定 、 世界 繁榮 注入 更多確 定性 和 正 能量 。 對此 提出 四點 建議 ：         開放 包容 世界 經濟         攜手 共建 開放 包容 的 世界 經濟 。 中國 與 葡語 國家 都 是 全球化 的 參與者 、 貢獻者 、 受益者 ， 願 與 葡語 國家 一道 支持 以 世界 貿易 組織 為 核心 的 多邊 貿易 體制 ， 維護 自由 開放 的 貿易 體系 ， 推動 世界 經濟 全球化 達到 更加 開放 、 普惠 、 包容 、 均衡 的 方向 發展 。 歡迎 更 多 葡語 國家 加入 到 共建 “ 一帶 一路 ” 倡議 ， 以互聯 互通 為主線 ， 開展 更 多 合作 ， 為國家 經濟 合作 打造 新 平台 。         促經濟 發展 現代化         攜手 提升 中葡 經貿 合作 水平 。 中國 與 葡語 國家 優勢 互補 ， 經貿 合作 潛力 巨大 ， 中方 已宣 佈 全面 取消 製 造 業 領 域 的 外 資 進 入 限制 措施 ， 將擴 大 服務 領域 開放 ， 豐富 服務 消費 ， 願 與 更 多 葡語國 家商 簽 自由 貿易 協定 、 投資 保護 協議 ， 擴大市場 開放 ， 促進 葡語 國家產品 出口 中國 ， 提升 貿易 投資 便利化 水平 ； 願 在 有意 的 葡語 國家 建設 經貿 合作 區和工業 園區 ， 共同 搭建 投資 合作 平台 ， 加強 在 設備 、 電信 、 能源 、 農業 和 自然 資源 等 領域 的 合作 ， 提高 經濟 發展 的 現代化 水平 。         中葡 拓新質 生產力         攜手 拓展 中葡 新興 領域 合作 。 中葡 與 葡語 國家 在 新興 領域 合作 的 前景 廣闊 ， 願 與 葡語 國家 加強 科技交流 合作 ， 加快 數字 經濟 發展 ， 發展 新質 生產力 ， 培育 經濟 新增 長點 ； 願 與 葡語 國家 共同 促進 綠色 發展 ， 在 新能源 、 低碳 合作 領域 開展 合作 ， 積極應 對 氣候 變化 、 自然 災害 ， 實現 可持續 發展 ； 願 與 葡語 國家 推動 人文 交流 ， 歡迎 葡語 國家成 為 中國 公民 組團 出境 遊的 目的地 ， 為 中國 公民 前往 葡語 國家 提供 便利 。         發揮 中葡 平台 作用         攜手 提升 澳門 的 中葡 平台 作用 。 澳門 中葡 平台 在 中葡 論壇 中 發揮 不可 替代 的 作用 ， 今年 是 澳門 回歸 廿五 周年 ， 中國將 全面 準確 、 堅定 不移 貫徹 “ 一國 兩制 ” 、 “ 澳人治澳 ” 、 高度 自治 的 方針 ， 保持 澳門長 期 繁榮 穩定 。 願 與 葡語 國家 一同 提升 澳門 的 中葡 平台 水平 ， 更好 建設 葡語 國家 食品 集散中心 、 中葡 中小 企業 貿易 服務 中心 、 中葡 經貿 合作 會展 中心 ， 辦好 中國 葡語 國家 經貿 博覽會 ， 支持 澳門 發展 電商 經濟 ， 為 葡語 國家產品 和服 務 進入 中國 市場 提供 便利 ； 願 與 葡語 國家 一同 不斷 豐富 澳門 中葡 商貿 合作 服務 平台 的 內涵 ， 拓展 金融 、 科技 、 人文 領域 的 合作 ， 為 新興 領域 提供 支撐 。,2024-04-23
李鴻忠：中葡語國合作共贏,李鴻忠：中葡語國合作共贏    【本報消息】中共中央政治局委員、全國人大常委會副委員長李鴻忠指出，中方堅持與葡語國家的友誼，中國政府言必行，言必信，行必果。    上屆部長級會議宣佈的舉措均已落實，下階段將推出六項新舉措，推動中葡經貿合作邁向新台階，包括促進貿易投資、擴展產業合作、加強發展合作、促進人力資源合作、推動醫療衛生合作及深化澳門平台作用。    助葡語國提升農業    一、促進貿易投資。支持葡語國家企業參與中國國際進口博覽會等重要會展，向企業提供出口信用保險，幫助中國企業與葡語國家企業開展合作，提供跨境融資，幫助中國企業擴大從葡語國家進口，為農產品、食品進口提供檢驗檢疫便利措施，加強貿易投資交流，編製中葡貿易投資指導手冊。    二、擴展產業合作。幫助有需要的葡語國家提升農業水平，設立和升級農業合作示範區。與更多葡語國家商簽航空運輸協議，密切人員交流。    小而美項目惠民生    三、加強發展合作，面向亞非葡語國家提供力所能及的幫助，幫助有意願的亞非葡語國家編制經濟發展規劃，統籌發展資金，在農業、衛生、文化、交通、基礎設施領域開展合作，實施一批小而美的民生項目。    四、促進人力資源合作。為葡語國家提供三千個培訓名額，為葡語國家學生到中國學習提供政治獎學金，支持澳門特別行政區邀請葡語國家到澳門開展旅遊領域的延伸學習。    五、推動醫療衛生合作。深化與葡語國家對口醫院合作，在葡語國家開展短期醫療項目，為葡語國家培育醫藥人才，在有條件的葡語國家設立中醫藥海外中心，向亞非葡語國家派遣三百人次的援外醫療隊。    金融科技澳門有為    六、深化澳門平台作用。支持澳門打造中國與葡語國家金融服務平台，發展以人民幣、澳門元等計價結算的國際債券市場；支持澳門建設中國與葡語國家科技合作平台，推動有條件的項目優先落地，支持在澳門建立中國與葡語國家視聽合作機制，開展多方面合作。    李鴻忠表示，中國古語講，“志合者不以山海為遠”。中國和葡語國家有着跨越時空、歷久彌新的友誼，是相向而行、面向未來的夥伴。中國願與葡語國家秉持合作共贏精神，堅持開放包容，加強團結互助，攜手構建人類命運共同體，共同推動中葡合作。,http://www.macaodaily.com/html/2024-04/23/content_1750238.htm,支持葡語國家企業參與中國國際進口博覽會等重要會展，向企業提供出口信用保險，幫助中國企業與葡語國家企業開展合作，提供跨境融資，幫助中國企業擴大從葡語國家進口，為農產品、食品進口提供檢驗檢疫便利措施，加強貿易投資交流，編製中葡貿易投資指導手冊,李鴻忠 ： 中葡 語國 合作 共贏         【 本報 消息 】 中共中央政治局 委員 、 全國 人大 常委 會 副 委員長 李鴻忠 指出 ， 中方 堅持 與 葡語 國家 的 友誼 ， 中國 政府 言 必行 ， 言必信 ， 行必果 。         上屆 部長 級 會議 宣 佈 的 舉措 均 已 落實 ， 下階段將 推出 六項 新 舉措 ， 推動 中葡 經貿 合作 邁向 新 台階 ， 包括 促進 貿易 投資 、 擴展 產業 合作 、 加強 發展 合作 、 促進 人力 資源 合作 、 推動 醫療 衛生 合作 及 深化 澳門 平台 作用 。         助 葡語國 提升 農業         一 、 促進 貿易 投資 。 支持 葡語 國家 企業 參與 中國國際 進口 博覽會 等 重要 會展 ， 向 企業 提供 出口 信用 保險 ， 幫助 中國 企業 與 葡語 國家 企業 開展 合作 ， 提供 跨境 融資 ， 幫助 中國 企業 擴大 從 葡語 國家 進口 ， 為 農產品 、 食品 進口 提供 檢驗 檢疫 便利 措施 ， 加強 貿易 投資 交流 ， 編 製 中葡 貿易 投資 指導 手冊 。         二 、 擴展 產業 合作 。 幫助 有 需要 的 葡語 國家 提升 農業 水平 ， 設立 和 升級 農業 合作 示範區 。 與 更 多 葡語國 家商 簽 航空 運輸 協議 ， 密切 人員 交流 。         小而美 項目 惠民 生         三 、 加強 發展 合作 ， 面向 亞非 葡語 國家 提供 力所能及 的 幫助 ， 幫助 有意 願 的 亞非 葡語 國家 編制 經濟 發展 規劃 ， 統籌 發展 資金 ， 在 農業 、 衛生 、 文化 、 交通 、 基礎 設施 領域 開展 合作 ， 實施 一批 小而 美的 民生 項目 。         四 、 促進 人力 資源 合作 。 為 葡語 國家 提供 三千 個 培訓 名額 ， 為 葡語 國家 學生 到 中國學習 提供 政治 獎學金 ， 支持 澳門 特別 行政 區邀 請 葡語 國家 到 澳門 開展 旅遊 領域 的 延伸 學習 。         五 、 推動 醫療 衛生 合作 。 深化 與 葡語 國家 對口 醫院 合作 ， 在 葡語 國家 開展 短期 醫療 項目 ， 為 葡語 國家 培育 醫藥 人才 ， 在 有 條件 的 葡語 國家 設立 中 醫藥 海外 中心 ， 向亞非 葡語 國家 派遣 三百 人次 的 援外 醫療隊 。         金融 科技 澳門 有 為         六 、 深化 澳門 平台 作用 。 支持 澳門 打造 中國 與 葡語 國家 金融 服務 平台 ， 發展 以 人民 幣 、 澳門元 等 計價 結算 的 國際 債券 市場 ； 支持 澳門 建設 中國 與 葡語 國家 科技 合作 平台 ， 推動 有 條件 的 項目 優先 落地 ， 支持 在 澳門 建立 中國 與 葡語 國家視 聽 合作 機制 ， 開展 多方面 合作 。         李鴻忠 表示 ， 中國古 語講 ， “ 志合者 不以 山海 為 遠 ” 。 中國 和 葡語 國家 有着 跨越 時空 、 歷久彌新 的 友誼 ， 是 相向 而行 、 面向 未來 的 夥伴 。 中國願 與 葡語 國家 秉持 合作 共贏 精神 ， 堅持 開放 包容 ， 加強 團結 互助 ， 攜手構 建人類 命運 共同 體 ， 共同 推動 中葡 合作 。,2024-04-23
中國推進與葡語國家經貿合作舉措,中國推進與葡語國家經貿合作舉措    （2024—2027）    一、貿易投資合作    ●中方願支持葡語國家企業參與中國國際進口博覽會、中國進出口商品交易會、中國國際服務貿易交易會、中國——葡語國家經貿博覽會（澳門）等重要展會，並提供便利。    ●中方願為中國企業與葡語國家企業在基礎設施、能源、船舶等重點行業合作提供出口信用保險支持，推動雙方貿易投資總額持續增長。    ●中方願提供貿易融資支持，幫助中國企業擴大自葡語國家進口。    ●中方願為自葡語國家進口食品、農產品提供檢驗檢疫等方面的便利化措施。    ●中方願加強與葡語國家貿易投資政策交流，編製中葡貿易投資指導手冊。    二、產業合作    ●中方願與葡語國家加強農業合作，幫助有需要的葡語國家提升農業生產、加工、存儲水平，在有意願的葡語國家設立或升級“農業合作示範區”。    ●中方願與有意願的葡語國家加強科技合作，開展聯合科考項目，建設聯合實驗室。    ●中方願與更多葡語國家加強航空運輸合作，商簽航空運輸協定，建立航權安排，密切人員交流。    三、發展合作    ●中方願與葡語國家加強發展合作政策對話，幫助有意願的亞非葡語國家編制經濟發展規劃。    ●中方願根據亞非葡語國家需求，統籌發展援助資金，在農業、衛生、文化、交通、基礎設施等領域開展合作，實施一批基建項目。    ●中方願根據亞非葡語國家需求，實施一批“小而美”民生項目，包括建設小型設施、提供一般物資、實施技術合作等。    四、人力資源合作    ●中方願為葡語國家提供三千個培訓名額，培養治國理政、扶貧減貧、互聯互通、生態環境、綠色發展等領域專業人才。    ●中方願為葡語國家學生來中國內地學習提供政府獎學金，支持澳門特別行政區政府為葡語國家學生赴澳門學習提供獎學金。    ●支持澳門特區政府邀請葡語國家人員赴澳門開展旅遊、醫療衛生領域研修實習。    五、醫療衛生合作    ●中方願深化與葡語國家對口醫院合作，在葡語國家開展義診或其他短期醫療項目。    ●中方願為葡語國家培訓傳統醫藥人才，在有條件的葡語國家設立中醫藥海外中心。    ●中方願向亞非葡語國家派遣三百人次的援外醫療隊。    六、澳門平台合作    ●支持橫琴粵澳深度合作區打造中國—葡語國家金融服務平台，支持澳門借助橫琴粵澳深度合作區發展以人民幣、澳門元等計價結算的國際債券市場。    ●支持澳門建設中國—葡語國家科技合作平台，推動符合條件的中葡項目優先在橫琴粵澳深度合作區落地。    ●支持在澳門建立中國與葡語國家視聽合作機制，開展政策對話、聯合製作、節目交流、技術合作、人才培養等方面合作。,http://www.macaodaily.com/html/2024-04/23/content_1750239.htm,中國推進與葡語國家經貿合作舉措    （2024—2027）    一、貿易投資合作    ●中方願支持葡語國家企業參與中國國際進口博覽會、中國進出口商品交易會、中國國際服務貿易交易會、中國——葡語國家經貿博覽會（澳門）等重要展會，並提供便利,中國 推進 與 葡語 國家 經貿 合作 舉措         （ 2024 — 2027 ）         一 、 貿易 投資 合作         ● 中方 願 支持 葡語 國家 企業 參與 中國國際 進口 博覽會 、 中國進 出口 商品交易 會 、 中國國際 服務貿易 交易 會 、 中國 — — 葡語 國家 經貿 博覽會 （ 澳門 ） 等 重要 展會 ， 並 提供 便利 。         ● 中方 願為 中國 企業 與 葡語 國家 企業 在 基礎 設施 、 能源 、 船舶 等 重點 行業 合作 提供 出口 信用 保險 支持 ， 推動 雙方 貿易 投資 總額 持續 增長 。         ● 中方 願 提供 貿易 融資 支持 ， 幫助 中國 企業 擴大自 葡語 國家 進口 。         ● 中方 願為 自 葡語 國家 進口 食品 、 農產品 提供 檢驗 檢疫 等 方面 的 便利化 措施 。         ● 中方 願加強 與 葡語 國家 貿易 投資 政策 交流 ， 編 製 中葡 貿易 投資 指導 手冊 。         二 、 產業 合作         ● 中方 願 與 葡語 國家 加強 農業 合作 ， 幫助 有 需要 的 葡語 國家 提升 農業 生產 、 加工 、 存儲 水平 ， 在 有意 願 的 葡語 國家 設立 或 升級 “ 農業 合作 示範區 ” 。         ● 中方 願 與 有意 願 的 葡語 國家 加強 科技 合作 ， 開展 聯合 科考 項目 ， 建設 聯合 實驗室 。         ● 中方 願 與 更 多 葡語 國家 加強 航空 運輸 合作 ， 商簽 航空 運輸 協定 ， 建立 航權 安排 ， 密切 人員 交流 。         三 、 發展 合作         ● 中方 願 與 葡語 國家 加強 發展 合作 政策 對話 ， 幫助 有意 願 的 亞非 葡語 國家 編制 經濟 發展 規劃 。         ● 中方 願根據 亞非 葡語 國家 需求 ， 統籌 發展 援助 資金 ， 在 農業 、 衛生 、 文化 、 交通 、 基礎 設施 等 領域 開展 合作 ， 實施 一批 基建 項目 。         ● 中方 願根據 亞非 葡語 國家 需求 ， 實施 一批 “ 小而美 ” 民生 項目 ， 包括 建設 小型 設施 、 提供 一般 物資 、 實施 技術 合作 等 。         四 、 人力 資源 合作         ● 中方 願為 葡語 國家 提供 三千 個 培訓 名額 ， 培養治國 理政 、 扶貧 減貧 、 互聯 互通 、 生態 環境 、 綠色 發展 等 領域 專業 人才 。         ● 中方 願為 葡語 國家學 生來 中國內 地學習 提供 政府 獎學金 ， 支持 澳門 特別 行政 區 政府 為 葡語 國家 學生 赴 澳門 學習 提供 獎學金 。         ● 支持 澳門 特區 政府 邀請 葡語國 家人 員 赴 澳門 開展 旅遊 、 醫療 衛生 領域 研修 實習 。         五 、 醫療 衛生 合作         ● 中方 願 深化 與 葡語 國家 對口 醫院 合作 ， 在 葡語 國家 開展 義診 或 其他 短期 醫療 項目 。         ● 中方 願為 葡語 國家 培訓 傳統 醫藥 人才 ， 在 有 條件 的 葡語 國家 設立 中 醫藥 海外 中心 。         ● 中方 願向 亞非 葡語 國家 派遣 三百 人次 的 援外 醫療隊 。         六 、 澳門 平台 合作         ● 支持 橫琴粵澳 深度 合作 區 打造 中國 — 葡語 國家 金融 服務 平台 ， 支持 澳門 借助 橫琴粵澳 深度 合作 區發展 以 人民 幣 、 澳門元 等 計價 結算 的 國際 債券 市場 。         ● 支持 澳門 建設 中國 — 葡語 國家 科技 合作 平台 ， 推動 符合 條件 的 中葡 項目 優先 在 橫琴粵澳 深度 合作 區 落地 。         ● 支持 在 澳門 建立 中國 與 葡語 國家視 聽 合作 機制 ， 開展 政策 對話 、 聯 合 製 作 、 節目 交流 、 技術 合作 、 人才 培養 等 方面 合作 。,2024-04-23
