Title,Content,Link,Summary,Preprocessed_Content,Date
今多雲驟雨,今多雲驟雨    【本報消息】氣象局預測今日多雲，部分時間有陽光，初時有幾陣驟雨，吹二至三級東北風，氣溫為攝氏二十五至三十二度，相對濕度百分之六十五至九十八。    路邊、高密度住宅區以及一般性空氣質量水平普通，沿海地區吹二至三級東北風，視野平常至良好。    預測明日天氣酷熱，天晴，部分時間多雲，吹微風，氣溫攝氏二十六至三十三度，相對濕度為百分之六十至九十五。    昨日天氣酷熱，天晴，部分時間多雲，氣溫攝氏二十六至三十三度，相對濕度百分之六十七至九十五，錄得最高紫外線指數為十點二，平均為五點五，強度屬於高。,http://www.macaodaily.com/html/2024-09/11/content_1780499.htm,昨日天氣酷熱，天晴，部分時間多雲，氣溫攝氏二十六至三十三度，相對濕度百分之六十七至九十五，錄得最高紫外線指數為十點二，平均為五點五，強度屬於高,今多雲驟 雨         【 本報 消息 】 氣象局 預測 今日 多 雲 ， 部分 時間 有陽光 ， 初時 有 幾陣 驟雨 ， 吹二至 三級 東北風 ， 氣溫 為 攝氏 二十五 至 三十二度 ， 相對 濕度 百分之六十五 至 九十八 。         路邊 、 高密度 住宅 區 以及 一般性 空氣 質量 水平 普通 ， 沿海 地區 吹二至 三級 東北風 ， 視野 平常 至 良好 。         預測 明日 天氣 酷熱 ， 天晴 ， 部分 時間 多 雲 ， 吹 微風 ， 氣溫 攝氏 二十六 至 三十三 度 ， 相對 濕度 為 百分之六十 至 九 十五 。         昨日 天氣 酷熱 ， 天晴 ， 部分 時間 多 雲 ， 氣溫 攝氏 二十六 至 三十三 度 ， 相對 濕度 百分之六十 七至 九 十五 ， 錄得 最高 紫外 線 指數 為 十點 二 ， 平均 為 五點 五 ， 強度屬 於 高 。,2024-09-11
六十澳青政務人才培訓結業,六十澳青政務人才培訓結業    【本報消息】由澳門工聯總會聯同屬下青年委員會及政務委員會合辦、澳門基金會資助的“澳門青年政務人才培訓計劃”，前晚七時半在工聯青年活動中心舉辦模擬政務辯論及結業禮，本年度共有六十名學員完成課程獲頒結業證書，當中十二名學員評為優秀學員。同時頒發模擬政務辯論“優秀組別”和“人氣組別”獎項。    模擬政務辯論    模擬政務辯論邀請工聯總會會長何雪卿、議員邱庭彪、澳廣視傳訊事務部總監何振明作評審。中聯辦社會工作部副處長王謐之，教育及青年發展局副局長黃嘉祺，工聯總會副會長、政務委員會主任林倫偉，議員李靜儀、梁孫旭、李振宇，工聯青年委員會主任程嘉雯，以及澳門青年政務人才培訓計劃籌委主任馮越洲等出席結業禮。    何雪卿寄語學員，新時代中國青年處在中華民族發展的最好時期，期望各位以更高的使命感同心建設澳門，成長為擔當民族復興重任的時代青年，在新征程青春的賽道上，奮力奔跑，爭取跑出當代青年的最好成績。    此次培訓課程由六月至八月舉辦，邀請本澳及外地眾多專業學者及議員等，透過專題講座、考察活動及實踐等，針對政務表達能力、邏輯思維能力及社會議題等，為學員提供培訓，並在過往課題上深化外交禮儀及演講技巧等，合計卅六學時。    認識社會事務    為堅持理論與實踐相結合，議員導師帶領組別學習，組織學員參觀立法會及前往橫琴粵澳深度合作區等地點考察，帶領青年認識澳門社會事務，提升學員的政務及社會綜合能力，為澳門青年“搭台搭梯”。期待未來能有更多青年投身於政務，為社會貢獻力量。學員以模擬政務辯論為學習作小總結，經過三個月培訓，學有所成，展現優良風采。自二○一五年起，工聯青年委員會開辦相關人才課程，至今培訓逾三百人。工聯總會未來將聯同屬下青年委員會及政務委員會，舉辦不同類型青年活動和培訓計劃，配合國家發展大局和澳門施政方針，為青年提供更多學習機會和展現創新和自我的平台，讓更多澳門優秀青年主動融入國家發展大局，為特區未來發展注入新力量。,http://www.macaodaily.com/html/2024-09/11/content_1780500.htm,六十澳青政務人才培訓結業    【本報消息】由澳門工聯總會聯同屬下青年委員會及政務委員會合辦、澳門基金會資助的“澳門青年政務人才培訓計劃”，前晚七時半在工聯青年活動中心舉辦模擬政務辯論及結業禮，本年度共有六十名學員完成課程獲頒結業證書，當中十二名學員評為優秀學員,六十 澳青政務 人才 培訓 結業         【 本報 消息 】 由 澳門 工聯 總會 聯同屬 下 青年 委員會 及 政務委員會 合辦 、 澳門 基金 會資助 的 “ 澳門 青年 政務 人才 培訓 計劃 ” ， 前 晚七時 半 在 工聯 青年 活動 中心 舉辦 模擬 政務 辯論 及 結業禮 ， 本年度 共有 六十名 學員 完成 課程 獲 頒 結業 證書 ， 當中 十二名 學員 評為 優秀學員 。 同時 頒 發模 擬政務 辯論 “ 優秀 組別 ” 和 “ 人氣 組別 ” 獎項 。         模擬 政務 辯論         模擬 政務 辯論 邀請 工聯 總會會長 何雪卿 、 議員 邱庭彪 、 澳廣視 傳訊 事務部 總監 何振明作 評審 。 中聯辦 社會 工作 部副 處長 王謐 之 ， 教育 及 青年 發展局 副 局長 黃 嘉祺 ， 工聯 總會 副 會長 、 政務委員會 主任 林倫偉 ， 議員 李靜儀 、 梁孫旭 、 李振宇 ， 工聯 青年 委員會 主任 程嘉雯 ， 以及 澳門 青年 政務 人才 培訓 計劃 籌委 主任 馮越洲 等 出席 結業禮 。         何雪卿 寄語 學員 ， 新時代 中國 青年 處 在 中華 民族 發展 的 最好 時期 ， 期望 各位 以 更 高 的 使命感 同心 建設 澳門 ， 成長 為 擔當 民族 復 興 重任 的 時代 青年 ， 在 新 征程 青春 的 賽道 上 ， 奮力 奔跑 ， 爭取 跑 出 當代 青年 的 最好 成績 。         此次 培訓 課程 由 六月 至 八月 舉辦 ， 邀請 本 澳及 外地 眾多 專業 學者 及 議員 等 ， 透過 專題 講座 、 考察 活動 及 實踐 等 ， 針對 政務表達 能力 、 邏輯 思維 能力 及 社會 議題 等 ， 為學員 提供 培訓 ， 並在 過往 課題 上 深化 外交 禮儀 及 演講 技巧 等 ， 合計卅六學時 。         認識 社會 事務         為 堅持 理論 與 實踐 相結合 ， 議員導 師帶 領組別 學習 ， 組織 學員 參觀 立法 會及 前往 橫琴粵澳 深度 合作 區等 地點 考察 ， 帶領 青年 認識 澳門 社會 事務 ， 提升 學員 的 政務及 社會 綜合 能力 ， 為 澳門 青年 “ 搭台 搭梯 ” 。 期待 未來 能 有 更 多 青年 投身 於 政務 ， 為 社會 貢獻 力量 。 學員以 模擬 政務 辯論 為 學習 作小總結 ， 經過 三個 月 培訓 ， 學 有所 成 ， 展現 優良 風采 。 自二 ○ 一 五年 起 ， 工聯 青年 委員會 開辦 相關 人才 課程 ， 至今 培訓 逾 三百 人 。 工聯 總會 未來 將聯 同屬 下 青年 委員會 及 政務委員會 ， 舉辦 不同 類型 青年 活動 和 培訓 計劃 ， 配合 國家 發展 大局 和 澳門 施政 方針 ， 為 青年 提供 更多學習 機會 和 展現 創新 和 自我 的 平台 ， 讓 更 多 澳門 優秀 青年 主動 融入 國家 發展 大局 ， 為 特區 未來 發展 注入 新 力量 。,2024-09-11
灣區個人信息跨境標準合同出台,向粵網信辦或澳個資局備案    灣區個人信息跨境標準合同出台    【本報消息】經濟及科技發展局訊：國家互聯網信息辦公室聯同澳門特區政府經濟及科技發展局、個人資料保護局，共同制定及推出《粵港澳大灣區（內地、澳門）個人信息跨境流動標準合同》便利措施。    便利灣區工作生活    《大灣區標準合同》便利措施，有助大灣區內地城市與澳門之間的個人信息數據跨境安全有序流動，並助力數據應用創新及澳門數字經濟發展，便利居民於大灣區工作及生活。    由九月十日起，在大灣區的九個內地城市（即廣州市、深圳市、珠海市、佛山市、惠州市、東莞市、中山市、江門市及肇慶市）與澳門企業或機構之間，可以選擇通過訂立《大灣區標準合同》的方式；並向廣東省網信辦或澳門個人資料保護局進行合同備案，進行大灣區內的跨境個人信息數據流動。    免除跨境流量限制    與內地現行的數據跨境安全管理框架相比，《大灣區標準合同》免除了個人信息處理者在個人信息跨境流動數量上的限制，簡化了個人信息保護影響評估的內容。《大灣區標準合同》對個人信息處理者及接收方的合同義務和責任、個人信息主體的權利、合同解除、違約責任、爭議解決方式等進行相關的規範，為大灣區個人信息數據跨境流動提供基礎。    當局短期辦宣講會    經濟及科技發展局與個人資料保護局，將於短期內舉辦宣講會，向業界及公眾介紹《大灣區標準合同》便利措施。    有關《大灣區標準合同》的實施指引及詳情，可參閱個人資料保護局網頁https://www.dspdp.gov.mo/。,http://www.macaodaily.com/html/2024-09/11/content_1780431.htm,向粵網信辦或澳個資局備案    灣區個人信息跨境標準合同出台    【本報消息】經濟及科技發展局訊：國家互聯網信息辦公室聯同澳門特區政府經濟及科技發展局、個人資料保護局，共同制定及推出《粵港澳大灣區（內地、澳門）個人信息跨境流動標準合同》便利措施,向粵網 信辦 或 澳個 資局 備案         灣區 個 人 信息 跨境 標準 合同 出台         【 本報 消息 】 經濟 及 科技 發展 局訊 ： 國家 互聯網 信息 辦 公室 聯同 澳門 特區 政府 經濟 及 科技 發展局 、 個 人 資料 保護局 ， 共同 制定 及 推出 《 粵 港澳 大灣區 （ 內地 、 澳門 ） 個 人 信息 跨境 流動 標準 合同 》 便利 措施 。         便利 灣區 工作 生活         《 大灣區 標準 合同 》 便利 措施 ， 有助 大灣區 內 地 城市 與 澳門 之間 的 個 人 信息 數據 跨境 安全 有序 流動 ， 並 助力 數據 應用 創新及 澳門 數字 經濟 發展 ， 便利 居民 於 大灣區 工作 及 生活 。         由 九月 十日 起 ， 在 大灣區 的 九個 內 地 城市 （ 即廣 州市 、 深圳市 、 珠海市 、 佛山市 、 惠州市 、 東莞市 、 中山市 、 江門市 及肇慶市 ） 與 澳門 企業 或 機構 之間 ， 可以 選擇 通過 訂立 《 大灣區 標準 合同 》 的 方式 ； 並向 廣東省 網信 辦 或 澳門個 人 資料 保護局 進行 合同 備案 ， 進行 大灣區 內 的 跨境 個 人 信息 數據 流動 。         免除 跨境 流量 限制         與 內 地 現行 的 數據 跨境 安全 管理 框架 相比 ， 《 大灣區 標準 合同 》 免除 了 個 人 信息 處理者 在 個 人 信息 跨境 流動 數量 上 的 限制 ， 簡化 了 個 人 信息 保護 影響 評估 的 內容 。 《 大灣區 標準 合同 》 對個 人 信息 處理者 及 接收 方 的 合同 義務 和 責任 、 個 人 信息 主體 的 權利 、 合同 解除 、 違約 責任 、 爭議 解決 方式 等 進行 相關 的 規範 ， 為 大灣區 個 人 信息 數據 跨境 流動 提供 基礎 。         當局 短期 辦宣 講會         經濟 及 科技 發展局 與 個 人 資料 保護局 ， 將於 短期 內舉 辦 宣講會 ， 向業界 及 公眾 介紹 《 大灣區 標準 合同 》 便利 措施 。         有關 《 大灣區 標準 合同 》 的 實施 指引 及 詳情 ， 可參 閱個 人 資料 保護局 網頁 https : / / www . dspdp . gov . mo / 。,2024-09-11
南網調研深合區保供電安全,南網調研深合區保供電安全    【本報記者廣州十日電】南方電網公司董事長孟振平近日到廣東珠海橫琴調研電力供應保障、橫琴數字零碳島共享實驗室建設情況，同時走訪“澳門新街坊”等項目，強調主動對接國家重大戰略，全力保障橫琴粵澳深度合作區供電安全穩定，助力建設便利澳門居民生活就業的新家園。    調研期間，孟振平首先走訪粵澳兩地攜手合作的首個綜合民生項目“澳門新街坊”，了解項目整體情況、對澳居民供電保障、電鴻化智能家居系統應用等情況。隨後，孟振平走進橫琴數字零碳島共享實驗室，觀摩智慧城市配用電平台、先進輸電技術平台、新能源並網技術平台，並與澳門中小微科創企業負責人溝通交流，了解實驗室面向科研團隊共享創新資源、推動數字化綠色化協同轉型的探索實踐，還觀看粵澳電力合作歷史展。在澳門客戶服務中心，孟振平詳細了解澳人澳企用電情況及公司服務澳人澳企用電舉措。    去年供澳電增一成    孟振平強調，要全力支持澳門更好融入國家發展大局，積極參與橫琴粵澳深度合作區建設，強化規則銜接、機制對接，以更安全可靠的電力供應、更優質貼心的供電服務，支撐澳門經濟適度多元的新產業發展，助力建設便利澳門居民生活就業的新家園。要深入把握發展機遇，以更大力度促進創新鏈、產業鏈、資金鏈、人才鏈“四鏈”深度融合，共建共享能源生態圈，推動能源領域數字化綠色化協同轉型，更好服務粵港澳大灣區高質量發展。據介紹，在橫琴粵澳深度合作區智慧能源監控中心，南方電網廣東珠海橫琴供電局工作人員實時監測電網“脈動”。廣東電網公司在橫琴實現配網電纜化、中壓開關自動化、通信光纖化、站房智能化“四個全覆蓋”，低壓客戶平均停電時間突破性實現每戶○點九八秒，讓停電“零感知”成為可能。    自一九八四年粵澳電力聯網以來，濠江兩岸電力合作日趨緊密。隨着粵港澳大灣區建設不斷提速，三地融合發展加快推進。去年，廣東電網公司對澳門輸送電量達五十三點二七億千瓦時，同比增長百分之九點三一。,http://www.macaodaily.com/html/2024-09/11/content_1780432.htm,南網調研深合區保供電安全    【本報記者廣州十日電】南方電網公司董事長孟振平近日到廣東珠海橫琴調研電力供應保障、橫琴數字零碳島共享實驗室建設情況，同時走訪“澳門新街坊”等項目，強調主動對接國家重大戰略，全力保障橫琴粵澳深度合作區供電安全穩定，助力建設便利澳門居民生活就業的新家園,南網 調研 深合區 保供 電 安全         【 本報 記者 廣州 十日 電 】 南方 電網 公司 董事 長 孟振平 近日 到 廣東 珠海 橫琴調 研電力 供應 保障 、 橫琴 數字 零碳島 共享 實驗室 建設 情況 ， 同時 走訪 “ 澳門 新 街坊 ” 等 項目 ， 強調 主動 對 接國家 重大 戰略 ， 全力 保障 橫琴粵澳 深度 合作 區供電 安全 穩定 ， 助力 建設 便利 澳門 居民 生活 就業 的 新家園 。         調研 期間 ， 孟振平 首先 走 訪粵澳 兩地 攜手 合作 的 首個 綜合 民生 項目 “ 澳門 新 街坊 ” ， 了解 項目 整體 情況 、 對澳 居民 供電 保障 、 電鴻化 智能家居 系統 應用 等 情況 。 隨後 ， 孟振平 走 進橫琴 數字 零碳島 共享 實驗室 ， 觀摩 智慧 城市 配用 電 平台 、 先進 輸電技術 平台 、 新能源 並網 技術 平台 ， 並與 澳門 中小 微科 創企業 負責人 溝通 交流 ， 了解 實驗室 面向 科研 團隊 共享 創新 資源 、 推動 數字化 綠色化 協同 轉型 的 探索 實踐 ， 還觀 看粵 澳電力 合作 歷史展 。 在 澳門 客戶 服務 中心 ， 孟振平 詳細 了解 澳人 澳企用 電情況 及 公司 服務 澳人 澳企用 電舉措 。         去年 供澳電 增一成         孟振平 強調 ， 要 全力支持 澳門 更好 融入 國家 發展 大局 ， 積極 參與 橫琴粵澳 深度 合作 區建設 ， 強化 規則 銜接 、 機制 對 接 ， 以 更 安全可靠 的 電力 供應 、 更 優質 貼心 的 供電 服務 ， 支撐 澳門 經濟 適度 多元 的 新產業 發展 ， 助力 建設 便利 澳門 居民 生活 就業 的 新家園 。 要 深入 把握 發展 機遇 ， 以 更 大 力度 促進 創新鏈 、 產業 鏈 、 資金鏈 、 人才 鏈 “ 四鏈 ” 深度 融合 ， 共建 共享 能源 生態 圈 ， 推動 能源 領域 數字化 綠色化 協同 轉型 ， 更好 服務粵 港澳 大灣區 高質量 發展 。 據介紹 ， 在 橫琴粵澳 深度 合作 區 智慧 能源 監控 中心 ， 南方 電網 廣東 珠海 橫琴供 電局 工作 人員 實時 監測 電網 “ 脈動 ” 。 廣東 電網 公司 在 橫琴 實現 配網 電纜化 、 中壓 開關 自動化 、 通信 光纖化 、 站房 智能化 “ 四個 全覆蓋 ” ， 低壓 客戶 平均 停電 時間 突破性 實現 每戶 ○ 點 九八 秒 ， 讓 停電 “ 零 感知 ” 成為 可能 。         自 一九八四年 粵澳 電力 聯網 以來 ， 濠江 兩岸 電力 合作 日趨 緊密 。 隨着粵 港澳 大灣區 建設 不斷 提速 ， 三地 融合 發展 加快 推進 。 去年 ， 廣東 電網 公司 對 澳門輸 送 電量 達 五十三 點 二七 億 千瓦 時 ， 同比 增長 百分之九 點三一 。,2024-09-11
關山月暨灣區名家展穗揭幕,關山月暨灣區名家展穗揭幕    展八十嶺南畫壇精英佳作    【本報記者廣州十日電】由廣東省政協辦公廳、廣州市政協辦公廳共同主辦的“壯麗關山 · 禮讚輝煌——關山月作品暨粵港澳大灣區書畫名家精品展”，昨天在廣州政協文史展示中心三樓開幕，展出關山月二十幅書畫珍品，其中《浩氣長存》和《梅石圖》是首次展出。展覽彙集八十位當代嶺南畫壇精英的優秀作品，彰顯嶺南畫壇藝術家踐行人民性、謳歌新時代的堅定立場，展現粵港澳大灣區書畫界多元共生、交流互鑒的繁榮景象。    兩畫作首次展出    今年是新中國成立七十五周年、人民政協成立七十五周年。七十五年來，廣大政協委員堅守初心、履職盡責，為我國革命、建設和改革事業作出積極貢獻。第二屆省政協常委、嶺南畫派第二代領軍人物關山月就是傑出代表，他秉承“筆墨當隨時代”、“折衷中西，融匯古今”的藝術主張，以其獨特的藝術造詣和創作風格，為新中國美術事業作出卓越貢獻。    關山月原名關澤霈，喜畫梅花，代表作品有《江山如此多嬌》、《俏不爭春》等，曾於一九三九年至一九四○年先後在澳門、香港舉辦抗戰畫展。展覽展出關山月二十幅書畫珍品，其中《浩氣長存》和《梅石圖》是首次展出。此外，還有來自粵港澳大灣區的中青年藝術英才代表，作品門類齊全，寫意墨彩飛揚、意蘊高妙，工筆富麗精巧、清新脫俗，展現粵港澳大灣區書畫界多元共生、交流互鑒的繁榮景象。    促灣區文化繁榮    關山月外孫、廣東畫院專職畫家關堅表示，關山月生前經常到香港和澳門交流，早年曾在港澳居住，與港澳聯繫密切，因此他有很多作品反映香港和澳門的城市景象。關堅表示，嶺南畫派關注當下生活，善於用畫展示時代內容，此次展覽關注新時代下粵港澳大灣區的繁榮景象，畫作中多反映深圳、香港和澳門的城市景色或者當地的花卉植物。    關堅指出，嶺南畫派有很多藝術家在香港和澳門發展，不乏有優秀的年輕人，希望未來能更注重粵港澳大灣區嶺南畫派的人才建設，給予年輕藝術家更多展示機會，促進大灣區文化繁榮。    該展覽還彙集了許欽松、李勁坤、林藍、劉斯奮、陳永鏘、方楚雄等八十位當代嶺南畫壇精英的優秀作品。展出作品門類齊全，包括山水畫卅一幅、花鳥畫廿六幅、人物畫十幅、書法十三幅。展覽展至十月十五日，周末及節假日正常開放。,http://www.macaodaily.com/html/2024-09/11/content_1780435.htm,關山月暨灣區名家展穗揭幕    展八十嶺南畫壇精英佳作    【本報記者廣州十日電】由廣東省政協辦公廳、廣州市政協辦公廳共同主辦的“壯麗關山 · 禮讚輝煌——關山月作品暨粵港澳大灣區書畫名家精品展”，昨天在廣州政協文史展示中心三樓開幕，展出關山月二十幅書畫珍品，其中《浩氣長存》和《梅石圖》是首次展出,關山 月 暨灣區 名家 展穗 揭幕         展 八十 嶺南 畫壇 精英 佳作         【 本報 記者 廣州 十日 電 】 由廣東 省政協 辦公廳 、 廣州 市政 協辦 公廳 共同 主辦 的 “ 壯麗 關山   ·   禮 讚 輝 煌 — — 關山 月 作品 暨粵 港澳 大灣區 書畫 名家 精品展 ” ， 昨天 在 廣州政協 文史 展示中心 三樓 開幕 ， 展出 關山 月 二十 幅書畫 珍品 ， 其中 《 浩氣長 存 》 和 《 梅石圖 》 是 首次 展出 。 展覽 彙 集 八十 位當代嶺 南畫壇 精英 的 優秀 作品 ， 彰 顯嶺 南畫壇 藝術家踐 行 人民性 、 謳歌 新 時代 的 堅定 立場 ， 展現粵 港澳 大灣區 書 畫界 多元 共生 、 交流 互 鑒 的 繁榮 景象 。         兩畫作 首次 展出         今年 是 新 中國 成立 七十五 周年 、 人 民政 協 成立 七十五 周年 。 七十五年 來 ， 廣 大政 協委員 堅守 初心 、 履職 盡責 ， 為 我國 革命 、 建設 和 改革 事業 作出 積極 貢獻 。 第二 屆 省政協 常委 、 嶺南畫 派 第二代 領軍 人物 關山 月 就是 傑出 代表 ， 他 秉承 “ 筆墨當 隨時代 ” 、 “ 折衷 中西 ， 融匯 古今 ” 的 藝術 主張 ， 以其 獨特 的 藝術 造詣 和 創作 風格 ， 為 新 中國 美術 事業 作出 卓越 貢獻 。         關山 月 原名 關澤霈 ， 喜畫 梅花 ， 代表作品 有 《 江山 如此 多嬌 》 、 《 俏不爭 春 》 等 ， 曾 於 一九三九年 至 一九四 ○ 年 先後在 澳門 、 香港 舉辦 抗戰 畫展 。 展覽 展出 關山 月 二十 幅書畫 珍品 ， 其中 《 浩氣長 存 》 和 《 梅石圖 》 是 首次 展出 。 此外 ， 還有 來 自粵 港澳 大灣區 的 中青年 藝術 英才 代表 ， 作品 門類 齊全 ， 寫意 墨彩 飛揚 、 意蘊 高妙 ， 工筆 富麗 精巧 、 清新 脫俗 ， 展現粵 港澳 大灣區 書 畫界 多元 共生 、 交流 互 鑒 的 繁榮 景象 。         促灣區 文化 繁榮         關山 月 外孫 、 廣東 畫院 專職 畫家 關堅 表示 ， 關山 月 生前 經常到 香港 和 澳門 交流 ， 早年 曾 在 港澳 居住 ， 與 港澳 聯 繫 密切 ， 因此 他 有 很多 作品 反映 香港 和 澳門 的 城市 景象 。 關堅 表示 ， 嶺南畫 派 關注 當下 生活 ， 善 於 用畫 展示 時代 內容 ， 此次 展覽關 注新 時代下粵 港澳 大灣區 的 繁榮 景象 ， 畫作 中 多 反映 深圳 、 香港 和 澳門 的 城市 景色 或者 當地 的 花卉 植物 。         關堅 指出 ， 嶺南畫 派 有 很多 藝術家 在 香港 和 澳門 發展 ， 不乏 有 優秀 的 年 輕人 ， 希望 未來 能 更 注重 粵 港澳 大灣區 嶺 南畫 派 的 人才 建設 ， 給予 年 輕藝術家 更 多 展示 機會 ， 促進 大灣區 文化 繁榮 。         該 展覽還 彙 集 了 許欽松 、 李勁 坤 、 林藍 、 劉斯奮 、 陳 永鏘 、 方 楚雄 等 八十 位當代嶺 南畫壇 精英 的 優秀 作品 。 展出 作品 門類 齊全 ， 包括 山水 畫卅 一幅 、 花鳥畫 廿六 幅 、 人物 畫 十幅 、 書法 十三 幅 。 展覽展 至 十月 十五日 ， 周末 及節 假日 正常 開放 。,2024-09-11
