Title,Content,Link,Summary,Preprocessed_Content,Date
（句句是甘）不信命  就是命    一鳴,不信命   就是命    是日甘句：問：你真的不信命嗎？答：真的，不信命就是我的命。    當焦慮正在生活不同領域和層面泛濫之際、內卷愈演愈烈的當下，鬆弛感真是一個好詞。不僅比起躺平、擺爛好得多，儘管大體上都是同類的詞，但是經過裝飾之後的況味，顯得比較“高級”。    據說鬆弛感一詞的走紅，源自有一位博主所分享的旅行見聞：此子在飛機上碰到了一家人齊齊出門旅行，卻因為小朋友的證件過期等原因，導致所有行李都被退回。在經歷這樣的事情後，最意外的是這家人依然其樂融融，並無抱怨或者生氣，重新處理好行李後又繼續開心聊天。這種從容淡定、波瀾不驚的態度就是所謂的鬆弛感。    曾經更早流行過的鈍感力一詞，則更為容易理解。    鈍感力可以直譯為“遲鈍的力量”，由日本作家渡邊淳一在《鈍感力》一書中首次提出的，意指人可以排除周圍干擾、勇往直前的態度和能力，強調應對困境的耐力，被認為是一種大智若愚的人生態度和處世智慧。    鈍感力作為一種積極的心理品質，被理解為人類通過降低自身的感受性，以更理性和放鬆的狀態去應對生活中的各種問題甚至是困境，避免應激事件造成的不良影響，促進健康和提高適應水準。    粵港澳大灣區的居民大概是最具鬆弛感的一群，大多數人實實在在地過生活，不喜虛妄、不總在攀比；不會言必稱天下大勢、喜談國家大計。他們穿牛仔褲、人字拖，照樣招搖過市也不會被睇唔起；還有“總着西裝只是老闆手下”的說法。無論在五星級酒店飲早茶，到街邊檔食牛腩粉，去大牌檔吃宵夜，都可以自得其樂。    鬆弛感讓不爭與自在成為追求目標，正合了《菜根譚》名句：“寵辱不驚，看庭前花開花落，去留無意，望天上雲卷雲舒”的境界。    一鳴,http://www.macaodaily.com/html/2024-09/12/content_1780596.htm,據說鬆弛感一詞的走紅，源自有一位博主所分享的旅行見聞：此子在飛機上碰到了一家人齊齊出門旅行，卻因為小朋友的證件過期等原因，導致所有行李都被退回,不 信命       就是 命         是 日 甘句 ： 問 ： 你 真的 不 信命 嗎 ？ 答 ： 真的 ， 不 信命 就是 我 的 命 。         當焦慮 正在 生活 不同 領域 和 層 面泛 濫之際 、 內卷 愈演愈烈 的 當下 ， 鬆 弛 感 真是 一個 好 詞 。 不僅 比起 躺平 、 擺爛 好得多 ， 儘 管 大 體 上 都 是 同 類 的 詞 ， 但是 經過 裝飾 之 後 的 況味 ， 顯得 比 較 “ 高級 ” 。         據 說 鬆 弛 感 一 詞 的 走 紅 ， 源自 有 一位 博主所 分享 的 旅行 見聞 ： 此子 在 飛機 上 碰到 了 一家人 齊齊 出門 旅行 ， 卻 因為 小朋友 的 證件 過期 等 原因 ， 導致 所有 行李 都 被 退回 。 在 經歷 這樣 的 事情 後 ， 最 意外 的 是 這 家人 依然 其樂 融融 ， 並無 抱怨 或者 生氣 ， 重新 處理 好 行李 後 又 繼續 開心 聊天 。 這種 從容 淡定 、 波瀾 不 驚 的 態度 就是 所謂 的 鬆 弛 感 。         曾經 更 早 流行 過的 鈍 感力 一詞 ， 則更為 容易 理解 。         鈍 感力 可以 直譯 為 “ 遲鈍 的 力量 ” ， 由 日本 作家 渡邊淳 一 在 《 鈍 感力 》 一書中 首次 提出 的 ， 意指 人 可以 排除 周圍 干擾 、 勇往直前 的 態度 和 能力 ， 強調 應 對 困境 的 耐力 ， 被 認為 是 一種 大智若愚 的 人生 態度 和 處世 智慧 。         鈍 感 力作 為 一種 積極 的 心理 品質 ， 被 理解 為 人類 通過 降低 自身 的 感受性 ， 以 更 理性 和 放 鬆 的 狀 態 去 應 對 生活 中 的 各種 問題 甚至 是 困境 ， 避免 應激 事件 造成 的 不良 影響 ， 促進 健康 和 提高 適應 水準 。         粵 港澳 大灣區 的 居民 大概 是 最 具 鬆 弛 感 的 一群 ， 大多 數人 實實 在 在 地過 生活 ， 不喜 虛妄 、 不 總 在 攀比 ； 不會言 必稱 天下 大勢 、 喜談國家 大計 。 他們 穿 牛仔 褲 、 人字拖 ， 照樣 招搖過 市 也 不會 被 睇 唔 起 ； 還有 “ 總着 西裝 只是 老 闆 手下 ” 的 說法 。 無論 在 五星 級 酒店 飲 早茶 ， 到 街邊 檔食 牛腩 粉 ， 去 大牌 檔 吃宵夜 ， 都 可以 自得 其樂 。         鬆 弛 感 讓 不 爭 與 自 在 成 為 追求 目標 ， 正合 了 《 菜根 譚 》 名句 ： “ 寵辱 不 驚 ， 看 庭前 花開 花落 ， 去留 無意 ， 望 天上 雲卷 雲舒 ” 的 境界 。         一鳴,2024-09-12
（斷章寫義）理想工作   穆  森,理想工作    長久以來，上大學一直被認為是幫助階級翻身、出社會後可爭取高薪工作的捷徑，但近幾年隨着高等教育費用飆升，美國年輕人不再執着於需要花費四年才能拿到的大專學位，越來越多人高中一畢業就投入普遍被認為不體面的藍領工作領域。其中還有不少人認為，藍領工作更不容易被AI取代，擁有更大的工作保障。    【摘自：〈美國Z世代跳過大學投入藍領行業〉， Valerie，Business Focus，二○二四年九月二日】    大概我們小時候都曾聽過這話：“努力讀書，長大後才可找到一份好工作。”這話看似簡單，實則隱含了不同的前設。首先，它將讀書與求職兩件事拉上關係，更在某程度上默認了只有讀書好，將來的工作才會好；其次，它定型了一種工作狀態，認為人必須專注在一份工作之上。    然而，世界已在不知不覺間極速改變。當大部分人依然覺得要讀好書、完成大學課程後才投身社會，大學畢業證書卻早已變得不再鍍金——當全球每年以數以千萬計的速度來“產出”大學生，大學證書早已貶值；果如是，誰又能確保一紙證書就能令人在求職路上暢通無阻？當大學課程所教授的內容已因資訊發達而喪失獨特性，只要擁有連通網絡的能力，社會上大多數人都能學到類近的知識；若然如此，繼續相信大學畢業證書與能力掛鈎，是否另一種不切實際的迷信？    “大學畢業找份好工”的問題，在於它令大多數人認定了飽讀詩書、能舒服坐在辦公室的工作才是好工，也令“工作無分貴賤”這句話淪為空談。當科技取代人類的討論出現，我們也許要把握機會，反思一下工作的真義。    （新世代的理想工作 · 二之一）    穆    森,http://www.macaodaily.com/html/2024-09/12/content_1780597.htm,【摘自：〈美國Z世代跳過大學投入藍領行業〉， Valerie，Business Focus，二○二四年九月二日】    大概我們小時候都曾聽過這話：“努力讀書，長大後才可找到一份好工作,理想 工作         長 久 以來 ， 上大學 一直 被 認為 是 幫助 階級 翻身 、 出 社會後可爭 取 高薪 工作 的 捷徑 ， 但近 幾年 隨着 高等教育 費用 飆升 ， 美國年 輕人 不再 執着 於 需要 花費 四年 才能 拿到 的 大 專學位 ， 越來 越 多 人 高中 一畢業 就 投入 普遍 被 認為 不體面 的 藍領 工作 領域 。 其中 還有 不少 人 認為 ， 藍領 工作 更 不 容易 被 AI 取代 ， 擁有 更 大 的 工作 保障 。         【 摘自 ： 〈 美國 Z 世代 跳過 大學 投入 藍領 行業 〉 ，   Valerie ， Business   Focus ， 二 ○ 二 四年 九月 二日 】         大概 我們 小 時候 都 曾 聽過 這話 ： “ 努力 讀書 ， 長 大後才 可 找到 一份 好 工作 。 ” 這話 看似 簡單 ， 實則 隱含 了 不同 的 前設 。 首先 ， 它 將讀 書 與 求職 兩件 事拉上關 係 ， 更 在 某 程度 上默認 了 只有 讀書 好 ， 將來 的 工作 才 會 好 ； 其次 ， 它 定型 了 一種 工作 狀態 ， 認為 人 必須 專注 在 一份 工作 之上 。         然而 ， 世界 已 在 不知 不 覺間 極速 改變 。 當 大部分 人 依然 覺得 要 讀 好 書 、 完成 大學課 程後才 投身 社會 ， 大學 畢業 證書 卻 早已 變得 不再 鍍金 — — 當 全球 每年 以數 以千萬計 的 速度 來 “ 產出 ” 大學生 ， 大學 證書 早已 貶值 ； 果 如是 ， 誰 又 能確 保一紙 證書 就 能 令人 在 求職 路上 暢通 無阻 ？ 當大學 課程 所 教授 的 內容 已 因資訊 發達 而 喪失 獨 特性 ， 只要 擁有 連通 網絡 的 能力 ， 社會 上 大多 數人 都 能 學到 類近 的 知識 ； 若然 如此 ， 繼續 相信 大學 畢業 證書 與 能力 掛 鈎 ， 是否 另 一種 不切 實際 的 迷信 ？         “ 大學 畢業 找份 好工 ” 的 問題 ， 在 於 它 令 大多 數人 認定 了 飽讀 詩書 、 能 舒服 坐在 辦 公室 的 工作 才 是 好工 ， 也 令 “ 工作 無分 貴賤 ” 這句 話 淪為 空談 。 當 科技 取代 人類 的 討論 出現 ， 我們 也 許要 把握 機會 ， 反思 一下 工作 的 真義 。         （ 新 世代 的 理想 工作   ·   二 之一 ）         穆         森,2024-09-12
（聲色點擊）御守之迷   王  和,御守之迷    日本是一個有很多妖怪傳說的國度，近山林的地方就有更多怪事流傳，因此寺廟與神社隨處可見，特別是神社，有的地方一條大街上有幾所。這與泰國的廟宇差不多，幾乎每條街都有。我想，這與它們所處的地理環境有關吧。其實整個東南亞，妖魔鬼怪的傳說也特別多，這說明了甚麼問題？大概是“死得人多”。再問為何會死那麼多人？那必定與其地理位置有關。東南亞多國均與環太平洋地震帶相連，而日本、印尼等島國就在環太平洋島弧之上，地震、海嘯常會發生。災後常伴隨瘟疫出現，山林中的瘴氣病毒往往又被引發出來，對於古代人而言，很自然就會想像各種妖魔鬼怪出來，於是就只有靠宗教的力量來鎮壓了。神社和寺廟多，不能說與此無關。    中國人為了保平安，會找寺廟或修道之人寫一道平安符護身，日本也有類似的文化。各大神社和寺廟都會做一種類似我們錦囊狀的護身之物，稱作御守。然而御守從內容物到佩戴方式，卻和中國的護身符有着很大差異；御守是由紙、木或金屬製成的“御神璽”，即神靈寄宿的護符之意，神社的神官透過稱為“御靈人”祈禱，將神力注入其中。御守封口處的繩結非常漂亮，這是為了將神官透過祈禱獲取的神力鎖住，因此古來便認為御守的繩結不可以解開，否則神力會散失。    這趟“慢遊”京都，參觀了不少當地人才會去的寺廟，雖偏遠一點的，卻大有特色。當然，出名的清水寺、金閣寺、八條神社等著名“景點”，還是一去再去的了。到了每一個寺廟和神社，妻都會挑選一些漂亮而有特色的御守，最後是一大包的給帶回來。問她買那麼多御守幹甚麼？妻云自己用不着的，用來送親朋好友也不錯啊！（重履蓬萊 · 二）    王    和,http://www.macaodaily.com/html/2024-09/12/content_1780598.htm,到了每一個寺廟和神社，妻都會挑選一些漂亮而有特色的御守，最後是一大包的給帶回來,御守 之迷         日本 是 一個 有 很多 妖怪 傳說 的 國度 ， 近 山林 的 地方 就 有 更 多 怪事 流傳 ， 因此 寺廟 與 神社 隨處 可見 ， 特別 是 神社 ， 有 的 地方 一條 大街 上 有 幾所 。 這與 泰國 的 廟宇 差不多 ， 幾乎 每條 街 都 有 。 我 想 ， 這與 它們 所處 的 地理 環境 有關 吧 。 其實 整個 東南亞 ， 妖魔鬼怪 的 傳 說 也 特別 多 ， 這說 明 了 甚麼 問題 ？ 大概 是 “ 死 得 人 多 ” 。 再 問為 何會 死 那麼 多 人 ？ 那 必定 與 其 地理位置 有關 。 東南亞 多國均 與環 太平洋 地震 帶 相連 ， 而 日本 、 印尼 等 島國 就 在 環 太平洋 島弧 之上 ， 地震 、 海嘯常會 發生 。 災後常伴 隨 瘟疫 出現 ， 山林 中 的 瘴氣 病毒 往往 又 被 引發 出來 ， 對 於 古代人 而言 ， 很 自然 就 會 想像 各種 妖魔鬼怪 出來 ， 於 是 就 只有 靠 宗教 的 力量 來鎮壓 了 。 神社 和 寺 廟 多 ， 不能 說 與 此無關 。         中國人 為 了 保平安 ， 會 找 寺 廟 或 修道 之人 寫 一道 平安 符護身 ， 日本 也 有類 似的 文化 。 各大 神社 和 寺 廟 都 會 做 一種 類似 我們 錦囊 狀 的 護身 之物 ， 稱作 御守 。 然而 御守 從 內容物 到 佩戴 方式 ， 卻 和 中國 的 護身 符 有着 很大 差異 ； 御守 是 由紙 、 木 或 金 屬 製 成 的 “ 御神璽 ” ， 即 神靈 寄宿 的 護符 之意 ， 神社 的 神官 透過 稱 為 “ 御靈人 ” 祈禱 ， 將 神力 注入 其中 。 御守 封口 處 的 繩結 非常 漂亮 ， 這是 為 了將 神官 透過 祈禱 獲取 的 神力 鎖住 ， 因此 古來 便 認為 御守 的 繩結 不 可以 解開 ， 否則 神力 會 散失 。         這趟 “ 慢遊 ” 京都 ， 參觀 了 不少 當地 人才 會 去 的 寺 廟 ， 雖 偏遠 一點 的 ， 卻大有 特色 。 當然 ， 出名 的 清水 寺 、 金閣 寺 、 八條 神社 等 著名 “ 景點 ” ， 還是 一去 再 去 的 了 。 到 了 每 一個 寺 廟 和 神社 ， 妻都會 挑選 一些 漂亮 而 有 特色 的 御守 ， 最後是 一 大包 的 給帶 回來 。 問 她 買 那麼 多 御守 幹 甚麼 ？ 妻云 自己 用不着 的 ， 用來 送 親朋 好友 也 不錯 啊 ！ （ 重履蓬 萊   ·   二 ）         王         和,2024-09-12
（菁菁樂道）當“男兒當入樽”照進現實   楊  菁,當“男兒當入樽”照進現實    在巴黎奧運會男籃小組賽中，當看完日本隊對法國隊的那場比賽後，我只有一個感想，那就是著名的日本動漫《男兒當入樽》，竟然照進了現實。    日本隊的控球後衛河村勇輝身高只有一米七二，而法國中鋒雲班耶馬則高達二米二二，身高差達到五十公分。然而比賽中，河村絲毫不為身高差困擾，靈活的控球技術像宮城良田，百發百中的三分球像三井壽，拼搶籃板像櫻木花道，清秀的長相像剪短髮的流川楓，而沉穩地組織和領導球隊則像赤木剛憲。如果不是因為法國隊有主場優勢，鹿死誰手還未可知。    惜敗之後，河村的發言更是讓人感嘆。    他說：“身為一名後衛，我沒有好好掌控住局面，輸了一場原本可以贏下來的比賽。這是我的責任。我們輸了，我必須要再進步，變得更好。”要知道，本場比賽中，他也創造了歷史：貢獻二十九分為全場最高，命中六個三分球，七個籃板和六次助攻，成為二十一世紀以來在奧運第四位單場至少拿到二十五分、五個籃板、五次助攻的球員，已可比肩NBA巨星。    《男兒當入樽》的動漫迷渴望這部作品搬上大熒幕，也是因為希望這部熱血動漫能有個圓滿的結局，希望湘北高中能實現制霸全國的夢想。但當井上雄彥兩年前終於給我們帶來《男兒當入樽》的電影時，不少人其實是失望的，因為湘北在全國大賽中輸給了山王。    有人說，剛剛結束的日本男籃對法國男籃，才是《男兒當入樽》的最佳續集。其實，從結果來看，一樣是令人遺憾的。也許當時沒看懂或者沒接受電影結局的人，至此終於明白，比賽有輸有贏，重要的是，沒有放棄熱愛，永不放棄熱愛。井上雄彥曾表示，《男兒當入樽》的電影不會再拍了。    感謝河村，在現實中用熱愛、努力、拼搏和忘我，續寫着《男兒當入樽》的神話。    楊    菁,http://www.macaodaily.com/html/2024-09/12/content_1780599.htm,但當井上雄彥兩年前終於給我們帶來《男兒當入樽》的電影時，不少人其實是失望的，因為湘北在全國大賽中輸給了山王,當 “ 男兒 當入 樽 ” 照進 現實         在 巴黎 奧運會 男籃 小 組賽 中 ， 當看 完 日本 隊 對 法國隊 的 那場 比賽 後 ， 我 只有 一個 感想 ， 那 就是 著名 的 日本 動漫 《 男兒 當入 樽 》 ， 竟然 照進 了 現實 。         日本 隊 的 控球 後 衛 河村 勇輝 身高 只有 一米 七二 ， 而法國 中鋒 雲班耶馬則 高達二米 二二 ， 身高 差達 到 五十 公分 。 然而 比賽 中 ， 河村 絲 毫不 為 身高 差困擾 ， 靈活 的 控球 技術 像 宮城 良田 ， 百發百中 的 三分球 像 三井 壽 ， 拼 搶 籃板 像櫻 木花 道 ， 清秀 的 長 相像 剪短 髮 的 流川楓 ， 而沉 穩地 組織 和 領導球 隊則 像 赤木 剛憲 。 如果 不是 因為 法國隊 有 主場 優勢 ， 鹿死 誰 手還 未可知 。         惜敗 之 後 ， 河村 的 發言 更是 讓 人 感嘆 。         他 說 ： “ 身為 一名 後 衛 ， 我 沒 有 好好 掌控 住 局面 ， 輸 了 一場 原本 可以 贏下 來 的 比賽 。 這是 我 的 責任 。 我們 輸 了 ， 我 必須 要 再 進步 ， 變得 更好 。 ” 要 知道 ， 本場 比賽 中 ， 他 也 創造 了 歷史 ： 貢獻 二十九 分為 全場 最高 ， 命中 六個 三分球 ， 七個 籃板 和 六次 助攻 ， 成為 二十一 世紀 以來 在 奧運 第四位 單場 至少 拿到 二十五分 、 五個 籃板 、 五次 助攻 的 球員 ， 已 可 比肩 NBA 巨星 。         《 男兒 當入 樽 》 的 動漫迷 渴望 這部 作品 搬上大 熒幕 ， 也 是 因為 希望 這部 熱血動 漫能 有個 圓滿 的 結局 ， 希望 湘北 高中 能 實現 制霸 全國 的 夢 想 。 但當 井上 雄彥 兩 年前 終於給 我們 帶來 《 男兒 當入 樽 》 的 電影時 ， 不少 人其實 是 失望 的 ， 因為 湘北 在 全國大賽 中輸給 了 山王 。         有人 說 ， 剛剛 結束 的 日本 男籃 對 法國 男籃 ， 才 是 《 男兒 當入 樽 》 的 最佳 續集 。 其實 ， 從 結果 來 看 ， 一樣 是 令人 遺憾 的 。 也 許當時 沒 看 懂 或者 沒 接受 電影 結局 的 人 ， 至此 終於 明白 ， 比賽 有輸 有贏 ， 重要 的 是 ， 沒有 放棄 熱愛 ， 永不 放棄 熱愛 。 井上 雄彥 曾 表示 ， 《 男兒 當入 樽 》 的 電影 不會 再 拍 了 。         感謝 河村 ， 在 現實 中用 熱愛 、 努力 、 拼搏 和 忘我 ， 續寫 着 《 男兒 當入 樽 》 的 神話 。         楊         菁,2024-09-12
（榕樹頭）永恆的悟空   公  榮,永恆的悟空    《黑神話：悟空》一上線便好評如潮。日前在電視上看了一場辯論，出席嘉賓都是專家學者，有人認為遊戲大賣是成功的文化輸出，也有人說遊戲中的悟空不戴緊箍兒，而且頭髮向上豎，這種髮型與動畫片《龍珠》中的悟空十分相似，是龍珠悟空的翻版，說不上文化輸出，爭論激烈，熱鬧得很。    不過，我認為這些爭論都不會有結果的，大家只是各抒己見，但用中國神話人物開發遊戲，又能賺得盆滿砵滿卻是事實。    悟空可以說是中國人最熟悉的角色，上世紀五十年代中，我在農村讀幼稚園，有一次學校帶我們到石岐看動畫片《大鬧天宮》，這是我第一次看到會動的孫悟空。從此，悟空嫉惡如仇、機靈勇猛的形象便深深地印在我的腦海裡。中國神話有許多神仙，悟空收得，說不定哪吒又會被關注了，這個充滿稚氣的孩子，頸掛鋼圈，手執火尖槍，足踏風火輪，在天地間飛馳，似乎也適合當遊戲主角。    其實好東西不用輸出都會被人採用的。大約二十多年前，類似的爭論也出現過，就是日本某遊戲裡的主角是《三國演義》裡的人物，當時有人向浙江法院提出訴訟，指這些外國公司未經同意就使用中國四大名著裡的人物，法院初審結果是判原訴人敗訴的。這裡雖然涉及知識產權的問題，但這些都是幾百年前的作品，又沒有後人註冊申請專利保護，開發遊戲的公司侵犯了誰的權利？要搞清楚真是不容易。    從另一個角度看，那種狀況也可以視為文化輸出。精神財富是人類的共同財產，當然這是指那些年代久遠的經典作品。    公    榮,http://www.macaodaily.com/html/2024-09/12/content_1780600.htm,日前在電視上看了一場辯論，出席嘉賓都是專家學者，有人認為遊戲大賣是成功的文化輸出，也有人說遊戲中的悟空不戴緊箍兒，而且頭髮向上豎，這種髮型與動畫片《龍珠》中的悟空十分相似，是龍珠悟空的翻版，說不上文化輸出，爭論激烈，熱鬧得很,永恆 的 悟空         《 黑神話 ： 悟空 》 一上線 便 好評 如潮 。 日前 在 電視 上 看 了 一場 辯論 ， 出席 嘉賓 都 是 專家 學者 ， 有人 認為 遊戲 大賣 是 成功 的 文化 輸出 ， 也 有人 說遊戲 中 的 悟空 不戴 緊箍兒 ， 而且 頭 髮 向上 豎 ， 這種 髮 型 與 動畫片 《 龍珠 》 中 的 悟空 十分相似 ， 是 龍珠 悟空 的 翻版 ， 說 不 上 文化 輸出 ， 爭論 激烈 ， 熱鬧 得 很 。         不過 ， 我 認為 這些 爭論 都 不會 有 結果 的 ， 大家 只是 各抒 己 見 ， 但用 中國 神話 人物 開發 遊戲 ， 又 能 賺 得 盆滿 砵 滿 卻 是 事實 。         悟空 可以 說 是 中國人 最 熟悉 的 角色 ， 上世紀 五十年代 中 ， 我 在 農村 讀 幼稚 園 ， 有 一次 學校 帶 我們 到 石岐 看動 畫片 《 大鬧 天宮 》 ， 這是 我 第一次 看到 會動的孫 悟空 。 從此 ， 悟空 嫉惡 如仇 、 機靈 勇猛 的 形象 便 深深地 印在 我 的 腦海裡 。 中國 神話 有 許多 神仙 ， 悟空 收 得 ， 說 不定 哪吒 又 會 被 關注 了 ， 這個 充滿 稚氣 的 孩子 ， 頸掛 鋼圈 ， 手 執火 尖槍 ， 足踏風 火輪 ， 在 天地 間 飛馳 ， 似乎 也 適合 當遊戲 主角 。         其實 好 東西 不用 輸出 都 會 被 人 採用 的 。 大約 二十多年 前 ， 類 似的 爭論 也 出 現過 ， 就是 日本 某遊 戲裡 的 主角 是 《 三國 演義 》 裡的 人物 ， 當時 有人 向 浙江 法院 提出 訴訟 ， 指 這些 外國 公司 未經 同意 就 使用 中國 四大名著 裡的 人物 ， 法院 初審 結果 是 判原訴 人敗訴 的 。 這裡 雖然 涉及 知識產權 的 問題 ， 但 這些 都 是 幾 百年 前 的 作品 ， 又 沒 有 後 人 註 冊 申 請 專 利 保 護 ， 開發 遊戲 的 公司 侵犯 了 誰 的 權利 ？ 要 搞清楚 真是 不 容易 。         從 另 一個 角度看 ， 那種 狀況 也 可以 視為 文化 輸出 。 精神 財富 是 人類 的 共同 財產 ， 當然 這是 指 那些 年代 久遠 的 經典 作品 。         公         榮,2024-09-12
