Title,Content,Link,Summary,Preprocessed_Content,Date
居民稱多次反映存消防隱患,居民稱多次反映存消防隱患    社區：整改後部分居民不聽勸阻    據封面新聞、上游新聞消息：南京明尚西苑居民樓發生火災已致十五人死亡，多層房屋留下煙燻的痕跡。當地電視台二○二二年報道，涉事小區曾兩次發生過類似火災。小區居民“半窮不窮的小桿子”，曾於二○二二年、二○二一年兩次發帖公開喊話物業和社區，稱大量電動車堆放在電梯間、業主推電動車進電梯，火災隱患大，自己多次反饋無果。    二月二十四日，該網民表示，他在最後一次發帖之後不久，便搬離了小區，“那是個拆遷安置小區，六棟樓都是三十層以上。帖子提到的情況太普遍了，當時就感覺早晚會出大事。”    電動車存火災隱患    小區居民馬林（化名）曾以“半窮不窮的桿子”的賬號，兩次發帖舉報電動車火災隱患，公開喊話物業和相關部門。火災之後，馬林被網民稱為“最早的預警人”。    馬林說，他的房子之前出租，二○一九年自己住了進去，發現火災隱患比較多。“一樓堆的全是電動車，電梯間也擺滿了。然後很多人習慣把電動車推進電梯，推回自己家的樓層充電。還有少部分人把電瓶取下來，拎回家充電。”    馬林表示，他曾通過市長熱線反映，也兩次向社區網格員反映，網格員回應會同步向物業和社區反饋，“一直沒動靜。我甚至提出，是不是可以安裝限制設備，讓電動車推不進去。他們反饋說，會對輪椅人士造成障礙。我也不知道該找誰，就發了兩次微博，也沒回音。”    遺憾無挽救遇難者    “我並不是甚麼預警人。這種人口密集還建房的小區或者老舊小區，電動車胡亂堆放或者進電梯，是普遍現象，肯定很多人一直在投訴反映，只不過我剛好留下了痕跡。”馬林說，很遺憾他的呼籲沒有挽救到那些遇難者。    對此，二十四日，該小區所屬的雨花台區西善橋街道明義社區一名工作人員告訴記者：“當時整改過了，可能有些不負責任的居民沒地方為電動車充電，不聽勸阻導致現在這種情況。”上述工作人員強調：“我們目前的工作重點就是整頓，屆時肯定會出台一個妥善的解決方案，像這種把電動車都放在架空層充電確實太危險了，接下來我們等上級部門出台的文件，進行整頓。以後主要還是靠小區物業來管理，我們會對其進行監督。”    記者聯繫了明尚西苑所屬的物業公司——南京新鴻運物業管理有限公司，一名工作人員在聽完記者描述後，掛斷了電話。,http://www.macaodaily.com/html/2024-02/25/content_1737030.htm,小區居民“半窮不窮的小桿子”，曾於二○二二年、二○二一年兩次發帖公開喊話物業和社區，稱大量電動車堆放在電梯間、業主推電動車進電梯，火災隱患大，自己多次反饋無果,居民 稱 多次 反映 存 消防 隱患         社區 ： 整改 後 部分 居民 不 聽 勸 阻         據 封面 新聞 、 上游 新聞 消息 ： 南京 明尚 西苑 居民 樓發 生火 災已致 十五 人 死亡 ， 多層 房屋 留下 煙 燻 的 痕跡 。 當地 電視台 二 ○ 二 二年 報道 ， 涉事 小區 曾 兩次 發生 過類 似火 災 。 小區 居民 “ 半窮 不窮 的 小桿子 ” ， 曾 於 二 ○ 二 二年 、 二 ○ 二 一年 兩次 發帖 公開 喊 話 物業 和 社區 ， 稱 大量 電動車 堆放 在 電梯間 、 業 主推 電動車 進電梯 ， 火災 隱患 大 ， 自己 多次 反饋 無果 。         二月 二十四日 ， 該 網民 表示 ， 他 在 最 後 一次 發帖 之 後 不久 ， 便 搬 離 了 小區 ， “ 那 是 個 拆遷 安置 小區 ， 六棟樓 都 是 三十 層 以上 。 帖子 提到 的 情況 太 普遍 了 ， 當時 就 感覺 早晚 會出 大事 。 ”         電動車 存火災 隱患         小區 居民 馬 林 （ 化名 ） 曾以 “ 半窮 不窮 的 桿子 ” 的 賬號 ， 兩次 發帖 舉報 電動車 火災 隱患 ， 公開 喊 話 物業 和 相關 部門 。 火災 之 後 ， 馬 林 被 網民稱 為 “ 最早 的 預警 人 ” 。         馬 林 說 ， 他 的 房子 之前 出租 ， 二 ○ 一 九年 自己 住 了 進去 ， 發現 火災 隱患 比 較 多 。 “ 一樓 堆 的 全是 電動車 ， 電梯間 也 擺滿 了 。 然 後 很多 人習 慣 把 電動車 推進 電梯 ， 推回 自己 家 的 樓層 充電 。 還有 少部分 人 把 電瓶取 下來 ， 拎 回家 充電 。 ”         馬 林 表示 ， 他 曾 通過 市長 熱線 反映 ， 也 兩次 向 社區 網格員 反映 ， 網格員 回應會 同步 向物業 和 社區 反饋 ， “ 一直 沒動靜 。 我 甚至 提出 ， 是不是 可以 安裝 限制 設備 ， 讓 電動車 推不進 去 。 他們 反饋 說 ， 會 對 輪椅 人士 造成 障礙 。 我 也 不 知道 該 找 誰 ， 就 發 了 兩次 微博 ， 也 沒 回音 。 ”         遺憾 無 挽救 遇難者         “ 我並 不是 甚麼 預警 人 。 這種 人口 密集 還 建房 的 小區 或者 老舊 小區 ， 電動車 胡亂 堆放 或者 進電梯 ， 是 普遍 現象 ， 肯定 很多 人 一直 在 投訴 反映 ， 只不過 我 剛好 留下 了 痕跡 。 ” 馬 林 說 ， 很 遺憾 他 的 呼籲 沒有 挽救 到 那些 遇難者 。         對此 ， 二十四日 ， 該小區 所屬 的 雨花台 區西善橋 街道 明義社區 一名 工作 人員 告訴 記者 ： “ 當時 整改 過了 ， 可能 有些 不 負責任 的 居民 沒 地方 為 電動車 充電 ， 不 聽 勸 阻導 致現 在 這種 情況 。 ” 上述 工作 人員 強調 ： “ 我們 目前 的 工作 重點 就是 整頓 ， 屆 時 肯定 會 出台 一個 妥善 的 解決 方案 ， 像 這種 把 電動車 都 放在 架空 層 充電確 實太 危險 了 ， 接下 來 我們 等 上級 部門 出台 的 文件 ， 進行 整頓 。 以 後 主要 還是 靠 小區 物業 來 管理 ， 我們 會 對 其 進行 監督 。 ”         記者 聯 繫 了 明 尚 西苑 所屬 的 物業 公司 — — 南京 新鴻運物業 管理 有限公司 ， 一名 工作 人員 在 聽 完記者 描述 後 ， 掛斷 了 電話 。,2024-02-25
西安女生遊峨眉山失聯17天,西安女生遊峨眉山失聯17天    【本報綜合報道】據極目新聞二十四日消息：二月二十四日，是西安女生陳小佳（化名）在四川省樂山市峨眉山失聯的第十七天，當地民警多次組織搜救犬搜查，也曾帶其母親上山參與搜救，二十四日上午，陳小佳的母親李女士表示，目前暫無進展，還沒有找到女兒。    “陳小佳今年二十三歲，在溫州讀大學，失聯時穿着長款的黑色棉襖，至今下落不明。”這樣一則消息，近日在社交媒體上廣為流傳，引起網友關注。    陳小佳母親李女士表示，女兒是一月二十九日離開西安前往成都的，後抵達峨眉山。她和女兒最後一次通話，是在二月七日晚上，女兒說自己有點喉嚨痛，此時一個人在峨眉山。八日，她發現女兒聯繫不上了，電話無法接通，發消息也沒人回。“二月八日我打了一天電話沒有人接，之後我就報了警。”    曾給閨蜜費解留言    緊接着，李女士也抵達了峨眉山，四處尋找卻沒有消息。    據封面新聞消息，陳小佳的閨蜜小雪（化名）告訴記者，陳小佳步行登山之前，給她留下一則“你要加油”的留言，讓她感覺很懵，擔憂陳小佳上山時的精神狀態。    李女士還表示，女兒此前精神方面落下了疾病，但經過長時間的治療，病情有所好轉，最近的交流中，沒有發現異常。女兒之前也獨自出去玩過，截至二十四日上午，此事暫無進展，還沒有找到女兒和手機。    警方多次搜山未果    據報道，知情人曾透露，陳小佳在雷洞坪靈覺寺附近打過電話，之後電話信號消失。後面有跡象顯示，可能又到懸崖邊去了。短短數日內，陳小佳兩次登上峨眉山，第一次是乘景區觀光車往返，第二次是徒步上山，並在山上留宿，二月七日晚上徒步下山。當天晚九時四十分左右，陳小佳曾出現在雷洞坪靈覺寺，其手機信號也顯示其在雷洞坪靈覺寺外停留。順着這一線索，樂山市公安局峨眉山景區分局民警多次組織搜救犬在該區域搜查，也曾帶李女士上山參與搜救，但沒有結果。    二十四日上午，樂山市公安局峨眉山景區分局工作人員表示，目前，還沒找到失聯人員和其手機，具體情況暫不清楚。,http://www.macaodaily.com/html/2024-02/25/content_1737032.htm,西安女生遊峨眉山失聯17天    【本報綜合報道】據極目新聞二十四日消息：二月二十四日，是西安女生陳小佳（化名）在四川省樂山市峨眉山失聯的第十七天，當地民警多次組織搜救犬搜查，也曾帶其母親上山參與搜救，二十四日上午，陳小佳的母親李女士表示，目前暫無進展，還沒有找到女兒,西安 女生 遊 峨眉山 失聯 17 天         【 本報 綜合 報道 】 據 極目 新聞 二十四日 消息 ： 二月 二十四日 ， 是 西安 女生 陳 小佳 （ 化名 ） 在 四川省 樂山市 峨眉山 失聯 的 第十七 天 ， 當地 民警 多次 組織 搜救 犬 搜查 ， 也 曾 帶 其 母親 上山 參與 搜救 ， 二十四日 上午 ， 陳 小佳 的 母親 李女士 表示 ， 目前 暫無進展 ， 還沒有 找到 女兒 。         “ 陳 小佳 今年 二十三 歲 ， 在 溫州 讀大學 ， 失聯時 穿着 長 款 的 黑色 棉襖 ， 至今 下落不明 。 ” 這樣 一則 消息 ， 近日 在 社交 媒體 上 廣為 流傳 ， 引起 網友 關注 。         陳 小佳 母親 李女士 表示 ， 女兒 是 一月 二十九日 離開 西安 前往 成都 的 ， 後 抵達 峨眉山 。 她 和 女兒 最 後 一次 通話 ， 是 在 二月 七日 晚上 ， 女兒 說 自己 有點 喉嚨 痛 ， 此時 一個 人 在 峨眉山 。 八日 ， 她 發現 女兒 聯 繫 不 上 了 ， 電話 無法 接通 ， 發 消息 也 沒人 回 。 “ 二月 八日 我 打 了 一天 電話 沒 有人 接 ， 之 後 我 就 報 了 警 。 ”         曾給 閨蜜費解 留言         緊 接着 ， 李女士 也 抵達 了 峨眉山 ， 四處 尋找 卻 沒 有 消息 。         據 封面 新聞 消息 ， 陳 小佳 的 閨蜜 小雪 （ 化名 ） 告訴 記者 ， 陳 小佳 步行 登山 之前 ， 給 她 留下 一則 “ 你 要 加油 ” 的 留言 ， 讓 她 感覺 很 懵 ， 擔憂 陳 小佳 上山 時 的 精神 狀態 。         李女士 還 表示 ， 女兒 此前 精神 方面 落下 了 疾病 ， 但經 過長 時間 的 治療 ， 病情 有所 好轉 ， 最近 的 交流 中 ， 沒有 發現 異常 。 女兒 之前 也 獨自 出去玩 過 ， 截至 二十四日 上午 ， 此事 暫無進展 ， 還沒有 找到 女兒 和 手機 。         警方 多次 搜山 未果         據 報道 ， 知情人 曾 透露 ， 陳 小佳 在 雷洞坪 靈覺 寺 附近 打過 電話 ， 之後電話 信號 消失 。 後 面有 跡象 顯示 ， 可能 又 到 懸崖邊 去 了 。 短短 數日 內 ， 陳 小佳 兩次 登上 峨眉山 ， 第一次 是 乘景區 觀光車 往返 ， 第二次 是 徒步 上山 ， 並在 山上 留宿 ， 二月 七日 晚上 徒步 下山 。 當天 晚九時 四 十分 左右 ， 陳 小佳 曾 出現 在 雷洞坪 靈覺 寺 ， 其手 機信號 也 顯示 其 在 雷洞坪 靈覺 寺 外 停留 。 順着 這一線索 ， 樂山市 公安局 峨眉山 景區 分局 民警 多次 組織 搜救 犬 在 該 區域 搜查 ， 也 曾 帶 李女士 上山 參與 搜救 ， 但 沒 有 結果 。         二十四日 上午 ， 樂山市 公安局 峨眉山 景區 分局 工作 人員 表示 ， 目前 ， 還沒 找到 失聯人員 和 其 手機 ， 具體 情況 暫 不 清楚 。,2024-02-25
魯漁船浙海域沉沒四人獲救,魯漁船浙海域沉沒四人獲救    【本報綜合報道】據新華社上海二十四日消息：交通運輸部東海救助局二十四日表示，二十四日凌晨一時許，一艘載有十二人的山東籍漁船在浙江海域沉沒，截至發稿時，已有四人獲救，救援仍在進行之中。    據央視新聞報道，山東籍漁船東海沉沒具體位置為北緯二十九度三十一分、東經一百二十三度三十二分海域（一百九十三海區七小區）。    據央廣網消息，山東省日照市嵐山區海洋漁業局表示，出事的山東籍漁船是魯嵐漁六一三一九船，鋼質，船長四十米，功率二百六十五千瓦。山東省相關部門一工作人員表示，這艘船是掛靠在山東日照，平時都在浙江活動，很少回山東。    據東海救助局介紹，事發地為舟山朱家尖島東南約六十五海浬。東海救助局接報後，已派出救援力量前往事發海域，全力參加搜救。,http://www.macaodaily.com/html/2024-02/25/content_1737034.htm,魯漁船浙海域沉沒四人獲救    【本報綜合報道】據新華社上海二十四日消息：交通運輸部東海救助局二十四日表示，二十四日凌晨一時許，一艘載有十二人的山東籍漁船在浙江海域沉沒，截至發稿時，已有四人獲救，救援仍在進行之中,魯漁船 浙 海域 沉沒四人 獲救         【 本報 綜合 報道 】 據 新華社 上海 二十四日 消息 ： 交通 運輸部 東海 救助 局 二十四日 表示 ， 二十四日 凌晨 一時許 ， 一艘 載有 十二 人 的 山東籍 漁船 在 浙江 海域 沉沒 ， 截至 發稿 時 ， 已有 四人 獲救 ， 救援 仍 在 進行 之中 。         據央視 新聞 報道 ， 山東籍 漁船 東海沉 沒 具體 位置 為北緯 二十九 度 三十一 分 、 東經 一百二十 三度 三 十二分 海域 （ 一百九十三 海區 七小區 ） 。         據央廣網 消息 ， 山東省 日照市 嵐山區 海洋 漁業局 表示 ， 出事 的 山東籍 漁船 是 魯嵐 漁 六一 三一九船 ， 鋼質 ， 船長 四十米 ， 功率 二百六十 五 千瓦 。 山東省 相關 部門 一 工作 人員 表示 ， 這艘 船 是 掛靠 在 山東 日照 ， 平時 都 在 浙江 活動 ， 很少 回山東 。         據 東海 救助 局介紹 ， 事發 地為 舟山 朱家尖 島東 南約 六十五 海浬 。 東海 救助 局接 報 後 ， 已 派出 救援 力量 前往 事發 海域 ， 全力 參加 搜救 。,2024-02-25
絲路花雨,絲路花雨    廿三日晚，經典舞劇《絲路花雨》在甘肅蘭州演出恭賀新春。演出現場，氣勢恢宏的“千手觀音”、婀娜多姿的“波斯舞”、風情萬種的“反彈琵琶”、飄逸絕美的“霓裳羽衣舞”等，讓台下觀眾連連讚嘆。（中新社）,http://www.macaodaily.com/html/2024-02/25/content_1737036.htm,演出現場，氣勢恢宏的“千手觀音”、婀娜多姿的“波斯舞”、風情萬種的“反彈琵琶”、飄逸絕美的“霓裳羽衣舞”等，讓台下觀眾連連讚嘆,絲路 花雨         廿三日 晚 ， 經典 舞劇 《 絲路 花雨 》 在 甘肅蘭州 演出 恭賀 新春 。 演出 現場 ， 氣勢 恢宏 的 “ 千手 觀音 ” 、 婀娜多姿 的 “ 波斯 舞 ” 、 風情 萬種 的 “ 反彈 琵琶 ” 、 飄逸絕 美的 “ 霓裳 羽衣 舞 ” 等 ， 讓 台下 觀眾連 連 讚 嘆 。 （ 中新社 ）,2024-02-25
俄防長赴前線視察部隊,俄烏衝突兩周年之際    俄防長赴前線視察部隊    【本報綜合報道】據香港中通社、觀察者網二十四日報道：俄烏衝突爆發兩周年之際，俄防長紹伊古當地時間二十四日赴俄烏衝突前線視察部隊。紹伊古說：“今天，就兵力比例而言，優勢在我們這邊。”    紹伊古在一個指揮中心對俄軍部隊說出上述話語。報道稱，俄軍方聲明稱，紹伊古聽取了匯報，稱俄軍在佔領工業中心阿夫傑耶夫卡後處於進攻態勢。    消息稱，紹伊古指出了無人機在特別軍事行動中的作用，並補充說，已計劃向軍隊供應使用人工智慧技術控制的無人機，這將提高其使用效率。    國防部引述紹伊古的話說，我們實現了這一步。它正在成為一種非常重要的武器。    除此之外，根據俄國防部通報，紹伊古下達了用電子戰裝備進一步強化俄軍中心集群的任務。    同時，軍官們向他報告了烏克蘭軍人在阿夫傑耶夫卡大規模投降的情況。紹伊古提醒道，必須人道地對待被俘虜的烏克蘭軍人。    二月二十四日是俄烏衝突爆發滿兩周年的日子，而衝突仍在持續。過去一年，俄烏衝突前線戰況激烈。俄羅斯《莫斯科共青團員報》稱，去年五月，俄軍奪取交通要地阿爾喬莫夫斯克（烏方稱巴赫穆特）；烏軍於去年六月在多個方向發起反攻，但數月來進展緩慢、未見成效；去年十月初以來，俄軍對烏東部的阿夫傑耶夫卡、馬林卡、巴赫穆特等地烏軍防線發動新一輪攻勢。    本月十七日，缺兵少彈的烏軍撤出防禦重鎮阿夫傑耶夫卡，這被視為去年五月以來前線出現的最大變化，《紐約時報》稱此役對烏方可謂“具有戰略和象徵意義的雙重打擊”。    烏稱擊落俄預警機    當地時間二十三日晚，烏克蘭空軍司令奧列修克在電報頻道上發文稱，烏軍又擊落了一架俄軍A-50空中預警機。奧列修克同時發佈的影片顯示，一架飛機在夜空中起火。這是烏軍一個多月內第二次發佈關於擊落A-50預警機的消息。    根據《基輔獨立報》消息，烏國防部情報總局證實這架飛機是在與烏空軍的聯合行動中被擊落的。烏軍方稱，這次事件是對俄軍事能力的“又一次沉重打擊”。    根據路透社報道，A-50於蘇聯時代末期首次投入使用，是一種大型機載預警和控制飛機，可掃描數百公里外的敵方飛機、艦艇和導彈。    先進的偵察機被視為俄軍協調地面行動的關鍵。“A-50被摧毀很可能會影響俄軍在衝突地區‘全天候’進行行動和通訊的能力。”烏國防部情報總局局長布達諾夫當時說。    攔截多架烏無人機    俄羅斯國防部稱，當地時間二月二十四日○時二十分至二時，俄軍分別在庫爾斯克州和圖拉州上空攔截一架烏克蘭無人機。此外，俄軍還在利佩茨克州上空攔截兩架烏軍無人機。,http://www.macaodaily.com/html/2024-02/25/content_1737020.htm,攔截多架烏無人機    俄羅斯國防部稱，當地時間二月二十四日○時二十分至二時，俄軍分別在庫爾斯克州和圖拉州上空攔截一架烏克蘭無人機,俄烏衝 突兩 周年 之際         俄防長 赴 前線 視察部隊         【 本報 綜合 報道 】 據 香港 中通社 、 觀察者網 二十四日 報道 ： 俄烏衝 突爆發 兩 周年 之際 ， 俄防長 紹伊古 當地 時間 二十四日 赴 俄 烏衝 突前 線 視察部隊 。 紹伊古 說 ： “ 今天 ， 就 兵力 比例 而言 ， 優勢 在 我們 這邊 。 ”         紹伊古 在 一個 指揮 中心 對 俄軍部隊 說 出 上述 話語 。 報道 稱 ， 俄軍方聲 明稱 ， 紹伊古 聽取 了 匯報 ， 稱 俄 軍 在 佔 領工業 中心 阿夫傑 耶夫 卡後處 於 進攻 態勢 。         消息 稱 ， 紹伊古 指出 了 無人機 在 特別 軍事 行動 中 的 作用 ， 並補充 說 ， 已計劃 向 軍隊 供應 使用 人工智慧 技術 控制 的 無人機 ， 這將 提高 其 使用 效率 。         國 防部 引述 紹伊古 的 話 說 ， 我們 實現 了 這 一步 。 它 正在 成為 一種 非常 重要 的 武器 。         除此之外 ， 根據 俄國 防部 通報 ， 紹伊古下 達 了 用 電子 戰裝備 進 一步 強化 俄 軍 中心 集群 的 任務 。         同時 ， 軍官們 向 他 報告 了 烏克蘭 軍人 在 阿夫傑 耶夫 卡大規模 投降 的 情況 。 紹伊古 提醒 道 ， 必須 人道 地 對 待 被俘 虜 的 烏克蘭 軍人 。         二月 二十四日 是 俄 烏衝 突爆 發滿 兩 周年 的 日子 ， 而 衝突 仍 在 持續 。 過去 一年 ， 俄烏衝 突前 線 戰況 激烈 。 俄羅斯 《 莫斯科 共青 團員報 》 稱 ， 去年 五月 ， 俄軍奪取 交通 要 地 阿爾喬 莫 夫斯 克 （ 烏方稱 巴赫 穆特 ） ； 烏 軍 於 去年 六月 在 多個 方向 發起 反攻 ， 但數 月 來 進展 緩慢 、 未見 成效 ； 去年 十月初 以來 ， 俄軍對 烏東部 的 阿夫傑 耶夫卡 、 馬 林卡 、 巴赫 穆特 等 地 烏軍防線 發動 新 一輪 攻勢 。         本月 十七日 ， 缺兵 少彈 的 烏 軍 撤出 防禦 重鎮 阿夫傑 耶夫卡 ， 這被 視為 去年 五月 以來 前線 出現 的 最大 變化 ， 《 紐約 時報 》 稱 此役 對 烏 方可 謂 “ 具有 戰略 和 象 徵意 義的 雙重 打擊 ” 。         烏稱 擊落 俄 預警機         當地 時間 二十三日 晚 ， 烏克蘭空 軍 司令 奧列 修克 在 電報 頻道 上 發文稱 ， 烏軍又擊 落 了 一架 俄 軍 A - 50 空中 預警機 。 奧列 修克同 時發 佈 的 影片 顯示 ， 一架 飛機 在 夜空 中 起火 。 這是 烏軍一個 多月 內 第二次 發 佈 關於擊 落 A - 50 預警機 的 消息 。         根據 《 基輔 獨立報 》 消息 ， 烏國 防部 情報 總局 證實 這架 飛機 是 在 與 烏空 軍 的 聯合 行動 中 被 擊落 的 。 烏軍方稱 ， 這次 事件 是 對 俄軍事 能力 的 “ 又 一次 沉重 打擊 ” 。         根據 路透社 報道 ， A - 50 於 蘇聯 時代 末期 首次 投入使用 ， 是 一種 大型 機載 預警 和 控制 飛機 ， 可掃 描數 百公里 外 的 敵方 飛機 、 艦艇 和 導彈 。         先進 的 偵察機 被 視為 俄軍協調 地面 行動 的 關鍵 。 “ A - 50 被 摧毀 很 可能 會 影響 俄軍在衝 突地 區 ‘ 全天候 ’ 進行 行動 和 通訊 的 能力 。 ” 烏國 防部 情報 總局 局長 布達諾夫 當時 說 。         攔截 多架 烏無人機         俄羅斯國 防部 稱 ， 當地 時間 二月 二十四日 ○ 時 二十分 至二時 ， 俄軍分別 在 庫爾 斯克州 和 圖拉州 上空 攔截 一架 烏克蘭 無人機 。 此外 ， 俄軍還 在 利佩茨克州 上空 攔截 兩架 烏軍無人機 。,2024-02-25
