Title,Content,Link,Summary,Preprocessed_Content,Date
姊弟換錢黨涉假碼騙客,賭場先後發現三個五萬港元假籌碼    姊弟換錢黨涉假碼騙客    【本報消息】內地姊弟來澳從事“換錢黨”，與賭客匯兌時更涉嫌使用假籌碼詐騙。司警接報調查後，前日在案發賭場拘捕涉案男女。兩人拒絕合作。司警檢獲三個面值五萬港元的假籌碼，與早前司警破獲其他假籌碼案時檢獲的假碼特徵相同，司警續跟進調查。    搵人兌錢換來假碼    被捕內地男女“換錢黨”姓王，三十七歲和三十四歲，姊弟關係，均報稱無業。司警落案控以相當巨額詐騙以及經營為賭博的不法匯兌罪，昨日下午移送檢察院偵辦。    案情透露，本星期二上午八時，司警接獲路氹某賭場報案稱，一名當値莊荷在例行點算珠盤籌碼時，發現一個面值五萬港元的籌碼有異，經賭場鑑定後證實爲假籌碼。約四十分鐘後，司警再接獲同一賭場通知，稱一名內地男子在賭檯輸掉三十萬港元籌碼，當値莊荷將籌碼收入珠盤時，再發現一個面值五萬港元的假籌碼。    光顧同一“換錢黨”    司警到場調查，尋獲案中男賭客並帶返司警局，調查揭發賭場檢獲的兩個假籌碼均是該名賭客賭博時輸掉的。該賭客聲稱，本月二十四日來澳賭博，期間曾透過兩名內地男女“換錢黨”用九萬五千元人民幣兌換十萬港元，當時獲得兩個面值五萬港元籌碼。其中一個假籌碼周一晚上七時在賭博時輸掉。    同日深夜約十一時，司警第三次接獲同一賭場通知，指另一名內地男賭客到賭檯要求莊荷把一個五萬港元籌碼兌換成五個面值一萬港元的籌碼時，被莊荷發現該個五萬港元籌碼是假碼。司警到場帶走男賭客調查，有人聲稱早前在賭場向“換錢黨”用四萬七千六百五十元人民幣兌得上述籌碼。    司警經調查相信兩名賭客均曾光顧相同的“換錢黨”而獲得假籌碼，並鎖定王姓姊弟身份。    一季兌換獲利八千    前日中午，王姓姊弟擬再次進入案發賭場時被司警截獲。兩人僅承認從事不法匯兌，但否認用假籌碼兌給賭客。經查，王姓姊弟今年八月開始從事“換錢黨”，除與上述兩名賭客兌換四次外，亦曾與他人兌換兩次，涉款合共八十萬港元，兩人從中獲利八千港元。    去年曾檢同類假碼    司警在兩人身上檢獲十五萬港元真籌碼及七千港元現金，相信用於不法匯兌，但未發現其他假籌碼。案中賭場報稱損失十萬港元，一名男賭客報稱損失五萬港元。檢獲的三個假籌碼與去年一宗同類案檢獲的假籌碼相同，相信屬同一批次，已交相關部門檢驗，繼續跟進調查。,http://www.macaodaily.com/html/2024-11/29/content_1797374.htm,光顧同一“換錢黨”    司警到場調查，尋獲案中男賭客並帶返司警局，調查揭發賭場檢獲的兩個假籌碼均是該名賭客賭博時輸掉的,賭場 先後發 現三個 五萬 港元 假籌碼         姊 弟換 錢 黨涉 假碼 騙客         【 本報 消息 】 內地 姊 弟來 澳 從 事 “ 換錢 黨 ” ， 與 賭 客匯 兌時 更 涉嫌 使用 假籌碼 詐騙 。 司警 接報 調查 後 ， 前日 在案 發 賭場 拘捕 涉案 男女 。 兩人 拒絕 合作 。 司警 檢獲 三個 面值 五萬 港元 的 假籌碼 ， 與 早前 司警 破 獲 其他 假籌碼 案時 檢獲 的 假碼 特徵 相同 ， 司警續 跟 進 調查 。         搵 人 兌 錢 換來 假碼         被捕 內地 男女 “ 換錢 黨 ” 姓王 ， 三十七 歲 和 三十四 歲 ， 姊 弟關 係 ， 均 報稱 無業 。 司警 落案 控以 相當 巨額 詐騙 以及 經營 為 賭博 的 不法 匯兌 罪 ， 昨日 下午 移送 檢 察院 偵辦 。         案情 透露 ， 本 星期二 上午 八時 ， 司警接 獲路 氹 某 賭場 報案 稱 ， 一名 當 値 莊荷 在 例行 點 算珠 盤籌碼 時 ， 發現 一個 面值 五萬 港元 的 籌碼 有異 ， 經賭場 鑑定 後 證實 爲 假籌碼 。 約 四 十分 鐘後 ， 司警 再 接獲 同一 賭場 通知 ， 稱 一名 內地 男子 在 賭 檯 輸掉 三十 萬 港元 籌碼 ， 當 値 莊荷將 籌碼 收入 珠盤 時 ， 再 發現 一個 面值 五萬 港元 的 假籌碼 。         光顧 同一 “ 換錢 黨 ”         司警 到場 調查 ， 尋獲案 中 男 賭客 並帶 返司 警局 ， 調查 揭發 賭場 檢獲 的 兩個 假籌碼 均 是 該 名 賭客 賭博時 輸掉 的 。 該 賭 客聲 稱 ， 本月 二十四日 來澳 賭博 ， 期間 曾 透過 兩名 內 地 男女 “ 換錢 黨 ” 用九萬 五千元 人民 幣兌 換十萬 港元 ， 當時 獲得 兩個 面值 五萬 港元 籌碼 。 其中 一個 假籌碼 周一 晚上 七時 在 賭博時 輸掉 。         同日 深夜 約 十一 時 ， 司警 第三次 接獲 同一 賭場 通知 ， 指 另一名 內地 男 賭客 到 賭 檯 要求 莊荷 把 一個 五萬 港元 籌碼 兌換 成五個 面值 一萬 港元 的 籌碼 時 ， 被 莊荷 發現 該個 五萬 港元 籌碼 是 假碼 。 司警 到場 帶 走 男 賭客 調查 ， 有人 聲稱 早前 在 賭場 向 “ 換錢 黨 ” 用四萬 七千 六百五十 元 人民 幣兌 得 上述 籌碼 。         司警經 調查 相信 兩名 賭客 均 曾 光顧 相同 的 “ 換錢 黨 ” 而 獲得 假籌碼 ， 並鎖定 王姓 姊弟 身份 。         一季 兌換 獲利 八千         前日 中午 ， 王姓 姊 弟擬 再次 進入 案發 賭場 時 被 司警 截獲 。 兩人僅 承認 從 事 不法 匯兌 ， 但否 認用 假籌碼 兌給 賭客 。 經查 ， 王姓 姊弟 今年 八月 開始 從 事 “ 換錢 黨 ” ， 除 與 上述 兩名 賭客 兌換 四次 外 ， 亦 曾 與 他人 兌換 兩次 ， 涉款 合共 八十 萬 港元 ， 兩人 從 中 獲利 八千 港元 。         去年 曾 檢同類 假碼         司警 在 兩人 身上 檢獲 十五 萬 港元 真籌碼 及 七千 港元 現金 ， 相信 用 於 不法 匯兌 ， 但 未 發現 其他 假籌碼 。 案中 賭場 報稱 損失 十萬 港元 ， 一名 男 賭客 報稱 損失 五萬 港元 。 檢獲 的 三個 假籌碼 與 去年 一宗 同類 案檢獲 的 假籌碼 相同 ， 相信 屬 同一 批次 ， 已 交相 關部門 檢驗 ， 繼續 跟 進 調查 。,2024-11-29
黃司：刑事化有助打擊換錢黨,新法生效近月逾半百人非法兌換被捕    黃司：刑事化有助打擊換錢黨    【本報消息】為打擊非法兌換，整頓娛樂場周邊治安環境，今年十月廿九日生效的《打擊不法賭博犯罪法》，新增了經營為賭博的不法匯兌罪。保安司司長黃少澤表示，截至本月廿二日，已有五十五人因從事非法兌換被捕。認為刑事化有效打擊非法匯兌活動，進一步壓縮“換錢黨”的生存空間。    “練功券”詐騙大減    黃少澤稱，俗稱“換錢黨”的非法兌換者長期擾亂娛樂場及周邊的治安環境，並衍生詐騙、搶劫、傷人甚至殺人等嚴重犯罪，近年更出現明顯的集團化與職業化趨勢。今年一至九月，司法警察局及治安警察局在各項行動中共截獲二千八百三十五名“換錢黨”，其中不涉刑事案的二千六百三十五名非本澳居民被禁止入境，並向博監局通報一千六百七十七名“換錢黨”，以便開展禁入賭場措施。首三季，“換錢黨”衍生的犯罪仍以詐騙為主，警方共錄得五百二十七宗相關騙案，主要手法包括“練功券”、偽造虛假匯款憑證以及向受害人轉帳涉犯罪的“黑錢”，使受害人的內地銀行帳戶因接收“黑錢”被凍結。其中“練功券”詐騙在警方持續打擊下，今年第二季起已大幅減少。    貴利禁錮同比增加    為更有效地遏止非法兌換，《打擊不法賭博犯罪法》已於十月廿九日生效，新增了“經營為賭博的不法匯兌”罪。截至本月廿二日，警方共開立四十二宗相關案件拘捕五十五人。司警局長薛仲明補充，截至前日，涉及兌換黨案件共檢獲七百一十一萬澳門元現金及一百九十五萬元籌碼。    除了“兌換黨”，暴利和剝奪行動自由亦是涉及娛樂場的常見罪案。今年首三季，暴利及剝奪行動自由案共錄得一百九十五宗及卅三宗，較去年同期分別增加一百二十八宗及廿一宗，但比二〇一九年的四百七十一宗及二百七十三宗大幅減少。    涉賭罪案較疫前降    黃少澤總結涉及博彩的罪案表示，絕大多數犯罪較疫前明顯下降，以往較多的暴利及剝奪他人行動自由罪案下降尤為顯著。現時以個人單獨作案為主，也有少數涉及跨境犯罪集團。警方已透過強化區域合作打擊。將繼續分析各類涉及博彩的罪案發展態勢，針對調整部署及優化執法措施，確保澳門社會安全穩定。,http://www.macaodaily.com/html/2024-11/29/content_1797375.htm,新法生效近月逾半百人非法兌換被捕    黃司：刑事化有助打擊換錢黨    【本報消息】為打擊非法兌換，整頓娛樂場周邊治安環境，今年十月廿九日生效的《打擊不法賭博犯罪法》，新增了經營為賭博的不法匯兌罪,新法 生效 近 月 逾 半百 人 非法 兌換 被捕         黃 司 ： 刑事 化 有助 打擊換 錢 黨         【 本報 消息 】 為 打擊 非法 兌換 ， 整頓 娛樂場 周邊 治安 環境 ， 今年 十月 廿九日 生效 的 《 打擊 不法 賭博 犯罪 法 》 ， 新增 了 經營 為 賭博 的 不法 匯兌 罪 。 保安 司司 長 黃 少澤 表示 ， 截至 本月 廿二日 ， 已有 五十五 人因 從 事 非法 兌換 被捕 。 認為 刑事 化 有效 打擊 非法 匯兌 活動 ， 進 一步 壓縮 “ 換錢 黨 ” 的 生存 空間 。         “ 練功券 ” 詐騙 大減         黃 少澤稱 ， 俗稱 “ 換錢 黨 ” 的 非法 兌換者 長 期擾 亂 娛樂場 及 周邊 的 治安 環境 ， 並 衍生 詐騙 、 搶劫 、 傷人 甚至 殺人 等 嚴重 犯罪 ， 近年 更出 現明顯 的 集團化 與 職業化 趨勢 。 今年 一至 九月 ， 司法 警察局 及 治安 警察局 在 各項 行動 中共 截獲 二 千八百 三十五名 “ 換錢 黨 ” ， 其中 不涉 刑事案 的 二千 六百 三十五名 非本澳 居民 被 禁止 入境 ， 並向 博監局 通報 一千六百 七十七 名 “ 換錢 黨 ” ， 以便 開展 禁入 賭場 措施 。 首 三季 ， “ 換錢 黨 ” 衍生 的 犯罪 仍 以詐 騙 為 主 ， 警方 共錄 得 五百 二十七 宗相關 騙案 ， 主要 手法 包括 “ 練功券 ” 、 偽造 虛假 匯款 憑證 以及 向 受害人 轉帳 涉 犯罪 的 “ 黑錢 ” ， 使 受害人 的 內 地 銀行 帳戶 因 接收 “ 黑錢 ” 被 凍結 。 其中 “ 練功券 ” 詐騙 在 警方 持續 打擊 下 ， 今年 第二季 起 已 大幅 減少 。         貴利禁 錮 同比增加         為 更 有效 地 遏止 非法 兌換 ， 《 打擊 不法 賭博 犯罪 法 》 已 於 十月 廿九日 生效 ， 新增 了 “ 經營 為 賭博 的 不法 匯兌 ” 罪 。 截至 本月 廿二日 ， 警方 共開立 四十二 宗相關 案件 拘捕 五十五 人 。 司 警局 長 薛仲明 補充 ， 截至 前日 ， 涉及 兌換 黨 案件 共檢獲 七百 一 十一 萬澳門元 現金及 一百九十 五萬元 籌碼 。         除了 “ 兌換 黨 ” ， 暴利 和 剝奪 行動 自由 亦 是 涉及 娛樂場 的 常見 罪案 。 今年 首 三季 ， 暴利 及 剝奪 行動 自由 案共錄 得 一百九十 五宗 及 卅三 宗 ， 較 去年同期 分別 增加 一百二十八 宗及 廿一 宗 ， 但 比 二 〇 一 九年 的 四百 七十一 宗及 二百七十 三宗 大幅 減少 。         涉賭 罪案 較疫 前降         黃 少澤總結 涉及 博彩 的 罪案 表示 ， 絕 大多 數 犯罪 較疫前 明顯 下降 ， 以往 較 多 的 暴利 及 剝奪 他 人行 動 自由 罪案 下降 尤為 顯著 。 現時 以個 人 單獨 作案 為主 ， 也 有 少數 涉及 跨境 犯罪 集團 。 警方 已透過 強化 區域 合作 打擊 。 將繼續 分析 各類 涉及 博彩 的 罪案 發展 態勢 ， 針對 調整 部署 及 優化 執法 措施 ， 確保 澳門 社會 安全 穩定 。,2024-11-29
黃少澤：未來工作待公佈,黃少澤：未來工作待公佈    【本報消息】近日網上流傳下一屆政府主要官員名單，社會關注保安司司長黃少澤的未來動向。黃少澤回應時表示，暫時未有消息透露，需要等候通知和公佈。    昨日首三季罪案數字發佈會上，保安司司長黃少澤再被問及未來的工作動向。黃少澤稱，新一屆主要官員需由行政長官提名，再由中央政府任命，有既定的程序，相信中央政府會在短時間內公佈消息。感謝傳媒關心個人的工作動向，但現階段未有消息可以對外透露，一切有待正式通知和公佈。,http://www.macaodaily.com/html/2024-11/29/content_1797376.htm,黃少澤：未來工作待公佈    【本報消息】近日網上流傳下一屆政府主要官員名單，社會關注保安司司長黃少澤的未來動向,黃 少澤 ： 未來 工作 待公 佈         【 本報 消息 】 近日 網 上流 傳下 一屆 政府 主要 官員名 單 ， 社會 關注 保安 司司 長 黃 少澤 的 未來動 向 。 黃 少澤回 應時 表示 ， 暫時 未有 消息 透露 ， 需要 等候 通知 和 公 佈 。         昨日 首 三季 罪案 數字發 佈 會 上 ， 保安 司司 長 黃 少澤再 被 問及 未來 的 工作 動向 。 黃 少澤稱 ， 新一屆 主要 官員 需 由 行政 長 官 提名 ， 再 由 中央政府 任命 ， 有 既定 的 程序 ， 相信 中央政府 會 在 短 時間 內公 佈 消息 。 感謝 傳媒關 心個 人 的 工作 動向 ， 但 現階段 未有 消息 可以 對外 透露 ， 一切 有待 正式 通知 和 公 佈 。,2024-11-29
羅立文：天下無不散之筵席,函運輸工務範疇同事冀支持下任司長工作    羅立文：天下無不散之筵席    【本報消息】特區政府下月二十日換屆，料新一屆政府主要官員人選即將公佈。第四、五屆政府運輸工務司司長羅立文近日以“以民為本，勇於承擔，迎難而上，團結向前”為題，向運輸工務範疇同事發信，提到在即將完成兩任運輸工務司司長的工作任務之際，感謝所有現職和曾經在運輸工務範疇部門努力工作的同事。信中指出“天下無不散之筵席”，期望同事們為澳門城市發展和居民福祉堅守崗位，支持下任運輸工務司司長的工作。    同事付出應予肯定    羅立文在信中表示，澳門走過廿五年翻天覆地的變化，他與大家共同為過去十年澳門大興土木作出努力。在即將完成兩任運輸工務司司長的工作任務之際，他與辦公室同事感謝所有現職和曾經在運輸工務範疇部門努力工作的同事，並緬懷和感謝已故的周惠民和山禮度作出的貢獻。同事們秉持公僕精神，以民為本，全力為澳門城市發展默默付出，值得社會給予肯定和尊重。    範疇多吃力不討好    羅立文指出，公務員從來不是輕鬆的職業。運輸工務範疇負責的更涵蓋城市建設、海陸空交通、環境氣象、電信，都是澳門發展不可或缺，與民生息息相關，最被社會關注、最被要求精準預測預判、最被強調要短時高質完成，卻又最吃力不討好的工作。其中更要應對因計劃趕不上變化而添加的各種工作，特別是疫情時期，同事們既要參與抗疫，又要如常處理公務。然而，相信當同事們最終看到工作成果時，應該感到自豪。他還感謝同事們的家人，體諒同事為建設澳門犧牲休息和陪伴他們的時間。    總結五年工作成果    信中提到，經過共同努力，在不足五年內，今天A區已建成三千〇一十七個經屋單位、十一個基建項目和公共設施，以及開通澳門大橋。目前，仍進行的基建工程共十二項、公屋和公共設施工程十六項。另外，還共同推動澳門輕軌建設，解決核心車廠問題，順利開通氹仔線、媽閣站，今年又迎來石排灣線和橫琴線通車，貫通A區的輕軌東線也按進度全速建設。同事們的工作已展示在部門網頁，公開透明。    跨部合作協調社會    羅立文形容，這些年來同事吸收社會和業界具建設性的意見和建議，並扛着居民對澳門未來憧憬的壓力，還要抽身應付對運輸工務範疇工作一知半解、紙上談兵，甚至懷着不同目的無理指罵的人士。希望同事能延續積極的精神和態度，與支持運輸工務範疇工作的政府其他部門繼續通力合作，與一直協助落實工作的業界、專營機構和團體保持良好協調。尊重每位參與、配合和正向推動範疇工作的居民，耐心溝通，不讓共同努力的成果被有心人扭曲，變成抨擊和抹黑運輸工務團隊工作的藉口。,http://www.macaodaily.com/html/2024-11/29/content_1797377.htm,第四、五屆政府運輸工務司司長羅立文近日以“以民為本，勇於承擔，迎難而上，團結向前”為題，向運輸工務範疇同事發信，提到在即將完成兩任運輸工務司司長的工作任務之際，感謝所有現職和曾經在運輸工務範疇部門努力工作的同事,函運輸 工務範疇 同事 冀 支持 下任 司長 工作         羅 立文 ： 天下 無不散 之 筵席         【 本報 消息 】 特區 政府 下 月 二十日 換屆 ， 料新 一屆 政府 主要 官員人 選即 將公 佈 。 第四 、 五屆 政府 運輸 工務司 司長 羅 立文 近日 以 “ 以民為 本 ， 勇 於 承擔 ， 迎難 而 上 ， 團結 向前 ” 為題 ， 向 運輸 工務範疇 同事 發信 ， 提到 在 即將 完成 兩任 運輸 工務司 司長 的 工作 任務之際 ， 感謝 所有 現職 和 曾經 在 運輸 工務範疇 部門 努力 工作 的 同事 。 信中 指出 “ 天下 無不散 之 筵席 ” ， 期望 同事 們 為 澳門 城市 發展 和 居民 福祉 堅守崗位 ， 支持 下任 運輸 工務司 司長 的 工作 。         同事 付出 應予 肯定         羅 立文 在 信中 表示 ， 澳門 走過 廿五年 翻天覆地 的 變化 ， 他 與 大家 共同 為過 去 十年 澳門 大興 土木 作出努力 。 在 即將 完成 兩任 運輸 工務司 司長 的 工作 任務之際 ， 他 與 辦 公室 同事 感謝 所有 現職 和 曾經 在 運輸 工務範疇 部門 努力 工作 的 同事 ， 並緬懷 和 感謝 已故 的 周 惠民 和 山禮度 作出 的 貢獻 。 同事 們 秉持 公僕 精神 ， 以民為 本 ， 全力 為 澳門 城市 發展 默默 付出 ， 值得 社會 給予 肯定 和 尊重 。         範疇 多 吃力 不討 好         羅 立文 指出 ， 公務員 從 來 不是 輕 鬆 的 職 業 。 運輸 工務範疇 負責 的 更 涵蓋 城市 建設 、 海陸空 交通 、 環境 氣象 、 電信 ， 都 是 澳門 發展 不可或缺 ， 與民 生息 息 相關 ， 最 被 社會 關注 、 最 被 要求 精準 預測 預判 、 最 被 強調 要 短時 高質 完成 ， 卻 又 最 吃力 不討 好 的 工作 。 其中 更要 應 對 因計劃 趕不上 變化 而 添加 的 各種 工作 ， 特別 是 疫情 時期 ， 同事 們 既 要 參 與 抗疫 ， 又 要 如常 處理 公務 。 然而 ， 相信 當 同事 們 最終 看到 工作 成果 時 ， 應該 感到 自豪 。 他 還感謝 同事 們 的 家人 ， 體諒 同事 為 建設 澳門 犧牲 休息 和 陪伴 他們 的 時間 。         總結 五年 工作 成果         信中 提到 ， 經過 共同努力 ， 在 不足 五年 內 ， 今天 A 區已 建成 三千 〇 一十七 個 經屋 單位 、 十一 個 基建 項目 和 公共 設施 ， 以及 開通 澳門 大橋 。 目前 ， 仍 進行 的 基建工程 共 十二 項 、 公屋 和 公共 設施 工程 十六 項 。 另外 ， 還 共同 推動 澳門 輕軌 建設 ， 解決 核心 車廠 問題 ， 順利 開通 氹 仔線 、 媽閣 站 ， 今年 又 迎來 石 排灣線 和 橫琴線 通車 ， 貫通 A 區的 輕軌 東線 也 按 進度 全速 建設 。 同事 們 的 工作 已 展示 在 部門 網頁 ， 公開 透明 。         跨部 合作 協調 社會         羅 立文 形容 ， 這些 年 來 同事 吸收 社會 和 業界 具建 設性 的 意見 和 建議 ， 並 扛着 居民 對 澳門 未來 憧憬 的 壓力 ， 還要 抽身 應付 對 運輸 工務範疇 工作 一知半解 、 紙上 談兵 ， 甚至 懷着 不同 目的 無理 指罵 的 人士 。 希望 同事 能延續 積極 的 精神 和 態度 ， 與 支持 運輸 工務範疇 工作 的 政府 其他 部門 繼續 通力合作 ， 與 一直 協助 落實 工作 的 業界 、 專營 機構 和 團體 保持良好 協調 。 尊重 每位 參與 、 配合 和 正向 推動 範疇 工作 的 居民 ， 耐心 溝通 ， 不 讓 共同努力 的 成果 被 有心人 扭曲 ， 變成 抨擊 和 抹黑 運輸 工務團隊 工作 的 藉口 。,2024-11-29
