Title,Content,Link,Summary,Preprocessed_Content,Date
央行減免MLF質押品  平衡債市供求,央行減免MLF質押品   平衡債市供求    【新華社北京廿二日電】中國人民銀行七月廿二日發佈消息稱，為增加可交易債券規模，緩解債市供求壓力，自本月起，有出售中長期債券需求的中期借貸便利(MLF)參與機構，可申請階段性減免MLF質押品。專家認為，此舉有利平衡債券市場供求關係。    今年以來，長債收益率持續較快下行，創二十年來新低。    助釋放存量長期債券    “中國人民銀行適當減免MLF操作質押品，可有效釋放市場存量長期債券，進一步增加可交易債券規模。”招聯首席研究員董希淼說，目前MLF餘額超過7萬億元，且大部分以國債、地方債作為質押品。若參與機構減免質押品後賣出長債，將釋放大量債券，緩解債券市場供求矛盾以及由此帶來的中長期債券利率過低等問題。    這並非中國人民銀行首次對債券市場“出手”。今年四月以來，中國人民銀行多次就長期國債收益率走勢問題表態：七月一日，中國人民銀行表示，決定面向部分公開市場業務一級交易商開展國債借入操作；七月五日，中國人民銀行與幾家主要金融機構簽訂債券借入協議，規模達數千億元。    下調七天逆回購利率    東方金誠首席宏觀分析師王青表示，中國人民銀行開展國債借入操作後，可以把這些國債在二級市場上出售，進而壓低相關國債市場價格，推升相關國債收益率。    同時，二級市場國債買賣還將逐步納入貨幣政策工具箱。    中國人民銀行行長潘功勝此前表示，把國債買賣納入貨幣政策工具箱，是將其定位於基礎貨幣投放渠道和流動性管理工具，既有買也有賣，與其他工具綜合搭配，共同營造適宜的流動性環境。中國人民銀行正與財政部加強溝通，共同研究推動在公開市場操作中逐步增加國債買賣。    七月廿二日，中國人民銀行發佈消息稱，把公開市場七天期逆回購操作調整為固定利率、數量招標，並從即日起把利率由此前的1.8%調整為1.7%。    中國民生銀行首席經濟學家溫彬表示，政策利率下調預計將通過金融市場逐步傳導至實體經濟，促進降低綜合融資成本、鞏固經濟回升向好態勢，打破長債收益率下行與預期轉弱的負向循環。    綜合施策阻債市風險    中長期債券收益率反映的更多是長期經濟走勢。中國人民銀行有關部門負責人表示，當前中國經濟長期向好的基本面沒有改變，中國經濟基礎好、韌性強、動能優、潛力大、活力足。儘管供求關係等因素會對長期國債收益率帶來短期擾動，但中國長期國債收益率總體會運行在與長期經濟增長預期相匹配的合理區間內。    溫彬預計，未來中國人民銀行或將綜合施策，必要時借入並賣出國債，及時校正和阻斷債市風險累積，以保持正常向上傾斜的收益率曲線。    此外，專家提示，對於長期限國債，利率變動會導致價格大幅波動。機構在決策是否持有大量低票面利率長期債券時，需進行壓力測試，充分考量利率風險。對公眾投資者來說，如果到期前因各種原因需要用錢，在二級市場賣出國債時可能產生較大投資損失，需關注利率風險和價格風險。,http://www.macaodaily.com/html/2024-07/23/content_1769914.htm,中國民生銀行首席經濟學家溫彬表示，政策利率下調預計將通過金融市場逐步傳導至實體經濟，促進降低綜合融資成本、鞏固經濟回升向好態勢，打破長債收益率下行與預期轉弱的負向循環,央行 減免 MLF 質押品       平衡 債市 供求         【 新華社 北京 廿二日 電 】 中國 人民 銀行 七月 廿二日 發 佈 消息 稱 ， 為 增加 可 交易 債券 規模 ， 緩解 債市 供求 壓力 ， 自 本月 起 ， 有 出售 中長 期債券 需求 的 中期 借貸 便利 ( MLF ) 參與 機構 ， 可申 請階段 性 減免 MLF 質押品 。 專家 認為 ， 此舉 有利 平衡 債券 市場 供求 關 係 。         今年 以來 ， 長 債 收益率 持續 較 快 下行 ， 創 二十年 來 新低 。         助釋 放 存量 長 期 債券         “ 中國 人民 銀行 適當 減免 MLF 操作 質押品 ， 可 有效 釋放 市場 存量 長 期 債券 ， 進 一步 增加 可 交易 債券 規模 。 ” 招聯 首席 研究 員 董希淼 說 ， 目前 MLF 餘額 超過 7 萬億元 ， 且 大部分 以國債 、 地方 債作 為質 押品 。 若參 與 機構 減免 質押 品後賣 出長 債 ， 將釋 放 大量 債券 ， 緩解 債券 市場 供求矛盾 以及 由此 帶來 的 中長 期債券 利率 過 低等 問題 。         這並 非 中國 人民 銀行 首次 對 債券 市場 “ 出手 ” 。 今年 四月 以來 ， 中國 人民 銀行 多次 就長 期國債 收益率 走勢 問題 表態 ： 七月 一日 ， 中國 人民 銀行 表示 ， 決定 面向 部分 公開市 場業務 一級 交易商 開展 國債 借入 操作 ； 七月 五日 ， 中國 人民 銀行 與 幾家 主要 金融 機構 簽訂 債券 借入 協議 ， 規模 達 數千億元 。         下調 七天 逆 回購 利率         東方金 誠 首席 宏觀 分析 師王青 表示 ， 中國 人民 銀行 開展 國債 借入 操作 後 ， 可以 把 這些 國債 在 二級 市場 上 出售 ， 進而壓 低 相關 國債 市場 價格 ， 推升 相關 國債 收益率 。         同時 ， 二級 市場 國債 買 賣 還將 逐步 納入 貨幣 政策 工具箱 。         中國 人民 銀行 行長 潘功勝 此前 表示 ， 把 國債 買 賣納入 貨幣 政策 工具箱 ， 是 將其 定位 於 基礎 貨幣 投放 渠道 和 流動性 管理工具 ， 既有 買 也 有 賣 ， 與 其他 工具 綜合 搭配 ， 共同 營造 適宜 的 流動性 環境 。 中國 人民 銀行 正 與 財政部 加強 溝通 ， 共同 研究 推動 在 公開 市場 操作 中 逐步 增加 國債 買 賣 。         七月 廿二日 ， 中國 人民 銀行發 佈 消息 稱 ， 把 公開 市場 七天 期逆 回購 操作 調整 為 固定 利率 、 數量 招標 ， 並從 即日起 把 利率 由此 前 的 1.8% 調整 為 1.7% 。         中國 民生 銀行 首席 經濟 學家 溫彬 表示 ， 政策 利率 下調 預計將 通過 金融 市場 逐步 傳導 至 實體 經濟 ， 促進 降低 綜合 融資 成本 、 鞏固 經濟 回升 向 好 態勢 ， 打破 長 債 收益率 下行 與 預期 轉弱 的 負向 循環 。         綜合 施策 阻債市 風險         中長 期債券 收益率 反映 的 更 多 是 長 期經濟 走勢 。 中國 人民 銀行 有 關部門 負責人 表示 ， 當前 中國 經濟長 期向 好 的 基本面 沒有 改變 ， 中國 經濟 基礎 好 、 韌性強 、 動能 優 、 潛力 大 、 活力 足 。 儘 管 供求 關 係 等 因素 會 對長 期國債 收益率 帶來 短期 擾動 ， 但 中國長 期國債 收益率 總體會 運行 在 與 長 期經濟 增長 預期 相匹配 的 合理 區間 內 。         溫彬 預計 ， 未來 中國 人民 銀行 或將 綜合 施策 ， 必要 時 借入 並賣 出國債 ， 及時 校正 和 阻斷 債市 風險 累積 ， 以 保持 正常 向上 傾斜 的 收益率 曲線 。         此外 ， 專家 提示 ， 對 於 長 期限 國債 ， 利率 變動會 導致 價格 大幅 波動 。 機構 在 決策 是否 持有 大量 低 票面 利率 長 期 債券時 ， 需進行 壓力 測試 ， 充分 考量 利率 風險 。 對公眾 投資者 來 說 ， 如果 到期 前因 各種 原因 需要 用 錢 ， 在 二級 市場 賣 出國 債時 可能 產生 較 大 投資 損失 ， 需關 注 利率 風險 和 價格 風險 。,2024-07-23
日匯吸引 上半年訪日旅客創新高,"日匯吸引   上半年訪日旅客創新高    【香港中通社電】受日圓匯率疲軟影響，日本入境旅客人次大增。今年一至六月，外籍旅客達約1,778萬人次，較疫前增加，並創歷史新高。日本將採用入境新制，縮減外國旅客入境手續所耗費的時間。    國際觀光振興機構發佈數據顯示，今年一至六月旅客較一九年同期創下的1,663萬多100多萬。    振興機構跟進的23個市場中，來自18個地區的旅客在六月份創下新高。入境旅客最多的前四個來源地為韓國（444萬）、中國（306萬多）、台灣地區（297萬多人次）和美國（134萬）。    明年推措省入境時間    路透社報道，雖然旅客消費對經濟有利，但旅客熱點地區的大量人群讓一些當地人感到不滿。京都和富士山等熱門景點的當地人對“超限旅遊”表示擔憂。    政策制定者相繼採取措施應對，處理人手不足、景點擁擠、旅客失序行為等影響。例如，富士山上的小徑擁擠，加上垃圾越來越多，促使官員本月首次實施門票和徒步旅行限制；西部姬路市市長上個月還建議對進入城堡的外國人收取相當於當地居民6倍的入門費。    今年四至六月的訪日外國人消費額近2.14萬億日圓，創下單季最高紀錄。日本觀光廳預計，今年全年度旅客支出達8萬億日圓。    日圓兌美元匯率跌至卅八年來最低點，吸引外地旅客入境。為減少外國旅客入境時所耗的時間，日本將落實“機場入境事先確認”制度，預計從明年一月起，讓一些外國旅客在出發機場事先申辦部分入境審查，抵達日本後僅需經過簡易的確認手續後，就可入境。",http://www.macaodaily.com/html/2024-07/23/content_1769915.htm,為減少外國旅客入境時所耗的時間，日本將落實“機場入境事先確認”制度，預計從明年一月起，讓一些外國旅客在出發機場事先申辦部分入境審查，抵達日本後僅需經過簡易的確認手續後，就可入境,"日匯 吸引       上半年 訪日 旅客 創 新高         【 香港 中通 社電 】 受日 圓匯率 疲軟 影響 ， 日本 入境 旅客 人次 大增 。 今年 一至 六月 ， 外籍 旅客 達約 1 , 778 萬 人次 ， 較疫前 增加 ， 並創 歷史 新高 。 日本 將採用 入境 新制 ， 縮減 外國 旅客 入境 手續 所耗 費的 時間 。         國際觀 光振興 機構 發 佈 數據 顯示 ， 今年 一至 六月 旅客 較 一 九年 同期 創下 的 1 , 663 萬多 100 多萬 。         振興 機構 跟 進 的 23 個 市場 中 ， 來 自 18 個 地區 的 旅客 在 六月份 創下 新高 。 入境 旅客 最多 的 前 四個 來 源地 為 韓國 （ 444 萬 ） 、 中國 （ 306 萬多 ） 、 台灣 地區 （ 297 萬 多人次 ） 和 美國 （ 134 萬 ） 。         明年 推措 省 入境 時間         路透社 報道 ， 雖然 旅客 消費 對 經濟 有利 ， 但 旅客 熱點 地區 的 大量 人群 讓 一些 當地 人 感到 不滿 。 京都 和 富士山 等 熱門 景點 的 當地 人 對 “ 超限 旅遊 ” 表示 擔憂 。         政策 制定者 相繼 採取 措施 應對 ， 處理 人手不足 、 景點 擁擠 、 旅客 失序 行為 等 影響 。 例如 ， 富士山 上 的 小徑 擁擠 ， 加上 垃圾 越來 越 多 ， 促使 官員 本月 首次 實施 門票 和 徒步旅行 限制 ； 西部 姬路市 市長 上個 月 還建議 對 進入 城堡 的 外國人 收取 相當 於 當地 居民 6 倍 的 入門費 。         今年 四至 六月 的 訪日 外國人 消費額 近 2.14 萬億日圓 ， 創下 單季 最高 紀錄 。 日本 觀光廳 預計 ， 今年 全 年度 旅客 支出 達 8 萬億日圓 。         日圓 兌 美元 匯率 跌 至 卅 八年 來 最低 點 ， 吸引 外地 旅客 入境 。 為 減少 外國 旅客 入境 時 所耗 的 時間 ， 日本 將落實 “ 機場 入境 事先 確認 ” 制度 ， 預計 從 明年 一月 起 ， 讓 一些 外國 旅客 在 出 發機場 事先 申辦 部分 入境 審查 ， 抵達 日本 後 僅需 經過 簡易 的 確認 手續 後 ， 就 可 入境 。",2024-07-23
經濟增速緩慢 人民幣偏軟    中國銀行澳門分行金融市場部,經濟增速緩慢   人民幣偏軟    上周內地公佈第二季GDP及六月經濟數據，內需表現繼續偏弱，拖累整體經濟增速。中國央行周一下調七天期逆回購操作利率及貸款市場報價利率(LPR)，展現貨策“呵護”經濟回升的決心，有利加大金融支持實體經濟力度。人民幣匯率繼續承壓，離岸人民幣流動性保持收緊，穩匯率政策繼續支持匯率偏緩下跌。美國大選的不確定性也將進一步增加人民幣的波動。    內地第二季GDP同比實際增4.7%，低於市場預期的5.1%，其中第二三產業同比增速分別為5.6%、4.2%，與外需相關度較高的製造業增速較強，金融業增速則偏低，房地產業繼續負增；最終消費支出對經濟增長貢獻率46.5%，不足50%，拉動GDP增長2.19%，讀數偏低，亦指向內需偏弱。六月工業增加值同比增5.3%，高於預期的5%，其中製造業及高技術製造業的同比增速達5.5%和8.8%，主要或是偏強的外需拉動。整體經濟增速對外需的依賴度較高，增速緩慢。    中國央行周一宣佈把公開市場七天逆回購操作調整為固定利率、數量招標，同時把操作利率由1.8%調整為1.7%，且對一年期和五年期以上LPR同步下降10個基點至3.35%和3.85%。強化七天逆回購利率的政策屬性，預計通過金融市場逐步傳導至實體經濟，促進降低綜合融資成本。第二十屆三中全會強調堅定不移實現全年經濟社會發展目標，後續或可期待更多財政和貨幣等逆周期政策的發力情況。    上周美國經濟數據良好，帶動美債利率和美元走高。但受拜登宣佈退出美國總統大選並支持哈里斯接棒出戰，美元指數明顯下跌。交易員可能傾向認為，若特朗普贏得大選，其較激進的加關稅舉措或增加中美貿易摩擦，令人民幣繼續承壓。短期內人民幣仍有下跌空間，上方阻力為近期高位7.31，下方支撐為7.26。    中國銀行澳門分行金融市場部,http://www.macaodaily.com/html/2024-07/23/content_1769916.htm,內地第二季GDP同比實際增4.7%，低於市場預期的5.1%，其中第二三產業同比增速分別為5.6%、4.2%，與外需相關度較高的製造業增速較強，金融業增速則偏低，房地產業繼續負增,經濟 增速 緩慢       人民 幣偏 軟         上周 內地公 佈 第二季 GDP 及 六月 經濟 數據 ， 內 需表現 繼續 偏弱 ， 拖累 整體 經濟 增速 。 中國 央行 周 一下 調 七天 期逆 回購 操作 利率 及 貸款 市場 報價 利率 ( LPR ) ， 展現 貨策 “ 呵護 ” 經濟 回升 的 決心 ， 有利 加大 金融 支持 實體 經濟 力度 。 人民 幣匯率 繼續 承壓 ， 離岸 人民 幣流動性 保持 收緊 ， 穩匯率 政策 繼續 支持 匯率 偏緩 下跌 。 美國大選 的 不確 定性 也 將進 一步 增加 人民 幣的 波動 。         內地 第二季 GDP 同比 實際增 4.7% ， 低 於 市場 預期 的 5.1% ， 其中 第二 三產業 同比 增速 分別 為 5.6% 、 4.2% ， 與 外 需相 關度 較 高 的 製 造 業 增速 較強 ， 金融 業 增速 則 偏低 ， 房地 產業 繼續 負增 ； 最終 消費 支出 對 經濟 增長 貢獻率 46.5% ， 不足 50% ， 拉動 GDP 增長 2.19% ， 讀數 偏低 ， 亦 指向 內需 偏弱 。 六月 工業 增加值 同比 增 5.3% ， 高 於 預期 的 5% ， 其中 製 造 業 及 高技 術 製 造 業 的 同比 增速 達 5.5% 和 8.8% ， 主要 或是 偏強 的 外 需拉動 。 整體 經濟 增速 對外 需 的 依賴度 較 高 ， 增速 緩慢 。         中國 央行 周一 宣 佈 把 公開 市場 七天 逆 回購 操作 調整 為 固定 利率 、 數量 招標 ， 同時 把 操作 利率 由 1.8% 調整 為 1.7% ， 且 對 一年期 和 五年期 以上 LPR 同步 下降 10 個 基點 至 3.35% 和 3.85% 。 強化 七天 逆 回購 利率 的 政策 屬性 ， 預計 通過 金融 市場 逐步 傳導 至 實體 經濟 ， 促進 降低 綜合 融資 成本 。 第二十 屆 三中 全會 強調 堅定 不移 實現 全年 經濟 社會 發展 目標 ， 後 續 或 可 期待 更多財 政和 貨幣 等 逆 周期 政策 的 發力 情況 。         上周 美國 經濟 數據 良好 ， 帶動 美債 利率 和 美元 走高 。 但 受 拜登 宣 佈 退出 美國 總統 大選並 支持 哈里斯 接棒 出戰 ， 美元 指數 明顯 下跌 。 交易 員 可能 傾向 認為 ， 若 特朗普 贏得 大選 ， 其較 激進 的 加關稅 舉措 或 增加 中美貿易 摩擦 ， 令 人民 幣繼續 承壓 。 短期 內 人民 幣仍 有 下跌 空間 ， 上方 阻力 為 近期 高位 7.31 ， 下方 支撐 為 7.26 。         中國 銀行 澳門 分行 金融 市場部,2024-07-23
海外因素或拖累港股    工銀澳門私人銀行部,"海外因素或拖累港股    英國六月CPI按年升2%，是連續第二個月達到目標水準。但最新數據略高於市場估計的1.9%，且服務業價格壓力具黏性，加劇對央行下月是否減息的疑慮。服務業通脹率維持在5.7%，高於央行上次預測的水準。歐洲央行在上月減息後，七月十八日決定維持利率不變。歐洲央行在聲明中指出，歐元區價格壓力仍很大，服務通脹高企，整體通脹可能在明年很長一段時間仍高於目標水準。    中國今年第二季GDP同比增4.7%，低於預期的5.1%，也低於第一季的5.3%，增速創五個季度最低水準。六月全國規模以上工業增加值同比增5.3%，較前值降0.3個百分點；環比增0.42個百分點，弱於近年來同期水準。二十屆三中全會強調堅定不移實現全年經濟社會發展目標。會議審議通過《中共中央關於進一步全面深化改革、推進中國式現代化的決定》，提出300多項重要改革舉措。    資本市場方面，全球股市上周出現回檔。MSCI全球跌2.1%，其中發達市場表現優於新興市場，分別跌2%和3%。美股表現優於歐股，標普500和泛歐斯托克600分別跌2%和2.7%。港股上周表現大幅調整。恆生指數、恆生綜指及恆生內地指數分別跌4.8%、4.7%及5.5%。恆生指數日均成交額較上上周降5.1%至9,598億港元。上周南向資金淨流入港股，成交淨流入176.19億元人民幣，成交佔17.3%，環比提高1.1個百分點。    市場展望方面，由於特朗普的獲勝概率在事件後進一步上升，市場將進一步強化“特朗普交易”。由於特朗普的貿易保護主義以及逆全球化傾向，或對美國通脹形成向上壓力，造成通脹黏性增加，進而對減息產生阻力。特朗普當選，或造成美聯儲局減息進程的延後，以及減息速度的下降。美元利率潛在更高、更久的預期，對港股或將產生一定影響。    工銀澳門私人銀行部",http://www.macaodaily.com/html/2024-07/23/content_1769917.htm,歐洲央行在聲明中指出，歐元區價格壓力仍很大，服務通脹高企，整體通脹可能在明年很長一段時間仍高於目標水準,"海外 因素 或 拖累 港股         英國 六月 CPI 按年 升 2% ， 是 連續 第二 個 月 達 到 目標 水準 。 但 最新 數據略 高 於 市場 估計 的 1.9% ， 且 服務業 價格 壓力 具 黏性 ， 加劇 對 央行 下 月 是否 減息 的 疑慮 。 服務業 通脹 率維持 在 5.7% ， 高 於 央行 上次 預測 的 水準 。 歐洲 央行 在 上 月 減息 後 ， 七月 十八日 決定 維持 利率 不變 。 歐洲 央行 在 聲明 中 指出 ， 歐元區 價格 壓力 仍 很大 ， 服務 通脹 高企 ， 整體 通脹 可能 在 明年 很長 一段 時間 仍 高 於 目標 水準 。         中國 今年 第二季 GDP 同比 增 4.7% ， 低 於 預期 的 5.1% ， 也 低 於 第一季 的 5.3% ， 增速 創五個 季度 最低 水準 。 六月 全國 規模 以上 工業 增加值 同比 增 5.3% ， 較 前值 降 0.3 個 百分 點 ； 環 比增 0.42 個 百分 點 ， 弱 於 近年 來 同期 水準 。 二十 屆 三中 全會 強調 堅定 不移 實現 全年 經濟 社會 發展 目標 。 會議 審議 通過 《 中共中央 關於進 一步 全面 深化改革 、 推進 中國式 現代化 的 決定 》 ， 提出 300 多項 重要 改革 舉措 。         資 本市 場 方面 ， 全球股市 上周 出現 回檔 。 MSCI 全球 跌 2.1% ， 其中 發達 市場 表現 優 於 新興 市場 ， 分別 跌 2% 和 3% 。 美股 表現 優 於 歐股 ， 標普 500 和 泛歐 斯托克 600 分別 跌 2% 和 2.7% 。 港股 上周 表現 大幅 調整 。 恆生 指數 、 恆生 綜指及 恆生 內地 指數 分別 跌 4.8% 、 4.7% 及 5.5% 。 恆生 指數 日均 成交 額較 上 上周 降 5.1% 至 9 , 598 億 港元 。 上周 南向 資金淨 流入 港股 ， 成交 淨 流入 176.19 億元 人民 幣 ， 成交 佔 17.3% ， 環比 提高 1.1 個 百分 點 。         市場 展望 方面 ， 由 於 特朗普 的 獲勝 概率 在 事件 後 進 一步 上升 ， 市場 將進 一步 強化 “ 特朗普 交易 ” 。 由 於 特朗普 的 貿易 保護 主義 以及 逆 全球化 傾向 ， 或 對 美國 通脹 形成 向上 壓力 ， 造成 通脹 黏性 增加 ， 進而 對 減息 產生 阻力 。 特朗普 當選 ， 或 造成 美聯 儲局 減息 進程 的 延 後 ， 以及 減息 速度 的 下降 。 美元 利率 潛在 更 高 、 更久 的 預期 ， 對 港股 或 將產生 一定 影響 。         工銀 澳門 私人 銀行部",2024-07-23
上半年日本74百年老店破產,"上半年日本74百年老店破產    【香港中通社廿二日電】雖然日本股市今年以來走勢強勁，但據日本帝國數據庫公司一項最新調查顯示，今年上半年74家創立百年以上的日本企業陷入破產，刷新二○○○年開始統計該數據以來的歷史同期最高紀錄。    去年同期近兩倍    調查指，物價高企導致利潤下降，以及缺少接班人，成為日本百年企業破產的主要原因，今年上半年“百年老店”陷入破產的數量，是去年同期的近2倍。    據帝國數據庫公司統計，去年日本約有4.36萬家百年企業。《日本經濟新聞》預計，今年百年企業破產數量將大幅超過發生國際金融危機的二○○八年。    企業破產十年高    月初，日本東京商工調查公司公佈的二四年上半年全國企業破產數，也升至二○一四年以來的高位，達到4,931家，較上年同期增22%。    日本官方下調經濟前景。日本內閣府在七月十九日的經濟財政諮詢會議上公佈推算稱，今年度經濟實際增長率為0.9%，較上次一月在內閣會議預測的1.3%有所下調。",http://www.macaodaily.com/html/2024-07/23/content_1769918.htm,上半年日本74百年老店破產    【香港中通社廿二日電】雖然日本股市今年以來走勢強勁，但據日本帝國數據庫公司一項最新調查顯示，今年上半年74家創立百年以上的日本企業陷入破產，刷新二○○○年開始統計該數據以來的歷史同期最高紀錄,"上半年 日本 74 百年 老店 破產         【 香港 中通社 廿二日 電 】 雖然 日本 股市 今年 以來 走勢 強勁 ， 但據 日本 帝國 數據庫 公司 一項 最新 調查 顯示 ， 今年 上半年 74 家 創立 百年 以上 的 日本 企業 陷入 破產 ， 刷新 二 ○ ○ ○ 年 開始 統計該 數據 以來 的 歷史 同期 最高 紀錄 。         去年同期 近 兩倍         調查 指 ， 物價 高 企導 致利潤 下降 ， 以及 缺少 接班人 ， 成為 日本 百年 企業 破產 的 主要 原因 ， 今年 上半年 “ 百年 老店 ” 陷入 破產 的 數量 ， 是 去年同期 的 近 2 倍 。         據 帝國 數據庫 公司 統計 ， 去年 日本 約 有 4.36 萬家 百年 企業 。 《 日本 經濟 新聞 》 預計 ， 今年 百年 企業 破產 數量將 大幅 超過 發生 國際 金融 危機 的 二 ○ ○ 八年 。         企業 破產 十年 高         月初 ， 日本 東京 商工 調查 公司 公 佈 的 二 四年 上半年 全國 企業 破產數 ， 也 升至 二 ○ 一 四年 以來 的 高位 ， 達到 4 , 931 家 ， 較 上年 同期 增 22% 。         日本 官方 下調 經濟 前景 。 日本 內閣府 在 七月 十九日 的 經濟 財政 諮 詢會議 上公 佈 推算 稱 ， 今 年度 經濟 實際 增長 率 為 0.9% ， 較 上次 一月 在 內閣 會議 預測 的 1.3% 有所 下調 。",2024-07-23
