Title,Content,Link,Summary,Preprocessed_Content,Date
暨大校友佛山交流促融灣區,暨大校友佛山交流促融灣區    為慶祝中華人民共和國成立七十五周年及澳門回歸祖國二十五周年，在暨南大學澳門校友會副會長龍鳳軍帶領二十餘名骨幹校友日前赴佛山交流，並與灣區校友座談。    活動旨在回應國家建設“粵港澳大灣區”的發展戰略宏圖，透過與灣區“九加二”城市的暨大校友會合作，作為校友的交流平台，推動灣區校友合作共融，為澳門深度融入灣區發展發揮積極作用。活動由澳門基金會支持部分經費。    交流團參訪暨南大學佛山校友會並座談。參觀校友企業輕鋁科技，直觀了解製造過程中的每一個環節。了解鋁業作為一個重要的工業板塊，如何推動地方經濟發展，帶動就業。還參觀佛山順峰山公園及舊寨、參觀佛山南國絲都絲綢博物館。    暨南大學原駐澳門聯絡處主任歐瑞鎮稱，活動感受到暨大校友的凝聚力、行動力、向心力。了解大灣區現階段發展情況，為未來在灣區投資創業生活提供更多可能性。,http://www.macaodaily.com/html/2024-12/24/content_1802908.htm,暨大校友佛山交流促融灣區    為慶祝中華人民共和國成立七十五周年及澳門回歸祖國二十五周年，在暨南大學澳門校友會副會長龍鳳軍帶領二十餘名骨幹校友日前赴佛山交流，並與灣區校友座談,暨大 校友 佛山 交流 促融灣區         為慶祝 中華 人民 共和 國 成立 七十五 周年 及 澳門 回歸祖國 二十五 周年 ， 在 暨南 大學 澳門 校友 會 副 會長 龍鳳 軍 帶領 二十 餘名 骨幹 校友 日前 赴 佛山 交流 ， 並與灣區 校友 座談 。         活動 旨在 回應 國家 建設 “ 粵 港澳 大灣區 ” 的 發展 戰略宏圖 ， 透過 與灣區 “ 九加 二 ” 城市 的 暨大 校友 會 合作 ， 作為 校友 的 交流平台 ， 推動灣區 校友 合作 共融 ， 為 澳門 深度 融入 灣區 發展 發揮 積極 作用 。 活動 由 澳門 基金 會 支持 部分 經費 。         交流 團參訪 暨南 大學 佛山 校友 會 並座 談 。 參觀 校友 企業 輕鋁 科技 ， 直觀 了解 製 造 過 程 中 的 每 一 個 環 節 。 了解 鋁業 作為 一個 重要 的 工業 板塊 ， 如何 推動 地方 經濟 發展 ， 帶動 就業 。 還參觀 佛山 順 峰山 公園 及 舊 寨 、 參觀 佛山 南國絲 都 絲綢 博物 館 。         暨南 大學原 駐 澳門 聯絡處 主任 歐瑞鎮 稱 ， 活動 感受 到 暨大 校友 的 凝聚力 、 行動力 、 向心力 。 了解 大灣區 現階段 發展 情況 ， 為 未來 在灣區 投資 創業 生活 提供 更 多 可能性 。,2024-12-24
贈人玫瑰學懂感恩   悅  鳴,贈人玫瑰學懂感恩    聖誕節、元旦及農曆新年假期緊接而至，父母除可安排子女外出旅遊或遊學外，不妨考慮以親子義工參與社會，服務社會，共享家庭樂，向有需要人士尤其獨居長者等送上節日祝福，讓弱勢群體感受到人間溫暖。    參考內地或鄰近地區，不少社會服務組織慣常於大型節日期間，安排義工尤其親子義工協助分發食物予有需要人士或家庭。父母同子女一同參與有意義的活動，既可以身作則，更可讓孩子明白到幸福並非必然的道理。透過把食物送給獨居長者、病人或低收入家庭等，藉節日送上祝福，很有意義。另也可將生活物資如舊衣服等，捐贈至相關社福機構、社區組織，惠及有需要人士。    贈人玫瑰，手留餘香。父母不妨因應子女的年紀、愛好和能力，為他們適切加入不同團體，開展相應的社會服務工作，發揮所長，更重要是通過參與慈善公益活動，一起學習如何關懷別人，學懂感恩。活動前，多為孩子做好思想準備，享受與受訪者溝通交流的時光，盡力為別人送上節日的快樂，終生受益。    悅  鳴,http://www.macaodaily.com/html/2024-12/24/content_1802909.htm,贈人玫瑰學懂感恩    聖誕節、元旦及農曆新年假期緊接而至，父母除可安排子女外出旅遊或遊學外，不妨考慮以親子義工參與社會，服務社會，共享家庭樂，向有需要人士尤其獨居長者等送上節日祝福，讓弱勢群體感受到人間溫暖,贈人 玫瑰 學懂 感恩         聖誕節 、 元旦 及農 曆 新年 假期 緊接 而 至 ， 父母 除 可 安排 子女 外出 旅遊 或 遊學外 ， 不妨 考慮 以 親子 義工 參與 社會 ， 服務 社會 ， 共享 家庭 樂 ， 向 有 需要 人士 尤其 獨居長 者 等 送 上 節日 祝福 ， 讓 弱勢 群體 感受 到 人間 溫暖 。         參考 內 地 或 鄰 近地 區 ， 不少 社會 服務 組織 慣常 於 大型 節 日期 間 ， 安排 義工 尤其 親子 義工 協助 分發 食物 予有 需要 人士 或 家庭 。 父母 同 子女 一同 參與 有意 義的 活動 ， 既 可以 身作則 ， 更 可 讓 孩子 明白 到 幸福 並非 必然 的 道理 。 透過 把 食物 送給 獨居長 者 、 病人 或 低收入 家庭 等 ， 藉 節日 送 上 祝福 ， 很 有意 義 。 另 也 可將 生活 物資 如舊 衣服 等 ， 捐贈 至 相關 社福 機構 、 社區 組織 ， 惠及 有 需要 人士 。         贈人 玫瑰 ， 手留 餘香 。 父母 不妨 因應 子女 的 年紀 、 愛好 和 能力 ， 為 他們 適切 加入 不同 團體 ， 開展 相應 的 社會 服務 工作 ， 發揮 所長 ， 更 重要 是 通過 參 與 慈善 公益 活動 ， 一起 學習 如何 關懷別 人 ， 學懂 感恩 。 活動前 ， 多為 孩子 做好 思想 準備 ， 享受 與 受 訪者 溝通 交流 的 時光 ， 盡力 為 別人 送 上 節日 的 快樂 ， 終生 受益 。         悅     鳴,2024-12-24
澳晉青親子體驗嶺南文化,澳晉青親子體驗嶺南文化    澳門晉江青年聯合會主辦、澳門基金會贊助的“走進大灣區·嶺南文化行”於十二月二十一至二十三日在中山、佛山兩地舉行，來自澳門的三十位親子會員在珠三角文化之旅中，探索兩地的嶺南文化精髓，感受嶺南地區獨特的文化魅力。    一行參觀、遊覽中山孫中山故居、佛山市城市展覽館、咀香園生產基地並製作杏仁餅、廚邦醬油文化博物館、佛山南風古灶並捏泥塑等。    參與的家長施偉群表示，旅程讓孩子親身體驗到書本上學不到的歷史。十二歲的參與者蔡正文稱，以前只在課本上讀過孫中山先生的事蹟，這次親臨故居，讓歷史變得生動起來。十三歲的王樂恆表示，雖然我捏（泥塑）的不太完美，但這是我第一次親手製作陶藝品，很有成就感。    該會會長許結玲表示，文化之旅是難得的文化傳承與創新的教育機會。澳晉青未來將持續舉辦類似的文化活動，為澳門兒童及青少年搭建更多認識祖國、了解中華文化的平台。,http://www.macaodaily.com/html/2024-12/24/content_1802910.htm,澳晉青親子體驗嶺南文化    澳門晉江青年聯合會主辦、澳門基金會贊助的“走進大灣區·嶺南文化行”於十二月二十一至二十三日在中山、佛山兩地舉行，來自澳門的三十位親子會員在珠三角文化之旅中，探索兩地的嶺南文化精髓，感受嶺南地區獨特的文化魅力,澳晉 青親子 體驗嶺 南 文化         澳門晉 江青 年 聯合會 主辦 、 澳門 基金 會 贊助 的 “ 走 進大灣區 · 嶺南 文化 行 ” 於 十二月 二十一 至 二十三日 在 中山 、 佛山 兩地 舉行 ， 來 自澳門 的 三十位 親子 會員 在 珠三角 文化 之 旅中 ， 探索 兩地 的 嶺 南 文化 精髓 ， 感受 嶺南 地區 獨特 的 文化 魅力 。         一行 參觀 、 遊覽 中山 孫 中山 故居 、 佛山市 城市 展覽館 、 咀香園 生產 基地 並 製 作 杏仁 餅 、 廚邦 醬油 文化 博物 館 、 佛山 南風 古灶 並捏 泥塑 等 。         參與 的 家長 施偉群 表示 ， 旅程 讓 孩子 親身 體驗 到 書本 上學 不到 的 歷史 。 十二 歲 的 參與者 蔡 正文 稱 ， 以前 只 在 課本 上 讀 過孫 中山 先生 的 事 蹟 ， 這次 親臨 故居 ， 讓 歷史 變得 生動 起來 。 十三 歲 的 王樂恆 表示 ， 雖然 我 捏 （ 泥塑 ） 的 不 太 完美 ， 但 這是 我 第一次 親 手 製 作 陶 藝 品 ， 很 有 成就感 。         該會會長 許結玲 表示 ， 文化 之 旅是 難得 的 文化 傳承 與 創新 的 教育 機會 。 澳晉 青未來 將持續 舉辦類 似的 文化 活動 ， 為 澳門兒 童及 青少年 搭建 更多 認識 祖國 、 了解 中華 文化 的 平台 。,2024-12-24
手作人創意製作賽頒獎,手作人創意製作賽頒獎    澳門手作及創意人協會主辦的“澳門手作人創意製作比賽二○二四”日前在南方大廈四樓小路演廳舉行頒獎禮，共五十多人出席。現場頒發金、銀、銅獎及優異獎項，得獎者介紹作品及感言環節。    比賽分別決出公開組和學生組的金、銀、銅獎及優異獎四大獎項共十五位得獎者。主辦方冀透過比賽發掘更多有潛質的手作創意人，廣泛推廣本土創意手作工藝產品，持續推動澳門文創產業多元發展。該會主席伍嘉欣致辭表示，希望透過比賽推廣手作及發掘更多有潛質的手作人，並鼓勵各位尊重多元文化的價值。該會今後將堅持舉辦文化創意與藝術教育活動，團結及招募更多藝術工作者傳授技藝和知識，做好民間藝術培育工作。    比賽以“澳門美食”為主題。公開組金獎得主蔡佩琳作品為“Memória——玻璃露營燈”；學生組方面，崔海盈、黎靜雯、林文茜、呂昕洳（培道中學）憑藉作品“澳門味蕾漫步”拿下金獎。兩組別銀獎、銅獎、優異獎得主名單、作品從略。,http://www.macaodaily.com/html/2024-12/24/content_1802911.htm,主辦方冀透過比賽發掘更多有潛質的手作創意人，廣泛推廣本土創意手作工藝產品，持續推動澳門文創產業多元發展,手作 人創 意 製 作 賽 頒 獎         澳門 手作 及 創意 人 協會 主辦 的 “ 澳門 手作 人創 意 製 作 比 賽 二 ○ 二四 ” 日前 在 南方 大廈 四樓 小 路演 廳 舉行 頒 獎禮 ， 共 五十多 人 出席 。 現場 頒 發金 、 銀 、 銅獎 及 優異 獎項 ， 得 獎者 介紹 作品 及 感言 環節 。         比賽 分別 決出 公開 組和學 生組 的 金 、 銀 、 銅獎 及 優異獎 四大 獎項 共 十五位 得 獎者 。 主辦 方冀透過 比賽 發掘 更 多 有 潛質 的 手作 創意 人 ， 廣泛 推廣 本土 創意手 作工 藝產品 ， 持續 推動 澳門文 創產業 多元 發展 。 該會 主席 伍嘉欣致 辭 表示 ， 希望 透過 比賽 推廣手 作及 發掘 更 多 有 潛質 的 手作 人 ， 並鼓勵 各位 尊重 多元 文化 的 價值 。 該會 今後將 堅持 舉辦 文化 創意 與 藝術 教育 活動 ， 團結 及 招募 更多 藝術 工作者 傳授 技藝 和 知識 ， 做好 民間 藝術 培育 工作 。         比賽 以 “ 澳門 美食 ” 為主題 。 公開 組金獎 得主 蔡佩琳 作品 為 “ Mem ó ria — — 玻璃 露營燈 ” ； 學生組 方面 ， 崔海盈 、 黎靜雯 、 林文茜 、 呂昕 洳 （ 培道 中學 ） 憑 藉 作品 “ 澳門 味蕾 漫步 ” 拿下 金獎 。 兩組別 銀獎 、 銅獎 、 優異獎 得主 名單 、 作品 從略 。,2024-12-24
音教協川交流促音樂發展,音教協川交流促音樂發展    澳門音樂教育協會主辦、澳門基金會資助的融入國家發展“蜀韻飛揚”四川音樂文化交流團，顧問高勝文、會長陳家豪帶領一行二十人日前一連五天，到四川省成都市交流音樂藝術，期望通過參訪成都音樂相關機構及景點，促進兩地音樂藝術發展。    一行拜訪四川高等學校澳門學生聯合會並交流。還參訪三星堆博物館、武侯祠、成都大熊貓繁育研究基地、四川省音樂家協會等音樂相關機構及景點。陳家豪表示，四川文化交流讓團員了解澳門青年在四川的學習和生活，以及雙方達成明年支持舉辦澳門國際音樂比賽、澳門國際音樂知識競賽等年度活動的初步協定。相信，成員通過音樂藝術交流，了解成都的歷史、獨特風俗及現代音樂文化，可促進澳門與四川地區音樂工作者及愛好者之間的交流合作，共同推動兩地音樂藝術發展。,http://www.macaodaily.com/html/2024-12/24/content_1802912.htm,音教協川交流促音樂發展    澳門音樂教育協會主辦、澳門基金會資助的融入國家發展“蜀韻飛揚”四川音樂文化交流團，顧問高勝文、會長陳家豪帶領一行二十人日前一連五天，到四川省成都市交流音樂藝術，期望通過參訪成都音樂相關機構及景點，促進兩地音樂藝術發展,音教 協川 交流 促音樂 發展         澳門 音樂 教育 協會 主辦 、 澳門 基金 會資助 的 融入 國家 發展 “ 蜀韻 飛揚 ” 四川 音樂 文化交流 團 ， 顧問 高勝文 、 會長 陳 家豪 帶領 一行 二十 人 日前 一連 五天 ， 到 四川省 成都市 交流 音樂 藝術 ， 期望 通過 參訪 成都 音樂 相關 機構 及 景點 ， 促進 兩地 音樂 藝術 發展 。         一行 拜訪 四川 高等 學校 澳門 學生 聯合會並 交流 。 還參訪 三星堆 博物 館 、 武侯祠 、 成都 大熊 貓 繁育 研究 基地 、 四川省 音樂家 協會 等 音樂 相關 機構 及 景點 。 陳 家豪 表示 ， 四川 文化交流 讓 團員 了解 澳門 青年 在 四川 的 學習 和 生活 ， 以及 雙方達成 明年 支持 舉辦 澳門 國際 音樂 比賽 、 澳門 國際 音樂 知識 競賽 等 年度 活動 的 初步 協定 。 相信 ， 成員 通過 音樂 藝術 交流 ， 了解 成都 的 歷史 、 獨特風俗 及 現代音樂 文化 ， 可促 進澳門 與 四川 地區 音樂 工作者 及 愛好者 之間 的 交流 合作 ， 共同 推動 兩地 音樂 藝術 發展 。,2024-12-24
髮美協新春廣西團報名,髮美協新春廣西團報名    髮型美容從業員協會將於一月三十日至二月二日（年初二至年初五）舉辦新春廣西高鐵四天團，行程遊覽灕江源大峽谷、貓兒山、崀山風景區、辣椒峰景區。    費用：會員每位三千一百六十三元（澳門元，下同）；非會員每位三千二百四十三；六歲以下小童每位二千五百七十八元（不含高鐵票，不佔床）；六至十二歲中童每位二千八百八十八元 （含高鐵票，不佔床），詳情可向該會或各區聯絡員查詢，報名：二八九二 · ○三四三，額滿即止。,http://www.macaodaily.com/html/2024-12/24/content_1802913.htm,六至十二歲中童每位二千八百八十八元 （含高鐵票，不佔床），詳情可向該會或各區聯絡員查詢，報名：二八九二 · ○三四三，額滿即止,髮 美協 新春 廣西團 報名         髮 型 美容 從業員 協會將 於 一月 三十日 至 二月 二日 （ 年初二 至 年初 五 ） 舉辦 新春 廣西 高鐵 四天 團 ， 行程 遊覽 灕 江源 大峽谷 、 貓兒 山 、 崀 山 風 景 區 、 辣椒 峰景區 。         費用 ： 會員 每位 三千 一百六十 三元 （ 澳門元 ， 下同 ） ； 非會員 每位 三千 二百四十 三 ； 六歲 以下 小童 每位 二千五百 七十八 元 （ 不含 高鐵票 ， 不佔床 ） ； 六至 十二 歲 中童 每位 二 千八百 八十八 元   （ 含高鐵票 ， 不佔床 ） ， 詳情 可 向 該 會 或 各區 聯絡員 查詢 ， 報名 ： 二 八九 二   ·   ○ 三四 三 ， 額滿 即止 。,2024-12-24
利物浦6:3拔“刺”,入球盛宴轟九球    利物浦6:3拔“刺”    【本報消息】英超昨凌晨利浦作客熱刺大演入球騷，紅軍憑沙拿、迪亞斯各自梅開二度，作客大勝六比三拔“刺”，以四分優勢拋開次席、踢多一場的車路士，聖誕前鞏固榜首。    熱刺今仗繼續孫興民、蘇蘭基和麥迪遜領軍，利物浦則以沙拿、加普和迪亞斯合組三叉戟。紅軍今仗反客為主，沙拿十八分鐘禁區右路射門中楣，迪亞斯五分鐘後接應阿諾妙傳頭鎚破網。卅六分鐘，麥亞里士打門前頭鎚頂成二比○。五分鐘後，麥亞里士打後場被截球，麥迪遜禁區外起腳追至一比二。上半場補時，沙拿藉反擊妙傳蘇保斯拉爾射空門成三比一返入更衣室。    熱刺下半場反撲，後防現更多空位，沙拿在五十四及六十一分鐘梅開二度，射手榜超越曼城的夏蘭特，以十五球高踞首位。落後一比五的熱刺未放棄，倒戈的蘇蘭基挑傳給古路斯夫斯基禁區內勁抽入網；前者八十三分鐘，禁區內臥射成三比五。兩分鐘後，沙拿再交助攻，造就迪亞斯梅開二度，鎖定六比三勝局。利物浦賽後積卅九分高踞榜首，熱刺積廿三分排名十一位。    史洛：最好作客表現    紅軍領隊史洛大讚球員表現：“或者是我們最好的作客表現，雖然我很喜歡對曼聯時看到的表現。如果我們半場只領先二比一，就無法充分掌握優勢，所以我對蘇保斯拉爾半場補時的入球很高興。然後難以置信地是贏到四比一、五比一。但你也可以看到，當我們少了奔跑，即使有出色的球員在陣，在這個聯賽都有危險，尤其和熱刺交手，他們的控球能力非常出色，能即時創造機會，幸好我們第六個入球來了，結局公平。”    老孫：失六球好痛苦    隊長孫興民未能成為歷來首名連續六次攻破紅軍大門的球員，賽後失望大敗：“對賽果很失望，失掉六球實在痛苦。我還可以說甚麼？作為球員，大家總想努力爭勝。此刻我們必須努力，我不想為輸波搵藉口。毫無疑問，利物浦是榜首球隊，頂級球員、一流的紀律，這就是高踞榜首的原因。當你犯任何錯誤，他們就會懲罰你。”熱刺再輸一仗，有球迷高呼領隊普斯迪高路下台，普帥回應：“或者他們中的一些人理解球隊現在的處境，似乎有很多人不理解。我希望球迷能看到正在努力打造的東西，因為我真的相信這會給球會和球迷帶來他們想要的結果。”,http://www.macaodaily.com/html/2024-12/24/content_1802914.htm,但你也可以看到，當我們少了奔跑，即使有出色的球員在陣，在這個聯賽都有危險，尤其和熱刺交手，他們的控球能力非常出色，能即時創造機會，幸好我們第六個入球來了，結局公平,入球 盛宴 轟九球         利物浦 6 : 3 拔 “ 刺 ”         【 本報 消息 】 英超 昨 凌晨 利浦 作客 熱刺 大演 入球 騷 ， 紅軍憑 沙 拿 、 迪亞斯 各自 梅開 二度 ， 作客 大勝六比 三拔 “ 刺 ” ， 以 四分 優勢 拋開 次席 、 踢 多 一場 的 車路士 ， 聖誕前 鞏固 榜首 。         熱刺 今仗 繼續 孫興民 、 蘇蘭基 和 麥迪遜領 軍 ， 利物浦 則以 沙 拿 、 加普和迪亞斯合組 三叉戟 。 紅軍今 仗 反客 為 主 ， 沙拿 十八分 鐘禁區 右路 射門 中楣 ， 迪亞斯 五分 鐘後接 應 阿諾妙 傳頭 鎚 破網 。 卅 六分 鐘 ， 麥亞里士 打門 前頭 鎚 頂 成二比 ○ 。 五分 鐘後 ， 麥亞里士 打後場 被 截球 ， 麥迪遜 禁區 外起 腳 追至 一比二 。 上半 場補時 ， 沙拿藉 反擊妙 傳蘇保 斯拉 爾射 空門 成三比 一 返入 更衣室 。         熱刺 下半場 反 撲 ， 後 防現 更 多 空位 ， 沙拿在 五十四 及 六十一 分鐘 梅開 二度 ， 射手榜 超越 曼城 的 夏蘭特 ， 以 十五 球 高踞 首位 。 落後一比 五 的 熱刺 未放棄 ， 倒戈 的 蘇蘭基 挑傳給 古 路斯 夫斯基 禁區 內勁 抽入網 ； 前者 八十 三分 鐘 ， 禁區 內 臥射成 三 比 五 。 兩分鐘 後 ， 沙拿再 交 助攻 ， 造就 迪亞斯梅開 二度 ， 鎖定 六 比三勝局 。 利物浦 賽後積 卅 九分 高踞 榜首 ， 熱刺積 廿三 分 排名 十一位 。         史洛 ： 最好 作客 表現         紅軍領 隊史洛 大 讚 球 員 表 現 ： “ 或者 是 我們 最好 的 作客 表現 ， 雖然 我 很 喜歡 對 曼聯時 看到 的 表現 。 如果 我們 半場 只領 先二比 一 ， 就 無法 充分 掌握 優勢 ， 所以 我 對 蘇保 斯拉 爾半場 補時 的 入球 很 高興 。 然後難 以 置信 地是 贏到 四比 一 、 五比 一 。 但 你 也 可以 看到 ， 當我們 少 了 奔跑 ， 即使 有 出色 的 球員 在 陣 ， 在 這個 聯賽 都 有 危險 ， 尤其 和 熱刺 交手 ， 他們 的 控球 能力 非常 出色 ， 能 即 時 創造 機會 ， 幸好 我們 第六 個 入球 來 了 ， 結局 公平 。 ”         老孫 ： 失六球 好 痛苦         隊長 孫興民 未能 成為 歷來 首名 連續 六次 攻破 紅軍大門 的 球員 ， 賽 後 失望 大敗 ： “ 對賽果 很 失望 ， 失掉 六球實 在 痛苦 。 我還 可以 說 甚麼 ？ 作為 球員 ， 大家 總想 努力 爭勝 。 此刻 我們 必須 努力 ， 我 不想 為 輸波 搵 藉口 。 毫無疑問 ， 利物浦 是 榜首 球隊 ， 頂級 球員 、 一流 的 紀律 ， 這 就是 高踞 榜首 的 原因 。 當你犯 任何 錯誤 ， 他們 就 會 懲罰 你 。 ” 熱刺 再輸 一仗 ， 有 球迷 高呼 領隊 普斯迪 高路 下台 ， 普帥 回應 ： “ 或者 他們 中 的 一些 人 理解 球隊 現在 的 處境 ， 似乎 有 很多 人 不 理解 。 我 希望 球迷 能 看到 正在 努力 打造 的 東西 ， 因為 我 真的 相信 這會 給球會 和 球迷 帶來 他們 想要 的 結果 。 ”,2024-12-24
