Title,Content,Link,Summary,Preprocessed_Content,Date
冀澳青年學習三中全會精神,冀澳青年學習三中全會精神    【本報消息】中國共產黨第二十屆中央委員會第三次全體會議於七月十五至十八日在北京舉行，會議審議通過《中共中央關於進一步全面深化改革、推進中國式現代化的決定》。冀澳青年交流促進會日前舉辦“學習貫徹黨的二十屆三中全會精神學習座談會”，會長宋碧琪主持，副理事長蔡琦海為主講人，理事長許冰、秘書長傅騰龍及眾理監事出席。    宋碧琪表示，《決定》審議通過，為全面深化改革作出總體部署，確定改革任務時間表，充分體現中央改革的決定及強烈的使命擔當，為中國式現代化及中華民族偉大復興推進提供強大動力和制度保障。《決定》強調，支持澳門在國家對外開放中更好發揮作用機制，為澳門指明發展方向，賦予新的使命。要深刻把握好會議精神，加強民族觀念、國家意識，用好澳門特色，發揮澳門優勢，為澳門在中國式現代化道路上發揮更大作用。    蔡琦海表示，《決定》共有三百多項重要改革舉措，涉及體制、機制、制度等層面的內容，為全面深化改革提出指導思想及總目標。《決定》提出了新概念、新論點及新論斷，顯示了黨立足全局，着眼長遠、與時俱進的重大戰略決策，對全面深化改革做出系統部署，為中國式現代化建設指明方向。    許冰表示，黨的二十屆三中全會強調，法治是中國式現代化的重要保障，澳門作為國家對外的平台窗口，要持續維護好憲法和基本法，更要適應新形勢新要求，積極普法用法，履行法律從業者自身社會責任，投身改革實踐，提高工作質效，為律師業界發展貢獻力量。    傅騰龍指出，《決定》指出，要健全推動高質量發展體制機制，提振民營經濟發展的信心和底氣，促進實體經濟和數字經濟深度融合。澳門直播經濟是虛實產業結合的新業態，期望能夠在澳門平台經濟發揮重要作用，匯聚澳門獨特優勢，輻射海內外市場。    會上，大家積極發言，期望持續深入學習二十屆三中全會精神，在中國式現代化進程中，發揮個人優勢，為融入國家發展大局，國家經濟高質量發展貢獻力量。,http://www.macaodaily.com/html/2024-08/07/content_1773206.htm,許冰表示，黨的二十屆三中全會強調，法治是中國式現代化的重要保障，澳門作為國家對外的平台窗口，要持續維護好憲法和基本法，更要適應新形勢新要求，積極普法用法，履行法律從業者自身社會責任，投身改革實踐，提高工作質效，為律師業界發展貢獻力量,冀澳 青年 學習 三中 全會 精神         【 本報 消息 】 中國共產黨 第二十 屆 中央 委員會 第三次 全體 會議 於 七月 十五 至 十八日 在 北京 舉行 ， 會議 審議 通過 《 中共中央 關於進 一步 全面 深化改革 、 推進 中國式 現代化 的 決定 》 。 冀澳 青年 交流 促進會 日前 舉辦 “ 學習 貫徹 黨 的 二十 屆 三中 全會 精神 學習 座 談會 ” ， 會長 宋碧琪 主持 ， 副 理事 長 蔡琦海為 主講 人 ， 理事 長 許冰 、 秘書長 傅騰龍 及 眾理 監事 出席 。         宋碧琪 表示 ， 《 決定 》 審議 通過 ， 為 全面 深化改革 作出 總體 部署 ， 確定 改革 任務時 間表 ， 充分 體現 中央 改革 的 決定 及 強烈 的 使命 擔當 ， 為 中國式 現代化 及 中華 民族 偉大 復 興 推進 提供 強大動力 和 制度 保障 。 《 決定 》 強調 ， 支持 澳門 在 國家 對外 開放中 更好 發揮 作用 機制 ， 為 澳門 指明 發展 方向 ， 賦予 新 的 使命 。 要 深刻 把握 好會議 精神 ， 加強 民族 觀念 、 國家 意識 ， 用 好 澳門 特色 ， 發揮 澳門 優勢 ， 為 澳門 在 中國式 現代化 道路 上 發揮 更 大 作用 。         蔡琦海 表示 ， 《 決定 》 共有 三百多 項 重要 改革 舉措 ， 涉及 體制 、 機制 、 制度 等 層面 的 內容 ， 為 全面 深化改革 提出 指導 思想 及 總 目標 。 《 決定 》 提出 了 新 概念 、 新論點 及 新論斷 ， 顯示 了 黨 立足 全局 ， 着眼 長 遠 、 與 時俱進 的 重大 戰略 決策 ， 對 全面 深化改革 做出 系統 部署 ， 為 中國式 現代化 建設 指明方向 。         許冰 表示 ， 黨 的 二十 屆 三中 全會 強調 ， 法治 是 中國式 現代化 的 重要 保障 ， 澳門 作為 國家 對 外 的 平台 窗口 ， 要持續 維護 好 憲法 和 基本法 ， 更要 適應 新 形勢 新 要求 ， 積極 普法 用法 ， 履行 法律 從業者 自身 社會責任 ， 投身 改革 實踐 ， 提高 工作 質效 ， 為律 師業界 發展 貢獻 力量 。         傅騰龍 指出 ， 《 決定 》 指出 ， 要 健全 推動 高質量 發展 體制 機制 ， 提振民營 經濟 發展 的 信心 和 底氣 ， 促進 實體 經濟 和 數字 經濟 深度 融合 。 澳門 直播 經濟 是 虛實產業 結合 的 新業態 ， 期望 能夠 在 澳門 平台 經濟 發揮 重要 作用 ， 匯聚 澳門 獨特 優勢 ， 輻射海 內外 市場 。         會上 ， 大家 積極 發言 ， 期望 持續 深入 學習 二十 屆 三中 全會 精神 ， 在 中國式 現代化 進程 中 ， 發揮個 人 優勢 ， 為 融入 國家 發展 大局 ， 國家 經濟 高質量 發展 貢獻 力量 。,2024-08-07
長者委考察滬蘇長者服務政策,長者委考察滬蘇長者服務政策    【本報消息】社工局訊：澳門特別行政區政府長者事務委員會及養老保障機制跨部門策導小組於七月廿一日至廿六日期間前往上海市和蘇州市考察交流，獲上海市政府港澳事務辦公室及民政局、蘇州市政府港澳事務辦公室及民政局相關負責人的熱情接待。    交流團一行廿六人由長者事務委員會副主席、養老保障機制跨部門策導小組副組長、社會工作局長韓衛帶領，並邀請中聯辦副秘書長兼社會工作部長黃華蓋擔任隨團顧問。    交流團在上海市期間，獲上海市政府港澳事務辦公室主任孔福安、上海市民政局長蔣蕊及相關負責人熱情接待。座談期間，雙方就上海市與澳門在應對人口老齡化的情況和各項長者服務，尤其在體系建設、人才培養及智慧養老等方面深入交流。韓衛向與會者介紹本澳長者服務現況及相關工作經驗。交流團先後考察上海市浦東新區養老服務發展中心、洋涇街道巨野老年人綜合型助餐服務示範點社區長者食堂、上海老年大學欽州書院、復旦大學附屬華東醫院、虹橋街道虹東社區，以及多家長者服務機構。    交流團在蘇州市期間，獲蘇州市政府港澳事務辦公室副主任金怡、蘇州市民政局副局長嚴強及相關負責人熱情接待。座談期間，雙方就蘇州市及澳門的長者政策及服務交流，了解到蘇州市在打造社區、居家、機構養老相協調和醫養結合的長者服務體系的相關經驗。其後，交流團參觀蘇州市社會福利總院、蘇州市怡養老年公寓（怡養護理院）、姑蘇區悅齡健康綜合服務中心，以及姑蘇區居家樂養老服務中心（虛擬養老院）。    具參考啟發作用    是次考察活動行程充實、收穫豐富，有助交流團深入認識上海市和蘇州市的長者政策和服務現況，以及有關應對人口老化的政策方針、具體服務和完善長者服務體系的重要舉措，對本澳未來長者服務規劃和持續發展具參考價值及前瞻性的啟發作用。    交流團成員還包括：勞工事務局長黃志雄、社會保障基金行政管理委員會主席容光耀、市政署市政管理委員會委員關施敏、衛生局主任潘詠紅、房屋局處長陳君傑、澳門理工大學代處長劉堅媚、澳門歸僑總會副會長廖麗瓊、澳門社會工作人員協進會副會長蕭紹雯、同善堂值理陳伯銘、澳門鏡湖護理學院主任梁淑敏、澳門街坊會聯合總會協調主任梁詠恩、澳門婦女聯合總會助理行政主管何伊琳、母親會院長馮少丹、澳門明愛院長黃愛蓮、澳門工會聯合總會主任馬韻妮，個人委員賀定一、羅少霞、陳建新，以及相關部門主管和代表等。,http://www.macaodaily.com/html/2024-08/07/content_1773201.htm,長者委考察滬蘇長者服務政策    【本報消息】社工局訊：澳門特別行政區政府長者事務委員會及養老保障機制跨部門策導小組於七月廿一日至廿六日期間前往上海市和蘇州市考察交流，獲上海市政府港澳事務辦公室及民政局、蘇州市政府港澳事務辦公室及民政局相關負責人的熱情接待,長 者 委 考察 滬蘇長 者 服務 政策         【 本報 消息 】 社工 局訊 ： 澳門 特別 行政 區 政府 長 者 事務委員會 及養 老 保障 機制 跨部門策 導小組 於 七月 廿一日 至 廿六日 期間 前往 上海市 和 蘇 州市 考察 交流 ， 獲 上海市政府 港澳 事務辦 公室 及 民政局 、 蘇州 市政府 港澳 事務辦 公室 及 民政局 相關 負責人 的 熱情 接待 。         交流 團 一行 廿六 人由長 者 事務委員會 副 主席 、 養老 保障 機制 跨部門策 導小組 副 組長 、 社會 工作 局長 韓衛 帶領 ， 並邀 請 中聯辦 副 秘書長 兼 社會 工作部 長 黃 華蓋 擔任 隨團 顧問 。         交流 團在 上海市 期間 ， 獲 上海市政府 港澳 事務 辦公 室主任 孔 福安 、 上海市 民政局 長 蔣蕊 及 相關 負責人 熱情 接待 。 座談 期間 ， 雙方 就 上海市 與 澳門 在 應 對 人口 老齡化 的 情況 和 各 項長 者 服務 ， 尤其 在 體系 建設 、 人才 培養 及 智慧 養老 等 方面 深入 交流 。 韓衛向 與 會者 介紹本 澳長 者 服務 現況 及 相關 工作 經驗 。 交流 團先 後 考察 上海市 浦東 新區養 老 服務 發展 中心 、 洋涇 街道 巨野 老年人 綜合型 助餐 服務示 範點 社區長 者 食堂 、 上海 老年 大學 欽州書院 、 復 旦 大學 附屬 華東 醫院 、 虹橋 街道 虹東 社區 ， 以及 多家 長 者 服務 機構 。         交流 團在 蘇 州市 期間 ， 獲蘇州 市政府 港澳 事務辦 公室 副 主任 金怡 、 蘇 州市 民政局 副 局長 嚴強 及 相關 負責人 熱情 接待 。 座談 期間 ， 雙方 就 蘇 州市 及 澳門 的 長 者 政策 及 服務 交流 ， 了解 到 蘇 州市 在 打造 社區 、 居家 、 機構 養老 相協調 和 醫養 結合 的 長 者 服務體系 的 相關 經驗 。 其 後 ， 交流 團參觀 蘇 州市 社會 福利 總院 、 蘇 州市 怡養 老年公寓 （ 怡養護 理院 ） 、 姑蘇區 悅齡 健康 綜合 服務 中心 ， 以及 姑蘇區 居家 樂養 老 服務 中心 （ 虛擬養 老院 ） 。         具參考 啟發 作用         是 次 考察 活動 行程 充實 、 收 穫 豐富 ， 有助 交流 團 深入 認識 上海市 和 蘇 州市 的 長 者 政策 和服 務 現況 ， 以及 有 關應 對 人口老化 的 政策 方針 、 具體 服務 和 完善 長 者 服務體系 的 重要 舉措 ， 對本 澳未來 長 者 服務 規劃 和 持續 發展 具參考 價值 及 前瞻性 的 啟發 作用 。         交流 團成員還 包括 ： 勞 工事 務局 長 黃 志雄 、 社會 保障 基金 行政 管理 委員會 主席 容 光耀 、 市政 署 市政管理 委員會 委員關 施敏 、 衛生局 主任 潘詠紅 、 房屋 局處長 陳 君傑 、 澳門 理工大 學代 處長 劉堅媚 、 澳門 歸僑 總會 副 會長 廖麗瓊 、 澳門 社會 工作 人員協 進會 副 會長 蕭紹雯 、 同 善堂 值理陳伯銘 、 澳門鏡 湖護理 學院 主任 梁淑敏 、 澳門 街坊 會聯合 總會 協調 主任 梁詠 恩 、 澳門婦 女聯合 總會 助理 行政主管 何伊琳 、 母親會 院長 馮少丹 、 澳門 明愛院 長 黃 愛蓮 、 澳門 工會 聯合 總會 主任 馬 韻妮 ， 個 人委員 賀定 一 、 羅 少霞 、 陳 建新 ， 以及 相關 部門 主管 和 代表 等 。,2024-08-07
（新聞小語）推廣電動車充電安全減意外   夏  耘,推廣電動車充電安全減意外    澳門地小人多，交通擠塞，不少居民選擇以電單車出行。近年政府大力推動環保節能政策，除對電動車提供免機動車輛稅優惠、無需繳納年度車輛使用牌照稅外，加上環保局前年開始推出《淘汰老舊摩托車並置換新電動摩托車資助計劃》，並陸續於公共停車場增設電動車充電位，吸引不少人考慮購買電動電單車或舊車置換電動電單車。    截至七月底，全澳共有一萬○四百○七輛電動車，其中汽車有六千五百一十輛，電單車有三千八百九十七輛。以全澳十二萬多輛電單車而言，電動電單車仍未普及。但短短兩個月本澳發生兩宗電動電單車火警事件，六月初青洲坊公共停車場有電動電單車疑充電線短路起火，昨日氹仔中央公園公共停車場亦有電動電單車充電期間起火，懷疑亦是電線短路引致。相比傳統燃油車，電動車的安全問題受到關注，離不開電池這個重要組成部分。    最近兩宗電動電單車的起火原因疑與電池、充電有關。雖然政府對電動車進口要求嚴格，電池成本較貴，加上電動電單車電池續航問題，對比起燃油車輛可行駛的公里數較少，因此駕駛者會選擇自購較大容量的電池以彌補電池續航不足，被指是引發火警的原因。有業界指出，電動電單車起火原因大多涉及非法改裝，尤其改用雜牌的大容量電池。    雖然政府大力推廣使用電動車，推介電動車行駛時無廢氣排放、較寧靜、節省燃料成本等優點，但有否向居民大眾普及安全使用電動車的知識？電動電單車充電時會產生高溫，尤其經過改裝電池的電動電單車，在充電期間容易因管理不善引發火警。目前電動電單車集中於公共停車場充電，車輛密集，若散熱不足，稍一不慎，容易招來祝融。    當局在推廣使用電動車時，應加大宣教電動車的使用安全，尤其電池維護和充電知識，普及加強駕駛者注意車輛和電池的日常管理，並應明確規範充電的指引，講解電池或充電時可能的異常表象、如何應對，讓用家注意，減少意外事故的發生。    夏  耘,http://www.macaodaily.com/html/2024-08/07/content_1773204.htm,近年政府大力推動環保節能政策，除對電動車提供免機動車輛稅優惠、無需繳納年度車輛使用牌照稅外，加上環保局前年開始推出《淘汰老舊摩托車並置換新電動摩托車資助計劃》，並陸續於公共停車場增設電動車充電位，吸引不少人考慮購買電動電單車或舊車置換電動電單車,推廣電動車 充電 安全 減 意外         澳門 地 小人 多 ， 交通 擠塞 ， 不少 居民 選擇 以電 單車 出行 。 近年 政府 大力 推動 環保節 能 政策 ， 除 對 電動車 提供 免機動 車輛 稅優惠 、 無需 繳納 年度 車輛 使用 牌照 稅外 ， 加上 環保局 前年 開始 推出 《 淘汰 老舊 摩托 車並置 換新 電動 摩托 車資助 計劃 》 ， 並陸續 於 公共 停車場 增設 電動車 充電位 ， 吸引 不少 人 考慮 購買 電動電 單車 或 舊車 置換 電動電 單車 。         截至 七月 底 ， 全澳 共有 一萬 ○ 四百 ○ 七輛 電動車 ， 其中 汽車 有 六千五百 一十 輛 ， 電單 車有 三千八百 九十七 輛 。 以 全澳 十二 萬多輛 電單車 而言 ， 電動電 單車 仍 未 普及 。 但 短短 兩個 月 本澳 發生 兩宗 電動電 單車 火警 事件 ， 六月 初 青洲 坊 公共 停車場 有 電動 電單 車疑 充電線 短路 起火 ， 昨日 氹 仔 中央 公園 公共 停車場 亦 有 電動電 單車 充電期 間 起火 ， 懷疑 亦 是 電線 短路 引致 。 相比 傳統 燃油 車 ， 電動車 的 安全 問題 受到 關注 ， 離不開 電池 這個 重要 組成 部分 。         最近 兩宗 電動電 單車 的 起火 原因 疑 與 電池 、 充電 有關 。 雖然 政府 對 電動車 進口 要求 嚴格 ， 電池 成本 較貴 ， 加上 電動電 單車 電池續 航問題 ， 對 比起 燃油 車輛 可行 駛 的 公里 數較 少 ， 因此 駕駛者 會 選擇 自購 較 大容量 的 電池 以彌補 電池續 航 不足 ， 被 指是 引發 火警 的 原因 。 有業界 指出 ， 電動電 單車 起火 原因 大多 涉及 非法 改裝 ， 尤其 改用 雜牌 的 大容量 電池 。         雖然 政府 大力 推廣 使用 電動車 ， 推介 電動車 行駛時 無 廢氣 排放 、 較寧靜 、 節省 燃料 成本 等 優點 ， 但 有否 向 居民 大眾 普及 安全 使用 電動車 的 知識 ？ 電動電 單車 充電時 會產生 高溫 ， 尤其 經過 改裝 電池 的 電動電 單車 ， 在 充電期 間 容易 因 管理 不善 引發 火警 。 目前 電動電 單車 集中 於 公共 停車場 充電 ， 車輛 密集 ， 若 散熱 不足 ， 稍 一 不慎 ， 容易 招來 祝融 。         當局 在 推廣 使用 電動車 時 ， 應 加大 宣教 電動車 的 使用 安全 ， 尤其 電池 維護 和 充電 知識 ， 普及 加強 駕駛者 注意 車輛 和 電池 的 日常 管理 ， 並應 明確 規範 充電 的 指引 ， 講解 電池 或 充電時 可能 的 異常 表象 、 如何 應對 ， 讓 用家 注意 ， 減少 意外事故 的 發生 。         夏     耘,2024-08-07
POP-UP圖書館推廣社區閱讀,POP-UP圖書館推廣社區閱讀    【本報消息】文化局訊：為加強社區閱讀推廣，宣揚閱讀豐富生活的理念，文化局於今年八月、十月及十二月的第二周在三盞燈、筷子基和氹仔推出“期間限定POP-UP圖書館”，為居民提供可免費取閱的圖書，讓閱讀在社區中生根萌芽。    POP-UP圖書館以“閱讀之城，齊來享閱”為口號，同時設置於嘉路米耶圓形地（三盞燈）、筷子基綠楊花園休憩區及氹仔星皓廣場行人道，每次連續擺放七天，居民每次可免費取閱一本圖書。為促進閱讀資源在社區內流轉，POP-UP圖書館亦設有漂書投放口，供居民釋出家中閒置圖書，延續書本的生命和價值。    查詢可於文化局公共圖書館櫃檯服務時間致電二八五六　·　七五七六或二八八四　·　三一○五、或瀏覽文化局公共圖書館網頁(www.library.gov.mo)或“我家圖書館”手機應用程式。,http://www.macaodaily.com/html/2024-08/07/content_1773205.htm,POP-UP圖書館以“閱讀之城，齊來享閱”為口號，同時設置於嘉路米耶圓形地（三盞燈）、筷子基綠楊花園休憩區及氹仔星皓廣場行人道，每次連續擺放七天，居民每次可免費取閱一本圖書,POP - UP 圖書館 推廣 社區 閱讀         【 本報 消息 】 文化局 訊 ： 為 加強 社區 閱讀 推廣 ， 宣揚 閱讀 豐富 生活 的 理念 ， 文化局 於 今年 八月 、 十月 及 十二月 的 第二周 在 三盞 燈 、 筷子 基和氹仔 推出 “ 期間 限定 POP - UP 圖書館 ” ， 為 居民 提供 可免 費取閱 的 圖書 ， 讓 閱讀 在 社區 中 生根 萌芽 。         POP - UP 圖書館 以 “ 閱讀 之城 ， 齊來 享閱 ” 為口號 ， 同時 設置 於 嘉路 米 耶圓形 地 （ 三盞 燈 ） 、 筷子 基綠 楊花園 休憩 區及 氹 仔星 皓 廣場 行人 道 ， 每次 連續 擺放 七天 ， 居民 每次 可免 費取閱 一本 圖書 。 為 促進 閱讀 資源 在 社區 內 流轉 ， POP - UP 圖書館 亦 設有 漂書 投放 口 ， 供 居民 釋出 家中 閒置 圖書 ， 延續 書本 的 生命 和 價值 。         查詢 可 於 文化局 公共 圖書館櫃 檯 服務 時間 致電 二八 五六 　 · 　 七五 七六 或 二八 八四 　 · 　 三一 ○ 五 、 或 瀏覽 文化局 公共 圖書館 網頁 ( www . library . gov . mo ) 或 “ 我家 圖書館 ” 手機 應用 程式 。,2024-08-07
今酷熱驟雨,今酷熱驟雨    【本報消息】氣象局已發出橙色高溫提示，預測今日立秋天氣仍然酷熱，多雲，部分時間有陽光，稍後有幾陣驟雨及雷暴，吹二至四級西南風及有陣風，氣溫為攝氏廿七至卅五度，相對濕度百分之六十至九十五。    路邊、一般性、高密度住宅區空氣質量水平普通，沿海地區吹二至四級西南風及有陣風，視野平常至良好。    預測明日天氣酷熱，大致天晴，吹二至四級西南風，氣溫攝氏廿八至卅四度，相對濕度為百分之六十至九十五。    昨日天氣酷熱，多雲，部分時間有陽光，下午有幾陣驟雨及雷暴，氣溫攝氏廿九至卅四度，相對濕度百分之五十八至九十三，錄得最高紫外線指數為八點六，平均為三點四，強度屬於中等。,http://www.macaodaily.com/html/2024-08/07/content_1773207.htm,今酷熱驟雨    【本報消息】氣象局已發出橙色高溫提示，預測今日立秋天氣仍然酷熱，多雲，部分時間有陽光，稍後有幾陣驟雨及雷暴，吹二至四級西南風及有陣風，氣溫為攝氏廿七至卅五度，相對濕度百分之六十至九十五,今酷 熱驟 雨         【 本報 消息 】 氣象局 已 發出 橙色 高溫 提示 ， 預測 今日 立 秋天 氣 仍然 酷熱 ， 多 雲 ， 部分 時間 有陽光 ， 稍後有 幾陣 驟雨及 雷暴 ， 吹二至 四級 西南 風及 有 陣風 ， 氣溫 為 攝氏 廿七 至卅 五度 ， 相對 濕度 百分之六十 至 九 十五 。         路邊 、 一般性 、 高密度 住宅 區空氣 質量 水平 普通 ， 沿海 地區 吹二至 四級 西南 風及 有 陣風 ， 視野 平常 至 良好 。         預測 明日 天氣 酷熱 ， 大致 天晴 ， 吹二至 四級 西南 風 ， 氣溫 攝氏 廿八 至卅 四度 ， 相對 濕度 為 百分之六十 至 九 十五 。         昨日 天氣 酷熱 ， 多 雲 ， 部分 時間 有陽光 ， 下午 有 幾陣 驟雨及 雷暴 ， 氣溫 攝氏 廿九 至卅 四度 ， 相對 濕度 百分之五十 八至 九十三 ， 錄得 最高 紫外 線 指數 為 八點 六 ， 平均 為 三點 四 ， 強度屬 於 中等 。,2024-08-07
