Title,Content,Link,Summary,Preprocessed_Content,Date
FR世盃烏高卓古封王,十七歲美車手成澳門首任盟主    FR世盃烏高卓古封王    【本報消息】第七十一屆澳門格蘭披治大賽車壓軸賽事——國際汽聯FR世界盃十五圈昨日順利完成，為今屆風雨中的大賽車畫上句號。賽事四度出安全車，十七歲的四號美國車手烏高卓古發揮出色，由頭帶到尾，成為這項首次落戶澳門賽事的第一位盟主。一號德國車手歌德和七號墨西哥車手理昂亦保持發揮，分奪亞軍和季軍。    起步五車炒埋一碟    賽事共鬥十五圈，共有廿七架戰車出戰，烏高卓古、歌德、理昂排在前三位發車，第四至六為卅一號英國車手史雷特、五號法國車手迪利尼和廿六號意大利車手迪帕洛。    遭遇前幾天的濕地戰，賽事終在正賽迎來陽光與乾地，安全車帶領各戰車完成熱身圈後，比賽正式開始。甫起步，史雷特已抽頭欲超越理昂未果，隨後十六號戰車在葡京彎撞欄，緊隨其後的卅三號、十八號、八十八號和十九號戰車收掣不及“炒埋一碟”，大會出示紅旗暫停賽事，排前幾位的戰車未受影響。    下午近四時，眾車在安全車帶領下從維修區重新返回跑道，繼續剩餘十三圈賽事。烏高卓古、歌德、理昂仍排在前三。烏高卓古與後車拉開些少距離，第二、三、四位則鬥得激烈，理昂在歌德後方不斷施壓。剩餘十一圈時，廿七號戰車壞車在賽道停下，安全車再次出動。    歌德全場最快圈速    剩下八圈賽事在安全車離場後恢復。烏高卓古加速發力，將與歌德的差距拉長至一秒，並不斷刷新最快圈速。理昂則緊追歌德，爭取向前衝刺。剩餘六圈時，烏高卓古與歌德已有兩秒距離，但歌德造出全場最快圈速。其後五十三號戰車壞車，賽事第三度出安全車帶跑。    最後兩圈賽事留給車手的機會不多，歌德仍未放棄，保持攻勢。最後一圈，三號車手高拿吉於漁翁彎的撞牆意外令安全車又再出動，意味賽事會在黃旗揮動下結束。此前，期望踏上領獎台的史雷特車頭在葡京彎一度超過理昂，但隨即撞欄失去最後機會。烏高卓古無驚無險率先衝線，歌德亞軍，理昂季軍。    理昂艱辛保住季軍    在賽後記者會上，烏高卓古表示，正賽十分艱鉅，慶幸奪冠，並感謝車隊。賽事期間安全車多次出動，令他此前與後車差距的優勢失去，不過每次重新起步表現不錯，便繼續專注領放。過程期間多次差點撞欄，幸沒有發生意外。    歌德亦分享，比賽期間好幾次與前車十分接近，幾乎可以超車，可惜路況不清晰，且輪胎溫度未如理想，每次提升胎溫後又出現安全車，需一直保持輪胎溫度，但仍開心獲得亞軍。    理昂表示，整個比賽中，大家均希望超越他，爭奪成為頒獎台上最後一席，尤其在最後一圈與對手鬥得十分激烈，至第三彎已預測對手將發動攻勢，自己亦努力保持位置。感到整個比賽過程相當艱鉅，開心能夠保住季軍。,http://www.macaodaily.com/html/2024-11/18/content_1794930.htm,歌德亦分享，比賽期間好幾次與前車十分接近，幾乎可以超車，可惜路況不清晰，且輪胎溫度未如理想，每次提升胎溫後又出現安全車，需一直保持輪胎溫度，但仍開心獲得亞軍,十七 歲 美車 手成 澳門 首任 盟主         FR 世 盃 烏高卓古 封王         【 本報 消息 】 第七十一 屆 澳門格蘭 披治大賽車 壓軸賽 事 — — 國際 汽聯 FR 世界 盃 十五 圈 昨日 順利 完成 ， 為 今屆 風雨 中 的 大賽 車畫 上句號 。 賽事 四度 出 安全 車 ， 十七 歲 的 四號 美國 車手 烏高卓古 發揮 出色 ， 由頭 帶 到 尾 ， 成為 這項 首次 落戶 澳門賽 事 的 第一位 盟主 。 一號 德國車 手 歌德 和 七號 墨西哥 車手 理昂 亦 保持 發揮 ， 分奪亞 軍和季 軍 。         起步 五車 炒 埋 一碟         賽事共鬥 十五 圈 ， 共有 廿七 架戰車 出戰 ， 烏高卓古 、 歌德 、 理昂排 在 前三位 發車 ， 第四 至六為 卅 一號 英國車 手史 雷特 、 五號 法國車 手迪利尼 和 廿六 號 意大利 車手 迪帕洛 。         遭遇 前 幾天 的 濕 地戰 ， 賽事終 在 正賽 迎來陽光 與 乾地 ， 安全 車帶領 各戰車 完成 熱身 圈 後 ， 比賽 正式 開始 。 甫 起步 ， 史雷特 已 抽頭 欲 超越 理昂 未果 ， 隨後 十六 號戰車 在 葡京 彎撞欄 ， 緊 隨其 後 的 卅三 號 、 十八 號 、 八十八 號和 十九 號戰車 收 掣 不及 “ 炒 埋 一碟 ” ， 大會 出示 紅旗 暫 停賽 事 ， 排前 幾位 的 戰車 未受 影響 。         下午 近四時 ， 眾車 在 安全 車帶 領下 從 維修區 重新 返回 跑道 ， 繼續 剩餘 十三 圈賽 事 。 烏高卓古 、 歌德 、 理昂 仍排 在 前 三 。 烏高卓古 與 後 車拉開些 少距離 ， 第二 、 三 、 四位 則鬥得 激烈 ， 理昂 在 歌德 後 方不斷 施壓 。 剩餘十 一圈 時 ， 廿七 號戰車 壞車 在 賽道 停下 ， 安全 車 再次 出動 。         歌德 全場 最快 圈速         剩下 八圈 賽事 在 安全 車離場 後 恢 復 。 烏高卓古 加速 發力 ， 將與 歌德 的 差距 拉長 至 一秒 ， 並不斷 刷新 最快 圈速 。 理昂則 緊 追 歌德 ， 爭取 向前 衝刺 。 剩餘 六圈 時 ， 烏高卓古 與 歌德 已有 兩秒 距離 ， 但 歌德 造出 全場 最快 圈速 。 其 後 五十三 號戰車 壞車 ， 賽事 第三度 出 安全 車帶 跑 。         最後兩圈 賽事 留給 車手 的 機會 不 多 ， 歌德 仍 未放棄 ， 保持 攻勢 。 最 後 一圈 ， 三號 車手 高拿吉 於 漁翁 彎 的 撞 牆 意外 令 安全 車又再 出動 ， 意味 賽事會 在 黃 旗揮動 下 結束 。 此前 ， 期望 踏上 領獎 台 的 史雷 特車頭 在 葡京 彎 一度 超過 理昂 ， 但 隨即 撞欄 失去 最後機會 。 烏高卓古 無 驚無險 率先 衝線 ， 歌德 亞軍 ， 理昂季 軍 。         理昂 艱辛 保住 季 軍         在 賽後記者 會 上 ， 烏高卓古 表示 ， 正賽 十分 艱鉅 ， 慶幸 奪冠 ， 並感 謝車隊 。 賽事 期間 安全 車 多次出 動 ， 令 他 此前 與後車 差距 的 優勢 失去 ， 不過 每次 重新 起步 表現 不錯 ， 便 繼續 專注 領放 。 過程 期間 多次 差點 撞欄 ， 幸沒有 發 生意 外 。         歌德 亦 分享 ， 比賽 期間 好 幾次 與 前車 十分 接近 ， 幾乎 可以 超車 ， 可惜 路況 不 清晰 ， 且 輪胎 溫度 未 如 理想 ， 每次 提升 胎溫 後 又 出現 安全 車 ， 需 一直 保持 輪胎 溫度 ， 但 仍 開心 獲得亞 軍 。         理昂 表示 ， 整個 比賽 中 ， 大家 均 希望 超越 他 ， 爭奪 成為 頒獎 台上 最 後 一席 ， 尤其 在 最 後 一圈 與 對 手鬥得 十分激烈 ， 至 第三 彎 已 預測 對 手將 發動 攻勢 ， 自己 亦 努力 保持 位置 。 感到 整個 比賽 過程 相當 艱鉅 ， 開心 能夠 保住 季 軍 。,2024-11-18
陶德以格電排位賽捧盃,賽道濕滑    正賽取消    陶德以格電排位賽捧盃    【本報消息】昨日凌晨至清早連場大雨，賽會決定，基於賽道濕滑及天氣狀況，根據大賽車相關規則，原定早上舉行的“澳門格蘭披治電單車——第五十六屆大賽”正賽取消，獎盃授予前日排位賽的三甲車手，廿五號英國車手陶德、卅八號芬蘭車手哥達摩、八十八號英國車手赫爾文在雨中接受獎項。    已第三十年來澳參與格電賽的“九冠王”路達稱，電單車須在賽道“完全乾爽”下作賽，故是次決定是大會與一眾車手溝通下作出，認為是恰當的決定。    練習取消已無奈    格電昨日上午八時四十五分頒獎，陶德談及是屆賽事安排稱“我們總是想冒險，但對賽事安排完全滿意；大家都想不到十一月還有颱風，還下雨！”坦言昨日是整個星期遇到的最糟的情況，並對此前天雨導致自由練習取消感到無奈。他稱澳門是一條危險的賽道，加上潮濕出賽，電單車車手需要冒很大的風險，認為賽會已盡全力作出最好的安排。    賽事都不可預測    陶德亦提到首次為車隊出戰，這是其效力車隊的好開始，能於排位賽擊敗三名前冠軍，感覺固然美妙。在如此路況下能夠造出這個成績令其喜出望外。寶馬戰車跟其今季慣用的一台表現非常不同，衷心感謝車隊為其準備的一切。很期待明年重返東望洋賽道時，能以更強的姿態與車手競技。    哥達摩稱，整個賽事都是不可預測，但亦好高興可以取得亞軍。    赫爾文集齊三甲    至於曾四度在澳奪冠的赫爾文，今年卻因天氣原因未有機會再爭冠。他表示，今屆賽事遇上天雨確是不幸，未能決戰更是可惜，但自己已在這項賽事中集齊冠、亞、季軍三個獎盃，期待明年可以再重返澳門作賽。    路達認決定恰當    對澳門格電極具經驗的路達稱，儘管今年是其踏足澳門三十周年紀念，但這幾天的情況一度令人擔憂；過去數十年，每次自由練習和排位賽都是乾地，認為取消是恰當的決定。今年世界各地都經歷糟糕的天氣，也遇到很多惡劣情況，“沒有人可以為這樣的天氣做些什麼，唯有明年再來！”,http://www.macaodaily.com/html/2024-11/18/content_1794931.htm,賽道濕滑    正賽取消    陶德以格電排位賽捧盃    【本報消息】昨日凌晨至清早連場大雨，賽會決定，基於賽道濕滑及天氣狀況，根據大賽車相關規則，原定早上舉行的“澳門格蘭披治電單車——第五十六屆大賽”正賽取消，獎盃授予前日排位賽的三甲車手，廿五號英國車手陶德、卅八號芬蘭車手哥達摩、八十八號英國車手赫爾文在雨中接受獎項,賽道 濕滑         正賽 取消         陶德 以格電 排位 賽 捧 盃         【 本報 消息 】 昨日 凌晨 至 清早 連場 大雨 ， 賽會 決定 ， 基 於 賽道 濕滑及 天氣 狀況 ， 根據 大賽車 相關 規則 ， 原定 早上 舉行 的 “ 澳門格蘭 披治電 單車 — — 第五十六 屆大賽 ” 正賽 取消 ， 獎 盃 授予 前日 排位 賽 的 三甲 車手 ， 廿五 號英國 車手 陶德 、 卅八號 芬蘭車 手哥 達摩 、 八十八 號英國車 手赫爾文 在 雨 中 接受 獎項 。         已 第 三十年 來澳 參與格 電賽 的 “ 九 冠王 ” 路達稱 ， 電單 車須 在 賽道 “ 完全 乾爽 ” 下作賽 ， 故是 次 決定 是 大會 與 一眾車 手溝 通下 作出 ， 認為 是 恰當 的 決定 。         練習 取消 已無奈         格電 昨日 上午 八時 四十五分 頒獎 ， 陶德談 及 是 屆 賽事 安排 稱 “ 我們 總 是 想 冒險 ， 但 對 賽事 安排 完全 滿意 ； 大家 都 想不到 十一月 還有 颱 風 ， 還 下雨 ！ ” 坦言 昨日 是 整個 星期 遇到 的 最糟 的 情況 ， 並對 此前 天雨導致 自由 練習 取消 感到 無奈 。 他稱 澳門 是 一條 危險 的 賽道 ， 加上 潮濕 出賽 ， 電單 車車 手 需要 冒 很大 的 風險 ， 認為 賽會 已 盡 全力 作出 最好 的 安排 。         賽事 都 不可 預測         陶德 亦 提到 首次 為 車隊 出戰 ， 這是 其 效力 車隊 的 好 開始 ， 能 於 排位 賽擊敗 三名 前冠 軍 ， 感覺 固然 美妙 。 在 如此 路況 下 能夠 造出 這個 成績 令 其 喜出望外 。 寶馬 戰車 跟 其 今 季慣 用 的 一台 表現 非常 不同 ， 衷心 感謝 車隊 為 其 準備 的 一切 。 很 期待 明年 重返 東 望洋 賽道 時 ， 能以 更強 的 姿態 與 車手 競技 。         哥達摩稱 ， 整個 賽事 都 是 不可 預測 ， 但 亦 好 高興 可以 取得 亞軍 。         赫爾 文集 齊 三甲         至於 曾 四度 在 澳奪冠 的 赫爾文 ， 今年 卻 因天氣 原因 未有 機會 再 爭冠 。 他 表示 ， 今屆 賽事 遇上 天雨確 是 不幸 ， 未能 決戰 更是 可惜 ， 但 自己 已 在 這項 賽事 中集 齊冠 、 亞 、 季軍三個獎 盃 ， 期待 明年 可以 再 重返 澳門 作賽 。         路達 認決定 恰當         對 澳門格 電極 具經驗 的 路 達 稱 ， 儘 管 今年 是 其 踏足 澳門 三十周年 紀念 ， 但 這幾天 的 情況 一度 令人 擔憂 ； 過去數 十年 ， 每次 自由 練習 和 排位 賽 都 是 乾地 ， 認為 取消 是 恰當 的 決定 。 今年 世界各地 都 經歷 糟糕 的 天氣 ， 也 遇到 很多 惡劣 情況 ， “ 沒 有人 可以 為 這樣 的 天氣 做些 什麼 ， 唯有 明年 再來 ！ ”,2024-11-18
體局：風雨下完賽達目標,總結經驗    辦好賽事    體局：風雨下完賽達目標    【本報消息】第七十一屆澳門格蘭披治大賽車各項賽事昨日下午結束。賽會昨錄得進場觀眾三萬三千人次，四天累計十萬○一千人次。體育局長、大賽車組委會協調員張子軒總結時稱，今屆天氣不似遇期，受颱風及天雨等影響，賽會動態研判，讓各賽事如期完成，達預期目標。強調會與國際汽聯不斷總結經驗，評估形勢開辦賽事，作出最好安排。    接軌世界汽車運動    張子軒受訪時，衷心感謝各贊助商、各政府部門及全體工作人員的努力和支持，並感謝各地傳媒專業報道，共同呈現一場安全、專業的國際體育賽事，整體得到國際汽聯高度認可。澳門大賽車共七項賽事，不僅只有國際汽聯FR世界盃或此前的三級方程式世界盃，還有備受關注的格電、國際汽聯GT世界盃及國際汽聯TCR世界巡迴賽等國際賽事，皆具亮點。其中在本澳恆常舉辦的方程式賽事，每年匯聚全球頂級車手，知名度高，地位不可代替，東望洋賽道更是國際年輕車手的成長搖籃、試金石。未來會與國際汽聯繼續保持緊密合作，保持開放態度，舉辦更多同類型的精彩賽事，與世界汽車運動接軌。接下來會與國際汽聯持續評估並檢視各項賽事，希望做得更好。    未鋪上蓋顧及安全    張子軒稱，比賽受天雨影響有所調整，所有調整是經過與車手、車隊及國際汽聯的專業研判而定，讓車手有充分準備。賽會秉持安全為首的原則，通過動態調整，全力保障車手生命安全。被問到部分觀眾席上蓋連續幾天都未重新鋪設，他回應表示，賽期遇上颱風天氣，風力較大，不希望有大型編織物等於賽事期間墜至賽道，造成危險，改為向觀眾派發雨衣或呼籲攜帶雨傘到場為宜。    特首官員觀賽巡視    此外，FR世界盃於昨日下午三時半上演正賽前，一如既往舉行起步禮。行政長官賀一誠在社會文化司司長、大賽車組委會主席歐陽瑜等陪同下進入跑道，先與賽會人員握手，並主持醒獅儀式，同時與所有參賽車手握手，預祝比賽圓滿成功。起步儀式後，賀一誠等到觀眾席觀賽，並於完賽後向得獎車手頒獎。    昨上午約十時二十分，保安司司長黃少澤、警察總局局長梁文昌、海關關長黃文忠、司警局長薛仲明及消防局長梁毓森等，一同到賽車場巡視安保情況，並慰問及勉勵前線人員。期間，張子軒等向黃少澤等介紹今屆大賽車各項安排。,http://www.macaodaily.com/html/2024-11/18/content_1794932.htm,體育局長、大賽車組委會協調員張子軒總結時稱，今屆天氣不似遇期，受颱風及天雨等影響，賽會動態研判，讓各賽事如期完成，達預期目標,總結 經驗         辦好 賽事         體局 ： 風雨下 完賽 達 目標         【 本報 消息 】 第七十一 屆 澳門格蘭 披治大賽車 各項 賽事 昨日 下午 結束 。 賽會 昨錄 得 進場 觀眾 三萬 三千 人次 ， 四天 累計十萬 ○ 一千 人次 。 體育 局長 、 大賽車 組委會協 調員 張子軒 總結 時稱 ， 今屆 天氣 不似 遇期 ， 受 颱 風及 天雨 等 影響 ， 賽會動態 研判 ， 讓 各賽 事 如期完成 ， 達 預期 目標 。 強調 會 與 國際 汽聯 不斷 總結 經驗 ， 評估 形勢 開辦 賽事 ， 作出 最好 安排 。         接軌 世界 汽車 運動         張子軒 受訪 時 ， 衷心 感謝 各 贊助商 、 各 政府 部門 及 全體 工作 人員 的 努力 和 支持 ， 並感謝 各地 傳媒 專業 報道 ， 共同 呈現 一場 安全 、 專業 的 國際 體育賽 事 ， 整體 得到 國際 汽聯 高度 認可 。 澳門 大賽 車共七項 賽事 ， 不僅 只有 國際 汽聯 FR 世界 盃 或 此前 的 三級 方程式 世界 盃 ， 還有備 受 關注 的 格電 、 國際 汽聯 GT 世界 盃 及 國際 汽聯 TCR 世界 巡 迴 賽 等 國際賽 事 ， 皆 具亮點 。 其中 在 本 澳恆常 舉辦 的 方程式 賽事 ， 每年 匯聚 全球 頂級 車手 ， 知名度 高 ， 地位 不可 代替 ， 東 望洋 賽道 更是 國際年 輕車 手 的 成長 搖籃 、 試 金石 。 未來 會 與 國際 汽聯 繼續 保持 緊密 合作 ， 保持 開放態度 ， 舉辦 更 多 同類 型 的 精彩 賽事 ， 與 世界 汽車 運動 接軌 。 接下 來會 與 國際 汽聯持續 評估 並檢視 各項 賽事 ， 希望 做 得 更好 。         未鋪 上 蓋 顧及 安全         張子 軒稱 ， 比賽 受天 雨影 響 有所 調整 ， 所有 調整 是 經過 與 車手 、 車隊 及 國際 汽聯 的 專業 研判 而定 ， 讓 車手 有 充分 準備 。 賽會 秉持 安全 為首 的 原則 ， 通過 動態 調整 ， 全力 保障 車手 生命安全 。 被 問到 部分 觀眾席 上 蓋 連續 幾天 都 未 重新 鋪設 ， 他 回應 表示 ， 賽期 遇上 颱 風天氣 ， 風力 較 大 ， 不 希望 有 大型 編織物 等 於 賽事 期間 墜 至賽 道 ， 造成 危險 ， 改為 向 觀眾 派發 雨衣 或 呼籲 攜 帶雨傘 到場 為 宜 。         特首 官員 觀賽 巡視         此外 ， FR 世界 盃 於 昨日 下午 三時 半 上演 正賽 前 ， 一如既往 舉行 起步 禮 。 行政 長 官賀 一誠在 社會 文化 司司 長 、 大賽車 組委會 主席 歐陽瑜 等 陪同 下 進入 跑道 ， 先 與 賽會 人員 握手 ， 並 主持 醒獅 儀式 ， 同時 與 所有 參賽車 手握手 ， 預祝 比賽 圓滿 成功 。 起步 儀式 後 ， 賀一 誠 等到 觀眾席 觀賽 ， 並 於 完賽 後 向 得 獎車手 頒獎 。         昨 上午 約十時 二十分 ， 保安 司司 長 黃 少澤 、 警察 總局 局長 梁文昌 、 海關 關長 黃 文忠 、 司 警局 長 薛仲明 及 消防局 長 梁毓森 等 ， 一同 到賽 車場 巡視 安保 情況 ， 並慰 問及 勉勵 前線 人員 。 期間 ， 張子軒 等 向 黃 少澤等 介紹 今屆 大賽車 各項 安排 。,2024-11-18
