Title,Content,Link,Summary,Preprocessed_Content,Date
創新學院新校區明年啟用,開學迎新並嘉許優秀教職員    創新學院新校區明年啟用    【本報消息】中西創新學院二○二四年開學典禮於九月九日上午在中土大廈校區舉行。澳門中聯辦教育與青年工作部高教處長岑嘉儀，澳門教青局高等教育廳長許嘉路，中西創新學院校董會常務副主席、暫代校監華子鋒等嘉賓出席了典禮。    將設智慧旅遊課程    校長仲偉合在典禮上提到中西創新學院的多元文化特色，強調澳門在國家戰略中的重要角色，學校立足澳門，依託大灣區，秉持核心價值，致力培養適應時代發展的國際化人才。他強調，學校將開設全學位層次的“智慧旅遊娛樂管理”課程和多個數字化課程，並與國際知名學府合作，提供豐富的學習交流機會。他指出，新校區將於明年啟用，學校將繼續在澳門和橫琴尋找辦學場地，為師生創造優質的學習環境。    新生代表陳曉彤在致辭中表示，珍惜在中西創新學院的學習時光，努力學習專業知識，培養跨文化交流能力，為未來的職業生涯奠定堅實基礎。她鼓勵同學們積極參與各類社團活動和社會實踐，將所學知識與社會實踐相結合，為社會的發展貢獻力量。同日下午，該校舉辦年度教師節慶祝大會，由中西創新學院副校長蔡智明教授主持，教青局學生廳長陳旭偉，創新教育協會榮譽主席劉東風、副理事長華子鋒、監事長周可祺，創新中學校長崔寶峰等，以及學校全體教職員工出席了典禮。    仲偉合在表彰報告中向教職工致以敬意和節日問候，總結了學校一年來在多個領域取得的成就，包括院校核證、校園擴展、課程優化、科研創新、持續教育豐富、交流合作、組織建設、招生突破及品牌形象提升。他強調這些成就歸功於理事會的支持和全體教職工的共同努力，鼓勵大家繼續努力，推動學校事業發展。在表彰環節，大會頒發了優秀員工獎、優秀教學獎、優秀團隊獎及特殊貢獻獎多個獎項。獲獎代表陳晃國、鄭曉晴和鄒柏等老師分別上台發言，分享了他們的工作心得和經驗，表達了對教育事業的熱愛和忠誠。    劉東風向教師們致以節日祝賀並表達感謝，他肯定了學校發展方向及所取得的成績，並勉勵大家保持積極態度，為學校發展、社會多作貢獻。,http://www.macaodaily.com/html/2024-09/12/content_1780613.htm,將設智慧旅遊課程    校長仲偉合在典禮上提到中西創新學院的多元文化特色，強調澳門在國家戰略中的重要角色，學校立足澳門，依託大灣區，秉持核心價值，致力培養適應時代發展的國際化人才,開學 迎新 並嘉許 優秀教 職員         創新學院 新 校區 明年 啟用         【 本報 消息 】 中西 創新學院 二 ○ 二 四年 開學 典禮 於 九月九 日 上午 在 中土 大廈 校區 舉行 。 澳門 中聯辦 教育 與 青年 工作部 高教 處長 岑嘉儀 ， 澳門 教青局 高等教育 廳長 許嘉路 ， 中西 創新學 院校 董會常務 副 主席 、 暫代校 監華子鋒 等 嘉賓 出席 了 典禮 。         將設 智慧 旅遊 課程         校長 仲偉合 在 典禮 上 提到 中西 創新學院 的 多元 文化 特色 ， 強調 澳門 在 國家 戰略 中 的 重要 角色 ， 學校 立足 澳門 ， 依 託 大灣區 ， 秉持 核心 價值 ， 致力 培養 適應 時代 發展 的 國際化 人才 。 他 強調 ， 學校 將開設 全學位 層次 的 “ 智慧 旅遊 娛樂 管理 ” 課程 和 多個 數字化 課程 ， 並與 國際 知名 學府 合作 ， 提供 豐富 的 學習 交流 機會 。 他 指出 ， 新校 區將 於 明年 啟用 ， 學校 將繼續 在 澳門 和 橫琴 尋找 辦學場 地 ， 為 師生 創造 優質 的 學習 環境 。         新生 代表 陳 曉彤 在 致辭 中 表示 ， 珍惜 在 中西 創新學院 的 學習 時光 ， 努力 學習 專業 知識 ， 培養 跨文化 交流 能力 ， 為 未來 的 職業 生涯 奠定 堅實 基礎 。 她 鼓勵 同學們 積極 參與 各類 社團 活動 和 社會 實踐 ， 將所學 知識 與 社會 實踐 相結合 ， 為 社會 的 發展 貢獻 力量 。 同日 下午 ， 該校 舉辦 年度 教師 節慶 祝大會 ， 由 中西 創新學院 副 校長 蔡智明 教授 主持 ， 教青局 學生廳 長 陳 旭偉 ， 創新 教育 協會 榮譽 主席 劉東風 、 副 理事 長 華子鋒 、 監事長 周可祺 ， 創新 中學 校長 崔寶峰 等 ， 以及 學校 全體 教 職員工 出席 了 典禮 。         仲偉合 在 表彰 報告 中 向 教職 工致 以 敬意 和 節日 問候 ， 總結 了 學校 一年 來 在 多個 領域 取得 的 成就 ， 包括 院校 核證 、 校園 擴展 、 課程 優化 、 科研 創新 、 持續 教育 豐富 、 交流 合作 、 組織 建設 、 招生 突破 及 品牌形象 提升 。 他 強調 這些 成就 歸功 於 理事 會 的 支持 和 全體 教職工 的 共同努力 ， 鼓勵 大家 繼續 努力 ， 推動 學校 事業 發展 。 在 表彰 環節 ， 大會 頒發 了 優秀員 工獎 、 優秀 教學獎 、 優秀團隊 獎及 特殊 貢獻獎 多個 獎項 。 獲獎 代表 陳 晃國 、 鄭曉 晴和 鄒柏 等 老師 分別 上台 發言 ， 分享 了 他們 的 工作 心得 和 經驗 ， 表達 了 對 教育 事業 的 熱愛和忠 誠 。         劉東風 向 教師們 致以 節日 祝賀 並表達 感謝 ， 他 肯定 了 學校 發展 方向 及 所 取得 的 成績 ， 並勉勵 大家 保持 積極 態度 ， 為學校 發展 、 社會 多作 貢獻 。,2024-09-12
新聞特搜,新聞特搜    拜神燒香留火種    招惹祝融罪責重    應節月餅帶回鄉    留意規定咪過量    △中秋節將至，部分居民或因個人或家庭的傳統信仰，會跟隨部分中國傳統節日一樣拜神祭祀，過程中也會燃燒冥鏹及香燭，若居民在中秋前後有拜神祭祀習慣，切勿在大廈走廊、後樓梯或單位內燃燒冥鏹，因此舉不但欠缺公德心，還會影響左鄰右里，一旦引發火警，涉事者更有機會負上刑責。    過往，也曾發生居民因中秋節拜神祭祀，將未完全熄滅的冥鏹灰燼傾倒入大廈垃圾房，引致火警，需要消防員到場處理。    所以，居民要時刻注意防火安全，不論平日還是喜慶節日，若要拜神祭祀，冥鏹在燃燒後，一定要用水完全淋熄，才可將灰燼傾倒處理。    △臨近中秋，居民及旅客若計劃從港澳台帶月餅入境內地需要注意，若月餅含有肉類、蛋類成分，存在攜帶禽流感、口蹄疫症及其他檢疫風險，根據《中華人民共和國禁止攜帶、郵寄進境的動植物及其產品名錄》規定，均不能隨意攜帶或郵寄入境。    攜帶或郵寄月餅等食品進出境，應充分了解出行、郵寄目的地檢疫規定和要求，嚴格遵守當地法律法規，避免因攜帶、郵寄禁止進境物造成不必要麻煩。同時，個人攜帶、郵寄進出境的月餅當以自用、合理數量為限，並接受海關規管。簡括而言，五仁月餅（不含肉餡）、蓮蓉月餅、豆沙月餅及朱古力月餅等可攜帶入境。,http://www.macaodaily.com/html/2024-09/12/content_1780615.htm,新聞特搜    拜神燒香留火種    招惹祝融罪責重    應節月餅帶回鄉    留意規定咪過量    △中秋節將至，部分居民或因個人或家庭的傳統信仰，會跟隨部分中國傳統節日一樣拜神祭祀，過程中也會燃燒冥鏹及香燭，若居民在中秋前後有拜神祭祀習慣，切勿在大廈走廊、後樓梯或單位內燃燒冥鏹，因此舉不但欠缺公德心，還會影響左鄰右里，一旦引發火警，涉事者更有機會負上刑責,新聞特 搜         拜神 燒香留 火種         招惹 祝融 罪責重         應節 月 餅帶 回鄉         留意 規定 咪 過量         △ 中秋 節將 至 ， 部分 居民 或 因個 人 或 家庭 的 傳統 信仰 ， 會 跟 隨 部分 中國 傳統 節日 一樣 拜神 祭祀 ， 過程 中 也 會 燃燒 冥鏹 及 香燭 ， 若 居民 在 中秋 前後有 拜神 祭祀 習慣 ， 切勿 在 大廈 走廊 、 後 樓梯 或 單位 內燃 燒冥鏹 ， 因此 舉 不但 欠缺 公德心 ， 還會 影響 左鄰 右里 ， 一旦 引發 火警 ， 涉事 者 更 有 機會負 上刑 責 。         過往 ， 也 曾 發生 居民 因 中秋 節 拜神 祭祀 ， 將未 完全 熄滅 的 冥鏹 灰燼 傾 倒入 大廈 垃圾 房 ， 引致 火警 ， 需要 消防 員到場 處理 。         所以 ， 居民 要 時刻 注意 防火 安全 ， 不論 平日 還是 喜慶節 日 ， 若 要 拜神 祭祀 ， 冥鏹 在 燃燒 後 ， 一定 要 用水 完全 淋熄 ， 才 可 將灰燼 傾倒 處理 。         △ 臨近 中秋 ， 居民 及 旅客 若計劃 從 港澳台 帶月餅 入境 內地 需要 注意 ， 若月餅 含有 肉類 、 蛋類 成分 ， 存在 攜帶 禽流感 、 口蹄疫 症 及其 他 檢疫 風險 ， 根據 《 中華 人民 共和 國 禁止 攜帶 、 郵寄進境 的 動 植物 及其 產 品名 錄 》 規定 ， 均 不能 隨意 攜帶 或 郵 寄 入境 。         攜帶 或 郵寄月餅 等 食品 進 出境 ， 應 充分 了解 出行 、 郵寄 目的地 檢疫 規定 和 要求 ， 嚴格 遵守 當地 法律 法規 ， 避免 因攜帶 、 郵寄 禁止 進境物 造成 不必要 麻煩 。 同時 ， 個 人 攜帶 、 郵寄進 出境 的 月餅 當以 自用 、 合理 數量 為 限 ， 並 接受 海關 規管 。 簡括 而言 ， 五仁月餅 （ 不含 肉 餡 ） 、 蓮蓉月餅 、 豆沙 月餅 及 朱古力 月餅 等 可 攜帶 入境 。,2024-09-12
培華家長日促家校溝通,培華家長日促家校溝通    培華中學日前舉辦新學年首個家長日活動，活動分中、小、幼三個學部進行。在家長觀看完“家長第一課”視頻後，培華中學校長李秋林為家長日開幕式致辭，介紹學校的育人方針，強調學校重視學生身心健康和全面發展，建議家長們多關顧學生的情緒狀況，留意他們在言語和行為上的細微變化，並及早與學校溝通，通過家校之間緊密合作共同營造良好成長氣氛。他介紹學校行政、級科組長、班主任及專職人員等相關人員，期望教師團隊及家長間能夠達到真誠溝通、善於協調，成為學生成長道路上的堅強後盾。隨後，教務主任張春燕介紹本學年有關教育教學計劃等，課程發展主任王帆講解升大保送情況及職技課程新法規要求。    家長會後，由各班班主任帶領家長入室，介紹新學年教青局有關要求，以及學校管理規章制度、注意事項等。,http://www.macaodaily.com/html/2024-09/12/content_1780616.htm,在家長觀看完“家長第一課”視頻後，培華中學校長李秋林為家長日開幕式致辭，介紹學校的育人方針，強調學校重視學生身心健康和全面發展，建議家長們多關顧學生的情緒狀況，留意他們在言語和行為上的細微變化，並及早與學校溝通，通過家校之間緊密合作共同營造良好成長氣氛,培華家長 日 促家校 溝通         培華 中學 日前 舉辦 新學年 首個 家長 日 活動 ， 活動 分中 、 小 、 幼三個 學部 進行 。 在家 長 觀看 完 “ 家長 第一 課 ” 視頻 後 ， 培華 中學 校長 李秋林 為家長 日 開幕式 致辭 ， 介紹 學校 的 育人 方針 ， 強調 學校 重視 學生 身心健康 和 全面 發展 ， 建議 家長 們 多關 顧學生 的 情緒 狀況 ， 留意 他們 在 言語 和 行為 上 的 細微 變化 ， 並 及早 與 學校 溝通 ， 通過 家校 之間 緊密 合作 共同 營造 良好 成長 氣氛 。 他 介紹 學校 行政 、 級科 組長 、 班主任 及 專職 人員 等 相關 人員 ， 期望 教師 團隊 及家長 間 能夠 達 到 真誠溝通 、 善 於 協調 ， 成為學 生成 長 道路 上 的 堅強後盾 。 隨後 ， 教務 主任 張春燕 介紹 本學年 有關 教育 教學 計劃 等 ， 課程 發展 主任 王帆 講解 升大 保送 情況 及 職技 課程 新法 規 要求 。         家長 會 後 ， 由 各班 班主任 帶 領家長 入室 ， 介紹 新學年 教青局 有關 要求 ， 以及 學校 管理 規章 制度 、 注意 事項 等 。,2024-09-12
氹坊家長認識預防校園欺凌,氹坊家長認識預防校園欺凌    氹坊校於開學前夕舉辦“快樂成長 · 拒絕欺凌”的主題講座，由司法警察局派員主講。會上詳細介紹欺凌行為定義，強調當出現具惡意的言行或持續性權力不平衡，均會被視為欺凌行為，並從法律層面深入淺出分析欺凌行為出現原因及帶來的後果。講師透過案例分析，讓家長明白到欺凌事件大多是由不恰當的情緒表達、薄弱的法律認知和沉默的旁觀者等因素引起，而欺凌事件亦會對孩子日後自身發展產生不良影響。講座結束前，講師傳授家長們正確處理欺凌行為的方法和提供預防校園欺凌的措施，並鼓勵家長多關心孩子，攜手遏止校園欺凌現象。    會後，家長們表示講座內容有助更好認識相關法律知識與行為，將加強教育子女的自我保護意識，並期望學校能多舉辦相關講座。,http://www.macaodaily.com/html/2024-09/12/content_1780617.htm,會後，家長們表示講座內容有助更好認識相關法律知識與行為，將加強教育子女的自我保護意識，並期望學校能多舉辦相關講座,氹坊 家長 認識 預防 校園 欺凌         氹坊校 於 開學 前夕 舉辦 “ 快樂 成長   ·   拒絕 欺凌 ” 的 主題 講座 ， 由 司法 警察局 派員主講 。 會上 詳細介紹 欺凌 行為 定義 ， 強調 當出 現具 惡意 的 言行 或 持續性 權力 不 平衡 ， 均會 被 視為 欺凌 行為 ， 並從 法律 層面 深入 淺出 分析 欺凌 行為 出現 原因 及 帶 來 的 後 果 。 講師 透過 案例 分析 ， 讓 家長 明白 到 欺凌 事件 大多 是 由 不 恰當 的 情緒表達 、 薄弱 的 法律 認知 和 沉默 的 旁 觀者 等 因素 引起 ， 而 欺凌 事件 亦 會 對 孩子 日 後 自身 發展 產生 不良 影響 。 講座 結束 前 ， 講師 傳授 家長 們 正確 處理 欺凌 行為 的 方法 和 提供 預防 校園 欺凌 的 措施 ， 並鼓勵 家長 多 關心 孩子 ， 攜手 遏止 校園 欺凌 現象 。         會 後 ， 家長 們 表示 講座 內容 有助 更好 認識 相關 法律 知識 與 行為 ， 將加強 教育 子女 的 自我 保護 意識 ， 並 期望 學校 能 多 舉辦 相關 講座 。,2024-09-12
澳大公共行政博士課程開學,澳大公共行政博士課程開學    澳門大學社會科學學院日前舉行第四屆公共行政博士(DPA)學位課程開學典禮。今屆課程共錄取卅二位精英，包括來自澳門和橫琴粵澳深度合作區的高級管理人才、公司領導、國企管理人員等。    澳大校長宋永華期望第四屆學員能夠充分利用澳大提供的學習平台，不斷探索和挑戰，為澳門、國家以至全球公共行政事業作出貢獻。    澳大社會科學學院院長胡偉星表示，在澳大開辦公共行政博士學位課程是一個大膽嘗試，其目標是為大灣區和國家培養更多能夠應對公共行政挑戰的高層次人才。    澳大社會科學學院助理院長及公共行政博士學位課程主任文博則介紹了課程設置和具體要求，並希望學員們能夠秉持純粹之心、向學之心、公益之心來完成學業。,http://www.macaodaily.com/html/2024-09/12/content_1780618.htm,澳大社會科學學院院長胡偉星表示，在澳大開辦公共行政博士學位課程是一個大膽嘗試，其目標是為大灣區和國家培養更多能夠應對公共行政挑戰的高層次人才,澳大 公共行政 博士 課程 開學         澳門 大學 社會 科學學院 日前 舉行 第四 屆 公共行政 博士 ( DPA ) 學位 課程 開學 典禮 。 今屆 課程共錄 取卅 二位 精英 ， 包括 來 自澳門 和 橫琴粵澳 深度 合作 區的 高級 管理 人才 、 公司 領導 、 國企 管理 人員 等 。         澳 大校 長 宋永華 期望 第四 屆 學員能夠 充分利用 澳大 提供 的 學習 平台 ， 不斷 探索 和 挑戰 ， 為 澳門 、 國家 以至 全球 公共行政 事業 作出 貢獻 。         澳 大社 會科學 學院 院長 胡偉星 表示 ， 在 澳大開 辦 公共行政 博士 學位 課程 是 一個 大膽 嘗試 ， 其目標 是 為 大灣區 和 國家 培養 更 多 能夠 應 對 公共行政 挑戰 的 高層次 人才 。         澳 大社 會科學 學院 助理 院長 及 公共行政 博士 學位 課程 主任 文博則 介紹 了 課程 設置 和 具體 要求 ， 並 希望 學員們 能夠 秉持 純粹 之心 、 向 學之心 、 公益 之心 來 完成 學業 。,2024-09-12
城大清華長三院共建實驗室,城大清華長三院共建實驗室    浙江清華長三角研究院黨組成員、副院長馮葉成率代表團一行於本月十日到訪澳門城市大學，獲副校長周萬雷熱情接待。來賓參觀了城大橫琴科創中心的實驗室、科研設施及辦公環境。期間，周萬雷與馮葉成分別代表雙方簽署合作協議，成立“澳門城市大學——浙江清華長三角研究院聯合實驗室”，並就共建聯合實驗室及未來的創新合作模式等深入座談交流。    會上，周萬雷介紹了城大數據科學學院的課程發展，並期望雙方攜手進一步推動人工智能領域的合作，實現優勢互補，合作產出更高質量的科研成果。馮葉成希望兩校進一步加強教研人員的交流互訪，以及推動產學研合作，促進聯合實驗室的成果轉化。,http://www.macaodaily.com/html/2024-09/12/content_1780619.htm,期間，周萬雷與馮葉成分別代表雙方簽署合作協議，成立“澳門城市大學——浙江清華長三角研究院聯合實驗室”，並就共建聯合實驗室及未來的創新合作模式等深入座談交流,城 大清 華長 三院 共建 實驗室         浙江 清華長 三角 研究院 黨 組成員 、 副 院長 馮葉 成率 代表 團 一行 於 本月 十日 到訪 澳門 城市 大學 ， 獲 副 校長 周萬雷 熱情 接待 。 來賓 參觀 了 城大橫 琴科 創 中心 的 實驗室 、 科研 設施 及 辦公環境 。 期間 ， 周萬雷 與 馮葉 成分 別 代表 雙方 簽署 合作 協議 ， 成立 “ 澳門 城市 大學 — — 浙江 清華長 三角 研究院 聯合 實驗室 ” ， 並就 共建 聯合 實驗室 及 未來 的 創新 合作 模式 等 深入 座談 交流 。         會上 ， 周萬雷 介紹 了 城大數 據 科學學院 的 課程 發展 ， 並 期望 雙方 攜手 進 一步 推動 人工智能 領域 的 合作 ， 實現 優勢 互補 ， 合作 產出 更 高質量 的 科研成果 。 馮葉成 希望 兩校 進 一步 加強 教研 人員 的 交流 互訪 ， 以及 推動 產學研 合作 ， 促進 聯合 實驗室 的 成果 轉化 。,2024-09-12
教育會講座分享教育家精神,教育會講座分享教育家精神    中華教育會於九月十日教師節假漁人碼頭會議展覽中心舉辦“二○二四教師節慶祝大會——教育家精神的時代意涵與培育路徑”專題講座，一百四十多名教師參與。活動邀請華南師範大學教授黃明喜主講，分享教育家精神的時代意涵與培育路徑，受到教師們的熱烈歡迎。活動獲澳門基金會贊助經費。會上，黃明喜講解教育家精神的背景和時代意涵，並從政府、學校、個人三個層面提出教育家精神的培養路徑，最後以實例解釋如何以教育家精神引領教師隊伍建設，如尊重學生的多樣性和獨特性，遵循學生成長規律，在學生認知覺醒和思維啟動過程中因材施教，落實立德樹人的根本任務，以及抱持終身學習志向和終生教育理念等。    講座結尾，黃明喜寄語教師們不忘初心，在平凡崗位上努力做不平凡的事業，感謝澳門教師在教育發展和人才培養方面所做的大量有實效工作。,http://www.macaodaily.com/html/2024-09/12/content_1780620.htm,會上，黃明喜講解教育家精神的背景和時代意涵，並從政府、學校、個人三個層面提出教育家精神的培養路徑，最後以實例解釋如何以教育家精神引領教師隊伍建設，如尊重學生的多樣性和獨特性，遵循學生成長規律，在學生認知覺醒和思維啟動過程中因材施教，落實立德樹人的根本任務，以及抱持終身學習志向和終生教育理念等,教育 會 講座 分享 教育家 精神         中華 教育 會 於 九月 十日 教師 節假 漁人碼 頭會議 展覽 中心 舉辦 “ 二 ○ 二四 教師 節慶 祝大會 — — 教育家 精神 的 時代 意涵 與 培育 路徑 ” 專題 講座 ， 一百四十 多 名教 師參 與 。 活動 邀請 華南師 範大學 教授 黃 明喜 主講 ， 分享 教育家 精神 的 時代 意涵 與 培育 路徑 ， 受到 教師們 的 熱烈 歡迎 。 活動 獲澳門 基金 會 贊助 經費 。 會上 ， 黃 明喜 講解 教育家 精神 的 背景 和 時代 意涵 ， 並從 政府 、 學校 、 個 人三個 層面 提出 教育家 精神 的 培養 路徑 ， 最後以 實例 解釋 如何 以 教育家 精神 引領 教師 隊伍 建設 ， 如 尊重 學生 的 多樣 性 和 獨 特性 ， 遵循 學 生成 長 規律 ， 在 學生 認知 覺醒 和 思維 啟動 過程 中 因材施教 ， 落實 立德 樹人 的 根本 任務 ， 以及 抱持 終身 學習 志向 和 終生 教育 理念 等 。         講座 結尾 ， 黃 明喜 寄語 教師們 不 忘 初心 ， 在 平凡 崗位 上 努力 做 不 平凡 的 事業 ， 感謝 澳門 教師 在 教育 發展 和 人才 培養 方面 所 做 的 大量 有 實效 工作 。,2024-09-12
培道慶教師節謝師恩,培道慶教師節謝師恩    培道中學學生會日前在校舉行“教師節慶祝活動”，以此感謝全體教師的辛勤付出和無私奉獻，同時引導同學體會老師平日教導，學會尊師重道，活動吸引全校師生積極參與。    活動伊始，校長李寶田向全體教師致感謝詞，同時勉勵教師要與時並進，持續提升教學質量，並寄語學生要牢記師長的教誨，勿忘師恩，在學業上要努力進取，以優異成績回報老師付出。隨後，學生會精心準備不同表演節目引得在場教師們頻頻點頭，現場洋溢歡樂氛圍。最後，由學生親手向全體教師致送精美小禮物，以表心意。    是次活動由培道學生會學生及社工籌備，同學動手製作“草藥按摩棒”。小禮物不但能幫助教師紓緩壓力，當中的草藥成份更能為教師帶來愉悅的心情。按摩棒充滿學生對師長的關愛，流露着同學們對老師的謝意，校園裏處處瀰漫溫馨愉悅的氣息。,http://www.macaodaily.com/html/2024-09/12/content_1780622.htm,活動伊始，校長李寶田向全體教師致感謝詞，同時勉勵教師要與時並進，持續提升教學質量，並寄語學生要牢記師長的教誨，勿忘師恩，在學業上要努力進取，以優異成績回報老師付出,培道 慶教 師節 謝師恩         培道 中學學 生會 日前 在校 舉行 “ 教師 節慶祝 活動 ” ， 以此 感謝 全體 教師 的 辛勤 付出 和 無私 奉獻 ， 同時 引導 同學 體會 老師 平日 教導 ， 學會 尊師 重道 ， 活動 吸引 全校 師生 積極 參 與 。         活動 伊始 ， 校長 李寶田向 全體 教師致 感謝 詞 ， 同時 勉勵 教師 要 與 時 並進 ， 持續 提升 教學質量 ， 並寄語 學生 要 牢記 師長 的 教誨 ， 勿忘 師恩 ， 在 學業 上 要 努力 進取 ， 以 優異 成績 回報 老師 付出 。 隨後 ， 學生會 精心 準備 不同 表演 節目 引得 在場 教師們 頻頻 點頭 ， 現場 洋溢 歡樂氛 圍 。 最 後 ， 由學生 親手 向 全體 教師 致送 精美 小禮物 ， 以表 心意 。         是 次 活動 由 培道 學生會 學生 及 社工 籌備 ， 同學動 手 製 作 “ 草藥 按摩棒 ” 。 小禮物 不但 能 幫 助教 師紓緩 壓力 ， 當中 的 草藥 成份 更能 為 教師 帶來 愉悅 的 心情 。 按摩棒 充滿 學生 對 師長 的 關愛 ， 流露 着 同學們 對 老師 的 謝意 ， 校園 裏 處處 瀰 漫 溫馨 愉悅 的 氣息 。,2024-09-12
