Title,Content,Link,Summary,Preprocessed_Content,Date
反詐小程式下月推出,毋須下載使用方便  四項功能拆穿詐騙    反詐小程式下月推出    【本報消息】保安司司長辦公室“安全與您”欄目刋登文章“全民反詐，由您做起。”當中提到近年電訊網絡詐騙已成全球犯罪現象，本澳去年立案數字均有明顯增幅，今年首月立案數字已高於去年月平均數。反詐首重預防，爲此司警局將於下月推出反詐微信小程式，協助公衆防騙。    不須輸入電話號碼    司警局下月推出的反詐小程式借助微信手機應用程式運行，切合澳門網絡環境，公眾熟悉且易於操作。程式上線後，公眾可經由司警局微信公眾號(PJ_Macao)進入。使用者毋須另行安裝應用程式，不須輸入電話號碼及個人資料，不會引起個人隱私、程式安全性的疑慮。該反詐小程式有四項功能，包括詐騙搜尋器、詐騙線索上報、詐騙知多D及騙案識別（詳見附表）。    電騙勁升二點六倍    “安全與您”文章亦總結了去年本澳的詐騙案及騙徒的作案手法。據司警去年立案統計，電話詐騙、網絡詐騙、盜刷信用卡的電腦詐騙，分別有四百〇七宗、八百七十一宗及三百二十九宗，按年分別錄得百分之二百六十三、四十三和八十九的升幅。    公檢法青年中招多    去年電話詐騙以“公檢法”最多，佔總數逾七成，是前年的三點三倍。受害人以卅五歲以下人士爲主，佔八成，當中以學生群體尤衆。其他的電騙案包括投資詐騙（殺豬盤），去年錄得一百八十宗，按年上升八成半；網購門票詐騙有逾二百宗，卅五歲以下青年佔逾六成；釣魚短訊及網站衍生的騙案按年增加二點七倍。    人人警惕騙徒冇符    司警表示，針對各類詐騙犯罪活動，會持續透過反詐騙協調中心統籌防治工作，並積極與周邊警方執法合作，深化預防、挽損和打擊的成效。防騙工作要取得成效，需要公眾積極參與。人人保持警惕騙徒便無所遁形，亦是司警推行防騙工作的核心理念和目標。    司警特別提醒現實中各地執法部門均不會透過電話或視頻辦案，更不會藉此要求居民將款項存入所謂“安全帳戶”或對其“資金審查”。任何人士如接到不明來電時應提高警惕。一旦遇到上述情況必然是詐騙，應立即掛線並主動報案。,http://www.macaodaily.com/html/2024-03/17/content_1742196.htm,人人警惕騙徒冇符    司警表示，針對各類詐騙犯罪活動，會持續透過反詐騙協調中心統籌防治工作，並積極與周邊警方執法合作，深化預防、挽損和打擊的成效,毋須 下載 使用方便     四項 功能 拆穿 詐騙         反詐 小 程式 下 月 推出         【 本報 消息 】 保安 司司 長 辦 公室 “ 安全 與 您 ” 欄目 刋 登 文章 “ 全民 反詐 ， 由 您 做起 。 ” 當中 提到 近年 電訊 網絡詐 騙 已成 全球 犯罪 現象 ， 本澳 去年 立案 數字 均 有 明顯 增幅 ， 今年 首 月 立案 數字 已 高 於 去年 月 平均 數 。 反詐 首重 預防 ， 爲 此司 警局 將於下 月 推出 反詐 微信 小 程式 ， 協助公 衆 防騙 。         不須 輸入 電話 號碼         司 警局 下 月 推出 的 反詐 小 程式 借助 微 信手 機應用 程式 運行 ， 切合 澳門 網絡 環境 ， 公眾 熟悉 且易 於 操作 。 程式 上線 後 ， 公眾 可經 由司 警局 微信 公眾號 ( PJ _ Macao ) 進入 。 使用者 毋須 另行 安裝 應用 程式 ， 不須 輸入 電話 號碼 及 個 人 資料 ， 不會 引起 個 人 隱私 、 程式 安全性 的 疑慮 。 該 反詐 小 程式 有四項 功能 ， 包括 詐騙 搜尋器 、 詐騙 線索 上 報 、 詐騙 知多 D 及騙 案識別 （ 詳見 附表 ） 。         電騙 勁 升二點 六倍         “ 安全 與 您 ” 文章 亦 總結 了 去年 本澳 的 詐 騙案 及 騙 徒 的 作案 手法 。 據 司警 去年 立案 統計 ， 電話 詐騙 、 網絡詐 騙 、 盜刷 信用卡 的 電腦 詐騙 ， 分別 有 四百 〇 七宗 、 八百 七十一 宗及 三百 二十九 宗 ， 按年 分別 錄得 百分之二百 六十三 、 四十三 和 八十九 的 升幅 。         公檢法 青年 中招 多         去年 電話 詐騙 以 “ 公檢法 ” 最 多 ， 佔 總數 逾 七成 ， 是 前年 的 三點 三倍 。 受害人 以卅五歲 以下 人士 爲 主 ， 佔 八成 ， 當中 以學生 群體 尤 衆 。 其他 的 電騙案 包括 投資詐 騙 （ 殺 豬盤 ） ， 去年 錄得 一百八十 宗 ， 按年 上升 八成 半 ； 網購 門票 詐騙 有 逾 二百 宗 ， 卅五歲 以下 青年 佔 逾 六成 ； 釣魚 短訊及 網站 衍生 的 騙案 按 年 增加 二點 七倍 。         人人 警惕 騙徒 冇 符         司警 表示 ， 針對 各類 詐騙 犯罪 活動 ， 會持續 透過 反詐 騙 協調 中心 統籌 防治 工作 ， 並積極 與 周邊 警方 執法 合作 ， 深化 預防 、 挽損 和 打擊 的 成效 。 防騙 工作 要 取得成效 ， 需要 公眾 積極 參 與 。 人人 保持警惕 騙徒 便 無 所 遁形 ， 亦 是 司警 推行 防騙 工作 的 核心理念 和 目標 。         司警 特別 提醒 現實 中 各地 執法 部門 均 不會 透過 電話 或 視頻 辦案 ， 更不會 藉此 要求 居民 將款 項 存入 所謂 “ 安全 帳戶 ” 或 對 其 “ 資金 審查 ” 。 任何 人士 如 接到 不明 來 電時 應 提高警惕 。 一旦 遇到 上述 情況 必然 是 詐 騙 ， 應 立即 掛線 並主動 報案 。,2024-03-17
議員冀適時提升防詐功能,認反詐小程式有助公衆防騙    議員冀適時提升防詐功能    【本報消息】司警局將於下月推出反詐微信小程式，進一步協助公衆防範騙案。議員梁孫旭相信程式有助減少居民被騙，希望本澳適時檢視系統的方便性，進一步加強防範詐騙伎倆。    毋須安裝直接使用    梁孫旭表示，近年電騙、網騙明顯上升，當中電騙增幅驚人，不少居民遭受嚴重損失。雖然警方在防騙、防詐宣傳做了大量工作，亦成立專責部門，但居民對詐騙手法仍然防不勝防，受騙嚴重。    司警局反詐小程式借助微信手機應用程式運行，公衆可經司警局微信公眾號(PJ_Macao)進入，使用者毋須另行安裝應用程式，只須在詐騙搜尋器輸入可疑來電號碼、電郵、銀行、戶口等資料，獲取經系統比對分析後的詐騙風險評估結果。    電信商可首先攔截    梁孫旭表示曾收到居民反映，曾收到陌生電話但不知道是否詐騙。故相信通過反詐微信小程式可方便居民評估詐騙風險，減少被騙機會。鄰近地區如內地、香港亦有類似功能的應用程式，相信一定程度能幫助居民減少被騙。希望政府加強宣傳，讓居民廣泛應用反詐微信小程式。    梁孫旭提到，香港升級反詐應用程式，當安裝應用程式後，直接在手機主動提醒可疑的電話、網頁等。希望本澳適時檢視系統的方便性，進一步加強防騙技術。又認為本澳電信商可在第一防線攔截，如通過本地以至跨境合作，攔截可疑的電話及網絡訊息。    提防AI造假詐騙    詐騙手法層出不窮，特別是人工智能（AI）發展與普及，深度造假技術作換臉變聲的詐騙，鄰近地區已出現有關騙案。梁孫旭冀警方加強防範新的詐騙伎倆，通過跨境合作等，進一步加強防範詐騙行為。,http://www.macaodaily.com/html/2024-03/17/content_1742197.htm,司警局反詐小程式借助微信手機應用程式運行，公衆可經司警局微信公眾號(PJ_Macao)進入，使用者毋須另行安裝應用程式，只須在詐騙搜尋器輸入可疑來電號碼、電郵、銀行、戶口等資料，獲取經系統比對分析後的詐騙風險評估結果,認反詐 小 程式 有助 公 衆 防騙         議員冀 適時 提升 防詐 功能         【 本報 消息 】 司 警局 將於下 月 推出 反詐 微信 小 程式 ， 進 一步 協助公 衆 防範 騙案 。 議員梁 孫旭 相信 程式 有助 減少 居民 被 騙 ， 希望 本澳 適時 檢視 系統 的 方便性 ， 進 一步 加強 防範詐 騙 伎 倆 。         毋須 安裝 直接 使用         梁孫旭 表示 ， 近年 電騙 、 網騙 明顯 上升 ， 當中 電騙 增幅 驚人 ， 不少 居民 遭受 嚴重 損失 。 雖然 警方 在 防騙 、 防詐 宣傳 做 了 大量 工作 ， 亦 成立 專責部門 ， 但 居民 對詐 騙 手法 仍然 防不勝防 ， 受騙 嚴重 。         司 警局 反詐 小 程式 借助 微 信手 機應用 程式 運行 ， 公 衆 可 經司 警局 微信 公眾號 ( PJ _ Macao ) 進入 ， 使用者 毋須 另行 安裝 應用 程式 ， 只須 在 詐騙 搜尋器 輸入 可疑 來 電號碼 、 電郵 、 銀行 、 戶口 等 資料 ， 獲取 經系統 比 對 分析 後 的 詐騙 風險 評估 結果 。         電信 商可 首先 攔截         梁孫旭 表示 曾 收到 居民 反映 ， 曾 收到 陌生 電話 但 不 知道 是否 詐騙 。 故 相信 通過 反詐 微信 小 程式 可 方便 居民 評估 詐騙 風險 ， 減少 被 騙 機會 。 鄰 近地 區如內 地 、 香港 亦 有 類似 功能 的 應用 程式 ， 相信 一定 程度 能 幫助 居民 減少 被 騙 。 希望 政府 加強 宣傳 ， 讓 居民 廣泛 應用 反詐 微信 小 程式 。         梁孫旭 提到 ， 香港 升級 反詐 應用 程式 ， 當安裝 應用 程式 後 ， 直接 在手 機主動 提醒 可疑 的 電話 、 網頁 等 。 希望 本澳 適時 檢視 系統 的 方便性 ， 進 一步 加強 防騙 技術 。 又 認為 本 澳電信 商可 在 第一 防線 攔截 ， 如通過 本地 以至 跨境 合作 ， 攔截 可疑 的 電話 及 網絡訊息 。         提防 AI 造假 詐騙         詐騙 手法 層出 不窮 ， 特別 是 人工智能 （ AI ） 發展 與 普及 ， 深度 造假 技術 作換 臉 變聲 的 詐 騙 ， 鄰 近地 區已 出現 有關 騙案 。 梁孫旭冀 警方 加強 防範新 的 詐 騙 伎 倆 ， 通過 跨境 合作 等 ， 進 一步 加強 防範詐 騙行 為 。,2024-03-17
男子疑墮援交騙局失財七百二,男子疑墮援交騙局失財七百二    【本報消息】一名本地男子懷疑墮入網上“色情”騙局，報稱合共損失七百二十六澳門元。司警接手調查。    案情透露，本地中年男事主上周四上午十時五十三分在網上社交平台認識一名女子，聊天過程中對方聲稱可提供“服務”，服務費七百澳門元。事主因有興趣，當日按指示到氹仔某大廈外與女子見面。事主等候期間收到一名陌生男子來電，要求其先到便利店購買點數卡付費，才能與女子見面。事主按指示到便利店購買了七百二十六澳門元的點數卡，再將自己的相片、身份及點數卡資料傳予男子。    稍後，該男子再要求購買點數卡作“保證金”，女子才會現身提供“服務”。事主始覺可疑，沒有再購買點數卡，也沒有再聯絡對方。不久，事主收到男子傳來訊息，便威脅稱若事主不從會對其及家人不利。事主同日下午二時三十分向司警報案。事主報案時不願透露女子向其提供甚麼“服務”。,http://www.macaodaily.com/html/2024-03/17/content_1742198.htm,事主等候期間收到一名陌生男子來電，要求其先到便利店購買點數卡付費，才能與女子見面,男子 疑 墮 援交 騙局 失財 七百 二         【 本報 消息 】 一名 本地 男子 懷疑 墮入 網上 “ 色情 ” 騙局 ， 報稱 合共 損失 七百 二十六 澳門元 。 司警 接手 調查 。         案情 透露 ， 本地 中年 男 事主 上周四 上午 十時 五十 三分 在 網上 社交 平台 認識 一名 女子 ， 聊天 過程 中 對 方聲 稱 可 提供 “ 服務 ” ， 服務費 七百 澳門元 。 事 主因 有興趣 ， 當日 按 指示 到 氹 仔 某大廈 外 與 女子 見面 。 事主 等候 期間 收到 一名 陌生 男子 來電 ， 要求 其先 到 便利店 購買點 數卡 付費 ， 才能 與 女子 見面 。 事主 按 指示 到 便利店 購買 了 七百 二十六 澳門元 的 點數 卡 ， 再將 自己 的 相片 、 身份 及點 數卡 資料 傳予 男子 。         稍 後 ， 該 男子 再 要求 購買點 數卡作 “ 保證金 ” ， 女子 才 會 現身 提供 “ 服務 ” 。 事主 始覺 可疑 ， 沒有 再 購買點 數卡 ， 也 沒 有 再 聯絡 對方 。 不久 ， 事主 收到 男子 傳來訊息 ， 便 威脅 稱 若 事主 不 從 會 對 其及 家人 不利 。 事主 同日 下午 二時 三十分 向 司警 報案 。 事主 報案 時不願 透露 女子 向 其 提供 甚麼 “ 服務 ” 。,2024-03-17
“公檢法”騙內地女四十萬,“公檢法”騙內地女四十萬    【本報消息】一名內地女子月初疑墮“公檢法”電話騙局，報稱被騙合共四十萬元人民幣。司警接手調查。    案情透露，年輕女事主本月三日身處本澳，當日下午二時接獲一名操普通話、自稱“快遞公司職員”來電，指事主的快遞涉及刑事犯罪。過程中，“快遞公司職員”可說出事主的姓名。事主信以為真。不久，電話轉駁至“內地公安”接聽，自稱“警官”的男子要求事主配合調查，包括將其內地所有銀行賬戶的款項轉到內地一指定銀行賬戶作為調查“保證金”。事主不虞有詐，將兩個內地銀行賬戶內合共四十萬元人民幣轉賬。    看防詐宣傳已太遲    本月十三日，事主在本澳乘搭的士時，因看到司警局的防詐騙短片才警覺自己疑墮“公檢法”電話騙局，翌日中午向司警報案求助。,http://www.macaodaily.com/html/2024-03/17/content_1742199.htm,看防詐宣傳已太遲    本月十三日，事主在本澳乘搭的士時，因看到司警局的防詐騙短片才警覺自己疑墮“公檢法”電話騙局，翌日中午向司警報案求助,“ 公檢法 ” 騙內 地女 四十 萬         【 本報 消息 】 一名 內地 女子 月初 疑 墮 “ 公檢法 ” 電話 騙局 ， 報稱 被 騙 合共 四十 萬元 人民 幣 。 司警 接手 調查 。         案情 透露 ， 年輕 女事主 本月 三日 身處 本澳 ， 當日 下午 二時 接獲 一名 操 普通 話 、 自稱 “ 快遞 公司 職員 ” 來電 ， 指 事主 的 快 遞 涉及 刑事犯罪 。 過程 中 ， “ 快遞 公司 職員 ” 可說 出事 主 的 姓名 。 事主 信以 為 真 。 不久 ， 電話 轉駁 至 “ 內地 公安 ” 接聽 ， 自稱 “ 警官 ” 的 男子 要求 事主 配合 調查 ， 包括 將其內 地 所有 銀行 賬戶 的 款項 轉到 內 地 一 指定 銀行 賬戶 作為 調查 “ 保證金 ” 。 事主 不虞有 詐 ， 將兩個 內地 銀行 賬戶 內 合共 四十 萬元 人民 幣轉賬 。         看防詐 宣傳 已太遲         本月 十三日 ， 事主 在 本 澳乘 搭 的士 時 ， 因 看到 司 警局 的 防詐 騙 短片 才 警覺 自己 疑 墮 “ 公檢法 ” 電話 騙局 ， 翌日 中午 向 司警 報案 求助 。,2024-03-17
綠化周揭幕親近大自然,官民齊植樹   辦琴生態遊    綠化周揭幕親近大自然    【本報消息】市政署主辦的第四十三屆澳門綠化周昨日至本月二十四日舉行，今屆活動以“傳承愛綠，共建美好城市”為主題，秉承“世界植樹日”的理念，舉辦多場植樹及體驗活動，介紹本澳的綠化建設、生態資源和保育現況。    活動期間，市政署將與團體及居民共植近千株苗木，並舉辦“橫琴生態遊”等，鼓勵居民多參與環境綠化，親近大自然。    綠化周開幕式昨日下午三時在氹仔龍環葡韻舉行，市政署管理委員會主席戴祖義、澳門中聯辦機關工作部部長杜偉民、外交部駐澳特派員公署辦公室主任傅愛民參贊、解放軍駐澳部隊參謀長趙建明大校、廣東省林業局事務中心主任李濤、橫琴粵澳深度合作區城市規劃和建設局長張國基及巿政諮詢委員會主席司徒民義主禮。    市政署自然保護研究處長陳海峰受訪稱，今年特別邀請科研機構參與，包括華南國家植物園和聖若瑟大學，向居民分享粵澳科研合作成果。    深合區城市規劃和建設局副局長譚惠芳表示，深合區第二年參與綠化，一直有與市政署聯動，參與澳門綠化周是“橫琴自然周”活動的一部分。今年“橫琴自然周”推出共二十一場植樹和自然科普、導賞活動受歡迎，居民透過“一戶通”報名，大部分已額滿。    綠化周嘉年華昨、今兩日，下午二時至傍晚六時，在氹仔龍環葡韻舉行，現場設多個主題攤位，介紹本澳原生動植物及入侵物種、古樹名木保護保育、野生動物飼養、荷花種植及昆蟲旅館等資訊，並設有遊戲攤位、手作工作坊及生態導賞活動，為居民大眾帶來不同層面的綠化與保育訊息，推廣保護大自然和愛護生態環境。現場還舉行派送植物活動，向居民送出長壽花、網紋草、薄荷等小盆栽。    派送植物添綠意    綠化周期間，當局將舉辦三十多場次親近大自然及植樹活動，供學校、團體及居民參與。期間並於全澳多區舉辦合共六場“全城愛綠——派送植物”活動，讓居民將綠意帶回家中。同時，豁免松山纜車及黑沙越野車場（越野單車及小童車）收費。,http://www.macaodaily.com/html/2024-03/17/content_1742115.htm,綠化周嘉年華昨、今兩日，下午二時至傍晚六時，在氹仔龍環葡韻舉行，現場設多個主題攤位，介紹本澳原生動植物及入侵物種、古樹名木保護保育、野生動物飼養、荷花種植及昆蟲旅館等資訊，並設有遊戲攤位、手作工作坊及生態導賞活動，為居民大眾帶來不同層面的綠化與保育訊息，推廣保護大自然和愛護生態環境,官民 齊植樹       辦琴生 態遊         綠化周 揭幕 親近 大自然         【 本報 消息 】 市政 署主辦 的 第四十三 屆 澳門 綠化周 昨日 至 本月 二十四日 舉行 ， 今屆 活動 以 “ 傳承愛綠 ， 共建 美好 城市 ” 為主題 ， 秉承 “ 世界 植樹日 ” 的 理念 ， 舉辦 多場 植樹及 體驗 活動 ， 介紹 本澳 的 綠化 建設 、 生態 資源 和 保育 現況 。         活動 期間 ， 市政 署將 與 團體 及 居民 共植近 千株 苗木 ， 並舉 辦 “ 橫琴生 態遊 ” 等 ， 鼓勵 居民 多參 與 環境 綠化 ， 親近 大自然 。         綠化 周開 幕式 昨日 下午 三時 在 氹 仔龍環 葡韻 舉行 ， 市政 署 管理 委員會 主席 戴祖義 、 澳門 中聯辦 機關 工作部 部長 杜偉民 、 外交部 駐澳 特派 員 公署 辦公 室主任 傅愛民 參贊 、 解放 軍駐 澳部隊 參謀長 趙 建明 大校 、 廣東省 林業 局事務 中心 主任 李濤 、 橫琴粵澳 深度 合作 區 城市 規劃 和 建設 局長 張國 基及 巿 政諮詢 委員會 主席 司徒 民義主禮 。         市政 署 自然 保護 研究 處長 陳 海峰 受訪 稱 ， 今年 特別 邀請 科研 機構 參 與 ， 包括 華南國家 植物 園和聖 若瑟 大學 ， 向 居民 分享 粵澳 科研 合作 成果 。         深合區 城市 規劃 和 建設局 副 局長 譚惠芳 表示 ， 深合區 第二年 參與 綠化 ， 一直 有 與 市政 署聯動 ， 參與 澳門 綠化 周是 “ 橫琴 自然 周 ” 活動 的 一部分 。 今年 “ 橫琴 自然 周 ” 推出 共 二十一 場植樹 和 自然 科普 、 導賞 活動受 歡迎 ， 居民 透過 “ 一戶通 ” 報名 ， 大部分 已額 滿 。         綠化 周嘉年華 昨 、 今 兩日 ， 下午 二時 至 傍晚 六時 ， 在 氹 仔龍環 葡韻 舉行 ， 現場 設多個 主題 攤位 ， 介紹 本澳 原生 動 植物 及 入侵 物種 、 古樹 名木 保護 保育 、 野生 動物 飼養 、 荷花 種植及 昆蟲 旅館 等 資訊 ， 並設 有 遊戲 攤位 、 手作 工作坊 及 生態 導賞 活動 ， 為 居民 大眾 帶來 不同 層面 的 綠化 與 保育 訊息 ， 推廣保護 大自然 和 愛護 生態 環境 。 現場 還舉行 派送 植物 活動 ， 向 居民 送 出長 壽花 、 網紋 草 、 薄荷 等 小 盆栽 。         派送 植物 添綠意         綠化 周期 間 ， 當局 將舉 辦 三十多 場次 親近 大自然 及植樹 活動 ， 供學校 、 團體 及 居民 參與 。 期間並 於 全澳多區 舉辦 合共 六場 “ 全城 愛綠 — — 派送 植物 ” 活動 ， 讓 居民 將綠意 帶 回家 中 。 同時 ， 豁免 松山 纜車 及 黑沙 越野 車場 （ 越野 單車 及 小童 車 ） 收費 。,2024-03-17
琴珍稀野生植物受歡迎   本報記者　　高嘉灝,琴珍稀野生植物受歡迎    橫琴粵澳深度合作區城市規劃和建設局主辦的“橫琴自然周”正舉行，局方昨今兩日在氹仔龍環葡韻澳門綠化周嘉年華設置攤位，冀將橫琴自然之美延伸到澳門。    現場設置多個主題攤位，介紹橫琴珍稀野生植物、橫琴常見昆蟲等資訊，並透過攤位遊戲、工作坊、科普展板，讓公眾寓學於樂，樹立保護大自然和愛護生態環境理念。有學生團體對遊戲內容展開熱烈討論，對橫琴野生植物和昆蟲表現出極高興趣。    “植物剪影”和“昆蟲回家”兩個遊戲最受小朋友歡迎，開攤前已有小朋友排隊等待。同行家長則較關注橫琴生物多樣性展板，有的向工作人員詢問國家二級保護野生植物在橫琴的生長現狀和遊覽建議，希望日後能親身參與橫琴野生植物保護行動。家長們普遍認為攤位內容有意義，能讓孩子在遊戲中學習愛護大自然，細緻觀察野生動植物，培養保護生物多樣性意識。    同場並播放深合區去年完成的《動植物資源本底調查紀錄片》，派送《橫琴珍稀野生植物畫冊》及《橫琴常見昆蟲畫冊》，冀向居民介紹深合區生物多樣性和生態保育工作。    本報記者　　高嘉灝,http://www.macaodaily.com/html/2024-03/17/content_1742116.htm,現場設置多個主題攤位，介紹橫琴珍稀野生植物、橫琴常見昆蟲等資訊，並透過攤位遊戲、工作坊、科普展板，讓公眾寓學於樂，樹立保護大自然和愛護生態環境理念,琴 珍稀 野生植物 受歡 迎         橫琴粵澳 深度 合作 區 城市 規劃 和 建設 局主辦 的 “ 橫琴 自然 周 ” 正舉行 ， 局方 昨今 兩日 在 氹 仔龍環 葡韻 澳門 綠化 周嘉年 華設 置 攤位 ， 冀將 橫琴 自然 之美 延伸 到 澳門 。         現場 設置 多個 主題 攤位 ， 介紹 橫琴 珍稀 野生植物 、 橫琴常見 昆蟲 等 資訊 ， 並透過 攤位 遊戲 、 工作坊 、 科普 展板 ， 讓 公眾 寓學 於 樂 ， 樹立 保護 大自然 和 愛護 生態 環境 理念 。 有學生 團體 對 遊戲 內容展 開熱烈 討論 ， 對 橫琴 野生植物 和 昆蟲表現 出極 高興趣 。         “ 植物 剪影 ” 和 “ 昆蟲 回家 ” 兩個 遊戲 最受 小朋友 歡迎 ， 開攤 前 已有 小朋友 排隊 等待 。 同行 家長 則較 關注 橫琴 生物 多樣 性 展板 ， 有 的 向 工作 人員詢 問國家 二級 保護 野生植物 在 橫琴 的 生長 現狀 和 遊覽 建議 ， 希望 日後能 親身 參與 橫琴 野生植物 保護 行動 。 家長 們 普遍 認為 攤位 內容 有意 義 ， 能 讓 孩子 在 遊戲 中學習 愛護 大自然 ， 細 緻 觀 察 野生 動 植物 ， 培養 保護 生物 多樣 性意識 。         同場並 播放 深合區 去年 完成 的 《 動 植物 資 源本 底調 查紀 錄片 》 ， 派送 《 橫琴 珍稀 野生植物 畫冊 》 及 《 橫琴常見 昆蟲 畫冊 》 ， 冀向 居民 介紹 深合區 生物 多樣 性 和 生態 保育 工作 。         本報 記者 　 　 高嘉灝,2024-03-17
綠意滿載,綠意滿載    綠化周昨開幕，現場向居民派送植物，花色鮮艷的小盆栽吸引，大家齊將綠意帶回家。羅惠旋   攝,http://www.macaodaily.com/html/2024-03/17/content_1742117.htm,綠意滿載    綠化周昨開幕，現場向居民派送植物，花色鮮艷的小盆栽吸引，大家齊將綠意帶回家,綠意 滿載         綠化周 昨開幕 ， 現場 向 居民 派送 植物 ， 花色 鮮艷 的 小 盆栽 吸引 ， 大家 齊將 綠意 帶 回家 。 羅 惠旋       攝,2024-03-17
