Title,Content,Link,Summary,Preprocessed_Content,Date
當局治亂過路黑點,東望洋新街首月三百行人違規    四宗事故    當局治亂過路黑點    【本報消息】交通諮詢委員會“簡化手續及安全工作小組”日前舉行工作會議。期間重點探討東望洋新街近馬大臣街上落客貨區情況。按照警方提供資料顯示，今年首月已檢控近三百宗行人違規，上述路段去年交通事故便有卅四宗，今年首月也錄得四宗，顯示有一定安全隱患。    倡增設交通燈指示牌    工作會議上，委員同時探討近期的路網優化構想，簡介一戶通辦理“的士駕駛員證續期”及“認領被移走的車輛”功能等。關注到東望洋新街近馬大臣街上落客貨區的行人違規過馬路問題。警方指出，現在該位置並沒有設置圍欄，成為行人違規過馬路的黑點；委員則認為，應考慮以其他方式保障行人過馬路安全。    然而，大部分委員認為應顧及商戶及居民的上落客貨需要，建議保留有關上落客貨區，並考慮以其他方式，例如增設交通燈、指示牌、警示及宣導等，引導行人安全過馬路。交通事務局則表示會繼續與警方保持合作，尋求合適措施改善有關路段的交通環境。    運動場道入游館圓地    會上，交通事務局也介紹奧林匹克游泳館圓形地周邊路網優化的構想。考慮到該圓形地西南匝道行車天橋，以及鄰近氹仔蓮花海濱大馬路近銆海灣的新建道路先後開放使用，交通事務局建議恢復運動場道直接進入奧林匹克游泳館圓形地的行車安排；於圓形地各出入口設置左轉專道；以及相應調整行人過馬路設施等，以完善奧林匹克游泳館圓形地的交通安排。有委員認為，可進一步到現場視察及提供意見。,http://www.macaodaily.com/html/2024-02/22/content_1736558.htm,然而，大部分委員認為應顧及商戶及居民的上落客貨需要，建議保留有關上落客貨區，並考慮以其他方式，例如增設交通燈、指示牌、警示及宣導等，引導行人安全過馬路,東 望洋 新街 首 月 三百 行人 違規         四宗 事故         當局 治亂 過路 黑點         【 本報 消息 】 交通 諮 詢委員會 “ 簡化 手續 及 安全 工作 小組 ” 日前 舉行 工作 會議 。 期間 重點 探討東 望洋 新街 近馬 大臣 街上 落客 貨區 情況 。 按照 警方 提供 資料 顯示 ， 今年 首月 已 檢控近 三百 宗 行人 違規 ， 上述 路段 去年 交通事故 便 有 卅 四宗 ， 今年 首月 也 錄得 四宗 ， 顯示 有 一定 安全 隱患 。         倡增設 交通 燈 指示牌         工作 會議 上 ， 委員同 時 探討 近期 的 路網 優化構 想 ， 簡介 一戶 通辦理 “ 的士 駕駛員 證續期 ” 及 “ 認領 被 移走 的 車輛 ” 功能 等 。 關注 到 東 望洋 新街 近馬 大臣 街上 落客 貨區 的 行人 違規 過馬路 問題 。 警方 指出 ， 現在 該 位置 並沒有 設置 圍欄 ， 成為 行人 違規 過馬路 的 黑點 ； 委員則 認為 ， 應 考慮 以 其他 方式 保障 行人 過馬路 安全 。         然而 ， 大部分 委員 認為 應顧 及 商戶 及 居民 的 上 落 客貨 需要 ， 建議 保留 有關 上 落客 貨區 ， 並考慮 以 其他 方式 ， 例如 增設 交通 燈 、 指示牌 、 警示 及 宣導 等 ， 引導 行人 安全 過馬路 。 交通 事務 局則 表示 會繼續 與 警方 保持 合作 ， 尋求 合適 措施 改善 有關 路段 的 交通 環境 。         運動場 道 入 游館 圓地         會上 ， 交通 事務局 也 介紹 奧林匹克 游泳 館圓 形地 周邊 路網 優化 的 構想 。 考慮 到 該 圓形 地 西南 匝道 行車 天橋 ， 以及 鄰近 氹 仔蓮 花海 濱大馬路 近 銆 海灣 的 新建 道路 先後開 放 使用 ， 交通 事務局 建議 恢 復 運動場 道 直接 進入 奧林匹克 游泳 館圓形 地 的 行車 安排 ； 於 圓形 地 各 出入口 設置 左轉 專道 ； 以及 相應 調整 行人 過馬路 設施 等 ， 以 完善 奧林匹克 游泳 館圓形 地 的 交通 安排 。 有委員 認為 ， 可進 一步 到 現場 視察及 提供 意見 。,2024-02-22
的士駕駛員證六月起到期,的士駕駛員證六月起到期    當局加強宣傳新法續期安排    【本報消息】交通諮詢委員會“簡化手續及安全工作小組”工作會議上，也簡介一戶通辦理“的士駕駛員證續期”及“認領被移走的車輛”功能。    逾期未續將失效    其中按照“新的士法”規定，的士駕駛員證的有效期為五年，在到期前六個月，持證人便可透過一戶通辦理續期申請。若於有效期屆滿且未獲許可續期，有關的士駕駛員證將會失效，持證人須要重新參與培訓及通過考試方能重新獲取證照。    此外，如持證人在逾期後十日內沒有將的士駕駛員證交還交通事務局，將會被罰款六百澳門元。有委員關注這是新法生效後首次面對的士駕駛員證續期，可能業界未必留意到相關安排，認為局方必須加強與業界的溝通，以及加強宣傳，以令業界清晰有關安排。局方代表回應時表示，最快於今年六月會有首批的士駕駛員證到期，屆時除會透過電話短訊通知外，也會透過各方面加強宣傳。,http://www.macaodaily.com/html/2024-02/22/content_1736560.htm,的士駕駛員證六月起到期    當局加強宣傳新法續期安排    【本報消息】交通諮詢委員會“簡化手續及安全工作小組”工作會議上，也簡介一戶通辦理“的士駕駛員證續期”及“認領被移走的車輛”功能,的士 駕駛員證 六月 起 到期         當局 加強 宣傳 新法 續期 安排         【 本報 消息 】 交通 諮 詢委員會 “ 簡化 手續 及 安全 工作 小組 ” 工作 會議 上 ， 也 簡介 一戶 通辦理 “ 的士 駕駛員 證續期 ” 及 “ 認領 被 移走 的 車輛 ” 功能 。         逾期 未續將 失效         其中 按照 “ 新 的士 法 ” 規定 ， 的士 駕駛員證 的 有效期 為 五年 ， 在 到期 前六個 月 ， 持證 人 便 可 透過 一戶 通辦 理續期 申請 。 若 於 有效期 屆 滿且 未 獲許 可續期 ， 有關 的士 駕駛員證 將會 失效 ， 持證 人須 要 重新 參與 培訓 及 通過 考試 方能 重新 獲取 證照 。         此外 ， 如持 證人 在 逾期 後 十日 內 沒 有將 的士 駕駛員證 交還 交通 事務局 ， 將會 被 罰款 六百 澳門元 。 有委員 關注 這是 新法 生效 後 首次 面對 的士 駕駛員 證續期 ， 可能 業界 未必 留意到 相關 安排 ， 認為 局方 必須 加強 與 業界 的 溝通 ， 以及 加強 宣傳 ， 以令業界 清晰 有關 安排 。 局方 代表 回應 時 表示 ， 最快 於 今年 六月 會 有 首批 的士 駕駛員證 到期 ， 屆 時 除會 透過 電話 短訊 通知 外 ， 也 會 透過 各 方面 加強 宣傳 。,2024-02-22
交諮委：顯眼標語助行人守法過路,持續派駐警員執法交通輔導員勸喻    交諮委：顯眼標語助行人守法過路    【本報消息】對於東望洋街近馬大臣街上落客貨區行人違規過馬路問題，交諮委古慶祥認為，應以適當標語及指示引導行人正確使用過路設施橫過馬路，配合執法增強警示作用，平衡及保障不同使用群體的過路安全及權益。    一刀切圍封礙營商    古慶祥指出，隨着東望洋街一帶陸續開設特色店舖及“打卡”熱點，客流量增加，部分行人出於方便違規橫過馬路，危及自身安全及影響駕駛者，亦使該區成為其中一個“交通黑點”。警方今年首月已檢控近三百宗行人違規，顯見嚴重性。就圍封馬大臣街的臨時停泊區的措施持保留態度，擔憂周邊中小企面臨更艱難的經營環境，同時為解決上落貨需求而衍生其他交通隱患。    他認為，解決之道仍在引導行人正確使用過路設施橫過馬路。現時東望洋街近雀仔園一帶設有行人天橋，華士古達嘉馬花園周邊亦設有斑馬線，足夠引導行人到不同目的地。期望當局在塔石體育館一帶及東望洋街近十字路口的位置設置顯眼的標語及引導，及早提醒過路行人使用行人天橋及斑馬線橫過馬路，否則將被罰款。並持續派駐警員執法及交通輔導員勸喻，減少行人亂過馬路的可能。    有關問題亦涉及過路設施的規劃與行人過路習慣的調和。因應本澳人口密度不斷上升，道路承載力越發沉重，平衡不同道路使用者的權益將是交通治理重中之重。古慶祥冀當局持開放態度，多聆聽各持份者意見，積極完善過路設施的規劃和建設，做好線上線下宣傳，增強居民和旅客的守法意識，營造友善安全的出行環境。,http://www.macaodaily.com/html/2024-02/22/content_1736561.htm,持續派駐警員執法交通輔導員勸喻    交諮委：顯眼標語助行人守法過路    【本報消息】對於東望洋街近馬大臣街上落客貨區行人違規過馬路問題，交諮委古慶祥認為，應以適當標語及指示引導行人正確使用過路設施橫過馬路，配合執法增強警示作用，平衡及保障不同使用群體的過路安全及權益,持續 派 駐 警員 執法 交通 輔導員 勸喻         交諮委 ： 顯眼標 語助 行人 守法 過路         【 本報 消息 】 對 於 東 望洋 街近 馬 大臣 街上 落客 貨區 行人 違規 過馬路 問題 ， 交諮委古慶祥 認為 ， 應以 適當 標語 及 指示 引導 行人 正確 使用 過路 設施 橫過 馬 路 ， 配合 執法 增強 警示 作用 ， 平衡 及 保障 不同 使用 群體 的 過路 安全 及 權益 。         一刀切 圍封礙 營商         古慶祥 指出 ， 隨着 東 望洋 街一帶 陸續 開設 特色店 舖 及 “ 打卡 ” 熱點 ， 客流量 增加 ， 部分 行人 出 於 方便 違規橫 過馬路 ， 危及 自身 安全 及 影響 駕駛者 ， 亦 使 該區 成為 其中 一個 “ 交通 黑點 ” 。 警方 今年 首月 已 檢控近 三百 宗 行人 違規 ， 顯見 嚴重性 。 就圍 封馬 大臣 街 的 臨時 停泊 區的 措施 持 保留 態度 ， 擔憂 周邊 中小 企面 臨 更 艱難 的 經營 環境 ， 同時 為 解決 上 落貨 需求 而 衍生 其他 交通 隱患 。         他 認為 ， 解決 之 道 仍 在 引導 行人 正確 使用 過路 設施 橫過 馬 路 。 現時東 望洋 街近 雀 仔園 一帶 設有 行人 天橋 ， 華士 古達嘉馬 花園 周邊 亦 設有 斑馬線 ， 足夠 引導 行人 到 不同 目的地 。 期望 當局 在 塔石 體育館 一帶 及東 望洋 街近 十字路口 的 位置 設置 顯眼 的 標語 及 引導 ， 及早 提醒 過路 行人 使用 行人 天橋 及 斑馬線 橫過 馬 路 ， 否則將 被 罰款 。 並持續 派 駐 警員 執法 及 交通 輔導員 勸喻 ， 減少 行人 亂 過馬路 的 可能 。         有關 問題 亦 涉及 過路 設施 的 規劃 與 行人 過路 習慣 的 調 和 。 因應 本澳 人口密度 不斷 上升 ， 道路 承載力 越發 沉重 ， 平衡 不同 道路 使用者 的 權益將 是 交通 治理 重中之重 。 古慶祥 冀當 局持 開放態度 ， 多 聆 聽 各持 份者 意見 ， 積極 完善 過路 設施 的 規劃 和 建設 ， 做好 線 上線 下 宣傳 ， 增強 居民 和 旅客 的 守法 意識 ， 營造 友善 安全 的 出行 環境 。,2024-02-22
琴二線壓力測試過渡封關,司機乘客暫無需落車   首日通行順暢    琴二線壓力測試過渡封關    【本報消息】深合區“二線”通道昨日起開展全流程綜合壓力測試，但司機和乘客仍均無需落車，公交巴士和被抽查車輛暫時只需按指定路線繞行海關查驗場，現場情形大致順利。深合區執委會稱，擬在封關運行前分階段執行公交、送客車輛乘客需全員下車經出島大廳離島的壓力測試，到三月一日零時起封關後正式執行該項措施。    測試延續至月杪    深合區“二線”通道全流程綜合壓力測試昨日上午八時啟動，此次測試一直延續至本月二十九日，主要針對“二線”對各通道的設施設備、系統運行、車輛通行流線及海關業務進行全流程全要素的整體測試，並對此前測試中出現的問題查漏補缺，以提升通道運行效率。    據現階段測試安排，海關將抽查佈控指令納入通道全流程測試中，持續驗證通道信息化系統、監管設備使用、部門協同聯動等功能性，搶抓時間推進各項準備工作。    在橫琴大橋“二線”通道，車輛通過卡口時，需根據現場屏幕提示信息通行，被抽中需接受查驗的車輛在現場工作人員指引下，按指定線路前往海關查驗場，然後再按指引駛出查驗場拐上離島橋頭。    現場所見，未被抽中查驗的車輛可與此前一樣直接經過“二線”車道閘口欄杆駛上橫琴大橋離島。被抽中需查驗的車輛，車牌號會出現在車道側的電子屏幕上，第二道閘的車道欄杆不會抬起即不允許直接通行，需按工作人員指引駛往海關查驗場，再在查驗場按規定路線駛出，所增加時間約為五分鐘。    現場抽查比例小    或與首日壓力測試有關，昨日被抽中需查驗的車輛比例相當低，即使抽中需查驗亦只是按指定路線繞行至海關查驗場，所有人員包括公交車乘客均無需下車，就可按規定路線駛出查驗場再重新拐上橫琴大橋離開橫琴。    在珠機城際軌道橫琴站、長隆站的“二線”查驗點，則與原有的進站安檢通道合二為一，海關在安檢通道派駐關員，所有旅客攜帶的行李物品需放入查驗設備過機掃描，供海關人員辨認放行。深合區經發局表示，綜合壓力測試首日各“二線”通道設施設備及信息化系統運行正常，車輛通行順暢，下一步將分階段執行公交、送客車輛乘客需全員下車經出島大廳離島的壓力測試，全力保障三月一日起封關運行順利進行。    將出台備案指引    深合區經發局還表示，為加快通行效率，旅客駕駛車輛出島可按自願自主提前申報備案，備案成功後可選擇包含通行備案車輛的多個“二線”通道出島。此外，為保障遊客、訪客駕駛車輛順利通行又能有效監管，深合區會盡快出台遊客、訪客駕駛車輛經“二線”通道出島的有關備案指引。    公交查驗任務重    按規定，深合區封關後途經“二線”離島的公交車，乘客需全員攜帶行李物品下車，在出島大廳查驗後才能重新登車離島。目前行經“二線”通道的公交線路共有十四條，其中經橫琴大橋的線路十條，經橫琴二橋則有兩條，另有一條觀光巴士線，日運送客流量巨大，屆時對該類人員的“二線”查驗料將是一大考驗。,http://www.macaodaily.com/html/2024-02/22/content_1736559.htm,深合區經發局表示，綜合壓力測試首日各“二線”通道設施設備及信息化系統運行正常，車輛通行順暢，下一步將分階段執行公交、送客車輛乘客需全員下車經出島大廳離島的壓力測試，全力保障三月一日起封關運行順利進行,司機 乘客 暫無需 落車       首日 通行 順暢         琴二線 壓力 測試 過渡 封關         【 本報 消息 】 深合區 “ 二線 ” 通道 昨日 起開展 全 流程 綜合 壓力 測試 ， 但 司機 和 乘客 仍均 無 需落車 ， 公交 巴士 和 被 抽查 車輛 暫時 只 需 按 指定 路線 繞 行海關 查驗場 ， 現場 情形 大致 順利 。 深合區 執委會 稱 ， 擬在 封關運 行前 分階段 執行 公交 、 送客 車輛 乘客 需全員下 車經 出島 大廳 離島 的 壓力 測試 ， 到 三月 一日 零時 起 封關 後 正式 執行 該 項 措施 。         測試 延續 至 月 杪         深合區 “ 二線 ” 通道 全 流程 綜合 壓力 測試 昨日 上午 八時 啟動 ， 此次 測試 一直 延續 至 本月 二十九日 ， 主要 針對 “ 二線 ” 對 各 通道 的 設施 設備 、 系統 運行 、 車輛 通行 流線 及海 關業務 進行 全 流程 全 要素 的 整體 測試 ， 並對 此前 測試 中 出現 的 問題 查漏 補缺 ， 以 提升 通道 運行 效率 。         據 現階段 測試 安排 ， 海關將 抽查 佈 控 指令 納入 通道 全 流程 測試 中 ， 持續驗證 通道 信息化 系統 、 監管 設備 使用 、 部門 協同 聯動 等 功能性 ， 搶 抓 時間 推進 各項 準備 工作 。         在 橫琴 大橋 “ 二線 ” 通道 ， 車輛 通過 卡口 時 ， 需根據 現場 屏幕提示 信息 通行 ， 被 抽 中 需 接受 查驗 的 車輛 在 現場 工作 人員 指引 下 ， 按 指定 線路 前往 海關 查驗場 ， 然後再 按 指引 駛出 查驗場 拐 上 離島 橋頭 。         現場 所見 ， 未 被 抽中 查驗 的 車輛 可 與 此前 一樣 直接 經過 “ 二線 ” 車道 閘口 欄杆駛上 橫琴 大橋 離島 。 被 抽中 需查驗 的 車輛 ， 車牌 號會 出現 在 車道側 的 電子 屏幕 上 ， 第二道 閘的 車道 欄杆 不會 抬起 即 不 允許 直接 通行 ， 需 按 工作 人員 指引 駛往 海關 查驗場 ， 再 在 查驗場 按 規定 路線 駛出 ， 所 增加 時間 約 為 五分 鐘 。         現場 抽查 比例 小         或 與 首日 壓力 測試 有關 ， 昨日 被 抽中 需查驗 的 車輛 比例 相當 低 ， 即使 抽中 需查驗 亦 只是 按 指定 路線 繞 行至 海關 查驗場 ， 所有人 員 包括 公交 車 乘客 均 無 需下車 ， 就 可 按 規定 路線 駛出 查驗場 再 重新 拐上 橫琴 大橋 離開 橫琴 。         在 珠機 城際 軌道 橫琴 站 、 長 隆站 的 “ 二線 ” 查驗點 ， 則與 原有 的 進站 安檢 通道 合二為 一 ， 海關 在 安檢 通道 派 駐 關員 ， 所有 旅客 攜帶 的 行李物品 需 放入 查驗 設備 過機 掃描 ， 供海關 人員辨認 放行 。 深合區 經發局 表示 ， 綜合 壓力 測試 首日 各 “ 二線 ” 通道 設施 設備 及 信息化 系統 運行 正常 ， 車輛 通行 順暢 ， 下 一步 將分 階段 執行 公交 、 送客 車輛 乘客 需全員下 車經 出島 大廳 離島 的 壓力 測試 ， 全力 保障 三月 一日 起封關 運行 順利 進行 。         將 出台 備案 指引         深合區 經發 局還 表示 ， 為 加快 通行 效率 ， 旅客 駕駛 車輛 出島 可 按 自願 自主 提前 申報 備案 ， 備案 成功 後 可 選擇 包含 通行 備案 車輛 的 多個 “ 二線 ” 通道 出島 。 此外 ， 為 保障 遊客 、 訪客 駕駛 車輛 順利 通行 又 能 有效 監管 ， 深合區 會 盡快 出台 遊客 、 訪客 駕駛 車輛經 “ 二線 ” 通道 出島 的 有 關備案 指引 。         公交 查驗 任務重         按規定 ， 深合區 封 關後途經 “ 二線 ” 離島 的 公交 車 ， 乘客 需全員 攜帶 行李物品 下車 ， 在 出島 大廳 查驗 後 才能 重新 登車 離島 。 目前 行經 “ 二線 ” 通道 的 公交 線路 共有 十四 條 ， 其中 經橫琴 大橋 的 線路 十條 ， 經橫琴 二橋則 有 兩條 ， 另有 一條 觀光 巴士 線 ， 日運送 客流量 巨大 ， 屆 時 對 該 類人員 的 “ 二線 ” 查驗料 將是 一大 考驗 。,2024-02-22
移除枯樹   周維勤  攝,移除枯樹    近年本澳多株樹木遭受病害。市政署人員在螺絲山公園移除枯萎樹木，清除倒樹隱患。    周維勤  攝,http://www.macaodaily.com/html/2024-02/22/content_1736562.htm,市政署人員在螺絲山公園移除枯萎樹木，清除倒樹隱患,移除 枯樹         近年 本澳 多株 樹木 遭受 病害 。 市政 署人員 在 螺絲山 公園 移除 枯萎 樹木 ， 清除 倒樹 隱患 。         周維勤     攝,2024-02-22
