Title,Content,Link,Summary,Preprocessed_Content,Date
澳門工作國之大者,中聯辦主任鄭新聰提四意見落實兩會精神    澳門工作國之大者    【本報消息】澳門中聯辦昨日召開全國“兩會”精神傳達會。中聯辦主任鄭新聰就共同貫徹落實好全國“兩會”精神和中央領導講話要求講了四點意見。包括認真學習貫徹全國“兩會”精神，準確把握大局大勢，堅決貫徹落實中央部署，以及增強榮譽感、責任感、使命感，以實際行動展現愛國愛澳新氣象。    主題鮮明成果豐碩    傳達會昨日下午三時半在中聯辦舉行。全國政協副主席何厚鏵、行政長官賀一誠、中聯辦主任鄭新聰分別講話，前行政長官崔世安出席，澳區全國人大代表團團長劉藝良、全國政協常委崔世昌分別傳達十四屆全國人大二次會議、全國政協十四屆二次會議精神。中聯辦副主任黃柳權主持會議。外交部駐澳特派員公署特派員劉顯法，中聯辦副主任嚴植嬋、呂玉印參加會議。    鄭新聰指出，這次全國“兩會”，高舉旗幟、主題鮮明、成果豐碩，對於動員和凝聚全國人民更加緊密地團結在以習近平主席為核心的中共中央周圍，全面推進中國式現代化，具有十分重要的意義。他就共同貫徹落實好全國“兩會”精神和中央領導講話要求講了四點意見。    一：認真學習貫徹    一是認真學習貫徹全國“兩會”精神，把思想和行動統一到中央決策部署上來。從“風景這邊獨好”的重大成就中，深刻領悟“兩個確立”的決定性意義；從“一張藍圖繪到底”的目標任務中，深刻領悟中國特色社會主義制度的優越性；從港澳是中央“掌上明珠”的特殊關愛中，深刻領悟澳門工作“國之大者”的戰略定位。    二：準確把握大局    二是準確把握大局大勢，堅定推進高質量發展的決心和信心。要看到，當今世界百年變局加速演進，世界進入新的動盪變革期。還要看到，時與勢仍在我們這邊，必須保持戰略定力和信心。更要看到，澳門與國家命運與共，祖國始終是澳門最堅強的後盾。過去一年，澳門維護國家安全有力有效，“愛國者治澳”原則深入落實，經濟快速恢復，多元發展和橫琴深合區建設加快推進，民生改善成效顯著。特別是“澳車北上”深入實施、橫琴深合區順利封關運行、新增港澳自由行城市等一系列中央惠澳政策，為澳門實現長期繁榮穩定發揮了重要作用。    三：堅決貫徹落實    三是堅決貫徹落實中央部署，以優異成績迎接澳門回歸祖國廿五周年。《政府工作報告》專門對港澳工作作出部署，充分體現了中央對港澳的關心和厚望。今年是澳門工作的“大年”，將迎來回歸祖國廿五周年、第六任行政長官選舉和政府換屆、中葡論壇第六屆部長級會議等一系列大事喜事。要按照中央部署要求，結合貫徹全國“兩會”精神，狠抓工作落實，努力做到好上加好、喜上加喜。要切實築牢澳門維護國家安全的堅實屏障；全面落實“愛國者治澳”原則；全力推動澳門經濟適度多元發展；發揮優勢更好服務國家發展大局。    全力推動澳門經濟適度多元發展是保持澳門長期繁榮穩定的必由之路。要緊緊圍繞澳門“一中心、一平台、一基地”定位，推動多元發展規劃落地落實。要因地制宜加快培育澳門的新質生產力，在傳統產業轉型升級、拓展新產業新業態、綠色低碳可持續等方面實現新突破。當前最緊要的任務是加快橫琴深合區建設，推動琴澳一體化發展，繼續引進有利於長遠發展的大產業大項目，促就業、引人氣、拼經濟，在引進更多的澳企澳資澳人到橫琴創業、生活上下更大工夫。    四：增強榮譽責任    四是增強榮譽感、責任感、使命感，以實際行動展現愛國愛澳新氣象。新征程上，要把中央的決策部署轉化為美好現實，關鍵在人、關鍵靠大家。今年全國“兩會”，澳區代表、委員不負六十八萬澳門居民的信任和重托，依法履職盡責，積極建言獻策，展現了良好形象，全方位展示了澳門特色“一國兩制”成功實踐。    增進一國兩制信心    鄭新聰強調，爲更好落實中央要求和全國“兩會”部署，要帶頭學習好、宣傳好、貫徹好全國“兩會”精神，在澳門社會掀起學習貫徹全國“兩會”精神的熱潮。    要積極組織和參與豐富多彩的慶祝澳門回歸祖國廿五周年活動，增進澳門社會和國際社會對“一國兩制”的信心。特別是內地建制人士，承擔着履行“雙重積極作用”的職責使命，中央寄予厚望，社會廣泛關注。要全力支持特區政府依法施政，多補位、多搭台，及時反映澳門居民所思所想所盼。要多做思想引領、凝聚共識的工作，引導社會各界人士，滙聚起共促“一國兩制”事業行穩致遠的強大合力。要不斷提高參政議政和履職能力，更好地為國家發展和澳門“一國兩制”實踐貢獻力量。    終審法院院長，特區政府主要官員、檢察長、特區國安委成員，澳區第十四屆全國人大代表、全國政協委員，現任省級和副省級市政協常委、澳區中華海外聯誼會常務理事、全國工商聯執委、全國青聯常委、全國婦聯執委、中國僑聯常委、建制內宗教界代表人士，中央駐澳機構和主要中資企業負責人等，共二百六十餘人參會。,http://www.macaodaily.com/html/2024-03/14/content_1741478.htm,增進一國兩制信心    鄭新聰強調，爲更好落實中央要求和全國“兩會”部署，要帶頭學習好、宣傳好、貫徹好全國“兩會”精神，在澳門社會掀起學習貫徹全國“兩會”精神的熱潮,中聯辦 主任 鄭新聰 提四意 見 落實 兩會 精神         澳門 工作 國之大者         【 本報 消息 】 澳門 中聯辦 昨日 召開 全國 “ 兩會 ” 精神 傳達會 。 中聯辦 主任 鄭新聰 就 共同 貫徹 落實 好 全國 “ 兩會 ” 精神 和 中央 領導 講話 要求 講了 四點 意見 。 包括 認真學習 貫徹 全國 “ 兩會 ” 精神 ， 準確 把握 大局 大勢 ， 堅決 貫徹 落實 中央 部署 ， 以及 增強 榮譽感 、 責任 感 、 使命感 ， 以實際 行動展 現愛國 愛 澳新 氣象 。         主題 鮮明 成果 豐碩         傳達會 昨日 下午 三時 半 在 中聯辦 舉行 。 全國政協 副 主席 何厚鏵 、 行政 長 官賀 一 誠 、 中聯辦 主任 鄭新聰 分別 講話 ， 前 行政 長 官 崔世安 出席 ， 澳區 全國 人大代表 團團長 劉藝良 、 全國政協 常委 崔世昌 分別 傳達 十四 屆 全國 人大 二次 會議 、 全國政協 十四 屆 二次 會議 精神 。 中聯辦 副 主任 黃 柳權 主持 會議 。 外交部 駐澳 特派 員 公署 特派 員 劉顯法 ， 中聯辦 副 主任 嚴植嬋 、 呂玉印 參加會議 。         鄭新聰 指出 ， 這次 全國 “ 兩會 ” ， 高舉 旗幟 、 主題 鮮明 、 成果 豐碩 ， 對 於 動員 和 凝聚 全國 人民 更加 緊密 地團 結在 以習 近平 主席 為 核心 的 中共中央 周圍 ， 全面 推進 中國式 現代化 ， 具有 十分 重要 的 意義 。 他 就 共同 貫徹 落實 好 全國 “ 兩會 ” 精神 和 中央 領導 講話 要求 講了 四點 意見 。         一 ： 認真學習 貫徹         一是 認真學習 貫徹 全國 “ 兩會 ” 精神 ， 把 思想 和 行動統 一到 中央 決策 部署 上來 。 從 “ 風景 這邊 獨好 ” 的 重大成就 中 ， 深刻 領悟 “ 兩個 確立 ” 的 決 定性 意義 ； 從 “ 一張 藍圖 繪 到底 ” 的 目標 任務中 ， 深刻 領悟 中國 特色 社會 主義 制度 的 優越性 ； 從 港澳 是 中央 “ 掌上明珠 ” 的 特殊 關愛中 ， 深刻 領悟 澳門 工作 “ 國之大者 ” 的 戰略 定位 。         二 ： 準確 把握 大局         二是 準確 把握 大局 大勢 ， 堅定 推進 高質量 發展 的 決心 和 信心 。 要 看到 ， 當今 世界 百年 變局 加速 演進 ， 世界 進入 新 的 動盪 變革期 。 還要 看到 ， 時 與 勢 仍 在 我們 這邊 ， 必須 保持 戰略 定力 和 信心 。 更要 看到 ， 澳門 與 國家 命運 與 共 ， 祖國始 終是 澳門 最 堅強 的 後 盾 。 過去 一年 ， 澳門 維護國家 安全 有力 有效 ， “ 愛國者 治澳 ” 原則 深入 落實 ， 經濟 快速 恢 復 ， 多元 發展 和 橫琴 深合區 建設 加快 推進 ， 民生 改善 成效 顯著 。 特別 是 “ 澳車 北上 ” 深入 實施 、 橫琴 深合區 順利 封關 運行 、 新增 港澳 自由 行 城市 等 一系列 中央 惠澳 政策 ， 為 澳門實 現長 期 繁榮 穩定 發揮 了 重要 作用 。         三 ： 堅決 貫徹 落實         三是 堅決 貫徹 落實 中央 部署 ， 以 優異 成績 迎接 澳門 回歸祖國 廿五 周年 。 《 政府 工作 報告 》 專門 對 港澳 工作 作出 部署 ， 充分 體現 了 中央 對 港澳 的 關心 和 厚望 。 今年 是 澳門 工作 的 “ 大 年 ” ， 將迎 來 回歸祖國 廿五 周年 、 第六任 行政 長 官選舉 和 政府 換屆 、 中葡 論壇 第六 屆 部長 級 會議 等 一系列 大事 喜事 。 要 按照 中央 部署 要求 ， 結合 貫徹 全國 “ 兩會 ” 精神 ， 狠抓 工作 落實 ， 努力做到 好上加好 、 喜上加喜 。 要切 實築牢 澳門 維護國家 安全 的 堅實 屏障 ； 全面 落實 “ 愛國者 治澳 ” 原則 ； 全力 推動 澳門 經濟 適度 多元 發展 ； 發揮 優勢 更好 服務國家 發展 大局 。         全力 推動 澳門 經濟 適度 多元 發展 是 保持 澳門長 期 繁榮 穩定 的 必由之路 。 要緊 緊圍 繞 澳門 “ 一 中心 、 一 平台 、 一 基地 ” 定位 ， 推動 多元 發展 規劃 落地 落實 。 要 因地制宜 加快 培育 澳門 的 新質 生產力 ， 在 傳統 產業 轉型 升級 、 拓展 新產業 新業態 、 綠色 低 碳 可持續 等 方面 實現 新 突破 。 當前 最 緊要 的 任務 是 加快 橫琴 深合區 建設 ， 推動琴 澳一體化 發展 ， 繼續 引進 有利於 長 遠 發展 的 大產業 大 項目 ， 促就業 、 引人氣 、 拼經濟 ， 在 引進 更 多 的 澳企澳資 澳人到 橫琴 創業 、 生活 上下 更大 工夫 。         四 ： 增強 榮譽 責任         四是 增強 榮譽感 、 責任 感 、 使命感 ， 以實際 行動展 現愛國 愛 澳新 氣象 。 新 征程 上 ， 要 把 中央 的 決策 部署 轉化 為 美好 現實 ， 關鍵 在 人 、 關鍵 靠 大家 。 今年 全國 “ 兩會 ” ， 澳區 代表 、 委員不負 六十八 萬澳門 居民 的 信任 和 重托 ， 依法 履職 盡責 ， 積極 建言 獻策 ， 展現 了 良好形象 ， 全方位 展示 了 澳門 特色 “ 一國 兩制 ” 成功 實踐 。         增進 一國 兩制 信心         鄭新聰 強調 ， 爲 更好 落實 中央 要求 和 全國 “ 兩會 ” 部署 ， 要 帶頭 學習 好 、 宣傳 好 、 貫徹 好 全國 “ 兩會 ” 精神 ， 在 澳門 社會 掀起 學習 貫徹 全國 “ 兩會 ” 精神 的 熱潮 。         要 積極 組織 和 參 與 豐富 多彩的 慶祝 澳門 回歸祖國 廿五 周年 活動 ， 增進 澳門 社會 和 國際 社會 對 “ 一國 兩制 ” 的 信心 。 特別 是 內 地 建制 人士 ， 承擔 着 履行 “ 雙重 積極 作用 ” 的 職責 使命 ， 中央 寄予厚望 ， 社會 廣泛 關注 。 要 全力支持 特區 政府 依法 施政 ， 多補位 、 多 搭台 ， 及時 反映 澳門 居民 所思 所想 所 盼 。 要 多 做 思想 引領 、 凝聚 共識 的 工作 ， 引導 社會 各界人士 ， 滙 聚起 共促 “ 一國 兩制 ” 事業行 穩致 遠 的 強大 合力 。 要 不斷 提高 參政議 政和 履職 能力 ， 更好 地為 國家 發展 和 澳門 “ 一國 兩制 ” 實踐 貢獻 力量 。         終審 法院 院長 ， 特區 政府 主要 官員 、 檢察長 、 特區 國安委成員 ， 澳區 第十四 屆 全國 人大代表 、 全國政 協委員 ， 現任 省級 和 副 省級 市政 協 常委 、 澳區 中華 海外 聯誼 會常務 理事 、 全國 工商 聯執委 、 全國 青聯 常委 、 全國 婦聯 執委 、 中國 僑聯 常委 、 建制 內 宗教界 代表 人士 ， 中央 駐澳 機構 和 主要 中資 企業 負責人 等 ， 共 二百六十 餘人 參會 。,2024-03-14
賀：實現居民美好生活嚮往,在全國“兩會”精神傳達會上談六點體會    賀：實現居民美好生活嚮往    【本報消息】行政長官賀一誠在中聯辦全國“兩會”精神傳達會上強調，要在以習近平主席為核心的中央堅強領導下，堅持穩中求進工作總基調，學習貫徹落實好“兩會”精神，凝心聚力，以實際行動貫徹執行好中央的決策部署，在團結奮鬥中不斷實現廣大居民對美好生活的嚮往。並結合澳門實際情況談及六點體會。    一：全面準確貫徹    一是全面準確貫徹“一國兩制”方針，築牢維護國家安全屏障。強調居安思危，未雨綢繆。澳門特區必須牢牢守住安全底線，不斷健全維護國家安全的制度機制，持續提升維護國家安全的能力水平，鞏固築牢維護國家安全屏障。堅決防範和遏制外部勢力干預澳門事務，防範化解金融經濟風險，保持澳門長期繁榮穩定的良好發展態勢。    二：有效落實多元    二是有效落實經濟適度多元發展規劃，推動澳門經濟高質量發展。今年是全面實施經濟適度多元發展規劃的開局之年，特區政府將牢牢把握橫琴開發服務澳門經濟適度多元發展的初心，貫徹落實習主席關於橫琴開發建設的重要指示精神，充分發揮“分線管理”特殊監管體制帶來的優勢，推動更多創新項目落地，加快推進澳琴一體化發展，與廣東省以及有關方面緊密合作，做好橫琴開發這篇文章，就深合區實現第一階段發展目標交出滿意答卷。    三：發揮澳門優勢    三是充分發揮澳門自身優勢，助力國家擴大高水平對外開放。特區政府將以中葡論壇（澳門）第六屆部長級會議為抓手，進一步強化中葡平台功能。積極參與和助力“一帶一路”建設，推動粵港澳大灣區高質量發展。積極參與和舉辦“中國與葡語國家企業經貿合作洽談會”等系列重要活動，辦好澳門國際環保合作發展論壇、國際基礎設施投資與建設高峰論壇等重大會展活動，充分發揮澳門聯通國內國際兩個市場兩種資源的平台作用。    四：優化民生工作    四是持續優化民生工作，穩步增進民生福祉。特區政府將以廣大居民較關注的就業、醫療、住房等作重要發力點，全力推進各項優化社會民生工作。充分發揮社會保障措施的保底作用，切實保障本地居民優先就業。發揮澳門協和醫院綜合效能，提升本地醫療服務水平，關顧居民身心健康。關注老齡化問題，優化長者服務，積極推動落實家庭友善政策。務實推進重大基建工程，加快建設宜居智慧綠色澳門。    五：推進行政改革    五是深入推進公共行政改革，全面提高政府施政效能。特區政府將帶頭學習、深刻領會“兩會”精神，加強學習理解和貫徹實施中央重大政策方針。堅持依法施政，不斷增強決策和政策科學性，努力提升政策執行力和施政效果，積極回應居民關切。繼續以電子政務為切入點，深入推進公共行政改革，構建便民便商的公共行政服務體系，持續提升公共服務質素及效率。強化施政團隊建設，提高公務人員整體素質，加強與社會溝通互動，提升政府整體施政效能。確保行政長官選舉嚴格依法、公平、公正和廉潔地進行。    六：壯大愛國愛澳    六是鞏固壯大愛國愛澳力量，維護社會大局和諧穩定。特區政府將鞏固弘揚愛國愛澳核心價值，不斷深化愛國愛澳教育，支持愛國愛澳社團發揮更大作用，廣泛團結凝聚廣大居民，發展壯大愛國愛澳力量，築牢“一國兩制”行穩致遠的社會政治基礎。厚植青年一代的家國情懷，引領更多青年成長成才。    發展新成果迎雙慶    賀一誠表示，今年是澳門回歸祖國廿五周年，特區政府將以此為契機，團結帶領澳門社會各界協同奮進，務實有為，推動特區各項事業取得新進步，推動具澳門特色的“一國兩制”實踐取得新進展。以繁榮景象、喜慶氛圍和新的發展成果迎接新中國七十五周年華誕和澳門回歸祖國廿五周年。,http://www.macaodaily.com/html/2024-03/14/content_1741479.htm,今年是全面實施經濟適度多元發展規劃的開局之年，特區政府將牢牢把握橫琴開發服務澳門經濟適度多元發展的初心，貫徹落實習主席關於橫琴開發建設的重要指示精神，充分發揮“分線管理”特殊監管體制帶來的優勢，推動更多創新項目落地，加快推進澳琴一體化發展，與廣東省以及有關方面緊密合作，做好橫琴開發這篇文章，就深合區實現第一階段發展目標交出滿意答卷,在 全國 “ 兩會 ” 精神 傳達會 上 談六點 體會         賀 ： 實現 居民 美好生活 嚮 往         【 本報 消息 】 行政 長 官賀 一誠在 中聯辦 全國 “ 兩會 ” 精神 傳達會 上 強調 ， 要 在 以習 近平 主席 為 核心 的 中央 堅強 領導下 ， 堅持 穩中求 進 工作 總基調 ， 學習 貫徹 落實 好 “ 兩會 ” 精神 ， 凝心 聚力 ， 以實際 行動 貫徹 執行 好 中央 的 決策 部署 ， 在 團結 奮鬥中 不斷 實現 廣大 居民 對 美好生活 的 嚮 往 。 並結合 澳門 實際 情況 談及 六點 體會 。         一 ： 全面 準確 貫徹         一是 全面 準確 貫徹 “ 一國 兩制 ” 方針 ， 築 牢維護 國家 安全 屏障 。 強調 居安思危 ， 未雨綢繆 。 澳門 特區 必須 牢牢 守住 安全 底線 ， 不斷 健全 維護國家 安全 的 制度 機制 ， 持續 提升 維護國家 安全 的 能力 水平 ， 鞏固築 牢維護 國家 安全 屏障 。 堅決 防範 和 遏制 外部 勢力 干 預澳門 事務 ， 防範 化解 金融 經濟 風險 ， 保持 澳門長 期 繁榮 穩定 的 良好 發展 態勢 。         二 ： 有效 落實 多元         二是 有效 落實 經濟 適度 多元 發展 規劃 ， 推動 澳門 經濟 高質量 發展 。 今年 是 全面 實施 經濟 適度 多元 發展 規劃 的 開局 之 年 ， 特區 政府 將 牢牢 把握 橫琴 開發 服務 澳門 經濟 適度 多元 發展 的 初心 ， 貫徹落 實習 主席 關於橫琴 開發 建設 的 重要 指示精神 ， 充分 發揮 “ 分線 管理 ” 特殊 監管 體制 帶來 的 優勢 ， 推動 更 多 創新 項目 落地 ， 加快 推進 澳琴 一體化 發展 ， 與 廣東省 以及 有關 方面 緊密 合作 ， 做好 橫琴 開發 這 篇文章 ， 就 深合區 實現 第一 階段 發展 目標 交出 滿意 答卷 。         三 ： 發揮 澳門 優勢         三是 充分 發揮 澳門 自身 優勢 ， 助力 國家 擴大 高水平 對外 開放 。 特區 政府 將以 中葡 論壇 （ 澳門 ） 第六 屆 部長 級 會議 為 抓手 ， 進 一步 強化 中葡 平台 功能 。 積極 參 與 和 助力 “ 一帶 一路 ” 建設 ， 推動粵 港澳 大灣區 高質量 發展 。 積極 參 與 和 舉辦 “ 中國 與 葡語 國家 企業 經貿 合作 洽談會 ” 等 系列 重要 活動 ， 辦好 澳門 國際 環保 合作 發展 論壇 、 國際 基礎 設施 投資 與 建設 高峰 論壇 等 重大 會展 活動 ， 充分 發揮 澳門 聯通國 內國際 兩個 市場 兩種 資源 的 平台 作用 。         四 ： 優化 民生 工作         四是 持續 優化 民生 工作 ， 穩步 增進 民生 福祉 。 特區 政府 將以 廣大 居民 較 關注 的 就業 、 醫療 、 住房 等作 重要 發力點 ， 全力 推進 各項 優化 社會 民生 工作 。 充分 發揮 社會 保障 措施 的 保底 作用 ， 切實 保障 本地 居民 優先 就業 。 發揮 澳門協 和 醫院 綜合 效能 ， 提升 本地 醫療 服務 水平 ， 關顧 居民 身心健康 。 關注 老齡化 問題 ， 優化長 者 服務 ， 積極 推動 落實 家庭 友善 政策 。 務實 推進 重大 基建工程 ， 加快 建設 宜居 智慧 綠色 澳門 。         五 ： 推進 行政 改革         五是 深入 推進 公共行政 改革 ， 全面提高 政府 施政 效能 。 特區 政府 將帶 頭學習 、 深刻 領會 “ 兩會 ” 精神 ， 加強 學習 理解 和 貫徹 實施 中央 重大 政策 方針 。 堅持 依法 施政 ， 不斷 增強 決策 和 政策 科學性 ， 努力 提升 政策 執行力 和 施政 效果 ， 積極 回應 居民 關切 。 繼續 以電 子政 務為 切入 點 ， 深入 推進 公共行政 改革 ， 構建 便民 便商 的 公共行政 服務體系 ， 持續 提升 公共 服務質 素及 效率 。 強化 施政 團隊 建設 ， 提高 公務人員 整體 素質 ， 加強 與 社會 溝通 互動 ， 提升 政府 整體 施政 效能 。 確保 行政 長 官選舉 嚴格 依法 、 公平 、 公正 和 廉潔地 進行 。         六 ： 壯大愛國 愛澳         六是 鞏固 壯大愛國 愛澳 力量 ， 維護 社會 大局 和諧 穩定 。 特區 政府 將鞏 固弘揚 愛國 愛澳 核心 價值 ， 不斷 深化 愛國 愛澳 教育 ， 支持 愛國 愛澳 社團 發揮 更 大 作用 ， 廣泛 團結 凝聚 廣大 居民 ， 發展 壯大愛國 愛澳 力量 ， 築牢 “ 一國 兩制 ” 行穩致 遠 的 社會 政治 基礎 。 厚植 青年一代 的 家國 情懷 ， 引領 更 多 青年 成長 成才 。         發展 新 成果 迎雙慶         賀一 誠 表示 ， 今年 是 澳門 回歸祖國 廿五 周年 ， 特區 政府 將 以此 為 契機 ， 團結 帶領 澳門 社會 各界 協同 奮進 ， 務實 有 為 ， 推動 特區 各項 事業 取得 新 進步 ， 推動 具澳門 特色 的 “ 一國 兩制 ” 實踐 取得 新 進展 。 以 繁榮 景象 、 喜慶氛 圍 和 新 的 發展 成果 迎接 新中國 七十五 周年 華誕 和 澳門 回歸祖國 廿五 周年 。,2024-03-14
