Title,Content,Link,Summary,Preprocessed_Content,Date
中俄白令海聯合空中巡航,中俄白令海聯合空中巡航    【本報綜合報道】據中新社、觀察者網廿五日消息：七月廿五日，國防部舉行例行記者會。針對中俄聯合空中戰略巡航一事，國防部新聞發言人張曉剛表示，根據中俄兩軍年度合作計劃，七月廿五日，雙方在白令海相關空域組織聯合空中戰略巡航。    有記者問，美國軍方廿四日表示，在阿拉斯加附近國際空域發現了兩架俄羅斯和兩架中國軍機，請發言人證實此次行動。另外，美國國防部近日發佈了《北極戰略》炒作中俄在北極區域加強合作，此次中俄聯合行動是否有針對性？    張曉剛指出，根據中俄兩軍年度合作計劃，七月廿五日，雙方在白令海相關空域組織聯合空中戰略巡航。這是自二○一九年以來兩軍聯合組織的第八次空中戰略巡航，進一步檢驗提升兩國空軍協作水平，深化兩軍戰略互信和務實合作。此次行動不針對第三方，符合國際法和國際實踐，與當前國際和地區局勢無關。    據報道，美國海軍將首次在日本部署F-35C戰機，由“華盛頓”號航母搭載，此外美國空軍也準備將駐日美軍的F-16替換為F-35A。有分析認為，此舉針對中國和俄羅斯，目的是保持美方空中優勢。    對此，張曉剛表示，我們注意到有關報道。近年來，美方持續推進亞太前沿軍事部署，損害他國安全利益，推高地區緊張局勢，我們對此堅決反對。我們希望美方摒棄陳舊的冷戰思維和地緣政治觀念，多做有利於世界與地區和平穩定的事情。    美加攔截中俄四機    此前，當地時間七月廿四日，北美防空司令部(NORAD)發佈公告稱，當天在美國阿拉斯加防空識別區(ADIZ)發現並追蹤了兩架俄羅斯“圖95”戰機和兩架中國“轟6”戰機。北美防空司令部表示，加拿大和美國的戰鬥機對這四架飛機“進行了攔截”。    北美防空司令部同時表示，中、俄戰機始終在國際空域，沒有進入美國或加拿大的主權空域，其活動不被視為威脅。北美防空司令部補充說，將繼續監視北美附近競爭對手的活動，並進行對抗。    北美防空司令部是由美國和加拿大共同組成的軍事機構，負責北美地區的空天預警和防禦任務。    西媒無需大驚小怪    就中俄戰機出現在阿拉斯加航空識別區一事，美國有線電視新聞網炒作稱，雖然俄羅斯戰機經常進入阿拉斯加防空識別區，但此次中俄戰機一同在此出現是種“新的發展”。    CNN報道還援引美國北方司令部和北美防空司令部司令葛列格里 · 吉洛特今年三月發表的言論，稱中國正進一步“向北推進”。他當時預計，“最快今年”就會看到中方在北極阿拉斯加地區的空中活動，聲稱“對此感到擔憂”。    軍事專家張軍社對觀察者網表示，西方媒體無需對此大驚小怪。    張軍社說，中俄的戰略巡航不針對第三方，與這個地區的安全形勢無關。此舉展示了我們維護全球戰略穩定的決心和能力，此外，通過這個行動，也提高了雙方的空中巡航和協同能力。對中國沒有不良企圖的國家不應該感到受到威脅，因此，北美防空司令部也沒有理由產生過激的危險反應。    美對識別區是雙標    美國軍方曾聲稱，不承認中方設立的防空識別區。張軍社表示，這是典型的雙標。因為美國是最早設立防空識別區的國家，而且美方所設防空識別區範圍最大。日本和韓國的防空識別區也是在美國的主導下設立的，還和中國防空識別區有所重疊。中國作為一個主權國家自然也可以設立防空識別區，美方對此的否認是其霸道思想的體現。    張軍社強調：“美方對中俄長年累月的抵近偵察才是風險源頭之一”。美國是全球最大的監控偵察國家，長期在世界各地開展情報活動。美國頻繁派艦機在中國周邊抵近偵察，嚴重危害中國國家安全，破壞地區和平穩定。    近期，美國在和菲律賓、日本等國在南海空中巡航時，頻頻聲稱其目的是為了制衡中國。張軍社指出，美方一再拿“航行自由”說事，在南海等地尋釁滋事，借此插手地區事務、維護美霸權。諷刺的是，美國至今並未加入《聯合國海洋法公約》，卻愛拿這個公約說事。美國的這種霸道行動恰恰是當前海上安全風險的源頭。,http://www.macaodaily.com/html/2024-07/26/content_1770508.htm,美加攔截中俄四機    此前，當地時間七月廿四日，北美防空司令部(NORAD)發佈公告稱，當天在美國阿拉斯加防空識別區(ADIZ)發現並追蹤了兩架俄羅斯“圖95”戰機和兩架中國“轟6”戰機,中 俄 白令海 聯合 空中 巡航         【 本報 綜合 報道 】 據 中新社 、 觀察者網 廿五日 消息 ： 七月 廿五日 ， 國 防部 舉行 例行 記者 會 。 針對 中 俄聯合 空中 戰略 巡航 一事 ， 國 防部 新聞 發言人 張曉剛 表示 ， 根據 中 俄 兩 軍 年度 合作 計劃 ， 七月 廿五日 ， 雙方 在 白令海 相關 空域 組織 聯合 空中 戰略 巡航 。         有 記者問 ， 美國 軍方 廿四日 表示 ， 在 阿拉斯加 附近 國際 空域 發現 了 兩架 俄羅斯 和 兩架 中國 軍機 ， 請 發言人 證實 此次 行動 。 另外 ， 美國國 防部 近日 發 佈 了 《 北極 戰略 》 炒作 中 俄 在 北極區域 加強 合作 ， 此次 中俄聯合 行動 是否 有針 對性 ？         張曉剛 指出 ， 根據 中 俄 兩 軍 年度 合作 計劃 ， 七月 廿五日 ， 雙方 在 白令海 相關 空域 組織 聯合 空中 戰略 巡航 。 這是 自二 ○ 一 九年 以來 兩軍聯合 組織 的 第八次 空中 戰略 巡航 ， 進 一步 檢驗 提升 兩國空 軍協作 水平 ， 深化 兩軍戰略 互信 和務實 合作 。 此次 行動 不針 對 第三方 ， 符合 國際法 和 國際 實踐 ， 與 當前 國際 和 地區 局勢 無關 。         據 報道 ， 美國海 軍將 首次 在 日本 部署 F - 35C 戰機 ， 由 “ 華盛頓 ” 號 航母 搭載 ， 此外 美國空 軍 也 準備 將駐 日美 軍 的 F - 16 替換 為 F - 35A 。 有 分析 認為 ， 此舉針 對 中國 和 俄羅斯 ， 目的 是 保持 美方 空中 優勢 。         對此 ， 張曉剛 表示 ， 我們 注意 到 有 關報 道 。 近年 來 ， 美方 持續 推進亞 太 前沿 軍事 部署 ， 損害 他國 安全 利益 ， 推 高地 區緊 張局 勢 ， 我們 對 此 堅決 反對 。 我們 希望 美方 摒棄 陳 舊 的 冷戰思維 和 地緣 政治 觀念 ， 多 做 有利於 世界 與 地區 和平 穩定 的 事情 。         美加 攔截 中 俄四機         此前 ， 當地 時間 七月 廿四日 ， 北美 防空 司令部 ( NORAD ) 發 佈 公告 稱 ， 當天 在 美國 阿拉斯加 防空 識別區 ( ADIZ ) 發現並 追 蹤 了 兩 架 俄 羅 斯 “ 圖 95 ” 戰機 和 兩架 中國 “ 轟 6 ” 戰機 。 北美 防空 司令部 表示 ， 加拿大 和 美國 的 戰鬥機 對 這 四架 飛機 “ 進行 了 攔截 ” 。         北美 防空 司令部 同時 表示 ， 中 、 俄戰 機始終 在 國際 空域 ， 沒有 進入 美國 或 加拿大 的 主權 空域 ， 其活動 不 被 視為 威脅 。 北美 防空 司令部 補充 說 ， 將繼續 監視 北美 附近 競爭 對 手 的 活動 ， 並進行 對 抗 。         北美 防空 司令部 是 由 美國 和 加拿大 共同 組成 的 軍事 機構 ， 負責 北美 地區 的 空天 預警 和 防禦 任務 。         西媒 無 需大 驚小怪         就 中 俄戰機 出現 在 阿拉斯加 航空 識別區 一事 ， 美國 有線 電視 新聞網 炒作 稱 ， 雖然 俄羅斯 戰機 經常 進入 阿拉斯加 防空 識別區 ， 但 此次 中俄戰機 一同 在 此 出現 是種 “ 新 的 發展 ” 。         CNN 報道還 援引 美國 北方 司令部 和 北美 防空 司令部 司令 葛列 格里   ·   吉洛特 今年 三月 發表 的 言論 ， 稱中國 正進 一步 “ 向北 推進 ” 。 他 當時 預計 ， “ 最快 今年 ” 就 會 看到 中方 在 北極 阿拉斯加 地區 的 空中 活動 ， 聲稱 “ 對此 感到 擔憂 ” 。         軍事 專家 張軍社 對 觀察者網 表示 ， 西方 媒體 無 需 對 此大 驚小怪 。         張軍社 說 ， 中 俄 的 戰略 巡航 不針 對 第三方 ， 與 這個 地區 的 安全 形勢 無關 。 此舉 展示 了 我們 維護 全球 戰略 穩定 的 決心 和 能力 ， 此外 ， 通過 這個 行動 ， 也 提高 了 雙方 的 空中 巡航 和 協同 能力 。 對 中國 沒有 不良 企圖 的 國家 不應 該 感到 受到 威脅 ， 因此 ， 北美 防空 司令部 也 沒 有 理由 產生 過激 的 危險 反應 。         美對識 別區 是 雙標         美國 軍方 曾 聲稱 ， 不承認 中方 設立 的 防空 識別區 。 張軍社 表示 ， 這是 典型 的 雙標 。 因為 美國 是 最早 設立 防空 識別區 的 國家 ， 而且 美方 所設 防空 識別區 範圍 最大 。 日本 和 韓國 的 防空 識別區 也 是 在 美國 的 主導下 設立 的 ， 還和中國 防空 識別區 有所 重疊 。 中國作 為 一個 主權 國家 自然 也 可以 設立 防空 識別區 ， 美方 對此 的 否認 是 其 霸道 思想 的 體現 。         張軍社 強調 ： “ 美方 對 中 俄長 年 累 月 的 抵近 偵察才 是 風險源頭 之一 ” 。 美國 是 全球 最大 的 監控 偵察國家 ， 長 期 在 世界各地 開展 情報 活動 。 美國頻 繁派 艦機 在 中國 周邊 抵近 偵察 ， 嚴重 危害 中國國家 安全 ， 破壞 地區 和平 穩定 。         近期 ， 美國 在 和 菲律賓 、 日本 等國 在 南海 空中 巡航 時 ， 頻頻 聲稱 其 目的 是 為 了 制衡 中國 。 張軍社 指出 ， 美方 一再 拿 “ 航行 自由 ” 說事 ， 在 南海 等 地 尋釁 滋事 ， 借此 插手 地區 事務 、 維護 美霸權 。 諷刺 的 是 ， 美國 至今 並未 加入 《 聯合國 海洋法 公約 》 ， 卻 愛拿 這個 公約 說 事 。 美國 的 這種 霸道 行動 恰恰 是 當前 海上 安全 風險 的 源頭 。,2024-07-26
福建艦第三次海試？,福建艦第三次海試？    【本報訊】據國防部網站廿五日消息：近日，多家外媒報道稱，中國第三艘航母福建艦在本月進行了第三次海試。廿五日下午，國防部新聞發言人張曉剛在例行記者會上回答中國日報記者提問時表示，海試是航母建造過程中的正常安排，後續還將根據航母建造的進展情況，逐步展開後續試驗項目。    想嚇中方癡心妄想    此外，有報道指出，“環太平洋二○二四”軍演在夏威夷周邊舉行，其中一個科目是擊沉四萬噸兩棲攻擊艦，有分析認為這是向中國示威之舉。美參聯會主席布朗近日稱，若中美因台灣問題爆發衝突，對擊敗中國“信心十足”。    對此，張曉剛表示，我們注意到有關報道。他說，如果想拿軍演來嚇唬中方，或者對中方搞虛言恫嚇，那完全是癡心妄想。中國軍隊歷來不信邪、不怕鬼、不怕壓，有決心、有能力、有手段打敗一切侵犯之敵，捍衛國家主權、安全和發展利益。,http://www.macaodaily.com/html/2024-07/26/content_1770518.htm,廿五日下午，國防部新聞發言人張曉剛在例行記者會上回答中國日報記者提問時表示，海試是航母建造過程中的正常安排，後續還將根據航母建造的進展情況，逐步展開後續試驗項目,福建 艦 第三次 海試 ？         【 本報 訊 】 據國 防部 網站 廿五日 消息 ： 近日 ， 多家 外媒報 道 稱 ， 中國 第三艘 航母 福建 艦 在 本月 進行 了 第三次 海試 。 廿五日 下午 ， 國 防部 新聞 發言人 張曉剛 在 例行 記者 會 上 回答 中國 日報 記者 提問 時 表示 ， 海試 是 航母 建造 過程 中 的 正常 安排 ， 後 續 還將 根據 航母 建造 的 進展 情況 ， 逐步 展開後續 試驗 項目 。         想嚇 中方 癡 心 妄想         此外 ， 有 報道 指出 ， “ 環 太平洋 二 ○ 二四 ” 軍演 在 夏威夷 周邊 舉行 ， 其中 一個 科目 是擊 沉四萬噸 兩棲 攻擊艦 ， 有 分析 認為 這是 向 中國 示威 之舉 。 美參聯會 主席 布朗 近日 稱 ， 若 中美因 台灣 問題 爆發 衝突 ， 對擊敗 中國 “ 信心十足 ” 。         對此 ， 張曉剛 表示 ， 我們 注意 到 有 關報 道 。 他 說 ， 如果 想 拿 軍 演來 嚇唬 中方 ， 或者 對 中方 搞虛言 恫嚇 ， 那 完全 是 癡 心 妄想 。 中國 軍隊 歷來 不信邪 、 不怕 鬼 、 不怕 壓 ， 有 決心 、 有 能力 、 有 手段 打敗 一切 侵犯 之敵 ， 捍衛國 家主 權 、 安全 和 發展 利益 。,2024-07-26
國防部：美是名副其實“謊言帝國”,國防部：美是名副其實“謊言帝國”    【本報駐北京記者鐵怡廿五日電】據報道，美國海軍陸戰隊近日首次發佈名為《欺騙》的條令，其核心包括如何利用欺騙來對付敵人、製作虛假情報資訊等。對此，國防部新聞局副局長、國防部新聞發言人張曉剛大校今日在國防部舉行的例行記者會上表示，美國早已成為名副其實的“謊言帝國”，應立即糾正錯誤做法，停止散佈虛假資訊。    張曉剛指出，美國的欺騙行為不僅存在於軍事領域，實際上已深入其骨髓之中，為一己私利什麼謊言都敢編，早已成為名副其實的“謊言帝國”。    他表示，從冷戰時期發起“知更鳥計劃”收買媒體操縱輿論，到借“洗衣粉”、“白頭盔”對伊拉克、敘利亞發動侵略戰爭，再到編造“世紀謊言”污蔑中國治疆政策，在菲律賓等國開展抹黑中國疫苗虛假資訊行動等，美國欺詐成性、造謠毫無底線，正加速其信譽破產。    他說，需要指出的是，騙得了一時，騙不了一世。美方應立即糾正錯誤做法，停止散佈虛假資訊，停止以謊言蠱惑世人、污蔑抹黑他國，盡快就其欺騙行徑給國際社會明明白白的交代。,http://www.macaodaily.com/html/2024-07/26/content_1770520.htm,對此，國防部新聞局副局長、國防部新聞發言人張曉剛大校今日在國防部舉行的例行記者會上表示，美國早已成為名副其實的“謊言帝國”，應立即糾正錯誤做法，停止散佈虛假資訊,國 防部 ： 美是 名 副 其實 “ 謊言 帝國 ”         【 本報 駐 北京 記者 鐵怡 廿五日 電 】 據 報道 ， 美國海 軍陸 戰隊 近日 首次 發 佈 名為 《 欺騙 》 的 條令 ， 其 核心 包括 如何 利用 欺騙 來 對付 敵人 、 製 作 虛 假 情 報 資 訊 等 。 對此 ， 國 防部 新聞局 副 局長 、 國 防部 新聞 發言人 張曉剛 大校 今日 在國 防部 舉行 的 例行 記者 會 上 表示 ， 美國 早已 成為 名 副 其實 的 “ 謊言 帝國 ” ， 應 立即 糾正 錯誤 做法 ， 停止 散 佈 虛假 資訊 。         張曉剛 指出 ， 美國 的 欺騙 行為 不僅 存在 於 軍事 領域 ， 實際 上 已 深入 其 骨髓 之中 ， 為 一己 私利 什麼 謊言 都 敢編 ， 早已 成為 名 副 其實 的 “ 謊言 帝國 ” 。         他 表示 ， 從 冷戰 時期 發起 “ 知 更 鳥 計劃 ” 收買 媒體 操縱 輿論 ， 到 借 “ 洗衣粉 ” 、 “ 白頭 盔 ” 對 伊拉克 、 敘利亞 發動 侵略 戰爭 ， 再到 編造 “ 世紀 謊言 ” 污蔑 中國治疆 政策 ， 在 菲律賓 等 國開展 抹黑 中國 疫苗 虛假 資訊 行動 等 ， 美國 欺詐 成性 、 造謠 毫無底 線 ， 正 加速 其信譽 破產 。         他 說 ， 需要 指出 的 是 ， 騙得 了 一時 ， 騙 不了 一世 。 美方 應 立即 糾正 錯誤 做法 ， 停止 散 佈 虛假 資訊 ， 停止 以謊 言 蠱惑 世人 、 污蔑 抹黑 他國 ， 盡快 就 其 欺騙 行徑 給國際 社會 明明白白 的 交代 。,2024-07-26
華：北約是“戰亂播種機”,華：北約是“戰亂播種機”    【本報駐北京記者鐵怡廿五日電】在廿五日的中國國防部例行記者會上，新聞發言人張曉剛表示，北約就是一部“戰亂播種機”，應反躬自省，而不是向中方甩鍋推責。    當天有記者就北約近日發佈《華盛頓峰會宣言》提問。張曉剛表示，這份《宣言》散佈好戰言論，對中方進行無端指責，充滿了謊言與偏見、煽動與抹黑，中方對此強烈不滿、堅決反對。    張曉剛指出，近年來，北約持續向亞太地區伸黑手，把矛頭指向中國，誘拉一些地區國家隨其起舞，搞陣營對抗、製造分裂。北約就是一部“戰亂播種機”，從烏克蘭到阿富汗、從伊拉克到利比亞，給地區和人民帶去戰火災難。歷史證明，製造分裂對抗不得人心，黷武擴張是自取滅亡之道。    張曉剛說，在烏克蘭問題上，中方一貫秉持客觀公正立場，積極勸和促談，得到了國際社會的廣泛認同。反而是以美國為首的北約國家一味火上澆油、借機大發戰爭財。北約應反躬自省，而不是向中方甩鍋推責。    這位發言人指出，中國是世界和平的建設者、全球發展的貢獻者、國際秩序的維護者，中國軍隊始終做維護世界與地區和平穩定的堅定力量。“我們敦促北約不要干涉中國內政、不要挑戰中方正當權益、不要抹黑中國內外政策，否則只會搬起石頭砸自己的腳。”,http://www.macaodaily.com/html/2024-07/26/content_1770521.htm,華：北約是“戰亂播種機”    【本報駐北京記者鐵怡廿五日電】在廿五日的中國國防部例行記者會上，新聞發言人張曉剛表示，北約就是一部“戰亂播種機”，應反躬自省，而不是向中方甩鍋推責,華 ： 北約 是 “ 戰亂播 種機 ”         【 本報 駐 北京 記者 鐵怡 廿五日 電 】 在 廿五日 的 中國國 防部 例行 記者 會 上 ， 新聞 發言人 張曉剛 表示 ， 北約 就是 一部 “ 戰亂播 種機 ” ， 應 反躬自省 ， 而 不是 向 中方 甩鍋 推責 。         當天 有 記者 就 北約 近日 發 佈 《 華盛 頓峰會 宣言 》 提問 。 張曉剛 表示 ， 這份 《 宣言 》 散 佈 好 戰言論 ， 對 中方 進行 無端 指責 ， 充滿 了 謊言 與 偏見 、 煽動 與 抹黑 ， 中方 對此 強烈 不滿 、 堅決 反對 。         張曉剛 指出 ， 近年 來 ， 北約 持續 向 亞太地區 伸 黑手 ， 把 矛頭 指向 中國 ， 誘拉 一些 地區 國家 隨其 起舞 ， 搞陣營 對 抗 、 製 造 分裂 。 北約 就是 一部 “ 戰亂播 種機 ” ， 從 烏克蘭到 阿富汗 、 從 伊拉克 到 利比 亞 ， 給地區 和 人民 帶去 戰火 災難 。 歷史 證明 ， 製 造 分裂 對抗 不得人心 ， 黷武 擴張 是 自取 滅亡 之道 。         張曉剛 說 ， 在 烏克蘭 問題 上 ， 中方 一貫 秉持 客觀 公正 立場 ， 積極 勸 和 促談 ， 得到 了 國際 社會 的 廣泛 認同 。 反而 是 以 美國 為 首 的 北約 國家 一味 火上 澆油 、 借機 大 發戰 爭財 。 北約 應 反躬自省 ， 而 不是 向 中方 甩鍋 推責 。         這位 發言人 指出 ， 中國 是 世界 和平 的 建設者 、 全球 發展 的 貢獻者 、 國際 秩序 的 維護者 ， 中國 軍隊 始終 做維護 世界 與 地區 和平 穩定 的 堅定 力量 。 “ 我們 敦促 北約 不要 干涉 中國 內政 、 不要 挑戰 中方 正當 權益 、 不要 抹黑 中國 內外 政策 ， 否則 只會 搬起 石頭 砸 自己 的 腳 。 ”,2024-07-26
華：濫施制裁解決不了半島問題,美國制裁中國個人和公司    華：濫施制裁解決不了半島問題    【本報綜合報道】據中新社北京廿五日電：針對美國財政部宣佈對中國六名個人和五家公司實施制裁，中國外交部發言人毛寧廿五日在例行記者會上表示，中方反對非法單邊制裁，濫施制裁解決不了半島問題。    有記者提問，美國財政部周三宣佈對中國六名個人和五家公司實施制裁，指控他們違反聯合國安理會決議，支持朝鮮彈道導彈和太空項目。中方對此有何回應？    毛寧表示，中方一貫認真執行安理會決議，履行自身國際義務，致力於維護半島和平穩定。我們反對非法單邊制裁，濫施制裁也解決不了半島問題。    據外媒報道，美國財政部指控該基於中國由六人和五家實體組成的網絡幫助購買已知用於朝鮮導彈生產的金屬板等物品。    被加入制裁清單的五家實體是：北京京華啟迪電子科技有限公司、北京三順達電子科技有限公司、啟東市衡成電子廠、深圳市明緯電器有限公司，以及意達通天津金屬材料有限公司。    消息稱，朝鮮的彈道導彈和太空項目依賴國外採購的材料和部件，而國內無法生產。為了採購這些材料和零部件，朝鮮利用廣泛的海外採購代理網絡，其中包括朝鮮外交使團或貿易辦事處的官員以及第三國國民。    美國財政部還聲稱，朝鮮還利用外資公司購買物品以支援其彈道導彈和武器生產。這些公司對物品進行整合和重新包裝，然後運往朝鮮，向物品的製造商和分銷商隱瞞真正的最終用戶。,http://www.macaodaily.com/html/2024-07/26/content_1770523.htm,美國制裁中國個人和公司    華：濫施制裁解決不了半島問題    【本報綜合報道】據中新社北京廿五日電：針對美國財政部宣佈對中國六名個人和五家公司實施制裁，中國外交部發言人毛寧廿五日在例行記者會上表示，中方反對非法單邊制裁，濫施制裁解決不了半島問題,美國 制裁 中國個 人 和 公司         華 ： 濫施 制裁 解決 不了 半島 問題         【 本報 綜合 報道 】 據 中新社 北京 廿五日 電 ： 針對 美國 財政部 宣 佈 對 中國 六名 個 人 和 五家 公司 實施 制裁 ， 中國 外交部 發言人 毛寧 廿五日 在 例行 記者 會 上 表示 ， 中方 反對 非法 單邊 制裁 ， 濫施 制裁 解決 不了 半島 問題 。         有 記者 提問 ， 美國 財政部 周三 宣 佈 對 中國 六名 個 人 和 五家 公司 實施 制裁 ， 指控 他們 違反 聯合 國安理會 決議 ， 支持 朝鮮彈 道 導彈 和 太空 項目 。 中方 對此 有何 回應 ？         毛寧 表示 ， 中方 一貫 認真 執行 安理會 決議 ， 履行 自身 國際義務 ， 致力 於 維護 半島 和平 穩定 。 我們 反對 非法 單邊 制裁 ， 濫施 制裁 也 解決 不了 半島 問題 。         據外 媒報 道 ， 美國 財政部 指控 該基 於 中國 由六人 和 五家 實體 組成 的 網絡 幫助 購買 已知 用 於 朝 鮮導彈 生產 的 金屬 板 等 物品 。         被 加入 制裁 清單 的 五家 實體 是 ： 北京 京華 啟迪電子 科技 有限公司 、 北京 三順達 電子 科技 有限公司 、 啟東市 衡成 電子 廠 、 深圳市 明緯 電器 有限公司 ， 以及 意達通 天津 金屬 材料 有限公司 。         消息 稱 ， 朝鮮 的 彈道 導彈 和 太空 項目 依賴國外 採購 的 材料 和 部件 ， 而國 內無法 生產 。 為 了 採購 這些 材料 和 零部件 ， 朝鮮 利用 廣泛 的 海外 採購 代理 網絡 ， 其中 包括 朝鮮 外交 使團 或 貿易 辦事處 的 官員 以及 第三 國國民 。         美國 財政部 還聲 稱 ， 朝鮮還 利用 外資 公司 購買 物品 以 支援 其彈 道 導彈 和 武器 生產 。 這些 公司 對 物品 進行 整合 和 重新 包裝 ， 然後運往 朝鮮 ， 向 物品 的 製 造 商 和 分 銷 商 隱 瞞 真正 的 最終 用戶 。,2024-07-26
中美交流,中美交流,http://www.macaodaily.com/html/2024-07/26/content_1770524.htm,中美交流,中 美 交流,2024-07-26
