Title,Content,Link,Summary,Preprocessed_Content,Date
金門民代聯署建廈金大橋,金門民代聯署建廈金大橋    【香港中通社六日電】金門縣議會“跨黨派問政聯盟政團”與“無黨籍聯盟政團”本月五日號召全縣議員及民意代表，一起響應建請民進黨當局支持“廈金大橋”修建以及“金門縣為非軍事區”的聯署活動。獲得幾乎全部民意代表支持，超過百位基層民代聯署簽名。    據台媒報道，金門縣議會“跨黨派問政聯盟”、“無黨籍聯盟政團”五日提出“廈金大橋”、“非軍事區”相關議題，邀集金門縣代表、村里長向當局發聲喊話。聯署簽名破百人，並將交往台行政機構以及立法部門，希望當局能聽見金門鄉親訴求。    陸水供金六周年    金門縣議會“跨黨派問政聯盟”召集人陳泱瑚表示，兩政團主要訴求在於，全力支持“廈金大橋”建設以及持續倡議將金門縣設為非軍事區試點。    陳泱瑚表示，“陸水供金”工程造福金門鄉親，解決當地長期用水困難的問題，五日正逢“兩岸通水”六周年紀念日，希望未來兩岸能在通水合作的基礎上，進一步開啟“通電”、“通橋”、“通氣”等民生建設，為金門融合發展打下基礎。    對大陸已經宣告啟動“廈金大橋”工程興建，陳泱瑚也表示，自兩岸“小三通”正式啟動後，兩岸人民生活更為密切，經濟生活圈逐漸擴大，盼民進黨當局能以“民生為本”，在兩岸和平穩定發展的前提下，共同合力讓“廈金大橋”建設早日實現。    籲列非軍事試點    金門縣議會兩政團也持續倡議設立“金門縣為非軍事區”試點，陳泱瑚表示，金門歷經抗日戰爭、金門戰鬥、“九　·　三”炮戰（一九五四年）、金門炮戰（一九五八年起），深刻認識到戰爭殘酷無情，呼籲當局將金門作為非軍事試點，讓鄉親安居樂業。    台灣文化大學副教授劉性仁肯定金門鄉親的聯署活動，認為民進黨當局不妨聽取金門鄉親訴求，從善如流。他認為，就民進黨當局堅持“兩國論”立場來看“非軍事區”可行性不大，但仍希望金門鄉親能夠過好生活，讓金門承負兩岸經濟建設合作之先試重任。,http://www.macaodaily.com/html/2024-08/07/content_1773097.htm,金門民代聯署建廈金大橋    【香港中通社六日電】金門縣議會“跨黨派問政聯盟政團”與“無黨籍聯盟政團”本月五日號召全縣議員及民意代表，一起響應建請民進黨當局支持“廈金大橋”修建以及“金門縣為非軍事區”的聯署活動,金門民代 聯署 建廈 金大橋         【 香港 中通社 六日 電 】 金門縣 議會 “ 跨黨 派 問政聯盟 政團 ” 與 “ 無黨籍 聯盟 政團 ” 本月 五日 號召 全縣 議員及 民意代表 ， 一起 響應 建請民 進黨 當局 支持 “ 廈金大橋 ” 修建 以及 “ 金門縣 為 非 軍事區 ” 的 聯署 活動 。 獲得 幾乎 全部 民意代表 支持 ， 超過 百位 基層 民代聯署 簽名 。         據台 媒報 道 ， 金門縣 議會 “ 跨黨 派 問政聯盟 ” 、 “ 無黨籍 聯盟 政團 ” 五日 提出 “ 廈金大橋 ” 、 “ 非軍事區 ” 相關 議題 ， 邀集 金門縣 代表 、 村里 長 向 當局 發聲 喊 話 。 聯署 簽名 破百 人 ， 並將 交往 台 行政 機構 以及 立法 部門 ， 希望 當局 能 聽 見 金門 鄉 親訴 求 。         陸水供 金 六周年         金門縣 議會 “ 跨黨 派 問政聯盟 ” 召集人 陳 泱瑚 表示 ， 兩政團 主要 訴求 在 於 ， 全力支持 “ 廈金大橋 ” 建設 以及 持續 倡議 將金門 縣 設為 非軍事區 試點 。         陳 泱瑚 表示 ， “ 陸水供 金 ” 工程 造福 金門 鄉親 ， 解決 當地長 期 用水 困難 的 問題 ， 五日 正逢 “ 兩岸 通水 ” 六周年 紀念 日 ， 希望 未來 兩岸 能 在 通水 合作 的 基礎 上 ， 進 一步 開啟 “ 通電 ” 、 “ 通橋 ” 、 “ 通氣 ” 等 民生 建設 ， 為 金門 融合 發展 打下 基礎 。         對大陸 已經 宣告 啟動 “ 廈金大橋 ” 工程 興建 ， 陳 泱瑚 也 表示 ， 自兩岸 “ 小三通 ” 正式 啟動 後 ， 兩岸 人民 生活 更為 密切 ， 經濟 生活圈 逐漸 擴大 ， 盼民 進黨 當局 能 以 “ 民生 為本 ” ， 在 兩岸 和平 穩定 發展 的 前提 下 ， 共同 合力 讓 “ 廈金大橋 ” 建設 早日 實現 。         籲列 非軍事 試點         金門縣 議會 兩政團 也 持續 倡議 設立 “ 金門縣 為 非 軍事區 ” 試點 ， 陳 泱瑚 表示 ， 金門 歷經 抗日 戰爭 、 金門 戰鬥 、 “ 九 　 · 　 三 ” 炮戰 （ 一九五四年 ） 、 金門 炮戰 （ 一九五八年 起 ） ， 深刻 認識 到 戰爭 殘酷 無情 ， 呼籲 當局 將金門 作為 非軍事 試點 ， 讓 鄉親 安居 樂業 。         台灣 文化 大學 副教授 劉性仁 肯定 金門 鄉親 的 聯署 活動 ， 認為民 進黨 當局 不妨 聽取 金門 鄉 親訴 求 ， 從善 如流 。 他 認為 ， 就民 進黨 當局 堅持 “ 兩國論 ” 立場 來 看 “ 非軍事區 ” 可行性 不 大 ， 但 仍 希望 金門 鄉親 能夠 過好 生活 ， 讓 金門 承負 兩岸 經濟 建設 合作 之先試 重任 。,2024-08-07
台類鼻疽暴增十一例,死亡率可達七成五    台類鼻疽暴增十一例    【本報訊】據中時新聞網六日消息：颱風“格美”七月重創台灣中南部，超過六縣市嚴重淹水，引發類鼻疽疫情。台疾管部門今天發出醫界通函，指出颱風後本地類鼻疽暴增十一例，其中三人住進加護病房，今年累計十八例，創五年同期新高。疾管部門表示，國際上報告類鼻疽死亡率可達四成至七成五，死亡率極高。    五年同期新高    疾管部門發言人羅一鈞表示，類鼻疽於“格美”後本地病例暴增十一例，高雄八例、台南兩例、嘉義縣一例，均為散發個案，無群聚，十例有慢性病，另一例有酗酒史，十一人均住院其中三人住加護病房。    羅一鈞表示，今年類鼻疽累計十八例，已創五年同期新高，因類鼻疽最常於颱風後兩到四周發病，預估至八月下旬為確診高峰，今再度發出醫界通函提醒醫師注意類鼻疽診治。    颱風後現疫情    羅一鈞表示，類鼻疽是島內第四類法定傳染病，主要透過皮膚傷口接觸土壤或污水而感染，也可因吸入、食入塵土或污水而感染，颱風後疫情常為吸入性感染，於颱風後一個月內確診增加。    疾管部門表示，國際上報告類鼻疽死亡率可達四成至七成五，島內統計近五年類鼻疽死亡率則為百分之四點五。常見的病徵包括發燒、頭痛、局部腫痛、潰瘍、胸痛、咳嗽、咳血及淋巴結腫大，可導致皮膚膿腫、肺炎、腦炎、敗血症，需盡速以適當抗生素治療。    料下旬達高峰    疾管部門統計，島內先前最大類鼻疽疫情為二○○五年“海棠”及“泰利”颱風後於南部二仁溪流域累計確診四十二例，其中八例死亡。    羅一鈞表示，預估類鼻疽個案到八月下旬還會增加，並達最高峰，累計病例可能追平上一次強颱風“海棠”造成四十二例確診的紀錄。特別提醒包括雲林、嘉義、台南、高雄、屏東等南部縣市特別注意災後疫情。,http://www.macaodaily.com/html/2024-08/07/content_1773098.htm,羅一鈞表示，今年類鼻疽累計十八例，已創五年同期新高，因類鼻疽最常於颱風後兩到四周發病，預估至八月下旬為確診高峰，今再度發出醫界通函提醒醫師注意類鼻疽診治,死亡率 可達 七成 五         台類 鼻疽 暴增 十一 例         【 本報 訊 】 據 中時 新聞網 六日 消息 ： 颱 風 “ 格美 ” 七月 重創 台灣 中南部 ， 超過 六縣 市 嚴重 淹水 ， 引發類 鼻疽 疫情 。 台疾管 部門 今天 發出 醫界 通函 ， 指出 颱 風 後 本地 類 鼻疽 暴增 十一 例 ， 其中 三人住 進加護 病房 ， 今年 累計 十八 例 ， 創 五年 同期 新高 。 疾管 部門 表示 ， 國際上 報告類 鼻疽 死亡率 可達 四成 至 七成 五 ， 死亡率 極高 。         五年 同期 新高         疾管 部門 發言 人羅一鈞 表示 ， 類 鼻疽 於 “ 格美 ” 後 本地 病例 暴增 十一 例 ， 高雄八例 、 台南 兩例 、 嘉義縣 一例 ， 均 為 散 發個案 ， 無 群聚 ， 十例 有 慢性病 ， 另 一例 有 酗酒 史 ， 十一 人均 住院 其中 三人住 加護 病房 。         羅 一鈞 表示 ， 今年 類 鼻疽 累計 十八 例 ， 已創 五年 同期 新高 ， 因類 鼻疽 最常 於 颱 風後兩到 四周 發病 ， 預估 至 八月 下旬 為 確診 高峰 ， 今 再度 發出 醫界 通函 提醒 醫師 注意 類 鼻疽 診治 。         颱 風後現 疫情         羅 一鈞 表示 ， 類 鼻疽 是 島內 第四 類 法定 傳 染病 ， 主要 透過 皮膚 傷口 接觸 土壤 或 污水 而 感染 ， 也 可 因 吸入 、 食入 塵土 或 污水 而 感染 ， 颱 風 後 疫情 常為 吸入性 感染 ， 於 颱 風後一個 月 內 確診 增加 。         疾管 部門 表示 ， 國際上 報告類 鼻疽 死亡率 可達 四成 至 七成 五 ， 島內 統計近 五年 類 鼻疽 死亡率 則為 百分之四 點五 。 常見 的 病徵 包括 發燒 、 頭痛 、 局部 腫痛 、 潰瘍 、 胸痛 、 咳嗽 、 咳血 及 淋巴 結腫 大 ， 可導致 皮膚 膿腫 、 肺炎 、 腦炎 、 敗 血症 ， 需盡速 以 適當 抗生素 治療 。         料 下旬 達 高峰         疾管 部門 統計 ， 島內 先前 最大 類 鼻疽 疫情 為 二 ○ ○ 五年 “ 海棠 ” 及 “ 泰利 ” 颱 風 後 於 南部 二仁溪 流域 累計 確診 四十二 例 ， 其中 八例 死亡 。         羅 一鈞 表示 ， 預估類 鼻疽 個案 到 八月 下旬 還會 增加 ， 並達 最高峰 ， 累計 病例 可能 追平 上 一次 強 颱 風 “ 海棠 ” 造成 四十二 例確 診 的 紀錄 。 特別 提醒 包括 雲林 、 嘉義 、 台南 、 高雄 、 屏東 等 南部 縣市 特別 注意 災後 疫情 。,2024-08-07
輕生問題困擾台軍   魯  木,輕生問題困擾台軍    據台媒報道，台審計部門披露，台軍近五年自傷人數合計一百五十八人，其中自傷致死九十七人，輕生成為台軍意外事故死因首位。二○二三年有六人自傷身亡，首度超過車禍死亡人數，成為台軍死亡原因之首。今年一月至五月，自傷致死人數已高達十三人。相較二○二三年同期的十二人（死亡六人），自傷案件和死亡人數均陡增。    據台媒此前報道，為降低台軍自傷發生率，台當局防務部門在二○一二年成立了“自殺防治中心”，並於二○一六年將“零自傷”設為目標。然而，台軍自傷案件依舊頻傳。就連民進黨籍民代林岱樺近日也不得不承認，儘管台防務部門強調建立了所謂周全的“三級自殺防處機制”，事實證明這套機制淪為口號。輿論認為，心理問題得不到重視與疏解，被蠱惑蒙蔽後看破真相的不甘利用，是造成台軍自傷甚至輕生的直接與根本原因。    民進黨當局自蔡英文上台以來，堅持“台獨”立場，“倚美抗陸”、“以武謀獨”，製造兩岸對立，不斷升高台海緊張局勢，挑動兩岸軍事對抗和軍事競賽，本應可繼續在和平穩定環境下成長生活的台灣青年，被民進黨當局帶入兵凶戰危險境，面對突如其來的冷酷軍事訓練和繁重的執勤任務，壓力陡增，心理預期和現實巨大落差，悲觀厭世，走上絕路。民進黨謀“獨”挑釁，才是台軍眾多自傷案背後真正的罪魁禍首。    魯  木,http://www.macaodaily.com/html/2024-08/07/content_1773099.htm,輕生問題困擾台軍    據台媒報道，台審計部門披露，台軍近五年自傷人數合計一百五十八人，其中自傷致死九十七人，輕生成為台軍意外事故死因首位,輕生 問題 困擾 台 軍         據台 媒報 道 ， 台 審計 部門 披露 ， 台軍近 五年 自傷 人數 合計 一百五十 八人 ， 其中 自傷 致死 九十七 人 ， 輕 生成 為 台 軍 意外事故 死因 首位 。 二 ○ 二三年 有六人 自傷 身亡 ， 首度 超過 車禍 死亡 人數 ， 成為 台 軍 死亡 原因 之 首 。 今年 一月 至 五月 ， 自傷 致死 人數 已 高達 十三 人 。 相較 二 ○ 二三年 同期 的 十二 人 （ 死亡 六人 ） ， 自傷 案件 和 死亡 人數 均 陡增 。         據 台媒 此前 報道 ， 為 降低 台軍自傷 發生率 ， 台當局 防務部門 在 二 ○ 一二年 成立 了 “ 自殺 防治 中心 ” ， 並於二 ○ 一 六年 將 “ 零自傷 ” 設為 目標 。 然而 ， 台軍自傷 案件 依舊 頻傳 。 就 連民進 黨籍 民代林 岱 樺 近日 也 不得不 承認 ， 儘 管 台 防 務 部 門 強 調 建立 了 所謂 周全 的 “ 三級 自殺 防處 機制 ” ， 事實 證明 這套 機制 淪為 口號 。 輿論 認為 ， 心理 問題 得不到 重視 與 疏解 ， 被 蠱惑 蒙蔽 後 看破 真相 的 不甘 利用 ， 是 造成 台軍自傷 甚至 輕生 的 直接 與 根本原因 。         民進 黨 當局 自 蔡 英文 上台 以來 ， 堅持 “ 台獨 ” 立場 ， “ 倚美 抗陸 ” 、 “ 以 武謀獨 ” ， 製 造 兩 岸 對 立 ， 不斷 升高 台海 緊張 局勢 ， 挑動 兩岸 軍事 對 抗 和 軍事 競賽 ， 本應 可繼續 在 和平 穩定 環境 下 成長 生活 的 台灣 青年 ， 被民 進黨 當局 帶入 兵 凶戰 危險境 ， 面對 突 如其 來 的 冷酷 軍事 訓練 和 繁重 的 執勤 任務 ， 壓力 陡增 ， 心理 預期 和 現實 巨大 落差 ， 悲觀 厭世 ， 走上 絕路 。 民進 黨謀 “ 獨 ” 挑釁 ， 才 是 台 軍眾 多 自傷案 背 後 真正 的 罪魁 禍首 。         魯     木,2024-08-07
高雄公廁色魔改判囚兩年,高雄公廁色魔改判囚兩年    【本報訊】據中時新聞網六日消息：高雄左營蓮池潭去年二月林姓男子尾隨女子小華（化名）進入公廁，對其猥褻。橋頭地院審理後，認罪證不足，判決林男無罪，檢方不服上訴，二審高雄高分院認定林男涉案，依強制猥褻罪改判兩年徒刑，可上訴。    女子如廁遭性虐    檢方指出，去年二月一日凌晨一時許，林男發現小華獨自步行於蓮池潭水域運動中心，尾隨小華進入蓮池潭兒童公園的無性別公廁，趁小華如廁之際，林男拉開公廁廁門，小華見狀急忙呼喊“救命”，但林男不予理會，強行環抱並扯下對方身上圍巾、外套、上衣等。小華想找機會掙脫往外跑，但林男將其拉進公廁，以強暴方式強制猥褻得逞，導致小華頭部、胸部及四肢受到鈍挫傷。    嫌犯一審判無罪    林男猥褻得逞後離去，小華隨即跑到派出所報案，警方循線拘提林男到案說明，並依強制猥褻罪移送橋頭地檢署。橋頭地院審理時，林男否認犯行，指稱自己只是剛好到蓮池潭附近工作，小華指控的犯嫌並不是他，橋頭地院檢視檢警所提證據，認為無法確認林男就是嫌疑人，以罪證不足為由，一審判決林男無罪。    檢方不服提出上訴，高雄高分院依據監視器畫面，認為林男案發時穿着的衣物與小華指控相符，且林男當天遇警方盤查時，穿着衣物也與犯嫌有高度相似性，加上林男行經路線與猥褻小華的犯嫌路線高度脗合，認定林男就是犯嫌，二審逆轉改判兩年徒刑，可上訴。,http://www.macaodaily.com/html/2024-08/07/content_1773100.htm,檢方不服提出上訴，高雄高分院依據監視器畫面，認為林男案發時穿着的衣物與小華指控相符，且林男當天遇警方盤查時，穿着衣物也與犯嫌有高度相似性，加上林男行經路線與猥褻小華的犯嫌路線高度脗合，認定林男就是犯嫌，二審逆轉改判兩年徒刑，可上訴,高雄 公廁 色魔 改判 囚兩年         【 本報 訊 】 據 中時 新聞網 六日 消息 ： 高雄 左營蓮池 潭 去年 二月 林姓 男子 尾 隨 女子 小華 （ 化名 ） 進入 公廁 ， 對 其 猥 褻 。 橋頭 地院 審理 後 ， 認罪證 不足 ， 判決林 男無罪 ， 檢方 不服 上訴 ， 二審 高雄 高 分院 認定 林 男 涉案 ， 依強制 猥 褻罪 改判 兩年 徒刑 ， 可上訴 。         女子 如廁 遭 性虐         檢方 指出 ， 去年 二月 一日 凌晨 一時許 ， 林男發 現小華 獨自 步行 於 蓮池 潭 水域 運動 中心 ， 尾 隨小華 進入 蓮池潭兒 童公園 的 無性 別公廁 ， 趁小華如 廁之際 ， 林男拉開 公廁 廁門 ， 小華見 狀 急忙 呼喊 “ 救命 ” ， 但林 男 不予 理會 ， 強行 環抱 並扯 下 對方 身上 圍巾 、 外套 、 上衣 等 。 小華想 找 機會 掙脫 往外 跑 ， 但林 男將 其拉進 公廁 ， 以 強暴 方式 強制 猥褻 得逞 ， 導致 小華頭部 、 胸部 及 四肢 受到 鈍 挫傷 。         嫌犯 一審判 無罪         林 男 猥 褻 得逞 後 離 去 ， 小華 隨即 跑 到 派出所 報案 ， 警方 循線 拘提 林 男 到案 說明 ， 並依 強制 猥 褻罪 移送 橋頭 地檢署 。 橋頭 地院 審理時 ， 林男否 認犯行 ， 指稱 自己 只是 剛好 到 蓮池 潭 附近 工作 ， 小華 指控 的 犯 嫌並 不是 他 ， 橋頭 地院 檢視檢 警所 提證據 ， 認為 無法確 認林 男 就是 嫌疑人 ， 以罪證 不足 為 由 ， 一審判 決林 男無罪 。         檢方 不服 提出 上訴 ， 高雄 高 分院 依據 監視器 畫面 ， 認為 林 男案 發時 穿着 的 衣物 與 小華 指控 相符 ， 且林 男當 天遇 警方 盤查 時 ， 穿着 衣物 也 與 犯 嫌 有 高度 相似性 ， 加上 林男行 經路線 與 猥 褻小華 的 犯 嫌 路線 高度 脗 合 ， 認定 林 男 就是 犯嫌 ， 二 審逆轉 改判 兩年 徒刑 ， 可上訴 。,2024-08-07
通脹破警,通脹破警    台七月消費者物價指數年增率再擴大為百分之二點五二，為近五個月以來最高，仍處高於百分之二的警戒值上。（香港中通社）,http://www.macaodaily.com/html/2024-08/07/content_1773101.htm,通脹破警    台七月消費者物價指數年增率再擴大為百分之二點五二，為近五個月以來最高，仍處高於百分之二的警戒值上,通脹 破警         台 七月 消費者 物價 指數 年增率 再 擴大為 百分之二 點 五二 ， 為 近五個 月 以來 最高 ， 仍處 高 於 百分之二 的 警戒 值上 。 （ 香港 中通社 ）,2024-08-07
英騷亂持續多國發旅警,英騷亂持續多國發旅警    【本報綜合報道】據新華社、香港中通社、參考消息網六日消息：英國利物浦附近持刀襲擊案觸發的示威浪潮未有平息跡象，迄今為止已有約四百人被捕。首相斯塔默五日召開緊急應變小組會議，商討對策，強調會嚴懲參與騷亂的人。目前，澳大利亞、馬來西亞和尼日利亞已向其公民發出有關英國騷亂的旅行警告。    當局準備更大監獄    斯塔默五日在唐寧街首相府就連日騷亂召開緊急應變小組會議，指無論動機如何，這些行為都不是示威，而是純粹的暴力，政府不會容忍對清真寺或穆斯林社區的襲擊。    斯塔默又批評網上不實信息造成民憤，當局會成立由特種警員組成的“常備軍”應對騷亂，強調所有參與騷亂的人都會受到法律制裁。無關線上或線下凡是參與煽動暴力者，都將必嚴懲。    斯塔默的發言人表示，當局發現網上不實信息遭到誇大，當中涉及有其他國家參與。    英國司法部國務大臣亞歷山大六日表示，政府已經準備了可容納五百人的監獄空間，並已徵召了六千名專業警員應對暴力活動。    破壞難民收容酒店    倫敦、利物浦、布里斯托爾、赫爾、曼徹斯特等多地發生抗議活動，並演變成暴力騷亂事件。一些騷亂者對難民收容酒店、清真寺、商舖等進行破壞，並襲擊警員、燒燬警車。    英國西南部普利茅斯八月五日有示威者互相對峙，支持移民與反對移民的示威者“打對台”，警員要將兩批示威者分開。警方表示有警車遭破壞，警告意圖擾亂公共秩序，或刑事犯罪的人，將受到嚴厲處理，重申不會容忍這類行為。    外裔開設商店遇襲    據法新社報道，普利茅斯五日發生投擲磚塊和鞭炮的騷亂事件，六人被捕，多名警員受傷。    北愛爾蘭貝爾法斯特的警員遭到暴徒襲擊，騷亂者試圖縱火焚燒一家外裔開設的商店。    藉反右翼施加暴力    此外，一群男子聚集在英國中部的伯明罕，以對抗所謂極右翼示威為藉口，迫使天空新聞頻道的一名記者高喊：“解放巴勒斯坦”。另一名記者說，他受到一群人的追逐，他們貌似“手持武器”。警方說，還發生了酒吧和汽車遭損毀的犯罪事件。    七月廿九日，利物浦附近一個社區有人持刀襲擊一個舞蹈班，三名女童死亡，多人受傷，一名兒童仍在留醫，十七歲疑兇被捕。其後，網上流傳疑兇是激進穆斯林移民，觸發連場示威。,http://www.macaodaily.com/html/2024-08/07/content_1773102.htm,當局準備更大監獄    斯塔默五日在唐寧街首相府就連日騷亂召開緊急應變小組會議，指無論動機如何，這些行為都不是示威，而是純粹的暴力，政府不會容忍對清真寺或穆斯林社區的襲擊,英騷亂 持續 多國發 旅警         【 本報 綜合 報道 】 據 新華社 、 香港 中通社 、 參考 消息 網 六日 消息 ： 英國 利物浦 附近 持刀 襲擊案 觸發 的 示威 浪潮 未有 平息 跡象 ， 迄今 為止 已有 約 四百人 被捕 。 首相 斯塔 默 五日 召開 緊急 應變 小 組會議 ， 商討 對策 ， 強調 會 嚴懲 參與 騷亂 的 人 。 目前 ， 澳大利 亞 、 馬 來 西亞和尼日 利亞 已 向 其 公民 發出 有 關英國 騷亂 的 旅行 警告 。         當局 準備 更 大 監獄         斯塔 默 五日 在 唐寧街 首相府 就 連日 騷亂 召開 緊急 應變 小 組會議 ， 指無論 動機 如何 ， 這些 行為 都 不是 示威 ， 而是 純粹 的 暴力 ， 政府 不會 容忍 對 清真寺 或 穆斯林 社區 的 襲擊 。         斯塔 默 又 批評 網上 不實 信息 造成 民憤 ， 當局 會 成立 由特種 警員 組成 的 “ 常備 軍 ” 應對 騷亂 ， 強調 所有 參與 騷亂 的 人 都 會 受到 法律制裁 。 無關線 上 或線 下 凡是 參與 煽動 暴力 者 ， 都 將必 嚴懲 。         斯塔 默 的 發言人 表示 ， 當局 發現 網上 不實 信息 遭到 誇大 ， 當中 涉及 有 其他 國家 參 與 。         英國 司法部 國務 大臣 亞歷 山大 六日 表示 ， 政府 已經 準備 了 可容納 五百 人 的 監獄 空間 ， 並已 徵召 了 六千名 專業 警員應 對 暴力 活動 。         破壞 難民 收容 酒店         倫敦 、 利物浦 、 布里斯托 爾 、 赫爾 、 曼徹 斯特 等 多 地 發生 抗議 活動 ， 並演 變成 暴力 騷亂 事件 。 一些 騷亂者 對 難民 收容 酒店 、 清真寺 、 商 舖 等 進行 破壞 ， 並襲擊 警員 、 燒 燬 警 車 。         英國 西南部 普利茅斯 八月 五日 有 示威者 互相 對峙 ， 支持 移民 與 反 對 移民 的 示威者 “ 打 對 台 ” ， 警員要 將兩批 示威者 分開 。 警方 表示 有 警車 遭破壞 ， 警告 意圖擾 亂 公共秩序 ， 或 刑事犯罪 的 人 ， 將 受到 嚴厲 處理 ， 重申 不會 容忍 這類 行為 。         外裔 開設 商店 遇襲         據 法新社 報道 ， 普利茅斯 五日 發生 投擲 磚塊 和 鞭炮 的 騷亂 事件 ， 六人 被捕 ， 多名 警員 受傷 。         北愛爾蘭 貝爾法 斯特 的 警員 遭到 暴徒 襲擊 ， 騷亂者 試圖 縱 火焚 燒 一家 外裔 開設 的 商店 。         藉 反 右翼 施加 暴力         此外 ， 一群 男子 聚集 在 英國 中部 的 伯明罕 ， 以 對 抗所謂極 右翼 示威 為 藉口 ， 迫使 天空 新聞 頻道 的 一名 記者 高喊 ： “ 解放 巴勒斯坦 ” 。 另一名 記者 說 ， 他 受到 一群 人 的 追逐 ， 他們 貌似 “ 手持 武器 ” 。 警方 說 ， 還發生 了 酒吧 和 汽車 遭 損毀 的 犯罪 事件 。         七月 廿九日 ， 利物浦 附近 一個 社區 有人 持刀 襲擊 一個 舞蹈班 ， 三名 女童 死亡 ， 多人 受傷 ， 一名 兒童 仍 在 留醫 ， 十七 歲疑 兇 被捕 。 其 後 ， 網 上流 傳疑 兇 是 激進 穆斯林 移民 ， 觸發 連場 示威 。,2024-08-07
