Title,Content,Link,Summary,Preprocessed_Content
飮食牌拖沓終有解,商社通平台網申    資料發各部審批    飮食牌拖沓終有解    【本報消息】新的飲食及飲料場所發牌程序行政法規昨日生效，申請人昨起可透過“商社通”全程網上辦理牌照申請。政府構建全新的“聯合審批平台”，簡化整個審批牌照流程。同時創設工程預先准照制度，解決過往業界反映的“動工難”問題。    數據系統校驗管理    政府多個部門昨日下午三時半於沙梨頭活動中心舉行新聞發佈會，市政署管委會副主席柯嵐、行政公職局長吳惠嫻、消防局代副局長林俊生、市政署管委會委員杜淑儀、衛生局防控煙酒辦公室主任林松、工務局城市建設廳長劉國權、文化局文化遺產廳長蔡健龍、勞工局職業安全健康廳長李錫樵、環保局環境污染防治處長徐成輝及市政署行政執照處長梁卓洪出席，介紹制度革新內容。    政府官員表示，為進一步提升飲食及飲料場所一站式發牌制度的成效，回應業界反映“動工難、審批難、開業難”的訴求，創造更有利的營商環境，當局修改法規，構建全新的“聯合審批平台”。當線上收到申請資料後，平台會將文件發送至相關部門，除市政署、工務局、消防局、衛生局及環保局外，還會視乎情況寄送到文化局、勞工局、專營公司及保險公司，各單位同步處理及審批，減省文件傳遞程序。同時使用數據化及系統校驗管理，簡化整個審批牌照的流程。    申預先准照早動工    申請人登入“商社通”服務平台可辦理飲食及飲料場所牌照，並可更改場所設施、查詢進度、接收通知等。申請全程電子化。新制度創設了工程預先准照制度，透過“商社通”遞交保險單、技術核查清單及聲明書等，經接納及繳付費用後，即可獲發具工程准照效力的收據。獲發收據翌日便可施工，審則流程亦同步開展。    申請人可於“商社通”自行預約消防驗收及聯合驗收的日期。驗收消防系統設備、檢查燃氣或燃料爐具及系統可同時進行，最快可於七個工作日完成並向場所發出消防檢查筆錄。    平台工具助估風險    業界過往關注開設餐飲場所存在的風險和成本等問題。為降低當中的不確定性，當局於平台內推出前期評估、三維模擬場景展廳及常見問題集的線上評估及查詢工具，協助業界預估開業前的選址風險及投入成本等。,http://www.macaodaily.com/html/2024-01/26/content_1731333.htm,數據系統校驗管理    政府多個部門昨日下午三時半於沙梨頭活動中心舉行新聞發佈會，市政署管委會副主席柯嵐、行政公職局長吳惠嫻、消防局代副局長林俊生、市政署管委會委員杜淑儀、衛生局防控煙酒辦公室主任林松、工務局城市建設廳長劉國權、文化局文化遺產廳長蔡健龍、勞工局職業安全健康廳長李錫樵、環保局環境污染防治處長徐成輝及市政署行政執照處長梁卓洪出席，介紹制度革新內容,商社 通 平台 網申         資料 發 各部 審批         飮 食 牌 拖沓 終有解         【 本報 消息 】 新 的 飲食 及 飲料場 所 發牌 程序 行政法 規 昨日 生效 ， 申請 人 昨起 可 透過 “ 商社 通 ” 全程 網上 辦理 牌照 申請 。 政府 構建 全新 的 “ 聯合 審批 平台 ” ， 簡化 整個 審批 牌照 流程 。 同時 創設 工程 預先 准照 制度 ， 解決過 往業界 反映 的 “ 動工難 ” 問題 。         數據 系統 校驗 管理         政府 多個 部門 昨日 下午 三時 半 於 沙梨 頭活動 中心 舉行 新聞發 佈 會 ， 市政 署 管委 會 副 主席 柯嵐 、 行政 公職 局長 吳惠嫻 、 消防局 代副局 長 林俊生 、 市政 署 管委 會委員 杜淑儀 、 衛生局 防控 煙酒 辦公 室主任 林松 、 工務局 城市 建設 廳長 劉國權 、 文化局 文化 遺產廳 長 蔡健龍 、 勞工局 職業 安全 健康 廳長 李錫樵 、 環保局 環境 污染 防治 處長 徐成 輝及 市政 署 行政 執照 處長 梁卓洪 出席 ， 介紹 制度 革新 內容 。         政府 官員 表示 ， 為進 一步 提升 飲食 及 飲料場 所 一站式 發牌 制度 的 成效 ， 回應業界 反映 “ 動工難 、 審批 難 、 開業 難 ” 的 訴求 ， 創造 更 有利 的 營商 環境 ， 當局 修改 法規 ， 構建 全新 的 “ 聯合 審批 平台 ” 。 當線 上 收到 申請 資料 後 ， 平台 會將 文件 發送 至 相關 部門 ， 除 市政 署 、 工務局 、 消防局 、 衛生 局及 環保 局外 ， 還會 視乎 情況 寄 送到 文化局 、 勞工局 、 專營 公司 及 保險 公司 ， 各 單位 同步 處理及 審批 ， 減省 文件 傳遞 程序 。 同時 使用 數據化 及 系統 校驗 管理 ， 簡化 整個 審批 牌照 的 流程 。         申預 先 准照 早動工         申請 人 登入 “ 商社 通 ” 服務 平台 可辦理 飲食 及 飲料場 所 牌照 ， 並 可更改 場所 設施 、 查詢 進度 、 接收 通知 等 。 申請 全程 電子化 。 新 制度 創設 了 工程 預先 准照 制度 ， 透過 “ 商社 通 ” 遞 交保 險單 、 技術 核查 清單 及聲 明書 等 ， 經接 納及 繳付 費用 後 ， 即可 獲發具 工程 准照 效力 的 收據 。 獲發 收據 翌日 便 可 施工 ， 審則 流程 亦 同步 開展 。         申請 人 可 於 “ 商社 通 ” 自行 預約 消防 驗收及 聯合驗 收 的 日期 。 驗收 消防 系統 設備 、 檢查 燃氣 或 燃料 爐 具及 系統 可 同時 進行 ， 最快 可 於 七個 工作日 完成 並向場 所 發出 消防 檢查 筆錄 。         平台 工具 助估 風險         業界過 往關 注開 設餐 飲場 所 存在 的 風險 和 成本 等 問題 。 為 降低 當中 的 不確 定性 ， 當局 於 平台 內 推出 前期 評估 、 三維模 擬場 景展 廳 及常見 問題 集 的 線 上 評估 及 查詢 工具 ， 協助業界 預估 開業 前 的 選址 風險 及 投入 成本 等 。
業界：新制度省時方便,業界：新制度省時方便    【本報消息】申請飲食及飲料場所牌照涉及政府七個部門，申請人即日起可透過“商社通”內的“一站式”功能，網上辦理飲食牌照。    料可省兩個月    餐飲業聯合商會會長陳澤武受訪稱，過往店舖免租期過後很多仍未有牌照經營，要“白交租”。今次革新主要是優化流程，並不是降低文件數量和質量要求。雖然申請提交文件項目不變，但減少消防局驗收的等候時間，以及引入工程預先准照制度。按經驗，符合條件的餐廳申請牌照最少可較過往節省兩個月時間。要申請過程順利，申請人應遵守規定。如果是在歷史城區裝修，必須遵守文化部門的規定。    磨合解決細節    工程師學會會長胡祖杰形容入則公司“極之歡迎”“一站式”制度，因所有文件均可網上遞交，再同步分派至各部門。過去因處理的飲食場所不同，資料不明確，現時所有工作標準化。新制度實施初期可能會存在一些細節問題，但相信可以通過一段時間磨合解決。    土木及結構工程師學會副理事長周子鍵稱，新制度在環保和省時有很大改善，業界在平台一次過提交所有申請文件，並同步分派至各部門處理，審批流程更加明確，申請人可以隨時了解審批進度。過往單是送交紙本文件給店舖業主和工程師簽名需七至十天，現時透過“一站式”網上平台處理，可幫助業界節省大量時間和精力。,http://www.macaodaily.com/html/2024-01/26/content_1731334.htm,土木及結構工程師學會副理事長周子鍵稱，新制度在環保和省時有很大改善，業界在平台一次過提交所有申請文件，並同步分派至各部門處理，審批流程更加明確，申請人可以隨時了解審批進度,業界 ： 新 制度 省時 方便         【 本報 消息 】 申請 飲食 及 飲料場 所 牌照 涉及 政府 七個 部門 ， 申請 人 即日起 可透過 “ 商社 通 ” 內 的 “ 一站式 ” 功能 ， 網上 辦理 飲食 牌照 。         料可省 兩個 月         餐飲業 聯合 商會會長 陳 澤 武受 訪稱 ， 過往 店 舖 免租 期過 後 很多 仍 未有 牌照 經營 ， 要 “ 白 交租 ” 。 今 次 革新 主要 是 優化 流程 ， 並 不是 降低 文件 數量 和 質量 要求 。 雖然 申請 提交 文件 項目 不變 ， 但 減少 消防局 驗收 的 等候 時間 ， 以及 引入 工程 預先 准照 制度 。 按經驗 ， 符合 條件 的 餐廳 申請 牌照 最少 可較 過往 節省 兩個 月 時間 。 要 申請 過程 順利 ， 申請 人應 遵守 規定 。 如果 是 在 歷史 城區 裝修 ， 必須 遵守 文化部 門的 規定 。         磨合 解決 細節         工程 師學會 會長 胡祖杰 形容 入則 公司 “ 極之歡 迎 ” “ 一站式 ” 制度 ， 因 所有 文件 均 可 網上 遞交 ， 再 同步 分派 至 各部 門 。 過去 因處理 的 飲 食場 所 不同 ， 資料 不明 確 ， 現時 所有 工作 標準化 。 新 制度 實施 初期 可能 會 存在 一些 細節 問題 ， 但 相信 可以 通過 一段 時間 磨合 解決 。         土木 及 結構 工程 師學會 副 理事 長 周子鍵 稱 ， 新 制度 在 環保 和 省 時 有 很大 改善 ， 業界 在 平台 一次 過 提交 所有 申請 文件 ， 並 同步 分派 至 各部 門處理 ， 審批 流程 更加 明確 ， 申請 人 可以 隨時 了解 審批 進度 。 過往 單是 送交 紙本 文件 給店 舖 業主 和 工程 師簽 名 需七至 十天 ， 現時 透過 “ 一站式 ” 網上 平台 處理 ， 可幫 助業界 節省 大量 時間 和 精力 。
市署助業界了解新飲食發牌,兩場交流會百人出席    市署助業界了解新飲食發牌    【本報消息】《飲食及飲料場所一站式發牌制度》昨日生效， 市政署早前舉辦兩場交流會，向業界介紹申請流程全面電子化、審批與動工可同步進行、納入消防驗收程序等，並即場解答業界疑問及聆聽意見。    兩場交流會共約一百名牌照申請人、代理人、業界及團體代表出席。與會者普遍支持革新發牌制度，期望加快效率，為投資者於本澳開業打下強心針，真正做到“打破壁壘，便商利企”。市政署、行政公職局、土地工務局及消防局代表會上介紹制度革新的背景和理念、新制度下的牌照申請流程及要求，以及涉及工程和消防的注意事項等。同時播放演示短片，講解平台操作，協助業界提前掌握牌照申請的各項流程。    合資格文件齊即裝修    會上提到，自飲食及飲料場所一站式發牌程序推出以來，特區政府持續與持份者交流，總結經驗，不斷優化行政審批流程。是次制度革新回應了業界優化發牌流程的需求及意見，於“商社通”設專屬電子平台，申請者可隨時隨地線上申請、查詢進度及接收通知。同時，創設工程預先准照制度，讓審批、動工可同步，符合條件者交齊資料後最快翌日可開始裝修。申請者還可自助預約檢查及驗收時間，明確驗收標準，壓縮審批時間。    業界代表踴躍提問，查詢新發牌制度的問題，部門代表一一回應。,http://www.macaodaily.com/html/2024-01/26/content_1731335.htm,兩場交流會百人出席    市署助業界了解新飲食發牌    【本報消息】《飲食及飲料場所一站式發牌制度》昨日生效， 市政署早前舉辦兩場交流會，向業界介紹申請流程全面電子化、審批與動工可同步進行、納入消防驗收程序等，並即場解答業界疑問及聆聽意見,兩場 交流 會百人 出席         市署 助業界 了解 新 飲食 發牌         【 本報 消息 】 《 飲食 及 飲料場 所 一站式 發牌 制度 》 昨日 生效 ，   市政 署 早前 舉辦 兩場 交流 會 ， 向業界 介紹 申請 流程 全面 電子化 、 審批 與 動工 可 同步 進行 、 納入 消防 驗收 程序 等 ， 並即場 解答 業界疑 問及 聆 聽 意見 。         兩場 交流 會共約 一百名 牌照 申請 人 、 代理人 、 業界 及 團體 代表 出席 。 與 會者 普遍 支持 革新 發牌 制度 ， 期望 加快 效率 ， 為 投資者 於 本 澳開業 打下 強心針 ， 真正 做到 “ 打破 壁壘 ， 便 商利企 ” 。 市政 署 、 行政 公職局 、 土地 工務局 及 消防局 代表 會上 介紹 制度 革新 的 背景 和 理念 、 新 制度 下 的 牌照 申請 流程 及 要求 ， 以及 涉及 工程 和 消防 的 注意 事項 等 。 同時 播放 演示 短片 ， 講解 平台 操作 ， 協助業界 提前 掌握 牌照 申請 的 各項 流程 。         合資格 文件 齊即 裝修         會上 提到 ， 自飲 食及 飲料場 所 一站式 發牌 程序 推出 以來 ， 特區 政府 持續 與 持份者 交流 ， 總結 經驗 ， 不斷 優化 行政 審批 流程 。 是 次 制度 革新 回應 了 業界 優化 發牌 流程 的 需求 及意 見 ， 於 “ 商社 通 ” 設 專屬 電子 平台 ， 申請者 可 隨時 隨地線 上 申請 、 查詢 進度 及 接收 通知 。 同時 ， 創設 工程 預先 准照 制度 ， 讓 審批 、 動工 可 同步 ， 符合 條件 者 交齊 資料 後 最快 翌日 可開始 裝修 。 申請者 還可 自助 預約 檢查 及驗 收時間 ， 明確驗 收標準 ， 壓縮 審批 時間 。         業界 代表 踴躍提問 ， 查詢 新 發牌 制度 的 問題 ， 部門 代表 一 一回 應 。
補習社藥房擬年內推一站發牌,補習社藥房擬年內推一站發牌    【本報消息】行政公職局長吳惠嫻表示，將參照今次飲食一站式發牌工作，未來擴展至包括補習社和藥房等經營申請。已與相關部門討論，爭取今年內推出。    吳惠嫻指出，推出一站式發牌前已開展較多配套測試，目前“商社通”和“一戶通”均設於雲計算中心，具有足夠數據支撐能力及專業運行維護團隊。若平台需要運行維護一定會事先通知，不會影響正常運作。若出現特殊情況亦可以按紙本申請的流程處理。    商社通帳戶逾萬    吳惠嫻稱，“商社通”自本月九日推出後，已開立的實體帳戶逾一萬個，當中公司約八千二百個。,http://www.macaodaily.com/html/2024-01/26/content_1731336.htm,吳惠嫻指出，推出一站式發牌前已開展較多配套測試，目前“商社通”和“一戶通”均設於雲計算中心，具有足夠數據支撐能力及專業運行維護團隊,補習 社藥 房擬 年 內 推 一站 發牌         【 本報 消息 】 行政 公職 局長 吳惠嫻 表示 ， 將參照 今次 飲食 一站式 發牌 工作 ， 未來 擴展 至 包括 補習 社和藥 房 等 經營 申請 。 已 與 相關 部門 討論 ， 爭取 今年 內 推出 。         吳惠嫻 指出 ， 推出 一站式 發牌 前 已 開展 較 多 配套 測試 ， 目前 “ 商社 通 ” 和 “ 一戶通 ” 均 設 於 雲計算 中心 ， 具有 足夠 數據 支撐 能力 及 專業 運行 維護 團隊 。 若 平台 需要 運行 維護 一定 會 事先 通知 ， 不會 影響 正常 運作 。 若 出現 特殊 情況 亦 可以 按紙 本 申請 的 流程 處理 。         商社 通帳 戶 逾 萬         吳惠嫻 稱 ， “ 商社 通 ” 自 本月 九日 推出 後 ， 已 開立 的 實體 帳戶 逾 一萬個 ， 當中 公司 約 八千 二百 個 。
去年千一僭建立案八罰款,近百三個案自願清拆    去年千一僭建立案八罰款    【本報消息】工務局訊：土地工務局二○二三年全年開立涉及非法工程的卷宗共一千一百一十四宗，全年自願清拆個案共一百二十九宗，較二○二二年同期有所增加，因進行非法工程的罰款個案亦有八宗。    從自願清拆非法工程個案數量增加，反映居民對處理自身非法工程的意識及意願日漸增加。局方歡迎居民自願清拆僭建物，也會持續進行打擊工作，呼籲社會大眾顧己及人，配合政府合力消除非法工程，共同維護樓宇安全及營造舒適居住環境。    佔用公共部分或空間，會阻礙火警救援及逃生，嚴重危害自身及他人生命財產安全；樓宇外牆加建花籠、平台或天台加建僭建物等更會影響樓宇承載能力及導致滲漏水等問題，影響其他住戶的居住環境，甚至會破壞樓宇結構。為有效跟進及打擊，對新建、翻新或殘危情況，對公眾走火安全及公共衛生等構成安全隱患的非法工程，工務局均會優先處理。    增罰則斷水斷電    隨着《都市建築法律制度》已生效，新法不僅提升違法人因進行非法工程的罰款，並新增不遵守拆卸令的罰款，以及增加其他懲罰措施，包括違令罪和“斷水斷電”等，呼籲居民切勿心存僥倖、以身試法。    自願清拆減罰款    為鼓勵違法人配合政府執法，自願清拆僭建物，《都市建築法律制度》就進行非法工程罰款的處罰程序，有鼓勵性減免措施。倘工程所有人在聽證期間，不作申辯且申請自願清拆，當獲許可及確認完全拆除所有非法工程後，可獲全數豁免此項罰款；倘局方對非法工程展開的聽證程序有最終決定並發出拆卸令，違法人於限期內申請自願清拆，罰款則可減半。法律規定此項減免僅適用一次，且違法人五年內再次違反將被視為累犯，相應罰款下限將提高四分之一。在拆卸非法工程前，應先向工務局申請，獲許可後才可施行；否則，相關人士會因違反《都市建築法律制度》其他規定而受罰。    非法工程相關統計數據可查閱工務局網站(https://www.dsscu.gov.mo)“土地工務局處理非法工程資料”，更多資訊可瀏覽“《都市建築法律制度》資訊網”(https://www.dsscu.gov.mo/zh_HANT/sites/rjcu)。,http://www.macaodaily.com/html/2024-01/26/content_1731288.htm,自願清拆減罰款    為鼓勵違法人配合政府執法，自願清拆僭建物，《都市建築法律制度》就進行非法工程罰款的處罰程序，有鼓勵性減免措施,近百 三個案 自願 清 拆         去年 千一 僭 建立 案八罰 款         【 本報 消息 】 工務局 訊 ： 土地 工務局 二 ○ 二三年 全年 開立 涉及 非法 工程 的 卷宗 共 一千一百 一 十四 宗 ， 全年 自願 清 拆個案 共 一百二十 九宗 ， 較 二 ○ 二 二年 同期 有所增加 ， 因進行 非法 工程 的 罰款 個案 亦 有 八宗 。         從 自願 清 拆 非法 工程 個案 數量 增加 ， 反映 居民 對 處理 自身 非法 工程 的 意識 及 意願 日漸 增加 。 局方 歡迎 居民 自願 清 拆 僭 建物 ， 也 會 持續 進行 打擊 工作 ， 呼籲 社會 大眾 顧己 及 人 ， 配合 政府 合力 消除 非法 工程 ， 共同 維護 樓宇 安全 及營造 舒適 居住 環境 。         佔用 公共 部分 或 空間 ， 會 阻礙 火警 救援 及 逃生 ， 嚴重 危害 自身 及 他人 生命 財產 安全 ； 樓宇外 牆加 建花籠 、 平台 或 天台 加建 僭 建物 等 更會 影響 樓宇承載 能力 及導 致滲 漏水 等 問題 ， 影響 其他 住戶 的 居住 環境 ， 甚至 會破壞 樓宇 結構 。 為 有效 跟 進及 打擊 ， 對 新建 、 翻新 或 殘危 情況 ， 對公眾 走火 安全 及 公共 衛生 等 構成 安全 隱患 的 非法 工程 ， 工務局 均 會 優先 處理 。         增罰則 斷 水斷電         隨着 《 都市 建築 法律 制度 》 已 生效 ， 新法 不僅 提升 違 法人 因進行 非法 工程 的 罰款 ， 並 新增 不 遵守 拆卸 令 的 罰款 ， 以及 增加 其他 懲罰 措施 ， 包括 違令罪 和 “ 斷水 斷電 ” 等 ， 呼籲 居民 切勿 心存 僥 倖 、 以身 試法 。         自願 清 拆 減罰款         為 鼓勵 違 法人 配合 政府 執法 ， 自願 清 拆 僭 建物 ， 《 都市 建築 法律 制度 》 就 進行 非法 工程 罰款 的 處罰 程序 ， 有 鼓勵 性 減免 措施 。 倘 工程 所有人 在 聽 證期間 ， 不作 申辯且 申請 自願 清 拆 ， 當獲 許可及 確認 完全 拆除 所有 非法 工程 後 ， 可獲 全數 豁免 此項 罰款 ； 倘 局方 對 非法 工程 展開 的 聽證 程序 有 最終 決定 並發出 拆卸 令 ， 違 法人 於 限期 內申 請 自願 清 拆 ， 罰款則 可 減半 。 法律 規定 此項 減免僅 適用 一次 ， 且 違 法人 五年 內 再次 違反將 被 視為 累犯 ， 相應 罰款 下限 將 提高 四分之一 。 在 拆卸 非法 工程 前 ， 應先 向 工務局 申請 ， 獲許 可後才 可 施行 ； 否則 ， 相關 人士 會因 違反 《 都市 建築 法律 制度 》 其他 規定 而 受罰 。         非法 工程 相關 統計 數據 可查 閱工務局 網站 ( https : / / www . dsscu . gov . mo ) “ 土地 工務局 處理 非法 工程 資料 ” ， 更多 資訊 可 瀏覽 “ 《 都市 建築 法律 制度 》 資訊網 ” ( https : / / www . dsscu . gov . mo / zh _ HANT / sites / rjcu ) 。
