Title,Content,Link,Summary,Preprocessed_Content,Date
澳載荷專家膺預備航天員,爲載人登月及空間站運作準備    澳載荷專家膺預備航天員    【本報駐北京記者王維十一日電】據中國載人航天辦公室今日消息，經過嚴格的選拔流程，第四批預備航天員名單正式出爐。其中，港澳地區各有一名載荷專家成功入選，標誌着港澳有居民首次進入中國航天員隊伍。他們未來有望在中國航天的新征程中扮演關鍵角色。    十人入選港澳各一    據報道，我國載人航天工程第四批預備航天員選拔工作日前結束，共有十名預備航天員最終入選，包括八名航天駕駛員和兩名載荷專家。其中，港澳地區各有一名載荷專家入選。後續，他們將進入中國航天員科研訓練中心接受全面系統的訓練，以確保能夠在未來的太空任務中勝任各項工作。    我國載人航天工程第四批預備航天員選拔工作自二〇二二年下半年全面啟動，經過初選、複選、定選三個階段。期間，首次面向港澳地區選拔載荷專家，得到港澳各界和社會民衆的大力支持、熱情參與。    港澳積極參與選拔    “選拔實施以來，港澳特區政府周密組織，科研機構全力協助，港澳廣大民眾反響熱烈，來自生物醫學工程、機械電子、材料、化學、天文等多個專業領域的科研人員與高校教師踴躍報名。”神舟十五號載人飛行任務新聞發佈會上，中國載人航天工程新聞發言人季啟明曾介紹。    層層測試嚴格選拔    中國載人航天工程航天員系統總設計師黃偉芬接受央視新聞採訪時介紹，這次選拔的範圍包括航天駕駛員、載荷專家。其中航天駕駛員覆蓋陸海空三軍現役飛行員，分別來自香港和澳門的數名候選對象進入載荷專家選拔的最後環節。    第四批航天員經過嚴格的層層選拔，包括全面深入的臨床醫學檢查、心理測試、航天環境適應測試、耐力測試、職業基本素質測試以及查訪走訪等各項流程。同時增加了虛擬現實訓練器體驗出艙活動、手動交互對接操作體驗等，進一步考察預備航天員的職業能力。    安排地質野外訓練    我國計劃在二〇三〇年前實現載人登陸月球開展科學探索。黃偉芬介紹，目前航天員隊伍的建設，無論是從選拔還是訓練，都統籌考慮了空間站和載人登月這兩大任務來進行相關工作。目前已開設地質訓練課程，還將安排航天員野外實習和地質考察等訓練，料訓練模擬器研究完成就可以開展實質訓練。航天員都要深入參加工程的硏製，深入科硏一線學習，爲後續做技術儲備。    目前，我國航天員選拔訓練體系更加成熟完善，隨着載人航天國際合作深入推進，還將有國外航天員參與選拔訓練並執行中國空間站飛行任務。,http://www.macaodaily.com/html/2024-06/12/content_1761445.htm,十人入選港澳各一    據報道，我國載人航天工程第四批預備航天員選拔工作日前結束，共有十名預備航天員最終入選，包括八名航天駕駛員和兩名載荷專家,爲 載 人 登月 及 空間 站 運作 準備         澳載 荷 專家膺 預備 航天 員         【 本報 駐 北京 記者 王維 十一日 電 】 據 中國載 人 航天 辦 公室 今日 消息 ， 經過 嚴格 的 選拔 流程 ， 第四批 預備 航天 員名 單 正式 出爐 。 其中 ， 港澳 地區 各有 一名 載荷 專家 成功 入選 ， 標誌 着 港澳 有 居民 首次 進入 中國 航天 員隊伍 。 他們 未來 有望 在 中國 航天 的 新 征程 中 扮演 關鍵 角色 。         十人入 選 港澳 各一         據 報道 ， 我國載 人 航天 工程 第四批 預備 航天 員選拔 工作 日前 結束 ， 共有 十名 預備 航天 員 最 終入 選 ， 包括 八名 航天 駕駛員 和 兩名 載荷 專家 。 其中 ， 港澳 地區 各有 一名 載荷 專家入 選 。 後 續 ， 他們 將進入 中國 航天 員 科研 訓練 中心 接受 全面 系統 的 訓練 ， 以確 保能夠 在 未來 的 太空 任務 中勝任 各項 工作 。         我國載 人 航天 工程 第四批 預備 航天 員選拔 工作 自二 〇 二 二年 下半年 全面 啟動 ， 經過 初選 、 複 選 、 定選三個 階段 。 期間 ， 首次 面向 港澳 地區 選拔 載荷 專家 ， 得到 港澳 各界 和 社會民 衆 的 大力支持 、 熱情 參 與 。         港澳 積極 參與 選拔         “ 選拔實 施以 來 ， 港澳 特區 政府 周密 組織 ， 科研 機構 全力 協助 ， 港澳 廣大民眾 反響 熱烈 ， 來 自 生物 醫學 工程 、 機械 電子 、 材料 、 化學 、 天文 等 多個 專業 領域 的 科研 人員 與 高校 教師 踴躍報 名 。 ” 神舟 十五 號載 人 飛行 任務 新聞發 佈 會 上 ， 中國載 人 航天 工程 新聞 發言人季 啟明 曾 介紹 。         層層 測試 嚴格 選拔         中國載 人 航天 工程 航天 員系統 總設 計師 黃 偉芬 接受 央視 新聞 採訪 時介紹 ， 這次 選拔 的 範圍 包括 航天 駕駛員 、 載荷 專家 。 其中 航天 駕駛員 覆蓋陸 海空 三軍現 役 飛行員 ， 分別 來 自 香港 和 澳門 的 數名候 選對象 進入 載荷 專家 選拔 的 最後環節 。         第四批 航天 員經過 嚴格 的 層層 選拔 ， 包括 全面 深入 的 臨床 醫學 檢查 、 心理 測試 、 航天 環境 適應 測試 、 耐力 測試 、 職業 基本 素質 測試 以及 查訪 走訪 等 各項 流程 。 同時 增加 了 虛擬 現實 訓練器 體驗 出艙 活動 、 手動 交互 對接 操作 體驗 等 ， 進 一步 考察 預備 航天 員 的 職業 能力 。         安排 地質 野外 訓練         我國 計劃 在 二 〇 三 〇 年前 實現 載人 登陸 月球 開展 科學 探索 。 黃 偉芬 介紹 ， 目前 航天 員隊伍 的 建設 ， 無論 是 從 選拔 還是 訓練 ， 都 統籌 考慮 了 空間 站 和 載 人 登月 這兩大 任務來 進行 相關 工作 。 目前 已 開設 地質 訓練 課程 ， 還將 安排 航天 員 野外 實習 和 地質 考察 等 訓練 ， 料訓練 模擬器 研究 完成 就 可以 開展 實質 訓練 。 航天 員 都 要 深入 參加 工程 的硏 製 ， 深入 科硏 一線 學習 ， 爲 後 續 做 技術 儲備 。         目前 ， 我國 航天 員選拔 訓練 體系 更加 成熟 完善 ， 隨着 載 人 航天 國際 合作 深入 推進 ， 還將 有 國外 航天 員參 與 選拔 訓練並 執行 中國 空間 站 飛行 任務 。,2024-06-12
特區政府續培育更多科硏人才,衷心感謝中央支持澳參與國家航天事業    特區政府續培育更多科硏人才    【本報消息】新聞局訊：澳門特別行政區政府衷心感謝中央政府對澳門參與國家航天事業的大力支持和厚愛，並熱烈祝賀國家載人航天工程第四批預備航天員選拔圓滿成功。    澳誕專家鼓舞澳青    是次國家第四批預備航天員選拔為澳門帶來關鍵突破——澳門首位載荷專家誕生，這彰顯了中央政府高度重視和支持澳門科技創新，讓澳門在航天科技領域邁出了重要一步，是澳門特別行政區的榮譽，也向澳門青年人發出了強烈的鼓舞訊息。    第四批預備航天員選拔順利完成，這個成功離不開祖國科技人員的辛勤努力和團隊合作精神，他們在航天科技領域的研究和探索取得了令人矚目的進展。特區政府會積極配合國家政策發展，加強與中央政府和相關部門的合作，深化兩地航天科技領域的交流與合作。    加強科創基礎建設    澳門致力推動科技創新事業不斷邁上新台階，期望為國家航天事業發展作出更大貢獻。未來，在中央政府的全力支持下，特區政府將加強培養更多科研人才，加強科技創新基礎設施建設，並積極推動航天科技與其他領域的融合發展，為推動澳門經濟的高質量發展作出更多貢獻。    特區政府再一次向中央政府表達最誠摯的謝意，長期為澳門的科技發展創造良好的環境和條件。期待與中國航天員科研訓練中心一道，讓澳門助力國家航天事業領域獲取更加輝煌的成就。,http://www.macaodaily.com/html/2024-06/12/content_1761446.htm,未來，在中央政府的全力支持下，特區政府將加強培養更多科研人才，加強科技創新基礎設施建設，並積極推動航天科技與其他領域的融合發展，為推動澳門經濟的高質量發展作出更多貢獻,衷心 感謝 中央 支持 澳參 與 國家 航天 事業         特區 政府 續 培育 更多 科硏 人才         【 本報 消息 】 新聞局 訊 ： 澳門 特別 行政 區 政府 衷心 感謝 中央政府 對 澳門 參與 國家 航天 事業 的 大力支持 和 厚 愛 ， 並熱烈 祝 賀國家載 人 航天 工程 第四批 預備 航天 員選拔 圓滿 成功 。         澳誕 專家 鼓舞 澳青         是 次 國家 第四批 預備 航天 員選拔 為 澳門 帶來 關鍵 突破 — — 澳門 首位 載荷 專家 誕生 ， 這彰顯 了 中央政府 高度 重視 和 支持 澳門 科技 創新 ， 讓 澳門 在 航天 科技 領域 邁出 了 重要 一步 ， 是 澳門 特別 行政 區的 榮譽 ， 也 向 澳門 青年人 發出 了 強烈 的 鼓舞 訊息 。         第四批 預備 航天 員選拔 順利 完成 ， 這個 成功 離不開 祖國 科技 人員 的 辛勤努力 和 團隊 合作 精神 ， 他們 在 航天 科技 領域 的 研究 和 探索 取得 了 令人 矚 目的 進展 。 特區 政府 會積極 配合 國家 政策 發展 ， 加強 與 中央政府 和 相關 部門 的 合作 ， 深化 兩地 航天 科技 領域 的 交流 與 合作 。         加強 科創 基礎 建設         澳門 致力 推動 科技 創新事業 不斷 邁上 新 台階 ， 期望 為國家 航天 事業 發展 作出 更大 貢獻 。 未來 ， 在 中央政府 的 全力支持 下 ， 特區 政府 將加強 培養 更 多 科研 人才 ， 加強 科技 創新 基礎 設施 建設 ， 並積極 推動 航天 科技 與 其他 領域 的 融合 發展 ， 為 推動 澳門 經濟 的 高質量 發展 作出 更多 貢獻 。         特區 政府 再 一次 向 中央政府 表達 最誠摯 的 謝意 ， 長 期為 澳門 的 科技 發展 創造 良好 的 環境 和 條件 。 期待 與 中國 航天 員 科研 訓練 中心 一道 ， 讓 澳門 助力 國家 航天 事業 領域 獲取 更加 輝煌 的 成就 。,2024-06-12
載荷專家負責處理航天設備   本報記者,載荷專家負責處理航天設備    載荷專家是指受過訓練的非職業航天員，負責處理飛行器或空間站上攜帶的高度複雜或精密設備，並進行空間實驗，亦配合飛行乘組其他人員開展站務管理的日常工作。今次的載荷專家是在從事空間科學研究及應用相關領域的科研人員中選拔。    澳選拔一年半    二〇二二年十月初，特區政府宣佈獲中央政府支持參與國家航天事業發展，在澳選拔一名載荷專家，擔任在太空進行的空間實驗研究，以及操作空間實驗設備等科研工作。載荷專家澳區選拔分初選、複選和定選三階段。報名半個多月，選拔過程一年半。    載荷專家澳區選拔對象的基本條件，是從事不少於三年有關醫學、生物學、心理學、物理化學、機械或電子工程、天文學等專業領域，擁有博士學位，且具備良好健康狀況、年齡介乎三十歲至四十五歲的澳門特區永久性居民中的中國籍公民。選拔由中國載人航天工程辦公室組織，中國航天員科研訓練中心實施，國務院港澳辦協調，協辦單位包括特區政府民航局、教青局及衛生局。    期待歷史一刻    國家為一直支持澳門，中國載人航天工程代表團於去年十二月一日至三日應邀訪澳，是國家載人航天工程時隔十一年再次組團訪問澳門，期間與澳門青年學生、科技界交流，再掀航天熱潮。代表團團長、中國載人航天工程辦公室副主任林西強當時表示，願意積極支援澳門特區科研機構及科學家更多參與載人航天研製建設，特別是共同期待澳門的載荷專家能執行中國載人航天飛行任務的這一歷史性時刻。    本報記者,http://www.macaodaily.com/html/2024-06/12/content_1761447.htm,代表團團長、中國載人航天工程辦公室副主任林西強當時表示，願意積極支援澳門特區科研機構及科學家更多參與載人航天研製建設，特別是共同期待澳門的載荷專家能執行中國載人航天飛行任務的這一歷史性時刻,載荷 專家 負責 處理 航天 設備         載荷 專家 是 指受 過訓練 的 非 職業 航天 員 ， 負責 處理 飛行器 或 空間 站上 攜帶 的 高度 複 雜或 精密 設備 ， 並進 行空 間 實驗 ， 亦 配合 飛行 乘組 其他人 員 開展 站務 管理 的 日常 工作 。 今次 的 載荷 專家 是 在 從 事空間 科學 研究 及 應用 相關 領域 的 科研 人員中 選拔 。         澳選拔 一年 半         二 〇 二 二年 十月初 ， 特區 政府 宣 佈 獲 中央政府 支持 參與 國家 航天 事業 發展 ， 在 澳選拔 一名 載荷 專家 ， 擔任 在 太空 進行 的 空間 實驗 研究 ， 以及 操作 空間 實驗 設備 等 科研工作 。 載荷 專家 澳區 選拔 分初 選 、 複 選和定 選三階段 。 報名 半個 多月 ， 選拔 過程 一年 半 。         載荷 專家 澳區 選拔 對象 的 基本 條件 ， 是 從 事 不少 於 三年 有關 醫學 、 生物 學 、 心理 學 、 物理 化學 、 機械 或 電子 工程 、 天文 學等 專業 領域 ， 擁有 博士 學位 ， 且 具備 良好 健康 狀況 、 年齡 介乎 三十 歲 至 四十五 歲 的 澳門 特區 永久性 居民 中 的 中國籍 公民 。 選拔 由 中國載 人 航天 工程 辦 公室 組織 ， 中國 航天 員 科研 訓練 中心 實施 ， 國務院 港澳 辦協調 ， 協辦 單位 包括 特區 政府 民航局 、 教青局 及 衛生局 。         期待 歷史 一刻         國家 為 一直 支持 澳門 ， 中國載 人 航天 工程 代表 團於 去年 十二月 一日 至 三日 應 邀訪 澳 ， 是 國家載 人 航天 工程 時隔 十一年 再次 組團 訪問 澳門 ， 期間 與 澳門 青年 學生 、 科技界 交流 ， 再 掀 航天 熱潮 。 代表 團團長 、 中國載 人 航天 工程 辦 公室 副 主任 林西 強當時 表示 ， 願意 積極 支援 澳門 特區 科研 機構 及 科學家 更 多 參與載 人 航天 研 製 建 設 ， 特別 是 共同 期待 澳門 的 載荷 專家能 執行 中國載 人 航天 飛行 任務 的 這一 歷史性 時刻 。         本報 記者,2024-06-12
“機遇灣區”展“一國兩制”優勢    本報記者　　牛寅虎　　圖／文,央媒及粵港澳廿三家媒體逾百記者聯合採訪    “機遇灣區”展“一國兩制”優勢    “機遇灣區”“機遇香港”“機遇澳門”主題採訪活動今日在廣州啟動，央媒及粵港澳廿三家媒體，逾百名記者將到訪廣州、深圳、香港、澳門、橫琴等地，開展為期九天的聯合採訪活動，全面感知粵港澳大灣區建設的新進展和新氣象。    （廣州十一日電）    撑澳打造世旅中心    “機遇灣區”廣東主題採訪活動情況介紹會今日上午在廣州市廣東大廈舉行。廣東省委常委、常務副省長張虎表示，下一步，將圍繞支持澳門打造世界旅遊休閒中心，積極對接澳門“一加四”適度多元發展策略，更好支持澳門融入國家發展大局。    張虎指出，經過五年努力，大灣區綜合實力不斷增強，粵港澳合作更加廣泛深入。粵港澳大灣區經濟總量從二〇一八年十點八萬億元，到二〇二三年突破十四萬億元，以不到全國百分之〇點六的國土面積，創造了全國九分之一的經濟總量，高質量發展潛力和動能不斷釋放，充分展現出“一國兩制”的制度優勢和勃勃生機。    粵港澳大灣區建設啟動以來，廣東將堅持把規劃抓在手上、把項目落在地上、把未來融在路上、把百姓記在心上，把大灣區建設作為廣東深化改革開放的大機遇、大文章抓緊做實，舉全省之力辦好這件大事，攜手港澳打造融入國內國際雙循環、走出高質量發展之路、彰顯中國式現代化特質的大灣區。    聚焦五面重點發力    下一步，將聚焦五個方面重點發力。一是強化發展戰略協同聯動。圍繞鞏固香港金融、航運、商貿等中心地位，以及支持澳門打造世界旅遊休閒中心，聚焦跨境基礎設施建設、科技創新合作、產業體系共建、民生深度融合等重點領域，積極對接香港北部都會區開發建設和澳門“一加四”適度多元發展策略，更好支持港澳融入國家發展大局。    二是強化科技產業互促雙強。將加快建立與港澳及國際有效對接的科研管理制度，持續推動重大科技基礎設施、高水平實驗室等創新平台共建共用共享，聚焦前沿優勢領域新建一批粵港澳聯合實驗室，聯合港澳推動科研攻關取得更大進展。    三是強化全方位互聯互通。將攜手港澳用好管好港珠澳大橋，加快推進跨珠江口通道建設，不斷提升大灣區內外聯通能力。加快打通大灣區各類要素跨境流動的體制機制障礙，進一步提升人員車輛往來、貨物通關、資金跨境、數據安全傳輸等便利化水平。進一步深化大灣區教育、醫療、社會保障等領域的民生合作，促進公共服務融通共享。    四是穩步擴大制度型開放。將堅定不移推動全方位對外開放，穩步推進由商品和要素流動型開放，向規則、規制、管理、標準等制度型開放拓展，聯動港澳開拓國際市場、參與全球競爭，加快構建國際合作和競爭新優勢。    五是強化重大合作平台建設。將充分發揮橫琴、前海、南沙、河套等重大合作平台作用，聯合港澳因地制宜培育各平台主導優勢領域，持續強化制度創新與規則試驗，積極推動與港澳公共服務體系銜接，“以點帶面”引領粵港澳深度融合發展。    本報記者　　牛寅虎　　圖／文,http://www.macaodaily.com/html/2024-06/12/content_1761361.htm,圍繞鞏固香港金融、航運、商貿等中心地位，以及支持澳門打造世界旅遊休閒中心，聚焦跨境基礎設施建設、科技創新合作、產業體系共建、民生深度融合等重點領域，積極對接香港北部都會區開發建設和澳門“一加四”適度多元發展策略，更好支持港澳融入國家發展大局,央媒 及粵 港澳 廿三 家媒體 逾 百記者 聯合 採訪         “ 機遇灣區 ” 展 “ 一國 兩制 ” 優勢         “ 機遇灣區 ” “ 機遇 香港 ” “ 機遇 澳門 ” 主題 採訪 活動 今日 在 廣州 啟動 ， 央媒 及粵 港澳 廿三 家媒體 ， 逾 百名 記者 將到 訪廣州 、 深圳 、 香港 、 澳門 、 橫琴 等 地 ， 開展 為期 九天 的 聯合 採訪 活動 ， 全面 感知 粵 港澳 大灣區 建設 的 新 進展 和 新氣象 。         （ 廣州 十一日 電 ）         撑澳 打造 世旅 中心         “ 機遇灣區 ” 廣東 主題 採訪 活動 情況 介紹會 今日 上午 在廣 州市 廣東大廈 舉行 。 廣東 省委常委 、 常務 副 省長 張虎 表示 ， 下 一步 ， 將圍 繞 支持 澳門 打造 世界 旅遊 休閒 中心 ， 積極 對 接澳門 “ 一加 四 ” 適度 多元 發展 策略 ， 更好 支持 澳門 融入 國家 發展 大局 。         張虎 指出 ， 經過 五年 努力 ， 大灣區 綜合 實力 不斷 增強 ， 粵 港澳 合作 更加 廣泛 深入 。 粵 港澳 大灣區 經濟 總量 從 二 〇 一 八年 十點 八萬 億元 ， 到 二 〇 二三年 突破 十四 萬億元 ， 以 不到 全國 百分之 〇 點六 的 國土 面積 ， 創造 了 全國 九分 之一 的 經濟 總量 ， 高質量 發展 潛力 和 動能 不斷 釋放 ， 充分 展現 出 “ 一國 兩制 ” 的 制度 優勢 和 勃勃 生機 。         粵 港澳 大灣區 建設 啟動 以來 ， 廣東將 堅持 把 規劃 抓 在 手上 、 把 項 目落 在 地上 、 把 未來融 在 路上 、 把 百姓 記在 心上 ， 把 大灣區 建設 作為 廣東 深化改革 開放 的 大機遇 、 大 文章 抓緊 做實 ， 舉 全省 之力 辦好 這件 大事 ， 攜手 港澳 打造 融入 國內 國際 雙循環 、 走出 高質量 發展 之路 、 彰顯 中國式 現代化 特質 的 大灣區 。         聚焦 五面 重點 發力         下 一步 ， 將 聚焦 五個 方面 重點 發力 。 一是 強化 發展 戰略 協同 聯動 。 圍繞 鞏固 香港 金融 、 航運 、 商貿 等 中心 地位 ， 以及 支持 澳門 打造 世界 旅遊 休閒 中心 ， 聚焦 跨境 基礎 設施 建設 、 科技 創新 合作 、 產業 體系 共建 、 民生 深度 融合 等 重點 領域 ， 積極 對 接 香港 北部 都 會區 開發 建設 和 澳門 “ 一加 四 ” 適度 多元 發展 策略 ， 更好 支持 港澳 融入 國家 發展 大局 。         二是 強化 科技 產業 互促 雙強 。 將 加快 建立 與 港澳 及國際 有效 對接 的 科研 管理制度 ， 持續 推動 重大 科技 基礎 設施 、 高水平 實驗室 等 創新 平台 共建 共用 共享 ， 聚焦 前沿 優勢 領域 新建 一批 粵 港澳 聯合 實驗室 ， 聯合 港澳 推動 科研 攻關 取得 更大 進展 。         三是 強化 全方位 互聯 互通 。 將攜手 港澳 用 好 管好 港珠 澳大橋 ， 加快 推進 跨 珠江口 通道 建設 ， 不斷 提升 大灣區 內外 聯通 能力 。 加快 打通 大灣區 各類 要素 跨境 流動 的 體制 機制 障礙 ， 進 一步 提升 人員車輛 往來 、 貨物 通關 、 資金 跨境 、 數據 安全 傳輸 等 便利化 水平 。 進 一步 深化 大灣區 教育 、 醫療 、 社會 保障 等 領域 的 民生 合作 ， 促進 公共 服務 融通 共享 。         四是 穩步 擴大 制度 型 開放 。 將堅定 不移 推動 全方位 對外 開放 ， 穩步 推進 由 商品 和 要素 流動型 開放 ， 向 規則 、 規制 、 管理 、 標準 等 制度 型 開放 拓展 ， 聯動 港澳 開拓國際 市場 、 參與 全球 競爭 ， 加快 構建國際 合作 和 競爭 新 優勢 。         五是 強化 重大 合作 平台 建設 。 將 充分 發揮 橫琴 、 前 海 、 南沙 、 河套 等 重大 合作 平台 作用 ， 聯合 港澳 因地制宜 培育 各 平台 主導 優勢 領域 ， 持續 強化 制度 創新 與 規則 試驗 ， 積極 推動 與 港澳 公共 服務體 系銜 接 ， “ 以點 帶面 ” 引領粵 港澳 深度 融合 發展 。         本報 記者 　 　 牛 寅虎 　 　 圖 ／ 文,2024-06-12
