Title,Content,Link,Summary,Preprocessed_Content,Date
人工島燃料中途倉月內竣工,涉道路設計連建造工程    人工島燃料中途倉月內竣工    【本報消息】位於港珠澳人工島的燃料中途倉即將完工。根據公建局網站顯示，該中途倉及連接道路設計連建造工程預計本月竣工。政府過往曾表示，待工程完工後，將把青洲臨時燃料中途倉搬遷至港珠澳大橋澳門口岸人工島燃料中途倉。    青洲大爆炸惹關注    過去，政府對危險品的監管不足，導致危險品在社區散落。二〇〇三年時，青洲禁區內一個非法儲存大量危險品的倉庫在深夜發生大爆炸，所幸周圍近十個石油氣庫及危險品中途倉未受影響。事件凸顯危險品儲存和監管的問題，引起公眾高度關注。    隨後，政府投資興建青洲臨時燃料中途倉，將青洲區內五個分散營運的燃料倉庫集中遷移至此，以便於管理和監督，措施一直持續至今。然而，附近居民擔心青洲燃料中轉倉庫如同一顆定時炸彈，一旦發生意外，可能會再次引發爆炸，因此一直強烈要求遷移。直到“危險品監管法律制度”立法後，政府提出將青洲臨時中轉倉庫遷移到人工島，並允許現有的五家運營公司搬遷。    造價近四千七百萬    新燃料中途倉位於人工島東停車場對開近海地段，佔地面積約三千二百九十九平方米，於二〇二三年委託中德工程有限公司承建，造價為四千六百九十八萬元，工期共四百二十個工作天，預計於今年九月竣工。    當局還計劃在九澳興建永久儲存倉，但該幅土地收回過程遇到司法訴訟，公眾未知最新進展。,http://www.macaodaily.com/html/2024-09/03/content_1778781.htm,隨後，政府投資興建青洲臨時燃料中途倉，將青洲區內五個分散營運的燃料倉庫集中遷移至此，以便於管理和監督，措施一直持續至今,涉 道路 設計連 建造 工程         人工 島 燃料 中途 倉月 內 竣工         【 本報 消息 】 位 於 港珠澳 人工 島的 燃料 中途 倉 即將 完工 。 根據 公建局 網站 顯示 ， 該 中途 倉及 連接 道路 設計連 建造 工程 預計 本月 竣工 。 政府 過往 曾 表示 ， 待 工程 完工 後 ， 將把 青洲 臨時 燃料 中途 倉 搬 遷 至 港珠 澳大橋 澳門 口岸 人工 島 燃料 中途 倉 。         青洲 大 爆炸 惹 關注         過去 ， 政府 對 危險品 的 監管 不足 ， 導致 危險品 在 社區 散落 。 二 〇 〇 三年 時 ， 青洲 禁區 內 一個 非法 儲存 大量 危險品 的 倉庫 在 深夜 發生 大 爆炸 ， 所幸 周圍 近十個 石油 氣庫 及 危險品 中途 倉未受 影響 。 事件 凸顯 危險品 儲存 和 監管 的 問題 ， 引起 公眾 高度 關注 。         隨後 ， 政府 投資興建 青洲 臨時 燃料 中途 倉 ， 將 青洲 區內 五個 分散 營運 的 燃料 倉庫 集中 遷移 至此 ， 以便 於 管理 和 監督 ， 措施 一直 持續 至今 。 然而 ， 附近 居民 擔心 青洲 燃料 中轉 倉庫 如同 一顆 定 時炸彈 ， 一旦 發 生意 外 ， 可能 會 再次 引發 爆炸 ， 因此 一直 強烈 要求 遷移 。 直到 “ 危險品 監管 法律 制度 ” 立法 後 ， 政府 提出 將 青洲 臨時 中轉 倉庫 遷移 到 人工 島 ， 並允 許現 有 的 五家 運營 公司 搬遷 。         造價近 四千七百 萬         新 燃料 中途 倉位 於 人工 島東 停車場 對 開 近海 地段 ， 佔 地面 積約 三千 二百九十九 平方米 ， 於 二 〇 二三年 委 託 中德 工程 有限公司 承建 ， 造價 為 四千 六百 九十八 萬元 ， 工期 共 四百 二十 個 工作 天 ， 預計 於 今年 九月 竣工 。         當局 還計劃 在 九 澳興建 永久 儲存 倉 ， 但 該 幅 土地 收回 過程 遇到 司法 訴訟 ， 公眾 未知 最新 進展 。,2024-09-03
(新聞小語)整合資源消弭生源變化影響   夏耘,整合資源消弭生源變化影響    新學年伊始，大部分中、小學生昨日重啟校園生活。今年初中一年級學生較上一學年增加約千二人，部分學生開學之際仍為找學位苦惱。雖然在當局協調下，大部分適齡學生可升讀初一，但可以預見未來幾年初中學額仍較緊張，與小一生源稀疏的情況形成反差，學額需求變化須當局及早部署應對。    新學年前夕，各方嚴陣以待，昨天八成學生開學，交通明顯車多繁忙，部分學校選擇下午進行開學禮，有利學生錯峰出行。今日開始更多學生正式上課，料早上和下午高峰時段接送車輛更多，除了治安警須加派警員疏導各學校周邊交通，維持正常行車秩序外，家長更應配合，迅速接送學童上下車，避免在現場等候，影響其他駕駛者。    十餘年前的“龍B”、“馬B”效應，加上新移民適齡學生回流，令到今學年升讀初中一學生明顯增多，初一級是學校人數最多的一級，部分北區學校開設四至五班、每班人數多達四十人以上，臨近開學仍有不少學生到區內找學位。與此同時，受之前疫情和社會經濟影響，近年出生率持續下降，令到入讀幼稚園和小一的學生不斷回落，之前已有只開辦小學或部分弱勢學校面臨嚴峻的收生困境。出生率的高低起伏，直接影響學額的需求，現時情況是初中生源“爆棚”，甚至要一改維持多年的“小班制”，加收學生。但卻有小學面對收生進一步下跌，新學年或無奈裁員，甚至擔憂能否繼續辦學的問題。    回看早年和近年的出生率，隨後幾年，幼小的生源將更少，初一、二的學額需求則可能更大。面對學額階段性的需求，尤其今次初中和小幼面對不同的生源困局，特區政府除協助學生尋求學位，加強宣導公校學額資訊，另一方面更須扶持面對收生困難的弱勢學校，在政策上作出傾斜或資助，協助學校改善辦學條件和資源，鼓勵有條件的小幼學校加開中學部，加快新城A區學校村建設進程等，藉此進一步探討資源整合，優化辦學條件，靈活提供適當學額，滿足不同年齡階段的學生需求。    夏耘,http://www.macaodaily.com/html/2024-09/03/content_1778783.htm,面對學額階段性的需求，尤其今次初中和小幼面對不同的生源困局，特區政府除協助學生尋求學位，加強宣導公校學額資訊，另一方面更須扶持面對收生困難的弱勢學校，在政策上作出傾斜或資助，協助學校改善辦學條件和資源，鼓勵有條件的小幼學校加開中學部，加快新城A區學校村建設進程等，藉此進一步探討資源整合，優化辦學條件，靈活提供適當學額，滿足不同年齡階段的學生需求,整合 資源 消弭 生源 變化 影響         新學年 伊始 ， 大部分 中 、 小學生 昨日 重啟 校園 生活 。 今年初 中 一年 級學生 較 上 一學年 增加 約 千 二人 ， 部分 學生 開學 之際 仍 為 找 學位 苦惱 。 雖然 在 當局 協調 下 ， 大部分 適齡 學生 可升讀 初一 ， 但 可以 預見 未來 幾年 初中 學額 仍 較 緊張 ， 與 小 一 生源 稀疏 的 情況 形成 反差 ， 學額 需求 變化須 當局 及早 部署 應對 。         新學年 前夕 ， 各方 嚴陣 以待 ， 昨天 八成 學生 開學 ， 交通 明顯車 多 繁忙 ， 部分 學校 選擇 下午 進行 開學禮 ， 有利 學生 錯峰 出行 。 今日 開始 更 多學生 正式 上課 ， 料 早上 和 下午 高峰 時段 接送 車輛 更 多 ， 除了 治安警 須加 派 警員 疏導 各學校 周邊 交通 ， 維持 正常 行車 秩序 外 ， 家長 更 應 配合 ， 迅速 接送 學童 上下 車 ， 避免 在 現場 等候 ， 影響 其他 駕駛者 。         十餘 年前 的 “ 龍 B ” 、 “ 馬 B ” 效應 ， 加上 新 移民 適齡 學生 回流 ， 令到 今學年 升讀 初中 一學生 明顯 增多 ， 初一 級 是 學校 人數 最 多 的 一級 ， 部分 北區 學校 開設 四至 五班 、 每班 人數 多 達 四十 人 以上 ， 臨近 開學 仍 有 不少 學生 到區 內 找 學位 。 與 此 同時 ， 受 之前 疫情 和 社會 經濟 影響 ， 近年 出生率 持續 下降 ， 令到 入讀 幼稚 園和小一 的 學生 不斷 回落 ， 之前 已有 只開 辦小學 或 部分 弱勢 學校 面臨 嚴峻 的 收生 困境 。 出生率 的 高低 起伏 ， 直接 影響 學額 的 需求 ， 現時 情況 是 初中 生源 “ 爆棚 ” ， 甚至 要 一 改維持 多年 的 “ 小班制 ” ， 加收 學生 。 但 卻 有 小學面 對 收生進 一步 下跌 ， 新學年 或 無奈裁員 ， 甚至 擔憂 能否 繼續 辦學 的 問題 。         回看 早年 和 近年 的 出生率 ， 隨後幾年 ， 幼小 的 生源 將更少 ， 初一 、 二 的 學額 需求 則 可能 更大 。 面對 學額 階段 性 的 需求 ， 尤其 今 次 初中 和 小 幼面 對 不同 的 生源 困局 ， 特區 政府 除協助 學生 尋求 學位 ， 加強 宣導 公校 學額 資訊 ， 另一方面 更須 扶持 面對 收生 困難 的 弱勢 學校 ， 在 政策 上 作出 傾斜 或 資助 ， 協助 學校 改善 辦學 條件 和 資源 ， 鼓勵 有 條件 的 小 幼學校 加開 中學部 ， 加快 新城 A 區學校 村建設 進程 等 ， 藉此 進 一步 探討 資源 整合 ， 優化 辦學 條件 ， 靈活 提供 適當 學額 ， 滿足 不同 年齡 階段 的 學生 需求 。         夏耘,2024-09-03
今明非常酷熱,今明非常酷熱    【本報消息】氣象局已發出橙色高溫提示，預料今明兩日天氣非常酷熱，部分地區最高氣溫將達到攝氏三十六度或以上，大眾應慎防中暑，避免在烈日下進行戶外活動及多補充水分。    預測今日天氣酷熱，天晴，部分時間多雲，吹微風，氣溫為攝氏二十七至三十五度，相對濕度百分之五十五至九十五。    路邊、高密度住宅區、一般性空氣質量水平普通，沿海地區吹二至三級東至東北風，視野平常至良好。    預測明日天氣酷熱，多雲，部分時間有陽光，有幾陣驟雨，可能有雷暴，吹二至三級偏北風，氣溫攝氏二十七至三十四度，相對濕度為百分之六十至九十五。    昨日天晴，部分時間多雲，氣溫介乎攝氏二十七至三十三度，相對濕度百分之六十至九十五，錄得最高紫外線指數為九點七，平均為五點三，強度屬於中等。,http://www.macaodaily.com/html/2024-09/03/content_1778784.htm,預測明日天氣酷熱，多雲，部分時間有陽光，有幾陣驟雨，可能有雷暴，吹二至三級偏北風，氣溫攝氏二十七至三十四度，相對濕度為百分之六十至九十五,今明 非常 酷熱         【 本報 消息 】 氣象局 已 發出 橙色 高溫 提示 ， 預料 今明 兩日 天氣 非常 酷熱 ， 部分 地區 最高 氣溫 將達 到 攝氏 三十六 度 或 以上 ， 大眾 應 慎防 中暑 ， 避免 在 烈日 下進 行戶 外 活動 及 多 補充 水分 。         預測 今日 天氣 酷熱 ， 天晴 ， 部分 時間 多 雲 ， 吹 微風 ， 氣溫 為 攝氏 二十七 至 三十五 度 ， 相對 濕度 百分之五十 五至 九 十五 。         路邊 、 高密度 住宅 區 、 一般性 空氣 質量 水平 普通 ， 沿海 地區 吹二至 三級 東至 東北風 ， 視野 平常 至 良好 。         預測 明日 天氣 酷熱 ， 多 雲 ， 部分 時間 有陽光 ， 有 幾陣 驟雨 ， 可能 有 雷暴 ， 吹二至 三級 偏北 風 ， 氣溫 攝氏 二十七 至 三十四 度 ， 相對 濕度 為 百分之六十 至 九 十五 。         昨日 天晴 ， 部分 時間 多 雲 ， 氣溫 介乎 攝氏 二十七 至 三十三 度 ， 相對 濕度 百分之六十 至 九 十五 ， 錄得 最高 紫外 線 指數 為 九點 七 ， 平均 為 五點 三 ， 強度屬 於 中等 。,2024-09-03
逸韻方遒書篆展昨開幕,呈十三澳青藝術家五十佳作    逸韻方遒書篆展昨開幕    【本報消息】由澳門文化界聯合總會、澳門青年美術協會主辦，獲澳門美術協會、澳門何族崇義堂聯誼會支持的“逸韻方遒——澳門青年書法篆刻展” ，昨假何族崇義堂二樓盛荷堂開幕，匯聚十三名澳門青年藝術家五十多件精心之作。參展者以筆為媒，以刀為器，將內心情感與對生活的感悟融入到每一件作品中。    開幕儀式昨日下午五時舉行。中聯辦宣文部副部長白冰，文化局長梁惠敏，文化發展基金行政委員許鑫源，立法議員陳浩星，澳門日報常務副總編輯蔡彩蓮，澳門文化界聯合總會秘書長梁嘉寶，澳門書法篆刻協會會長蕭春源，澳門美術協會會長陸曦，澳門文化界聯合總會書法家專委會主任何斌等出席主禮。    是次展覽匯聚十三位澳門青年藝術家五十多件精心之作，包括吳金楓、李嘉瀚、洪尚專、陳星宇、莫羲世、張子君、鄧佳來、楊詠欣、楊嘉凡、鄭佩儀 、蔡坤煌、譚俊傑、嚴鶴麟。涵蓋篆書、隸書、楷書、行書、草書及篆刻等作品。    傳承中華優秀文化    參展藝術家代表吳金楓致詞稱，澳門回歸祖國廿五年來，澳門新青年始終愛國愛澳，對中國傳統文化熱愛有加。中國書法和篆刻的發展歷史源遠流長，不僅承載着千年的歷史沉澱，更是中華文明不可或缺的文化瑰寶。祈願新時代澳門新青年共同努力，更好弘揚及傳承中華優秀書法篆刻文化，融入國家文化強國建設，為搭建澳門中西文化交流橋樑添磚加瓦。    活動期間將舉辦工作坊和交流活動，並邀請參展青年藝術家與觀眾分享創作心得和經驗。展期至本月三十日。,http://www.macaodaily.com/html/2024-09/03/content_1778789.htm,呈十三澳青藝術家五十佳作    逸韻方遒書篆展昨開幕    【本報消息】由澳門文化界聯合總會、澳門青年美術協會主辦，獲澳門美術協會、澳門何族崇義堂聯誼會支持的“逸韻方遒——澳門青年書法篆刻展” ，昨假何族崇義堂二樓盛荷堂開幕，匯聚十三名澳門青年藝術家五十多件精心之作,呈 十三 澳青 藝術家 五十 佳作         逸 韻方 遒書 篆展 昨開幕         【 本報 消息 】 由 澳門 文化界 聯合 總會 、 澳門 青年 美術 協會 主辦 ， 獲澳門 美術 協會 、 澳門 何族 崇義堂 聯誼會 支持 的 “ 逸 韻方 遒 — — 澳門 青年 書法 篆刻展 ”   ， 昨假 何族 崇義堂 二樓 盛 荷堂 開幕 ， 匯聚 十三名 澳門 青年 藝術家 五十多件 精心 之作 。 參展者 以筆 為 媒 ， 以刀 為器 ， 將內心 情感 與 對 生活 的 感悟 融入 到 每一件 作品 中 。         開幕 儀式 昨日 下午 五時 舉行 。 中聯辦 宣文 部副 部長 白冰 ， 文化局 長 梁惠敏 ， 文化 發展 基金 行政 委員 許鑫源 ， 立法 議員陳浩星 ， 澳門 日 報常務 副 總 編輯 蔡彩蓮 ， 澳門 文化界 聯合 總會 秘書長 梁嘉寶 ， 澳門書法 篆刻 協會會長 蕭春源 ， 澳門 美術 協會會長 陸曦 ， 澳門 文化界 聯合 總會書 法家 專委會主 任何 斌 等 出席 主禮 。         是 次 展覽 匯聚 十三位 澳門 青年 藝術家 五十多件 精心 之作 ， 包括 吳金楓 、 李嘉瀚 、 洪尚專 、 陳 星宇 、 莫羲世 、 張子君 、 鄧佳來 、 楊詠 欣 、 楊嘉凡 、 鄭佩儀   、 蔡坤煌 、 譚俊傑 、 嚴鶴麟 。 涵蓋 篆書 、 隸書 、 楷書 、 行書 、 草書及 篆刻 等 作品 。         傳承中華 優秀 文化         參展 藝術家 代表 吳金楓致 詞稱 ， 澳門 回歸祖國 廿五年 來 ， 澳門 新 青年 始終 愛國 愛澳 ， 對 中國 傳統 文化 熱愛 有加 。 中國書法 和 篆刻 的 發展歷 史源 遠流長 ， 不僅 承載 着 千年 的 歷史 沉 澱 ， 更是 中華 文明 不可或缺 的 文化 瑰 寶 。 祈願 新 時代 澳門 新 青年 共同努力 ， 更好 弘揚 及 傳承中華 優秀書法 篆刻 文化 ， 融入 國家 文化 強國 建設 ， 為 搭建 澳門 中西文化 交流 橋 樑 添磚 加瓦 。         活動 期間 將舉 辦 工作坊 和 交流 活動 ， 並邀 請 參展 青年 藝術家 與 觀眾 分享 創作 心得 和 經驗 。 展期 至 本月 三十日 。,2024-09-03
在葡澳生考察灣區行業發展,在葡澳生考察灣區行業發展    教青局轄下語言推廣中心於上月組織“在葡澳生大灣區交流團”，共十七名正就讀葡萄牙天主教大學及波爾圖大學的澳門學生參加。    交流團先後到訪廣州市荔灣區人民法院、科大訊飛華南人工智能研究院、天河區港澳青年創業服務中心，並邀請港澳創業青年分享創業心得和經歷，了解天河區對港澳青年創業的政策服務，探索灣區就業機遇。另外，分別參觀湯臣倍健透明工廠、粵港澳現代農業示範園，了解灣區城市有關大健康產業的發展，認識推動珠海現代農業發展的重點專案。最後，交流團到訪廣州老街永慶坊，感受傳統文化與現代生活的融合。    是次交流團為在葡澳生提供了解大灣區發展的機會，拓展其個人視野，有助學生將自身塑造成具備實踐能力、創新思維和國際視野的複合型人才。,http://www.macaodaily.com/html/2024-09/03/content_1778747.htm,在葡澳生考察灣區行業發展    教青局轄下語言推廣中心於上月組織“在葡澳生大灣區交流團”，共十七名正就讀葡萄牙天主教大學及波爾圖大學的澳門學生參加,在 葡澳生 考察 灣區 行業 發展         教青 局轄下 語言 推廣 中心 於 上 月 組織 “ 在 葡澳生 大灣區 交流 團 ” ， 共 十七名 正 就 讀 葡萄牙 天主教 大學及 波爾圖 大學 的 澳門 學生 參加 。         交流 團先後到 訪廣 州市 荔灣區 人民法院 、 科大 訊 飛華南 人工智能 研究院 、 天河 區 港澳 青年 創業 服務 中心 ， 並邀 請 港澳 創業 青年 分享 創業 心得 和 經歷 ， 了解 天河 區對 港澳 青年 創業 的 政策 服務 ， 探索 灣區 就業 機遇 。 另外 ， 分別 參觀 湯臣 倍 健 透明 工廠 、 粵 港澳 現代 農業示 範園 ， 了解 灣區 城市 有關 大 健康 產業 的 發展 ， 認識 推動 珠海 現代 農業 發展 的 重點 專案 。 最 後 ， 交流 團到 訪廣州 老街 永慶坊 ， 感受 傳統 文化 與 現代 生活 的 融合 。         是 次 交流 團為 在 葡澳生 提供 了解 大灣區 發展 的 機會 ， 拓展 其個 人視野 ， 有助 學生將 自身 塑造成 具備 實踐 能力 、 創新思維 和 國際視野 的 複 合型 人才 。,2024-09-03
澳大清華儀仗隊升國旗交流,澳大清華儀仗隊升國旗交流    清華大學學生國旗儀仗隊日前到訪澳門大學，與澳大國旗儀仗隊進行升旗儀式展示，吸引眾多師生觀禮。    清華大學學生國旗儀仗隊隊員出發到達觀禮地點，其後澳大國旗儀仗隊隊員亦以整齊步伐，護衛着國旗、區旗和校旗，緩緩向升旗台邁進。隨着國歌響起，升旗儀式展示開始，台下觀眾莊嚴肅立，向三面旗幟報以注目禮。有學生表示，觀看升旗儀式展示讓他內心不由自主升起強烈的愛國之情，因為這面鮮豔的旗幟代表着國家，令人自豪和敬畏。    兩隊隊員隨後交流座談，由澳大學生事務長彭執中與清華黨委武裝部余中淇主持。兩隊成員均表示，是次活動經歷將成為兩隊成員珍貴回憶，並激勵在未來的學習和生活中，繼續傳承和弘揚愛國主義精神。隨後兩隊隊員還交換各自旗隊的隊徽及臂章作留念。,http://www.macaodaily.com/html/2024-09/03/content_1778748.htm,澳大清華儀仗隊升國旗交流    清華大學學生國旗儀仗隊日前到訪澳門大學，與澳大國旗儀仗隊進行升旗儀式展示，吸引眾多師生觀禮,澳 大清 華儀 仗 隊 升國旗 交流         清華大學學 生國旗 儀仗隊 日前 到訪 澳門 大學 ， 與 澳大國旗 儀仗隊 進行 升旗 儀式 展示 ， 吸引 眾多 師生 觀禮 。         清華大學學 生國旗 儀仗隊 隊員出 發到 達 觀禮 地點 ， 其後澳 大國旗 儀仗隊 隊員亦以 整齊 步伐 ， 護衛着 國旗 、 區旗 和 校旗 ， 緩緩 向 升旗台 邁進 。 隨着 國歌響 起 ， 升旗 儀式 展示 開始 ， 台下 觀眾莊 嚴肅立 ， 向 三面 旗幟 報以 注目 禮 。 有學生 表示 ， 觀看 升旗 儀式 展示 讓 他 內心 不由自主 升起 強烈 的 愛國 之情 ， 因為 這面 鮮 豔 的 旗幟 代表 着 國家 ， 令人 自豪 和 敬畏 。         兩隊 隊員 隨後 交流 座談 ， 由 澳大學 生事 務長 彭 執中 與 清華黨 委武裝 部余中 淇 主持 。 兩隊 成員均 表示 ， 是 次 活動經 歷將 成為 兩隊 成員珍貴 回憶 ， 並激勵 在 未來 的 學習 和 生活 中 ， 繼續 傳承 和 弘揚 愛國主義 精神 。 隨後兩隊 隊員 還交換 各自 旗隊 的 隊徽及 臂章 作 留念 。,2024-09-03
澳生赴愛爾蘭參地理奧賽,澳生赴愛爾蘭參地理奧賽    第二十屆國際地理奧林匹克競賽八月十九日至廿五日在愛爾蘭梅努斯大學舉行，吸引來自全球約一百八十名優秀選手參與。澳門地理暨教育研究會派出六名師生代表澳門參賽。活動獲教青局資助。    參賽隊伍由培正教師周慧心和濠江中學附屬英才學校教師黃洛茵帶領，學生分別為培正中學池峰、菜農子弟學校蕭愛琳、濠江中學附屬英才學校梁倬僑和鏡平學校莊騰威。此次競賽包括野外實地測驗、地理議題論述和多媒體測驗三個主要部分。學生不僅需要野外觀察、記錄和評估，還要在短時間內繪製地景圖、土地利用圖及書面申論，非常考驗學生的綜合技能和地理知識應用。    參賽學生表示，是次比賽不僅讓他們獲得寶貴的參與證書，更學到如何從不同角度觀察世界，並將地理知識應用於解決實際問題。,http://www.macaodaily.com/html/2024-09/03/content_1778749.htm,參賽學生表示，是次比賽不僅讓他們獲得寶貴的參與證書，更學到如何從不同角度觀察世界，並將地理知識應用於解決實際問題,澳生 赴 愛爾蘭 參 地理 奧賽         第二十 屆國際 地理 奧林匹克 競賽 八月 十九日 至 廿五日 在 愛爾蘭梅 努斯大學 舉行 ， 吸引 來 自 全球 約 一百八十 名 優秀 選手 參 與 。 澳門 地理 暨 教育 研究 會 派出 六名 師生 代表 澳門 參賽 。 活動 獲教 青局 資助 。         參賽 隊伍 由培 正教 師周 慧心 和 濠江 中學 附屬 英才 學校 教師 黃 洛茵 帶領 ， 學 生分 別為培 正中 學池峰 、 菜農 子弟 學校 蕭愛琳 、 濠江 中學 附屬 英才 學校 梁倬僑 和 鏡 平學校 莊騰威 。 此次 競賽 包括 野外 實地 測驗 、 地理 議題 論述 和 多 媒體 測驗 三個 主要 部分 。 學生 不僅 需要 野外 觀察 、 記錄 和 評估 ， 還要 在 短 時間 內 繪 製 地 景 圖 、 土地利用 圖及 書面 申論 ， 非常 考驗 學生 的 綜合 技能 和 地理 知識 應用 。         參賽 學生 表示 ， 是 次 比賽 不僅 讓 他們 獲得 寶貴 的 參 與 證書 ， 更學到 如何 從 不同 角度 觀察 世界 ， 並將 地理 知識 應用 於 解決 實際 問題 。,2024-09-03
