Title,Content,Link,Summary,Preprocessed_Content,Date
歐冠改制有利新丁競爭   足球評述員  微灝,歐冠改制有利新丁競爭    今季歐洲五大聯賽充滿驚喜，除利華古遜贏得隊史首個德甲冠軍外，多支球隊亦爭取到久違甚至是隊史首次的歐冠資格，包括英超維拉、西甲傑羅納、意甲博洛尼亞、法甲比斯特，還有德甲史特加。    下季歐冠有五支新丁，數目之多是近年罕見。按現時的種子分配制度，計算球隊在過去五年的歐戰成績排名，這些新丁球隊大多被列為第三或第四檔次。若按過往四隊一組分組，很大機會抽到兩支傳統強隊同組。    不過歐冠下季改制，首輪雖按舊制分為四個檔次，但將取消分組制，改為所有球隊都須與每個檔次兩支不同球隊對戰，一共八場，然後按得分及得失球排名次。相比下，高檔次的球隊優勢大致喪失，因對手從以往的第三、第四檔次，變成同樣需要面對第一、第二檔次的傳統強隊，首輪對手與低檔次球隊再無差異。八輪比賽後，前八名直接晉級十六強，並在次回合獲主場優勢。而第九至廿四名的球隊，將進行兩回合主客制淘汰賽，爭入八強。若套用舊制，以往小組第三的球隊將降級至歐霸盃，但如今將獲一次復活的機會，讓球隊較多容錯的空間。    新賽制削弱了傳統歐戰球隊的既有優勢，有些球隊近年在歐冠戰力大不如前，如賓菲加、波爾圖、薩克達。但因在國內競爭較低，長年能取得參賽資格累積歐戰分數，但戰力配不上種子。新制度下更容易洗牌，有利新丁在公平環境下爭出線，淘汰賽對戰組合亦將有較多變化，增加新鮮感。    足球評述員  微灝,http://www.macaodaily.com/html/2024-05/26/content_1757732.htm,不過歐冠下季改制，首輪雖按舊制分為四個檔次，但將取消分組制，改為所有球隊都須與每個檔次兩支不同球隊對戰，一共八場，然後按得分及得失球排名次,歐冠 改制 有利 新丁 競爭         今季 歐洲 五大 聯賽 充滿 驚喜 ， 除利華古遜 贏得 隊史 首個 德甲 冠軍外 ， 多支 球隊 亦 爭取 到 久 違 甚至 是 隊史 首次 的 歐冠資格 ， 包括 英超 維拉 、 西甲 傑羅納 、 意甲 博洛尼 亞 、 法甲 比斯特 ， 還有 德甲 史特加 。         下季 歐冠有 五支 新 丁 ， 數目 之 多 是 近年 罕見 。 按現 時 的 種子 分配制度 ， 計算球隊 在 過去 五年 的 歐戰 成績 排名 ， 這些 新 丁球隊 大多 被 列為 第三 或 第四 檔次 。 若 按 過往 四隊 一組 分組 ， 很大 機會 抽到 兩支 傳統 強隊 同組 。         不過 歐冠 下季 改制 ， 首輪 雖 按 舊制 分為 四個 檔次 ， 但將 取消 分組制 ， 改為 所有 球隊 都須 與 每個 檔次 兩支 不同 球隊 對戰 ， 一共 八場 ， 然後按 得分 及 得 失球 排名 次 。 相比 下 ， 高檔次 的 球隊 優勢 大致 喪失 ， 因對 手 從 以往 的 第三 、 第四 檔次 ， 變成 同樣 需要 面對 第一 、 第二 檔次 的 傳統 強隊 ， 首輪 對 手 與 低 檔次 球隊 再 無 差異 。 八輪 比賽 後 ， 前 八名 直接 晉級 十六 強 ， 並在次 回合 獲主場 優勢 。 而 第九 至 廿四 名 的 球隊 ， 將進行 兩 回合 主客 制 淘汰 賽 ， 爭入 八強 。 若 套用 舊制 ， 以往 小組 第三 的 球隊 將降級 至 歐霸 盃 ， 但 如今 將獲 一次 復 活 的 機會 ， 讓 球隊 較 多容錯 的 空間 。         新賽制 削弱 了 傳統 歐戰球隊 的 既有 優勢 ， 有些 球隊 近年 在 歐冠戰力 大不如前 ， 如賓菲加 、 波爾圖 、 薩克達 。 但 因 在 國內 競爭 較 低 ， 長 年 能 取得 參賽 資格 累積 歐戰 分數 ， 但 戰力 配不上 種子 。 新 制度 下 更 容易 洗牌 ， 有利 新丁 在 公平 環境 下爭 出線 ， 淘汰 賽對戰 組合亦將 有 較 多 變化 ， 增加 新鮮感 。         足球 評述員     微灝,2024-05-26
AC彼奧利季尾“分手”,AC彼奧利季尾“分手”    【本報消息】意甲AC米蘭正式宣佈辭退主帥彼奧利。據意大利媒體報道，紅黑兵迅速找到替代人選，前羅馬教練方錫卡料在近日接掌，來季起成為紅黑兵新主帥。    AC在彼奧利帶領下，在前季贏得近二十年來首個聯賽錦標，惜未能延續強勢，儘管上季領軍殺入歐冠四強成功續命，但今季表現繼續下滑。聯賽保住亞軍，不過在歐冠盃小組出局，歐霸亦不敵意甲老對手羅馬在八強止步，加上國內盃賽同樣早早出局，整體表現不穩，令彼奧利在季中已盛傳不獲留任。最終AC正式公佈彼奧利將在季後離任。    盛傳方錫卡入主    AC早在季中已傳出來季易帥，但人選之一的盧比迪古爾不獲球迷支持，更為此一度發起抗議。多番轉折後，紅黑兵可望選定前羅馬主帥、現執教法甲里爾的方錫卡。據意媒報道，AC相中方錫卡在意甲的領軍經驗，亦對方錫卡擅於發掘、提拔隊內青訓的能力感滿意。方錫卡今夏將與里爾約滿，預料將與AC簽下兩至三年合約。    不獲續約的彼奧利亦不愁下家，據報來季易帥的拿坡里、博洛尼亞均對彼奧利有意，以至土超班霸費倫巴治同樣有意邀請彼奧利執教。    博洛煞科輸兩球    此外，博洛尼亞在煞科戰作客以○比二不敵熱拿亞，被同分的祖記憑較佳得失球升上第三。博洛尼亞跌落第四，不利羅馬在下季爭踢歐冠，因第五的阿特蘭大落後博洛尼亞兩分，但踢少兩場。,http://www.macaodaily.com/html/2024-05/26/content_1757733.htm,聯賽保住亞軍，不過在歐冠盃小組出局，歐霸亦不敵意甲老對手羅馬在八強止步，加上國內盃賽同樣早早出局，整體表現不穩，令彼奧利在季中已盛傳不獲留任,AC 彼奧利 季尾 “ 分手 ”         【 本報 消息 】 意甲 AC 米蘭 正式 宣 佈 辭 退主帥 彼奧利 。 據 意大利 媒體 報道 ， 紅黑兵 迅速 找到 替代 人選 ， 前羅馬 教練 方錫卡料 在 近日 接掌 ， 來季 起成 為 紅黑兵 新主帥 。         AC 在 彼 奧利帶 領下 ， 在 前季 贏得 近 二十年 來 首個 聯賽 錦標 ， 惜 未能 延續 強勢 ， 儘 管 上 季 領 軍 殺 入 歐 冠 四 強 成功 續命 ， 但 今 季表現 繼續 下滑 。 聯賽 保住 亞軍 ， 不過 在 歐冠 盃 小組 出局 ， 歐霸 亦 不 敵 意甲 老對 手羅馬 在 八強 止步 ， 加上 國內 盃 賽 同樣 早早 出局 ， 整體 表現 不穩 ， 令彼奧利 在 季中 已 盛傳 不 獲 留任 。 最終 AC 正式 公 佈 彼 奧利將 在 季後離任 。         盛傳 方錫卡 入主         AC 早 在 季中 已 傳出 來 季易帥 ， 但人選 之一 的 盧比 迪古 爾 不 獲 球迷 支持 ， 更為 此 一度 發起 抗議 。 多番 轉折 後 ， 紅黑兵 可望 選定 前羅馬 主帥 、 現執 教法 甲里爾 的 方錫卡 。 據意 媒報 道 ， AC 相 中方 錫卡 在 意甲 的 領軍經驗 ， 亦 對 方錫卡 擅 於 發掘 、 提拔 隊內 青訓 的 能力 感滿意 。 方錫卡 今夏 將與里爾約 滿 ， 預料將 與 AC 簽下 兩至 三年 合約 。         不 獲續 約 的 彼奧利 亦 不愁 下家 ， 據 報來 季易帥 的 拿 坡 里 、 博洛尼 亞均 對 彼奧利 有意 ， 以至 土超班 霸費倫巴治 同樣 有意 邀請 彼奧利 執教 。         博洛煞 科輸 兩球         此外 ， 博洛尼 亞在 煞科戰 作客 以 ○ 比二不敵 熱拿亞 ， 被 同分 的 祖記 憑 較佳得 失球 升 上 第三 。 博洛尼 亞 跌落 第四 ， 不利 羅 馬 在 下季 爭 踢 歐冠 ， 因 第五 的 阿特 蘭大落 後 博洛尼 亞兩分 ， 但 踢 少 兩場 。,2024-05-26
傑羅納收咧破“格”派七蛋,傑羅納收咧破“格”派七蛋    【本報消息】傑羅納在西甲煞科戰，杜夫比克大演帽子戲法兼助攻，在主場以七球大炒十人應戰的格蘭納達，以季軍“達”陣衝線，杜夫比克更登上射手榜領先。    提前鎖定前三的傑羅納煞科戰在主場鬥格蘭納達，力爭金靴的杜夫比克連同樸度、杜斯根哥夫攻堅。上半場尾段有杜斯根哥夫一傳一射，三十分鐘傳中助攻E加西亞頭鎚破網，三分鐘後再門前撞入，加上杜夫比克射入極刑，傑羅納半場領先三比○。    杜夫比克登射手榜首    傑羅納換邊後續攻，杜斯根哥夫在五十四分鐘門前撞入贏到四球；客軍有柏利斯迪在六十一分鐘被逐，踢多個的傑羅納有杜夫比克及史杜安尼在尾段互相助攻得手，杜夫比克在完場前射入十二碼完成帽子戲法，助傑羅納大勝七比○。    轟入三球的杜夫比克以廿三球暫升上射手榜首位與維拉利爾的索洛夫並列。傑羅納以第三完季，主帥米切爾為球隊過去一季的表現感驕傲：“今季的過程並不容易，但我們書寫了歷史。明天醒來就是新球季的開始，需要由零開始重新準備，希望我們同樣能像今季一樣，交出最好表現，為球迷送上一個精彩的球季。”,http://www.macaodaily.com/html/2024-05/26/content_1757735.htm,上半場尾段有杜斯根哥夫一傳一射，三十分鐘傳中助攻E加西亞頭鎚破網，三分鐘後再門前撞入，加上杜夫比克射入極刑，傑羅納半場領先三比○,傑羅納 收咧破 “ 格 ” 派七蛋         【 本報 消息 】 傑羅納 在 西甲 煞科戰 ， 杜夫 比克 大演 帽子 戲法 兼 助攻 ， 在 主場 以七球 大 炒十人 應戰 的 格蘭納達 ， 以季 軍 “ 達 ” 陣衝線 ， 杜夫 比克 更 登上 射手榜 領先 。         提前 鎖定 前 三 的 傑羅納 煞科戰 在 主場 鬥格蘭納達 ， 力爭 金靴 的 杜夫 比克 連同樸度 、 杜斯 根哥夫 攻堅 。 上半 場 尾段 有 杜斯 根哥夫 一傳 一射 ， 三十分 鐘傳 中 助攻 E 加西亞頭 鎚 破網 ， 三分 鐘後再 門前 撞入 ， 加上 杜夫 比克 射入 極刑 ， 傑羅納 半場 領先 三比 ○ 。         杜夫 比克 登 射手榜 首         傑羅納換 邊後續 攻 ， 杜斯 根哥夫 在 五十四 分鐘門 前 撞入 贏到 四球 ； 客軍有 柏利斯迪 在 六十一 分鐘 被 逐 ， 踢 多個 的 傑羅納 有 杜夫 比克 及史 杜安尼 在 尾段 互相 助攻 得手 ， 杜夫 比克 在 完場 前 射入 十二 碼 完成 帽子 戲法 ， 助傑羅納 大勝七比 ○ 。         轟入 三球 的 杜夫 比克 以 廿三 球 暫升 上 射手榜 首位 與 維拉利爾 的 索洛夫 並列 。 傑羅納以 第三 完季 ， 主帥 米 切爾為 球隊 過去 一季 的 表現 感驕傲 ： “ 今季 的 過程並 不 容易 ， 但 我們 書 寫 了 歷史 。 明天 醒來 就是 新 球季 的 開始 ， 需要 由 零開始 重新 準備 ， 希望 我們 同樣 能 像 今季 一樣 ， 交出 最好 表現 ， 為 球迷 送上 一個 精彩 的 球季 。 ”,2024-05-26
拉莫斯擬再離西維爾,拉莫斯擬再離西維爾    【本報消息】拉莫斯上季重投母會西維爾，但暗示或將再離開母會，轉戰其他聯賽，今晚迎戰巴塞可能是在西甲最後一戰。    卅八歲的拉莫斯上季約滿巴黎聖日門後，重返西甲重投母會西維爾，簽約一年。西維爾今季表現差勁，一直居中下游，已確定無緣來季歐戰，是近十年來首次。即將約滿的拉莫斯已暗示不會留隊：“正如我父親所說，我要活在當下，享受每一刻。自己已向年輕球員展示應有的精神面貌及對足球的飢餓感，希望年輕球員都能在球隊經歷困境時挺身而出，撐起球隊。”    據西班牙媒體報道，當球會來季沒有歐戰收入時必須削減開支，或因而導致拉莫斯離開。西維爾仍未向拉莫斯提出續約，預計今夏將以自由身離隊。卅八歲的拉莫斯仍受不少球隊青睞，近日傳出與美職聯的FC聖地亞哥及沙特球隊扯上關係。,http://www.macaodaily.com/html/2024-05/26/content_1757738.htm,拉莫斯擬再離西維爾    【本報消息】拉莫斯上季重投母會西維爾，但暗示或將再離開母會，轉戰其他聯賽，今晚迎戰巴塞可能是在西甲最後一戰,拉莫斯 擬再 離西維爾         【 本報 消息 】 拉莫斯 上 季重 投母會 西維爾 ， 但 暗示 或將 再 離開 母會 ， 轉戰 其他 聯賽 ， 今晚 迎戰 巴塞 可能 是 在 西甲 最後一戰 。         卅八歲 的 拉莫斯 上季 約 滿 巴黎 聖日門 後 ， 重返 西甲 重投母 會 西維爾 ， 簽約 一年 。 西維爾今 季表現 差勁 ， 一直 居 中下游 ， 已 確定 無緣 來季 歐戰 ， 是 近十年 來 首次 。 即將 約 滿 的 拉莫斯 已 暗示 不會 留隊 ： “ 正如 我 父親 所 說 ， 我要 活 在 當下 ， 享受 每一刻 。 自己 已 向 年 輕球員 展示 應有 的 精神面貌 及 對 足球 的 飢餓 感 ， 希望 年 輕球員 都 能 在 球隊 經歷 困境 時 挺身而出 ， 撐 起球 隊 。 ”         據 西班牙 媒體 報道 ， 當球會 來季 沒有 歐戰 收入 時必須 削 減開支 ， 或 因而 導致 拉莫斯 離開 。 西維爾 仍 未 向 拉莫斯 提出 續約 ， 預計 今夏 將以 自由 身離隊 。 卅八歲 的 拉莫斯 仍受 不少 球隊 青睞 ， 近日 傳出 與 美 職聯 的 FC 聖地 亞哥 及 沙特 球隊 扯 上關 係 。,2024-05-26
蔡倬堯破大會紀錄,分齡泳賽揭幕    蔡倬堯破大會紀錄    【本報消息】中國澳門游泳總會主辦的“第四十七屆澳門分齡游泳比賽”一連兩個周末、日假奧林匹克體育中心游泳館舉行，共有九個屬會逾五百名運動員角逐。昨首日賽事共誕生廿九面金牌，並打破兩項大會紀錄。蔡倬堯在男子一百蛙刷新大會紀錄，隨後再與隊友打破男女混合接力紀錄。    “第四十七屆澳門分齡游泳比賽”的對象為廿四歲及以下的運動員，按年齡分成男、女子組各有六個組別，除十八至廿四歲組外，另外五個組別皆設有個人全場錦標獎。賽事皆採用分組決賽制，昨日下午二時半進行首日賽事，先上演六至十二歲三個年齡組的各個單項和三個混合年齡組接力項目，共產生廿九面金牌。    今屆賽事首日刷兩項新紀錄，紅棉的蔡倬堯在男子九至十歲組一百米蛙游出一分三十秒五○，較大會紀錄快三秒二五，他隨後再聯同隊友陳詠欣、章馨妍及彭珏熙出戰男女六至十歲組四乘五十米混合泳接力，合力游出兩分卅三秒一七，將舊大會紀錄大幅推前六點○四秒。    陳珮琳林志聰今亮相    今日下午三時將進行第二日賽事，共進行卅四個項目，十三至廿四歲泳手將亮相，包括澳門紀錄保持者陳珮琳、鄭穎芝及分齡紀錄保持者林志聰、黃婉柔。,http://www.macaodaily.com/html/2024-05/26/content_1757741.htm,今屆賽事首日刷兩項新紀錄，紅棉的蔡倬堯在男子九至十歲組一百米蛙游出一分三十秒五○，較大會紀錄快三秒二五，他隨後再聯同隊友陳詠欣、章馨妍及彭珏熙出戰男女六至十歲組四乘五十米混合泳接力，合力游出兩分卅三秒一七，將舊大會紀錄大幅推前六點○四秒,分齡泳賽 揭幕         蔡倬堯 破大會 紀錄         【 本報 消息 】 中國 澳門 游泳 總會 主辦 的 “ 第四十七 屆 澳門 分齡 游泳 比賽 ” 一連 兩個 周末 、 日假 奧林匹克 體育 中心 游泳 館 舉行 ， 共有 九個 屬會 逾 五百名 運動員 角逐 。 昨 首日 賽事共誕生 廿九 面 金牌 ， 並 打破 兩項 大會 紀錄 。 蔡倬堯 在 男子 一百 蛙 刷新 大會 紀錄 ， 隨後再 與 隊友 打破 男女 混合 接力 紀錄 。         “ 第四十七 屆 澳門 分齡 游泳 比賽 ” 的 對象 為 廿四 歲 及 以下 的 運動員 ， 按年齡 分成 男 、 女子 組各有 六個 組別 ， 除 十八 至 廿四 歲 組外 ， 另外 五個 組別 皆 設有 個 人 全場 錦 標獎 。 賽事 皆 採用 分組 決賽制 ， 昨日 下午 二時 半 進行 首日 賽事 ， 先 上演 六至 十二 歲 三個 年齡 組 的 各個 單項 和 三個 混合 年齡 組 接力 項目 ， 共產生 廿九 面 金牌 。         今屆 賽事 首日 刷 兩項 新紀錄 ， 紅棉 的 蔡倬堯 在 男子 九至 十歲 組 一百米 蛙游出 一分 三十秒 五 ○ ， 較大會 紀錄 快 三秒 二五 ， 他 隨後再 聯同 隊友 陳 詠 欣 、 章馨妍 及 彭珏熙 出戰 男女 六至 十歲 組四乘 五十米 混合泳 接力 ， 合力 游出 兩分 卅三 秒 一七 ， 將舊 大會 紀錄 大幅 推前 六點 ○ 四秒 。         陳 珮 琳 林志聰今 亮相         今日 下午 三時將 進行 第二日 賽事 ， 共進 行卅四個 項目 ， 十三 至 廿四 歲泳 手將 亮相 ， 包括 澳門 紀錄 保持者 陳 珮 琳 、 鄭穎芝 及 分齡 紀錄 保持者 林志聰 、 黃 婉柔 。,2024-05-26
配套活動助增辦賽效益   賈大廚,配套活動助增辦賽效益    引入體育活動及盛事並不能僅滿足於舉辦，要真正成功，其他周邊活動要做足之餘，亦要與活動的主角做好協調及溝通，把效益最大化。    本澳體育活動及盛事一浪接一浪，繼月前的乒乓球世界盃賽、日前葡萄牙傳奇的五人足球賽，還有今周展開的世界女排聯賽，先後有不同項目的現役且當打，及退役的巨星來澳作賽或表演。舉行盛事對小城觀眾及球迷是非常難得機會，可近距離欣賞喜愛的運動員風采，亦可觀看高水平比賽，體驗運動員的拼搏精神。然而，順利舉行僅是成功一半，要圓滿便要將效益最大化。    活動要圓滿舉行，便要讓觀眾從活動中感受到受重視、尊重以及與運動員有否更多互動環節，滿足他們追“星”的需求。當然，前提是不影響活動及比賽流程。若能做得好，觀眾反饋佳，對主辦方辦賽口碑會帶來更正面影響。若做得不好便會與鄰埠在年初的足球表演賽般，受盡各方詬病。    剛結束的五人足球表演賽及即將舉行的世界女排聯賽，主辦方均安排不錯。如安排運動員參與訓練班、簽名會，與本澳運動員真情對話，賽後讓球員在場邊為球迷送親筆簽名，落力表演讓球迷一飽眼福等，均獲觀眾一致好評，認為應多搞這類回饋活動。這些活動固然要事先與球員協調好，球員能贏得親民形象，增加支持者。收穫豐富的受眾滿足之餘亦會間接助力宣傳，主辦方則贏得口碑，得到最大效益，形成三贏局面。    賈大廚,http://www.macaodaily.com/html/2024-05/26/content_1757744.htm,如安排運動員參與訓練班、簽名會，與本澳運動員真情對話，賽後讓球員在場邊為球迷送親筆簽名，落力表演讓球迷一飽眼福等，均獲觀眾一致好評，認為應多搞這類回饋活動,配套 活動助 增辦賽 效益         引入 體育 活動 及 盛事 並 不能 僅滿足 於 舉辦 ， 要 真正 成功 ， 其他 周邊 活動 要 做 足 之餘 ， 亦 要 與 活動 的 主角 做好 協調 及 溝通 ， 把 效益 最大化 。         本澳 體育 活動 及 盛事 一浪接 一浪 ， 繼月 前 的 乒乓球 世界 盃 賽 、 日前 葡萄牙 傳奇 的 五人 足球 賽 ， 還有 今 周展 開 的 世界 女排 聯賽 ， 先後有 不同 項 目的 現役 且 當打 ， 及 退役 的 巨星 來 澳作賽 或 表演 。 舉行 盛事 對 小城 觀眾 及 球迷 是 非常 難得 機會 ， 可 近距 離欣賞 喜愛的 運動員 風采 ， 亦可 觀看 高水平 比賽 ， 體驗 運動員 的 拼搏精神 。 然而 ， 順利舉 行僅 是 成功 一半 ， 要 圓滿 便 要將 效益 最大化 。         活動要 圓滿 舉行 ， 便 要 讓 觀眾 從 活動 中 感受 到 受重 視 、 尊重 以及 與 運動員 有否 更多 互動 環節 ， 滿足 他們 追 “ 星 ” 的 需求 。 當然 ， 前提 是 不 影響 活動 及 比賽 流程 。 若能 做得好 ， 觀眾 反饋 佳 ， 對主 辦方 辦賽 口碑 會帶 來 更 正面 影響 。 若 做 得 不好 便會 與 鄰埠 在 年初 的 足球 表演 賽般 ， 受盡 各方 詬病 。         剛結束 的 五人 足球 表演 賽及 即將 舉行 的 世界 女排 聯賽 ， 主辦 方均 安排 不錯 。 如 安排 運動員 參與 訓練班 、 簽名會 ， 與 本 澳運動員 真情 對話 ， 賽後讓 球員 在 場邊 為 球迷 送 親筆 簽名 ， 落力 表演 讓 球迷 一飽 眼福 等 ， 均 獲 觀眾 一致 好評 ， 認為 應多 搞 這類 回饋 活動 。 這些 活動 固然 要 事先 與 球員 協調 好 ， 球員能 贏得 親民 形象 ， 增加 支持者 。 收 穫 豐富 的 受眾 滿足 之餘亦會間 接 助力 宣傳 ， 主辦 方則 贏得 口碑 ， 得到 最大 效益 ， 形成 三贏 局面 。         賈大廚,2024-05-26
