Title,Content,Link,Summary,Preprocessed_Content,Date
大三巴遺址下周二暫停開放,大三巴遺址下周二暫停開放    【本報消息】文化局訊：文化局四月十六日上午六時至下午六時對大三巴牌坊進行例行性的除草及銅像檢查工作。因應施工需要及保障公眾安全，文化局將於四月十五日下午六時起，在大三巴牌坊前的石板地台放置圍欄分隔工作區域。    大三巴牌坊前地及大三巴遺址（包括遺址內的“時空穿梭 · 遊歷三巴”大三巴牌坊沉浸式數字體驗展、天主教藝術博物館及墓室）在四月十六日當天將暫停對外開放，敬請公眾留意。查詢可於辦公時間致電二八三六 · 六三二○。,http://www.macaodaily.com/html/2024-04/13/content_1747998.htm,大三巴牌坊前地及大三巴遺址（包括遺址內的“時空穿梭 · 遊歷三巴”大三巴牌坊沉浸式數字體驗展、天主教藝術博物館及墓室）在四月十六日當天將暫停對外開放，敬請公眾留意,大三巴 遺址 下 周二 暫停 開放         【 本報 消息 】 文化局 訊 ： 文化局 四月 十六日 上午 六時 至 下午 六時 對 大三巴牌坊 進行 例行 性 的 除草 及 銅像 檢查 工作 。 因應 施工 需要 及 保障 公眾 安全 ， 文化局 將於 四月 十五日 下午 六時 起 ， 在 大三巴牌坊 前 的 石板 地台 放置 圍欄 分隔 工作 區域 。         大三巴牌坊 前地 及 大三巴 遺址 （ 包括 遺址 內 的 “ 時空 穿梭   ·   遊歷 三巴 ” 大三巴牌坊 沉浸 式 數字 體驗展 、 天主教 藝術 博物 館及 墓室 ） 在 四月 十六日 當天將 暫停 對外 開放 ， 敬請 公眾 留意 。 查詢 可 於 辦公時間 致電 二八 三 六   ·   六三 二 ○ 。,2024-04-13
EMBA羽球賽六月上旬琴澳舉行,多名世界冠軍二百商界精英以球會友    EMBA羽球賽六月上旬琴澳舉行    【本報消息】第八屆全球商學院EMBA羽毛球明星賽六月上旬將在橫琴和澳門兩地共同舉行，屆時多名世界冠軍以及二百多名商界精英將齊聚琴澳，透過參賽以球會友，同場競技。    此次賽事以“琴澳和鳴、羽悅同行”為主題，由全球商學院EMBA羽毛球聯盟主辦，澳門大學工商管理學院承辦，深合區民生事務局支持，廣東小瑪達羽毛球俱樂部協辦。承辦方前日在深合區市民中心舉行發佈會介紹賽事籌備情況，深合區民生事務局長黃宇傑、澳門大學工商管理學院主任張旭、羽毛球世界冠軍馬晉與會。    賽事擬於六月七至九日在橫琴和澳門共同舉行，中歐國際工商管理學院、長江商學院、北京大學、清華大學、中山大學等全球眾多商學院聯隊已基本確認參賽，賽事設三打三的比賽項目，且每所學校的參賽者將被打亂分配隊伍，以加強參賽者的溝通，鼓勵團隊協作。    促琴澳體育產業    黃宇傑表示，隨着分線管理工作深入推進，深合區正迎來更加開放、市場化、法制化和國際化的營商環境，在此背景下冀藉舉辦高水平體育運動和賽事，吸引更多來自不同行業和領域的精英齊聚橫琴，為琴澳發展注入新活力。    張旭強調，全球商學院EMBA羽毛球明星賽是全球EMBA同學傳播健康、友誼、快樂的平台，在全球高校積累大量觀眾以及廣泛影響力。賽事在琴澳兩地舉辦，既是澳門“1+4”戰略的體現，相信亦對琴澳體育產業發展起推動和帶動作用。    正在澳門大學就讀EMBA課程的前國家羽毛球隊員、世界冠軍馬晉表示，作為澳大學生，有義務和責任推廣羽毛球運動，用好此體育運動的媒介和平台功能，冀藉賽事讓更多優秀人士聚集琴澳，親身體驗兩地發展與變化。,http://www.macaodaily.com/html/2024-04/13/content_1747995.htm,正在澳門大學就讀EMBA課程的前國家羽毛球隊員、世界冠軍馬晉表示，作為澳大學生，有義務和責任推廣羽毛球運動，用好此體育運動的媒介和平台功能，冀藉賽事讓更多優秀人士聚集琴澳，親身體驗兩地發展與變化,多名 世界 冠 軍 二百 商界 精英 以球會友         EMBA 羽球 賽 六月 上旬 琴澳 舉行         【 本報 消息 】 第八 屆 全球 商學院 EMBA 羽毛球 明星 賽 六月 上旬 將在 橫琴 和 澳門 兩地 共同 舉行 ， 屆 時 多名 世界 冠 軍 以及 二百多名 商界 精英 將齊 聚琴澳 ， 透過 參賽 以球會友 ， 同場 競技 。         此次 賽事以 “ 琴 澳和鳴 、 羽悅 同行 ” 為主題 ， 由 全球 商學院 EMBA 羽毛球 聯 盟主 辦 ， 澳門 大學 工商管理 學院 承辦 ， 深合區 民生 事務局 支持 ， 廣東 小瑪達 羽毛球 俱樂部 協辦 。 承辦方 前日 在 深合區 市民 中心 舉行發 佈 會 介紹賽 事籌備 情況 ， 深合區 民生 事務局 長 黃 宇傑 、 澳門 大學 工商管理 學院 主任 張旭 、 羽毛球 世界 冠軍馬晉 與 會 。         賽事擬 於 六月 七至 九日 在 橫琴 和 澳門 共同 舉行 ， 中 歐國際 工商管理 學院 、 長 江商學院 、 北京 大學 、 清華大學 、 中山 大學 等 全球 眾多 商學院 聯隊 已 基本 確認 參賽 ， 賽事設 三打 三 的 比賽 項目 ， 且 每 所學校 的 參賽者將 被 打亂 分配 隊伍 ， 以加強 參賽者 的 溝通 ， 鼓勵 團隊 協作 。         促琴 澳體育 產業         黃 宇傑 表示 ， 隨着 分線 管理工作 深入 推進 ， 深合區 正迎 來 更加 開放 、 市場化 、 法制化 和 國際化 的 營商 環境 ， 在 此 背景 下冀藉 舉辦 高水平 體育 運動 和 賽事 ， 吸引 更多來 自 不同 行業 和 領域 的 精英 齊聚 橫琴 ， 為琴 澳發展 注入 新 活力 。         張旭 強調 ， 全球 商學院 EMBA 羽毛球 明星 賽是 全球 EMBA 同學 傳播 健康 、 友誼 、 快樂 的 平台 ， 在 全球 高校 積累 大量 觀眾 以及 廣泛 影響力 。 賽事 在 琴 澳兩地 舉辦 ， 既 是 澳門 “ 1 + 4 ” 戰略 的 體現 ， 相信 亦 對琴 澳體育 產業 發展 起 推動 和 帶動 作用 。         正在 澳門 大學 就 讀 EMBA 課程 的 前國家 羽毛球 隊員 、 世界 冠軍馬晉 表示 ， 作為 澳大學生 ， 有義務 和 責任 推廣 羽毛球 運動 ， 用 好 此 體育 運動 的 媒介 和 平台 功能 ， 冀藉 賽事 讓 更 多 優秀 人士 聚集 琴澳 ， 親身 體驗 兩地 發展 與 變化 。,2024-04-13
澳代表赴港恭拜軒轅黃帝,澳代表赴港恭拜軒轅黃帝    【本報消息】河南省政府、政協河南省委員會、國務院台灣事務辦公室、中華全國歸國華僑聯合會等聯合主辦“甲辰年黃帝故里拜祖大典”，日前在黃帝故里河南鄭州新鄭莊嚴拉開序幕。為表達華夏兒女敬重祖先、根脈相連的情感，特在香港設立會場，舉行以同根同祖同源、和平和諧和睦為主題的“甲辰年粵港澳大灣區（香港）恭拜軒轅黃帝大典”。    香港會場由香港梅州聯會、香港梅州（嘉應）總商會、尖沙咀街坊福利會、香港客家文化會、香港河南總商會、河南省客家聯合會共同主辦，日前在尖沙咀街坊福利會隆重舉行。活動秉承河南新鄭黃帝故里拜祖大典一貫儀制，有條不紊地展開九項儀程。    主禮嘉賓代表、中國僑聯副主席吳換炎致詞；澳門嘉應同鄉會、客家歸僑聯誼會創會會長黃銓昌為大典組委會副主任，與澳門嘉應同鄉會會長郭守源，全國僑聯委員、客家歸僑聯誼會名譽會長蘇慶輝盥手登台，在黃帝像前鞠躬進爵。澳門科技大學僑史學者項方參與祈福儀式。隨後全場參與儀式的嘉賓，面向人文始祖虔誠共拜，場面宏大震撼，神聖莊嚴。    澳門科技大學博士宋漢曉、李栩諾等澳門代表日前專程赴港出席拜祖大典活動。,http://www.macaodaily.com/html/2024-04/13/content_1747997.htm,澳代表赴港恭拜軒轅黃帝    【本報消息】河南省政府、政協河南省委員會、國務院台灣事務辦公室、中華全國歸國華僑聯合會等聯合主辦“甲辰年黃帝故里拜祖大典”，日前在黃帝故里河南鄭州新鄭莊嚴拉開序幕,澳 代表 赴 港 恭拜軒 轅黃帝         【 本報 消息 】 河南省政府 、 政協 河南省委 員會 、 國務院 台灣 事務辦 公室 、 中華 全國 歸國華僑 聯合會 等 聯合主辦 “ 甲辰 年黃帝 故里 拜 祖大典 ” ， 日前 在 黃 帝 故里 河南 鄭州 新 鄭莊 嚴拉開 序幕 。 為表達 華夏兒 女 敬重 祖先 、 根脈 相連 的 情感 ， 特 在 香港 設立會場 ， 舉行 以 同根 同祖 同源 、 和平 和諧 和睦 為主題 的 “ 甲辰 年粵 港澳 大灣區 （ 香港 ） 恭拜軒 轅黃帝 大典 ” 。         香港 會場 由 香港 梅州 聯會 、 香港 梅州 （ 嘉應 ） 總商會 、 尖沙咀 街坊 福利 會 、 香港 客家 文化 會 、 香港 河南 總商會 、 河南省 客家 聯合會 共同 主辦 ， 日前 在 尖沙咀 街坊 福利 會 隆重 舉行 。 活動 秉承 河南 新 鄭黃帝 故里 拜 祖大典 一貫 儀制 ， 有條 不紊 地展 開九項 儀程 。         主禮嘉賓 代表 、 中國 僑聯 副 主席 吳換 炎致 詞 ； 澳門嘉應 同鄉 會 、 客家 歸僑 聯誼會 創會會長 黃 銓昌為 大典 組委會 副 主任 ， 與 澳門嘉應 同鄉 會會長 郭守源 ， 全國僑 聯委員 、 客家 歸僑 聯誼會 名譽 會長 蘇慶輝 盥手 登台 ， 在 黃 帝像 前 鞠躬 進爵 。 澳門 科技 大學 僑史 學者 項方參 與 祈福 儀式 。 隨後全場 參與 儀式 的 嘉賓 ， 面向 人文 始祖 虔 誠 共拜 ， 場面 宏大 震撼 ， 神聖 莊嚴 。         澳門 科技 大學 博士 宋漢曉 、 李栩諾 等 澳門 代表 日前 專程 赴 港 出席 拜 祖大典 活動 。,2024-04-13
豫政協副主席訪省級政協會,豫政協副主席訪省級政協會    河南省政協副主席劉炯天昨日上午率團到訪澳區省級政協委員聯誼會，獲會長馬志成、名譽會長羅奕龍、秘書長孫振鴻、常務副會長陳志玲、副會長歐潤光等接待。    馬志成表示，今年將不遺餘力推進新中國成立七十五周年和澳門回歸祖國廿五周年雙慶活動。未來，冀通過豫澳雙方在經貿合作、文化交流等多個層面的深入聯繫，優勢互補，促進澳門更好融入國家發展大局，並助力河南經濟社會注入新活力。    劉炯天寄語澳區政協委員認真貫徹國家決策部署，為推動政協事業高質量發展，為譜寫新時代中國更出彩的絢麗篇章作更大貢獻。邀請聯誼會組織委員到河南實地考察，加強交流聯繫。    會上，雙方還就兩地會展商貿、人才交流、中醫藥大健康等議題交換意見。,http://www.macaodaily.com/html/2024-04/13/content_1747999.htm,未來，冀通過豫澳雙方在經貿合作、文化交流等多個層面的深入聯繫，優勢互補，促進澳門更好融入國家發展大局，並助力河南經濟社會注入新活力,豫政協 副 主席 訪省級 政協會         河南省 政協 副 主席 劉炯天 昨日 上午 率團 到 訪 澳區 省級 政協委員 聯誼會 ， 獲會長 馬 志成 、 名譽 會長 羅 奕 龍 、 秘書長 孫振鴻 、 常務 副 會長 陳 志玲 、 副會長 歐潤光 等 接待 。         馬 志成 表示 ， 今年 將不 遺餘 力推 進新 中國 成立 七十五 周年 和 澳門 回歸祖國 廿五 周年 雙慶 活動 。 未來 ， 冀通 過豫澳 雙方 在 經貿 合作 、 文化交流 等 多個 層面 的 深入 聯 繫 ， 優勢 互補 ， 促進 澳門 更好 融入 國家 發展 大局 ， 並 助力 河南 經濟 社會 注入 新 活力 。         劉炯天 寄語 澳區 政協委員 認真貫 徹國家 決策 部署 ， 為 推動 政協事業 高質量 發展 ， 為 譜 寫 新 時代 中國 更 出彩 的 絢麗 篇章 作 更 大 貢獻 。 邀請 聯誼會 組織 委員到 河南 實地 考察 ， 加強 交流 聯 繫 。         會上 ， 雙方還 就 兩 地會 展商 貿 、 人才交流 、 中醫藥 大 健康 等 議題 交換 意見 。,2024-04-13
珠澳物管團體簽約促琴澳一體,珠澳物管團體簽約促琴澳一體    澳門物業管理業商會及珠海市物業管理行業協會昨日假橫琴梧桐樹大廈卅一樓多媒體功能室舉行《珠澳物管橫琴戰略合作框架協議》簽署儀式。珠海市住房和城鄉建設局副局長劉苑平，深合區城建局長張國基、法務局綜合事務處長蕭裕林，澳區全國人大代表、該商會永遠會長劉藝良等出席。    澳物管業商會會長謝思訓致辭表示，合作協議的達成，標誌雙方衝破地域界限，在物業管理領域深度合作。商會將促進兩地物業服務企業的創新，推動兩地行業互聯互動高質量發展。    珠物管業協會會長曾師致辭稱，該會將充分利用橫琴特殊地位和管理體制，深入探討及開展相關專項活動，包括為澳門從業員舉辦內地物業法規公益培訓、協助政府為橫琴企業和居民提供物業糾紛調解服務等，為琴澳一體化建設添磚加瓦。,http://www.macaodaily.com/html/2024-04/13/content_1748000.htm,珠物管業協會會長曾師致辭稱，該會將充分利用橫琴特殊地位和管理體制，深入探討及開展相關專項活動，包括為澳門從業員舉辦內地物業法規公益培訓、協助政府為橫琴企業和居民提供物業糾紛調解服務等，為琴澳一體化建設添磚加瓦,珠澳物 管團體 簽約 促琴 澳一體         澳門 物業 管理 業商會 及 珠海市 物業 管理 行業 協會 昨日 假橫琴 梧桐 樹大 廈卅一樓 多 媒體 功能 室 舉行 《 珠澳物 管橫琴 戰略 合作 框架 協議 》 簽署 儀式 。 珠海市 住房 和 城鄉 建設局 副 局長 劉苑 平 ， 深合區 城建局 長 張國基 、 法務局 綜合 事務 處長 蕭裕林 ， 澳區 全國 人大代表 、 該 商會 永遠會長 劉藝良 等 出席 。         澳物 管業 商會會長 謝思訓 致辭 表示 ， 合作 協議 的 達成 ， 標誌 雙方 衝破 地域 界限 ， 在 物業 管理 領域 深度 合作 。 商會將 促進 兩 地物 業服務 企業 的 創新 ， 推動 兩地 行業 互聯 互動 高質量 發展 。         珠物 管業 協會會長 曾 師致 辭稱 ， 該會將 充分利用 橫琴 特殊 地位 和 管理 體制 ， 深入 探討及 開展 相關 專項 活動 ， 包括 為 澳門 從業員舉 辦內 地物 業法規 公益 培訓 、 協助 政府 為 橫琴 企業 和 居民 提供 物業 糾紛 調解 服務 等 ， 為琴 澳一體化 建設 添磚 加瓦 。,2024-04-13
法聯會為勞校師生宣介三法,法聯會為勞校師生宣介三法    法律工作者聯合會日前在會址舉行本年度第二次“青年法律工作者走進校園”活動。卅五名勞校中學高二及高三年級學生在老師鄧佩玲陪同下參加。活動由該會青年部委員程嘉雯主持，理事長邱庭彪、青年部長黃景禧分別發言。    在普法環節，張宏哲、高嘉仁、區小平分別介紹憲法、基本法和維護國家安全法的重要知識。在小組分享與討論環節，由分別任職法學院教師、律師及公務員的翁文挺、江盛軒、羅卓彥、鄭嘉瑤、李兆東及程明海共六名青年法律工作者分享職涯規劃經驗，探討澳門青年法律工作者在大灣區及深合區的發展，介紹預防青少年犯罪、熱點法律問題等。    鄧佩玲表示，同學們通過是次活動內容及專家分享，加深了解憲法、基本法及國安法知識，築牢國家安全意識、緊扣依法治國理念。,http://www.macaodaily.com/html/2024-04/13/content_1748001.htm,在小組分享與討論環節，由分別任職法學院教師、律師及公務員的翁文挺、江盛軒、羅卓彥、鄭嘉瑤、李兆東及程明海共六名青年法律工作者分享職涯規劃經驗，探討澳門青年法律工作者在大灣區及深合區的發展，介紹預防青少年犯罪、熱點法律問題等,法聯會 為 勞校 師生 宣介三法         法律 工作者 聯合會 日前 在 會址 舉行 本年度 第二次 “ 青年 法律 工作者 走進 校園 ” 活動 。 卅 五名 勞校 中學 高二及 高 三年 級學生 在 老師 鄧佩玲 陪同 下 參加 。 活動 由 該 會 青年 部委 員程 嘉雯 主持 ， 理事 長 邱庭彪 、 青年 部長 黃 景禧 分別 發言 。         在 普法 環節 ， 張宏哲 、 高嘉仁 、 區小 平分 別介紹 憲法 、 基本法 和 維護國家 安全法 的 重要 知識 。 在 小組 分享 與 討論 環節 ， 由分 別任 職法 學院 教師 、 律師 及 公務員 的 翁 文挺 、 江盛軒 、 羅 卓彥 、 鄭嘉瑤 、 李兆東 及程 明海共 六名 青年 法律 工作者 分享 職涯 規劃 經驗 ， 探討 澳門 青年 法律 工作者 在 大灣區 及 深合區 的 發展 ， 介紹 預防 青少年 犯罪 、 熱點 法律 問題 等 。         鄧佩玲 表示 ， 同學們 通過 是 次 活動 內容及 專家 分享 ， 加深了解 憲法 、 基本法 及國安法 知識 ， 築 牢國家 安全 意識 、 緊扣 依法 治國 理念 。,2024-04-13
ASHRAE訪中國製冷學會,ASHRAE訪中國製冷學會    ASHRAE澳門分會——供暖製冷及空調工程師學會考察團一行十人，日前赴京拜訪中國製冷學會，了解中國製冷行業最新動態、技術創新和可持續發展成果。考察團在該會創會會長陳錫邦、副會長黃肇雄及財務長曹煒龍帶領下出發，獲中國製冷學會副理事長兼秘書長李曉虎，常務理事、副秘書長荊華乾等接待。    會上，一行與中國製冷學會幹部成員深入交流，對學會會務、行業未來發展和相關挑戰有更深入了解。一行了解到中國製冷行業正面臨多項重要挑戰，其中涉及節能減排、冷鏈物流等。中國製冷學會提出一系列具體解決方案和行動計劃，並鼓勵行業技術創新，提倡綠色製冷技術應用，推動製冷系統能效提升。ASHRAE澳門分會期待未來與學會進一步合作，共同推動製冷技術發展，實現更高效、更環保的製冷系統。,http://www.macaodaily.com/html/2024-04/13/content_1748002.htm,ASHRAE訪中國製冷學會    ASHRAE澳門分會——供暖製冷及空調工程師學會考察團一行十人，日前赴京拜訪中國製冷學會，了解中國製冷行業最新動態、技術創新和可持續發展成果,ASHRAE 訪中 國 製 冷 學 會         ASHRAE 澳門 分會 — — 供暖 製 冷 及 空 調 工程 師學會 考察 團 一行 十人 ， 日前 赴京 拜訪 中 國 製 冷 學 會 ， 了解 中 國 製 冷 行 業 最新 動態 、 技術 創新 和 可持續 發展 成果 。 考察 團在 該會 創會會長 陳 錫邦 、 副會長 黃 肇雄及 財務長 曹煒龍 帶 領下 出發 ， 獲中 國 製 冷 學 會 副 理事 長 兼 秘書長 李曉虎 ， 常務 理事 、 副 秘書長 荊華乾 等 接待 。         會上 ， 一行 與 中 國 製 冷 學 會 幹 部 成 員 深入 交流 ， 對學會 會務 、 行業 未來 發展 和 相關 挑戰 有 更 深入 了解 。 一行 了解 到 中 國 製 冷 行 業 正面 臨多項 重要 挑戰 ， 其中 涉及 節能 減排 、 冷鏈 物流 等 。 中 國 製 冷 學 會 提出 一系列 具體 解決 方案 和 行動 計劃 ， 並鼓勵 行業 技術 創新 ， 提倡 綠 色 製 冷 技 術 應 用 ， 推 動 製 冷 系 統 能效 提升 。 ASHRAE 澳門 分會 期待 未來 與 學會進 一步 合作 ， 共同 推 動 製 冷 技 術 發 展 ， 實現 更 高效 、 更 環保 的 製 冷 系 統 。,2024-04-13
學新社下周一推國安短片,學新社下周一推國安短片    學新社去年推出十集國家安全教育系列短片，反應良好。故此，今年將繼續推出十集國家安全教育系列短片，藉此讓全體成員增進對國家安全的了解。    理事長歐陽偉然表示，為進一步貫徹總體國家安全觀，學新社合共推出十集短片，包含糧食安全、核安全、海外利益安全、太空安全、深海安全、極地安全、生物安全、人工智慧安全、數據安全，廣泛收集政策文件、國內外媒體報道、學術研究成果等普適性及權威性資料，具有專業性和知識性，兼顧實用性和可看性，有助提高成員“大安全”意識和素養。    系列短片將於四月十五日全民國家安全教育日當天，在學新社Facebook及微信群組陸續推出，歡迎瀏覽。,http://www.macaodaily.com/html/2024-04/13/content_1748004.htm,理事長歐陽偉然表示，為進一步貫徹總體國家安全觀，學新社合共推出十集短片，包含糧食安全、核安全、海外利益安全、太空安全、深海安全、極地安全、生物安全、人工智慧安全、數據安全，廣泛收集政策文件、國內外媒體報道、學術研究成果等普適性及權威性資料，具有專業性和知識性，兼顧實用性和可看性，有助提高成員“大安全”意識和素養,學新社 下周一 推國安 短片         學新社 去年 推出 十集 國家 安全 教育 系列 短片 ， 反應 良好 。 故此 ， 今年 將繼續 推出 十集 國家 安全 教育 系列 短片 ， 藉此 讓 全體 成員 增進 對 國家 安全 的 了解 。         理事 長 歐陽偉然 表示 ， 為進 一步 貫徹 總體 國家 安全 觀 ， 學新社 合共 推出 十集 短片 ， 包含 糧食 安全 、 核 安全 、 海外 利益 安全 、 太空 安全 、 深海 安全 、 極地 安全 、 生物 安全 、 人工智慧 安全 、 數據 安全 ， 廣泛 收集 政策 文件 、 國內外 媒體 報道 、 學術 研究成果 等 普 適性 及權 威性 資料 ， 具有 專業性 和 知識性 ， 兼顧 實用性 和 可看性 ， 有助 提高 成員 “ 大 安全 ” 意識 和 素養 。         系列 短片 將於 四月 十五日 全民 國家 安全 教育 日當天 ， 在 學新社 Facebook 及微 信群 組陸續 推出 ， 歡迎 瀏覽 。,2024-04-13
莞澳青年會訪東莞促合作,莞澳青年會訪東莞促合作    莞澳青年交流促進會主辦，澳門基金會贊助的二○二四東莞考察活動日前舉行。該會會長楊駿、理事長孫嘉蔚等一行十二人分別獲東莞市委統戰部、市團委、市文廣旅體局、市文化館、長安鎮政府等領導接待。是次交流團帶領該會不同界別理監事走訪東莞，助澳門青年了解東莞社會狀況、歷史文化及經貿合作等方面。會上，各單位領導肯定該會歷年會務工作，冀共同推動“雙慶”系列活動開展，並繼續緊密聯絡，做好團結青年工作。    翌日，考察團前往東莞長安。上午，開展“綠美廣東 · 青年先行”志願植樹活動。隨後，參訪OPPO廣東移動通信有限公司、東莞市宇瞳光學科技股份有限公司以及華附長安學校施工現場。    孫嘉蔚表示，冀推動更多澳門青年凝聚共識，做深做實兩地青年工作，貢獻莞澳青春力量。,http://www.macaodaily.com/html/2024-04/13/content_1748006.htm,莞澳青年會訪東莞促合作    莞澳青年交流促進會主辦，澳門基金會贊助的二○二四東莞考察活動日前舉行,莞澳 青年 會訪 東莞促 合作         莞澳 青年 交流 促進會 主辦 ， 澳門 基金 會 贊助 的 二 ○ 二四 東莞 考察 活動 日前 舉行 。 該會會長 楊駿 、 理事 長 孫嘉蔚 等 一行 十二 人分別 獲東莞 市委 統戰部 、 市團委 、 市文廣 旅體局 、 市 文化 館 、 長 安鎮 政府 等 領導 接待 。 是 次 交流 團帶 領該 會 不同 界別理 監事 走訪 東莞 ， 助澳門 青年 了解 東莞 社會 狀況 、 歷史 文化 及 經貿 合作 等 方面 。 會上 ， 各 單位 領導 肯定 該會 歷年 會務 工作 ， 冀 共同 推動 “ 雙慶 ” 系列 活動 開展 ， 並繼續 緊密 聯絡 ， 做好 團結 青年 工作 。         翌日 ， 考察 團 前往 東莞長 安 。 上午 ， 開展 “ 綠美廣東   ·   青年 先行 ” 志願 植樹 活動 。 隨後 ， 參訪 OPPO 廣東 移動 通信 有限公司 、 東莞市 宇瞳 光學 科技股份 有限公司 以及 華附長 安學校 施工 現場 。         孫嘉蔚 表示 ， 冀 推動 更 多 澳門 青年 凝聚 共識 ， 做深 做實 兩地 青年 工作 ， 貢獻莞 澳 青春 力量 。,2024-04-13
