Title,Content,Link,Summary,Preprocessed_Content,Date
灣區“大號地鐵”今午開通,四線連通橫跨五市交通大動脈    灣區“大號地鐵”今午開通    【本報消息】經省交通運輸廳批覆同意，被譽爲大灣區“大號地鐵”中的廣佛南環、佛莞城際今日中午十二時開通運營。新開的兩條城際線路將與已開通的佛肇城際、莞惠城際首尾相連，實現“四線”貫通運營，形成一條全長二百五十八公里、橫跨五座城市、呈東西走向的交通大動脈，將佛山、東莞中心區納入廣州半小時通勤圈，肇慶、惠州中心區納入廣州一小時通勤圈。“四線”採用公交化模式運營，可使用實名制驗證後的全國交通一卡通、嶺南通等乘車，澳人灣區出行更加快捷方便。    公交運營隨到隨走    兩條城際線路開通後，廣州地鐵集團運營的城際鐵路將達三百一十八點六公里，以番禺站為中心，向西為廣肇城際，向東為廣惠城際，連通廣州、佛山、肇慶、東莞、惠州，大大加強廣州與周邊城市的交通聯繫，發揮軌道交通牽引經濟大動脈的作用。    與傳統城際不同，“四線”貫通的城際採用公交化運營和雙票務購票系統，讓旅客隨到隨走，無需提前購票，乘車接近地鐵。全面啟用“站站停+大站快車”的公交化運營，是廣州地鐵應用在長途地鐵的行車模式，執行“肇慶站——小金口站”和“佛山西站——小金口站”交路，平均行車間隔為二十六分鐘。其中，大站快車固定停靠十四個車站，旅客可根據自身需求靈活安排出行時間。    灣區城際趨地鐵化    配合城際公交化運營，“四線”購票採用“一二三〇六+城際鐵路公交化多元支付”雙票務系統。人們既可在一二三〇六票務系統購買當日一次有效票，也可通過城際鐵路公交化多元支付票務系統，使用實名制驗證後的全國交通一卡通、嶺南通、羊城通、廣州地鐵APP城際乘車碼等乘車。    四條線路以城際為名，但被人們稱為粵港澳大灣區的“大號地鐵”。從運營管理到開行班次、旅客進站，四條城際明顯“地鐵化”。與傳統城際鐵路由國鐵集團運營不同，四條城際線路均由廣州地鐵集團建設和運營。此前，廣州地鐵已在廣清城際採用公交化運營，採用雙票務系統實現車票當日有效，隨到隨走。並於去年十月底在廣清、廣州東環城際推出二十次“計次票”和三十日“定期票”兩種新型優惠票，減少固定站點通勤旅客的支出。    打造軌道上大灣區    “四線”貫通讓無需對號入座、刷碼即進、進站即走的出行方式覆蓋更多的粵港澳大灣區跨城出行旅客，讓人們從一座城市到另一座城市變得輕鬆方便，拉近城市間距離，成為打造“軌道上的大灣區”重要一步。,http://www.macaodaily.com/html/2024-05/26/content_1757786.htm,公交運營隨到隨走    兩條城際線路開通後，廣州地鐵集團運營的城際鐵路將達三百一十八點六公里，以番禺站為中心，向西為廣肇城際，向東為廣惠城際，連通廣州、佛山、肇慶、東莞、惠州，大大加強廣州與周邊城市的交通聯繫，發揮軌道交通牽引經濟大動脈的作用,四線 連通橫 跨五市 交通 大動脈         灣區 “ 大號 地鐵 ” 今午 開通         【 本報 消息 】 經省 交通 運輸廳 批覆 同意 ， 被譽 爲 大灣區 “ 大號 地鐵 ” 中 的 廣佛 南環 、 佛莞 城際 今日 中午 十二 時開 通運營 。 新開 的 兩條 城際線 路將 與 已 開通 的 佛肇城際 、 莞惠城際 首尾 相連 ， 實現 “ 四線 ” 貫通 運營 ， 形成 一條 全長 二百五十 八公里 、 橫跨 五座 城市 、 呈 東西 走向 的 交通 大動脈 ， 將 佛山 、 東莞 中心 區納入 廣州 半小時 通勤 圈 ， 肇慶 、 惠州 中心 區納入 廣州 一小 時 通勤 圈 。 “ 四線 ” 採用 公交化 模式 運營 ， 可 使用 實名 制驗證 後 的 全國 交通 一卡通 、 嶺 南通 等 乘車 ， 澳人灣區 出行 更加 快捷 方便 。         公交 運營 隨到 隨走         兩條 城際線 路 開通 後 ， 廣州 地鐵 集團 運營 的 城際 鐵路 將達 三百 一十八 點 六公里 ， 以 番禺 站 為 中心 ， 向 西為 廣肇城際 ， 向 東為 廣惠城際 ， 連通 廣州 、 佛山 、 肇慶 、 東莞 、 惠州 ， 大大 加強 廣州 與 周邊 城市 的 交通 聯 繫 ， 發揮 軌道 交通 牽引 經濟 大動脈 的 作用 。         與 傳統 城際 不同 ， “ 四線 ” 貫通 的 城際 採用 公交化 運營 和 雙票務 購票 系統 ， 讓 旅客 隨到 隨走 ， 無需 提前 購票 ， 乘車 接近 地鐵 。 全面 啟用 “ 站 站 停 + 大站 快車 ” 的 公交化 運營 ， 是 廣州 地鐵應 用 在 長 途地 鐵 的 行車 模式 ， 執行 “ 肇慶站 — — 小 金口 站 ” 和 “ 佛山 西站 — — 小 金口 站 ” 交路 ， 平均 行車間 隔 為 二十六 分鐘 。 其中 ， 大站 快車 固定 停靠 十四 個車 站 ， 旅客 可根據 自身 需求 靈活 安排 出行 時間 。         灣區 城際 趨地 鐵化         配合 城際 公交化 運營 ， “ 四線 ” 購票 採用 “ 一二三 〇 六 + 城際 鐵路 公交化 多元 支付 ” 雙票務系統 。 人們 既 可 在 一二三 〇 六票務系 統購 買 當日 一次 有效票 ， 也 可 通過 城際 鐵路 公交化 多元 支付 票務系統 ， 使用 實名 制驗證 後 的 全國 交通 一卡通 、 嶺 南通 、 羊城通 、 廣州 地鐵 APP 城際 乘車碼 等 乘車 。         四條線 路 以 城際 為 名 ， 但 被 人們 稱 為粵 港澳 大灣區 的 “ 大號 地鐵 ” 。 從運營 管理 到 開行 班次 、 旅客 進站 ， 四條 城際 明顯 “ 地鐵化 ” 。 與 傳統 城際鐵 路由 國鐵 集團 運營 不同 ， 四條 城際線 路 均 由 廣州 地鐵 集團 建設 和 運營 。 此前 ， 廣州 地鐵 已在廣 清城 際 採用 公交化 運營 ， 採用 雙票務系統 實現 車票 當日 有效 ， 隨到 隨走 。 並 於 去年 十月底 在 廣清 、 廣州東 環城際 推出 二十次 “ 計次票 ” 和 三十日 “ 定期 票 ” 兩種 新型 優惠票 ， 減少 固定 站點 通勤 旅客 的 支出 。         打造 軌道 上 大灣區         “ 四線 ” 貫通 讓 無 需 對號 入座 、 刷碼 即 進 、 進站 即 走 的 出行 方式 覆蓋 更 多 的 粵 港澳 大灣區 跨城 出行 旅客 ， 讓 人們 從 一座 城市 到 另 一座 城市 變得 輕 鬆 方便 ， 拉近 城市 間 距離 ， 成為 打造 “ 軌道 上 的 大灣區 ” 重要 一步 。,2024-05-26
南珠（中）城際十萬區間段啓盾構,將實現大灣區城際聯通穗地鐵    南珠（中）城際十萬區間段啓盾構    【本報消息】隨着“鐵兵南沙四號”盾構機刀盤緩緩轉動，標誌着南珠（中）城際廣州段十涌站至萬頃沙站區間（十萬區間）進入盾構施工，全力保障全年“洞通”目標。北端起點在萬頃沙站的南珠（中）城際，與廣州地鐵十八號線南端的萬頃沙站銜接，建成後兩條線路貫通運營，是首條可實現粵港澳大灣區城際與廣州地鐵網互聯互通的軌道交通項目。該城際中珠段將會採用公交化運營，實現中山中心至廣州中心四十五分鐘、中山中心至珠海拱北（澳門）五十分鐘通達。    長遠連深圳市中心    南珠（中）城際是國家批覆的《粵港澳大灣區城際鐵路建設規劃》中的項目，是第一個可實現大灣區城際與廣州地鐵網互聯互通的軌道交通項目。線路建成後，廣州地鐵將實現“四網融合”、城際鐵路公交化、自主化運營。    南珠（中）城際沿珠江西岸，串聯廣州南沙、中山、珠海，憑借城際與地鐵“無縫銜接”，南珠（中）城際乘客可直抵廣州市中心城區。遠期南珠（中）城際與深南中城際銜接貫通運行，將把珠江東岸的深圳市中心拉入“朋友圈”。    中山抵拱毋須句鐘    項目廣州段正盾構掘進，朝全年“洞通”目標邁進。中山至珠海段也爭取年內開工。珠中城際啟建時提出，線路將實施公交化運營模式，買票即上車，車到即走，盡量提升乘客的出行效率。    中珠城際定位為粵港澳大灣區西岸南北向內圈層的骨幹通勤城際鐵路，兼顧沿線城市的都市圈快線、市域快線功能。據測算，能夠實現中山中心至廣州中心四十五分鐘、中山中心至珠海拱北（澳門）五十分鐘通達，形成粵港澳大灣區跨城公交化、通勤化服務標準。    方便灣區居民往來    廣州地鐵建設規劃透露，廣州地鐵十八號線將與南珠（中）城際在南沙銜接，另一端銜接廣花城際、芳白城際，進而實現南珠（中）城際與廣花城際、芳白城際的貫通。    借助廣州地鐵十八號線，城際與地鐵多線貫通、並行運營，未來粵港澳大灣區的居民無需出站換乘、重新購票，就可便捷往來廣州、深圳、佛山、東莞、中山、珠海等城市中心。,http://www.macaodaily.com/html/2024-05/26/content_1757787.htm,借助廣州地鐵十八號線，城際與地鐵多線貫通、並行運營，未來粵港澳大灣區的居民無需出站換乘、重新購票，就可便捷往來廣州、深圳、佛山、東莞、中山、珠海等城市中心,將實 現大灣區 城際 聯通穗 地鐵         南珠 （ 中 ） 城際十萬區 間 段 啓 盾構         【 本報 消息 】 隨着 “ 鐵兵 南沙 四號 ” 盾構 機刀盤 緩緩 轉動 ， 標誌 着 南珠 （ 中 ） 城際 廣州段 十涌 站 至 萬頃 沙站 區間 （ 十萬區 間 ） 進入 盾構 施工 ， 全力 保障 全年 “ 洞通 ” 目標 。 北端 起點 在 萬頃 沙站 的 南珠 （ 中 ） 城際 ， 與 廣州 地鐵 十八 號線 南端 的 萬頃 沙站 銜接 ， 建成 後 兩 條線 路貫 通運營 ， 是 首條 可實 現粵 港澳 大灣區 城際 與 廣州 地鐵網 互聯 互通 的 軌道 交通 項目 。 該 城際 中珠段 將會 採用 公交化 運營 ， 實現 中山 中心 至廣州 中心 四十五分 鐘 、 中山 中心 至 珠海 拱北 （ 澳門 ） 五 十分 鐘通達 。         長 遠連 深圳市 中心         南珠 （ 中 ） 城際 是 國家 批覆 的 《 粵 港澳 大灣區 城際 鐵路 建設 規劃 》 中 的 項目 ， 是 第一 個 可 實現 大灣區 城際 與 廣州 地鐵網 互聯 互通 的 軌道 交通 項目 。 線路 建成 後 ， 廣州 地鐵將 實現 “ 四網 融合 ” 、 城際 鐵路 公交化 、 自主化 運營 。         南珠 （ 中 ） 城際 沿 珠江 西岸 ， 串聯廣州 南沙 、 中山 、 珠海 ， 憑 借城際 與 地 鐵 “ 無縫 銜接 ” ， 南珠 （ 中 ） 城際 乘客 可 直抵 廣州 市中心 城區 。 遠期 南珠 （ 中 ） 城際 與 深南 中城際銜 接貫 通運行 ， 將把 珠江 東岸 的 深圳市 中心 拉 入 “ 朋友圈 ” 。         中山 抵拱 毋須 句鐘         項目 廣州段 正盾 構掘 進 ， 朝 全年 “ 洞通 ” 目標 邁進 。 中山 至 珠海 段 也 爭取 年 內 開工 。 珠中 城際 啟建時 提出 ， 線路將 實施 公交化 運營 模式 ， 買票 即 上車 ， 車到 即 走 ， 盡量 提升 乘客 的 出行 效率 。         中珠 城際 定位 為粵 港澳 大灣區 西岸 南北向 內圈層 的 骨 幹 通勤 城際 鐵路 ， 兼顧 沿線 城市 的 都市 圈 快線 、 市域 快線 功能 。 據 測算 ， 能夠 實現 中山 中心 至廣州 中心 四十五分 鐘 、 中山 中心 至 珠海 拱北 （ 澳門 ） 五 十分 鐘通達 ， 形成 粵 港澳 大灣區 跨城 公交化 、 通勤 化服務 標準 。         方便 灣區 居民 往來         廣州 地 鐵建設 規劃 透露 ， 廣州 地鐵 十八 號線將 與 南珠 （ 中 ） 城際 在 南沙 銜接 ， 另一端 銜接廣 花城 際 、 芳 白城 際 ， 進而 實現 南珠 （ 中 ） 城際 與廣 花城 際 、 芳 白城 際 的 貫通 。         借助 廣州 地鐵 十八 號線 ， 城際 與 地 鐵多線 貫通 、 並行 運營 ， 未來粵 港澳 大灣區 的 居民 無 需出 站換 乘 、 重新 購票 ， 就 可 便捷 往來 廣州 、 深圳 、 佛山 、 東莞 、 中山 、 珠海 等 城市 中心 。,2024-05-26
灣區智慧通可訂多地酒店,灣區智慧通可訂多地酒店    粵澳跨境聯名卡累計交易逾廿一萬筆    【本報消息】智能交通在大灣區普及應用，澳門居民北上及跨境消費越趨便捷。嶺南通灣區智慧通小程序“酒店”功能本月廿三日上線，板塊聚合中國（北京、上海、廣州、深圳、香港、澳門）、新加坡、泰國、馬來西亞等國家和地區上千家酒店資源，用戶可通過灣區智慧通小程序輕鬆訂購境外酒店。嶺南通表示，嶺南通 · 澳門通聯名卡自二〇一三年推出，至今年四月累計發行超過〇點三四萬張，累計境內交易超廿一萬筆。    創新跨境業務合作    廣東省智能交通協會舉辦的“五月智能交通工程師文化節 · 交通大數據”專場近日在廣州舉行，圍繞交通行業數據應用新技術、新業態和新模式，讓業界就總體趨勢、數據資源、技術進展和應用場景等交流。    會上透露，嶺南通灣區智慧通小程序“酒店”功能上線，創新灣區智慧通境外業務合作模式。“酒店”小程序覆蓋中國大陸、新加坡、泰國、馬來西亞、中國香港和中國澳門等國家和地區，上線酒店上千家，創新嶺南通“交通+旅遊”的跨境業務合作新模式。    二〇一三年二月，廣東嶺南通股份有限公司繼嶺南通與香港八達通成功合作後，推出嶺南通 · 澳門通跨境聯名卡，實現廣東與澳門交通一卡通。    方便支付內地交通    二〇二二年，嶺南通推出“灣區智慧通”，為粵港澳大灣區出行用戶提供集公交、地鐵，公路、水路客運的一站式服務，現拓展超過二百條城際定制客運線路、二十多條粵港澳跨境及海島水上客運線路，上線澳門氹仔水上客運航線，並持續推進與東南亞國家和地區的酒店資源合作。    截至今年四月，嶺南通累計發行粵澳聯名卡超過〇點三四萬張，累計境內交易超廿一萬筆，交易金額超四十一萬元，為粵港澳居民提供便捷的交通支付體驗。,http://www.macaodaily.com/html/2024-05/26/content_1757788.htm,方便支付內地交通    二〇二二年，嶺南通推出“灣區智慧通”，為粵港澳大灣區出行用戶提供集公交、地鐵，公路、水路客運的一站式服務，現拓展超過二百條城際定制客運線路、二十多條粵港澳跨境及海島水上客運線路，上線澳門氹仔水上客運航線，並持續推進與東南亞國家和地區的酒店資源合作,灣區 智慧 通可訂 多 地 酒店         粵澳 跨境 聯名 卡累計 交易 逾 廿一 萬筆         【 本報 消息 】 智能 交通 在 大灣區 普及 應用 ， 澳門 居民 北上 及 跨境 消費 越 趨 便捷 。 嶺 南通 灣區 智慧 通小 程序 “ 酒店 ” 功能 本月 廿三日 上線 ， 板塊 聚合 中國 （ 北京 、 上海 、 廣州 、 深圳 、 香港 、 澳門 ） 、 新加坡 、 泰國 、 馬 來 西亞 等 國家 和 地區 上 千家 酒店 資源 ， 用戶 可通 過灣區 智慧 通小 程序 輕 鬆 訂 購 境外 酒店 。 嶺 南通 表示 ， 嶺 南通   ·   澳門 通聯名 卡自二 〇 一 三年 推出 ， 至今 年 四月 累計 發行 超過 〇 點 三四 萬張 ， 累計境 內 交易 超 廿一 萬筆 。         創新 跨境 業務 合作         廣東省 智能 交通 協會 舉辦 的 “ 五月 智能 交通 工程 師 文化 節   ·   交通 大數據 ” 專場 近日 在 廣州 舉行 ， 圍繞 交通 行業 數據 應用 新技術 、 新業態 和 新 模式 ， 讓 業界 就 總體 趨勢 、 數據 資源 、 技術 進展 和 應用 場景 等 交流 。         會上 透露 ， 嶺 南通 灣區 智慧 通小 程序 “ 酒店 ” 功能 上線 ， 創新灣區 智慧 通 境外 業務 合作 模式 。 “ 酒店 ” 小 程序 覆蓋 中國大陸 、 新加坡 、 泰國 、 馬 來 西亞 、 中國 香港 和 中國 澳門 等 國家 和 地區 ， 上線 酒店 上 千家 ， 創新嶺 南通 “ 交通 + 旅遊 ” 的 跨境 業務 合作 新 模式 。         二 〇 一 三年 二月 ， 廣東嶺 南通 股份 有限公司 繼嶺 南通 與 香港 八達通 成功 合作 後 ， 推出 嶺 南通   ·   澳門通 跨境 聯名 卡 ， 實現 廣東 與 澳門 交通 一卡通 。         方便 支付 內地 交通         二 〇 二 二年 ， 嶺 南通 推出 “ 灣區 智慧 通 ” ， 為粵 港澳 大灣區 出行 用戶 提供 集 公交 、 地鐵 ， 公路 、 水路 客運 的 一站式 服務 ， 現 拓展 超過 二百 條城際 定制 客運線 路 、 二十多 條粵 港澳 跨境 及海島 水上 客運線 路 ， 上線 澳門 氹 仔 水上 客運 航線 ， 並持續 推進 與 東南亞國家 和 地區 的 酒店 資源 合作 。         截至 今年 四月 ， 嶺 南通 累計 發行粵 澳聯名 卡 超過 〇 點 三四 萬張 ， 累計境 內 交易 超 廿一 萬筆 ， 交易 金額 超 四十一 萬元 ， 為粵 港澳 居民 提供 便捷 的 交通 支付 體驗 。,2024-05-26
澳流感未現大規模爆發,四月環比增近三成四    澳流感未現大規模爆發    【本報消息】本澳四月流感個案按月增加近三成四。衛生局副局長、仁伯爵綜合醫院院長郭昌宇昨日出席活動後受訪表示，鄰近地區、大灣區流感數字有所上升，鄰近地方出現流感、新冠新變種病毒，澳門暫時未有大規模爆發表現，在急診及住院方面較平穩。    急診輪候平穩    郭昌宇表示，以當下成人急診、兒科急診、離島急診即時情況為例，第三類成人急診有五人等候、第四類有三人，平均輪候時間分別是三十六分鐘、五十三分鐘，輪候時間在當局預計中，當局期望值是輪候時間不超過兩小時。兒科急診輪候時間較長，為兩小時三十四分鐘，但屬第四級，輪候時間亦在當局預計之中。    被問及夏季流感趨勢？郭昌宇稱，一般按季節性流感是冬春季較明顯，夏季應較平靜。但現時面對流感、新冠病毒有變異情況，當局會密切留意。    做好個人防護    現時居民接種預防疫苗的積極性如何？郭昌宇指出，有關數字沒有明顯減退或增加，呼籲居民注意個人衛生、勤洗手，未洗手不要用手接觸眼鼻口。對於居民暑假外遊，當使用公共交通工具及在人多場所時，建議戴口罩做好個人防護。    關注蚊患指數    另外，被問及今年登革熱情況？郭昌宇表示，近日濕度高，疾控中心會密切注意各區誘蚊產卵器指數有否增高，並跟進處理。,http://www.macaodaily.com/html/2024-05/26/content_1757764.htm,急診輪候平穩    郭昌宇表示，以當下成人急診、兒科急診、離島急診即時情況為例，第三類成人急診有五人等候、第四類有三人，平均輪候時間分別是三十六分鐘、五十三分鐘，輪候時間在當局預計中，當局期望值是輪候時間不超過兩小時,四月 環 比增 近三成 四         澳 流感 未現 大規模 爆發         【 本報 消息 】 本澳 四月 流感 個案 按 月 增加 近三成 四 。 衛生局 副 局長 、 仁 伯爵 綜合 醫院 院長 郭昌宇 昨日 出席 活動後受 訪 表示 ， 鄰 近地 區 、 大灣區 流感 數字 有所 上升 ， 鄰近 地方 出現 流感 、 新冠新 變種 病毒 ， 澳門 暫時 未有 大規模 爆 發表現 ， 在 急 診及 住院 方面 較平穩 。         急診 輪候 平穩         郭昌宇 表示 ， 以當下 成人 急診 、 兒科 急診 、 離島 急診 即 時 情況 為例 ， 第三 類 成人 急診 有 五人 等候 、 第四 類有 三人 ， 平均 輪候 時間 分別 是 三十六 分鐘 、 五十 三分 鐘 ， 輪候 時間 在 當局 預計 中 ， 當局 期望值 是 輪候 時間 不 超過 兩小時 。 兒科急 診輪候 時間 較長 ， 為 兩小時 三十四 分鐘 ， 但屬 第四 級 ， 輪候 時間 亦 在 當局 預計 之中 。         被 問及 夏季 流感 趨勢 ？ 郭昌宇稱 ， 一般 按季 節性 流感 是 冬春季 較明顯 ， 夏季 應較 平靜 。 但現 時面 對 流感 、 新冠 病毒 有 變異 情況 ， 當局 會 密切 留意 。         做好 個 人防 護         現時 居民 接種 預防 疫苗 的 積極性 如何 ？ 郭昌宇 指出 ， 有關 數字 沒有 明顯 減退 或 增加 ， 呼籲 居民 注意 個 人衛生 、 勤洗手 ， 未 洗手 不要 用手 接觸 眼鼻口 。 對 於 居民 暑假 外遊 ， 當 使用 公共 交通工具 及 在 人多場 所時 ， 建議 戴 口罩 做好 個 人防 護 。         關注 蚊患 指數         另外 ， 被 問及 今年 登革熱 情況 ？ 郭昌宇 表示 ， 近日 濕度 高 ， 疾控中心 會 密切注意 各區 誘 蚊產卵器 指數 有否 增高 ， 並跟進 處理 。,2024-05-26
醫生：呼吸道疾病趨增,醫生：呼吸道疾病趨增    籲長幼接種疫苗防重症    【本報消息】當局稱，今年四月流感及新冠病毒個案增加。新青協副理事長、信和醫療中心醫生陳國強提醒居民要注重自身和長者及小朋友的個人衛生及預防病毒，減低群體感染風險。    陳國強指出，近期除流感及新冠病毒外，感染猩紅熱、手足口病、皰疹性咽喉炎等人數也有上升趨勢，社區醫療就診人數相應增加，一般以發燒及上呼吸道症狀為主，長者及兒童較為多見。呼吸道疾病會刺激病人的呼吸道、氣管以及肺部，出現咳嗽、咳痰、流鼻水、打噴嚏及氣促氣喘等症狀；部分因為天氣改變、濕度加重，引起原本過敏情況加重，症狀反覆難以緩解，容易導致氣管炎、哮喘等。    保持衛生勤洗手    他提醒居民應注意多飲水及保持充足休息，保持良好衛生習慣、勤洗手、補充足夠營養，避免到人多擠迫地方，如有不適，應佩戴好口罩。幼兒抵抗力較差，如有發病，應待身體好轉後才上學，避免交叉感染。未有注射疫苗人士，尤其長者及幼兒等自身免疫力較低群體，應盡快注射，乃最有效的預防重症方法。    一旦身體不適，要及時求診，如高燒不退，應盡快四十八小時內檢測並診斷，如感染流感可服用特效藥，越早服用，可減輕症狀，並預防重症。,http://www.macaodaily.com/html/2024-05/26/content_1757765.htm,陳國強指出，近期除流感及新冠病毒外，感染猩紅熱、手足口病、皰疹性咽喉炎等人數也有上升趨勢，社區醫療就診人數相應增加，一般以發燒及上呼吸道症狀為主，長者及兒童較為多見,醫生 ： 呼吸道 疾病 趨增         籲長 幼接種 疫苗 防 重症         【 本報 消息 】 當局 稱 ， 今年 四月 流感 及 新冠 病毒 個案 增加 。 新青協 副 理事 長 、 信 和 醫療 中心 醫生 陳 國強 提醒 居民 要 注重 自身 和 長 者 及 小朋友 的 個 人衛生 及 預 防病毒 ， 減低 群體 感染 風險 。         陳 國強 指出 ， 近期 除 流感 及 新冠 病毒 外 ， 感染 猩紅熱 、 手足 口病 、 皰疹 性 咽喉炎 等 人數 也 有 上升 趨勢 ， 社區 醫療 就 診人數 相應 增加 ， 一般 以發 燒及 上呼吸道 症狀 為 主 ， 長 者 及 兒童 較 為 多 見 。 呼吸道 疾病 會 刺激 病人 的 呼吸道 、 氣管 以及 肺部 ， 出現 咳嗽 、 咳痰 、 流 鼻水 、 打噴嚏 及氣 促氣 喘 等 症狀 ； 部分 因為 天氣 改變 、 濕度 加重 ， 引起 原本 過敏 情況 加重 ， 症狀 反覆 難以 緩解 ， 容易 導致氣 管炎 、 哮喘 等 。         保持 衛生 勤洗手         他 提醒 居民 應 注意 多 飲水及 保持 充足 休息 ， 保持良好 衛生 習慣 、 勤洗手 、 補 充足 夠營養 ， 避免 到 人 多 擠迫 地方 ， 如有 不適 ， 應 佩戴 好 口罩 。 幼兒 抵抗力 較差 ， 如有 發病 ， 應待 身體 好 轉後才 上學 ， 避免 交叉感染 。 未有 注射 疫苗 人士 ， 尤其 長 者 及 幼兒 等 自身 免疫力 較 低 群體 ， 應盡快 注射 ， 乃 最 有效 的 預防 重症 方法 。         一旦 身體 不適 ， 要 及 時求診 ， 如高燒 不退 ， 應盡快 四十八 小時 內 檢測 並診斷 ， 如 感染 流感 可 服用 特效 藥 ， 越 早 服用 ， 可減 輕症 狀 ， 並預防 重症 。,2024-05-26
