Title,Content,Link,Summary,Preprocessed_Content,Date
莫文蔚錄新歌唱哭自己,莫文蔚錄新歌唱哭自己    莫文蔚近來為電影《被我弄丟的你》演唱同名主題曲，她在錄唱MV“我弄丟了你，怪我不小心”這句歌詞時，多次深陷其中落淚，而久久難以自已。    MV由曾獲金雞獎最佳攝影提名的著名攝影師樸松日掌鏡，莫文蔚身着白襯衫深情演唱，拍攝過程中被歌詞感動到多次唱哭自己，好幾次哽咽下潛然落淚，為MV留下不可多得的感人場面。MV與歌曲甫上架，兩岸三地點擊數突破六百萬，網友紛紛留言：“動人心弦的歌聲。” “已經讓這首歌深深烙印在腦海，聽完副歌就忍不住掉淚了。”    龍年開春莫文蔚聊起二○二四年的新計劃，她表示：“已經在開始籌備新的音樂作品，許多樂迷都會私訊叫我開演唱會，我也正跟團隊構想新計劃，請大家靜心等待，我們會努力的。”,http://www.macaodaily.com/html/2024-02/25/content_1737067.htm,莫文蔚錄新歌唱哭自己    莫文蔚近來為電影《被我弄丟的你》演唱同名主題曲，她在錄唱MV“我弄丟了你，怪我不小心”這句歌詞時，多次深陷其中落淚，而久久難以自已,莫文蔚 錄新 歌唱 哭 自己         莫文蔚 近來 為 電影 《 被 我 弄 丟的 你 》 演唱 同名 主題 曲 ， 她 在 錄唱 MV “ 我 弄 丟了 你 ， 怪 我 不 小心 ” 這句 歌詞 時 ， 多次 深陷 其中 落淚 ， 而 久久 難以 自已 。         MV 由 曾 獲金雞獎 最佳 攝影 提名 的 著名 攝影 師樸 松日 掌鏡 ， 莫文蔚 身着 白襯 衫 深情 演唱 ， 拍攝 過程 中 被 歌詞 感動 到 多次 唱 哭 自己 ， 好 幾次 哽咽 下潛然 落淚 ， 為 MV 留下 不可多得 的 感人 場面 。 MV 與 歌曲 甫 上架 ， 兩岸 三地 點擊數 突破 六百 萬 ， 網友 紛紛 留言 ： “ 動人 心弦 的 歌聲 。 ”   “ 已經 讓 這 首歌 深深 烙印 在 腦海 ， 聽 完 副歌 就 忍不住 掉 淚 了 。 ”         龍年 開春 莫文蔚 聊起 二 ○ 二 四年 的 新計劃 ， 她 表示 ： “ 已經 在 開始 籌備 新 的 音樂 作品 ， 許多樂迷 都 會 私訊 叫 我 開 演唱 會 ， 我 也 正 跟 團隊 構想 新計劃 ， 請 大家 靜心 等待 ， 我們 會 努力 的 。 ”,2024-02-25
Phone Show嘉年華今晚舉行,Phone Show嘉年華今晚舉行    由澳門管樂協會主辦，文化發展基金贊助，第八屆“Phone Show嘉年華”薩克管重奏音樂會，今日晚上七時四十五分於文化中心小劇院舉行。    本屆“Phone Show嘉年華”由澳門青年薩克管演奏家呂瀚章擔任指揮，並邀得來自台灣的薩克管演奏家陳力鋒加盟演出，帶領澳門管樂協會薩克管重奏團為澳門樂迷演繹出中華文化的自信與自強。    本次演出曲目包括《春節序曲》、《瑤族舞曲》、《珈牧仁的鲜花》、《梁祝協奏曲》、《第一薩克斯管協奏曲》、《台灣民謠組曲》等經典及別具特色的作品。    台灣薩克管演奏家陳力鋒演奏足跡遍及世界各地，在多項國際大賽均有傑出表現。陳力鋒每年各式演出場次達六十場，曾與高雄市立交響樂團、TSO 管樂團等知名樂團演出協奏曲。    門票於澳門售票網（廣星）公開發售，有關音樂會查詢可致電管樂協會(2825 · 2825 / 6866 · 6332)，或瀏覽協會網頁www.mbda.org.mo及Facebook專頁。,http://www.macaodaily.com/html/2024-02/25/content_1737069.htm,本屆“Phone Show嘉年華”由澳門青年薩克管演奏家呂瀚章擔任指揮，並邀得來自台灣的薩克管演奏家陳力鋒加盟演出，帶領澳門管樂協會薩克管重奏團為澳門樂迷演繹出中華文化的自信與自強,Phone   Show 嘉年華 今晚 舉行         由 澳門 管樂 協會 主辦 ， 文化 發展 基金 贊助 ， 第八 屆 “ Phone   Show 嘉年華 ” 薩克管 重奏 音樂會 ， 今日 晚上 七時 四十五分 於 文化 中心 小劇院 舉行 。         本屆 “ Phone   Show 嘉年華 ” 由 澳門 青年 薩克管 演奏家 呂瀚章 擔任 指揮 ， 並邀 得 來 自台灣 的 薩克管 演奏家 陳 力鋒 加盟 演出 ， 帶領 澳門 管樂 協會 薩克管 重奏 團為 澳門樂迷 演繹出 中華 文化 的 自信 與 自強 。         本次 演出 曲目 包括 《 春節 序曲 》 、 《 瑤族 舞曲 》 、 《 珈 牧仁 的 鲜花 》 、 《 梁祝 協 奏曲 》 、 《 第一 薩 克斯 管協 奏曲 》 、 《 台灣民謠 組曲 》 等 經典 及 別具 特色 的 作品 。         台灣薩克管 演奏家 陳 力鋒 演奏 足跡 遍及 世界各地 ， 在 多 項國際 大賽 均 有傑 出表現 。 陳 力鋒 每年 各式 演出 場次 達 六十 場 ， 曾 與 高雄市 立交 響樂團 、 TSO   管樂團 等 知名 樂團 演出 協 奏曲 。         門票 於 澳門 售票 網 （ 廣星 ） 公開 發售 ， 有關 音樂會 查詢 可致 電管樂 協會 ( 2825   ·   2825   /   6866   ·   6332 ) ， 或 瀏覽 協會 網頁 www . mbda . org . mo 及 Facebook 專頁 。,2024-02-25
馬後炮逢發必中    娛翁,馬後炮逢發必中    當李龍基與王青霞的“父女戀”最近爆出新聞後，幸災樂禍的人不少，但大多都是身份不明的網民，反而圈中人則甚少公開評論或取笑。畢竟不看僧面看佛面，為了一時貪口爽得失同行實在太不值得。不過也不是誰都會避忌，正如林作便公開抽水。始終他也不算是圈中人，基本上不會跟李龍基有演藝上合作的機會。即使有機會他都可以放棄，所以對他而言自然該抽便抽，不負“抽水王”之名。反倒是有相士公開評價王青霞，也算是較狠的一個，原因大概跟“抽水王”情況相近，哪怕其也會幕前演出，但畢竟只是副業，是以亦不介意揶揄一下。    這相士先直指李龍基的“李”與“龍”兩字犯太歲，然後再稱早已發覺王青霞有點不尋常，繼而再爆曾收過王青霞自稱為名牌設計的筷子，但卻無法在該名牌的網店中找到該對筷子的相片，繼而再說估不到李龍基如此癡心。    玄學兩字中最深奧的就是玄。這相士無疑將“玄”發揮到極致，直可以將所有看錯的事、說錯的話回收。不過這相士發炮素來準確，原因不是其玄學造詣，而是發出的多是“馬後炮”。如二○一六年在看過英女王伊莉莎白二世的出世紙後，便指英女王一生大富大貴衣食無憂，貴為英國君主難道還要愁穿愁吃嗎？二○一四年六月曾指方力申和鄧麗欣戀情穩定，指他們有機會在二○一六年結婚，但結果方鄧兩人卻在二○一六年宣佈分手。二○一八年十一月，又於報章上指出馬國明與黃心穎在二○一九年的豬年有機會結婚，但翌年四月隨即爆出安心偷食事件。在二○二二年當黃曉明與Angelababy離婚後，又稱一早批中……類似事例實在多不勝數。    娛翁,http://www.macaodaily.com/html/2024-02/25/content_1737070.htm,這相士先直指李龍基的“李”與“龍”兩字犯太歲，然後再稱早已發覺王青霞有點不尋常，繼而再爆曾收過王青霞自稱為名牌設計的筷子，但卻無法在該名牌的網店中找到該對筷子的相片，繼而再說估不到李龍基如此癡心,馬 後 炮逢 發必 中         當李龍基 與 王青霞 的 “ 父女 戀 ” 最近 爆出 新聞 後 ， 幸災樂禍 的 人 不少 ， 但 大多 都 是 身份 不明 的 網民 ， 反而 圈 中人則 甚少 公開 評論 或 取笑 。 畢竟 不看僧面看佛面 ， 為 了 一時 貪口爽 得失 同行 實在 太 不 值得 。 不過 也 不是 誰 都 會 避忌 ， 正 如林 作便 公開 抽水 。 始終 他 也 不算 是 圈 中人 ， 基本上 不會 跟 李龍 基有 演藝上 合作 的 機會 。 即使 有 機會 他 都 可以 放棄 ， 所以 對 他 而言 自然 該 抽 便 抽 ， 不負 “ 抽水 王 ” 之名 。 反倒 是 有 相士 公開 評價 王青霞 ， 也 算是 較 狠 的 一個 ， 原因 大概 跟 “ 抽水 王 ” 情況 相近 ， 哪怕 其 也 會 幕前 演出 ， 但 畢竟 只是 副業 ， 是 以 亦 不介意 揶揄 一下 。         這 相士 先 直指 李龍基 的 “ 李 ” 與 “ 龍 ” 兩字 犯太歲 ， 然後再 稱 早已 發覺 王青霞 有點 不 尋常 ， 繼而 再 爆 曾 收過 王青霞 自稱 為 名牌 設計 的 筷子 ， 但 卻 無法 在 該 名牌 的 網店 中 找到 該 對 筷子 的 相片 ， 繼而 再 說估 不到 李龍基 如此 癡 心 。         玄學 兩字 中 最深 奧 的 就是 玄 。 這 相士 無疑將 “ 玄 ” 發揮到 極致 ， 直 可以 將 所有 看錯 的 事 、 說 錯 的 話 回收 。 不過 這 相士 發炮 素來 準確 ， 原因 不是 其玄學 造詣 ， 而是 發出 的 多 是 “ 馬 後 炮 ” 。 如二 ○ 一 六年 在 看過 英女王 伊莉莎白 二世 的 出世 紙後 ， 便 指 英女王 一生 大富 大貴 衣食 無憂 ， 貴為 英國 君主 難道 還要 愁 穿 愁 吃 嗎 ？ 二 ○ 一 四年 六月 曾 指 方力申 和 鄧麗 欣戀情 穩定 ， 指 他們 有 機會 在 二 ○ 一 六年 結婚 ， 但 結果方 鄧兩人 卻 在 二 ○ 一 六年 宣 佈 分手 。 二 ○ 一 八年 十一月 ， 又 於 報章 上 指出 馬 國明 與 黃 心穎 在 二 ○ 一 九年 的 豬年 有 機會 結婚 ， 但 翌年 四月 隨即 爆出 安心 偷食 事件 。 在 二 ○ 二 二年 當黃曉明 與 Angelababy 離婚 後 ， 又 稱 一早 批中 … … 類似 事例 實在 多 不勝數 。         娛翁,2024-02-25
網民掛念小龍女    高梁,網民掛念小龍女    龍年，有網民掛念小龍女。她們母女關係，破裂了許多年，新年新開始，有否緩和？恭喜骨肉不分離！    口痕友將三年前照片放上網，聖誕節，吳卓林和外籍老婆，比她年長十二歲的Andi，瑟縮加拿大街頭，領取救濟品。陰功豬，點解不返港找媽媽。吳綺莉當時回應：“最重要是家人開心、幸福、健康、平安。”    這段影片，新春期間轉到抖音，網友留言：“吳卓林眞慘！”吳綺莉親自正面回應：“一個人在年輕的時候，可以有經歷，是幸福的。”這位似單親，實非單親的母親，對於女兒遠走他方，一直勞氣。轉眼二十三歲了，也有了女大女世界的胸懷。吳綺莉社交平台向網友拜年，祝福新年快樂，並不介懷網友將小龍女相片放上網，贏來網友一片讚嘆：“女兒既然已經認定了自己的生活方式，就接納包容她吧。畢竟是自己的親生骨肉……”並祝福“讓她回到媽媽懷抱，母女共享愛的暖意！”該段留言，讓吳綺莉感動，帖上“愛心”、“合掌”等圖案回應。讓網友也在猜，兩母女也許有破冰可能。    吳綺莉、吳卓林，母女相依為命，關係好好。十七歲時，小龍女突然宣佈出櫃，並找工作供養當時三十歲的女友Andi，母女關係頓時決裂。不時爆出新聞，成為網民茶餘飯後的話題。吳綺莉與卓林，不只一次，母女互相攻擊及批評對方，甚至驚動警方，骨肉親情勢如水火。卓林這對同性夫妻到加拿大結婚流浪，傳聞要領救濟品。不少網民認為她們母女關係難以修復 。但人會變，月會圓，吳綺莉最近積極做直播帶貨，日前，她罕有地談及女兒吳卓林及成龍，再次引起網民關注。    “女兒現在是學習當中，我覺得要讓她自己去學習。”吳綺莉直播帶貨，提起小龍女，心平氣和了：“許多東西，媽媽講多少都沒有用，要自己去感受體會了才懂。她碰了，覺得痛了，就知道那個是不對的……”直言自己都有做錯的地方，“現在，我就要學得溫柔一點”。吳綺莉透露，“現在卓林好努力生活，希望女兒能夠走出不一樣的路”，“若遇挫折時，母親亦會等她回來，家裡的大門永遠向她敞開……”母女正在修補關係。    高梁,http://www.macaodaily.com/html/2024-02/25/content_1737071.htm,吳綺莉社交平台向網友拜年，祝福新年快樂，並不介懷網友將小龍女相片放上網，贏來網友一片讚嘆：“女兒既然已經認定了自己的生活方式，就接納包容她吧,網民掛 念小龍 女         龍年 ， 有 網民掛 念小龍 女 。 她 們 母女 關 係 ， 破裂 了許 多年 ， 新年新 開始 ， 有否 緩 和 ？ 恭喜 骨肉 不分 離 ！         口痕 友將 三年 前 照片 放上網 ， 聖誕節 ， 吳卓林 和 外籍 老婆 ， 比 她 年 長 十二 歲 的 Andi ， 瑟縮 加拿大 街頭 ， 領取 救濟品 。 陰功豬 ， 點解 不 返港 找 媽媽 。 吳綺莉 當時 回應 ： “ 最 重要 是 家人 開心 、 幸福 、 健康 、 平安 。 ”         這段 影片 ， 新春 期間 轉到 抖音 ， 網友 留言 ： “ 吳卓林眞慘 ！ ” 吳綺莉 親自 正面 回應 ： “ 一個 人 在 年 輕 的 時候 ， 可以 有 經歷 ， 是 幸福 的 。 ” 這位 似 單親 ， 實非 單親 的 母親 ， 對 於 女兒 遠 走 他方 ， 一直 勞氣 。 轉眼 二十三 歲 了 ， 也 有 了 女大女 世界 的 胸懷 。 吳綺莉 社交 平台 向 網友 拜年 ， 祝福 新年 快樂 ， 並不介懷 網友 將小龍 女 相片 放上網 ， 贏來 網友 一片 讚 嘆 ： “ 女兒 既然 已經 認定 了 自己 的 生活 方式 ， 就 接納 包容 她 吧 。 畢 竟是 自己 的 親生 骨肉 … … ” 並 祝福 “ 讓 她 回到 媽媽 懷抱 ， 母女 共享 愛的 暖意 ！ ” 該段 留言 ， 讓 吳綺莉 感動 ， 帖 上 “ 愛心 ” 、 “ 合掌 ” 等 圖案 回應 。 讓 網友 也 在 猜 ， 兩 母女 也 許有 破冰 可能 。         吳綺莉 、 吳卓林 ， 母女 相依 為命 ， 關 係 好好 。 十七 歲 時 ， 小龍女 突然 宣 佈 出櫃 ， 並找 工作 供養 當時 三十 歲 的 女友 Andi ， 母女 關 係 頓時 決裂 。 不時 爆出 新聞 ， 成為 網民茶 餘飯 後 的 話題 。 吳綺莉 與 卓林 ， 不 只 一次 ， 母女 互相 攻擊 及 批評 對方 ， 甚至 驚動 警方 ， 骨肉 親情勢 如 水火 。 卓林 這對 同性 夫妻 到 加拿大 結婚 流浪 ， 傳聞要 領救濟品 。 不少 網民認 為 她 們 母女 關 係 難以 修 復   。 但 人會變 ， 月會圓 ， 吳綺莉 最近 積極 做 直播 帶貨 ， 日前 ， 她 罕有 地談及 女兒 吳卓林及 成龍 ， 再次 引起 網民關 注 。         “ 女兒現 在 是 學習 當中 ， 我覺 得 要 讓 她 自己 去 學習 。 ” 吳綺莉 直播 帶貨 ， 提起 小龍女 ， 心平氣 和 了 ： “ 許多 東西 ， 媽媽講 多少 都 沒 有用 ， 要 自己 去 感受 體會 了 才 懂 。 她 碰 了 ， 覺得 痛 了 ， 就 知道 那個 是 不 對 的 … … ” 直言 自己 都 有 做 錯 的 地方 ， “ 現在 ， 我 就要 學得 溫柔 一點 ” 。 吳綺莉 透露 ， “ 現在 卓林 好 努力 生活 ， 希望 女兒 能夠 走出 不一樣 的 路 ” ， “ 若遇 挫折 時 ， 母親 亦 會 等 她 回來 ， 家裡 的 大門永遠 向 她 敞開 … … ” 母女 正在 修補關 係 。         高梁,2024-02-25
陳雅莉劉漪琳育新苗    文：花生仔,辦澳門兒童才藝教育品牌    陳雅莉劉漪琳育新苗    本地電影導演陳雅莉(Emily)自二〇二一年編寫電視劇《野人老師》後，便與兒童教育建立不解之緣。近日Emily伙拍演員劉漪琳(Eliz)攜手創辦的澳門兒童才藝學院（簡稱MOKTA）正式開幕，二人表示MOKTA將透過豐富多彩的教學方式，提升孩子們的創造力、表達力和溝通技巧，藉此培育和發掘更多演藝人材。    Emily表示：“MOKTA源自於香港兒童才藝學院集團，作為該集團在外地的首個分支，將憑專業教育系統以及多位星級導師的支持，打造出一個讓孩子們發揮無限潛能學習空間，並鼓勵多元發展的綜合戲劇課程。”    Eliz表示：“本來對教育一事並沒有太多想法，但當得悉同為澳門人的香港兒童才藝學院行政總裁梁善欣(Juli)的分享後，感覺大家對澳門的想法與情懷是一致的，十分希望能以‘過來人’身份，帶領澳門的小朋友體驗更大的舞台。”    開幕典禮當日，本地歌手陳慧敏登場獻唱，為現場氣氛注入活力。隨後澳門兒童才藝學院的首批學員登場，家長們也在現場分享了孩子參與學院後的成長與轉變。緊接由來自香港和澳門的學員聯合表演了本年度大騷《神奇學生》節目巡禮展演，將開幕典禮的氣氛推至高峰。現場更有超過二十組來自香港的學員家庭到場支持，港澳家長亦把握機會交流教育心得。    文：花生仔,http://www.macaodaily.com/html/2024-02/25/content_1737068.htm,”    Eliz表示：“本來對教育一事並沒有太多想法，但當得悉同為澳門人的香港兒童才藝學院行政總裁梁善欣(Juli)的分享後，感覺大家對澳門的想法與情懷是一致的，十分希望能以‘過來人’身份，帶領澳門的小朋友體驗更大的舞台,辦澳門兒 童才藝 教育 品牌         陳 雅莉 劉漪琳 育新 苗         本地 電影導 演陳雅莉 ( Emily ) 自二 〇 二 一年 編寫 電視劇 《 野人 老師 》 後 ， 便 與 兒童 教育 建立 不解 之緣 。 近日 Emily 伙拍 演員 劉漪琳 ( Eliz ) 攜手 創辦 的 澳門兒 童才 藝學院 （ 簡稱 MOKTA ） 正式 開幕 ， 二人 表示 MOKTA 將透過 豐富 多彩的 教學 方式 ， 提升 孩子 們 的 創造力 、 表達力 和 溝通 技巧 ， 藉此 培育 和 發掘 更 多 演藝 人材 。         Emily 表示 ： “ MOKTA 源自 於 香港 兒童 才 藝學院 集團 ， 作為 該 集團 在 外地 的 首個 分支 ， 將憑 專業 教育系 統 以及 多位 星級 導師 的 支持 ， 打造出 一個 讓 孩子 們 發揮 無限 潛能 學習 空間 ， 並鼓勵 多元 發展 的 綜合 戲劇 課程 。 ”         Eliz 表示 ： “ 本來 對 教育 一事 並沒有 太多 想法 ， 但當 得悉 同為 澳門 人 的 香港 兒童 才 藝學院 行政 總裁 梁善欣 ( Juli ) 的 分享 後 ， 感覺 大家 對 澳門 的 想法 與 情懷 是 一致 的 ， 十分 希望 能以 ‘ 過來 人 ’ 身份 ， 帶領 澳門 的 小朋友 體驗 更 大 的 舞台 。 ”         開幕 典禮 當日 ， 本地 歌手 陳 慧敏 登場 獻 唱 ， 為 現場 氣氛 注入 活力 。 隨後澳門 兒童 才 藝學院 的 首批 學員 登場 ， 家長 們 也 在 現場 分享 了 孩子 參與 學院 後 的 成長 與 轉變 。 緊接 由 來 自 香港 和 澳門 的 學員聯合 表演 了 本年度 大騷 《 神奇 學生 》 節目 巡禮 展演 ， 將開幕 典禮 的 氣氛 推至 高峰 。 現場 更 有 超過 二十 組來 自 香港 的 學員 家庭 到場 支持 ， 港澳 家長 亦 把握 機會 交流 教育 心得 。         文 ： 花生 仔,2024-02-25
歐陽日華擔任MOKTA導師,歐陽日華擔任MOKTA導師    本地跳唱歌手歐陽日華(Kane)獲邀成為MOKTA導師，他表示非常興奮和期待。Kane說：“加入MOKTA是我尋求新挑戰的一步，希望能夠與學生們一同成長，並將我所學的舞台知識和經驗傳授給他們。”談到童年的經歷，Kane坦言自己也曾是一個上台就會害怕得腳抖的小朋友，後來因為對舞台的熱愛，努力克服困難和恐懼，才成為今天全能藝人。也正因有這些感受，令他更認同MOKTA的辦學理念。    Kane表示：“MOKTA通過戲劇、唱歌、跳舞等多種形式訓練孩子的專注力，增強孩子的自信及創造力、建立更有效的溝通協調及表演力，跟自己的成長軌跡不謀而合，因此十分有信心帶領小朋友一起進步成長。”他今年暑假將會帶澳門小朋友一同到香港，參加香港總校HKKTA舉行的全港最大型親子音樂劇場一事，Kane表示：“冇有怕！一定掂！”,http://www.macaodaily.com/html/2024-02/25/content_1737072.htm,Kane表示：“MOKTA通過戲劇、唱歌、跳舞等多種形式訓練孩子的專注力，增強孩子的自信及創造力、建立更有效的溝通協調及表演力，跟自己的成長軌跡不謀而合，因此十分有信心帶領小朋友一起進步成長,歐陽 日華 擔任 MOKTA 導師         本地 跳 唱歌 手 歐陽 日華 ( Kane ) 獲邀 成為 MOKTA 導師 ， 他 表示 非常 興奮 和 期待 。 Kane 說 ： “ 加入 MOKTA 是 我 尋 求新 挑戰 的 一步 ， 希望 能夠 與 學生們 一同 成長 ， 並將 我 所學 的 舞台 知識 和 經驗 傳 授給 他們 。 ” 談到 童年 的 經歷 ， Kane 坦言 自己 也 曾 是 一個 上台 就 會 害怕 得 腳抖 的 小朋友 ， 後 來 因為 對 舞台 的 熱愛 ， 努力 克服 困難 和 恐懼 ， 才 成為 今天 全能 藝人 。 也 正 因有 這些 感受 ， 令 他 更 認同 MOKTA 的 辦學 理念 。         Kane 表示 ： “ MOKTA 通過 戲劇 、 唱歌 、 跳舞 等 多種 形式 訓練 孩子 的 專注力 ， 增強 孩子 的 自信 及 創造力 、 建立 更 有效 的 溝通 協調 及 表演 力 ， 跟 自己 的 成長 軌跡 不謀而合 ， 因此 十分 有 信心 帶領 小朋友 一起 進步 成長 。 ” 他 今年 暑假 將會 帶 澳門 小朋友 一同 到 香港 ， 參加 香港 總校 HKKTA 舉行 的 全港 最 大型 親 子音 樂劇場 一事 ， Kane 表示 ： “ 冇 有 怕 ！ 一定 掂 ！ ”,2024-02-25
