Title,Content,Link,Summary,Preprocessed_Content,Date
減息預期升溫 加元轉弱   中國銀行澳門分行金融市場部,減息預期升溫   加元轉弱    周二加拿大公佈四月份CPI數據，當地通脹年率由三月的2.9%回落至2.7%，符合市場預期，為二一年三月以來最低水準。數據公佈後，市場對加拿大央行減息預期迅速升溫，加上美聯儲局在四月通脹數據公佈後維持審慎，令加元走勢隨之轉弱。美元兌加元匯價最高見1.3675水準，目前匯價徘徊在1.3650附近。    本次公佈的四月份通脹數據，是加央行在六月宣佈下一次利率水準前的最後一份重要數據。通脹回落，為市場注入一劑強心針，交易員押注加央行將在六月迎來第一次減息，或致加元走勢進一步疲軟。    加拿大央行旨在把通脹率維持在2%左右，當局曾預測，今年上半年通脹率將保持在3%左右，並預計明年降至目標水準。但根據目前公佈的通脹數據顯示，當地通脹率的下降速度可能超出當局預期。    加上加拿大上半年經濟水準似有放緩跡象，先前公佈的二月份GDP環比增0.2%，較一月份的0.3%回落；統計局預計三月份經濟增長將保持不變。市場相信在通脹持續放緩及經濟增長走弱的壓力下，加央行在六月的議息會議上決定減息的可能性不斷上升。    美元方面，上周公佈的四月核心消費者價格指數(CPI)同比漲3.6%，低於前值的3.8%，符合市場預期，暗示美國通脹水準可能有回落跡象。但數據公佈後多位美聯儲局官員相繼發聲，整體論調偏向“鷹派”，認為目前數據顯示通脹降溫的趨勢不顯著，需要更多數據支持以確認通脹水準持續降溫，直到目標水準2%的路徑上，才會調整目前的利率水準。    市場預料美聯儲局將在九月實現第一次減息。有關論調為美元指數的回穩提供支撐，目前在104.6上方波動，令非美貨幣承壓。伴隨着加拿大減息預期升溫，投資者需留意美加減息預期步伐的錯落，或迫使加元在減息決議公佈前持續偏弱。    中國銀行澳門分行金融市場部,http://www.macaodaily.com/html/2024-05/23/content_1757137.htm,減息預期升溫   加元轉弱    周二加拿大公佈四月份CPI數據，當地通脹年率由三月的2.9%回落至2.7%，符合市場預期，為二一年三月以來最低水準,減息 預期 升溫       加元 轉弱         周二 加拿大 公 佈 四月份 CPI 數據 ， 當地 通脹 年率 由 三月 的 2.9% 回落 至 2.7% ， 符合 市場 預期 ， 為 二 一年 三月 以來 最低 水準 。 數據公 佈 後 ， 市場 對 加拿大 央行 減息 預期 迅速 升溫 ， 加上 美聯 儲局 在 四月 通脹 數據公 佈 後 維持 審慎 ， 令 加元 走勢 隨之 轉弱 。 美元 兌 加元 匯價 最高 見 1.3675 水準 ， 目前 匯價 徘徊 在 1.3650 附近 。         本次 公 佈 的 四月份 通脹 數據 ， 是 加 央行 在 六月 宣 佈 下 一次 利率 水準 前 的 最 後 一份 重要 數據 。 通脹 回落 ， 為 市場 注入 一劑 強心針 ， 交易 員 押注 加 央行 將在 六月 迎來 第一次 減息 ， 或致 加元 走勢 進 一步 疲軟 。         加拿大 央行 旨在 把 通脹 率維持 在 2% 左右 ， 當局 曾 預測 ， 今年 上半年 通脹 率將 保持 在 3% 左右 ， 並預計 明年 降至 目標 水準 。 但 根據 目前 公 佈 的 通脹 數據 顯示 ， 當地 通脹 率 的 下降 速度 可能 超出 當局 預期 。         加上 加拿大 上半年 經濟 水準 似有 放 緩跡 象 ， 先前 公 佈 的 二月份 GDP 環 比增 0.2% ， 較 一月份 的 0.3% 回落 ； 統計局 預計 三月份 經濟 增長將 保持 不變 。 市場 相信 在 通脹 持續 放緩 及 經濟 增長 走弱 的 壓力 下 ， 加 央行 在 六月 的 議息會議 上 決定 減息 的 可能性 不斷 上升 。         美元 方面 ， 上周 公 佈 的 四月 核心 消費者 價格 指數 ( CPI ) 同比 漲 3.6% ， 低 於 前值 的 3.8% ， 符合 市場 預期 ， 暗示 美國 通脹 水準 可能 有 回落 跡象 。 但 數據公 佈 後 多位 美聯 儲局 官員 相繼 發聲 ， 整體 論調 偏向 “ 鷹派 ” ， 認為 目前 數據 顯示 通脹 降溫 的 趨勢 不 顯著 ， 需要 更多 數據 支持 以確 認通脹 水準 持續 降溫 ， 直到 目標 水準 2% 的 路徑 上 ， 才 會 調整 目前 的 利率 水準 。         市場 預料 美聯儲 局將 在 九月 實現 第一次 減息 。 有 關論 調為 美元 指數 的 回穩 提供 支撐 ， 目前 在 104.6 上方 波動 ， 令非 美貨幣 承壓 。 伴 隨着 加拿大 減息 預期 升溫 ， 投資者 需 留意 美加 減息 預期 步伐 的 錯落 ， 或 迫使 加元 在 減息 決議 公 佈 前持續 偏弱 。         中國 銀行 澳門 分行 金融 市場部,2024-05-23
FED官員密集發聲 引導市場預期   工銀澳門金融市場部,FED官員密集發聲   引導市場預期    美國此前公佈的數據反映通脹降溫和零售銷售疲軟，提振市場對美聯儲局(FED)即將轉向寬鬆政策的樂觀情緒，股票、債券及大宗商品等主要資產表現亮眼，迎來新一輪反彈。然而，本周FED多位官員再度放鷹，市場重新修正FED減息路徑預期，聯邦基金利率期貨顯示市場對九月啟動減息的預期，由上周通脹數據公佈後的61%降至目前51%。    近日FED多位官員密集發聲，整體立場偏向鷹派，對首次減息持謹慎態度。理事沃勒認為，如果未來三至五個月數據持續疲軟，FED將考慮於年底減息。FED副主席傑斐遜、巴爾以及亞特蘭大聯儲主席博斯蒂克均認為現時不急於減息，限制性利率需維持更長時間，以確保通脹水準朝2%的目標區間邁進。理事鮑曼更重申若通脹持續高位運行，將不排除加息的可能性。    FED官員對首次減息時點看法不一，但普遍認為美國經濟基本面尚未具備充分的減息基礎。鑑於FED官員近日多番言論的總體基調一致認為現時不急於減息，各期限美國國債收益率再度上揚，抵銷部分因通脹壓力出現緩和跡象而錄得的跌幅，兩年期和十年期美國國債收益率分別由五月十五日通脹數據公佈日的低位4.72%和4.34%，回升至4.85%和4.4%的水準。    總括而言，通脹數據單月回落，並不會加快FED貨幣政策轉向，美國通脹趨勢有着高度不確定性，通脹上行風險仍存，疊加通脹黏性，令FED難提早啟動減息。首次減息時點將取決於接下來幾個月的經濟數據，並綜合考量經濟前景及風險平衡。    工銀澳門金融市場部,http://www.macaodaily.com/html/2024-05/23/content_1757138.htm,鑑於FED官員近日多番言論的總體基調一致認為現時不急於減息，各期限美國國債收益率再度上揚，抵銷部分因通脹壓力出現緩和跡象而錄得的跌幅，兩年期和十年期美國國債收益率分別由五月十五日通脹數據公佈日的低位4.72%和4.34%，回升至4.85%和4.4%的水準,FED 官員 密集 發聲       引導 市場 預期         美國 此前 公 佈 的 數據 反映 通脹 降溫 和 零售 銷售 疲軟 ， 提振市場 對 美聯 儲局 ( FED ) 即將 轉向 寬 鬆 政策 的 樂觀 情緒 ， 股票 、 債券及 大宗 商品 等 主要 資產表現 亮眼 ， 迎來 新 一輪 反彈 。 然而 ， 本周 FED 多位 官員 再度 放鷹 ， 市場 重新 修正 FED 減息 路徑 預期 ， 聯邦 基金 利率 期貨 顯示 市場 對 九月 啟動 減息 的 預期 ， 由 上周 通脹 數據公 佈 後 的 61% 降至 目前 51% 。         近日 FED 多位 官員 密集 發聲 ， 整體 立場 偏向 鷹派 ， 對 首次 減息持 謹慎 態度 。 理事 沃勒 認為 ， 如果 未來 三至 五個 月 數據 持續 疲軟 ， FED 將考慮 於 年底 減息 。 FED 副 主席 傑斐遜 、 巴爾 以及 亞特蘭 大聯儲 主席 博斯蒂克均 認為 現時 不 急 於 減息 ， 限制性 利率 需維持 更長 時間 ， 以確 保通脹 水準 朝 2% 的 目標 區間 邁進 。 理事 鮑曼 更 重申 若 通脹 持續 高位 運行 ， 將不 排除 加息 的 可能性 。         FED 官員 對 首次 減息 時點 看法 不 一 ， 但 普遍 認為 美國 經濟 基本面 尚未 具備 充分 的 減息 基礎 。 鑑 於 FED 官員 近日 多番 言論 的 總體 基調 一致 認為 現時 不 急 於 減息 ， 各 期限 美國國債 收益率 再度 上揚 ， 抵銷 部分 因通脹 壓力 出現 緩和跡 象 而 錄得 的 跌幅 ， 兩 年期 和 十年 期美國 國債 收益率 分別 由 五月 十五日 通脹 數據公 佈 日 的 低位 4.72% 和 4.34% ， 回升 至 4.85% 和 4.4% 的 水準 。         總括 而言 ， 通脹 數據 單月 回落 ， 並不會 加快 FED 貨幣 政策 轉向 ， 美國 通脹 趨勢 有着 高度 不確 定性 ， 通脹 上行 風險 仍存 ， 疊加 通脹 黏性 ， 令 FED 難 提早 啟動 減息 。 首次 減息 時點將 取決 於 接下 來 幾個 月 的 經濟 數據 ， 並綜合 考量 經濟 前景 及風險 平衡 。         工銀 澳門 金融 市場部,2024-05-23
D'Agostino Momentum MxV合併式放大器   清  泉,"D'Agostino Momentum MxV合併式放大器    Dan D'Agostino是前Krell Industries  Inc.創始人，其於1980年創立Krell音響品牌，以生產低失真大功率放大器馳名。    Dan D'Agostino是Krell首席工程師，也是音響界傳奇人物，其設計及製造高端放大器，2009年引入新投資者，卻被投資者趕出自己創立的公司，自始Krell易手他人。Dan另起爐灶，創辦Dan D'Agostino Master Audio Systems，專注提供最高級別雙聲道音頻設備，其是意大利裔，姓氏Agostino，是意大利語“偉大、壯麗”的意思，作為Hi-End品牌，正好反映其設計。D'Agostino主打功率放大器，亦製作高端前置放大器，在Krell主理期間，包含唱放的KRC-HR前級與KSA250後級，開創了Krell里程碑，D'Agostino自立門戶亦有大發展。    D'Agostino產品外形具厚金屬感，機體堅固扎實，帶點華麗“霸氣”，重量一般約40至50KG，最大特色是面板設有獨特指針式功率錶，其與電平控制器(Volume)連成一體，機箱外兩側是散熱部分，機箱內側是厚銅板散熱器。    D'Agostino以A或AB類模擬放大器為主，對D類放大器無興趣，亦與Krell時代追求低失真及高技術規格不同概念，其認為堅持測量標準與聲音品質之間存在脫節，測量性能不佳當然不可能完整傳送音樂，但測量得好規格並不一定能保證有好聲音，放大器在測得好規格的同時，最重要還是聲音的情感體驗。    D'Agostino的產品包括Relentless、Momentum、Progression三大系列共12款型號，Relentless是旗艦系列，Momentum較Progression高級，兩系列中各有一款合併機，其中Momentum MxV是最高級合併放大器，採分離電源。MxV共設兩機箱，上方是主機箱、下方是電源裝置，經一個互鎖30針30A鍍金插連接主機，兩機箱疊在一起成為整體。MxV主機包含Relentless及Momentum系列型號中的新技術，使用左右聲道獨立功放模塊，輸出級採用新輸出晶體管，此是Relentless旗艦單聲放大器所用的28枚高速大功率輸出管，其使用厚銅板作散熱，再將熱量耦合至機外的鋁質散熱器，能提供每聲道250W/8歐姆的功率輸出。MxV採用分離式、直接耦合平衡電路，從前級開始，六個獨立左右電路板組成輸入、音控及輸出，其取自Momentum HD及前級的創新輸入電路。    Momentum MxV除基本設置外，還能增加模擬唱放模組、數位DAC模組。    唱放左右獨立，動圈唱頭支援超過60dB增益；數位模組提供USB-A、同軸、光纖，乙太網，WiFi、藍牙、串流等接收功能。MxV基本版參考價65,000美元，內置唱放版本70,000美元，全唱放 / 數位DAC版本89,000美元。    □清    泉",http://www.macaodaily.com/html/2024-05/23/content_1757139.htm,MxV主機包含Relentless及Momentum系列型號中的新技術，使用左右聲道獨立功放模塊，輸出級採用新輸出晶體管，此是Relentless旗艦單聲放大器所用的28枚高速大功率輸出管，其使用厚銅板作散熱，再將熱量耦合至機外的鋁質散熱器，能提供每聲道250W/8歐姆的功率輸出,"D ' Agostino   Momentum   MxV 合 併 式 放大器         Dan   D ' Agostino 是 前 Krell   Industries     Inc . 創始 人 ， 其 於 1980 年 創立 Krell 音響 品牌 ， 以生 產低 失真 大功率 放大器 馳名 。         Dan   D ' Agostino 是 Krell 首席 工程 師 ， 也 是 音響界 傳奇 人物 ， 其 設計 及 製 造 高端 放大器 ， 2009 年 引入 新 投資者 ， 卻 被 投資者 趕出 自己 創立 的 公司 ， 自始 Krell 易手 他人 。 Dan 另起 爐 灶 ， 創辦 Dan   D ' Agostino   Master   Audio   Systems ， 專注 提供 最高 級別 雙聲 道 音頻 設備 ， 其是 意大利 裔 ， 姓氏 Agostino ， 是 意大利 語 “ 偉大 、 壯麗 ” 的 意思 ， 作為 Hi - End 品牌 ， 正好 反映 其 設計 。 D ' Agostino 主打 功率 放大器 ， 亦 製 作 高端 前置 放大器 ， 在 Krell 主理 期間 ， 包含 唱放 的 KRC - HR 前級 與 KSA250 後 級 ， 開創 了 Krell 里程碑 ， D ' Agostino 自立 門戶 亦 有 大 發展 。         D ' Agostino 產品 外形 具厚 金屬 感 ， 機體 堅固 扎實 ， 帶點 華麗 “ 霸氣 ” ， 重量 一般 約 40 至 50KG ， 最大 特色 是 面板 設有 獨 特指 針式 功率 錶 ， 其 與 電平 控制器 ( Volume ) 連成 一體 ， 機箱 外 兩側 是 散熱 部分 ， 機箱 內側 是 厚 銅板 散 熱器 。         D ' Agostino 以 A 或 AB 類模擬 放大器 為主 ， 對 D 類 放大器 無興趣 ， 亦 與 Krell 時代 追求 低 失真 及 高技 術 規格 不同 概念 ， 其 認為 堅持 測量 標準 與 聲 音品 質之間 存在 脫節 ， 測量 性能 不佳 當然 不 可能 完整 傳送 音樂 ， 但 測量 得 好 規格並 不 一定 能 保證 有 好 聲音 ， 放大器 在 測得 好 規格 的 同時 ， 最 重要 還是 聲音 的 情感 體驗 。         D ' Agostino 的 產品 包括 Relentless 、 Momentum 、 Progression 三大 系列 共 12 款型 號 ， Relentless 是 旗艦 系列 ， Momentum 較 Progression 高級 ， 兩 系列 中 各有 一款 合 併 機 ， 其中 Momentum   MxV 是 最高 級合 併 放大器 ， 採分 離電源 。 MxV 共設 兩機箱 ， 上方 是 主機箱 、 下方 是 電源 裝置 ， 經一個 互鎖 30 針 30A 鍍金 插 連接 主機 ， 兩機箱 疊 在 一起 成為 整體 。 MxV 主機 包含 Relentless 及 Momentum 系列 型號 中 的 新 技術 ， 使用 左右 聲道 獨 立功 放模塊 ， 輸出級 採用 新輸 出晶體 管 ， 此 是 Relentless 旗艦 單聲 放大器 所用 的 28 枚 高速 大功率 輸出 管 ， 其 使用 厚銅板 作散熱 ， 再將 熱量 耦合 至 機外 的 鋁質 散 熱器 ， 能 提供 每聲 道 250W / 8 歐姆 的 功率 輸出 。 MxV 採用 分離式 、 直接 耦合 平衡 電路 ， 從 前級 開始 ， 六個 獨立 左右 電路板 組成 輸入 、 音控及 輸出 ， 其 取自 Momentum   HD 及 前級 的 創新輸入 電路 。         Momentum   MxV 除 基本 設置 外 ， 還能 增加 模擬 唱放 模組 、 數位 DAC 模組 。         唱放 左右 獨立 ， 動圈 唱頭 支援 超過 60dB 增益 ； 數位 模組 提供 USB - A 、 同軸 、 光纖 ， 乙太網 ， WiFi 、 藍牙 、 串流 等 接收 功能 。 MxV 基本 版參 考價 65 , 000 美元 ， 內置 唱 放 版本 70 , 000 美元 ， 全唱放   /   數位 DAC 版本 89 , 000 美元 。         □ 清         泉",2024-05-23
走進地道探索黑暗深淵   域  高,走進地道探索黑暗深淵    獨自駕車前往底特律參加工作面試的泰絲，在深夜時份到達當地舊區預先訂好的出租屋，但她發現房屋已被男子基斯重複預訂，無奈下泰絲只好接受基斯提議入屋暫住一晚。對於與陌生男子同住一屋，泰絲整夜也提高警惕，幸未發生意外。第二天早上，基斯一早已出門，泰絲隨後也到了市區出席面試。回到屋子後，基斯仍未回來，獨自一人的泰絲發現屋內地牢存在一間秘密房間，房內放着一部陳舊的攝錄機和一張懷疑滲有血漬的床褥，不安的泰絲打算立即離開出租屋，剛好遇上回來的基斯，基斯懇求泰絲留下，待他前往地牢一探究竟。然而基斯一去不返，泰絲唯有前往地牢尋找基斯，原來在秘密房間旁還有一條通往更深處的漆黑通道，為了找回基斯，極度恐懼的泰絲只好硬着頭皮探索黑暗深淵。    《宿劫》是2022年上映的驚慄電影，故事講述女主角泰絲探索出租屋內恐怖地道的經歷，電影成功利用光影與音樂營造出懸疑緊張氣氛，獲得觀眾一致好評，喜歡恐怖題材的影迷不容錯過。    □域    高,http://www.macaodaily.com/html/2024-05/23/content_1757140.htm,走進地道探索黑暗深淵    獨自駕車前往底特律參加工作面試的泰絲，在深夜時份到達當地舊區預先訂好的出租屋，但她發現房屋已被男子基斯重複預訂，無奈下泰絲只好接受基斯提議入屋暫住一晚,走進 地道 探索 黑暗 深淵         獨自 駕車 前往 底特律 參加 工作面 試 的 泰絲 ， 在 深夜 時份 到 達 當地 舊區 預先訂 好 的 出租屋 ， 但 她 發現 房屋 已 被 男子 基斯 重 複 預訂 ， 無奈下 泰絲 只好 接受 基斯 提議 入屋 暫住 一晚 。 對 於 與 陌生 男子 同住 一屋 ， 泰絲 整夜 也 提高警惕 ， 幸未 發 生意 外 。 第二天 早上 ， 基斯 一 早已 出門 ， 泰絲 隨後也 到 了 市區 出席 面試 。 回到 屋子 後 ， 基斯 仍 未 回來 ， 獨自 一人 的 泰絲 發現 屋內 地牢 存在 一間 秘密 房間 ， 房內放 着 一部 陳 舊 的 攝錄機 和 一張 懷疑 滲有 血漬 的 床褥 ， 不安 的 泰絲 打算 立即 離開 出租屋 ， 剛好 遇上 回來 的 基斯 ， 基斯 懇求 泰絲 留下 ， 待 他 前往 地牢 一探 究竟 。 然而 基斯 一去不返 ， 泰絲 唯有 前往 地牢 尋找 基斯 ， 原來 在 秘密 房間 旁 還有 一條 通往 更深 處 的 漆黑 通道 ， 為 了 找回 基斯 ， 極度 恐懼 的 泰絲 只好 硬 着 頭皮 探索 黑暗 深淵 。         《 宿劫 》 是 2022 年 上映 的 驚 慄 電影 ， 故事 講述 女主角 泰絲 探索 出租屋 內 恐怖 地道 的 經歷 ， 電影 成功 利用 光影 與 音樂營 造出 懸疑 緊張 氣氛 ， 獲得 觀眾 一致 好評 ， 喜歡 恐怖 題材 的 影迷 不容 錯過 。         □ 域         高,2024-05-23
《芙莉歐莎》口碑載道熱爆上映   穆  梓,《芙莉歐莎》口碑載道熱爆上映    踏入暑假檔期，全球票房未見熾熱，港澳這邊仍以《九龍城寨之圍城》遙遙領先，幾齣荷里活猛片未見勁爆。    暑假檔期以今天開畫的《芙莉歐莎：末日先鋒傳說》最讓人期待，上周康城影展首映，掌聲雷動，口碑狂爆，成為今年最好評的荷里活娛樂片之一。這是九年前《末日先鋒：戰甲飛車》的前傳，此片當年票房未算超勁，但構思獨特、動作超猛、飛車場面多變，還有濃烈戲劇性，形成只此一家的飛車動作片，在影迷心中有着神聖地位。    七十年代末，澳洲導演佐治米勒炮製的低成本飛車片《霹靂神探怒掃飛車黨》平地一聲雷，後來續集《開路先鋒》〈又名《末日戰士》〉及《末日戰士勇破雷電堡》續受歡迎，三集全由米路吉遜主演，他亦因而大紅轉戰荷里活。《戰甲飛車》是米勒根據此概念重新創作的飛車戲，讓人看得目瞪口呆。    《芙莉歐莎》由《后翼棄兵》的安雅泰萊采兒、“雷神”基斯咸士禾夫合演，是一則反強權、抗壓逼的女性電影，西方影評大讚特讚，今次在本澳上映更有巨幕版，感染力肯定更強。    □穆    梓,http://www.macaodaily.com/html/2024-05/23/content_1757141.htm,七十年代末，澳洲導演佐治米勒炮製的低成本飛車片《霹靂神探怒掃飛車黨》平地一聲雷，後來續集《開路先鋒》〈又名《末日戰士》〉及《末日戰士勇破雷電堡》續受歡迎，三集全由米路吉遜主演，他亦因而大紅轉戰荷里活,《 芙莉 歐莎 》 口碑 載道 熱爆 上映         踏入 暑假 檔期 ， 全球 票房 未見 熾熱 ， 港澳 這邊 仍 以 《 九龍 城寨 之圍 城 》 遙遙 領先 ， 幾 齣 荷里活 猛片 未見 勁 爆 。         暑假 檔期 以 今天 開畫 的 《 芙莉 歐莎 ： 末日 先鋒 傳說 》 最 讓 人 期待 ， 上周 康城 影展 首映 ， 掌聲 雷動 ， 口碑 狂爆 ， 成為 今年 最好 評 的 荷里活 娛樂片 之一 。 這是 九年 前 《 末日 先鋒 ： 戰甲 飛車 》 的 前 傳 ， 此片 當年 票房 未算 超勁 ， 但構 思獨特 、 動作 超猛 、 飛車場 面多變 ， 還有 濃烈 戲劇性 ， 形成 只此一家 的 飛車動 作片 ， 在 影迷 心中 有着 神聖 地位 。         七十年代 末 ， 澳洲 導演 佐治 米勒 炮 製 的 低成本 飛車片 《 霹靂 神探 怒掃 飛車 黨 》 平地 一聲雷 ， 後 來續 集 《 開路 先鋒 》 〈 又名 《 末日 戰士 》 〉 及 《 末日 戰士勇 破雷 電堡 》 續受 歡迎 ， 三集 全由米 路吉遜 主演 ， 他 亦 因而 大紅 轉戰 荷里活 。 《 戰甲 飛車 》 是 米勒 根據 此 概念 重新 創作 的 飛車戲 ， 讓 人 看 得 目瞪口呆 。         《 芙莉 歐莎 》 由 《 后翼 棄兵 》 的 安雅泰萊 采兒 、 “ 雷神 ” 基斯 咸士 禾夫 合演 ， 是 一則 反強權 、 抗壓 逼 的 女性 電影 ， 西方 影評 大 讚 特 讚 ， 今次 在 本澳 上映 更 有 巨幕版 ， 感染力 肯定 更強 。         □ 穆         梓,2024-05-23
郎朗開懷之作   曲  揚,郎朗開懷之作    聖桑的《動物狂歡節》是充滿童趣而熱鬧歡欣的作品，在郎朗伉儷雙鋼琴主導下，長笛、單簧管、木琴、大提琴都奏得特別投入，加上此專輯逼真地重現各樂器音色，幾乎把以往的版本都比下去。對郎朗來說，動物狂歡節只是小菜一碟，《第二鋼琴協奏曲》才是大顯身手之作，他的發揮可謂駕輕就熟，鋼琴澎湃處鏗鏘璀璨，抒情處柔情似水，結合光輝華麗的管弦樂音響，充份表現出作品玲瓏剔透的美感。    另一CD結集一系列鋼琴曲，除了聖桑，還有其他法國作品，更包括五位女性作曲家的樂曲。郎朗夫人亦再度登場，在德布西《小組曲》及聖桑《天鵝》中與夫婿四手聯彈。    聖桑作品很適合郎朗發揮（他應快點奏足五部鋼協），相信他亦玩得開懷，得力於Andris Nelsons指揮德國萊比錫布商大廈管弦樂團的支援，令他如虎添翼。本片錄音傑出，包裝亮麗，瀰漫濃厚嘉年華氣氛，郎朗迷定忍不住再掏腰包。    □曲    揚,http://www.macaodaily.com/html/2024-05/23/content_1757142.htm,郎朗開懷之作    聖桑的《動物狂歡節》是充滿童趣而熱鬧歡欣的作品，在郎朗伉儷雙鋼琴主導下，長笛、單簧管、木琴、大提琴都奏得特別投入，加上此專輯逼真地重現各樂器音色，幾乎把以往的版本都比下去,郎朗 開懷 之作         聖桑 的 《 動物狂 歡節 》 是 充滿 童趣 而 熱鬧 歡欣 的 作品 ， 在 郎朗 伉儷 雙鋼琴 主導下 ， 長 笛 、 單 簧管 、 木琴 、 大提琴 都 奏 得 特別 投入 ， 加上 此 專輯 逼真 地 重現 各樂器 音色 ， 幾乎 把 以往 的 版本 都 比 下去 。 對 郎朗 來 說 ， 動物狂 歡節 只是 小菜一碟 ， 《 第二 鋼琴協 奏曲 》 才 是 大顯 身手 之作 ， 他 的 發揮 可謂 駕輕 就 熟 ， 鋼琴 澎湃 處鏗鏘 璀璨 ， 抒情 處 柔情似水 ， 結合光 輝華麗 的 管弦 樂音響 ， 充份 表現 出 作品 玲瓏 剔透 的 美感 。         另 一 CD 結集 一系列 鋼 琴曲 ， 除了 聖桑 ， 還有 其他 法國 作品 ， 更 包括 五位 女性 作曲家 的 樂曲 。 郎朗 夫人 亦 再度 登場 ， 在 德布 西 《 小組曲 》 及 聖桑 《 天鵝 》 中 與 夫婿 四手 聯彈 。         聖桑 作品 很 適合 郎朗 發揮 （ 他應 快點 奏足 五部 鋼協 ） ， 相信 他 亦 玩 得 開懷 ， 得力 於 Andris   Nelsons 指揮德 國萊比錫 布商 大廈 管弦 樂團 的 支援 ， 令 他 如虎添翼 。 本片 錄音 傑出 ， 包裝 亮麗 ， 瀰 漫 濃厚嘉年 華氣氛 ， 郎朗 迷定 忍不住 再 掏腰包 。         □ 曲         揚,2024-05-23
