Title,Content,Link,Summary,Preprocessed_Content,Date
大學生換錢呃同學11萬,賭波欠債    收錢拖數    八人報案    大學生換錢呃同學11萬    【本報消息】本地十九歲“爛賭”大學生因欠債做“換錢黨”，瘋狂搵同學換人民幣，收錢後以“賬戶凍結、額度已滿”藉口拖延，八名同學被騙逾十一萬澳門元。司警調查拘捕涉案男學生，供稱贓款已還債及日常花光。    被捕男大學生姓湯，十九歲，本地人。八名事主當中，一名本地人、六名內地人及一名南美人，與湯某就讀同一大學。    大學聊天群物色對象    今年二月至本月，八名事主陸續向司警報案稱被換錢詐騙，司警分析發現與湯某有關，本月二十二日在北區截獲湯某並帶返司警局調查。經查發現，湯某在今年一月至四月期間，在大學聊天群組物色需要換錢的同學，訛稱可兌換人民幣。    期間八名同學“落沓”，按要求將三千至五萬三千澳門元轉到指定的內地支付平台賬戶及本澳賬戶等，但事後一直未收到人民幣。湯某則以當日已夠額度無法轉賬、賬戶遭凍結等藉口拖延，並偽造三張轉賬截圖以博取事主信任。當事主揚言報警追究，湯某則將部分騙款退回對方，但終究紙包不住火，各事主陸續報警，合共損失逾十一萬澳門元。    偽造轉賬截圖博信任    司警調查發現，有人開立多個內地支付平台及本地銀行賬戶作案，並從涉案手機內發現偽造的轉賬截圖。湯某承認從去年中開始賭波，至今欠下友人九萬元賭債，因而做“換錢黨”，但並無能力協助兌換現金，贓款用於還債及日常開銷。案件涉巨額詐騙、電腦偽造移送檢察院處理。,http://www.macaodaily.com/html/2024-04/24/content_1750406.htm,賭波欠債    收錢拖數    八人報案    大學生換錢呃同學11萬    【本報消息】本地十九歲“爛賭”大學生因欠債做“換錢黨”，瘋狂搵同學換人民幣，收錢後以“賬戶凍結、額度已滿”藉口拖延，八名同學被騙逾十一萬澳門元,賭波 欠債         收錢 拖數         八人 報案         大學 生換 錢 呃 同學 11 萬         【 本報 消息 】 本地 十九 歲 “ 爛賭 ” 大學生 因 欠債 做 “ 換錢 黨 ” ， 瘋狂 搵 同學換 人民 幣 ， 收錢後以 “ 賬戶 凍結 、 額度 已滿 ” 藉口 拖延 ， 八名 同學 被 騙 逾 十一 萬澳門 元 。 司警 調查 拘捕 涉案 男學生 ， 供稱 贓款 已 還債 及 日常 花 光 。         被捕 男大學生 姓湯 ， 十九 歲 ， 本地人 。 八名 事主 當中 ， 一名 本地人 、 六名 內地 人及 一名 南美 人 ， 與 湯某 就 讀 同一 大學 。         大學 聊天 群 物色 對象         今年 二月 至 本月 ， 八名 事主 陸續 向 司警 報案 稱 被 換錢 詐騙 ， 司警 分析 發現 與 湯某 有關 ， 本月 二十二日 在 北區 截 獲湯 某 並帶 返司 警局 調查 。 經查 發現 ， 湯某 在 今年 一月 至 四月 期間 ， 在 大學 聊天 群組 物色 需要 換錢 的 同學 ， 訛稱 可 兌換 人民 幣 。         期間 八名 同學 “ 落沓 ” ， 按 要求 將 三千 至五萬 三千 澳門元 轉到 指定 的 內 地 支付 平台 賬戶 及 本澳 賬戶 等 ， 但事 後 一直 未 收到 人民 幣 。 湯某則 以 當日 已夠 額度 無法 轉賬 、 賬戶 遭凍結 等 藉口 拖延 ， 並偽造 三張 轉賬 截圖 以 博取 事主 信任 。 當 事主 揚言 報警 追究 ， 湯某則將 部分 騙款 退回 對方 ， 但 終究紙 包 不住 火 ， 各 事主 陸續 報警 ， 合共 損失 逾 十一 萬澳門 元 。         偽造 轉賬 截圖博 信任         司警 調查 發現 ， 有人 開立 多個 內 地 支付 平台 及 本地 銀行 賬戶 作案 ， 並從 涉案 手機 內 發現 偽造 的 轉賬 截圖 。 湯某 承認 從 去年 中開始 賭波 ， 至今 欠下 友人 九萬元 賭債 ， 因而 做 “ 換錢 黨 ” ， 但並 無 能力 協助 兌換 現金 ， 贓款 用 於 還債 及 日常 開銷 。 案件 涉巨額 詐騙 、 電腦 偽造 移送 檢 察院 處理 。,2024-04-24
團體籲潔身自愛勿沾賭騙,團體籲潔身自愛勿沾賭騙    【本報消息】就有大學生因嗜賭欠債而騙取八名同學共十一萬元被捕，聖公會樂天倫賭博輔導暨健康家庭服務中心主任胡慧嫻對事件表示關注，指該名大學生為還賭債，竟以兌換人民幣方式騙取同學金錢，最終東窗事發，前程盡毀。    胡慧嫻指出，中心過往曾收到不少類似個案，當中有年輕人利誘同齡者以“投資”賺錢為名，成功騙取金錢，被騙金額幾萬元至數十萬元不等，最終血本無歸。事實上，當下騙案手法可謂層出不窮，防不勝防。    該中心再次呼籲大眾尤其青年學生應潔身自愛，視博彩為娛樂，並非一種賺錢途徑，更不應該沉迷。另外，凡在金錢上與別人有往來者，務必提高警覺，切勿輕信別人的“賺錢攻略”，宜多留意不同騙案，提升認知。如有需要，可致電該中心輔導熱線二八二二·三三七二，與輔導員聯絡，尋求適切支援。,http://www.macaodaily.com/html/2024-04/24/content_1750407.htm,團體籲潔身自愛勿沾賭騙    【本報消息】就有大學生因嗜賭欠債而騙取八名同學共十一萬元被捕，聖公會樂天倫賭博輔導暨健康家庭服務中心主任胡慧嫻對事件表示關注，指該名大學生為還賭債，竟以兌換人民幣方式騙取同學金錢，最終東窗事發，前程盡毀,團體籲潔身 自愛勿 沾 賭騙         【 本報 消息 】 就 有 大學生 因 嗜 賭 欠債 而 騙取 八名 同學 共 十一 萬元 被捕 ， 聖公會樂 天倫 賭博輔導 暨 健康 家庭 服務 中心 主任 胡慧嫻 對 事件 表示 關注 ， 指該 名大學生 為還 賭債 ， 竟以 兌換 人民 幣 方式 騙取 同學金 錢 ， 最終 東窗 事發 ， 前程 盡毀 。         胡慧嫻 指出 ， 中心 過往 曾 收到 不少 類似 個案 ， 當中 有 年 輕人利 誘同齡者 以 “ 投資 ” 賺 錢 為 名 ， 成功 騙取 金錢 ， 被 騙 金額 幾萬元 至 數十萬元 不 等 ， 最終 血本 無歸 。 事實 上 ， 當下 騙案 手法 可謂 層出 不窮 ， 防不勝防 。         該 中心 再次 呼籲 大眾 尤其 青年 學生 應潔身 自愛 ， 視 博彩 為 娛樂 ， 並非 一種 賺 錢 途徑 ， 更不應 該 沉迷 。 另外 ， 凡 在 金錢 上 與 別人 有 往來者 ， 務必 提高 警覺 ， 切勿 輕信別 人 的 “ 賺 錢 攻略 ” ， 宜多 留意 不同 騙案 ， 提升 認知 。 如 有 需要 ， 可致 電該 中心 輔導 熱線 二八 二 二 · 三 三七 二 ， 與 輔導員 聯絡 ， 尋求 適切 支援 。,2024-04-24
沉迷賭博如無底洞 鋌而走險自毀前途   本報記者 白 丁,沉迷賭博如無底洞  鋌而走險自毀前途    賭海無涯，回頭是岸。一名男大學生疑賭波債台高築，化身換錢黨呃同學換錢，收錢後採拖字訣，若對方揚言報警，則以後續的騙款退回部分款項給對方，以為可以“數冚數”，終究紙包不住火，被司警拘捕移送法辦，自毀前途。    博彩業是本澳經濟的主要產業，對大多數人來說，博彩是一種消閒娛樂，不過，少數人卻過度沉迷。沉迷賭博不但造成經濟問題，甚至會影響家庭關係、工作表現、情緒及身體健康。當個人生活上任何一方面因賭博而造成負面影響，都可能是問題賭博的徵兆，應正視問題及對症下藥。    身在澳門這個賭城中，居民無可避免接觸到與博彩相關的人和事，甚至流行的夾公仔、抽盲盒，都有博弈成份。既然無法完全隔絕，倒不如從小教育正確的價值觀，了解賭博，學會理財觀念。父母應以身作則，自小教導正確的價值觀，認識賭博引起的社會問題；面對朋輩的慫恿參與賭博，青年人應堅決說不。    家長若發現子女經常有經濟問題、經常向朋友借錢、家中有財物損失等，又或者突然“富貴”經常購買名牌、賭不離口等，都應該留意其是否染上賭癮。    政府多年來推廣負責任博彩，最大限度地減少賭博活動對個人和社會造成的潛在危害。例如社工局轄下“防治問題賭博處——志毅軒”，為受賭博問題困擾的人士及其家人提供輔導服務，並透過社區預防工作，來減低賭博失調對個人及家庭的影響，若有需要應積極尋求協助。    本地休閒企業亦響應政府和社會訴求，推出一系列負責任博彩計劃和服務。最後，呼籲大眾應視博彩為娛樂，有所節制；長賭必輸，切勿沉迷。    本報記者  白 丁,http://www.macaodaily.com/html/2024-04/24/content_1750408.htm,例如社工局轄下“防治問題賭博處——志毅軒”，為受賭博問題困擾的人士及其家人提供輔導服務，並透過社區預防工作，來減低賭博失調對個人及家庭的影響，若有需要應積極尋求協助,沉迷 賭博如 無底 洞     鋌而 走險 自毀 前途         賭海無涯 ， 回頭 是 岸 。 一名 男大學 生疑 賭波 債台 高築 ， 化身 換錢 黨 呃 同學換 錢 ， 收錢後採 拖 字 訣 ， 若 對 方揚言 報警 ， 則以後續 的 騙款 退回 部分 款 項給 對方 ， 以為 可以 “ 數 冚 數 ” ， 終究紙 包 不住 火 ， 被 司警 拘捕 移送 法辦 ， 自毀 前途 。         博彩 業是 本 澳經濟 的 主要 產業 ， 對 大多 數人來 說 ， 博彩 是 一種 消閒 娛樂 ， 不過 ， 少數 人 卻 過度 沉迷 。 沉迷 賭博 不但 造成 經濟 問題 ， 甚至 會 影響 家庭 關 係 、 工作 表現 、 情緒 及 身體 健康 。 當個 人 生活 上 任何 一方面 因 賭博而 造成 負面 影響 ， 都 可能 是 問題 賭博 的 徵兆 ， 應正視 問題 及 對 症下藥 。         身在 澳門 這個 賭 城中 ， 居民 無可 避免 接觸 到 與 博彩 相關 的 人和事 ， 甚至 流行 的 夾 公仔 、 抽盲 盒 ， 都 有 博弈 成份 。 既然 無法 完全 隔絕 ， 倒不如 從 小 教育 正確 的 價值觀 ， 了解 賭博 ， 學會理 財觀念 。 父母 應以 身作則 ， 自小 教導 正確 的 價值觀 ， 認識 賭博 引起 的 社會 問題 ； 面對 朋輩 的 慫恿 參與 賭博 ， 青年人 應 堅決 說 不 。         家長 若 發現 子女 經 常有 經濟 問題 、 經常向 朋友 借錢 、 家中 有 財物 損失 等 ， 又 或者 突然 “ 富貴 ” 經常購 買 名牌 、 賭不離口 等 ， 都 應該 留意 其 是否 染上 賭癮 。         政府 多年 來 推廣 負責任 博彩 ， 最大 限度 地 減少 賭博 活動 對 個 人 和 社會 造成 的 潛 在 危害 。 例如 社工 局轄下 “ 防治 問題 賭博處 — — 志毅軒 ” ， 為 受 賭博 問題 困擾 的 人士 及其 家人 提供 輔導 服務 ， 並透過 社區 預防 工作 ， 來 減低 賭博失 調對個 人及 家庭 的 影響 ， 若有 需要 應積極 尋求 協助 。         本地 休閒 企業 亦 響應 政府 和 社會 訴求 ， 推出 一系列 負責任 博彩 計劃 和服 務 。 最 後 ， 呼籲 大眾 應視 博彩 為 娛樂 ， 有所 節制 ； 長 賭 必輸 ， 切勿 沉迷 。         本報 記者     白   丁,2024-04-24
內地生涉受僱換錢詐騙被捕,收千元報酬代交易   對款項來源不知情    內地生涉受僱換錢詐騙被捕    【本報消息】內地大學生為搵快錢，收取一千元人民幣報酬協助兌換黨與“客仔”交易，完成轉帳後事主銀行帳戶被凍結，懷疑被騙向司警報案，損失十萬港元。警方查後鎖定疑人身份，昨日於關閘口岸將其截獲。    涉案人姓金，男性，廿三歲，內地居民，報稱學生。司警本月十八日接獲案中內地男事主報案，聲稱與兌換黨交易後銀行帳戶被凍結，懷疑被人詐騙。據悉，事主本月十七日透過通訊軟件群組與金某聯絡，雙方協議以十萬港元兌換九萬二千元人民幣，並於路氹城某娛樂場會面。事主收到金某轉帳後，將十萬港元現金交對方。    直至本月十八日，事主收到銀行通知，稱該筆轉帳懷疑由詐騙獲得，故將其銀行帳戶凍結。事主懷疑被騙向司警報案，警方查後鎖定疑人身份，昨日金某經關閘入境時將其截獲。調查期間，疑人聲稱收取一千元人民幣報酬，受僱按指示到現場與事主交易，對款項來源並不知情。警方以巨額詐騙罪及清洗黑錢罪對其落案起訴，移交檢察院跟進。,http://www.macaodaily.com/html/2024-04/24/content_1750409.htm,收千元報酬代交易   對款項來源不知情    內地生涉受僱換錢詐騙被捕    【本報消息】內地大學生為搵快錢，收取一千元人民幣報酬協助兌換黨與“客仔”交易，完成轉帳後事主銀行帳戶被凍結，懷疑被騙向司警報案，損失十萬港元,收 千元 報酬 代 交易       對款 項來源 不知情         內地生 涉受 僱換 錢 詐 騙 被捕         【 本報 消息 】 內地 大學生 為 搵 快 錢 ， 收取 一千元 人民 幣報酬 協助 兌換 黨 與 “ 客仔 ” 交易 ， 完成 轉帳 後 事主 銀行 帳戶 被 凍結 ， 懷疑 被 騙 向 司警 報案 ， 損失 十萬 港元 。 警方 查後鎖定 疑人 身份 ， 昨日 於 關閘 口岸 將其 截獲 。         涉案人 姓金 ， 男性 ， 廿三 歲 ， 內地 居民 ， 報稱 學生 。 司警 本月 十八日 接獲案 中內 地 男 事主 報案 ， 聲稱 與 兌換 黨 交易 後 銀行 帳戶 被 凍結 ， 懷疑 被 人詐 騙 。 據悉 ， 事主 本月 十七日 透過 通訊 軟件 群組 與 金 某聯絡 ， 雙方 協議 以十萬 港元 兌換 九萬 二千元 人民 幣 ， 並於路 氹 城 某 娛樂場 會面 。 事主 收到 金某 轉帳 後 ， 將十萬 港元 現金交 對方 。         直至 本月 十八日 ， 事主 收到 銀行 通知 ， 稱該 筆轉 帳懷疑 由 詐騙 獲得 ， 故將 其銀行 帳戶 凍結 。 事主 懷疑 被 騙 向 司警 報案 ， 警方 查後鎖定 疑人 身份 ， 昨日 金 某經 關閘 入境 時將 其 截獲 。 調查 期間 ， 疑人聲 稱 收取 一千元 人民 幣報酬 ， 受僱 按 指示 到 現場 與 事主 交易 ， 對款 項來 源並 不知情 。 警方 以 巨額 詐騙 罪及 清洗 黑錢罪 對 其 落案 起訴 ， 移交 檢 察院 跟 進 。,2024-04-24
亞馬喇前地重鋪增綠化帶,更換殘舊圍欄    優化街道燈飾    亞馬喇前地重鋪增綠化帶    【本報消息】市政署計劃於亞馬喇前地區域開展一系列環境優化措施，包括重鋪亞馬喇前地行人路面、調整增加行人道綠化帶、優化燈飾和照明設施，處理地下行人通道漏水情況等。    市政署早前在大堂區社區座談會上介紹區內市政建設時提到，計劃重鋪亞馬喇前地行人路面，與周邊地磚圖案風格相匹配；更換殘舊圍欄及優化街道無障礙設施；調整及增加行人道的綠化帶，圍合小型休憩空間。當局會優化街道的燈飾設施，增添夜間步行氛圍感，為大眾創建更寛敞舒適的步行環境。    處理地下通道漏水    此外，市政署將優化亞馬喇前地連接葡京酒店至永利酒店公共地下行人通道，拆除現有殘舊的假天花及燈飾，重新設計假天花及佈置照明系統，並改善地下行人通道的標識系統，處理該通道部分位置的漏水問題。    會上並介紹了澳門半島南岸海濱綠廊第二期項目設計總面積約六萬平方米，東西長度約一千三百米，休憩區內設有包括親子遊樂區、親子車場、綜合滑板場、健身區、眺望台、釣魚區等，並有餐飲空間和小賣亭、公厠等多項基礎設施。    現時，嘉樂庇總督大橋以西至融和門相關範圍土地平整及堤堰整治工程正公開招標，設計連建造工期為二百四十個工作天，工程將為後續海濱綠廊建設提供場地。,http://www.macaodaily.com/html/2024-04/24/content_1750410.htm,更換殘舊圍欄    優化街道燈飾    亞馬喇前地重鋪增綠化帶    【本報消息】市政署計劃於亞馬喇前地區域開展一系列環境優化措施，包括重鋪亞馬喇前地行人路面、調整增加行人道綠化帶、優化燈飾和照明設施，處理地下行人通道漏水情況等,更換 殘舊 圍欄         優化 街道 燈飾         亞馬 喇前 地重 鋪 增綠化 帶         【 本報 消息 】 市政 署計劃 於 亞馬 喇前 地區域 開展 一系列 環境 優化 措施 ， 包括 重鋪 亞馬 喇前 地 行人 路面 、 調整 增加 行人 道 綠化 帶 、 優化 燈飾 和 照明 設施 ， 處理 地下 行人 通道 漏水 情況 等 。         市政 署 早前 在 大堂 區社區 座 談會 上 介紹區 內 市政 建設 時 提到 ， 計劃 重鋪 亞馬 喇前 地 行人 路面 ， 與 周邊 地磚 圖案 風格 相匹配 ； 更換 殘舊 圍欄 及 優化 街道 無障礙 設施 ； 調整 及 增加 行人 道 的 綠化 帶 ， 圍合 小型 休憩 空間 。 當局 會 優化 街道 的 燈飾 設施 ， 增添 夜間 步行 氛圍 感 ， 為大眾 創建 更寛敞 舒適 的 步行 環境 。         處理 地下通道 漏水         此外 ， 市政 署將 優化亞馬 喇前 地連接 葡京 酒店 至 永利 酒店 公共 地下 行人 通道 ， 拆除 現有 殘舊 的 假 天花 及 燈飾 ， 重新 設計假 天花 及 佈 置 照明 系統 ， 並 改善 地下 行人 通道 的 標識 系統 ， 處理 該 通道 部分 位置 的 漏水 問題 。         會上 並介紹 了 澳門 半島 南岸 海濱 綠廊 第二期 項目 設計 總面 積約 六萬 平方米 ， 東西長 度 約 一千三百 米 ， 休憩 區內 設有 包括 親子 遊樂區 、 親子 車場 、 綜合 滑板 場 、 健身 區 、 眺望台 、 釣魚區 等 ， 並有餐 飲空間 和 小賣 亭 、 公 厠 等 多項 基礎 設施 。         現時 ， 嘉樂 庇 總督大橋 以西 至 融和 門相關 範圍 土地平整 及 堤堰 整治 工程 正公開 招標 ， 設計連 建造 工期 為 二百四十 個 工作 天 ， 工程 將為後續 海濱 綠廊 建設 提供 場地 。,2024-04-24
