Title,Content,Link,Summary,Preprocessed_Content,Date
續推廣優化輔具服務,續推廣優化輔具服務    該會於二○一九年底開辦本澳首間澳門輔具資源中心，提供輔具宣傳及教育、輔具諮詢及評估、輔具展示與體驗、輔具租借及轉贈服務。為進一步推廣輔具資訊，中心去年開展“探索輔具新領域”校園推廣活動，通過入校開展講座和推廣攤位，增加學生認識輔具，推動本澳學生關注長者和特殊人士的需要，輔具對提升長者和特殊人士生活質素的重要性。針對有輔具需要人士的個別化需求，健樂生活站引進國內外不同的輔具供應商和品牌，為居民提供更多優質的輔具選擇。    營造長幼共融平台    頤康中心多年來持續舉辦“全澳耆英才藝大匯演”、“盡顯耆能話劇比賽”，為全澳長者營造展現才藝的平台。長者通過訓練和創意發揮，增強自我效能感、發揮所長和提升社交技巧，積極參與社會，提升退休後的生活品質。氹仔日昇長者中心，持續推動長幼共融，致力為長者和年輕一代營造交流互動平台，如去年度舉辦“日昇希奇古怪裝扮日”，組織長者及年輕人裝扮和體驗萬聖節節慶，以及舉辦“耆樂科技互動日”，由青年義工設計課堂內容，義務教授長者使用一戶通、巴士報站、手機支付等功能。中心的四隊長者義工表演隊，包括手布偶隊、歌唱隊、合唱團和舞蹈隊，定期走訪各服務單位表演及交流探訪。    由頤駿中心主辦《無限耆系列活動之“情繫家國”長青共融短劇匯演》，以長者在澳門親身經歷的生活故事作為短劇藍本，透過長者與年輕人合作演出話劇說好澳門故事，並向本澳居民特別是年輕一代傳遞愛國愛澳精神，以及分享澳門回歸前後的生活點滴。    街總社會服務團隊持續關注長者精神健康，推動長者終身學習，鼓勵長者及特殊人士參與社會，並結合科技與應用輔具，提升長者及特殊人士的生活質素，關注社區上潛在服務需要的人士，將持續連結社區網絡，推動睦鄰互助，呼籲社會大眾勿忘關懷身邊的長者及特殊人士，主動踏出關愛社區的第一步，一同構建社區支持網絡。,http://www.macaodaily.com/html/2024-03/14/content_1741519.htm,為進一步推廣輔具資訊，中心去年開展“探索輔具新領域”校園推廣活動，通過入校開展講座和推廣攤位，增加學生認識輔具，推動本澳學生關注長者和特殊人士的需要，輔具對提升長者和特殊人士生活質素的重要性,續 推廣 優化 輔具 服務         該會 於 二 ○ 一 九 年底 開辦 本 澳首間 澳門輔 具資源 中心 ， 提供 輔具 宣傳及 教育 、 輔具 諮 詢及 評估 、 輔具 展示 與 體驗 、 輔具 租借 及 轉贈 服務 。 為進 一步 推廣輔 具資訊 ， 中心 去年 開展 “ 探索 輔具 新 領域 ” 校園 推廣 活動 ， 通過 入校 開展 講座 和 推廣攤位 ， 增加 學生 認識 輔具 ， 推動本 澳學 生關 注長 者 和 特殊 人士 的 需要 ， 輔具 對 提升 長 者 和 特殊 人士 生活 質素 的 重要性 。 針對 有 輔具 需要 人士 的 個 別化 需求 ， 健樂 生活 站 引 進國 內外 不同 的 輔 具供 應商 和 品牌 ， 為 居民 提供 更多 優質 的 輔具 選擇 。         營造長 幼共融 平台         頤康 中心 多年 來持續 舉辦 “ 全澳耆 英才 藝大 匯演 ” 、 “ 盡顯 耆能 話 劇比賽 ” ， 為 全澳長 者 營造展 現才藝 的 平台 。 長 者 通過 訓練 和 創意 發揮 ， 增強 自我 效能 感 、 發揮 所長 和 提升 社交 技巧 ， 積極 參與 社會 ， 提升 退休 後 的 生活 品質 。 氹 仔日 昇 長 者 中心 ， 持續 推動長 幼共融 ， 致力 為長 者 和 年 輕 一代 營造 交流 互動 平台 ， 如去 年度 舉辦 “ 日 昇 希奇古怪 裝扮 日 ” ， 組織長 者 及 年 輕人 裝扮 和 體驗 萬聖節 節慶 ， 以及 舉辦 “ 耆樂 科技 互動 日 ” ， 由 青年 義工 設計 課堂 內容 ， 義務 教授 長 者 使用 一戶通 、 巴士 報站 、 手機 支付 等 功能 。 中心 的 四隊 長 者 義工 表演 隊 ， 包括 手 布偶 隊 、 歌唱 隊 、 合唱 團和 舞蹈 隊 ， 定期 走訪 各服 務 單位 表演 及 交流 探訪 。         由 頤駿 中心 主辦 《 無限耆 系列 活動 之 “ 情 繫 家 國 ” 長 青共融 短劇 匯演 》 ， 以長 者 在 澳門 親身 經歷 的 生活 故事 作為 短劇 藍本 ， 透過 長 者 與 年 輕人 合作 演出 話劇 說 好 澳門 故事 ， 並向 本澳 居民 特別 是 年 輕 一代 傳遞 愛國 愛澳 精神 ， 以及 分享 澳門 回歸前 後 的 生活 點滴 。         街 總 社會 服務團隊 持續 關注長 者 精神 健康 ， 推動長 者 終身 學習 ， 鼓勵 長 者 及 特殊 人士 參與 社會 ， 並結合 科技 與 應用 輔具 ， 提升 長 者 及 特殊 人士 的 生活 質素 ， 關注 社區 上 潛 在 服務 需要 的 人士 ， 將持續 連結 社區 網絡 ， 推動 睦 鄰 互助 ， 呼籲 社會 大眾 勿忘 關懷 身邊 的 長 者 及 特殊 人士 ， 主動 踏出 關愛社區 的 第一步 ， 一同 構建 社區 支持 網絡 。,2024-03-14
藝術節五月開展夢幻“奇遇”,近八十場節目涵蓋不同種類    藝術節五月開展夢幻“奇遇”    【本報消息】文化局主辦的第三十四屆澳門藝術節將於五月三日至六月七日舉行，以“奇 · 遇”為題，呈獻十九套精選演出，以及廿三項延伸活動，近八十場節目，涵蓋戲劇、戲曲、舞蹈、音樂及視覺藝術等，總預算約二千四百九十萬澳門元，本地參與人員約佔半，當局廣邀觀眾結伴同行，一起踏上這趟奇幻繽紛的藝術之旅。    本屆藝術節獲旅遊局、澳門廣播電視股份有限公司、澳門航空及美高梅支持。節目巡禮昨日中午十二時在美獅美高梅維天閣舉行，文化局長梁惠敏，旅遊局副局長程衛東，澳廣視節目及製作部總監陸鋼，美高梅文化藝術高級副總裁郭蕙心，文化局副局長張麗珊及鄭繼明，以及眾參演藝團代表等出席。    欣賞不同地域創作    梁惠敏表示，澳門藝術節致力搭建國際藝術交流及展示本地藝術力量的平台，今年引進不同國度的藝術佳作，觀眾可以了解和認識不同地域、民族的藝術創造，增進對多元文化的認識和理解。此外，觀眾可檢閱和欣賞本澳藝團專業創作的最新成果，不論是舞蹈、戲劇、非遺土生土語的新作，還是新場地、新技術、新觀念的融合運用，都會有接踵而來的驚喜。此外，立足澳門中西文化薈萃之地，重磅展覽“焦點：十八至十九世紀中西方視覺藝術的調適”，遴選三百多件／套展品，開啟歷史上中外藝術家的創作交流和思維碰撞。    深入社區與民互動    藝術深入社區、深入生活，就能更好發揮文化傳播的參與性與互動性，提高審美意識，造福民眾日常生活。今屆藝術節同樣在社區設置藝文薈萃的“百藝看館”，也精心策劃了藝人談、後台探索、演前導賞、講座、工作坊等豐富延伸活動，同時用心安排了適合兒童與闔家欣賞的節目。    今屆澳門藝術節門票於本月廿三日上午十時在澳門售票網公開發售，門市、電話及網上訂票服務同步開通。活動詳情可瀏覽官網www.icm.gov.mo/fam。,http://www.macaodaily.com/html/2024-03/14/content_1741517.htm,近八十場節目涵蓋不同種類    藝術節五月開展夢幻“奇遇”    【本報消息】文化局主辦的第三十四屆澳門藝術節將於五月三日至六月七日舉行，以“奇 · 遇”為題，呈獻十九套精選演出，以及廿三項延伸活動，近八十場節目，涵蓋戲劇、戲曲、舞蹈、音樂及視覺藝術等，總預算約二千四百九十萬澳門元，本地參與人員約佔半，當局廣邀觀眾結伴同行，一起踏上這趟奇幻繽紛的藝術之旅,近 八十 場節 目涵 蓋 不同 種類         藝術節 五月 開展 夢幻 “ 奇遇 ”         【 本報 消息 】 文化局 主辦 的 第三十四 屆 澳門 藝術 節將 於 五月 三日 至 六月 七日 舉行 ， 以 “ 奇   ·   遇 ” 為題 ， 呈獻 十九 套 精選 演出 ， 以及 廿三 項 延伸 活動 ， 近 八十 場節目 ， 涵蓋 戲劇 、 戲曲 、 舞蹈 、 音樂及 視覺 藝術 等 ， 總 預算約 二千 四百 九十 萬澳門 元 ， 本地 參與 人員約 佔 半 ， 當局 廣邀 觀眾 結伴 同行 ， 一起 踏上 這趟 奇幻 繽紛 的 藝術 之 旅 。         本屆 藝術節 獲 旅遊局 、 澳門 廣播 電視 股份 有限公司 、 澳門 航空 及 美高梅 支持 。 節目 巡禮 昨日 中午 十二 時 在 美獅 美高梅 維天閣 舉行 ， 文化局 長 梁惠敏 ， 旅遊局 副 局長 程衛東 ， 澳廣視 節目 及 製 作 部 總 監 陸 鋼 ， 美高梅 文化 藝術 高級 副 總裁 郭 蕙心 ， 文化局 副 局長 張麗珊及 鄭繼明 ， 以及 眾參演 藝團 代表 等 出席 。         欣賞 不同 地域 創作         梁惠敏 表示 ， 澳門 藝術節 致力 搭建 國際 藝術 交流 及 展示 本地 藝術 力量 的 平台 ， 今年 引進 不同 國度 的 藝術 佳作 ， 觀眾 可以 了解 和 認識 不同 地域 、 民族 的 藝術 創造 ， 增進 對 多元 文化 的 認識 和 理解 。 此外 ， 觀眾 可檢閱 和 欣賞 本 澳藝團 專業 創作 的 最新 成果 ， 不論 是 舞蹈 、 戲劇 、 非遺 土生 土語 的 新作 ， 還是 新場 地 、 新技術 、 新觀念 的 融合 運用 ， 都 會 有 接踵 而來 的 驚喜 。 此外 ， 立足 澳門 中西文化 薈萃 之 地 ， 重磅 展覽 “ 焦點 ： 十八 至 十九 世紀 中 西方 視覺 藝術 的 調適 ” ， 遴選 三百多 件 ／ 套 展品 ， 開啟 歷史 上 中外 藝術家 的 創作 交流 和 思維 碰撞 。         深入 社區 與 民互動         藝術 深入 社區 、 深入生活 ， 就 能 更好 發揮 文化 傳播 的 參與性 與 互動性 ， 提高 審 美意 識 ， 造福 民眾 日常生活 。 今屆 藝術節 同樣 在 社區 設置 藝文薈萃 的 “ 百藝 看館 ” ， 也 精心 策劃 了 藝人談 、 後 台 探索 、 演前 導賞 、 講座 、 工作坊 等 豐富 延伸 活動 ， 同時 用心 安排 了 適合 兒童 與 闔 家 欣賞 的 節目 。         今屆 澳門 藝術 節門票 於 本月 廿三日 上午 十時 在 澳門 售票 網公開 發售 ， 門市 、 電話 及 網上 訂票 服務 同步 開通 。 活動 詳情 可 瀏覽 官網 www . icm . gov . mo / fam 。,2024-03-14
延伸活動開拓觀眾想像空間,延伸活動開拓觀眾想像空間    【本報消息】今屆澳門藝術節除系列表演節目及展覽外，亦將舉行廿三項延伸活動，涵蓋藝人談、後台探索、演前導賞、講座、工作坊及國際舞台映像放映等，與觀眾暢賞藝術，拓展藝術想像空間。    分享藝術轉型歷程    藝術節重視搭建藝術家與觀眾交流平台，今年將由本名藝術團藝術總監維克多 · 胡戈 · 龐特斯主講“藝人談：《血親》製作紀錄短片放映及創作分享”，分享其從視覺藝術家轉型為編舞家的心路歷程，講述編舞家及舞者如何克服困難，把創作搬上舞台。“國際舞台映像精選”將國際大型製作呈現澳門銀幕，四部作品包括英國國家劇院現場《少年Pi的奇幻漂流》、龐德斯 · 里德堡《舞影如水》、馬德里皇家劇院《斷背山》及《火熱Hip Hop》，以預錄放映形式讓觀眾欣賞國際頂尖製作。    指導親子製立體書    多項延伸活動將發掘多元的藝術嘗試，探索身體與藝術的對話。其中“雜技體驗工作坊”分別有“天鵝班”及“小鴨親子班”，前者由無界限雜技團巡演總監介紹如何策劃一場精彩表演，以及成為馬戲演員需要具備的技能；後者將透過部分演出情節讓參加者學習酷炫的馬戲技巧，並跟隨傑斯羅 · 伍沃德和柴可夫斯基創作的美妙音樂舞動肢體。    “親子立體書工作坊”則由專業導師講解立體書的基本組件及製作技巧，並指導親子共同製作獨一無二立體書；“生命之聲——古謠傳唱體驗工作坊”讓參加者親身體驗古老口述傳承，感受排灣族的生命之聲；“里昂歌劇院芭蕾舞團舞蹈工作坊”透過編舞家馬可 · 莫勞創作的獨特舞蹈語言“Kova”，詮釋身體與空間、形狀和體量之間的密切聯繫。,http://www.macaodaily.com/html/2024-03/14/content_1741521.htm,延伸活動開拓觀眾想像空間    【本報消息】今屆澳門藝術節除系列表演節目及展覽外，亦將舉行廿三項延伸活動，涵蓋藝人談、後台探索、演前導賞、講座、工作坊及國際舞台映像放映等，與觀眾暢賞藝術，拓展藝術想像空間,延伸 活動 開拓 觀眾 想像 空間         【 本報 消息 】 今屆 澳門 藝術 節除 系列 表演 節目 及 展覽外 ， 亦 將舉行 廿三 項 延伸 活動 ， 涵蓋 藝人談 、 後 台 探索 、 演前 導賞 、 講座 、 工作坊 及國際 舞台 映像 放映 等 ， 與 觀眾 暢賞 藝術 ， 拓展 藝術 想像 空間 。         分享 藝術 轉型 歷程         藝術節 重視 搭建 藝術家 與 觀眾 交流平台 ， 今年 將由 本名 藝術團 藝術 總監 維克多   ·   胡戈   ·   龐 特斯 主講 “ 藝人談 ： 《 血親 》 製 作 紀 錄 短片 放映 及 創作 分享 ” ， 分享 其 從 視覺 藝術家 轉型 為 編舞家 的 心路 歷程 ， 講述 編舞家 及 舞者 如何 克服 困難 ， 把 創作 搬 上 舞台 。 “ 國際 舞台 映像 精選 ” 將國際 大型 製 作 呈 現 澳 門 銀 幕 ， 四部 作品 包括 英國國家 劇院 現場 《 少年 Pi 的 奇幻 漂流 》 、 龐 德斯   ·   里德 堡 《 舞影 如水 》 、 馬 德里 皇家 劇院 《 斷 背山 》 及 《 火熱 Hip   Hop 》 ， 以 預錄 放映 形式 讓 觀眾 欣賞 國際頂 尖 製 作 。         指導親 子 製 立 體 書         多項 延伸 活動將 發掘 多元 的 藝術 嘗試 ， 探索 身體 與 藝術 的 對 話 。 其中 “ 雜技 體驗 工作坊 ” 分別 有 “ 天鵝班 ” 及 “ 小鴨 親子 班 ” ， 前者 由 無 界限 雜技團 巡演 總監 介紹 如何 策劃 一場 精彩表演 ， 以及 成為馬戲 演員 需要 具備 的 技能 ； 後 者 將透過 部分 演出 情節 讓 參加者 學習酷 炫的馬戲 技巧 ， 並跟 隨傑斯羅   ·   伍沃德 和 柴可夫斯基 創作 的 美妙 音樂 舞動 肢體 。         “ 親子 立體 書 工作坊 ” 則由 專業導 師講 解立 體書 的 基本 組件 及 製 作 技巧 ， 並指導 親子 共同 製 作 獨 一 無 二 立 體 書 ； “ 生命 之聲 — — 古謠 傳唱 體驗 工作坊 ” 讓 參加者 親身 體驗 古老 口述 傳承 ， 感受 排灣族 的 生命 之聲 ； “ 里昂 歌劇院 芭蕾舞 團 舞蹈 工作坊 ” 透過 編舞家 馬 可   ·   莫勞 創作 的 獨特 舞蹈 語言 “ Kova ” ， 詮釋 身體 與 空間 、 形狀 和 體量 之間 的 密切 聯 繫 。,2024-03-14
藝術節精彩節目助建演藝之都    高嘉灝,藝術節精彩節目助建演藝之都    今屆澳門藝術節，可視之為打造澳門“演藝之都”的一次誠意奉獻，集合各國名著、名團、名導，都是備受全球各地觀眾追捧、各大藝術節炙手可熱的演藝新寵，必定讓觀眾視野為之大開，藝術品味隨之提升。    中葡搖滾文化共融    英國著名編舞家艾甘 · 漢，將諾貝爾文學獎得主魯德亞德 · 吉卜林的傳世經典改編為發人深省的舞蹈劇場作品《叢林奇譚（再造版）》，為今屆澳門藝術節拉開帷幕，舞者將以舞姿巧妙刻畫動物野性，配以精心打造的動畫影像，講述人類與他者建立關係的需求，傳達萬物和諧共處的重要性。    壓軸則呈獻《中葡搖滾瘋》，由擅長演奏流行搖滾歌曲的葡萄牙浮士德船長樂隊與擅長糅合中西樂風的歌手黃大煒同台獻技，以風格各異的音樂共創中葡文化交流的繽紛時刻，延續澳門數百年來中西文化交匯與共融的傳統。    雜技劇場糅合經典    還有雜技劇場《小鴨跌落天鵝湖》，取材自柴可夫斯基的芭蕾舞劇《天鵝湖》和安徒生童話《醜小鴨》，來自澳洲布里斯班的無界限雜技團將以高超技藝呈獻輕鬆惹笑的劇場作品；當代芭蕾舞劇《睡美人》則由西班牙國家舞蹈大獎得主馬可 · 莫勞將攜手里昂歌劇院芭蕾舞團，引領觀眾走進沉睡公主的異空間。    葡萄牙“本名藝術團”的《血親》，由演戲空間攜手日本瞬間劇場呈獻的改編作品《科學／怪人》，瑪麗 · 布拉薩德執導的《都市女子心靈圖鑑》，以及《葉麗儀與澳門中樂團》音樂會等，相信各有捧場客，還有眾多精彩戲碼，留待看倌細味。    本報記者   高嘉灝,http://www.macaodaily.com/html/2024-03/14/content_1741523.htm,中葡搖滾文化共融    英國著名編舞家艾甘 · 漢，將諾貝爾文學獎得主魯德亞德 · 吉卜林的傳世經典改編為發人深省的舞蹈劇場作品《叢林奇譚（再造版）》，為今屆澳門藝術節拉開帷幕，舞者將以舞姿巧妙刻畫動物野性，配以精心打造的動畫影像，講述人類與他者建立關係的需求，傳達萬物和諧共處的重要性,藝術節 精彩 節目助 建演藝 之 都         今屆 澳門 藝術節 ， 可視 之 為 打造 澳門 “ 演藝 之 都 ” 的 一次 誠意 奉獻 ， 集合 各國 名著 、 名團 、 名導 ， 都 是 備受 全球 各地 觀眾 追捧 、 各大藝術 節炙手 可熱 的 演藝 新寵 ， 必定 讓 觀眾 視野為 之大開 ， 藝術 品味 隨之 提升 。         中葡 搖滾 文化 共融         英國 著名 編舞家 艾甘   ·   漢 ， 將諾 貝爾文學獎 得主 魯德亞德   ·   吉卜林 的 傳世經典 改編 為 發人 深省 的 舞蹈 劇場 作品 《 叢林 奇譚 （ 再造 版 ） 》 ， 為 今屆 澳門 藝術 節拉開 帷幕 ， 舞者 將以 舞姿 巧妙 刻畫 動物 野性 ， 配以 精心 打造 的 動畫 影像 ， 講述 人類 與 他者 建立 關 係 的 需求 ， 傳達 萬物 和 諧共處 的 重要性 。         壓軸則 呈 獻 《 中葡 搖滾 瘋 》 ， 由 擅長 演奏 流行 搖滾 歌曲 的 葡萄牙 浮士德 船長 樂隊 與 擅長 糅合 中西 樂風 的 歌手 黃 大煒 同台 獻技 ， 以風格 各異 的 音樂共創 中葡 文化交流 的 繽紛 時刻 ， 延續 澳門數 百年 來 中西文化 交匯 與 共融 的 傳統 。         雜技劇場 糅合 經典         還有 雜技劇場 《 小 鴨 跌落 天鵝湖 》 ， 取材自 柴可夫斯基 的 芭蕾舞 劇 《 天鵝湖 》 和 安徒生 童話 《 醜小鴨 》 ， 來 自 澳洲 布里斯班 的 無 界限 雜技團 將以 高超 技藝 呈 獻 輕 鬆 惹 笑 的 劇 場 作品 ； 當代 芭蕾舞 劇 《 睡美人 》 則由 西班牙 國家 舞蹈 大獎 得主 馬 可   ·   莫勞將 攜手 里昂 歌劇院 芭蕾舞 團 ， 引領 觀眾 走進 沉睡 公主 的 異空間 。         葡萄牙 “ 本名 藝術團 ” 的 《 血親 》 ， 由 演戲 空間 攜手 日本 瞬間 劇場 呈 獻 的 改編 作品 《 科學 ／ 怪人 》 ， 瑪麗   ·   布拉 薩德 執導 的 《 都市 女子 心靈 圖鑑 》 ， 以及 《 葉麗儀 與 澳門 中樂團 》 音樂會 等 ， 相信 各有 捧 場客 ， 還有 眾多 精彩 戲碼 ， 留待 看倌 細味 。         本報 記者       高嘉灝,2024-03-14
澳大校園記者訪本報了解運作,澳大校園記者訪本報了解運作    【本報消息】澳門大學校園記者一行昨訪本報，就報章及新媒體的編採工作等踴躍發問，獲本報負責人解答，互動氣氛熱烈。澳大校園記者一行昨日下午三時，在澳大傳訊部高級新聞專員葉浩男、新聞專員梁曉珊帶領下到訪本報，獲本報助理總編輯陳文戈、視頻組記者趙歌盈熱情接待。    一行觀看了本報視頻新聞及參觀報史室，並與本報負責人交流。校園記者關注本報新聞標題形式、自媒體對傳統媒體的衝擊、外地新聞選取等。陳文戈指出，新聞標題要求簡潔明瞭，但在新媒體平台領域，越清晰或越少人看，模糊性標題可引發讀者的獵奇心，故在微信公眾號標題下工夫，與報章標題有分別，迎合市場需要吸引讀者。強調傳統媒體公信力最重要，內文會保持新聞性及專業性，內容為王，讓讀者持續關注。    自媒體創作方式較靈活，傳統媒體則要核實內容及有理性，新聞報道也非只為流量。當下自媒體遍地開花，更能反映出傳統媒體的重要性，報社想方設法深挖各類新聞，並透過深度訪談等尋求不同社會問題的解決之道，提升公信力及發揮媒體作用。又指傳統媒體以社會民生新聞為主，在選取外地新聞時，會兼顧讀者關心、有趣及影響力大的新聞登出。本報近年大力發展視頻新聞，趙歌盈向一行介紹了視頻新聞製作的要領及本報視頻新聞欄目。認為學生要關心身邊發生的事情及多角度採訪，也要多看多學習不同的新聞模式，拓展各類技能。,http://www.macaodaily.com/html/2024-03/14/content_1741524.htm,澳大校園記者一行昨日下午三時，在澳大傳訊部高級新聞專員葉浩男、新聞專員梁曉珊帶領下到訪本報，獲本報助理總編輯陳文戈、視頻組記者趙歌盈熱情接待,澳 大校 園記者 訪本報 了解 運作         【 本報 消息 】 澳門 大學 校園 記者 一行 昨訪 本報 ， 就 報章 及 新 媒體 的 編採 工作 等 踴躍發問 ， 獲本報 負責人 解答 ， 互動 氣氛 熱烈 。 澳 大校 園記者 一行 昨日 下午 三時 ， 在 澳大 傳訊部 高級 新聞 專員葉浩 男 、 新聞 專員 梁曉珊帶 領下 到 訪本報 ， 獲本報 助理 總編輯 陳 文戈 、 視頻 組記者 趙 歌盈 熱情 接待 。         一行 觀看 了 本 報視 頻新聞 及 參觀 報史室 ， 並與 本報 負責人 交流 。 校園 記者 關注 本報 新聞 標題 形式 、 自媒體 對 傳統 媒體 的 衝擊 、 外地 新聞 選取 等 。 陳 文戈 指出 ， 新聞 標題 要求 簡潔明 瞭 ， 但 在 新 媒體 平台 領域 ， 越 清晰 或 越少 人 看 ， 模糊性 標題 可 引發 讀者 的 獵奇心 ， 故 在 微信 公眾號 標題 下工夫 ， 與 報章 標題 有 分別 ， 迎合 市場 需要 吸引 讀者 。 強調 傳統 媒體 公信力 最 重要 ， 內文會 保持 新聞性 及 專業性 ， 內容 為 王 ， 讓 讀者 持續 關注 。         自媒體 創作 方式 較靈活 ， 傳統 媒體則 要 核實 內容 及 有 理性 ， 新聞 報道 也 非 只 為 流量 。 當下 自媒體 遍地 開花 ， 更能 反映 出傳統 媒體 的 重要性 ， 報社 想方 設法 深挖 各類 新聞 ， 並透過 深度 訪談 等 尋求 不同 社會 問題 的 解決 之道 ， 提升 公信力 及 發揮 媒體 作用 。 又 指傳統 媒體 以 社會 民生 新聞 為 主 ， 在 選取 外地 新聞時 ， 會 兼顧 讀者 關心 、 有趣 及 影響力 大 的 新聞 登出 。 本報 近年 大力 發展 視頻 新聞 ， 趙 歌盈 向 一行 介紹 了 視頻 新 聞 製 作 的 要 領 及 本 報 視 頻 新 聞 欄 目 。 認為 學生 要關 心身 邊發生 的 事情 及 多角度 採訪 ， 也 要 多 看 多學習 不同 的 新聞 模式 ， 拓展 各類 技能 。,2024-03-14
