Title,Content,Link,Summary,Preprocessed_Content,Date
穗藍皮書促軌道交通融入機場,旅客運輸規模不及雙機場城市    穗藍皮書促軌道交通融入機場    【本報記者廣州電】廣州大學、廣州市與社會科學文獻出版社最近聯合發佈的《廣州藍皮書：二○二四年中國廣州社會發展分析與展望》建議，合理規劃加快發展，優化主要交通樞紐。    其中白雲國際機場應推動軌道交通融入機場集輸散體系。    客量成本遇挑戰    藍皮書稱，去年白雲機場實現國內單體機場旅客吞吐量“四連冠”，全年旅客吞吐量六千七百多萬人次，同比增長百分之一百四十二。國內航線旅客量五千五百萬人次，同比增長一點二倍，國際航線七百六十多萬人次，同比增長八點九倍。    目前白雲機場通航點二百三十六個，已超二○一九年二百三十四個水平，國際及地區定期航點七十二個，國內航點一百六十四個。    藍皮書同時提出需要關注的問題。其一，白雲機場雖然連續四年保持了國內單體機場旅客吞吐量的全國第一位，但是從城市的整體規模而言不及上海、北京、成都等擁有雙機場的城市。    去年上海和北京的雙機場旅客吞吐量達九千七百萬人次和九千二百萬人次，規模已經逼近一億人次。成都雙流及天府機場合力完成旅客吞吐量七千五百萬人次，超過廣州一千多萬人次。    其二，運價徘徊在較低的水平。國際航空運輸協會（IATA）相關分析師指出，去年因為中國客機腹艙運力的補充，航空運力總體供大於求，導致去年的運價同比下降了三成。    三是環保政策導致企業成本激增。目前歐盟多個國家已經對航空運輸企業徵收多項航空環保稅，如排碳稅金、氣候稅、噪聲稅等，還嚴格限制航班起降時間，導致運輸環節增加進而增加成本。    加速建設增產品    為此，穗藍皮書就白雲機場的加快發展和優化提出了具體的建議。第一是要加速白雲機場T1和T2航站樓硬件和軟件的聯通，積極推動高鐵、城際、地鐵等軌道交通融入機場集輸散體系，讓多層次的空鐵聯運提升白雲機場的集輸散能力。    第二是聯合各大航空公司，豐富國內和國際的各種聯程、跨公司的中轉出行產品，從而實現“一站式辦理、一次性通關完成中轉”，讓廣大旅客體驗“經廣飛”的便捷以及順暢。    第三是推動白雲機場三期西飛行區建設，令T3航站樓及配套設施按時投入使用。,http://www.macaodaily.com/html/2024-10/04/content_1785333.htm,客量成本遇挑戰    藍皮書稱，去年白雲機場實現國內單體機場旅客吞吐量“四連冠”，全年旅客吞吐量六千七百多萬人次，同比增長百分之一百四十二,旅客 運輸 規模 不及 雙機場 城市         穗 藍皮書 促軌 道 交通 融入 機場         【 本報 記者 廣州電 】 廣州 大學 、 廣 州市 與 社會 科學 文獻 出版社 最近 聯合發 佈 的 《 廣州 藍皮書 ： 二 ○ 二 四年 中國 廣州 社會 發展 分析 與 展望 》 建議 ， 合理 規劃 加快 發展 ， 優化 主要 交通 樞紐 。         其中 白雲國際 機場 應 推動 軌道 交通 融入 機場 集輸散 體系 。         客量 成本 遇 挑戰         藍皮書稱 ， 去年 白雲機場 實現 國內 單體 機場 旅客 吞吐量 “ 四連冠 ” ， 全年 旅客 吞吐量 六千 七百多 萬 人次 ， 同比 增長 百分之一百 四十二 。 國內 航線 旅客量 五千 五百 萬 人次 ， 同比 增長 一點 二倍 ， 國際 航線 七百 六十多 萬 人次 ， 同比 增長 八點 九倍 。         目前 白雲機場 通航 點 二百 三十六 個 ， 已超 二 ○ 一 九年 二百三十 四個 水平 ， 國際及 地區 定期 航點 七十二 個 ， 國內 航點 一百六十四 個 。         藍皮書 同時 提出 需要 關注 的 問題 。 其一 ， 白雲機場 雖然 連續 四年 保持 了 國內 單體 機場 旅客 吞吐量 的 全國 第一位 ， 但是 從 城市 的 整體 規模 而言 不及 上海 、 北京 、 成都 等 擁有 雙機場 的 城市 。         去年 上海 和 北京 的 雙機場 旅客 吞吐量 達 九千 七百 萬 人次 和 九千 二百 萬 人次 ， 規模 已經 逼近 一億 人次 。 成都 雙流 及 天府 機場 合力 完成 旅客 吞吐量 七千五百 萬 人次 ， 超過 廣州 一千多 萬 人次 。         其二 ， 運價 徘徊 在 較 低 的 水平 。 國際 航空 運輸 協會 （ IATA ） 相關 分析 師 指出 ， 去年 因為 中國 客機 腹艙 運力 的 補充 ， 航空 運力 總體 供大 於 求 ， 導致 去年 的 運價 同比 下降 了 三成 。         三是 環保 政策 導致 企業 成本 激增 。 目前 歐盟 多個 國家 已經 對 航空 運輸 企業 徵收 多項 航空 環保稅 ， 如排 碳 稅金 、 氣候稅 、 噪聲稅 等 ， 還嚴格 限制 航班 起降 時間 ， 導致 運輸 環節 增加 進而 增加 成本 。         加速 建設 增產品         為 此 ， 穗 藍皮書 就 白雲機場 的 加快 發展 和 優化 提出 了 具體 的 建議 。 第一 是 要 加速 白雲機場 T1 和 T2 航站 樓 硬件 和 軟件 的 聯通 ， 積極 推動 高鐵 、 城際 、 地鐵 等 軌道 交通 融入 機場 集輸散 體系 ， 讓 多 層次 的 空鐵聯運 提升 白雲機場 的 集輸散 能力 。         第二 是 聯合 各大 航空公司 ， 豐富國 內 和 國際 的 各種 聯程 、 跨 公司 的 中轉 出行 產品 ， 從 而 實現 “ 一站式 辦理 、 一次性 通關 完成 中轉 ” ， 讓 廣大 旅客 體驗 “ 經廣飛 ” 的 便捷 以及 順暢 。         第三 是 推動 白雲機場 三期 西飛 行區 建設 ， 令 T3 航站 樓及 配套 設施 按時 投入使用 。,2024-10-04
東航擴珠三角區域通服務,拓用新退舊範圍   提升航旅體驗    東航擴珠三角區域通服務    【本報記者廣州電】東方航空、上海航空“珠三角區域通”產品覆蓋區域拓寬至佛山沙堤機場，此前，包括廣州白雲國際機場、深圳寶安國際機場、珠海金灣機場、揭陽潮汕國際機場、湛江吳川國際機場、惠州平潭機場等機場已提出該產品，廣東旅客乘坐東航航班出行將更為方便。    東航、上航於今年七月上線了“珠三角區域通”產品，旅客購買東航、上航承運的珠三角區域內機場始發或到達的國內單程航班客票，如有變更省內其他機場的需求，可在原航班計劃起飛時刻四小時（含）之前使用相同證件購買原航班前後兩天珠三角區域的新航班，旅行完畢後“用新退舊”，原票可全額退款。    如旅客黃女士購買一張十月五日從廣州飛往北京大興機場的航班，但十月四日臨時因工作原因變化需要推後一天從深圳出發，她可以在十月四日當天先重新買一張十月六日的深圳至北京大興的機票，並取消原航班行程訂座。十月六日，當她使用新機票乘機抵達北京之後，再辦理此前所購買的十月五日廣州至北京大興的退票，在退票理由上選擇“區域通”選項，並註明自己新買的深圳至北京大興“781”開頭票號，即可享受“使用新票，原票全額退票”的政策。    業內人士指出，這一產品的推廣，不僅在於改善旅客的出行體驗，更是東航針對日益多樣化的市場需求的積極回應。在未來的航空市場中，靈活性和便捷性將成為航空公司競爭的重要因素。越來越多的旅客將希望能夠以最低的成本，享受到最佳的服務，而東航正是通過這種“用新退舊”的靈活政策，滿足了這一點。,http://www.macaodaily.com/html/2024-10/04/content_1785335.htm,拓用新退舊範圍   提升航旅體驗    東航擴珠三角區域通服務    【本報記者廣州電】東方航空、上海航空“珠三角區域通”產品覆蓋區域拓寬至佛山沙堤機場，此前，包括廣州白雲國際機場、深圳寶安國際機場、珠海金灣機場、揭陽潮汕國際機場、湛江吳川國際機場、惠州平潭機場等機場已提出該產品，廣東旅客乘坐東航航班出行將更為方便,拓用 新退 舊範圍       提升 航旅 體驗         東航 擴 珠三角 區域 通服務         【 本報 記者 廣州電 】 東方 航空 、 上海 航空 “ 珠三角 區域 通 ” 產品 覆蓋區域 拓寬 至 佛山 沙堤 機場 ， 此前 ， 包括 廣州 白雲國際 機場 、 深圳 寶安國際 機場 、 珠海 金灣 機場 、 揭陽 潮汕 國際 機場 、 湛江 吳川國際 機場 、 惠州 平潭 機場 等 機場 已 提出 該產品 ， 廣東 旅客 乘坐 東航 航班 出行 將更為 方便 。         東航 、 上航 於 今年 七月 上線 了 “ 珠三角 區域 通 ” 產品 ， 旅客 購買 東航 、 上 航承運 的 珠三角 區域 內 機場 始發 或 到 達 的 國內 單程 航班 客票 ， 如有 變 更 省 內 其他 機場 的 需求 ， 可 在 原 航班 計劃 起飛 時刻 四小時 （ 含 ） 之前 使用 相同 證件 購買原 航班 前後兩天 珠三角 區域 的 新 航班 ， 旅行 完畢 後 “ 用 新 退 舊 ” ， 原票 可 全額 退款 。         如 旅客 黃 女士 購買 一張 十月 五日 從廣州 飛往 北京 大興 機場 的 航班 ， 但 十月 四日 臨時 因 工作 原因 變化 需要 推 後 一天 從 深圳 出發 ， 她 可以 在 十月 四日 當天 先 重新 買 一張 十月 六日 的 深圳 至 北京 大興 的 機票 ， 並 取消 原 航班 行程 訂座 。 十月 六日 ， 當 她 使用 新機票 乘機 抵達 北京 之 後 ， 再 辦理 此前 所購 買 的 十月 五日 廣州 至 北京 大興 的 退票 ， 在 退票 理由 上 選擇 “ 區域 通 ” 選項 ， 並 註 明 自己 新買 的 深圳 至 北京 大興 “ 781 ” 開頭 票號 ， 即可 享受 “ 使用 新票 ， 原票 全額 退票 ” 的 政策 。         業內 人士 指出 ， 這一產品 的 推廣 ， 不僅 在 於 改善 旅客 的 出行 體驗 ， 更是 東航針 對 日益 多樣化 的 市場 需求 的 積極 回應 。 在 未來 的 航空 市場 中 ， 靈 活性 和 便捷性 將成 為 航空公司 競爭 的 重要 因素 。 越來 越 多 的 旅客 將 希望 能夠 以 最低 的 成本 ， 享受 到 最佳 的 服務 ， 而 東航 正是 通過 這種 “ 用 新 退 舊 ” 的 靈活 政策 ， 滿足 了 這一點 。,2024-10-04
深圳達卡貨運航線開通,深圳達卡貨運航線開通    【本報記者深圳電】中州航空一架波音七三八全貨機近日從深圳機場起飛前往孟加拉國達卡國際機場，標誌着深圳至達卡國際貨運航線正式開通。這是深圳機場今年新開及加密的第二十條國際貨運航線，全貨機國際通航點達三十九個，助力深圳擴大外貿“鵬友圈”，拓展新興市場。    深圳至達卡國際貨運航線計劃一周執行三班，每周可提供近一百噸來往孟加拉國的航空運力，有效滿足深圳乃至珠三角地區面向孟加拉國的航空貨運需求，提升了商品運輸時效。    深圳機場相關負責人表示，目前與“一帶一路”共建國家之間的國際貨運航線數量達到十九條，每周往返的全貨機航班達二百架次，為深圳穩步拓展“一帶一路”經貿合作新領域、新空間，以及推動“深圳製造”、“深圳產品”更快速地走向“一帶一路”共建國家架起了“空中橋樑”。,http://www.macaodaily.com/html/2024-10/04/content_1785336.htm,深圳機場相關負責人表示，目前與“一帶一路”共建國家之間的國際貨運航線數量達到十九條，每周往返的全貨機航班達二百架次，為深圳穩步拓展“一帶一路”經貿合作新領域、新空間，以及推動“深圳製造”、“深圳產品”更快速地走向“一帶一路”共建國家架起了“空中橋樑”,深圳 達卡 貨運 航線 開通         【 本報 記者 深圳 電 】 中州 航空 一架 波音 七 三八 全貨機 近日 從 深圳 機場 起飛 前往 孟加拉 國達 卡國際 機場 ， 標誌 着 深圳 至達 卡國際 貨運 航線 正式 開通 。 這是 深圳 機場 今年 新開 及 加密 的 第二十 條國際 貨運 航線 ， 全貨 機國際 通航 點達 三十九 個 ， 助力 深圳 擴大 外貿 “ 鵬友圈 ” ， 拓展 新興 市場 。         深圳 至達 卡國際 貨運 航線 計劃 一周 執行 三班 ， 每周 可 提供 近 一百 噸來 往 孟加拉 國的 航空 運力 ， 有效 滿足 深圳 乃至 珠三角 地區 面向 孟加拉 國的 航空 貨運 需求 ， 提升 了 商品 運輸 時效 。         深圳 機場 相關 負責人 表示 ， 目前 與 “ 一帶 一路 ” 共建 國家 之間 的 國際 貨運 航線 數量 達 到 十九 條 ， 每周 往返 的 全貨機 航班 達 二百架 次 ， 為 深圳 穩步 拓展 “ 一帶 一路 ” 經貿 合作 新 領域 、 新空間 ， 以及 推動 “ 深圳 製 造 ” 、 “ 深圳 產品 ” 更 快速 地 走向 “ 一帶 一路 ” 共建 國家 架起 了 “ 空中 橋 樑 ” 。,2024-10-04
廣州貝爾格萊德開通直航,廣州貝爾格萊德開通直航    【本報記者廣州電】塞爾維亞航空近日在廣州宣佈其在中國市場的航線佈局取得重要進展。繼二○二二年成功開通天津航線後，塞航於九月三十日開通廣州至塞爾維亞首都貝爾格萊德的直飛航線，並正按計劃積極推進上海浦東航線的開通準備工作。    塞爾維亞航空於九月三十日開通一周兩班廣州至貝爾格萊德的直飛航線。這一航線的開通將進一步加強中國與塞爾維亞兩國之間的空中聯繫，為商務人士、留學生及旅遊愛好者提供更加便捷的出行方式。塞航表示，將投入先進的空中客車A330執飛廣州航線，確保乘客享受舒適、安全的飛行體驗。    此外，塞航還在積極推進上海浦東航線的開通準備工作。作為中國最重要的國際航空樞紐之一，上海浦東國際機場擁有完善的航線網絡和先進的設施設備。塞航對開通浦東航線充滿期待，並正積極與相關部門溝通協調，以確保航線開通工作的順利進行。    通過加強航線網絡佈局，塞航希望能夠更好地服務中塞兩國人民，促進兩國之間的友好交流與合作。,http://www.macaodaily.com/html/2024-10/04/content_1785337.htm,繼二○二二年成功開通天津航線後，塞航於九月三十日開通廣州至塞爾維亞首都貝爾格萊德的直飛航線，並正按計劃積極推進上海浦東航線的開通準備工作,廣州 貝爾格萊德 開通 直航         【 本報 記者 廣州電 】 塞爾維亞 航空 近日 在 廣州 宣 佈 其 在 中國 市場 的 航線 佈 局 取得 重要 進展 。 繼二 ○ 二 二年 成功 開通 天津 航線 後 ， 塞航 於 九月 三十日 開通 廣州 至塞爾維亞 首都 貝爾格萊德 的 直飛 航線 ， 並正 按 計劃 積極 推進 上海 浦東 航線 的 開通 準備 工作 。         塞爾維亞 航空 於 九月 三十日 開通 一周 兩班廣州 至 貝爾格萊德 的 直飛 航線 。 這一 航線 的 開通 將進 一步 加強 中國 與 塞爾維亞 兩國 之間 的 空中 聯 繫 ， 為 商務 人士 、 留學生 及 旅遊 愛好者 提供 更加 便捷 的 出行 方式 。 塞航 表示 ， 將 投入 先進 的 空中 客車 A330 執飛 廣州 航線 ， 確保 乘客 享受 舒適 、 安全 的 飛行 體驗 。         此外 ， 塞航 還在 積極 推進 上海 浦東 航線 的 開通 準備 工作 。 作為 中國 最 重要 的 國際 航空 樞紐 之一 ， 上海 浦東國際 機場 擁有 完善 的 航線 網絡 和 先進 的 設施 設備 。 塞航 對 開通浦東 航線 充滿 期待 ， 並正 積極 與 相關 部門 溝通 協調 ， 以確 保航線 開通 工作 的 順利 進行 。         通過 加強 航線 網絡 佈 局 ， 塞航 希望 能夠 更好 地 服務 中塞 兩國 人民 ， 促進 兩國 之間 的 友好 交流 與 合作 。,2024-10-04
古天樂：女校究竟有冇男廁？,演協School Tour第二站    古天樂：女校究竟有冇男廁？    香港演藝人協會會長古天樂為關注學童心理健康，發起的School Tour行動，繼早前首站到訪古天樂母校後，昨日他再率領一眾演協理事：副會長余安安、秘書長張繼聰、司庫周家怡、理事岑珈其、游學修、J. Arie到訪第二站九龍真光中學。    由古天樂領軍的《PAG巡校遊：放飛EMO的拼勁》，第二站到訪女校——九龍真光中學，除了一眾演協理事成員，今次還有周國賢、吳林峰、林千渟、李玗蓁擔任表演嘉賓，鄭文、黃芳雯則是活動司儀，陣容鼎盛。而古天樂與一眾嘉賓甫出場時，全校師生熱烈歡呼，氣氛熾熱。據司儀透露，自《PAG巡校遊：放飛EMO的拼勁》第一站舉行後，獲不少學校邀請演協到訪，可見School Tour行動十分成功。古天樂繼續向在座每位同學作呼籲：“知道讀書有一定壓力，不過最重要都係嗰三樣嘢，第一讀書唔係求分數，第二千祈唔好比較，第三唔好鑽牛角尖，遇到問題要同人分享。”    提到今次在女校舉行活動，古天樂即笑言：“好想藉此見識女校係咩情況，嚟之前我諗究竟呢度有冇男廁？有男教師，係有男廁。”古天樂續說岑珈其、游學修對於到訪女校感到怕醜，逗得全場學生鼓掌哄笑。    此外，每位到場嘉賓都有跟同學們分享減壓心得，席間余安安、周家怡、J. Arie、林千渟、黃芳雯不約而同曾就讀女校，其中林千渟、黃芳雯更是就讀九龍真光中學。    至於周家怡跟周國賢合唱歌曲《模稜兩可》，首次唱現場的周家怡表示十分緊張：“近排覺得潛意識好重要，當有壓力時，就不斷話‘我好好呀、我好好呀’，而家我就不斷同自己講‘我係歌手、我係歌手、我係歌手’。”身旁周國賢亦笑言受周家怡的緊張所感染，所以出台前，他吃了香蕉紓壓。,http://www.macaodaily.com/html/2024-10/04/content_1785338.htm,香港演藝人協會會長古天樂為關注學童心理健康，發起的School Tour行動，繼早前首站到訪古天樂母校後，昨日他再率領一眾演協理事：副會長余安安、秘書長張繼聰、司庫周家怡、理事岑珈其、游學修、J. Arie到訪第二站九龍真光中學,演協 School   Tour 第二站         古天樂 ： 女校 究竟 有 冇 男廁 ？         香港 演藝人 協會會長 古天樂 為關 注學童 心理健康 ， 發起 的 School   Tour 行動 ， 繼 早前 首站 到 訪古天樂 母校 後 ， 昨日 他 再率 領一眾 演協 理事 ： 副會長 余安安 、 秘書長 張繼聰 、 司庫 周家 怡 、 理事 岑珈 其 、 游學修 、 J .   Arie 到訪 第二站 九龍 真光 中學 。         由古 天樂領 軍 的 《 PAG 巡校遊 ： 放飛 EMO 的 拼勁 》 ， 第二站 到訪 女校 — — 九龍 真光 中學 ， 除了 一眾 演協 理事 成員 ， 今次 還有 周國賢 、 吳林峰 、 林千 渟 、 李 玗 蓁 擔任 表演 嘉賓 ， 鄭文 、 黃 芳雯則 是 活動 司儀 ， 陣容 鼎盛 。 而 古天樂 與 一眾 嘉賓甫 出場 時 ， 全校 師生 熱烈 歡呼 ， 氣氛 熾熱 。 據司 儀 透露 ， 自 《 PAG 巡校遊 ： 放飛 EMO 的 拼勁 》 第一站 舉行 後 ， 獲 不少 學校 邀請 演協到 訪 ， 可見 School   Tour 行動 十分 成功 。 古天樂 繼續 向 在座 每位 同學作 呼籲 ： “ 知道 讀書 有 一定 壓力 ， 不過 最 重要 都 係 嗰 三 樣 嘢 ， 第一 讀書 唔 係 求 分數 ， 第二千 祈 唔 好比 較 ， 第三 唔 好 鑽 牛角尖 ， 遇到 問題 要 同人 分享 。 ”         提到 今次 在 女校 舉行 活動 ， 古天樂 即 笑 言 ： “ 好 想 藉此 見識 女校 係 咩 情況 ， 嚟 之前 我 諗 究竟 呢 度 有 冇 男廁 ？ 有 男教師 ， 係 有 男廁 。 ” 古天樂續 說 岑珈 其 、 游學修 對 於 到 訪 女校 感到 怕醜 ， 逗得 全場 學生 鼓掌 哄笑 。         此外 ， 每位 到場 嘉賓 都 有 跟 同學們 分享 減壓 心得 ， 席間 余安安 、 周家 怡 、 J .   Arie 、 林千 渟 、 黃 芳雯 不約 而 同 曾 就 讀 女校 ， 其中 林千 渟 、 黃 芳雯 更是 就 讀九龍 真光 中學 。         至於 周家 怡 跟 周國賢 合唱 歌曲 《 模 稜 兩 可 》 ， 首次 唱 現場 的 周家 怡 表示 十分 緊張 ： “ 近排 覺得 潛意識 好 重要 ， 當有 壓力 時 ， 就 不斷 話 ‘ 我 好好 呀 、 我 好好 呀 ’ ， 而家 我 就 不斷 同 自己 講 ‘ 我 係 歌手 、 我 係 歌手 、 我 係 歌手 ’ 。 ” 身旁 周國賢 亦 笑言受 周家 怡 的 緊張 所 感染 ， 所以 出台 前 ， 他 吃 了 香蕉 紓 壓 。,2024-10-04
電影《焚城》製作特輯昨登場,電影《焚城》製作特輯昨登場    香港首部以輻射災難為題材的電影《焚城》將於十一月一日上畫，港版主海報以及製作特輯“重裝訓練”昨日亦登場。    最新製作特輯“重裝訓練”，聚焦飾演消防員的演員們。去年在中國電視劇年度盛典獲得年度突破男演員的白宇，戲中夥拍金馬影帝謝君豪，率領一班新生代演員王丹妮、廖子妤、Dee、Jeffrey、阿炳、林家熙、黃愷傑等進入火場，組成熱血最強的消防隊伍。製作特輯中展示各人拍攝前接受的各項嚴格訓練，經歷了濃縮版的“消防精讀班”以及消防特訓考驗體能。    訓練當天，一班演員被帶到一幢二十多層高的大廈天台，準備挑戰在高空繩陣移動。作為當日其中一位女演員，王丹妮挑戰前都要克服心理障礙：“其實我怕高嘅，跳樓機都驚！”但憑藉她的手長腳長優勢，順利完成挑戰，甚至在半空中擺出超人姿勢，好不威風。廖子妤則沒那麼順利，平日連摩天輪都不敢玩的她，在繩陣上不斷手震腳震，無法前進，甚至嚇得在半空中落淚。王丹妮不斷安慰廖子妤，並主動陪她一起完成挑戰，最終兩人互相扶持順利過關。高空訓練後，監製還安排戶外BBQ及團體遊戲，進一步加深演員們之間的默契和信任，務求令大家無論戲裡戲外，都打造出出生入死，肝膽相照的情誼。,http://www.macaodaily.com/html/2024-10/04/content_1785339.htm,去年在中國電視劇年度盛典獲得年度突破男演員的白宇，戲中夥拍金馬影帝謝君豪，率領一班新生代演員王丹妮、廖子妤、Dee、Jeffrey、阿炳、林家熙、黃愷傑等進入火場，組成熱血最強的消防隊伍,電影 《 焚城 》 製 作 特 輯 昨 登 場         香港 首部 以輻射 災難 為 題材 的 電影 《 焚城 》 將於 十一月 一日 上畫 ， 港版 主海報 以及 製 作 特 輯 “ 重裝 訓練 ” 昨日 亦 登場 。         最新 製 作 特 輯 “ 重裝 訓練 ” ， 聚焦 飾演 消防 員 的 演員們 。 去年 在 中國 電視劇 年度 盛典 獲得 年度 突破 男演員 的 白宇 ， 戲中夥 拍金馬 影帝 謝君豪 ， 率領 一班 新生代 演員 王丹妮 、 廖子 妤 、 Dee 、 Jeffrey 、 阿炳 、 林家 熙 、 黃 愷傑 等 進入 火場 ， 組成 熱血 最強 的 消防 隊伍 。 製 作 特 輯 中 展示 各人 拍 攝前 接受 的 各項 嚴格 訓練 ， 經歷 了 濃縮 版 的 “ 消防 精讀 班 ” 以及 消防 特訓 考驗 體能 。         訓練 當天 ， 一班 演員 被 帶 到 一幢 二十多 層高 的 大廈 天台 ， 準備 挑戰 在 高空 繩陣 移動 。 作為 當日 其中 一位 女演員 ， 王丹妮 挑戰前 都 要 克服 心理 障礙 ： “ 其實 我 怕 高 嘅 ， 跳樓機 都 驚 ！ ” 但 憑 藉 她 的 手長 腳長 優勢 ， 順利 完成 挑戰 ， 甚至 在 半空中 擺出 超人 姿勢 ， 好 不 威風 。 廖子 妤 則 沒 那麼 順利 ， 平日 連 摩天 輪 都 不敢 玩 的 她 ， 在 繩陣 上 不斷 手震 腳震 ， 無法 前進 ， 甚至 嚇得 在 半空中 落淚 。 王丹妮 不斷 安慰 廖子 妤 ， 並主動 陪 她 一起 完成 挑戰 ， 最終 兩人 互相 扶持 順利 過關 。 高空 訓練 後 ， 監 製 還 安排 戶外 BBQ 及團體 遊戲 ， 進 一步 加深 演員們 之間 的 默契 和 信任 ， 務求 令 大家 無論 戲裡 戲外 ， 都 打造出 出生入死 ， 肝膽 相照 的 情誼 。,2024-10-04
