Title,Content,Link,Summary,Preprocessed_Content,Date
警閃電破案拘五祈福黨,“神醫”重出江湖    事主誤信消災解難險失財十三萬    警閃電破案拘五祈福黨    【本報消息】祈福黨再現！有長者誤信神醫後代指其子女即將有“血光之災”及家中鬧鬼，交出價值十三萬元的金飾及現金祈福禳災，最終發現被騙，報警求助。司警接報後迅速破案，拘捕五名內地男女，起回全數騙款及贓物。    同行期間套取個資    被捕祈福黨三女兩男，均為內地居民。三名女嫌犯分別姓陳、羅、林，男嫌犯姓林、李，年齡介乎四十二至五十八歲，來自茂名。司警將五人落案控以犯罪集團及巨額詐騙罪，移送檢察院處理。    案情透露，案中事主爲本澳女長者，本月二十日上午十時許，事主行經黑沙環時，陳女上前搭訕，詢問是否認識一位神醫？羅女隨即出現，聲稱認識該神醫。由於女事主常有病痛，遂跟隨兩人前往訪尋神醫。期間有人藉故詢問事主的個人資料及家庭背景。三人其後到達祐漢區某大廈天井，兩名林姓嫌犯現身並自稱是神醫的孫兒，表示神醫可以替人治病，祈福消災解難。又指女事主兒子將有“血光之災”以及家中有鬼魂作祟，建議其取出家中全部首飾及現金祈福，方可消災解難。    祈福財物不翼而飛    爲讓事主相信，林女亦要求實爲同伙的陳女交出財物祈福。及後羅女陪同事主返家，取出共値十三萬澳門元的首飾及現金，兩人約於同日中午返回上述大廈天井。陳男及羅女即着事主將首飾及現金放入一個裝有礦泉水的黑色膠袋內，並以膠紙封口。然後要求事主背着膠袋，向東面拜三下。完成後將膠袋交還事主，叮囑其回家後方可打開。當事主回家後拆開黑色膠袋，發現袋內只有兩樽礦泉水及兩盒飲料，現金及首飾則不翼而飛，始知被騙，立即向治安警報案求助。    事主財物全部起回    司警接獲治安警轉介後立即調查，鎖定四名着手行騙的嫌犯及在外圍把風的李某，當日下午五時於新口岸某酒店拘捕五人，起回涉案全數首飾及現金。經調查，五人在祈福詐騙中分工明確，分別負責物色目標、帶路、假扮神醫後代、偷龍轉鳳及把風等。五人中陳女拒絕合作，其餘四人承認來澳作案。    預防祈福黨司警呼籲居民    在街上應提防陌生人搭訕或過分關心，切勿聽信他人的花言巧語，更不應輕易交出財物。    時刻保持冷靜及理性思考，在動用大量財物前應先與家人聯絡商量。    如遇到可疑情況，可利用該局“反詐程式”查詢詐騙風險指數或致電該局防詐騙查詢熱線八八〇〇 · 七七七七。    倘不幸受騙，盡快致電該局報案熱線九九三求助。,http://www.macaodaily.com/html/2024-07/23/content_1769943.htm,事主財物全部起回    司警接獲治安警轉介後立即調查，鎖定四名着手行騙的嫌犯及在外圍把風的李某，當日下午五時於新口岸某酒店拘捕五人，起回涉案全數首飾及現金,“ 神醫 ” 重出江湖         事主 誤信 消災解 難險 失財 十三 萬         警閃電 破案 拘五 祈福 黨         【 本報 消息 】 祈福 黨 再現 ！ 有長 者誤 信神 醫後代 指其 子女 即將 有 “ 血光 之災 ” 及 家中 鬧 鬼 ， 交出 價值 十三 萬元 的 金飾 及 現金 祈福 禳 災 ， 最終 發現 被 騙 ， 報警 求助 。 司警 接報 後 迅速 破案 ， 拘捕 五名 內地 男女 ， 起回 全數 騙款 及 贓物 。         同行 期間 套取 個資         被捕 祈福 黨三女 兩 男 ， 均 為 內 地 居民 。 三名 女 嫌犯 分別 姓 陳 、 羅 、 林 ， 男 嫌犯 姓林 、 李 ， 年齡 介乎 四十二 至 五十八 歲 ， 來 自 茂名 。 司警 將五人 落案 控以 犯罪 集團 及 巨額 詐騙 罪 ， 移送 檢 察院 處理 。         案情 透露 ， 案中 事主 爲 本澳 女長 者 ， 本月 二十日 上午 十時許 ， 事主 行經 黑沙 環時 ， 陳 女 上前 搭訕 ， 詢問 是否 認識 一位 神醫 ？ 羅 女 隨即 出現 ， 聲稱 認識 該 神醫 。 由 於 女事主 常有 病痛 ， 遂 跟 隨兩人 前往 訪尋神醫 。 期間 有人 藉 故 詢問 事主 的 個 人資 料及 家庭 背景 。 三人 其後到 達 祐 漢區 某大廈 天井 ， 兩名 林姓 嫌犯 現身 並自稱 是 神醫 的 孫兒 ， 表示 神醫 可以 替人 治病 ， 祈福 消災 解難 。 又 指 女事主 兒子 將有 “ 血光 之災 ” 以及 家中 有 鬼魂 作祟 ， 建議 其 取出 家中 全部 首飾 及 現金 祈福 ， 方可 消災 解難 。         祈福 財物 不翼 而 飛         爲 讓 事主 相信 ， 林女 亦 要求 實 爲 同伙 的 陳 女 交出 財物 祈福 。 及後羅女 陪同 事主 返家 ， 取出 共 値 十三 萬澳門 元 的 首飾 及 現金 ， 兩人 約 於 同日 中午 返回 上述 大廈 天井 。 陳 男 及羅女 即 着 事主 將首飾 及 現金 放入 一個 裝有 礦 泉水 的 黑色 膠袋 內 ， 並以 膠紙 封口 。 然 後 要求 事主 背着 膠袋 ， 向 東面 拜 三下 。 完成 後 將膠袋 交還 事主 ， 叮囑 其 回家 後 方可 打開 。 當 事主 回家 後 拆開 黑色 膠袋 ， 發現 袋 內 只有 兩樽礦 泉水 及 兩盒 飲料 ， 現金及 首飾則 不翼 而 飛 ， 始知 被 騙 ， 立即 向 治安警 報案 求助 。         事主 財物 全部 起回         司警 接獲 治安警 轉介 後 立即 調查 ， 鎖定 四名 着手 行騙 的 嫌犯 及 在外 圍 把 風 的 李某 ， 當日 下午 五時 於 新 口岸 某 酒店 拘捕 五人 ， 起回 涉案 全數 首飾 及 現金 。 經調查 ， 五人 在 祈福 詐騙 中 分工 明確 ， 分別 負責 物色 目標 、 帶路 、 假扮 神醫後代 、 偷龍 轉鳳及 把 風 等 。 五人 中 陳 女 拒絕 合作 ， 其餘四人 承 認來 澳 作案 。         預防 祈福 黨司 警呼籲 居民         在 街上 應 提防 陌生人 搭 訕 或 過分 關心 ， 切勿 聽信 他人 的 花言巧語 ， 更不應 輕易 交出 財物 。         時刻 保持 冷靜及 理性 思考 ， 在 動用 大量 財物前 應先 與 家人 聯絡 商量 。         如 遇到 可疑 情況 ， 可 利用 該局 “ 反詐 程式 ” 查詢 詐騙 風險 指數 或致 電該 局防詐 騙 查詢 熱線 八八 〇 〇   ·   七七七 七 。         倘 不幸 受騙 ， 盡快 致電 該局 報案 熱線 九九 三 求助 。,2024-07-23
內地男騙女三百萬被捕,訛稱投資賭廳每年可獲兩成四分紅    內地男騙女三百萬被捕    【本報消息】一名內地男子涉嫌串謀同黨，以“高息”投資路氹賭廳為名，詐騙內地中年女子三百萬元人民幣。女事主日前與其中一名騙徒在路氹某娛樂場相遇並發生爭執，驚動保安揭發案件。司警跟進調查，正追緝在逃同黨及騙款下落。    帶“視察業務”引落沓    涉案內地男子姓吳，三十五歲，報稱無業。涉相當巨額詐騙移交檢察院處理。    本月二十日晩，司警博彩罪案調查處人員於路氹城一娛樂場內處理一宗錢債糾紛時揭發案件。案情顯示，女事主報稱，二〇一九年十月在網上認識在逃騙子，對方多次向事主表示，涉案吳某在路氹城一娛樂場內開設賭廳，遊說事主投資，聲稱每年可獲投資額兩成四分紅。為加強事主信任，期間吳某與同黨（在逃者）多次帶領事主到娛樂場內“視察業務”，但無具體說明是何賭廳。事主信以爲眞，在不清楚賭廳任何資料和未有簽署正式文件的情況下，於二〇一九至二〇二〇年間多次轉賬合共三百萬元人民幣給在逃者指定的內地銀行賬戶。    賭場遇嫌犯揭發案件    但至二〇二〇年十二月仍無收到任何分紅。在事主多番追問下，吳某簽署一張三百萬元人民幣的借據給事主，但事主最終仍沒有收到任何分紅，亦未能取回投資的三百萬元人民幣。經多次向吳某追討，均被對方以不同藉口拖延，其後更失去聯絡。    直至本月二十日，事主在路氹某娛樂場遇到吳某，上前截停追數發生爭執，最終驚動保安報警揭發事件。,http://www.macaodaily.com/html/2024-07/23/content_1769944.htm,案情顯示，女事主報稱，二〇一九年十月在網上認識在逃騙子，對方多次向事主表示，涉案吳某在路氹城一娛樂場內開設賭廳，遊說事主投資，聲稱每年可獲投資額兩成四分紅,訛稱 投資 賭廳 每年 可獲 兩成 四分 紅         內地 男騙 女 三百 萬 被捕         【 本報 消息 】 一名 內地 男子 涉嫌 串謀 同黨 ， 以 “ 高息 ” 投資路 氹 賭廳 為 名 ， 詐騙 內 地 中年 女子 三百 萬元 人民 幣 。 女事主 日前 與 其中 一名 騙徒 在 路 氹 某 娛樂場 相遇 並發生 爭執 ， 驚動 保安 揭發 案件 。 司警 跟 進 調查 ， 正 追緝 在 逃 同黨 及 騙款 下落 。         帶 “ 視察業務 ” 引落 沓         涉案 內地 男子 姓吳 ， 三十五 歲 ， 報稱 無業 。 涉相當 巨額 詐騙 移交 檢 察院 處理 。         本月 二十日 晩 ， 司警 博彩 罪案 調查 處人員 於 路 氹 城一 娛樂場 內 處理 一宗 錢債 糾紛 時 揭發 案件 。 案情 顯示 ， 女事主 報稱 ， 二 〇 一 九年 十月 在 網上 認識 在 逃 騙子 ， 對方 多次 向 事主 表示 ， 涉案 吳某 在 路 氹 城一 娛樂場 內 開設 賭廳 ， 遊說 事主 投資 ， 聲稱 每年 可獲 投資額 兩成 四分 紅 。 為 加強 事主 信任 ， 期間 吳某 與 同黨 （ 在 逃者 ） 多次 帶領 事主 到 娛樂場 內 “ 視察業務 ” ， 但 無 具體 說明 是 何 賭廳 。 事主 信以 爲 眞 ， 在 不 清楚 賭廳 任何 資料 和 未有 簽署 正式 文件 的 情況 下 ， 於 二 〇 一九至 二 〇 二 〇 年間 多次 轉賬 合共 三百 萬元 人民 幣給 在 逃者 指定 的 內 地 銀行 賬戶 。         賭場 遇 嫌犯 揭發 案件         但 至 二 〇 二 〇 年 十二月 仍 無 收到 任何 分紅 。 在 事主 多番 追問 下 ， 吳某 簽署 一張 三百 萬元 人民 幣的 借據給 事主 ， 但 事主 最終 仍 沒 有 收到 任何 分紅 ， 亦 未能 取回 投資 的 三百 萬元 人民 幣 。 經 多次 向 吳某 追討 ， 均 被 對 方以 不同 藉口 拖延 ， 其後更 失去 聯絡 。         直至 本月 二十日 ， 事主 在 路 氹 某 娛樂場 遇到 吳某 ， 上前 截停 追數 發生 爭執 ， 最終 驚動 保安 報警 揭發 事件 。,2024-07-23
警再破補漏騙案拘兩嫌,警再破補漏騙案拘兩嫌    【本報消息】兩名居民近日墮入防漏工程詐騙，合共損失逾六萬澳門元，補漏後仍然漏水才知被騙，向司警報案。司警調查後拘捕兩名內地男子，檢獲一批工具及懷疑贓款。有人拒絕交代案情，被移送法辦。    被捕兩名內地男子分別姓王及陸，四十多歲，均報稱裝修工。案情透露，本月十一日，一名中年女事主在網上社交平台看到“專業防水工程公司”廣告，聯絡後對方宣稱無需鑿牆即可灌漿維修，並提供十年保固。事主信以為真，預約上門維修。本月十八日上午，兩名嫌犯到事主單位施工，聲稱每磅防水漿約五百八十澳門元。經施工後，兩人報稱已灌漿五十四磅，索價三萬一千澳門元，事主即場全數付款。其後發現仍然漏水，上網察覺遭遇與此前傳媒報道的其他防漏工程騙案相似，下午隨即報警。    司警調查後鎖定目標，翌日在中區某酒店拘捕兩名嫌犯，起出一批作案工具及六萬澳門元懷疑贓款，兩人拒絕合作。經調查，司警發現本月十八日除了女事主外，同日兩名嫌犯亦以同類手法詐騙一名本地中年男子二萬九千五百澳門元。兩名事主均表示工程無法達到有效防漏，追究責任。    司警調查獲悉，兩名嫌犯受僱於防漏工程詐騙集團，針對本澳居民不熟悉工程，以廉價及免鑿牆作招徠，待完成工程後再開出極高費用詐騙。這是司警近期破獲的第二宗同類案件，前案司警根據事主報案拘捕三名涉防漏工程詐騙嫌犯，有四名事主被騙。    本案兩名嫌犯涉犯罪集團及巨額詐騙，已移送檢察院處理。由於不排除尙有居民被騙，司警呼籲若曾遇到同類手法行騙招致損失的居民，盡快聯絡該局。,http://www.macaodaily.com/html/2024-07/23/content_1769945.htm,警再破補漏騙案拘兩嫌    【本報消息】兩名居民近日墮入防漏工程詐騙，合共損失逾六萬澳門元，補漏後仍然漏水才知被騙，向司警報案,警再 破 補漏 騙案 拘 兩 嫌         【 本報 消息 】 兩名 居民 近日 墮入 防漏 工程 詐騙 ， 合共 損失 逾六萬 澳門元 ， 補漏 後 仍然 漏水 才 知 被 騙 ， 向 司警 報案 。 司警 調查 後 拘捕 兩名 內 地 男子 ， 檢獲 一批 工具 及 懷疑 贓款 。 有人 拒絕 交代 案情 ， 被 移送 法辦 。         被捕 兩名 內 地 男子 分別 姓 王及 陸 ， 四十多 歲 ， 均 報稱 裝修工 。 案情 透露 ， 本月 十一日 ， 一名 中年 女事主 在 網上 社交 平台 看到 “ 專業 防水工程 公司 ” 廣告 ， 聯絡 後 對方 宣稱 無 需鑿 牆 即可 灌漿 維修 ， 並 提供 十年 保固 。 事主 信以 為 真 ， 預約 上門維修 。 本月 十八日 上午 ， 兩名 嫌犯 到 事主 單位 施工 ， 聲稱 每磅 防水 漿 約 五百 八十 澳門元 。 經 施工 後 ， 兩人 報稱 已 灌漿 五十四 磅 ， 索價 三萬 一千 澳門元 ， 事主 即場 全數 付款 。 其後發現 仍然 漏水 ， 上 網察覺 遭遇 與 此前 傳媒報 道 的 其他 防漏 工程 騙案 相似 ， 下午 隨即 報警 。         司警 調查後鎖定 目標 ， 翌日 在 中區 某 酒店 拘捕 兩名 嫌犯 ， 起出 一批 作案工具 及六萬 澳門元 懷疑 贓款 ， 兩人 拒絕 合作 。 經調查 ， 司警 發現 本月 十八日 除了 女事主 外 ， 同日 兩名 嫌犯 亦 以 同類 手法 詐騙 一名 本地 中年男子 二萬 九千 五百 澳門元 。 兩名 事主 均 表示 工程 無法 達 到 有效 防漏 ， 追究 責任 。         司警 調查 獲悉 ， 兩名 嫌犯 受僱 於 防漏 工程 詐騙 集團 ， 針對 本澳 居民 不 熟悉 工程 ， 以廉 價及 免鑿 牆作 招徠 ， 待 完成 工程 後 再 開出 極高費用 詐騙 。 這是 司警 近期 破獲 的 第二宗 同類 案件 ， 前案 司警 根據 事主 報案 拘捕 三名 涉 防漏 工程 詐騙 嫌犯 ， 有 四名 事主 被 騙 。         本案 兩名 嫌犯 涉 犯罪 集團 及 巨額 詐騙 ， 已 移送 檢 察院 處理 。 由 於 不 排除 尙 有 居民 被 騙 ， 司警 呼籲 若 曾 遇到 同類 手法 行騙 招致 損失 的 居民 ， 盡快 聯絡 該局 。,2024-07-23
女子涉經營麻將檔法辦,女子涉經營麻將檔法辦    【本報消息】中年女子經營非法麻將檔，治安警日前根據舉報到慕拉士大馬路某工廈單位調查，期間發現包括負責人在內的五名男女。據調查所得，有人自今年五月起以月租八千五百港元租用單位，租出麻將檯供熟客“打牌”，警方將五人轉交檢察院跟進。    涉案女子姓余，三十多歲，澳門居民，無業。    治安警日前接獲舉報，指有人在慕拉士大馬路某工廈單位非法賭博及經營麻將檔，本月十八日傍晚到目標單位偵查。警員到場後聽到“打牌聲”，隨即進入單位調查，於單位內發現年齡介乎三十至六十歲的三男一女賭客及余姓女負責人。在現場檢獲一張麻將檯、兩副麻將及小量現金。    調查期間，四名賭客稱透過朋友介紹，支付時租五十澳門元在場“打麻將”。余某則供稱，今年五月十五日開始租用單位經營“麻將”生意，每日傍晚五時至晚上九時開放予熟客打牌。警方以不法賭博將五人落案，移交檢察院跟進。,http://www.macaodaily.com/html/2024-07/23/content_1769946.htm,據調查所得，有人自今年五月起以月租八千五百港元租用單位，租出麻將檯供熟客“打牌”，警方將五人轉交檢察院跟進,女子 涉經營 麻將 檔法辦         【 本報 消息 】 中年 女子 經營 非法 麻將 檔 ， 治安警 日前 根據 舉報 到 慕拉士 大馬路 某 工廈 單位 調查 ， 期間 發現 包括 負責人 在 內 的 五名 男女 。 據 調查 所得 ， 有人 自 今年 五月 起以 月租 八千 五百 港元 租用 單位 ， 租出 麻將 檯 供 熟客 “ 打牌 ” ， 警方 將五人 轉交檢 察院 跟 進 。         涉案 女子 姓余 ， 三十多 歲 ， 澳門 居民 ， 無業 。         治安警 日前 接獲 舉報 ， 指 有人 在 慕拉士 大馬路 某 工廈 單位 非法 賭博及 經營 麻將 檔 ， 本月 十八日 傍晚 到 目標 單位 偵查 。 警員到 場後聽 到 “ 打牌 聲 ” ， 隨即 進入 單位 調查 ， 於 單位 內 發現 年齡 介乎 三十 至 六十 歲 的 三 男 一女 賭客 及余姓 女 負責人 。 在 現場 檢獲 一張 麻將 檯 、 兩副麻將 及 小量 現金 。         調查 期間 ， 四名 賭客 稱 透過 朋友 介紹 ， 支付 時租 五十 澳門元 在場 “ 打麻將 ” 。 余 某則 供稱 ， 今年 五月 十五日 開始 租用 單位 經營 “ 麻將 ” 生意 ， 每日 傍晚 五時 至 晚上 九時 開放予 熟客 打牌 。 警方 以 不法 賭博將 五人 落案 ， 移交 檢 察院 跟 進 。,2024-07-23
慕拉士社屋基本完工,供千六單位   裙樓設綜服大樓    慕拉士社屋基本完工    【本報消息】慕拉士社屋上蓋工程及裝修工程基本完工，公共建設局網站顯示上蓋工程於本月竣工，未來將提供共一千五百九十個一房一廳及兩房一廳單位，公共停車場共約八百個汽車及電單車泊位，地面層設巴士總站。另外，裙樓將設政府綜合服務大樓，預計八月竣工。    慕拉士大馬路公共房屋位於舊澳門發電廠土地，建造工程分為地基及上蓋兩部分，其中“基礎及地庫”工程造價五億多元，於二○一八年八月委託，受新冠疫情影響延期廿七個工作天，至二○二一年十二月臨時接收。    工程沒有超時    上蓋工程於二○二一年十二月委託，合約竣工期為今年六月。受疫情影響延誤四十三個工作天，最新竣工日期是今年七月。項目造價為十二億五千○六十萬元，據七日前更新的運輸工務範疇超過一億元工程的狀況，造價出現負增長百分之○點七，即較原預算減少。    工程沒有超時，進度理想。昨日所見，所有棚架已拆除，外牆飾面已全部裝修完成，並懸掛“望廈社屋——望信樓”及“望信樓公共停車場” 牌匾。慕拉士社屋住宅位於裙樓以上，分為三座塔樓，落成後提供一房一廳、兩房一廳單位共一千五百九十個。    預留空中走廊    政府今年三月表示，裙樓內將設慕拉士政府綜合服務中心，現正開展擴建工程，增設電子政務展示區及廿四小時自助服務區，預計於八月底竣工。當局早年提到，有意將現時黑沙環政府綜合服務大樓的服務遷至慕拉士公屋項目，因“黑綜”每年需支付不少租金。另外，社屋亦預留結構供日後與東北大馬路的空中走廊連接。,http://www.macaodaily.com/html/2024-07/23/content_1769920.htm,供千六單位   裙樓設綜服大樓    慕拉士社屋基本完工    【本報消息】慕拉士社屋上蓋工程及裝修工程基本完工，公共建設局網站顯示上蓋工程於本月竣工，未來將提供共一千五百九十個一房一廳及兩房一廳單位，公共停車場共約八百個汽車及電單車泊位，地面層設巴士總站,供千六 單位       裙樓 設 綜服 大樓         慕拉士 社屋 基本 完工         【 本報 消息 】 慕拉士 社屋 上 蓋 工程 及 裝修 工程 基本 完工 ， 公共 建設局 網站 顯示 上 蓋 工程 於 本月 竣工 ， 未來將 提供 共 一千五百 九十 個 一房 一廳 及 兩房 一廳 單位 ， 公共 停車 場共約 八百 個 汽車 及電 單車 泊位 ， 地面 層設 巴士 總站 。 另外 ， 裙樓 將設 政府 綜合 服務大樓 ， 預計 八月 竣工 。         慕拉士 大馬路 公共 房屋 位 於 舊 澳門 發電廠 土地 ， 建造 工程 分為 地基 及 上 蓋 兩 部分 ， 其中 “ 基礎 及 地庫 ” 工程 造價 五 億 多元 ， 於 二 ○ 一 八年 八月 委 託 ， 受新冠 疫情 影響 延期 廿七 個 工作 天 ， 至 二 ○ 二 一年 十二月 臨時 接收 。         工程 沒有 超時         上蓋 工程 於 二 ○ 二 一年 十二月 委 託 ， 合約 竣工 期為 今年 六月 。 受 疫情 影響 延誤 四十三 個 工作 天 ， 最新 竣工 日期 是 今年 七月 。 項目 造價 為 十二 億 五千 ○ 六十 萬元 ， 據 七日 前 更新 的 運輸 工務範疇 超過 一億元 工程 的 狀況 ， 造價出 現負 增長 百分之 ○ 點七 ， 即 較 原 預算 減少 。         工程 沒有 超時 ， 進度 理想 。 昨日 所見 ， 所有 棚架 已 拆除 ， 外牆 飾面 已 全部 裝修 完成 ， 並懸掛 “ 望廈 社屋 — — 望 信樓 ” 及 “ 望 信樓 公共 停車場 ”   牌匾 。 慕拉士 社屋 住宅 位 於 裙樓 以上 ， 分為 三座 塔樓 ， 落成 後 提供 一房 一廳 、 兩房 一廳 單位 共 一千五百 九十 個 。         預留 空中走廊         政府 今年 三月 表示 ， 裙樓 內 將設 慕拉士 政府 綜合 服務 中心 ， 現正 開展 擴建 工程 ， 增設電 子政 務 展示 區及 廿四 小時 自助 服務區 ， 預計 於 八月 底 竣工 。 當局 早年 提到 ， 有意 將現 時 黑沙 環 政府 綜合 服務大樓 的 服務遷 至 慕拉士 公屋 項目 ， 因 “ 黑綜 ” 每年 需 支付 不少 租金 。 另外 ， 社屋 亦 預留 結構 供 日 後 與 東 北大 馬 路 的 空中走廊 連接 。,2024-07-23
