Title,Content,Link,Summary,Preprocessed_Content,Date
機場擴建年底施工,料六載完成    年接待旅客可達千五萬人次    機場擴建年底施工    【本報消息】澳門國際機場專營股份有限公司(CAM)昨發新聞稿表示，得到中央政府及澳門特區政府大力支持，澳門國際機場於二四年十月三日正式獲土地批給用作填海擴建工程，預計二四年底前正式施工，三〇年下半年完工。這一工程啟動標誌着澳門民用航空業進入新發展里程。    十多年前規劃擴建    填海工程將在跑道人工島與滑行橋之間填土，以擴大停機坪容量和增設飛機停泊位及快速脫離道，並預留九十五米寬的水道。新設施將顯著提升客運大樓和通用航空的承載能力。    整個擴建工程預計二〇三〇年完成，屆時澳門國際機場的年旅客接待能力將達到一千五百萬人次，機場運營能力將獲全面提升。    新聞稿表示，隨着本澳旅遊業迅速增長及航空客運結構變化，為配合粵港澳大灣區的高質量發展，澳門國際機場需完善設施以應對日益增加的客運需求。早在二〇一〇年，特區政府民航局與澳門國際機場專營股份有限公司已啟動編制《澳門國際機場整體發展規劃》，一六年規劃獲特區政府批准。一七年向中央政府提出擴建申請，計劃分階段填海，並於二二年獲中央政府批准。    完成多項前期工作    用海申請獲批後，CAM分別與民航局、土地工務局、環境保護局、市政署、地圖繪製暨地籍局等多個政府部門緊密協調和聯繫，陸續開展工程顧問判給、土地使用批給、環境及防洪前期監測、工程計劃制訂、填海及機坪建造工程招標等前期準備工作。CAM至今已完成施工前的環境及防洪基線監測工作，並向相關政府部門及內地機構呈交監測報告。同時向當局提交“填海及機坪工程計劃”，並獲發可行意見。工程擬填海面積超過一百二十九公頃，CAM積極與政府相關部門協調，更新機場地界，同時把填海區域納入機場範圍，並修改土地批給合同，以配合澳門國際機場擴建工程。    增機泊位附屬設施    根據規劃，將分區有序開展施工，部分施工安排晚間進行，以降低影響機場日常營運。填海造陸後，機坪擴建施工將於二〇二六年上半年至二〇二八年下半年進行，期間將於二〇二七年建造兩條新滑行橋，建成後將於二〇二八年拆除現有滑行橋。整個填海工程預計二〇三〇年完成，屆時將適度增設各類型飛機停泊位及附屬設施，配合機場未來發展。    施工期間保障營運    在不停航施工背景下，澳門國際機場填海擴建工程面臨多重挑戰，安全管理至關重要。施工期間，機場將與各營運單位協調，妥善管理施工範圍和時間安排，最大程度確保現有航班正常運行，同時保障機場工作人員和旅客的安全。這些挑戰不僅考驗機場團隊的施工管理能力，也對機場的運營效率提出更高要求。在確保施工順利的同時，維持服務質量和航班準時率亦是機場必須面對的重要課題，澳門國際機場團隊將全力以赴，確保填海擴建工程有序開展。,http://www.macaodaily.com/html/2024-10/04/content_1785378.htm,料六載完成    年接待旅客可達千五萬人次    機場擴建年底施工    【本報消息】澳門國際機場專營股份有限公司(CAM)昨發新聞稿表示，得到中央政府及澳門特區政府大力支持，澳門國際機場於二四年十月三日正式獲土地批給用作填海擴建工程，預計二四年底前正式施工，三〇年下半年完工,料六載 完成         年 接待 旅客 可達 千五 萬 人次         機場 擴建 年底 施工         【 本報 消息 】 澳門 國際 機場 專營 股份 有限公司 ( CAM ) 昨發 新聞稿 表示 ， 得到 中央政府 及 澳門 特區 政府 大力支持 ， 澳門 國際 機場 於 二 四年 十月 三日 正式 獲 土地 批給 用作 填海 擴建 工程 ， 預計 二四 年底 前 正式 施工 ， 三 〇 年 下半年 完工 。 這一 工程 啟動 標誌 着 澳門 民用航空 業進入 新 發展 里程 。         十多年 前規劃 擴建         填海 工程 將在 跑道 人工 島與 滑行 橋之間 填土 ， 以 擴大停 機坪 容量 和 增設 飛機 停 泊位 及 快速 脫離 道 ， 並預 留 九 十五米 寬 的 水道 。 新設 施將 顯著 提升 客運大樓 和 通用 航空 的 承載 能力 。         整個 擴建 工程 預計 二 〇 三 〇 年 完成 ， 屆 時 澳門 國際 機場 的 年 旅客 接待 能力 將達 到 一千五百 萬 人次 ， 機場 運營 能力 將獲 全面 提升 。         新聞稿 表示 ， 隨着 本澳 旅遊業 迅速 增長 及 航空 客運 結構 變化 ， 為 配合 粵 港澳 大灣區 的 高質量 發展 ， 澳門 國際 機場 需 完善 設 施以 應對 日益 增加 的 客運 需求 。 早 在 二 〇 一 〇 年 ， 特區 政府 民航局 與 澳門 國際 機場 專營 股份 有限公司 已 啟動 編制 《 澳門 國際 機場 整體 發展 規劃 》 ， 一 六年 規劃 獲特區 政府 批准 。 一 七年 向 中央政府 提出 擴建 申請 ， 計劃 分階段 填海 ， 並於二 二年 獲 中央政府 批准 。         完成 多項 前期工作         用海 申請 獲批 後 ， CAM 分別 與 民航局 、 土地 工務局 、 環境 保護局 、 市政 署 、 地圖 繪 製 暨 地籍 局等 多個 政府 部門 緊密 協調 和 聯 繫 ， 陸續 開展 工程 顧問 判給 、 土地 使用 批給 、 環境 及 防洪 前期 監測 、 工程 計劃 制訂 、 填海 及 機坪 建造 工程 招標 等 前期 準備 工作 。 CAM 至今 已 完成 施工 前 的 環境 及 防洪 基線 監測 工作 ， 並向 相關 政府 部門 及 內 地 機構 呈交 監測 報告 。 同時 向 當局 提交 “ 填海 及 機坪 工程 計劃 ” ， 並獲發 可行 意見 。 工程 擬填 海面 積超過 一百二十 九公頃 ， CAM 積極 與 政府 相關 部門 協調 ， 更新 機場 地界 ， 同時 把 填海 區域 納入 機場 範圍 ， 並 修改 土地 批給 合同 ， 以 配合 澳門 國際 機場 擴建 工程 。         增機 泊位 附屬 設施         根據 規劃 ， 將分區 有序 開展 施工 ， 部分 施工 安排 晚間 進行 ， 以 降低 影響 機場 日常 營運 。 填海 造陸 後 ， 機坪 擴建 施工 將於二 〇 二 六年 上半年 至 二 〇 二 八年 下半年 進行 ， 期間將 於 二 〇 二七 年 建造 兩條 新 滑行 橋 ， 建成 後將 於 二 〇 二 八年 拆除 現有 滑行 橋 。 整個 填海 工程 預計 二 〇 三 〇 年 完成 ， 屆 時將 適度 增設 各類 型 飛機 停 泊位 及 附屬 設施 ， 配合 機場 未來 發展 。         施工期 間 保障 營運         在 不 停航 施工 背景 下 ， 澳門 國際 機場 填海 擴建 工程 面臨 多重 挑戰 ， 安全 管理 至關 重要 。 施工期 間 ， 機場將 與 各營運 單位 協調 ， 妥善 管理 施工 範圍 和 時間 安排 ， 最大 程度 確保現 有 航班 正常 運行 ， 同時 保障 機場 工作 人員 和 旅客 的 安全 。 這些 挑戰 不僅 考驗 機場 團隊 的 施工 管理 能力 ， 也 對 機場 的 運營 效率 提出 更高 要求 。 在 確保 施工 順利 的 同時 ， 維持 服務質量 和 航班 準時率 亦 是 機場 必須 面 對 的 重要 課題 ， 澳門 國際 機場 團隊將 全力以赴 ， 確保 填海 擴建 工程 有序 開展 。,2024-10-04
AB區車橋造價逾廿二億,公建局分四年支付    AB區車橋造價逾廿二億    【本報消息】根據特區公報公佈的跨年度負擔明細，新城A、B區行車天橋的設計連建造費用超過二十二億元。公建局在今年起的四年內，分期向承建公司支付相關款項。此外，已完成主體工程並於今年五月由公建局臨時接收的輕軌石排灣線，尚有一項車站擋雨設施優化工程，造價逾二千一百萬元。    A區連科學館圓形地    根據公建局網頁資料，新城A、B區行車天橋的設計連建造工程由中國建築工程（香港）有限公司澳門分公司／中國建築工程（澳門）有限公司／保利長大工程有限公司澳門分公司合作經營中標。造價爲廿一億八千萬澳門元，工期爲九百個工作天。連同工程監測等其他判給，總造價超過廿二億元。    該天橋位於澳門半島與新城A區之間，西接科學館圓形地和孫逸仙大馬路，向東穿越友誼大橋和現有航道，終點在新城A區並與澳門大橋互通。針對早前有意見質疑天橋可能影響世遺景觀，公建局於官網澄清，此天橋並非樓宇興建項目，故不適用第八三／二〇〇八號行政長官批示的規範。該地段亦不屬於《文化遺產保護法》及相關行政法規規範的被評定或待評定不動產，也不在緩衝區範圍內。    石排灣輕軌站加雨擋    此外，輕軌石排灣線尚有一項車站擋雨設施優化工程，仍由原施工方中國路橋工程公司負責。公建局將於明年支付該項工程費用，總額超過二千一百七十九萬元，但官網未見相關資料。    輕軌石排灣線全長約一點六公里，途經路氹連貫公路、石排灣圓形地及石排灣馬路，設有“石排灣”及“協和醫院”兩個車站，主體建造工程費用九億三千多萬元。該線早前已測試，配合澳門協和醫院正式開業，協和醫院站早於九月一日率先啓用，方便居民前往該醫院。,http://www.macaodaily.com/html/2024-10/04/content_1785379.htm,公建局分四年支付    AB區車橋造價逾廿二億    【本報消息】根據特區公報公佈的跨年度負擔明細，新城A、B區行車天橋的設計連建造費用超過二十二億元,公建局 分 四年 支付         AB 區車橋 造價 逾 廿二 億         【 本報 消息 】 根據 特區 公報 公 佈 的 跨年度 負擔 明細 ， 新城 A 、 B 區行車 天橋 的 設計連 建造 費用 超過 二十二 億元 。 公建局 在 今年 起 的 四年 內 ， 分期 向 承建 公司 支付 相關款 項 。 此外 ， 已 完成 主體 工程 並 於 今年 五月 由公建局 臨時 接收 的 輕 軌石 排灣線 ， 尚有 一項 車站 擋 雨 設施 優化 工程 ， 造價 逾 二千 一百 萬元 。         A 區連科 學館 圓形 地         根據 公建局 網頁 資料 ， 新城 A 、 B 區行車 天橋 的 設計連 建造 工程 由 中國 建築 工程 （ 香港 ） 有限公司 澳門 分公司 ／ 中國 建築 工程 （ 澳門 ） 有限公司 ／ 保利 長 大 工程 有限公司 澳門 分公司 合作 經營 中標 。 造價 爲 廿一 億 八千 萬澳門 元 ， 工期 爲 九百 個 工作 天 。 連同 工程 監測 等 其他 判給 ， 總造 價超過 廿二 億元 。         該 天橋位 於 澳門 半島 與 新城 A 區之間 ， 西接 科學館 圓形 地和孫 逸仙 大馬路 ， 向東 穿越 友誼 大橋 和 現有 航道 ， 終點 在 新城 A 區並 與 澳門 大橋 互通 。 針對 早前 有意 見質疑 天橋 可能 影響 世 遺景觀 ， 公建局 於 官網 澄清 ， 此天橋 並非樓 宇興建 項目 ， 故 不 適用 第八 三 ／ 二 〇 〇 八號 行政 長 官 批示 的 規範 。 該 地段 亦 不屬 於 《 文化 遺產 保護法 》 及 相關 行政法 規規範 的 被 評定 或 待 評定 不動產 ， 也 不 在 緩衝區 範圍 內 。         石排灣 輕軌 站 加雨擋         此外 ， 輕軌 石 排灣線 尚有 一項 車站 擋 雨 設施 優化 工程 ， 仍由原 施工方 中國路橋 工程 公司 負責 。 公建 局將 於 明年 支付 該項 工程 費用 ， 總額 超過 二千 一百七十 九萬元 ， 但 官網 未見 相關 資料 。         輕軌 石 排灣線 全長 約 一點 六公里 ， 途經路 氹 連貫 公路 、 石排灣 圓形 地及 石 排灣馬路 ， 設有 “ 石排灣 ” 及 “ 協和醫院 ” 兩個 車站 ， 主體 建造 工程 費用 九 億 三千多 萬元 。 該線 早前 已測試 ， 配合 澳門協 和 醫院 正式 開業 ， 協和醫院 站 早 於 九月 一日 率先 啓 用 ， 方便 居民 前往 該 醫院 。,2024-10-04
機場擴建後總面積增逾八成,新獲批廿六幅共148萬多平米塡海地    機場擴建後總面積增逾八成    【本報消息】特區公報昨日刊登運輸工務司司長批示，修改機場土地的批給合同，土地的總面積改為三百二十五萬多平方米，用作保留及擴建現有的澳門國際機場。    三幅地塊歸還國家    運輸工務司司長批示，修改一幅以租賃方式批出、面積一百七十七萬九千二百五十四平方米，位於氹仔島，鄰近偉龍馬路，其上建有澳門國際機場，標示於物業登記局B106A冊第一百四十三頁背頁第22035號的土地批給。    基於上述修改內容涉及批給標的，尤其是土地的面積及邊界，因此將上述土地的一幅面積四十七平方米的地塊歸還國家，以納入其公產，作為公共街道。及將兩幅面積分別為八千五百二十六及六千八百六十平方米的地塊歸還國家以納入國家海域。同時以租賃制度及豁免公開招標方式批出八幅從填海取得、總面積一百三十九萬八千八百二十五平方米，未在物業登記局標示的地塊，以及以同一制度及豁免公開招標方式批出十八幅從填海取得、總面積八萬九千九百三十八平方米，未在物業登記局標示的地塊。    土地租金五年調整    基於以上數款所指的修改，土地的總面積改為三百二十五萬二千五百八十四平方米，用作保留及擴建現有的澳門國際機場。批示即時生效。    合同列明，土地租賃續期十年至二〇三五年十二月十三日。租金方面，由本批示公佈之日起至二〇三二年十二月三十日，總金額為五百三十三萬三千八百一十元，由二〇三三年一月一日起總金額為八百一十三萬一千四百六十元，租金可每五年調整一次。    十年完成塡海平整    利用期間方面，機場專營公司須於二〇三二年十二月三十一日前執行填海工程。二〇三三年十二月三十一日前執行土地平整工程。    特別稅捐方面，土地批給由二〇二五年十二月十四日起續期十年，繳付特別稅捐，金額為四千四百四十八萬一千三百五十元。,http://www.macaodaily.com/html/2024-10/04/content_1785380.htm,三幅地塊歸還國家    運輸工務司司長批示，修改一幅以租賃方式批出、面積一百七十七萬九千二百五十四平方米，位於氹仔島，鄰近偉龍馬路，其上建有澳門國際機場，標示於物業登記局B106A冊第一百四十三頁背頁第22035號的土地批給,新 獲批 廿六 幅共 148 萬多 平米 塡 海地         機場 擴建後總面 積增 逾 八成         【 本報 消息 】 特區 公報 昨日 刊登 運輸 工務司 司長 批示 ， 修改 機場 土地 的 批給 合同 ， 土地 的 總面積 改為 三百 二十五 萬 多平方米 ， 用作 保留 及 擴建現 有 的 澳門 國際 機場 。         三幅 地塊 歸 還國家         運輸 工務司 司長 批示 ， 修改 一幅 以租賃 方式 批出 、 面積 一百七十 七萬 九千 二百五十 四平方米 ， 位 於 氹 仔島 ， 鄰近 偉龍馬路 ， 其上 建有 澳門 國際 機場 ， 標示 於 物業 登記局 B106A 冊第 一百四十 三頁 背頁 第 22035 號的 土地 批給 。         基 於 上述 修改 內容 涉及 批給標 的 ， 尤其 是 土地 的 面積 及 邊界 ， 因此 將 上述 土地 的 一幅 面積 四十七 平方米 的 地塊 歸 還國家 ， 以納入 其公產 ， 作為 公共 街道 。 及將 兩 幅面 積分別 為 八千 五百 二十六 及 六 千八百 六十 平方米 的 地塊 歸 還國家 以納入 國家 海域 。 同時 以租賃 制度 及 豁免 公開 招標 方式 批出 八幅 從 填海 取得 、 總面積 一百三十 九萬八 千八百 二十五 平方米 ， 未 在 物業 登記局 標示 的 地塊 ， 以及 以 同一 制度 及 豁免 公開 招標 方式 批出 十八 幅 從 填海 取得 、 總面 積八萬 九千 九百 三十八 平方米 ， 未 在 物業 登記局 標示 的 地塊 。         土地 租金 五年 調整         基 於 以上 數款 所指 的 修改 ， 土地 的 總面積 改為 三百 二十五 萬 二千五百 八十四 平方米 ， 用作 保留 及 擴建現 有 的 澳門 國際 機場 。 批示 即時 生效 。         合同 列明 ， 土地 租賃 續期 十年 至 二 〇 三五年 十二月 十三日 。 租金 方面 ， 由本 批示 公 佈 之日起 至 二 〇 三二年 十二月 三十日 ， 總金額 為 五百三十 三萬 三千八百 一 十元 ， 由 二 〇 三 三年 一月 一日 起 總金額 為 八百 一十三 萬 一千四百 六十元 ， 租金 可 每 五年 調整 一次 。         十年 完成 塡 海 平整         利用 期間 方面 ， 機場 專營 公司 須 於 二 〇 三二年 十二月 三十一日 前 執行 填海 工程 。 二 〇 三 三年 十二月 三十一日 前 執行 土地平整 工程 。         特別稅 捐 方面 ， 土地 批給 由 二 〇 二 五年 十二月 十四日 起續期 十年 ， 繳付 特別稅 捐 ， 金額 為 四千 四百 四十八 萬 一千三百 五十元 。,2024-10-04
昨十七萬客遊澳歷史新高,昨十七萬客遊澳歷史新高    國慶假單日紀錄兩連破    【本報消息】旅客大軍紛至沓來，昨國慶節假期第三日，中區人潮擁擠，大三巴街實施人潮管制措施，確保人車通行安全。警方公佈，昨全日逾七十二萬人次進出本澳，其中，出入境旅客三十四萬四千人次，入境旅客約有十七萬四千人次，均較前日（二日）為高，並超過今年八月廿四日入境旅客十六萬六千五百多人次的單日最高客流量。    另據旅遊局昨日上午公佈，澳門國慶節假期客況理想，本月二日入境旅客達十六點六一萬人次，超過二○一九年十月五日十六點二一萬人次的最高單日紀錄，成為有正式統計數據以來國慶假期旅客的最高單日。結合治安警今日凌晨的初步數據，國慶假期旅客的最高單日客流量實現了兩連破（十月二日、三日），這一兩天會否持續刷新紀錄，值得留意。    統計暨普查局數據顯示，之前的國慶假期頭三位單日最高紀錄均出現於二○一九年，依次是十月五日（十六點二一萬）、十月三日（十六點一六萬）、以及十月二日（十五點九三萬）。    大三巴人潮管制    昨日多個旅遊景點人氣暢旺，中區人潮擁擠，治安警於下午二時四十五分實施人潮管制措施，至下午五時十五分取消，期間大三巴街行人只可單向上行前往牌坊，並取道周邊街巷離開；關前後街的行車道亦同時封閉，途經車輛繞道而行。昨晚近八時，橫琴口岸澳門口岸區離境通道一度人流擁擠，近兩個半小時後恢復正常。    琴岸通關破十萬    橫琴口岸澳門口岸區出入境事務站昨刷新單日出入境總數紀錄，共有十萬三千五百六十三人次，是該出入境事務站首次突破十萬人次的單日出入境紀錄。    為有效應對十 · 一國慶假期大幅增加的出入境客流量，治安警察局已做好相關預案和警力部署，並與珠海邊檢總站加強聯動協調，雙方人員共同堅守崗位，在客流高峰時段有序疏導通關人士，確保口岸通關安全與順暢。,http://www.macaodaily.com/html/2024-10/04/content_1785461.htm,另據旅遊局昨日上午公佈，澳門國慶節假期客況理想，本月二日入境旅客達十六點六一萬人次，超過二○一九年十月五日十六點二一萬人次的最高單日紀錄，成為有正式統計數據以來國慶假期旅客的最高單日,昨 十七 萬客 遊澳 歷史 新高         國慶假 單日 紀錄 兩連破         【 本報 消息 】 旅客 大軍紛 至沓來 ， 昨國慶節 假期 第三日 ， 中區 人潮 擁擠 ， 大三巴 街實施 人潮 管制 措施 ， 確 保人 車 通行 安全 。 警方 公 佈 ， 昨 全日 逾 七十二 萬 人次 進出 本澳 ， 其中 ， 出入境 旅客 三十四 萬 四千人 次 ， 入境 旅客 約 有 十七 萬 四千人 次 ， 均 較 前日 （ 二日 ） 為 高 ， 並超過 今年 八月 廿四日 入境 旅客 十六 萬 六千五百 多人次 的 單日 最高 客流量 。         另據 旅遊局 昨日 上午 公 佈 ， 澳門 國慶節 假期 客況 理想 ， 本月 二日 入境 旅客 達 十六 點 六一 萬 人次 ， 超過 二 ○ 一 九年 十月 五日 十六 點二一萬 人次 的 最高 單日 紀錄 ， 成為 有 正式 統計 數據 以來 國慶 假期 旅客 的 最高 單日 。 結合 治安警 今日 凌晨 的 初步 數據 ， 國慶 假期 旅客 的 最高 單日 客流量 實現 了 兩連破 （ 十月 二日 、 三日 ） ， 這一 兩天會 否持續 刷新 紀錄 ， 值得 留意 。         統計 暨 普查局 數據 顯示 ， 之前 的 國慶 假期 頭 三位 單日 最高 紀錄 均 出現 於 二 ○ 一 九年 ， 依次 是 十月 五日 （ 十六 點二一萬 ） 、 十月 三日 （ 十六 點一六萬 ） 、 以及 十月 二日 （ 十五 點 九三 萬 ） 。         大三巴 人潮 管制         昨日 多個 旅遊景點 人氣 暢旺 ， 中區 人潮 擁擠 ， 治安警 於 下午 二時 四十五分 實施 人潮 管制 措施 ， 至 下午 五時 十五分 取消 ， 期間 大三巴 街 行人 只 可單 向 上行 前往 牌坊 ， 並 取道 周邊 街巷 離開 ； 關前 後 街 的 行車 道 亦 同時 封閉 ， 途經 車輛 繞 道 而行 。 昨晚 近八時 ， 橫琴 口岸 澳門 口岸 區離境 通道 一度 人流 擁擠 ， 近 兩個 半小時 後 恢 復 正常 。         琴岸 通關 破十萬         橫琴 口岸 澳門 口岸 區 出入境 事務站 昨 刷新 單日 出入境 總數 紀錄 ， 共有 十萬 三千五百 六十三 人次 ， 是 該 出入境 事務站 首次 突破 十萬 人次 的 單日 出入境 紀錄 。         為 有效 應對 十   ·   一國慶 假期 大幅 增加 的 出入境 客流量 ， 治安 警察局 已 做好 相關 預案 和 警力 部署 ， 並與 珠海 邊檢總站 加強 聯動 協調 ， 雙方人員 共同 堅守崗位 ， 在 客流 高峰 時段 有序 疏導 通關 人士 ， 確保 口岸 通關 安全 與 順暢 。,2024-10-04
