Title,Content,Link,Summary,Preprocessed_Content,Date
桃李競花妍戲曲展演今響鑼,桃李競花妍戲曲展演今響鑼    由澳門戲曲文化藝術協會主辦，澳門音樂曲藝粵劇總會協辦，澳門文化發展基金、霍英東基金會贊助的“桃李競花妍戲曲展演”，今日下午二時假永樂戲院上演。    演出內容有：一、折子戲《無情寶劍有情天》（陳卓濱、王寶安）；二、《高山流水萬古情》（歐陽日華、何少芬）；三、《十繡香囊》（林錦波、甘連崧）；四、折子戲《幽會小周后》（龍振飛、譚燕霞）；五、《夢會太湖》（林錦波、甘連崧）；六、折子戲《潞安洲》（龍振飛、譚燕霞）；七、《秋夜賦》（胡棟榮）；八、《遊園驚夢》（龍振飛、甘連崧）。,http://www.macaodaily.com/html/2024-04/24/content_1750275.htm,八、《遊園驚夢》（龍振飛、甘連崧）,桃李 競花妍 戲曲 展演 今響鑼         由 澳門 戲曲 文化 藝術 協會 主辦 ， 澳門 音樂曲 藝粵劇 總會 協辦 ， 澳門 文化 發展 基金 、 霍英東 基金 會 贊助 的 “ 桃李 競花妍 戲曲 展演 ” ， 今日 下午 二時 假永樂 戲院 上演 。         演出 內容 有 ： 一 、 折子 戲 《 無情 寶劍 有情 天 》 （ 陳 卓濱 、 王寶安 ） ； 二 、 《 高山流水 萬古情 》 （ 歐陽 日華 、 何少芬 ） ； 三 、 《 十繡 香囊 》 （ 林錦波 、 甘連 崧 ） ； 四 、 折子 戲 《 幽會 小 周后 》 （ 龍振飛 、 譚燕霞 ） ； 五 、 《 夢會 太湖 》 （ 林錦波 、 甘連 崧 ） ； 六 、 折子 戲 《 潞安 洲 》 （ 龍振飛 、 譚燕霞 ） ； 七 、 《 秋夜 賦 》 （ 胡棟榮 ） ； 八 、 《 遊園 驚夢 》 （ 龍振飛 、 甘連 崧 ） 。,2024-04-24
《澳門人》介紹《我們的扮演角色遊戲》,《澳門人》介紹《我們的扮演角色遊戲》    《我們的扮演角色遊戲》是澳門演藝學院戲劇學校表演入門課程的實習演出，今年演出總共有三個劇目，分別是《笑看風雲》、《安蒂岡妮》及《代理人》。通過參與演出，學生能夠進一步提升表演技巧，深化對戲劇藝術的理解，並增強自信心與表達能力。澳視澳門（91台）今晚九時播出的《澳門人 · 澳門事》，將與觀眾分享一眾學生的參演心得及精彩演出。    澳門演藝學院戲劇學校表演入門課程，分別由十一歲至十三歲（少年班）及十四歲至十七歲（青少年班）組成，通過劇場遊戲及練習、肢體與聲音開發、即興創作及戲劇欣賞等，培養學生的想像力和觀察力，令他們對劇場表演具備初步認識。,http://www.macaodaily.com/html/2024-04/24/content_1750292.htm,澳門演藝學院戲劇學校表演入門課程，分別由十一歲至十三歲（少年班）及十四歲至十七歲（青少年班）組成，通過劇場遊戲及練習、肢體與聲音開發、即興創作及戲劇欣賞等，培養學生的想像力和觀察力，令他們對劇場表演具備初步認識,《 澳門 人 》 介紹 《 我們 的 扮演 角色 遊戲 》         《 我們 的 扮演 角色 遊戲 》 是 澳門 演藝學院 戲劇 學校 表演 入門 課程 的 實習 演出 ， 今年 演出 總 共有 三個 劇目 ， 分別 是 《 笑 看風 雲 》 、 《 安蒂岡妮 》 及 《 代理人 》 。 通過 參 與 演出 ， 學生 能夠 進 一步 提升 表演 技巧 ， 深化 對 戲劇 藝術 的 理解 ， 並增強 自信心 與 表達 能力 。 澳視 澳門 （ 91 台 ） 今晚 九時 播出 的 《 澳門 人   ·   澳門事 》 ， 將與 觀眾 分享 一眾 學生 的 參演 心得 及 精彩演出 。         澳門 演藝學院 戲劇 學校 表演 入門 課程 ， 分別 由 十一 歲 至 十三 歲 （ 少年班 ） 及 十四 歲 至 十七 歲 （ 青少年 班 ） 組成 ， 通過 劇場 遊戲 及練習 、 肢體 與 聲音 開發 、 即興 創作 及 戲劇 欣賞 等 ， 培養 學生 的 想像力 和 觀察力 ， 令 他們 對 劇場 表演 具備 初步 認識 。,2024-04-24
澳視澳門播《一個劇本的誕生》,澳視澳門播《一個劇本的誕生》    澳視澳門（91台）今、明兩晚八時播《一個劇本的誕生》，有星級導師黃百鳴分享數十年創作經驗。節目設有多個重播時間，包括澳視澳門每集首播後翌日凌晨一時、澳門-MACAU衛星頻道上午十時、澳門綜藝下午三時二十分。    黃百鳴是香港資深影視製作人，參與電影創作近半個世紀，代表作多不勝數，《最佳拍檔》、《開心鬼》、《八星報喜》、《家有囍事》、《葉問》將香港電影帶進一個又一個的高潮。在一連兩晚節目中，黃百鳴除會分享半世紀電影歷程當中，究竟如何創作劇本，他還會將心得與經驗與學員分享。此外，黃百鳴更會講到劇本的市場價值，以及香港電影黃金年代，一些鮮為人知的故事，觀眾不容錯過。,http://www.macaodaily.com/html/2024-04/24/content_1750294.htm,黃百鳴是香港資深影視製作人，參與電影創作近半個世紀，代表作多不勝數，《最佳拍檔》、《開心鬼》、《八星報喜》、《家有囍事》、《葉問》將香港電影帶進一個又一個的高潮,澳視 澳門播 《 一個 劇本 的 誕生 》         澳視 澳門 （ 91 台 ） 今 、 明兩晚 八時播 《 一個 劇本 的 誕生 》 ， 有星級 導師 黃 百鳴 分享 數 十年 創作 經驗 。 節目 設有 多個 重播 時間 ， 包括 澳視 澳門 每集 首播 後 翌日 凌晨 一時 、 澳門 - MACAU 衛星 頻道 上午 十時 、 澳門 綜藝 下午 三時 二十分 。         黃 百鳴 是 香港 資深影 視 製 作 人 ， 參與 電影 創作 近半個 世紀 ， 代表作 多不勝數 ， 《 最佳 拍檔 》 、 《 開心 鬼 》 、 《 八星 報喜 》 、 《 家有 囍 事 》 、 《 葉問 》 將 香港 電影帶 進一個 又 一個 的 高潮 。 在 一連 兩晚 節目 中 ， 黃 百鳴 除會 分享 半世 紀電影 歷程 當中 ， 究竟 如何 創作 劇本 ， 他 還會將 心得 與 經驗 與 學員 分享 。 此外 ， 黃 百鳴 更會 講到 劇本 的 市場 價值 ， 以及 香港 電影 黃 金 年代 ， 一些 鮮為 人知 的 故事 ， 觀眾 不容 錯過 。,2024-04-24
南方歌舞團禪演“盜夢空間”,南方歌舞團禪演“盜夢空間”    南方歌舞團新作——舞蹈劇場《瞬息》，近日在佛山大劇院展演成功，這是現代舞蹈劇場新形式的大膽探索，是“軟科幻”融入舞蹈藝術的先鋒實踐。    舞蹈劇場《瞬息》集結了一眾年輕且富有國際化視野的舞台藝術菁英。在韓國首爾國際大賽、第十三屆全國舞蹈展演等國內外賽事中屢獲大獎的青年舞蹈家王培先，與創作過《羅刹國》、《活着》、《回廊亭殺人事件》等舞台佳作的中國話劇院演員、導演汪玥共同執導；被盛讚為“中國古典舞教科書”的國家二級演員蘇海陸，憑《與妻書》斬獲中國舞蹈最高獎“荷花獎”金獎的南方歌舞團首席演員金超，兩位優秀青年舞者強強合作、領銜主演。還有頂尖製作團隊用極致舞美解鎖震撼視聽，帶領觀眾走進多時空穿越的沉浸式體驗之旅。    我和我，在我們相遇的那一刻，如時間長流中的無數塵埃一般，陡然爆炸，散落四方，卻又在某一個瞬間，相互呼喚，不期而遇。宇宙中，我們無關緊要；時間裡，我們微不足道。我們在各自的空間裡，毫不相干，直到時間碰撞，瞬息之間，宇宙融為一點，我們都在裡面。不，只剩下我和……我。    舞蹈劇場《瞬息》講述了一個男人在不同時空中迷失自己，又終於和自己相逢的故事，用身體刻畫了過去和未來交錯的神秘畫面，用舞蹈演繹了平行宇宙間的穿梭旅程。劇中未來科技先鋒登場，當冰冷的機器與舞者炙熱的肉體相逢，如同冰與火之歌般劇烈碰撞。不同時空在同一個舞台上瞬間變換，夢幻開啟國內舞劇新紀元。    以“平行宇宙”為創作概念的影視劇和文學作品數不勝數，然而在舞台藝術創作領域卻尤為罕見。舞蹈劇場《瞬息》以突破性的創新嘗試，拓寬創作邊界，探索舞蹈藝術的更多可能。蘇海陸、金超雙男主角實力搭檔，以極致肢體表達演繹舞蹈版“盜夢空間”。,http://www.macaodaily.com/html/2024-04/24/content_1750296.htm,南方歌舞團禪演“盜夢空間”    南方歌舞團新作——舞蹈劇場《瞬息》，近日在佛山大劇院展演成功，這是現代舞蹈劇場新形式的大膽探索，是“軟科幻”融入舞蹈藝術的先鋒實踐,南方 歌舞 團禪演 “ 盜夢空間 ”         南方 歌舞 團 新作 — — 舞蹈 劇場 《 瞬息 》 ， 近日 在 佛山 大劇院 展演 成功 ， 這是 現代 舞蹈 劇場 新 形式 的 大膽 探索 ， 是 “ 軟 科幻 ” 融入 舞蹈 藝術 的 先鋒 實踐 。         舞蹈 劇場 《 瞬息 》 集結 了 一眾 年 輕且 富有 國際化 視野 的 舞台 藝術 菁英 。 在 韓國 首爾國際 大賽 、 第十三 屆 全國 舞蹈 展演 等 國內 外賽 事 中 屢 獲大獎 的 青年 舞蹈家 王培先 ， 與 創作過 《 羅 刹國 》 、 《 活着 》 、 《 回廊 亭 殺 人 事件 》 等 舞台 佳作 的 中國話 劇院 演員 、 導演 汪玥 共同 執導 ； 被 盛 讚 為 “ 中國 古典舞 教科 書 ” 的 國家二級 演員 蘇海陸 ， 憑 《 與 妻書 》 斬 獲中國 舞蹈 最高 獎 “ 荷花 獎 ” 金獎 的 南方 歌舞 團 首席 演員金超 ， 兩位 優秀 青年 舞者 強強 合作 、 領銜 主演 。 還有 頂 尖 製 作 團 隊 用 極 致 舞美 解鎖 震撼 視聽 ， 帶領 觀眾 走 進多 時空 穿越 的 沉浸 式 體驗 之 旅 。         我 和 我 ， 在 我們 相遇 的 那一刻 ， 如時間 長 流中 的 無數 塵埃 一般 ， 陡然 爆炸 ， 散落 四方 ， 卻 又 在 某 一個 瞬間 ， 相互 呼喚 ， 不期而遇 。 宇宙 中 ， 我們 無關 緊要 ； 時間裡 ， 我們 微不足道 。 我們 在 各自 的 空間裡 ， 毫不相干 ， 直到 時間 碰撞 ， 瞬息 之間 ， 宇宙 融為 一點 ， 我們 都 在 裡面 。 不 ， 只 剩下 我 和 … … 我 。         舞蹈 劇場 《 瞬息 》 講述 了 一個 男人 在 不同 時 空中 迷失 自己 ， 又終 於 和 自己 相逢 的 故事 ， 用身 體刻畫 了 過去 和 未來 交錯 的 神秘 畫面 ， 用 舞蹈 演繹 了 平行 宇宙 間 的 穿梭 旅程 。 劇中 未來 科技 先鋒 登場 ， 當 冰冷 的 機器 與 舞者 炙熱 的 肉體 相逢 ， 如同 冰 與 火 之 歌般 劇烈 碰撞 。 不同 時空 在 同一 個 舞台 上瞬間 變換 ， 夢幻開 啟國內 舞劇 新紀元 。         以 “ 平行 宇宙 ” 為 創作 概念 的 影視劇 和文 學 作品 數不勝數 ， 然而 在 舞台 藝術 創作 領域 卻 尤為 罕見 。 舞蹈 劇場 《 瞬息 》 以 突破性 的 創新嘗試 ， 拓寬 創作 邊界 ， 探索 舞蹈 藝術 的 更 多 可能 。 蘇海陸 、 金超雙 男主角 實力 搭 檔 ， 以極 致肢 體表達 演繹 舞蹈 版 “ 盜夢空間 ” 。,2024-04-24
絲蓮迪安：康復後重返舞台,受訪分享抗病歷程    絲蓮迪安：康復後重返舞台    五十六歲的國際巨星絲蓮迪安(Celine Dion)近日接受雜誌《Vogue》法國版的訪問兼榮登封面，以黑白色調拍攝了頗為性感的靚相，網民都認為這代表她好快重返演藝圈。絲蓮也罕見地受訪，公開講述了她與僵人綜合症的鬥爭。    二二年自爆患病，絲蓮分享了她如何每天處理疾病，她承認自己一天接一天地接受治療，並且正在學習如何應對那些症狀。當被問及她近況如何時，她回答說：“我很好，但每天都有好多應對疾病的工作要做，工作量都很大，我會一天一天地服用它！”在解釋她如何控制病情時，她再解釋道：“我每周有五天接受運動、物理和聲音治療，我現在必須學會忍受它並停止質疑自己。”    在封面照片中，都可以隱約看到絲蓮是瘦到得返一棚骨，今年二月，絲蓮驚喜亮相格林美頒獎典禮，當天活動上身穿芥末黃色的外套，她受訪時也解釋穿外套的原因說：“穿上那件外套，讓我暫時避開那些小事細節，讓我感覺好多了。選擇衣着非常令人傷腦筋，但同時也是一種巨大的榮譽。”絲蓮稱當時見到粉絲、人群以及再次看到演藝界盛事，是非常開心快樂的，人都充滿活力。絲蓮還表示，身體準備好後一定會重現舞台，進行她最愛的現場演出，沒有任何事可以阻止這個想法。,http://www.macaodaily.com/html/2024-04/24/content_1750299.htm,受訪分享抗病歷程    絲蓮迪安：康復後重返舞台    五十六歲的國際巨星絲蓮迪安(Celine Dion)近日接受雜誌《Vogue》法國版的訪問兼榮登封面，以黑白色調拍攝了頗為性感的靚相，網民都認為這代表她好快重返演藝圈,受訪 分享 抗病 歷程         絲蓮 迪安 ： 康 復 後 重返 舞台         五十六 歲 的 國際 巨星 絲蓮 迪安 ( Celine   Dion ) 近日 接受 雜誌 《 Vogue 》 法國版 的 訪問 兼榮 登 封面 ， 以 黑 白色 調拍 攝 了 頗 為 性感 的 靚 相 ， 網民 都 認為 這 代表 她 好 快 重返 演藝圈 。 絲蓮 也 罕見 地 受訪 ， 公開 講述 了 她 與 僵人 綜合症 的 鬥爭 。         二 二年 自爆 患病 ， 絲蓮 分享 了 她 如何 每天 處理 疾病 ， 她 承認 自己 一天 接 一天 地 接受 治療 ， 並且 正在 學習 如何 應對 那些 症狀 。 當被 問及 她 近況 如何 時 ， 她 回答 說 ： “ 我 很 好 ， 但 每天 都 有 好多 應對 疾病 的 工作 要 做 ， 工作量 都 很大 ， 我會 一天 一天 地 服用 它 ！ ” 在 解釋 她 如何 控制 病情 時 ， 她 再 解釋 道 ： “ 我 每周 有 五天 接受 運動 、 物理 和 聲音 治療 ， 我現 在 必須 學會 忍受 它並 停止 質疑 自己 。 ”         在 封面 照片 中 ， 都 可以 隱約 看到 絲蓮 是 瘦 到 得 返 一棚 骨 ， 今年 二月 ， 絲蓮 驚喜 亮相 格林 美 頒獎 典禮 ， 當天 活動 上 身穿 芥末 黃 色 的 外套 ， 她 受訪 時 也 解釋 穿 外套 的 原因 說 ： “ 穿 上 那件 外套 ， 讓 我 暫時 避開 那些 小事 細節 ， 讓 我 感覺 好多 了 。 選擇 衣着 非常 令人 傷腦 筋 ， 但 同時 也 是 一種 巨大 的 榮譽 。 ” 絲蓮稱 當時 見 到 粉絲 、 人群 以及 再次 看到 演藝界 盛事 ， 是 非常 開心 快樂 的 ， 人 都 充滿 活力 。 絲蓮還 表示 ， 身體 準備 好 後 一定 會 重現 舞台 ， 進行 她 最愛的 現場 演出 ， 沒有 任何 事 可以 阻止 這個 想法 。,2024-04-24
Apink尹普美公開認愛放閃,Apink尹普美公開認愛放閃    韓國人氣女團Apink成員尹普美近期憑藉飾演《淚之女王》羅秘書一角備受關注，昨日又被傳和“黑眼必勝”成員宋周英穩定交往已經八年的消息。隨後，尹普美特別以手寫信的方式公開認愛：“未來也會像現在的尹普美一樣，以誠實積極的能量展現好的樣貌。”    宋周英比尹普美年紀大九歲，是High Up娛樂公司的音樂製作人，寫過許多首知名歌曲。Apink一六年發行的專輯《Pink Revolution》中的主打歌就是由“黑眼必勝”製作，二人也因此結緣，隔年四月開始秘密交往。消息傳出後，尹普美先對粉絲致歉，隨後表示因和宋周英合作多首歌而產生好感開始交往，還甜蜜騷恩愛：“與如此有智慧又英明的人交往，讓有很多不足之處又年幼的我變得更加成熟。”,http://www.macaodaily.com/html/2024-04/24/content_1750300.htm,消息傳出後，尹普美先對粉絲致歉，隨後表示因和宋周英合作多首歌而產生好感開始交往，還甜蜜騷恩愛：“與如此有智慧又英明的人交往，讓有很多不足之處又年幼的我變得更加成熟,Apink 尹普美公開 認愛放 閃         韓國 人氣 女團 Apink 成員 尹普美 近期 憑 藉 飾演 《 淚 之 女王 》 羅 秘書 一角 備受 關注 ， 昨日 又 被 傳 和 “ 黑眼 必勝 ” 成員宋 周英 穩定 交往 已經 八年 的 消息 。 隨後 ， 尹普 美特 別以 手 寫 信 的 方式 公開 認愛 ： “ 未來 也 會 像 現 在 的 尹普美 一樣 ， 以誠實 積極 的 能量 展現 好 的 樣貌 。 ”         宋周 英比 尹普美年 紀大九歲 ， 是 High   Up 娛樂 公司 的 音 樂 製 作 人 ， 寫 過許 多首 知名 歌曲 。 Apink 一 六年 發行 的 專輯 《 Pink   Revolution 》 中 的 主打 歌 就是 由 “ 黑眼 必勝 ” 製 作 ， 二人 也 因此 結緣 ， 隔年 四月 開始 秘密 交往 。 消息 傳出 後 ， 尹普美先 對 粉絲 致歉 ， 隨後 表示 因和宋 周英 合作 多 首歌 而產生 好感 開始 交往 ， 還 甜蜜 騷恩愛 ： “ 與 如此 有 智慧 又 英明 的 人 交往 ， 讓 有 很多 不足 之處 又 年幼 的 我 變得 更加 成熟 。 ”,2024-04-24
ILLIT粉絲名稱惹爭議,ILLIT粉絲名稱惹爭議    韓國知名娛樂公司HYBE推出的最新人氣女團ILLIT氣勢如虹，但也引起不少爭議，先是MV疑似性暗示，成員又被懷疑成績造假。日前，粉絲名稱又再引起眾怒，HYBE娛樂前日緊急發公告宣佈將重新命名。    上周ILLIT公佈粉絲名稱為“LILLY”，但與女團NMIXX成員Lily的韓文讀音完全一樣，引發粉絲間戰爭。隨後又公佈改成“LILLYs”，又撞上了大熱女團BlackPink成員Lisa粉絲名，又再惹怒Lisa的粉絲。    前日，ILLIT所屬經紀公司對外發表聲明：“公開的粉絲名是由各位粉絲參與後，在多個候補中選取，祈願能與ILLIT永遠相愛而選定。”隨後表示：“在公開粉絲名後，收到了來自各方的擔憂意見，決定重新挑選粉絲名。不會另行募集新名稱，將會從先前蒐集到的投稿中選擇，並在之後公告。”,http://www.macaodaily.com/html/2024-04/24/content_1750301.htm,ILLIT粉絲名稱惹爭議    韓國知名娛樂公司HYBE推出的最新人氣女團ILLIT氣勢如虹，但也引起不少爭議，先是MV疑似性暗示，成員又被懷疑成績造假,ILLIT 粉絲名 稱 惹 爭議         韓國 知名 娛樂 公司 HYBE 推出 的 最新 人氣 女團 ILLIT 氣勢 如虹 ， 但 也 引起 不少 爭議 ， 先是 MV 疑似 性 暗示 ， 成員 又 被 懷疑 成績 造假 。 日前 ， 粉絲名 稱 又 再 引起 眾怒 ， HYBE 娛樂 前日 緊急發 公告 宣 佈 將 重新命名 。         上周 ILLIT 公 佈 粉絲名 稱 為 “ LILLY ” ， 但 與 女團 NMIXX 成員 Lily 的 韓文 讀音 完全 一樣 ， 引發 粉絲間 戰爭 。 隨後又公 佈 改成 “ LILLYs ” ， 又 撞 上 了 大熱 女團 BlackPink 成員 Lisa 粉絲名 ， 又 再 惹怒 Lisa 的 粉絲 。         前日 ， ILLIT 所屬 經紀 公司 對外 發表聲明 ： “ 公開 的 粉絲名 是 由 各位 粉絲 參 與 後 ， 在 多個候 補中 選取 ， 祈願 能 與 ILLIT 永遠 相愛而 選定 。 ” 隨後 表示 ： “ 在 公開 粉絲名 後 ， 收到 了 來 自 各方 的 擔憂意 見 ， 決定 重新 挑選粉 絲名 。 不會 另行 募集 新名 稱 ， 將會 從 先前 蒐集 到 的 投稿 中選擇 ， 並在 之 後 公告 。 ”,2024-04-24
瑞貝爾威爾森自爆曾參加毒趴,受英王室成員邀請    瑞貝爾威爾森自爆曾參加毒趴    四十四歲澳洲女星瑞貝爾威爾森(Rebel Wilson)向來語不驚人誓不休，近日酸民睇完她的自傳《Rebel Rising》發現，瑞貝爾聲稱某名王室成員曾邀請她去美國某科技億萬富翁的家中，參加一場毒品狂歡派對。瑞貝爾沒有透露該成員的名字，但給了三個暗示。    瑞貝爾稱那人是男性，時間發生在一四年，他是“英國王位的第十五或第二十順位繼承人”，這樣看起來也不是經常曝光的成員。瑞貝爾笑言那是一個尋找男朋友以及見多識廣的絕佳機會，該派對以中世紀為主題，並在洛杉磯郊外的某個租用牧場舉行。,http://www.macaodaily.com/html/2024-04/24/content_1750302.htm,受英王室成員邀請    瑞貝爾威爾森自爆曾參加毒趴    四十四歲澳洲女星瑞貝爾威爾森(Rebel Wilson)向來語不驚人誓不休，近日酸民睇完她的自傳《Rebel Rising》發現，瑞貝爾聲稱某名王室成員曾邀請她去美國某科技億萬富翁的家中，參加一場毒品狂歡派對,受 英王室 成員 邀請         瑞貝爾 威爾森 自爆 曾 參加毒 趴         四十四 歲 澳洲 女星 瑞貝爾 威爾森 ( Rebel   Wilson ) 向 來語 不 驚人誓 不休 ， 近日 酸民 睇 完 她 的 自傳 《 Rebel   Rising 》 發現 ， 瑞貝爾聲 稱 某名 王室 成員 曾 邀 請 她 去 美國 某 科技 億萬 富翁 的 家中 ， 參加 一場 毒品 狂歡 派 對 。 瑞貝爾 沒有 透露 該 成員 的 名字 ， 但給 了 三個 暗示 。         瑞貝爾稱 那 人 是 男性 ， 時間 發生 在 一 四年 ， 他 是 “ 英國 王位 的 第十五 或 第二十 順位 繼承人 ” ， 這樣 看 起來 也 不是 經常 曝光 的 成員 。 瑞貝爾笑 言 那 是 一個 尋找 男朋友 以及 見 多識廣 的 絕佳 機會 ， 該 派 對 以 中世紀 為 主題 ， 並在 洛杉磯 郊外 的 某個 租用 牧場 舉行 。,2024-04-24
賴恩高斯寧認老婆係英雄,賴恩高斯寧認老婆係英雄    四十三歲的荷里活型男賴恩高斯寧(Ryan Gosling)近年在圈內佳作好多，讓他無後顧之憂的就是五十歲的《情場絕橋王》女星伊娃文迪絲(Eva Mendes)這位賢內助。賴恩日前接受雜誌《Men's Health》訪問時，直認伊娃就是他的人生英雄之一，沒有她總是缺少了甚麼。    伊娃在十年前的電影《Lost River》後，已經停掉了演藝事業，安心為賴恩養育兩名女兒，九歲的Esmeralda及七歲的Amada。賴恩笑稱他最愛為家人煮食，摩洛哥雞就是其中一道拿手好菜。,http://www.macaodaily.com/html/2024-04/24/content_1750303.htm,賴恩高斯寧認老婆係英雄    四十三歲的荷里活型男賴恩高斯寧(Ryan Gosling)近年在圈內佳作好多，讓他無後顧之憂的就是五十歲的《情場絕橋王》女星伊娃文迪絲(Eva Mendes)這位賢內助,賴恩 高斯 寧認 老婆 係 英雄         四十三 歲 的 荷里活 型 男賴恩 高斯 寧 ( Ryan   Gosling ) 近年 在 圈 內 佳作 好多 ， 讓 他 無後顧 之 憂 的 就是 五十 歲 的 《 情場 絕橋 王 》 女星 伊娃 文迪絲 ( Eva   Mendes ) 這位 賢 內助 。 賴恩 日前 接受 雜誌 《 Men ' s   Health 》 訪問 時 ， 直認 伊娃 就是 他 的 人生 英雄 之一 ， 沒有 她 總 是 缺少 了 甚麼 。         伊娃 在 十年 前 的 電影 《 Lost   River 》 後 ， 已經 停掉 了 演藝事業 ， 安心 為 賴恩養育 兩名 女兒 ， 九歲 的 Esmeralda 及七歲 的 Amada 。 賴恩笑 稱 他 最愛為 家人 煮食 ， 摩洛哥 雞 就是 其中 一道 拿手 好菜 。,2024-04-24
美娜古尼絲否認參演《That 90s Show》,美娜古尼絲否認參演《That 90s Show》    劇集《That 70s Show》是《黑天鵝》女星美娜古尼絲(Mila Kunis)和男星阿斯頓傑查(Ashton Kutcher)的合作作品之一，是靑春喜劇的經典。近年由Netflix開創新劇《That 90s Show》，很希望獲得美娜及阿斯頓的支持。    去年該劇已播出了首季，在宣佈將會開拍第二季時，美娜宣佈他們不會加入，聲稱已有既定的計劃，無意參與。美娜十分識做地大讚該劇講述角色後代的故事，認為焦點還是放在新生代，暗示比自己做得更好，長江後浪推前浪。,http://www.macaodaily.com/html/2024-04/24/content_1750307.htm,美娜古尼絲否認參演《That 90s Show》    劇集《That 70s Show》是《黑天鵝》女星美娜古尼絲(Mila Kunis)和男星阿斯頓傑查(Ashton Kutcher)的合作作品之一，是靑春喜劇的經典,美娜 古尼絲否 認參演 《 That   90s   Show 》         劇集 《 That   70s   Show 》 是 《 黑天 鵝 》 女星 美娜 古尼絲 ( Mila   Kunis ) 和 男星 阿斯 頓傑查 ( Ashton   Kutcher ) 的 合作 作品 之一 ， 是 靑 春 喜劇 的 經典 。 近年 由 Netflix 開創 新劇 《 That   90s   Show 》 ， 很 希望 獲得 美娜 及 阿斯 頓 的 支持 。         去年 該劇 已 播出 了 首季 ， 在 宣 佈 將會開 拍 第二季 時 ， 美娜 宣 佈 他們 不會 加入 ， 聲稱 已有 既定 的 計劃 ， 無意 參 與 。 美娜 十分 識 做 地 大 讚 該 劇 講 述 角色 後 代 的 故事 ， 認為 焦點 還是 放在 新生代 ， 暗示 比 自己 做 得 更好 ， 長 江後浪 推 前浪 。,2024-04-24
