Title,Content,Link,Summary,Preprocessed_Content,Date
（新聞小語）開誠佈公訂好三級收費   夏  耘,開誠佈公訂好三級收費    澳人寄予厚望的澳門協和醫院近日開業，將循序漸進推出面向非轉介患者的門診服務，構建電子化專科掛號服務，助力實現“大病不出澳”的目標。    “預防優先，妥善治療”是本澳長期以來的醫療政策。本澳初級衛生保健服務作為西太平洋地區的典範，令本澳在“預防優先”方面做得相當出色，從本澳人均壽命、初生兒存活率在全球名列前茅足以印證。另一方面，由於醫療市場細小，窒礙本澳專科醫療發展，普羅大眾一直希望本澳能提高疑難重症及專科診治能力，令澳人在本地有更多優質醫療選擇。對於澳門協和醫院，坊間寄望甚殷，但對醫院的認識目前似乎停留於“協和”品牌，其他所知甚少。醫院高大上，“在地感”仍須努力加強。    澳門協和醫院自今年三月起，陸續為經衛生局轉介的患者提供包括專科門診、超聲檢查、放射CT檢查和前列腺癌放射治療等服務，提供共廿五個專科門診，積極發揮社區分流作用，並持續擴大免費醫療服務的專科範疇。院方公佈三級收費，第一級為面向享免費醫療的澳門居民提供免費服務；第二級為收費醫療；第三級為國際醫療，屬於私人醫療服務，迎合不同人士所需。    協和醫院作為重點民生工程，服務收費備受社會關注。當中提到第二級收費醫療，居民可享七折優惠，但定價將重新考慮。院方指出有部分公營醫療收費已三十多年未調整，醫療成本及合理性有變，希望在本澳居民可承擔的基礎上訂定合理價格。居民理解適時調整，惟公營醫療有公共利益屬性，收費水平牽一髮動全身，加幅多少、何謂合理，須一攬子考慮。說到底，院方應持開放態度，廣開言路，積極蒐集各界意見，雙向溝通增進共識。隨着醫院各項醫療服務陸續到位，當局有必要加強宣傳，供大眾知悉，便利求醫。    助力實現“大病不出澳”目標，關鍵在於服務要到位，政策接地氣，專科團隊穩定充足。長遠要發展成為國家區域醫療中心，面向灣區乃至周邊地區，推進“醫療＋旅遊”以至大健康產業發展，必須穩步前行。    夏  耘,http://www.macaodaily.com/html/2024-09/19/content_1782190.htm,澳門協和醫院自今年三月起，陸續為經衛生局轉介的患者提供包括專科門診、超聲檢查、放射CT檢查和前列腺癌放射治療等服務，提供共廿五個專科門診，積極發揮社區分流作用，並持續擴大免費醫療服務的專科範疇,開 誠 佈 公訂 好 三級 收費         澳人 寄予厚望 的 澳門協 和 醫院 近日 開業 ， 將 循序 漸進 推出 面向 非 轉介 患者 的 門診 服務 ， 構建 電子化 專科 掛號 服務 ， 助力 實現 “ 大病 不出 澳 ” 的 目標 。         “ 預防 優先 ， 妥善 治療 ” 是 本 澳長 期以 來 的 醫療 政策 。 本澳 初級 衛生 保健 服務作 為 西太平洋 地區 的 典範 ， 令本 澳在 “ 預防 優先 ” 方面 做 得 相當 出色 ， 從本澳 人均 壽命 、 初生 兒 存活率 在 全球 名列前茅 足以 印證 。 另一方面 ， 由 於 醫療 市場 細小 ， 窒礙 本澳 專科 醫療 發展 ， 普羅大眾 一直 希望 本澳能 提高 疑難 重症 及 專科 診治 能力 ， 令澳人 在 本地 有 更 多 優質 醫療 選擇 。 對 於 澳門協 和 醫院 ， 坊 間 寄望 甚殷 ， 但 對 醫院 的 認識 目前 似乎 停留 於 “ 協和 ” 品牌 ， 其他 所知 甚 少 。 醫院 高大 上 ， “ 在 地感 ” 仍須 努力 加強 。         澳門協 和 醫院 自 今年 三月 起 ， 陸續 為 經衛 生局 轉介 的 患者 提供 包括 專科門診 、 超聲 檢查 、 放射 CT 檢查 和 前列腺癌 放射 治療 等 服務 ， 提供 共 廿五 個 專科門診 ， 積極 發揮 社區 分流 作用 ， 並持續 擴大免 費醫療 服務 的 專科範疇 。 院方 公 佈 三級 收費 ， 第一 級 為 面向 享免 費醫療 的 澳門 居民 提供 免費 服務 ； 第二 級 為 收費 醫療 ； 第三 級 為 國際 醫療 ， 屬 於 私人 醫療 服務 ， 迎合 不同 人士 所 需 。         協和醫院 作為 重點 民生 工程 ， 服務 收費備 受 社會 關注 。 當中 提到 第二 級 收費 醫療 ， 居民 可享 七折 優惠 ， 但定 價將 重新 考慮 。 院方 指出 有 部分 公營 醫療 收費 已 三十多年 未 調整 ， 醫療 成本 及 合理性 有變 ， 希望 在 本澳 居民 可承擔 的 基礎 上 訂定 合理 價格 。 居民 理解 適時 調整 ， 惟公營 醫療 有 公共利益 屬性 ， 收費 水平 牽一 髮 動 全身 ， 加幅 多少 、 何謂 合理 ， 須一攬子 考慮 。 說 到底 ， 院方 應持 開放態度 ， 廣開 言路 ， 積極 蒐集 各界 意見 ， 雙向 溝通 增進 共識 。 隨着 醫院 各項 醫療 服務陸續 到位 ， 當局 有 必要 加強 宣傳 ， 供大眾 知悉 ， 便利 求醫 。         助力 實現 “ 大病 不出 澳 ” 目標 ， 關鍵 在 於 服務要 到位 ， 政策 接地 氣 ， 專科團隊 穩定 充足 。 長 遠要 發展 成為 國家區域 醫療 中心 ， 面向 灣區 乃至 周邊 地區 ， 推進 “ 醫療 ＋ 旅遊 ” 以至 大 健康 產業 發展 ， 必須 穩步 前行 。         夏     耘,2024-09-19
今多雲內港或微浸,今多雲內港或微浸    【本報消息】氣象局預測，位於南海中部的熱帶氣旋向偏西方向移動，大致移向海南島以南至越南中部。由於該熱帶氣旋將與本澳保持超過六百公里距離，且環流較鬆散，對本澳造成直接影響較小，需要發出熱帶氣旋信號的機會較低。由於未來數日正值天文大潮，今日早上內港以南一帶會因天文潮出現輕微水浸。    今日大致多雲，短暫時間有陽光，有一兩陣驟雨，吹四至五級東至東北風，間中六級及有陣風，氣溫為攝氏二十六至三十二度，相對濕度百分之六十至九十五。    路邊、高密度住宅區、一般地區空氣質量水平普通，沿海地區吹四至六級東至東北風及有陣風，視野良好至非常良好。    預測明日大致多雲，有幾陣驟雨及雷暴，吹三至四級偏東風，間中五級及有陣風，氣溫為攝氏二十六至三十一度，相對濕度百分之七十至九十八。    昨日多雲，部分時間有陽光，初時有一兩陣驟雨，氣溫為攝氏二十五至三十二度，相對濕度為百分之六十四至九十八。昨日錄得最高紫外線指數為十點二，平均為四點七，強度屬於中等。,http://www.macaodaily.com/html/2024-09/19/content_1782191.htm,今日大致多雲，短暫時間有陽光，有一兩陣驟雨，吹四至五級東至東北風，間中六級及有陣風，氣溫為攝氏二十六至三十二度，相對濕度百分之六十至九十五,今多雲內 港 或 微浸         【 本報 消息 】 氣象局 預測 ， 位 於 南海 中部 的 熱帶 氣旋 向 偏西 方向 移動 ， 大致 移 向 海南 島 以南 至 越南 中部 。 由 於 該 熱帶 氣旋將 與 本澳 保持 超過 六百 公里 距離 ， 且 環流 較 鬆 散 ， 對本澳 造成 直接 影響 較 小 ， 需要 發出 熱帶 氣旋 信號 的 機會 較 低 。 由 於 未來 數日 正值 天文 大潮 ， 今日 早上 內港 以南 一帶 會 因 天文 潮出 現輕微 水浸 。         今日 大致 多 雲 ， 短暫 時間 有陽光 ， 有 一 兩陣 驟雨 ， 吹 四至 五級 東至 東北風 ， 間 中六級 及 有 陣風 ， 氣溫 為 攝氏 二十六 至 三十二度 ， 相對 濕度 百分之六十 至 九 十五 。         路邊 、 高密度 住宅 區 、 一般 地區 空氣 質量 水平 普通 ， 沿海 地區 吹 四至 六級 東至 東北風 及 有 陣風 ， 視野 良好 至 非常 良好 。         預測 明日 大致 多 雲 ， 有 幾陣 驟雨及 雷暴 ， 吹三至 四級 偏東風 ， 間 中五級 及 有 陣風 ， 氣溫 為 攝氏 二十六 至 三十 一度 ， 相對 濕度 百分之七十 至 九十八 。         昨日 多 雲 ， 部分 時間 有陽光 ， 初時 有 一 兩陣 驟雨 ， 氣溫 為 攝氏 二十五 至 三十二度 ， 相對 濕度 為 百分之六十 四至 九十八 。 昨日 錄得 最高 紫外 線 指數 為 十點 二 ， 平均 為 四點 七 ， 強度屬 於 中等 。,2024-09-19
中醫關樹權發佈新書分享經驗,中醫關樹權發佈新書分享經驗    【本報消息】澳門著名中醫師關樹權於九月十六日假萬豪軒酒家萬寶廳舉行新書《醫案隨筆》發佈會。該書得到社會各界及友好人士支持，由澳門基金會及霍英東基金會支持出版。    關樹權長期擔任澳門中藥業公會(中藥研究會)和澳門國際中醫藥大健康產業發展協會會長，對推動澳門中醫藥及大健康產業的發展發揮了不可磨滅的作用。    此書由關樹權編著，凝聚了他多年來的臨床實戰經驗，旨在回饋社會。該書內容豐富，理論與臨床實踐緊密結合，文字順暢淺顯，實用性強。書中的觀點簡明扼要，深入淺出，對讀者具有指導意義。    承先啟後培育人才    在發佈會上，關樹權表示，《醫案隨筆》記錄其行醫五十多年來的臨床醫案集粹，期望藉此與讀者分享這些寶貴經驗。後學者可以從中汲取精華，將所學知識融會貫通，探索臨床診治的規律；同行醫者亦可借鑒其中的方法，應用於自身的臨床實踐中，提升療效。他希望通過這本書的傳承，能承先啟後，持續培養中醫人才。    發佈會當日，霍英東基金會總幹事史濠、醫務界聯合總會創會會長孔競勉、全國名中醫莫蕙、醫療人員協會會長何舜發、國際葡語市場企業家商會主席吳川源、澳門抗癌協會理事長羅光輝、中醫專業學會會長馬凱旋、中醫學會會長林慶雲、戒煙保健會會長歐家輝、澳門中藥業公會常務副會長潘炳輝、理事長黃健華等嘉賓到場慶賀。,http://www.macaodaily.com/html/2024-09/19/content_1782194.htm,發佈會當日，霍英東基金會總幹事史濠、醫務界聯合總會創會會長孔競勉、全國名中醫莫蕙、醫療人員協會會長何舜發、國際葡語市場企業家商會主席吳川源、澳門抗癌協會理事長羅光輝、中醫專業學會會長馬凱旋、中醫學會會長林慶雲、戒煙保健會會長歐家輝、澳門中藥業公會常務副會長潘炳輝、理事長黃健華等嘉賓到場慶賀,中醫關 樹權 發 佈 新書 分享 經驗         【 本報 消息 】 澳門 著名 中醫師 關樹權 於 九月 十六日 假萬豪軒 酒家 萬寶廳 舉行 新書 《 醫案 隨筆 》 發 佈 會 。 該書 得到 社會 各界 及 友好人士 支持 ， 由 澳門 基金 會及 霍英東 基金 會 支持 出版 。         關樹 權長 期 擔任 澳門 中藥業 公會 ( 中藥 研究 會 ) 和 澳門 國際 中 醫藥 大 健康 產業 發展 協會會長 ， 對 推動 澳門 中 醫藥 及 大 健康 產業 的 發展 發揮 了 不可 磨滅 的 作用 。         此書 由 關樹權 編著 ， 凝聚 了 他 多年 來 的 臨床 實戰 經驗 ， 旨在 回饋 社會 。 該書 內容 豐富 ， 理論 與 臨床 實踐 緊密 結合 ， 文字 順暢 淺顯 ， 實用 性強 。 書中 的 觀點 簡明 扼要 ， 深入 淺出 ， 對 讀者 具有 指導 意義 。         承先啟 後 培育 人才         在 發 佈 會 上 ， 關樹權 表示 ， 《 醫案 隨筆 》 記錄 其行醫 五十多年 來 的 臨床 醫案 集粹 ， 期望 藉此 與 讀者 分享 這些 寶貴 經驗 。 後 學者 可以 從 中 汲取 精華 ， 將所學 知識 融會 貫通 ， 探索 臨床 診治 的 規律 ； 同行 醫者 亦可 借 鑒 其中 的 方法 ， 應用 於 自身 的 臨床 實踐 中 ， 提升 療效 。 他 希望 通過 這本書 的 傳承 ， 能承先啟 後 ， 持續 培養 中醫 人才 。         發 佈 會 當日 ， 霍英東 基金 會 總幹 事史 濠 、 醫務界 聯合 總會 創會會長 孔 競勉 、 全國名 中 醫莫蕙 、 醫療 人員 協會會長 何舜發 、 國際 葡語 市場 企業 家商 會 主席 吳川源 、 澳門 抗癌 協會 理事 長 羅 光輝 、 中醫 專業 學會會長 馬 凱旋 、 中醫學會 會長 林慶 雲 、 戒煙 保健 會會長 歐家輝 、 澳門 中藥業 公會常務 副 會長 潘炳輝 、 理事 長 黃 健華 等 嘉賓 到 場慶賀 。,2024-09-19
慈惠堂參大馬羅天大醮,慈惠堂參大馬羅天大醮    【本報消息】籌備多年、作為馬來西亞檳城首場最大且最隆重莊嚴的道教盛會“金籙羅天大醮”，於本月十三日上午啟壇，亦為各界同賀馬來西亞北海斗母宮創宮五十周年系列活動掀開帷幕，獲海峽兩岸暨港澳地區、新加坡及馬來西亞共十六間道觀近三百名道長支持及協助，盛況空前。    北海斗母宮金禧慶典慶委會大會主席、拿督斯里方炎華，世界道教聯合會理事長、中國道教協會會長李光富道長，中國駐馬來西亞檳城總領事館代總領事丁巧，甲辰年金籙羅天大醮主禮人、馬來西亞財政部副部長林慧英先後致詞，恭宣羅天大醮和平宣言。世界道教聯合會副會長、香港道教聯合會主席梁德華，馬來西亞慈惠堂堂主余蓮及澳門圓定慈惠堂堂主周志輝等亦到場參加。同場，李光富為受邀參加活動的各經樂壇授旗、頒令。    方炎華表示，通過啟建大醮，以最崇高、最盛大的科儀，向諸神祈福，以護國佑民、延壽度亡、消災禳禍及祈福謝恩。    交流文化團結社會    李光富說，羅天大醮在斗母宮舉辦，可以幫助東南亞信眾體驗和感悟宏大的道教儀式，還可通過不同國家的文化形式，使信眾領略道教深邃的人文價值和與時俱進的精神風貌。    率眾弟子參加法會的周志輝稱，高度認同主持“金籙羅天大醮”不僅是宗教信仰盛事，更是促進文化交流與社會團結的象徵，有利講好中國故事、澳門故事。    據安排，首次舉辦的“亞洲民族文化藝陣妝藝大遊行”將於本月廿一日傍晚舉行，將有來自國內外珍貴的非物質文遺表演團隊匯聚展演。,http://www.macaodaily.com/html/2024-09/19/content_1782195.htm,慈惠堂參大馬羅天大醮    【本報消息】籌備多年、作為馬來西亞檳城首場最大且最隆重莊嚴的道教盛會“金籙羅天大醮”，於本月十三日上午啟壇，亦為各界同賀馬來西亞北海斗母宮創宮五十周年系列活動掀開帷幕，獲海峽兩岸暨港澳地區、新加坡及馬來西亞共十六間道觀近三百名道長支持及協助，盛況空前,慈惠堂 參大馬羅 天大 醮         【 本報 消息 】 籌備 多年 、 作為 馬 來 西亞檳城 首場 最大 且 最 隆重 莊嚴 的 道教 盛會 “ 金籙 羅 天大 醮 ” ， 於 本月 十三日 上午 啟壇 ， 亦 為 各界 同賀馬來 西亞 北海 斗母宮 創宮 五十周年 系列 活動 掀開 帷幕 ， 獲海峽 兩岸 暨 港澳 地區 、 新加坡 及馬來 西亞共 十六 間 道 觀近 三百名 道長 支持 及 協助 ， 盛況 空前 。         北海 斗母 宮金禧慶典 慶委會 大會 主席 、 拿督斯里 方炎華 ， 世界 道教 聯合會 理事 長 、 中國 道教 協會會長 李光富 道 長 ， 中國 駐馬來 西亞檳城 總領 事館 代總領 事丁巧 ， 甲辰 年 金籙 羅 天大 醮 主禮人 、 馬 來 西亞 財政 部副 部長 林慧英 先後致 詞 ， 恭宣羅 天大 醮 和平 宣言 。 世界 道教 聯合會 副 會長 、 香港 道教 聯合會 主席 梁德華 ， 馬 來 西亞 慈惠 堂堂 主余蓮及 澳門 圓定 慈惠 堂堂 主周志輝 等 亦 到場 參加 。 同場 ， 李光富 為 受邀 參加 活動 的 各 經樂壇 授旗 、 頒令 。         方炎華 表示 ， 通過 啟建大 醮 ， 以 最 崇高 、 最 盛大 的 科儀 ， 向 諸神 祈福 ， 以護 國佑民 、 延壽度 亡 、 消災 禳 禍 及 祈福 謝恩 。         交流 文化 團結 社會         李光富 說 ， 羅 天大 醮 在 斗母 宮舉 辦 ， 可以 幫助 東南亞 信眾 體驗 和 感悟 宏大 的 道教 儀式 ， 還可 通過 不同 國家 的 文化 形式 ， 使 信眾 領略 道教 深邃 的 人文 價值 和 與 時俱進 的 精神 風貌 。         率眾 弟子 參 加法 會 的 周志輝 稱 ， 高度 認同 主持 “ 金籙 羅 天大 醮 ” 不僅 是 宗教信仰 盛事 ， 更是 促進 文化交流 與 社會 團結 的 象 徵 ， 有利 講好 中國 故事 、 澳門 故事 。         據 安排 ， 首次 舉辦 的 “ 亞洲 民族 文化 藝陣妝藝 大遊行 ” 將於 本月 廿一日 傍晚 舉行 ， 將有 來 自國 內外 珍貴 的 非物質 文遺 表演 團隊 匯聚 展演 。,2024-09-19
專家科大談奢侈品展望,專家科大談奢侈品展望    澳門科技大學酒店與旅遊管理學院於九月十六日舉辦本學期首場“酒旅名家論壇”系列講座，特邀Asia Pacific Journal of Marketing and Logistics期刊主編、澳大利亞科廷大學商業與法律學院教授Ian Phau主講。他以其深厚的學術造詣和豐富的行業經驗，為現場觀眾帶來一場關於奢侈品未來發展的深刻洞見。    Ian Phau以其獨特視角和前沿研究，深入剖析奢侈品領域當前的發展趨勢與未來走向。着重探討奢侈品牌在智慧化浪潮中的創新策略，如何運用現代科技手段重塑品牌體驗，以及面對消費者日益多樣化的需求時，奢侈品牌應如何保持其獨特魅力和市場領先地位。Ian Phau演講內容詳實、見解獨到，為與會師生提供關於奢侈品市場研究的寶貴思考角度和靈感來源。,http://www.macaodaily.com/html/2024-09/19/content_1782177.htm,專家科大談奢侈品展望    澳門科技大學酒店與旅遊管理學院於九月十六日舉辦本學期首場“酒旅名家論壇”系列講座，特邀Asia Pacific Journal of Marketing and Logistics期刊主編、澳大利亞科廷大學商業與法律學院教授Ian Phau主講,專家 科大 談 奢侈品 展望         澳門 科技 大學 酒店 與 旅遊 管理 學院 於 九月 十六日 舉辦 本學期 首場 “ 酒旅 名家 論壇 ” 系列 講座 ， 特邀 Asia   Pacific   Journal   of   Marketing   and   Logistics 期刊 主編 、 澳大利 亞科廷 大學 商業 與 法律 學院 教授 Ian   Phau 主講 。 他 以 其 深厚 的 學術 造詣 和 豐富 的 行業 經驗 ， 為 現場 觀眾 帶來 一場關 於 奢侈品 未來 發展 的 深刻 洞見 。         Ian   Phau 以其 獨特視角 和 前沿 研究 ， 深入 剖析 奢侈品 領域 當前 的 發展 趨勢 與 未來 走向 。 着重 探討 奢侈 品牌 在 智慧 化 浪潮 中 的 創 新策略 ， 如何 運用 現代 科技 手段 重塑 品牌 體驗 ， 以及 面對 消費者 日益 多樣化 的 需求 時 ， 奢侈 品牌 應 如何 保持 其獨特 魅力 和 市場 領先 地位 。 Ian   Phau 演講 內容 詳實 、 見解 獨到 ， 為 與 會 師生 提供 關於 奢侈品 市場 研究 的 寶貴 思考 角度 和 靈感 來源 。,2024-09-19
城大師生解讀三中全會政策,城大師生解讀三中全會政策    由澳門城市大學研究生院及研究生會聯合舉辦的“我與研究生院院長面對面——二十屆三中全會涉澳政策解讀報告會”，於本月十七日下午在城大氹仔校區開展。會議由澳門城大副校長、研究生院院長、葡語國家研究院院長葉桂平主講，談到二十屆三中全會提出的一系列新思想，是新時代全面深化改革理論創新、實踐創新的最新成果。    澳門特區政府在開展工作時應與中央保持一致，引領社會各界把握國家重點戰略機遇，發揮澳門優勢服務國家發展。第一，充分發揮澳門高等教育的國際化優勢，吸引更多國際優秀人才開展科研創新。第二，依托“雙循環”交匯點優勢，健全澳門在國家對外開放中更好發揮作用機制，建設好“一中心一平台一基地”。第三，推動澳門經濟適度多元，加快建設橫琴粵澳深度合作區，推動粵港澳大灣區營造高水平對外開放的市場環境。,http://www.macaodaily.com/html/2024-09/19/content_1782178.htm,城大師生解讀三中全會政策    由澳門城市大學研究生院及研究生會聯合舉辦的“我與研究生院院長面對面——二十屆三中全會涉澳政策解讀報告會”，於本月十七日下午在城大氹仔校區開展,城大師 生解讀 三中 全會 政策         由 澳門 城市 大學 研究生院 及 研究生 會聯合 舉辦 的 “ 我 與 研究生院 院長 面對面 — — 二十 屆 三中 全會 涉澳 政策 解讀 報告 會 ” ， 於 本月 十七日 下午 在 城大 氹 仔校區 開展 。 會議 由 澳門 城大 副 校長 、 研究生院 院長 、 葡語 國家 研究院 院長 葉 桂平 主講 ， 談到 二十 屆 三中 全會 提出 的 一系列 新 思想 ， 是 新 時代 全面 深化改革 理論 創新 、 實踐 創新 的 最新 成果 。         澳門 特區 政府 在 開展 工作 時應 與 中央 保持一致 ， 引領 社會 各界 把握 國家 重點 戰略 機遇 ， 發揮 澳門 優勢 服務國家 發展 。 第一 ， 充分 發揮 澳門 高等教育 的 國際化 優勢 ， 吸引 更多國際 優秀 人才 開展 科研 創新 。 第二 ， 依托 “ 雙循環 ” 交匯點 優勢 ， 健全 澳門 在 國家 對外 開放中 更好 發揮 作用 機制 ， 建設 好 “ 一 中心 一 平台 一 基地 ” 。 第三 ， 推動 澳門 經濟 適度 多元 ， 加快 建設 橫琴粵澳 深度 合作 區 ， 推動粵 港澳 大灣區 營造 高水平 對外 開放 的 市場 環境 。,2024-09-19
北大生訪澳大交流學習,北大生訪澳大交流學習    為深化澳門與北京高校的交流，北京大學元培學院師生日前到澳門大學鄭裕彤書院進行“澳門歷史文化之旅”交流活動。    在澳大師生帶領下，北大師生參觀澳大校園、博彩研究所博彩實驗室，欣賞在澳大舉行的“弦響‧啟航”雙慶專場音樂會，並到訪大三巴牌坊、媽閣廟、澳門大賽車博物館、澳門蓮花衛視等。北大學生還旁聽澳大課程，參與一系列由澳大鄭裕彤書院準備的工作坊，包括非洲鼓體驗課、特色葡撻與涼茶製作、咖啡工作坊等，通過體驗式學習了解澳門的中西方文化交融。此外，澳大鄭裕彤書院副院長龔映雪亦陪同北大教員參觀澳大的鄭裕彤書院、蔡繼有書院和呂志和書院。雙方教員就書院工作、管理方式、育人平台等深入交流。,http://www.macaodaily.com/html/2024-09/19/content_1782179.htm,北大學生還旁聽澳大課程，參與一系列由澳大鄭裕彤書院準備的工作坊，包括非洲鼓體驗課、特色葡撻與涼茶製作、咖啡工作坊等，通過體驗式學習了解澳門的中西方文化交融,北大 生訪 澳大 交流 學習         為 深化 澳門 與 北京高校 的 交流 ， 北京 大學元 培學院師 生日 前到 澳門 大學 鄭裕彤 書院 進行 “ 澳門 歷史 文化 之旅 ” 交流 活動 。         在 澳大師 生帶 領下 ， 北大 師生 參觀 澳 大校 園 、 博彩 研究所 博彩 實驗室 ， 欣賞 在 澳大 舉行 的 “ 弦響 ‧ 啟航 ” 雙慶 專場 音樂會 ， 並到 訪 大三巴牌坊 、 媽閣 廟 、 澳門 大賽車 博物 館 、 澳門蓮花 衛視 等 。 北大 學生 還旁 聽 澳大 課程 ， 參與 一系列 由 澳大 鄭裕彤 書院 準備 的 工作坊 ， 包括 非洲 鼓體驗 課 、 特色 葡撻 與 涼 茶 製 作 、 咖啡 工作坊 等 ， 通過 體驗式 學習 了解 澳門 的 中 西方 文化 交融 。 此外 ， 澳大 鄭裕彤 書院 副 院長 龔映 雪 亦 陪同 北大 教員 參觀 澳大 的 鄭裕彤 書院 、 蔡繼有 書院 和 呂志 和 書院 。 雙方 教員 就 書院 工作 、 管理 方式 、 育人 平台 等 深入 交流 。,2024-09-19
