Title,Content,Link,Summary,Preprocessed_Content,Date
大賽車首跑區域方程式,下月中七大賽  預算二億四    大賽車首跑區域方程式    【本報消息】第七十一屆澳門格蘭披治大賽車將於十一月十四至十七日舉行。今屆大賽車共上演七項賽事，預計將有超過一百八十名車手參與，總預算約二億四千萬澳門元。今屆賽事的焦點之一，是區域方程式(FR)首次在澳落地競速，三級方程式則暫時退出東望洋跑道。    六休企贊助共一億    澳門格蘭披治大賽車組織委員會昨日中午十二時假科學館會議廳舉行新聞發佈會，公佈賽事、贊助商及聯乘合作項目等資訊。體育局長、大賽車組委會協調員張子軒，大賽車組委會賽事專責小組組長鍾國榮、助理協調員李詩靈，六大休閒企業代表，大賽車組委會成員，體育委員及其他贊助商代表等出席。    今屆大賽車將於十一月十四至十七日舉行，共安排七項賽事（詳見附表）。會上播出了國際汽聯主席穆罕默德 · 本 · 蘇拉耶姆的講話片段，祝賀“第七十一屆澳門格蘭披治大賽車”舉辦，並落實國際汽聯FR世界盃、國際汽聯GT世界盃及國際汽聯TCR世界巡迴賽在澳門舉行。隨後舉行主要贊助商及特級贊助商，即六家綜合度假休閒企業代表遞交支票儀式。其中澳娛綜合、銀娛、金沙中國、美高梅分別贊助二千萬元，新濠博亞、永利各贊助一千萬元。    參賽車手已超疫前    張子軒受訪表示，今屆大賽車預算約二點四億元，未包括休企贊助及門票收入。估計門票收入與往年相若，上屆兩星期賽車門票收入約一千七百萬元。今屆賽事吸引超過三十五個國家和地區逾一百八十名車手參與，參賽國家及車手數量已超過二〇一九年，可見澳門大賽車受到國際車壇認可。    大賽車推體育旅遊    張子軒稱，今年適逢“雙慶年”，組委會期望賽事能為“雙慶”增添更多熱鬧歡樂的氣氛。去年與不同中小企共同推出一系列聯乘合作項目，成功打造與業界合作的平台。今年將在這個平台的基礎上繼續發揮大賽車的聯動效應，與本澳企業及旅遊業界攜手合作，持續推動旅遊業及體育產業發展。繼續發揮大賽車宣傳澳門及推動體育旅遊的作用，讓旅客感受澳門體育盛事之都的活力形象，同時以大賽車的聯動效應為整個澳門帶來體育、旅遊、經濟以至各方面的效益。    國際汽聯滿意工作    張子軒談到大賽車籌備工作表示，大賽車重鋪路面與往年一樣，從暑假開始持續至十月初。國際汽聯人員近日曾初步檢驗賽道，滿意各項準備工作，為下個月的賽事打下“強心針”。大賽車是澳門一個重要的體育盛事及體育名片，鼓勵居民當宣傳大使，共同講好澳門大賽車的故事。,http://www.macaodaily.com/html/2024-10/23/content_1789363.htm,今屆賽事吸引超過三十五個國家和地區逾一百八十名車手參與，參賽國家及車手數量已超過二〇一九年，可見澳門大賽車受到國際車壇認可,下 月 中七大賽     預算二 億四         大賽 車首 跑 區域 方程式         【 本報 消息 】 第七十一 屆 澳門格蘭 披治大賽 車將 於 十一月 十四 至 十七日 舉行 。 今屆 大賽 車共 上演 七項 賽事 ， 預計將 有 超過 一百八十 名車 手參 與 ， 總 預算 約 二 億 四千 萬澳門 元 。 今屆 賽事 的 焦點 之一 ， 是 區域 方程式 ( FR ) 首次 在 澳 落地 競速 ， 三級 方程式 則暫 時 退出 東 望洋 跑道 。         六休 企贊助 共 一 億         澳門格蘭 披治大賽 車組織 委員會 昨日 中午 十二 時假 科學館 會議 廳 舉行 新聞發 佈 會 ， 公 佈 賽事 、 贊助 商及 聯乘 合作 項目 等 資訊 。 體育 局長 、 大賽車 組委會協 調員 張子軒 ， 大賽車 組委會 賽事 專責小組 組長 鍾 國榮 、 助理 協調員 李詩靈 ， 六大 休閒 企業 代表 ， 大賽車 組委會 成員 ， 體育委員 及其 他 贊助商 代表 等 出席 。         今屆 大賽 車將 於 十一月 十四 至 十七日 舉行 ， 共 安排 七項 賽事 （ 詳見 附表 ） 。 會上 播出 了 國際 汽聯 主席 穆罕默德   ·   本   ·   蘇拉耶姆 的 講話 片段 ， 祝賀 “ 第七十一 屆 澳門格蘭 披治大賽車 ” 舉辦 ， 並落 實國際 汽聯 FR 世界 盃 、 國際 汽聯 GT 世界 盃 及 國際 汽聯 TCR 世界 巡 迴 賽 在 澳門 舉行 。 隨後舉行 主要 贊助 商及 特級 贊助商 ， 即 六家 綜合 度假 休閒 企業 代表 遞交 支票 儀式 。 其中 澳娛 綜合 、 銀娛 、 金沙 中國 、 美高梅 分別 贊助 二千 萬元 ， 新濠 博亞 、 永利 各贊助 一千 萬元 。         參賽 車手 已 超疫前         張子軒 受訪 表示 ， 今屆 大賽車 預算約 二點 四 億元 ， 未 包括 休企贊助 及門票 收入 。 估計門票 收入 與 往年 相若 ， 上屆 兩 星期 賽車 門票 收入 約 一千七百 萬元 。 今屆 賽事 吸引 超過 三十五 個國家 和 地區 逾 一百八十 名車 手參 與 ， 參賽 國家及 車手 數量 已 超過 二 〇 一 九年 ， 可見 澳門 大賽車 受到 國際 車壇 認可 。         大賽車 推體育 旅遊         張子 軒稱 ， 今年 適逢 “ 雙慶年 ” ， 組委會 期望 賽事能 為 “ 雙慶 ” 增添 更多 熱鬧 歡樂 的 氣氛 。 去年 與 不同 中小 企 共同 推出 一系列 聯乘 合作 項目 ， 成功 打造 與業界 合作 的 平台 。 今年 將在 這個 平台 的 基礎 上 繼續 發揮 大賽車 的 聯動 效應 ， 與 本澳 企業 及 旅遊業界 攜手 合作 ， 持續 推動 旅遊業 及 體育 產業 發展 。 繼續 發揮 大賽車 宣傳 澳門 及 推動 體育 旅遊 的 作用 ， 讓 旅客 感受 澳門 體育 盛事 之 都 的 活力 形象 ， 同時 以大賽車 的 聯動效 應為 整個 澳門 帶來 體育 、 旅遊 、 經濟 以至 各 方面 的 效益 。         國際 汽聯 滿意 工作         張子軒 談到 大賽 車籌備 工作 表示 ， 大賽 車重 鋪 路面 與 往年 一樣 ， 從 暑假 開始 持續 至 十月初 。 國際 汽聯人員 近日 曾 初步 檢驗賽 道 ， 滿意 各項 準備 工作 ， 為 下個 月 的 賽事 打下 “ 強心針 ” 。 大賽車 是 澳門 一個 重要 的 體育 盛事 及 體育 名片 ， 鼓勵 居民 當宣傳 大使 ， 共同 講好 澳門 大賽車 的 故事 。,2024-10-23
賽會不認同FR遜於F3,賽會不認同FR遜於F3    【本報消息】今屆大賽車沒有F3方程式，首次引入區域方程式賽車（Formula Regional，簡稱FR）。FR是否比F3賽事遜色？體育局長、大賽車組委會協調員張子軒回應稱，兩者都是方程式賽事，認為FR在國際車壇並非次一級。今屆FR賽事吸引世界各地的國際冠軍車手或優秀車手參賽，是高水平的賽事。    本澳車手亦可參與    張子軒認為，賽車運動並非一成不變，隨着科技進步、賽制更新等，賽車種類及賽事形式亦不斷變化。今年FR賽事有世界各地的冠軍車手或優秀車手參與，可見是高水平的賽事。此外，澳門車手也有機會參與FR賽事，體驗主場優勢，讓公衆看到澳門車手的光芒。    未來會否重新引入F3賽事？張子軒稱，要視乎整個車壇發展及評估FR、F3的影響力。F3是一個可讓車手展示身手的平台，FR亦一樣。目前，許多國際F1車隊都有FR梯隊，表明FR在國際車壇並非次一級，又或與F3有絕對的對比。車隊在選擇頂級車手或明日之星時，會考慮不同的梯隊及方式。若一級車隊的後起之秀能來澳門東望洋賽道比賽角逐，他們的故事將與歷年來國際賽車頂級的世界冠軍相似，只是時間及車型不同。    引其他賽事須硏究    未來會否引進其他賽事？張子軒表示，需要與國際汽聯協調，考慮不同賽事巡迴賽的檔期，同時平衡居民的出行需要及賽事精彩程度等。強調最終目的是希望做好澳門大賽車的品牌。,http://www.macaodaily.com/html/2024-10/23/content_1789364.htm,體育局長、大賽車組委會協調員張子軒回應稱，兩者都是方程式賽事，認為FR在國際車壇並非次一級,賽會 不 認同 FR 遜 於 F3         【 本報 消息 】 今屆 大賽車 沒有 F3 方程式 ， 首次 引入 區域 方程式 賽車 （ Formula   Regional ， 簡稱 FR ） 。 FR 是否 比 F3 賽事遜色 ？ 體育 局長 、 大賽車 組委會協 調員 張子軒 回應 稱 ， 兩者 都 是 方程式 賽事 ， 認為 FR 在 國際 車壇 並非次 一級 。 今屆 FR 賽事 吸引 世界各地 的 國際 冠軍車 手 或 優秀車 手 參賽 ， 是 高水平 的 賽事 。         本澳車 手 亦可 參與         張子軒 認為 ， 賽車 運動 並非 一成 不變 ， 隨着 科技 進步 、 賽制 更新 等 ， 賽車種 類及 賽事 形式 亦 不斷 變化 。 今年 FR 賽事 有 世界各地 的 冠軍車 手 或 優秀車 手參 與 ， 可見 是 高水平 的 賽事 。 此外 ， 澳門 車手 也 有 機會 參 與 FR 賽事 ， 體驗 主場 優勢 ， 讓 公 衆 看到 澳門 車手 的 光芒 。         未來 會否 重新 引入 F3 賽事 ？ 張子 軒稱 ， 要視乎 整個 車壇 發展 及 評估 FR 、 F3 的 影響力 。 F3 是 一個 可 讓 車手 展示 身手 的 平台 ， FR 亦 一樣 。 目前 ， 許多國際 F1 車隊 都 有 FR 梯隊 ， 表明 FR 在 國際 車壇 並非次 一級 ， 又 或 與 F3 有絕 對 的 對 比 。 車隊 在 選擇 頂級 車手 或 明日之星 時 ， 會 考慮 不同 的 梯隊 及 方式 。 若 一級 車隊 的 後 起 之秀能 來 澳門東 望洋 賽道 比賽 角逐 ， 他們 的 故事 將與 歷年 來 國際賽 車頂級 的 世界 冠 軍 相似 ， 只是 時間 及 車型 不同 。         引 其他 賽事 須硏 究         未來 會否 引進 其他 賽事 ？ 張子軒 表示 ， 需要 與 國際 汽聯 協調 ， 考慮 不同 賽事 巡 迴 賽 的 檔期 ， 同時 平衡 居民 的 出行 需要 及賽 事 精彩 程度 等 。 強調 最終 目的 是 希望 做好 澳門 大賽車 的 品牌 。,2024-10-23
大賽車門票今起發售,試車兩天每位百元    正賽四百至千二元    大賽車門票今起發售    【本報消息】今屆大賽車門票今日上午十時起公開發售，票價與去年一樣，十一月十四及十五日的賽事票價為一百澳門元；十六及十七日的賽事票價介乎四百至一千二百元不等，取決於不同看台。每人每次限購最多二十張門票，凡年滿兩歲或以上的人士須購票入場。大賽車並設有多個購票途徑，包括現場銷售點以及網上購票等。    線上下多渠道購票    為方便居民及車迷購買賽事門票，大賽車組委會在本澳、香港及內地合共設有十五個銷售點，並提供網上、電話、電郵及手機應用程式等多種銷售途徑。有興趣現場觀看今屆大賽車的居民及旅客，可透過澳門售票網(www.macauticket.com)、電郵及電話預訂，或直接前往廣星傳訊澳門及香港門市、內地銷售點購買門票，亦可透過攜程旅行、Trip.com的手機應用程式，大麥手機應用程式及微信小程序，東瀛遊網站(www.egltours.com)及同悅網國內版微信小程序、中旅旅行微信小程序購票。    賽事期間，各個現場售票中心除了人手櫃台服務外，並設有自助購票機，觀眾可以使用信用卡及其他電子支付方式購票。    遊澳看賽車優惠價    為發揮體育旅遊的聯動效應，今屆大賽車繼續推出“遊澳看賽車”門票合作計劃。大賽車組委會希望藉此計劃與本澳及其他地區的旅遊商會、旅行社、航空公司或線上旅遊平台合作，聯動推出機票、船票或酒店聯乘今屆大賽車賽事門票的套票優惠。有興趣參與“遊澳看賽車”門票合作計劃的機構及商戶可與澳門格蘭披治大賽車組委會聯繫洽談。成功合作者，大會將按購票數量向該商戶提供不同折扣的合作門票優惠。,http://www.macaodaily.com/html/2024-10/23/content_1789365.htm,有興趣現場觀看今屆大賽車的居民及旅客，可透過澳門售票網(www.macauticket.com)、電郵及電話預訂，或直接前往廣星傳訊澳門及香港門市、內地銷售點購買門票，亦可透過攜程旅行、Trip.com的手機應用程式，大麥手機應用程式及微信小程序，東瀛遊網站(www.egltours.com)及同悅網國內版微信小程序、中旅旅行微信小程序購票,試車 兩天 每位 百元         正賽 四百 至千 二元         大賽 車門票 今起 發售         【 本報 消息 】 今屆 大賽 車門票 今日 上午 十時 起公開 發售 ， 票價 與 去年 一樣 ， 十一月 十四 及 十五日 的 賽事票 價為 一百 澳門元 ； 十六 及 十七日 的 賽事 票價 介乎 四百 至 一千二百元 不 等 ， 取決 於 不同 看台 。 每人 每次 限購 最多 二十 張門票 ， 凡年 滿 兩歲 或 以上 的 人士 須購票 入場 。 大賽車 並設 有 多個 購票 途徑 ， 包括 現場 銷售點 以及 網上 購票 等 。         線 上下 多渠道 購票         為 方便 居民 及車 迷購 買賽 事門票 ， 大賽車 組委會 在 本澳 、 香港 及 內 地 合共 設有 十五 個 銷售點 ， 並 提供 網上 、 電話 、 電郵及 手機 應用 程式 等 多種 銷售 途徑 。 有興趣 現場 觀看 今屆 大賽車 的 居民 及 旅客 ， 可透過 澳門 售票 網 ( www . macauticket . com ) 、 電郵及 電話 預訂 ， 或 直接 前往 廣星 傳訊 澳門 及 香港 門市 、 內地 銷售點 購買門票 ， 亦可 透過 攜程 旅行 、 Trip . com 的 手機 應用 程式 ， 大麥 手機 應用 程式 及 微信 小 程序 ， 東瀛遊 網站 ( www . egltours . com ) 及 同悅 網國 內版 微信 小 程序 、 中旅 旅行 微信 小 程序 購票 。         賽事 期間 ， 各個 現場 售票 中心 除了 人手 櫃 台服 務外 ， 並設 有 自助 購票機 ， 觀眾 可以 使用 信用卡 及其 他 電子 支付 方式 購票 。         遊澳 看賽車 優惠價         為 發揮 體育 旅遊 的 聯動 效應 ， 今屆 大賽 車繼續 推出 “ 遊澳 看賽車 ” 門票 合作 計劃 。 大賽車 組委會 希望 藉此 計劃 與 本澳 及其 他 地區 的 旅遊 商會 、 旅行社 、 航空公司 或線 上 旅遊 平台 合作 ， 聯動 推出 機票 、 船票 或 酒店 聯乘 今屆 大賽 車賽 事門票 的 套票 優惠 。 有興趣 參 與 “ 遊澳 看賽車 ” 門票 合作 計劃 的 機構 及 商戶 可 與 澳門格蘭 披治大賽車 組委會 聯 繫 洽 談 。 成功 合作者 ， 大會將 按 購票 數量 向 該 商戶 提供 不同 折扣 的 合作 門票 優惠 。,2024-10-23
廿頂尖年輕車手參與FR賽事,廿頂尖年輕車手參與FR賽事    三大高手出戰   GT盃精彩可期    【本報消息】澳門格蘭披治大賽車今年有新轉變，首次引入區域方程式（Formula Regional）賽車，取代三級方程式。 FR賽事吸引超過二十名來自全球的頂尖年輕車手參賽，包括即將晉升一級方程式車手的安東利尼。備受矚目的澳門GT盃賽事，則有澳門賽車的常客莫他拿、晏高及去年冠軍馬些路同場較量，一決高下，精彩可期。    莫他拿爭五冠王    澳門GT世界盃為今年大賽車的“重頭戲”，參賽車輛及車手份量均為歷屆之冠，包括五部保時捷戰車，奧迪、寶馬及平治各有四部，另外法拉利及林寶堅尼各有三部。“澳門先生”莫他拿將首次駕駛林寶堅尼挑戰群雄，力爭個人第五冠；近年大賽車常客、晏高同樣會嘗試爭取個人第四次勝利；去年冠軍馬些路則轉駕寶馬出戰，目標是登上最高領獎台。三位車手同場競技，預料將有一場龍爭虎鬥，令人期待。    自二○一八年推出世界區域方程式，賽事級數介乎F3與F4之間，先在亞洲和北美舉行，翌年拓展至歐洲，二○二○年到日本，今年首度在澳門舉辦。有車迷形容FR賽事“降級”，但國際汽聯則認為，由F3轉變FR是為了吸引更多優秀青少年賽車手，讓澳門的街道賽恢復昔日發掘和歷練年輕高手的精神。    僅一澳車手競FR    今屆FR賽事吸引二十多名來自世界各地頂尖的年輕車手參賽，包括即將進入一級方程式的安東利尼，麥拿侖一級方程式車隊新秀鄧恩，以及去年日本區域方程式錦標賽的冠軍得主小川颯太等，而帝雅戈則是去年中國四級方程式的總冠車，亦是唯一一位參賽的澳門車手。    澳門東望洋大賽——Kumho國際汽聯TCR世界巡迴賽澳門站，再次滙集眾多國際頂尖車手，包括TCR世界巡迴賽衛冕冠軍兼積分榜領先車手米捷利斯，將與隊友阿斯哥拿和基奧拿美，組成強勁的“鐵三角”陣容。緊隨其後，位於積分榜第二位的古里亞利，將與意大利車手布提、塞爾維亞車手博爾科維奇聯手參賽。同場，還有東望洋大賽史上最成功的車手、“九冠王”侯夫，他將駕駛奧迪RS 3 LMS賽車再度挑戰東望洋賽道。    赫爾文格電披甲    澳門格蘭披治電單車——第五十六屆大賽則迎來四屆冠軍赫爾文，他將與九屆冠軍路達和去年澳門賽事亞軍陶德等對手一決高下。大灣區GT盃(GT4)則吸引眾多國際車手及中國車手同場競技；而 “澳門路車挑戰賽”及“澳門路車回歸盃”主要由澳門車手參與，所有參賽車輛均為豐田GR86 (ZN8) 或富士BRZ (ZD8) 出賽，以確保比賽的公平性。,http://www.macaodaily.com/html/2024-10/23/content_1789366.htm,僅一澳車手競FR    今屆FR賽事吸引二十多名來自世界各地頂尖的年輕車手參賽，包括即將進入一級方程式的安東利尼，麥拿侖一級方程式車隊新秀鄧恩，以及去年日本區域方程式錦標賽的冠軍得主小川颯太等，而帝雅戈則是去年中國四級方程式的總冠車，亦是唯一一位參賽的澳門車手,廿頂 尖年 輕車 手參 與 FR 賽事         三大 高手 出戰       GT 盃 精彩 可 期         【 本報 消息 】 澳門格蘭 披治大賽車 今年 有 新 轉變 ， 首次 引入 區域 方程式 （ Formula   Regional ） 賽車 ， 取代 三級 方程式 。   FR 賽事 吸引 超過 二十名 來 自 全球 的 頂 尖 年 輕車手 參賽 ， 包括 即將 晉升 一級 方程式 車手 的 安東利尼 。 備受 矚 目的 澳門 GT 盃 賽事 ， 則有 澳門 賽車 的 常客 莫 他 拿 、 晏高及 去年 冠軍馬些 路 同場 較量 ， 一決 高下 ， 精彩 可 期 。         莫 他 拿爭 五 冠王         澳門 GT 世界 盃 為 今年 大賽車 的 “ 重頭戲 ” ， 參賽 車輛 及 車手 份量 均 為 歷屆 之冠 ， 包括 五部 保時 捷戰車 ， 奧迪 、 寶馬及 平治 各有 四部 ， 另外 法拉利 及林 寶堅尼 各有 三部 。 “ 澳門 先生 ” 莫 他 拿將 首次 駕駛林 寶堅尼 挑戰 群雄 ， 力爭 個 人 第五 冠 ； 近年 大賽車 常客 、 晏高 同樣 會 嘗 試爭 取個 人 第四次 勝利 ； 去年 冠軍馬些 路則 轉駕 寶馬 出戰 ， 目標 是 登上 最高 領獎 台 。 三位 車手 同場 競技 ， 預料 將有 一場 龍爭 虎鬥 ， 令人 期待 。         自二 ○ 一 八年 推出 世界 區域 方程式 ， 賽事級數 介乎 F3 與 F4 之間 ， 先 在 亞洲 和 北美 舉行 ， 翌年 拓展 至 歐洲 ， 二 ○ 二 ○ 年 到 日本 ， 今年 首度 在 澳門 舉辦 。 有車 迷 形容 FR 賽事 “ 降級 ” ， 但國際 汽聯則 認為 ， 由 F3 轉變 FR 是 為 了 吸引 更多 優秀 青少年 賽車 手 ， 讓 澳門 的 街道 賽 恢 復 昔日 發掘 和 歷練 年 輕 高手 的 精神 。         僅一 澳車 手 競 FR         今屆 FR 賽事 吸引 二十多名 來 自 世界各地 頂尖 的 年 輕車手 參賽 ， 包括 即將 進入 一級 方程式 的 安東利尼 ， 麥 拿 侖 一 級 方程式 車隊 新秀 鄧恩 ， 以及 去年 日本 區域 方程式 錦標賽 的 冠 軍 得主 小川 颯太 等 ， 而帝 雅戈 則是 去年 中國 四級 方程式 的 總冠車 ， 亦 是 唯一 一位 參賽 的 澳門 車手 。         澳門東 望洋 大賽 — — Kumho 國際 汽聯 TCR 世界 巡 迴 賽 澳門 站 ， 再次 滙 集眾 多國際 頂 尖車 手 ， 包括 TCR 世界 巡 迴 賽衛冕 冠軍兼積 分榜 領先車 手米 捷利 斯 ， 將與 隊友 阿斯哥 拿 和 基奧拿美 ， 組成 強勁 的 “ 鐵 三角 ” 陣容 。 緊 隨其 後 ， 位 於 積分 榜 第二位 的 古里 亞利 ， 將與 意大利 車手布 提 、 塞爾維亞車 手博爾科維奇 聯手 參賽 。 同場 ， 還有 東 望洋 大賽史 上 最 成功 的 車手 、 “ 九 冠王 ” 侯夫 ， 他將 駕駛 奧迪 RS   3   LMS 賽車 再度 挑戰東 望洋 賽道 。         赫爾文格電 披甲         澳門格蘭 披治電 單車 — — 第五十六 屆 大賽則 迎來 四屆 冠軍赫爾文 ， 他將 與 九屆 冠軍路 達 和 去年 澳門賽 事亞 軍陶德 等 對 手 一決 高下 。 大灣區 GT 盃 ( GT4 ) 則 吸引 眾多國際車 手及 中國 車手 同場 競技 ； 而   “ 澳門 路車 挑戰賽 ” 及 “ 澳門 路車 回歸 盃 ” 主要 由 澳門 車手 參 與 ， 所有 參賽 車輛 均 為 豐田 GR86   ( ZN8 )   或 富士 BRZ   ( ZD8 )   出賽 ， 以確 保比賽 的 公平性 。,2024-10-23
大賽車活動下月初開鑼,親子嘉年華車展攝影賽炒熱氣氛    大賽車活動下月初開鑼    【本報消息】澳門格蘭披治大賽車開鑼前夕，十一月中上旬將舉行多項賽事周邊活動，包括大賽車親子嘉年華、車展及大賽車攝影比賽等，讓居民及旅客一同感受大賽車的熱熾氣氛。    大賽車親子嘉年華活動於十一月二日及三日在塔石廣場舉行，現場將模擬成為東望洋跑道及迷你賽車場，讓小朋友感受大賽車的各類型工作及崗位，從而生動及有趣地認識更多有關賽車活動的知識。    車展活動於十一月九日及十日在塔石廣場舉行，讓居民和遊客能近距離親睹即將參賽的戰車，本屆賽事的開幕禮亦將於十一月九日同場進行，活動現場還設有以大賽車為主題的文創產品銷售攤位。此外，為進一步推廣賽車文化，將繼續舉辦第七十一屆澳門格蘭披治大賽車攝影比賽，鼓勵居民以不同形式參與大賽車活動。,http://www.macaodaily.com/html/2024-10/23/content_1789367.htm,親子嘉年華車展攝影賽炒熱氣氛    大賽車活動下月初開鑼    【本報消息】澳門格蘭披治大賽車開鑼前夕，十一月中上旬將舉行多項賽事周邊活動，包括大賽車親子嘉年華、車展及大賽車攝影比賽等，讓居民及旅客一同感受大賽車的熱熾氣氛,親子 嘉年 華車展 攝影賽 炒 熱氣氛         大賽車 活動 下月初 開鑼         【 本報 消息 】 澳門格蘭 披治大賽 車開鑼 前夕 ， 十一月 中 上旬 將舉行 多 項賽 事 周邊 活動 ， 包括 大賽車 親子 嘉年華 、 車展 及 大賽車 攝影 比賽 等 ， 讓 居民 及 旅客 一同 感受 大賽車 的 熱熾氣氛 。         大賽車 親子 嘉年華 活動 於 十一月 二日 及 三日 在 塔 石廣場 舉行 ， 現場 將模 擬成 為 東 望洋 跑道 及 迷你 賽車場 ， 讓 小朋友 感受 大賽車 的 各類 型 工作 及崗位 ， 從 而 生動 及 有趣 地 認識 更 多 有 關賽車 活動 的 知識 。         車展 活動 於 十一月 九日 及 十日 在 塔 石廣場 舉行 ， 讓 居民 和 遊客 能 近距 離親睹 即將 參賽 的 戰車 ， 本屆 賽事 的 開幕 禮亦將 於 十一月 九日 同場 進行 ， 活動 現場 還設 有 以大賽 車為 主題 的 文 創產品 銷售 攤位 。 此外 ， 為進 一步 推廣賽車 文化 ， 將繼續 舉辦 第七十一 屆 澳門格蘭 披治大賽 車攝 影比賽 ， 鼓勵 居民 以 不同 形式 參與 大賽車 活動 。,2024-10-23
打通經脈   周維勤  攝,打通經脈    興建中的新城A區第三條行車天橋將有四條車道接入市區。圖為連接港澳碼頭方向車道的落腳點。   周維勤   攝,http://www.macaodaily.com/html/2024-10/23/content_1789368.htm,打通經脈    興建中的新城A區第三條行車天橋將有四條車道接入市區,打通 經脈         興 建中 的 新城 A 區 第三 條行車 天橋 將有 四條 車道 接入 市區 。 圖為 連接 港澳 碼頭 方向 車道 的 落腳點 。       周維勤       攝,2024-10-23
