Title,Content,Link,Summary,Preprocessed_Content,Date
法聯會向兩校師生宣講三法,法聯會向兩校師生宣講三法    澳門法律工作者聯合會於十月廿六日上午在會址舉行本年度第六場“青年法律工作者走進校園”活動，邀請鏡平學校及利瑪竇中學共四十名學生參與，鏡平學校教師廖潤賢及利瑪竇中學副校長胡詠欣出席。    本次活動由青年部部長黃景禧主持，憲法主題講者張宏哲、基本法主題講者施麗君、國安法主題講者廖志漢及小組分享人殷鈴貽、周挺、李心妍、蔡依瑩、陳景禧、鄭兆甯等出席活動。    在普法環節中，張宏哲、施麗君、廖志漢用生動的方式講解法律背景及規定，詳細地向同學們介紹憲法、基本法和維護國家安全法的重要意義和核心內容，並與同學們互動答問，氣氛熱鬧。在小組分享與討論環節中，青年法律工作者與同學們面對面就學習法律知識、法律行業職涯規劃、澳門法律工作者在內地的發展機遇、青少年保護與犯罪預防、當前熱點法律問題等方面交流。,http://www.macaodaily.com/html/2024-11/10/content_1793109.htm,法聯會向兩校師生宣講三法    澳門法律工作者聯合會於十月廿六日上午在會址舉行本年度第六場“青年法律工作者走進校園”活動，邀請鏡平學校及利瑪竇中學共四十名學生參與，鏡平學校教師廖潤賢及利瑪竇中學副校長胡詠欣出席,法聯會 向 兩校 師生 宣講 三法         澳門 法律 工作者 聯合會 於 十月 廿六日 上午 在 會址 舉行 本年度 第六 場 “ 青年 法律 工作者 走進 校園 ” 活動 ， 邀請鏡 平學校 及利瑪 竇中學 共 四十名 學生 參 與 ， 鏡平學校 教師 廖潤賢及 利瑪 竇中學 副 校長 胡詠 欣 出席 。         本次 活動 由 青年 部部長 黃 景禧 主持 ， 憲法 主題 講者 張宏哲 、 基本法 主題 講者 施麗君 、 國安法 主題 講者 廖志漢及 小組 分享 人 殷鈴 貽 、 周挺 、 李心妍 、 蔡依瑩 、 陳 景禧 、 鄭兆 甯 等 出席 活動 。         在 普法 環節 中 ， 張宏哲 、 施麗君 、 廖志漢用 生動 的 方式 講解 法律 背景 及 規定 ， 詳細地 向 同學們 介紹 憲法 、 基本法 和 維護國家 安全法 的 重要 意義和 核心 內容 ， 並與 同學們 互動 答問 ， 氣氛 熱鬧 。 在 小組 分享 與 討論 環節 中 ， 青年 法律 工作者 與 同學們 面對面 就 學習 法律 知識 、 法律 行業 職涯 規劃 、 澳門 法律 工作者 在 內 地 的 發展 機遇 、 青少年 保護 與 犯罪 預防 、 當前 熱點 法律 問題 等 方面 交流 。,2024-11-10
聖德蘭親子旅行享天倫,聖德蘭親子旅行享天倫    聖德蘭學校幼稚園昨日在石排灣郊野公園舉行一年一度親子旅行，活動目的是讓家長在大自然陪伴幼兒，透過不同活動探索學習，配合國家推行“永續發展”目標。老師也鼓勵幼兒使用環保餐具及珍惜食物，在生活中實踐愛護環境的美德。,http://www.macaodaily.com/html/2024-11/10/content_1793110.htm,聖德蘭親子旅行享天倫    聖德蘭學校幼稚園昨日在石排灣郊野公園舉行一年一度親子旅行，活動目的是讓家長在大自然陪伴幼兒，透過不同活動探索學習，配合國家推行“永續發展”目標,聖德蘭 親子 旅行 享天倫         聖德蘭學校 幼稚 園 昨日 在 石 排灣 郊野 公園 舉行 一年一度 親子 旅行 ， 活動 目的 是 讓 家長 在 大自然 陪伴 幼兒 ， 透過 不同 活動 探索 學習 ， 配合 國家 推行 “ 永續 發展 ” 目標 。 老師 也 鼓勵 幼兒 使用 環保 餐具 及 珍惜 食物 ， 在生活中 實踐 愛護 環境 的 美德 。,2024-11-10
澳大講座紀念葡作家瑪麗亞,澳大講座紀念葡作家瑪麗亞    澳門大學日前舉辦紀念葡萄牙著名作家瑪麗亞 · 翁迪娜 · 布拉嘉的講座及展覽，以弘揚中葡兩國友誼並宣揚瑪麗亞 · 布拉嘉在文學及中葡文化交流領域的重要貢獻。    瑪麗亞 · 布拉嘉是葡萄牙二十世紀最具影響力的作家之一。作品涵蓋小說、散文、遊記等多種體裁，以細膩筆觸呈現其在澳門、印度、安哥拉等地的生活與觀察，並深刻反映對異國文化的敏銳理解及對跨文化交際的獨特思考。    時任澳大葡文系教授姚京明和教授Dora Nunes Gago受邀參加活動。姚京明分享與瑪麗亞 · 布拉嘉的友誼故事。Dora Nunes Gago介紹其在澳門的生活經歷和寫作歷程。    是次活動為學術界提供交流平台，並為大眾帶來全面了解瑪麗亞 · 布拉嘉及其作品的機會，讓大眾走進這位作家的內心世界，感受她筆下多元文化的交匯與融合。,http://www.macaodaily.com/html/2024-11/10/content_1793111.htm,澳大講座紀念葡作家瑪麗亞    澳門大學日前舉辦紀念葡萄牙著名作家瑪麗亞 · 翁迪娜 · 布拉嘉的講座及展覽，以弘揚中葡兩國友誼並宣揚瑪麗亞 · 布拉嘉在文學及中葡文化交流領域的重要貢獻,澳大 講座 紀念 葡 作家 瑪麗亞         澳門 大學 日前 舉辦 紀念 葡萄牙 著名作家 瑪麗亞   ·   翁迪娜   ·   布拉 嘉 的 講座 及 展覽 ， 以弘揚 中葡 兩國友誼 並宣揚 瑪麗亞   ·   布拉 嘉在 文學及 中葡 文化交流 領域 的 重要 貢獻 。         瑪麗亞   ·   布拉 嘉是 葡萄牙 二十 世紀 最具 影響力 的 作家 之一 。 作品 涵蓋 小 說 、 散文 、 遊記 等 多種 體裁 ， 以細膩 筆觸 呈 現其 在 澳門 、 印度 、 安哥拉 等 地 的 生活 與 觀察 ， 並 深刻 反映 對 異國 文化 的 敏銳 理解 及 對 跨文化 交際 的 獨特 思考 。         時任 澳大 葡文 系 教授 姚京明 和 教授 Dora   Nunes   Gago 受邀 參加 活動 。 姚京明 分享 與 瑪麗亞   ·   布拉 嘉 的 友誼 故事 。 Dora   Nunes   Gago 介紹 其 在 澳門 的 生活 經歷 和 寫作 歷程 。         是 次 活動 為 學術界 提供 交流平台 ， 並為 大眾 帶來 全面 了解 瑪麗亞   ·   布拉 嘉 及其 作品 的 機會 ， 讓 大眾 走進 這位 作家 的 內心 世界 ， 感受 她 筆下 多元 文化 的 交匯 與 融合 。,2024-11-10
演院劇目《戲劇春秋》售票,演院劇目《戲劇春秋》售票    為慶祝澳門特區成立二十五周年及澳門演藝學院成立三十五周年，澳門演藝學院戲劇學校將於十二月七日（星期六）下午二時四十五分和晚上七時四十五分，在澳門文化中心小劇院演出中華文化優秀劇目《戲劇春秋》。    是次演出得到北京中央戲劇學院大力支持，並特別派遣導演系和舞美系的資深教授李珊和張華翔親臨澳門，與戲劇學校的師生和校友攜手合作，共同打造這部經典劇目，與觀眾經歷戲劇運動發展一路走來的感人時刻。    《戲劇春秋》門票即日起公開發售，票價分為一百五十及二百澳門元，另設多項票務優惠，澳門售票網訂票熱線及查詢二八五五 · 五五五五，網上訂票www.macauticket.com。演出詳情可瀏覽澳門演藝學院網頁www.cons.gov.mo，或於辦公時間致電二八七○ · 一五八八查詢。,http://www.macaodaily.com/html/2024-11/10/content_1793112.htm,演院劇目《戲劇春秋》售票    為慶祝澳門特區成立二十五周年及澳門演藝學院成立三十五周年，澳門演藝學院戲劇學校將於十二月七日（星期六）下午二時四十五分和晚上七時四十五分，在澳門文化中心小劇院演出中華文化優秀劇目《戲劇春秋》,演院 劇目 《 戲劇 春秋 》 售票         為慶祝 澳門 特區 成立 二十五 周年 及 澳門 演藝學院 成立 三十五周年 ， 澳門 演藝學院 戲劇學 校將 於 十二月 七日 （ 星期六 ） 下午 二時 四十五分 和 晚上 七時 四十五分 ， 在 澳門 文化 中心 小劇院 演出 中華 文化 優秀 劇目 《 戲劇 春秋 》 。         是 次 演出 得到 北京 中央 戲劇 學院 大力支持 ， 並特別 派遣 導演系 和 舞美 系 的 資深 教授 李珊 和 張華翔 親臨 澳門 ， 與 戲劇 學校 的 師生 和 校友 攜手 合作 ， 共同 打造 這部 經典 劇目 ， 與 觀眾 經歷 戲劇 運動 發展 一路 走來 的 感人 時刻 。         《 戲劇 春秋 》 門票 即日起 公開 發售 ， 票價分 為 一百五十 及 二百 澳門元 ， 另設 多 項票務 優惠 ， 澳門 售票 網訂票 熱線 及 查詢 二 八五 五   ·   五五 五五 ， 網上 訂票 www . macauticket . com 。 演出 詳情 可 瀏覽 澳門 演藝學院 網頁 www . cons . gov . mo ， 或 於 辦公時間 致電二 八七 ○   ·   一五 八八 查詢 。,2024-11-10
城大赴滬寧辦招生宣講會,城大赴滬寧辦招生宣講會    澳門城市大學為幫助學生更好了解城大的學科特色、院系優勢及招生政策，十一月八日至九日分別在上海及南京舉辦二五／二六學年招生宣講會。此次宣講會由城大校長劉駿、協理副校長陳俊拔帶隊，攜十大學院院長、課程主任等親臨現場，吸引近三百名學生及其家長參與。    宣講會上劉駿表示，在上海及南京舉辦招生宣講會，不僅為展示城大的教育理念和學科特色，更是為吸引更多有志於在前沿領域深造的優秀學生加入城大大家庭。數據科學學院副院長朱天清介紹近年城大科研成果及學術水平成倍增長。十大學院院長、課程主任及招生事務處專員詳細介紹各自學院及課程特色與優勢。為幫助家長與學生對各課程有更清晰了解，本次宣講會特別設置學院展台，為學生們答疑解惑的同時，激發對未來學術生涯的美好憧憬。,http://www.macaodaily.com/html/2024-11/10/content_1793113.htm,此次宣講會由城大校長劉駿、協理副校長陳俊拔帶隊，攜十大學院院長、課程主任等親臨現場，吸引近三百名學生及其家長參與,城大赴 滬寧辦 招生 宣講會         澳門 城市 大學為 幫助 學生 更好 了解 城大 的 學科 特色 、 院系 優勢 及 招生 政策 ， 十一月 八日 至 九日 分別 在 上海 及 南京 舉辦 二五 ／ 二六 學年 招生 宣講會 。 此次 宣講會 由城 大校 長 劉駿 、 協理 副 校長 陳 俊拔 帶隊 ， 攜 十大 學院 院長 、 課程 主任 等 親臨 現場 ， 吸引 近 三百名 學生 及其 家長 參 與 。         宣講會 上 劉駿 表示 ， 在 上海 及 南京 舉辦 招生 宣講會 ， 不僅 為 展示 城大 的 教育 理念 和 學科 特色 ， 更是 為 吸引 更 多 有志 於 在 前沿 領域 深造 的 優秀學生 加入 城 大大 家庭 。 數據 科學學院 副 院長 朱天 清介紹 近年 城大 科研成果 及學術 水平 成 倍增 長 。 十大 學院 院長 、 課程 主任 及 招生 事務處 專員詳 細介紹 各自 學院 及 課程 特色 與 優勢 。 為 幫助家長 與 學生 對 各 課程 有 更 清晰 了解 ， 本次 宣講會 特別 設置 學院 展台 ， 為學 生們 答疑 解惑 的 同時 ， 激發 對 未來 學術 生涯 的 美好 憧憬 。,2024-11-10
專家科大談新污染物治理,專家科大談新污染物治理    由澳門科技大學主辦，新偉浩進出口貿易有限公司支持的科技大師講座“新污染物治理重大科技需求”於十一月六日下午在大學D座演講廳舉辦。講座邀請到中國工程院院士、環境基準標準與污染防治專家吳丰昌主講。澳科大校副校監、校長李行偉致辭，歡迎並感謝吳院士為澳科大師生作專題演講。講座伊始，吳丰昌概述了環境基準標準與風險管控全國重點實驗室，並講述新污染物的概念、主要類型及危害，指出新污染物治理關乎生態文明建設與人民生命健康，是推動綠色低碳發展與產業轉型升級的難得機遇。    吳丰昌還為大家介紹了新污染物治理的研究現狀與科技挑戰，並提出了新污染物治理的戰略佈局、預期目標和總體技術路線，詳細介紹幾項重點研究任務、治理的經濟社會與環境效益。,http://www.macaodaily.com/html/2024-11/10/content_1793114.htm,講座伊始，吳丰昌概述了環境基準標準與風險管控全國重點實驗室，並講述新污染物的概念、主要類型及危害，指出新污染物治理關乎生態文明建設與人民生命健康，是推動綠色低碳發展與產業轉型升級的難得機遇,專家 科大 談新 污染物 治理         由 澳門 科技 大學主辦 ， 新偉浩進 出口 貿易 有限公司 支持 的 科技 大師 講座 “ 新 污染物 治理 重大 科技 需求 ” 於 十一月 六日 下午 在 大學 D座 演講廳 舉辦 。 講座 邀請 到 中國 工程院 院士 、 環境 基準 標準 與 污染 防治 專家 吳丰昌主講 。 澳科 大校 副 校監 、 校長 李行 偉致 辭 ， 歡迎 並感 謝吳 院士 為 澳 科大 師生作 專題 演講 。 講座 伊始 ， 吳丰昌 概述 了 環境 基準 標準 與 風險 管控 全國 重點 實驗室 ， 並講述 新 污染物 的 概念 、 主要 類型 及 危害 ， 指出 新 污染物 治理 關乎 生態 文明 建設 與 人民 生命 健康 ， 是 推動 綠色 低 碳 發展 與 產業 轉型 升級 的 難得 機遇 。         吳丰昌 還為 大家 介紹 了 新 污染物 治理 的 研究 現狀 與 科技 挑戰 ， 並 提出 了 新 污染物 治理 的 戰略 佈 局 、 預期 目標 和 總體 技術 路線 ， 詳細介紹 幾項 重點 研究 任務 、 治理 的 經濟 社會 與 環境 效益 。,2024-11-10
母親會托所角色扮演推廣閱讀,母親會托所角色扮演推廣閱讀    為積極推行幼兒閱讀活動，母親會聖約翰托兒所日前分別舉辦幼兒故事角色扮演日，讓幼兒除了觀看、聆聽喜愛故事外，還可以透過扮演喜歡的角色來深入理解故事的內容，藉此令幼兒增加閱讀的興趣及豐富其想像力。    角色扮演日當天各院所合共六百名幼兒參與活動，托兒所內特設多個著名童話故事的場景，幼兒們穿着各式故事人物服飾，導師們亦繪聲繪影地演說故事，與幼兒一同扮演書中角色，藉此啟發幼兒們的想象力。導師與幼兒一起頌唱最受幼兒歡迎歌曲《BABY SHARK》，還讓幼兒手拿樂器跟着音樂節拍一齊扭動身體，場面趣致可愛；托兒所還為幼兒搭建表演舞台，讓精心打扮不同造型的幼兒嘗試Catwalk show表演，感受舞台上氣氛。隨後班室員工更與幼兒一起進行集體遊戲，班室內氣氛熱鬧及充滿了歡笑聲，幼兒們童真笑聲更如洗滌人心動人的曲韻。,http://www.macaodaily.com/html/2024-11/10/content_1793115.htm,角色扮演日當天各院所合共六百名幼兒參與活動，托兒所內特設多個著名童話故事的場景，幼兒們穿着各式故事人物服飾，導師們亦繪聲繪影地演說故事，與幼兒一同扮演書中角色，藉此啟發幼兒們的想象力,母親 會托 所 角色扮演 推廣 閱讀         為 積極 推行 幼兒 閱讀 活動 ， 母親會 聖約 翰托兒 所 日前 分別 舉辦 幼兒 故事 角色扮演 日 ， 讓 幼兒 除了 觀看 、 聆 聽 喜 愛 故事 外 ， 還 可以 透過 扮演 喜歡 的 角色 來 深入 理解 故事 的 內容 ， 藉此 令幼兒 增加 閱讀 的 興趣 及 豐富 其 想像力 。         角色扮演 日當天 各 院所 合共 六百名 幼兒 參與 活動 ， 托兒 所內 特設 多個 著名 童話 故事 的 場景 ， 幼兒們 穿着 各式 故事 人物 服飾 ， 導師們 亦 繪聲 繪影 地演 說 故事 ， 與 幼兒 一同 扮演 書中 角色 ， 藉此 啟發 幼兒們 的 想象力 。 導師 與 幼兒 一起 頌唱 最受 幼兒 歡迎 歌曲 《 BABY   SHARK 》 ， 還讓 幼兒 手拿樂器 跟着 音樂節 拍 一齊 扭動 身體 ， 場面 趣致 可 愛 ； 托兒 所 還為 幼兒 搭建 表演 舞台 ， 讓 精心 打扮 不同 造型 的 幼兒 嘗試 Catwalk   show 表演 ， 感受 舞台 上氣氛 。 隨後班 室員工 更 與 幼兒 一起 進行 集體 遊戲 ， 班室 內氣氛 熱鬧 及 充滿 了 歡笑聲 ， 幼兒們 童真 笑聲 更 如洗 滌 人心 動人 的 曲韻 。,2024-11-10
暨大澳聯主席團換屆,暨大澳聯主席團換屆    第二十九屆暨南大學澳門學生聯合會總結暨成員見面會於十月廿六日在暨南大學石牌校區舉行。澳門中聯辦廣東聯絡部綜合處處長、二級巡視員李國文，中聯辦教育與青年工作部代表馮子銘，暨南大學對外聯絡處駐澳門聯絡處主任謝偉卡等出席並致以熱烈祝賀。    第二十九屆暨澳聯主席團代表梁志軒致辭，簡要回顧了過去一年裡取得的突出成果，並代表新一屆暨澳聯承諾，將繼續以“團結、熱情、友愛”為宗旨，積極組織更多有意義的活動，促進學術交流和社會實踐，為澳門學生提供更優質、更貼心的服務，與所有同學攜手共進，為暨南大學的繁榮發展貢獻力量。見面會上，馮子銘為第二十九屆暨澳聯主席團成員梁志軒、吳倩華、黎欣桐、趙雅雯、張佩琳頒發聘書。隨後由新一屆主席團成員向各負責人頒發聘書，標誌着新一屆團隊正式履職。,http://www.macaodaily.com/html/2024-11/10/content_1793117.htm,第二十九屆暨澳聯主席團代表梁志軒致辭，簡要回顧了過去一年裡取得的突出成果，並代表新一屆暨澳聯承諾，將繼續以“團結、熱情、友愛”為宗旨，積極組織更多有意義的活動，促進學術交流和社會實踐，為澳門學生提供更優質、更貼心的服務，與所有同學攜手共進，為暨南大學的繁榮發展貢獻力量,暨 大澳 聯 主席 團換 屆         第二十九 屆 暨南 大學 澳門 學生 聯合會 總結 暨 成員見 面會 於 十月 廿六日 在 暨南 大學 石牌 校區 舉行 。 澳門 中聯辦 廣東 聯絡部 綜合處 處長 、 二級 巡視員 李國文 ， 中聯辦 教育 與 青年 工作部 代表 馮子銘 ， 暨南 大學 對 外聯絡 處 駐 澳門 聯絡處 主任 謝偉卡 等 出席 並 致以 熱烈 祝賀 。         第二十九 屆 暨 澳聯 主席 團 代表 梁志軒 致辭 ， 簡要 回顧 了 過去 一年 裡 取得 的 突出 成果 ， 並 代表 新一屆 暨 澳聯承諾 ， 將繼續 以 “ 團結 、 熱情 、 友愛 ” 為 宗旨 ， 積極 組織 更 多 有意 義的 活動 ， 促進 學術 交流 和 社會 實踐 ， 為 澳門 學生 提供 更 優質 、 更 貼心 的 服務 ， 與 所有 同學 攜 手共進 ， 為 暨南 大學 的 繁榮 發展 貢獻 力量 。 見 面會 上 ， 馮子銘 為 第二十九 屆 暨 澳聯 主席 團成員 梁志軒 、 吳倩華 、 黎欣桐 、 趙 雅雯 、 張佩琳 頒 發聘書 。 隨後由 新 一屆 主席 團成員 向 各 負責人 頒 發聘書 ， 標誌 着 新 一屆 團隊 正式 履職 。,2024-11-10
展藝館展三青年插畫作品,展藝館展三青年插畫作品    教青展局轄下青少年展藝館由即日起至本月廿四日展出“步食糰隊覓險記”——Aurélio、曹家傑、鄭詠琳澳門IP插畫展。是次展覽將展出三位青年IP創作者的聯合插畫，Aurélio Franco Lewis是小熊步步的創作者，曹家傑和鄭詠琳是皮克樂園的創作者。展覽內容是講述步步被邀請在美食節擺放一個美食攤檔，當中遇到重重困難，最後得到朋友豬大叔和皮克樂園的飯糰、湯圓和豆花幫助下成功完成攤檔。作者期望透過展覽介紹澳門，以不同視覺展示小城的魅力。    展覽免費入場，歡迎有興趣的居民前往參觀。如需查詢，請於辦公時間致電二八五六 · 二八○一或二八五六 · 五四六三，或瀏覽青少年展藝館網頁(www.dsedj.gov.mo/peeaj)。,http://www.macaodaily.com/html/2024-11/10/content_1793118.htm,是次展覽將展出三位青年IP創作者的聯合插畫，Aurélio Franco Lewis是小熊步步的創作者，曹家傑和鄭詠琳是皮克樂園的創作者,展藝館展 三 青年 插畫 作品         教青展 局轄下 青少年 展藝館 由 即日起 至 本月 廿四日 展出 “ 步食 糰 隊 覓 險記 ” — — Aur é lio 、 曹家傑 、 鄭詠琳 澳門 IP 插畫展 。 是 次 展覽將 展出 三位 青年 IP 創 作者 的 聯合 插畫 ， Aur é lio   Franco   Lewis 是 小熊 步步 的 創 作者 ， 曹家傑 和 鄭詠琳 是 皮克樂園 的 創 作者 。 展覽 內容 是 講述 步步 被 邀 請 在 美食 節擺放 一個 美食 攤檔 ， 當中 遇到 重重 困難 ， 最 後 得到 朋友 豬 大叔 和 皮克樂園 的 飯 糰 、 湯圓 和 豆花 幫助 下 成功 完成 攤檔 。 作者 期望 透過 展覽 介紹 澳門 ， 以 不同 視覺 展示 小城 的 魅力 。         展覽 免費 入場 ， 歡迎 有 興趣 的 居民 前往 參觀 。 如 需查詢 ， 請 於 辦公時間 致電 二八 五六   ·   二八 ○ 一 或 二八 五六   ·   五四 六三 ， 或 瀏覽 青少年 展藝館 網頁 ( www . dsedj . gov . mo / peeaj ) 。,2024-11-10
氹坊邀民康會宣傳共融社會,氹坊邀民康會宣傳共融社會    氹坊校日前邀請澳門民康精神健康促進會的理監事及眾會員到校，與高二級同學交流及分享。    民康會總幹事羅耀祖總幹事向同學介紹該會的工作概況後，以自身的成長經歷為例，教導同學消化負面情緒的技巧，同時亦勉勵同學要勇於接受挑戰，不畏挫折，迎難而上。舞台上，先由民康會員為同學獻唱及表演健康操，再有同學們演奏《友誼萬歲》和獻唱《楓》，現場氣氛熱鬧。    本次活動讓同學們認識到“共融社會”的理念，明白應關愛及公平對待社會上不同需要的人士，有助培養同學的同理心，未來以正面態度去尊重和接納其他人的不同和需要，促進和諧社區。,http://www.macaodaily.com/html/2024-11/10/content_1793119.htm,民康會總幹事羅耀祖總幹事向同學介紹該會的工作概況後，以自身的成長經歷為例，教導同學消化負面情緒的技巧，同時亦勉勵同學要勇於接受挑戰，不畏挫折，迎難而上,氹坊 邀民康會 宣傳共融 社會         氹坊校 日前 邀請 澳門民康 精神 健康 促進會 的 理監 事及 眾會員 到校 ， 與 高二級 同學 交流 及 分享 。         民康會 總幹 事羅 耀祖 總幹事 向 同學 介紹 該 會 的 工作 概況 後 ， 以 自身 的 成長 經歷 為例 ， 教導 同學 消化 負面 情緒 的 技巧 ， 同時 亦 勉勵 同學要 勇 於 接受 挑戰 ， 不畏 挫折 ， 迎難 而 上 。 舞台 上 ， 先由民康 會員為 同學獻 唱 及 表演 健康 操 ， 再有 同學們 演奏 《 友誼 萬歲 》 和 獻 唱 《 楓 》 ， 現場 氣氛 熱鬧 。         本次 活動 讓 同學們 認識 到 “ 共融 社會 ” 的 理念 ， 明白 應關 愛及 公平 對待 社會 上 不同 需要 的 人士 ， 有助 培養 同學 的 同理 心 ， 未來 以 正面 態度 去 尊重 和 接納 其他人 的 不同 和 需要 ， 促進 和諧 社區 。,2024-11-10
