Title,Content,Link,Summary,Preprocessed_Content,Date
徐正溪疑引退登熱搜,被爆與經紀公司不合    徐正溪疑引退登熱搜    三十八歲內地男星徐正溪日前發文表示“告別演員崗位”，又聲稱將會完成手頭上的工作，引來不少網民猜想他是不是要全面退出娛樂圈，即時成為微博熱搜，掀起逾一億閱讀量。    徐正溪當日在微博貼上一張身穿籃球衣，默默退場的背影照，寫着：“告別演員崗位，謝謝長久支持，給你們添麻煩了，感謝一切，我愛你們。”之後又在留言區稱：“會完成手頭上的目前接納的工作。”    徐正溪突然其來的“引退”言論在網上大受關注，粉絲紛紛湧入留言區表示：“我震驚了，退圈？”“你不是說還要堅持十二年嗎？”“我當你近期情緒不好，這條微博不算數。”    據內地網媒報道，目前徐正溪與所屬經紀公司因為在對接的項目中，想法無法一致，而對於未來規劃也不同，傳聞正在商談解約，但傳媒致電有關公司查詢並沒有回應。有網友爆料，其實徐正溪所屬經紀公司一直不顧他本人意願，迫他接不想拍的戲劇作品，與公司溝通無果後，他才不惜任何代價都想解約。然而公司堅持不放人，徐正溪最後只能崩潰到發文要“引退”。    徐正溪出道至今十八年，曾在多部古裝劇中表現出色，令觀眾印象深刻，演技受到肯定。他與歐陽娜娜合演的古裝懸疑愛情劇《永安夢》本月十四日才剛播完，劇中平穩的演出受到觀眾認可。另外，徐正溪近期新戲《烈焰》也才開播沒幾天，還有《錦衣夜行》、《流水迢迢》、《水龍吟》等三部作品在待播中。    徐正溪於二○一三年在上海拍劇時，與較他年長六歲的港星周勵淇曾擦出愛火。這段戀情僅僅持續兩年時間，後來兩人因工作繁忙聚少離多而分手。,http://www.macaodaily.com/html/2024-03/17/content_1742019.htm,被爆與經紀公司不合    徐正溪疑引退登熱搜    三十八歲內地男星徐正溪日前發文表示“告別演員崗位”，又聲稱將會完成手頭上的工作，引來不少網民猜想他是不是要全面退出娛樂圈，即時成為微博熱搜，掀起逾一億閱讀量,被 爆 與 經紀 公司 不合         徐正溪疑 引退 登熱 搜         三十八 歲 內 地 男星 徐正溪 日前 發文 表示 “ 告別 演員崗位 ” ， 又 聲稱 將會 完成 手頭 上 的 工作 ， 引來 不少 網民 猜想 他 是不是 要 全面 退出 娛樂圈 ， 即時 成為 微博熱 搜 ， 掀起 逾 一 億閱 讀量 。         徐正溪 當日 在 微博貼 上 一張 身穿 籃 球衣 ， 默默 退場 的 背影 照 ， 寫 着 ： “ 告別 演員崗位 ， 謝謝長 久 支持 ， 給你們 添麻煩 了 ， 感謝 一切 ， 我 愛你們 。 ” 之 後 又 在 留言 區稱 ： “ 會 完成 手頭 上 的 目前 接納 的 工作 。 ”         徐正溪 突然 其來 的 “ 引退 ” 言論 在 網上 大受 關注 ， 粉絲 紛紛 湧入 留言 區 表示 ： “ 我震 驚 了 ， 退圈 ？ ” “ 你 不是 說 還要 堅持 十二年 嗎 ？ ” “ 我當 你 近期 情緒 不好 ， 這條 微博 不算 數 。 ”         據 內 地網 媒報 道 ， 目前 徐正溪 與 所屬 經紀 公司 因為 在 對 接 的 項目 中 ， 想法 無法 一致 ， 而 對 於 未來 規劃 也 不同 ， 傳聞 正在 商談 解約 ， 但 傳媒致 電有關 公司 查詢 並沒有 回應 。 有 網友 爆料 ， 其實 徐正溪 所屬 經紀 公司 一直 不顧 他 本人 意願 ， 迫 他 接 不想 拍 的 戲劇 作品 ， 與 公司 溝通 無果 後 ， 他 才 不惜 任何 代價 都 想 解約 。 然而 公司 堅持 不放人 ， 徐正溪 最 後 只能 崩潰 到 發文要 “ 引退 ” 。         徐正溪 出道 至今 十八年 ， 曾 在 多部 古裝劇 中表現 出色 ， 令觀眾 印象 深刻 ， 演技 受到 肯定 。 他 與 歐陽 娜娜 合演 的 古裝 懸疑 愛情劇 《 永安 夢 》 本月 十四日 才 剛播 完 ， 劇 中平 穩 的 演出 受到 觀眾 認可 。 另外 ， 徐正溪 近期 新戲 《 烈焰 》 也 才 開播 沒 幾天 ， 還有 《 錦衣 夜行 》 、 《 流水 迢迢 》 、 《 水龍吟 》 等 三部 作品 在 待播 中 。         徐正溪 於 二 ○ 一 三年 在 上海 拍劇 時 ， 與 較 他 年 長 六歲 的 港星 周勵 淇 曾 擦 出愛火 。 這段 戀情 僅僅 持續 兩年 時間 ， 後 來 兩人 因 工作 繁忙 聚少離 多 而 分手 。,2024-03-17
許光漢新片台首映票房奪冠,許光漢新片台首映票房奪冠    台日合作的愛情電影《青春18x2 通往有你的旅程》本月十四日在台上映，開片首日全台收七百七十萬票房佳績，拿下全台票房冠軍寶座。日籍導演藤井道人和女主角清原果耶特地到台宣傳，與監製張震和男主角許光漢出席多場戲院見面會。藤井導演感謝大家前來：“電影集結了台日兩地很棒的團隊，不管是一個人看還是跟朋友、家人、情人一起來欣賞，應該都會很喜歡，也希望藉着兩地的力量，接下來繼續將電影推廣到全世界。”    女主角清原果耶更是圈粉無數，讓台灣觀眾留下深刻又美好的印象。行程結束後清原果耶特別去品嘗台北知名麻辣鍋，吃後表示非常滿足，並希望在離台前還能吃到鳳梨酥。,http://www.macaodaily.com/html/2024-03/17/content_1742023.htm,藤井導演感謝大家前來：“電影集結了台日兩地很棒的團隊，不管是一個人看還是跟朋友、家人、情人一起來欣賞，應該都會很喜歡，也希望藉着兩地的力量，接下來繼續將電影推廣到全世界,許光漢 新片 台 首映 票房 奪冠         台日 合作 的 愛情 電影 《 青春 18x2   通往 有 你 的 旅程 》 本月 十四日 在 台 上映 ， 開片 首日 全台 收 七百 七十 萬 票房 佳績 ， 拿下 全 台 票房 冠軍寶座 。 日籍 導演藤井 道人 和 女主角 清原 果耶 特地到 台 宣傳 ， 與 監 製 張 震 和 男主角 許光漢 出席 多場 戲院 見 面會 。 藤井導 演感謝 大家 前來 ： “ 電 影集 結了 台日 兩地 很棒 的 團隊 ， 不管 是 一個 人 看 還是 跟 朋友 、 家人 、 情人 一起 來欣賞 ， 應該 都 會 很 喜歡 ， 也 希望 藉 着 兩地 的 力量 ， 接下 來 繼續 將電影 推廣到 全世界 。 ”         女主角 清原 果耶 更是 圈粉 無數 ， 讓 台灣 觀眾 留下 深刻 又 美好 的 印象 。 行程 結束 後 清原 果耶特別 去 品嘗 台北 知名 麻辣 鍋 ， 吃 後 表示 非常 滿足 ， 並 希望 在 離 台前 還能 吃 到 鳳梨 酥 。,2024-03-17
郭書瑤冰天雪地露春光,郭書瑤冰天雪地露春光    三十三歲女星郭書瑤（瑤瑤）近日到日本度假，前日在IG上傳一張滑雪照，大方脫掉外套露出胸前春光，還問大家：“好看嗎？！”立刻吸引數萬人按讚。照片中，郭書瑤手拿雪板笑得燦爛，在雪地脫掉上身保暖衣服，單穿黑色運動內衣，映襯她的白皙肌膚之外，也完美襯托出豐滿上圍。    郭書瑤近年在戲劇領域表現亮眼，她和林子閎主演的愛情喜劇《完全省錢戀愛手冊》二月殺青，將於四月開播。兩人為宣傳這部由台灣和新加坡傳媒首度聯手合作的新劇，日前專誠到香港出席“香港國際影視展”，和大家分享拍攝軼事。兩人也談起與新加坡演員的合作，大讚對方對喜劇節奏的掌握很厲害，拍戲過程中不同文化撞擊出精彩的火花。,http://www.macaodaily.com/html/2024-03/17/content_1742025.htm,兩人也談起與新加坡演員的合作，大讚對方對喜劇節奏的掌握很厲害，拍戲過程中不同文化撞擊出精彩的火花,郭書瑤 冰天雪地 露 春光         三十三 歲 女星 郭書瑤 （ 瑤瑤 ） 近日 到 日本 度假 ， 前日 在 IG 上傳 一張 滑雪 照 ， 大方 脫掉 外套 露出 胸前 春光 ， 還問 大家 ： “ 好看 嗎 ？ ！ ” 立刻 吸引 數萬人 按 讚 。 照片 中 ， 郭書瑤手 拿 雪板 笑 得 燦爛 ， 在 雪地 脫掉 上身 保暖 衣服 ， 單穿 黑色 運動 內衣 ， 映襯 她 的 白皙 肌膚 之外 ， 也 完美 襯托出 豐滿 上圍 。         郭書瑤 近年 在 戲劇 領域 表現 亮眼 ， 她 和 林子 閎 主演 的 愛情 喜劇 《 完全 省錢 戀愛手冊 》 二月 殺青 ， 將於 四月 開播 。 兩人為 宣傳 這部 由 台灣 和 新加坡 傳媒 首度 聯手 合作 的 新劇 ， 日前 專誠到 香港 出席 “ 香港 國際 影視展 ” ， 和 大家 分享 拍 攝軼事 。 兩人 也 談起 與 新加坡 演員 的 合作 ， 大 讚 對 方 對 喜 劇 節 奏 的 掌握 很 厲害 ， 拍戲 過程 中 不同 文化 撞擊出 精彩 的 火花 。,2024-03-17
妻涉毒阿沁自檢證清白,妻涉毒阿沁自檢證清白    台灣歌手阿沁的妻子“花花”李汶靜，日前在家驚爆涉毒，警方到她台北市住所搜索，查扣二級毒品大麻，依法帶回調查並釐清毒品來源、用途。阿沁第一時間表示不知花花持毒，主動配合警方作毛髮以及尿液檢驗。不過警方報告暫未出爐，他為了自清，前往醫事檢驗所專業檢驗，稍早大麻檢驗報告出爐為“陰性”。他所屬的“晴空未來”公司發聲明表示：“另待本公司收到警局正式之官方檢驗裁決結果出爐之後，本公司也一定會即時公告大眾。”    “F.I.R.飛兒樂團”前結他手阿沁和小他十四歲的老婆花花一四年結婚，育有兩個女兒。花花也因今次事件鞠躬道歉，承認自己的不法行為，強調此事與老公無關，表示不會再依賴違法物品。,http://www.macaodaily.com/html/2024-03/17/content_1742029.htm,妻涉毒阿沁自檢證清白    台灣歌手阿沁的妻子“花花”李汶靜，日前在家驚爆涉毒，警方到她台北市住所搜索，查扣二級毒品大麻，依法帶回調查並釐清毒品來源、用途,妻 涉毒 阿沁 自檢證 清白         台灣 歌手 阿沁 的 妻子 “ 花花 ” 李汶靜 ， 日前 在家 驚爆 涉毒 ， 警方 到 她 台北市 住所 搜索 ， 查扣 二級 毒品 大麻 ， 依法 帶回 調查 並釐清 毒品 來源 、 用途 。 阿沁 第一 時間 表示 不知 花花 持毒 ， 主動 配合 警方 作毛 髮 以及 尿液 檢驗 。 不過 警方 報告 暫未 出爐 ， 他 為 了 自清 ， 前往 醫事 檢驗 所 專業 檢驗 ， 稍早 大麻 檢驗 報告 出爐 為 “ 陰性 ” 。 他 所屬 的 “ 晴空 未來 ” 公司 發聲明 表示 ： “ 另待本 公司 收到 警局 正式 之 官方 檢驗 裁決 結果 出爐 之 後 ， 本 公司 也 一定 會 即 時 公告 大眾 。 ”         “ F . I . R . 飛兒 樂團 ” 前結 他 手 阿沁 和 小 他 十四 歲 的 老婆 花花 一 四年 結婚 ， 育有 兩個 女兒 。 花花 也 因 今次 事件 鞠躬 道歉 ， 承認 自己 的 不法 行為 ， 強調 此事 與 老公 無關 ， 表示 不會 再 依賴 違法 物品 。,2024-03-17
郭雪芙倫敦朝聖名店,郭雪芙倫敦朝聖名店    女星郭雪芙年初結束手上新戲拍攝後，宣告暫別演藝圈，出發英國遊學三個半月。她坦言曾因害怕他人眼光，才遲遲沒有出發圓夢，如今踏上旅程，外界都非常支持。她不時會在網上更新近況，與粉絲交流。    她較早前曾到巴黎出席時裝周，日前則到了倫敦的烘焙名店朝聖。只見她一身淺藍色外套、毛帽，打扮減齡又亮眼，乖乖地跟着人群排隊，目光卻早被整片糕點吸引，手迫不及待打開錢包。搞笑一幕被同行的妹妹拍下，郭雪芙自嘲：“每個都想吃，眼裡只剩下甜點……妹妹是有多怕我吃胖，我有節制，每個吃一口就好了（應該吧……）。”網友回應說：“美食當前真的太難了！”“女神好美。”,http://www.macaodaily.com/html/2024-03/17/content_1742031.htm,搞笑一幕被同行的妹妹拍下，郭雪芙自嘲：“每個都想吃，眼裡只剩下甜點,郭雪 芙倫敦 朝聖 名店         女星 郭雪 芙 年初 結 束手 上新戲 拍 攝 後 ， 宣告 暫別 演藝圈 ， 出發 英國遊 學三個 半月 。 她 坦言 曾 因 害怕 他人 眼光 ， 才 遲遲 沒 有 出 發圓夢 ， 如今 踏上 旅程 ， 外界 都 非常 支持 。 她 不 時會 在 網上 更新 近況 ， 與 粉絲 交流 。         她 較 早前 曾到 巴黎 出席 時裝周 ， 日前 則到 了 倫敦 的 烘焙 名店 朝聖 。 只見 她 一身 淺藍色 外套 、 毛帽 ， 打扮 減齡 又 亮眼 ， 乖乖 地 跟着 人群 排隊 ， 目光 卻 早 被 整片 糕點 吸引 ， 手 迫不及待 打開 錢 包 。 搞笑 一幕 被 同行 的 妹妹 拍 下 ， 郭雪 芙 自嘲 ： “ 每個 都 想 吃 ， 眼裡 只 剩下 甜點 … … 妹妹 是 有 多 怕 我 吃 胖 ， 我 有 節制 ， 每個 吃 一口 就 好 了 （ 應該 吧 … … ） 。 ” 網友 回應 說 ： “ 美食 當前 真的 太難 了 ！ ” “ 女神 好美 。 ”,2024-03-17
“譚道德”新西蘭嫁女   高梁,“譚道德”新西蘭嫁女    《愛 · 回家》譚道德夫婦：TVB金綠葉的連理枝，陳榮峻、吳香倫，剛剛慶祝結婚五周年，隨即報喜——今年嫁女了。大紅喜帖來自新西蘭，親家送來中國的三書六禮。“超開心” ，陳榮峻狂喜，“感覺備受尊重，今時今日仲有傳統禮儀……”    非常罕見，影視古裝片亦早已不見婚禮聘書，卻在陳榮峻網上出現——大紅帖端正書法寫上：“陳府親翁見字如面：小子與貴府之千金因緣而遇，眞心實意，因誠而知，天地而感。雙方自願及彼此之長輩同意，經媒妁之言，預結秦晉之好……”    陳榮峻女兒更獲親家連環大讚：“貴府千金穎儀天生麗質，端莊優雅，知書達禮，善良賢淑。實乃我門之大幸。”文尾提及，此書信連同聘禮一起寄給陳家。親家更指——兒子跟陳榮峻女兒將回港，估計一對新人在外國認識，今後，也會在外國生活。    “譚道德”陳榮峻，早年與圈外妻子鄭安麗結婚，育有兩子一女。二〇一〇年，鄭安麗因腦溢血辭世，陳榮峻一度難走出喪妻之痛曾欲輕生，幸得好友陳國邦及陳錦鴻開解，才走出陰霾。二〇一五年，陳榮峻與吳香倫拍拖，二〇一八年結婚時，在兒女及兩個孫仔四代同堂見證下再為人夫，再婚亦獲三子女支持。女兒中學時，已到新西蘭留學，目前在當地生活並任護士，每年都有回港探親人，去年陳榮峻與吳香倫結婚五周年時女兒亦有回港。    陳榮峻、吳香倫，戲裡戲外都是一對恩愛夫妻，十指緊扣，形影不離，揭開了一片綠葉也能出演現實生活中“不愛江山愛美人”的故事。陳榮峻出身佳視龍虎武師，後轉TVB藝訓班，老臨演到男二，常站在苗僑偉的旁邊，“快要擔正了……好害怕。時間長，對白多，我想炒散，多點工作機會……”    陳榮峻自爆，為了養家，拍戲之餘，還去修理雪櫃和各種家電。天道酬勤，“我在內地十天，相當於香港一年收入——但我捨不得吳香倫，獨自在港自知不太好，我要隨時照顧香港的老婆，就不北上掘金了。”是否另類的“不愛江山愛美人”！    高梁,http://www.macaodaily.com/html/2024-03/17/content_1742035.htm,女兒中學時，已到新西蘭留學，目前在當地生活並任護士，每年都有回港探親人，去年陳榮峻與吳香倫結婚五周年時女兒亦有回港,“ 譚 道德 ” 新西蘭 嫁女         《 愛   ·   回家 》 譚 道德 夫婦 ： TVB 金綠葉 的 連理枝 ， 陳 榮峻 、 吳香倫 ， 剛剛 慶祝 結婚 五周年 ， 隨即 報喜 — — 今年 嫁女 了 。 大紅 喜帖 來 自新西蘭 ， 親家 送來 中國 的 三書六禮 。 “ 超開心 ”   ， 陳 榮峻 狂喜 ， “ 感覺備 受 尊重 ， 今時 今日 仲有 傳統 禮儀 … … ”         非常 罕見 ， 影視 古裝片 亦 早已 不見 婚禮聘書 ， 卻 在 陳 榮峻 網上 出現 — — 大紅帖 端正 書法 寫 上 ： “ 陳 府 親翁 見 字 如面 ： 小子 與 貴府 之 千金 因緣 而 遇 ， 眞 心 實意 ， 因誠而知 ， 天地 而感 。 雙方 自願 及 彼此 之長 輩 同意 ， 經 媒妁之言 ， 預結 秦晉 之 好 … … ”         陳 榮峻 女兒 更 獲 親家 連環 大 讚 ： “ 貴府 千金 穎 儀 天生 麗質 ， 端莊 優雅 ， 知書達禮 ， 善良 賢 淑 。 實乃 我門 之 大幸 。 ” 文尾 提及 ， 此書 信連 同聘禮 一起 寄給 陳 家 。 親家 更 指 — — 兒子 跟 陳 榮峻 女兒將 回港 ， 估計 一 對 新人 在外 國認識 ， 今 後 ， 也 會 在外 國 生活 。         “ 譚 道德 ” 陳 榮峻 ， 早年 與 圈外 妻子 鄭安麗 結婚 ， 育有 兩子 一女 。 二 〇 一 〇 年 ， 鄭安麗 因腦 溢血 辭世 ， 陳 榮峻 一度 難 走出 喪妻 之痛 曾 欲 輕生 ， 幸得 好友 陳 國邦 及 陳 錦鴻開解 ， 才 走出 陰霾 。 二 〇 一 五年 ， 陳 榮峻 與 吳香倫 拍拖 ， 二 〇 一 八年 結婚 時 ， 在 兒 女及 兩個 孫仔 四代同堂 見證 下 再 為 人夫 ， 再婚 亦 獲 三 子女 支持 。 女兒 中學時 ， 已到 新西蘭 留學 ， 目前 在 當地 生活 並任 護士 ， 每年 都 有 回港 探親 人 ， 去年 陳 榮峻 與 吳香倫 結婚 五周年 時 女兒 亦 有 回港 。         陳 榮峻 、 吳香倫 ， 戲裡 戲外 都 是 一 對 恩 愛 夫妻 ， 十指 緊扣 ， 形影 不離 ， 揭開 了 一片 綠葉 也 能 出演 現實 生活 中 “ 不愛 江山 愛美人 ” 的 故事 。 陳 榮峻 出身 佳視龍虎 武師 ， 後轉 TVB 藝訓班 ， 老臨 演到 男二 ， 常站 在 苗僑偉 的 旁邊 ， “ 快要 擔正 了 … … 好 害怕 。 時間 長 ， 對白多 ， 我 想 炒 散 ， 多點 工作 機會 … … ”         陳 榮峻 自爆 ， 為 了 養家 ， 拍戲 之餘 ， 還去 修理 雪櫃 和 各種 家電 。 天道酬勤 ， “ 我 在 內 地 十天 ， 相當 於 香港 一年 收入 — — 但 我 捨 不得 吳香倫 ， 獨自 在 港 自知 不太好 ， 我要 隨時 照顧 香港 的 老婆 ， 就 不 北上 掘金 了 。 ” 是否 另類 的 “ 不愛 江山 愛美人 ” ！         高梁,2024-03-17
金庸百年誕辰紀念   娛翁,金庸百年誕辰紀念    “金庸”查良鏞先生是已故香港文學家及武俠小說名家，他的名字當然跟娛樂新聞無關，但他的作品卻一直影響着無數人。那些年為追看他在報章的連載小說買報紙、為拜讀他的著作捱更抵夜，這些故事都曾發生在無數人的身上。然而即使不曾追看過小說，但大概沒有多少人不曾看過查大俠作品所改編的電視劇，所以才令娛樂圈勉強能跟查大俠拉上了關係。    為紀念查良鏞先生的百年誕辰，香港特別舉行了“俠之大者——金庸百年誕辰紀念”共兩項活動，同時邀請了許多曾演出過他筆下人物的演員現身，較特別的是佳視年代的《射鵰》及《神鵰》的主角米雪、白彪、羅樂林及劉丹。乍看第一眼，當年的觀劇回憶湧現；再看第二眼，卻差點以為米雪將參演《愛 · 回家之開心速遞》，只因為白彪、羅樂林及劉丹近年在《開心速遞》中的形象太深入民心了。    兩項活動分別為“江湖盛匯”及“任哲雕塑展”，前者在中環愛丁堡廣場舉行，後者於沙田的香港文化博物館展出。    說回是次雕塑展，展品實與許多人心目中的形象不同。這並不是說雕塑作品欠佳，而是因為原著畢竟是小說，即使再有生花妙筆都無法將一個人的面貌百分百呈現，是以公眾對角色的形象往往都是由演員所帶出。如當年劉德華與陳玉蓮演活了楊過與小龍女，大部分人都認為楊過與小龍女的形象類似劉德華與陳玉蓮；至於張無忌到底似鄭少秋、梁朝偉還是吳啟華，則要視乎觀眾看的是哪個版本。是次的雕塑作品的人像風格，其實較似近年港產漫畫風的作品，較易為公眾所接受。    不論是否金迷，是次的兩項活動都極具意義。不管是為了認識文壇巨匠的風采，還是為了欣賞大師級的雕塑作品，都具備了真正的吸引力。    娛翁,http://www.macaodaily.com/html/2024-03/17/content_1742036.htm,這並不是說雕塑作品欠佳，而是因為原著畢竟是小說，即使再有生花妙筆都無法將一個人的面貌百分百呈現，是以公眾對角色的形象往往都是由演員所帶出,金庸 百年 誕辰 紀念         “ 金庸 ” 查良鏞 先生 是 已故 香港 文學家 及 武俠 小 說 名家 ， 他 的 名字 當然 跟 娛樂 新聞 無關 ， 但 他 的 作品 卻 一直 影響 着 無數 人 。 那些 年 為 追 看 他 在 報章 的 連載 小 說 買 報紙 、 為 拜 讀 他 的 著作 捱 更 抵夜 ， 這些 故事 都 曾 發生 在 無數 人 的 身上 。 然而 即使 不曾 追看 過小說 ， 但 大概 沒有 多少 人 不曾 看過 查大俠 作品 所 改編 的 電視劇 ， 所以 才 令 娛樂圈 勉強 能 跟 查大俠 拉 上 了關 係 。         為 紀念查 良鏞 先生 的 百年 誕辰 ， 香港 特別 舉行 了 “ 俠之大者 — — 金庸 百年 誕辰 紀念 ” 共 兩項 活動 ， 同時 邀請 了 許多 曾 演出 過他 筆下 人物 的 演員 現身 ， 較 特別 的 是 佳視 年代 的 《 射 鵰 》 及 《 神 鵰 》 的 主角 米 雪 、 白彪 、 羅 樂林及 劉丹 。 乍看 第一眼 ， 當年 的 觀劇 回憶 湧現 ； 再 看 第二眼 ， 卻 差點 以 為 米 雪將 參演 《 愛   ·   回家 之開 心速 遞 》 ， 只 因為 白彪 、 羅 樂林及 劉丹 近年 在 《 開心速 遞 》 中 的 形象 太 深入 民心 了 。         兩項 活動 分別 為 “ 江湖 盛匯 ” 及 “ 任哲 雕塑 展 ” ， 前者 在 中 環愛丁堡 廣場 舉行 ， 後 者 於 沙田 的 香港 文化 博物 館 展出 。         說 回 是 次 雕塑 展 ， 展品 實與 許多人 心目 中 的 形象 不同 。 這並 不是 說 雕塑 作品 欠佳 ， 而是 因為 原著 畢 竟是 小說 ， 即使 再 有生 花妙筆 都 無法將 一個 人 的 面貌 百分百 呈現 ， 是 以公眾 對 角色 的 形象 往往 都 是 由 演員 所 帶 出 。 如當 年 劉德華 與 陳 玉蓮 演活 了 楊過 與 小龍女 ， 大部分 人 都 認為 楊過 與 小龍 女 的 形象 類似 劉德華 與 陳 玉蓮 ； 至於 張無忌 到底 似 鄭少秋 、 梁朝 偉還 是 吳啟 華 ， 則要 視乎 觀眾 看 的 是 哪個 版本 。 是 次 的 雕塑 作品 的 人 像 風格 ， 其實 較 似 近年 港產漫 畫風 的 作品 ， 較易 為 公眾 所 接受 。         不論 是否 金迷 ， 是 次 的 兩項 活動 都 極具 意義 。 不管 是 為 了 認識 文壇 巨匠 的 風采 ， 還是 為 了 欣賞 大師級 的 雕塑 作品 ， 都 具備 了 真正 的 吸引力 。         娛翁,2024-03-17
