Title,Content,Link,Summary,Preprocessed_Content,Date
賀：持續健全維護國安體系,全民國家安全教育展昨綜藝館揭幕    賀：持續健全維護國安體系    【本報消息】由澳門特區政府與中聯辦合辦的“全民國家安全教育展”昨日在澳門綜藝館揭幕，展期一個月。澳門特區維護國家安全委員會主席、行政長官賀一誠表示，十年來，總體國家安全觀不斷豐富和發展。在總體國家安全觀的創新引領和科學指導下，澳門特區政府帶領社會各界團結奮進，持續健全特區維護國家安全體系，積極統籌特區的安全與發展，致力築牢維護國家總體安全的防線，保持澳門社會的長期繁榮穩定。    總體國安觀高瞻遠矚    國安展昨日上午十時在綜藝館舉行開幕禮，由賀一誠，全國政協副主席何厚鏵，澳門特區維護國家安全委員會安全事務顧問、中聯辦主任鄭新聰，外交部駐澳特派員公署特派員劉顯法及駐澳部隊政委林慶華主禮，政府官員及社會各界逾三百八十人出席。    賀一誠致詞表示，十年前，習近平主席高瞻遠矚，在國家進入新時代、世界正值百年變局之際，創造性提出了總體國家安全觀，為解決新時代強國建設、民族復興所面臨的安全和發展問題提供了根本遵循和行動指南。    推動各項事業新發展    賀一誠稱，今年是總體國家安全觀提出十周年，本次“全民國家安全教育展”特別以“總體國家安全觀，創新引領十周年”為主題，讓廣大澳門居民全面重溫和深刻領會總體國家安全觀的深層內涵和重大意義，充分認識當今總體安全形勢的複雜性、嚴峻性，以及國家和澳門特區在新時代偉大征程中面臨的各種挑戰和機遇。全面了解十年來國家和澳門特區維護總體安全工作所取得的豐碩成果，從而以實際行動，堅定維護國家安全和發展利益，積極推動澳門特區各項事業實現新的發展。    沒有網安就沒有國安    賀一誠指出，習近平主席反覆強調“沒有網絡安全就沒有國家安全”。對於網絡安全問題，本澳青少年學生在本屆“我心中的網絡安全”中文徵文比賽和短視頻比賽中，透過文字或影像積極展示他們的看法、說法，展現了他們維護國家安全和國家利益的責任擔當，以及愛國愛澳光榮傳統的良好傳承與發展。    今年是特區重要的一年，將迎來新中國成立七十五周年、澳門回歸祖國二十五周年，以及深合區成立三周年暨第一階段發展目標實現之年，特區政府和廣大澳門居民將全面貫徹落實“二十大”和全國“兩會”精神，更好地踐行總體國家安全觀。透過持續健全維護國家安全體制機制、不斷提升管治水平和治理效能，切實推動澳門經濟高質量發展、改善民生福祉，使廣大居民的獲得感、幸福感和安全感更加充實、更有保障和更能持續，務求推動特區各項事業邁上更高的台階，為以中國式現代化全面推進中華民族偉大復興，展現更大的作為。    開幕禮後舉行了“我心中的網絡安全”徵文比賽及短視頻比賽頒獎儀式，主禮嘉賓頒發兩項比賽的主要獎項後，隨即參觀展覽。,http://www.macaodaily.com/html/2024-04/16/content_1748620.htm,透過持續健全維護國家安全體制機制、不斷提升管治水平和治理效能，切實推動澳門經濟高質量發展、改善民生福祉，使廣大居民的獲得感、幸福感和安全感更加充實、更有保障和更能持續，務求推動特區各項事業邁上更高的台階，為以中國式現代化全面推進中華民族偉大復興，展現更大的作為,全民 國家 安全 教育展 昨綜藝館 揭幕         賀 ： 持續 健全 維護 國安體系         【 本報 消息 】 由 澳門 特區 政府 與 中聯 辦合辦 的 “ 全民 國家 安全 教育展 ” 昨日 在 澳門 綜藝館 揭幕 ， 展期 一個 月 。 澳門 特區 維護國家 安全 委員會 主席 、 行政 長 官賀 一 誠 表示 ， 十年 來 ， 總體 國家 安全 觀不斷 豐富 和 發展 。 在 總體 國家 安全 觀 的 創新 引領 和 科學 指導下 ， 澳門 特區 政府 帶領 社會 各界 團結 奮進 ， 持續 健全 特區 維護國家 安全 體系 ， 積極統 籌特區 的 安全 與 發展 ， 致力 築 牢維護 國家 總體 安全 的 防線 ， 保持 澳門 社會 的 長 期 繁榮 穩定 。         總體 國安觀 高瞻遠矚         國安展 昨日 上午 十時 在 綜藝館 舉行 開幕禮 ， 由賀 一 誠 ， 全國政協 副 主席 何厚鏵 ， 澳門 特區 維護國家 安全 委員會 安全 事務 顧問 、 中聯辦 主任 鄭新聰 ， 外交部 駐澳 特派 員 公署 特派 員 劉顯 法及 駐 澳部隊 政委 林慶華主禮 ， 政府 官員及 社會 各界 逾 三 百八十 人 出席 。         賀一誠致 詞 表示 ， 十年 前 ， 習近 平 主席 高瞻遠矚 ， 在 國家 進入 新 時代 、 世界 正值 百年 變局 之際 ， 創造性 提出 了 總體 國家 安全 觀 ， 為 解決 新 時代強 國建設 、 民族 復 興所面 臨 的 安全 和 發展 問題 提供 了 根本 遵循 和 行動 指南 。         推動 各項 事業 新 發展         賀一誠稱 ， 今年 是 總體 國家 安全 觀 提出 十周年 ， 本次 “ 全民 國家 安全 教育展 ” 特別 以 “ 總體 國家 安全 觀 ， 創新 引領 十周年 ” 為主題 ， 讓廣 大澳 門 居民 全面 重溫 和 深刻 領會 總體 國家 安全 觀 的 深層 內涵 和 重大 意義 ， 充分 認識 當今 總體 安全 形勢 的 複 雜性 、 嚴峻性 ， 以及 國家 和 澳門 特區 在 新 時代偉大 征程 中面 臨 的 各種 挑戰 和 機遇 。 全面 了解 十年 來國家 和 澳門 特區 維護 總體 安全 工作 所 取得 的 豐碩 成果 ， 從 而 以 實際 行動 ， 堅定 維護國家 安全 和 發展 利益 ， 積極 推動 澳門 特區 各項 事業 實現 新 的 發展 。         沒有 網安 就 沒 有 國安         賀一 誠 指出 ， 習近 平 主席 反覆 強調 “ 沒有 網絡 安全 就 沒 有 國家 安全 ” 。 對 於 網絡 安全 問題 ， 本澳 青少年 學生 在 本屆 “ 我 心中 的 網絡 安全 ” 中文 徵文 比賽 和 短視 頻比賽 中 ， 透過 文字 或 影像 積極 展示 他們 的 看法 、 說法 ， 展現 了 他們 維護國家 安全 和 國家 利益 的 責任 擔當 ， 以及 愛國 愛澳光榮 傳統 的 良好 傳承 與 發展 。         今年 是 特區 重要 的 一年 ， 將迎 來 新 中國 成立 七十五 周年 、 澳門 回歸祖國 二十五 周年 ， 以及 深合區 成立 三周年 暨 第一 階段 發展 目標 實現 之 年 ， 特區 政府 和廣 大澳 門 居民 將 全面 貫徹 落實 “ 二十大 ” 和 全國 “ 兩會 ” 精神 ， 更好 地踐 行總體 國家 安全 觀 。 透過 持續 健全 維護國家 安全 體制 機制 、 不斷 提升 管治 水平 和 治理 效能 ， 切實 推動 澳門 經濟 高質量 發展 、 改善 民生 福祉 ， 使廣大 居民 的 獲得感 、 幸福感 和 安全感 更加 充實 、 更 有 保障 和 更 能 持續 ， 務求 推動 特區 各項 事業 邁上 更 高 的 台階 ， 為 以 中國式 現代化 全面 推進 中華 民族 偉大 復 興 ， 展現 更 大 的 作為 。         開幕 禮後舉行 了 “ 我 心中 的 網絡 安全 ” 徵文 比賽 及 短視 頻比賽 頒獎 儀式 ， 主禮嘉賓 頒發 兩項 比賽 的 主要 獎項 後 ， 隨即 參觀 展覽 。,2024-04-16
鄭新聰：國安才能家興,在國安教育展開幕禮致辭提四要求    鄭新聰：國安才能家興    【本報消息】澳門特區維護國安委員會安全事務顧問、中聯辦主任鄭新聰昨日在國安展開幕式上致辭表示，“國安”才能“家興”。國家安全是人民的最大福祉。澳門回歸以來，特區政府和社會各界在維護國家安全問題上，始終堅持只有“一國”之責、沒有“兩制”之分，展現了強烈的國家觀念和愛國情懷。希望廣大澳門同胞繼續以坐言起行的實際行動，共同維護好國家安全和澳門社會穩定，為強國建設、民族復興貢獻應有的力量。    澳現新氣象新亮點    鄭新聰表示，過去一年，以國家主席習近平為核心的黨中央統籌“兩個大局”，帶領全黨全國人民，頂住外部壓力、克服內部困難，扎實推進高質量發展，實現了貫徹落實中共二十大精神的良好開局。在中央的堅強領導下，澳門“一國兩制”實踐呈現許多新氣象、新亮點：完成維護國家安全法修改並扎實推進相關配套立法，澳門選舉制度進一步完善，“愛國者治澳”原則得到更好落實，經濟實現快速復甦，橫琴深合區建設加快推進。“澳科一號”科學衛星成功發射、“澳車北上”深入實施以及橫琴深合區分線管理順利落實等一系列重要利好，為澳門發展注入了新動能。習近平主席和中央政府充分肯定了澳門的工作。    居安思危有備無患    他說，“居安思危，思則有備，有備無患。”今年是習近平主席創造性提出總體國家安全觀十周年。十年來，在總體國家安全觀引領下，我們全方位重塑國家安全領導體制和法治體系、戰略體系、政策體系，國家主權、安全、發展利益得到有效維護。今年是澳門回歸祖國二十五周年，大事要事多，做好維護國家安全工作尤為重要。我們要樹牢“大安全”理念，統籌好發展和安全，努力實現高水平安全和高質量發展良性互動，推動澳門特色“一國兩制”成功實踐邁上新台階。    鄭新聰提出四點要求：    築牢維護國安屛障    1.加強法律制度和執行機制建設，築牢維護國家安全屏障。總體國家安全觀強調加強法治思維，構建系統完備、科學規範、運行有效的國家安全制度體系。要居安思危、未雨綢繆，進一步健全澳門維護國家安全法律制度，加強維護國家安全執行機制特別是執法、司法力量建設，有效防範化解風險。要依法加強網絡空間治理，堅決抵制各種錯誤思潮侵襲，構建網上網下“同心圓”。    弘揚愛國愛澳價値    2.全面落實“愛國者治澳”原則，弘揚愛國愛澳核心價值。“愛國者治澳”是澳門維護國家安全的重要保障。要樹立治理導向，積極推進公共行政和法律改革，不斷提升施政效能，以良政善治促進澳門安定繁榮。要堅持大團結大聯合，凝聚共識、增強合力，厚植愛國愛澳社會政治基礎。要多為澳門青年學業、就業、創業和向上流動搭台、搭梯，讓愛國愛澳核心價值薪火相傳。    發展經濟改善民生    3.堅持以人民為中心，大力發展經濟、改善民生。總體國家安全觀強調通過發展提升國家安全實力、強調國家安全一切為了人民。要優化營商環境，建好“一中心、一平台、一基地”，不斷催生新質生產力，努力實現“兩條腿走路”。要加快橫琴深合區建設，推動琴澳一體化發展，拓展澳門發展新空間。要堅持人民至上，及時回應市民訴求，精準辦好民生實事。    發揮優勢服務國家    4.發揮澳門獨特優勢和作用，服務中國式現代化建設大局。要在中央指導下發揮澳門國際都市、聯接世界等優勢，辦好中葡論壇第六屆部長級會議，積極參與高質量共建“一帶一路”和粵港澳大灣區建設，傳播好中華文明、促進國際人文交流，服務國家高質量發展。,http://www.macaodaily.com/html/2024-04/16/content_1748621.htm,在中央的堅強領導下，澳門“一國兩制”實踐呈現許多新氣象、新亮點：完成維護國家安全法修改並扎實推進相關配套立法，澳門選舉制度進一步完善，“愛國者治澳”原則得到更好落實，經濟實現快速復甦，橫琴深合區建設加快推進,在 國安 教育展 開幕 禮致 辭 提四 要求         鄭新聰 ： 國安 才能 家興         【 本報 消息 】 澳門 特區 維護 國安委員會 安全 事務 顧問 、 中聯辦 主任 鄭新聰 昨日 在 國安展 開幕式 上 致辭 表示 ， “ 國安 ” 才能 “ 家興 ” 。 國家 安全 是 人民 的 最大 福祉 。 澳門 回歸以 來 ， 特區 政府 和 社會 各界 在 維護國家 安全 問題 上 ， 始終 堅持 只有 “ 一國 ” 之責 、 沒有 “ 兩制 ” 之分 ， 展現 了 強烈 的 國家 觀念 和 愛國 情懷 。 希望 廣 大澳 門 同胞 繼續 以 坐言起行 的 實際 行動 ， 共同 維護 好國家 安全 和 澳門 社會 穩定 ， 為 強國 建設 、 民族 復 興 貢獻應 有 的 力量 。         澳現 新氣象 新亮點         鄭新聰 表示 ， 過去 一年 ， 以國家 主席 習近 平為 核心 的 黨 中央 統籌 “ 兩個 大局 ” ， 帶領 全黨 全國 人民 ， 頂住 外部 壓力 、 克服 內部 困難 ， 扎實 推進 高質量 發展 ， 實現 了 貫徹 落實 中共 二十大 精神 的 良好 開局 。 在 中央 的 堅強 領導下 ， 澳門 “ 一國 兩制 ” 實踐 呈 現許 多 新氣象 、 新亮點 ： 完成 維護國家 安全法 修改 並扎實 推進 相關 配套 立法 ， 澳門 選舉 制度 進 一步 完善 ， “ 愛國者 治澳 ” 原則 得到 更好 落實 ， 經濟 實現 快速 復 甦 ， 橫琴 深合區 建設 加快 推進 。 “ 澳科 一號 ” 科學衛星 成功 發射 、 “ 澳車 北上 ” 深入 實施 以及 橫琴 深合區 分線 管理 順 利落 實等 一系列 重要 利好 ， 為 澳門 發展 注入 了 新動能 。 習近 平 主席 和 中央政府 充分肯定 了 澳門 的 工作 。         居安思危 有備 無患         他 說 ， “ 居安思危 ， 思則 有備 ， 有備 無患 。 ” 今年 是習 近平 主席 創造性 提出 總體 國家 安全 觀 十周年 。 十年 來 ， 在 總體 國家 安全 觀引 領下 ， 我們 全方位 重塑 國家 安全 領導 體制 和 法治 體系 、 戰略 體系 、 政策 體系 ， 國 家主 權 、 安全 、 發展 利益 得到 有效 維護 。 今年 是 澳門 回歸祖國 二十五 周年 ， 大事 要事 多 ， 做好 維護國家 安全 工作 尤為 重要 。 我們 要 樹牢 “ 大 安全 ” 理念 ， 統籌好 發展 和 安全 ， 努力 實現 高水平 安全 和 高質量 發展 良性 互動 ， 推動 澳門 特色 “ 一國 兩制 ” 成功 實踐 邁上 新 台階 。         鄭新聰 提出 四點 要求 ：         築 牢維護 國安 屛 障         1 . 加強 法律 制度 和 執行 機制 建設 ， 築 牢維護 國家 安全 屏障 。 總體 國家 安全 觀強 調加強 法治 思維 ， 構建系統 完備 、 科學 規範 、 運行 有效 的 國家 安全 制度 體系 。 要 居安思危 、 未雨綢繆 ， 進 一步 健全 澳門 維護國家 安全 法律 制度 ， 加強 維護國家 安全 執行 機制 特別 是 執法 、 司法 力量 建設 ， 有效 防範 化解 風險 。 要 依法 加強 網絡 空間 治理 ， 堅決 抵制 各種 錯誤 思潮 侵襲 ， 構建網 上 網下 “ 同心 圓 ” 。         弘揚 愛國 愛澳價 値         2 . 全面 落實 “ 愛國者 治澳 ” 原則 ， 弘揚 愛國 愛澳 核心 價值 。 “ 愛國者 治澳 ” 是 澳門 維護國家 安全 的 重要 保障 。 要樹立 治理 導向 ， 積極 推進 公共行政 和 法律 改革 ， 不斷 提升 施政 效能 ， 以良 政善治 促進 澳門 安定 繁榮 。 要 堅持 大團 結大聯合 ， 凝聚 共識 、 增強 合力 ， 厚植愛國 愛澳 社會 政治 基礎 。 要 多 為 澳門 青年 學業 、 就業 、 創業 和 向 上流 動 搭台 、 搭梯 ， 讓 愛國 愛澳 核心 價值 薪火 相傳 。         發展 經濟 改善 民生         3 . 堅持 以 人民 為 中心 ， 大力 發展 經濟 、 改善 民生 。 總體 國家 安全 觀強 調通過 發展 提升 國家 安全 實力 、 強調 國家 安全 一切 為 了 人民 。 要 優化 營商 環境 ， 建 好 “ 一 中心 、 一 平台 、 一 基地 ” ， 不斷 催生 新質 生產力 ， 努力 實現 “ 兩條 腿走路 ” 。 要 加快 橫琴 深合區 建設 ， 推動琴 澳一體化 發展 ， 拓展 澳門 發展 新空間 。 要 堅持 人民 至上 ， 及時 回應 市民 訴求 ， 精準 辦好 民生 實事 。         發揮 優勢 服務國家         4 . 發揮 澳門 獨特 優勢 和 作用 ， 服務 中國式 現代化 建設 大局 。 要 在 中央 指導下 發揮 澳門 國際 都市 、 聯接 世界 等 優勢 ， 辦好 中葡 論壇 第六 屆 部長 級 會議 ， 積極 參與 高質量 共建 “ 一帶 一路 ” 和粵 港澳 大灣區 建設 ， 傳播 好 中華 文明 、 促進 國際 人文 交流 ， 服務國家 高質量 發展 。,2024-04-16
長者公寓首輪加推至千五單位,長者公寓首輪加推至千五單位    一樓接駁東北大馬路空中走廊便出行    【本報消息】政府宣佈長者公寓首階段推出單位增至一千五百多個。社工局長韓衛表示，除是次加推單位外設施配套上亦有一大突破，就是公寓的一樓將接駁至東北大馬路空中走廊，屆時長者住戶可經由公寓直接到空中走廊，創造長者友善空間和無障礙通道的安排，更顧及入住的長者出行需要。    政府長者公寓推出的住宿單位由七百五十九個增加至一千五百多個。首批合資格的申請者只要在社工局指定的時間內揀樓及簽訂使用協議，均可享有首三年使用費八折優惠。韓衛受訪稱，因應在評估工作期間見到不少申請的長者都很期待入住公寓，並以實際行動第一時間響應提交申請，但始終各有得分結果。因此結合實際情況經綜合考慮後決定增推單位至一千五百多個，藉此回應到首批申請的長者數量。    裝修需時逐步上樓    他提到，會盡量在首批長者入住時同步完成相關配套設施，包括一樓的酒樓、二樓的會所和醫療設施、地下的商舖等。其中，有一大突破就是一樓將接駁至東北大馬路空中走廊，即長者住戶既可直接坐電梯到一樓的酒樓，也可藉此到達空中走廊，創造長者友善空間和無障礙通道的安排，期望可讓入住的長者更便利出行。    被問及政府長者公寓全數單位僅逾一千八百個，為何仍要預留單位不推出？韓衛強調，是次加推是因應見到去年首階段截止日時共收到約一千五百多個申請，但當時考慮到建築、裝修等工作未必可以一次過推出一千五百個單位，故首階段先推出七百五十九個單位，現時正在裝修和安裝冷氣等。因此即使加推亦需要逐步上樓，首階段的七百五十九個單位會如期於今年第四季安排入住，再於明年逐步安排今次加推的七百多個單位合資格人士入住。,http://www.macaodaily.com/html/2024-04/16/content_1748622.htm,社工局長韓衛表示，除是次加推單位外設施配套上亦有一大突破，就是公寓的一樓將接駁至東北大馬路空中走廊，屆時長者住戶可經由公寓直接到空中走廊，創造長者友善空間和無障礙通道的安排，更顧及入住的長者出行需要,長 者 公寓 首輪加 推至 千五 單位         一樓 接駁 東 北大 馬 路 空中走廊 便 出行         【 本報 消息 】 政府 宣 佈 長 者 公寓 首階段 推出 單位 增至 一千五百多 個 。 社工 局長 韓衛 表示 ， 除 是 次加 推單 位外 設施 配套 上 亦 有 一大 突破 ， 就是 公寓 的 一樓 將接 駁 至 東 北大 馬 路 空中走廊 ， 屆 時長 者 住戶 可經 由 公寓 直接 到 空中走廊 ， 創造長 者 友善 空間 和 無 障礙 通道 的 安排 ， 更 顧及 入住 的 長 者 出行 需要 。         政府 長 者 公寓 推出 的 住宿 單位 由 七百 五十九 個 增加 至 一千五百多 個 。 首批 合資格 的 申請者 只要 在 社工 局 指定 的 時間 內揀樓 及 簽訂 使用 協議 ， 均 可 享有 首 三年 使用 費 八折 優惠 。 韓衛受 訪稱 ， 因應 在 評估 工作 期間 見 到 不少 申請 的 長 者 都 很 期待 入住 公寓 ， 並以 實際 行動 第一 時間 響應 提交 申請 ， 但始終 各有 得分 結果 。 因此 結合 實際 情況 經綜合 考慮 後 決定 增推 單位 至 一千五百多 個 ， 藉此 回應 到 首批 申請 的 長 者 數量 。         裝修 需時 逐步 上樓         他 提到 ， 會 盡量 在 首批 長 者 入住 時 同步 完成 相關 配套 設施 ， 包括 一樓 的 酒樓 、 二樓 的 會 所 和 醫療 設施 、 地下 的 商 舖 等 。 其中 ， 有 一大 突破 就是 一樓 將接 駁 至 東 北大 馬 路 空中走廊 ， 即長 者 住 戶 既 可 直接 坐電梯 到 一樓 的 酒樓 ， 也 可 藉此 到 達 空中走廊 ， 創造長 者 友善 空間 和 無 障礙 通道 的 安排 ， 期望 可 讓 入住 的 長 者 更 便利 出行 。         被 問及 政府 長 者 公寓 全數 單位僅 逾 一千八百 個 ， 為何 仍 要 預留 單位 不 推出 ？ 韓衛 強調 ， 是 次加 推是 因應 見 到 去年 首階段 截止日 時共 收到 約 一千五百多 個 申請 ， 但 當時 考慮 到 建築 、 裝修 等 工作 未必 可以 一次 過 推出 一千五百 個 單位 ， 故首 階段 先 推出 七百 五十九 個 單位 ， 現時 正在 裝修 和 安裝 冷氣 等 。 因此 即使 加推 亦 需要 逐步 上樓 ， 首階段 的 七百 五十九 個 單位 會 如期 於 今年 第四季 安排 入住 ， 再 於 明年 逐步 安排 今次加 推 的 七百多 個 單位 合資格 人士 入住 。,2024-04-16
