Title,Content,Link,Summary,Preprocessed_Content,Date
S沙藝美術展宣保護海洋,S沙藝美術展宣保護海洋    由澳門文創藝術志願者協會、澳門環保志願者協會合辦的“S沙藝美術展”昨日假黑沙海灘休憩區舉行。文創志協會長黃潮裕、副理事長梁麗雅、何安儀，環保志協會長沙鶯、理事長張浩然等出席。    活動以沙灘為媒界、再配合環保元素，分別由橫琴粵澳深合區民生事務局、珠海市志願者聯合會以及是次活動組成的志願者，合共五十多名志願者合力創作一幅巨型畫作。    現場有沙雕藝術家利用澳門旅遊景點或特色建築物為題，創作多組沙雕作品，宣揚保護海洋訊息；並設多個文創環保物料手作坊、親子沙雕體驗區、攤位遊戲等。澳門海事局以及珠海市志願者聯合會亦設特色攤位，吸引居民參與。    活動經費獲澳門基金會贊助。市政署、海事局場地支持；環保局以及多個團體機構為支持單位。,http://www.macaodaily.com/html/2024-11/18/content_1794911.htm,活動以沙灘為媒界、再配合環保元素，分別由橫琴粵澳深合區民生事務局、珠海市志願者聯合會以及是次活動組成的志願者，合共五十多名志願者合力創作一幅巨型畫作,S 沙藝 美術展 宣保護 海洋         由 澳門文 創藝術志 願者 協會 、 澳門 環保志 願者 協會 合辦 的 “ S 沙藝 美術展 ” 昨日 假黑 沙海 灘 休憩 區舉行 。 文創志 協會長 黃 潮裕 、 副 理事 長 梁麗雅 、 何安儀 ， 環保志 協會長 沙鶯 、 理事 長 張 浩然 等 出席 。         活動 以沙灘 為 媒界 、 再 配合 環保 元素 ， 分別 由 橫琴粵澳 深合區 民生 事務局 、 珠海市 志願者 聯合會 以及 是 次 活動 組成 的 志願者 ， 合共 五十多名 志願者 合力 創作 一幅 巨型 畫作 。         現場 有 沙雕 藝術家 利用 澳門 旅遊景點 或 特色 建築物 為題 ， 創作 多組 沙雕 作品 ， 宣揚 保護 海洋 訊息 ； 並設 多個 文創 環保 物料 手 作坊 、 親子 沙雕 體驗區 、 攤位 遊戲 等 。 澳門 海事局 以及 珠海市 志願者 聯合會 亦 設 特色 攤位 ， 吸引 居民 參與 。         活動 經費 獲澳門 基金 會 贊助 。 市政 署 、 海事局 場地 支持 ； 環保局 以及 多個 團體 機構 為 支持 單位 。,2024-11-18
栢蕙青義協工作坊體驗節慶,栢蕙青義協工作坊體驗節慶    澳門栢蕙青年義務工作者協會日前舉辦“親子節慶體驗系列活動”，活動分為三個工作坊，包括賀年用品工作坊、中秋節燈籠工作坊、登高寫生工作坊。    是次系列活動共有五十二位親子參加，導師透過繪本閱讀、情境式引導，讓小朋友認識中國傳統節日及習俗，同時透過親子互動，共同製作賀年用品及中秋燈籠。另外，藉由登高寫生工作坊讓親子走到戶外，到郊野公園登高及寫生，培養親子關係。    主辦單位期望透過系列活動，弘揚中國傳統美德，提升公民素質，促進親子互動及合作，建立和諧親子關係。    活動獲澳門基金會贊助。,http://www.macaodaily.com/html/2024-11/18/content_1794912.htm,是次系列活動共有五十二位親子參加，導師透過繪本閱讀、情境式引導，讓小朋友認識中國傳統節日及習俗，同時透過親子互動，共同製作賀年用品及中秋燈籠,栢 蕙 青 義 協 工作坊 體驗 節慶         澳 門 栢 蕙 青年 義務 工作者 協會 日前 舉辦 “ 親子 節慶 體驗 系列 活動 ” ， 活動 分為 三個 工作坊 ， 包括 賀年 用品 工作坊 、 中秋 節燈 籠 工作坊 、 登高 寫生 工作坊 。         是 次 系列 活動 共有 五十 二位 親子 參加 ， 導師 透過 繪本 閱讀 、 情境 式 引導 ， 讓 小朋友 認識 中國 傳統 節日 及 習俗 ， 同時 透過 親子 互動 ， 共同 製 作 賀 年 用品 及 中秋 燈籠 。 另外 ， 藉由 登高 寫生 工作坊 讓 親子 走 到 戶外 ， 到 郊野 公園 登高 及 寫生 ， 培養 親子關 係 。         主辦 單位 期望 透過 系列 活動 ， 弘揚 中國 傳統 美德 ， 提升 公民 素質 ， 促進 親子 互動 及 合作 ， 建立 和諧 親子關 係 。         活動 獲澳門 基金 會 贊助 。,2024-11-18
的士違規銳減值得肯定   悅  鳴,的士違規銳減值得肯定    今屆大賽車昨日落下帷幕，四日賽事期間，賽道及周邊道路分階段實施多項臨時交通管制措施，特別是有五十條巴士路線需改道及臨時調整停靠站，不少居民和遊客為減少出行影響，或改以的士代步。這時的士服務的質和量至關重要，所幸自“新的士法”生效以來，的士違規情況斷崖式下降，今年大賽車期間亦未見太多的士違規，成績值得肯定。    根據早年澳門陸路整體交通運輸政策十年規劃，政府堅持“公交優先”，期間巴士線路由六十一條增至八十五條，有效實現更完善的公交路網和分流作用。但對於澳門這樣一個人口密度甚高的旅遊城市，的士仍有其不可或缺作用，尤其對於“人生路不熟”的旅客，乘搭的士能更便捷、舒適地前往目的地。    “新的士法”一九年生效前，的士違規情況十分猖獗，以一八年為例，當年違規個案總數逾萬宗，即平均每日近卅宗，相當嚴重，其中濫收車資最多，其次是拒載，有關行為對小城旅遊形象造成惡劣影響，尤其經常被受影響旅客分享到網上，引起廣泛議論，小城旅遊形象插水。    “新的士法”引入電子監控系統後，違規情況大幅改善，但仍有少數害群之馬知法犯法，需要當局持續加強打擊，淨化行業形象。    悅   鳴,http://www.macaodaily.com/html/2024-11/18/content_1794913.htm,“新的士法”一九年生效前，的士違規情況十分猖獗，以一八年為例，當年違規個案總數逾萬宗，即平均每日近卅宗，相當嚴重，其中濫收車資最多，其次是拒載，有關行為對小城旅遊形象造成惡劣影響，尤其經常被受影響旅客分享到網上，引起廣泛議論，小城旅遊形象插水,的士 違規銳減 值得 肯定         今屆 大賽車 昨日 落下 帷幕 ， 四日 賽事 期間 ， 賽道 及 周邊 道路 分階段 實施 多項 臨時 交通管制 措施 ， 特別 是 有 五十 條 巴士 路線 需 改道 及 臨時 調整 停靠站 ， 不少 居民 和 遊客 為 減少 出行 影響 ， 或 改以 的士 代步 。 這時 的士 服務 的 質和量 至關 重要 ， 所幸 自 “ 新 的士 法 ” 生效 以來 ， 的士 違規 情況 斷崖式 下降 ， 今年 大賽 車期 間 亦 未見 太多 的士 違規 ， 成績 值得 肯定 。         根據 早年 澳門 陸路 整體 交通 運輸 政策 十年 規劃 ， 政府 堅持 “ 公交 優先 ” ， 期間 巴士 線 路由 六十一 條 增至 八十五 條 ， 有效 實現 更 完善 的 公交 路網 和 分流 作用 。 但 對 於 澳門 這樣 一個 人口密度 甚高 的 旅遊 城市 ， 的士 仍 有 其 不可或缺 作用 ， 尤其 對 於 “ 人生路不熟 ” 的 旅客 ， 乘 搭 的士 能 更 便捷 、 舒適 地 前往 目的地 。         “ 新 的士 法 ” 一 九年 生效 前 ， 的士 違規 情況 十分 猖獗 ， 以一 八年 為例 ， 當年 違規個案 總數 逾 萬宗 ， 即 平均 每日 近卅宗 ， 相當 嚴重 ， 其中 濫收 車資 最多 ， 其次 是 拒載 ， 有 關行 為 對 小城 旅遊 形象 造成 惡劣 影響 ， 尤其 經常 被 受 影響 旅客 分享 到 網上 ， 引起 廣泛 議論 ， 小城 旅遊 形象 插水 。         “ 新 的士 法 ” 引入 電子 監控 系統 後 ， 違規 情況 大幅 改善 ， 但 仍 有 少 數害 群之馬 知法犯法 ， 需要 當局 持續 加強 打擊 ， 淨化 行業 形象 。         悅       鳴,2024-11-18
利民會蓮花盃推廣復康足球,利民會蓮花盃推廣復康足球    利民會主辦“二○二四年蓮花盃復康足球交流賽”，共有五隊的精神復康團體參與，包括深圳市殘疾人聯合會——深圳隊、香港心理衛生會——復元聯隊、澳門扶康會——怡樂軒隊、澳門特殊奧運會——SO KICK隊及澳門利民會——旭之優隊，賽事分為共融賽及交流賽，交流賽由深圳市殘疾人聯合會——深圳隊獲得冠軍。    賽事由社工局贊助，決賽日前舉行，開幕禮由中聯辦社工部四級主任科員楊慧延，社工局康復服務處長余家偉，議員何潤生、顏奕恆，以及利民會理事委員會主席蔡嘉敏等主持。    蔡嘉敏表示，適逢今年雙慶，藉此聯繫各地區精神復康團體，推廣及共同參與復康足球運動，加深連結和合作。該會將持續努力，推廣復康足球及社區共融訊息。,http://www.macaodaily.com/html/2024-11/18/content_1794914.htm,利民會蓮花盃推廣復康足球    利民會主辦“二○二四年蓮花盃復康足球交流賽”，共有五隊的精神復康團體參與，包括深圳市殘疾人聯合會——深圳隊、香港心理衛生會——復元聯隊、澳門扶康會——怡樂軒隊、澳門特殊奧運會——SO KICK隊及澳門利民會——旭之優隊，賽事分為共融賽及交流賽，交流賽由深圳市殘疾人聯合會——深圳隊獲得冠軍,利民 會蓮花 盃 推廣 復 康 足球         利民 會主辦 “ 二 ○ 二 四年 蓮花 盃 復 康 足球 交流 賽 ” ， 共有 五隊 的 精神 復 康團體 參 與 ， 包括 深圳市 殘疾人 聯合會 — — 深圳 隊 、 香港 心理 衛生會 — — 復 元 聯隊 、 澳門 扶康會 — — 怡樂 軒隊 、 澳門 特殊 奧運會 — — SO   KICK 隊及 澳門 利民 會 — — 旭 之 優隊 ， 賽事 分為 共融賽 及 交流 賽 ， 交流 賽由 深圳市 殘疾人 聯合會 — — 深圳 隊 獲得 冠 軍 。         賽 事由 社工 局贊助 ， 決賽 日前 舉行 ， 開幕禮 由 中聯 辦社 工部 四級 主任 科員 楊慧延 ， 社工 局康 復 服務 處長 余家 偉 ， 議員 何潤生 、 顏奕恆 ， 以及 利民 會 理事 委員會 主席 蔡嘉敏 等 主持 。         蔡嘉敏 表示 ， 適逢 今年 雙慶 ， 藉此 聯 繫 各地 區 精神 復 康團體 ， 推廣及 共同 參與 復 康 足球 運動 ， 加深 連結 和 合作 。 該會 將持續 努力 ， 推廣 復 康 足球 及 社區 共 融訊息 。,2024-11-18
金融界雙慶盃環山賽報名,金融界雙慶盃環山賽報名    由澳門金融界籌備慶祝活動常設委員會主辦、澳門銀行公會承辦的金融界雙慶系列活動之二○二四“雙慶盃”環山跑比賽，將於十二月十五日在松山馬路舉行，十一月十八至二十九日接受報名。是次比賽為金融界雙慶系列活動之一。    賽事設“個人賽”及“接力賽”，個人賽環繞松山一個圈（全長約1700米）; 接力賽環繞松山兩個圈（全長約3400米）。個人賽各組及接力賽獎前十名。比賽章程和報名表可掃描二維碼或登入網址(https://www.abm.org.mo/home)下載報名表。報名者填妥報名表、健康聲明書、提供身份證明文件前往達威獎品公司報名。,http://www.macaodaily.com/html/2024-11/18/content_1794915.htm,金融界雙慶盃環山賽報名    由澳門金融界籌備慶祝活動常設委員會主辦、澳門銀行公會承辦的金融界雙慶系列活動之二○二四“雙慶盃”環山跑比賽，將於十二月十五日在松山馬路舉行，十一月十八至二十九日接受報名,金融界 雙慶 盃 環山賽 報名         由 澳門 金融界 籌備 慶祝 活動常 設委員會 主辦 、 澳門 銀行 公會 承辦 的 金融界 雙慶 系列 活動 之二 ○ 二四 “ 雙慶 盃 ” 環山 跑 比賽 ， 將於 十二月 十五日 在 松山 馬 路 舉行 ， 十一月 十八 至 二十九日 接受 報名 。 是 次 比賽 為 金融界 雙慶 系列 活動 之一 。         賽事設 “ 個 人賽 ” 及 “ 接力 賽 ” ， 個 人賽 環繞 松山一 個圈 （ 全長 約 1700 米 ） ;   接力 賽環繞 松山 兩個 圈 （ 全長 約 3400 米 ） 。 個 人賽 各 組及 接力 賽獎 前十名 。 比賽 章程 和 報 名表 可掃 描二維碼 或 登入 網址 ( https : / / www . abm . org . mo / home ) 下載 報 名表 。 報名者 填 妥報 名表 、 健康 聲明書 、 提供 身份 證明 文件 前往 達威 獎品 公司 報名 。,2024-11-18
友愛傳承嘉年華宣互助共融,"友愛傳承嘉年華宣互助共融    街總青洲社區中心聯同澳門青洲青年義務工作者協會日前舉辦“友愛傳承樂滿FUN”嘉年華活動，旨在弘揚互助共融和身心健康理念。    街坊總會副會長、立法議員何潤生，街坊總會副理事長、立法議員梁鴻細，青洲坊眾互助會副會長楊達威，筷子基坊眾互助會副理事長陳少佳，澳門青洲青年義務工作者協會理事長梁潔環等出席。    街總青洲社區中心主任鄭海輝致辭稱，中心在過去一年特別關注不同群體需求，合共處理91宗個案，舉辦253項活動，開設班組793次，服務153,910人次。個案中，情緒問題尤為突出，因此中心將繼續加強情緒健康支持服務，提供更多心理輔導和社區活動，以幫助居民應對情緒挑戰。    活動現場設攤位遊戲、親子手工坊、親子攝影區及親子廚藝坊等，吸引眾多家庭參與，場面熱鬧。",http://www.macaodaily.com/html/2024-11/18/content_1794918.htm,友愛傳承嘉年華宣互助共融    街總青洲社區中心聯同澳門青洲青年義務工作者協會日前舉辦“友愛傳承樂滿FUN”嘉年華活動，旨在弘揚互助共融和身心健康理念,"友愛傳 承嘉年 華宣 互助 共融         街 總 青洲 社區 中心 聯同 澳門 青洲 青年 義務 工作者 協會 日前 舉辦 “ 友愛傳 承樂滿 FUN ” 嘉年華 活動 ， 旨在 弘揚 互助 共 融和 身心健康 理念 。         街坊 總會 副 會長 、 立法 議員 何潤生 ， 街坊 總會 副 理事 長 、 立法 議員 梁鴻細 ， 青洲 坊眾 互助 會 副 會長 楊達威 ， 筷子 基坊眾 互助 會 副 理事 長 陳 少佳 ， 澳門 青洲 青年 義務 工作者 協會 理事 長 梁潔環 等 出席 。         街 總 青洲 社區 中心 主任 鄭海輝致 辭稱 ， 中心 在 過去 一年 特別 關注 不同 群體 需求 ， 合共 處理 91 宗個案 ， 舉辦 253 項活動 ， 開設 班組 793 次 ， 服務 153 , 910 人次 。 個案 中 ， 情緒 問題 尤為 突出 ， 因此 中心 將繼續 加強 情緒 健康 支持 服務 ， 提供 更 多 心理 輔導 和 社區 活動 ， 以幫助 居民 應對 情緒 挑戰 。         活動 現場 設攤位 遊戲 、 親子 手工 坊 、 親子 攝影區 及 親子 廚藝坊 等 ， 吸引 眾多 家庭 參與 ， 場面 熱鬧 。",2024-11-18
聖公會親子同樂日防迷網,"聖公會親子同樂日防迷網    聖公會“重新連線”前日下午三時於科學館舉行“Connect Us親子同樂日”。本年為發揮青少年的創意、創新潛能及優勢，社工推動青少年參與策劃好玩有趣的遊戲及攤位，推廣網絡素養，吸引居民參與。冀藉打造親子時光，支援家長及早預防子女沉迷網絡及關注“隱蔽”此一社會現象。    聖公會澳門社會服務處服務總監葉鑑波表示，服務處本年一至十月共服務約3,147宗個案及其家庭，當中包括家庭、學習、工作、情緒、身體健康、成癮等相關問題。網絡成癮或賭博成癮相關佔626宗。    是次活動設八個特色區域，包括“VR隱空間”、FPV遙控車體驗、3D人像掃描、SPEED RUNNER（AR動態遊戲）、親子奶油膠手作、豆袋擂台挑戰、咖啡義賣及桌遊體驗。同場設網絡素養Ready Go家長小冊子及時間管理輔助工具推廣。",http://www.macaodaily.com/html/2024-11/18/content_1794924.htm,"聖公會澳門社會服務處服務總監葉鑑波表示，服務處本年一至十月共服務約3,147宗個案及其家庭，當中包括家庭、學習、工作、情緒、身體健康、成癮等相關問題","聖公會 親子 同樂日 防迷網         聖公會 “ 重新 連線 ” 前日 下午 三時 於 科學館 舉行 “ Connect   Us 親子 同樂日 ” 。 本年 為 發揮 青少年 的 創意 、 創新 潛能 及 優勢 ， 社工 推動 青少年 參與 策劃 好玩 有趣 的 遊戲 及 攤位 ， 推廣 網絡 素養 ， 吸引 居民 參與 。 冀藉 打造 親子 時光 ， 支援 家長 及早 預防 子女 沉迷 網絡 及 關注 “ 隱蔽 ” 此一 社會 現象 。         聖公會 澳門 社會 服務處 服務 總監葉 鑑波 表示 ， 服務處 本年 一至 十月 共 服務約 3 , 147 宗個案 及其 家庭 ， 當中 包括 家庭 、 學習 、 工作 、 情緒 、 身體 健康 、 成癮 等 相關 問題 。 網絡 成癮 或 賭博成 癮 相關 佔 626 宗 。         是 次 活動 設八個 特色 區域 ， 包括 “ VR 隱空間 ” 、 FPV 遙控車 體驗 、 3D 人像 掃描 、 SPEED   RUNNER （ AR 動態 遊戲 ） 、 親子 奶油 膠手作 、 豆袋 擂台 挑戰 、 咖啡 義賣 及 桌遊 體驗 。 同場 設 網絡 素養 Ready   Go 家長 小冊子 及 時間 管理 輔助 工具 推廣 。",2024-11-18
製總智能手機應用班報名,製總智能手機應用班報名    澳門製造業總工會十二月開辦智能手機應用之微信溫故知新篇，由十二月二日起，逢星期一、四上課，上課時間 : 上午十時至十一時半，全期十五堂，報名及上課地點：製造業總工會（黑沙環大馬路四十二號福祥樓二樓A-G座）。即日起接受報名，額滿即止，查詢電話 : 2848-1483。,http://www.macaodaily.com/html/2024-11/18/content_1794925.htm,製總智能手機應用班報名    澳門製造業總工會十二月開辦智能手機應用之微信溫故知新篇，由十二月二日起，逢星期一、四上課，上課時間 : 上午十時至十一時半，全期十五堂，報名及上課地點：製造業總工會（黑沙環大馬路四十二號福祥樓二樓A-G座）,製 總 智能 手機 應用 班 報名         澳 門 製 造 業 總 工 會 十二月 開辦 智能 手機 應用 之微 信溫 故知 新篇 ， 由 十二月 二日 起 ， 逢 星期一 、 四上 課 ， 上課 時間   :   上午 十時 至 十一 時半 ， 全期 十五 堂 ， 報名 及 上 課 地點 ： 製 造 業 總 工 會 （ 黑沙 環大馬路 四十二 號福祥樓 二樓 A - G 座 ） 。 即日起 接受 報名 ， 額滿 即止 ， 查詢 電話   :   2848 - 1483 。,2024-11-18
酒店後台智能化料延伸前台,機器難取代人    酒店後台智能化料延伸前台    【本報消息】智能化管理應用正在本澳各行業中不斷延伸，可幫助企業減輕人力成本，達至更高效的管理水平。有本澳酒店業界指，酒店智能化應用主要是後台管理，坦言未來或會進一步向前台延伸。但強調不會以機器取代人類的友善服務，以配合澳門熱情好客的旅遊城市特質。    內地酒店業在智能化應用上超前突破，除一般後台系統應用，部分城巿更推出無人酒店，吸引不少旅客的好奇心爭相入住體驗。    兩三分鐘辦妥入住    對於本澳酒店業的智能化和技術應用，立法議員、澳門酒店旅業商會會長、澳門中國旅行社股份有限公司董事長張健中表示，酒店業科技應用在各行業中相對靠前，由原本以人工運行，變成現時大部分酒店已實現智能化後台管理，包括酒店預訂系統、客房編排、入住安排等，全採取智能化運作，無論客人是透過電話、網站、親臨預訂，只要預訂行為發生，後台的智能化設備應用就可令整個接待速度大幅提升，當客人到達酒店即可馬上簽名入住，需時可能只是兩三分鐘，相比以往已經快得多，相信由此產生的效能和技術累積後，未來智能化會進一步延伸至前台，包括接待旅客或活動領域等都有條件去實現。    旅客有更優質體驗    行業實現智能化管理不單只是節省資源，而是令旅客有更優質、更便利的旅遊體驗。現時酒店業智能化應用最普及的是便捷高速的入住登記、餐飲運輸、信息傳遞等服務應用，實現智能方案是讓旅客感受到優質和遠超預期的服務，令入住者體驗溫暖、安全、可靠的旅遊服務，強調一系列過程中堅守依法合規、資料保密、信息運用安全等原則，相信未來數年本澳酒店業科技賦能應用上會進一步加快和提高。    至於本澳酒店實現無人接待的可能性？他坦言不排除經過一段時間會陸續出現。由於本澳要保持優質旅遊城巿形象，坦言未來智能化應用即使會進一步向酒店前台延伸，但不會以機器取代人類的熱情、好客形象，而是令顧客享受到科技進步同時，也能感受到旅遊城巿熱情服務。,http://www.macaodaily.com/html/2024-11/18/content_1794877.htm,兩三分鐘辦妥入住    對於本澳酒店業的智能化和技術應用，立法議員、澳門酒店旅業商會會長、澳門中國旅行社股份有限公司董事長張健中表示，酒店業科技應用在各行業中相對靠前，由原本以人工運行，變成現時大部分酒店已實現智能化後台管理，包括酒店預訂系統、客房編排、入住安排等，全採取智能化運作，無論客人是透過電話、網站、親臨預訂，只要預訂行為發生，後台的智能化設備應用就可令整個接待速度大幅提升，當客人到達酒店即可馬上簽名入住，需時可能只是兩三分鐘，相比以往已經快得多，相信由此產生的效能和技術累積後，未來智能化會進一步延伸至前台，包括接待旅客或活動領域等都有條件去實現,機器 難 取代 人         酒店 後 台 智能化 料 延伸 前台         【 本報 消息 】 智能化 管理 應用 正在 本澳 各行 業中 不斷 延伸 ， 可幫助 企業 減輕 人力 成本 ， 達至 更 高效 的 管理水平 。 有本澳 酒店 業界 指 ， 酒店 智能化 應用 主要 是後台 管理 ， 坦言 未來 或會進 一步 向前 台 延伸 。 但強 調不會 以 機器 取代 人類 的 友善 服務 ， 以 配合 澳門 熱情 好客 的 旅遊 城市 特質 。         內地 酒店 業在 智能化 應用 上 超前 突破 ， 除 一般 後 台系統 應用 ， 部分 城 巿 更 推出 無人 酒店 ， 吸引 不少 旅客 的 好奇心 爭相 入住 體驗 。         兩 三分 鐘辦 妥 入住         對 於 本澳 酒店 業的 智能化 和 技術 應用 ， 立法 議員 、 澳門 酒店 旅業 商會會長 、 澳門 中國 旅行社 股份 有限公司 董事 長 張健中 表示 ， 酒店 業 科技 應用 在 各行 業中 相 對 靠 前 ， 由 原本 以 人工 運行 ， 變成 現時 大部分 酒店 已 實現 智能化 後 台 管理 ， 包括 酒店 預訂 系統 、 客房 編排 、 入住 安排 等 ， 全採取 智能化 運作 ， 無論 客人 是 透過 電話 、 網站 、 親臨 預訂 ， 只要 預訂 行為 發生 ， 後 台 的 智能化 設備 應用 就 可令 整個 接待 速度 大幅 提升 ， 當 客人 到 達 酒店 即可 馬 上 簽名 入住 ， 需時 可能 只是 兩 三分 鐘 ， 相比 以往 已經 快得多 ， 相信 由此 產生 的 效能 和 技術 累積 後 ， 未來 智能化 會進 一步 延伸 至 前台 ， 包括 接待 旅客 或 活動 領域 等 都 有 條件 去 實現 。         旅客 有 更 優質 體驗         行業 實現 智能化 管理 不單 只是 節省 資源 ， 而是 令 旅客 有 更 優質 、 更 便利 的 旅遊 體驗 。 現時 酒店 業 智能化 應用 最 普及 的 是 便捷 高速 的 入住 登記 、 餐飲 運輸 、 信息 傳遞 等 服務 應用 ， 實現 智能 方案 是 讓 旅客 感受 到 優質 和 遠超 預期 的 服務 ， 令 入住 者 體驗 溫暖 、 安全 、 可靠 的 旅遊 服務 ， 強調 一系列 過程 中 堅守 依法 合規 、 資料 保密 、 信息 運用 安全 等 原則 ， 相信 未來 數年 本澳 酒店 業 科技 賦能 應用 上會進 一步 加快 和 提高 。         至於 本澳 酒店 實現 無人 接待 的 可能性 ？ 他 坦言 不 排除 經過 一段 時間 會 陸續 出現 。 由 於 本 澳要 保持 優質 旅遊城 巿 形象 ， 坦言 未來 智能化 應用 即使 會進 一步 向 酒店 前台 延伸 ， 但 不會 以 機器 取代 人類 的 熱情 、 好客 形象 ， 而是 令顧客 享受 到 科技 進步 同時 ， 也 能 感受 到 旅遊城 巿 熱情 服務 。,2024-11-18
