Title,Content,Link,Summary,Preprocessed_Content,Date
馬伊琍周依然素顏聚會,拍《我的阿勒泰》結緣    馬伊琍周依然素顏聚會    內地演員周依然在個人社交平台曬出與馬伊琍、蔣奇明等人聚會照。身為九○後的蔣奇明和周依然，雖然比馬伊琍小很多，但因合作《我的阿勒泰》而結緣的她們並沒有代溝，相處得十分自然。從周依然曬出的無修圖聚會照，可見眾人臉上痘痘、皺紋都能看到，但大家的狀態都很好，真實自然靈動。    網民說尤其是馬伊琍，已經四十八歲的馬伊琍與周依然這些小年輕同框毫無壓力，全素顏示人的她臉斑清晰可見，但皮膚卻很緊致，精神面貌好青春。合照時與周依然臉貼臉的馬伊琍，臉上掛滿笑容，眼角雖有些許細紋，但相比很多同齡普通人狀態還是要優越很多。聚在一起的一行人每個人都喝了酒，臉都紅紅的。    在《我的阿勒泰》劇中和周依然飾演母女的馬伊琍，有網友說現實生活中的兩人，從某個角度來看長得的確有些相似。蔣奇明則在劇中飾演周依然扮演角色的追求者，談到蔣奇明在劇中表現，身為前輩的馬伊琍對他給予了很高的評價。    馬伊琍在採訪中，就曾公開誇讚蔣奇明是個將自己扔到角色的那種人，還說他演得比自己都好，絲毫不掩飾對他的欣賞。從《親愛的小孩》《宇宙探索編輯部》到《我的阿勒泰》，蔣奇明演出的雖都是配角，但每個角色在他的詮釋下都很出色，在圈中未來可期。    而說到馬伊琍，不管是演戲還是生活中，她同樣是個值得讓人讚賞的人。身為演員，四十多歲的馬伊琍完全沒有年齡焦慮，不管是拍戲還是生活中她從不畏懼將最真實一面呈現在鏡頭前。而生活中身為兩個孩子的單親媽媽，她將愛馬姐妹培養得很優秀，和文章離婚後從不阻止女兒們與爸爸親近，而且，有時候還會和文章一起陪伴孩子，被讚做得很體面。,http://www.macaodaily.com/html/2024-09/03/content_1778599.htm,在《我的阿勒泰》劇中和周依然飾演母女的馬伊琍，有網友說現實生活中的兩人，從某個角度來看長得的確有些相似,拍 《 我 的 阿勒泰 》 結緣         馬 伊 琍 周 依然 素顏聚會         內地 演員周 依然 在 個 人 社交 平台 曬出 與 馬 伊 琍 、 蔣奇明 等 人 聚會照 。 身為 九 ○ 後 的 蔣奇明 和 周 依然 ， 雖然 比馬伊 琍 小 很多 ， 但 因 合作 《 我 的 阿勒泰 》 而 結緣 的 她 們 並沒有 代溝 ， 相處 得 十分 自然 。 從周 依然 曬出 的 無 修圖 聚會照 ， 可見 眾人 臉上 痘痘 、 皺紋 都 能 看到 ， 但 大家 的 狀態 都 很 好 ， 真實 自然 靈動 。         網民說 尤其 是 馬 伊 琍 ， 已經 四十八 歲 的 馬 伊 琍 與 周 依然 這 些小 年 輕同 框毫 無 壓力 ， 全素顏 示人 的 她 臉斑 清晰 可見 ， 但 皮膚 卻 很 緊致 ， 精神面貌 好 青春 。 合照 時 與 周 依然 臉貼 臉 的 馬 伊 琍 ， 臉上 掛滿 笑容 ， 眼角 雖 有些 許細紋 ， 但 相比 很多 同齡 普通人 狀態 還是 要 優越 很多 。 聚在一起 的 一行 人 每個 人 都 喝了酒 ， 臉 都 紅紅 的 。         在 《 我 的 阿勒泰 》 劇中 和 周 依然 飾演 母女 的 馬 伊 琍 ， 有 網友 說 現實 生活 中 的 兩人 ， 從 某個 角度 來 看長 得 的確 有些 相似 。 蔣奇 明則 在 劇中飾 演周 依然 扮演 角色 的 追求者 ， 談到 蔣奇明 在 劇中表現 ， 身為 前輩 的 馬 伊 琍 對 他 給予 了 很 高 的 評價 。         馬 伊 琍 在 採訪 中 ， 就 曾 公開 誇 讚 蔣 奇 明 是 個 將 自己 扔 到 角色 的 那種 人 ， 還說 他 演得 比 自己 都 好 ， 絲 毫不 掩飾 對 他 的 欣賞 。 從 《 親愛的 小孩 》 《 宇宙 探索 編輯部 》 到 《 我 的 阿勒泰 》 ， 蔣奇明 演出 的 雖 都 是 配角 ， 但 每個 角色 在 他 的 詮釋 下 都 很 出色 ， 在 圈 中 未來 可期 。         而 說 到 馬 伊 琍 ， 不管 是 演戲 還是 生活 中 ， 她 同樣 是 個 值得 讓 人 讚 賞 的 人 。 身為 演員 ， 四十多 歲 的 馬 伊 琍 完全 沒有 年齡 焦慮 ， 不管 是 拍戲 還是 生活 中 她 從 不畏 懼將 最真實 一面 呈現 在 鏡頭 前 。 而 生活 中身 為 兩個 孩子 的 單親 媽媽 ， 她 將愛馬 姐妹 培養 得 很 優秀 ， 和 文章 離婚 後 從 不 阻止 女兒們 與 爸爸 親近 ， 而且 ， 有 時候 還會 和 文章 一起 陪伴 孩子 ， 被 讚 做 得 很 體 面 。,2024-09-03
愷樂突曬超音波孕肚照,愷樂突曬超音波孕肚照    愷樂（蝴蝶姐姐）消失在熒光屏前已有四年，上一次更新社群是哀悼小鬼黃鴻升離世。她於去年曾被周刊爆料離婚，不過後續並未有下文。    怎料，愷樂昨日突然更新IG，曬出一張超音波照，寫下“Hello 9月”，宣佈懷孕消息。    愷樂在二○二○年因捲入羅志祥背叛女友周揚青及“多人運動”醜聞，直接從娛圈消失。    後來傳出她嫁給上海醫生，於去年鬧婚變，不過消息始終未被證實。她昨日突然曬出一張胎兒的超音波照，似乎即將升格當新手媽媽，喜訊引來大批網友圍觀點讚。    她息影前是羅志祥的公司藝人，喜訊公開後，記者詢問羅志祥經紀人，對方表示“我在開會，等下問他，還沒收到喜訊。”    過去，羅志祥曾在受訪時被問到是否有跟愷樂聯絡，他大方承認還是朋友，有透過公司去關心，知道她最近很好，“每個人都往前看，不用去提，已經過這麼多年”。至於傳聞愷樂有意復出演藝圈，羅志祥不想代替她回答，僅表示：“要問她個人，個人意願比較重要”。,http://www.macaodaily.com/html/2024-09/03/content_1778600.htm,”    過去，羅志祥曾在受訪時被問到是否有跟愷樂聯絡，他大方承認還是朋友，有透過公司去關心，知道她最近很好，“每個人都往前看，不用去提，已經過這麼多年”,愷樂 突曬 超音波 孕肚照         愷樂 （ 蝴蝶 姐姐 ） 消失 在熒 光屏 前 已有 四年 ， 上 一次 更新 社群 是 哀悼 小鬼 黃 鴻 升離世 。 她 於 去年 曾 被 周刊 爆料 離婚 ， 不 過後續並 未有 下文 。         怎料 ， 愷樂 昨日 突然 更新 IG ， 曬出 一張 超音波 照 ， 寫下 “ Hello   9 月 ” ， 宣 佈 懷孕 消息 。         愷樂 在 二 ○ 二 ○ 年 因 捲 入羅志祥 背叛 女友 周揚 青及 “ 多人 運動 ” 醜聞 ， 直接 從 娛圈 消失 。         後 來 傳出 她 嫁給 上海 醫生 ， 於 去年 鬧 婚變 ， 不過 消息 始終 未 被 證實 。 她 昨日 突然 曬出 一張 胎兒 的 超音波 照 ， 似乎 即將 升格 當 新手 媽媽 ， 喜訊 引來 大批 網友 圍觀 點 讚 。         她 息影 前 是羅志祥 的 公司 藝人 ， 喜訊 公開 後 ， 記者詢 問羅志祥 經紀 人 ， 對方 表示 “ 我 在 開會 ， 等 下問 他 ， 還沒 收到 喜訊 。 ”         過去 ， 羅 志祥 曾 在 受訪 時 被 問到 是否 有 跟愷樂 聯絡 ， 他 大方 承認 還是 朋友 ， 有 透過 公司 去 關心 ， 知道 她 最近 很 好 ， “ 每個 人 都 往前 看 ， 不用 去 提 ， 已經過 這麼 多年 ” 。 至於 傳聞愷樂 有意 復 出演 藝圈 ， 羅 志祥 不想 代替 她 回答 ， 僅 表示 ： “ 要問 她 個 人 ， 個 人 意願 比 較 重要 ” 。,2024-09-03
彭昱暢闌尾炎術後暴瘦,彭昱暢闌尾炎術後暴瘦    前日，內地演員彭昱暢出席第十九屆長春電影節，憑電影《我們一起搖太陽》中飾演的角色呂途，獲最佳男演員獎，但更引起關注的是他的身材變化。彭昱暢過去參加《嚮往的生活》時，身材較為圓潤，且常被拍到在吃的關係，在觀眾心中留下深刻印象。不過一旦結束節目，就會回歸演員本業開始瘦身。但近日參加第十九屆長春電影節，被發現整個人瘦了一大圈，他幕後訪問中透露，其實是因為闌尾炎，動手術後才突然瘦這麼多的。    彭昱暢在長春電影節中以《我們一起搖太陽》呂途獲得最佳男演員獎，對此殊榮他非常開心，並在社交平台上發文表示：“在我三十歲之前獲得的最有意義的禮物，未來繼續努力前行，呂途，看，希望一直在，太陽搖起來了。”    網友們紛紛留言表示關心，有人寫道：“本來還想學一下怎麼暴瘦，這可不行，這個辦不到”、“一定要注意休息啊”、“要注意身體，飲食搭配要規律”，並建議大家通過運動來健康減肥，不要靠不吃飯來達到目的。,http://www.macaodaily.com/html/2024-09/03/content_1778601.htm,彭昱暢闌尾炎術後暴瘦    前日，內地演員彭昱暢出席第十九屆長春電影節，憑電影《我們一起搖太陽》中飾演的角色呂途，獲最佳男演員獎，但更引起關注的是他的身材變化,彭昱 暢闌尾 炎術後暴 瘦         前日 ， 內地 演員 彭昱暢 出席 第十九 屆長 春電 影節 ， 憑電影 《 我們 一起 搖太陽 》 中飾演 的 角色 呂途 ， 獲 最佳 男演員獎 ， 但 更 引起 關注 的 是 他 的 身材 變化 。 彭昱 暢過 去 參加 《 嚮 往 的 生活 》 時 ， 身材 較 為 圓潤 ， 且常 被 拍 到 在 吃 的關 係 ， 在 觀眾 心中 留下 深刻印象 。 不過 一旦 結束 節目 ， 就會 回歸 演員本業 開始 瘦身 。 但 近日 參加 第十九 屆長 春電 影節 ， 被 發現 整個 人 瘦 了 一大 圈 ， 他幕後訪 問中 透露 ， 其實 是 因為 闌尾炎 ， 動手術後才 突然 瘦 這麼 多 的 。         彭昱暢 在 長 春電 影節 中以 《 我們 一起 搖太陽 》 呂途 獲得 最佳 男演員獎 ， 對 此殊榮 他 非常 開心 ， 並在 社交 平台 上 發文 表示 ： “ 在 我 三十 歲 之前 獲得 的 最 有意 義的 禮物 ， 未來 繼續 努力 前行 ， 呂途 ， 看 ， 希望 一直 在 ， 太陽搖起 來 了 。 ”         網友們 紛紛 留言 表示 關心 ， 有人 寫道 ： “ 本來 還想學 一下 怎麼 暴瘦 ， 這可 不行 ， 這個 辦 不到 ” 、 “ 一定 要 注意 休息 啊 ” 、 “ 要 注意 身體 ， 飲食 搭配 要 規律 ” ， 並建議 大家 通過 運動來 健康 減肥 ， 不要 靠 不吃 飯來 達 到 目的 。,2024-09-03
關秀媚：導演要我插他屁股,當年吳彥祖面紅堅拒    關秀媚：導演要我插他屁股    吳彥祖出道電影《美少年之戀》電暈無數影迷，隨後拍攝無數港片，其中二○○一的《知法犯法》尺度非常大。片中他與女主角關秀媚有場激情戲相當經典，女方近日透露拍攝秘辛，讓這場戲再掀話題。關秀媚上王晶的YouTube節目，暢談過去的拍攝點滴。她出道時身材火辣，有“地表最強性感body”稱號，加上演出眾多黑社會主題片，被封為“江湖最強大嫂”，九八年曾憑《每天愛您8小時》入圍金馬獎最佳女配角。    關秀媚在《知法犯法》中飾演黑幫大佬的妻子，合作的有曾志偉、吳彥祖。片中與吳彥祖有場激情戲，她透露開拍前向對方說明，等一下拍攝會摸哪些部位，大概是肩膀、腰間等，她表示：“導演要求我雙手插他屁股，結果拍不了，因為他的臉太紅了，我就要令他冷靜。”她強調最終只是表情加攝影角度。    吳彥祖在《知法犯法》飾演臥底警察，加入黑幫後卻逐步黑化。他片裡愛上大佬的妻子，被關秀媚背後貼身環抱，兩人脫衣狂吻，激情戲至今仍是經典場面。,http://www.macaodaily.com/html/2024-09/03/content_1778603.htm,當年吳彥祖面紅堅拒    關秀媚：導演要我插他屁股    吳彥祖出道電影《美少年之戀》電暈無數影迷，隨後拍攝無數港片，其中二○○一的《知法犯法》尺度非常大,當年 吳彥 祖面 紅堅 拒         關 秀媚 ： 導演 要 我 插 他 屁股         吳彥 祖出 道 電影 《 美少年 之戀 》 電暈 無數 影迷 ， 隨後拍 攝無數 港片 ， 其中 二 ○ ○ 一 的 《 知法犯法 》 尺度 非常 大 。 片中 他 與 女主角 關 秀媚 有場 激情 戲相當 經典 ， 女方 近日 透露 拍攝 秘辛 ， 讓 這場 戲再 掀話題 。 關 秀媚 上 王晶 的 YouTube 節目 ， 暢談過 去 的 拍 攝點 滴 。 她 出道 時 身材 火辣 ， 有 “ 地表 最強 性感 body ” 稱號 ， 加上 演出 眾多 黑 社會 主題 片 ， 被 封為 “ 江湖 最強 大嫂 ” ， 九八年 曾 憑 《 每天 愛 您 8 小時 》 入圍 金馬獎 最佳 女配角 。         關 秀媚 在 《 知法犯法 》 中飾 演黑 幫 大佬 的 妻子 ， 合作 的 有 曾志偉 、 吳彥 祖 。 片中 與 吳彥 祖有場 激情 戲 ， 她 透露 開拍 前 向 對方 說明 ， 等 一下 拍 攝會 摸 哪些 部位 ， 大概 是 肩膀 、 腰間 等 ， 她 表示 ： “ 導演 要求 我 雙手 插 他 屁股 ， 結果 拍 不了 ， 因為 他 的 臉太紅 了 ， 我 就要 令 他 冷靜 。 ” 她 強調 最終 只是 表情 加攝影 角度 。         吳彥 祖在 《 知法犯法 》 飾演 臥底 警察 ， 加入 黑幫 後 卻 逐步 黑化 。 他 片裡 愛上 大佬 的 妻子 ， 被關 秀媚 背後貼 身環 抱 ， 兩人 脫衣 狂吻 ， 激情 戲 至今 仍 是 經典 場面 。,2024-09-03
凱莎自揭工作中忍屎煎熬,凱莎自揭工作中忍屎煎熬    台灣富邦悍將啦啦隊Fubon Angels成員Kesha（凱莎），日前坦承跳應援到第二局上半場的時候，就已經非常想大便了，就這樣一直撐到結束，整個過程描述十分生動，引起討論。凱莎在Threads發文自爆，坦言自己在比賽應援期間，在二局上半已經感到“屎在滾”，然而仍然堅持到三局上半場愈來愈不對勁：“三下一個全壘打很興奮差點hold不住！上班有時候很煎熬，每次聽到蛋堡的屎王都覺得根本是我的歌，朋友們要顧好腸胃。”    經歷如此難熬的時間，凱莎讚嘆自己最後還是撐住了，在廁所對着鏡子自拍時比出“讚”的手勢。有到場的球迷都在留言區說“三局在妳前面，妳表情管理太厲害”、“推敬業，但身體有狀況還是要盡快排除，畢竟表演時不小心的話，就真的上頭條了”、“只有滾過的才懂你的感受”、“形容得好生動”、“辛苦了，但是真的不舒服應該不要硬撐吧”。,http://www.macaodaily.com/html/2024-09/03/content_1778606.htm,有到場的球迷都在留言區說“三局在妳前面，妳表情管理太厲害”、“推敬業，但身體有狀況還是要盡快排除，畢竟表演時不小心的話，就真的上頭條了”、“只有滾過的才懂你的感受”、“形容得好生動”、“辛苦了，但是真的不舒服應該不要硬撐吧”,凱莎自 揭 工作 中忍 屎 煎熬         台灣 富邦 悍將 啦 啦 隊 Fubon   Angels 成員 Kesha （ 凱莎 ） ， 日前 坦承 跳 應援 到 第 二局上半 場的 時候 ， 就 已經 非常 想 大便 了 ， 就 這樣 一直 撐 到 結束 ， 整個 過程 描述 十分 生動 ， 引起 討論 。 凱莎 在 Threads 發文 自爆 ， 坦言 自己 在 比賽 應援 期間 ， 在 二局上半 已經 感到 “ 屎 在 滾 ” ， 然而 仍然 堅持 到 三局 上半 場愈來 愈 不 對 勁 ： “ 三下 一個 全壘 打 很 興奮 差點 hold 不住 ！ 上班 有 時候 很 煎熬 ， 每次 聽到 蛋堡 的 屎王 都 覺得 根本 是 我 的 歌 ， 朋友 們 要 顧好 腸胃 。 ”         經歷 如此 難熬 的 時間 ， 凱 莎 讚 嘆 自己 最後還 是 撐 住 了 ， 在 廁所 對 着 鏡子 自拍時 比出 “ 讚 ” 的 手勢 。 有 到場 的 球迷 都 在 留言 區說 “ 三局 在 妳 前面 ， 妳 表情 管理 太厲害 ” 、 “ 推敬業 ， 但 身體 有 狀況 還是 要 盡快 排除 ， 畢竟 表演 時 不 小心 的 話 ， 就 真的 上頭條 了 ” 、 “ 只有 滾過 的 才 懂 你 的 感受 ” 、 “ 形容 得 好生 動 ” 、 “ 辛苦 了 ， 但是 真的 不 舒服 應該 不要 硬撐 吧 ” 。,2024-09-03
石堅遺願無法實現   娛翁,石堅遺願無法實現    “堅叔”石堅在離世前的三年、亦即二○○六年曾委託香港電視專業人員協會尋人，並想捐出一個單位。事緣在許久之前堅叔夥同高魯泉、金雷、黃楚山及李壽祺為了令同業有個固定地方休息及交流，五人曾以“長命契”的方式在九龍城買了一個單位，及至二○○六年時除堅叔外其餘合夥人均已離世，原則上堅叔已成為物業擁有人。是以當時堅叔找到香港電視專業人員協會創會會長徐小明，協助尋找四位前輩的後人，望在取得四位前輩的死亡證後可以辦理業權手續，最終將物業捐給有需要的演藝團體。    其時許多傳媒都有報道此事，然而直至堅叔在二○○九年離世後，此事的後續並未獲更新，也不知圓了堅叔遺願沒有。    及至徐小明上周五出席在香港電影資料館電影院舉行，紀念黃卓漢逝世二十周年的“影畫早晨：黃卓漢的影夢人生”中的《流浪小天使》場次時，再被問起堅叔的遺願，徐小明才表示位於九龍城的單位業權頗為複雜，且仍有業權人的一些親人在此居住，而且單位亦頗為殘舊，即使香港電視專業人員協會最終能獲得這單位，也要花不少經費進行大修葺，是以協會與律師研究商討後決定放棄。    實在不知該如何評價這宗事件，其時堅叔肯定不知原來有四位前輩的後人一直在此居住，饋贈物業無疑純屬一番心意，也不想物業浪費，只望能在離世前安排好所有事情，才會簽下授權書由香港電視專業人員協會代為處理。    雖然說現今的市道不好，但一個物業的價值總也要數百萬元，卻原來早已被霸佔了，對方有沒有申請逆權侵佔不得而知，但可以肯定的是堅叔無法圓遺願。    娛翁,http://www.macaodaily.com/html/2024-09/03/content_1778607.htm,及至徐小明上周五出席在香港電影資料館電影院舉行，紀念黃卓漢逝世二十周年的“影畫早晨：黃卓漢的影夢人生”中的《流浪小天使》場次時，再被問起堅叔的遺願，徐小明才表示位於九龍城的單位業權頗為複雜，且仍有業權人的一些親人在此居住，而且單位亦頗為殘舊，即使香港電視專業人員協會最終能獲得這單位，也要花不少經費進行大修葺，是以協會與律師研究商討後決定放棄,石堅 遺願 無法 實現         “ 堅叔 ” 石堅 在 離世前 的 三年 、 亦 即 二 ○ ○ 六年 曾委 託 香港 電視 專業 人員 協會 尋人 ， 並想 捐出 一個 單位 。 事緣 在 許久 之前 堅叔夥同 高魯泉 、 金雷 、 黃 楚山及 李壽祺為 了 令 同業 有個 固定 地方 休息 及 交流 ， 五人 曾 以 “ 長 命契 ” 的 方式 在 九龍城 買 了 一個 單位 ， 及至 二 ○ ○ 六年 時除 堅叔外 其餘 合夥人 均 已 離世 ， 原則 上 堅叔 已成 為物業 擁 有人 。 是 以 當時 堅叔 找到 香港 電視 專業 人員 協會 創會會長 徐小明 ， 協助 尋找 四位 前輩 的 後 人 ， 望 在 取得 四位 前輩 的 死亡 證後 可以 辦理業權 手續 ， 最終 將物業 捐給 有 需要 的 演藝 團體 。         其時 許多 傳媒 都 有 報道 此事 ， 然而 直至 堅叔 在 二 ○ ○ 九年 離世 後 ， 此事 的後續 並未 獲 更新 ， 也 不知 圓了 堅叔 遺願 沒有 。         及至 徐小明 上周五 出席 在 香港 電影 資料 館電 影院 舉行 ， 紀念 黃 卓漢 逝世 二十周年 的 “ 影畫 早晨 ： 黃 卓漢 的 影夢 人生 ” 中 的 《 流浪 小天使 》 場次 時 ， 再 被 問起 堅叔 的 遺願 ， 徐小明 才 表示 位 於 九龍城 的 單位 業權 頗 為 複 雜 ， 且 仍 有業 權人 的 一些 親人 在 此 居住 ， 而且 單位 亦 頗 為 殘舊 ， 即使 香港 電視 專業 人員 協會 最 終能 獲得 這單位 ， 也 要 花 不少 經費 進行 大 修葺 ， 是 以 協會 與 律師 研究 商討後決定 放棄 。         實在 不知 該 如何 評價 這宗 事件 ， 其時 堅叔 肯定 不知 原來 有 四位 前輩 的 後 人 一直 在 此 居住 ， 饋贈 物業 無疑 純屬 一番 心意 ， 也 不想 物業 浪費 ， 只望 能 在 離世前 安排 好 所有 事情 ， 才 會 簽下 授權 書 由 香港 電視 專業 人員 協會代為 處理 。         雖然 說 現今 的 市道 不好 ， 但 一個 物業 的 價值 總 也 要 數百萬元 ， 卻 原來 早已 被 霸 佔 了 ， 對方有 沒有 申請 逆權 侵佔 不得而知 ， 但 可以 肯定 的 是 堅叔 無法圓 遺願 。         娛翁,2024-09-03
