Title,Content,Link,Summary,Preprocessed_Content,Date
新聞特搜,新聞特搜    呑雲吐霧學生哥    加強宣教不嫌多    道路限高務先知    退進維谷計難施    △近日網上有帖文指，懷疑有數名身穿校服的學生在校外吸煙，情況值得關注。自“新控煙法”實施，本澳控煙工作取得一定成效，日前衛生部門公佈，首季共巡查場所六萬八千多間次，共檢控一千一百多宗違反控煙法個案，絕大部分是違法吸煙，其中有三十七宗涉及電子煙。    近年電子煙等被宣傳成潮流玩意，根據二○二一年青少年電子煙調查結果顯示，十三至十五歲中學生人群的電子煙使用率從二○一五年約百分之二點六，上升至二○二一年的百分之四，高於捲煙使用率，可見青少年對電子煙使用率上升。    為此，政府、家、校在控煙宣傳工作上必須與時俱進，深入淺出，讓青少年認識煙害，免受煙害。    △一輛凍櫃貨車昨日中午在羅理基博士大馬路東方拱門行車隧道，疑因車身高度超出隧道限制而撞頂，男司機及女乘客受輕傷，事故更引致外圍交通大受影響。類似事故，包括貨車撞及隧道指示牌和頂部或被困的情況，過往不時發生，起因或與駕車司機疏忽大意有關，因現場早已設有限高指示牌提醒司機。    為避免同類事故再發生，司機必須清楚知道自己所駕駛貨車的車身及運載貨物後的高度等，行車過程中應多留意路牌，及早規劃行車路線，以選擇合適路段行車。    貨運業界須加強對司機的培訓或宣傳，提醒司機注意限高、限寬、限重情況，安全行車。,http://www.macaodaily.com/html/2024-04/11/content_1747543.htm,為避免同類事故再發生，司機必須清楚知道自己所駕駛貨車的車身及運載貨物後的高度等，行車過程中應多留意路牌，及早規劃行車路線，以選擇合適路段行車,新聞特 搜         呑 雲吐霧 學生哥         加強 宣教 不 嫌多         道路 限高 務 先知         退進 維谷計 難施         △ 近日 網上 有 帖 文指 ， 懷疑 有 數名 身穿 校服 的 學生 在 校外 吸煙 ， 情況 值得 關注 。 自 “ 新 控煙法 ” 實施 ， 本澳 控煙 工作 取得 一定 成效 ， 日前 衛生 部門公 佈 ， 首季 共 巡查 場所六萬 八千多 間次 ， 共檢控 一千一百 多宗 違反 控煙法 個案 ， 絕 大部分 是 違法 吸煙 ， 其中 有 三 十七宗 涉及 電子 煙 。         近年 電子 煙 等 被 宣傳成 潮流 玩意 ， 根據 二 ○ 二 一年 青少年 電子 煙 調查 結果 顯示 ， 十三 至 十五 歲 中學生 人群 的 電子 煙 使用率 從 二 ○ 一 五年 約 百分之二 點六 ， 上升 至 二 ○ 二 一年 的 百分之四 ， 高 於 捲 煙 使用率 ， 可見 青少年 對 電子 煙 使用率 上升 。         為 此 ， 政府 、 家 、 校在 控煙 宣傳 工作 上 必須 與 時俱進 ， 深入 淺出 ， 讓 青少年 認識 煙害 ， 免受 煙害 。         △ 一輛 凍櫃 貨車 昨日 中午 在羅理基 博士 大馬路 東方 拱門 行車 隧道 ， 疑因 車身 高度 超出 隧道 限制 而 撞 頂 ， 男司 機及 女 乘客 受輕傷 ， 事故 更 引致 外圍 交通 大受 影響 。 類似 事故 ， 包括 貨車 撞 及 隧道 指示牌 和 頂部 或 被困 的 情況 ， 過往 不時 發生 ， 起因 或 與 駕車 司機 疏忽大意 有關 ， 因 現場 早已 設 有限 高 指示牌 提醒 司機 。         為 避免 同類 事故 再 發生 ， 司機 必須 清楚 知道 自己 所 駕駛 貨車 的 車身 及 運載 貨物 後 的 高度 等 ， 行車 過程 中應 多 留意 路牌 ， 及早 規劃 行車 路線 ， 以選擇 合適 路段 行車 。         貨運業界須 加強 對 司機 的 培訓 或 宣傳 ， 提醒 司機 注意 限高 、 限寬 、 限 重情 況 ， 安全 行車 。,2024-04-11
港女涉盜老婦銀行存款被捕,利用網銀密碼暗中轉賬    港女涉盜老婦銀行存款被捕    【本報消息】香港女子涉利用賭場認識的老婦信任，暗中記下對方提供的網銀密碼，趁用膳期間偷用對方電話轉走近十萬元人民幣，老婦事後發現報警，疑人被司警拘捕。    涉案香港女子姓張，三十九歲，報稱商人，司警以不當進入電腦系統、巨額電腦詐騙罪名移送檢察院處理。    司警公佈案情指出，事主為一名非本澳居民的女長者，數個月前在本澳賭場認識張女，並向對方兌換籌碼，由於事主不懂操作手機銀行，曾將銀行密碼及手機交予疑人代為操作，事後兩人互換聯絡資料。至本月九日早上九時許，事主在路氹某賭場碰見疑人，提議一起用膳，期間事主將電話放在身邊，有人趁事主不為意，拿起電話一番操作後再擺回原處，裝作若無其事。    未幾，事主收到轉賬信息提示，查賬發現有兩筆合共九萬九千多元人民幣被轉走，憶起其密碼只有疑人知道，懷疑是對方所為，報警處理。司警到場向疑人查問，有人否認事件並拒絕交代。,http://www.macaodaily.com/html/2024-04/11/content_1747545.htm,司警公佈案情指出，事主為一名非本澳居民的女長者，數個月前在本澳賭場認識張女，並向對方兌換籌碼，由於事主不懂操作手機銀行，曾將銀行密碼及手機交予疑人代為操作，事後兩人互換聯絡資料,利用 網銀密碼 暗中 轉賬         港女 涉盜 老婦 銀行 存款 被捕         【 本報 消息 】 香港 女子 涉 利用 賭場 認識 的 老婦 信任 ， 暗中 記下 對方 提供 的 網銀密碼 ， 趁 用膳 期間 偷用 對方 電話轉 走近 十萬元 人民 幣 ， 老婦 事後發現 報警 ， 疑人 被 司警 拘捕 。         涉案 香港 女子 姓張 ， 三十九 歲 ， 報稱 商人 ， 司警 以 不當 進入 電腦 系統 、 巨額 電腦 詐騙 罪名 移送 檢 察院 處理 。         司警公 佈 案情 指出 ， 事主 為 一名 非本澳 居民 的 女長 者 ， 數個 月 前 在 本澳 賭場 認識 張女 ， 並向 對方 兌換 籌碼 ， 由 於 事主 不 懂 操作手 機銀行 ， 曾將 銀行 密碼 及 手機 交予 疑人代為 操作 ， 事後兩人 互換 聯絡 資料 。 至 本月 九日 早上 九時許 ， 事主 在 路 氹 某 賭場 碰見 疑人 ， 提議 一起 用膳 ， 期間 事主 將電話 放在 身邊 ， 有人 趁 事主 不為 意 ， 拿起 電話 一番 操作 後 再 擺 回 原處 ， 裝作 若 無 其事 。         未 幾 ， 事主 收到 轉賬 信息 提示 ， 查賬 發現 有 兩筆 合共 九萬 九千多 元 人民 幣被 轉走 ， 憶起 其密碼 只有 疑人 知道 ， 懷疑 是 對 方所為 ， 報警 處理 。 司警 到場 向 疑人 查問 ， 有人 否認 事件 並拒絕 交代 。,2024-04-11
警搗非法麻將檔拘五男女,警搗非法麻將檔拘五男女    【本報消息】治安警本周一在提督馬路道咩卑利士街一店舖搗破一個非法麻將檔，一名涉經營“賭檔”的本地男子，以及四名正在竹戰的本地男女被帶走調查。行動中，檢獲一張麻將檯、兩副麻將及八十八個籌碼證物。    涉案本地男子姓郭，三十四歲，莊荷，涉嫌不法經營麻將場所；同案四名本地男女分別姓梁，五十五歲，賭場主任；姓吳（女），五十一歲，無業；姓謝，五十餘歲，無業；姓李（女），五十歲，莊荷。案件已移送檢察院偵辦。    治安警早前接報指上址一店舖疑有人不法賭博及經營麻將場所，本周一下午四時十五分派員到場調查時發現四人正在打麻將。調查期間，郭某返抵店舖。經查問，有人供稱為店舖承租人，於去年三月上旬租用店舖經營麻將檔，“雀友”在打麻將過程中，任何人每局贏出須抽水十澳門元費用，抽水費用上限為三百澳門元，經營至今共獲利約五千澳門元。    調查資料顯示，上述在賭場工作的男女為男負責人朋友，同於今年二月知悉上址的店舖可以打麻將，在本周一下午四時相約到場打麻將，男負責人提供店舖開門密碼並自行進入店內。,http://www.macaodaily.com/html/2024-04/11/content_1747546.htm,警搗非法麻將檔拘五男女    【本報消息】治安警本周一在提督馬路道咩卑利士街一店舖搗破一個非法麻將檔，一名涉經營“賭檔”的本地男子，以及四名正在竹戰的本地男女被帶走調查,警搗 非法 麻將 檔 拘五 男女         【 本報 消息 】 治安警 本周一 在 提督 馬 路 道 咩 卑 利士 街一店 舖 搗 破 一個 非法 麻將 檔 ， 一名 涉經營 “ 賭檔 ” 的 本地 男子 ， 以及 四名 正在 竹戰 的 本地 男女 被 帶 走 調查 。 行動 中 ， 檢獲 一張 麻將 檯 、 兩副麻將 及 八十八 個 籌碼 證物 。         涉案 本地 男子 姓 郭 ， 三十四 歲 ， 莊荷 ， 涉嫌 不法 經營 麻將場 所 ； 同案 四名 本地 男女 分別 姓 梁 ， 五十五 歲 ， 賭場 主任 ； 姓吳 （ 女 ） ， 五十一 歲 ， 無業 ； 姓謝 ， 五十 餘歲 ， 無業 ； 姓李 （ 女 ） ， 五十 歲 ， 莊荷 。 案件 已 移送 檢 察院 偵辦 。         治安警 早前 接報 指上址 一店 舖 疑 有人 不法 賭博及 經營 麻將場 所 ， 本周一 下午 四時 十五 分派 員到場 調查 時 發現 四人 正在 打麻將 。 調查 期間 ， 郭某 返抵 店 舖 。 經查問 ， 有人 供稱 為 店 舖 承租人 ， 於 去年 三月 上旬 租用 店 舖 經營 麻將 檔 ， “ 雀友 ” 在 打麻將 過程 中 ， 任何人 每局 贏出須 抽水 十澳門 元費用 ， 抽水 費用 上限 為 三百 澳門元 ， 經營 至今 共 獲利約 五千 澳門元 。         調查 資料 顯示 ， 上述 在 賭場 工作 的 男女 為 男 負責人 朋友 ， 同 於 今年 二月 知悉 上址 的 店 舖 可以 打麻將 ， 在 本周一 下午 四時 相約 到場 打麻將 ， 男 負責人 提供 店 舖 開門密 碼並 自行 進 入店 內 。,2024-04-11
三女子服食過量藥物送院,三女子服食過量藥物送院    【本報消息】本澳昨晨先後發生三宗過量服藥事件，三名女子送院治理。確切起因待查。    昨日凌晨一時至早上七時期間，警方接報發生三宗懷疑服食過量藥物事件，分別位於美副將大馬路、青洲大馬路及沙梨頭南街，警員及消防趕抵各單位處理。三名年齡介乎十八至三十六歲的本地女子均感到暈眩，其中兩人懷疑服用大量安眠藥，一人曾服食過量精神科藥物，分別送山頂醫院治理。各事件確切起因有待警方進一步查明。,http://www.macaodaily.com/html/2024-04/11/content_1747547.htm,昨日凌晨一時至早上七時期間，警方接報發生三宗懷疑服食過量藥物事件，分別位於美副將大馬路、青洲大馬路及沙梨頭南街，警員及消防趕抵各單位處理,三 女子 服食 過量 藥物 送院         【 本報 消息 】 本澳 昨晨 先後發生 三宗 過量 服藥 事件 ， 三名 女子 送院 治理 。 確切 起因 待查 。         昨日 凌晨 一時 至 早上 七時 期間 ， 警方 接報 發生 三宗 懷疑 服食 過量 藥物 事件 ， 分別位 於 美 副 將大馬路 、 青洲 大馬路 及 沙梨 頭 南街 ， 警員及 消防 趕抵 各 單位 處理 。 三名 年齡 介乎 十八 至 三十六 歲 的 本地 女子 均 感到 暈眩 ， 其中 兩人 懷疑 服用 大量 安眠 藥 ， 一人 曾 服食 過量 精神科 藥物 ， 分別 送山頂 醫院 治理 。 各 事件 確切 起因 有待 警方 進 一步 查明 。,2024-04-11
統一司法見解上訴被駁回,終院：規避刑訟法規則絕不能接受    統一司法見解上訴被駁回    【本報消息】終審法院院長辦公室訊：甲在初級法院刑事法庭被裁定以直接正犯及既遂方式觸犯一項《刑法典》第三四七條所規定及處罰的“濫用職權罪”罪成，判處八個月徒刑，緩期兩年六個月執行。    甲不服，向中級法院提起上訴。    中級法院於二〇二三年二月十六日在第八六三／二〇二一號案作出合議庭裁判（以下稱“被上訴裁判”），裁定甲的中間上訴不成立，終局上訴的上訴理由部份成立，維持原審法院的有罪判決，但基於缺乏事實依據證明甲的手提電話為犯罪工具，故命令將被扣押的手提電話退回予甲。    甲仍不服，向終審法院提起統一司法見解的非常上訴，認為被上訴裁判與中級法院於二〇一四年十二月十一日在第四一七／二〇一四號案作出的合議庭裁判（以下稱“對立之裁判”）相互對立。    甲指出，在對立之裁判中，該案的上訴人針對原審法院形成心證的證據及理由說明所作出的爭議的依據與被上訴裁判相同，同樣是原審法庭僅列舉相關證據後，便表示綜合該些證言及文件，結論性表述法庭已形成心證及證據充分。甲認為被上訴裁判和原審法院裁判同樣違反《刑事訴訟法典》第三五五條第二款有關理由說明的規定，理應產生與對立之裁判一致的裁判效力，即宣告被上訴裁判同樣基於缺乏說明理由而沾有無效瑕疵。    終審法院對案件作出審理。合議庭指出，受理統一司法見解的非常上訴須符合以下要件：存在合議庭裁判之間的相互對立、針對相同的法律問題及法律規定沒有發生改變。其中，裁判的相互對立要求在被認為相互對立的兩個裁判中所闡述的針鋒相對的觀點具有就同一基本法律問題訂立或給出不同的解決辦法，且這兩個相互對立的裁判必須明示。    合議庭指出，在本案中，並不存在甲所指的合議庭裁判的相互對立。從甲所陳述的理由和所作的結論中可以看到，甲明顯是想要通過非常規的訴訟手段，對被上訴裁判中所作的裁決重新審查，但由於上述裁決已轉為確定，故甲顯然無法通過常規手段來達到此目的。    被上訴裁判和原審法院裁判的理由說明充分且恰當，而甲則只是通過本上訴表達自己的不服，主要針對被視為已確定但對其不利的部分，順帶提及被上訴裁判的理由說明，只不過是想重新討論已被認定的事實事宜和法院在審查證據時形成心證的理由，這種規避《刑事訴訟法典》有關上訴規則的做法絕對不能被接受。    綜上所述，合議庭通過評議會裁定駁回上訴。    參閱終審法院第七七／二〇二三號案的合議庭裁判。,http://www.macaodaily.com/html/2024-04/11/content_1747548.htm,甲仍不服，向終審法院提起統一司法見解的非常上訴，認為被上訴裁判與中級法院於二〇一四年十二月十一日在第四一七／二〇一四號案作出的合議庭裁判（以下稱“對立之裁判”）相互對立,終院 ： 規避 刑訟法 規則絕 不能 接受         統一 司法 見解 上訴 被 駁 回         【 本報 消息 】 終審 法院 院長 辦 公室 訊 ： 甲 在 初級 法院 刑事法庭 被 裁定 以 直接 正犯 及 既 遂 方式 觸犯 一項 《 刑法典 》 第三 四七 條所 規定 及 處罰 的 “ 濫用 職權 罪 ” 罪成 ， 判處 八個 月 徒刑 ， 緩期 兩年 六個 月 執行 。         甲 不服 ， 向 中級 法院 提起 上訴 。         中級 法院 於 二 〇 二三年 二月 十六日 在 第八 六三 ／ 二 〇 二一號案 作出 合議庭 裁判 （ 以下 稱 “ 被 上訴 裁判 ” ） ， 裁定 甲 的 中間 上訴 不 成立 ， 終局 上訴 的 上訴 理由 部份 成立 ， 維持 原審 法院 的 有罪 判決 ， 但基 於 缺乏 事實 依據 證明 甲 的 手提 電話 為 犯罪 工具 ， 故 命令 將被 扣押 的 手提 電話 退回 予甲 。         甲 仍 不服 ， 向 終審 法院 提起 統一 司法 見解 的 非常 上訴 ， 認為 被 上訴 裁判 與 中級 法院 於 二 〇 一 四年 十二月 十一日 在 第四 一 七 ／ 二 〇 一四號案 作出 的 合議庭 裁判 （ 以下 稱 “ 對立 之 裁判 ” ） 相互 對立 。         甲 指出 ， 在 對立 之 裁判 中 ， 該案 的 上訴 人針 對 原審 法院 形成 心證 的 證據 及 理由 說明 所 作出 的 爭議 的 依據 與 被 上訴 裁判 相同 ， 同樣 是 原審 法庭 僅列舉 相關 證據 後 ， 便 表示 綜合 該些證 言及 文件 ， 結論性 表述 法庭 已 形成 心證 及 證據 充分 。 甲 認為 被 上訴 裁判 和 原審 法院 裁判 同樣 違反 《 刑事 訴訟 法典 》 第三 五五 條 第二款 有關 理由 說明 的 規定 ， 理應 產生 與 對立 之 裁判 一致 的 裁判 效力 ， 即 宣告 被 上訴 裁判 同樣 基 於 缺乏 說明 理由 而 沾 有 無效 瑕疵 。         終審 法院 對 案件 作出 審理 。 合議庭 指出 ， 受理 統一 司法 見解 的 非常 上訴須 符合 以下 要件 ： 存在 合議庭 裁判 之間 的 相互 對立 、 針對 相同 的 法律 問題 及 法律 規定 沒有 發生 改變 。 其中 ， 裁判 的 相互 對立 要求 在 被 認為 相互 對立 的 兩個 裁判 中所 闡述 的 針鋒 相 對 的 觀點 具有 就 同一 基本 法律 問題 訂立 或 給出 不同 的 解決 辦法 ， 且 這兩個 相互 對立 的 裁判 必須 明示 。         合議庭 指出 ， 在 本案 中 ， 並不 存在 甲 所指 的 合議庭 裁判 的 相互 對立 。 從甲 所陳述 的 理由 和 所作 的 結論 中 可以 看到 ， 甲明 顯是 想要 通過 非常 規的 訴訟 手段 ， 對 被 上訴 裁判 中所作 的 裁決 重新 審查 ， 但 由 於 上述 裁決 已 轉為 確定 ， 故甲 顯然 無法 通過 常規 手段 來 達 到 此 目的 。         被 上訴 裁判 和 原審 法院 裁判 的 理由 說明 充分 且 恰當 ， 而甲則 只是 通過 本上 訴表達 自己 的 不服 ， 主要 針對 被 視為 已 確定 但 對 其 不利 的 部分 ， 順帶 提及 被 上訴 裁判 的 理由 說明 ， 只不過 是 想 重新 討論 已 被 認定 的 事實 事宜 和 法院 在 審查 證據 時 形成 心證 的 理由 ， 這種 規避 《 刑事 訴訟 法典 》 有關 上訴 規則 的 做法 絕對 不能 被 接受 。         綜上 所述 ， 合議庭 通過 評議 會 裁定 駁回 上訴 。         參閱 終審 法院 第七 七 ／ 二 〇 二三 號案 的 合議庭 裁判 。,2024-04-11
拱關截兩司機走私近百龍蝦,兩地牌車經大橋珠岸過境    拱關截兩司機走私近百龍蝦    【本報消息】近日，拱北海關所屬港珠澳大橋海關連續查獲兩起跨境客車司機攜帶鮮活龍蝦進境案。    四月四日，兩輛粵澳兩地牌跨境客車先後駛入港珠澳大橋珠海公路口岸進境通道，現場關員巡查時發現異常。經進一步檢查，關員在兩台車內查獲鮮活龍蝦九十六隻，共一百七十六點三千克。該批龍蝦未依法辦理檢疫審批手續。目前，海關已按規定截留該批龍蝦，並對案件作後續處置。    海關提醒，所有哺乳動物、魚類、鳥類、甲殼類、兩棲類、爬行類、昆蟲類和其他無脊椎動物等活動物（犬、貓除外）均屬於《中華人民共和國禁止攜帶、寄遞進境的動植物及其產品和其他檢疫物名錄》中的物品，如需攜帶入境，需取得國家有關行政主管部門審批許可並具有輸出國家或地區官方機構出具的檢疫證書。（文／陳綺汐）,http://www.macaodaily.com/html/2024-04/11/content_1747549.htm,海關提醒，所有哺乳動物、魚類、鳥類、甲殼類、兩棲類、爬行類、昆蟲類和其他無脊椎動物等活動物（犬、貓除外）均屬於《中華人民共和國禁止攜帶、寄遞進境的動植物及其產品和其他檢疫物名錄》中的物品，如需攜帶入境，需取得國家有關行政主管部門審批許可並具有輸出國家或地區官方機構出具的檢疫證書,兩地 牌車 經大橋 珠岸 過境         拱 關截 兩司機 走私 近百 龍蝦         【 本報 消息 】 近日 ， 拱 北海 關所屬 港珠 澳大橋 海關 連續 查獲 兩起 跨境 客車 司機 攜帶 鮮活 龍 蝦 進境案 。         四月 四日 ， 兩輛 粵澳 兩地牌 跨境 客車 先後駛 入港 珠 澳大橋 珠海 公路 口岸 進境 通道 ， 現場 關員 巡查 時 發現 異常 。 經進 一步 檢查 ， 關員 在 兩台車 內查 獲鮮 活龍 蝦 九十六 隻 ， 共 一百七十 六點 三 千克 。 該 批龍 蝦 未 依法 辦理 檢疫 審批 手續 。 目前 ， 海關 已 按 規定 截留 該 批龍 蝦 ， 並對 案件 作後續 處置 。         海關 提醒 ， 所有 哺乳 動物 、 魚類 、 鳥類 、 甲殼類 、 兩棲類 、 爬行 類 、 昆蟲類 和 其他 無 脊椎 動物 等 活動物 （ 犬 、 貓 除外 ） 均屬 於 《 中華 人民 共和 國 禁止 攜帶 、 寄遞 進境 的 動 植物 及其 產品 和 其他 檢疫物 名錄 》 中 的 物品 ， 如需 攜帶 入境 ， 需 取得 國家 有關 行政主管 部門 審批 許可並 具有 輸出 國家 或 地區 官方 機構 出具 的 檢疫 證書 。 （ 文 ／ 陳 綺汐 ）,2024-04-11
