Title,Content,Link,Summary,Preprocessed_Content,Date
德天瀑布美如畫    蕉  蕉,德天瀑布美如畫    炎炎夏日，探尋山水秘境不失為納涼好方式。位於廣西崇左市境內的德天瀑布，宛如一幅絕美的畫卷，橫亙在中國與越南邊境，吸引世界各地旅客慕名而至。    中越界河瀑流三疊    德天瀑布作為亞洲第一大跨國瀑布，起源於廣西靖西縣歸春河。歸春河是中越兩國的界河，流入越南又流回廣西，經過崇左市大新縣德天村，最後從六十餘米高的斷崖三級一瀉而下，形成磅礡景觀。    主體瀑布寬二百米，縱深六十米，落差七十米。從觀景台俯視德天瀑布，上下分為三層。第一層呈氣吞山河之勢從高處傾瀉而下，氣勢磅礡。第二層比較低緩，山勢形成數十米的台階，然後蓄勢而發造出最為壯觀的第三層。三級瀑布層層交替，垂直流下的水幕衝擊河面，水霧瀰漫，描繪出一幅掩映在青山懷抱中的天然畫卷。    瀑下乘舟氣象萬千    德天瀑布的左側，是越南境內水量較小的板約瀑布。兩個瀑布一大一小，掛在青翠的山崖間，似一對親密姐妹。儘管景區沿途告示禁止越界兜售，但因相鄰僅一河之隔，仍有不少越南商販撐着竹筏，向中國遊客兜售當地商品。    除了在觀景台駐足欣賞，亦可選擇乘坐竹筏近距離接觸瀑布。竹筏在湍急的水流中顛簸前行，快靠近水幕時，彷彿置身滂沱大雨之中，打濕遊人的衣衫和頭髮，帶來涼意，洗滌身心。瀑布水聲如同巨獸咆哮，令人領略大自然的震撼與力量。    德天瀑布最佳遊覽時間是每年六月至十一月的豐水期，此時瀑布水量最大，氣勢也最磅礡。夏季水量充足，山上植被茂盛，綠意蔥蘢，提供觀賞瀑布最佳的自然背景。    一日遊兩國夠吸引    在德天瀑布景區，除了欣賞瀑布的壯麗景色，亦能體驗豐富多彩的遊玩項目，包括飛天魔毯、滑梯、玻璃棧道等，每個都帶給旅客不同的刺激和驚喜。其中，飛天魔毯就像是一場空中之旅，乘坐滑梯上山觀賞沿途風光彷彿置身雲端。此外，亦可體驗中越德天（板約）瀑布跨境旅遊合作區推出的“中越跨境一日遊”，採取團進團出、“一日遊兩國”的新穎旅遊方式，吸引不少中越旅客。    德天瀑布出口處便是“中越友誼街”，匯聚各式越南美食，包括簸箕宴、越南春卷、越南酸奶、西貢咖啡、越式芒果糯米飯等，亦有琳琅滿目的中越兩國商品。    蕉  蕉,http://www.macaodaily.com/html/2024-07/26/content_1770547.htm,一日遊兩國夠吸引    在德天瀑布景區，除了欣賞瀑布的壯麗景色，亦能體驗豐富多彩的遊玩項目，包括飛天魔毯、滑梯、玻璃棧道等，每個都帶給旅客不同的刺激和驚喜,德天瀑布 美如畫         炎炎夏日 ， 探尋 山水 秘境 不失 為納涼 好 方式 。 位 於 廣西 崇左市 境內 的 德天瀑布 ， 宛如 一幅 絕 美的 畫卷 ， 橫亙 在 中國 與 越南 邊境 ， 吸引 世界各地 旅客 慕名 而 至 。         中 越 界河 瀑流 三疊         德天瀑布 作為 亞洲 第一 大 跨國 瀑布 ， 起源 於 廣西 靖西 縣歸春河 。 歸春河 是 中越 兩國 的 界河 ， 流入 越南 又 流回 廣西 ， 經過 崇左市 大新縣 德天村 ， 最後從 六十 餘米 高 的 斷 崖 三級 一瀉 而 下 ， 形成 磅 礡 景 觀 。         主體 瀑布 寬 二百米 ， 縱深 六十米 ， 落差 七十米 。 從 觀景台 俯視 德天瀑布 ， 上下 分為 三層 。 第一 層 呈 氣吞 山河 之勢 從 高處 傾瀉 而 下 ， 氣勢 磅 礡 。 第二 層 比 較 低緩 ， 山勢 形成 數 十米 的 台階 ， 然後蓄勢 而 發造 出 最為 壯觀 的 第三 層 。 三級 瀑布 層層 交替 ， 垂直 流下 的 水幕 衝擊 河面 ， 水霧 瀰 漫 ， 描繪出 一幅 掩映 在 青山 懷抱 中 的 天然 畫卷 。         瀑下 乘舟 氣象 萬千         德天瀑布 的 左側 ， 是 越南 境內 水量 較 小 的 板 約 瀑布 。 兩個 瀑布 一大 一小 ， 掛在 青翠 的 山崖 間 ， 似一對 親密 姐妹 。 儘 管 景 區 沿途 告示 禁止 越界 兜售 ， 但 因相 鄰僅 一河 之 隔 ， 仍 有 不少 越南 商販撐 着 竹筏 ， 向 中國 遊客 兜售 當地 商品 。         除了 在 觀景台 駐足 欣賞 ， 亦可 選擇 乘坐 竹筏 近距 離接觸 瀑布 。 竹筏 在 湍急 的 水流 中顛簸 前行 ， 快 靠近 水幕 時 ， 彷 彿 置身 滂沱大雨 之中 ， 打濕遊 人 的 衣衫 和頭 髮 ， 帶來 涼意 ， 洗滌 身心 。 瀑布 水聲 如同 巨獸 咆哮 ， 令人 領略 大自然 的 震撼 與 力量 。         德天瀑布 最佳 遊覽 時間 是 每年 六月 至 十一月 的 豐水期 ， 此時 瀑布 水量 最大 ， 氣勢 也 最 磅 礡 。 夏季 水量 充足 ， 山上 植被 茂盛 ， 綠意 蔥 蘢 ， 提供 觀賞 瀑布 最佳 的 自然 背景 。         一日 遊兩國夠 吸引         在 德天瀑布 景區 ， 除了 欣賞 瀑布 的 壯麗 景色 ， 亦 能 體驗 豐富 多彩的 遊玩 項目 ， 包括 飛 天魔 毯 、 滑梯 、 玻璃 棧道 等 ， 每個 都 帶給 旅客 不同 的 刺激 和 驚喜 。 其中 ， 飛 天魔 毯 就 像是 一場 空中 之旅 ， 乘坐 滑梯 上山 觀賞 沿途 風光 彷 彿 置身 雲端 。 此外 ， 亦可 體驗 中 越德天 （ 板約 ） 瀑布 跨境 旅遊 合作 區 推出 的 “ 中 越 跨境 一日 遊 ” ， 採取團 進團 出 、 “ 一日 遊兩國 ” 的 新穎 旅遊 方式 ， 吸引 不少 中 越 旅客 。         德天瀑布 出口 處 便是 “ 中越 友誼 街 ” ， 匯聚 各式 越南 美食 ， 包括 簸箕 宴 、 越南 春卷 、 越南 酸奶 、 西貢 咖啡 、 越式 芒果 糯米 飯 等 ， 亦 有 琳琅 滿 目的 中越 兩國 商品 。         蕉     蕉,2024-07-26
自薦入獄研歷史    西門公子,自薦入獄研歷史    朱翁，朱維德，今無人識矣！然當年以電視送飯者幾無人不識。無記新聞節目朱翁乃生招牌，自無記創台始，晚晚六點半，例見朱翁與李大為一雙活寶。阿叔阿蟬曰：當年得知世界大事，全靠佢哋。    朱翁原生廣州，上世紀五十年代居港，曾執教鞭，好研歷史，餘暇喜行山。某日途經赤柱，見一奇特建築，探知此乃監獄。為求一探，膽粗粗自薦入獄演講。講得幾輪，成個監獄行勻晒，更要求畀佢坐十五分鐘監。    適時巧遇獄官鮑漢琳，鮑官兼演職於電視台，朱翁得被薦入行。無記開台，朱翁係十個開荒牛之一。新聞以外，朱翁以行山之趣，歷史之淵，多闢休閑節目，後索性搞埋旅行社，一度當旺。    電視台打滾半世紀，年老色衰，漸遭冷遇。然朱公鬥心甚強：你冷淡我，我自發圍。佢比胡楓大一歲，胡公於今尚登台表演，惜朱翁因認知障礙，居老人院矣。今日乃朱翁牛一，算來該九十有三了。    西門公子,http://www.macaodaily.com/html/2024-07/26/content_1770550.htm,新聞以外，朱翁以行山之趣，歷史之淵，多闢休閑節目，後索性搞埋旅行社，一度當旺,自薦 入獄 研歷史         朱翁 ， 朱維德 ， 今無人識 矣 ！ 然當 年 以 電視 送 飯者 幾無人 不識 。 無記 新聞 節目 朱翁 乃生 招牌 ， 自無記 創台始 ， 晚晚 六點 半 ， 例見 朱翁 與 李大為 一雙活 寶 。 阿叔 阿蟬 曰 ： 當年 得知 世界 大事 ， 全 靠 佢 哋 。         朱翁 原生 廣州 ， 上世紀 五十年代 居港 ， 曾執 教鞭 ， 好研 歷史 ， 餘暇 喜行山 。 某日 途經 赤柱 ， 見 一 奇特 建築 ， 探知 此 乃 監獄 。 為求 一探 ， 膽 粗粗 自薦 入獄 演講 。 講得 幾輪 ， 成個 監獄 行勻 晒 ， 更 要求 畀 佢 坐 十五分 鐘監 。         適時 巧遇 獄官 鮑漢琳 ， 鮑官 兼 演職 於 電視台 ， 朱翁 得 被薦 入行 。 無記 開台 ， 朱翁 係 十個 開荒 牛 之一 。 新聞 以外 ， 朱翁 以行 山之趣 ， 歷史 之淵 ， 多闢 休 閑 節目 ， 後 索性 搞 埋 旅行社 ， 一度 當旺 。         電視台 打 滾 半世 紀 ， 年老色衰 ， 漸遭 冷遇 。 然朱 公鬥心 甚強 ： 你 冷淡 我 ， 我 自發圍 。 佢 比 胡 楓 大 一 歲 ， 胡公 於 今尚 登台 表演 ， 惜 朱翁 因 認知 障礙 ， 居 老人院 矣 。 今日 乃 朱翁 牛 一 ， 算來 該 九十 有 三 了 。         西門 公子,2024-07-26
曹敏寶爆喊三分鐘,緋聞後首現身公開活動    曹敏寶爆喊三分鐘    曹敏寶自年初傳出與同是“中1生”的梁浩銓鬧緋聞而遭公司雪藏後，昨日首度現身公開活動。當她提到得到老公強大支持時，隨即禁不住爆喊，並需時三分鐘來冷靜情緒。有指她是遭人爆料，以及“中1生”集體杯葛，她未有直接承認或否認。    說到外界認為她與龍婷均鬧緋聞，但公司待遇不一疑欠公平；她謂：“我不方便多講，公司有不同的處理做法，大家不用擔心，因為我跟公司有溝通與交流。（與公司關係良好？）我喜歡和平，自覺關係良好。（跟‘中1生’關係也良好？）我可以做的事已經做了，《中年好聲音》講求團結和一家人精神，我不想破滅。這半年間出現很多新聞，我希望將時間放在珍惜自己的人身上。（有傳事件是有‘中1生’爆料。）這半年我在沉澱自己及陪伴家人，其他許多事情都不清楚，但我不願相信這些新聞，在我心中‘中一生’就是一家人。”    原本一直對答如流的曹敏寶，被問及現在與老公的關係時，她只說了跟老公吃過午飯，外間很擔心老公，而老公則擔心她……，隨即忍不住爆喊起來，並躲在一角拭淚。約三分鐘後調整了情緒，曹敏寶續謂：“面對負面新聞，老公比我更強大，會堅強地支持我，我剛剛喊就是因為遇到他是我一生最幸福的事，他是很成熟的男士，面對問題時，情緒比我更穩定。（今後會小心避開緋聞？）每件事我都會跟老公商量，亦會檢討自己的行為，因為每個人把尺不同，可能我的行為未必為大眾所接受，我會嘗試思考到別人那把尺。”    此外，同場的伍允龍被問及近日出現“私追”粉，引起另一班粉絲心痛爆發內訌，他自言也有很多偶像，小時候也跟父親試過為取得成龍合照及簽名，排隊五個小時，所以很明白粉絲的心態，而他亦想支持自己的粉絲，今後會盡力和守候自己的粉絲合照。,http://www.macaodaily.com/html/2024-07/26/content_1770546.htm,約三分鐘後調整了情緒，曹敏寶續謂：“面對負面新聞，老公比我更強大，會堅強地支持我，我剛剛喊就是因為遇到他是我一生最幸福的事，他是很成熟的男士，面對問題時，情緒比我更穩定,緋聞後首 現身 公開 活動         曹敏 寶爆 喊 三分 鐘         曹敏 寶自 年初 傳出 與 同 是 “ 中 1 生 ” 的 梁浩銓 鬧 緋聞 而 遭 公司 雪藏 後 ， 昨日 首度 現身 公開 活動 。 當 她 提到 得到 老公 強大 支持 時 ， 隨即 禁不住 爆喊 ， 並需 時 三分 鐘來 冷靜 情緒 。 有 指 她 是 遭人 爆料 ， 以及 “ 中 1 生 ” 集體 杯葛 ， 她 未有 直接 承認 或 否認 。         說 到 外界 認為 她 與 龍婷 均 鬧 緋聞 ， 但 公司 待遇 不一疑 欠 公平 ； 她謂 ： “ 我 不 方便 多講 ， 公司 有 不同 的 處理 做法 ， 大家 不用 擔心 ， 因為 我 跟 公司 有 溝通 與 交流 。 （ 與 公司 關 係 良好 ？ ） 我 喜歡 和平 ， 自覺關 係 良好 。 （ 跟 ‘ 中 1 生 ’ 關 係 也 良好 ？ ） 我 可以 做 的 事 已經 做 了 ， 《 中年 好聲音 》 講求 團結 和 一家人 精神 ， 我 不想 破滅 。 這 半年 間 出現 很多 新聞 ， 我 希望 將時間 放在 珍惜 自己 的 人 身上 。 （ 有傳 事件 是 有 ‘ 中 1 生 ’ 爆料 。 ） 這 半年 我 在 沉 澱 自己 及 陪伴 家人 ， 其他 許多 事情 都 不 清楚 ， 但 我 不願 相信 這些 新聞 ， 在我心中 ‘ 中 一生 ’ 就是 一家人 。 ”         原本 一直 對答 如流 的 曹敏 寶 ， 被 問及現 在 與 老公 的關 係 時 ， 她 只 說 了 跟 老公 吃 過午 飯 ， 外間 很 擔心 老公 ， 而 老公 則擔 心 她 … … ， 隨即 忍不住 爆喊 起來 ， 並躲 在 一角 拭淚 。 約 三分 鐘後調整 了 情緒 ， 曹敏 寶續謂 ： “ 面對 負面 新聞 ， 老公 比 我 更 強大 ， 會 堅強 地 支持 我 ， 我 剛剛 喊 就是 因為 遇到 他 是 我 一生 最 幸福 的 事 ， 他 是 很 成熟 的 男士 ， 面對 問題 時 ， 情緒 比 我 更 穩定 。 （ 今後會 小心 避開 緋聞 ？ ） 每件事 我 都 會 跟 老公 商量 ， 亦 會 檢討 自己 的 行為 ， 因為 每個 人 把 尺 不同 ， 可能 我 的 行為 未必 為大眾 所 接受 ， 我會 嘗試 思考 到 別人 那 把 尺 。 ”         此外 ， 同場 的 伍允龍 被 問及 近日 出現 “ 私追 ” 粉 ， 引起 另 一班 粉絲 心痛 爆發 內訌 ， 他 自言 也 有 很多 偶像 ， 小時候 也 跟 父親 試過 為 取得 成龍 合照 及 簽名 ， 排隊 五個 小時 ， 所以 很 明白 粉絲 的 心態 ， 而 他 亦 想 支持 自己 的 粉絲 ， 今後會 盡力 和 守候 自己 的 粉絲 合照 。,2024-07-26
鍾嘉欣靚聲預演俘虜觀眾,鍾嘉欣靚聲預演俘虜觀眾    鍾嘉欣日前出席保健品牌活動大開金口，甜美悅耳的歌聲俘虜場內觀眾，正好為下月廣州個唱注下“強心針”！她還期望年底推出一首勵志新歌送給粉絲，作為自己入行二十年的一個記念。    活動上，嘉欣即場獻唱金曲，仿如預演演唱會般，令現場氣氛沸騰，“Encore”之聲不絕於耳。嘉欣謙稱其實每次上台唱歌總略帶緊張，很感恩大會給她預演機會，令她早日感受舞台的張力。談到演唱會籌備進度，嘉欣笑言幸得老公和子女支持，已準備得“八八九九”：“我成日同仔女喺屋企練歌，囡囡最鍾意我首《Love Love Love》及《最幸福的事》。”嘉欣續說香港是其歌唱事業發源地，最大夢想還是在香港開個唱。    提到健康保養，鍾嘉欣分享了她的凍齡秘訣，是每天吃早餐前先飲一杯暖水、檸檬水等清腸胃，加上勤敷面膜，才養成白滑肌膚。近年又愛上焗桑拿，還有意在家中添置桑拿室。嘉欣亦很注重小朋友健康，反而老公態度則較隨性，她表示：“仔女都好好動，囝囝愛玩冰球，我同老公夢想佢將來做冰球運動員；囡囡就喜歡網球，同老公一樣，佢已贏獎無數，反而我最冇運動底子。”,http://www.macaodaily.com/html/2024-07/26/content_1770548.htm,鍾嘉欣靚聲預演俘虜觀眾    鍾嘉欣日前出席保健品牌活動大開金口，甜美悅耳的歌聲俘虜場內觀眾，正好為下月廣州個唱注下“強心針”,鍾 嘉欣靚聲 預演 俘 虜 觀眾         鍾 嘉欣 日前 出席 保健 品牌 活動 大開 金口 ， 甜美 悅耳 的 歌聲 俘虜場 內 觀眾 ， 正好 為 下 月 廣州個 唱 注下 “ 強心針 ” ！ 她還 期望 年底 推出 一首 勵志 新歌 送給 粉絲 ， 作為 自己 入 行 二十年 的 一個 記念 。         活動 上 ， 嘉欣 即場 獻 唱 金曲 ， 仿如 預演 演唱 會般 ， 令 現場 氣氛 沸騰 ， “ Encore ” 之聲 不絕 於 耳 。 嘉欣謙稱 其實 每次 上台 唱歌 總略 帶 緊張 ， 很 感恩 大會給 她 預演 機會 ， 令 她 早日 感受 舞台 的 張力 。 談到 演唱 會籌備 進度 ， 嘉欣笑 言 幸得 老公 和 子女 支持 ， 已 準備 得 “ 八八九九 ” ： “ 我成 日 同仔 女 喺 屋企 練歌 ， 囡囡 最鍾意 我首 《 Love   Love   Love 》 及 《 最 幸福 的 事 》 。 ” 嘉欣續 說 香港 是 其 歌唱 事業發 源地 ， 最大 夢想 還是 在 香港 開個 唱 。         提到 健康 保養 ， 鍾 嘉欣 分享 了 她 的 凍齡 秘訣 ， 是 每天 吃 早餐 前先 飲 一杯 暖水 、 檸檬水 等 清腸 胃 ， 加上 勤敷 面膜 ， 才 養成 白滑 肌膚 。 近年 又 愛上 焗 桑拿 ， 還 有意 在 家中 添置 桑拿室 。 嘉欣 亦 很 注重 小朋友 健康 ， 反而 老公 態度則 較 隨性 ， 她 表示 ： “ 仔女 都 好好 動 ， 囝 囝 愛玩 冰球 ， 我同 老公 夢 想 佢 將 來 做 冰球 運動員 ； 囡囡 就 喜歡 網球 ， 同 老公 一樣 ， 佢 已 贏 獎 無 數 ， 反而 我 最 冇 運動 底子 。 ”,2024-07-26
歐陽震華梁思浩緣起歐陽太,歐陽震華梁思浩緣起歐陽太    《直播靈接觸》最後一集邀請歐陽震華做壓軸嘉賓，主持人梁思浩透露二人的認識緣起於歐陽震華太太，並指認識歐陽太太時只有十八歲，自此成為閨蜜。    記者笑問二人相識多年，會否在節目中互爆黑歷史，歐陽震華鬼馬地扮恐嚇梁思浩說：“你夠膽講咩，得返兩個小時你搵得切嘉賓做節目咩？大家都唔好將別人的缺點放大，應該盡量看別人的優點。”梁思浩表示認同，更自言心目中的歐陽震華沒有黑歷史。歐陽震華又笑指與梁思浩不時有相約飯聚，但二人很少交談，都是各自與其他朋友聊天。不過他很佩服梁思浩，甚麼都不怕，會幫先人清潔遺體。梁思浩就笑言唯獨與歐陽震華一樣，很怕對方的太太，說罷二人笑作一團。    歐陽震華早前轉投英皇娛樂，問到新工作方向，他稱始終拍了四十年電視劇，想轉換新環境，更打趣道：“無出去睇過，就唔會知道TVB有幾好。現在電視或電影我都會做，但就唔會透露工作安排，這是商業機密”。本月二十八日是歐陽震華的六十四歲生日，將會與相隔一個星期生日的太太一同慶祝。,http://www.macaodaily.com/html/2024-07/26/content_1770549.htm,歐陽震華梁思浩緣起歐陽太    《直播靈接觸》最後一集邀請歐陽震華做壓軸嘉賓，主持人梁思浩透露二人的認識緣起於歐陽震華太太，並指認識歐陽太太時只有十八歲，自此成為閨蜜,歐陽 震華梁 思浩緣 起 歐陽 太         《 直播 靈接觸 》 最 後 一集 邀請 歐陽震華 做 壓軸嘉賓 ， 主持人 梁思浩 透露 二人 的 認識緣 起 於 歐陽震華 太太 ， 並指 認識 歐陽 太太 時 只有 十八 歲 ， 自此 成為 閨蜜 。         記者 笑問 二人 相識 多年 ， 會否 在 節目 中互 爆黑 歷史 ， 歐陽 震華鬼馬 地扮 恐嚇 梁思浩說 ： “ 你夠 膽講 咩 ， 得返 兩個 小時 你 搵 得 切嘉賓 做 節目 咩 ？ 大家 都 唔 好 將別 人 的 缺點 放大 ， 應該 盡量 看別 人 的 優點 。 ” 梁思浩 表示 認同 ， 更 自言 心目 中 的 歐陽震華 沒 有 黑 歷史 。 歐陽震華 又 笑 指 與 梁思浩不時 有 相約 飯 聚 ， 但 二人 很少 交談 ， 都 是 各自 與 其他 朋友 聊天 。 不過 他 很 佩服 梁思浩 ， 甚麼 都 不怕 ， 會幫 先人 清潔 遺體 。 梁思浩 就 笑 言 唯獨 與 歐陽震華 一樣 ， 很怕 對方 的 太太 ， 說罷 二人 笑作 一團 。         歐陽震華 早前 轉投 英皇 娛樂 ， 問到 新 工作 方向 ， 他 稱始終 拍 了 四十年 電視劇 ， 想 轉換 新 環境 ， 更 打趣 道 ： “ 無 出去 睇 過 ， 就 唔 會 知道 TVB 有 幾好 。 現在 電視 或 電影 我 都 會 做 ， 但 就 唔 會 透露 工作 安排 ， 這是 商業 機密 ” 。 本月 二十八日 是 歐陽震華 的 六十四 歲 生日 ， 將會 與 相隔 一個 星期 生日 的 太太 一同 慶祝 。,2024-07-26
馬國明唔慣食軟飯,馬國明唔慣食軟飯    馬國明日前出席首屆“香港好物節”啟動禮，他表示以前很少網購，近年受太太影響才愛上網購，但最愛買工藝品。他說：“又幾方便，網上睇完再去實體店買，慳好多時間，咁我又唔係富三代唔使做，我鍾意買工藝品，我個人好老土，鍾意福祿壽擺設，不過係卡通版嘅，（鍾唔鍾意多仔佛？）我冇買，但阿媽屋企有，如果有朋友送我都唔抗拒。”    他又謂太太平時買衫同飾物比較多，但唔算好瘋狂：“佢篩選過先會幫我買，大家都知我對時裝，真係識條鐵咩！”現場有人讚馬明一身打扮好靚仔，他表示現時都有同香港時裝設計師合作，對方會給他服裝出席活動。    馬國明又大讚老婆賺錢有道，一手包辦網上廣告：“佢近排喺屋企拍社交媒體廣告，自己拍片、剪片、落字幕，燈都自己打埋，一手包辦，我真係好佩服佢，我都好想學。如果社交媒體想搵我哋拍廣告都冇問題，我地可以自己搞掂晒，拍咩都可以，就嚟太太可以養埋我。（咁你有冇畀家用？）梗係有，點可以唔畀，男人係一頭家嘅開支，我係好傳統嘅男人，唔慣食軟飯。佢成日都話我嘅錢係屋企嘅錢，佢嘅錢係佢嘅錢。”,http://www.macaodaily.com/html/2024-07/26/content_1770552.htm,馬國明又大讚老婆賺錢有道，一手包辦網上廣告：“佢近排喺屋企拍社交媒體廣告，自己拍片、剪片、落字幕，燈都自己打埋，一手包辦，我真係好佩服佢，我都好想學,馬 國明 唔 慣食 軟飯         馬國 明日 前 出席 首屆 “ 香港 好物節 ” 啟動禮 ， 他 表示 以前 很少 網購 ， 近年 受 太太 影響 才 愛上 網購 ， 但 最愛買 工藝品 。 他 說 ： “ 又 幾 方便 ， 網上 睇 完 再 去 實體 店 買 ， 慳 好多 時間 ， 咁 我 又 唔 係 富 三代 唔 使 做 ， 我 鍾 意買 工藝品 ， 我個 人 好 老土 ， 鍾 意福祿壽 擺設 ， 不過 係 卡通版 嘅 ， （ 鍾 唔 鍾 意多 仔佛 ？ ） 我 冇 買 ， 但 阿媽 屋企 有 ， 如果 有 朋友 送 我 都 唔 抗拒 。 ”         他 又 謂 太太 平時 買衫 同飾物 比 較 多 ， 但 唔 算 好 瘋狂 ： “ 佢 篩 選 過 先 會 幫 我 買 ， 大家 都 知 我 對 時裝 ， 真 係 識 條鐵 咩 ！ ” 現場 有人 讚 馬 明 一身 打扮 好靚 仔 ， 他 表示 現時 都 有 同 香港 時裝 設計師 合作 ， 對方會給 他 服裝 出席 活動 。         馬 國明 又 大 讚 老婆 賺 錢 有 道 ， 一手 包辦 網上 廣告 ： “ 佢 近 排 喺 屋企 拍 社交 媒體 廣告 ， 自己 拍片 、 剪片 、 落 字幕 ， 燈 都 自己 打 埋 ， 一手 包辦 ， 我 真 係 好 佩服 佢 ， 我 都 好 想學 。 如果 社交 媒體 想 搵 我 哋 拍 廣告 都 冇 問題 ， 我 地 可以 自己 搞掂 晒 ， 拍 咩 都 可以 ， 就 嚟 太太 可以 養埋 我 。 （ 咁 你 有 冇 畀 家用 ？ ） 梗 係 有 ， 點 可以 唔 畀 ， 男人 係 一頭 家 嘅 開 支 ， 我 係 好 傳 統 嘅 男人 ， 唔 慣食 軟飯 。 佢 成 日 都 話 我 嘅 錢 係 屋企 嘅 錢 ， 佢 嘅 錢 係 佢 嘅 錢 。 ”,2024-07-26
