Title,Content,Link,Summary,Preprocessed_Content
機場海關檢千三萬元K仔,德情侶行李清空仍太重    檢查揭發藏毒    機場海關檢千三萬元K仔    【本報消息】據港媒報道：香港海關昨公佈，本月六日上午時分，海關機場科人員為兩名由德國法蘭克福抵港的外籍男女進行清關，發現寄艙行李被清空後，行李仍然異常沉重，於是進一步用X光機檢查其內部結構，並察覺影像有可疑。關員以更深入方式檢驗，最後在行李夾層尋獲四塊共重約廿一公斤、估計市值約一千三百萬港元的懷疑氯胺酮（K仔），遂以涉嫌販運危險藥物罪名拘捕兩人。案件交由海關毒品調查科跟進。    被捕男女均報稱倉務員，並準備在抵港後將行李運送到酒店，然後等待進一步指示。案件仍在調查中，海關會繼續循毒品來源及流向展開追查，不排除稍後有更多人被捕。    調查人員表示，案件屬過去近二十年來最大宗利用行李夾層偷運K仔入境案件。販毒集團利用行李內部結構，將毒品收藏在夾層內，企圖以情侶同行作掩飾，逃避海關截查。面對毒販層出不窮的收藏手法，海關配備精準先進的設備儀器，例如電子掃瞄系統、拉曼光譜儀等，協助關員有效快速檢查，而今次行動相信已從源頭堵截該批毒品流入香港。    農曆新年將至，海關將會繼續加強執法，並會適時調整執法策略，根據風險管理原則，重點揀選來自高風險地區的航空旅客作清關檢查，打擊毒品流入香港。,http://www.macaodaily.com/html/2024-02/08/content_1734011.htm,德情侶行李清空仍太重    檢查揭發藏毒    機場海關檢千三萬元K仔    【本報消息】據港媒報道：香港海關昨公佈，本月六日上午時分，海關機場科人員為兩名由德國法蘭克福抵港的外籍男女進行清關，發現寄艙行李被清空後，行李仍然異常沉重，於是進一步用X光機檢查其內部結構，並察覺影像有可疑,德情侶 行李 清空 仍 太重         檢查 揭 發藏毒         機場 海關檢 千三 萬元 K 仔         【 本報 消息 】 據港 媒報 道 ： 香港 海關 昨公 佈 ， 本月 六日 上午 時分 ， 海關 機場 科人員為 兩名 由德國 法蘭克福 抵港 的 外籍 男女 進行 清關 ， 發現 寄艙 行李 被 清空 後 ， 行李 仍然 異常 沉重 ， 於 是 進 一步 用 X光 機檢查 其 內部 結構 ， 並察覺 影像 有 可疑 。 關員以 更 深入 方式 檢驗 ， 最後在 行李 夾層 尋獲 四塊 共 重約 廿一 公斤 、 估計 市值 約 一千三百 萬 港元 的 懷疑 氯胺酮 （ K 仔 ） ， 遂 以 涉嫌 販運 危險 藥物 罪名 拘捕 兩人 。 案件 交由 海關 毒品 調查科 跟 進 。         被捕 男女 均 報稱 倉務員 ， 並準備 在 抵港後將 行李 運 送到 酒店 ， 然 後 等待 進 一步 指示 。 案件 仍 在 調查 中 ， 海關會 繼續 循 毒品 來源 及 流向 展開 追查 ， 不 排除 稍後有 更 多 人 被捕 。         調查 人員 表示 ， 案件 屬過 去 近 二十年 來 最大 宗 利用 行李 夾層 偷運 K 仔 入境 案件 。 販毒 集團 利用 行李 內部 結構 ， 將 毒品 收藏 在 夾層 內 ， 企圖 以 情侶 同行 作掩飾 ， 逃避 海關 截查 。 面對毒 販層 出不窮 的 收藏 手法 ， 海關 配備 精準 先進 的 設備 儀器 ， 例如 電子 掃 瞄系統 、 拉曼 光譜儀 等 ， 協助 關員 有效 快速 檢查 ， 而今 次行動 相信 已 從源頭 堵截 該批 毒品 流入 香港 。         農 曆 新年 將至 ， 海關 將會 繼續 加強 執法 ， 並會 適時 調整 執法 策略 ， 根據 風險 管理 原則 ， 重點 揀 選來 自高 風險 地區 的 航空 旅客 作清關 檢查 ， 打擊 毒品 流入 香港 。
駐港部隊向港人送新春祝福,駐港部隊向港人送新春祝福    【中新社香港七日電】春節即將來臨之際，中國人民解放軍駐香港部隊司令員彭京堂少將、政治委員賴如鑫海軍少將七日發表新春賀詞，代表駐港部隊全體官兵提前向香港市民拜年。    賀詞指出，回望這一年，特區政府堅定維護國家安全，推動香港邁向由治及興，煥發“國安家好”新景象；全面對接國家戰略，接連舉辦大型國際盛事和會議，不斷開拓繁榮發展新空間；悉心排解民生憂難，市井街頭丁財兩旺，呈現歡樂祥和新常態，廣大市民安全感、獲得感、幸福感不斷躍升。由衷感到驕傲，對香港的光明前景充滿信心。    賀詞表示，一年來，駐港部隊堅決貫徹中共中央、中央軍委和習主席決策部署，堅定落實“一國兩制”偉大方針，嚴格遵守香港特別行政區基本法、駐軍法，聚焦主責主業、聚力練兵備戰，精心組織軍營開放、軍事夏令營和軍事生活體驗營，迎接馬來西亞、越南軍艦首次訪問香港，圓滿完成以履行防務為中心的各項任務。駐港部隊衷心感謝特區政府、社會各界和廣大市民長期以來的關心、信任和支持。    賀詞指出，今年是新中國成立七十五周年。偉大祖國正以中國式現代化全面推進強國建設、民族復興偉業。欣逢盛世，當不負盛世。堅信香港定能發揮“背靠祖國、聯通世界”的獨特優勢，抓住國家發展的歷史機遇，續寫新篇章、再創新輝煌。駐港部隊駐守東方之珠，將一如既往當好值得信賴的香江衛士，護萬家燈火溫暖長明，與廣大香港同胞共同迎接更加美好的明天。,http://www.macaodaily.com/html/2024-02/08/content_1734012.htm,賀詞表示，一年來，駐港部隊堅決貫徹中共中央、中央軍委和習主席決策部署，堅定落實“一國兩制”偉大方針，嚴格遵守香港特別行政區基本法、駐軍法，聚焦主責主業、聚力練兵備戰，精心組織軍營開放、軍事夏令營和軍事生活體驗營，迎接馬來西亞、越南軍艦首次訪問香港，圓滿完成以履行防務為中心的各項任務,駐港 部隊 向 港人 送 新春 祝福         【 中新社 香港 七日 電 】 春節 即 將來 臨之際 ， 中國 人民 解放 軍駐 香港 部隊 司令 員 彭京堂 少將 、 政治 委員賴 如鑫海 軍少將 七日 發表 新春 賀詞 ， 代表 駐港 部隊 全體 官兵 提前 向 香港市民 拜年 。         賀詞 指出 ， 回望 這 一年 ， 特區 政府 堅定 維護國家 安全 ， 推動 香港 邁向 由治及 興 ， 煥發 “ 國 安家 好 ” 新 景象 ； 全面 對 接國家 戰略 ， 接連舉 辦 大型 國際 盛事 和 會議 ， 不斷 開拓 繁榮 發展 新空間 ； 悉心 排解 民生 憂難 ， 市井 街頭 丁財 兩旺 ， 呈現 歡樂 祥和 新常態 ， 廣大 市民 安全感 、 獲得感 、 幸福感 不斷 躍升 。 由衷 感到 驕傲 ， 對 香港 的 光明 前景 充滿 信心 。         賀詞 表示 ， 一年 來 ， 駐港 部隊 堅決 貫徹 中共中央 、 中央 軍委和習 主席 決策 部署 ， 堅定 落實 “ 一國 兩制 ” 偉 大方 針 ， 嚴格 遵守 香港 特別 行政 區 基本法 、 駐軍法 ， 聚焦 主責主業 、 聚力 練兵 備戰 ， 精心 組織 軍營 開放 、 軍事 夏令 營和軍事 生活 體驗營 ， 迎接 馬 來 西亞 、 越南 軍艦 首次 訪問 香港 ， 圓滿 完成 以 履行 防務為 中心 的 各項 任務 。 駐港 部隊 衷心 感謝 特區 政府 、 社會 各界 和 廣大 市民 長 期以 來 的 關心 、 信任 和 支持 。         賀詞 指出 ， 今年 是 新 中國 成立 七十五 周年 。 偉大祖國 正以 中國式 現代化 全面 推進 強國 建設 、 民族 復 興偉業 。 欣逢 盛世 ， 當不負 盛世 。 堅信 香港 定能 發揮 “ 背靠 祖國 、 聯通 世界 ” 的 獨特 優勢 ， 抓住 國家 發展 的 歷史 機遇 ， 續寫 新篇章 、 再 創新輝煌 。 駐港 部隊 駐守 東方 之珠 ， 將 一如既往 當好 值得 信賴 的 香江 衛士 ， 護萬家 燈火 溫暖長 明 ， 與 廣大 香港 同胞 共同 迎接 更加 美好 的 明天 。
Twins忘形強吻容祖兒,十四場演出圓滿結束    Twins忘形強吻容祖兒    一共十四場的《Twins Spirit 2024 紅館演唱會》，前晚在一片歡呼聲中圓滿結束，蔡卓妍（阿Sa）和鍾欣潼（阿嬌）攜手打破了Twins演出場次的紀錄。當晚容祖兒擔任表演嘉賓，“龍虎豹”三人合體演出，現場氣氛熱烈，Twins二姝更左右夾擊強吻祖兒，答謝她的支持。當晚阿Sa的初戀男友及前度石恆聰均有來捧場，問阿嬌“蜜友”皇甫聖華有否到場？她即說：“只係朋友呀，總之好多朋友都有來捧場。”    在前晚《Twins Spirit 2024 紅館演唱會》最後一場舉行時，阿Sa和阿嬌落力演出，化身陳慧嫻的小粉絲即興跳唱了一段《跳舞街》，為觀眾帶來驚喜。當晚容祖兒除了陪母親來看騷之餘，還擔任表演嘉賓，於“安歌”時上台與Twins“龍虎豹”三人大合體唱出一曲《隆重登場》。唱畢之後，阿Sa與阿嬌更左右夾擊強吻祖兒，祖兒大呼Twins好猖狂，引得全場起哄。三人之後又公開“屈”老闆楊受成請她們去旅行作為今次演唱會慶功，楊生亦大方表示無所謂，皆大歡喜。    演唱會到了尾場，Twins難免有不少感觸，她們表示：“好多謝大家幫我們完成十四場演出會，打破了Twins的紀錄。”之後阿Sa及阿嬌亦互相感謝對方廿二年來的砥礪同行，並拖手合唱出一首《相愛22年》。最後，她們在三度“安歌”下完成了今次的演唱會。    演唱會完騷後，Twins即舉行慶功祝酒儀式並接受傳媒訪問。阿Sa和阿嬌都好開心：“我們表示要開十四場紅館演唱會後，便出現一些質疑的聲音，懷疑我們能否應付得到，加上之前聲帶受傷，大家都好擔心。但結果證明，我們做到了，而且成功完成今次演出。”阿嬌則主動談及因身體不適要取消打側手翻環節之事：“因演唱會中段時我病了，身體狀況好差，咬東西都冇力，連廁所都去唔到；打側手翻跣腳嗰日仲要食緊感冒藥……所以，真係要開始放假休養身體了。”,http://www.macaodaily.com/html/2024-02/08/content_1734013.htm,”    在前晚《Twins Spirit 2024 紅館演唱會》最後一場舉行時，阿Sa和阿嬌落力演出，化身陳慧嫻的小粉絲即興跳唱了一段《跳舞街》，為觀眾帶來驚喜,十四 場 演出 圓滿 結束         Twins 忘形 強吻 容祖兒         一共 十四 場的 《 Twins   Spirit   2024   紅館 演唱 會 》 ， 前晚 在 一片 歡呼聲 中圓滿 結束 ， 蔡卓妍 （ 阿 Sa ） 和 鍾 欣潼 （ 阿嬌 ） 攜手 打破 了 Twins 演出 場次 的 紀錄 。 當晚 容祖兒 擔任 表演 嘉賓 ， “ 龍 虎豹 ” 三人合體 演出 ， 現場 氣氛 熱烈 ， Twins 二 姝 更 左右 夾擊強 吻 祖兒 ， 答謝 她 的 支持 。 當晚 阿 Sa 的 初戀 男友 及 前度 石恆聰均 有 來捧場 ， 問阿嬌 “ 蜜友 ” 皇甫 聖華 有否 到場 ？ 她 即 說 ： “ 只 係 朋友 呀 ， 總 之 好多 朋友 都 有 來捧場 。 ”         在 前 晚 《 Twins   Spirit   2024   紅館 演唱 會 》 最後一場 舉行 時 ， 阿 Sa 和 阿嬌 落力 演出 ， 化身 陳 慧嫻 的 小粉 絲即 興 跳 唱 了 一段 《 跳舞 街 》 ， 為 觀眾 帶來 驚喜 。 當晚 容祖兒 除了 陪母 親來 看 騷之餘 ， 還擔 任 表演 嘉賓 ， 於 “ 安歌 ” 時 上台 與 Twins “ 龍 虎豹 ” 三 人大 合體 唱 出 一曲 《 隆重 登場 》 。 唱 畢 之 後 ， 阿 Sa 與 阿嬌 更 左右 夾擊強 吻 祖兒 ， 祖兒 大呼 Twins 好 猖狂 ， 引得 全場 起哄 。 三人 之 後 又 公開 “ 屈 ” 老 闆 楊 受成 請 她 們 去 旅行 作為 今次 演唱 會慶功 ， 楊生 亦 大方 表示 無所謂 ， 皆 大歡 喜 。         演唱 會到 了 尾場 ， Twins 難免 有 不少 感觸 ， 她 們 表示 ： “ 好多 謝 大家 幫 我們 完成 十四 場 演出 會 ， 打破 了 Twins 的 紀錄 。 ” 之後阿 Sa 及 阿嬌 亦 互相 感謝 對方 廿二年 來 的 砥 礪 同行 ， 並拖手 合唱 出 一首 《 相愛 22 年 》 。 最 後 ， 她 們 在 三度 “ 安歌 ” 下 完成 了 今次 的 演唱 會 。         演唱 會 完騷 後 ， Twins 即舉 行慶功 祝酒 儀式並 接受 傳媒 訪問 。 阿 Sa 和 阿嬌 都 好 開心 ： “ 我們 表示 要開 十四 場紅館 演唱 會 後 ， 便 出現 一些 質疑 的 聲音 ， 懷疑 我們 能否 應付 得到 ， 加上 之前 聲帶 受傷 ， 大家 都 好 擔心 。 但 結果 證明 ， 我們 做到 了 ， 而且 成功 完成 今 次 演出 。 ” 阿嬌則 主動 談及 因 身體 不 適要 取消 打側 手翻 環節 之事 ： “ 因 演唱 會 中段 時 我 病 了 ， 身體 狀況 好 差 ， 咬 東西 都 冇 力 ， 連廁 所 都 去 唔 到 ； 打側 手 翻 跣 腳 嗰 日 仲 要 食 緊 感冒 藥 … … 所以 ， 真 係 要 開始 放假 休養 身體 了 。 ”
尹光澳門遇假女僕啼笑皆非,尹光澳門遇假女僕啼笑皆非    尹光（光B）早前來澳，為即將於二月十七日在百老匯舞台舉行的“過大海系列之尹光 Fly High 演唱會”宣傳，並在兩天內為多個頻道拍攝訪問，行程非常奔波勞碌卻充實。光B一向精力充沛， 連跑多場也未見疲態， 其中一組宣傳片便是與澳門知名網媒“歡樂馬介休”及“膠街架”合作，以尹光經典歌曲《少理阿爸》MV做二次創作， 馬介休成員模仿原版MV中的各種造型。當中“歡樂馬介休”成員梁子龍就以經典長髮及紅色長裙出現，非常神似， 連工作人員及街坊都忍不住捧腹大笑。    接着又拍攝尹光幫襯澳門的女僕Cafe， 光B說：“以前去過日本的女僕Cafe， 都係抱住去見識吓嘅心態，覺得幾有趣，澳門嘅就真係冇去過。”當日光B與一班澳門網紅玩得不亦樂乎，澳門KOL 中村更假扮成女僕，為尹光等人服務， 到最後一刻才揭穿其男兒身份， 光B笑言知道這個女僕是男人後，真的是啼笑皆非。    尹光近日已積極為演唱會作準備， 保證以十足水準演出。由於演唱會當日為年初八， 新年氣氛濃厚， 因此本次演出氣氛也是以喜慶、熱鬧為主。,http://www.macaodaily.com/html/2024-02/08/content_1734014.htm,尹光澳門遇假女僕啼笑皆非    尹光（光B）早前來澳，為即將於二月十七日在百老匯舞台舉行的“過大海系列之尹光 Fly High 演唱會”宣傳，並在兩天內為多個頻道拍攝訪問，行程非常奔波勞碌卻充實,尹光 澳門 遇假 女僕 啼笑皆非         尹光 （ 光 B ） 早前 來澳 ， 為 即將 於 二月 十七日 在 百老 匯 舞台 舉行 的 “ 過 大海 系列 之 尹光   Fly   High   演唱 會 ” 宣傳 ， 並在 兩天 內為 多個 頻道 拍 攝訪問 ， 行程 非常 奔波 勞碌 卻 充實 。 光 B 一向 精力充沛 ，   連跑 多場 也 未見 疲態 ，   其中 一組 宣傳片 便是 與 澳門 知名 網媒 “ 歡樂馬 介休 ” 及 “ 膠街 架 ” 合作 ， 以 尹光 經典 歌曲 《 少理 阿爸 》 MV 做 二次 創作 ，   馬 介休 成員 模仿 原版 MV 中 的 各種 造型 。 當中 “ 歡樂馬 介休 ” 成員 梁子 龍 就 以 經典長 髮 及 紅色長 裙 出現 ， 非常 神似 ，   連 工作 人員及 街坊 都 忍不住 捧腹大笑 。         接着 又 拍 攝 尹光 幫襯 澳門 的 女僕 Cafe ，   光 B 說 ： “ 以前 去過 日本 的 女僕 Cafe ，   都 係 抱住 去 見識 吓 嘅 心 態 ， 覺得 幾 有趣 ， 澳 門 嘅 就 真 係 冇 去 過 。 ” 當 日光 B 與 一班 澳門 網紅玩得 不亦樂乎 ， 澳門 KOL   中村 更 假扮 成女 僕 ， 為 尹光 等 人 服務 ，   到 最 後 一刻 才 揭穿 其 男兒 身份 ，   光 B 笑言 知道 這個 女僕 是 男人 後 ， 真的 是 啼笑皆非 。         尹光 近日 已積 極為 演唱 會作 準備 ，   保證 以 十足 水準 演出 。 由 於 演唱 會 當日 為 年 初八 ，   新年 氣氛 濃厚 ，   因此 本次 演出 氣氛 也 是 以 喜慶 、 熱鬧 為 主 。
林凱恩回應“男友”拖糧風波,林凱恩回應“男友”拖糧風波    前晚，無線處境劇《愛 · 回家之開心速遞》藝人出席商場騷宣傳，一眾演員劉丹、滕麗名、呂慧儀、林淑敏、周嘉洛、單立文及林凱恩等以喜慶服飾打扮現身玩遊戲，又向居民大派利市封，場面十分熱鬧。呂慧儀今個農曆新年會留港與兒子及家人度歲，而滕麗名因為攞到兩個多星期假，春節可以與老公去日本旅行，甜蜜過二人世界。    早前，林凱恩捲入“男友”Vincent餐廳拖糧風波，有指其“男友”涉及拖糧近五十萬元，林凱恩前晚受訪時否認對方是男友，“他只是我的一個朋友，（事後有否聯絡Vincent？）冇，佢話唔好意思影響到我，要請食飯，我就說下次先啦。（是否驚了對方？）又唔係。（若有朋友向你借錢會否幫手？）我一向都鍾意幫人，但而家未有錢。（你現今感情狀況如何？）感情方面的事，一日未肯定，我都唔會講的。”,http://www.macaodaily.com/html/2024-02/08/content_1734015.htm,早前，林凱恩捲入“男友”Vincent餐廳拖糧風波，有指其“男友”涉及拖糧近五十萬元，林凱恩前晚受訪時否認對方是男友，“他只是我的一個朋友，（事後有否聯絡Vincent,林凱恩 回應 “ 男友 ” 拖 糧風波         前 晚 ， 無線 處境劇 《 愛   ·   回家 之開 心速 遞 》 藝人 出席 商場 騷宣傳 ， 一眾 演員 劉丹 、 滕麗名 、 呂慧儀 、 林淑敏 、 周嘉洛 、 單立 文及 林凱恩 等 以 喜慶 服飾 打扮 現身 玩遊戲 ， 又 向 居民 大派 利市 封 ， 場面 十分 熱鬧 。 呂慧儀 今個 農 曆 新年 會 留港 與 兒子 及 家人 度歲 ， 而 滕麗名 因 為 攞 到 兩 個 多星期 假 ， 春節 可以 與 老公 去 日本 旅行 ， 甜蜜 過 二人 世界 。         早前 ， 林凱恩 捲 入 “ 男友 ” Vincent 餐廳 拖 糧風波 ， 有 指其 “ 男友 ” 涉及 拖 糧近 五十 萬元 ， 林凱恩前 晚 受訪 時否 認對方 是 男友 ， “ 他 只是 我 的 一個 朋友 ， （ 事 後 有否 聯絡 Vincent ？ ） 冇 ， 佢 話 唔 好意思 影響 到 我 ， 要 請 食飯 ， 我 就 說 下次 先 啦 。 （ 是否 驚 了 對方 ？ ） 又 唔 係 。 （ 若有 朋友 向 你 借 錢會否 幫手 ？ ） 我 一向 都 鍾 意幫人 ， 但而家 未有 錢 。 （ 你 現今 感情 狀況 如何 ？ ） 感情 方面 的 事 ， 一日 未 肯定 ， 我 都 唔 會講 的 。 ”
蔣家旻被指命格宜嫁外國人,蔣家旻被指命格宜嫁外國人    無線風水賀年節目《2024 風生水起》由薛家燕、陳懿德、許文軒及徐文浩擔任主持，邀來堪輿學家李丞責、麥玲玲、元海、唐碧霞、黃楚淇為觀眾指點迷津。    今晚的一集，邀來導演葉念琛及蔣家旻擔任嘉賓。玲玲師傅直指葉導面相旺老闆：“你個命係好旺老闆，老闆搵你做嘢，可以由小公司變大公司！”玲玲師傅更教大家睇旺老闆面相，耳頭形狀是關鍵所在。玲玲師傅又批葉念琛命格利金，適合音樂相關的工作。葉導笑言：“即係我要出道啦，等《中年好聲音》第三季啦，我唔好意思話去《聲夢》！”    肖蛇的蔣家旻非常關心事業運，她被批龍年有較多機會出埠以及有男性貴人，至於姻緣運方面，玲玲師傅指家旻命格水泛木漂，適合較遠方之姻緣，到底家旻又能否接受？節目中會揭曉。    “區區行大運”環節中，丞丞師傅帶觀眾遊尖沙咀以及油麻地廟街，他指尖沙咀陽地配陰水，有利女性相關生意，至於廟街則是鱷魚下水格局，適合發展娛樂及零售事業！,http://www.macaodaily.com/html/2024-02/08/content_1734017.htm,蔣家旻被指命格宜嫁外國人    無線風水賀年節目《2024 風生水起》由薛家燕、陳懿德、許文軒及徐文浩擔任主持，邀來堪輿學家李丞責、麥玲玲、元海、唐碧霞、黃楚淇為觀眾指點迷津,蔣家 旻 被 指命格 宜嫁 外國人         無線 風水 賀年 節目 《 2024   風 生水 起 》 由 薛 家燕 、 陳 懿德 、 許文軒 及 徐文浩 擔任 主持 ， 邀來 堪 輿學家 李丞責 、 麥 玲玲 、 元海 、 唐碧霞 、 黃 楚 淇 為 觀眾 指點 迷津 。         今晚 的 一集 ， 邀來 導演 葉念琛 及 蔣家旻擔 任嘉賓 。 玲玲 師傅 直指 葉導 面相 旺 老 闆 ： “ 你 個 命 係 好旺 老 闆 ， 老 闆 搵 你 做 嘢 ， 可以 由 小 公司 變大 公司 ！ ” 玲玲 師傅 更教 大家 睇 旺 老 闆 面相 ， 耳頭 形狀 是 關鍵 所在 。 玲玲 師傅 又 批葉念 琛 命 格利 金 ， 適 合音 樂相關 的 工作 。 葉導 笑 言 ： “ 即 係 我 要 出道 啦 ， 等 《 中年 好聲音 》 第三季 啦 ， 我 唔 好意思 話 去 《 聲夢 》 ！ ”         肖蛇 的 蔣家 旻 非常 關 心事 業運 ， 她 被 批龍 年 有 較 多 機會 出埠 以及 有 男性 貴人 ， 至於 姻緣運 方面 ， 玲玲 師傅 指家 旻 命格 水泛 木 漂 ， 適合 較 遠方 之姻 緣 ， 到底 家 旻 又 能否 接受 ？ 節目 中會 揭曉 。         “ 區區 行大運 ” 環節 中 ， 丞丞師 傅帶 觀眾遊 尖沙咀 以及 油麻 地廟 街 ， 他 指 尖沙咀 陽地配 陰水 ， 有利 女性 相關 生意 ， 至於 廟 街則 是 鱷魚 下水 格局 ， 適合 發展 娛樂及 零售 事業 ！
甄采浠分享喼弗心得,甄采浠分享喼弗心得    甄采浠（前名甄詠珊）在無線新劇《本尊就位》中飾演“歸二娘”一角，她近日在劇中為氹金爺（韋家雄飾）買下“溫香玉院”，先後出動“餵提子”及“坐大髀高八度撒嬌”向金爺連環獻媚，十分搶鏡。劇集開播後，她被譽為劇中“三大漏網美女”之一，除了嗲功驚人，餵提子時更大曬美腿，保養得宜。    甄采浠受訪時笑言，自己其實是“不懂撒嬌的女人”，並大讚韋家雄是好對手，即使親密場口，二人亦能“快靚正”完成：“雖然韋家雄好鍾意搞笑講爛gag，但佢亦係一個好專業同好敬業嘅演員，所以我哋一埋位，無論咩場口都好快就入到戲，一take過搞掂。”至於喼弗心得，她透露靠負重及帶氧運動雙管齊下之餘，戒糖及注意均衡飲食亦很重要，並笑指被醫生指“吃菜太多”：“醫生話我食太多菜，原來好大塊葉嘅菜，係唔可以食太多，要食返啲細葉嘅菜先得，因為細葉嘅菜冇咁濕，濕會令身體易積聚毒素。”,http://www.macaodaily.com/html/2024-02/08/content_1734018.htm,甄采浠分享喼弗心得    甄采浠（前名甄詠珊）在無線新劇《本尊就位》中飾演“歸二娘”一角，她近日在劇中為氹金爺（韋家雄飾）買下“溫香玉院”，先後出動“餵提子”及“坐大髀高八度撒嬌”向金爺連環獻媚，十分搶鏡,甄采 浠 分享 喼 弗 心得         甄采 浠 （ 前名 甄詠 珊 ） 在 無線 新劇 《 本尊 就位 》 中飾演 “ 歸 二娘 ” 一角 ， 她 近日 在 劇中 為 氹 金爺 （ 韋家雄飾 ） 買下 “ 溫香玉院 ” ， 先後出動 “ 餵 提子 ” 及 “ 坐大 髀 高 八度 撒嬌 ” 向 金爺 連環獻媚 ， 十分 搶鏡 。 劇集 開播 後 ， 她 被 譽 為 劇中 “ 三大 漏網 美女 ” 之一 ， 除了 嗲功 驚人 ， 餵 提子 時 更 大 曬 美腿 ， 保養 得宜 。         甄采 浠 受訪 時 笑 言 ， 自己 其實 是 “ 不 懂 撒嬌 的 女人 ” ， 並 大 讚 韋 家 雄 是 好 對 手 ， 即使 親密場 口 ， 二人 亦 能 “ 快靚 正 ” 完成 ： “ 雖然 韋家雄 好 鍾 意 搞笑 講爛 gag ， 但 佢 亦 係 一 個 好 專 業 同 好 敬 業 嘅 演 員 ， 所以 我 哋 一 埋位 ， 無論 咩 場口 都 好 快 就 入 到戲 ， 一 take 過 搞掂 。 ” 至於 喼 弗 心得 ， 她 透露 靠 負重 及 帶氧運動 雙管 齊下 之餘 ， 戒糖 及 注意 均衡 飲食 亦 很 重要 ， 並笑 指 被 醫生 指 “ 吃 菜 太 多 ” ： “ 醫生 話 我 食太多菜 ， 原來 好 大塊 葉 嘅 菜 ， 係 唔 可以 食太多 ， 要 食返 啲 細 葉 嘅 菜 先 得 ， 因為細 葉 嘅 菜 冇 咁 濕 ， 濕會 令身 體易 積聚 毒素 。 ”
