Title,Content,Link,Summary,Preprocessed_Content
氹舊城新春設行人專區,年初一至年初九    每日午十二晩七    氹舊城新春設行人專區    【本報消息】當局預計新春氹仔舊城區的人車流較繁忙，政府跨部門經聽取社團意見後，研究及評估過去情況，計劃於本月十至十八日（年初一至年初九），每日中午十二時至晚上七時在氹仔舊城區設置臨時行人專區，優化區內的人流及交通管理。政府跨部門及社團代表昨日聯合舉行新聞發佈會，介紹詳情。    優化區內人流交通    新聞發佈會昨日下午四時在國際銀行大廈七樓經科局會議室舉行，經濟及科技發展局長戴建業、交通事務局運輸管理處代處長阮潔玲、治安警察局行動及通訊處長張樂民、旅遊局傳播及對外關係廳長劉鳳池、市政署道路處長梁振榮、氹仔社區發展促進會理事長蕭東文、澳門離島工商業聯合會理事長阮若華、氹仔坊眾聯誼會理事長陳自成等出席。    戴建業介紹，臨時行人專區範圍由飛能便度街與素啤古街交界（嘉模泳池巴士站前），至告利雅施利華街與巴坡沙總督街交界（路氹歷史館），當中包括兵房斜巷至嘉路士米耶馬路部分路段。指出設置行人專區目的是優化區內人流及交通管理，各部門致力平衡居民、商戶及遊客的需要，確保行人及車輛安全有序通行，同時讓居民及遊客有更舒適及更好的體驗。    遊人密集時均數千    戴建業稱，行人專區實施期間將有警員及工作人員協助居民和旅客掌握區內交通改道和行人專區等資訊，並於區內當眼處設置大型指示牌。同時製作宣傳海報、宣傳短片，讓居民和商戶了解安排，提前做好準備。居民、駕駛者及旅客出行前，可留意交通事務局發佈的交通資訊。    戴建業補充，設置行人專區已充分協調區內各項活動，包括文化局、市政署、旅遊局等計劃舉辦的活動。據觀察，設行人專區的路段過去遊人較密集，峰值每小時可達數千人次。當局是根據以往經驗及充分聽取區內社團及居民的意見設置臨時步行區，目的是讓區內人員及交通更舒適地流動。    劉鳳池表示，居民及旅客屆時可上旅遊局網站，透過智慧客流應用程式查看景點的人流情況。    冀顧居民商戶需求    蕭東文表示，氹仔舊城區平日人車流暢旺。隨着新春假期臨近，預計農曆新年來澳及到氹仔舊城區遊覽的旅客將較多，氹仔社區發展促進會、氹仔坊眾聯誼會及澳門離島工商業聯合會將全力配合特區政府新春期間的措施。冀政府確保居民及遊客出行安全，加強與居民和商戶溝通，盡量顧及區內居民、商戶的出行和經營需求。,http://www.macaodaily.com/html/2024-02/03/content_1733030.htm,年初一至年初九    每日午十二晩七    氹舊城新春設行人專區    【本報消息】當局預計新春氹仔舊城區的人車流較繁忙，政府跨部門經聽取社團意見後，研究及評估過去情況，計劃於本月十至十八日（年初一至年初九），每日中午十二時至晚上七時在氹仔舊城區設置臨時行人專區，優化區內的人流及交通管理,年初一 至 年 初九         每日 午 十二 晩 七         氹 舊城 新春 設 行人 專區         【 本報 消息 】 當局 預計 新春 氹 仔舊 城區 的 人車 流較 繁忙 ， 政府 跨部門經 聽取 社團 意見 後 ， 研究 及評 估過 去 情況 ， 計劃 於 本月 十至 十八日 （ 年初一 至 年 初九 ） ， 每日 中午 十二 時至 晚上 七時 在 氹 仔舊 城區 設置 臨時 行人 專區 ， 優化區 內 的 人流 及 交通管理 。 政府 跨部門 及 社團 代表 昨日 聯合 舉行 新聞發 佈 會 ， 介紹 詳情 。         優化區 內 人流 交通         新聞發 佈 會 昨日 下午 四時 在 國際 銀行 大廈 七樓經 科局 會議室 舉行 ， 經濟 及 科技 發展 局長 戴建業 、 交通 事務局 運輸 管理 處代 處長 阮潔玲 、 治安 警察局 行動 及 通訊 處長 張樂民 、 旅遊局 傳播 及 對 外關 係 廳 長 劉鳳池 、 市政 署 道路 處長 梁振榮 、 氹 仔社區 發展 促進會 理事 長 蕭東文 、 澳門 離島 工商 業聯合會 理事 長 阮若華 、 氹 仔坊 眾聯誼會 理事 長 陳 自成 等 出席 。         戴建業 介紹 ， 臨時 行人 專區 範圍 由 飛能 便度 街 與 素 啤 古街 交界 （ 嘉模 泳池 巴士站 前 ） ， 至告 利雅施 利華街 與 巴坡沙 總督街 交界 （ 路 氹 歷史館 ） ， 當中 包括 兵房 斜巷 至嘉路 士米 耶馬路 部分 路段 。 指出 設置 行人 專區 目的 是 優化區 內 人流 及 交通管理 ， 各部 門 致力 平衡 居民 、 商戶 及 遊客 的 需要 ， 確保 行人 及 車輛 安全 有序 通行 ， 同時 讓 居民 及遊客 有 更 舒適 及 更好 的 體驗 。         遊人 密集 時均 數千         戴建業 稱 ， 行人 專區 實施 期間 將有 警員及 工作 人員 協助 居民 和 旅客 掌握 區內 交通 改道 和 行人 專區 等 資訊 ， 並於區 內當 眼處 設置 大型 指示牌 。 同 時 製 作 宣 傳 海 報 、 宣傳 短片 ， 讓 居民 和 商戶 了解 安排 ， 提前 做好 準備 。 居民 、 駕駛者 及 旅客 出行 前 ， 可 留意 交通 事務局 發 佈 的 交通 資訊 。         戴建業 補充 ， 設置 行人 專區 已 充分 協調區 內 各項 活動 ， 包括 文化局 、 市政 署 、 旅遊局 等 計劃 舉辦 的 活動 。 據 觀察 ， 設 行人 專區 的 路段 過去 遊人 較 密集 ， 峰值 每小時 可達 數千 人次 。 當局 是 根據 以往 經驗 及 充分 聽 取區 內 社團 及 居民 的 意見 設置 臨時 步行 區 ， 目的 是 讓 區內 人員及 交通 更舒適 地流動 。         劉鳳池 表示 ， 居民 及 旅客 屆 時 可上 旅遊局 網站 ， 透過 智慧 客流 應用 程式 查看 景點 的 人流 情況 。         冀顧 居民 商戶 需求         蕭東文 表示 ， 氹 仔舊 城區 平日 人車流 暢旺 。 隨着 新春 假期 臨近 ， 預計農 曆 新年 來 澳及 到 氹 仔舊 城區 遊覽 的 旅客 將較 多 ， 氹 仔社區 發展 促進會 、 氹 仔坊 眾聯誼 會 及 澳門 離島 工商 業聯合會將 全力 配合 特區 政府 新春 期間 的 措施 。 冀 政府 確保 居民 及遊客 出行 安全 ， 加強 與 居民 和 商戶 溝通 ， 盡量 顧及區 內 居民 、 商戶 的 出行 和 經營 需求 。
新春四日設氹仔市集,新春四日設氹仔市集    當局多措保行人專區安全衛生    【本報消息】市政署道路處長梁振榮表示，為配合農曆新年氹仔舊城區臨時行人專用區開展，“氹仔市集”將在初一、二、三、九舉行，一如以往於黑橋附近設置十八個小販檔，將以地線劃分檔口位置，確保有足夠空間讓行人通行。該署已與警方商議人流控制措施。    梁振榮介紹了行人專用區系列協調措施，包括在施督憲正街、律政司街等路口以印有特別式樣的圍布鐵馬分隔行人專區；於部分街道設置大型吊燈及燈飾增加節日氣氛；並與清潔專營公司協調於行人專用區期間設特別時段收集垃圾，區內適當位置增加垃圾桶，並增派人員加強街道清潔及收集垃圾。亦會加強維修及巡查該區道路，確保環境安全。,http://www.macaodaily.com/html/2024-02/03/content_1733031.htm,新春四日設氹仔市集    當局多措保行人專區安全衛生    【本報消息】市政署道路處長梁振榮表示，為配合農曆新年氹仔舊城區臨時行人專用區開展，“氹仔市集”將在初一、二、三、九舉行，一如以往於黑橋附近設置十八個小販檔，將以地線劃分檔口位置，確保有足夠空間讓行人通行,新春 四日 設氹仔 市集         當局 多 措保 行人 專區 安全 衛生         【 本報 消息 】 市政 署 道路 處長 梁振榮 表示 ， 為 配合 農 曆 新年 氹 仔舊 城區 臨時 行人 專用區 開展 ， “ 氹 仔 市集 ” 將在 初一 、 二 、 三 、 九舉行 ， 一如 以往 於 黑橋 附近 設置 十八 個 小 販檔 ， 將以 地線 劃分 檔口 位置 ， 確 保有 足夠 空間 讓 行人 通行 。 該署 已 與 警方 商議 人流 控制措施 。         梁振榮 介紹 了 行人 專用區 系列 協調 措施 ， 包括 在 施督憲 正街 、 律政司 街 等 路口 以 印有 特別式樣 的 圍布 鐵馬 分隔 行人 專區 ； 於 部分 街道 設置 大型 吊燈 及 燈飾 增加 節日 氣氛 ； 並與 清潔 專營 公司 協調 於 行人 專用區 期間 設特別 時段 收集 垃圾 ， 區內 適當 位置 增加 垃圾桶 ， 並 增派 人員加強 街道 清潔及 收集 垃圾 。 亦 會加 強維修 及 巡查 該區 道路 ， 確保 環境 安全 。
配合行人專區多線巴士改道,配合行人專區多線巴士改道    警方訂預案有需要時人潮管制    【本報消息】氹仔舊城區將於年初一至初九，每日中午十二時至晚上七時設臨時行人專區，途經範圍內的多條巴士線全日改道。當局表示，會做好系列臨時交通疏導措施，加派人員維持秩序及協助。    區內四巴士站停用    交通事務局運輸管理處代處長阮潔玲表示，配合臨時行人專區措施，二月十日至十八日（年初一至初九），每日中午十二時至晚上七時行人專區範圍及周邊部分道路封閉交通，車輛可取道奧林匹克大馬路前往地堡街及黑橋街一帶。近飛能便度街一段素啤古街反方向行車，以保持區內交通循環。為方便重型客車上落客，望德聖母灣大馬路近望德聖母灣馬路／軍營巴士站的上落客貨區僅供重型客車使用。    途經行人專區範圍的多條巴士線由二月十日首班車至十八日尾班車全日改道，“泉悅花園”、“嘉模泳池”、“氹仔官也街”和“氹仔中葡小學”站臨時停用，乘客可使用“奧林匹克大馬路”及“澳門運動場”站上落車。另於巴波沙總督前地、鄰近氹仔中葡小學位置設臨時站，供11及28A路線停靠。    增員維持交通秩序    臨時行人專區及周邊道路的臨時交通安排，交通事務局將另發新聞稿公佈。    治安警察局行動及通訊處長張樂民表示，將全力配合行人專區安排，協助封路及交通改道，並加派人員在區內維持秩序、指揮及疏導交通，指引駕駛者改道行駛。警方已制訂預案，有需要時按實際情況實施人潮管制。亦會因應周邊道路的交通情況，有需要時實施臨時交通措施，保障公共秩序和公衆安全。    張樂民稱，為更好地管理該帶交通，特許車輛可在現場警員指揮下，經飛能便度街駛入施督憲政街。停泊區內的車輛可經兵房斜巷離開。呼籲公衆留意行人專區的宣傳資訊以及配合現場警員指示。,http://www.macaodaily.com/html/2024-02/03/content_1733032.htm,區內四巴士站停用    交通事務局運輸管理處代處長阮潔玲表示，配合臨時行人專區措施，二月十日至十八日（年初一至初九），每日中午十二時至晚上七時行人專區範圍及周邊部分道路封閉交通，車輛可取道奧林匹克大馬路前往地堡街及黑橋街一帶,配合 行人 專區 多線 巴士 改道         警方 訂 預案 有 需要 時 人潮 管制         【 本報 消息 】 氹 仔舊 城區將 於 年初一 至 初九 ， 每日 中午 十二 時至 晚上 七時 設臨 時 行人 專區 ， 途經 範圍 內 的 多條 巴士 線 全日 改道 。 當局 表示 ， 會 做好 系列 臨時 交通 疏導 措施 ， 加派 人員維持 秩序 及 協助 。         區內 四 巴士站 停用         交通 事務局 運輸 管理 處代 處長 阮潔玲 表示 ， 配合 臨時 行人 專區 措施 ， 二月 十日 至 十八日 （ 年初一 至 初九 ） ， 每日 中午 十二 時至 晚上 七時 行人 專區 範圍 及 周邊 部分 道路 封閉 交通 ， 車輛 可取 道 奧林匹克大馬路 前往 地堡 街及 黑橋 街 一帶 。 近飛能 便度 街 一段 素 啤 古街 反 方向 行車 ， 以 保持 區內 交通 循環 。 為 方便 重型 客車 上 落客 ， 望德聖 母灣 大馬路 近望 德聖 母灣馬路 ／ 軍營 巴士站 的 上 落客 貨區 僅供 重型 客車 使用 。         途經 行人 專區 範圍 的 多條 巴士 線 由 二月 十日 首班 車至 十八日 尾班車 全日 改道 ， “ 泉悅 花園 ” 、 “ 嘉模 泳池 ” 、 “ 氹 仔官 也 街 ” 和 “ 氹 仔 中葡 小學 ” 站 臨時 停用 ， 乘客 可 使用 “ 奧林匹克大馬路 ” 及 “ 澳門 運動場 ” 站上 落車 。 另 於 巴波沙 總督前 地 、 鄰近 氹 仔 中葡 小學 位置 設臨 時 站 ， 供 11 及 28A 路線 停靠 。         增員維持 交通秩序         臨時 行人 專區 及 周邊 道路 的 臨時 交通 安排 ， 交通 事務 局將 另 發新聞 稿公 佈 。         治安 警察局 行動 及 通訊 處長 張樂民 表示 ， 將 全力 配合 行人 專區 安排 ， 協助 封路 及 交通 改道 ， 並加 派 人員在區 內維持 秩序 、 指揮及 疏導 交通 ， 指引 駕駛者 改道 行駛 。 警方 已 制訂 預案 ， 有 需要 時 按 實際 情況 實施 人潮 管制 。 亦 會 因應 周邊 道路 的 交通 情況 ， 有 需要 時實施 臨時 交通 措施 ， 保障 公共秩序 和 公 衆 安全 。         張樂民稱 ， 為 更好 地 管理 該 帶 交通 ， 特許 車輛 可 在 現場 警員 指揮下 ， 經飛能 便度 街駛入 施督 憲政街 。 停泊 區內 的 車輛 可經 兵房 斜巷 離開 。 呼籲公 衆 留意 行人 專區 的 宣傳 資訊 以及 配合 現場 警員 指示 。
旅局多渠道宣傳氹仔行人專區,旅局多渠道宣傳氹仔行人專區    【本報消息】旅遊局傳播及對外關係廳長劉鳳池相信，設置臨時步行區能為旅客帶來較舒適的步行環境。當局已爲區內遊人和交通的優化措施製作宣傳短片，在不同平台播放，包括旅遊局轄下各旅客詢問處的LED屏幕、本地電視台、巴士電視、旅遊局官方社交媒體等，讓訪澳旅客可提早得知安排。    邀外地網紅助宣傳    劉鳳池表示，旅遊局亦透過邀請多位內地及海外網紅來澳考察氹仔舊城區及了解“農曆新年氹仔舊城區臨時行人專用區”的措施，並以圖文、視頻等形式在網上宣傳。此外，旅遊局官方社交平台，包括微信、微博、抖音、小紅書、TikTok、Facebook、Instagram、Line、Youtube等帳號鋪開系列線上推廣，製作遊玩攻略、周邊打卡景點及短視頻等宣傳介紹。亦會提醒旅行社注意臨時行人專區的交通改道及旅遊巴上落客安排。    新春活動延至氹仔    預計春節期間不少旅客來澳度歲，旅遊局將繼續宣傳澳門有禮都市形象，將“歡樂春節——二〇二四年龍騰舞躍賀新春”社區巡演的部分活動延伸至氹仔舊城區，安排多項表演，包括與你“麥麥”見、福祿壽三星派金元寶、葡萄牙表演隊及“麥麥龍年帶你飛”街舞表演等，為居民和旅客帶來新春節慶氣氛。,http://www.macaodaily.com/html/2024-02/03/content_1733033.htm,新春活動延至氹仔    預計春節期間不少旅客來澳度歲，旅遊局將繼續宣傳澳門有禮都市形象，將“歡樂春節——二〇二四年龍騰舞躍賀新春”社區巡演的部分活動延伸至氹仔舊城區，安排多項表演，包括與你“麥麥”見、福祿壽三星派金元寶、葡萄牙表演隊及“麥麥龍年帶你飛”街舞表演等，為居民和旅客帶來新春節慶氣氛,旅局 多渠道 宣傳 氹 仔 行人 專區         【 本報 消息 】 旅遊局 傳播 及 對 外關 係 廳 長 劉鳳池 相信 ， 設置 臨時 步行 區能 為 旅客 帶來 較 舒適 的 步行 環境 。 當局 已 爲 區內 遊人 和 交通 的 優化 措施 製 作 宣 傳 短片 ， 在 不同 平台 播放 ， 包括 旅遊 局轄下 各 旅客 詢問 處 的 LED 屏幕 、 本地 電視台 、 巴士 電視 、 旅遊局 官方 社交 媒體 等 ， 讓 訪澳 旅客 可 提早 得知 安排 。         邀 外地 網紅助 宣傳         劉鳳池 表示 ， 旅遊局 亦 透過 邀請 多位 內地 及 海外 網紅來 澳 考察 氹 仔舊 城區 及 了解 “ 農 曆 新年 氹 仔舊 城區 臨時 行人 專用區 ” 的 措施 ， 並以 圖文 、 視頻 等 形式 在 網上 宣傳 。 此外 ， 旅遊局 官方 社交 平台 ， 包括 微信 、 微博 、 抖音 、 小紅書 、 TikTok 、 Facebook 、 Instagram 、 Line 、 Youtube 等 帳號 鋪 開 系列 線 上推 廣 ， 製 作 遊 玩 攻略 、 周邊 打卡 景點 及 短視頻 等 宣傳 介紹 。 亦 會 提醒 旅行社 注意 臨時 行人 專區 的 交通 改道 及 旅遊 巴上 落客 安排 。         新春 活動 延至 氹 仔         預計春節 期間 不少 旅客 來 澳度 歲 ， 旅遊局 將繼續 宣傳 澳門 有禮 都市 形象 ， 將 “ 歡樂春節 — — 二 〇 二 四年 龍騰 舞躍賀 新春 ” 社區 巡演 的 部分 活動 延伸 至 氹 仔舊 城區 ， 安排 多項 表演 ， 包括 與 你 “ 麥麥 ” 見 、 福祿壽 三星 派 金元 寶 、 葡萄牙 表演 隊及 “ 麥麥龍 年 帶 你 飛 ” 街舞 表演 等 ， 為 居民 和 旅客 帶來 新春 節慶氣氛 。
首批生鮮雞抵澳居民“嘗鮮”,鼻環示屠宰期   貯冷藏櫃展示    首批生鮮雞抵澳居民“嘗鮮”    【本報消息】首批約二千隻即日屠宰即日銷售的內地“生鮮雞”昨日起供澳。“生鮮雞”須佩有標示屠宰日期及時間的鼻環，外包裝上印有產品資訊、屠宰日期及時間等，且須貯存及展示於冷藏櫃內。昨日早上不少居民、街坊到超市、街市選購“嘗鮮”。    市政署表示，為向本澳居民提供更優質、多元的鮮活食品選擇，滿足居民食用鮮雞的傳統飲食習慣，在國家海關總署支持、市政署與拱北海關合作及協調下，首批“生鮮雞”昨晨通過快速通關及優先檢驗檢疫流程後，經港珠澳大橋澳門口岸抵澳門，過程順暢。訂購首批“生鮮雞”的包括超市、餐廳、街市攤販及居民。    供澳“生鮮雞”在屠宰並包裝完成後，立即以冷鏈運輸車運載，全程冷鏈配送直達關口。內地海關實行快速通關，市政署則預先安排檢疫人員在關口準備，當“生鮮雞”冷鏈運輸車抵達後，檢疫人員優先展開檢驗，對冷鏈運輸車及“生鮮雞”進行溫度檢測、核對貨證等查驗工作，盡量快速放行，確保“生鮮雞”在出廠後一個半小時內運抵本澳上市。    監察零售鮮活食品    市政署將持續加強對零售鮮活食品場所衛生巡查及抽樣監察，保障本澳鮮活食品安全。並提醒消費者光顧持有零售鮮活食品場所登記證明的商戶或街市攤檔，購買時留意“生鮮雞”應貯存及展示在冷藏櫃，並檢查包裝是否完整及留意生產日期及時間，確保所購買的“生鮮雞”安全及質量。,http://www.macaodaily.com/html/2024-02/03/content_1732902.htm,市政署表示，為向本澳居民提供更優質、多元的鮮活食品選擇，滿足居民食用鮮雞的傳統飲食習慣，在國家海關總署支持、市政署與拱北海關合作及協調下，首批“生鮮雞”昨晨通過快速通關及優先檢驗檢疫流程後，經港珠澳大橋澳門口岸抵澳門，過程順暢,鼻環示 屠宰 期       貯 冷藏 櫃 展示         首批 生鮮雞 抵澳 居民 “ 嘗鮮 ”         【 本報 消息 】 首批 約 二千 隻 即日 屠宰 即日 銷售 的 內 地 “ 生鮮雞 ” 昨日 起供 澳 。 “ 生鮮雞 ” 須佩有 標示 屠宰 日期 及 時間 的 鼻環 ， 外 包裝 上 印有 產品 資訊 、 屠宰 日期 及 時間 等 ， 且須 貯存 及 展示 於 冷藏 櫃內 。 昨日 早上 不少 居民 、 街坊 到 超市 、 街市 選購 “ 嘗鮮 ” 。         市政 署 表示 ， 為 向 本澳 居民 提供 更 優質 、 多元 的 鮮活 食品 選擇 ， 滿足 居民 食用 鮮雞 的 傳統 飲食 習慣 ， 在 國家 海關 總署 支持 、 市政 署 與 拱 北海 關 合作 及 協調 下 ， 首批 “ 生鮮雞 ” 昨晨 通過 快速 通關 及 優先 檢驗 檢疫 流程 後 ， 經港珠 澳大橋 澳門 口岸 抵澳門 ， 過程 順暢 。 訂購 首批 “ 生鮮雞 ” 的 包括 超市 、 餐廳 、 街市 攤販及 居民 。         供澳 “ 生鮮雞 ” 在 屠宰 並包裝 完成 後 ， 立即 以冷鏈 運輸車 運載 ， 全程 冷鏈 配送 直達 關口 。 內地 海關 實行 快速 通關 ， 市政 署則 預先 安排 檢疫 人員 在 關口 準備 ， 當 “ 生鮮雞 ” 冷鏈 運輸車 抵達 後 ， 檢疫 人員 優先展 開檢驗 ， 對 冷鏈 運輸車 及 “ 生鮮雞 ” 進行 溫度 檢測 、 核對 貨證 等 查驗 工作 ， 盡量 快速 放行 ， 確保 “ 生鮮雞 ” 在 出廠 後 一個 半小時 內運 抵本澳 上市 。         監察 零售 鮮活 食品         市政 署將 持續 加強 對 零售 鮮活 食品 場所衛生 巡查 及 抽樣 監察 ， 保障 本澳 鮮活 食品安全 。 並 提醒 消費者 光顧 持有 零售 鮮活 食品 場所 登記 證明 的 商戶 或 街市 攤檔 ， 購買時 留意 “ 生鮮雞 ” 應貯存 及 展示 在 冷藏 櫃 ， 並檢查 包裝 是否 完整 及 留意 生產 日期 及 時間 ， 確保所購 買 的 “ 生鮮雞 ” 安全 及質量 。
