Title,Content,Link,Summary,Preprocessed_Content,Date
凍櫃車猛撼車隧兩傷,“生鏽鐵”下擦限高指示牌無感    凍櫃車猛撼車隧兩傷    【本報消息】羅理基博士大馬路東方拱門地下行車隧道昨日中午發生凍櫃貨車疑凍櫃過高猛撼隧道頂部交通事故，本地男司機及一名內地女外僱乘客受輕傷，兩人由救護車送院治理。治安警表示，男司機通過酒精呼氣測試，將予檢控。    車隧限高二米二    消防表示，兩名傷者分別為四十五歲本地男司機以及四十九歲內地女外僱乘客，均前額挫傷，送院時情況穩定。    意外發生於昨日中午約十二時半。一輛凍櫃貨車沿羅理基博士大馬路東方拱門地下行車隧道駛往水塘馬路方向，當貨車駛入隧道時疑因凍櫃過高，首先撞及隧道入口懸掛標示限高二米二的指示牌，司機似無所覺，繼續駕車前行，最終猛撼隧道頂部，男司機及女乘客同告受輕傷。消防救護員接報到場，爲兩人初步護理後，用救護車送往山頂醫院治理。    意外曲折阻交通    肇事凍櫃貨車的凍櫃製冷機及車頭擋風玻璃損毀。意外發生後，交通警員接報到場處理。現場所見，貨車初時仍能行駛，警員遂將貨車倒出行車隧道，擬駕駛往交通廳進一步處理。惟貨車駛至羅理基博士大馬路一側的松山隧道口時突然“跪低”，引擎不能再啟動。警員須召來拖車將貨車拖走。事發時正值午膳時段，現場一帶車流量大，交通一度擠塞。    撞車隧意外常見    雖然當局在羅理基行車隧道前吊掛活動式限高指示牌，只要駛經車輛頂部碰到指示牌，即表示超高不能通過隧道。惟車輛因超高撞及行車隧道頂的事故仍時有發生。去年三月初，一輛解款車疑撞及隧道頂部。二〇二一年十月中，一輛貨車疑撞及隧道頂部，貨車被卡住，需治安警和消防員到場協助解困。〇八年二月中，一輛貨車先後撞及隧道限高指示牌及頂部，貨車同樣被卡住，司機須為四條車胎放氣，再在治安警協助下倒車脫困。同年十二月中，一輛貨車撞及隧道頂，令車頂飛脫，男司機輕傷送院。,http://www.macaodaily.com/html/2024-04/11/content_1747618.htm,“生鏽鐵”下擦限高指示牌無感    凍櫃車猛撼車隧兩傷    【本報消息】羅理基博士大馬路東方拱門地下行車隧道昨日中午發生凍櫃貨車疑凍櫃過高猛撼隧道頂部交通事故，本地男司機及一名內地女外僱乘客受輕傷，兩人由救護車送院治理,“ 生 鏽 鐵 ” 下 擦 限高 指示牌 無感         凍櫃車 猛撼車 隧兩傷         【 本報 消息 】 羅 理基 博士 大馬路 東方 拱門 地下 行車 隧道 昨日 中午 發生 凍櫃 貨車疑 凍櫃過 高 猛撼 隧道 頂部 交通事故 ， 本地 男司 機及 一名 內地 女 外僱 乘客 受輕傷 ， 兩人 由 救護車 送院 治理 。 治安警 表示 ， 男司 機通過 酒精 呼氣 測試 ， 將予 檢控 。         車隧 限高 二米 二         消防 表示 ， 兩名 傷者 分別 為 四十五 歲 本地 男司機 以及 四十九 歲 內 地 女 外僱 乘客 ， 均 前額 挫傷 ， 送院 時 情況 穩定 。         意外 發生 於 昨日 中午 約 十二 時半 。 一輛 凍櫃 貨車 沿羅理基 博士 大馬路 東方 拱門 地下 行車 隧道 駛往 水塘 馬 路 方向 ， 當貨車 駛入 隧道 時疑 因凍 櫃過 高 ， 首先 撞 及 隧道 入口 懸掛 標示 限高 二米 二 的 指示牌 ， 司機 似無所覺 ， 繼續 駕車 前行 ， 最終 猛撼 隧道 頂部 ， 男司 機及 女 乘客 同告 受輕傷 。 消防 救護員 接報 到場 ， 爲 兩人 初步 護理 後 ， 用 救護車 送往 山頂 醫院 治理 。         意外 曲折 阻 交通         肇事 凍櫃 貨車 的 凍 櫃 製 冷 機 及 車 頭 擋 風 玻璃 損毀 。 意外 發生 後 ， 交通警 員接 報到場 處理 。 現場 所見 ， 貨車 初時 仍 能 行駛 ， 警員 遂 將貨車 倒 出行 車 隧道 ， 擬駕 駛往 交通 廳進 一步 處理 。 惟貨 車駛 至羅理基 博士 大馬路 一側 的 松山 隧道口 時 突然 “ 跪低 ” ， 引擎 不能 再 啟動 。 警員須 召來 拖車 將貨車 拖走 。 事發時 正值 午膳 時段 ， 現場 一帶車 流量 大 ， 交通 一度 擠塞 。         撞車 隧 意外 常見         雖然 當局 在羅理 基行車 隧道 前吊掛 活動式 限高 指示牌 ， 只要 駛經 車輛 頂部 碰到 指示牌 ， 即 表示 超高 不能 通過 隧道 。 惟車輛 因 超高 撞及 行車 隧道 頂 的 事故 仍時 有 發生 。 去年 三月初 ， 一輛 解款 車疑 撞 及 隧道 頂部 。 二 〇 二 一年 十月 中 ， 一輛 貨車疑 撞 及 隧道 頂部 ， 貨車 被 卡住 ， 需 治安警 和 消防 員到場 協助 解困 。 〇 八年 二月 中 ， 一輛 貨車 先後撞 及 隧道 限高 指示牌 及 頂部 ， 貨車 同樣 被 卡住 ， 司機須 為 四條 車胎 放氣 ， 再 在 治安警 協助 下 倒車 脫困 。 同年 十二月 中 ， 一輛 貨車 撞 及 隧道 頂 ， 令車 頂 飛脫 ， 男司 機輕傷 送院 。,2024-04-11
十六號碼頭擬建旅娛設施,新七份規劃條件圖不乏公眾關注項目    十六號碼頭擬建旅娛設施    【本報消息】新一批七份規劃條件圖草案現正公示，當中包括十六浦發展新項目。根據草案，項目現存樓宇不得加高，增建樓宇限高二十點五米。文化局意見應保留十六號碼頭建築外觀特徵。另外，涉及機場擴建填海和原卓家村地段的規劃條件圖亦公示。    建無障礙行人天橋    當中一份草案為鄰近澳門火船頭街及巴素打爾古街，項目為新馬路區都市規劃範圍。根據草案，用途為旅遊娛樂用地。將歸還約二百六十五平方米土地用作公共街道，重整後土地面積約為二萬二千八百平方米。當局要求土地承批人須負責設計及建造附設扶手電梯及升降機的公共行人天橋，工程計劃須先經當局審批。工程計劃草案及建築計劃階段亦須聽取交通事務局及市政署的意見。須保留地段內現存的水域作船隻停泊用途。除了必要的整治工程外，該範圍不許建造任何建築物。項目需提交環評報告。    卓家村盡量保現樹    鄰近氹仔菜園路的土地規劃條件圖草案公示，列明須保留地段內現存樹木，但當不可能原位保留時，須請求市政署協助移栽到其他地方。工程範圍涉及行道樹的保護措施，亦須聽取市政署意見。該地段為氹仔原卓家村所在的TN6地段，屬於氹北都市化整治計劃。根據草案，土地原本面積四千六百六十一平方米，屬私有土地。土地屬商住用地或旅遊娛樂用地，建設的樓宇限高九十米、裙樓最大許可高度十五米。裙樓頂層須架空作綠化休憩區，綠化面積應不小於露天範圍的一半。部分土地將用作公共街道及重整，重整後面積減至二千四百多平方米。    機場擴建須交環評    鄰近偉龍馬路土地的規劃條件圖同時公示，即機場擴建塡海。根據草案，用途為交通設施用地，地段重整後土地面積逾三百二十五萬平方米。工程須一併提供土地潛在污染評估報告，以及倘需的環境影響和交通評估報告。    工務局表示，此七份規劃條件圖草案已上載至城市規劃資訊網公示。公眾可在四月廿四日前透過電郵、傳真、郵寄或親臨工務局提交意見。,http://www.macaodaily.com/html/2024-04/11/content_1747619.htm,卓家村盡量保現樹    鄰近氹仔菜園路的土地規劃條件圖草案公示，列明須保留地段內現存樹木，但當不可能原位保留時，須請求市政署協助移栽到其他地方,新七份 規劃 條件 圖 不乏 公眾 關注 項目         十六 號碼 頭擬建 旅娛 設施         【 本報 消息 】 新 一批 七份 規劃 條件 圖 草案 現正 公示 ， 當中 包括 十六 浦發展 新 項目 。 根據 草案 ， 項目 現存 樓宇 不得 加高 ， 增建 樓宇 限高 二十 點 五米 。 文化局 意見 應 保留 十六 號碼 頭建築 外觀 特徵 。 另外 ， 涉及 機場 擴建 填海 和 原卓 家村 地段 的 規劃 條件 圖 亦 公示 。         建無障礙 行人 天橋         當中 一份 草案 為 鄰近 澳門火 船頭 街及 巴素 打爾 古街 ， 項目 為 新馬路區 都市 規劃 範圍 。 根據 草案 ， 用途 為 旅遊 娛樂 用地 。 將歸 還約 二百六十 五 平方米 土地 用作 公共 街道 ， 重整 後 土地 面積 約 為 二萬二 千八百 平方米 。 當局 要求 土地 承批 人須 負責設 計及 建造 附設 扶手 電梯 及 升降 機 的 公共 行人 天橋 ， 工程 計劃須 先經 當局 審批 。 工程 計劃 草案 及 建築 計劃 階段 亦須 聽取 交通 事務局 及 市政 署 的 意見 。 須 保留地 段 內 現存 的 水域 作船 隻 停泊 用途 。 除了 必要 的 整治 工程 外 ， 該範圍 不許 建造 任何 建築物 。 項目 需提交 環評 報告 。         卓 家村 盡量 保現 樹         鄰近 氹 仔菜 園路 的 土地 規劃 條件 圖 草案 公示 ， 列明 須 保留地 段 內現 存樹木 ， 但當 不 可能 原位 保留 時 ， 須請求 市政 署協助 移栽 到 其他 地方 。 工程 範圍 涉及 行道 樹 的 保護 措施 ， 亦須 聽取 市政 署意 見 。 該 地段 為 氹 仔原 卓 家村 所在 的 TN6 地段 ， 屬 於 氹 北 都市化 整治 計劃 。 根據 草案 ， 土地 原本 面積 四千 六百六十 一平方米 ， 屬 私有土地 。 土地 屬 商住 用地 或 旅遊 娛樂 用地 ， 建設 的 樓宇 限高 九十 米 、 裙樓 最大 許可 高度 十五米 。 裙樓 頂 層須 架空 作綠化 休憩 區 ， 綠化面 積應 不小 於 露天 範圍 的 一半 。 部分 土地 將 用作 公共 街道 及 重整 ， 重整 後 面積 減至 二千 四百多 平方米 。         機場 擴建須 交環評         鄰近 偉龍馬路 土地 的 規劃 條件 圖同 時 公示 ， 即 機場 擴 建 塡 海 。 根據 草案 ， 用途 為 交通 設 施用 地 ， 地段 重整 後 土地 面積 逾 三百 二十五 萬 平方米 。 工程 須一 併 提供 土地 潛在 污染 評估 報告 ， 以及 倘需 的 環境 影響 和 交通 評估 報告 。         工務局 表示 ， 此七份 規劃 條件 圖 草案 已上 載 至 城市 規劃 資訊網 公示 。 公眾 可 在 四月 廿四日 前透過 電郵 、 傳真 、 郵寄 或 親臨 工務局 提交 意見 。,2024-04-11
兩巴服務質素環比下降,交局公佈去年上半年服務評鑑結果    兩巴服務質素環比下降    【本報消息】交通事務局公佈去年上半年巴士服務評鑑結果，兩巴均獲C，均較二〇二二年下半年有所下跌，當中新福利跌一級，澳巴則跌兩級。    服務評鑑三指標    交通事務局公佈，巴士服務評鑑有三大項指標，服務及管理指標、運輸工具設備與安全指標各佔三成，乘客滿意度指標佔四成。另設自主改善評分，在原來服務評鑑總分基礎上加分，上限為百分之四。    在二〇二二年下半年的巴士服務評鑑中，新福利獲得C+（大於等於七十七分至八十分）的結果，澳巴則獲得B-（大於等於八十分至八十三分）。二〇二三年兩巴均獲C（大於等於七十三分至七十七分）。    乘客滿意度微跌    巴士服務評鑑內包括乘客滿意度調查，透過問卷調查在巴士站點收集乘客對巴士服務的意見，以確保公眾參與巴士評鑑制度。評分以四十分為滿分，當中乘客對整體澳門巴士服務滿意度為二十八點八分，較二〇二二年下半年微跌〇點一分。巴士公司方面，澳巴雖然較上次評分稍微下跌〇點三分至二十九點九分，但仍較新福利高分。新福利與上一次評分結果相同，維持二十七點五分。    去年辭退卅二人    巴士公司透過不同措施提升車長的安全意識及服務質素，包括召回教育再培訓、扣減獎金、停職等。倘重複出現安全或服務問題，如違反安全駕駛規定（衝紅燈、駕駛期間使用手提電話等）、涉及嚴重交通意外導致乘客受傷、不合理缺勤等，有關車長或會被勸退或撤職。截至二〇二三年十二月三十一日，兩巴公司共勸退十四人，以及撤職十八人。    交通事務局表示，目前以六種方式收集乘客對巴士服務的意見，包括四種恆常收集的單次出行評分以及兩種季度收集的季度評分（詳見附表）。,http://www.macaodaily.com/html/2024-04/11/content_1747620.htm,交局公佈去年上半年服務評鑑結果    兩巴服務質素環比下降    【本報消息】交通事務局公佈去年上半年巴士服務評鑑結果，兩巴均獲C，均較二〇二二年下半年有所下跌，當中新福利跌一級，澳巴則跌兩級,交局 公 佈 去年 上半年 服務 評鑑 結果         兩巴 服務質素 環比 下降         【 本報 消息 】 交通 事務局 公 佈 去年 上半年 巴士 服務 評鑑 結果 ， 兩巴均 獲 C ， 均 較 二 〇 二 二年 下半年 有所 下跌 ， 當中 新 福利 跌一級 ， 澳巴則 跌 兩級 。         服務 評鑑 三 指標         交通 事務局 公 佈 ， 巴士 服務評 鑑有 三大項 指標 ， 服務及 管理 指標 、 運輸 工具 設備 與 安全 指標 各 佔 三成 ， 乘客 滿意度 指標 佔 四成 。 另設 自主 改善 評分 ， 在 原來 服務 評鑑 總分 基礎 上 加分 ， 上限 為 百分之四 。         在 二 〇 二 二年 下半年 的 巴士 服務評 鑑中 ， 新 福利 獲得 C + （ 大 於 等 於 七十七 分至 八 十分 ） 的 結果 ， 澳巴則 獲得 B - （ 大 於 等 於 八 十分 至 八十 三分 ） 。 二 〇 二三年 兩巴均 獲 C （ 大 於 等 於 七十 三分 至 七十七 分 ） 。         乘客 滿意度 微跌         巴士 服務評 鑑內 包括 乘客 滿意度 調查 ， 透過 問卷 調查 在 巴士站 點 收集 乘客 對 巴士 服務 的 意見 ， 以確 保公眾 參 與 巴士 評鑑 制度 。 評分 以 四 十分 為 滿分 ， 當中 乘客 對 整體 澳門 巴士 服務滿 意度 為 二十八 點 八分 ， 較 二 〇 二 二年 下半年 微跌 〇 點 一分 。 巴士 公司 方面 ， 澳巴 雖然 較 上次 評分 稍微 下跌 〇 點 三分 至 二十九 點 九分 ， 但 仍 較 新 福利 高分 。 新 福利 與 上 一次 評分 結果 相同 ， 維持 二十七 點 五分 。         去年 辭退 卅 二人         巴士 公司 透過 不同 措施 提升 車長 的 安全 意識 及 服務質素 ， 包括 召回 教育 再 培訓 、 扣 減獎 金 、 停職 等 。 倘重 複 出現 安全 或 服務 問題 ， 如 違反 安全 駕駛 規定 （ 衝紅燈 、 駕駛期 間 使用 手提 電話 等 ） 、 涉及 嚴重 交通 意外 導致 乘客 受傷 、 不合理 缺勤 等 ， 有關 車長 或 會 被 勸 退 或 撤職 。 截至 二 〇 二三年 十二月 三十一日 ， 兩巴 公司 共 勸 退 十四 人 ， 以及 撤職 十八 人 。         交通 事務局 表示 ， 目前 以六種 方式 收集 乘客 對 巴士 服務 的 意見 ， 包括 四種 恆常 收集 的 單次 出行 評分 以及 兩種 季度 收集 的 季度 評分 （ 詳見 附表 ） 。,2024-04-11
火警首季二百五宗主因疏忽,火警首季二百五宗主因疏忽    消防局籲外出熄爐小心處理火種    消防局昨公佈二○二四年首季工作數據。消防局教育宣傳及公關處長劉皓瑋表示，一至三月消防局所有事件出勤總數為一萬四千○九十八宗，當中火警出勤二百五十四宗，較去年同期上升十四宗；其中沒有開喉灌救的事件二百○四宗，佔火警出勤總數八成。    疏忽肇禍佔六成半    發佈會昨日下午三時半於消防局總部曁西灣湖行動站舉行。劉皓瑋表示，火警原因仍以忘記關爐、電線短路、燃燒香燭／冥鏹、有人留下火種、機件／設備故障為主，合共一百六十七宗，佔火警總出勤約六成半。因此，消防局提醒居民，外出前應將爐具及電器關好，日常生活上應小心處理煙蒂及火種，勿讓一時疏忽大意，引致火警造成財物損失。    籲勿濫用救護服務    首三月消防局救護車出勤一萬一千七百七十四宗，較去年同期上升一千三百五十八宗，升幅約一成三，主要因發燒、暈眩、頭痛等輕微不適個案增加所致。整體救護個案仍以頭暈、腹痛、發燒、心悸、嘔吐等為主，合共六千五百○五宗，佔救護車出勤總數逾五成半。呼籲全澳居民應將救護資源留予有需要居民，切勿濫用救護服務。    巡二百六廈罰五宗    消防局一直秉持“以防為主、防消結合”工作方針，持續派員到社區樓宇防火安全排查及巡查，首季共進行二千六百九十八次巡查及排查，涉及二百六十八幢樓宇，一千七百○七戶住戶。對於屢勸不改或情況嚴重個案已完成行政處罰程序共有五宗，自新法生效至今共完成三十九宗，主要涉及在疏散通道上擺放雜物、鞋架、電單車等情況，另有五宗已開展行政處罰程序。    危品排查四千八次    危險品工作方面，首三月消防局共對各區工廈、油站、油庫、中途倉、食肆、銷售危險品相關產品的商舖、危險品及燃料儲存設施等進行四千八百○三次危險品安全排查及巡查。檢視場所或儲存區內的消防設備、儲存數量及周邊環境等，以確保危險品及燃料的儲存得到充足安全保障。期間共開展四宗行政處罰程序。消防局將持續宣教及推廣新法，並依法監管所負責的危險品種類及範圍，落實對本澳危險品的監控及預防發生嚴重意外事故。    本報記者　　王  彬　　報道,http://www.macaodaily.com/html/2024-04/11/content_1747621.htm,籲勿濫用救護服務    首三月消防局救護車出勤一萬一千七百七十四宗，較去年同期上升一千三百五十八宗，升幅約一成三，主要因發燒、暈眩、頭痛等輕微不適個案增加所致,火警 首季 二百五 宗主 因 疏忽         消防局 籲 外出 熄爐 小心 處理 火種         消防局 昨公 佈 二 ○ 二 四年 首季 工作 數據 。 消防局 教育 宣傳及 公關 處長 劉皓瑋 表示 ， 一至 三月 消防局 所有 事件 出勤 總數 為 一萬 四千 ○ 九十八 宗 ， 當中 火警 出勤 二百五十 四宗 ， 較 去年同期 上升 十四 宗 ； 其中 沒有 開喉 灌救 的 事件 二百 ○ 四宗 ， 佔 火警 出勤 總數 八成 。         疏忽 肇禍 佔 六成 半         發 佈 會 昨日 下午 三時 半 於 消防局 總部 曁 西灣 湖行動 站 舉行 。 劉皓瑋 表示 ， 火警 原因 仍以 忘 記關 爐 、 電線 短路 、 燃燒 香燭 ／ 冥鏹 、 有人 留下 火種 、 機件 ／ 設備 故障 為主 ， 合共 一百六十 七宗 ， 佔 火警 總 出勤 約 六成 半 。 因此 ， 消防局 提醒 居民 ， 外出 前應 將爐 具及 電器 關好 ， 日常生活 上應 小心 處理 煙蒂及 火種 ， 勿 讓 一時 疏忽大意 ， 引致 火警 造成 財物 損失 。         籲勿 濫用 救護 服務         首 三月 消防局 救護車 出勤 一萬 一千七百 七十四 宗 ， 較 去年同期 上升 一千三百 五十八 宗 ， 升幅 約 一成 三 ， 主要 因發燒 、 暈眩 、 頭痛 等 輕微 不 適個案 增加 所致 。 整體 救護個 案 仍 以頭暈 、 腹痛 、 發燒 、 心悸 、 嘔吐 等 為 主 ， 合共 六千五百 ○ 五宗 ， 佔 救護車 出勤 總數 逾 五成 半 。 呼籲 全澳 居民 應將 救護 資源 留予 有 需要 居民 ， 切勿 濫用 救護 服務 。         巡 二百 六廈 罰 五宗         消防局 一直 秉持 “ 以防 為主 、 防消 結合 ” 工作 方針 ， 持續 派員到 社區 樓宇 防火 安全 排查 及 巡查 ， 首季 共 進行 二千 六百 九十八 次 巡查 及 排查 ， 涉及 二百六十 八幢 樓宇 ， 一千七百 ○ 七戶 住戶 。 對 於 屢 勸 不 改 或 情況 嚴重 個案 已 完成 行政 處罰 程序 共有 五宗 ， 自 新法 生效 至今 共 完成 三十九 宗 ， 主要 涉及 在 疏散 通道 上 擺放 雜物 、 鞋架 、 電單車 等 情況 ， 另有 五宗 已 開展 行政 處罰 程序 。         危品 排查 四千 八次         危險品 工作 方面 ， 首 三月 消防局 共 對 各區 工廈 、 油站 、 油庫 、 中途 倉 、 食肆 、 銷售 危險 品相 關產品 的 商 舖 、 危險品 及 燃料 儲存 設施 等 進行 四千八百 ○ 三次 危險品 安全 排查 及 巡查 。 檢視場 所 或 儲存區 內 的 消防 設備 、 儲存 數量 及 周邊 環境 等 ， 以確 保危險品 及 燃料 的 儲存 得到 充足 安全 保障 。 期間 共 開展 四宗 行政 處罰 程序 。 消防局 將持續 宣教 及 推廣 新法 ， 並 依法 監管 所 負責 的 危險 品種 類及 範圍 ， 落實 對 本澳 危險品 的 監控及 預防 發生 嚴重 意外事故 。         本報 記者 　 　 王     彬 　 　 報道,2024-04-11
風季將至籲做好防風準備,確保窗戶招牌簷篷安全牢固    風季將至籲做好防風準備    風季將至，消防局持續積極做好各項民防工作部署，同時全力配合警察總局統籌的“颱風期間風暴潮低窪地區疏散撤離計劃”，並透過各項活動加強居民的防風抗災意識。    為提醒居民在風季來臨前及早做好應對準備，自本年二月起，在警察總局統籌下，消防局持續走訪多個坊會團體傳遞防災避險意識，同時與坊會團體舉行民防工作會議交流意見，加深坊會團體對民防計劃的了解，藉此透過團體呼籲居民踴躍參與演習，共同努力做好防災減災工作。    踴躍參民防演習    同時，消防局將參與本年四月廿七日舉辦的“水晶魚二○二四”民防演習，主要工作包括：執行“颱風期間風暴潮低窪地區疏散撤離計劃”、進行消防專項演練及協助其他部門演練等，藉此檢視及完善應急處置機制，強化與民防架構各成員間的溝通協作能力。    再次呼籲居民，因應澳門即將進入風季，居民應預早做好防風準備，並確保窗戶、招牌及簷篷等設施安全牢固。另外，在颱風或風暴潮警告期間，應密切留意電台、電視及相關部門發佈的訊息，盡量避免前往低窪地區以及地庫等低地勢設施，以免發生危險。,http://www.macaodaily.com/html/2024-04/11/content_1747622.htm,確保窗戶招牌簷篷安全牢固    風季將至籲做好防風準備    風季將至，消防局持續積極做好各項民防工作部署，同時全力配合警察總局統籌的“颱風期間風暴潮低窪地區疏散撤離計劃”，並透過各項活動加強居民的防風抗災意識,確保 窗戶 招牌 簷 篷 安全 牢固         風季 將至籲 做好 防風 準備         風季 將至 ， 消防局 持續 積極 做好 各項 民防 工作 部署 ， 同時 全力 配合 警察 總局 統籌 的 “ 颱 風期間 風暴潮 低窪 地區 疏散 撤離 計劃 ” ， 並透過 各項 活動 加強 居民 的 防風 抗災 意識 。         為 提醒 居民 在 風季來 臨前 及早 做好 應對 準備 ， 自本 年 二月 起 ， 在 警察 總局 統籌下 ， 消防局 持續 走 訪多個 坊 會 團體 傳遞 防災 避險 意識 ， 同時 與 坊 會 團體 舉行 民防 工作 會議 交流 意見 ， 加深 坊 會 團體 對 民防 計劃 的 了解 ， 藉此 透過 團體 呼籲 居民 踴躍參 與 演習 ， 共同努力 做好 防災 減災 工作 。         踴躍參 民防 演習         同時 ， 消防局 將參 與 本年 四月 廿七日 舉辦 的 “ 水晶 魚二 ○ 二四 ” 民防 演習 ， 主要 工作 包括 ： 執行 “ 颱 風期間 風暴潮 低窪 地區 疏散 撤離 計劃 ” 、 進行 消防 專項 演練 及 協助 其他 部門 演練 等 ， 藉此 檢視 及 完善 應急 處置 機制 ， 強化 與 民防 架構 各 成員間 的 溝通 協作 能力 。         再次 呼籲 居民 ， 因應 澳門 即將 進入 風季 ， 居民 應 預早 做好 防風 準備 ， 並確 保 窗戶 、 招牌 及 簷 篷 等 設施 安全 牢固 。 另外 ， 在 颱 風 或 風暴潮 警告 期間 ， 應 密切 留意 電台 、 電視及 相關 部門發 佈 的 訊息 ， 盡量 避免 前往 低窪 地區 以及 地庫 等 低 地勢 設施 ， 以免 發生 危險 。,2024-04-11
