Title,Content,Link,Summary,Preprocessed_Content,Date
吉漢刺傷美四教師被捕,公園走路擦碰拔刀行兇    吉漢刺傷美四教師被捕    【本報綜合報道】據中新社吉林十一日消息：吉林省吉林市公安局船營分局十一日發佈警情通報表示，六月十日十一時四十九分，該分局接市公安局一一○派警指令稱，吉林市船營區北山公園發生傷人案件。屬地派出所民警迅速趕到現場，第一時間將傷者送醫救治，迅速抓捕犯罪嫌疑人。    華客上前阻止受傷    經查，崔某某（男，五十五歲，吉林市龍潭區人）在北山公園走路時與一名外籍人士發生碰撞，遂持刀刺傷該外籍人士和三名同行外籍人士，以及上前阻止其行兇的一名中國籍遊客。    網上曝光的畫面顯示，有三名傷者躺在地上，現場有大量血漬，救護人員趕到現場時，傷者意識仍清晰。據《光明日報》消息，傷者包括艾奧瓦州眾議員的弟弟，犯罪嫌疑人崔某某當日被抓獲。    經了解，四名外籍人士來自美國愛荷華州康奈爾學院，受邀在北華大學授課。    中方：係偶發事件    目前，傷者均得到妥善醫治，無生命危險。    就吉林市北華大學四名外教遇襲一事，中國外交部發言人林劍十一日在例行記者會上應詢表示，據了解，六月十日上午，吉林市北華大學四名外教在吉林市北山公園遊玩時遇襲。所有傷員第一時間被送醫並得到妥善救治，均無生命危險。警方初步判斷此案係偶發事件，目前正在進一步調查中。    林劍表示，中國是世界上公認的最安全的國家之一。中方一直並將繼續採取有效措施，切實保護所有在華外國人的安全。有關偶發事件不會對中美人文交流正常開展造成影響。,http://www.macaodaily.com/html/2024-06/12/content_1761356.htm,公園走路擦碰拔刀行兇    吉漢刺傷美四教師被捕    【本報綜合報道】據中新社吉林十一日消息：吉林省吉林市公安局船營分局十一日發佈警情通報表示，六月十日十一時四十九分，該分局接市公安局一一○派警指令稱，吉林市船營區北山公園發生傷人案件,公園 走路 擦碰 拔刀 行兇         吉漢 刺傷 美四教師 被捕         【 本報 綜合 報道 】 據 中新社 吉林 十一日 消息 ： 吉林省 吉林市 公安局 船營 分局 十一日 發 佈 警情 通報 表示 ， 六月 十日 十一 時 四十九 分 ， 該 分局 接市 公安局 一一 ○ 派警 指令 稱 ， 吉林市 船營區 北山 公園 發生 傷人 案件 。 屬地 派出所 民警 迅速 趕到 現場 ， 第一 時間 將傷者 送醫 救治 ， 迅速 抓捕 犯罪 嫌疑人 。         華客 上前 阻止 受傷         經查 ， 崔 某某 （ 男 ， 五十五 歲 ， 吉林市 龍潭區 人 ） 在 北山 公園 走路 時 與 一名 外籍人士 發生 碰撞 ， 遂 持刀 刺傷 該 外籍人士 和 三名 同行 外籍人士 ， 以及 上前 阻止 其行 兇 的 一名 中國籍 遊客 。         網上 曝光 的 畫面 顯示 ， 有 三名 傷者 躺 在 地上 ， 現場 有 大量 血漬 ， 救護 人員 趕到 現場 時 ， 傷者 意識 仍 清晰 。 據 《 光明 日報 》 消息 ， 傷者 包括 艾奧瓦州 眾議員 的 弟弟 ， 犯罪 嫌疑人 崔 某某 當日 被 抓 獲 。         經 了解 ， 四名 外籍人士 來 自美國 愛荷華州 康奈爾學院 ， 受邀 在 北華大學 授課 。         中方 ： 係 偶發 事件         目前 ， 傷者 均 得到 妥善 醫治 ， 無 生命 危險 。         就 吉林市 北華大學 四名 外教 遇襲 一事 ， 中國 外交部 發言人林 劍 十一日 在 例行 記者 會 上 應詢 表示 ， 據 了解 ， 六月 十日 上午 ， 吉林市 北華大學 四名 外教 在 吉林市 北山 公園 遊玩時 遇襲 。 所有 傷員 第一 時間 被 送 醫並 得到 妥善 救治 ， 均 無 生命 危險 。 警方 初步 判斷 此案 係 偶發 事件 ， 目前 正在 進 一步 調查 中 。         林劍 表示 ， 中國 是 世界 上公認 的 最 安全 的 國家 之一 。 中方 一直 並將 繼續 採取 有效 措施 ， 切實 保護 所有 在 華外 國人 的 安全 。 有關 偶發 事件 不會 對 中美 人文 交流 正常 開展 造成 影響 。,2024-06-12
河北現大範圍高溫,河北現大範圍高溫    【本報綜合報道】據中新社石家莊十一日消息：河北省氣象局消息，六月八日以來，河北出現大範圍高溫天氣。十一日，河北部分地區達到四十一至四十二攝氏度，讚皇、正定等二十一個氣象站點突破六月中旬極值。    續發高溫紅色預警    據了解，河北此次高溫過程持續時間長，影響範圍廣，極端性強。河北省氣象台於六月九日發佈今年首個高溫紅色預警信號，十一日下午五時繼續發佈高溫紅色預警信號，未來兩天高溫天氣範圍繼續擴大，強度增強。    據河北省氣象台首席預報員李江波介紹，近期河北受高壓脊控制，暖氣團強盛，天空雲量較少，在晴空輻射增溫和下沉增溫共同作用下，促進了高溫發展。本輪高溫天氣是入夏以來河北影響範圍最廣、強度最強的高溫過程，部分地區發生中暑氣象風險高，建議公眾減少戶外活動，做好防暑降溫。    京迎雷雨大風天氣    十一日傍晚，北京迎來雷雨大風天氣。氣象部門稱，截至當日晚七時，北京平均降水量為○點六毫米，最大降水量在房山區聖蓮山，達十六毫米。    北京市氣象台於十一日先後發佈雷電黃色預警、大風黃色預警、冰雹黃色預警，預報當日下午至傍晚，北京自西向東將出現雷陣雨，並伴有八至十級短時大風和冰雹，局地短時雨強較大。    短暫雷雨大風過後，北京高溫天氣預計將持續。北京市氣象台發佈的高溫橙色預警顯示，十一日至十三日，每日下午一時至五時，北京平原地區最高氣溫預計可達三十七攝氏度以上。,http://www.macaodaily.com/html/2024-06/12/content_1761357.htm,河北省氣象台於六月九日發佈今年首個高溫紅色預警信號，十一日下午五時繼續發佈高溫紅色預警信號，未來兩天高溫天氣範圍繼續擴大，強度增強,河北 現大範圍 高溫         【 本報 綜合 報道 】 據 中新社 石家 莊 十一日 消息 ： 河北省 氣象局 消息 ， 六月 八日 以來 ， 河北 出現 大範圍 高溫 天氣 。 十一日 ， 河北 部分 地區 達 到 四十一 至 四十二 攝氏度 ， 讚 皇 、 正定 等 二十一 個 氣象 站點 突破 六月 中旬 極值 。         續 發高 溫紅色 預警         據 了解 ， 河北 此次 高溫 過程 持續 時間 長 ， 影響 範圍廣 ， 極端 性強 。 河北省 氣象 台 於 六月 九日 發 佈 今年 首個 高 溫紅色 預警 信號 ， 十一日 下午 五時 繼續 發 佈 高 溫紅色 預警 信號 ， 未來 兩天 高溫 天氣 範圍 繼續 擴大 ， 強度 增強 。         據 河北省 氣象 台 首席 預報員 李 江波 介紹 ， 近期 河北 受高壓 脊 控制 ， 暖氣團 強盛 ， 天空 雲量 較 少 ， 在 晴空 輻射 增溫 和 下沉 增溫 共同 作用 下 ， 促進 了 高溫 發展 。 本輪 高溫 天氣 是 入夏 以來 河北 影響 範圍 最廣 、 強度 最強 的 高溫 過程 ， 部分 地區 發生 中暑 氣象 風險 高 ， 建議 公眾 減少戶 外 活動 ， 做好 防暑 降溫 。         京迎 雷雨 大風 天氣         十一日 傍晚 ， 北京 迎來 雷雨 大風 天氣 。 氣象 部門稱 ， 截至 當日 晚七時 ， 北京 平均 降水量 為 ○ 點六 毫米 ， 最大 降水量 在 房山 區聖蓮山 ， 達 十六 毫米 。         北京市 氣象 台 於 十一日 先後發 佈 雷電黃色 預警 、 大風黃色 預警 、 冰雹 黃 色 預警 ， 預報 當日 下午 至 傍晚 ， 北京 自西向 東將 出現 雷陣雨 ， 並 伴有 八至 十級 短時 大風 和 冰雹 ， 局地 短時 雨強 較 大 。         短暫 雷雨 大風過 後 ， 北京 高溫 天氣 預計 將持續 。 北京市 氣象 台發 佈 的 高溫 橙色 預警 顯示 ， 十一日 至 十三日 ， 每日 下午 一時 至 五時 ， 北京 平原 地區 最高 氣溫 預計 可達 三十七 攝氏度 以上 。,2024-06-12
彩虹跑,彩虹跑    十一日，在湖北武漢，二○二四武漢歡樂谷畢業季彩虹跑開跑，近千名高中、大學應屆畢業生共慶多彩青春。（中新社）,http://www.macaodaily.com/html/2024-06/12/content_1761358.htm,彩虹跑    十一日，在湖北武漢，二○二四武漢歡樂谷畢業季彩虹跑開跑，近千名高中、大學應屆畢業生共慶多彩青春,彩虹 跑         十一日 ， 在 湖北 武漢 ， 二 ○ 二四 武漢 歡樂谷 畢業季 彩虹 跑 開 跑 ， 近千名 高中 、 大學 應屆 畢業 生共慶 多彩 青春 。 （ 中新社 ）,2024-06-12
兒慈會停活動三個月,工作人員騙患兒家長千萬救命錢    兒慈會停活動三個月    【中新社北京十一日電】六月十一日，中國民政部發佈關於中華少年兒童慈善救助基金會（下稱“兒慈會”）有關問題調查處理情況的通報。    通報稱，經查，柯某孝曾作為患兒家長接受過兒慈會救助；從二○二二年十一月起參與兒慈會九九五八（救救我吧）兒童大病緊急救助項目（以下簡稱九九五八項目）廊坊救助站相關工作。    二○二三年六月至八月，柯某孝私自以“兒慈會九九五八項目”的名義向患兒家長籌集資金，騙取患兒家長錢款近千萬元（人民幣）。二○二三年九月，因涉嫌詐騙，柯某孝被採取強制措施，目前案件已移送司法機關處理。    列入違法失信名單    通報指出，柯某孝案件暴露出兒慈會存在內部管理不規範、九九五八項目操作違規等問題。    經進一步調查，兒慈會還存在未按規定的業務範圍開展活動、未依法履行信息公開義務等違法情形。依據《中華人民共和國慈善法》、《基金會管理條例》等法律法規的有關規定，民政部已對兒慈會作出停止活動三個月的行政處罰，並將其列入社會組織嚴重違法失信名單。    項目負責人涉犯罪    通報稱，兒慈會相關負責人履職不力、失職失責，民政部已責令兒慈會按程序罷免相關負責人職務，並依規依紀對有關黨員失職失責問題展開立案審查。    兒慈會副秘書長、九九五八項目負責人王某涉嫌職務犯罪，經有關監察機關立案調查已移送司法機關處理。    通報表示，兒慈會停止活動期間，民政部派出工作組採取有力措施，切實維護當前正在接受兒慈會救助的患兒的合法權益。    兒慈會官方網站顯示，該基金會成立於二○一○年一月十二日，由中國民政部主管，對困境兒童、事實無人撫養兒童、年滿十八歲仍在全日制學校就讀的困難學生、留守兒童、流浪兒童等處於困境或者有特殊困難的少年兒童開展幫扶活動。,http://www.macaodaily.com/html/2024-06/12/content_1761359.htm,工作人員騙患兒家長千萬救命錢    兒慈會停活動三個月    【中新社北京十一日電】六月十一日，中國民政部發佈關於中華少年兒童慈善救助基金會（下稱“兒慈會”）有關問題調查處理情況的通報,工作 人員騙 患兒 家長 千萬 救命 錢         兒慈會 停 活動 三個 月         【 中新社 北京 十一日 電 】 六月 十一日 ， 中國 民政部 發 佈 關於中華 少年 兒童 慈善 救助 基金 會 （ 下稱 “ 兒慈會 ” ） 有關 問題 調查 處理 情況 的 通報 。         通報 稱 ， 經查 ， 柯某 孝 曾 作為 患兒 家長 接受 過兒 慈會 救助 ； 從 二 ○ 二 二年 十一月 起 參與兒 慈會 九 九五 八 （ 救救 我 吧 ） 兒童 大病 緊急 救助 項目 （ 以下 簡稱 九 九五 八項 目 ） 廊坊 救助站 相關 工作 。         二 ○ 二三年 六月 至 八月 ， 柯某 孝 私自 以 “ 兒慈會 九 九五 八項 目 ” 的 名義向 患兒 家長 籌集 資金 ， 騙取 患兒 家長 錢款 近千萬元 （ 人民 幣 ） 。 二 ○ 二三年 九月 ， 因涉嫌 詐騙 ， 柯某 孝 被 採取 強制 措施 ， 目前 案件 已 移送 司法 機關 處理 。         列入 違法 失信 名單         通報 指出 ， 柯某 孝 案件 暴露出 兒慈會 存在 內部 管理 不規範 、 九 九五 八項 目 操作 違規 等 問題 。         經進 一步 調查 ， 兒 慈會還 存在 未 按 規定 的 業務範圍 開展 活動 、 未 依法 履行 信息 公開義務 等 違法 情形 。 依據 《 中華 人民 共和 國 慈善 法 》 、 《 基金 會 管理 條例 》 等 法律 法規 的 有 關規定 ， 民政部 已 對兒 慈會 作出 停止 活動 三個 月 的 行政 處罰 ， 並將 其 列入 社會 組織 嚴重 違法 失信 名單 。         項目 負責 人涉 犯罪         通報 稱 ， 兒慈會 相關 負責人 履職 不力 、 失職 失責 ， 民政部 已責令兒 慈會 按程序 罷免 相關 負責人 職務 ， 並依規 依紀 對 有 關黨員 失職 失責 問題 展開 立案 審查 。         兒慈會 副 秘書長 、 九 九五 八項 目負 責人王 某 涉嫌 職務 犯罪 ， 經有關 監察機關 立案 調查 已 移送 司法 機關 處理 。         通報 表示 ， 兒慈會 停止 活動 期間 ， 民政部 派出 工作 組採取 有力 措施 ， 切實 維護 當前 正在 接受 兒慈會 救助 的 患兒 的 合法 權益 。         兒慈會 官方 網站 顯示 ， 該 基金 會 成立 於 二 ○ 一 ○ 年 一月 十二日 ， 由 中國 民政部 主管 ， 對 困境 兒童 、 事實 無人 撫養 兒童 、 年 滿 十八 歲 仍 在 全日制 學校 就 讀 的 困難 學生 、 留守 兒童 、 流浪 兒童 等 處 於 困境 或者 有 特殊 困難 的 少年 兒童 開展 幫 扶 活動 。,2024-06-12
內地端午假逾六億人出行,內地端午假逾六億人出行    【本報綜合報道】據中新社北京十一日消息：中國交通運輸部十一日消息，今年六月八日至十日（端午節假期期間），全社會跨區域人員流動量六億三千七百六十一點六萬人次，日均二億一千二百五十三點九萬人次，同比（二○二三年端午節假期期間，下同）增長百分之九點四。    具體來看，鐵路發送旅客四千六百○四點七萬人次，日均一千五百三十四點九萬人次，同比增長百分之五點一。水路發送旅客二百九十二點九萬人次，日均九十七點六萬人次，同比增長百分之四點四。民航發送旅客五百五十三萬人次，日均一百八十四點三萬人次，同比增長百分之七點九。    公路人員流動量五億八千三百一十一萬人次，日均一億九千四百三十七萬人次，同比增長百分之九點五。其中高速公路及普通國省道非營業性小客車人員出行量四億七千五百二十三萬人次，日均一億五千八百四十一萬人次，同比增長百分之七點二。公路營業性客運量一億○七百八十八萬人次，日均三千五百九十六萬人次，同比增長百分之二十一點三。    五百七萬人出入境    另據中國國家移民管理局十一日通報，今年端午節假期期間全國邊檢機關共計保障五百七十五點二萬人次中外人員出入境，日均一百九十一點七萬人次，較去年同期增長百分之四十五點一，單日出入境通關最高峰出現在六月八日，達一百九十七點六萬人次。    其中，內地居民出入境二百四十六萬人次，較去年同期增長百分之二十五點四；港澳台居民二百七十七點九萬人次，較去年同期增長百分之六十六點一；外國人五十點七萬人次，較去年同期增長百分之五十七。    端午節假期期間，全國邊檢機關共計查驗出入境交通運輸工具二十三點八萬架（艘、列、輛）次，較去年同期增長百分之三十五點二。,http://www.macaodaily.com/html/2024-06/12/content_1761360.htm,內地端午假逾六億人出行    【本報綜合報道】據中新社北京十一日消息：中國交通運輸部十一日消息，今年六月八日至十日（端午節假期期間），全社會跨區域人員流動量六億三千七百六十一點六萬人次，日均二億一千二百五十三點九萬人次，同比（二○二三年端午節假期期間，下同）增長百分之九點四,內地 端午 假逾六 億人 出行         【 本報 綜合 報道 】 據 中新社 北京 十一日 消息 ： 中國 交通 運輸部 十一日 消息 ， 今年 六月 八日 至 十日 （ 端午 節 假期 期間 ） ， 全社 會 跨區域 人員 流動量 六 億 三千七百 六十一 點六萬 人次 ， 日均 二億 一千二百 五十三 點九萬 人次 ， 同比 （ 二 ○ 二三年 端午 節 假期 期間 ， 下同 ） 增長 百分之九 點四 。         具體 來 看 ， 鐵路 發送 旅客 四千 六百 ○ 四點 七萬 人次 ， 日均 一千五百 三十四 點九萬 人次 ， 同比 增長 百分之五 點一 。 水路 發送 旅客 二百 九 十二 點九萬 人次 ， 日均 九十七 點六萬 人次 ， 同比 增長 百分之四 點四 。 民航 發送 旅客 五百 五十三 萬 人次 ， 日均 一百八十 四點 三萬 人次 ， 同比 增長 百分之七 點九 。         公路 人員 流動量 五 億 八千 三百 一 十一 萬 人次 ， 日均 一億 九千 四百 三十七 萬 人次 ， 同比 增長 百分之九 點五 。 其中 高速公路 及 普通 國省 道 非營業 性小客 車人員 出行 量 四 億 七千五百 二十三 萬 人次 ， 日均 一億 五千 八百 四十一 萬 人次 ， 同比 增長 百分之七 點二 。 公路 營業性 客運量 一 億 ○ 七百 八十八 萬 人次 ， 日均 三千五百九十 六萬 人次 ， 同比 增長 百分之二十 一點 三 。         五百 七萬人 出入境         另據 中國國家 移民 管理局 十一日 通報 ， 今年 端午 節 假期 期間 全國邊 檢機 關共計 保障 五百 七十五 點二萬 人次 中外 人員 出入境 ， 日均 一百九十 一點 七萬 人次 ， 較 去年同期 增長 百分之四十 五點 一 ， 單日 出入境 通關 最高峰 出現 在 六月 八日 ， 達 一百九十 七點 六萬 人次 。         其中 ， 內地 居民 出入境 二 百四十六 萬 人次 ， 較 去年同期 增長 百分之二十五 點四 ； 港澳台 居民 二百七十 七點 九萬 人次 ， 較 去年同期 增長 百分之六十六 點一 ； 外國人 五十 點七萬 人次 ， 較 去年同期 增長 百分之五十 七 。         端午 節 假期 期間 ， 全國邊 檢機 關共計 查驗 出入境 交通 運輸 工具 二十三 點八萬架 （ 艘 、 列 、 輛 ） 次 ， 較 去年同期 增長 百分之三十五 點二 。,2024-06-12
難民船也門近海傾覆四十九死,難民船也門近海傾覆四十九死    【本報綜合報道】據新華社、央視新聞、美聯社、路透社十一日消息：聯合國國際移民組織六月十一日表示，一艘載有移民的船隻在也門海岸沉沒，造成至少四十九人死亡、一百四十人失蹤。    遭遇大風沉沒    沙特阿拉伯《阿拉伯新聞》網站以一名不願公開姓名的也門籍援助人員為訊息源報道，這艘偷渡船遭遇大風，十日上午在距離亞丁以東的舍卜沃省海岸大約兩海里（約三點七公里）的海域沉沒。    國際移民組織說，這艘船於當地時間九日凌晨從索馬里出發。船上有一百一十五名索馬里公民和一百四十五名埃塞俄比亞公民。這艘船於十日在也門南部舍卜沃省附近海域傾覆。目前已有七十一人獲救，另有一百四十人下落不明。    百四人仍失蹤    聲明稱，搜尋工作仍在繼續，目前已有七十一人獲救，仍有一百四十人失蹤。報告稱，死者中有卅一名婦女和六名兒童。    也門是東非和非洲之角移民前往海灣國家工作的主要路線。國際移民組織上個月表示，儘管也門經歷了近十年的內戰，但從二○二一至二○二三年，每年抵達的移民人數增加了兩倍，從約兩萬七千人飆升至九萬多人。據該機構稱，目前也門約有卅八萬移民。為了到達也門，移民被走私者乘坐往往危險且過度擁擠的船隻穿越紅海或亞丁灣。    今年四月，在吉布提海岸試圖抵達也門的兩艘沉船中，至少有六十二人死亡。國際移民組織表示，沿途至少有一千八百六十人死亡或失蹤，其中四百八十人溺水身亡。    移民問題緊迫    國際移民組織發言人穆阿布納杰拉表示，六月十日的沉沒事件“再次提醒人們，迫切需要共同努力應對緊迫的移民挑戰，並確保移民沿途的安全”。,http://www.macaodaily.com/html/2024-06/12/content_1761312.htm,難民船也門近海傾覆四十九死    【本報綜合報道】據新華社、央視新聞、美聯社、路透社十一日消息：聯合國國際移民組織六月十一日表示，一艘載有移民的船隻在也門海岸沉沒，造成至少四十九人死亡、一百四十人失蹤,難 民船 也門 近海 傾覆 四十九 死         【 本報 綜合 報道 】 據 新華社 、 央視 新聞 、 美聯社 、 路透社 十一日 消息 ： 聯合國 國際 移民 組織 六月 十一日 表示 ， 一艘 載有 移民 的 船 隻 在 也門 海岸 沉沒 ， 造成 至少 四十九 人 死亡 、 一百四十 人 失 蹤 。         遭遇 大風沉 沒         沙特阿拉伯 《 阿拉伯 新聞 》 網站 以 一名 不願 公開 姓名 的 也 門籍 援助 人員為 訊息源 報道 ， 這艘 偷渡 船 遭遇 大風 ， 十日 上午 在 距 離亞丁 以東 的 舍卜沃省 海岸 大約 兩 海里 （ 約 三點 七 公里 ） 的 海域 沉沒 。         國際 移民 組織 說 ， 這艘 船 於 當地 時間 九日 凌晨 從索馬里 出發 。 船上 有 一百一十 五名 索馬里 公民 和 一百四十 五名 埃塞 俄比亞 公民 。 這艘 船 於 十日 在 也門 南部 舍卜沃省 附近 海域 傾覆 。 目前 已有 七十一 人 獲救 ， 另有 一百四十 人 下落不明 。         百四人 仍 失 蹤         聲明稱 ， 搜尋 工作 仍 在 繼續 ， 目前 已有 七十一 人 獲救 ， 仍 有 一百四十 人 失 蹤 。 報告 稱 ， 死者 中有 卅 一名 婦女 和 六名 兒童 。         也門 是 東非 和 非洲之角 移民 前往 海灣國家 工作 的 主要 路線 。 國際 移民 組織 上個 月 表示 ， 儘 管 也 門 經 歷 了 近十年 的 內戰 ， 但 從 二 ○ 二一至 二 ○ 二三年 ， 每年 抵達 的 移民 人數 增加 了 兩倍 ， 從 約 兩萬 七千 人飆 升至 九萬多 人 。 據 該 機構 稱 ， 目前 也 門約 有卅八萬 移民 。 為 了 到 達 也門 ， 移民 被 走私者 乘坐 往往 危險且 過度 擁擠 的 船 隻 穿越 紅海 或 亞丁灣 。         今年 四月 ， 在 吉布提 海岸 試圖 抵達 也門 的 兩艘 沉船 中 ， 至少 有 六十二 人 死亡 。 國際 移民 組織 表示 ， 沿途 至少 有 一千八百 六十 人 死亡 或 失 蹤 ， 其中 四百八十 人 溺水 身亡 。         移民 問題 緊迫         國際 移民 組織 發言人穆 阿布納 杰拉 表示 ， 六月 十日 的 沉 沒 事件 “ 再次 提醒 人們 ， 迫切需要 共同努力 應對 緊迫 的 移民 挑戰 ， 並確 保 移民 沿途 的 安全 ” 。,2024-06-12
