Title,Content,Link,Summary,Preprocessed_Content,Date
下環坊會促完善媽閣交通,下環坊會促完善媽閣交通    下環坊眾醒獅賀新歲活動昨日上午十時在會址前舉行。坊會會長張麗珍表示，藉此為區內增添歡樂氣氛，向商戶及街坊拜年，廣泛凝聚街坊，致力促進睦鄰互助。    中聯辦社工部社區工作處四級調研員胡碩，街總理事長陳家良，議員何潤生、葉兆佳、梁鴻細，多個政府部門代表，坊會理事長張振鴻、監事長鍾兆泉等出席。    張麗珍稱，隨着媽閣交通樞紐開通，新春期間大量旅客進駐下環區觀光消費，帶來不少生氣。促請政府積極推動媽閣片區活化計劃，刺激區內經濟發展，期望積極完善區內交通問題。至今，內港南雨水泵站及下水道工程完成一半以上，冀有關方面如期竣工。    坊會將繼續舉辦“下環巡禮”活動，更好宣傳下環美食及世遺景點等，希望吸引更多旅客進入下環區，帶旺區內經濟。開幕式後，嘉賓轉往媽閣廟上香，醒獅隊兵分兩路在區內巡遊採青，沿途向商戶和居民拜年。,http://www.macaodaily.com/html/2024-02/25/content_1737170.htm,坊會將繼續舉辦“下環巡禮”活動，更好宣傳下環美食及世遺景點等，希望吸引更多旅客進入下環區，帶旺區內經濟,下環坊 會促 完善 媽閣 交通         下環坊 眾醒 獅賀 新歲 活動 昨日 上午 十時 在 會址 前 舉行 。 坊 會會長 張麗珍 表示 ， 藉此 為區 內 增添 歡樂氣氛 ， 向 商戶 及 街坊 拜年 ， 廣泛 凝聚 街坊 ， 致力 促進 睦 鄰 互助 。         中聯 辦社 工部 社區 工作 處四級 調 研員 胡碩 ， 街 總 理事 長 陳 家良 ， 議員 何潤生 、 葉兆佳 、 梁鴻細 ， 多個 政府 部門 代表 ， 坊 會 理事 長 張振鴻 、 監事長 鍾 兆 泉 等 出席 。         張麗珍 稱 ， 隨着 媽閣 交通 樞紐 開通 ， 新春 期間 大量 旅客 進駐 下 環區 觀光 消費 ， 帶來 不少 生氣 。 促請 政府 積極 推動 媽閣 片區 活化 計劃 ， 刺激 區內 經濟 發展 ， 期望 積極 完善 區內 交通 問題 。 至今 ， 內港南 雨水 泵站 及 下水道 工程 完成 一半 以上 ， 冀有關 方面 如期 竣工 。         坊 會 將繼續 舉辦 “ 下環 巡禮 ” 活動 ， 更好 宣傳 下環 美食 及世 遺景點 等 ， 希望 吸引 更 多 旅客 進入 下 環區 ， 帶旺區 內 經濟 。 開幕式 後 ， 嘉賓 轉往 媽閣 廟 上 香 ， 醒 獅隊 兵分 兩路 在 區內 巡遊 採青 ， 沿途 向 商戶 和 居民 拜年 。,2024-02-25
大三巴哪吒廟新春祈福,大三巴哪吒廟新春祈福    昨日元宵佳節，大三巴哪吒廟值理會上午十時在廟前舉行新春祈福活動。值理會會長葉達稱，祈願甲辰龍年百業興旺，廣大居民龍馬精神，安居樂業，事事順利。新的一年，將如常推出各項活動，達至神人同樂。    中聯辦協調部二級巡視員布志光，文遺委員陸南德，有巢氏廟代表黃淑芬等出席。該廟值理會副會長李家寶、李耀光，理事長楊國雄，副理事長鄧錦泉、伍麗卿、郭凱琳、羅海驅、李錦榮、李順祥、李富華，監事長黎順華以及副監事長曾瑞娟、郭炳浩等出席，互動氣氛熱烈。    活動獲文化發展基金支持。儀式後，一眾負責人及善信有序進廟參拜，祈求哪吒三太子福佑小城，澳門社區及經濟繼續蓬勃發展。,http://www.macaodaily.com/html/2024-02/25/content_1737171.htm,該廟值理會副會長李家寶、李耀光，理事長楊國雄，副理事長鄧錦泉、伍麗卿、郭凱琳、羅海驅、李錦榮、李順祥、李富華，監事長黎順華以及副監事長曾瑞娟、郭炳浩等出席，互動氣氛熱烈,大三巴 哪吒 廟 新春 祈福         昨日 元宵 佳節 ， 大三巴 哪吒 廟值 理會 上午 十時 在 廟 前 舉行 新春 祈福 活動 。 值理會 會長 葉達稱 ， 祈願 甲辰 龍年 百業 興旺 ， 廣大 居民 龍馬 精神 ， 安居 樂業 ， 事事 順利 。 新 的 一年 ， 將 如常 推出 各項 活動 ， 達至 神人 同樂 。         中聯辦 協調 部二級 巡視員布志光 ， 文遺委員陸 南德 ， 有巢氏 廟 代表 黃 淑芬 等 出席 。 該廟 值理會 副 會長 李家 寶 、 李耀光 ， 理事 長 楊國雄 ， 副 理事 長 鄧錦泉 、 伍麗卿 、 郭凱琳 、 羅 海驅 、 李錦榮 、 李順祥 、 李富華 ， 監事長 黎順華 以及 副 監事長 曾瑞娟 、 郭炳浩 等 出席 ， 互動 氣氛 熱烈 。         活動 獲 文化 發展 基金 支持 。 儀式 後 ， 一眾 負責人 及 善信 有序 進廟 參拜 ， 祈求 哪吒 三太子 福佑 小城 ， 澳門 社區 及 經濟 繼續 蓬勃 發展 。,2024-02-25
工聯北綜探訪長者送暖,工聯北綜探訪長者送暖    工聯北區綜合服務中心過年前組織青年義工，前往長者家中探訪，送上問候和節日祝福，並協助大掃除，持續為社區長者送上慰問和關懷。    青年義工黃同學表示，第一次參加這樣的活動，通過與長者交流，不僅了解她們的過去，也能夠提供實際的支援。    工聯北綜青年部社工鄭冠南表示，探訪活動不僅讓長者感受社會的關懷，也鼓勵更多青年主動關心他人、服務社會，傳承尊老敬老的美德。中心設有多支義工隊伍，包括婦女、親子及青年義工等，定期提供義工基礎培訓、專項培訓和實踐活動等，旨在培養義工的服務技巧，提升對社區的歸屬感，並為持續為社區注入義工的助人動力。如對中心義工服務有興趣，可致電二八四七 · ○七八九查詢。,http://www.macaodaily.com/html/2024-02/25/content_1737173.htm,工聯北綜探訪長者送暖    工聯北區綜合服務中心過年前組織青年義工，前往長者家中探訪，送上問候和節日祝福，並協助大掃除，持續為社區長者送上慰問和關懷,工聯北 綜探 訪長 者 送暖         工聯北區 綜合 服務 中心 過 年前 組織 青年 義工 ， 前往 長 者 家中 探訪 ， 送上 問候 和 節日 祝福 ， 並協助 大掃除 ， 持續 為 社區長 者 送 上 慰問 和 關懷 。         青年 義工 黃 同學 表示 ， 第一次 參加 這樣 的 活動 ， 通過 與 長 者 交流 ， 不僅 了解 她 們 的 過去 ， 也 能夠 提供 實際 的 支援 。         工聯北 綜 青年 部 社工 鄭冠南 表示 ， 探訪 活動 不僅 讓 長 者 感受 社會 的 關懷 ， 也 鼓勵 更 多 青年 主動 關心 他人 、 服務 社會 ， 傳承 尊老敬老 的 美德 。 中心 設有 多支 義工 隊伍 ， 包括 婦女 、 親子 及 青年 義工 等 ， 定期 提供 義工 基礎 培訓 、 專項 培訓 和 實踐 活動 等 ， 旨在 培養 義工 的 服務 技巧 ， 提升 對 社區 的 歸 屬感 ， 並為 持續 為 社區 注入 義工 的 助人 動力 。 如對 中心 義工 服務有 興趣 ， 可致電 二八 四七   ·   ○ 七八 九查詢 。,2024-02-25
貨運業冀推措施助發展,訪經科局反映營運維修壓力    貨運業冀推措施助發展    【本報消息】澳門貨車運輸業互助會與澳門重型車司機職工會，日前在澳門工會聯合總會副會長馮家輝帶領下，一行九人拜訪經濟及科技發展局，獲副局長陳子慧等接待，雙方就澳門貨運業運作情況與成本壓力等問題交流意見。    成本油價升壓力大    貨車運輸業互助會會長湯澤森、理事長鄺熾明與重型車司機職工會理事長蔡文陽、副理事長陳漢標等感謝經科局多年來對本澳貨運行業的支持，並分別介紹行業現時面對的困難。近年社會對環保意識提升，為配合尾氣排放標準要求，近期本澳柴油貨車維修成本，部分零件需從海外訂購。隨着疫後經濟復甦，海外零件的來貨價格以及運費亦隨之提升，貨運業面臨經營成本和油價壓力，工友的收入亦受影響，期望局方推出措施紓緩業界壓力。    澳中小企可申援助    對外貿易及經濟合作廳長林凱健表示因應《澳門特別行政區公共財政資助制度》的生效，工商業發展基金的職責亦作出相應調整，現時主要負責推動中小企、社區經濟、科技創新等涉及特區政府“1+4”適度多元發展策略的產業發展，並介紹工商發展基金會運作情況，基金的資助計劃均受公共資產監督管理局監管，規範資助項目的使用。基金現時的資助計劃包括：工商企業服務及推廣中心資助計劃，以及促進產業發展及科技創新資助計劃。陳子慧表示，澳門經濟處於復甦階段，如業界工友有需要購買新車輛，可透過中小企業援助計劃申請貸款。    馮家輝表示，明白特區政府各部門職能調整，現時本澳經濟處於復甦階段，運輸行業工友面臨經營壓力，期望局方可以適時推出合適措施協助業界。    出席會議的還包括：經濟及科技發展局對外貿易處長羅芷敏、高級技術員鄧詠恩；澳門貨車運輸業互助會副理事長馮甜棠；澳門重型車司機職工會副理事長孔偉明；澳門交通運輸業總工會辦公室主任許育勝、秘書趙公允。,http://www.macaodaily.com/html/2024-02/25/content_1737172.htm,訪經科局反映營運維修壓力    貨運業冀推措施助發展    【本報消息】澳門貨車運輸業互助會與澳門重型車司機職工會，日前在澳門工會聯合總會副會長馮家輝帶領下，一行九人拜訪經濟及科技發展局，獲副局長陳子慧等接待，雙方就澳門貨運業運作情況與成本壓力等問題交流意見,訪經 科局 反映 營運維修 壓力         貨運業 冀 推 措施 助發展         【 本報 消息 】 澳門 貨車 運輸業 互助 會 與 澳門 重型 車司 機職 工會 ， 日前 在 澳門 工會 聯合 總會 副 會長 馮家輝 帶 領下 ， 一行 九人 拜訪 經濟 及 科技 發展局 ， 獲副局 長 陳 子慧 等 接待 ， 雙方 就 澳門 貨運業 運作 情況 與 成本 壓力 等 問題 交流 意見 。         成本 油價升 壓力 大         貨車 運輸業 互助 會會長 湯澤森 、 理事 長 鄺熾明 與 重型 車司 機職 工會 理事 長 蔡文陽 、 副 理事 長 陳 漢標 等 感謝經 科局 多年 來 對 本 澳貨 運行業 的 支持 ， 並分別 介紹 行業現 時面 對 的 困難 。 近年 社會 對 環保意識 提升 ， 為 配合 尾氣 排放 標準 要求 ， 近期 本澳 柴油 貨車 維修 成本 ， 部分 零件 需從 海外 訂購 。 隨着 疫後經濟 復 甦 ， 海外 零件 的 來 貨價格 以及 運費 亦 隨之 提升 ， 貨運業 面臨 經營 成本 和 油價 壓力 ， 工友 的 收入 亦 受 影響 ， 期望 局方 推出 措施 紓 緩業界 壓力 。         澳 中小 企可申 援助         對外 貿易 及 經濟 合作 廳長 林凱健 表示 因應 《 澳門 特別 行政 區 公共 財政資助 制度 》 的 生效 ， 工商 業發展 基金 的 職責 亦 作出 相應 調整 ， 現時 主要 負責 推動 中小 企 、 社區 經濟 、 科技 創新 等 涉及 特區 政府 “ 1 + 4 ” 適度 多元 發展 策略 的 產業 發展 ， 並介紹 工商 發展 基金 會運作 情況 ， 基金 的 資助 計劃 均 受 公共 資產 監督 管理局 監管 ， 規範資助 項 目的 使用 。 基金 現時 的 資助 計劃 包括 ： 工商 企業 服務及 推廣 中心 資助 計劃 ， 以及 促進 產業 發展 及 科技 創新 資助 計劃 。 陳 子慧 表示 ， 澳門 經濟處 於 復 甦 階段 ， 如業界 工友 有 需要 購買 新車輛 ， 可透過 中小 企業 援助 計劃 申請 貸款 。         馮家輝 表示 ， 明白 特區 政府 各部 門職 能 調整 ， 現時本 澳經濟 處 於 復 甦 階段 ， 運輸 行業 工友 面臨 經營 壓力 ， 期望 局方 可以 適時 推出 合適 措施 協助業界 。         出席 會議 的還 包括 ： 經濟 及 科技 發展局 對 外貿易 處長 羅 芷敏 、 高級 技術員 鄧詠 恩 ； 澳門 貨車 運輸業 互助 會 副 理事 長 馮甜棠 ； 澳門 重型 車司 機職 工會 副 理事 長 孔偉明 ； 澳門 交通 運輸業 總工會 辦公 室主任 許育勝 、 秘書 趙 公允 。,2024-02-25
(新聞小語)加快基建跟上A區公共配套    夏耘,加快基建跟上A區公共配套    從申報到審批，從構思到落實，從填海到平整，從施工到一幢幢建築物拔地而起，一點三八平方公里的新城A區從無到有。由水塘至黑沙環新填海區一帶眺望，A區大工地如火如荼，新城漸見雛形。    這個規劃居住近十萬人的新城，將建二萬八千個公屋單位，首批於一九年開放申請的三個地段經屋項目料今年內先後落成，最快明年派匙，三千多戶經屋家團將成為A區的第一批住戶。行政長官早前透過批示，公佈了A區經屋的售價，並於春節假期實地視察，囑咐各單位對用料、施工質量及驗收過程嚴格把關，政府部門亦要做好居民入住前的配套工作。    A區至今仍是個大地盤，共同管道、區內道路、其餘公屋等各項基建仍陸續施工，更重要的是A區接連澳門半島的行人與行車通道仍處於施工及規劃階段，A 區連接至近黑沙環污水廠的A2連接橋工程，預計今年十月完工；A區至外港碼頭一帶的A3行車天橋則仍未動工，預計二八年才完成。坊間有意見擔憂，若明年派匙上樓，時間會否過於倉猝？    時間軸拉回到一四年五月。當年同樣是新闢公屋群的石排灣公屋群入伙時，區內交通、醫療及生活配套設施均未能跟上。如衛生站沒有晚間、周六、日的急診或門診服務，區內學校建設仍在進行，超級市場稀少及公共運輸不足，令區內居民深感不便。社會意見認為，石排灣經屋初期的高空置率，關鍵在於區內配套不完善。    與石排灣不同的是，A區的基建乃全新概念，採用共同管道，即使首批公屋住宅單位落成，深埋在地下的共同管道工程能否如期配合？再者，A區的污水系統將由新建於港珠澳大橋澳門口岸人工島的污水處理廠承擔，A區亦將接駁中水。中水站同樣位於人工島，相關基建能否趕及完成，應付居民入住需求？目前A區唯一已落成的公共設施僅B6地段的公共大樓，僅得街市、熟食中心、社區服務及活動中心、公共停車場等，居民需要的學校村、體育用地、衛生中心等各項設施進度表又如何？凡此種種，均要及早部署，以免A區更遜於當年的石排灣，甚至淪為“孤島”。    夏耘,http://www.macaodaily.com/html/2024-02/25/content_1737174.htm,A區至今仍是個大地盤，共同管道、區內道路、其餘公屋等各項基建仍陸續施工，更重要的是A區接連澳門半島的行人與行車通道仍處於施工及規劃階段，A 區連接至近黑沙環污水廠的A2連接橋工程，預計今年十月完工,加快 基建 跟上 A 區 公共 配套         從 申報 到 審批 ， 從構 思到 落實 ， 從 填海 到 平整 ， 從 施工 到 一幢幢 建築物 拔地而起 ， 一點 三八 平方公里 的 新城 A 區從 無到 有 。 由 水塘 至 黑沙 環新 填海 區一帶 眺望 ， A 區大 工地 如火如荼 ， 新城 漸見 雛形 。         這個 規劃 居住 近十萬人 的 新城 ， 將建二萬 八千 個 公屋 單位 ， 首批 於 一 九年 開放 申請 的 三個 地段 經屋 項 目料 今年 內先 後 落成 ， 最快 明年 派匙 ， 三千多 戶經 屋家團 將成 為 A 區的 第一批 住戶 。 行政 長 官 早前 透過 批示 ， 公 佈 了 A 區經屋 的 售價 ， 並於春節 假期 實地 視察 ， 囑咐 各 單位 對 用料 、 施工 質量 及驗 收過程 嚴格 把關 ， 政府 部門 亦 要 做好 居民 入住 前 的 配套 工作 。         A 區 至今 仍 是 個 大地 盤 ， 共同 管道 、 區內 道路 、 其餘 公屋 等 各項 基建 仍陸續 施工 ， 更 重要 的 是 A 區接 連澳門 半島 的 行人 與 行車 通道 仍處 於 施工 及 規劃 階段 ， A   區連接 至 近 黑沙 環 污水 廠 的 A2 連接橋 工程 ， 預計 今年 十月 完工 ； A 區至 外港 碼頭 一帶 的 A3 行車 天橋則 仍 未動工 ， 預計 二 八年 才 完成 。 坊 間 有意 見 擔憂 ， 若 明年 派匙 上樓 ， 時間 會 否過 於 倉猝 ？         時間 軸拉 回到 一 四年 五月 。 當年 同樣 是 新闢 公屋 群 的 石 排灣 公屋 群 入伙 時 ， 區內 交通 、 醫療 及 生活 配套 設施 均 未能 跟上 。 如衛生 站 沒 有 晚間 、 周六 、 日 的 急診 或門診 服務 ， 區內 學校 建設 仍 在 進行 ， 超級 市場 稀少 及 公共 運輸 不足 ， 令區 內 居民 深感不便 。 社會 意見 認為 ， 石排灣 經屋 初期 的 高 空置率 ， 關鍵 在 於 區內 配套 不 完善 。         與 石 排灣 不同 的 是 ， A 區的 基建 乃 全新 概念 ， 採用 共同 管道 ， 即使 首批 公屋 住宅 單位 落成 ， 深埋在 地下 的 共同 管道工程 能否 如期 配合 ？ 再者 ， A 區的 污水 系統將 由 新建 於 港珠 澳大橋 澳門 口岸 人工 島的 污水 處理廠 承擔 ， A 區亦將 接駁 中水 。 中水站 同樣 位 於 人工 島 ， 相關 基建 能否 趕及 完成 ， 應付 居民 入住 需求 ？ 目前 A 區 唯一 已 落成 的 公共 設施僅 B6 地段 的 公共 大樓 ， 僅得 街市 、 熟食 中心 、 社區 服務及 活動 中心 、 公共 停車場 等 ， 居民 需要 的 學校 村 、 體育 用地 、 衛生 中心 等 各項 設施 進度表 又 如何 ？ 凡此 種種 ， 均 要 及早 部署 ， 以免 A 區更遜 於 當年 的 石 排灣 ， 甚至 淪為 “ 孤島 ” 。         夏耘,2024-02-25
今多雲有陽光,今多雲有陽光    【本報消息】氣象局預測今日天色多雲，短暫時間有陽光。    氣象局預測今日氣溫介乎攝氏十四至廿一度，相對濕度百分之五十五至八十五，吹三至四級北至東北風，最高紫外線指數約為八，級別屬於高。空氣質量方面，路邊及一般性監測站指數五十至七十，水平良好至普通，高密度住宅區六十至八十，水平普通。    本澳昨日大致多雲，氣溫介乎攝氏十四至二十度，相對濕度百分之六十三至八十三，吹三至四級北至東北風。    展望明日氣溫，介乎攝氏十六至二十度，相對濕度百分之六十五至九十，大致多雲，吹三至四級東至東北風，間中五級及有陣風。,http://www.macaodaily.com/html/2024-02/25/content_1737175.htm,氣象局預測今日氣溫介乎攝氏十四至廿一度，相對濕度百分之五十五至八十五，吹三至四級北至東北風，最高紫外線指數約為八，級別屬於高,今多雲有 陽光         【 本報 消息 】 氣象局 預測 今日 天色 多 雲 ， 短暫 時間 有陽光 。         氣象局 預測 今日 氣溫 介乎 攝氏 十四 至 廿 一度 ， 相對 濕度 百分之五十 五至 八十五 ， 吹三至 四級 北至 東北風 ， 最高 紫外 線 指數 約 為 八 ， 級 別屬 於 高 。 空氣 質量 方面 ， 路邊 及 一般性 監測 站 指數 五十 至 七十 ， 水平 良好 至 普通 ， 高密度 住宅 區 六十 至 八十 ， 水平 普通 。         本澳 昨日 大致 多 雲 ， 氣溫 介乎 攝氏 十四 至 二十度 ， 相對 濕度 百分之六十 三至 八十三 ， 吹三至 四級 北至 東北風 。         展望 明日 氣溫 ， 介乎 攝氏 十六 至 二十度 ， 相對 濕度 百分之六十五 至 九十 ， 大致 多 雲 ， 吹三至 四級 東至 東北風 ， 間 中五級 及 有 陣風 。,2024-02-25
