Title,Content,Link,Summary,Preprocessed_Content,Date
深合區：琴澳多次往返簽註將有消息,深合區：琴澳多次往返簽註將有消息    【本報消息】年初特區政府透露，正與中央商討能否讓旅行團在橫琴住宿，以及橫琴與澳門多次往返證件簽註的問題。在昨日舉行的旅博會新聞發佈會上，橫琴粵澳深合區經濟發展局副局長黃中堅表示，有關政策的推進工作受到國家部委、澳門特區政府、廣東省和深合區執委會的重視。國家部委更在今年三月到橫琴調研，並提供前期成果材料。由於政策需得到國家部委認可及正式通知，故深合區現正按要求積極配合製作方案，“應該好快有消息”。    他稱，有關政策的推行涉及較多細節內容，包括通關設施的保障、琴澳兩地酒店市場需求、旅客意願、海關及移民局準備工作等，並需要聽取澳門旅遊業界意見。,http://www.macaodaily.com/html/2024-04/11/content_1747592.htm,在昨日舉行的旅博會新聞發佈會上，橫琴粵澳深合區經濟發展局副局長黃中堅表示，有關政策的推進工作受到國家部委、澳門特區政府、廣東省和深合區執委會的重視,深合區 ： 琴澳 多次 往返 簽 註 將 有 消息         【 本報 消息 】 年初 特區 政府 透露 ， 正 與 中央 商討 能否 讓 旅行 團在 橫琴 住宿 ， 以及 橫琴 與 澳門 多次 往返 證件 簽 註 的 問 題 。 在 昨日 舉行 的 旅博會 新聞發 佈 會 上 ， 橫琴粵澳 深合區 經濟 發展局 副 局長 黃 中堅 表示 ， 有關 政策 的 推進 工作 受到 國家 部委 、 澳門 特區 政府 、 廣東省 和 深合區 執委會 的 重視 。 國家 部委 更 在 今年 三月 到 橫琴 調研 ， 並 提供 前期 成果 材料 。 由 於 政策 需 得到 國家 部委 認可及 正式 通知 ， 故深 合區 現正 按 要求 積極 配合 製 作 方案 ， “ 應該 好 快 有 消息 ” 。         他稱 ， 有關 政策 的 推行 涉及 較 多 細節 內容 ， 包括 通關 設施 的 保障 、 琴澳 兩地 酒店 市場 需求 、 旅客 意願 、 海關 及 移民局 準備 工作 等 ， 並 需要 聽取 澳門 旅遊業界 意見 。,2024-04-11
桂澳促深化文旅  聯動演藝產業,桂澳促深化文旅  聯動演藝產業    【本報記者張麗真十日桂林電】“    桂澳創新文旅經濟考察團”一行今日出席“桂林市政協——澳門工商聯會、澳門廣西桂林聯誼會助力桂林打造世界級旅遊城市懇談會”。桂澳雙方倡兩地深化文旅合作，加強演藝產業聯動，豐富旅遊城市內涵，鞏固旅遊城市定位。    懇談會今上午十時假大瀑布酒店宴會廳舉行。桂林市政協主席陳麗華，澳區全國人大代表、澳門工商聯會會長何敬麟，桂林市澳區政協常委、澳門廣西桂林聯誼會會長蕭金發，中聯辦協調部二級調研員賴家樂等出席。    借澳平台走出去    何敬麟認為，廣西作為民族團結示範區和世界級旅遊城市，可利用澳門“一中心、一平台、一基地”定位，以及加強與廣東、灣區城市聯動，拓展旅遊合作空間、創新旅遊產品。他希望可帶動各地工商界投入桂林旅遊產業，藉企業相互合作、相互投資，促進對接、發掘商機。留意到桂林旅遊配套不斷完善，澳門作為世界旅遊休閒中心，旅遊業成熟，兩地合作大有作為。寄語桂林政協澳區委員發揮作用，帶動更多投資者、企業透過澳門走進桂林，在經濟文化不同產業作出貢獻。    蕭金發稱，桂林產品受消費者歡迎，包括訪澳旅客、澳門居民，冀可發掘更多潛力商品引進到澳門市場，特別是澳門有龐大旅客群基礎，對多元產品有需求。他認為廣西企業可多利用澳門平台協助產品“走出去”，走到葡語國家、灣區，開拓更大市場。    考察團成員、桂林市政協澳區委員吳迪恆表示，兩地企業可聯手合作互推產品、互推品牌，增加廣西、桂林產品在澳門的曝光度，更好把產品透過澳門平台推廣出去。    在文旅合作方面，吳迪恆、副團長歐家威提到，澳門去年大小表演活動超過三百項。在桂林，有國際性的表演如《印象 · 劉三姐》受追捧，有潛力在澳辦定期演出或巡演。另一方面，澳門也有國際表演可帶到桂林，強強聯手，促進兩地文旅事業發展。    豐富旅遊吸引力    團員鄭曉松認為可藉澳門平台＋桂林元素，在兩地落實更多文旅商業項目，豐富旅遊吸引力。    陳麗華總結會議表示，兩地旅遊業合作有能力創出產業新篇章。桂林有山水資源、歷史文化，去年訪桂旅客達1.4億人次，超過疫前。在出入境日漸便利的措施下，國際客增長迅猛，達300萬。她希望透過與澳門合作，提升桂林演藝產業發展，並積極參與到中葡平台、灣區平台，加強互動、整合資源，助力桂澳旅遊城市共贏發展。    考察團下午考察桂花公社，其開創桂林“工業＋研學”、“工業＋旅遊”、“旅遊＋食品”、“文化＋旅遊”新型旅遊業態，從桂花收購到桂花加工，到桂花產業開發完整產業鏈。此外，一行到鳳凰文投考察鳳凰來棲項目，集康養、旅居、度假一體的世界級山水康養勝地。,http://www.macaodaily.com/html/2024-04/11/content_1747593.htm,桂澳促深化文旅  聯動演藝產業    【本報記者張麗真十日桂林電】“    桂澳創新文旅經濟考察團”一行今日出席“桂林市政協——澳門工商聯會、澳門廣西桂林聯誼會助力桂林打造世界級旅遊城市懇談會”,桂澳促 深化 文旅     聯動 演藝產業         【 本報 記者 張麗真 十日 桂林 電 】 “         桂澳 創新文 旅經濟 考察 團 ” 一行 今日 出席 “ 桂林 市政 協 — — 澳門 工商 聯會 、 澳門 廣西 桂林 聯誼會 助力 桂林 打造 世界 級 旅遊 城市 懇談會 ” 。 桂澳 雙方倡 兩地 深化 文旅 合作 ， 加強 演藝產業 聯動 ， 豐富 旅遊 城市 內涵 ， 鞏固 旅遊 城市 定位 。         懇談會 今 上午 十時 假大 瀑布 酒店 宴會廳 舉行 。 桂林 市政 協 主席 陳 麗華 ， 澳區 全國 人大代表 、 澳門 工商 聯會會長 何敬麟 ， 桂林市 澳區 政協 常委 、 澳門 廣西 桂林 聯誼 會會長 蕭金發 ， 中聯辦 協調 部二級 調 研員賴家樂 等 出席 。         借澳 平台 走 出去         何敬麟 認為 ， 廣西作 為 民族 團結示 範區 和 世界 級 旅遊 城市 ， 可 利用 澳門 “ 一 中心 、 一 平台 、 一 基地 ” 定位 ， 以及 加強 與 廣東 、 灣區 城市 聯動 ， 拓展 旅遊 合作 空間 、 創新 旅遊產品 。 他 希望 可帶動 各地 工商界 投入 桂林 旅遊產業 ， 藉 企業 相互合作 、 相互 投資 ， 促進 對 接 、 發掘 商機 。 留意到 桂林 旅遊 配套 不斷 完善 ， 澳門作 為 世界 旅遊 休閒 中心 ， 旅遊業 成熟 ， 兩地 合作 大有 作為 。 寄語 桂林 政協 澳區 委員 發揮 作用 ， 帶動 更 多 投資者 、 企業 透過 澳門 走進 桂林 ， 在 經濟 文化 不同 產業 作出 貢獻 。         蕭金 發稱 ， 桂林 產品 受 消費者 歡迎 ， 包括 訪澳 旅客 、 澳門 居民 ， 冀可 發掘 更 多 潛力 商品 引進 到 澳門 市場 ， 特別 是 澳門 有 龐大 旅客 群基礎 ， 對 多元 產品 有 需求 。 他 認為 廣西 企業 可多 利用 澳門 平台 協助 產品 “ 走 出去 ” ， 走到 葡語 國家 、 灣區 ， 開拓 更 大 市場 。         考察 團成員 、 桂林 市政 協澳區 委員 吳迪恆 表示 ， 兩地 企業 可聯手 合作 互推 產品 、 互推 品牌 ， 增加 廣西 、 桂林 產品 在 澳門 的 曝光 度 ， 更好 把 產品 透過 澳門 平台 推廣 出去 。         在 文旅 合作 方面 ， 吳迪恆 、 副 團長 歐家威 提到 ， 澳門 去年 大小 表演 活動 超過 三百 項 。 在 桂林 ， 有國際性 的 表演 如 《 印象   ·   劉三姐 》 受 追捧 ， 有 潛力 在 澳辦 定期 演出 或 巡演 。 另一方面 ， 澳門 也 有 國際 表演 可帶 到 桂林 ， 強強 聯手 ， 促進 兩地文 旅事業 發展 。         豐富 旅遊 吸引力         團員 鄭曉松 認為 可 藉 澳門 平台 ＋ 桂林 元素 ， 在 兩地 落實 更 多文 旅商業 項目 ， 豐富 旅遊 吸引力 。         陳 麗華 總 結會議 表示 ， 兩地 旅遊業 合作 有 能力 創出 產業 新篇章 。 桂林 有 山水 資源 、 歷史 文化 ， 去年 訪桂 旅客 達 1.4 億 人次 ， 超過 疫前 。 在 出入境 日漸 便利 的 措施 下 ， 國際客 增長 迅猛 ， 達 300 萬 。 她 希望 透過 與 澳門 合作 ， 提升 桂林 演藝產業 發展 ， 並積 極參 與 到 中葡 平台 、 灣區 平台 ， 加強 互動 、 整合 資源 ， 助力 桂澳 旅遊 城市 共贏 發展 。         考察 團 下午 考察 桂花 公社 ， 其開 創 桂林 “ 工業 ＋ 研學 ” 、 “ 工業 ＋ 旅遊 ” 、 “ 旅遊 ＋ 食品 ” 、 “ 文化 ＋ 旅遊 ” 新型 旅遊業態 ， 從 桂花 收購 到 桂花 加工 ， 到 桂花 產業 開發 完整 產業 鏈 。 此外 ， 一行 到 鳳凰文 投 考察 鳳凰來 棲項 目 ， 集康養 、 旅居 、 度假 一體 的 世界 級 山水 康養 勝地 。,2024-04-11
北區消費獎賞商戶增至千家,餐飲生意增兩三成    北區消費獎賞商戶增至千家    【本報消息】北區工商聯會副會長楊榮光昨在電台時事節目探討中小企升級轉型時表示，北區有兩個關口，居民較容易選擇北上消費，因此經營環境困難。透過現正舉行的“周末北區消費大奬賞”，相信有助北區商戶。現時已有一千家商戶參與。    楊榮光稱，“周末北區消費大奬賞”由推出首周有四百八十家商號參與，至第三周增至一千家。消費奬賞使用情況理想，按已登記活動的餐飲商號反映，生意增兩至三成。    至於有聽眾反映，活動奬賞只能在緊接的周六、日使用，認為消費時間不足，建議放寬至兩個周末。楊榮光解釋，商戶經營具周期性，倘允許優惠券延長一至兩周，未能對即時振興經濟起作用。政府與商會考慮後才作出有關限制，希望居民理解。    活動現時以北區為試點，倘商戶和居民均表示反應良好，會與政府商討延伸至其他區份，希望可形成互動消費。此外，政府推出的北區宣傳短片有作用，希望未來增加更多推廣路線和攻略。,http://www.macaodaily.com/html/2024-04/11/content_1747598.htm,餐飲生意增兩三成    北區消費獎賞商戶增至千家    【本報消息】北區工商聯會副會長楊榮光昨在電台時事節目探討中小企升級轉型時表示，北區有兩個關口，居民較容易選擇北上消費，因此經營環境困難,餐飲 生意 增兩 三成         北區 消費 獎賞 商戶 增至 千家         【 本報 消息 】 北區 工商 聯會 副 會長 楊榮光 昨在 電台 時事 節目 探討 中小 企升級 轉型 時 表示 ， 北區 有 兩個 關口 ， 居民 較 容易 選擇 北上 消費 ， 因此 經營 環境 困難 。 透過 現正 舉行 的 “ 周末 北區 消費 大 奬 賞 ” ， 相信 有助 北區 商戶 。 現時 已有 一千家 商戶 參 與 。         楊榮 光稱 ， “ 周末 北區 消費 大 奬 賞 ” 由 推出 首周 有 四百八十 家商 號參 與 ， 至 第三周 增至 一千家 。 消 費 奬 賞 使用 情況 理想 ， 按 已 登記 活動 的 餐 飲 商號 反映 ， 生意 增兩至 三成 。         至於 有 聽眾 反映 ， 活 動 奬 賞 只能 在 緊接 的 周六 、 日 使用 ， 認為 消費 時間 不足 ， 建議 放 寬 至 兩個 周末 。 楊榮 光解 釋 ， 商戶 經營具 周期性 ， 倘允許 優惠券 延長 一至 兩周 ， 未能 對 即 時振興 經濟起 作用 。 政府 與 商會 考慮 後 才 作出 有關 限制 ， 希望 居民 理解 。         活動 現時 以北 區為 試點 ， 倘商戶 和 居民 均 表示 反應 良好 ， 會 與 政府 商討 延伸 至 其他 區份 ， 希望 可 形成 互動 消費 。 此外 ， 政府 推出 的 北區 宣傳 短片 有 作用 ， 希望 未來 增加 更多 推廣路線 和 攻略 。,2024-04-11
中小企拓多元業務 營收增一成    暨大實習生  黃嘉慧,中小企拓多元業務  營收增一成    面對疫後經營環境轉變，中小企須積極求變，升級轉型，以擴大客源。有北區商戶表示，去年增設咖啡業務，吸引旅客到訪，帶動營業額增一成。期望政府加強烘焙、咖啡的人資培訓，提升專業質素及競爭力。另有食肆商戶負責人表示，對新媒體營銷了解不足，希望政府設相關課程，協助商戶提升網絡營銷推廣能力。    有北區花店負責人陸小姐表示，開業十年，顧客以居民為主，去年增加咖啡業務，常在社交平台推廣自家品牌，成功開拓旅客市場，旅客佔總客量約兩成，帶動營業額增加一成。    她認為，店舖升級轉型，人資是重要因素之一，希望政府可推出烘焙、咖啡等不同類型的人資培訓課程，提升專業質素及行業競爭力。目前北區商戶以內需市場為主，旅客對社區店舖了解較少。其實不少社區店舖的產品質量不比旅遊區遜色，唯推廣力度較弱，認為政府可宣傳社區優質商店，吸引旅客走進社區消費，協助中小企商戶升級轉型。    另有小食店負責人李先生表示，店舖開業四個多月，營業額平穩，顧客以居民為主，旅客較少。北區商戶有不同特色，商品種類繁多。多數商戶在社交平台推廣，但他對新媒體宣傳、營銷的使用方式和技巧不太清楚，深入網絡推廣面臨一定困難。希望政府可開辦新媒體宣傳培訓課程予中小企，提升中小企網絡營銷能力，擴大營銷效果。    暨大實習生  黃嘉慧,http://www.macaodaily.com/html/2024-04/11/content_1747600.htm,有北區花店負責人陸小姐表示，開業十年，顧客以居民為主，去年增加咖啡業務，常在社交平台推廣自家品牌，成功開拓旅客市場，旅客佔總客量約兩成，帶動營業額增加一成,中小 企拓 多元 業務     營收 增一成         面對 疫後經營 環境 轉變 ， 中小 企須 積極求 變 ， 升級 轉型 ， 以 擴大 客源 。 有北區 商戶 表示 ， 去年 增設 咖啡 業務 ， 吸引 旅客 到訪 ， 帶動 營業額 增一成 。 期望 政府 加強 烘焙 、 咖啡 的 人 資培訓 ， 提升 專業 質素 及 競爭力 。 另有 食肆 商戶 負責人 表示 ， 對 新 媒體 營銷 了解 不足 ， 希望 政府 設相關 課程 ， 協助 商戶 提升 網絡 營銷 推廣 能力 。         有北區 花店 負責 人陸 小姐 表示 ， 開業 十年 ， 顧客 以 居民 為主 ， 去年 增加 咖啡 業務 ， 常在 社交 平台 推廣 自家 品牌 ， 成功 開拓 旅客 市場 ， 旅客 佔 總 客量 約 兩成 ， 帶動 營業額 增加 一 成 。         她 認為 ， 店 舖 升級 轉型 ， 人資 是 重要 因素 之一 ， 希望 政府 可 推出 烘焙 、 咖啡 等 不同 類型 的 人 資培訓 課程 ， 提升 專業 質素 及 行業 競爭力 。 目前 北區 商戶 以內 需市場 為 主 ， 旅客 對 社區 店 舖 了解 較少 。 其實 不少 社區 店 舖 的 產品 質量 不 比 旅遊區 遜色 ， 唯推廣 力度 較弱 ， 認為 政府 可宣傳 社區 優質 商店 ， 吸引 旅客 走進 社區 消費 ， 協助 中小 企商戶 升級 轉型 。         另有 小食店 負責人 李先生 表示 ， 店 舖 開業 四個 多月 ， 營業額 平穩 ， 顧客 以 居民 為主 ， 旅客 較少 。 北區 商戶 有 不同 特色 ， 商品 種類 繁多 。 多數 商戶 在 社交 平台 推廣 ， 但 他 對 新 媒體 宣傳 、 營銷 的 使用 方式 和 技巧 不太 清楚 ， 深入 網絡 推廣面 臨 一定 困難 。 希望 政府 可開 辦新 媒體 宣傳 培訓 課程予 中小 企 ， 提升 中小 企網絡 營銷 能力 ， 擴大營銷 效果 。         暨大 實習生     黃 嘉慧,2024-04-11
商會籲中小企了解需求 提升能力,物價貴   競爭力不足？    商會籲中小企了解需求  提升能力    【本報消息】電台時事節目昨探討中小企升級轉型發展。有聽眾希望政府再推消費卡，直接幫助居民和商戶。另有聽眾認為，中小企產品價格貴，但質素不夠內地好，才導致居民選擇北上消費。中小型企業聯合總商會理事長馮健富鼓勵中小企了解本地消費者需要，增強經營能力，並稱政府已推出多元活動作誘因，消費者和商家也要共同付出，澳門經濟才能走出困局。    生產力暨科技轉移中心標準、管理及培訓考試部首席高級經理李藹倫，澳門中小型企業聯合總商會理事長馮健富，澳門北區工商聯會副會長楊榮光，澳門直播協會理事長戴顯揚昨上午八時半出席電台時事節目。    倡成立關注營商小組    馮健富表示，在通關便利、“澳車北上”、旅客消費模式改變等情況下，無論是居民或旅客，消費模式都在轉變。過往港客較年長，現時則趨向年輕化；居民假期離澳消費增多等，社會復常至今逾一年，上述問題已越趨明顯，中小企應思考如何提升能力，才能讓消費落到民生區。希望政府、商界乃至博企共同成立關注中小企營商的小組，聚焦問題，合力解決。    借直播帶貨曝光商品    戴顯揚表示，近年透過直播帶貨在內地推廣澳門商品已較過往容易，去年底在經濟及科技發展局的支持和推動下，打通一站式物流服務，只要澳門商品符合內地標準，可透過保稅倉方式引進至內地。該會鼓勵商戶，倘五十件貨品有二十件符合內地標準，便先上架符合內地標準的貨品，盡力讓自家商品曝光內地市場。經過兩年磋商，現時澳門主播只要申請內地居住證，再在內地平台申請直播權限，便可參與內地平台直播帶貨。關鍵是中小企自身要“走出來”。,http://www.macaodaily.com/html/2024-04/11/content_1747601.htm,中小型企業聯合總商會理事長馮健富鼓勵中小企了解本地消費者需要，增強經營能力，並稱政府已推出多元活動作誘因，消費者和商家也要共同付出，澳門經濟才能走出困局,物價貴       競爭力 不足 ？         商會籲 中小 企 了解 需求     提升 能力         【 本報 消息 】 電台 時事 節目 昨探 討 中小 企升級 轉型 發展 。 有 聽眾 希望 政府 再 推 消費卡 ， 直接 幫助 居民 和 商戶 。 另有 聽眾 認為 ， 中小 企產品 價格貴 ， 但質素 不夠 內 地 好 ， 才 導致 居民 選擇 北上 消費 。 中小型 企業 聯合 總商會 理事 長 馮健富 鼓勵 中小 企 了解 本地 消費者 需要 ， 增強 經營 能力 ， 並稱 政府 已 推出 多元 活動作 誘因 ， 消費者 和 商家 也 要 共同 付出 ， 澳門 經濟 才能 走出 困局 。         生產力 暨 科技 轉移 中心 標準 、 管理 及 培訓 考試部 首席 高級 經理 李藹倫 ， 澳門 中小型 企業 聯合 總商會 理事 長 馮健富 ， 澳門 北區 工商 聯會 副 會長 楊榮光 ， 澳門 直播 協會 理事 長 戴 顯揚 昨 上午 八時 半 出席 電台 時事 節目 。         倡 成立 關注營 商小組         馮健富 表示 ， 在 通關 便利 、 “ 澳車 北上 ” 、 旅客 消費 模式 改變 等 情況 下 ， 無論 是 居民 或 旅客 ， 消費 模式 都 在 轉變 。 過往 港客 較 年 長 ， 現時則 趨向 年 輕化 ； 居民 假期 離澳 消費 增多 等 ， 社會 復 常 至今 逾 一年 ， 上述 問題 已 越 趨明顯 ， 中小 企應 思考 如何 提升 能力 ， 才能 讓 消費 落到 民生 區 。 希望 政府 、 商界 乃至 博企 共同 成立 關注 中小 企營商 的 小組 ， 聚焦 問題 ， 合力 解決 。         借 直播 帶貨 曝光 商品         戴 顯揚 表示 ， 近年 透過 直播 帶貨 在 內 地 推廣澳門 商品 已較 過往 容易 ， 去年底 在 經濟 及 科技 發展局 的 支持 和 推動 下 ， 打通 一站式 物流 服務 ， 只要 澳門 商品 符合 內地 標準 ， 可透過 保稅 倉 方式 引進 至 內 地 。 該會 鼓勵 商戶 ， 倘 五十 件 貨品 有 二十 件 符合 內地 標準 ， 便 先 上架 符合 內地 標準 的 貨品 ， 盡力 讓 自家 商品 曝光 內地 市場 。 經過 兩年 磋商 ， 現時 澳門 主播 只要 申請 內 地 居住 證 ， 再 在 內 地 平台 申請 直播 權限 ， 便 可 參 與 內 地 平台 直播 帶貨 。 關鍵 是 中小 企 自身 要 “ 走出 來 ” 。,2024-04-11
生產力設AI新媒體應用課程,生產力設AI新媒體應用課程    【本報消息】生產力暨科技轉移中心標準、管理及培訓考試部首席高級經理李藹倫表示，中心已向中小企推出靈活的培訓方式，近年亦因應新媒體發展，開辦新課程，當中包括透過AI結合新媒體應用，深受業界歡迎；營銷攻略課程基本每月開辦。中心還推出新媒體到店輔導服務，上門為中小企解決困難和疑問，盡力解決中小企因人力資源不足，難以參與升級轉型培訓問題。,http://www.macaodaily.com/html/2024-04/11/content_1747602.htm,生產力設AI新媒體應用課程    【本報消息】生產力暨科技轉移中心標準、管理及培訓考試部首席高級經理李藹倫表示，中心已向中小企推出靈活的培訓方式，近年亦因應新媒體發展，開辦新課程，當中包括透過AI結合新媒體應用，深受業界歡迎,生產力 設 AI 新媒體 應用 課程         【 本報 消息 】 生產力 暨 科技 轉移 中心 標準 、 管理 及 培訓 考試部 首席 高級 經理 李藹倫 表示 ， 中心 已 向 中小 企 推出 靈活 的 培訓 方式 ， 近年 亦 因應 新 媒體 發展 ， 開辦 新 課程 ， 當中 包括 透過 AI 結合 新 媒體 應用 ， 深受 業界 歡迎 ； 營銷 攻略 課程 基本 每月 開辦 。 中心 還 推出 新媒體 到 店 輔導 服務 ， 上門 為 中小 企解決 困難 和 疑問 ， 盡力 解決 中小 企因 人力 資源 不足 ， 難以 參與 升級 轉型 培訓 問題 。,2024-04-11
