Title,Content,Link,Summary,Preprocessed_Content,Date
公僕團體雲南捐資助學,公僕團體雲南捐資助學    【本報消息】為加強對雲南的了解、增強國情教育及提升澳門公務員的凝聚力與歸屬感，由澳門中聯辦社工部策劃、指導及組織的“澳門公務員團體雲南愛心之旅訪問團”，九月四日至八日進行為期五天的行程。    訪問團由澳門中聯辦社工部一級主任科員蔡陸宏、行政公職局高級技術員李佩衡擔任顧問，澳門公務專業人員協會會員大會副主席官世海擔任團長，公共行政管理學會理事長李略及公務員保齡球協會會長陳旭偉擔任副團長，來自三十個不同公務人員團體的近四十位成員組成。    期間，一行赴郭大寨鄉開展紀念澳門回歸希望小學的助學捐贈及探訪活動。團長官世海稱，此次訪問恰逢國慶七十五周年及澳門回歸祖國廿五周年，尤其是疫情後首次重返郭大寨鄉紀念澳門回歸希望學校，意義非凡。    多年捐助五千學生    訪問團重點探訪郭大寨鄉紀念澳門回歸希望小學。廿五年前，九九年澳門回歸祖國之際，公專會在中聯辦等多方協助下，捐款三十五萬人民幣為郭大寨鄉建設一所希望學校和設立獎學金，澳門回歸二十年的一九年再捐建一百九十九點九平方米的圖書館作為獻給祖國的禮物。此外，今次公專會收到澳門熱心人士的大力支持捐贈助學金十三萬八千六百元人民幣，如咀香園餅家捐贈四百五十盒月餅，另有國際福壽食品(澳門)有限公司捐出四百袋大米及謝亞霖女士捐贈四百包爆米花等物資，並舉行捐贈儀式。    官世海表示，公專會攜手多方力量，捐建了這座希望小學，為偏遠山區的孩子點亮了知識的燈塔。公專會多年來持續資助學生，設立教育獎勵基金，捐贈教學和生活必需品達五百萬人民幣。至今，該會已幫助超過五千名學生，見證了該校從破舊危樓到現代化希望學校的華麗蛻變。    領略雲南自然風光    此外，訪問團還遊覽了大理古城、洱海公園、西南聯大舊址及雲南陸軍講武堂等名勝景點，深入領略了雲南的自然風光與深厚的人文底蘊，讓團員們留下深刻印象，進一步加深對中華文化的認識與理解，增強愛國愛澳的家國情懷。    此次“雲南愛心之旅”不僅是一次文化交流之旅，更是一次愛心傳遞與希望播種的旅程，也是澳門公務員團隊凝聚力與愛國情懷的生動體現。通過實地走訪與深入交流，訪問團成員對雲南的自然風光、人文景觀及教育事業有了更全面和深入的了解。他們表示，將把這份經歷與感悟帶回澳門，為特區的發展貢獻更多力量，同時，也將繼續關注和支持澳門回歸希望小學的發展，為孩子的成長成才貢獻更多力量。,http://www.macaodaily.com/html/2024-09/16/content_1781469.htm,廿五年前，九九年澳門回歸祖國之際，公專會在中聯辦等多方協助下，捐款三十五萬人民幣為郭大寨鄉建設一所希望學校和設立獎學金，澳門回歸二十年的一九年再捐建一百九十九點九平方米的圖書館作為獻給祖國的禮物,公僕團 體雲南 捐 資助學         【 本報 消息 】 為 加強 對雲南 的 了解 、 增強 國情 教育 及 提升 澳門 公務員 的 凝聚力 與 歸 屬感 ， 由 澳門 中聯 辦社 工部 策劃 、 指導及 組織 的 “ 澳門 公務員團 體雲南 愛心 之 旅訪 問團 ” ， 九月 四日 至 八日 進行 為期 五天 的 行程 。         訪 問團 由 澳門 中聯 辦社 工部 一級 主任 科員 蔡陸宏 、 行政 公職局 高級 技術員 李佩衡 擔任 顧問 ， 澳門 公務 專業 人員 協會 會員大會 副 主席 官世海 擔任 團長 ， 公共行政 管理 學會 理事 長 李略 及 公務員 保齡球 協會會長 陳 旭偉 擔任 副 團長 ， 來 自 三十 個 不同 公務人員 團體 的 近 四十位 成員 組成 。         期間 ， 一行 赴 郭 大寨 鄉 開展 紀念 澳門 回歸 希望 小學 的 助學 捐贈 及 探訪 活動 。 團長 官世海稱 ， 此次 訪問 恰逢 國慶 七十五 周年 及 澳門 回歸祖國 廿五 周年 ， 尤其 是 疫情 後 首次 重返 郭 大寨 鄉紀念 澳門 回歸 希望 學校 ， 意義 非凡 。         多年 捐助 五千 學生         訪 問團 重點 探訪 郭 大寨 鄉紀念 澳門 回歸 希望 小學 。 廿五年 前 ， 九九年 澳門 回歸祖國 之際 ， 公專會 在 中聯辦 等 多方 協助 下 ， 捐款 三十五 萬 人民 幣為 郭 大寨 鄉建設 一所 希望 學校 和 設立 獎學金 ， 澳門 回歸 二十年 的 一 九年 再 捐建 一百九十 九點 九平方米 的 圖書館 作為 獻給 祖國 的 禮物 。 此外 ， 今次 公專會 收到 澳門 熱心 人士 的 大力支持 捐贈 助學金 十三 萬 八千 六百元 人民 幣 ， 如咀 香園 餅家 捐贈 四百五十 盒月餅 ， 另有 國際福壽 食品 ( 澳門 ) 有限公司 捐出 四百 袋 大米 及 謝亞霖 女士 捐贈 四百 包 爆米花 等 物資 ， 並舉行 捐贈 儀式 。         官世海 表示 ， 公專會 攜手 多方 力量 ， 捐建 了 這座 希望 小學 ， 為 偏遠 山區 的 孩子 點亮 了 知識 的 燈塔 。 公專會 多年 來持續 資助 學生 ， 設立 教育 獎勵 基金 ， 捐贈 教學 和 生活必需品 達 五百 萬 人民 幣 。 至今 ， 該會 已 幫助 超過 五千名 學生 ， 見證 了 該校 從 破舊 危樓 到 現代化 希望 學校 的 華麗 蛻變 。         領略雲南 自然 風光         此外 ， 訪 問團 還遊覽 了 大理 古城 、 洱海 公園 、 西南 聯大 舊址 及 雲南陸 軍講 武堂 等 名勝景點 ， 深入 領略 了 雲南 的 自然 風光 與 深厚 的 人文 底蘊 ， 讓 團員們 留下 深刻印象 ， 進 一步 加深 對 中華 文化 的 認識 與 理解 ， 增強 愛國 愛澳 的 家國 情懷 。         此次 “ 雲南愛心 之 旅 ” 不僅 是 一次 文化交流 之旅 ， 更是 一次 愛心 傳遞 與 希望 播種 的 旅程 ， 也 是 澳門 公務員 團隊 凝聚力 與 愛國 情懷 的 生動 體現 。 通過 實地 走訪 與 深入 交流 ， 訪 問團 成員 對雲南 的 自然 風光 、 人 文景 觀及 教育 事業 有 了 更 全面 和 深入 的 了解 。 他們 表示 ， 將把 這份 經歷 與 感悟 帶回 澳門 ， 為 特區 的 發展 貢獻 更 多 力量 ， 同時 ， 也 將繼續 關注 和 支持 澳門 回歸 希望 小學 的 發展 ， 為 孩子 的 成長 成才 貢獻 更 多 力量 。,2024-09-16
國慶牌樓巡展黑沙環舉行,國慶牌樓巡展黑沙環舉行    【本報消息】由市政署、澳門口述歷史協會主辦，澳門美術協會協辦、澳門日報支持的《慶祝中華人民共和國成立七十五周年暨澳門特別行政區成立廿五周年——澳門國慶牌樓回顧展》，昨起至下月底在黑沙環公園舉行戶外巡展，期望藉此向公眾展現上世紀四十年代末起國慶牌樓的發展及變遷，加深公眾了解相關資訊。    下月底移師青洲坊    戶外巡展昨起在黑沙環公園舉行，不少居民途徑時都駐足觀賞展覽。有居民稱，透過閱讀展板上的資訊，深入認識以前澳門慶祝國慶的情況，亦感受到澳門回歸後的社會變化，感覺變化很大。    在黑沙環公園的戶外巡展展期至十月三十日，結束後將移師至青洲坊蓮花廣場繼續展出，展期至十二月十五日；十二月十五日至明年一月二十四日將在氹仔運動場圓形地展出，歡迎有興趣人士前往參觀。,http://www.macaodaily.com/html/2024-09/16/content_1781472.htm,國慶牌樓巡展黑沙環舉行    【本報消息】由市政署、澳門口述歷史協會主辦，澳門美術協會協辦、澳門日報支持的《慶祝中華人民共和國成立七十五周年暨澳門特別行政區成立廿五周年——澳門國慶牌樓回顧展》，昨起至下月底在黑沙環公園舉行戶外巡展，期望藉此向公眾展現上世紀四十年代末起國慶牌樓的發展及變遷，加深公眾了解相關資訊,國慶牌 樓 巡展 黑沙 環舉行         【 本報 消息 】 由 市政 署 、 澳門 口述 歷史 協會 主辦 ， 澳門 美術 協會 協辦 、 澳門 日報 支持 的 《 慶祝 中華 人民 共和 國 成立 七十五 周年 暨 澳門 特別 行政 區 成立 廿五 周年 — — 澳門 國慶牌 樓 回顧展 》 ， 昨起 至 下 月底 在 黑沙 環公園 舉行戶 外 巡展 ， 期望 藉此 向 公眾展 現上 世紀 四十年代 末起 國慶牌 樓 的 發展 及 變遷 ， 加深 公眾 了解 相關 資訊 。         下 月底 移師 青洲 坊         戶外 巡展 昨起 在 黑沙 環公園 舉行 ， 不少 居民 途徑 時 都 駐足 觀賞 展覽 。 有 居民 稱 ， 透過 閱讀 展板 上 的 資訊 ， 深入 認識 以前 澳門慶 祝國慶 的 情況 ， 亦 感受 到 澳門 回歸 後 的 社會 變化 ， 感覺 變化 很大 。         在 黑沙 環公園 的 戶外 巡展 展期 至 十月 三十日 ， 結束後將 移師 至 青洲 坊 蓮花 廣場 繼續 展出 ， 展期 至 十二月 十五日 ； 十二月 十五日 至 明年 一月 二十四日 將在 氹 仔運動場 圓形 地 展出 ， 歡迎 有 興趣 人士 前往 參觀 。,2024-09-16
中信紅酒鐘錶拍賣競投熱烈,中信紅酒鐘錶拍賣競投熱烈    【本報消息】澳門中信國際拍賣有限公司舉辦的“二○二四年名貴紅酒鐘錶專場拍賣會”，經過一連十多天預展，昨假旅遊塔會展中心四樓開拍，豐富的名貴紅酒及鐘錶拍品吸引了不少嘉賓及收藏家到場競投。    負責人表示，今次拍品極具收藏及商業價值，希望通過拍賣活動，助力澳門經濟、旅遊、會展及文化藝術收藏品市場發展，為澳門產業多元發展貢獻綿力。    拍賣會昨日下午三時舉行，澳門中信負責人高強首先祝賀澳門當選“東亞文化之都”，希望特區政府藉契機，進一步推動文化事業和旅遊業發展。    高強表示，澳門中信在逾二十年的發展歷程，腳踏實地，堅持不懈努力，先後舉辦了五十多場藝術品拍賣會，創造了澳門拍賣行業許多新亮點。    為響應持區政府宣導的適度多元化發展的號召，努力把澳門發展為旅遊休閒城市。澳門中信舉辦名貴紅酒鐘錶專場拍賣會預展已於八月廿六至九月十四日在南灣中國法律大廈二樓“世界華人博物館”舉行，反應熱烈。拍賣會昨日舉行，由著名拍賣師何妹擔任主槌。參與競投的收藏家及居民，經過兩個多小時的激烈競投，不少買家投得心頭好，現場氣氛熱烈。,http://www.macaodaily.com/html/2024-09/16/content_1781474.htm,中信紅酒鐘錶拍賣競投熱烈    【本報消息】澳門中信國際拍賣有限公司舉辦的“二○二四年名貴紅酒鐘錶專場拍賣會”，經過一連十多天預展，昨假旅遊塔會展中心四樓開拍，豐富的名貴紅酒及鐘錶拍品吸引了不少嘉賓及收藏家到場競投,中信 紅酒鐘 錶 拍 賣 競 投熱烈         【 本報 消息 】 澳門 中信 國際 拍 賣 有限公司 舉辦 的 “ 二 ○ 二 四年 名貴紅 酒鐘 錶 專場 拍 賣會 ” ， 經過 一連 十多天 預展 ， 昨假 旅遊塔會展 中心 四樓 開 拍 ， 豐富 的 名貴 紅酒 及鐘 錶 拍品 吸引 了 不少 嘉賓 及 收藏家 到場 競投 。         負責人 表示 ， 今 次 拍品 極具 收藏 及 商業 價值 ， 希望 通過 拍 賣 活動 ， 助力 澳門 經濟 、 旅遊 、 會展 及 文化 藝術 收藏品 市場 發展 ， 為 澳門產業 多元 發展 貢獻綿力 。         拍賣會 昨日 下午 三時 舉行 ， 澳門 中信 負責人 高強 首先 祝賀 澳門 當選 “ 東亞 文化 之 都 ” ， 希望 特區 政府 藉 契機 ， 進 一步 推動 文化 事業 和 旅遊業 發展 。         高強 表示 ， 澳門 中信 在 逾 二十年 的 發展 歷程 ， 腳踏實 地 ， 堅持 不懈努力 ， 先後舉 辦 了 五十多 場藝術品 拍 賣會 ， 創造 了 澳門 拍 賣 行業 許多 新亮點 。         為響 應持區 政府 宣導 的 適度 多元化 發展 的 號召 ， 努力 把 澳門 發展 為 旅遊 休閒 城市 。 澳門 中信 舉辦 名貴紅 酒鐘 錶 專場 拍 賣會 預展 已 於 八月 廿六 至 九月 十四日 在 南灣 中國 法律 大廈 二樓 “ 世界 華人 博物 館 ” 舉行 ， 反應 熱烈 。 拍賣會 昨日 舉行 ， 由 著名 拍賣師 何妹 擔任 主槌 。 參與 競投 的 收藏家 及 居民 ， 經過 兩個 多小時 的 激烈 競投 ， 不少 買家 投得 心頭 好 ， 現場 氣氛 熱烈 。,2024-09-16
林詩棟孫穎莎WTT奪冠,林詩棟孫穎莎WTT奪冠    【本報消息】“WTT澳門冠軍賽二○二四——由銀河娛樂呈獻”冠軍誕生，殺入決賽的國家隊球手林詩棟及“一姐”孫穎莎，在決賽分別擊敗德國的邱黨及國家隊隊友王藝迪，奪得男、女單冠軍。    孫穎莎破王藝迪    賽事昨晚在東亞運體育館上演決賽，全場滿座，球迷提早入場欣賞精彩比賽。率先上演的女單決賽，由“一姐”孫穎莎與王藝迪合演中國內戰。兩人熟悉對方打法，展開拉鋸戰，互有領先下各取兩局，孫穎莎兩度領先；王藝迪則兩度追和戰至二比二。比賽尾段，兩人來回多板下，王藝迪數次搶攻惜打失，孫穎莎在關鍵分把握更好，最後連贏十一比八及十一比四，局數贏四比二奪冠。    林詩棟橫掃邱黨    林詩棟在男單決賽相對贏得較輕鬆，林詩棟全場壓制邱黨，連贏十一比五、十一比六及兩局十一比八，直落贏局數四比○，首次贏得WTT澳門站冠軍。    孫穎莎繼二二年後再大熱奪冠，表示由於屬奧運後首個比賽，賽前主要以恢復及提升狀態為主，很高興能打出表現，與王藝迪一同為球迷送上精彩的決賽，是新奧運周期的好開始，感謝球迷支持。    孫穎莎在今屆賽事先後面對日本及韓國青年球手，她認為日、韓年輕球員近年進步很大，並再次點名稱讚四強對手、日本新星張本美和，認為對方雖年僅十六歲，但已擁有奧運經驗，其閱讀、理解比賽的能力亦越來越好，相信自己與張本美和未來將會有一段長時間在賽場上交手。期望能夠與一眾好手互相激勵及進步，在未來為乒乓球壇送上更多精彩的比賽。林詩棟首次在澳門奪冠，很高興能在澳門贏得冠軍。今屆賽事每場同樣難忘及經典，其中八強面對張本智和險勝，是自己與對方三次交手以來第一次贏波，十分深刻。    體育局代局長張子軒表示，經過多年的辦賽經驗，今屆賽事由塔石移師東亞運體育館，周邊交通與旅遊配套更適合，同時容納觀眾的座位數量亦大大增加，滿足居民、球迷及旅客需要。當局亦與賽會合作，讓本地學生有機會親身感受舉辦大型體育賽事的工作內容，期望澳門居民、年輕人及運動員未來能有更多機會在此類國際性體育賽事參與其中。,http://www.macaodaily.com/html/2024-09/16/content_1781529.htm,孫穎莎繼二二年後再大熱奪冠，表示由於屬奧運後首個比賽，賽前主要以恢復及提升狀態為主，很高興能打出表現，與王藝迪一同為球迷送上精彩的決賽，是新奧運周期的好開始，感謝球迷支持,林詩棟 孫穎莎 WTT 奪冠         【 本報 消息 】 “ WTT 澳門 冠軍賽 二 ○ 二四 — — 由銀河 娛樂 呈 獻 ” 冠軍誕生 ， 殺入 決賽 的 國家隊 球手 林詩棟 及 “ 一姐 ” 孫穎莎 ， 在 決賽 分別 擊敗 德國 的 邱黨 及 國家隊 隊友 王藝迪 ， 奪得 男 、 女 單冠 軍 。         孫穎莎破 王藝迪         賽事 昨晚 在 東亞運 體育館 上演 決賽 ， 全場 滿座 ， 球迷 提早 入場 欣賞 精彩 比賽 。 率先 上演 的 女單 決賽 ， 由 “ 一姐 ” 孫穎莎 與 王藝迪 合演 中國 內戰 。 兩人 熟悉 對方 打法 ， 展開 拉 鋸戰 ， 互有 領先下 各取 兩局 ， 孫穎莎 兩度 領先 ； 王藝迪則 兩度 追 和 戰至 二比二 。 比賽 尾段 ， 兩人來 回多板 下 ， 王藝迪 數次 搶 攻惜 打失 ， 孫穎莎 在 關鍵分 把握 更好 ， 最後連贏 十一 比八及 十一 比四 ， 局數 贏四比二奪 冠 。         林詩棟 橫掃 邱黨         林詩棟 在 男單 決賽 相對 贏得 較 輕 鬆 ， 林詩棟 全場 壓制 邱黨 ， 連贏 十一 比五 、 十一 比六及 兩局 十一 比八 ， 直落 贏局 數四比 ○ ， 首次 贏得 WTT 澳門 站 冠 軍 。         孫穎莎 繼二 二年 後 再 大熱 奪冠 ， 表示 由 於 屬奧運後首個 比賽 ， 賽前 主要 以 恢 復 及 提升 狀態 為 主 ， 很 高興能 打出 表現 ， 與 王藝迪 一同 為 球迷 送上 精彩 的 決賽 ， 是 新 奧運 周期 的 好 開始 ， 感謝 球迷 支持 。         孫穎莎 在 今屆賽 事先 後 面 對 日本 及 韓國 青年 球手 ， 她 認為 日 、 韓年 輕球員 近年 進步 很大 ， 並 再次 點名 稱 讚 四 強 對 手 、 日本 新星 張本 美 和 ， 認為 對方 雖年僅 十六 歲 ， 但 已 擁有 奧運 經驗 ， 其 閱讀 、 理解 比賽 的 能力 亦 越來 越 好 ， 相信 自己 與 張本 美 和 未來 將會 有 一段 長 時間 在 賽場 上 交手 。 期望 能夠 與 一眾 好手 互相 激勵 及 進步 ， 在 未來 為 乒乓球 壇 送 上 更 多 精彩 的 比賽 。 林詩棟 首次 在 澳門 奪冠 ， 很 高興能 在 澳門 贏得 冠 軍 。 今屆 賽事 每場 同樣 難忘及 經典 ， 其中 八強面 對 張本智 和 險勝 ， 是 自己 與 對方 三次 交手 以來 第一次 贏波 ， 十分 深刻 。         體育 局代局 長 張子軒 表示 ， 經過 多年 的 辦賽 經驗 ， 今屆賽 事由 塔石 移師 東亞運 體育館 ， 周邊 交通 與 旅遊 配套 更 適合 ， 同時 容納 觀眾 的 座位 數量 亦 大大增加 ， 滿足 居民 、 球迷 及 旅客 需要 。 當局 亦 與 賽會 合作 ， 讓 本地 學生 有 機會 親身 感受 舉辦 大型 體育賽 事 的 工作 內容 ， 期望 澳門 居民 、 年 輕人及 運動員 未來 能 有 更 多 機會 在 此類 國際性 體育賽 事 參 與 其中 。,2024-09-16
麥拿倫阿站奪冠反超紅牛,麥拿倫阿站奪冠反超紅牛    【本報消息】麥拿倫在F1阿塞拜疆站憑派斯迪在中段超過排頭位的陸克萊，守住勝利過終點，贏得生涯第二個分站冠軍，加上隊友羅里斯得第四後，麥拿倫在車隊榜已反超紅牛。    麥拿倫已超越紅牛成為目前最快的戰車，近幾站已逐步收窄差距，儘管羅里斯在巴庫街道賽的阿塞拜疆站因失誤僅排十七位起步，還有派斯迪守在第二。排頭位的陸克萊起步守住位置，很快甩開派斯迪逾三秒，紅牛的佩雷斯起步超越辛斯守在第三。不過派斯迪換上硬胎後表現醒神，第二十圈爬過陸克萊，佩雷斯亦緊咬，三車差距不足一秒糾纏二十多圈。    派斯迪與陸克萊鬥至最後四圈，隨着陸克萊的輪胎耗損更嚴重逐漸被甩開。羅里斯在最後兩圈爬過競爭對手華斯達賓升上第六；佩雷斯在一圈後逼近陸克萊嘗試爬頭不果，辛斯乘虛而入反超佩雷斯，兩人各不相讓最後攬炒撞牆；派斯迪在虛擬安全車下以首名過終點，陸克萊得第二，平治的羅素在辛斯與佩雷斯攬炒下漁人得利執得第三，羅里斯排第四。在威廉士取代沙真特的新人哥拿賓度在第二場已得第八，為車隊取分；麥路臣停賽做“替工”的比爾曼得第十，同樣獲最後一分。    派斯迪第二分站冠軍    麥拿倫的派斯迪繼匈牙利站贏得生涯處子勝利後，再獲第二個分站冠軍，加上隊友羅里斯得第四；紅牛僅有華斯達賓得第五而佩雷斯退賽，麥拿倫在車隊榜已反超紅牛二十分取得領先，第三的法拉利亦僅落後紅牛不足一場勝利的差距。華斯達賓在車手榜仍領先，但優勢稍減。,http://www.macaodaily.com/html/2024-09/16/content_1781531.htm,麥拿倫阿站奪冠反超紅牛    【本報消息】麥拿倫在F1阿塞拜疆站憑派斯迪在中段超過排頭位的陸克萊，守住勝利過終點，贏得生涯第二個分站冠軍，加上隊友羅里斯得第四後，麥拿倫在車隊榜已反超紅牛,麥拿倫 阿站 奪冠 反超 紅牛         【 本報 消息 】 麥拿倫 在 F1 阿塞拜疆 站 憑 派斯 迪在 中段 超過 排頭位 的 陸克萊 ， 守住 勝利過 終點 ， 贏得 生涯 第二 個 分站 冠 軍 ， 加上 隊友羅 里斯 得 第四 後 ， 麥拿倫 在 車隊 榜 已 反超 紅牛 。         麥拿倫 已 超越 紅牛成 為 目前 最快 的 戰車 ， 近幾站 已 逐步 收窄 差距 ， 儘 管 羅 里斯 在 巴庫 街道 賽 的 阿塞拜疆 站 因 失誤 僅排 十七位 起步 ， 還有 派斯 迪守 在 第二 。 排頭位 的 陸克萊 起步 守住 位置 ， 很快 甩開 派斯 迪 逾 三秒 ， 紅牛 的 佩雷斯 起步 超越 辛斯守 在 第三 。 不過 派斯 迪換 上 硬 胎後表現 醒 神 ， 第二十 圈 爬 過陸克萊 ， 佩雷斯 亦 緊 咬 ， 三車 差距 不足 一秒 糾纏 二十多 圈 。         派斯 迪 與 陸克萊鬥 至 最 後 四圈 ， 隨着 陸克萊 的 輪胎 耗損 更 嚴重 逐漸 被 甩 開 。 羅 里斯 在 最後兩圈 爬過 競爭 對 手華斯達 賓升 上 第六 ； 佩雷斯 在 一圈 後 逼近 陸克萊嘗試 爬頭 不果 ， 辛斯乘 虛而入 反超 佩雷斯 ， 兩人 各不相 讓 最後攬 炒 撞 牆 ； 派斯 迪在 虛擬 安全 車下 以 首名 過終點 ， 陸克萊得 第二 ， 平治 的 羅 素 在 辛斯 與 佩雷斯 攬 炒 下 漁人 得利 執得 第三 ， 羅 里斯 排 第四 。 在 威廉 士 取代 沙真特 的 新人 哥拿賓度 在 第二 場已 得 第八 ， 為 車隊 取分 ； 麥路臣 停賽 做 “ 替工 ” 的 比爾曼 得 第十 ， 同樣 獲 最 後 一分 。         派斯 迪 第二 分站 冠 軍         麥拿倫 的 派斯 迪繼 匈牙利 站 贏得 生涯 處子 勝利 後 ， 再 獲 第二 個 分站 冠 軍 ， 加上 隊友羅 里斯 得 第四 ； 紅牛僅 有華斯達賓 得 第五 而 佩雷斯 退賽 ， 麥拿倫 在 車隊 榜 已 反超 紅牛 二十分 取得 領先 ， 第三 的 法拉利 亦僅 落後紅牛 不足 一場 勝利 的 差距 。 華斯達賓 在 車手 榜 仍 領先 ， 但 優勢 稍減 。,2024-09-16
