Title,Content,Link,Summary,Preprocessed_Content,Date
韓警：涉“引誘朝鮮攻擊”內容,從前情報司令官筆記發現    韓警：涉“引誘朝鮮攻擊”內容    【香港中通社廿三日電】據韓聯社報道，韓國警方廿三日表示，在涉嫌策劃“十二月三日緊急戒嚴”事件的韓軍前情報司令官盧相源（音）的筆記中發現“引誘朝鮮攻擊”內容。    據報道，韓國警察廳國家調查本部特別調查團相關人員廿三日在接受採訪時透露，在盧相源住所搜查到的筆記本中發現了“在NLL（韓國主張半島西部海域朝韓海上分界線）引誘朝鮮攻擊”的內容。    為戒嚴挑釁朝鮮？    報道指出，這與關於韓前國防部長官金龍顯等人為了戒嚴而挑釁朝鮮的說法是一致的。不過，韓警方表示，目前尚未證實是否按照筆記本中的描述採取了實際行動。    韓警方還稱，盧相源的筆記本中包含與戒嚴有關的“封鎖國會”的表述。此外，筆記中，政治家、記者、宗教人士、工會成員、法官和公職人員都被稱為“收集目標”，並列出了法官等一些目標的真實姓名，以及對於上述目標的“收容及處理辦法”。報道指出，“收集”可以解釋為“逮捕”。    韓警方表示，盧相源的筆記本巴掌大小，有六十至七十頁，包含大量與戒嚴相關的內容。韓警方稱，在對金龍顯的通話記錄進行搜索和分析時，他們確定了在戒嚴前後多次與其聯繫的盧相源是該案的核心人物。    此前，韓國警方十五日緊急逮捕國防部情報司令部司令官文相虎、前情報司令官盧相源。    韓國警察廳國家調查本部特別調查團十五日表示，韓國總統尹錫悅三日宣佈實施緊急戒嚴後，韓國防部、陸軍本部、首都防衛司令部、特戰司令部等部門共出動一千五百多名兵力。,http://www.macaodaily.com/html/2024-12/24/content_1802838.htm,從前情報司令官筆記發現    韓警：涉“引誘朝鮮攻擊”內容    【香港中通社廿三日電】據韓聯社報道，韓國警方廿三日表示，在涉嫌策劃“十二月三日緊急戒嚴”事件的韓軍前情報司令官盧相源（音）的筆記中發現“引誘朝鮮攻擊”內容,從前 情報 司令官 筆記 發現         韓警 ： 涉 “ 引誘 朝鮮 攻擊 ” 內容         【 香港 中通社 廿三日 電 】 據 韓聯社 報道 ， 韓國 警方 廿三日 表示 ， 在 涉嫌 策劃 “ 十二月 三日 緊急 戒嚴 ” 事件 的 韓軍前 情報 司令官 盧相源 （ 音 ） 的 筆記 中 發現 “ 引誘 朝鮮 攻擊 ” 內容 。         據 報道 ， 韓國 警察 廳國家 調查 本部 特別 調查團 相關 人員 廿三日 在 接受 採訪 時 透露 ， 在 盧相源 住所 搜查 到 的 筆記本 中 發現 了 “ 在 NLL （ 韓國主 張半島 西部 海域 朝韓 海上 分界 線 ） 引誘 朝鮮 攻擊 ” 的 內容 。         為 戒嚴 挑釁 朝鮮 ？         報道 指出 ， 這與關 於 韓前國 防部 長 官金龍顯 等 人 為 了 戒嚴 而 挑釁 朝鮮 的 說 法 是 一致 的 。 不過 ， 韓 警方 表示 ， 目前 尚未 證實 是否 按照 筆記本 中 的 描述 採取 了 實際 行動 。         韓 警方 還稱 ， 盧相源 的 筆記本 中 包含 與 戒 嚴有關 的 “ 封鎖 國會 ” 的 表述 。 此外 ， 筆記 中 ， 政治家 、 記者 、 宗教 人士 、 工會 成員 、 法官 和 公職 人員 都 被 稱 為 “ 收集 目標 ” ， 並 列出 了 法官 等 一些 目標 的 真實 姓名 ， 以及 對 於 上述 目標 的 “ 收容 及 處理 辦法 ” 。 報道 指出 ， “ 收集 ” 可以 解釋 為 “ 逮捕 ” 。         韓 警方 表示 ， 盧相源 的 筆記本 巴掌 大小 ， 有 六十 至 七十 頁 ， 包含 大量 與 戒嚴 相關 的 內容 。 韓 警方 稱 ， 在 對 金龍顯 的 通話 記錄 進行 搜索 和 分析 時 ， 他們 確定 了 在 戒 嚴前 後 多次 與 其 聯 繫 的 盧 相 源 是 該 案 的 核心人物 。         此前 ， 韓國 警方 十五日 緊急 逮捕 國 防部 情報 司令部 司令官 文相虎 、 前情 報 司令官 盧相源 。         韓國 警察 廳國家 調查 本部 特別 調查團 十五日 表示 ， 韓國 總統 尹錫悅 三日 宣 佈 實施 緊急 戒嚴 後 ， 韓國 防部 、 陸 軍 本部 、 首都 防衛 司令部 、 特戰 司令部 等 部門 共 出動 一千五百多名 兵力 。,2024-12-24
尹錫悅夫人被爆整容近三小時,韓發佈戒嚴令前    尹錫悅夫人被爆整容近三小時    【本報綜合報道】據環球網、外媒廿三日消息：韓聯社報道，韓國最大在野黨共同民主黨議員張慶泰（音譯）廿三日表示，有目擊者稱，在韓國總統尹錫悅宣佈實施“緊急戒嚴”當天，即本月三日，曾見到尹錫悅妻子金建希在首爾江南區一家整形外科醫院停留了約三小時，直到尹錫悅戒嚴宣佈前一小時的晚上九時三十分才離開。    報道稱，張慶泰廿三日在國會召開的記者會上稱，在十日前收到目擊者上述舉報，並已確認舉報消息的可靠性。張慶泰稱，“根據目擊者舉報，金建希於本月三日下午六時廿五分至九時三十分，約三小時期間，一直待在位於首爾江南區的一家整形外科醫院。”    張慶泰進一步質疑稱，“金建希不應也無法知曉與國家安全相關的緊急戒嚴信息。而她在戒嚴宣佈一小時前匆忙返回官邸，一定另有原因。”他主張，應查明尹錫悅與前國防部長金龍顯等人在秘密場所討論戒嚴事宜時，金建希是否在場的相關情況。    截至發稿前，暫未看到總統府及金建希方面對張慶泰上述說法作出回應。    當地時間十二月三日深夜，尹錫悅突然發動緊急戒嚴，隨後遭韓國國會以涉嫌觸犯“內亂罪”彈劾。韓國國會議長簽署的彈劾議決書於十四日晚七時廿四分被送達至總統辦公室，尹錫悅隨即被停職，並面臨由警檢和公調處組成的戒嚴聯合偵查組的調查，以及憲法法院的彈劾審理。,http://www.macaodaily.com/html/2024-12/24/content_1802839.htm,韓發佈戒嚴令前    尹錫悅夫人被爆整容近三小時    【本報綜合報道】據環球網、外媒廿三日消息：韓聯社報道，韓國最大在野黨共同民主黨議員張慶泰（音譯）廿三日表示，有目擊者稱，在韓國總統尹錫悅宣佈實施“緊急戒嚴”當天，即本月三日，曾見到尹錫悅妻子金建希在首爾江南區一家整形外科醫院停留了約三小時，直到尹錫悅戒嚴宣佈前一小時的晚上九時三十分才離開,韓發 佈 戒 嚴令前         尹錫悅 夫人 被 爆 整容 近三小時         【 本報 綜合 報道 】 據 環球網 、 外媒 廿三日 消息 ： 韓聯社 報道 ， 韓國 最大 在野 黨 共同 民主 黨議員 張慶泰 （ 音譯 ） 廿三日 表示 ， 有 目擊者 稱 ， 在 韓國 總統 尹錫悅 宣 佈 實施 “ 緊急 戒嚴 ” 當天 ， 即 本月 三日 ， 曾見 到 尹錫悅 妻子 金建希 在 首爾 江南 區 一家 整形外科 醫院 停留 了 約 三小時 ， 直到 尹錫悅戒 嚴宣 佈 前 一小 時 的 晚上 九時 三十分 才 離開 。         報道 稱 ， 張慶泰 廿三日 在 國會 召開 的 記者 會 上 稱 ， 在 十 日前 收到 目擊者 上述 舉報 ， 並已 確認 舉報 消息 的 可靠性 。 張慶泰稱 ， “ 根據 目擊者 舉報 ， 金建希 於 本月 三日 下午 六時 廿五 分至 九時 三十分 ， 約 三小時 期間 ， 一直 待 在位 於 首爾 江南 區的 一家 整形外科 醫院 。 ”         張慶泰進 一步 質疑 稱 ， “ 金建 希不應 也 無法 知曉與 國家 安全 相關 的 緊急 戒嚴 信息 。 而 她 在 戒 嚴宣 佈 一小 時前 匆忙 返回 官邸 ， 一定 另有 原因 。 ” 他主張 ， 應 查明 尹錫悅 與 前國 防部 長 金龍顯 等 人 在 秘密 場所 討論 戒嚴 事宜 時 ， 金建希 是否 在場 的 相關 情況 。         截至 發稿 前 ， 暫未 看到 總統府 及 金建希 方面 對 張慶泰 上述 說法 作出 回應 。         當地 時間 十二月 三日 深夜 ， 尹錫悅 突然 發動 緊急 戒嚴 ， 隨後遭 韓國國會 以 涉嫌 觸犯 “ 內亂罪 ” 彈劾 。 韓國國會 議長 簽署 的 彈劾 議決 書 於 十四日 晚七時 廿四 分 被 送 達 至 總統 辦 公室 ， 尹錫悅 隨即 被 停職 ， 並面 臨由警 檢和公調 處 組成 的 戒 嚴聯合 偵查 組 的 調查 ， 以及 憲法 法院 的 彈劾 審理 。,2024-12-24
盧卡申科參選下屆白俄總統,盧卡申科參選下屆白俄總統    【新華社明斯克廿三日電】白俄羅斯中央選舉委員會廿三日確認總統候選人名單，包括現任總統盧卡申科在內的五名候選人獲得參加下一屆總統選舉資格。    選舉下月26日舉行    白俄羅斯中央選舉委員會在統計支持總統候選人的民眾簽名數量後，確認了候選人名單，包括盧卡申科、勞動與正義黨主席希日尼亞克、自由民主黨主席蓋杜克維奇、企業家卡諾帕茨卡婭和共產黨中央委員會第一書記瑟蘭科夫。    新一屆白俄羅斯總統選舉定於明年一月廿六日舉行。根據法律，總統通過直選產生，獲得百分之五十以上選票的候選人將當選總統，否則得票前兩位的候選人將進入第二輪投票，獲得簡單多數票者勝出。    白俄羅斯上一屆總統選舉於二○二○年八月舉行，盧卡申科以百分之八十點一的得票率勝出。,http://www.macaodaily.com/html/2024-12/24/content_1802840.htm,選舉下月26日舉行    白俄羅斯中央選舉委員會在統計支持總統候選人的民眾簽名數量後，確認了候選人名單，包括盧卡申科、勞動與正義黨主席希日尼亞克、自由民主黨主席蓋杜克維奇、企業家卡諾帕茨卡婭和共產黨中央委員會第一書記瑟蘭科夫,盧卡 申科 參選下 屆 白俄 總統         【 新華社 明斯克 廿三日 電 】 白俄 羅 斯 中央 選舉 委員會 廿三日 確認 總統候 選人 名單 ， 包括 現任 總統 盧卡 申科 在 內 的 五名 候選人 獲得 參加下 一屆 總統 選舉 資格 。         選舉 下 月 26 日舉行         白俄 羅 斯 中央 選舉 委員會 在 統計 支持 總統候 選人 的 民眾 簽名 數量 後 ， 確認 了 候選人 名單 ， 包括 盧卡 申科 、 勞動 與 正義黨 主席 希日尼亞克 、 自由民主 黨 主席 蓋 杜克維奇 、 企業家 卡諾 帕茨卡婭 和 共產黨 中央 委員會 第一 書 記瑟蘭 科夫 。         新一屆 白俄 羅 斯 總統 選舉定 於 明年 一月 廿六日 舉行 。 根據 法律 ， 總統 通過 直選產生 ， 獲得 百分之五十 以上 選票 的 候選人將 當選 總統 ， 否則 得票 前 兩位 的 候選人將 進入 第二 輪 投票 ， 獲得 簡單 多 數票者 勝出 。         白俄 羅 斯上 一屆 總統 選舉 於 二 ○ 二 ○ 年 八月 舉行 ， 盧卡 申科以 百分之八十 點一 的 得票率 勝出 。,2024-12-24
特撐TikTok美續運營一段時間,特撐TikTok美續運營一段時間    【本報綜合報道】據新華社、央視新聞、中新網廿三日消息：美國當選總統特朗普廿二日在亞利桑那州舉行的一場保守派大會上表示，他傾向於允許短視頻社交媒體平台TikTok在美國繼續運營一段時間。    讚平台反饋良好    特朗普說，“我們在這個平台收到了良好的反饋，瀏覽量有數十億”“也許我們應該讓它再存在一段時間”。    路透社報道稱，這是特朗普迄今為止反對TikTok退出美國市場最強烈的信號之一。    最高法下月辯論    今年四月廿四日，美國總統拜登簽署一項國會通過的法案，要求TikTok母公司字節跳動在兩百七十天內將TikTok出售給非中國企業，否則這款應用程序將在美國被禁用。本月十六日，TikTok緊急要求美國聯邦最高法院臨時凍結美政府針對該平台的強迫出售令。十八日，美國聯邦最高法院表示，將快速審理這一強迫出售令是否違憲一案，聯邦最高法院定於明年一月十日就此案舉行辯論。,http://www.macaodaily.com/html/2024-12/24/content_1802841.htm,特撐TikTok美續運營一段時間    【本報綜合報道】據新華社、央視新聞、中新網廿三日消息：美國當選總統特朗普廿二日在亞利桑那州舉行的一場保守派大會上表示，他傾向於允許短視頻社交媒體平台TikTok在美國繼續運營一段時間,特撐 TikTok 美續 運營 一段 時間         【 本報 綜合 報道 】 據 新華社 、 央視 新聞 、 中新網 廿三日 消息 ： 美國 當選 總統 特朗普 廿二日 在 亞利 桑那州 舉行 的 一場 保守派 大會 上 表示 ， 他 傾向 於 允許 短視頻 社交 媒體 平台 TikTok 在 美國 繼續 運營 一段 時間 。         讚 平台 反饋 良好         特朗普 說 ， “ 我們 在 這個 平台 收到 了 良好 的 反饋 ， 瀏覽量 有 數十億 ” “ 也許 我們 應該 讓 它 再 存在 一段 時間 ” 。         路透社 報道 稱 ， 這是 特朗普 迄今 為止 反對 TikTok 退出 美國 市場 最 強烈 的 信號 之一 。         最高 法下 月 辯論         今年 四月 廿四日 ， 美國 總統 拜登 簽署 一項 國會 通過 的 法案 ， 要求 TikTok 母公司 字節 跳動 在 兩百 七十 天內將 TikTok 出售 給非 中國 企業 ， 否則 這款 應用 程序 將在 美國 被 禁用 。 本月 十六日 ， TikTok 緊急 要求 美國 聯邦 最高法院 臨時 凍結 美政府 針對 該 平台 的 強迫 出售 令 。 十八日 ， 美國 聯邦 最高法院 表示 ， 將 快速 審理 這一 強迫 出售 令 是否 違憲 一案 ， 聯邦 最高法院 定 於 明年 一月 十日 就 此案 舉行 辯論 。,2024-12-24
本田日產啟合併談判,本田日產啟合併談判    【據新華社東京廿三日電】日本汽車製造商本田汽車公司和日產汽車公司廿三日在東京共同宣佈，本田、日產和三菱汽車三方已簽署諒解備忘錄，本田與日產將正式開啟合併談判，三菱汽車公司將就參與合併事宜進行探討。    後年實現經營合併    本田社長三部敏宏、日產社長內田誠以及三菱汽車社長加藤隆雄共同出席了當天的記者會。    三部說，本田和日產將共同出資成立一家控股公司，雙方均作為該控股公司子公司，以此方式進行合併。控股公司名稱、各方持股比例、人事安排等細節將通過後續談判進一步明確。據三部介紹，本田和日產計劃於二○二五年六月達成最終合併協議，控股公司擬於二○二六年八月正式成立並同步上市。    三菱下月杪前決定    加藤表示，三菱汽車將於二○二五年一月底之前就是否參與合併作出最終決定。    據日本媒體報道，控股公司過半數的內部董事和外部董事將由本田提名，總裁將從本田提名的董事中選出。    日本媒體和專家分析說，目前日產是三菱汽車最大股東，如果未來三菱汽車也加入這一合併，上述三家製造商完成合併後的汽車總年銷量將超過八百萬輛，成為僅次於豐田和大眾的世界第三大汽車集團。    經營受困抱團取暖    分析人士指出，全球汽車產業電動化、智能化浪潮來襲，日本汽車製造商轉型遲緩。日本車企銷量不斷下滑、經營陷入困境，促使它們“抱團取暖”。,http://www.macaodaily.com/html/2024-12/24/content_1802842.htm,本田日產啟合併談判    【據新華社東京廿三日電】日本汽車製造商本田汽車公司和日產汽車公司廿三日在東京共同宣佈，本田、日產和三菱汽車三方已簽署諒解備忘錄，本田與日產將正式開啟合併談判，三菱汽車公司將就參與合併事宜進行探討,本田 日產 啟合 併 談判         【 據 新華社 東京 廿三日 電 】 日本 汽 車 製 造 商 本田 汽車 公司 和 日產 汽車 公司 廿三日 在 東京 共同 宣 佈 ， 本田 、 日產 和 三菱 汽車 三方 已 簽署 諒 解備 忘錄 ， 本田 與 日產將 正式 開 啟合 併 談判 ， 三菱 汽車 公司 將就 參與合 併 事宜 進行 探討 。         後 年 實現 經營合 併         本田 社長 三部 敏宏 、 日產 社長 內田 誠 以及 三菱 汽車 社長 加藤 隆雄 共同 出席 了 當天 的 記者 會 。         三部 說 ， 本田 和 日產將 共同 出資 成立 一家 控股公司 ， 雙方均 作為 該 控股公司 子公司 ， 以此 方式 進行合 併 。 控股公司 名稱 、 各方 持股 比例 、 人事安排 等 細節 將通 過後續 談判進 一步 明確 。 據 三部 介紹 ， 本田 和 日產計劃 於 二 ○ 二 五年 六月 達成 最 終合 併 協議 ， 控股公司 擬於二 ○ 二 六年 八月 正式 成立 並 同步 上市 。         三菱 下 月 杪 前 決定         加藤 表示 ， 三菱 汽車將 於 二 ○ 二 五年 一月底 之前 就 是否 參與合 併 作出 最終 決定 。         據 日本 媒體 報道 ， 控股公司 過半數 的 內部 董事 和 外部 董事 將由 本田 提名 ， 總裁將 從 本田 提名 的 董事 中選出 。         日本 媒體 和 專家 分析 說 ， 目前 日產 是 三菱 汽車 最大 股東 ， 如果 未來 三菱 汽車 也 加入 這一合 併 ， 上述 三家 製 造 商 完成 合 併 後 的 汽車 總年 銷量 將超過 八百 萬輛 ， 成為 僅次 於 豐田 和 大眾 的 世界 第三 大汽車 集團 。         經營 受困 抱團 取暖         分析 人士 指出 ， 全球 汽車 產業 電動化 、 智能化 浪潮 來襲 ， 日本 汽 車 製 造 商 轉 型 遲 緩 。 日本 車企銷量 不斷 下滑 、 經營 陷入困境 ， 促使 它們 “ 抱團 取暖 ” 。,2024-12-24
日櫻島火山噴發,日櫻島火山噴發    【據新華社東京廿三日電】日本氣象廳消息，位於日本鹿兒島縣的櫻島南嶽山頂火山口廿三日上午噴發，火山煙霧從火山口上升至空中三千四百米左右。目前尚無人員傷亡及財產損失報告。    煙霧高達三千四米    日本氣象廳說，此次櫻島南嶽山頂火山口噴發發生在當地時間廿三日七時廿九分（北京時間六時廿九分）。隨後，火山煙霧向東南方向飄動。日本氣象廳提醒相關地區注意火山灰掉落。    櫻島是位於日本九州南部鹿兒島灣內的一座活火山島，由北嶽、中嶽、南嶽三座火山體組成。截至目前，櫻島火山今年噴發已超過四十次，上一次櫻島火山噴發煙霧高度突破三千米是在今年十月十八日。    警戒提升限制入山    目前，日本氣象廳把櫻島的火山警戒級別維持在三級，即限制入山。日本的火山噴發共有五個警戒級別，五級為最高級。,http://www.macaodaily.com/html/2024-12/24/content_1802843.htm,日櫻島火山噴發    【據新華社東京廿三日電】日本氣象廳消息，位於日本鹿兒島縣的櫻島南嶽山頂火山口廿三日上午噴發，火山煙霧從火山口上升至空中三千四百米左右,日櫻島 火山 噴發         【 據 新華社 東京 廿三日 電 】 日本 氣象 廳 消息 ， 位 於 日本 鹿兒 島縣 的 櫻島 南 嶽 山頂 火山口 廿三日 上午 噴發 ， 火山 煙霧 從 火山口 上升 至 空中 三千 四百米 左右 。 目前 尚無人員 傷亡 及 財產 損失 報告 。         煙霧 高達 三千 四米         日本 氣象 廳 說 ， 此次 櫻島 南 嶽 山頂 火山口 噴發 發生 在 當地 時間 廿三日 七時 廿九 分 （ 北京 時間 六時 廿九 分 ） 。 隨後 ， 火山 煙霧 向 東 南方 向 飄動 。 日本 氣象 廳 提醒 相關 地區 注意 火山灰 掉落 。         櫻島 是 位 於 日本 九州 南部 鹿兒 島灣 內 的 一座 活火山 島 ， 由北 嶽 、 中 嶽 、 南 嶽 三座 火山 體組成 。 截至 目前 ， 櫻島 火山 今年 噴發 已 超過 四十 次 ， 上 一次 櫻島 火山 噴發 煙霧 高度 突破 三千米 是 在 今年 十月 十八日 。         警戒 提升 限制 入山         目前 ， 日本 氣象 廳 把 櫻島 的 火山 警戒 級 別維持 在 三級 ， 即 限制 入山 。 日本 的 火山 噴發 共有 五個 警戒 級別 ， 五級 為 最高 級 。,2024-12-24
聖誕老人,聖誕老人    廿二日，在馬來西亞首都吉隆坡街頭，裝扮成聖誕老人的男子向遊客揮手致意。（新華社）,http://www.macaodaily.com/html/2024-12/24/content_1802844.htm,聖誕老人    廿二日，在馬來西亞首都吉隆坡街頭，裝扮成聖誕老人的男子向遊客揮手致意,聖誕 老人         廿二日 ， 在 馬 來 西亞 首都 吉隆坡 街頭 ， 裝 扮成 聖誕 老人 的 男子 向遊 客揮手 致意 。 （ 新華社 ）,2024-12-24
