Title,Content,Link,Summary,Preprocessed_Content,Date
澳協和醫院今開業,設廿五專科門診    暫無現場掛號    澳協和醫院今開業    【本報消息】澳門協和醫院今日正式開業，標誌着澳門醫療迎來新一頁。該院開業後，將按序逐步推出面向非轉介患者的門診服務，並正構建電子化專科掛號服務，以減少居民現場掛號的不便。院方提醒暫時不設現場掛號服務，具體服務安排將適時公佈。    澳門協和醫院於今日上午十一時舉行開業儀式。該院去年十二月二十日起試營運，經過二百七十天的積極準備，醫院各項工作已漸入正軌。醫院自今年三月始，陸續開放一系列超聲檢查、影像檢查和門診服務，服務對象為經衛生局轉介享有免費醫療的患者。現階段，醫院以優先滿足公共醫療衛生服務為原則，已提供廿五個專科門診服務，X光、CT、超聲波掃描及驗血等檢驗服務亦已開展，將持續擴大免費醫療服務的專科範疇，如風濕免疫科、骨科及感染科等。此外，急救服務要待院內所有手術室、病床及病房等準備就緒。    醫護年底達四百人    在人員招聘方面，社會文化司司長歐陽瑜在今年中表示，截至六月，協和醫院員工有一百七十九名，當中五十一人是北京協和醫院派駐；衛生局借調的人員十八人，未來會返回衛生局。早前衛生局則指，澳門協和醫院已聘請本地醫療人員八十多名，非臨床醫療輔助人員約二十名，亦會持續於本澳招聘醫療人員，增加人力以滿足正式營運後所開展的醫療服務，以及培養本地醫療人才。初步計劃醫院人員於年底將達至四百名，明年底招聘至七百人。    三級收費下季設APP    在醫療服務收費方面，收費分三級：第一級為免費醫療，對象為現時享有免費公營專科醫療服務的澳門居民，經衛生局轉介至澳門協和醫院後，可繼續享有與現時相同的免費醫療服務；第二級為收費醫療，包括對澳門居民將考慮給予適當優惠，對非澳門居民如持外地僱員身份認別證、學生簽證及特別逗留證等長期逗留者將按正常標準收費；第三級則為國際醫療，屬私人醫療服務，將提供更高端醫療服務選擇，收費會參考鄰近地區高端醫療服務的市場價格，亦將考慮給予澳門居民適當優惠。    澳門協和醫院預計第四季推出應用程式，分階段提供多項便利公眾求診的功能，首階段將包括線上預約掛號、報告查詢及醫院資訊查詢等功能，以提高醫療服務的便利性和效率。,http://www.macaodaily.com/html/2024-09/16/content_1781539.htm,早前衛生局則指，澳門協和醫院已聘請本地醫療人員八十多名，非臨床醫療輔助人員約二十名，亦會持續於本澳招聘醫療人員，增加人力以滿足正式營運後所開展的醫療服務，以及培養本地醫療人才,設 廿五 專科門診         暫無 現場 掛號         澳協 和 醫院 今 開業         【 本報 消息 】 澳門協 和 醫院 今日 正式 開業 ， 標誌 着 澳門 醫療 迎來 新 一頁 。 該院 開業 後 ， 將 按序 逐步 推出 面向 非 轉介 患者 的 門診 服務 ， 並正構 建電子化 專科 掛號 服務 ， 以 減少 居民 現場 掛號 的 不便 。 院方 提醒 暫時 不設 現場 掛號 服務 ， 具體 服務 安排 將適 時公 佈 。         澳門協 和 醫院 於 今日 上午 十一 時舉行 開業 儀式 。 該院 去年 十二月 二十日 起試 營運 ， 經過 二百七十 天 的 積極 準備 ， 醫院 各項 工作 已漸 入 正軌 。 醫院 自 今年 三月 始 ， 陸續 開放 一系列 超聲 檢查 、 影像 檢查 和 門診 服務 ， 服務 對象 為 經衛 生局 轉介 享有 免費 醫療 的 患者 。 現階段 ， 醫院 以 優先 滿足 公共 醫療 衛生 服務為 原則 ， 已 提供 廿五 個 專科門診 服務 ， X光 、 CT 、 超聲 波掃 描及驗 血 等 檢驗 服務 亦 已 開展 ， 將持續 擴大免 費醫療 服務 的 專科範疇 ， 如風濕 免疫科 、 骨科 及 感染 科等 。 此外 ， 急救 服務要 待院 內 所有 手術室 、 病床 及 病房 等 準備 就緒 。         醫護 年底 達 四百人         在 人員 招聘 方面 ， 社會 文化 司司 長 歐陽瑜 在 今年 中 表示 ， 截至 六月 ， 協和 醫院員 工有 一百七十 九名 ， 當中 五十一 人 是 北京 協和醫院 派 駐 ； 衛生局 借調 的 人員 十八 人 ， 未來 會 返回 衛生局 。 早前 衛生 局則 指 ， 澳門協 和 醫院 已聘 請 本地 醫療 人員八 十多名 ， 非臨床 醫療 輔 助人 員約 二十名 ， 亦 會 持續 於 本澳 招聘 醫療 人員 ， 增加 人力 以滿足 正式 營運後所 開展 的 醫療 服務 ， 以及 培養 本地 醫療 人才 。 初步 計劃 醫院 人員 於 年底 將達 至 四百名 ， 明 年底 招聘 至 七百 人 。         三級 收費 下季 設 APP         在 醫療 服務 收費 方面 ， 收費 分三級 ： 第一 級 為 免費 醫療 ， 對象 為 現時 享有 免費 公營 專科 醫療 服務 的 澳門 居民 ， 經衛 生局 轉介至 澳門協 和 醫院 後 ， 可繼續 享有 與 現時 相同 的 免費 醫療 服務 ； 第二 級 為 收費 醫療 ， 包括 對 澳門 居民 將考慮 給予 適當 優惠 ， 對非 澳門 居民 如持 外地 僱員 身份 認別證 、 學生 簽證 及 特別 逗留 證等長 期 逗留 者 將按 正常 標準 收費 ； 第三 級則 為 國際 醫療 ， 屬 私人 醫療 服務 ， 將 提供 更 高端 醫療 服務 選擇 ， 收費會 參考 鄰 近地 區 高端 醫療 服務 的 市場 價格 ， 亦將 考慮 給予 澳門 居民 適當 優惠 。         澳門協 和 醫院 預計 第四季 推出 應用 程式 ， 分階段 提供 多項 便利 公眾 求診 的 功能 ， 首階段將 包括 線上 預約 掛號 、 報告 查詢 及 醫院 資訊 查詢 等 功能 ， 以 提高 醫療 服務 的 便利性 和 效率 。,2024-09-16
醫務委：推動本地專科高質量發展,醫務委：推動本地專科高質量發展    【本報消息】離島醫療綜合體北京協和醫院澳門醫學中心今開業。醫務委員會成員張志雄認為，醫院將依托北京協和醫院的卓越醫療技術及豐富資源，促進高水平青年醫療人才培養，推動澳門專科醫療服務高質量發展，帶動大健康產業。    張志雄關注到，醫院將採用北京協和醫院的專家團隊、管理理念、先進技術和醫療資源等突出優勢，優先招聘澳門居民，並廣納各地專科領域專家打造一支高水平的專業醫療團隊，善用澳門在引進先進藥物和醫療設備的優勢，為居民和旅客提供優質醫療服務。    特區政府在國家支持下充分發揮“一國兩制”的制度優勢，成功開創與內地合作辦醫的先河，憑藉協和醫院的百年品牌效應和獲高度肯定的頂尖醫療技術，將擴大澳門大健康產業佈局，與現行政策發揮協同效應。期望醫院持續發揮自身優勢，維持以公、私營與非牟利醫療機構及社會各界的緊密合作，完善產業鏈建設和服務對接，打造澳門醫療名城的新名片。    冀增實習培訓    張志雄指出，醫療行業一直是青年升學的熱門選擇。現行《醫療人員專業資格及執業註冊制度》要求不同醫療專業人員完成至少六個月的實習及完成最後考核，才可取得資格認可及申請執照。有關制度於二○二一年生效後有較大的實習需求。展望協和醫院能提供更多不同實習崗位，讓本地青年醫療人才在實習中熟悉本澳醫療體制，並有機會在北京的專家團隊帶領下接觸內地前沿醫療技術，協助掌握知識和磨練技能，為日後執業做好準備。通過和官方及北京協和醫院的合作機制，完善專科醫生培養機制，實現專科醫生在澳門和北京實習，接觸更多案例累積經驗。    他建議院方考慮和有關機構合作，提供不同醫療專業的持續專業發展活動，推動本地醫療人員持續提升自我，助力構建澳門醫療人才梯隊，提升醫療服務品質，滿足居民對優質醫療的強大需求，實現“足不出澳”也可享有優質服務的美好願景。,http://www.macaodaily.com/html/2024-09/16/content_1781540.htm,醫務委員會成員張志雄認為，醫院將依托北京協和醫院的卓越醫療技術及豐富資源，促進高水平青年醫療人才培養，推動澳門專科醫療服務高質量發展，帶動大健康產業,醫務委 ： 推動 本地 專科 高質量 發展         【 本報 消息 】 離島 醫療 綜合體 北京 協和醫院 澳門 醫學 中心 今開業 。 醫務委員會 成員 張志雄 認為 ， 醫院將 依托 北京 協和醫院 的 卓越 醫療 技術 及 豐富 資源 ， 促進 高水平 青年 醫療 人才 培養 ， 推動 澳門 專科 醫療 服務 高質量 發展 ， 帶動 大 健康 產業 。         張志雄關 注到 ， 醫院將 採用 北京 協和醫院 的 專家 團隊 、 管理 理念 、 先進 技術 和 醫療 資源 等 突出 優勢 ， 優先 招聘 澳門 居民 ， 並廣納 各地 專科 領域 專家 打造 一支 高水平 的 專業 醫療 團隊 ， 善用 澳門 在 引進 先進 藥物 和 醫療 設備 的 優勢 ， 為 居民 和 旅客 提供 優質 醫療 服務 。         特區 政府 在 國家 支持 下 充分 發揮 “ 一國 兩制 ” 的 制度 優勢 ， 成功 開創 與 內 地 合作 辦醫 的 先河 ， 憑 藉 協和醫院 的 百年 品牌 效應 和 獲 高度肯定 的 頂 尖 醫療 技術 ， 將擴 大澳 門大 健康 產業 佈 局 ， 與 現行 政策 發揮 協同 效應 。 期望 醫院 持續 發揮 自身 優勢 ， 維持 以公 、 私營 與 非 牟利 醫療 機構 及 社會 各界 的 緊密 合作 ， 完善 產業 鏈建設 和服 務 對 接 ， 打造 澳門 醫療 名城 的 新 名片 。         冀增 實習 培訓         張志雄 指出 ， 醫療 行業 一直 是 青年 升學 的 熱門 選擇 。 現行 《 醫療 人員 專業 資格 及執 業 註 冊 制度 》 要求 不同 醫療 專業 人員 完成 至少 六個 月 的 實習 及 完成 最 後 考核 ， 才 可 取得 資格 認可及 申請 執照 。 有關 制度 於 二 ○ 二 一年 生效 後 有 較 大 的 實習 需求 。 展望 協和醫院 能 提供 更 多 不同 實習 崗位 ， 讓 本地 青年 醫療 人才 在 實習 中 熟悉 本澳 醫療 體制 ， 並有 機會 在 北京 的 專家 團隊 帶 領下 接觸 內 地 前沿 醫療 技術 ， 協助 掌握 知識 和 磨練 技能 ， 為 日 後 執業 做好 準備 。 通過 和 官方 及 北京 協和醫院 的 合作 機制 ， 完善 專科 醫生 培養 機制 ， 實現 專科 醫生 在 澳門 和 北京 實習 ， 接觸 更 多 案例 累積 經驗 。         他 建議 院方 考慮 和 有 關機構 合作 ， 提供 不同 醫療 專業 的 持續 專業 發展 活動 ， 推動 本地 醫療 人員持續 提升 自我 ， 助力 構建 澳門 醫療 人才 梯隊 ， 提升 醫療 服務品 質 ， 滿足 居民 對 優質 醫療 的 強大 需求 ， 實現 “ 足不出 澳 ” 也 可 享有 優質 服務 的 美好 願景 。,2024-09-16
澳協和醫院建醫學交流平台,首屆學術周匯聚專家院士分享經驗    澳協和醫院建醫學交流平台    【本報消息】澳門協和醫院訊：離島醫療綜合體北京協和醫院澳門醫學中心於昨日舉辦“慶祝中華人民共和國成立七十五周年、澳門特別行政區成立廿五周年、離島醫療綜合體北京協和醫院澳門醫學中心首屆澳門協和學術周”開幕式暨大師論壇。    儀式由社會文化司司長歐陽瑜，北京協和醫院名譽院長、中華醫學會會長趙玉沛，社文司司長辦主任、策略發展委員會委員何鈺珊，中聯辦宣文部長萬速成，北京協和醫院院長張抒揚，衛生局長、策略發展委員會委員羅奕龍，北京協和醫院副院長韓丁，財政局副局長、策略發展委員會委員何燕梅，澳門協和醫院院長、策略發展委員會委員吳文銘，澳門醫療專業委員會主席、策略發展委員會副主席李展潤共同主禮。    貫徹國家健康政策    儀式後，活動特邀多位院士舉行“大師論壇”，就多個重要醫學主題分享經驗及交流。出席儀式的嘉賓，還包括來自內地多所重要院校的院士、粵港澳大灣區，以及內地與外國醫學領軍人才、知名專家及業界代表等逾二百人。    歐陽瑜提到，特區政府着力貫徹國家的健康政策，制訂和公佈《健康澳門藍圖》，聯動社會力量，通過持續完善醫療保障制度、優化公共醫療資源配置、拓展社區基礎醫療服務建設、強化居民健康管理能力等措施，推動“健康澳門”建設，從多方面促進醫療衛生服務體系的高質量發展。    澳門協和醫院作為其中一項最重要的民生工程，不僅可為澳門居民帶來更高水平的醫療服務，也可為推動區域醫療合作交流、提升區域醫療水平作出積極貢獻。期望澳門協和學術周將發展成為醫療界高水平的專業交流平台，並有助推動澳門醫療在技術創新、人才培養、服務優化等方面取得嶄新突破；促進澳門與內地、香港乃至國際醫療界的深入合作，共同應對全球醫療衛生的挑戰，提升醫療服務水平。期待澳門醫療界能充分利用澳門獨特的優勢和豐富資源，積極加強與葡語國家、東南亞地區乃至全球醫療機構，在醫療研究、人才培養、技術引進等交流，促進醫療資訊的共享，推動醫療技術的創新與應用，為提升醫療水平貢獻澳門智慧和力量。    助力澳成醫學高地    趙玉沛表示，澳門協和醫院是在中央支持下，澳門特區政府與北京協和醫院緊密合作的寶貴成果，是推動“一國兩制”在衛生健康領域實踐的示範性、標誌性、實質性民生工程，開啟內地醫院在境外運營管理醫療機構的新嘗試，具有獨特、重大和深遠的意義。醫教研三位一體是醫院發展的重要內涵和醫護人員的核心素養，期待學術周能為促進澳門協和醫院合理配置學科資源、加強人才隊伍建設和培育醫學科技創新能力注入強勁動力，為推動澳門大健康產業發展貢獻力量。    張抒揚提到，北京協和建院之初已確立研究重大醫學科學問題的宗旨。一百○三年前，即一九二一年的九月十五至廿一日，北京協和醫院同樣舉辦為期一周的高水平學術活動。在澳門協和醫院即將運行之際，再次以“學術周”迎新開局，是跨越時空的致敬經典與學術傳承。勉勵澳門協和醫院同仁，以學術周的舉辦為新起點，更好發揮平台作用，促進內地與澳門醫學界的交流合作，特別是充分“借力”澳門在新藥研發、新設備優先使用等方面的優勢，推動兩地醫學發展與科技創新，助力澳門早日成為新的醫學高地。    深化技術協同效應    吳文銘表示，在國家、特區政府和社會各界大力支持下，澳門協和醫院去年十二月二十日投入試營運，經過二百七十天的積極準備，目前醫院各項工作已逐漸步入正軌。百年前北京協和開業時舉辦備受重視的學術周活動，澳門協和醫院亦效法當年，舉辦三天活動，設置二十餘個醫學分論壇，國內外報告專家超過百人，出席人員逾千人，並得到多個學術組織支持。強調澳門協和醫院與北京協和血脈相連，推進澳門醫療事業發展，建設立足大灣區，面向東南亞，具有國際影響力的醫學中心，努力成為澳門國際化大都市的另一張“金名片”。    首屆澳門協和學術周本月十三至十五日一連三天在澳門協和醫院舉行，並聯合中華醫學會、中國胰腺病學會、中國醫學裝備協會及亞太血管學術聯盟，分別圍繞腫瘤醫學、前沿技術及檢驗病理、慢病管理、國際醫療、護理等熱點話題設立學術論壇深入學術交流與探討。活動特邀中國工程院院士鄭樹森，中國科學院院士樊嘉，中國工程院院士張學，以及中國科學院院士楊正林出席“大師論壇”就“高水平醫療機構建設與人才培育”以及“精準醫療的理念、現狀與發展”的應用主題，分享經驗及交流心得，期望深化本澳與國內外醫療技術的協同效應，提升各醫療領域的專科水平，共同推動本澳醫療衛生健康事業的發展。,http://www.macaodaily.com/html/2024-09/16/content_1781541.htm,助力澳成醫學高地    趙玉沛表示，澳門協和醫院是在中央支持下，澳門特區政府與北京協和醫院緊密合作的寶貴成果，是推動“一國兩制”在衛生健康領域實踐的示範性、標誌性、實質性民生工程，開啟內地醫院在境外運營管理醫療機構的新嘗試，具有獨特、重大和深遠的意義,首屆 學術 周匯 聚 專家 院士 分享 經驗         澳協 和 醫院 建醫學 交流平台         【 本報 消息 】 澳門協 和 醫院 訊 ： 離島 醫療 綜合體 北京 協和醫院 澳門 醫學 中心 於 昨日 舉辦 “ 慶祝 中華 人民 共和 國 成立 七十五 周年 、 澳門 特別 行政 區 成立 廿五 周年 、 離島 醫療 綜合體 北京 協和醫院 澳門 醫學 中心 首屆 澳門協 和 學術 周 ” 開幕式 暨大 師論壇 。         儀式 由 社會 文化 司司 長 歐陽瑜 ， 北京 協和醫院 名譽 院長 、 中華 醫學會 會長 趙 玉沛 ， 社文司 司長 辦 主任 、 策略 發展 委員會委員 何鈺珊 ， 中聯辦 宣 文部 長 萬 速成 ， 北京 協和醫院 院長 張抒揚 ， 衛生 局長 、 策略 發展 委員會 委員羅奕龍 ， 北京 協和醫院 副 院長 韓丁 ， 財 政局 副 局長 、 策略 發展 委員會 委員何 燕梅 ， 澳門協 和 醫院 院長 、 策略 發展 委員會委員 吳文銘 ， 澳門 醫療 專業 委員會 主席 、 策略 發展 委員會 副 主席 李展潤 共同 主禮 。         貫徹 國家 健康 政策         儀式 後 ， 活動 特邀 多位 院士 舉行 “ 大師 論壇 ” ， 就 多個 重要 醫學主題 分享 經驗 及 交流 。 出席 儀式 的 嘉賓 ， 還 包括 來 自內 地 多所 重要 院校 的 院士 、 粵 港澳 大灣區 ， 以及 內地 與 外國 醫學領 軍 人才 、 知名 專家 及業界 代表 等 逾 二百人 。         歐陽瑜 提到 ， 特區 政府 着力 貫徹 國家 的 健康 政策 ， 制訂 和 公 佈 《 健康 澳門 藍圖 》 ， 聯動 社會 力量 ， 通過 持續 完善 醫療 保障制度 、 優化 公共 醫療 資源 配置 、 拓展 社區 基礎 醫療 服務建設 、 強化 居民 健康 管理 能力 等 措施 ， 推動 “ 健康 澳門 ” 建設 ， 從 多方面 促進 醫療 衛生 服務體系 的 高質量 發展 。         澳門協 和 醫院 作為 其中 一項 最 重要 的 民生 工程 ， 不僅 可為 澳門 居民 帶來 更 高水平 的 醫療 服務 ， 也 可為 推動區域 醫療 合作 交流 、 提升 區域 醫療 水平 作出 積極 貢獻 。 期望 澳門協 和 學術 周將 發展 成為 醫療界 高水平 的 專業 交流平台 ， 並有 助推 動澳門 醫療 在 技術 創新 、 人才 培養 、 服務 優化 等 方面 取得 嶄新 突破 ； 促進 澳門 與 內 地 、 香港 乃至 國際 醫療界 的 深入 合作 ， 共同 應對 全球 醫療 衛生 的 挑戰 ， 提升 醫療 服務 水平 。 期待 澳門 醫療界 能 充分利用 澳門 獨特 的 優勢 和 豐富 資源 ， 積極 加強 與 葡語 國家 、 東南亞 地區 乃至 全球 醫療 機構 ， 在 醫療 研究 、 人才 培養 、 技術 引進 等 交流 ， 促進 醫療 資訊 的 共享 ， 推動 醫療 技術 的 創新 與 應用 ， 為 提升 醫療 水平 貢獻 澳門 智慧 和 力量 。         助力 澳成 醫學 高地         趙 玉沛 表示 ， 澳門協 和 醫院 是 在 中央 支持 下 ， 澳門 特區 政府 與 北京 協和醫院 緊密 合作 的 寶貴 成果 ， 是 推動 “ 一國 兩制 ” 在 衛生 健康 領域 實踐 的 示範性 、 標誌 性 、 實質性 民生 工程 ， 開啟 內地 醫院 在 境外 運營 管理 醫療 機構 的 新嘗試 ， 具有 獨特 、 重大 和 深遠 的 意義 。 醫 教研 三位 一體 是 醫院 發展 的 重要 內涵 和 醫護 人員 的 核心 素養 ， 期待 學術 周能 為 促進 澳門協 和 醫院 合理配置 學科 資源 、 加強 人才 隊伍 建設 和 培育 醫學 科技 創新 能力 注入 強勁動力 ， 為 推動 澳門 大 健康 產業 發展 貢獻 力量 。         張抒揚 提到 ， 北京 協和 建院 之初 已 確立 研究 重大 醫學 科學 問題 的 宗旨 。 一百 ○ 三年 前 ， 即 一九二 一年 的 九月 十五 至 廿一日 ， 北京 協和醫院 同樣 舉辦 為期 一周 的 高水平 學術 活動 。 在 澳門協 和 醫院 即 將運行 之際 ， 再次 以 “ 學術 周 ” 迎新 開局 ， 是 跨越 時空 的 致敬 經典 與 學術 傳承 。 勉勵 澳門協 和 醫院 同仁 ， 以學術 周 的 舉辦 為 新 起點 ， 更好 發揮 平台 作用 ， 促進 內 地 與 澳門 醫學界 的 交流 合作 ， 特別 是 充分 “ 借力 ” 澳門 在 新藥 研發 、 新 設備 優先 使用 等 方面 的 優勢 ， 推動 兩地 醫學 發展 與 科技 創新 ， 助力 澳門 早日 成為 新 的 醫學 高地 。         深化 技術 協同 效應         吳文銘 表示 ， 在 國家 、 特區 政府 和 社會 各界 大力支持 下 ， 澳門協 和 醫院 去年 十二月 二十日 投入 試營運 ， 經過 二百七十 天 的 積極 準備 ， 目前 醫院 各項 工作 已 逐漸 步入 正軌 。 百年 前 北京 協和開業 時舉 辦備 受重 視 的 學術 周活動 ， 澳門協 和 醫院 亦 效法 當年 ， 舉辦 三天 活動 ， 設置 二十 餘個 醫學 分論壇 ， 國內外 報告 專家 超過 百人 ， 出席人 員逾千人 ， 並 得到 多個 學術 組織 支持 。 強調 澳門協 和 醫院 與 北京 協和血脈 相連 ， 推進 澳門 醫療 事業 發展 ， 建設 立足 大灣區 ， 面向 東南亞 ， 具有 國際 影響力 的 醫學 中心 ， 努力 成為 澳門 國際化 大都市 的 另 一張 “ 金 名片 ” 。         首屆 澳門協 和 學術 周 本月 十三 至 十五日 一連 三天 在 澳門協 和 醫院 舉行 ， 並聯合 中華 醫學會 、 中國 胰腺 病學會 、 中國 醫學 裝備 協會 及亞 太 血管 學術 聯盟 ， 分別 圍繞 腫瘤 醫學 、 前沿 技術 及 檢驗 病理 、 慢病 管理 、 國際 醫療 、 護理 等 熱點 話題 設立 學術 論壇 深入 學術 交流 與 探討 。 活動 特邀 中國 工程院 院士 鄭樹森 ， 中國 科學院 院士 樊嘉 ， 中國 工程院 院士 張學 ， 以及 中國 科學院 院士 楊正林 出席 “ 大師 論壇 ” 就 “ 高水平 醫療 機構 建設 與 人才 培育 ” 以及 “ 精準 醫療 的 理念 、 現狀 與 發展 ” 的 應用 主題 ， 分享 經驗 及 交流心得 ， 期望 深化 本澳 與 國內外 醫療 技術 的 協同 效應 ， 提升 各醫療 領域 的 專科 水平 ， 共同 推動本 澳醫療 衛生 健康 事業 的 發展 。,2024-09-16
