Title,Content,Link,Summary,Preprocessed_Content
郭昌宇：腫瘤門診無輪候壓力,離島醫院九月營運可提供診療服務    郭昌宇：腫瘤門診無輪候壓力    【本報消息】仁伯爵綜合醫院院長郭昌宇昨日出席世界癌症日活動時，表示近年本澳癌症發病率變化不大，每年癌症發病數約兩千多例。倘本澳居民懷疑或確診患癌。可轉介至專科醫療跟進，經確診後會提供適切服務。山頂醫院腫瘤專科門診首次輪候時間少於八周，沒有特別的輪候壓力。    郭昌宇稱，肺癌是本澳十大癌症之首，其次為乳癌、大腸癌等，局方已推出子宮頸癌、大腸癌等篩查項目，旨為早診斷、早治療。肺癌與吸煙有直接關係，集中在戒煙門診推行篩查工作。衛生中心正向適齡婦女開展乳腺癌篩查計劃，計劃首階段推行，以問卷發現高危人群，再進一步篩查，正審視問卷工具有否需要調整。    開展乳癌篩查    此外，離島醫院將在九月正式營運，屆時期望可提供腫瘤相關服務，但目前正試營運，暫未有腫瘤科病人轉介至離島醫院。    愛心之友協進會昨日聯同衛生局慢性病防制委員會、護士學會、工聯總會、婦聯總會舉辦“世界癌症日健康教育推廣活動”。透過醫學講座、健康篩查、中醫諮詢、舞台表演等，冀防癌抗癌工作更深入社區民眾，提高大眾對防癌抗癌的認知。    開幕式昨下午二時半假祐漢公園舉行，由中聯辦社工部代表陳鍵、澳門基金會行政委員區榮智，衛生局仁伯爵綜合醫院院長郭昌宇、社區醫療衛生廳長謝師輝，社工局代表卓曉淋，巿政署文康社群處長歐振榮，鏡湖醫院常務副院長李鵬斌、醫生丘熹彬，婦聯總會會長劉金玲，護士學會會長謝少英，工聯總會副理事長趙蘭瑛及愛心之友協進會主席田潔冰、副主席羅少霞、理事長譚穗貞、副理事長曾紀寧等主禮。    田潔冰指出，據世界衛生組織數據顯示，逾三分之一的癌症可以預防，通過預防、早期發現及治療，預估每年可挽救全球數百萬人的生命。是次活動圍繞今年國際抗癌聯盟（UICC）訂定“Close the care gap整合衛生資源，醫療人人共享”的目標主題，邀請醫護以專業知識深入淺出引導居民認識癌症、預防癌症、對抗癌症，也希望以不同專業角度剖析致癌的各種因素，介紹各項癌症篩查的途徑，呼籲大眾及早預防、早期診斷、早期治療。    活動上，丘熹彬主講“常見癌症的預防和篩查”、工聯總會代表許璇珊主講“乳癌，知多D健康D”、婦女聯合總會副理事長黃潔貞主講“兩癌篩查你要知”，以及護士學會專科護士陳正敏主講“壓力與癌症”，並設多項表演項目、有獎遊戲、健康篩查等。,http://www.macaodaily.com/html/2024-02/05/content_1733439.htm,開幕式昨下午二時半假祐漢公園舉行，由中聯辦社工部代表陳鍵、澳門基金會行政委員區榮智，衛生局仁伯爵綜合醫院院長郭昌宇、社區醫療衛生廳長謝師輝，社工局代表卓曉淋，巿政署文康社群處長歐振榮，鏡湖醫院常務副院長李鵬斌、醫生丘熹彬，婦聯總會會長劉金玲，護士學會會長謝少英，工聯總會副理事長趙蘭瑛及愛心之友協進會主席田潔冰、副主席羅少霞、理事長譚穗貞、副理事長曾紀寧等主禮,離島 醫院 九月 營運 可 提供 診療 服務         郭昌宇 ： 腫瘤 門診 無輪候 壓力         【 本報 消息 】 仁 伯爵 綜合 醫院 院長 郭昌宇 昨日 出席 世界 癌症 日活 動時 ， 表示 近年 本澳 癌症 發病率 變化 不大 ， 每年 癌症 發病 數約 兩千 多例 。 倘本澳 居民 懷疑 或 確診 患癌 。 可轉 介至 專科 醫療 跟 進 ， 經確 診後會 提供 適切 服務 。 山頂 醫院 腫瘤 專科門診 首次 輪候 時間 少 於 八周 ， 沒有 特別 的 輪候 壓力 。         郭昌宇稱 ， 肺癌 是 本澳 十大 癌症 之 首 ， 其次 為 乳癌 、 大腸癌 等 ， 局方 已 推出 子宮 頸癌 、 大腸癌 等 篩查 項目 ， 旨 為 早 診斷 、 早 治療 。 肺癌 與 吸煙 有 直接 關 係 ， 集中 在 戒煙門診 推行 篩查 工作 。 衛生 中心 正向 適齡 婦女 開展 乳腺癌 篩查 計劃 ， 計劃 首階段 推行 ， 以 問卷 發現 高危 人群 ， 再進 一步 篩查 ， 正審視 問卷 工具 有否 需要 調整 。         開展 乳癌 篩查         此外 ， 離島 醫院將 在 九月 正式 營運 ， 屆 時 期望 可 提供 腫瘤 相關 服務 ， 但 目前 正試 營運 ， 暫 未有 腫瘤 科 病人 轉介至 離島 醫院 。         愛心 之友 協進會 昨日 聯同 衛生局 慢性病 防制 委員會 、 護士 學會 、 工聯 總會 、 婦聯 總會 舉辦 “ 世界 癌症 日 健康 教育 推廣 活動 ” 。 透過 醫學 講座 、 健康 篩查 、 中醫諮詢 、 舞台 表演 等 ， 冀 防癌 抗癌 工作 更 深入 社區民眾 ， 提高 大眾 對 防癌 抗癌 的 認知 。         開幕式 昨 下午 二時 半假 祐 漢公園 舉行 ， 由 中聯 辦社 工部 代表 陳 鍵 、 澳門 基金 會 行政 委員區 榮智 ， 衛生 局仁 伯爵 綜合 醫院 院長 郭昌宇 、 社區 醫療 衛生 廳長 謝師輝 ， 社工 局 代表 卓曉淋 ， 巿 政署 文康 社群 處長 歐振榮 ， 鏡湖 醫院 常務 副 院長 李鵬斌 、 醫生 丘熹 彬 ， 婦聯 總會會長 劉金玲 ， 護士 學會會長 謝少英 ， 工聯 總會 副 理事 長 趙 蘭瑛 及 愛心 之友 協進會 主席 田潔冰 、 副 主席 羅 少霞 、 理事 長 譚穗貞 、 副 理事 長 曾 紀寧 等 主禮 。         田潔冰 指出 ， 據 世界 衛生 組織 數據 顯示 ， 逾 三分之一 的 癌症 可以 預防 ， 通過 預防 、 早期 發現 及 治療 ， 預估 每年 可 挽救 全球 數百萬人 的 生命 。 是 次 活動圍 繞 今年 國際 抗癌 聯盟 （ UICC ） 訂定 “ Close   the   care   gap 整合 衛生 資源 ， 醫療 人人 共享 ” 的 目標 主題 ， 邀請 醫護以 專業 知識 深入 淺出 引導 居民 認識 癌症 、 預防 癌症 、 對抗 癌症 ， 也 希望 以 不同 專業 角度 剖析 致癌 的 各種 因素 ， 介紹 各項 癌症 篩查 的 途徑 ， 呼籲 大眾 及早 預防 、 早期 診斷 、 早期 治療 。         活動 上 ， 丘熹 彬 主講 “ 常見 癌症 的 預防 和 篩查 ” 、 工聯 總會 代表 許璇 珊主講 “ 乳癌 ， 知多 D 健康 D ” 、 婦女 聯合 總會 副 理事 長 黃 潔貞主講 “ 兩癌 篩查 你 要 知 ” ， 以及 護士 學會 專科護士 陳 正敏 主講 “ 壓力 與 癌症 ” ， 並設 多項 表演 項目 、 有獎 遊戲 、 健康 篩查 等 。
（新聞小語）通盤規劃新城路網便出行    夏  耘,通盤規劃新城路網便出行    新城A區推進建設，A區西側一段道路昨開通，旨在配合新城A區北及中區下一階段共同管道及道路施工。由珠澳口岸人工島及新城A區往澳門半島方向行車須繞道新路段行駛。    A區建設，霎眼多年。港珠澳大橋二○一八年十月通車，“澳車北上”去年實施，由A區往返澳門半島的交通日漸繁忙。新路開通，對區內交通稍稍盤活，但與黑沙環之間的交通往來無太大幫助，整個A區與澳門市區仍繫於黑沙環東方明珠一點，造成瓶頸效應。新建通道難在短期內落成，往來車輛卻日增，瓶頸壓力料越來越大。    完善及前瞻的基礎設施，是發展新區的重要條件。新城填海由特區政府向中央提出申請，至完成圍海造地、推進區內各項基建上馬，至今已近十八載，對外連接交通仍遠遠落後於發展速度，未能配合新區的整體發展，凸顯交通配套的嚴重滯後。    新城A區位於澳門半島以東，作為港珠澳大橋人工島澳門口岸的連接樞紐，亦是本澳對外連接的新“大門”，過境人流、車流匯聚，社會早已提出該區交通需求的重要性，尤其A區具有連接過境關口的功能，早應作出合理及科學的通盤交通規劃。整個新城是白紙一張，理應較好規劃，惟多年來區內其他連接通道遲遲未建成，令人百思不得其解。    興建中的第四條澳氹大橋預計上半年竣工，A區公屋樓群部分已封頂建成，隨後各階段公屋亦將陸續竣工。加上經新城A區往來港珠澳大橋車流量日增，預見區內交通需求和壓力將加大，嚴重影響到東方明珠迴旋處的交通匯流點，連鎖影響到該區周邊路網，特別是往返友誼大橋與關閘及黑沙環東北大馬路各方向的車流。    A區被喻為澳門城區的延伸，完善的交通規劃是發展新城區的重要策略，當局有需要加快建設A區與澳門半島之間的交通連接網絡，及早為日後的經濟及服務功能、居民生活及出行需求做好準備。新城A區的交通設置問題，亦應作為其他填海新區的經驗教訓。    夏  耘,http://www.macaodaily.com/html/2024-02/05/content_1733440.htm,新城A區位於澳門半島以東，作為港珠澳大橋人工島澳門口岸的連接樞紐，亦是本澳對外連接的新“大門”，過境人流、車流匯聚，社會早已提出該區交通需求的重要性，尤其A區具有連接過境關口的功能，早應作出合理及科學的通盤交通規劃,通盤 規劃 新城 路網 便 出行         新城 A 區推進 建設 ， A 區西側 一段 道路 昨開通 ， 旨在 配合 新城 A 區北及 中區 下 一階段 共同 管道 及 道路 施工 。 由珠澳 口岸 人工 島及 新城 A 區往 澳門 半島 方向 行車須 繞 道 新 路段 行駛 。         A 區建設 ， 霎眼 多年 。 港珠 澳大橋 二 ○ 一 八年 十月 通車 ， “ 澳車 北上 ” 去年 實施 ， 由 A 區 往返 澳門 半島 的 交通 日漸 繁忙 。 新路 開通 ， 對區 內 交通 稍稍 盤活 ， 但 與 黑沙 環之間 的 交通 往來 無太大 幫助 ， 整個 A 區與 澳門 市區 仍 繫 於 黑沙 環東方 明珠 一點 ， 造成 瓶頸 效應 。 新建 通道 難 在 短期 內 落成 ， 往來 車輛 卻 日增 ， 瓶頸 壓力料 越來 越大 。         完善 及 前瞻 的 基礎 設施 ， 是 發展 新區 的 重要 條件 。 新城 填海 由特區 政府 向 中央 提出 申請 ， 至 完成 圍海造 地 、 推進區 內 各項 基建 上馬 ， 至今 已近 十八 載 ， 對外 連接 交通 仍遠 遠落 後 於 發展 速度 ， 未能 配合 新區 的 整體 發展 ， 凸顯 交通 配套 的 嚴重 滯 後 。         新城 A 區位 於 澳門 半島 以東 ， 作為 港珠 澳大橋 人工 島澳門 口岸 的 連接 樞紐 ， 亦 是 本澳 對 外連接 的 新 “ 大門 ” ， 過境 人流 、 車流 匯聚 ， 社會 早已 提出 該區 交通 需求 的 重要性 ， 尤其 A 區 具有 連接 過境 關口 的 功能 ， 早應 作出 合理 及科學 的 通盤 交通 規劃 。 整個 新城 是 白紙 一張 ， 理應 較 好 規劃 ， 惟 多年 來區 內 其他 連 接通 道 遲遲 未 建成 ， 令人 百思不得其解 。         興 建中 的 第四 條澳 氹 大橋 預計 上半年 竣工 ， A 區 公屋 樓群 部分 已 封頂 建成 ， 隨後各階段 公屋 亦 將陸續 竣工 。 加上 經 新城 A 區往 來 港珠 澳大橋車 流量 日增 ， 預見區 內 交通 需求 和 壓力將 加大 ， 嚴 重影 響到 東方 明珠 迴 旋處 的 交通 匯流點 ， 連鎖 影響 到 該區 周邊 路網 ， 特別 是 往返 友誼 大橋 與 關閘 及 黑沙 環東 北大 馬 路 各 方向 的 車流 。         A 區被 喻為 澳門 城區 的 延伸 ， 完善 的 交通 規劃 是 發展 新城 區的 重要 策略 ， 當局 有 需要 加快 建設 A 區與 澳門 半島 之間 的 交通 連接 網絡 ， 及早 為 日 後 的 經濟及 服務 功能 、 居民 生活 及 出行 需求 做好 準備 。 新城 A 區的 交通 設置 問題 ， 亦 應作 為 其他 填海 新區 的 經驗 教訓 。         夏     耘
專家分享醫療健康新資訊,專家分享醫療健康新資訊    【本報消息】二○二四醫療與健康路演——“免疫健康”昨日舉辦。主辦方表示，活動共有超過六百名本澳的在職醫護人員報名參與，邀請多名大灣區的醫學專家擔任講者。    活動昨日早上十一時假置地廣場工銀中心九樓何鴻燊博士醫療拓展基金會舉辦，新發病毒診斷（香港）有限公司的專案經理兼高階系統架構師張境翔、香港大學進修學院藥物科學客席講師梁耀鳴、鎧耀環境衛生科技高級科學項目經理嚴緒濃、清華大學附屬北京清華長庚醫院消化內科主任姜泊和廣州市第一人民醫院消化科主任周永健任講者。    講題分別為“旅遊城市在疫情時期的防禦措施”、“台灣ICU 常見葡萄糖：非發酵菌治療方案更新（IDS 指引 2023版）”、“抗菌技術在醫療上的應用”、“鏡澈——讓腸道早癌無所遁形”、“糞菌移植技術（FMT）在消化肝病中的臨床實踐與展望”等。    講者之一梁耀鳴受訪時表示，現時不少人有感冒病徵時會自行購買抗生素藥物服用，但提醒居民雖然抗生素有效對抗病毒，但倘非細菌感染，服用抗生素則無助病情，更有可能增加腎功能衰竭風險，對身體健康造成影響。    呼籲使用抗生素時應先由醫生評估病情，切勿在未經醫生處方下，胡亂服用抗生素。,http://www.macaodaily.com/html/2024-02/05/content_1733441.htm,活動昨日早上十一時假置地廣場工銀中心九樓何鴻燊博士醫療拓展基金會舉辦，新發病毒診斷（香港）有限公司的專案經理兼高階系統架構師張境翔、香港大學進修學院藥物科學客席講師梁耀鳴、鎧耀環境衛生科技高級科學項目經理嚴緒濃、清華大學附屬北京清華長庚醫院消化內科主任姜泊和廣州市第一人民醫院消化科主任周永健任講者,專家 分享 醫療 健康 新資訊         【 本報 消息 】 二 ○ 二四 醫療 與 健康 路演 — — “ 免疫 健康 ” 昨日 舉辦 。 主辦方 表示 ， 活動 共有 超過 六百名 本澳 的 在 職醫護 人員 報名 參 與 ， 邀請 多名 大灣區 的 醫學 專家 擔任 講者 。         活動 昨日 早上 十一 時假置 地廣場 工銀 中心 九樓 何鴻燊 博士 醫療 拓展 基金 會舉 辦 ， 新發 病毒 診斷 （ 香港 ） 有限公司 的 專案 經理 兼 高階系 統架 構師 張境翔 、 香港 大學進 修學院 藥物 科學 客席 講師 梁耀鳴 、 鎧耀 環境 衛生 科技 高級 科學項 目經理 嚴緒濃 、 清華大學 附屬 北京 清華長 庚 醫院 消化 內 科主任 姜泊和廣 州市 第一 人民 醫院 消化科 主任 周永健任 講者 。         講題 分別 為 “ 旅遊 城市 在 疫情 時期 的 防禦 措施 ” 、 “ 台灣 ICU   常見 葡萄糖 ： 非發 酵菌 治療 方案 更新 （ IDS   指引   2023 版 ） ” 、 “ 抗菌 技術 在 醫療 上 的 應用 ” 、 “ 鏡澈 — — 讓 腸道 早癌 無 所 遁形 ” 、 “ 糞菌 移植 技術 （ FMT ） 在 消化 肝病 中 的 臨床 實踐 與 展望 ” 等 。         講者 之一 梁耀鳴 受訪 時 表示 ， 現時 不少 人有 感冒 病徵時 會 自行 購買 抗生素 藥物 服用 ， 但 提醒 居民 雖然 抗生素 有效 對 抗病毒 ， 但 倘非 細菌 感染 ， 服用 抗生素 則無助 病情 ， 更 有 可能 增加 腎 功能 衰竭 風險 ， 對 身體 健康 造成 影響 。         呼籲 使用 抗生素 時應 先 由 醫生 評估 病情 ， 切勿 在 未經 醫生 處方下 ， 胡亂 服用 抗生素 。
今降溫有雨霧,今降溫有雨霧    【本報消息】氣象局預測今日多雲，初時有幾陣雨及薄霧。    氣象局料今日氣溫下降，介乎攝氏十五至十九度，相對濕度百分之七十至九十九，吹三至五級北至東北風及有陣風，最高紫外線指數約為三，級別中等。空氣質量方面，路邊及一般性監測站指數卅五至五十五，高密度住宅區四十至六十，水平良好至普通。    本澳昨日多雲，有微雨及薄霧，天氣極為潮濕，相對濕度百分之九十四至一百，氣溫攝氏十九至二十度，吹二至四級東至東南風。    展望明日氣溫攝氏十七至二十度，相對濕度百分之七十五至九十五，天色多雲，有幾陣微雨，吹四至五級偏東風及有陣風。,http://www.macaodaily.com/html/2024-02/05/content_1733442.htm,氣象局料今日氣溫下降，介乎攝氏十五至十九度，相對濕度百分之七十至九十九，吹三至五級北至東北風及有陣風，最高紫外線指數約為三，級別中等,今降 溫有 雨霧         【 本報 消息 】 氣象局 預測 今日 多 雲 ， 初時 有 幾陣雨及 薄霧 。         氣象 局料 今日 氣溫 下降 ， 介乎 攝氏 十五 至 十九 度 ， 相對 濕度 百分之七十 至 九十九 ， 吹三至 五級 北至 東北風 及 有 陣風 ， 最高 紫外 線 指數 約 為 三 ， 級別 中等 。 空氣 質量 方面 ， 路邊 及 一般性 監測 站 指數卅五至 五十五 ， 高密度 住宅 區 四十 至 六十 ， 水平 良好 至 普通 。         本澳 昨日 多 雲 ， 有 微雨 及 薄霧 ， 天氣 極為 潮濕 ， 相對 濕度 百分之九十 四至 一百 ， 氣溫 攝氏 十九 至 二十度 ， 吹二至 四級 東至 東南風 。         展望 明日 氣溫 攝氏 十七 至 二十度 ， 相對 濕度 百分之七十五 至 九 十五 ， 天色 多 雲 ， 有 幾陣 微雨 ， 吹 四至 五級 偏東 風及 有 陣風 。
博企酒店新春檔全爆滿,業界發財好市    博企酒店新春檔全爆滿    【本報消息】還有五天便踏入龍年，本澳活動精彩紛呈，有文旅部“歡樂春節”活動，還有不同片區連串喜慶活動，處處“綻放”新春氣氛。有酒店業者表示，今年新春業界勢頭勁好，料入住率九成以上；據其了解，六大博企酒店更是由年三十晚至年初九全“爆滿”。    酒店旅業商會理事長盧志良表示，現時旅客量未復疫前，但旅客量不斷向上，業界不僅“睇好”今個新春檔期，亦認為今年業界勢頭勁好，在當局持續拓客源下，酒店入住率可續上升，做到淡季不淡。    今個新春，本澳的舞龍巡演、花車匯演、煙花匯演三項品牌活動，共同獲國家文化和旅遊部列入“歡樂春節”活動框架，將成為本澳新春年度重頭戲。大賽車博物館亦在春節期間有新戰車展出。    博企片區齊辦活動    博企除在旗下度假村舉行系列活動，聯同政府工作團隊活化不同歷史片區，分別在荔枝碗船廠片區、大炮台花園、媽閣塘片區、益隆炮竹廠、龍環葡韻、新馬路片區及福隆新街步行區舉辦連串精彩活動，與居民、旅客歡度新春、共慶佳節，打造龍年新氣象。到了晩上，還有以“璀璨遊樂場”為主題，覆蓋全澳七個區份合共卅四個地點的“幻彩耀濠江”燈飾，細說澳門故事。    盧志良相信能如旅遊局所說，日均十二萬人次甚至更理想，連帶酒店業亦然，生意大旺。外省客固然會留宿澳門一兩天以上，今個新春也有不少灣區旅客選擇留宿澳門，“實行由朝玩到晚”，體驗澳門各區新春活動。    房價不再“海鮮價”    據其了解六大博企酒店更是由年三十晚至年初九全“爆滿”，現時中小型酒店預訂率陸續上升，由年初二至初五達八至九成。房價方面，他稱升幅兩三成，但不會如往年般出現“海鮮價”，因現時澳門有逾四萬間客房，供求關係不如往年緊張；業界也會密切留意平台房價的升幅。人手方面，業界已做足準備、做好服務，迎接客量大增。,http://www.macaodaily.com/html/2024-02/05/content_1733410.htm,業界發財好市    博企酒店新春檔全爆滿    【本報消息】還有五天便踏入龍年，本澳活動精彩紛呈，有文旅部“歡樂春節”活動，還有不同片區連串喜慶活動，處處“綻放”新春氣氛,業界 發財 好市         博企 酒店 新春 檔全 爆滿         【 本報 消息 】 還有 五天 便 踏入 龍年 ， 本澳 活動 精彩 紛呈 ， 有文 旅部 “ 歡樂春節 ” 活動 ， 還有 不同 片區 連串 喜慶 活動 ， 處處 “ 綻放 ” 新春 氣氛 。 有 酒店 業者 表示 ， 今年 新春 業界 勢頭 勁 好 ， 料 入住率 九成 以上 ； 據 其 了解 ， 六大 博企 酒店 更是 由 年三十 晚至 年 初九 全 “ 爆滿 ” 。         酒店 旅業 商會 理事 長 盧志良 表示 ， 現時 旅客量 未 復 疫前 ， 但 旅客量 不斷 向上 ， 業界 不僅 “ 睇 好 ” 今個 新春 檔期 ， 亦 認為 今年 業界 勢頭 勁 好 ， 在 當局 持續拓 客源 下 ， 酒店 入住率 可續 上升 ， 做到 淡季 不淡 。         今個 新春 ， 本澳 的 舞龍 巡演 、 花車 匯演 、 煙花匯 演三項 品牌 活動 ， 共同 獲國家 文化 和 旅遊部 列入 “ 歡樂春節 ” 活動 框架 ， 將成 為 本澳 新春 年度 重頭戲 。 大賽車 博物 館 亦 在 春節 期間 有 新 戰車 展出 。         博企片區 齊辦 活動         博企除 在 旗下 度假村 舉行 系列 活動 ， 聯同 政府 工作 團隊 活化 不同 歷史 片區 ， 分別 在 荔枝 碗 船廠 片區 、 大 炮台 花園 、 媽閣 塘 片區 、 益隆 炮竹 廠 、 龍環 葡韻 、 新馬路 片區 及 福隆 新街 步行 區舉 辦連串 精彩 活動 ， 與 居民 、 旅客 歡度 新春 、 共慶佳節 ， 打造 龍年 新氣象 。 到 了 晩 上 ， 還有 以 “ 璀璨 遊樂場 ” 為主題 ， 覆蓋 全澳七個 區份 合共 卅四個 地點 的 “ 幻彩 耀 濠江 ” 燈飾 ， 細說 澳門 故事 。         盧志良 相信 能 如 旅遊 局所 說 ， 日均 十二 萬 人次 甚至 更 理想 ， 連帶 酒店 業 亦然 ， 生意 大旺 。 外省 客 固然 會 留宿 澳門 一 兩天 以上 ， 今個 新春 也 有 不少 灣區 旅客 選擇 留宿 澳門 ， “ 實行 由 朝 玩 到 晚 ” ， 體驗 澳門 各區 新春 活動 。         房價 不再 “ 海鮮價 ”         據 其 了解 六大 博企 酒店 更是 由 年三十 晚至 年 初九 全 “ 爆滿 ” ， 現時 中小型 酒店 預訂 率 陸續 上升 ， 由 年初二 至 初五 達八至 九成 。 房價 方面 ， 他稱 升幅 兩 三成 ， 但 不會 如 往年 般 出現 “ 海鮮價 ” ， 因現 時 澳門 有 逾 四萬間 客房 ， 供求 關 係 不如 往年 緊張 ； 業界 也 會 密切 留意 平台 房價 的 升幅 。 人手 方面 ， 業界 已 做 足 準備 、 做好 服務 ， 迎接 客 量大增 。
