Title,Content,Link,Summary,Preprocessed_Content,Date
澳郵集獲國際競賽銀獎,澳郵集獲國際競賽銀獎    【本報消息】萬國郵政聯盟及國際集郵聯合會舉辦的國際競賽於去年十一月廿七日至十二月二日在泰國曼谷舉行。澳門郵電的郵集憑藉澳門郵票引人入勝的設計風格及優質的印製技術，於C組級別（每年發行多於七十款郵資票的國家或地區）榮獲銀獎。郵集內容取材自澳門郵電於二○年至二三年發行的郵品，劃分為三個主題：國際焦點、本土特色及中西融匯，展示豐富多元的澳門郵票題材，設計美侖美奐。    郵電局稱，榮獲銀獎對澳門郵電是一大肯定和鼓勵，將繼續透過不同的郵票主題，向世界彰顯“以中華文化為主流、多元文化共存”的澳門風貌。,http://www.macaodaily.com/html/2024-02/29/content_1738243.htm,澳門郵電的郵集憑藉澳門郵票引人入勝的設計風格及優質的印製技術，於C組級別（每年發行多於七十款郵資票的國家或地區）榮獲銀獎,澳郵集 獲國際 競賽 銀獎         【 本報 消息 】 萬國 郵政聯盟 及 國際集 郵聯合會 舉辦 的 國際 競賽 於 去年 十一月 廿七日 至 十二月 二日 在 泰國 曼谷 舉行 。 澳門 郵電 的 郵集 憑 藉 澳門 郵票 引人 入勝 的 設計 風格及 優質 的 印 製 技 術 ， 於 C 組級別 （ 每年 發行 多 於 七十 款 郵資票 的 國家 或 地區 ） 榮獲 銀獎 。 郵集 內容 取材自 澳門 郵電 於 二 ○ 年 至 二三年 發行 的 郵品 ， 劃分 為 三個 主題 ： 國際 焦點 、 本土 特色 及 中西 融匯 ， 展示 豐富 多元 的 澳門 郵票 題材 ， 設計 美 侖 美 奐 。         郵電局 稱 ， 榮獲 銀獎 對 澳門 郵電是 一大 肯定 和 鼓勵 ， 將繼續 透過 不同 的 郵票 主題 ， 向 世界 彰顯 “ 以中華 文化 為 主流 、 多元 文化 共存 ” 的 澳門 風貌 。,2024-02-29
福校青洲中學合作教研收穫豐,福校青洲中學合作教研收穫豐    福建學校與青洲中學日前攜手推進的PBL項目式教學合作教研計劃圓滿結束。此次活動不僅加深了兩校師生的友誼與合作，更為學生提供了展示自我、交流學習的寶貴機會。    在合作教研期間，兩校教師們圍繞小學常識科的教學內容和方法深入探討。雙方共同分享了各自的教學經驗和資源，並就如何在課堂中實施PBL項目式教學進行了細緻的研討。通過此次合作，雙方教師不僅收穫了豐富的教學經驗，也為今後的課程改革提供有效益的參考。    在活動的最後一天，兩校學生代表進行了一場精彩紛呈的成果匯報。學生們在小組合作中針對實際問題深入探究，並準備了詳盡的匯報材料。他們紛紛上台展示了自己在PBL項目式教學中的學習成果，分享解決問題的思路和方法。兩校同學的匯報內容充實、邏輯清晰，贏得了在場師生陣陣掌聲。,http://www.macaodaily.com/html/2024-02/29/content_1738244.htm,此次活動不僅加深了兩校師生的友誼與合作，更為學生提供了展示自我、交流學習的寶貴機會,福校 青洲 中學 合作 教研 收 穫 豐         福建 學校 與 青洲 中學 日前 攜 手推 進 的 PBL 項目式 教學 合作 教研 計劃 圓滿 結束 。 此次 活動 不僅 加深 了 兩校 師生 的 友誼 與 合作 ， 更為 學生 提供 了 展示 自我 、 交流 學習 的 寶貴 機會 。         在 合作 教研 期間 ， 兩校 教師們 圍繞 小學常識科 的 教學 內容 和 方法 深入 探討 。 雙方 共同 分享 了 各自 的 教學 經驗 和 資源 ， 並就 如何 在 課堂 中 實施 PBL 項目式 教學 進行 了 細 緻 的 研 討 。 通過 此次 合作 ， 雙方 教師 不僅 收 穫 了 豐富 的 教學 經驗 ， 也 為 今 後 的 課程 改革 提供 有 效益 的 參考 。         在 活動 的 最 後 一天 ， 兩校 學生 代表 進行 了 一場 精彩 紛呈 的 成果 匯報 。 學生們 在 小組 合作 中針 對 實際 問題 深入 探究 ， 並準備 了 詳盡 的 匯報 材料 。 他們 紛紛 上台 展示 了 自己 在 PBL 項目式 教學 中 的 學習 成果 ， 分享 解決 問題 的 思路 和 方法 。 兩校 同學 的 匯報 內容 充實 、 邏輯 清晰 ， 贏得 了 在 場師 生陣陣 掌聲 。,2024-02-29
婦校家長日促家校溝通,婦校家長日促家校溝通    婦聯學校日前舉行“家長約見日”，班主任就學生的綜合學習情況個別約見家長溝通，並派發二○二三／二○二四學年上學期成績表。    “家長約見日”旨讓家長和教師深入交流，班主任向家長介紹學生的學業成績、行為習慣、課餘活動參與等綜合學習情況，又認真聽取家長對學生在家庭表現的反饋，傾聽家長對學校工作提出的建議。    通過是次家長約見日，讓家長和教師更深入地了解學生的學習狀況，共同關心學生的學習成長，加強親師合作，促進學生學習，提升教學成效。,http://www.macaodaily.com/html/2024-02/29/content_1738245.htm,“家長約見日”旨讓家長和教師深入交流，班主任向家長介紹學生的學業成績、行為習慣、課餘活動參與等綜合學習情況，又認真聽取家長對學生在家庭表現的反饋，傾聽家長對學校工作提出的建議,婦校 家長 日 促家校 溝通         婦聯學校 日前 舉行 “ 家長 約 見 日 ” ， 班主任 就 學生 的 綜合學習 情況 個 別約 見家長 溝通 ， 並派 發二 ○ 二三 ／ 二 ○ 二四 學年 上 學期 成績 表 。         “ 家長 約 見 日 ” 旨 讓 家長 和 教師 深入 交流 ， 班主任 向家長 介紹 學生 的 學業 成績 、 行為 習慣 、 課餘 活動 參 與 等 綜合學習 情況 ， 又 認真 聽 取家長 對 學生 在 家庭 表現 的 反饋 ， 傾聽家長 對 學校 工作 提出 的 建議 。         通過 是 次家長 約 見 日 ， 讓 家長 和 教師 更 深入 地 了解 學生 的 學習 狀況 ， 共同 關心 學生 的 學習 成長 ， 加強 親師 合作 ， 促進 學生 學習 ， 提升 教學 成效 。,2024-02-29
粵華師生探訪九澳護養院,粵華師生探訪九澳護養院    澳門粵華中學師生一行十二人，於二月廿五日到工聯九澳護養院探訪，是次活動共邀請十名院友參加。    學生親手製作有趣又適合院友的拋豆袋遊戲，透過遊戲訓練院友的眼力和計算能力，院友大展身手爭取獎品；學生還精心設計明信片，親手寫上祝福語，送給院舍每位院友，傳遞滿滿的正能量。遊戲過後，學生與院友閒話家常，彼此了解，大家都聊得津津樂道，期望日後能夠再聚。院舍社工除安排師生參觀院舍，讓他們對院舍有初步的認識外，也悉心準備體驗活動給予師生，包括學習使用輪椅、試坐輪椅、試食糊餐等，讓學生透過體驗，能夠換位思考，明白使用者的感受。,http://www.macaodaily.com/html/2024-02/29/content_1738246.htm,院舍社工除安排師生參觀院舍，讓他們對院舍有初步的認識外，也悉心準備體驗活動給予師生，包括學習使用輪椅、試坐輪椅、試食糊餐等，讓學生透過體驗，能夠換位思考，明白使用者的感受,粵華師生 探訪 九 澳護 養院         澳門粵華 中學 師生 一行 十二 人 ， 於 二月 廿五日 到 工聯九澳護 養院 探訪 ， 是 次 活動 共邀 請 十名 院友 參加 。         學生親 手 製 作 有趣 又 適合 院友 的 拋豆袋 遊戲 ， 透過 遊戲 訓練 院友 的 眼力 和 計算 能力 ， 院友 大展身手 爭取 獎品 ； 學生還 精心 設計 明信片 ， 親手 寫 上 祝福 語 ， 送給 院舍 每位 院友 ， 傳遞 滿滿 的 正 能量 。 遊戲過 後 ， 學生 與 院友 閒話 家常 ， 彼此 了解 ， 大家 都 聊得 津津 樂道 ， 期望 日後能夠 再 聚 。 院舍 社工 除 安排 師生 參觀 院舍 ， 讓 他們 對院 舍有 初步 的 認識外 ， 也 悉心 準備 體驗 活動 給予 師生 ， 包括 學習 使用 輪椅 、 試坐 輪椅 、 試食 糊餐 等 ， 讓 學生 透過 體驗 ， 能夠 換位 思考 ， 明白 使用者 的 感受 。,2024-02-29
海星教師培訓優化教學,海星教師培訓優化教學    海星中學日前邀請香港中文大學“優質學校改進計劃”(QSIP)團隊主講教育工作坊，主題聚焦於“探究式教學與學生自評互評”，為教師們帶來豐富的教學理念和實踐策略。    主講者周富鴻博士首先通過數學、中文和科學三個學科的實例，展示如何引導學生從預習中發現問題，並在課堂上深入探究。他強調在教學中利用學生的錯誤進行有效回饋的重要性，並提倡根據學生的學習難點調整教學內容，以促進知識的“探索”和“建構”。周富鴻還提到，教師應重視所有層次的回饋，並通過靈活運用，照顧到學習的多樣性。    工作坊第二部分，柯玉儀通過具體的教學案例，闡述課堂評估如何幫助學生及時了解自己的學習狀態，並據此調整學習方法。同時，這也為教師提供反思和優化教學的機會。,http://www.macaodaily.com/html/2024-02/29/content_1738247.htm,海星教師培訓優化教學    海星中學日前邀請香港中文大學“優質學校改進計劃”(QSIP)團隊主講教育工作坊，主題聚焦於“探究式教學與學生自評互評”，為教師們帶來豐富的教學理念和實踐策略,海星 教師 培訓 優化 教學         海星 中學 日前 邀請 香港中文 大學 “ 優質學 校改 進計劃 ” ( QSIP ) 團隊 主講 教育 工作坊 ， 主題 聚焦 於 “ 探究 式 教學 與 學生 自評 互評 ” ， 為 教師們 帶來 豐富 的 教學 理念 和 實踐 策略 。         主講者 周富 鴻 博士 首先 通過 數學 、 中文 和 科學三個 學科 的 實例 ， 展示 如何 引導 學生 從 預習 中 發現 問題 ， 並在 課 堂上 深入 探究 。 他 強調 在 教學 中 利用 學生 的 錯誤 進行 有效 回饋 的 重要性 ， 並 提倡 根據 學生 的 學習 難點 調整 教學 內容 ， 以 促進 知識 的 “ 探索 ” 和 “ 建構 ” 。 周富鴻還 提到 ， 教師應 重視 所有 層次 的 回饋 ， 並通過 靈活 運用 ， 照顧 到 學習 的 多樣 性 。         工作坊 第二 部分 ， 柯玉儀 通過 具體 的 教學 案例 ， 闡述 課堂 評估 如何 幫助 學生 及 時 了解 自己 的 學習 狀態 ， 並據 此調 整學習 方法 。 同時 ， 這也 為 教師 提供 反思 和 優化 教學 的 機會 。,2024-02-29
人工智能語音克隆技術   學勤進修教育中心電腦專科導師 周柏堅,"人工智能語音克隆技術    今時今日，圖文聲像仍可信嗎？    近日坊間社交媒體曾一度流傳視頻訊息，視頻中某名人接受媒體主持人訪問，分析目前經濟環境，建議人們做甚麼等。驟眼看幾可亂真，完全不覺異樣，內容全是善意忠告。但經考證後，其實該視頻是從人工智能合成，是別有用心人士所為。    欺詐騙案已經從過去最早期的圖文層面，提升到幾年前的聲像層面，－不留神，難分真假。人工智能語音克隆技術(AI Voice Cloning Technology)已相當成熟。    一個真實故事：一位AI專才想知道自己的聲音在人工智能克隆下有多準繩，於是找來他的母親做試驗，他打電話給母親，與她對話，幾分鐘後，他用電腦輸入文字，透過電腦AI代他發聲，大家有問有答，對話自如，最後幾分鐘他轉回用自己真實的聲音發聲。回家後，他告知母親所作之事，母親說她分不出哪段對話是真，哪段對話是AI造成的。    年輕一代喜愛社交媒體，輕易地留下很多自己的個人資料、自己的真實語音，很容易被不法分子利用。今時今日，圖文聲像(Picture, text, audio and video)仍然可信嗎？    學勤進修教育中心電腦專科導師  周柏堅",http://www.macaodaily.com/html/2024-02/29/content_1738248.htm,一個真實故事：一位AI專才想知道自己的聲音在人工智能克隆下有多準繩，於是找來他的母親做試驗，他打電話給母親，與她對話，幾分鐘後，他用電腦輸入文字，透過電腦AI代他發聲，大家有問有答，對話自如，最後幾分鐘他轉回用自己真實的聲音發聲,"人工智能 語音 克隆 技術         今時 今日 ， 圖文聲 像 仍 可信 嗎 ？         近日 坊 間 社交 媒體 曾一度 流傳視 頻訊息 ， 視頻 中 某 名人 接受 媒體 主持人 訪問 ， 分析 目前 經濟 環境 ， 建議 人們 做 甚麼 等 。 驟 眼看 幾可亂 真 ， 完全 不覺 異樣 ， 內容 全是 善意 忠告 。 但經 考證 後 ， 其實 該 視頻 是 從 人工智能 合成 ， 是 別 有 用心 人士 所為 。         欺詐 騙案 已經 從過 去 最 早期 的 圖文層面 ， 提升 到 幾 年前 的 聲 像 層面 ， － 不 留神 ， 難分 真假 。 人工智能 語音 克隆 技術 ( AI   Voice   Cloning   Technology ) 已 相當 成熟 。         一個 真實 故事 ： 一位 AI 專才 想 知道 自己 的 聲音 在 人工智能 克隆 下有 多 準繩 ， 於 是 找 來 他 的 母親 做 試驗 ， 他 打 電話給 母親 ， 與 她 對 話 ， 幾分鐘 後 ， 他用 電腦 輸入 文字 ， 透過 電腦 AI 代他 發聲 ， 大家 有 問有 答 ， 對話 自如 ， 最後幾分鐘 他 轉回用 自己 真實 的 聲音 發聲 。 回家 後 ， 他 告知 母親 所作 之事 ， 母親 說 她 分不出 哪段 對 話 是 真 ， 哪段 對 話 是 AI 造成 的 。         年輕 一代 喜愛 社交 媒體 ， 輕 易地 留下 很多 自己 的 個 人 資料 、 自己 的 真實 語音 ， 很 容易 被 不法分子 利用 。 今時 今日 ， 圖文聲 像 ( Picture ,   text ,   audio   and   video ) 仍然 可信 嗎 ？         學勤 進修 教育 中心 電腦 專科導師     周柏堅",2024-02-29
菜農幼師赴穗學習識國情,菜農幼師赴穗學習識國情    菜農子弟學校幼稚園（威龍分校）於二月廿四日組織全體教師前往廣州市，進行教學人員學習及弘揚中國歷史文化參觀學習之旅，該活動獲教青局資助。    交流團一行十八人在主任王秀碰帶領下到花城廣州，上午先到東山片區，參觀毛澤東同志主辦農民運動講習所舊址紀念館，了解當年如何推動農民運動，為中國革命作出了重要的貢獻。隨後，繼續參觀中國共產黨第三次全國代表大會會址，場館內模擬當時“三大”代表們開會場景，展示紅色革命歷史記憶。下午，學習團到訪西關片區的麻石路、滿洲窗、趟櫳門等，還遊覽了集合西關騎樓的建築精髓“永慶坊”，參觀了粵劇藝術博物館、鍾書閣、護耳屋及活字印刷體驗館。此次學習之旅，讓幼稚園教師加深對大灣區尤其廣州的深厚歷史及文化底蘊的認識，加強對國家和民族的認同感。,http://www.macaodaily.com/html/2024-02/29/content_1738249.htm,菜農幼師赴穗學習識國情    菜農子弟學校幼稚園（威龍分校）於二月廿四日組織全體教師前往廣州市，進行教學人員學習及弘揚中國歷史文化參觀學習之旅，該活動獲教青局資助,菜 農幼師 赴 穗 學習識 國情         菜農 子弟 學校 幼稚 園 （ 威龍 分校 ） 於 二月 廿四日 組織 全體 教師 前往 廣 州市 ， 進行 教學 人員學習 及 弘揚 中國 歷史 文化 參觀 學習 之 旅 ， 該 活動 獲教 青局 資助 。         交流 團 一行 十八 人 在 主任 王秀 碰帶 領下 到 花城 廣州 ， 上午 先到 東山 片區 ， 參觀 毛澤東 同志 主辦 農民運動 講習 所 舊址 紀念館 ， 了解 當年 如何 推動 農民運動 ， 為 中國 革命 作出 了 重要 的 貢獻 。 隨後 ， 繼續 參觀 中國共產黨 第三次 全國 代表 大會會址 ， 場館 內 模擬 當時 “ 三大 ” 代表 們 開會 場景 ， 展示 紅色 革命 歷史 記憶 。 下午 ， 學習 團到 訪西關 片區 的 麻石路 、 滿洲 窗 、 趟 櫳 門等 ， 還遊覽 了 集合 西關 騎樓 的 建築 精髓 “ 永慶坊 ” ， 參觀 了 粵劇 藝術 博物 館 、 鍾 書閣 、 護耳屋 及 活字印刷 體驗館 。 此次 學習 之 旅 ， 讓 幼稚 園教師 加深 對大灣區 尤其 廣州 的 深厚 歷史 及 文化 底蘊 的 認識 ， 加強 對 國家 和 民族 的 認 同感 。,2024-02-29
研究院三期刊獲國家收錄,研究院三期刊獲國家收錄    近年，國際（澳門）學術研究院創辦了多本學術期刊，其中《經濟管理學刊》、《教育發展學刊》、《數學建模研究與應用》自二二年八月開始，被國家哲學社會科學文獻中心及國家哲學社會科學學術期刊數據庫全文收錄。    期刊顧問高勝文表示，這是澳門特區第一批被收錄的學術期刊，體現了研究院科研良好的發展勢頭，辦刊水平受學術界的認同及肯定。未來，為進一步加強學術影響力，將繼續申請加入其他國際期刊資料庫，以進一步把期刊建設為具有澳門優勢、灣區特色、中國靈魂、國際視野的學術名刊。,http://www.macaodaily.com/html/2024-02/29/content_1738250.htm,研究院三期刊獲國家收錄    近年，國際（澳門）學術研究院創辦了多本學術期刊，其中《經濟管理學刊》、《教育發展學刊》、《數學建模研究與應用》自二二年八月開始，被國家哲學社會科學文獻中心及國家哲學社會科學學術期刊數據庫全文收錄,研究院 三 期刊 獲國家 收錄         近年 ， 國際 （ 澳門 ） 學術 研究院 創辦 了 多 本學術 期刊 ， 其中 《 經濟 管理 學刊 》 、 《 教育 發展 學刊 》 、 《 數學 建模 研究 與 應用 》 自二 二年 八月 開始 ， 被 國家 哲學 社會 科學 文獻 中心 及國家 哲學 社會 科學學術 期刊 數據庫 全文 收錄 。         期刊 顧問 高勝文 表示 ， 這是 澳門 特區 第一批 被 收錄 的 學術 期刊 ， 體現 了 研究院 科研 良好 的 發展 勢頭 ， 辦刊 水平 受學術界 的 認同 及 肯定 。 未來 ， 為進 一步 加強 學術 影響力 ， 將繼續 申請 加入 其他 國際 期刊 資料 庫 ， 以進 一步 把 期刊 建設 為 具有 澳門 優勢 、 灣區 特色 、 中國 靈魂 、 國際視野 的 學術 名刊 。,2024-02-29
澳大學者談博彩業負責任投資,澳大學者談博彩業負責任投資    澳門大學日前舉行“澳大學人研究講壇”第十七講，由澳大工商管理學院教授傅曉青以“博彩產業的負責任投資”為題發表演說。講座現場反響熱烈，並吸引眾師生線上參與。    講座上，傅曉青談到當前負責任投資從一種避免投資於特定產業（如煙草、酒精和博彩行業）的投資組合策略，轉變為將環境、社會和企業管治(ESG)議題整合到投資決策中的投資過程，以更好地管理風險並產生可持續及長期的投資回報。該演變引發關注，企業社會責任會否影響機構投資者對博彩產業的投資決策。她亦探討澳門政府在ESG問題上採取的各種舉措對博彩公司機構投資人持股的影響。,http://www.macaodaily.com/html/2024-02/29/content_1738251.htm,講座上，傅曉青談到當前負責任投資從一種避免投資於特定產業（如煙草、酒精和博彩行業）的投資組合策略，轉變為將環境、社會和企業管治(ESG)議題整合到投資決策中的投資過程，以更好地管理風險並產生可持續及長期的投資回報,澳大學者 談 博彩 業負 責任 投資         澳門 大學 日前 舉行 “ 澳大學 人 研究 講壇 ” 第十七 講 ， 由 澳大 工商管理 學院 教授 傅曉青以 “ 博彩 產業 的 負責任 投資 ” 為題 發 表演 說 。 講座 現場 反響 熱烈 ， 並 吸引 眾師 生線 上 參 與 。         講座 上 ， 傅曉青 談到 當前 負責任 投資 從 一種 避免 投資 於 特定 產業 （ 如煙草 、 酒精 和 博彩 行業 ） 的 投資 組合 策略 ， 轉變 為 將環境 、 社會 和 企業 管治 ( ESG ) 議題 整合 到 投資 決策 中 的 投資 過程 ， 以 更好 地 管理 風險 並產生 可持續 及長 期 的 投資 回報 。 該 演變 引發 關注 ， 企業 社會責 任會否 影響 機構 投資者 對 博彩 產業 的 投資 決策 。 她 亦 探討 澳門 政府 在 ESG 問題 上 採取 的 各種 舉措 對 博彩 公司 機構 投資人 持股 的 影響 。,2024-02-29
