Title,Content,Link,Summary,Preprocessed_Content,Date
東盟國際商會改選領導層,東盟國際商會改選領導層    【本報消息】澳門東盟國際商會日前假麗景灣藝術酒店宴會廳舉行二○二四會員大會暨晚宴。大會審議和通過各項報告，最後議決第四屆理監事架構提案。陳海欽等百多名成員獲選為商會第四屆理監事會成員。會後，邀請來自汶萊、老撾、馬來西亞、緬甸、菲律賓、新加坡、泰國等多個東盟國家駐港澳總領事出席交流晚宴。    是次大會由商會常務副主席陳海欽代表第三屆主席曾志龍主持，理事長黃玉詩作會務報告、常務副理事長兼秘書長曹霜作財務報告、監事長李松深作監事會報告。    曾志龍以視像致詞表示，十餘年來商會不但組織商務考察團帶領海峽兩岸暨港澳地區企業家會員走遍東盟十個國家，並每年在澳門國際貿易投資展覽會搭建東盟展區，協助促進與東盟國家的經貿投資以及旅遊文化交流。    黃玉詩作會務報告，闡述包括會務發展、商務考察，參展工作，接待拜訪、慈善公益及學習活動等工作。在中聯辦、外交公署、橫琴深合區、貿促局、經科局和旅遊局等部門重視及支持下，理事會任內帶領海峽兩岸暨港澳地區企業家會員走訪印尼及大灣區。    出席會員一致通過所有報告，並議決第四屆理監事架構，獲出席者一致通過。第四屆理監事架構候任主席為陳海欽、理事長為黃玉詩、監事長為涂映容、秘書長為曹霜。,http://www.macaodaily.com/html/2024-05/23/content_1757147.htm,曾志龍以視像致詞表示，十餘年來商會不但組織商務考察團帶領海峽兩岸暨港澳地區企業家會員走遍東盟十個國家，並每年在澳門國際貿易投資展覽會搭建東盟展區，協助促進與東盟國家的經貿投資以及旅遊文化交流,東盟 國際 商會 改選 領導層         【 本報 消息 】 澳門 東盟 國際 商會 日前 假麗景灣 藝術 酒店 宴會廳 舉行 二 ○ 二四 會員大會 暨 晚宴 。 大會 審議 和 通過 各項 報告 ， 最後議 決 第四 屆理 監事架構 提案 。 陳 海欽 等 百 多名 成員 獲選為 商會 第四 屆理 監事會 成員 。 會 後 ， 邀請 來 自汶萊 、 老撾 、 馬 來 西亞 、 緬甸 、 菲律賓 、 新加坡 、 泰國 等 多個 東盟 國家 駐 港澳 總領 事 出席 交流 晚宴 。         是 次 大會 由 商會常務 副 主席 陳 海欽 代表 第三 屆 主席 曾志龍 主持 ， 理事 長 黃 玉詩 作會務 報告 、 常務 副 理事 長 兼 秘書長 曹霜作 財務 報告 、 監事長 李松 深作 監事會 報告 。         曾志龍 以視 像 致詞 表示 ， 十餘年 來 商會 不但 組織 商務 考察 團帶 領海峽 兩岸 暨 港澳 地區 企業 家會員 走遍 東盟 十個 國家 ， 並 每年 在 澳門 國際 貿易 投資 展覽會 搭建 東盟 展區 ， 協助 促進 與 東盟 國家 的 經貿 投資 以及 旅遊 文化交流 。         黃 玉詩 作會務 報告 ， 闡述 包括 會務 發展 、 商務 考察 ， 參展 工作 ， 接待 拜訪 、 慈善 公益 及學習 活動 等 工作 。 在 中聯辦 、 外交 公署 、 橫琴 深合區 、 貿促局 、 經 科局 和 旅遊局 等 部門 重視 及 支持 下 ， 理事 會任 內帶 領海峽 兩岸 暨 港澳 地區 企業 家會員 走訪 印尼 及大灣區 。         出席 會員 一致 通過 所有 報告 ， 並議決 第四 屆理 監事架構 ， 獲 出席 者 一致 通過 。 第四 屆理 監事架 構候 任 主席 為 陳 海欽 、 理事 長 為 黃 玉詩 、 監事長 為 涂映容 、 秘書長 為 曹霜 。,2024-05-23
新會同鄉會就職開拓創新,新會同鄉會就職開拓創新    【本報消息】澳門新會同鄉會慶祝成立六十五周年暨第二十三屆會長、理事、監事就職及敬老聯歡宴會昨舉行。會長劉少倫表示，新一屆負責人定當秉承優良傳統，竭誠工作，開拓創新，以更好服務會員為己任；充分發揮好該會橋樑紐帶作用，促進家鄉和澳門在文化、經貿、旅遊、飲食等往來，在合作中同進步、齊發展；為特區多元發展、為家鄉持續進步作新貢獻。    宴會昨晚七時半假萬豪軒酒家舉行，前任行政長官、澳門新會同鄉會永遠榮譽會長崔世安，立法會主席高開賢，中聯辦協調部副部長王建峰，郵電局長劉惠明，立法議員鄭安庭、羅彩燕、邱庭彪，江門市委統戰部副部長、市委台港澳工作辦公室主任李欣立，市僑聯主席林春暉，新會區區長劉兵及區政協主席張華等出席。    劉少倫表示，該會始終秉持“愛國、愛澳、愛鄉”宗旨，團結在澳鄉親，服務會員，夯實會務根基、提升凝聚力。尊老敬老是中華民族傳統美德，要努力在全社會廣泛營造尊重長者、愛護長者、學習長者的良好社會氛圍。    劉兵讚揚該會對新會發展作貢獻，希望新一屆理監事持續關注新會、宣傳新會，積極投身新會高質量發展，合力建設繁榮美麗的家園。並支持特區政府依法施政，為澳門長期繁榮穩定作更大貢獻。    餐會筵開五十多席，席間向名譽會長、名譽顧問頒發聘書，並向長者派發利市，設抽獎環節，場面熱鬧。,http://www.macaodaily.com/html/2024-05/23/content_1757148.htm,宴會昨晚七時半假萬豪軒酒家舉行，前任行政長官、澳門新會同鄉會永遠榮譽會長崔世安，立法會主席高開賢，中聯辦協調部副部長王建峰，郵電局長劉惠明，立法議員鄭安庭、羅彩燕、邱庭彪，江門市委統戰部副部長、市委台港澳工作辦公室主任李欣立，市僑聯主席林春暉，新會區區長劉兵及區政協主席張華等出席,新會同 鄉會 就 職開拓 創新         【 本報 消息 】 澳門 新會 同鄉 會慶祝 成立 六十五 周年 暨 第二十三 屆會長 、 理事 、 監事 就 職及 敬老 聯歡 宴會 昨舉行 。 會長 劉少倫 表示 ， 新一屆 負責 人定當 秉承 優良 傳統 ， 竭 誠 工作 ， 開拓 創新 ， 以 更好 服務會員為 己任 ； 充分 發揮 好 該會橋 樑 紐帶 作用 ， 促進家 鄉 和 澳門 在 文化 、 經貿 、 旅遊 、 飲食 等 往來 ， 在 合作 中同 進步 、 齊發展 ； 為 特區 多元 發展 、 為家 鄉持續 進步 作新 貢獻 。         宴會 昨晚 七時 半假 萬豪軒 酒家 舉行 ， 前任 行政 長 官 、 澳門 新會 同鄉 會永遠 榮譽 會長 崔世安 ， 立法 會 主席 高開賢 ， 中聯辦 協調 部副 部長 王建峰 ， 郵電局 長 劉惠明 ， 立法 議員 鄭安庭 、 羅 彩燕 、 邱庭彪 ， 江門 市委 統戰 部副 部長 、 市委 台港澳 工作 辦公 室主任 李欣立 ， 市僑聯 主席 林春暉 ， 新會區 區長 劉兵 及區 政協 主席 張華 等 出席 。         劉少倫 表示 ， 該會 始終 秉持 “ 愛國 、 愛澳 、 愛鄉 ” 宗旨 ， 團結 在 澳鄉親 ， 服務會員 ， 夯 實會務 根基 、 提升 凝聚力 。 尊老敬老 是 中華 民族 傳統 美德 ， 要 努力 在 全社 會廣泛 營造 尊重 長 者 、 愛護長 者 、 學習 長 者 的 良好 社會 氛圍 。         劉 兵 讚 揚 該 會 對 新 會 發 展 作 貢 獻 ， 希望 新 一屆理 監事 持續 關注 新會 、 宣傳 新會 ， 積極 投身 新會 高質量 發展 ， 合力 建設 繁榮 美麗 的 家園 。 並 支持 特區 政府 依法 施政 ， 為 澳門長 期 繁榮 穩定 作 更 大 貢獻 。         餐會 筵開 五十多 席 ， 席間 向 名譽 會長 、 名譽 顧問 頒 發聘書 ， 並向長 者 派 發 利市 ， 設 抽獎 環節 ， 場面 熱鬧 。,2024-05-23
工聯離島辦促優化石排灣公園,工聯離島辦促優化石排灣公園    【本報消息】石排灣水庫周邊的石排灣市區公園於二○二一年下旬投入使用，供居民享受休閒時光。工聯離島辦事處主任梁銘恩和離島社諮委馮子建期望當局進一步優化公園設施及周邊過路設施，為居民提供更舒適環境，吸引更多居民前往。    兩人表示，石排灣社區發展方興未艾，相應社區配套設施如超市、衛生中心和市署綜合服務大樓等陸續投入服務，區內還有不少新樓宇項目相繼落成，可預見居住人口將隨着發展而增長。社區康體設施的建設至關重要，為確保能夠滿足居民休閒和健身場所需求，落實綠色休閒發展核心，須不斷優化區內休憩空間。    冀公園加闊行人道    梁銘恩表示，工聯離島辦事處過去一直關注石排灣區的康體休憩空間，不少居民期望該公園像澳門水塘般成為環狀的休憩空間。現時由於離島醫療綜合體和輕軌工程逐步投入使用，加上周邊道路狹窄車多，居民大多於公園西側步行或運動便折返。建議考慮在工程期間，一併在公園西側加闊行人道或增設棧道，讓居民沿環狀路徑行走，提供更流暢健身體驗。    馮子建表示，石排灣市區公園環境及設施相對完備，但缺乏遮陽設施，大大降低居民到公園意願，亦影響兒童遊玩時舒適度。建議在公園遊玩區設置遮陽設施或設置灑水降溫設施，減輕炎熱天氣對兒童的不適感。並建議增加公園綠化面積。,http://www.macaodaily.com/html/2024-05/23/content_1757149.htm,冀公園加闊行人道    梁銘恩表示，工聯離島辦事處過去一直關注石排灣區的康體休憩空間，不少居民期望該公園像澳門水塘般成為環狀的休憩空間,工聯離 島辦 促優 化石 排灣 公園         【 本報 消息 】 石排灣 水庫 周邊 的 石 排灣 市區 公園 於 二 ○ 二 一年 下旬 投入使用 ， 供 居民 享受 休閒 時光 。 工聯 離島 辦事處 主任 梁銘恩 和 離島 社諮委 馮子建 期望 當局 進 一步 優化 公園 設施 及 周邊 過路 設施 ， 為 居民 提供 更舒適 環境 ， 吸引 更 多 居民 前往 。         兩人 表示 ， 石排灣 社區 發展 方興 未 艾 ， 相應 社區 配套 設施 如 超市 、 衛生 中心 和 市署 綜合 服務大樓 等 陸續 投入 服務 ， 區內 還有 不少 新樓 宇項 目相繼 落成 ， 可 預見 居住 人口 將隨着 發展 而 增長 。 社區 康體 設施 的 建設 至關 重要 ， 為確 保能夠 滿足 居民 休閒 和 健身 場所 需求 ， 落實 綠色 休閒 發展 核心 ， 須不斷 優化區 內 休憩 空間 。         冀公園 加闊 行人 道         梁銘恩 表示 ， 工聯 離島 辦事 處過 去 一直 關注石 排灣區 的 康體 休憩 空間 ， 不少 居民 期望 該公園 像 澳門 水塘 般成 為 環狀 的 休憩 空間 。 現時 由 於 離島 醫療 綜合體 和 輕軌 工程 逐步 投入使用 ， 加上 周邊 道路 狹窄 車多 ， 居民 大多 於 公園 西側 步行 或 運動 便 折返 。 建議 考慮 在 工程 期間 ， 一 併 在 公園 西側 加闊 行人 道 或 增設 棧道 ， 讓 居民 沿環 狀路徑 行走 ， 提供 更流暢 健身 體驗 。         馮子建 表示 ， 石排灣 市區 公園 環境 及 設施 相對 完備 ， 但 缺乏 遮陽 設施 ， 大大降低 居民 到 公園 意願 ， 亦 影響 兒童 遊玩時 舒 適度 。 建議 在 公園 遊玩區 設置 遮陽 設施 或 設置 灑水 降溫 設施 ， 減輕炎 熱天氣 對 兒童 的 不 適感 。 並建議 增加 公園 綠化 面積 。,2024-05-23
“五四青年盃”足賽慶雙慶,“五四青年盃”足賽慶雙慶    【本報消息】二○二四年南光澳大“五四青年盃”五人制足球邀請賽本月十九日上午在澳門開幕。活動旨在慶祝新中國成立七十五周年和澳門回歸祖國二十五周年，同時弘揚“五四”精神，展現新時代青年的風采。    澳門中聯辦經濟部綜合處長鄧強、南光集團副總經理張沛然、司法警察局副局長賴文威、海關副關長李煜輝、工程師學會會長胡祖杰、中建澳門副總經理呂育敏、澳門中銀金融部副總經理鄭嘉聰、澳門大學體育事務部代總監廖文威等出席開球禮。    張沛然強調賽事不僅是一場體育競技，更是新時代青年團結協作、奮發向上的精神體現，傳承和弘揚新時代青年精神。鼓勵運動員揮灑青春汗水，展現個人才華，為澳門的社會體育事業注入新活力。    多年來，南光集團與澳門大學在多個領域展開深入合作，包括學生獎學金計劃、實習實訓項目、科研合作等。這些合作項目不僅為學生提供更廣闊的發展空間，也為企業輸送優秀人才。    來自各單位的八支隊伍展開激烈的角逐，最終由澳門大學獲得比賽冠軍，澳門海關、司法警察局和澳門中銀分別獲得亞、季、殿軍。比賽不僅展現各單位的運動風采和團隊精神，也進一步加深各單位間的友誼和合作。    未來，南光集團將繼續與澳門大學等教育機構深化合作，共同推動澳門青年事業的繁榮發展，為澳門青年提供更多參與企業實習的機會和平台，助力澳門青年實現全面發展。同時，雙方將積極探索校企合作新模式，為澳門“一國兩制”行穩致遠貢獻智慧和力量。,http://www.macaodaily.com/html/2024-05/23/content_1757150.htm,未來，南光集團將繼續與澳門大學等教育機構深化合作，共同推動澳門青年事業的繁榮發展，為澳門青年提供更多參與企業實習的機會和平台，助力澳門青年實現全面發展,“ 五四 青年 盃 ” 足賽慶 雙慶         【 本報 消息 】 二 ○ 二 四年 南光 澳大 “ 五四 青年 盃 ” 五人制 足球 邀請賽 本月 十九日 上午 在 澳門 開幕 。 活動 旨在 慶祝新 中國 成立 七十五 周年 和 澳門 回歸祖國 二十五 周年 ， 同時 弘揚 “ 五四 ” 精神 ， 展現 新 時代 青年 的 風采 。         澳門 中聯辦 經濟部 綜合 處長 鄧強 、 南光 集團 副 總經理 張沛然 、 司法 警察局 副 局長 賴文威 、 海關 副 關長 李煜 輝 、 工程 師學會 會長 胡祖杰 、 中建 澳門 副 總經理 呂育敏 、 澳門 中銀 金融 部副 總經理 鄭嘉聰 、 澳門 大學 體育 事務部代 總監 廖文威 等 出席 開球禮 。         張沛然強 調賽 事不僅 是 一場 體育 競技 ， 更是 新時代 青年 團結 協作 、 奮發 向上 的 精神 體現 ， 傳承 和 弘揚 新 時代 青年 精神 。 鼓勵 運動員揮灑 青春 汗水 ， 展現 個 人才 華 ， 為 澳門 的 社會 體育 事業 注入 新 活力 。         多年 來 ， 南光 集團 與 澳門 大學 在 多個 領域 展開 深入 合作 ， 包括 學生 獎學 金計劃 、 實習 實訓 項目 、 科研 合作 等 。 這些 合作 項目 不僅 為 學生 提供 更廣闊 的 發展 空間 ， 也 為 企業 輸送 優秀 人才 。         來 自 各 單位 的 八支 隊伍 展開 激烈 的 角逐 ， 最終 由 澳門 大學 獲得 比賽 冠 軍 ， 澳門 海關 、 司法 警察局 和 澳門 中 銀分別 獲得亞 、 季 、 殿 軍 。 比賽 不僅 展現 各 單位 的 運動 風采 和 團隊 精神 ， 也 進 一步 加深 各單 位間 的 友誼 和 合作 。         未來 ， 南光 集團 將繼續 與 澳門 大學 等 教育 機構 深化 合作 ， 共同 推動 澳門 青年 事業 的 繁榮 發展 ， 為 澳門 青年 提供 更 多 參 與 企業 實習 的 機會 和 平台 ， 助力 澳門 青年 實現 全面 發展 。 同時 ， 雙方將 積極 探索 校企 合作 新 模式 ， 為 澳門 “ 一國 兩制 ” 行穩致 遠 貢獻 智慧 和 力量 。,2024-05-23
"澳門人才引進政策之我見    澳門大學工商管理學院院長
 澳門大學發展基金會金融學及經濟學講座教授
 余  俊",澳門人才引進政策之我見    二○二一年澳門的出生率僅為一點○九，遠低於維持總人口不變所需要的出生率水平（二點一）。按照出生率一點○九計算，澳門總人口每年大約會以百分之○點五速度減少。    與此同時，從目前人口結構來看，澳門老年人口（即六十五歲及以上）的比例會持續上升。二○二一年澳門老年人口的佔比為百分之十二點二，到二○二三年這一比例已上升到百分之十四點二。也就是說，七個人中就有一個是老人。老化指數（老年人口：少年兒童人口）為百分之一百○六點一，老年人口首度超過少年兒童人口。按照世界衛生組織的定義，在二○二三年澳門已正式宣告邁入“高齡社會”。更為嚴峻的是，到二○四一年，澳門老年人口的佔比會超過百分之二十，到時澳門會邁入“超高齡社會”。澳門的老年人口預計將由二○二一年的八萬三千二百人上升至二○四一年的十六萬四千四百人。    超低的出生率和逐年增加的老年人口比例比然導致總勞動人口供給（Labor Supply）的減少。如果想要填補總勞動人口供給的缺口，就需要引進外來勞動人口，特別是年輕的外來勞動人口。    如果引進的外來勞動人口是高質人才，一個社會問題和一個經濟現象相應而生。一個明顯的社會問題是本地原有勞動人口短期會感到競爭壓力。一個明顯的經濟現象是勞動生產率（Labor Productivity）會隨着更多高質人才加入勞動力市場而提高。如果被引進的高質人才專業吻合澳門政府“一加四”適度多元發展策略，還會助力澳門經濟多元化。    但是勞動力市場，正如其他經濟活動一樣，並非靜態，而是動態。勞動力需求（Labor Demand）會隨着經濟活動（包括投資規模、產業轉型、產業升級等因數）的變化而變化。當勞動生產率提高時，新投資會被吸引進來，甚至帶動新產業，從而刺激新的勞動力需求。所以從長期來看，短期內出現的勞動力市場競爭壓力增強的問題會逐漸減弱或消失。此外，更多的經濟活動的出現往往帶來更多在職培訓（On-the-job-training）機會。還有，外來高質人才可以幫助促進本地勞動人口的技術升級。因此，本地勞動人口的勞動生產率也會被進一步提高，從而提高本地原有勞動人口競爭力和薪資水準。    所以從短期來看，引進年輕外來高質人才可以迅速緩解因低出生率和老齡化所導致勞動人口供給不足問題。從長期看來，引進年輕外來高質人才是對澳門本地勞動人口的補充，而不是取代本地勞動人口。年輕外來高質人才可以提高本地勞動人口的競爭力，也有可能助力澳門經濟多元化的發展策略，促進澳門經濟高質量發展。    澳門大學工商管理學院院長    澳門大學發展基金會金融學及經濟學講座教授    余  俊,http://www.macaodaily.com/html/2024-05/23/content_1757151.htm,年輕外來高質人才可以提高本地勞動人口的競爭力，也有可能助力澳門經濟多元化的發展策略，促進澳門經濟高質量發展,澳門 人才 引進 政策 之 我 見         二 ○ 二 一年 澳門 的 出生率 僅為 一點 ○ 九 ， 遠低 於 維持 總 人口 不變 所 需要 的 出生率 水平 （ 二點 一 ） 。 按照 出生率 一點 ○ 九計算 ， 澳門 總 人口 每年 大約會 以 百分之 ○ 點五 速度 減少 。         與 此 同時 ， 從 目前 人口 結構 來 看 ， 澳門 老年人 口 （ 即 六十五 歲 及 以上 ） 的 比例 會持續 上升 。 二 ○ 二 一年 澳門 老年人 口 的 佔 比 為 百分之十二 點二 ， 到 二 ○ 二三年 這一 比例 已 上升 到 百分之十四 點二 。 也 就是 說 ， 七個 人 中 就 有 一個 是 老人 。 老化 指數 （ 老年人 口 ： 少年 兒童 人口 ） 為 百分之一百 ○ 六點 一 ， 老年人 口 首度 超過 少年 兒童 人口 。 按照 世界 衛生 組織 的 定義 ， 在 二 ○ 二三年 澳門 已 正式 宣告 邁入 “ 高齡 社會 ” 。 更為 嚴峻 的 是 ， 到 二 ○ 四 一年 ， 澳門 老年人 口 的 佔 比會 超過 百分之二十 ， 到 時 澳門會 邁入 “ 超高 齡社會 ” 。 澳門 的 老年人 口 預計將 由 二 ○ 二 一年 的 八萬 三千 二百人 上升 至 二 ○ 四 一年 的 十六 萬 四千 四百人 。         超低 的 出生率 和 逐年 增加 的 老年 人口比例 比然 導致 總勞動 人口 供給 （ Labor   Supply ） 的 減少 。 如果 想要 填補 總勞動 人口 供給 的 缺口 ， 就 需要 引進 外來 勞動 人口 ， 特別 是 年 輕 的 外來 勞動 人口 。         如果 引進 的 外來 勞動 人口 是 高質 人才 ， 一個 社會 問題 和 一個 經濟 現象 相應 而生 。 一個 明顯 的 社會 問題 是 本地 原有 勞動 人口 短期 會 感到 競爭 壓力 。 一個 明顯 的 經濟現 象是 勞動 生產率 （ Labor   Productivity ） 會 隨着 更 多 高質 人才 加入 勞動力 市場 而 提高 。 如果 被 引進 的 高質 人才 專業 吻合 澳門 政府 “ 一加 四 ” 適度 多元 發展 策略 ， 還會 助力 澳門 經濟 多元化 。         但是 勞動力 市場 ， 正如 其他 經濟 活動 一樣 ， 並非 靜態 ， 而是 動態 。 勞動力 需求 （ Labor   Demand ） 會 隨着 經濟 活動 （ 包括 投資 規模 、 產業 轉型 、 產業 升級 等 因數 ） 的 變化 而 變化 。 當勞動 生產率 提高 時 ， 新 投資會 被 吸引 進來 ， 甚至 帶動 新產業 ， 從 而 刺激 新 的 勞動力 需求 。 所以 從長 期來 看 ， 短期 內 出現 的 勞動力 市場 競爭 壓力 增強 的 問題 會 逐漸 減弱 或 消失 。 此外 ， 更 多 的 經濟 活動 的 出現 往往 帶來 更 多 在 職培訓 （ On - the - job - training ） 機會 。 還有 ， 外來 高質 人才 可以 幫助 促進 本地 勞動 人口 的 技術 升級 。 因此 ， 本地 勞動 人口 的 勞動 生產率 也 會 被 進 一步 提高 ， 從 而 提高 本地 原有 勞動 人口 競爭力 和 薪資水準 。         所以 從 短期 來 看 ， 引進 年 輕外 來 高質 人才 可以 迅速 緩解 因低 出生率 和 老齡化 所導致 勞動 人口 供給 不足 問題 。 從長 期 看來 ， 引進 年 輕外 來 高質 人才 是 對 澳門 本地 勞動 人口 的 補充 ， 而 不是 取代 本地 勞動 人口 。 年 輕外 來 高質 人才 可以 提高 本地 勞動 人口 的 競爭力 ， 也 有 可能 助力 澳門 經濟 多元化 的 發展 策略 ， 促進 澳門 經濟 高質量 發展 。         澳門 大學 工商管理 學院 院長         澳門 大學 發展 基金 會 金融 學及 經濟學 講座 教授         余     俊,2024-05-23
