Title,Content,Link,Summary,Preprocessed_Content,Date
深圳機場三跑料明年底投用,陸域軟基工程完成    進驗收移交階段    深圳機場三跑料明年底投用    【本報記者深圳電】深圳機場集團發佈，深圳機場三跑道擴建工程場地陸域形成及軟基處理工程近日全部完工，進入竣工驗收後的場地移交階段，現正開展機場工程施工建設，三跑道預計二○二五年底投入使用。    可起降A三八〇    深圳機場三跑道擴建工程位於機場二跑道和廣深沿江高速間，長三千六百米，寬四十五米，飛行區按照最高等級4F級建設，可起降A三八〇等各類大型客機。建成後，深圳機場可滿足年旅客吞吐量八千萬人次、貨郵吞吐量二百六十萬噸的需求目標，有效提升深圳機場運行保障能力。    深圳機場三跑道擴建工程場地陸域形成及軟基處理工程規劃用海面積約二百八十五點五萬平方米，實際填海面積二百八十一點五萬平方米，陸域形成面積約二百三十八萬平方米，軟基處理面積約二百五十七萬平方米，新建外海堤總長約七千四百三十七點七米，跑道區長三千六百米。建設內容包括外海堤、跑道區、滑行道、土面區、水面區、場區圍堰、穿越道及繞行滑行道、南側燈光帶共八個功能分區的場地陸域形成及軟基處理。    現兩跑道已飽和    深圳機場現有的跑道是按照四千五百萬人次旅客的容量標準設計，去年機場旅客吞吐量達到五千二百七十三萬人次，已突破其容量標準，且第一跑道已投用三十年，急需“騰出手”來對其進行全面檢修，以保障飛機起落安全。因此，通過填海形成新的陸域，用於第三跑道建設，將為深圳國際航空樞紐和粵港澳大灣區世界級機場群建設形成更有力的支撐。    此外，《深圳市機場東綜合交通樞紐工程環境影響報告表》正進行備案前公示。該綜合交通樞紐即將動工，並有望在二○二八年底建成。機場東綜合交通樞紐工程由深江鐵路、廣深第二高鐵兩條高鐵，深大城際一條城際鐵路和一、十二、二十、廿六號線四條城市軌道及陸空側捷運系統、公交車、出租車、小汽車等接駁設施組成，與東航站區（原ABD航站樓拆除重建）一同構建集航空、高速鐵路、城際鐵路、城市軌道等多種交通方式於一體的“空鐵聯運、站城一體”綜合交通樞紐。,http://www.macaodaily.com/html/2024-08/16/content_1774929.htm,陸域軟基工程完成    進驗收移交階段    深圳機場三跑料明年底投用    【本報記者深圳電】深圳機場集團發佈，深圳機場三跑道擴建工程場地陸域形成及軟基處理工程近日全部完工，進入竣工驗收後的場地移交階段，現正開展機場工程施工建設，三跑道預計二○二五年底投入使用,陸域 軟基 工程 完成         進驗 收 移交 階段         深圳 機場 三 跑 料明 年底 投用         【 本報 記者 深圳 電 】 深圳 機場 集團發 佈 ， 深圳 機場 三 跑道 擴建 工程 場地 陸域 形成 及軟 基處理 工程 近日 全部 完工 ， 進入 竣工 驗收 後 的 場地 移交 階段 ， 現正 開展 機場 工程施工 建設 ， 三 跑道 預計 二 ○ 二五 年底 投入使用 。         可 起降 A 三八 〇         深圳 機場 三 跑道 擴建 工程 位 於 機場 二 跑道 和 廣深 沿江 高速 間 ， 長 三千六百 米 ， 寬 四十五 米 ， 飛行區 按照 最高 等級 4F 級 建設 ， 可 起降 A 三八 〇 等 各類 大型 客機 。 建成 後 ， 深圳 機場 可 滿足 年 旅客 吞吐量 八千 萬 人次 、 貨郵 吞吐量 二百六十 萬噸 的 需求 目標 ， 有效 提升 深圳 機場 運行 保障 能力 。         深圳 機場 三 跑道 擴建 工程 場地 陸域 形成 及軟 基處理 工程 規劃 用 海面 積約 二百八十 五點 五萬 平方米 ， 實際 填 海面 積 二百八十 一點 五萬 平方米 ， 陸域 形成 面積 約 二百三十八 萬 平方米 ， 軟基處 理面 積約 二百五十 七萬 平方米 ， 新建 外 海堤 總長 約 七千四百 三十七 點 七米 ， 跑道 區長 三千六百 米 。 建設 內容 包括 外 海堤 、 跑道 區 、 滑行道 、 土面區 、 水面 區 、 場區 圍堰 、 穿越道 及 繞行 滑行道 、 南側 燈光 帶共八個 功能 分區 的 場地 陸域 形成 及軟 基處理 。         現兩 跑道 已 飽 和         深圳 機場 現有 的 跑道 是 按照 四千五百 萬 人次 旅客 的 容量 標準 設計 ， 去年 機場 旅客 吞吐量 達到 五千 二百七十 三萬 人次 ， 已 突破 其 容量 標準 ， 且 第一 跑道 已 投用 三十年 ， 急需 “ 騰 出手 ” 來 對 其 進行 全面 檢修 ， 以 保障 飛機 起落 安全 。 因此 ， 通過 填海 形成 新 的 陸域 ， 用 於 第三 跑道 建設 ， 將為 深圳 國際 航空 樞紐和粵 港澳 大灣區 世界 級 機場 群建設 形成 更 有力 的 支撐 。         此外 ， 《 深圳市 機場 東 綜合 交通 樞紐 工程 環境 影響 報告表 》 正進 行備 案前 公示 。 該 綜合 交通 樞紐 即 將動工 ， 並 有望 在 二 ○ 二八 年底 建成 。 機場 東 綜合 交通 樞紐 工程 由 深江 鐵路 、 廣深 第二 高鐵 兩條 高鐵 ， 深 大城 際 一條 城際 鐵路 和 一 、 十二 、 二十 、 廿六 號線 四條 城市 軌道 及 陸空側 捷運系統 、 公交 車 、 出租 車 、 小汽車 等 接駁 設施 組成 ， 與 東 航站 區 （ 原 ABD 航站 樓 拆除 重建 ） 一同 構建集 航空 、 高速 鐵路 、 城際 鐵路 、 城市 軌道 等 多種 交通 方式 於 一體 的 “ 空鐵聯運 、 站城 一體 ” 綜合 交通 樞紐 。,2024-08-16
深圳直飛布達佩斯客運線開通,深圳直飛布達佩斯客運線開通    【本報記者深圳電】深圳直飛匈牙利首都布達佩斯的國際客運航線近日首航，這是深圳機場今年開通的第四條洲際客運航線，也是今年開通的又一條通達深圳“友城”（友好城市及友好交流城市）的直飛航線。深圳與“友城”之間的客運航線達到十四條，進一步加強了深圳與外界的互通互聯，助力深圳擴大更高水平對外開放。    開通的深圳至布達佩斯航線由海南航空運營，採用波音七八七寬體客機執飛，每周執行兩班，單程飛行時長約十二個小時。航班計劃每周一、周五凌晨兩點由深圳寶安國際機場出港至布達佩斯李斯特 · 費倫茨國際機場；返程航班計劃周二、周六凌晨四點五十分落地深圳機場。    布達佩斯被譽為“多瑙河上的明珠”，它不僅是匈牙利的首都，也是中東歐地區重要的經濟、文化和交通樞紐。深圳與布達佩斯自二○○七年四月簽署《加強交流與合作備忘錄》後便確立了友好交流城市關係。據了解，深圳在開展對匈牙利經貿合作方面一直走在前列。華為、中興、比亞迪等一批深圳企業在匈牙利扎根經營多年。去年，深圳對匈牙利的進出口總額達到廿六億。    為進一步暢通深匈兩地之間的信息流、資金流、技術流、產品流、產業流、人員流，今年三月，深圳機場還聯合中國外運開通了深圳至布達佩斯定期貨運航線，目前每周出港兩班，每周出港運力超一百二十噸，主要承運深圳本地跨境電商、通訊電子、半導體等貨物。,http://www.macaodaily.com/html/2024-08/16/content_1774931.htm,為進一步暢通深匈兩地之間的信息流、資金流、技術流、產品流、產業流、人員流，今年三月，深圳機場還聯合中國外運開通了深圳至布達佩斯定期貨運航線，目前每周出港兩班，每周出港運力超一百二十噸，主要承運深圳本地跨境電商、通訊電子、半導體等貨物,深圳 直飛布 達 佩斯 客運線 開通         【 本報 記者 深圳 電 】 深圳 直飛 匈牙利 首都 布達 佩斯 的 國際客 運航線 近日 首航 ， 這是 深圳 機場 今年 開通 的 第四 條洲際 客運 航線 ， 也 是 今年 開通 的 又 一條 通達 深圳 “ 友城 ” （ 友好城市 及 友好 交流 城市 ） 的 直飛 航線 。 深圳 與 “ 友城 ” 之間 的 客運 航線 達 到 十四 條 ， 進 一步 加強 了 深圳 與 外界 的 互通 互聯 ， 助力 深圳 擴大 更 高水平 對外 開放 。         開通 的 深圳 至布達 佩斯 航線 由 海南 航空 運營 ， 採用 波音 七 八七 寬體 客機 執飛 ， 每周 執行 兩班 ， 單程 飛行 時長 約 十二 個小時 。 航班 計劃 每周 一 、 周五 凌晨 兩點 由 深圳 寶安國際 機場 出港 至布達 佩斯 李斯特   ·   費倫茨國際 機場 ； 返程 航班 計劃 周二 、 周六 凌晨 四點 五 十分 落地 深圳 機場 。         布達 佩斯 被譽 為 “ 多瑙河 上 的 明珠 ” ， 它 不僅 是 匈牙利 的 首都 ， 也 是 中東 歐地區 重要 的 經濟 、 文化 和 交通 樞紐 。 深圳 與 布達 佩斯 自二 ○ ○ 七年 四月 簽署 《 加強 交流 與 合作 備忘錄 》 後 便 確立 了 友好 交流 城市 關 係 。 據 了解 ， 深圳 在 開展 對 匈牙利 經貿 合作 方面 一直 走 在 前列 。 華為 、 中興 、 比亞迪 等 一批 深圳 企業 在 匈牙利 扎根 經營 多年 。 去年 ， 深圳 對 匈牙利 的 進 出口 總額 達 到 廿六 億 。         為進 一步 暢通 深 匈兩地 之間 的 信息流 、 資金流 、 技術流 、 產 品流 、 產業流 、 人員流 ， 今年 三月 ， 深圳 機場 還聯合 中國外 運開通 了 深圳 至布達 佩斯 定期 貨運 航線 ， 目前 每周 出港 兩班 ， 每周 出港 運力 超 一百二十 噸 ， 主要 承運 深圳 本地 跨境 電商 、 通訊 電子 、 半導體 等 貨物 。,2024-08-16
東航物流華南分公司深圳成立,佈局灣區拓跨境電商業務    東航物流華南分公司深圳成立    【本報記者深圳電】東航物流華南分公司近日在深圳正式掛牌成立，標誌着深圳機場與東航物流的戰略合作開啟新篇章。東航物流華南分公司將依托東航物流的全球航網資源，積極拓展跨境電商、冷鏈物流等多種物流業務，形成多元化的業務格局。    東航物流是我國現代綜合物流服務頭部企業，面向全球客戶提供安全、高效、精準、便捷的物流服務。長期以來，深圳機場與東航物流形成了良好的合作關係，自二○二○年十一月起，東航物流在深圳機場投入兩架B777全貨機，運營深圳至倫敦（三班/周）、深圳至洛杉磯（四班/周）兩條國際貨航線。其中，深圳至倫敦航線主要以跨境電商貨物為主、普貨為輔，深圳至洛杉磯航線為跨境電商及普貨。據統計，東航物流全貨機及客機腹艙每周貨運量超一千四百噸，今年上半年，東航物流在深圳機場進出港貨運量已達近三點七萬噸。    華南分公司成立後，東航物流將以深圳機場作為華南地區全貨機運營基地，整合利用全球航線網絡資源和綜合保障實力，重點圍繞深圳城市發展定位，積極拓展與深圳產業高度關聯的戰略性航點，為“深圳製造”出海和增加全球市場“含深度”提供更多支撐，共同助力粵港澳大灣區貨物走向世界。    深圳機場集團表示，將大力支持東航物流華南分公司做強業務、做大規模、做優生態，攜手推動航空物流高質量發展，同時也加強與國內外友好機場、航空公司、物流企業的密切合作，持續提升航空樞紐能級，開拓更多客貨運航線。,http://www.macaodaily.com/html/2024-08/16/content_1774932.htm,華南分公司成立後，東航物流將以深圳機場作為華南地區全貨機運營基地，整合利用全球航線網絡資源和綜合保障實力，重點圍繞深圳城市發展定位，積極拓展與深圳產業高度關聯的戰略性航點，為“深圳製造”出海和增加全球市場“含深度”提供更多支撐，共同助力粵港澳大灣區貨物走向世界,佈 局灣區 拓 跨境 電商業務         東航 物流 華南 分公司 深圳 成立         【 本報 記者 深圳 電 】 東航 物流 華南 分公司 近日 在 深圳 正式 掛牌 成立 ， 標誌 着 深圳 機場 與 東航 物流 的 戰略 合作 開啟 新篇章 。 東航 物流 華南 分公司 將 依托 東航 物流 的 全球 航網 資源 ， 積極 拓展 跨境 電商 、 冷鏈 物流 等 多種 物流 業務 ， 形成 多元化 的 業務 格局 。         東航 物流 是 我國 現代 綜合 物流 服務頭部 企業 ， 面向 全球 客戶 提供 安全 、 高效 、 精準 、 便捷 的 物流 服務 。 長 期以 來 ， 深圳 機場 與 東航 物流 形成 了 良好 的 合作 關 係 ， 自二 ○ 二 ○ 年 十一月 起 ， 東航 物流 在 深圳 機場 投入 兩架 B777 全貨機 ， 運營 深圳 至倫敦 （ 三班 / 周 ） 、 深圳 至洛杉磯 （ 四班 / 周 ） 兩條 國際貨 航線 。 其中 ， 深圳 至倫敦 航線 主要 以 跨境 電商 貨物 為 主 、 普貨為 輔 ， 深圳 至洛杉磯 航線 為 跨境 電商及 普貨 。 據 統計 ， 東航 物流 全貨機 及 客機 腹艙 每周 貨運量 超 一千四百 噸 ， 今年 上半年 ， 東航 物流 在 深圳 機場 進 出港 貨運量 已達近 三點 七萬噸 。         華南 分公司 成立 後 ， 東航 物流 將以 深圳 機場 作為 華南 地區 全貨機 運營 基地 ， 整合 利用 全球 航線 網絡 資源 和 綜合 保障 實力 ， 重點 圍繞 深圳 城市 發展 定位 ， 積極 拓展 與 深圳 產業 高度 關聯 的 戰略性 航點 ， 為 “ 深圳 製 造 ” 出海 和 增加 全球 市場 “ 含 深度 ” 提供 更 多支 撐 ， 共同 助力 粵 港澳 大灣區 貨物 走向世界 。         深圳 機場 集團 表示 ， 將 大力支持 東航 物流 華南 分公司 做 強業務 、 做大規模 、 做 優生態 ， 攜 手推 動 航空 物流 高質量 發展 ， 同時 也 加強 與 國內外 友好 機場 、 航空公司 、 物流 企業 的 密切合作 ， 持續 提升 航空 樞紐 能級 ， 開拓 更 多 客貨運 航線 。,2024-08-16
廣州國際港到發中歐班列破千,廣州國際港到發中歐班列破千    【本報記者廣州電】廣州海關公佈，八月二日，在廣州車站海關的監管下，一列滿載家電、LED燈具的中歐班列從廣州國際港站緩緩駛出，前往歐洲地區，標誌着廣州國際港站到發中歐班列突破一千列。    廣州國際港中歐班列站點於二○二二年八月四日正式啟用，地處廣州市白雲區江高鎮，北接廣州空港經濟區，南通廣州南沙港，地理區位優勢明顯，是廣東省唯一、華南地區最大的國家級鐵路貨運站場。據統計，自廣州國際港中歐班列站點啟用以來，截至今年八月二日，累計到發中歐班列突破一千列，發運標箱超九點五萬個，貨物貨值超二百二十五億元人民幣，為服務共建“一帶一路”高質量發展注入強勁動能。    為滿足“灣區製造”產品出口需求，廣州海關聚焦班列發展需求開展深度調研，依托“關長聯繫企業”、“關長送政策上門”等機制，支持運營平台常態化開行新能源汽車專列、通信設備專列、液晶電視專列以及微波爐、空調專列等“精品班列”，發揮鐵路運輸優勢提升貿易質量。    今年以來，廣州車站海關已監管由廣州國際港開行出口“精品班列”一百一十八列，佔中歐班列開行總量的五成，出口貨物涉及液晶電視機、空調、廚房電器等多個品類，助力“廣貨廣出”跑出“加速度”。    目前，廣州國際港常態化開行“十一出五進”共十六條中歐班列線路，通達西歐、東歐、西亞、中亞等地區的二十多個國家、四十餘個城市，出口商品涉及汽車、家電、服裝等一百多個品種，為四千餘家外貿企業提供了高效、安全、穩定的國際物流通道。,http://www.macaodaily.com/html/2024-08/16/content_1774933.htm,目前，廣州國際港常態化開行“十一出五進”共十六條中歐班列線路，通達西歐、東歐、西亞、中亞等地區的二十多個國家、四十餘個城市，出口商品涉及汽車、家電、服裝等一百多個品種，為四千餘家外貿企業提供了高效、安全、穩定的國際物流通道,廣州 國際港 到 發中歐 班列 破千         【 本報 記者 廣州電 】 廣州海 關公 佈 ， 八月 二日 ， 在 廣州車 站 海關 的 監管 下 ， 一列 滿載 家電 、 LED 燈具 的 中歐 班列 從廣州 國際港 站 緩 緩駛出 ， 前往 歐洲 地區 ， 標誌 着 廣州 國際港 站 到 發中歐 班列 突破 一千 列 。         廣州 國際港 中歐 班列 站點 於 二 ○ 二 二年 八月 四日 正式 啟用 ， 地處廣 州市 白雲區 江高鎮 ， 北接 廣州 空港 經濟區 ， 南通 廣州 南沙 港 ， 地理 區位 優勢 明顯 ， 是 廣東省 唯一 、 華南 地區 最大 的 國家級 鐵路 貨運 站場 。 據 統計 ， 自廣州 國際港 中歐 班列 站 點啟 用以 來 ， 截至 今年 八月 二日 ， 累計 到 發中歐 班列 突破 一千 列 ， 發運 標箱 超九點 五萬個 ， 貨物 貨值 超 二百二十五 億元 人民 幣 ， 為 服務 共建 “ 一帶 一路 ” 高質量 發展 注入 強勁動 能 。         為 滿足 “ 灣 區 製 造 ” 產品 出口 需求 ， 廣州 海關 聚焦 班列 發展 需求 開展 深度 調研 ， 依托 “ 關長 聯 繫 企 業 ” 、 “ 關長 送 政策 上門 ” 等 機制 ， 支持 運營 平台 常態化 開行 新能源 汽車 專列 、 通信 設備 專列 、 液晶 電視 專列 以及 微波 爐 、 空調 專列 等 “ 精品 班列 ” ， 發揮 鐵路 運輸 優勢 提升 貿易 質量 。         今年 以來 ， 廣州車 站 海關 已 監管 由 廣州 國際港 開行 出口 “ 精品 班列 ” 一百一十 八列 ， 佔 中歐 班列 開行 總量 的 五成 ， 出口 貨物 涉及 液晶 電視機 、 空調 、 廚房 電器 等 多個 品類 ， 助力 “ 廣貨廣出 ” 跑 出 “ 加速度 ” 。         目前 ， 廣州 國際港 常態化 開行 “ 十一 出五進 ” 共 十六 條中歐 班列 線路 ， 通達 西歐 、 東歐 、 西亞 、 中亞 等 地區 的 二十多 個國家 、 四十 餘個 城市 ， 出口商品 涉及 汽車 、 家電 、 服裝 等 一百多 個 品種 ， 為 四千 餘家 外貿 企業 提供 了 高效 、 安全 、 穩定 的 國際 物流 通道 。,2024-08-16
新濠天地暑假精彩周末   馬  龍,新濠天地暑假精彩周末    今個夏季，新濠天地精心預備了浪接浪的驚喜夏日活動，約定來澳旅客與本澳居民一同“濠”玩暑假周末。    港藝人一起唱演玩    剛過去的七月已迎來多位明星藝人歡度多個周末，包括譽滿大灣區的香港音樂組合農夫，多才多藝的電視節目主持李思捷、林盛斌、阮兆祥、陸浩明，香港著名歌手JW王灝兒、陳奐仁、周志康及藝人朱智賢等，親臨澳門首屈一指的娛樂度假村新濠天地《濠玩夏令營》。各藝人嘉賓施展渾身解數落力表演，近距離與觀眾互動打卡以及玩刺激遊戲，氣氛熱烈。    踏入八月，暑假正式進入一個月倒數，《濠玩夏令營》明星藝人陣容繼續強大，著名歌手周柏豪、鄭融、布志綸以及一眾廣受歡迎的電視節目明星藝人如謝天華、麥美恩、菊梓喬、黃翠如及蕭正楠等，於八月十一日至九月一日，連續四個周末駕臨新濠天地，近距離為觀眾深情獻唱，表演及互動玩遊戲。勝出的現場朋友，更有機會贏得新濠天地精選豐富獎品以及金龍擺設。    特色禮品精彩驚喜    《濠玩夏令營》亦會呈獻樂隊現場表演及派發多款特色禮品，賓客在社交平台打卡並加上指定標記，還可獲贈免費雪糕。成為新濠風尚更可於《濠玩夏令營》活動當天換領價值超過五百澳門元的星級禮券包，打造最熾熱的驚喜夏日，讓每個暑期周末更加精彩。    睹麥拿倫超跑丰采    除了體驗《濠玩夏令營》，賓客可於即日起至九月一日，在度假村主入口體驗由新濠天地與世界著名豪華跑車品牌麥拿倫攜手推出澳門獨一無二的豪華跑車展覽。“新濠天地麥拿倫車展”展出專為新濠特別訂製的“McLaren 750S CoD    PORCELAIN EDITION”青花龍紋圖案麥拿倫750S超跑，彰顯兩大國際品牌不懈探索，以及追求創新的共同精神，同場另展出兩部特別版麥拿倫超級跑車，讓車迷愛好者可以感受前沿設計與精湛工藝的非凡魅力。    馬  龍,http://www.macaodaily.com/html/2024-08/16/content_1774934.htm,踏入八月，暑假正式進入一個月倒數，《濠玩夏令營》明星藝人陣容繼續強大，著名歌手周柏豪、鄭融、布志綸以及一眾廣受歡迎的電視節目明星藝人如謝天華、麥美恩、菊梓喬、黃翠如及蕭正楠等，於八月十一日至九月一日，連續四個周末駕臨新濠天地，近距離為觀眾深情獻唱，表演及互動玩遊戲,新濠 天地 暑假 精彩 周末         今個 夏季 ， 新濠 天地 精心 預備 了 浪 接浪 的 驚喜 夏日 活動 ， 約定 來 澳 旅客 與 本澳 居民 一同 “ 濠 ” 玩 暑假 周末 。         港藝人 一起 唱演 玩         剛過 去 的 七月 已迎 來 多位 明星 藝人 歡度 多個 周末 ， 包括 譽滿 大灣區 的 香港 音樂 組合 農夫 ， 多才 多藝 的 電視 節目 主持 李思捷 、 林盛斌 、 阮兆祥 、 陸浩明 ， 香港 著名 歌手 JW 王灝兒 、 陳 奐 仁 、 周志康 及 藝人 朱智賢 等 ， 親臨 澳門 首屈一指 的 娛樂 度假村 新濠 天地 《 濠 玩 夏令 營 》 。 各藝 人嘉賓 施展 渾身 解數 落力 表演 ， 近距 離 與 觀眾 互動 打卡 以及 玩 刺激 遊戲 ， 氣氛 熱烈 。         踏入 八月 ， 暑假 正式 進入 一個 月 倒數 ， 《 濠 玩 夏令 營 》 明星 藝人 陣容 繼續 強大 ， 著名 歌手 周柏豪 、 鄭融 、 布志綸 以及 一眾 廣受 歡迎 的 電視 節目 明星 藝人 如謝 天華 、 麥美恩 、 菊梓喬 、 黃 翠 如及 蕭正楠 等 ， 於 八月 十一日 至 九月 一日 ， 連續 四個 周末 駕臨 新濠 天地 ， 近距 離為 觀眾 深情 獻唱 ， 表演 及 互動 玩遊戲 。 勝出 的 現場 朋友 ， 更 有 機會 贏得 新濠 天地 精選 豐富 獎品 以及 金龍 擺設 。         特色 禮品 精彩 驚喜         《 濠 玩 夏令 營 》 亦 會 呈 獻樂隊 現場 表演 及 派 發 多款 特色 禮品 ， 賓客 在 社交 平台 打卡 並 加上 指定 標記 ， 還可 獲贈 免費 雪糕 。 成為 新濠 風尚 更 可 於 《 濠 玩 夏令 營 》 活動 當天換 領價值 超過 五百 澳門元 的 星級 禮券包 ， 打造 最熾熱 的 驚喜 夏日 ， 讓 每個 暑期 周末 更加 精彩 。         睹 麥拿倫超 跑 丰采         除了 體驗 《 濠 玩 夏令 營 》 ， 賓客 可 於 即日起 至 九月 一日 ， 在 度假村 主 入口 體驗 由 新 濠 天地 與 世界 著名 豪華跑車 品牌 麥拿倫 攜手 推出 澳門 獨一無二 的 豪華跑 車展覽 。 “ 新濠 天地 麥拿倫 車展 ” 展出 專為 新濠 特別 訂 製 的 “ McLaren   750S   CoD         PORCELAIN   EDITION ” 青花 龍紋 圖案 麥拿倫 750S 超跑 ， 彰顯 兩大國際 品牌 不懈 探索 ， 以及 追求 創新 的 共同 精神 ， 同場 另 展出 兩部 特別 版 麥拿倫 超級 跑車 ， 讓 車迷 愛好者 可以 感受 前沿 設計 與 精湛 工藝 的 非凡 魅力 。         馬     龍,2024-08-16
