Title,Content,Link,Summary,Preprocessed_Content,Date
李英愛人生大變    高梁,李英愛人生大變    亞洲卓越電影人大奬：《大長今》李英愛，留下一份人情——希望拍一部港韓合作，一后雙王的鉅片。二十歲初出道，來港拍巧力克宣傳片，合作者劉德華，已是天王巨星。很幸運。二十年前，釜山頒奬禮，遇梁朝偉，很談得來……李英愛從此有個夢——劉德華、梁朝偉、李英愛，合作一部港韓《無間道》。    但，追問最多的，何時開拍《大長今》續集？“不能急，這是美好回顧，不但要多元化，內容與演技要更精進。”李英愛自爆：“我經常翻看《大長今》，記住所有金句，警醒自己。”不只經典；堪稱神劇。二○○三年香港播映，哄動一時，結局篇五十點，創高紀錄，更紅遍全亞洲，“《大長今》！是我們韓國的外交官。”這種提法，芸芸影評人，似甚罕見。影片劇集成功，可以為國爭光，令民族自豪，畢竟，李英愛感受到這份卓越了。所以，處理《大長今》續集，步步為營，再精煉，再改進！但，製作公司已經宣佈，《大長今》定於今年十月開拍，明年播映。公司宣佈，還有註腳——片名，仍叫《大長今》，五十四歲的李英愛仍肩負重任。不過——與《大長今》前世無關，與《大長今》續集無關，另一個故事。    有變，好過無變，何必堅持，只要越變越好。性格溫順的李英愛，二十一年來，也人生大變了。她自爆都有虎媽上身一刻：“我的龍鳳胎已經十四歲，都上中學。小朋友不免犯錯，偶爾都會對他們發脾氣的。”    歲月催人，青春玉女，今已是媽媽。回說人妻階段，曲折奇情。丈夫年長自己二十歲，美國韓僑富商鄭浩英，開始拍拖並不順利。    李英愛事業與愛情皆遇瓶頸，困擾不堪，獨自飛到外國療傷，好好地沉澱心情。“分開，不意味着永遠分別，而是留給彼此喘息與獨處空間，各自深思自己要的是甚麼。浮現清晰的答案，繞了一圈才深知，對方是值得走下去那一個人。”    鄭浩英億萬富商，閨房之樂，與李英愛討論劇本，提供意見。老婆拍戲，老公帶孩子，有時探班，富商還扮工作人員派飯盒。    愛老婆所愛，樂老婆所樂，夫妻不似相差二十載，形神都四十而已。    高梁,http://www.macaodaily.com/html/2024-03/20/content_1742650.htm,李英愛人生大變    亞洲卓越電影人大奬：《大長今》李英愛，留下一份人情——希望拍一部港韓合作，一后雙王的鉅片,李英 愛 人生 大變         亞洲 卓越 電影 人大 奬 ： 《 大長 今 》 李英 愛 ， 留下 一份 人情 — — 希望 拍 一部 港韓 合作 ， 一后 雙王 的 鉅 片 。 二十 歲 初 出道 ， 來港 拍巧 力克 宣傳片 ， 合作者 劉德華 ， 已 是 天王 巨星 。 很 幸運 。 二十年 前 ， 釜山 頒 奬 禮 ， 遇 梁朝 偉 ， 很談 得 來 … … 李英 愛從 此 有 個 夢 — — 劉德華 、 梁朝 偉 、 李英 愛 ， 合作 一部 港韓 《 無間 道 》 。         但 ， 追問 最 多 的 ， 何時 開 拍 《 大長 今 》 續集 ？ “ 不能 急 ， 這是 美好 回顧 ， 不但 要 多元化 ， 內容 與 演技 要 更 精進 。 ” 李英 愛 自爆 ： “ 我 經常 翻看 《 大長 今 》 ， 記住 所有 金句 ， 警醒 自己 。 ” 不 只 經典 ； 堪稱 神劇 。 二 ○ ○ 三年 香港 播映 ， 哄動 一時 ， 結局 篇 五十 點 ， 創高紀錄 ， 更紅遍 全亞洲 ， “ 《 大長 今 》 ！ 是 我們 韓國 的 外交官 。 ” 這種 提法 ， 芸芸 影評 人 ， 似 甚罕見 。 影片 劇集 成功 ， 可以 為國 爭光 ， 令 民族 自豪 ， 畢竟 ， 李英 愛 感受 到 這份 卓越 了 。 所以 ， 處理 《 大長 今 》 續集 ， 步步 為營 ， 再 精煉 ， 再 改進 ！ 但 ， 製 作 公司 已經 宣 佈 ， 《 大長 今 》 定 於 今年 十月 開拍 ， 明年 播映 。 公司 宣 佈 ， 還 有 註 腳 — — 片名 ， 仍 叫 《 大長 今 》 ， 五十四 歲 的 李英 愛仍 肩負 重任 。 不過 — — 與 《 大長 今 》 前世 無關 ， 與 《 大長 今 》 續集 無關 ， 另 一個 故事 。         有變 ， 好過 無變 ， 何必 堅持 ， 只要 越變 越 好 。 性格 溫順 的 李英 愛 ， 二十一年 來 ， 也 人生 大變 了 。 她 自爆 都 有 虎媽 上身 一刻 ： “ 我 的 龍鳳胎 已經 十四 歲 ， 都 上 中學 。 小朋友 不免 犯錯 ， 偶爾 都 會 對 他們 發脾氣 的 。 ”         歲 月 催人 ， 青春 玉女 ， 今 已 是 媽媽 。 回說 人 妻階段 ， 曲折 奇情 。 丈夫 年長 自己 二十 歲 ， 美國 韓僑 富商 鄭浩英 ， 開始 拍拖 並不順利 。         李英 愛事業 與 愛情 皆 遇瓶 頸 ， 困擾 不堪 ， 獨自飛 到 外國 療傷 ， 好好 地沉 澱 心情 。 “ 分開 ， 不 意味着 永遠 分別 ， 而是 留給 彼此 喘息 與 獨處 空間 ， 各自 深思 自己 要 的 是 甚麼 。 浮現 清晰 的 答案 ， 繞 了 一圈 才 深知 ， 對方 是 值得 走 下去 那一個 人 。 ”         鄭浩英 億萬 富商 ， 閨房 之樂 ， 與 李英 愛討論 劇本 ， 提供 意見 。 老婆 拍戲 ， 老公 帶 孩子 ， 有時 探班 ， 富商 還扮 工作 人員派 飯盒 。         愛 老婆 所愛 ， 樂 老婆 所樂 ， 夫妻 不 似 相差 二十 載 ， 形神 都 四十 而已 。         高梁,2024-03-20
友人劇團再辦《心之飛人》   文：三三如一,邀國際劇場大師來澳演出    友人劇團再辦《心之飛人》    由友人創作藝術劇團主辦、澳門特別行政區文化發展基金資助的《心之飛人——共融藝術演出暨交流對談會》，於四月八日晚上八時在南豐工業大廈十二樓演出，並設演後座談會。    《心之飛人》由紐約大學榮休藝術教授Stephen Wangh創辦，他深受葛氏的獨特形體表演訓練方法所啟發，並發展出《心之飛人》表演訓練體系。友人劇團負責人趙啟業表示：“《心之飛人》大概在二〇一九年由本地演員黃天恩開始引入澳門，當時因為我接觸到這門教學法，感覺對於演員來說好有效率。《心之飛人》讓身體去嘗試，拋開一些自身的枷鎖，枷鎖往往就是演技上的障礙，我們可能會想好多、設計好多，但其實可能無法執行出來。《心之飛人》是一個表演訓練體系、一個教學法，可以令我們找回最原始的身體，我們所有訓練都是先由身體出發，例如日常生活中好多時候，就算沒有語言，我們依然會充滿交流與感受。當身體有感受，下一步就能發展出有感受的語言。”    經歷幾年時間，友人劇團感受到《心之飛人》是一個可以幫助表演者摒棄一些虛假表演，而着重人與人之間的真情實感的練習。趙啟業表示：“我見證《心之飛人》進入澳門數年，印象最深刻是發現它不只是在演技上幫到演員，在各行各業不同學生中更發展出其他可能性。有演員、老師、教育工作者、心理輔導人員，甚至手語導師，他們都可以在這個教學法中找到可以結合運用的方法。”    今年友人劇團將邀請國際劇場大師Thomas Richards來澳。Thomas Richards與葛羅托斯基自一九八六年開始合作，三十五年來他的團隊不斷發展，以古老歌謠作為每天工作的修煉藝行。是次演出將讓公眾目睹Thomas和團隊的獨特工作及行動研究方法，當中包括：如何以古老的地中海及非洲歌謠，連結身體行動喚醒人類細微內在經驗及其潛能。    文：三三如一,http://www.macaodaily.com/html/2024-03/20/content_1742645.htm,邀國際劇場大師來澳演出    友人劇團再辦《心之飛人》    由友人創作藝術劇團主辦、澳門特別行政區文化發展基金資助的《心之飛人——共融藝術演出暨交流對談會》，於四月八日晚上八時在南豐工業大廈十二樓演出，並設演後座談會,邀國際 劇場 大師 來 澳 演出         友人 劇團 再 辦 《 心之飛 人 》         由 友人 創作 藝術 劇團 主辦 、 澳門 特別 行政 區 文化 發展 基金 資助 的 《 心之飛 人 — — 共融 藝術 演出 暨 交流 對 談會 》 ， 於 四月 八日晚上 八時 在 南豐 工業 大廈 十二 樓 演出 ， 並設 演後座 談會 。         《 心之飛 人 》 由 紐約 大學榮 休藝術 教授 Stephen   Wangh 創辦 ， 他 深受 葛氏 的 獨特 形體 表演 訓練 方法 所 啟發 ， 並發 展出 《 心之飛 人 》 表演 訓練 體系 。 友人 劇團 負責人 趙 啟業 表示 ： “ 《 心之飛 人 》 大概 在 二 〇 一 九年 由 本地 演員 黃 天恩 開始 引入 澳門 ， 當時 因為 我 接觸 到 這門 教學法 ， 感覺 對 於 演員來 說 好 有效率 。 《 心之飛 人 》 讓 身體 去 嘗試 ， 拋開 一些 自身 的 枷鎖 ， 枷鎖 往往 就是 演技 上 的 障礙 ， 我們 可能 會想 好多 、 設計 好多 ， 但 其實 可能 無法 執行 出來 。 《 心之飛 人 》 是 一個 表演 訓練 體系 、 一個 教學法 ， 可以 令 我們 找回 最 原始 的 身體 ， 我們 所有 訓練 都 是 先 由 身體 出發 ， 例如 日常生活 中 好多 時候 ， 就算 沒有 語言 ， 我們 依然 會 充滿 交流 與 感受 。 當身體 有 感受 ， 下 一步 就 能發 展出 有 感受 的 語言 。 ”         經歷 幾年 時間 ， 友人 劇團 感受 到 《 心之飛 人 》 是 一個 可以 幫助 表演者 摒棄 一些 虛假 表演 ， 而 着重 人 與 人 之間 的 真情 實感 的 練習 。 趙 啟業 表示 ： “ 我見證 《 心之飛 人 》 進入 澳門數 年 ， 印象 最 深刻 是 發現 它 不 只是 在 演技 上 幫到 演員 ， 在 各行 各業 不同 學生 中 更發 展出 其他 可能性 。 有 演員 、 老師 、 教育工作者 、 心理 輔導 人員 ， 甚至 手語 導師 ， 他們 都 可以 在 這個 教學法 中 找到 可以 結合 運用 的 方法 。 ”         今年 友人 劇團將 邀請 國際 劇場 大師 Thomas   Richards 來澳 。 Thomas   Richards 與 葛羅 托斯基 自 一九八六年 開始 合作 ， 三十五年 來 他 的 團隊 不斷 發展 ， 以 古老 歌謠 作為 每天 工作 的 修煉 藝行 。 是 次 演出 將讓 公眾 目睹 Thomas 和 團隊 的 獨特 工作 及行動 研究 方法 ， 當中 包括 ： 如何 以 古老 的 地中海 及 非洲 歌謠 ， 連結 身體 行動 喚醒 人類 細微 內 在 經驗 及其 潛能 。         文 ： 三三如 一,2024-03-20
2CM婦女節橫琴出騷    文：車點心,2CM婦女節橫琴出騷    本地小清新樂隊2CM早前獲邀到橫琴，為當地社區舉辦的慶祝“三·八”國際婦女節嘉年華活動擔任表演嘉賓。    2CM表示近一年不時都收到邀請到內地不同地方演出，除了可以推動本地原創音樂之外，樂隊亦可以有機會去認識當地的旅遊熱景及文化，可謂一舉兩得。加上樂隊成員平日各有各忙，今次難得齊人到內地出騷，大家都感到十分開心和感動。因此，2CM在演出時都顯得特別落力。    演出當日，2CM獻唱了《真的愛你》和《分分鐘需要你》等多首好歌，為現場帶來了歡樂氣氛。2CM透露今年都會在澳門和內地出騷，最近樂隊在練習一些新歌，亦計劃籌備自己的原創作品，為日後演出做好準備，期望能給觀眾帶來更多驚喜。    文：車點心,http://www.macaodaily.com/html/2024-03/20/content_1742651.htm,2CM透露今年都會在澳門和內地出騷，最近樂隊在練習一些新歌，亦計劃籌備自己的原創作品，為日後演出做好準備，期望能給觀眾帶來更多驚喜,2CM 婦女節 橫琴 出騷         本地 小 清新 樂隊 2CM 早前 獲邀 到 橫琴 ， 為 當地 社區 舉辦 的 慶祝 “ 三 · 八 ” 國際婦 女節 嘉年華 活動 擔任 表演 嘉賓 。         2CM 表示 近 一年 不時 都 收到 邀請 到 內 地 不同 地方 演出 ， 除了 可以 推動 本地 原創 音樂 之外 ， 樂隊 亦 可以 有 機會 去 認識 當地 的 旅遊 熱景及 文化 ， 可謂 一舉 兩得 。 加上 樂隊 成員 平日 各有 各忙 ， 今次 難得 齊人到 內地 出騷 ， 大家 都 感到 十分 開心 和 感動 。 因此 ， 2CM 在 演出 時 都 顯得 特別 落力 。         演出 當日 ， 2CM 獻唱 了 《 真的 愛你 》 和 《 分分鐘 需要 你 》 等 多首 好歌 ， 為 現場 帶來 了 歡樂氣氛 。 2CM 透露 今年 都 會 在 澳門 和 內 地 出騷 ， 最近 樂隊 在 練習 一些 新 歌 ， 亦 計劃 籌備 自己 的 原創 作品 ， 為 日 後 演出 做好 準備 ， 期望 能給 觀眾 帶來 更 多 驚喜 。         文 ： 車點心,2024-03-20
身心合一反擊人生   小  也,身心合一反擊人生    ——談《熱辣滾燙》    賈玲在《熱辣滾燙》中減肉五十公斤，不是製造噱頭，而是從人生低谷攀上高峰的徹底表現，用肉體表現被人踩低的怒氣，格外有感染力。    在內地狂收三十億元人民幣的《熱辣滾燙》，改編自日本片《100円的愛》，成功移植到中國內地。劇情實為一個籮底橙到擂台比賽的故事，見慣見熟，但雅俗共賞。自編自導自演的賈玲，一開始用了八十分鐘的篇幅刻劃超肥女主角衰到貼地的失敗際遇。    愛情上的失敗，體現於男友與死黨結婚，然而這只是輕輕一筆。親情上，親姐要求她無償轉讓住宅單位；表妹為了搏上位而要求她上鬧笑電視節目，充分表現連親人也佔她便宜；母親與姐姐聯手逼她簽名轉讓物業的一段戲，盡現金錢社會下的無奈親情，讓人唏噓。她搬出去後邂逅拳擊老師，以為是戀愛春天，卻被出賣。    這八十分鐘的段落，細緻地描繪出主角從無人關心的地獄人生，過程沒有賣弄煽情伎倆，而是具生活感，尤其捕捉人人為錢而活的景象，頗有諷刺性。    全片最精彩的並非打拳，而是她受到多重打擊後，對人生的無望。獨自在深夜一層一層地走上自己住宅的遠景定鏡，她每走到一層，燈為她而亮，周圍漆黑一片，風雨交加，仿如孤獨地走完人生最後一程，準備自殺。這鏡頭正好表現她墮入人生最低谷，也為後來瘦身成為拳手提供說服力。    之後的拳賽，貫徹着“不投降”原則，也是她對人生的不投降，因此像《洛奇》般捱打。一個環迴鏡頭，拍攝她在擂台上的持續奮戰，特別好看，技巧上更與之前她在電腦合成的長鏡頭中從肥婆變瘦女的過程互相呼應，因此後半段節奏明快，鏡頭亦有動感。    從肥到瘦、從地底泥到走上擂台，影片展現了身心合一的谷底反擊。以身體變化表現意志，以不被打倒的狀態展現人生不敗，令典型勵志片去得更盡。    lhaio@yahoo.com.hk    小  也,http://www.macaodaily.com/html/2024-03/20/content_1742653.htm,一個環迴鏡頭，拍攝她在擂台上的持續奮戰，特別好看，技巧上更與之前她在電腦合成的長鏡頭中從肥婆變瘦女的過程互相呼應，因此後半段節奏明快，鏡頭亦有動感,身心 合一 反擊 人生         — — 談 《 熱辣 滾 燙 》         賈玲 在 《 熱辣 滾 燙 》 中 減肉 五十 公斤 ， 不是 製 造 噱 頭 ， 而是 從 人生 低谷 攀 上 高峰 的 徹底 表現 ， 用肉 體表現 被 人 踩 低 的 怒氣 ， 格外 有 感染力 。         在 內 地 狂收 三十 億元 人民 幣的 《 熱辣 滾 燙 》 ， 改編 自 日本 片 《 100 円的 愛 》 ， 成功 移植 到 中國內 地 。 劇情 實為 一個 籮底 橙 到 擂台 比賽 的 故事 ， 見慣 見 熟 ， 但 雅俗 共賞 。 自編 自導 自演 的 賈玲 ， 一開始 用 了 八 十分 鐘的 篇幅 刻劃 超肥 女主角 衰到 貼 地 的 失敗際遇 。         愛情 上 的 失敗 ， 體現 於 男友 與 死 黨 結婚 ， 然而 這 只是 輕輕 一筆 。 親情 上 ， 親姐 要求 她 無償 轉讓 住宅 單位 ； 表妹 為 了 搏 上位 而 要求 她 上 鬧 笑 電視 節目 ， 充分 表現 連親 人 也 佔 她 便宜 ； 母親 與 姐姐 聯手 逼 她 簽名 轉讓 物業 的 一段 戲 ， 盡現 金錢 社會 下 的 無奈 親情 ， 讓 人 唏噓 。 她 搬出去 後 邂逅 拳擊 老師 ， 以為 是 戀愛 春天 ， 卻 被 出賣 。         這八 十分 鐘的 段落 ， 細 緻 地 描 繪 出 主角 從無人 關心 的 地獄 人生 ， 過程 沒 有 賣 弄 煽情 伎倆 ， 而是 具 生活 感 ， 尤其 捕捉 人人 為 錢 而活 的 景象 ， 頗 有諷 刺性 。         全片 最 精彩 的 並非 打拳 ， 而是 她 受到 多重 打擊 後 ， 對 人生 的 無望 。 獨自 在 深夜 一層 一層 地 走上 自己 住宅 的 遠 景定 鏡 ， 她 每 走 到 一層 ， 燈為 她 而亮 ， 周圍 漆黑一片 ， 風雨 交加 ， 仿如 孤獨地 走 完 人生 最 後 一程 ， 準備 自殺 。 這鏡頭 正好 表現 她 墮入 人生 最低谷 ， 也 為後來 瘦身 成為 拳手 提供 說 服力 。         之 後 的 拳賽 ， 貫徹 着 “ 不 投降 ” 原則 ， 也 是 她 對 人生 的 不 投降 ， 因此 像 《 洛奇 》 般 捱打 。 一個環 迴 鏡頭 ， 拍攝 她 在 擂台 上 的 持續 奮戰 ， 特別 好看 ， 技巧 上 更 與 之前 她 在 電腦 合成 的 長 鏡頭 中 從 肥婆變 瘦 女 的 過程 互相 呼應 ， 因此 後 半段 節奏 明快 ， 鏡頭 亦 有動感 。         從肥 到 瘦 、 從 地 底泥 到 走上 擂台 ， 影片 展現 了 身心 合一 的 谷底 反擊 。 以 身體 變化表現 意志 ， 以 不 被 打倒 的 狀態 展現 人生 不敗 ， 令 典型 勵志片 去 得 更 盡 。         lhaio @ yahoo . com . hk         小     也,2024-03-20
中國芭蕾扛鼎作《紅色娘子軍》穗展演,中國芭蕾扛鼎作《紅色娘子軍》穗展演    由中央芭蕾舞團演繹的經典芭蕾舞劇《紅色娘子軍》作為廣州大劇院二〇二四女性藝術節的重磅演出，本月十六、十七日在廣州大劇院歌劇廳舞台圓滿上演。這部中國芭蕾史上的扛鼎之作於今年迎來首演六十周年紀念，用挺立的足尖書寫不朽傳奇。    《紅色娘子軍》是中國首部成功借鑒歐洲芭蕾舞形式而創作的大型現代舞劇，開創了中國芭蕾史上融合東西方文化的先河，創造出全新的舞蹈語彙，成為具有里程碑意義的典範。舞劇講述了從惡霸南霸天府中逃出來的丫鬟瓊花，在紅軍黨代表洪常青以及戰友們的幫助下，經過血與火的戰鬥考驗，從一名苦大仇深的鄉下丫鬟，逐漸轉變成長為一名堅定的革命戰士的過程。    該劇大膽顛覆了西方有着幾百年傳統的足尖舞，從題材、音樂、佈景、舞蹈動作、故事推進的方式等各方面全方位創新了西方芭蕾舞，拓寬了傳統芭蕾舞的廣度，豐富了芭蕾舞的題材。芭蕾中的主角，第一次由仙女變成了女戰士，芭蕾舞演員亦第一次在舞蹈中舉起了鋼刀鋼槍，將充滿力量感與正義感的軍人風範成功立於芭蕾舞台之上。    從中國古典舞、黎族民間舞，到“五寸刀舞”“斗笠舞”等經典舞段，以及傳統戲曲、武術，中華民族傳統藝術的動作語彙被巧妙地融入到西方的芭蕾技巧中。其中，“倒踢紫金冠”這一原是京劇中的動作，被開創性地加入到芭蕾之中，成為該劇象徵奮鬥精神的標誌性動作。該劇不僅塑造了娘子軍英姿颯爽的舞蹈形象，更讓《萬泉河水清又清》、《娘子軍連歌》、《快樂的女戰士》等音樂成為了家喻戶曉的經典旋律，編織出幾代人的音樂記憶。    這部被中央芭蕾舞團視為“看家戲”的經典作品，從首演至今，女主角“瓊花”的演員已傳承了六代，依舊保持風采，深入人心。“瓊花”的命運與精神也感染着一代又一代人。,http://www.macaodaily.com/html/2024-03/20/content_1742654.htm,《紅色娘子軍》是中國首部成功借鑒歐洲芭蕾舞形式而創作的大型現代舞劇，開創了中國芭蕾史上融合東西方文化的先河，創造出全新的舞蹈語彙，成為具有里程碑意義的典範,中國 芭蕾 扛 鼎作 《 紅色 娘子 軍 》 穗 展演         由 中央 芭蕾舞 團演繹 的 經典 芭蕾舞 劇 《 紅色 娘子 軍 》 作為 廣州 大劇院 二 〇 二四 女性 藝術節 的 重磅 演出 ， 本月 十六 、 十七日 在 廣州 大劇院 歌劇廳 舞台 圓滿 上演 。 這部 中國 芭蕾 史上 的 扛鼎之作 於 今年 迎來 首演 六十周年 紀念 ， 用 挺立 的 足尖 書寫 不朽 傳奇 。         《 紅色 娘子 軍 》 是 中國 首部 成功 借 鑒 歐洲 芭蕾舞 形式 而 創作 的 大型 現代舞劇 ， 開創 了 中國 芭蕾 史上 融合 東 西方 文化 的 先河 ， 創造 出 全新 的 舞蹈 語 彙 ， 成為 具有 里程碑 意義的 典範 。 舞劇 講述 了 從 惡霸 南霸天 府 中 逃出 來 的 丫鬟 瓊花 ， 在 紅軍黨 代表 洪 常青 以及 戰友們 的 幫助 下 ， 經過 血 與 火 的 戰鬥 考驗 ， 從 一名 苦大仇深 的 鄉 下 丫鬟 ， 逐漸 轉變 成長 為 一名 堅定 的 革命 戰士 的 過程 。         該 劇大膽 顛覆 了 西方 有着 幾 百年 傳統 的 足尖 舞 ， 從題 材 、 音樂 、 佈 景 、 舞蹈 動作 、 故事 推進 的 方式 等 各 方面 全方位 創新 了 西方 芭蕾舞 ， 拓寬 了 傳統 芭蕾舞 的 廣度 ， 豐富 了 芭蕾舞 的 題材 。 芭蕾 中 的 主角 ， 第一次 由 仙女 變成 了 女戰士 ， 芭蕾舞 演員 亦 第一次 在 舞蹈 中舉 起 了 鋼刀 鋼槍 ， 將充 滿 力量感 與 正義感 的 軍人 風範 成功 立 於 芭蕾舞 台 之上 。         從 中國 古典舞 、 黎族 民間 舞 ， 到 “ 五寸 刀舞 ” “ 斗笠 舞 ” 等 經典 舞段 ， 以及 傳統 戲曲 、 武術 ， 中華 民族 傳統 藝術 的 動作語 彙 被 巧妙 地 融入 到 西方 的 芭蕾 技巧 中 。 其中 ， “ 倒 踢 紫 金冠 ” 這一原 是 京劇 中 的 動作 ， 被 開 創性 地 加入 到 芭蕾 之中 ， 成為 該 劇象 徵奮鬥 精神 的 標誌 性動作 。 該劇 不僅 塑造 了 娘子 軍 英姿 颯爽 的 舞蹈 形象 ， 更 讓 《 萬泉 河水 清 又 清 》 、 《 娘子 軍連歌 》 、 《 快樂 的 女戰士 》 等 音樂成 為 了 家 喻戶曉 的 經典 旋律 ， 編織 出 幾代人 的 音樂 記憶 。         這部 被 中央 芭蕾舞 團視 為 “ 看家 戲 ” 的 經典 作品 ， 從 首演 至今 ， 女主角 “ 瓊花 ” 的 演員 已 傳承 了 六代 ， 依舊 保持 風采 ， 深入人心 。 “ 瓊花 ” 的 命運 與 精神 也 感染 着 一代 又 一代人 。,2024-03-20
《澳門人 · 澳門事》介紹警民同樂日,《澳門人 · 澳門事》介紹警民同樂日    治安警察局於早前舉辦了“警民同樂日二〇二四”，活動目的是加強警民互動互信，攜手共建安全城市。澳視澳門（91台）今晚九時播出的《澳門人 · 澳門事》，將與觀眾回顧警民同樂日當日熱鬧情況。    “警民同樂日”再次在塔石廣場舉辦，市民透過豐富的攤位遊戲、裝備展示、展覽及各項精彩表演，與警方近距離接觸，更加了解警隊各部門的工作，同時亦起到宣傳防罪訊息的效果。現場還頒發了“好市民獎”以及“警察 · 反詐”填色等創作比賽獎項。,http://www.macaodaily.com/html/2024-03/20/content_1742656.htm,“警民同樂日”再次在塔石廣場舉辦，市民透過豐富的攤位遊戲、裝備展示、展覽及各項精彩表演，與警方近距離接觸，更加了解警隊各部門的工作，同時亦起到宣傳防罪訊息的效果,《 澳門 人   ·   澳門事 》 介紹 警民 同樂日         治安 警察局 於 早前 舉辦 了 “ 警民 同樂日 二 〇 二四 ” ， 活動 目的 是 加強 警民 互動 互信 ， 攜手 共建 安全 城市 。 澳視 澳門 （ 91 台 ） 今晚 九時 播出 的 《 澳門 人   ·   澳門事 》 ， 將與 觀眾 回顧 警民 同樂日 當日 熱鬧 情況 。         “ 警民 同樂日 ” 再次 在 塔 石廣場 舉辦 ， 市民 透過 豐富 的 攤位 遊戲 、 裝備 展示 、 展覽及 各項 精彩表演 ， 與 警方 近距 離接觸 ， 更加 了解 警隊 各部 門的 工作 ， 同時 亦 起到 宣傳防 罪訊息 的 效果 。 現場 還頒發 了 “ 好 市民 獎 ” 以及 “ 警察   ·   反詐 ” 填色 等 創作 比賽 獎項 。,2024-03-20
