Title,Content,Link,Summary,Preprocessed_Content,Date
世界合唱賽浸信奪金銀兩獎,世界合唱賽浸信奪金銀兩獎    澳門浸信中學合唱團於七月十三至廿一日遠赴新西蘭參加了第十三屆世界合唱比賽，在與來自三十多個國家的二百五十個合唱團、一萬一千名合唱隊員的激烈角逐中，澳門浸信中學合唱團分別榮獲“聖樂組”金獎和“中學組”銀獎兩項大獎。    在“聖樂組”比賽中，合唱團在查偉革(Veiga Jardim)指揮下，演唱了舒伯特、安東 · 布魯克納、約翰 · 邁克爾 · 特羅塔和卡羅爾 · 史蒂芬斯等人的作品，榮獲金獎，同時獲得了在未來五年參加“冠軍聯賽”的資格。“中學組”在王雅莉老師的帶領下演唱了澳門作曲家áureo Castro (1917-    1993)及多首有特色的中外合唱作品，榮獲銀獎殊榮。    除比賽外，合唱團還與來自美國和英國的合唱團參加了當地舉行的“友誼音樂會”。在音樂會上，指揮簡要介紹了澳門悠久的葡萄牙文化及澳門歷史，並演唱了多首作品，闡釋了澳門多文化的主要特徵。,http://www.macaodaily.com/html/2024-07/31/content_1771731.htm,世界合唱賽浸信奪金銀兩獎    澳門浸信中學合唱團於七月十三至廿一日遠赴新西蘭參加了第十三屆世界合唱比賽，在與來自三十多個國家的二百五十個合唱團、一萬一千名合唱隊員的激烈角逐中，澳門浸信中學合唱團分別榮獲“聖樂組”金獎和“中學組”銀獎兩項大獎,世界 合唱 賽浸 信奪 金銀 兩獎         澳門 浸信 中學 合唱 團於 七月 十三 至 廿一日 遠 赴 新西蘭 參加 了 第十三 屆 世界 合唱 比賽 ， 在 與 來 自 三十多 個國家 的 二百五十 個 合唱 團 、 一萬 一千名 合唱 隊員 的 激烈 角逐 中 ， 澳門 浸信 中學 合唱 團分 別榮 獲 “ 聖樂組 ” 金獎 和 “ 中學組 ” 銀獎 兩項 大獎 。         在 “ 聖樂組 ” 比賽 中 ， 合唱 團在 查偉革 ( Veiga   Jardim ) 指揮下 ， 演唱 了 舒伯特 、 安東   ·   布魯克納 、 約翰   ·   邁克爾   ·   特羅塔 和 卡羅爾   ·   史蒂芬 斯 等 人 的 作品 ， 榮獲 金獎 ， 同時 獲得 了 在 未來 五年 參加 “ 冠軍聯賽 ” 的 資格 。 “ 中學組 ” 在 王雅莉 老師 的 帶 領下 演唱 了 澳門 作曲家 á ureo   Castro   ( 1917 -         1993 ) 及 多首 有 特色 的 中外 合唱 作品 ， 榮獲 銀獎 殊榮 。         除比賽 外 ， 合唱 團還 與 來 自美國 和 英國 的 合唱 團參加 了 當地 舉行 的 “ 友誼 音樂會 ” 。 在 音樂會 上 ， 指揮 簡要 介紹 了 澳門 悠久 的 葡萄牙 文化 及 澳門 歷史 ， 並 演唱 了 多首 作品 ， 闡釋 了 澳門 多 文化 的 主要 特徵 。,2024-07-31
蘇澳聯新屆理事會就職,蘇澳聯新屆理事會就職    江蘇（高校）澳門學生聯合會於七月廿八日下午三時假澳門青年發展服務中心舉行了“‘蘇’出自我，薪火相傳——第十屆理事會就職典禮”。    澳門中聯辦北京聯絡部處長司晨、教青局學生廳職務主管洪慧敏、江蘇省青年聯合會澳區主任何嘉慈、澳門中華學生聯合總會理事長蕭顯華、澳門青年峰會理事長胡宏堅、澳門中華新青年協會副理事長溫詠儀、中華青年進步協會秘書長劉嘉琪及蘇澳聯監事長阮樂彤等嘉賓共同主禮。    蘇澳聯理事會成員在第十屆理事長游顏全帶領下，司晨、洪慧敏和何嘉慈監誓下，宣誓就職。游顏全承諾將繼續引領蘇澳聯的成員們攜手合作，共同探索澳門青年發展的新方向，並與其他地區聯會共同促進兩地青年之間的交流與合作，為建立澳門與內地之間的橋樑而努力。同時，他亦望能加強與南京本地機構合作，合辦更多關於文化交流與職業規劃的活動。,http://www.macaodaily.com/html/2024-07/31/content_1771734.htm,澳門中聯辦北京聯絡部處長司晨、教青局學生廳職務主管洪慧敏、江蘇省青年聯合會澳區主任何嘉慈、澳門中華學生聯合總會理事長蕭顯華、澳門青年峰會理事長胡宏堅、澳門中華新青年協會副理事長溫詠儀、中華青年進步協會秘書長劉嘉琪及蘇澳聯監事長阮樂彤等嘉賓共同主禮,蘇澳 聯新屆 理事 會 就 職         江蘇 （ 高校 ） 澳門 學生 聯合會 於 七月 廿八日 下午 三時 假 澳門 青年 發展 服務 中心 舉行 了 “ ‘ 蘇 ’ 出自 我 ， 薪火 相傳 — — 第十 屆 理事 會 就 職典禮 ” 。         澳門 中聯辦 北京 聯絡部 處長 司晨 、 教青局 學生廳 職務 主管 洪慧敏 、 江蘇省 青年 聯合會 澳區主 任何 嘉慈 、 澳門 中華學生 聯合 總會 理事 長 蕭顯華 、 澳門 青年 峰會 理事 長 胡宏堅 、 澳門 中華新 青年 協會 副 理事 長 溫詠 儀 、 中華 青年 進步 協會 秘書長 劉嘉琪 及 蘇澳聯 監事長 阮樂彤 等 嘉賓 共同 主禮 。         蘇澳聯 理事 會 成員 在 第十 屆 理事 長 游顏 全帶 領下 ， 司晨 、 洪慧敏 和 何嘉慈 監誓 下 ， 宣誓 就 職 。 游顏 全承諾將 繼續 引領 蘇澳聯 的 成員們 攜手 合作 ， 共同 探索 澳門 青年 發展 的 新 方向 ， 並與 其他 地區 聯會 共同 促進 兩地 青年 之間 的 交流 與 合作 ， 為 建立 澳門 與 內 地之間 的橋 樑 而 努力 。 同時 ， 他亦望 能 加強 與 南京 本地 機構 合作 ， 合辦 更 多關 於 文化交流 與 職業 規劃 的 活動 。,2024-07-31
專家科大網談旅遊與健康,專家科大網談旅遊與健康    澳門科技大學酒店與旅遊管理學院於七月廿五日舉辦“國際名師培訓工作坊”，主題為“旅遊何以療癒？跨學科視角下的研究設計、方法與展望”。此次培訓特邀上海復旦大學旅遊學系副教授鄭丹妮擔任主講嘉賓，酒旅學院助理院長張楊及近百名師生出席本次講座，並得到澳門教育基金大力支持。    培訓聚焦“旅遊與健康”及“數字文化旅遊”兩大主題，探討旅遊的治療效果、旅遊與公共衛生的結合、數字文化旅遊發展與應用等議題。在互動環節中，參與者就期刊發表和康養新議題展開熱烈討論。    此次工作坊不僅體現了滬澳兩地在教育和科研領域的緊密合作，並且回應了澳門特區政府和中央政府發展康養旅遊及大健康產業的號召，促進旅遊與健康、數字科技等領域深度融合。,http://www.macaodaily.com/html/2024-07/31/content_1771736.htm,此次工作坊不僅體現了滬澳兩地在教育和科研領域的緊密合作，並且回應了澳門特區政府和中央政府發展康養旅遊及大健康產業的號召，促進旅遊與健康、數字科技等領域深度融合,專家 科大 網談 旅遊 與 健康         澳門 科技 大學 酒店 與 旅遊 管理 學院 於 七月 廿五日 舉辦 “ 國際 名師 培訓 工作坊 ” ， 主題 為 “ 旅遊 何以 療 癒 ？ 跨學 科視角 下 的 研究 設計 、 方法 與 展望 ” 。 此次 培訓 特邀 上海 復 旦 大學 旅遊學系 副教授 鄭丹妮 擔任 主講 嘉賓 ， 酒 旅學院 助理 院長 張 楊及 近百名 師生 出席 本次 講座 ， 並 得到 澳門 教育 基金 大力支持 。         培訓 聚焦 “ 旅遊 與 健康 ” 及 “ 數字 文化 旅遊 ” 兩大主題 ， 探討 旅遊 的 治療 效果 、 旅遊 與 公共 衛生 的 結合 、 數字 文化 旅遊 發展 與 應用 等 議題 。 在 互動 環節 中 ， 參與者 就 期刊 發表 和 康養 新議 題展 開熱烈 討論 。         此次 工作坊 不僅 體現 了 滬澳 兩地 在 教育 和 科研 領域 的 緊密 合作 ， 並且 回應 了 澳門 特區 政府 和 中央政府 發展 康養 旅遊及 大 健康 產業 的 號召 ， 促進 旅遊 與 健康 、 數字 科技 等 領域 深度 融合 。,2024-07-31
澳大華東師大學生滬澳研習,澳大華東師大學生滬澳研習    澳門大學曹光彪書院和華東師範大學孟憲承書院日前合辦“城市與文化發展：聚焦上海與澳門”暑期交流實踐項目，組織兩院二十名學生互訪上海和澳門，並進行實地研習。    為了深入體驗當地文化特色，澳大學生分成五個聯合小組，分別聚焦於“自然上海”、“科技上海”、“人文上海”、“地理上海”和“文創上海”五個主題考察，深度體驗上海獨特的歷史文化底蘊，感受上海的風土人情。    在澳門期間，曹光彪書院特別邀請了澳門青年茶文化推廣協會會長余健南，向孟憲承書院學生介紹茶的基本知識及中國對於茶文化的貢獻，並進行點茶體驗。孟憲承書院學生亦參觀了澳門著名地標，實地了解澳門獨特的中西文化，以及國家對澳門發展的大力支持。,http://www.macaodaily.com/html/2024-07/31/content_1771738.htm,澳大華東師大學生滬澳研習    澳門大學曹光彪書院和華東師範大學孟憲承書院日前合辦“城市與文化發展：聚焦上海與澳門”暑期交流實踐項目，組織兩院二十名學生互訪上海和澳門，並進行實地研習,澳大華東 師大學 生滬澳 研習         澳門 大學 曹光彪 書院 和 華東師 範大學 孟憲承書院 日前 合辦 “ 城市 與 文化 發展 ： 聚焦 上海 與 澳門 ” 暑期 交流 實踐 項目 ， 組織 兩院 二十名 學生 互訪 上海 和 澳門 ， 並進行 實地 研習 。         為 了 深入 體驗 當地 文化 特色 ， 澳大學生 分成 五個 聯合小組 ， 分別 聚焦 於 “ 自然 上海 ” 、 “ 科技 上海 ” 、 “ 人文 上海 ” 、 “ 地理 上海 ” 和 “ 文創 上海 ” 五個 主題 考察 ， 深度 體驗 上海 獨特 的 歷史 文化 底蘊 ， 感受 上海 的 風土 人情 。         在 澳門 期間 ， 曹光彪 書院 特別 邀請 了 澳門 青年 茶文化 推廣協會 會長 余健南 ， 向 孟憲承書院 學生 介紹 茶 的 基本 知識 及 中國 對 於 茶文化 的 貢獻 ， 並進 行點 茶 體驗 。 孟憲承書院 學生 亦 參觀 了 澳門 著名 地標 ， 實地 了解 澳門 獨特 的 中西文化 ， 以及 國家 對 澳門 發展 的 大力支持 。,2024-07-31
高校教師新疆交流促合作,高校教師新疆交流促合作    經中聯辦教青部組織協調，澳門高等教育發展促進會組織的“澳門高校教師新疆訪問團”一行二十九人，於日前赴新疆等地拜訪當地高校及機構，冀加強兩地高校及教師方面的交流合作。    是次參訪團由高促會會長莫啓明任團長、中聯辦教青部高校處處長岑嘉儀任顧問，參訪團會員來自各高校的教師。是次參訪團拜訪新疆大學，受該校黨委常委、副校長粟智熱情接待。雙方分別就人才培養、教師交流等方面深入探討。參訪團同時到喬爾瑪革命烈士墓園，瞻仰天山獨庫公路烈士纪念碑，讓教師們了解當年數萬名官兵歷經十年修築而成的獨庫公路，進一步提升澳門高校教師的家國情懷。    莫啓明表示，透過參訪團與新疆大學交流，未來冀能進一步加強兩地合作，共同為高等教育事業發展作出應有貢獻。,http://www.macaodaily.com/html/2024-07/31/content_1771741.htm,莫啓明表示，透過參訪團與新疆大學交流，未來冀能進一步加強兩地合作，共同為高等教育事業發展作出應有貢獻,高校 教師 新疆 交流 促 合作         經中 聯辦 教青部 組織 協調 ， 澳門 高等教育 發展 促進會 組織 的 “ 澳門 高校 教師 新疆 訪 問團 ” 一行 二十九 人 ， 於 日前 赴 新疆 等 地 拜訪 當地 高校 及 機構 ， 冀加強 兩地 高校 及 教師 方面 的 交流 合作 。         是 次 參訪團 由 高 促會會長 莫 啓 明任 團長 、 中聯辦 教青部 高校 處處長 岑嘉儀 任顧問 ， 參訪 團會員來 自 各 高校 的 教師 。 是 次 參訪團 拜訪 新疆 大學 ， 受該 校黨委 常委 、 副 校長 粟智 熱情 接待 。 雙方 分別 就 人才 培養 、 教師 交流 等 方面 深入 探討 。 參訪團 同時 到 喬爾瑪 革命 烈士墓 園 ， 瞻仰 天山 獨庫 公路 烈士 纪念碑 ， 讓 教師們 了解 當年 數萬名 官兵 歷經 十年 修築 而 成 的 獨庫 公路 ， 進 一步 提升 澳門 高校 教師 的 家國 情懷 。         莫 啓 明 表示 ， 透過 參訪團 與 新疆 大學 交流 ， 未來 冀能 進 一步 加強 兩地 合作 ， 共同 為 高等教育 事業 發展 作出 應有 貢獻 。,2024-07-31
雷鳴道教師體驗巴蜀文化,雷鳴道教師體驗巴蜀文化    雷鳴道主教紀念學校日前組織了為期五天的教學人員考察團，前往四川成都進行文化學習。此次考察團的十五位教學人員參觀了多個具有重要文化意義的地點。    考察團在都江堰的參觀中，深入了解了古代水利工程的智慧；在三星堆遺址，教學人員認識到古蜀文明的獨特性；在成都大熊貓培育基地，教學人員理解到自然環境與文化的密切關聯。杜甫草堂則像一座文化寶庫，讓教學人員充分感受到詩人杜甫非凡的文學才華及憂國憂民的精神。此外，團隊還欣賞了一場精彩的國粹表演，其中最獨特的是四川變臉，這場表演展示了中國深邃的文化內涵，增強教學人員對我國文化的自豪感。    此次考察活動不僅加深了教學人員對中國歷史文化的理解，也促進彼此交流與合作。活動由教青局教育發展基金贊助。,http://www.macaodaily.com/html/2024-07/31/content_1771745.htm,此次考察活動不僅加深了教學人員對中國歷史文化的理解，也促進彼此交流與合作,雷鳴 道教 師體驗 巴蜀 文化         雷鳴道 主教 紀念學校 日前 組織 了 為期 五天 的 教學 人員 考察 團 ， 前往 四川 成都 進行 文化 學習 。 此次 考察 團的 十五位 教學 人員 參觀 了 多個 具有 重要 文化 意義的 地點 。         考察 團在 都江堰 的 參觀 中 ， 深入 了解 了 古代 水利工程 的 智慧 ； 在 三星堆 遺址 ， 教學 人員 認識 到 古 蜀 文明 的 獨 特性 ； 在 成都 大熊 貓 培育 基地 ， 教學 人員 理解 到 自然 環境 與 文化 的 密切 關聯 。 杜甫 草堂 則像 一座 文化 寶庫 ， 讓 教學 人員 充分 感受 到 詩人 杜甫 非凡 的 文學 才 華及 憂國 憂民 的 精神 。 此外 ， 團隊 還欣賞 了 一場 精彩 的 國粹 表演 ， 其中 最獨特 的 是 四川 變臉 ， 這場 表演 展示 了 中國 深邃 的 文化 內涵 ， 增強 教學 人員 對 我國 文化 的 自豪感 。         此次 考察 活動 不僅 加深 了 教學 人員 對 中國 歷史 文化 的 理解 ， 也 促進 彼此 交流 與 合作 。 活動 由 教青局 教育 發展 基金 贊助 。,2024-07-31
澳娛綜合舉辦紅色之旅弘揚愛國愛澳精神,澳娛綜合舉辦紅色之旅弘揚愛國愛澳精神    澳娛綜合度假股份有限公司（“澳娛綜合”）堅定秉持“愛國愛澳”的核心價值，多年來積極向廣大市民及團隊成員弘揚家國情懷。自二〇一一年起，澳娛綜合定期舉辦“愛國教育·江西紅色之旅”，並於二〇一四在江西省設立“澳娛綜合·井岡山愛國主義教育培訓基地”。    今年七月十五日至十九日，第八屆“江西井岡山愛國主義教育培訓課程”於井岡山舉行，欣逢中華人民共和國成立75周年暨澳門特別行政區成立25周年，本屆課程擴大規模，除了組織澳娛綜合團隊成員及其年輕子女外，更開放名額予澳門社團的青年。    親子共同學習薪火相傳    作為全澳首家舉辦愛國教育課程及紅色之旅的綜合度假休閒企業，澳娛綜合冀透過舉辦“江西井岡山愛國主義教育培訓課程”，組織員工親子團及來自澳門工會聯合總會的青年及學生赴井岡山學習，在打造充實親子時光的同時，亦將愛國精神薪火相傳，增強年輕一代對祖國的認識、國家觀念及自身國民身份的認同。    近百團員體驗愛國教育    開班儀式七月十六日在中共井岡山市委紅色教育基地舉行，獲井岡山政協主席李斌出席，並由澳娛綜合董事兼員工福利諮詢委員會主席、江西省僑聯副主席、井岡山市榮譽市民梁安琪擔任團長。出席領導勉勵團員，把握機會深刻領會井岡山精神，為全面建設社會主義現代化國家而努力奮鬥，96名團員莊嚴宣誓，並獲授班旗，象徵愛國教育課程正式開展。,http://www.macaodaily.com/html/2024-07/31/content_1771748.htm,親子共同學習薪火相傳    作為全澳首家舉辦愛國教育課程及紅色之旅的綜合度假休閒企業，澳娛綜合冀透過舉辦“江西井岡山愛國主義教育培訓課程”，組織員工親子團及來自澳門工會聯合總會的青年及學生赴井岡山學習，在打造充實親子時光的同時，亦將愛國精神薪火相傳，增強年輕一代對祖國的認識、國家觀念及自身國民身份的認同,澳娛 綜合舉 辦紅色 之 旅弘揚 愛國 愛澳 精神         澳娛 綜合 度假 股份 有限公司 （ “ 澳娛 綜合 ” ） 堅定 秉持 “ 愛國 愛澳 ” 的 核心 價值 ， 多年 來積 極向 廣大 市民 及團隊 成員弘 揚家國 情懷 。 自二 〇 一 一年 起 ， 澳娛 綜合 定期 舉辦 “ 愛國 教育 · 江西 紅色 之 旅 ” ， 並於二 〇 一四在 江西省 設立 “ 澳娛 綜合 · 井岡山 愛國主義 教育 培訓 基地 ” 。         今年 七月 十五日 至 十九日 ， 第八 屆 “ 江西 井岡山 愛國主義 教育 培訓 課程 ” 於 井岡山 舉行 ， 欣逢 中華 人民 共和 國 成立 75 周年 暨 澳門 特別 行政 區 成立 25 周年 ， 本屆 課程 擴大規模 ， 除了 組織 澳娛 綜合 團隊 成員 及其 年輕 子女 外 ， 更 開放名 額予 澳門 社團 的 青年 。         親子 共同 學習 薪火 相傳         作為 全澳 首家 舉辦 愛國 教育 課程 及 紅色 之 旅 的 綜合 度假 休閒 企業 ， 澳娛 綜合冀 透過 舉辦 “ 江西 井岡山 愛國主義 教育 培訓 課程 ” ， 組織員工 親子 團及 來 自澳門 工會 聯合 總會 的 青年 及學生 赴 井岡山 學習 ， 在 打造 充實 親子 時光 的 同時 ， 亦 將愛國 精神 薪火 相傳 ， 增強 年 輕 一代 對祖國 的 認識 、 國家觀 念及 自身 國民 身份 的 認同 。         近百 團員體驗 愛國 教育         開班 儀式 七月 十六日 在 中共 井岡山 市委 紅色 教育 基地 舉行 ， 獲井岡山政協 主席 李斌 出席 ， 並由 澳娛 綜合 董事 兼員工 福利 諮 詢委員會 主席 、 江西省 僑聯 副 主席 、 井岡山市 榮譽 市民 梁安琪 擔任 團長 。 出席 領導 勉勵 團員 ， 把握 機會 深刻 領會 井岡山 精神 ， 為 全面 建設 社會 主義現 代化 國家 而 努力 奮鬥 ， 96 名團員 莊嚴 宣誓 ， 並獲 授班旗 ， 象 徵愛國 教育 課程 正式 開展 。,2024-07-31
深植井岡山精神不忘學以致用,深植井岡山精神不忘學以致用    第八屆“江西井岡山愛國主義教育培訓課程”充分善用井岡山深厚的紅色文化底蘊。團員首站前往井岡山革命烈士陵園向革命烈士敬獻花圈，以及參觀井岡山革命博物館，緬懷革命先烈及感受其崇高品德。培訓配合野外紅色體驗教學，讓一眾團員在重要軍紀“三大紀律”的誕生地——荊竹山雷打石，投入體驗紅軍當年的艱辛生活，從中激發團員的民族凝聚力。而透過觀看情境劇《永恒的信仰 — 跨越時空的對話》及大型戶外實景劇《井岡山》，助團員進一步了解井岡山作為中國共產黨第一個農村革命根據地的重要歷史。    是次課程內容豐富，團員先後參觀了井岡山革命博物館、挑糧小道、黃洋界、茅坪八角樓、龍江書院等重點紅色教學地點，並參與一系列結合歷史知識的親身體驗，深入學習先輩革命家率領紅軍的革命道路。行程亦包括到訪曾為貧困農村的茅坪神山村，一眾學員了解到神山村在國家實行精準扶貧政策下已成功蛻變成文明富裕鄉村，村民生活得以大大改善。此外，團員在《紅歌中的愛國主義精神》環節中通過學習紅歌及歌唱互動，感受祖國的強大與溫暖，對國家的認同及自豪感油然而生。    順利完成一連五日的課程後，團員紛紛表示收獲豐盛，並加入“井岡山幹部教育學院澳門同學會”，致力將所見所聞、所學所知融入日常工作和生活中，堅定不移地弘揚愛國愛澳精神。,http://www.macaodaily.com/html/2024-07/31/content_1771753.htm,是次課程內容豐富，團員先後參觀了井岡山革命博物館、挑糧小道、黃洋界、茅坪八角樓、龍江書院等重點紅色教學地點，並參與一系列結合歷史知識的親身體驗，深入學習先輩革命家率領紅軍的革命道路,深植井岡山 精神 不忘學 以致 用         第八 屆 “ 江西 井岡山 愛國主義 教育 培訓 課程 ” 充分 善用 井岡山 深厚 的 紅色 文化 底蘊 。 團員 首站 前往 井岡山 革命烈士 陵園 向 革命烈士 敬獻 花圈 ， 以及 參觀 井岡山 革命 博物 館 ， 緬懷 革命先烈 及 感受 其 崇高品德 。 培訓 配合 野外 紅色 體驗 教學 ， 讓 一眾 團員 在 重要 軍紀 “ 三大紀律 ” 的 誕 生地 — — 荊 竹山 雷打石 ， 投入 體驗 紅軍當 年 的 艱辛 生活 ， 從 中激 發團員 的 民族 凝聚力 。 而 透過 觀看 情境 劇 《 永恒 的 信仰   —   跨越 時空 的 對 話 》 及 大型 戶外 實景劇 《 井岡山 》 ， 助團員進 一步 了解 井岡山 作為 中國共產黨 第一 個 農村 革命 根據 地 的 重要 歷史 。         是 次 課程 內容 豐富 ， 團員 先後參觀 了 井岡山 革命 博物 館 、 挑糧 小道 、 黃 洋界 、 茅坪 八角 樓 、 龍江書院 等 重點 紅色 教學 地點 ， 並參 與 一系列 結合 歷史 知識 的 親身 體驗 ， 深入 學習 先輩 革命家 率 領紅 軍 的 革命道路 。 行程 亦 包括 到訪 曾 為 貧困 農村 的 茅坪神 山村 ， 一眾 學員 了解 到 神 山村 在 國家 實行 精準 扶貧 政策 下 已 成功 蛻變成 文明 富裕 鄉村 ， 村民 生活 得以 大大 改善 。 此外 ， 團員 在 《 紅歌 中 的 愛國主義 精神 》 環節 中通 過學習 紅歌 及 歌唱 互動 ， 感受 祖國 的 強大 與 溫暖 ， 對國家 的 認同 及 自豪感 油然而生 。         順利 完成 一連 五日 的 課程 後 ， 團員 紛紛 表示 收獲 豐盛 ， 並 加入 “ 井岡山 幹部 教育 學院 澳門 同學會 ” ， 致力 將所見 所聞 、 所學 所知 融入 日常 工作 和 生活 中 ， 堅定 不移 地弘揚 愛國 愛澳 精神 。,2024-07-31
