Title,Content,Link,Summary,Preprocessed_Content,Date
維拉傷患纏身爭四現隱憂    足球評述員  微灝,維拉傷患纏身爭四現隱憂    維拉季初有驚喜演出，直到半季時仍處於爭冠集團。不過下半季表現下滑，兩次敗予曼聯嚴重打擊士氣。球員傷病有明顯關係，先有中堅托利斯缺陣，現時又有防中卡馬拉長傷今季報銷，陣中欠缺一位在防線前作掩護的中場，雷斯及麥堅都偏向進攻型，導致失球數字大幅上升。近三場聯賽失八球，只能寄望進攻補救。    不幸的是，前鋒屈堅斯日前歐協盃傷出，今仗上陣成疑。後備前鋒杜蘭表現相當普通，體型較笨重，未有英超正選水平，影響球隊攻力。今晚更要作客回勇的韋斯咸，柏基達及艾華利斯復出後，球隊進攻重現生機，近五場入十四球，加上其快速反擊踢法正中維拉弱點，艾馬利需要調整戰術踢法，否則正面硬碰硬恐怕又會大敗一場。    現時球隊多打一場下領先熱刺兩分，前四席位大概難以維持。不過歐冠新制下，英超有望取得額外一席，或許餘下賽程把握與曼聯的八分優勢，劣勢下爭取和局，守住第五更為實際。    足球評述員  微灝,http://www.macaodaily.com/html/2024-03/17/content_1742145.htm,今晚更要作客回勇的韋斯咸，柏基達及艾華利斯復出後，球隊進攻重現生機，近五場入十四球，加上其快速反擊踢法正中維拉弱點，艾馬利需要調整戰術踢法，否則正面硬碰硬恐怕又會大敗一場,維拉傷 患纏 身爭 四現 隱憂         維拉 季初 有 驚喜 演出 ， 直到 半季 時 仍 處 於 爭冠 集團 。 不過 下半季 表現 下滑 ， 兩次 敗予 曼聯 嚴重 打擊士氣 。 球員傷 病有明 顯關 係 ， 先有 中堅 托利 斯 缺陣 ， 現時 又 有 防中 卡馬拉長 傷今季 報銷 ， 陣中 欠缺 一位 在 防線 前作 掩護 的 中場 ， 雷斯及 麥堅 都 偏向 進攻 型 ， 導致 失球 數字 大幅 上升 。 近三場 聯賽 失八球 ， 只能 寄望 進攻 補救 。         不幸 的 是 ， 前鋒屈 堅斯 日前 歐協 盃 傷出 ， 今仗 上陣 成疑 。 後 備 前鋒 杜蘭表現 相當 普通 ， 體型 較 笨重 ， 未有 英超 正選 水平 ， 影響 球隊 攻力 。 今晚 更要 作客 回勇 的 韋斯咸 ， 柏基達 及 艾華利斯 復 出 後 ， 球隊 進攻 重現 生機 ， 近五場 入 十四 球 ， 加上 其 快速 反擊 踢法 正中 維拉弱點 ， 艾馬利 需要 調整 戰術 踢法 ， 否則 正面 硬碰硬 恐怕 又 會 大敗 一場 。         現時 球隊 多 打 一場 下 領先 熱刺 兩分 ， 前四 席位 大概 難以 維持 。 不過 歐冠 新制 下 ， 英超 有望 取得 額外 一席 ， 或 許餘下 賽程 把握 與 曼聯 的 八分 優勢 ， 劣勢 下爭 取和局 ， 守住 第五 更為 實際 。         足球 評述員     微灝,2024-03-17
卡特林高球賽升首位,創單輪最佳成績    卡特林高球賽升首位    【本報消息】永利呈獻：國際系列賽澳門站今日煞科，昨日進行的第三輪中，美國球手J卡特林表現出色以低標準十一桿的五十九桿，創下賽事單輪最佳成績，以一百九十二桿以二桿優勢排第一。    卡特林：保持發揮    國際系列賽第三輪中，美國球手J卡特林表現最出色，打到九隻小鳥及一隻老鷹，以低標準十一桿的五十九桿，創下賽事單輪最佳成績，以一百九十二桿次二桿優勢升上第一，明天將有機會衝擊冠軍。他表示非常高興打出五十九桿，這不容易做到。希望今天能繼續保持發揮。    J卡特林同胞J高克拉克亦有出色表現，打到六隻小鳥及一隻老鷹，低標準八桿單輪並列第二，同時以一百九十四桿排第二。    西班牙球手加西亞雖捉到四隻小鳥及一老鷹，但有兩個柏忌低標準四桿完賽，以二百○一桿並列卅三。    港球手：目標前八    中國香港球手張雄熙同樣打到四隻小鳥及一老鷹，亦有兩個柏忌，低標準四桿的六十六桿，合計以一百九十九桿並列第十九位。 張雄熙表示成功執行自己計劃，打得很扎實。在這裡，保持耐心很重要。他又稱目標是殺入前八名，以獲得國際系列賽下一站的參賽資格。    總成績方面，除J卡特林及J高克拉克獨佔第一、第二，澳洲球手赫伯特單日打低八桿六十二桿，與打出低四桿六十六桿南非球手古加以一百九十五桿並列第三。墨西哥奧帝斯第三輪打出六十五桿，以一百九十六桿，與第三輪造出六十三桿的新西蘭球手班甘貝利並列第五。次日升上第一的佩治則未能保持優勢，打出六十八桿，一百九十七桿跌落第七。,http://www.macaodaily.com/html/2024-03/17/content_1742147.htm,卡特林：保持發揮    國際系列賽第三輪中，美國球手J卡特林表現最出色，打到九隻小鳥及一隻老鷹，以低標準十一桿的五十九桿，創下賽事單輪最佳成績，以一百九十二桿次二桿優勢升上第一，明天將有機會衝擊冠軍,創單 輪 最佳 成績         卡特 林 高球 賽升 首位         【 本報 消息 】 永利 呈獻 ： 國際 系列 賽澳門 站 今日 煞科 ， 昨日 進行 的 第三 輪中 ， 美國 球手 J 卡特 林表 現 出色 以低 標準 十一 桿的 五十九 桿 ， 創下 賽事 單輪 最佳 成績 ， 以 一百九十 二桿 以二桿 優勢 排 第一 。         卡特 林 ： 保持 發揮         國際 系列 賽 第三 輪中 ， 美國 球手 J 卡特 林表 現 最出色 ， 打到 九 隻 小 鳥 及 一 隻 老鷹 ， 以低 標準 十一 桿的 五十九 桿 ， 創下 賽事 單輪 最佳 成績 ， 以 一百九十 二桿次 二桿 優勢 升上 第一 ， 明天 將有 機會 衝擊冠 軍 。 他 表示 非常 高興 打出 五十九 桿 ， 這不 容易 做到 。 希望 今天 能繼續 保持 發揮 。         J 卡特 林 同胞 J 高 克拉克 亦 有 出色 表現 ， 打到 六 隻 小 鳥 及 一 隻 老鷹 ， 低標 準八桿 單輪 並列 第二 ， 同時 以 一百九十 四桿排 第二 。         西班牙 球手 加西亞 雖 捉 到 四 隻 小 鳥 及 一老鷹 ， 但 有 兩個 柏忌 低標 準四桿 完賽 ， 以 二百 ○ 一桿 並列 卅三 。         港 球手 ： 目標 前 八         中國 香港 球手 張雄熙 同樣 打到 四 隻 小 鳥 及 一老鷹 ， 亦 有 兩個 柏忌 ， 低標 準四桿 的 六十六 桿 ， 合計以 一百九十 九桿 並列 第十九 位 。   張雄熙 表示 成功 執行 自己 計劃 ， 打得 很 扎實 。 在 這裡 ， 保持 耐心 很 重要 。 他 又 稱 目標 是 殺入 前 八名 ， 以 獲得 國際 系列 賽下 一站 的 參賽 資格 。         總成績 方面 ， 除 J 卡特 林及 J 高 克拉克 獨佔 第一 、 第二 ， 澳洲 球手 赫伯特 單日 打 低八桿 六十二 桿 ， 與 打出 低四桿 六十六 桿 南非 球手 古 加以 一百九十 五桿 並列 第三 。 墨西哥 奧帝斯 第三 輪 打出 六十五 桿 ， 以 一百九十六 桿 ， 與 第三 輪造 出 六十三 桿的 新西蘭 球手 班甘貝利 並列 第五 。 次日 升 上 第一 的 佩治則 未能 保持 優勢 ， 打出 六十八 桿 ， 一百九十 七桿 跌落 第七 。,2024-03-17
運動之“火”需延續    賈大廚,運動之“火”需延續    現今社會千方百計培養青少年對運動的興趣，養成朝着目標進發的鬥心與團結性。只是投身社會後，這團“火”往往因工作、家庭等不同因素熄滅。如何保持對運動的激情，局方、有關總會需多加思量。    為令澳門體壇持續發展，政府與社團、學校等合力推動全民運動，從青少年着手推出入門、培訓班，讓他們學習更多運動技能，培養對運動興趣，同時養成向目標奮勇拼搏的精神，由教青局主導的學界賽成效顯著。每當學界決賽舉行，家長、學生、校友等都到場打氣，場面盛況空前。學界登頂，不僅是青少年的目標，有時更是一些教練、校友未能完成的心願。學生經過多年努力奪冠，運動員、教練及支持者都極為喜悅，盡顯青少年團結、熱血及對運動的喜愛。    學界賽場上的熱血激情，場邊的澎湃氣氛，卻未能延續到聯賽。即使是決賽，場邊支持者都相對較少，日常的聯賽賽事只得“小貓三四隻”。學界賽球員眾多，但繼續追夢、投身到聯賽球隊的青少年卻甚少。可能是學生經過社會“洗禮”，身上肩負家庭、工作壓力及經濟考量因素，消磨對運動激情。加上澳門運動員缺乏參與國際賽機會，埠際賽亦少之又少，球員缺少出賽機會，經驗及技術難再上一層樓。無論運動員前景及社會壓力，都阻礙運動激情的延續。    賈大廚,http://www.macaodaily.com/html/2024-03/17/content_1742151.htm,為令澳門體壇持續發展，政府與社團、學校等合力推動全民運動，從青少年着手推出入門、培訓班，讓他們學習更多運動技能，培養對運動興趣，同時養成向目標奮勇拼搏的精神，由教青局主導的學界賽成效顯著,運動 之 “ 火 ” 需延續         現今 社會 千方 百計 培養 青少年 對運動 的 興趣 ， 養成 朝着 目標 進發 的 鬥心 與 團結性 。 只是 投身 社會 後 ， 這團 “ 火 ” 往往 因 工作 、 家庭 等 不同 因素 熄滅 。 如何 保持 對運動 的 激情 ， 局方 、 有關 總會 需多加 思量 。         為令 澳門 體壇 持續 發展 ， 政府 與 社團 、 學校 等 合力 推動 全民 運動 ， 從 青少年 着手 推出 入門 、 培訓班 ， 讓 他們 學習 更 多 運動 技能 ， 培養 對 運動 興趣 ， 同時 養成 向 目標 奮勇 拼搏 的 精神 ， 由 教青局 主導 的 學界賽 成效 顯著 。 每當 學界 決賽 舉行 ， 家長 、 學生 、 校友 等 都 到場 打氣 ， 場面 盛況 空前 。 學界 登頂 ， 不僅 是 青少年 的 目標 ， 有時 更是 一些 教練 、 校友 未能 完成 的 心願 。 學生 經過 多年 努力 奪冠 ， 運動員 、 教練 及 支持者 都 極為 喜悅 ， 盡顯 青少年 團結 、 熱血及 對 運動 的 喜 愛 。         學界 賽場 上 的 熱血 激情 ， 場邊 的 澎湃 氣氛 ， 卻 未能 延續 到 聯賽 。 即使 是 決賽 ， 場邊 支持者 都 相 對 較 少 ， 日常 的 聯賽 賽事 只得 “ 小貓 三四 隻 ” 。 學界賽 球員眾 多 ， 但 繼續 追夢 、 投身 到 聯賽 球隊 的 青少年 卻 甚少 。 可能 是 學生 經過 社會 “ 洗禮 ” ， 身上 肩負 家庭 、 工作 壓力 及 經濟 考量 因素 ， 消磨 對運動 激情 。 加上 澳門 運動員 缺乏 參與 國際賽 機會 ， 埠際賽 亦 少之又少 ， 球員 缺少 出賽 機會 ， 經驗 及 技術 難 再 上 一層 樓 。 無論 運動員 前景 及 社會 壓力 ， 都 阻礙 運動 激情 的 延續 。         賈大廚,2024-03-17
嘉華六蛋贈加義,嘉華六蛋贈加義    【本報消息】本地甲組足球聯賽，昨日下午三時蓮峰球場上演兩戰。嘉華面對加義，雖有射手高美斯早段傷出，但仍靠張海山、何嘉誠梅開二度，六比○大勝加義。恆勢的利馬後備上陣遠射建功，恆勢二比一反勝士砵亭。    開季一勝一和的嘉華，迎戰年輕球員掛帥的加義，開波未夠三分鐘，嘉華即由蘇沙把握首個攻勢破網，閃電先開紀錄領先一比○。領先的嘉華之後攻勢不斷，何嘉誠、高美斯、陳大維前線不斷組織攻勢。雖然高美斯在十九分鐘因傷退下火線，但嘉華完半場前，張海山兩度在禁區頂遠射得手，嘉華半場三球在手。    嘉華在下半場仍然佔得主動，何嘉誠六十四分鐘建功擴至四比○優勢。受壓兼大比數落後的加義雪上加霜，王志誠一分鐘兩黃變一紅被逐。踢多個的嘉華把握機會，何嘉誠七十三分鐘入夠兩球，後備的黃禧龍五分鐘後埋齋，嘉華六球大勝加義，兩勝一和升上第三。    恆勢反勝士砵亭    另一戰恆勢鬥士砵亭，士砵亭開賽十五分鐘，由射手謝薩斯建功領先一比○。戰至卅三分鐘，李潤濤為恆勢扳平一比一完半場。恆勢換邊後幾近主導形勢，惜多次攻勢均未能轉化成入球。七十三分鐘，利馬禁區邊放冷箭得手，恆勢二比一反勝士砵亭，兩勝一負暫列第五。    甲足今日下午三時有獨腳戲，BARBIE聯樂迎戰蒙地卡羅，聯樂人腳牌面較好，有望睇高半線在蒙卡身上力爭今季首勝。,http://www.macaodaily.com/html/2024-03/17/content_1742152.htm,踢多個的嘉華把握機會，何嘉誠七十三分鐘入夠兩球，後備的黃禧龍五分鐘後埋齋，嘉華六球大勝加義，兩勝一和升上第三,嘉華六蛋 贈加義         【 本報 消息 】 本地 甲組 足球 聯賽 ， 昨日 下午 三時 蓮峰 球場 上演 兩戰 。 嘉華面 對 加義 ， 雖有 射手 高美斯 早段 傷出 ， 但 仍 靠 張 海山 、 何嘉誠梅開 二度 ， 六比 ○ 大勝 加義 。 恆勢 的 利馬後備 上 陣遠射 建功 ， 恆勢 二 比 一 反勝士 砵 亭 。         開季 一勝 一 和 的 嘉華 ， 迎戰年 輕球員 掛帥 的 加義 ， 開波 未夠 三分 鐘 ， 嘉華即 由 蘇沙 把握 首個 攻勢 破網 ， 閃電先 開紀錄 領先 一比 ○ 。 領先 的 嘉華之後攻 勢不斷 ， 何嘉 誠 、 高美斯 、 陳 大維前 線 不斷 組織 攻勢 。 雖然 高美斯 在 十九分 鐘因傷 退下 火線 ， 但嘉華 完半場 前 ， 張 海山 兩度 在 禁區 頂 遠射 得手 ， 嘉華半場 三球 在手 。         嘉華 在 下半場 仍然 佔 得主 動 ， 何嘉 誠 六十四 分鐘 建功 擴至 四比 ○ 優勢 。 受壓 兼大比 數落 後 的 加義 雪上加霜 ， 王志 誠 一分 鐘兩黃變 一紅 被 逐 。 踢 多個 的 嘉華 把握 機會 ， 何嘉 誠 七十 三分 鐘入夠 兩球 ， 後 備的黃禧龍 五分 鐘後埋 齋 ， 嘉華六球 大勝 加義 ， 兩勝 一和升 上 第三 。         恆勢 反勝士 砵 亭         另 一戰恆勢 鬥士 砵 亭 ， 士 砵 亭 開賽 十五分 鐘 ， 由 射手 謝薩斯 建功 領先 一比 ○ 。 戰至 卅三 分鐘 ， 李潤濤 為 恆勢 扳平 一比 一 完半場 。 恆勢 換邊 後 幾近 主導 形勢 ， 惜 多次 攻勢 均 未能 轉 化成 入球 。 七十 三分 鐘 ， 利馬 禁區邊 放冷箭 得手 ， 恆勢 二 比 一 反勝士 砵 亭 ， 兩勝 一負 暫列 第五 。         甲足 今日 下午 三時 有 獨腳戲 ， BARBIE 聯樂迎 戰蒙地 卡羅 ， 聯樂人 腳牌 面較 好 ， 有望 睇 高半線 在 蒙卡 身上 力爭 今季 首勝 。,2024-03-17
蔣文曦衛冕KZ組,蔣文曦衛冕KZ組    【本報消息】中國澳門汽車總會主辦的“二○二四澳門汽車總會小型賽車錦標賽”第二回合昨日起一連兩日在小型賽車場舉行，KZ組有蔣文曦因對手搶跑被罰而升上第一，驚險奪冠衛冕次回合。    首日賽事先進行125成年公開組、KZ組、Rok Gp 少年組 及Mini Rok組。決賽由125成年公開組率先上演賽廿五圈，由兩位港將廖恩億、廖恩賢展組成領先車隊並上演頭車爭奪戰，“廖氏兄弟”的弟弟廖恩賢先佔據首位，哥哥廖恩億不斷從後施壓，過程中雙方曾經兩度反超，最終廖恩賢頂住壓力以二十分五三秒六一率先衝線，第三為李志恆。    廖恩億搶跑被罰失冠    壓軸的KZ組，開賽因有選手在紅燈未熄滅前搶跑，需要第二次起步。第二次起步順利，洛迪古斯順利佔據頭位，蔣文曦排第二，港將廖恩億緊隨其後，三人形成第一車群帶至尾段，廖恩億把握洛迪古斯失誤並阻擋隊友蔣文曦，成功超越兩人升上第一。蔣文曦順勢升上第二，洛迪古斯跌落第三。最終三人排名未變化，廖恩億首先衝線。不過，由於包括廖恩億在內，有三名車手首次起步時搶跑被賽會罰加五秒，最終跌落第三，蔣文曦以十三分廿四秒九八驚險重奪第一，洛迪古斯第二。    首回合冠軍的蔣文曦表示過程辛苦：“當頭車的隊友出現犯錯，我夾在中間無法再作出幫助，所以被對手超過後再超過洛迪古斯，順勢力追，但比賽只餘下幾圈，無辦法再採取有效的進攻。”他透露今年希望找到贊助商，參加上海舉行的四級方程式賽事。    連賽兩場的廖恩億坦言體能上挑戰巨大，加上戰車在決賽前已出現轉向問題，認為自己在輪胎掌控上較具優勢，藉對手犯錯超車。    至於Rok GP少年組，首回合冠軍劉司鑾未受壓力由頭帶到尾，以十分二十秒四九三順利衛冕冠軍；而Mini ROK組，由盧健隆帶出並保持頭車位置數圈，譚卓賢雖力追並一度超車，但又被反超，隨後因戰車出現問題“入廠”，盧健隆無對手下以八分廿三秒○二九順利衛冕。,http://www.macaodaily.com/html/2024-03/17/content_1742154.htm,第二次起步順利，洛迪古斯順利佔據頭位，蔣文曦排第二，港將廖恩億緊隨其後，三人形成第一車群帶至尾段，廖恩億把握洛迪古斯失誤並阻擋隊友蔣文曦，成功超越兩人升上第一,蔣文曦 衛冕 KZ 組         【 本報 消息 】 中國 澳門 汽車 總會 主辦 的 “ 二 ○ 二四 澳門 汽車 總會 小型 賽車 錦 標賽 ” 第二 回合 昨日 起一連 兩日 在 小型 賽車場 舉行 ， KZ 組有 蔣文曦 因 對 手 搶 跑 被 罰 而 升上 第一 ， 驚險 奪冠衛冕次 回合 。         首日 賽 事先 進行 125 成年 公開組 、 KZ 組 、 Rok   Gp   少年 組   及 Mini   Rok 組 。 決賽 由 125 成年 公開組 率先 上演 賽 廿五 圈 ， 由 兩位 港將 廖恩 億 、 廖恩賢展 組成 領先車 隊並 上演 頭車爭 奪戰 ， “ 廖氏 兄弟 ” 的 弟弟 廖恩賢先 佔據 首位 ， 哥哥 廖恩 億不斷 從後施 壓 ， 過程 中 雙方 曾經 兩度 反超 ， 最終 廖恩賢頂 住 壓力 以 二十分 五 三秒 六一 率先 衝線 ， 第三 為 李志恆 。         廖恩 億 搶 跑 被 罰 失冠         壓軸 的 KZ 組 ， 開賽 因有 選手 在 紅燈 未 熄滅 前 搶 跑 ， 需要 第二次 起步 。 第二次 起步 順利 ， 洛 迪古 斯順利 佔據 頭位 ， 蔣文曦排 第二 ， 港將 廖恩 億緊 隨其 後 ， 三人 形成 第一 車群 帶 至 尾段 ， 廖恩 億 把握 洛 迪古 斯失誤 並阻 擋 隊友 蔣文曦 ， 成功 超越 兩人升 上 第一 。 蔣文曦 順勢 升上 第二 ， 洛 迪古 斯 跌落 第三 。 最終 三人 排名 未 變化 ， 廖恩 億 首先 衝線 。 不過 ， 由 於 包括 廖恩 億 在 內 ， 有 三名 車手 首次 起步 時 搶 跑 被 賽會 罰加 五秒 ， 最終 跌落 第三 ， 蔣文曦 以 十三分 廿四 秒 九八 驚險 重奪 第一 ， 洛 迪古 斯 第二 。         首回合 冠 軍 的 蔣文曦 表示 過程 辛苦 ： “ 當頭車 的 隊友 出現 犯錯 ， 我 夾在 中間 無法 再 作出 幫助 ， 所以 被 對 手 超過 後 再 超過 洛 迪古 斯 ， 順勢力 追 ， 但 比賽 只餘下 幾圈 ， 無辦法 再 採取 有效 的 進攻 。 ” 他 透露 今年 希望 找到 贊助商 ， 參加 上海 舉行 的 四級 方程式 賽事 。         連賽 兩場 的 廖恩 億 坦言 體能 上 挑戰 巨大 ， 加上 戰車 在 決賽 前 已 出現 轉向 問題 ， 認為 自己 在 輪胎 掌控 上 較 具 優勢 ， 藉 對 手 犯錯 超車 。         至於 Rok   GP 少年 組 ， 首回合 冠 軍 劉司 鑾 未受 壓力 由頭 帶 到 尾 ， 以 十分 二十 秒 四九 三順利衛冕 冠 軍 ； 而 Mini   ROK 組 ， 由 盧健隆 帶 出並 保持 頭車 位置 數圈 ， 譚卓賢 雖力 追並 一度 超車 ， 但 又 被 反超 ， 隨後因 戰車 出現 問題 “ 入廠 ” ， 盧健隆 無 對 手下 以 八分 廿三 秒 ○ 二九 順利衛冕 。,2024-03-17
國米爭贏“坡”,國米爭贏“坡”    【本報消息】意甲米蘭雙雄分途出擊，失意歐冠的國米返回聯賽，聖西路主場地利惡鬥拿坡里，藍黑兵有望乘對手不穩，主場贏波返勝軌振士氣。AC作客維羅納，睇好再贏三分搶三連勝。    國米歐冠由贏變輸出局，各項賽事十四連勝走勢同樣告終，士氣受挫。不過國米今季聯賽表現幾近無敵，L馬天尼斯、米希達恩、山齊士及卡漢路古掛帥的鋒線仍屬進攻保證，後防迪維積、門將蘇馬把關亦為信心之選。惟國米周中歐冠踢足百二分鐘，拿坡里無疑更有體能優勢，不過拿坡里今仗有奧森漢因傷缺陣，主場出擊的國米或有機可乘，全力爭返勝軌。    國米M杜林有信心球隊能重新振作：“以這樣的形式結束今季歐冠旅程，我相信士氣很難不受影響，不過我對球隊有信心。我們就像大家庭一樣互相扶持，我相信我們今季的旅程仍未完結，仍有很多目標可以達成，球隊會重新振作，重新出發爭取未來每一勝。”    AC“維”所欲為    AC米蘭作客維羅納，AC近況不俗，各項賽事五戰不敗兼四連勝，歐霸盃輕取對手晉級，狀態士氣同樣好。“美國隊長”普列錫連續三場有波入，狀態好腳風順，聯同利亞奧、門將邁治南、卡魯魯等主力領軍，紅黑兵作客低一班的維羅納，缺地利亦睇好贏走聯賽三連勝。,http://www.macaodaily.com/html/2024-03/17/content_1742158.htm,“美國隊長”普列錫連續三場有波入，狀態好腳風順，聯同利亞奧、門將邁治南、卡魯魯等主力領軍，紅黑兵作客低一班的維羅納，缺地利亦睇好贏走聯賽三連勝,國米 爭贏 “ 坡 ”         【 本報 消息 】 意甲 米蘭 雙雄 分途 出擊 ， 失意 歐冠 的 國米 返回 聯賽 ， 聖 西路 主場 地利 惡鬥拿坡 里 ， 藍黑兵 有望 乘 對 手不穩 ， 主場 贏波 返勝 軌振士氣 。 AC 作客 維羅納 ， 睇 好 再贏 三分 搶三連勝 。         國米 歐冠由贏 變輸 出局 ， 各項 賽事 十四 連勝 走勢 同樣 告終 ， 士氣 受挫 。 不過 國米 今季 聯賽 表現 幾近 無敵 ， L 馬 天 尼斯 、 米 希達恩 、 山齊士 及 卡漢路 古掛帥 的 鋒線 仍屬 進攻 保證 ， 後 防迪維積 、 門將 蘇馬 把 關亦為 信心 之選 。 惟國米 周中 歐冠 踢 足百 二分 鐘 ， 拿坡里 無疑 更 有 體能 優勢 ， 不過 拿坡里 今仗 有 奧森漢 因傷 缺陣 ， 主場 出擊 的 國米 或 有機 可 乘 ， 全力 爭返 勝軌 。         國米 M 杜林 有 信心 球隊 能 重新 振作 ： “ 以 這樣 的 形式 結束 今季 歐冠 旅程 ， 我 相信 士氣 很 難不受 影響 ， 不過 我 對 球隊 有 信心 。 我們 就 像 大家庭 一樣 互相 扶持 ， 我 相信 我們 今季 的 旅程 仍 未 完結 ， 仍 有 很多 目標 可以 達成 ， 球隊 會 重新 振作 ， 重新 出發爭 取未來 每 一勝 。 ”         AC “ 維 ” 所欲 為         AC 米蘭 作客 維羅納 ， AC 近況 不俗 ， 各項 賽事 五戰 不敗 兼 四連勝 ， 歐霸 盃 輕取 對手 晉級 ， 狀態 士氣 同樣 好 。 “ 美國隊 長 ” 普列錫連續 三場 有 波入 ， 狀態 好 腳風順 ， 聯同 利亞奧 、 門將 邁治南 、 卡魯魯 等 主力 領軍 ， 紅黑兵 作客 低 一班 的 維羅納 ， 缺 地利 亦 睇 好 贏走 聯賽 三連勝 。,2024-03-17
