Title,Content,Link,Summary,Preprocessed_Content,Date
環局：按計劃推廣新能源車,用家求充電方便價相宜    環局：按計劃推廣新能源車    【本報消息】議員顏奕恆早前提出書面質詢，問當局將如何加快電車普及，會否有其他鼓勵措施？當局研究電動車於公共停車場停泊的鼓勵措施研究進度如何？環保局長譚偉文回應指出，特區政府將按《澳門電動車推廣計劃》推廣使用新能源車，倘有鼓勵措施將適時公佈。    議員促慢充費下調    書質亦指當局早前推出的公共充電收費下調政策，暫未涉及慢充，問當局會否考慮下一步下調慢充收費。譚偉文回覆時表示，第66/2024號行政長官批示已訂定將慢速充電的“非繁忙時間”延長三小時（由晚上十一時提前至晚上八時），以配合充電用戶使用公共停車場的特性，有助減輕其充電費用。    機動車入口商會理事長鄭穎堯表示，本澳電動車佔新車銷售兩成多，用家主要關注充電便利性、充電價格兩大因素，建議在這兩方面着手，增強用家購買電動車的信心。    鄭穎堯表示，二○二二年公共停車場電動車充電樁收費前，電動車銷量比例一度佔總銷量的三成；電動車充電收費後，比例回落至兩成多。去年“澳車北上”實施後，電動車銷量比例進一步回落，今年有所回升，但仍未能達到二二年的銷售高峰。    倡調整快慢充比例    據業界觀察，居民購買電動車主要關注充電便利性及充電價格兩大因素，充電安全問題並非主要阻力，始終電動車充電已反覆進行安全測試才推出市場。    電動車充電便利性方面，最理想當然是在私人停車場安裝私人充電樁，但在澳門有一定困難，因此公共停車場的充電設施成為關鍵。目前本澳公共停車場大部分為慢充，未必符合部分用家需求，如部分用家時間緊逼，需要短時間充電繼續行程，甚至因突發事情到香港或內地，便需要快充服務。故建議政府調整快充、慢充比例，滿足不同人士的出行需求。    電動車充電價格方面，受電費因素影響，本澳充電費用較鄰近地區高。“澳車北上”實施後，燃油車在內地的入油成本顯著減少，油電混能車的燃料費用也具競爭力。相比之下，澳門電動車充電費用的優勢並不及鄰近地區顯著。,http://www.macaodaily.com/html/2024-06/10/content_1761041.htm,機動車入口商會理事長鄭穎堯表示，本澳電動車佔新車銷售兩成多，用家主要關注充電便利性、充電價格兩大因素，建議在這兩方面着手，增強用家購買電動車的信心,用家求 充電 方便 價 相宜         環局 ： 按計劃 推廣 新能源 車         【 本報 消息 】 議員 顏奕恆 早前 提出 書面 質詢 ， 問當 局將 如何 加快 電車 普及 ， 會否 有 其他 鼓勵 措施 ？ 當局 研究 電動車 於 公共 停車場 停泊 的 鼓勵 措施 研究 進度 如何 ？ 環保局 長 譚偉文 回應 指出 ， 特區 政府 將按 《 澳門 電動車 推廣計劃 》 推廣 使用 新能源 車 ， 倘有 鼓勵 措施 將適 時公 佈 。         議員 促慢 充費 下調         書質 亦 指當局 早前 推出 的 公共 充電 收費 下調 政策 ， 暫未 涉及 慢充 ， 問當 局會否 考慮 下 一步 下調 慢充 收費 。 譚偉文 回覆 時 表示 ， 第 66 / 2024 號 行政 長 官 批示 已訂 定將 慢速 充電 的 “ 非 繁忙 時間 ” 延長 三小時 （ 由 晚上 十一 時 提前 至 晚上 八時 ） ， 以 配合 充電用 戶 使用 公共 停車場 的 特性 ， 有助 減輕 其充 電費用 。         機動車 入口 商會 理事 長 鄭穎堯 表示 ， 本澳 電動車 佔 新車 銷售 兩成 多 ， 用 家 主要 關注 充電 便利性 、 充電價格 兩大 因素 ， 建議 在 這兩 方面 着手 ， 增強 用家購 買 電動車 的 信心 。         鄭穎堯 表示 ， 二 ○ 二 二年 公共 停車場 電動車 充電樁 收費前 ， 電動車 銷量 比例 一度 佔 總銷量 的 三成 ； 電動車 充電 收費 後 ， 比例 回落 至 兩成 多 。 去年 “ 澳車 北上 ” 實施 後 ， 電動車 銷量 比例 進 一步 回落 ， 今年 有所 回升 ， 但 仍 未能 達到 二 二年 的 銷售 高峰 。         倡調整 快慢 充 比例         據業界 觀察 ， 居民 購買 電動車 主要 關注 充電 便利性 及 充電價格 兩大 因素 ， 充電 安全 問題 並非 主要 阻力 ， 始終 電動車 充電 已 反覆 進行 安全 測試 才 推出 市場 。         電動車 充電 便利性 方面 ， 最 理想 當然 是 在 私人 停車 場安裝 私人 充電樁 ， 但 在 澳門 有 一定 困難 ， 因此 公共 停車場 的 充電設 施成 為 關鍵 。 目前 本澳 公共 停車場 大部分 為 慢充 ， 未必 符合 部分 用 家 需求 ， 如 部分 用家 時間 緊 逼 ， 需要 短時間 充電繼續 行程 ， 甚至 因 突發 事情 到 香港 或 內 地 ， 便 需要 快充 服務 。 故建議 政府 調整 快充 、 慢充 比例 ， 滿足 不同 人士 的 出行 需求 。         電動車 充電價格 方面 ， 受電費 因素 影響 ， 本澳充 電費用 較 鄰 近地 區高 。 “ 澳車 北上 ” 實施 後 ， 燃油 車在 內 地 的 入油 成本 顯著 減少 ， 油電 混能車 的 燃料 費用 也 具 競爭力 。 相比之下 ， 澳門 電動車 充電費 用 的 優勢並 不及 鄰 近地 區顯 著 。,2024-06-10
社諮委促宣教電動車安全資訊,社諮委促宣教電動車安全資訊    完善充電位消防設備加強排查    【本報消息】日前，公共停車場發生電動電單車起火波及附近兩車，幸無人傷，初步懷疑電線短路所致。北區社諮會副召集人高岸峰表示，近年本澳推行電動車，建議當局加強向居民宣教電動車的安全使用知識，推動日常維護，以防類似事故發生，並推出更多電動車的優惠措施和配套，以增強公眾信心，從而有利陸路交通電動化的發展。    高岸峰表示，由於電動車火災採取的滅火手段與一般燃油汽車不同，當局曾表示轄下的公共停車場均設有消防系統，尤其充電櫃及充電泊車位旁均已設置符合消防規格的滅火筒；停車場管理公司會持續培訓員工處理相關突發事件。但私人車場則難以保證有合適的消防設備，相關人員亦未必了解如何處理電動車引起的火災。建議當局針對設有電動車設備的停車場進行排查，了解是否備有合適的消防措施，提供指引協助管理公司及業主優化消防系統和設備。    倡增建電池營運站    高岸峰表示，涉及電動車的安全問題偶有發生，令部分人對電動車仍持觀望態度。為達到減碳目標，當局應考慮優化本地的支持政策，例如推出扶持私人充電樁設施的政策；或結合香港政府推出的電動車“一換一計劃”，以鼓勵車主以舊車換新電動汽車。因應車輛發展趨勢，協助電動車供應商及油站提供快速充電器及換電設施。在消防設備設施及防範措施到位下，讓電動車電池營運商能與政府、企業或民間團體合作，增建電池營運站，增加公共停車場的換電設施及提供換電停車優惠等，持續完善全澳充電網絡。,http://www.macaodaily.com/html/2024-06/10/content_1761042.htm,在消防設備設施及防範措施到位下，讓電動車電池營運商能與政府、企業或民間團體合作，增建電池營運站，增加公共停車場的換電設施及提供換電停車優惠等，持續完善全澳充電網絡,社諮委促 宣教 電動車 安全 資訊         完善 充電位 消防 設備 加強 排查         【 本報 消息 】 日前 ， 公共 停車場 發生 電動電 單車 起火 波及 附近 兩車 ， 幸無人傷 ， 初步 懷疑 電線 短路 所致 。 北區 社諮會 副 召集人 高岸 峰 表示 ， 近年 本澳 推行 電動車 ， 建議 當局 加強 向 居民 宣教 電動車 的 安全 使用 知識 ， 推動 日常 維護 ， 以防 類似 事故 發生 ， 並 推出 更多 電動車 的 優惠 措施 和 配套 ， 以 增強 公眾 信心 ， 從 而 有利 陸路 交通 電動化 的 發展 。         高岸 峰 表示 ， 由 於 電動車 火災 採取 的 滅火 手段 與 一般 燃油 汽車 不同 ， 當局 曾 表示 轄 下 的 公共 停車場 均 設有 消防 系統 ， 尤其 充電櫃 及 充電泊 車位 旁均 已 設置 符合 消防 規格 的 滅火筒 ； 停車場 管理 公司 會持續 培訓員 工處理 相關 突發 事件 。 但 私人 車場則 難以 保證 有 合適 的 消防 設備 ， 相關 人員 亦 未必 了解 如何 處理 電動車 引起 的 火災 。 建議 當局 針對 設有 電動車 設備 的 停車場 進行 排查 ， 了解 是否 備有 合適 的 消防 措施 ， 提供 指引 協助 管理 公司 及業主 優化 消防 系統 和 設備 。         倡 增建 電池 營運站         高岸 峰 表示 ， 涉及 電動車 的 安全 問題 偶有 發生 ， 令 部分 人 對 電動車 仍持 觀望 態度 。 為 達 到 減碳 目標 ， 當局 應 考慮 優化 本地 的 支持 政策 ， 例如 推出 扶持 私人 充電樁 設施 的 政策 ； 或 結合 香港政府 推出 的 電動車 “ 一換 一計劃 ” ， 以鼓勵 車主以 舊 車換 新電動 汽車 。 因應 車輛 發展 趨勢 ， 協助 電動車 供應 商及 油站 提供 快速 充電器 及 換電 設施 。 在 消防 設備 設施 及 防範 措施 到位 下 ， 讓 電動車 電池 營運 商能 與 政府 、 企業 或民間 團體 合作 ， 增建 電池 營運站 ， 增加 公共 停車場 的 換電設 施及 提供 換電 停車 優惠 等 ， 持續 完善 全澳 充電 網絡 。,2024-06-10
業者：電動電單車不宜自配電池,業者：電動電單車不宜自配電池    【本報消息】近年改用環保電動車出行成社會趨勢。有業者直言，據不完全統計，全澳行駛中的環保電動電單車約二千多部，合計卅多個品牌共一百二十多款，主要產自廣東江門、深圳、佛山、順德或江蘇無錫等地，外形選擇多，已成居民出行新寵。    業者指出，採用環保電動車出行，符合環保低碳原則。在保養電動電單車方面，需要更換的僅車胎、避震及“剎車皮”等，屬有限支出，每年僅進行二至三次的維護便可。但觀乎澳門實際情況，在普及充電等方面仍有很大的優化空間。    業者亦發現，有部分電動車使用者為求省錢，會郵購較便宜的電池。但必須注意的是，一些較低廉的電動車電池質量難以保證，無疑存在一定危險性。故不建議“慳錢”在內地自購電池，以免衍生意外，甚至出現嚴重事故。    另建議交通警員在查驗電動車輛時，應仔細查看車身編號及標籤，有否涉及非法改裝等，加強執法。,http://www.macaodaily.com/html/2024-06/10/content_1761043.htm,有業者直言，據不完全統計，全澳行駛中的環保電動電單車約二千多部，合計卅多個品牌共一百二十多款，主要產自廣東江門、深圳、佛山、順德或江蘇無錫等地，外形選擇多，已成居民出行新寵,業者 ： 電動電 單車 不宜 自配 電池         【 本報 消息 】 近年 改用 環保 電動車 出行 成社會 趨勢 。 有業者 直言 ， 據 不 完全 統計 ， 全澳 行駛中 的 環保電動 電單 車約 二千 多部 ， 合計卅多個 品牌 共 一百二十多 款 ， 主要 產自廣東 江門 、 深圳 、 佛山 、 順德 或江 蘇無錫 等 地 ， 外形 選擇 多 ， 已成 居民 出行 新寵 。         業者 指出 ， 採用 環保 電動車 出行 ， 符合 環保低 碳 原則 。 在 保養 電動電 單車 方面 ， 需要 更換 的 僅車 胎 、 避震 及 “ 剎車 皮 ” 等 ， 屬 有限 支出 ， 每年 僅進 行二至 三次 的 維護 便 可 。 但 觀乎 澳門 實際 情況 ， 在 普及 充電 等 方面 仍 有 很大 的 優化 空間 。         業者 亦 發現 ， 有 部分 電動車 使用者 為求 省 錢 ， 會 郵購 較 便宜 的 電池 。 但 必須 注意 的 是 ， 一些 較 低廉 的 電動車 電池 質量 難以 保證 ， 無疑 存在 一定 危險性 。 故不建議 “ 慳錢 ” 在 內 地 自購 電池 ， 以免 衍生 意外 ， 甚至 出現 嚴重 事故 。         另建議 交通警 員 在 查驗 電動 車輛 時 ， 應仔細 查看 車身 編號 及標 籤 ， 有否 涉及 非法 改裝 等 ， 加強 執法 。,2024-06-10
昨十三萬八旅客入境,昨十三萬八旅客入境    大橋口岸客流暢旺   大三巴人潮管制    【本報消息】端午節假期第二日，本澳各口岸共錄得六十七萬二千六百多人次出入境，其中出入境旅客共二十七萬九千三百多人次，入境旅客佔十三萬八千四百多人次，旅客主要經關閘和港珠澳大橋口岸出入境。    大橋巴士站現人龍    昨日上午近十一時，港珠澳大橋口岸訪澳客流暢旺，當局節日期間於該口岸增設時節性巴士及博企發財巴站點，疏導旅客。有發財巴職員表示，端午節假期間公司安排約五分鐘一班車，一小時可出逾十班車，目前安排足以應對乘客需求。現場所見，乘客有車就上，幾乎無需排隊。而另一邊巴士站則現人龍。    香港旅客駱先生表示，是次一行十二人來澳二日一夜遊，團友事前已經做好攻略。自己每逢長假期間都會來澳遊玩，認為澳門旅遊具吸引力。其團友羅小姐亦表示經常來澳門，覺得澳門的親子公園適合小朋友，如觀音像海濱休憩區及沙梨頭公園等，適合一家大小玩樂。另同樣來自香港的陳小姐表示來澳一日一夜遊，是次主要到酒店游泳，享受酒店設施，沒有打算到景區，覺得澳門交通特別是巴士班次、截的士難等均有待改善。    有來自深圳的旅客楊小姐表示，是次來澳旅遊體驗經港珠澳大橋入境，感到新鮮及方便。第二次來澳門，事前沒有做攻略，打算去大三巴及路氹數間娛樂場遊覽“打卡”，即日來回，認為本澳美食吸引。    人潮管制四句半鐘    昨日中午，大三巴街再被遊客“攻陷”，現場人頭湧湧針插不入。因應現場情況，警方實施人潮管制，下午一時三十五分開始，大三巴街只可通往牌坊方向，遊人需取道大關斜巷、關前後街、高園街等周邊街巷離開。因應關前後街禁止車輛通行，來自營地大街的車輛必須左轉入草堆街，高園街亦禁止車輛左轉進入大三巴斜巷，人潮管制至傍晚六時十分取消，歷約四個半小時。    管制期間，大三巴街手信、藥房店職員忙得不可開交。店舖迫滿遊客，食店亦有不少遊人排隊候餐。區內手信店迫滿顧客，工作人員準備肉乾等讓遊人試食，場面相當“墟冚”。為免意外發生及防止罪案發生，警方加派人手在場維持秩序，指示行進方向及為旅客提供協助，並以廣播及屏幕提醒行人人潮管制措施生效，呼籲居民如無必要勿入該區，同時遵守警方安排。,http://www.macaodaily.com/html/2024-06/10/content_1760995.htm,昨十三萬八旅客入境    大橋口岸客流暢旺   大三巴人潮管制    【本報消息】端午節假期第二日，本澳各口岸共錄得六十七萬二千六百多人次出入境，其中出入境旅客共二十七萬九千三百多人次，入境旅客佔十三萬八千四百多人次，旅客主要經關閘和港珠澳大橋口岸出入境,昨 十三 萬八 旅客 入境         大橋 口岸 客流 暢旺       大三巴 人潮 管制         【 本報 消息 】 端午 節 假期 第二日 ， 本澳 各口岸 共錄 得 六十七 萬 二千 六百多 人次 出入境 ， 其中 出入境 旅客 共 二十七 萬 九千 三百多 人次 ， 入境 旅客 佔 十三 萬 八千 四百多 人次 ， 旅客 主要 經關閘 和 港珠 澳大橋 口岸 出入境 。         大橋 巴士站 現人龍         昨日 上午 近 十一 時 ， 港珠 澳大橋 口岸 訪澳 客流 暢旺 ， 當局節 日期 間 於 該 口岸 增設 時 節性 巴士 及博 企發 財巴 站點 ， 疏導 旅客 。 有發 財巴 職員 表示 ， 端午 節 假期 間 公司 安排 約 五分 鐘 一班 車 ， 一小 時可出 逾 十班 車 ， 目前 安排 足以 應對 乘客 需求 。 現場 所見 ， 乘客 有車 就 上 ， 幾乎 無 需 排隊 。 而 另 一邊 巴士站 則現 人龍 。         香港 旅客 駱 先生 表示 ， 是 次 一行 十二 人來 澳 二日 一夜 遊 ， 團友 事前 已經 做好 攻略 。 自己 每逢 長 假期 間 都 會 來 澳遊 玩 ， 認為 澳門 旅遊具 吸引力 。 其團 友羅 小姐 亦 表示 經常來 澳門 ， 覺得 澳門 的 親子 公園 適合 小朋友 ， 如觀 音像 海濱 休憩 區及 沙梨 頭公園 等 ， 適合 一家 大小 玩樂 。 另 同樣 來 自 香港 的 陳 小姐 表示 來澳 一日 一夜 遊 ， 是 次 主要 到 酒店 游泳 ， 享受 酒店 設施 ， 沒有 打算 到 景區 ， 覺得 澳門 交通 特別 是 巴士 班次 、 截 的士 難 等 均 有待 改善 。         有來 自 深圳 的 旅客 楊 小姐 表示 ， 是 次 來 澳 旅遊 體驗 經港珠 澳大橋 入境 ， 感到 新鮮及 方便 。 第二次 來 澳門 ， 事前 沒有 做 攻略 ， 打算 去 大三巴 及路 氹 數間 娛樂場 遊覽 “ 打卡 ” ， 即日 來 回 ， 認為 本澳 美食 吸引 。         人潮 管制 四句 半鐘         昨日 中午 ， 大三巴 街 再 被 遊客 “ 攻陷 ” ， 現場 人頭 湧 湧針 插 不入 。 因應 現場 情況 ， 警方 實施 人潮 管制 ， 下午 一時 三十五分 開始 ， 大三巴 街 只 可 通往 牌坊 方向 ， 遊人 需 取道 大關 斜巷 、 關前 後 街 、 高園 街 等 周邊 街巷 離開 。 因應關 前後街 禁止 車輛 通行 ， 來 自營 地 大街 的 車輛 必須 左 轉入 草堆 街 ， 高園 街 亦 禁止 車輛 左轉 進入 大三巴 斜巷 ， 人潮 管制 至 傍晚 六時 十分 取消 ， 歷約 四個 半小時 。         管制 期間 ， 大三巴 街手 信 、 藥房 店 職員 忙得不可 開交 。 店 舖 迫滿 遊客 ， 食店 亦 有 不少 遊人 排隊 候餐 。 區內手 信店 迫滿 顧客 ， 工作 人員 準備 肉 乾 等 讓 遊人 試食 ， 場 面相 當 “ 墟 冚 ” 。 為免 意外 發生 及 防止 罪案 發生 ， 警方 加 派 人手 在 場維持 秩序 ， 指示 行進 方向 及 為 旅客 提供 協助 ， 並以 廣播 及 屏幕 提醒 行人 人潮 管制 措施 生效 ， 呼籲 居民 如 無 必要 勿入 該區 ， 同時 遵守 警方 安排 。,2024-06-10
端午假大橋現客車流雙高峰,端午假大橋現客車流雙高峰    前日創單日單向過關車流最高紀錄    【本報消息】今年端午節與周末雙休連成三天小長假，吸引大批港澳居民“北上”出遊，港珠澳大橋珠海公路口岸接連兩天出現客流車流雙高峰，日均通關客流、車流分別達八萬人次和一萬七千輛次。今日傍晚假期尾聲料出現返程車流通關高峰，建議旅客及司機注意錯峰通關。    昨近萬單牌車過關    前日為端午小長假首日，港珠澳大橋珠海公路口岸出現川流不息的過關“北上”車流，當天錄得出入境車輛一萬七千七百餘輛次，環比增加接近一成二，其中過關“北上”車輛佔一萬○五百多輛次，刷新該口岸單日單向過關車流最高記錄，平均每輛車同行人員超過四人。    該口岸昨日通關客流、車輛繼續維持高位運行，昨截至下午二時已錄得通關客流超過四萬人次、車輛接近八千輛次，高峰時段“北上”客車每小時接近一千輛次，自駕港澳單牌車前往內地旅遊是推高口岸入境車流高峰的主要因素，測算當天過關“北上”港澳單牌車接近一萬輛次。    在“北上”通關車流中，不乏舉家出遊、探親訪友的旅客。有單牌車主表示，“港澳車北上”政策使港澳居民的生活空間大為拓展，便利通關之餘，也讓他們能夠更加輕鬆往來大灣區各地，尤其假期方便全家人出行享受假期時光。    首五月車量增逾倍    數據顯示，今年一至五月，港珠澳大橋珠海公路口岸出入境客車累計一百八十三萬六千多輛次，同比增長一點二八倍，其中港澳單牌車佔比超過五成七。    增調人員保障暢通    為應對假期客流車流高峰，港珠澳大橋邊檢站通過警務聯絡官機制，不斷強化與港方澳方的處突聯動和信息共享，及時掌握入境方向的客流車流情況，提前研判、提前預警，備足執勤警力和機動力量，在客流車流高峰到來前開足、開滿查驗通道。    此外，針對近期持續性強降雨天氣，該邊檢站加強應急值守，運用“視頻監控+多部門聯動處置”模式，及時防範和處置突發險情，並抽調技術人員全天候駐守查驗場地，對露天查驗設備進行重點防護，保障口岸安全暢通。    今下半天返程高峰    今日下午至晚上為端午假期尾聲，今日下午三時至晚上十一時，港珠澳大橋珠海公路口岸料將出現返程出境車流高峰，港澳旅客應合理安排出行計劃，宜選擇錯峰通關。,http://www.macaodaily.com/html/2024-06/10/content_1760996.htm,端午假大橋現客車流雙高峰    前日創單日單向過關車流最高紀錄    【本報消息】今年端午節與周末雙休連成三天小長假，吸引大批港澳居民“北上”出遊，港珠澳大橋珠海公路口岸接連兩天出現客流車流雙高峰，日均通關客流、車流分別達八萬人次和一萬七千輛次,端午 假大橋 現客 車流雙 高峰         前日 創單 日 單向 過關 車流 最高 紀錄         【 本報 消息 】 今年 端午 節與 周末 雙休 連成 三天 小長 假 ， 吸引 大批 港澳 居民 “ 北上 ” 出遊 ， 港珠 澳大橋 珠海 公路 口岸 接連 兩天 出現 客流 車流雙 高峰 ， 日均 通關 客流 、 車流 分別 達八萬 人次 和 一萬 七千 輛次 。 今日 傍晚 假期 尾聲料 出現 返程 車 流通 關 高峰 ， 建議 旅客 及司機 注意 錯峰 通關 。         昨近 萬單 牌車 過關         前日 為 端午 小長 假 首日 ， 港珠 澳大橋 珠海 公路 口岸 出現 川流不息 的 過關 “ 北上 ” 車流 ， 當天錄 得 出入境 車輛 一萬 七千 七百 餘輛 次 ， 環比 增加 接近 一成 二 ， 其中 過關 “ 北上 ” 車輛 佔 一萬 ○ 五百多 輛次 ， 刷新 該 口岸 單日 單向 過關 車流 最高 記錄 ， 平均 每輛車 同行人 員 超過 四人 。         該 口岸 昨日 通關 客流 、 車輛 繼續 維持 高位 運行 ， 昨 截至 下午 二時 已錄 得 通關 客流 超過 四萬 人次 、 車輛 接近 八千 輛次 ， 高峰 時段 “ 北上 ” 客車 每小時 接近 一千 輛次 ， 自駕 港澳 單牌車 前往 內地 旅遊 是 推高 口岸 入境 車流 高峰 的 主要 因素 ， 測算 當天 過關 “ 北上 ” 港澳 單牌車 接近 一萬輛 次 。         在 “ 北上 ” 通關 車流 中 ， 不乏 舉家 出遊 、 探親 訪友 的 旅客 。 有 單牌 車主 表示 ， “ 港澳 車 北上 ” 政策 使 港澳 居民 的 生活 空間 大為 拓展 ， 便利 通關 之餘 ， 也 讓 他們 能夠 更加 輕 鬆 往 來 大 灣 區 各地 ， 尤其 假期 方便 全家人 出行 享受 假期 時光 。         首 五月 車量 增逾倍         數據 顯示 ， 今年 一至 五月 ， 港珠 澳大橋 珠海 公路 口岸 出入境 客車 累計 一百八十 三萬 六千多 輛次 ， 同比 增長 一點 二八 倍 ， 其中 港澳 單牌車 佔 比 超過 五成 七 。         增調 人員 保障 暢通         為 應 對 假期 客流 車流 高峰 ， 港珠 澳大橋邊 檢站 通過 警務 聯絡官 機制 ， 不斷 強化 與 港方 澳方 的 處 突聯動 和 信息 共享 ， 及時 掌握 入境 方向 的 客流 車流 情況 ， 提前 研判 、 提前 預警 ， 備足 執勤 警力 和 機動 力量 ， 在 客流 車流 高峰 到 來 前 開足 、 開滿 查驗 通道 。         此外 ， 針對 近期 持續 性強 降雨 天氣 ， 該邊 檢站 加強 應急 值守 ， 運用 “ 視頻 監控 + 多部 門聯動 處置 ” 模式 ， 及時 防範 和 處置 突發險情 ， 並抽調 技術 人員 全天候 駐守 查驗場 地 ， 對 露天 查驗 設備 進行 重點 防護 ， 保障 口岸 安全 暢通 。         今下 半天 返程 高峰         今日 下午 至 晚上 為 端午 假期 尾聲 ， 今日 下午 三時 至 晚上 十一 時 ， 港珠 澳大橋 珠海 公路 口岸 料將 出現 返程 出境 車流 高峰 ， 港澳 旅客 應 合理安排 出行 計劃 ， 宜選擇 錯峰 通關 。,2024-06-10
