Title,Content,Link,Summary,Preprocessed_Content,Date
新城AB區車橋今冬動工,未來海濱大動脈    收五標書最高24億    新城AB區車橋今冬動工    【本報消息】“新城A、B區行車天橋設計連建造工程”昨日上午九時半舉行第二階段公開開標，五家獲邀競投聯營公司均遞交標書。經開標後，全部標書被接納，工程造價介乎廿一億八千萬至廿三億九千多萬澳門元。工程預計今年第四季動工，最長設計連施工期為九百個工作天。    穿友誼橋底接A區    新城A、B區行車天橋連接新城A區南區至科學館圓形地一帶，全長約三點二公里。天橋西接科學館圓形地和孫逸仙大馬路，向東穿越友誼大橋和既有航道，終點位於新城A區，並與澳門大橋（澳氹第四橋）互通。換言之，天橋將由孫逸仙大馬路經科學館圓形地上方，穿過友誼大橋橋底連接至新城A區南區。    將擴闊孫逸仙馬路    公建局土木工程師余國達表示，新城AB區天橋啟用後，將有助分流新城A區、氹仔北安往返皇朝區的車流，預計孫逸仙大馬路將成為一條繁忙的道路。因此，介乎觀音像至科學館圓形地的一段孫逸仙大馬路將由現時四線行車擴闊至八線車道。    為配合工程，現有連接文化中心與觀音像海濱休憩區的行人天橋將拆除，並改建行人隧道。孫逸仙大馬路將新建一條行人天橋，連接觀音像海濱休憩區至新建的政府辦公大樓。新城A區南區規劃為地下行車隧道，減少影響南區文創區景觀。    兒童設施移向海邊    如何減少施工期間影響交通？余國達表示，工程將分階段進行，計劃先優化觀音像海濱休憩區，部分綠化及兒童遊玩設施需向海邊推移，創設條件增建四條行車道。因應擴路工程，兒童遊樂區可能暫停開放三至四個月。項目穿越友誼大橋及既有航道，局方會與海事及水務局緊密溝通，確保航道暢通，橋上交通則不受影響。    新城A、B區行車天橋採用預先評定資格的限制招標方式。去年九月舉行首階段公開開標，甄選出五家具資格的競投者進入第二階段招標。,http://www.macaodaily.com/html/2024-05/23/content_1757163.htm,未來海濱大動脈    收五標書最高24億    新城AB區車橋今冬動工    【本報消息】“新城A、B區行車天橋設計連建造工程”昨日上午九時半舉行第二階段公開開標，五家獲邀競投聯營公司均遞交標書,未來 海濱 大動脈         收五標 書 最高 24 億         新城 AB 區車橋 今冬 動工         【 本報 消息 】 “ 新城 A 、 B 區行車 天橋 設計連 建造 工程 ” 昨日 上午 九時 半舉行 第二 階段 公開 開標 ， 五家 獲邀 競 投聯營 公司 均 遞交標 書 。 經開標 後 ， 全部 標書 被 接納 ， 工程 造價 介乎 廿一 億 八千 萬至 廿三 億 九千多 萬澳門 元 。 工程 預計 今年 第四季 動工 ， 最長 設計連 施工期 為 九百 個 工作 天 。         穿友誼 橋底 接 A 區         新城 A 、 B 區行車 天橋 連接 新城 A 區南區 至 科學館 圓形 地 一帶 ， 全長 約 三點 二 公里 。 天橋 西接 科學館 圓形 地和孫 逸仙 大馬路 ， 向東 穿越 友誼 大橋 和 既有 航道 ， 終點位 於 新城 A 區 ， 並與 澳門 大橋 （ 澳 氹 第四 橋 ） 互通 。 換言 之 ， 天橋 將由孫 逸仙 大馬路 經科學館 圓形 地 上方 ， 穿過 友誼 大橋 橋底 連接 至 新城 A 區南區 。         將擴 闊孫 逸仙 馬 路         公建局 土木工程 師余國 達 表示 ， 新城 AB 區天橋 啟用 後 ， 將 有助 分流 新城 A 區 、 氹 仔 北安 往返 皇朝 區的 車流 ， 預計孫 逸仙 大馬路 將成 為 一條 繁忙 的 道路 。 因此 ， 介乎 觀 音像 至科學館 圓形 地 的 一段 孫 逸仙 大馬路 將由現 時四線 行車 擴闊 至八線 車道 。         為 配合 工程 ， 現有 連接 文化 中心 與 觀 音像 海濱 休憩 區的 行人 天橋將 拆除 ， 並 改建 行人 隧道 。 孫 逸仙 大馬路將 新建 一條 行人 天橋 ， 連接觀 音像 海濱 休憩 區至 新建 的 政府 辦公大樓 。 新城 A 區南區 規劃 為 地下 行車 隧道 ， 減少 影響 南區文 創區 景觀 。         兒童 設施移 向海 邊         如何 減少 施工期 間 影響 交通 ？ 余國達 表示 ， 工程 將分 階段 進行 ， 計劃 先 優化觀 音像 海濱 休憩 區 ， 部分 綠化 及兒 童遊 玩 設施 需 向海 邊 推移 ， 創設 條件 增建 四條 行車 道 。 因應 擴路 工程 ， 兒童 遊樂區 可能 暫停 開放三至 四個 月 。 項目 穿越 友誼 大橋 及 既有 航道 ， 局方 會 與 海事 及 水務局 緊密 溝通 ， 確保 航道 暢通 ， 橋上 交通 則不受 影響 。         新城 A 、 B 區行車 天橋 採用 預先 評定 資格 的 限制 招標 方式 。 去年 九月 舉行 首階段 公開 開標 ， 甄選出 五 家具 資格 的 競 投者 進入 第二 階段 招標 。,2024-05-23
新塡海政府辦公樓上蓋招標,基礎及地庫料十月竣工    新塡海政府辦公樓上蓋招標    【本報消息】外港新填海區第二十五地段公共辦公大樓現正進行基礎及地庫工程，公共建設局為該辦公大樓上蓋建造工程公開招標，下月二十五日截標，翌日開標。    建兩幢政府辦公樓    公建局網站顯示，項目位於外港新填海區第二十五地段，鄰近文化中心，佔地面積六千四百八十平方米，興建兩幢分別為十二層及十七層的政府辦公大樓，並設三層地庫停車場，供政府部門辦公用途。    為配合整體進度，項目採取基礎及地庫和上蓋分開招標方式。基礎及地庫工程於二〇二二年九月委託工程，造價為五億一千四百萬元，合約竣工期為今年九月。受新冠疫情影響延誤十四個工作天，最新預計竣工日期為今年十月。    項目評標按三標準    是次招標為項目的上蓋工程，將緊接基礎及地庫工程動工，最長施工期為八百五十個工作天。根據公開招標公告，由委託工程日起計算，有一個工程節點：完成兩座塔樓結構封頂，最長施工期為四百三十五個工作天。項目評標標準有三項：承攬造價佔五成、施工期佔三成、施工經驗及質量佔兩成。    六月二十五日截標    下月二十五日（星期二）下午五時截止交標。翌（廿六）日上午九時三十分在羅理基博士大馬路南光大廈十樓公共建設局公開開標。,http://www.macaodaily.com/html/2024-05/23/content_1757165.htm,基礎及地庫料十月竣工    新塡海政府辦公樓上蓋招標    【本報消息】外港新填海區第二十五地段公共辦公大樓現正進行基礎及地庫工程，公共建設局為該辦公大樓上蓋建造工程公開招標，下月二十五日截標，翌日開標,基礎 及 地庫料 十月 竣工         新 塡 海 政府 辦公樓 上 蓋 招標         【 本報 消息 】 外港 新 填海 區 第二十五 地段 公共 辦公大樓 現正 進行 基礎 及 地庫 工程 ， 公共 建設 局為 該 辦公大樓 上 蓋 建造 工程 公開 招標 ， 下 月 二十五日 截標 ， 翌日 開標 。         建兩幢 政府 辦公樓         公建局 網站 顯示 ， 項目位 於 外港 新 填海 區 第二十五 地段 ， 鄰近 文化 中心 ， 佔 地面 積 六千 四百八十 平方米 ， 興建 兩幢 分別 為 十二 層及 十七 層 的 政府 辦公大樓 ， 並設 三層 地庫 停車場 ， 供 政府 部門 辦公 用途 。         為 配合 整體 進度 ， 項目 採取 基礎 及 地庫 和 上 蓋 分開 招標 方式 。 基礎 及 地庫 工程 於 二 〇 二 二年 九月 委 託 工程 ， 造價 為 五 億 一千四百 萬元 ， 合約 竣工 期為 今年 九月 。 受新冠 疫情 影響 延誤 十四 個 工作 天 ， 最新 預計 竣工 日期 為 今年 十月 。         項目 評標 按 三 標準         是 次 招標 為 項 目的 上蓋 工程 ， 將緊 接基礎 及 地庫 工程 動工 ， 最長 施工期 為 八百 五十 個 工作 天 。 根據 公開 招標 公告 ， 由委 託 工程 日起 計算 ， 有 一個 工程 節點 ： 完成 兩座 塔樓 結構 封頂 ， 最長 施工期 為 四百 三十五 個 工作 天 。 項目 評標 標準 有 三項 ： 承攬 造價 佔 五成 、 施工期 佔 三成 、 施工 經驗 及 質量 佔 兩成 。         六月 二十五日 截標         下 月 二十五日 （ 星期二 ） 下午 五時 截止 交標 。 翌 （ 廿六 ） 日 上午 九時 三十分 在羅理基 博士 大馬 路南 光大 廈十樓 公共 建設 局公開 開標 。,2024-05-23
澳車北上申請優化兩程序,澳車北上申請優化兩程序    【本報消息】交通事務局訊：為進一步方便居民新申請和再次申請“澳車北上”，經多個單位協調，今日起符合下列情況的申請，可獲豁免提交“跨境車輛資料證明”及自動上傳交通事務局的車輛檢驗結果表。    此外，繼早前優化安卓版(Android)的界面後，經檢視運行穩定，蘋果版(iOS)將於近日更新界面。    優化申請“澳車北上”程序包括：符合再次申請條件的車輛，在沒有改裝或更改車輛特徵下，可獲豁免提交“跨境車輛資料證明”，符合條件的申請人毋須申請和支付相關費用。有關改裝或更改車輛特徵的詳情可查閱常見問題集的再次申請欄目：https://www.dsat.gov.mo/mcars-to-gd/index.aspx?a_id=2000013。    根據《廣東省關於澳門機動車經港珠澳大橋珠海公路口岸入出內地的管理辦法》規定，申請車輛註冊登記達六年或以上須提交機動車安全技術檢驗合格證明，倘申請之車輛在新申請或再次申請進入“交警預審”階段時，於交通事務局存在檢驗日期在半年內且結果為合格之車輛檢驗結果表，系統便會自動上傳相關證明。申請人只需按照系統的提示信息繼續後續步驟，具體可瀏覽https://www.dsat.gov.mo/mcars-to-gd/index.aspx?a_id=2000005。    配合優化調整，交通事務局更新了專頁內的圖文包、申請手續、驗車及常見問題頁面，方便居民查閱。    具體可瀏覽局方專頁(https://www.dsat.gov.mo/mcars-to-gd/index.aspx)。,http://www.macaodaily.com/html/2024-05/23/content_1757168.htm,澳車北上申請優化兩程序    【本報消息】交通事務局訊：為進一步方便居民新申請和再次申請“澳車北上”，經多個單位協調，今日起符合下列情況的申請，可獲豁免提交“跨境車輛資料證明”及自動上傳交通事務局的車輛檢驗結果表,澳車 北上 申請 優化 兩 程序         【 本報 消息 】 交通 事務局 訊 ： 為進 一步 方便 居民 新申 請 和 再次 申請 “ 澳車 北上 ” ， 經多個 單位 協調 ， 今日 起 符合 下列 情況 的 申請 ， 可獲 豁免 提交 “ 跨境 車輛 資料 證明 ” 及 自動 上 傳 交通 事務局 的 車輛 檢驗 結果表 。         此外 ， 繼 早前 優化安卓版 ( Android ) 的 界面 後 ， 經檢視 運行 穩定 ， 蘋果 版 ( iOS ) 將於 近日 更新 界面 。         優化 申請 “ 澳車 北上 ” 程序 包括 ： 符合 再次 申請 條件 的 車輛 ， 在 沒 有 改裝 或 更改 車輛 特徵下 ， 可獲 豁免 提交 “ 跨境 車輛 資料 證明 ” ， 符合 條件 的 申請 人 毋須 申請 和 支付 相關 費用 。 有關 改裝 或 更改 車輛 特徵的 詳情 可查 閱常見 問題 集 的 再次 申請 欄目 ： https : / / www . dsat . gov . mo / mcars - to - gd / index . aspx ? a _ id = 2000013 。         根據 《 廣東 省關 於 澳門 機動車 經港珠 澳大橋 珠海 公路 口岸 入出 內 地 的 管理 辦法 》 規定 ， 申請車 輛 註 冊 登 記 達 六年 或 以上 須 提交 機動車 安全 技術 檢驗 合格 證明 ， 倘申 請 之 車輛 在 新 申請 或 再次 申請 進入 “ 交警 預審 ” 階段 時 ， 於 交通 事務局 存在 檢驗 日期 在 半年 內且 結果 為 合格 之車輛 檢驗 結果表 ， 系統 便 會 自動 上 傳相關 證明 。 申請 人 只 需 按照 系統 的 提示信息 繼續後續 步驟 ， 具體 可 瀏覽 https : / / www . dsat . gov . mo / mcars - to - gd / index . aspx ? a _ id = 2000005 。         配合 優化 調整 ， 交通 事務局 更新 了 專頁 內 的 圖文包 、 申請 手續 、 驗車 及常見 問題 頁 面 ， 方便 居民 查閱 。         具體 可 瀏覽 局方 專頁 ( https : / / www . dsat . gov . mo / mcars - to - gd / index . aspx ) 。,2024-05-23
澳琴寧德時代簽合作協議    本報記者 楊夏怡  報道,助力澳落實經濟適度多元發展    澳琴寧德時代簽合作協議    《澳門特區與寧德時代新能源科技股份有限公司戰略合作框架協議》、《橫琴粵澳合作區執委會與寧德時代新能源科技股份有限公司合作框架協議》簽署儀式，昨日下午二時半在政府總部舉行。兩份合作框架協議的簽署，將進一步助力澳門落實經濟適度多元發展。    簽署儀式在行政長官賀一誠、全國政協副主席何厚鏵、中聯辦主任鄭新聰，寧德時代董事長曾毓群等嘉賓見證下進行，由經濟財政司司長、橫琴深合區執委會主任李偉農，與寧德時代首席投資官王紅波分別代表雙方簽署上述兩份協議。    推進綠色低碳發展    李偉農致詞表示，今年一月，在行政長官帶領下，特區政府和橫琴粵澳深合區相關人員專程考察了寧德時代。當前，特區政府正着力推進“1+4”產業適度多元，今年以來經濟發展和社會民生均保持良好發展態勢。是次與寧德時代簽署協議，相信必將為澳門特區的產業多元注入新的動力。現時，寧德時代團隊與特區政府各相關部門密切對接，已建立了良好溝通機制。特區政府將積極利用寧德時代在產業、市場、科技、人才等方面優勢，共同探討在綠色低碳高質量發展方面的全方位、寬領域、深層次合作機會，秉着優勢互補、合作共贏的原則，推進雙方合作盡快取得實質性進展，期待取得豐碩成果。    助新能源產業集聚    粵澳深合區執委會副主任蘇崑致詞表示，過去五個月來，雙方建立常態化聯絡機制，成立項目工作組，及時協調解決遇到的問題。合作區高度重視本次合作，就寧德時代關注的資金出海、國際綠能認證中心等問題，多次赴北京溝通國家發改委、國家金融監督管理總局，並赴深圳等地調研人民幣海外投貸基金的實現路徑。他指出，此次合作涵蓋產業基金、產業落地、可再生能源建設等多項事宜。合作區將進一步整合資源，搭建對接交流平台，為協議落地創造有利條件。也希望寧德時代積極協調集團優質資源，加大在合作區的項目投入，吸引澳門優秀青年，帶動新能源行業在合作區的產業集聚。    深層合作服務社區    王紅波表示，該公司的發展目標與澳門及橫琴深合區綠色低碳高質量的發展需求匹配，雙方將以本次戰略合作為契機，發揮各自優勢，完善並深化各層次的合作機制，共推各領域合作發展，服務澳琴社區。他說，自雙方成立總對總工作組至今，深切體會到特區政府行政效率與市場化的有機結合和高度統一，澳琴的營商環境和社會活力極大增強了公司在當地的發展信心，希望雙方合作開花結果。    出席是次簽署儀式的還包括經濟財政司司長辦公室主任辜美玲，以及中聯辦和特區政府相關部門、社會各界等代表。    本報記者  楊夏怡  報道,http://www.macaodaily.com/html/2024-05/23/content_1757056.htm,助力澳落實經濟適度多元發展    澳琴寧德時代簽合作協議    《澳門特區與寧德時代新能源科技股份有限公司戰略合作框架協議》、《橫琴粵澳合作區執委會與寧德時代新能源科技股份有限公司合作框架協議》簽署儀式，昨日下午二時半在政府總部舉行,助力 澳落 實經濟 適度 多元 發展         澳琴寧德 時代簽 合作 協議         《 澳門 特區 與 寧德 時代 新能源 科技股份 有限公司 戰略 合作 框架 協議 》 、 《 橫琴粵澳 合作 區執委會 與 寧德 時代 新能源 科技股份 有限公司 合作 框架 協議 》 簽署 儀式 ， 昨日 下午 二時 半 在 政府 總部 舉行 。 兩份 合作 框架 協議 的 簽署 ， 將進 一步 助力 澳門 落實 經濟 適度 多元 發展 。         簽署 儀式 在 行政 長 官賀 一 誠 、 全國政協 副 主席 何厚鏵 、 中聯辦 主任 鄭新聰 ， 寧德 時代 董事 長 曾毓群 等 嘉賓見 證下 進行 ， 由 經濟 財政司 司長 、 橫琴 深合區 執委會 主任 李偉農 ， 與 寧德 時代 首席 投資官 王紅 波分 別 代表 雙方 簽署 上述 兩份 協議 。         推進 綠色 低 碳 發展         李偉 農致 詞 表示 ， 今年 一月 ， 在 行政 長 官帶 領下 ， 特區 政府 和 橫琴粵澳 深合區 相關 人員 專程 考察 了 寧德 時代 。 當前 ， 特區 政府 正 着 力推 進 “ 1 + 4 ” 產業 適度 多元 ， 今年 以來 經濟 發展 和 社會 民生 均 保持良好 發展 態勢 。 是 次 與 寧德 時代 簽署 協議 ， 相信 必將 為 澳門 特區 的 產業 多元 注入 新 的 動力 。 現時 ， 寧德 時代團隊 與 特區 政府 各相關 部門 密切 對接 ， 已 建立 了 良好 溝通 機制 。 特區 政府 將積極 利用 寧德 時代 在 產業 、 市場 、 科技 、 人才 等 方面 優勢 ， 共同 探討 在 綠色 低 碳 高質量 發展 方面 的 全方位 、 寬 領域 、 深層次 合作 機會 ， 秉着 優勢 互補 、 合作 共贏 的 原則 ， 推進 雙方 合作 盡快 取得 實質性 進展 ， 期待 取得 豐碩 成果 。         助 新能源 產業 集聚         粵澳 深合區 執委會 副 主任 蘇崑 致詞 表示 ， 過去 五個 月 來 ， 雙方 建立 常態化 聯絡 機制 ， 成立 項目 工作 組 ， 及時 協調 解決 遇到 的 問題 。 合作 區 高度 重視 本次 合作 ， 就寧德 時代關 注 的 資金 出海 、 國際 綠能 認證 中心 等 問題 ， 多次 赴 北京 溝通 國家發 改委 、 國家 金融 監督 管理 總局 ， 並赴 深圳 等 地 調研 人民 幣 海外 投貸 基金 的 實現 路徑 。 他 指出 ， 此次 合作 涵蓋產業 基金 、 產業 落地 、 可 再生能源 建設 等 多項 事宜 。 合作 區將 進 一步 整合 資源 ， 搭建 對接 交流平台 ， 為 協議 落地 創造 有利 條件 。 也 希望 寧德 時代積 極協調 集團 優質 資源 ， 加大 在 合作 區的 項目 投入 ， 吸引 澳門 優秀 青年 ， 帶動 新能源 行業 在 合作 區的 產業 集聚 。         深層 合作 服務 社區         王紅波 表示 ， 該 公司 的 發展 目標 與 澳門 及 橫琴 深合區 綠色 低 碳 高質量 的 發展 需求 匹配 ， 雙方將 以 本次 戰略 合作 為 契機 ， 發揮 各自 優勢 ， 完善 並 深化 各層次 的 合作 機制 ， 共推 各 領域 合作 發展 ， 服務 澳琴 社區 。 他 說 ， 自雙方 成立 總對 總 工作 組 至今 ， 深切 體會 到 特區 政府 行政效率 與 市場化 的 有機 結合 和 高度 統一 ， 澳琴 的 營商 環境 和 社會 活力 極 大增 強了 公司 在 當地 的 發展 信心 ， 希望 雙方 合作 開花 結果 。         出席 是 次 簽署 儀式 的還 包括 經濟 財政司 司長 辦公 室主任 辜 美玲 ， 以及 中聯辦 和 特區 政府 相關 部門 、 社會 各界 等 代表 。         本報 記者     楊夏怡     報道,2024-05-23
寧德時代新能源電池稱霸全球,寧德時代新能源電池稱霸全球    是次與澳門特區及橫琴深合區簽署合作協議的寧德時代是一家新能源創新科技公司，一直致力於以動力電池和電化學儲能為基礎，實現對化石能源的替代，構建零碳生態。    寧德時代新能源科技股份有限公司成立於二○一一年，總部位於福建寧德市。經過多年發展，其在動力電池及電化學儲能領域方面在全球均居領先位置，動力電池系統使用量連續七年全球第一，充分體現了公司的持續創新能力和國際化市場拓展能力。    去年，橫琴粵澳深度合作區執行委員會印發了《橫琴粵澳深度合作區碳中和試點示範建設總體規劃》，力爭將合作區打造成為全國領先、國際知名的碳中和試點示範區。在澳門及深合區綠色低碳和高質量發展需求驅動下，寧德時代將以本次合作為契機，充分發揮自身優勢，與澳門及深合區在新能源領域展開深入合作，為當地產業多元發展注入新動力，助力澳門及橫琴深合區開啓綠色發展的嶄新篇章。    此外，香港科技園公司亦於去年十二月與寧德時代簽署合作備忘錄，寧德時代宣佈將在香港科學園設立國際研發中心，總投資超過十二億港元，以促進新能源科技創新，推動香港可持續發展。,http://www.macaodaily.com/html/2024-05/23/content_1757057.htm,寧德時代新能源電池稱霸全球    是次與澳門特區及橫琴深合區簽署合作協議的寧德時代是一家新能源創新科技公司，一直致力於以動力電池和電化學儲能為基礎，實現對化石能源的替代，構建零碳生態,寧德 時代 新能源 電池 稱霸 全球         是 次 與 澳門 特區 及 橫琴 深合區 簽署 合作 協議 的 寧德 時代 是 一家 新能源 創新 科技 公司 ， 一直 致力 於 以動力 電池 和 電化學 儲能 為 基礎 ， 實現 對 化石 能源 的 替代 ， 構建 零碳 生態 。         寧德 時代 新能源 科技股份 有限公司 成立 於 二 ○ 一 一年 ， 總 部位 於 福建 寧德市 。 經過 多年 發展 ， 其 在 動力 電池 及 電化學 儲能 領域 方面 在 全球 均 居 領先 位置 ， 動力 電池 系統 使用量 連續 七年 全球 第一 ， 充分 體現 了 公司 的 持續 創新 能力 和 國際化 市場 拓展 能力 。         去年 ， 橫琴粵澳 深度 合作 區執行 委員會 印發 了 《 橫琴粵澳 深度 合作 區碳 中 和 試點示 範建設 總體 規劃 》 ， 力爭將 合作 區打 造成 為 全國 領先 、 國際 知名 的 碳 中 和 試點 示範區 。 在 澳門 及 深合區 綠色 低 碳 和 高質量 發展 需求 驅動 下 ， 寧德 時代將 以 本次 合作 為 契機 ， 充分 發揮 自身 優勢 ， 與 澳門 及 深合區 在 新能源 領域 展開 深入 合作 ， 為當 地產業 多元 發展 注入 新動力 ， 助力 澳門 及 橫琴 深合區 開 啓 綠色 發展 的 嶄 新篇章 。         此外 ， 香港 科技 園 公司 亦 於 去年 十二月 與 寧德 時代 簽署 合作 備忘錄 ， 寧德 時代宣 佈 將在 香港 科學園 設立 國際 研發 中心 ， 總 投資 超過 十二 億 港元 ， 以 促進 新能源 科技 創新 ， 推動 香港 可持續 發展 。,2024-05-23
