Title,Content,Link,Summary,Preprocessed_Content,Date
澳五十年後海平面升2呎,高溫天氣頻    極端降雨增    澳五十年後海平面升2呎    【本報消息】根據政府間氣候變化專門委員會（IPCC）《第六次評估報告》的氣候模式綜合研究推算，本澳在本世紀中末期的整體氣溫將會持續上升，高溫天氣事件變得頻繁。本世紀末期（二○八一至二一○○年）澳門整體降雨量增加，海平面高度亦將上升○點六四米，加劇本澳受天文大潮和風暴潮的影響。    年最高日降雨增三成    氣象局在官方網站公佈《第六次評估報告》的氣候模式綜合研究推算，顯示無論是中等排放情景或非常高排放情景，研究顯示，澳門整體降雨量和極端降雨事件將增加（見圖一）：中等排放情景下，本世紀中期（二○四一至二○六○年）澳門的年降雨量和年最高日降雨量將分別較一九九五至二○一四年的平均值增加約百分之八點三和百分之五點八；非常高排放情景下，本世紀末期（二○八一至二一○○年）的年最高日降雨量將增加約三成，反映極端降雨顯著增加。    海平面升風暴潮加劇    此外，研究顯示本世紀無論出現哪一種情景，澳門的海平面高度均會有所上升（圖二）。當中：中等排放情景下，本世紀中期（二○四一至二○六○年），澳門的海平面高度將較一九九五至二○一四年的平均值上升約○點三一米，本世紀末期（二○八一至二一○○年）更預計會上升約○點六四米。可以預見，因應海平面高度的上升，將加劇澳門受天文大潮和風暴潮的影響。    由於上述研究只是因應未來在不同溫室氣體濃度下，對本世紀不同時期的長期氣候平均狀態的推算評估，並非短期的天氣預測或季度氣候預測，因此本世紀中末期的實際氣候情況仍有很大的不確定性。然而，隨着全球暖化加劇，世界各地發生極端天氣事件的頻率已明顯增加，因此，本世紀中末期澳門亦將面臨高溫、極端降雨增加和海平面上升等氣候變化問題。    完善預警增應急能力    為更好地應對頻發的極端天氣，氣象局呼籲社會各界及大眾攜手實踐聯合國的“全民早期預警”的倡議（圖三），以期更好地提升全民的氣象災害應急處理能力，共同應對氣候變化和自然災害等全球性挑戰。氣象局亦將繼續致力於促進各類預警和預報工作的良好運作，並在提升預報技術的同時，持續優化及拓展相關服務，加強與公共部門及私營機構的交流合作，並推動氣象科普教育工作。    當中，局方積極優化預報策略，並以“先定性、後定量”的發佈方式，持續加強天氣警告的事前提示信息，及早讓公眾提高對短期內可能出現的惡劣天氣或重大天氣變化的警覺，並提前做好預防措施。此外，氣象局將繼續密切監察澳門的氣候狀況，並提供澳門氣候的預測資訊，增加公眾對氣候變化及澳門面臨的氣候風險的認識，以提高預警性，並增強自身對極端天氣的應變能力，共同應對氣候變化帶來的挑戰。,http://www.macaodaily.com/html/2024-09/12/content_1780714.htm,年最高日降雨增三成    氣象局在官方網站公佈《第六次評估報告》的氣候模式綜合研究推算，顯示無論是中等排放情景或非常高排放情景，研究顯示，澳門整體降雨量和極端降雨事件將增加（見圖一）：中等排放情景下，本世紀中期（二○四一至二○六○年）澳門的年降雨量和年最高日降雨量將分別較一九九五至二○一四年的平均值增加約百分之八點三和百分之五點八,高溫 天氣頻         極端 降雨 增         澳 五十年 後 海平面 升 2 呎         【 本報 消息 】 根據 政府 間 氣候 變化 專門委員會 （ IPCC ） 《 第六次 評估 報告 》 的 氣候 模式 綜合 研究 推算 ， 本澳 在 本世紀 中 末期 的 整體 氣溫 將會 持續 上升 ， 高溫 天氣 事件 變得 頻繁 。 本世紀 末期 （ 二 ○ 八一 至二一 ○ ○ 年 ） 澳門 整體 降雨量 增加 ， 海平面 高度 亦將 上升 ○ 點六 四米 ， 加劇本 澳受 天文 大潮 和 風暴潮 的 影響 。         年 最高 日 降雨 增 三成         氣象局 在 官方 網站 公 佈 《 第六次 評估 報告 》 的 氣候 模式 綜合 研究 推算 ， 顯示 無論 是 中等 排放 情景 或 非常 高 排放 情景 ， 研究 顯示 ， 澳門 整體 降雨量 和 極端 降雨 事件 將 增加 （ 見圖 一 ） ： 中等 排放 情景 下 ， 本世紀 中期 （ 二 ○ 四一至 二 ○ 六 ○ 年 ） 澳門 的 年 降雨量 和 年 最高 日 降雨量 將分別 較 一九九 五至 二 ○ 一 四年 的 平均值 增加 約 百分之八 點三 和 百分之五 點八 ； 非常 高 排放 情景 下 ， 本世紀 末期 （ 二 ○ 八一 至二一 ○ ○ 年 ） 的 年 最高 日 降雨量 將 增加 約 三成 ， 反映 極端 降雨 顯著 增加 。         海平面 升風 暴潮 加劇         此外 ， 研究 顯示 本世紀 無論 出現 哪 一種 情景 ， 澳門 的 海平面 高度 均會 有所 上升 （ 圖二 ） 。 當中 ： 中等 排放 情景 下 ， 本世紀 中期 （ 二 ○ 四一至 二 ○ 六 ○ 年 ） ， 澳門 的 海平面 高度 將較 一九九 五至 二 ○ 一 四年 的 平均值 上升 約 ○ 點三 一米 ， 本世紀 末期 （ 二 ○ 八一 至二一 ○ ○ 年 ） 更 預計會 上升 約 ○ 點六 四米 。 可以 預見 ， 因應 海平面 高度 的 上升 ， 將加劇 澳門 受 天文 大潮 和 風暴潮 的 影響 。         由 於 上述 研究 只是 因應 未來 在 不同 溫室 氣體 濃度 下 ， 對本 世紀 不同 時期 的 長 期氣候 平均 狀態 的 推算 評估 ， 並非 短期 的 天氣 預測 或 季度 氣候 預測 ， 因此 本世紀 中 末期 的 實際 氣候 情況 仍 有 很大 的 不確 定性 。 然而 ， 隨着 全球 暖化 加劇 ， 世界各地 發生 極端 天氣 事件 的 頻率 已 明顯 增加 ， 因此 ， 本世紀 中 末期 澳門 亦 將面 臨高溫 、 極端 降雨 增加 和 海平面 上升 等 氣候 變化 問題 。         完善 預警 增應 急 能力         為 更好 地應 對 頻發 的 極端 天氣 ， 氣象局 呼籲 社會 各界 及大眾 攜手 實踐 聯合國 的 “ 全民 早期 預警 ” 的 倡議 （ 圖三 ） ， 以期 更好 地 提升 全民 的 氣象 災害 應急 處理 能力 ， 共同 應對 氣候 變化 和 自然 災害 等 全球性 挑戰 。 氣象 局亦將 繼續 致力 於 促進 各類 預警 和 預報 工作 的 良好 運作 ， 並在 提升 預報 技術 的 同時 ， 持續 優化 及 拓展 相關 服務 ， 加強 與 公共 部門 及 私營 機構 的 交流 合作 ， 並推動 氣象 科普 教育 工作 。         當中 ， 局方 積極 優化 預報 策略 ， 並以 “ 先 定性 、 後 定量 ” 的 發 佈 方式 ， 持續 加強 天氣 警告 的 事前 提示信息 ， 及早 讓 公眾 提高 對 短期 內 可能 出現 的 惡劣 天氣 或 重大 天氣 變化 的 警覺 ， 並 提前 做好 預防 措施 。 此外 ， 氣象 局將 繼續 密切 監察 澳門 的 氣候 狀況 ， 並 提供 澳門 氣候 的 預測 資訊 ， 增加 公眾 對 氣候 變化 及 澳門 面臨 的 氣候 風險 的 認識 ， 以 提高 預警性 ， 並增強 自身 對 極端 天氣 的 應變 能力 ， 共同 應對 氣候 變化 帶來 的 挑戰 。,2024-09-12
林宇滔促靈活疏導風後交通,林宇滔促靈活疏導風後交通    【本報消息】議員林宇滔呼籲政府檢討輕軌定位和作用，並因應氣象預報的準確度提升，制訂更靈活的颱風交通應對措施，提升整體運輸效率。    林宇滔指出，輕軌在颱風過後的表現，與鄰近地區同樣有露天段的列車，在颱風期間仍能維持服務相比差距明顯。根據《澳門陸路整體交通運輸政策二○一○至二○二○》，輕軌應作為澳門公共交通的主幹，巴士和的士則作為基礎。然而，現實情況卻並非如此，輕軌的票價收入極低（根據二○二一年輕軌年報，票價收入僅佔輕軌營運收入的約百分之一），並無承擔交通主幹的壓力，“無論有冇乘客，政府都係使咁多錢”。    林宇滔強調，應重新檢討輕軌的定位，若輕軌能在交通高峰期有效運作，將有助緩解城市交通壓力。    他還指出，橫琴口岸交通設計存在問題。作為新建口岸，卻缺乏與交通轉乘相應的停車場設施，私家車落客區的設計也不合理，造成車輛堵塞；的士站僅設置一個上客位，無法有效疏導車輛和人流，可見口岸規劃失當。    他認為，隨着近年氣象預報準確度和透明度提升，政府應根據實際情況制訂更加靈活、清晰的交通應對措施，而不應僅依賴風球標準執行。建議巴士可根據實際情況提前發車，以減輕交通壓力，“一點半的風和兩點的風差唔多，但巴士若提前半小時發車，效果會大不相同。”    針對颱風的士供不應求的問題，他建議設立附加費以提高司機的出車意慾，同時引入網約車，前提是做好相關安全保障與保險措施。並建議檢討現行的停課制度，以應對極端天氣的影響。    林宇滔呼籲有關部門更加關注民生，颱風後親自到現場了解交通情況，並及時採取措施改進。雖然沒有完美的解決方案，但政府應展現解決問題的決心與魄力。,http://www.macaodaily.com/html/2024-09/12/content_1780715.htm,林宇滔促靈活疏導風後交通    【本報消息】議員林宇滔呼籲政府檢討輕軌定位和作用，並因應氣象預報的準確度提升，制訂更靈活的颱風交通應對措施，提升整體運輸效率,林宇滔 促靈活 疏導風 後 交通         【 本報 消息 】 議員林 宇滔 呼籲 政府 檢討 輕軌 定位 和 作用 ， 並因 應氣象 預報 的 準確度 提升 ， 制訂 更 靈活 的 颱 風 交通 應對 措施 ， 提升 整體 運輸 效率 。         林宇滔 指出 ， 輕軌 在 颱 風過 後 的 表現 ， 與 鄰 近地 區同樣 有 露天 段 的 列車 ， 在 颱 風期 間 仍 能維持 服務 相比 差距 明顯 。 根據 《 澳門 陸路 整體 交通 運輸 政策 二 ○ 一 ○ 至 二 ○ 二 ○ 》 ， 輕軌 應作 為 澳門 公共交通 的 主幹 ， 巴士 和 的士 則作 為 基礎 。 然而 ， 現實 情況 卻 並非 如此 ， 輕軌 的 票價 收入 極低 （ 根據 二 ○ 二 一年 輕軌 年 報 ， 票價 收入 僅佔輕 軌營運 收入 的 約 百分之一 ） ， 並無承擔 交通 主幹 的 壓力 ， “ 無論 有 冇 乘客 ， 政府 都 係 使 咁 多 錢 ” 。         林宇滔 強調 ， 應 重新 檢討 輕軌 的 定位 ， 若輕 軌能 在 交通 高峰期 有效 運作 ， 將 有助 緩解 城市交通 壓力 。         他還 指出 ， 橫琴 口岸 交通 設計 存在 問題 。 作為 新建 口岸 ， 卻 缺乏 與 交通 轉乘 相應 的 停車場 設施 ， 私家 車落 客區 的 設計 也 不合理 ， 造成 車輛 堵塞 ； 的士 站僅 設置 一個 上 客位 ， 無法 有效 疏導 車輛 和 人流 ， 可見 口岸 規劃 失當 。         他 認為 ， 隨着 近年 氣象 預報準 確度 和 透明度 提升 ， 政府 應根據 實際 情況 制訂 更加 靈活 、 清晰 的 交通 應對 措施 ， 而 不 應僅 依賴 風球 標準 執行 。 建議 巴士 可根據 實際 情況 提前 發車 ， 以 減輕 交通 壓力 ， “ 一點 半 的 風 和 兩點 的 風差 唔 多 ， 但 巴士 若 提前 半小時 發車 ， 效果 會 大不相同 。 ”         針對 颱 風 的士 供 不 應求 的 問題 ， 他 建議 設立 附加 費以 提高 司機 的 出車意 慾 ， 同時 引入 網約車 ， 前提 是 做好 相關 安全 保障 與 保險 措施 。 並建議 檢討 現行 的 停課 制度 ， 以應 對 極端 天氣 的 影響 。         林宇滔 呼籲 有 關部門 更加 關注 民生 ， 颱 風後親 自到 現場 了解 交通 情況 ， 並及 時 採取 措施 改進 。 雖然 沒有 完美 的 解決 方案 ， 但 政府 應展 現解決 問題 的 決心 與 魄力 。,2024-09-12
交局檢視颱風後巴士服務,交局檢視颱風後巴士服務    【本報消息】本澳上周五下午二時改掛三號風球，巴士同步恢復營運。交通事務局表示，兩巴在復運首兩小時共發車逾千班次，載客逾七萬三千人次；當局及巴士公司會持續檢視候車及巴士營運情況，採取措施盡力減低惡劣天氣對巴士服務的影響。    交通事務局前日發新聞稿表示，因應惡劣天氣，公共交通會於發出八號或以上熱帶氣旋信號期間暫停服務。在氣象部門發出即將改掛三號風球的提示後，局方立即評估颱風對道路交通環境構成的影響，在確保安全前提下，指示巴士公司提前為巴士復運作好準備。    兩巴隨即便會安排人員巡查巴士沿線道路的通行條件，以及組織車長前往車廠檢查車輛狀況，在確保巴士設備沒有損壞及正常運作後，便會於改掛三號風球起陸續發車前往各總站開始營運。此外，考慮到惡劣天氣後居民的出行需要，對公交服務的需求會瞬間增加，巴士公司會因應客流狀況，適時調度人手及車輛加開特班車及中途插入車，以加快疏導候車乘客。    因應客流增車疏導    受颱風“摩羯”影響，本澳一度掛八號風球。本月六日下午二時改掛三號風球，兩家巴士公司超過一千名車長在提前確認路面通行條件及巴士設備後，於下午二時發出首班車，高峰時段首一小時（下午二時至三時）錄得超過四萬一千人次客流，次一小時（下午三時至四時）超過三萬二千人次。期間兩巴合共發出一千○七十一班次，並針對客流高峰路線增派約一百三十班中途插入車前往候車乘客密集站點加快疏導。    當局稱，由於當日下午高峰時段居民集中出行、車流聚集，道路交通壓力較大，令巴士回車時間延長，乘客候車時間亦受影響。交通事務局及巴士公司會持續檢視候車及巴士營運情況，採取措施盡力減低惡劣天氣對巴士服務的影響，以滿足乘客的搭乘需要。,http://www.macaodaily.com/html/2024-09/12/content_1780716.htm,此外，考慮到惡劣天氣後居民的出行需要，對公交服務的需求會瞬間增加，巴士公司會因應客流狀況，適時調度人手及車輛加開特班車及中途插入車，以加快疏導候車乘客,交局 檢視 颱 風 後 巴士 服務         【 本報 消息 】 本澳 上周五 下午 二時 改掛 三號 風球 ， 巴士 同步 恢 復 營運 。 交通 事務局 表示 ， 兩巴 在 復 運首 兩小時 共 發車 逾 千 班次 ， 載客 逾七萬 三千 人次 ； 當局 及 巴士 公司 會持續 檢視候 車及 巴士 營運 情況 ， 採取 措施 盡力 減低 惡劣 天氣 對 巴士 服務 的 影響 。         交通 事務局 前日 發新聞稿 表示 ， 因應 惡劣 天氣 ， 公共交通 會 於 發出 八號 或 以上 熱帶 氣旋 信號 期間 暫停 服務 。 在 氣象 部門 發出 即將 改掛 三號 風球 的 提示 後 ， 局方 立即 評估 颱 風 對 道路交通 環境 構成 的 影響 ， 在 確保 安全 前提 下 ， 指示 巴士 公司 提前 為 巴士 復 運 作好 準備 。         兩巴 隨 即便 會 安排 人員 巡查 巴士 沿線 道路 的 通行 條件 ， 以及 組織 車長 前往 車廠 檢查 車輛 狀況 ， 在 確保 巴士 設備 沒有 損壞 及 正常 運作 後 ， 便會 於 改掛 三號 風球 起陸續 發車 前往 各總站 開始 營運 。 此外 ， 考慮 到 惡劣 天氣 後 居民 的 出行 需要 ， 對 公交 服務 的 需求 會瞬間 增加 ， 巴士 公司 會 因應 客流 狀況 ， 適時 調度 人手 及 車輛 加開 特班車 及 中途 插入 車 ， 以 加快 疏導 候車 乘客 。         因應 客流 增車 疏導         受 颱 風 “ 摩 羯 ” 影響 ， 本澳 一度 掛八號 風球 。 本月 六日 下午 二時 改掛 三號 風球 ， 兩家 巴士 公司 超過 一千名 車長 在 提前 確認 路面 通行 條件 及 巴士 設備 後 ， 於 下午 二時 發出 首班 車 ， 高峰 時段 首 一小 時 （ 下午 二時 至 三時 ） 錄得 超過 四萬 一千 人次 客流 ， 次 一小 時 （ 下午 三時 至 四時 ） 超過 三萬 二千 人次 。 期間 兩巴 合共 發出 一千 ○ 七十一 班次 ， 並針 對 客流 高峰 路線 增派 約 一百三十 班 中途 插入 車 前往 候車 乘客 密集 站點 加快 疏導 。         當局 稱 ， 由 於 當日 下午 高峰 時段 居民 集中 出行 、 車流 聚集 ， 道路交通 壓力 較 大 ， 令 巴士 回車 時間 延長 ， 乘客 候車 時間 亦 受 影響 。 交通 事務局 及 巴士 公司 會持續 檢視候 車及 巴士 營運 情況 ， 採取 措施 盡力 減低 惡劣 天氣 對 巴士 服務 的 影響 ， 以滿足 乘客 的 搭乘 需要 。,2024-09-12
