Title,Content,Link,Summary,Preprocessed_Content,Date
桂澳帶路研討會促金融合作,澳債券市場成熱議焦點    桂澳帶路研討會促金融合作    【本報消息】由廣西海外聯誼會、澳門廣西社團聯合總會主辦“第六屆桂澳‘一帶一路’合作研討會暨桂澳新時代全方位合作會議”昨舉行，來自廣西、澳門金融範疇專家及企業代表圍繞金融政策、市場趨勢以及合作機遇等議題深入討論。研討會旨在深化桂澳在金融領域的交流與合作，推動雙方在金融範疇實現高質量發展，並探討桂澳兩地金融服務發展的新路徑。    開幕式昨日下午三時假科學館舉行，經濟財政司司長代表戴建業，廣西壯族自治區黨委統戰部部務委員、廣西海外聯誼會副會長覃定堅，中聯辦協調部副部長王建峰，廣西壯族自治區產業園區改革發展辦公室黨組成員、副主任覃元臻，全國政協澳區委員何富強，海事及水務局長黃穗文，廣西壯族自治區政協常務委員、澳門廣西社團聯合總會會長徐家頴，活動籌委會主席、澳門廣西社團聯合總會理事長黃淑禧主禮儀式。    助桂澳多元合作    徐家頴期望通過研討會，帶動桂澳兩地企業家以及學者深入交流，促進桂澳兩地在“一帶一路”的多元化合作發展。    覃元臻稱，研討會自第一屆舉辦以來，為廣西與澳門交流合作搭建良好平台，廣西與澳門各界朋友深入交流，合作更加緊密。    覃定堅認為，桂澳是“一帶一路”重要節點，雙方攜手參與建設，既有良好合作基礎，又有廣闊發展空間。在共同服務粵港澳大灣區國家戰略背景下，推動兩地包括金融在內的務實合作，將是桂澳合作邁向更大範圍、更寬領域、更高水平重點。    今年研討會聚焦金融領域最新動態，特邀五象新區（自貿試驗區南寧片區）管理委員會財政局副局長鍾自敏、中國（廣西）自由貿易試驗區欽州港片區財政金融局協理局長文元昊、澳門中央證券託管結算一人有限公司(MCSD)總裁助理沈國斌、中華（澳門）金融資產交易股份有限公司(MOX)市場二部總經理助理張鵬路四位來自廣西及澳門金融界權威講者，圍繞金融政策創新、市場發展現狀及投資融資環境等議題深度剖析。熱議焦點之一，將集中在澳門債券市場蓬勃發展與廣西QFLP金融政策的創新實踐，探索桂澳金融合作的無限可能與廣闊前景。    簽約促資源共享    研討會上，廣西壯族自治區產業園區改革發展辦公室與澳門廣西社團聯合總會簽署“共襄發展 · 共享機遇”合作備忘錄。雙方將在資源共享、優勢互補、合作共贏原則下，依託廣西的區位、政策、資源等優勢，發揮澳門廣西社團聯合總會的橋樑作用，共同推進廣西“一區兩地一園一通道”建設，促進經濟高質量發展，並為澳門長期繁榮穩定作貢獻。,http://www.macaodaily.com/html/2024-08/22/content_1776192.htm,澳債券市場成熱議焦點    桂澳帶路研討會促金融合作    【本報消息】由廣西海外聯誼會、澳門廣西社團聯合總會主辦“第六屆桂澳‘一帶一路’合作研討會暨桂澳新時代全方位合作會議”昨舉行，來自廣西、澳門金融範疇專家及企業代表圍繞金融政策、市場趨勢以及合作機遇等議題深入討論,澳債券 市場 成熱議 焦點         桂澳 帶路 研討會促 金融 合作         【 本報 消息 】 由廣西 海外 聯誼會 、 澳門 廣西 社團 聯合 總會 主辦 “ 第六 屆桂澳 ‘ 一帶 一路 ’ 合作 研討會 暨 桂 澳新 時代 全方位 合作 會議 ” 昨舉行 ， 來 自廣西 、 澳門 金融 範疇 專家及 企業 代表 圍繞 金融 政策 、 市場 趨勢 以及 合作 機遇 等 議題 深入 討論 。 研討會 旨在 深化 桂澳 在 金融 領域 的 交流 與 合作 ， 推動 雙方 在 金融 範疇 實現 高質量 發展 ， 並探 討桂澳 兩地 金融 服務 發展 的 新路 徑 。         開幕式 昨日 下午 三時 假科學館 舉行 ， 經濟 財政司 司長 代表 戴建業 ， 廣西 壯族 自治 區黨委統 戰部 部務委員 、 廣西 海外 聯誼會 副 會長 覃定堅 ， 中聯辦 協調 部副 部長 王建峰 ， 廣西 壯族 自治 區產業 園區 改革 發展 辦 公室 黨 組成員 、 副 主任 覃元臻 ， 全國政協 澳區 委員何 富強 ， 海事 及 水務局 長 黃 穗文 ， 廣西 壯族 自治 區政協常務委員 、 澳門 廣西 社團 聯合 總會會長 徐家 頴 ， 活動 籌委會 主席 、 澳門 廣西 社團 聯合 總會 理事 長 黃 淑禧 主禮 儀式 。         助桂澳 多元 合作         徐家 頴 期望 通過 研討會 ， 帶動桂澳 兩地 企業家 以及 學者 深入 交流 ， 促進 桂澳 兩地 在 “ 一帶 一路 ” 的 多元化 合作 發展 。         覃元臻 稱 ， 研討會 自 第一 屆 舉辦 以來 ， 為 廣西 與 澳門 交流 合作 搭建 良好 平台 ， 廣西 與 澳門 各界 朋友 深入 交流 ， 合作 更加 緊密 。         覃定 堅認 為 ， 桂澳 是 “ 一帶 一路 ” 重要 節點 ， 雙方 攜手 參與 建設 ， 既有 良好 合作 基礎 ， 又 有 廣闊 發展 空間 。 在 共同 服務粵 港澳 大灣區 國家 戰略 背景 下 ， 推動 兩地 包括 金融 在 內 的 務實 合作 ， 將是 桂澳 合作 邁向 更 大範圍 、 更 寬 領域 、 更 高水平 重點 。         今年 研討會 聚焦 金融 領域 最新 動態 ， 特邀 五象 新區 （ 自貿 試驗區 南寧片區 ） 管理 委員會財 政局 副 局長 鍾 自敏 、 中國 （ 廣西 ） 自由 貿易 試驗區 欽州 港片 區財政 金融 局協理 局長 文元昊 、 澳門 中央 證券 託 管 結算 一人 有限公司 ( MCSD ) 總裁 助理 沈國斌 、 中華 （ 澳門 ） 金融 資產 交易 股份 有限公司 ( MOX ) 市場 二部 總經理 助理 張鵬路 四位 來 自廣西及 澳門 金融界 權威 講者 ， 圍繞 金融 政策 創新 、 市場 發展 現狀及 投資融 資環境 等 議題 深度 剖析 。 熱議 焦點 之一 ， 將 集中 在 澳門 債券 市場 蓬勃 發展 與 廣西 QFLP 金融 政策 的 創新 實踐 ， 探索 桂澳 金融 合作 的 無限 可能 與 廣闊 前景 。         簽約 促資源 共享         研討會 上 ， 廣西 壯族 自治 區產業 園區 改革 發展 辦 公室 與 澳門 廣西 社團 聯合 總會 簽署 “ 共襄 發展   ·   共享 機遇 ” 合作 備忘錄 。 雙方將 在 資源 共享 、 優勢 互補 、 合作 共贏 原則 下 ， 依 託 廣西 的 區位 、 政策 、 資源 等 優勢 ， 發揮 澳門 廣西 社團 聯合 總會的橋 樑 作用 ， 共同 推進 廣西 “ 一區 兩地 一園 一 通道 ” 建設 ， 促進 經濟 高質量 發展 ， 並為 澳門長 期 繁榮 穩定作 貢獻 。,2024-08-22
佳景嘉獎十優異學子,佳景嘉獎十優異學子    【本報消息】佳景集團第二十四屆僱員子女優異生獎勵計劃昨日舉行頒獎儀式，十位品學兼優的學生獲頒獎學金及獎狀。多位佳景集團領導層及部門主管出席，一同見證和分享得獎學生的喜悅，場面溫馨熱鬧。    是次獎勵計劃為初小、高小、初中、高中及大學五個組別，獎勵計劃旨在從各組別參選的僱員子女中選取成績優異、積極參與社會活動的優異生給予嘉獎，並藉此讚揚其父母，辛勤工作之餘能夠培養出新一代社會生力軍。    佳景集團秉持“立基澳門，共創佳景”宗旨，在積極發展業務的同時，更關顧僱員，希望能與僱員繼續同心協力，推動澳門經濟及社會發展，共創佳景。    今屆獲獎僱員子女包括，初學組：趙雪寧、繆天琛；高小組：李瑋軒、梁靖尉、羅詠怡；初中組：陳欣桐、趙雪盈、周盈伃、李霆浩；大學組：朱嘉儀。,http://www.macaodaily.com/html/2024-08/22/content_1776195.htm,是次獎勵計劃為初小、高小、初中、高中及大學五個組別，獎勵計劃旨在從各組別參選的僱員子女中選取成績優異、積極參與社會活動的優異生給予嘉獎，並藉此讚揚其父母，辛勤工作之餘能夠培養出新一代社會生力軍,佳景 嘉獎 十優異 學子         【 本報 消息 】 佳景 集團 第二十四 屆 僱員 子女 優異生 獎勵 計劃 昨日 舉行 頒獎 儀式 ， 十位 品學 兼 優 的 學生 獲 頒獎 學金及 獎狀 。 多位 佳景 集團 領導層 及 部門 主管 出席 ， 一同 見證 和 分享 得 獎學生 的 喜悅 ， 場面 溫馨 熱鬧 。         是 次 獎勵 計劃 為 初 小 、 高 小 、 初中 、 高中 及大學 五個 組別 ， 獎勵 計劃 旨在 從 各 組別 參選 的 僱員 子女 中選取 成績 優異 、 積極 參與 社會 活動 的 優異 生給 予嘉獎 ， 並 藉此 讚 揚 其 父母 ， 辛勤工作 之餘能夠 培養 出新 一代 社會 生力 軍 。         佳景 集團 秉持 “ 立基 澳門 ， 共創 佳景 ” 宗旨 ， 在 積極 發展 業務 的 同時 ， 更 關顧 僱員 ， 希望 能 與 僱員繼續 同心 協力 ， 推動 澳門 經濟及 社會 發展 ， 共創 佳景 。         今屆 獲獎 僱員 子女 包括 ， 初學組 ： 趙 雪寧 、 繆天琛 ； 高小組 ： 李瑋軒 、 梁靖尉 、 羅 詠 怡 ； 初中 組 ： 陳 欣桐 、 趙 雪盈 、 周盈 伃 、 李霆浩 ； 大學組 ： 朱嘉儀 。,2024-08-22
閩台總商會考察奉賢發展成就,閩台總商會考察奉賢發展成就    【本報記者馮靖欣上海廿一日電】澳門閩台總商會考察團今日在上海展開系列參觀行程，深入探索上海經濟社會發展的新成就，包括文化創意產業、區域規劃建設及企業數字化賦能等前沿動態。並與奉賢區相關領導及不同產業領域代表交流，為促進雙方日後合作奠定基礎。    了解動漫IP產業    上午十時，一行首先前往拜訪艾漫（上海）動漫設計有限公司，在工作人員帶領下，參觀企業旗下潮流IP線下新零售品牌店及IP主題餐廳，認識動漫產業市場發展現狀及前景。雙方並就動漫IP產業的創新發展、文化輸出等深入交流。    上海重要工業基地    隨後，一行與上海市奉賢區相關領導午宴，奉賢區委常委統戰部長李銳、奉賢區台辦主任顧軍等出席。李銳致辭表示，奉賢區作為上海臨港新片區的重要部分及五大新區的發展點，近年經濟高速發展，且獲得創新成就，已成為上海重要工業基地。歡迎考察團到奉賢考察，並期待眾人深入了解這片充滿活力的土地，共同探索合作機遇，奉賢區也將全力為企業家在當地的發展提供支持與服務。    午宴結束後，考察團馬不停蹄前往奉賢區規劃館、化妝品牌企業自然堂集團生產基地，以及日化產品企業美樂家中國總部園區參觀。    在奉賢區規劃館內，一行不僅了解到奉賢區在產業佈局、城市建設、生態環境保護等方面的長遠規劃，還直觀感受到奉賢區在經濟社會發展方面所取得成就。    在參觀自然堂集團生產基地及美樂家總部園區期間，考察團聽取專業人員介紹產品及企業運作，認識智能化、自動化的生產及物流工序，切身感受到企業數字化賦能成果。,http://www.macaodaily.com/html/2024-08/22/content_1776197.htm,閩台總商會考察奉賢發展成就    【本報記者馮靖欣上海廿一日電】澳門閩台總商會考察團今日在上海展開系列參觀行程，深入探索上海經濟社會發展的新成就，包括文化創意產業、區域規劃建設及企業數字化賦能等前沿動態,閩台 總商會 考察 奉賢 發展 成就         【 本報 記者 馮靖欣 上海 廿一日 電 】 澳門 閩台 總商會 考察 團 今日 在 上海 展開 系列 參觀 行程 ， 深入 探索 上海 經濟 社會 發展 的 新 成就 ， 包括 文化 創意 產業 、 區域 規劃 建設 及 企業 數字化 賦能 等 前沿 動態 。 並與 奉賢區 相關 領導及 不同 產業 領域 代表 交流 ， 為 促進 雙方日 後 合作 奠定 基礎 。         了解 動漫 IP 產業         上午 十時 ， 一行 首先 前往 拜訪 艾漫 （ 上海 ） 動漫 設計 有限公司 ， 在 工作 人員帶 領下 ， 參觀 企業 旗下 潮流 IP 線下 新 零售 品牌 店及 IP 主題 餐廳 ， 認識動 漫產業 市場 發展 現狀 及 前景 。 雙方並 就 動漫 IP 產業 的 創新 發展 、 文化 輸出 等 深入 交流 。         上海 重要 工業 基地         隨後 ， 一行 與 上海市 奉賢區 相關 領導 午宴 ， 奉賢區委 常委 統戰部長 李銳 、 奉賢區 台辦 主任 顧軍等 出席 。 李銳 致辭 表示 ， 奉賢區 作為 上海 臨港 新片 區的 重要 部分 及 五大 新區 的 發展點 ， 近年 經濟 高速 發展 ， 且 獲得 創新 成就 ， 已成 為 上海 重要 工業 基地 。 歡迎 考察 團到 奉賢 考察 ， 並 期待 眾人 深入 了解 這片 充滿 活力 的 土地 ， 共同 探索 合作 機遇 ， 奉賢區 也將 全力 為 企業家 在 當地 的 發展 提供 支持 與 服務 。         午宴 結束 後 ， 考察 團馬 不 停蹄 前往 奉賢區 規劃館 、 化妝 品牌 企業 自然 堂 集團 生產 基地 ， 以及 日化 產品 企業 美樂 家中 國總部 園區 參觀 。         在 奉賢區 規劃館 內 ， 一行 不僅 了解 到 奉賢區 在 產業 佈 局 、 城市 建設 、 生態 環境 保護 等 方面 的 長 遠 規劃 ， 還直觀 感受 到 奉賢區 在 經濟 社會 發展 方面 所 取得 成就 。         在 參觀 自然 堂 集團 生產 基地 及 美樂家 總部 園區 期間 ， 考察 團聽取 專業 人員介紹 產品 及 企業 運作 ， 認識 智能化 、 自動化 的 生產及 物流 工序 ， 切身感受 到 企業 數字化 賦能 成果 。,2024-08-22
深合區開展防非法集資宣傳,強化責任擔當    提升防範能力    深合區開展防非法集資宣傳    【本報消息】深合區金融發展局訊：為學習貫徹黨的二十大及黨的二十屆二中、三中全會精神，落實防非處非工作部署，進一步提高社區工作人員履職盡責和防非處非業務能力，本月二十日，橫琴粵澳深度合作區防範和處置非法集資聯席會議辦公室在蓮花社區舉辦以“強化責任擔當，提升防非能力”為主題的防範非法集資宣傳活動。橫琴粵澳深度合作區金融發展局長、黨支部書記池騰輝、省委橫琴工委黨建工作處副處長張體蘭出席活動。    構建群防群治網絡    池騰輝指出，防範和處置非法集資關係著人民群眾的切身利益，必須高度重視防範非法集資工作，堅持黨對防範和處置非法集資工作的集中統一領導，通過強化監測預警和宣教，構建一張嚴密的群防群治網絡，推動防非觸角延伸到基層的每個角落，寄語社區工作人員能夠通過本次活動對防非工作有更深入的了解，積極加入到防範非法集資宣教隊伍中來。    池騰輝、張體蘭共同為合作區荷塘社區、新家園社區、小橫琴社區、蓮花社區授予防範非法集資宣傳牌匾，正式與社區建立防範非法集資宣教協同機制，在社區設置防範非法集資宣傳點，打通防非宣傳教育“最後一公里”。    增強人員防範意識    池騰輝為到場人員講授黨紀學習教育專題黨課，就《中國共產黨紀律處分條例》修訂內容詳細解讀，為結合工作實際詮釋遵規守紀的內在要求，切實提高參與人員的廉潔自律意識、履職盡責能力。金融發展局工作人員結合實際工作，講解《防範和處置非法集資條例》出台的背景、主要框架和內容，提醒社區工作人員在日常工作中加強非法集資風險排查、積極舉報非法集資行為，增強法治意識及防範和處置非法集資工作的能力。    下一步，金融發展局將攜手社區合力向居民宣傳防範非法集資知識，培育居民理性投資理念，提高防範意識，共建美好社區。,http://www.macaodaily.com/html/2024-08/22/content_1776227.htm,強化責任擔當    提升防範能力    深合區開展防非法集資宣傳    【本報消息】深合區金融發展局訊：為學習貫徹黨的二十大及黨的二十屆二中、三中全會精神，落實防非處非工作部署，進一步提高社區工作人員履職盡責和防非處非業務能力，本月二十日，橫琴粵澳深度合作區防範和處置非法集資聯席會議辦公室在蓮花社區舉辦以“強化責任擔當，提升防非能力”為主題的防範非法集資宣傳活動,強化責任 擔當         提升 防範 能力         深合區 開展 防 非法 集資 宣傳         【 本報 消息 】 深合區 金融 發展 局訊 ： 為學習 貫徹 黨 的 二十大 及黨 的 二十 屆 二中 、 三中 全會 精神 ， 落實 防非 處非 工作 部署 ， 進 一步 提高 社區 工作 人員 履職 盡責 和 防非處 非業務 能力 ， 本月 二十日 ， 橫琴粵澳 深度 合作 區防範 和 處置 非法 集資 聯席會議 辦 公室 在 蓮花 社區 舉辦 以 “ 強化責任 擔當 ， 提升 防非 能力 ” 為主題 的 防範 非法 集資 宣傳 活動 。 橫琴粵澳 深度 合作 區 金融 發展 局長 、 黨 支部 書記 池騰輝 、 省委 橫琴 工委 黨建 工作 處 副 處長 張體蘭 出席 活動 。         構建 群防群治 網絡         池騰輝 指出 ， 防範 和 處置 非法 集資關 係 著 人民 群眾 的 切身利益 ， 必須 高度 重視 防範 非法 集資 工作 ， 堅持 黨 對 防範 和 處置 非法 集資 工作 的 集中 統一 領導 ， 通過 強化 監測 預警 和 宣教 ， 構建 一張 嚴密 的 群防群治 網絡 ， 推動 防非 觸角 延伸 到 基層 的 每個 角落 ， 寄語 社區 工作 人員能夠 通過 本次 活動 對 防非 工作 有 更 深入 的 了解 ， 積極 加入 到 防範 非法 集資 宣教 隊伍 中來 。         池騰輝 、 張體蘭 共同 為 合作 區 荷塘 社區 、 新家園 社區 、 小橫琴 社區 、 蓮花 社區 授予 防範 非法 集資 宣傳 牌匾 ， 正式 與 社區 建立 防範 非法 集資 宣教 協同 機制 ， 在 社區 設置 防範 非法 集資 宣傳點 ， 打通 防非 宣傳 教育 “ 最後一 公里 ” 。         增強 人員防 範意識         池騰輝 為 到 場人員 講授 黨紀 學習 教育 專題 黨 課 ， 就 《 中國共產黨 紀律 處分 條例 》 修訂 內容 詳細 解讀 ， 為 結合 工作 實際 詮釋 遵規守紀 的 內 在 要求 ， 切實 提高 參與 人員 的 廉潔 自律 意識 、 履職 盡責 能力 。 金融 發展局 工作 人員 結合 實際 工作 ， 講解 《 防範 和 處置 非法 集資 條例 》 出台 的 背景 、 主要 框架 和 內容 ， 提醒 社區 工作 人員 在 日常 工作 中加 強 非法 集資 風險 排查 、 積極 舉報 非法 集資行 為 ， 增強 法治 意識 及 防範 和 處置 非法 集資 工作 的 能力 。         下 一步 ， 金融 發展 局將 攜手 社區 合力 向 居民 宣傳 防範 非法 集資 知識 ， 培育 居民 理性 投資 理念 ， 提高 防範意識 ， 共建 美好 社區 。,2024-08-22
（新聞小語）整合資源 提升醫療服務水平   夏  耘,整合資源   提升醫療服務水平    公私營醫療資源配置失衡，問題亟待重視。當前社區優惠門診配額有限，供不應求。公立醫生則人手不足，前線醫生工作壓力大。人口老齡化不斷加劇，如何妥善回應居民醫療需求尤其長者醫療服務，值得深思。    目前在衛生中心及專科門診工作的醫護人手不足，並非分配不均，而是求診人數過多，每日大排長龍，醫護應接不暇，只好加班加點。醫護也是肉體凡胎，一旦長期處於高壓工作環境，料必身心疲憊，工作與精神狀態也大打折扣。    有數據反映，再過兩年或現醫生退休潮。本澳專科醫生比例早已不高，若同一時間大批退休，有序培養中的一批醫護精英未能迅速“補位”，必衍生一攬子急切問題。政府宜檢視並出台措施，考慮增加在公立醫療系統實習的名額，或採取赴灣區醫院臨床實習亦獲認可的做法，多想折衷之策。    未來，衛生當局宜審時度勢，堅持“兩條腿”走路，讓醫療資源均衡配置。一方面完善本地醫療服務體系，急民所急、想民所想，讓居民在就醫方面有更多選擇。另方面，宜在原有良好基礎上善用社區門診優勢，適當增加受惠名額，即向非牟利醫療機構資助和購買更多服務，為有需要居民提供適切治療，以免小病演變成大病甚至慢性病。一言以蔽之，達至便民就診，平衡公私營醫療服務之間的協同發展。    “預防優先，妥善治療”是本澳長期以來且行之有效的衛生政策。彈丸之地醫療市場受限，要發展高端專科醫療存在掣肘，因此及早預防、及早治療，病向淺中醫，防病於未發，是有效提升本澳居民整體健康水平的根本策略。當局近日公佈的《健康澳門藍圖》，為本澳未來五年的健康醫療政策描好藍圖，指明方向。面對人口老化，完善基層醫療、社區醫療為重中之重，整合本澳公私醫療資源，結合整個灣區醫療資源合理分配，方能真正有效提升醫療服務水平，從而提升整體居民健康素質。    夏  耘,http://www.macaodaily.com/html/2024-08/22/content_1776228.htm,面對人口老化，完善基層醫療、社區醫療為重中之重，整合本澳公私醫療資源，結合整個灣區醫療資源合理分配，方能真正有效提升醫療服務水平，從而提升整體居民健康素質,整合 資源       提升 醫療 服務 水平         公私 營醫療 資源 配置 失衡 ， 問題 亟待 重視 。 當前 社區 優惠門診 配額 有限 ， 供 不 應求 。 公立 醫生則 人手不足 ， 前線 醫生 工作 壓力 大 。 人口 老齡化 不斷 加劇 ， 如何 妥善 回應 居民 醫療 需求 尤其 長 者 醫療 服務 ， 值得 深思 。         目前 在 衛生 中心 及 專科門診 工作 的 醫護 人手不足 ， 並非 分配 不均 ， 而是 求診 人 數過 多 ， 每日 大排 長 龍 ， 醫護 應接 不暇 ， 只好 加班 加點 。 醫護 也 是 肉體 凡胎 ， 一旦 長 期處 於 高壓 工作 環境 ， 料必 身心 疲憊 ， 工作 與 精神 狀態 也 大打折扣 。         有 數據 反映 ， 再過 兩年 或現 醫生 退休 潮 。 本澳 專科 醫生 比例 早已 不高 ， 若 同一 時間 大批 退休 ， 有序 培養 中 的 一批 醫護 精英 未能 迅速 “ 補位 ” ， 必 衍生 一攬子 急切 問題 。 政府 宜檢視並 出台 措施 ， 考慮 增加 在 公立 醫療 系統 實習 的 名額 ， 或 採取 赴灣區 醫院 臨床 實習 亦 獲認 可 的 做法 ， 多想 折衷 之策 。         未來 ， 衛生 當局 宜審 時度勢 ， 堅持 “ 兩條 腿 ” 走路 ， 讓 醫療 資源 均衡 配置 。 一方面 完善 本地 醫療 服務體系 ， 急民所急 、 想民所想 ， 讓 居民 在 就醫 方面 有 更 多 選擇 。 另 方面 ， 宜在 原有 良好 基礎 上 善用 社區 門診 優勢 ， 適當 增加 受惠 名額 ， 即 向 非 牟利 醫療 機構 資助 和 購買 更 多服 務 ， 為 有 需要 居民 提供 適切 治療 ， 以免 小病 演變成 大病 甚至 慢性病 。 一言以蔽之 ， 達至 便民 就診 ， 平衡 公私 營醫療 服務之間 的 協同 發展 。         “ 預防 優先 ， 妥善 治療 ” 是 本 澳長 期以 來且 行之有效 的 衛生 政策 。 彈丸 之 地 醫療 市場 受限 ， 要 發展 高端 專科 醫療 存在 掣肘 ， 因此 及早 預防 、 及早 治療 ， 病向 淺 中醫 ， 防病 於 未發 ， 是 有效 提升 本澳 居民 整體 健康 水平 的 根本 策略 。 當局 近日 公 佈 的 《 健康 澳門 藍圖 》 ， 為本 澳未來 五年 的 健康 醫療 政策 描好 藍圖 ， 指明方向 。 面對 人口老化 ， 完善 基層 醫療 、 社區 醫療 為 重中之重 ， 整合 本澳 公私 醫療 資源 ， 結合 整個灣區 醫療 資源 合理 分配 ， 方 能 真正 有效 提升 醫療 服務 水平 ， 從 而 提升 整體 居民 健康 素質 。         夏     耘,2024-08-22
