Title,Content,Link,Summary,Preprocessed_Content,Date
俄遠東金礦坍塌困十三人,俄遠東金礦坍塌困十三人    【本報綜合報道】據新華社、美聯社十九日消息：俄羅斯緊急情況部門證實，俄遠東地區阿穆爾州一座礦井三月十八日晚發生岩體坍塌，致十三人被困井下。    被困百二米深處    據俄媒體報道，發生事故的礦井位於阿穆爾州結雅區，屬於俄遠東大型金礦開採企業彼得羅巴甫洛夫斯克礦業公司。俄緊急情況部門和醫療機構組成的救援隊正在事故現場搜救被困人員，但目前仍未與被困人員取得聯繫。    據俄羅斯媒體報道，緊急救援人員正試圖透過通風井救援被困在約一百二十五米深處的礦工。    受該事故影響，阿穆爾州州長奧爾洛夫十九日宣佈當地進入緊急狀態。,http://www.macaodaily.com/html/2024-03/20/content_1742790.htm,俄遠東金礦坍塌困十三人    【本報綜合報道】據新華社、美聯社十九日消息：俄羅斯緊急情況部門證實，俄遠東地區阿穆爾州一座礦井三月十八日晚發生岩體坍塌，致十三人被困井下,俄遠 東金礦 坍塌 困 十三 人         【 本報 綜合 報道 】 據 新華社 、 美聯社 十九日 消息 ： 俄羅斯緊 急情 況部門 證實 ， 俄遠東 地區 阿穆爾州 一座 礦井 三月 十八日 晚發生 岩體 坍塌 ， 致 十三 人 被困 井下 。         被困 百二 米 深處         據 俄 媒體 報道 ， 發生 事故 的 礦 井位 於 阿穆爾州 結雅區 ， 屬 於 俄遠東 大型 金礦 開採 企業 彼得 羅 巴甫洛夫 斯克 礦業 公司 。 俄緊 急情 況部門 和 醫療 機構 組成 的 救援 隊 正在 事故 現場 搜救 被困 人員 ， 但 目前 仍 未 與 被困 人員 取得 聯 繫 。         據 俄羅斯 媒體 報道 ， 緊急 救援 人員正 試圖 透過 通風井 救援 被困 在 約 一百二十五 米 深處 的 礦工 。         受該 事故 影響 ， 阿穆爾州州長 奧爾 洛夫 十九日 宣 佈 當地 進入 緊急 狀態 。,2024-03-20
美警五秒連轟嫌犯卅六槍,便利店發生脅持人質事件    美警五秒連轟嫌犯卅六槍    【本報綜合報道】據中新社、香港中通社十九日消息：美國《紐約郵報》十八日報道，美國丹佛市在三月初發生一宗便利店搶劫及人質脅持事件。當地警方日前公開了隨身攝像機拍攝的畫面，顯示警方在五秒內向嫌犯開了卅六槍。    嫌犯斃命四警待查    丹佛警方表示，三月一日，四名警察接到報警後使用工具突入便利店後面的一個房間，發現嫌犯使用鋒利的工具威脅便利店員工。視頻畫面顯示，嫌疑人在拒絕放下武器後，屋內的警察隨即近距離開槍，在五秒內向其射出卅六發子彈。嫌犯之後在醫院因槍傷過重死亡，此次事件中的四名警察正等待調查。    另據美國媒體當地時間十八日報道，十七日晚，美國佛羅里達州海濱度假城市傑克遜維爾海灘在一小時內發生三宗互不關聯的槍擊事件，造成一人死亡、三人受傷。多名嫌疑人仍在逃。    佛州度假地三槍擊    據美國廣播公司報道，傑克遜維爾海灘警方官員十八日說，十七日晚七時五十分許，兩人在當地一家酒店附近開槍，一名路人和兩名嫌疑人受傷。美媒援引警方官員的話稱，三名傷者中有兩人傷勢嚴重，其中一名嫌疑人為幫派成員。    警方說，十七日晚八時十三分許，一名男子在當地一些商舖附近邊跑邊開槍，沒有人員受傷。涉案槍支已經找到，嫌疑人在逃。    警方尋三名嫌疑人    十七日晚八時卅一分許，當地一家酒吧附近發生槍擊事件，造成一名廿一歲男子死亡。警方十八日仍在尋找三名嫌疑人。,http://www.macaodaily.com/html/2024-03/20/content_1742791.htm,佛州度假地三槍擊    據美國廣播公司報道，傑克遜維爾海灘警方官員十八日說，十七日晚七時五十分許，兩人在當地一家酒店附近開槍，一名路人和兩名嫌疑人受傷,便利店 發生脅 持人質 事件         美警 五秒 連轟 嫌犯 卅六槍         【 本報 綜合 報道 】 據 中新社 、 香港 中通社 十九日 消息 ： 美國 《 紐約 郵報 》 十八日 報道 ， 美國 丹佛市 在 三月初 發生 一宗 便利店 搶劫 及 人 質脅持 事件 。 當地 警方 日前 公開 了 隨身 攝像機 拍 攝 的 畫面 ， 顯 示警 方在 五秒 內向 嫌犯 開了卅六槍 。         嫌犯 斃命 四警 待查         丹佛 警方 表示 ， 三月 一日 ， 四名 警察 接到 報警 後 使用 工具 突入 便利店 後 面 的 一個 房間 ， 發現 嫌犯 使用 鋒利 的 工具 威脅 便利店 員工 。 視頻 畫面 顯示 ， 嫌疑人 在 拒絕 放下 武器 後 ， 屋內 的 警察 隨即 近距 離開 槍 ， 在 五秒 內向 其射 出卅六 發子彈 。 嫌犯 之後在 醫院 因槍 傷過 重 死亡 ， 此次 事件 中 的 四名 警察 正等待 調查 。         另據 美國 媒體 當地 時間 十八日 報道 ， 十七日 晚 ， 美國 佛羅里 達州 海濱 度假 城市 傑克遜 維爾海灘 在 一小 時內 發生 三宗 互不 關聯 的 槍擊 事件 ， 造成 一人 死亡 、 三人 受傷 。 多名 嫌疑人 仍 在 逃 。         佛州 度假地 三槍擊         據美國 廣播 公司 報道 ， 傑克遜 維爾海灘 警方 官員 十八日 說 ， 十七日 晚七時 五 十分 許 ， 兩人 在 當地 一家 酒店 附近 開槍 ， 一名 路人 和 兩名 嫌疑人 受傷 。 美媒 援引 警方 官員 的 話 稱 ， 三名 傷者 中 有 兩人 傷勢 嚴重 ， 其中 一名 嫌疑人 為 幫派 成員 。         警方 說 ， 十七日 晚八時 十三分 許 ， 一名 男子 在 當地 一些 商 舖 附近 邊跑邊 開槍 ， 沒 有人 員 受傷 。 涉案 槍支 已經 找到 ， 嫌疑人 在 逃 。         警方 尋 三名 嫌疑人         十七日 晚八時 卅 一分 許 ， 當地 一家 酒吧 附近 發生 槍擊 事件 ， 造成 一名 廿一 歲 男子 死亡 。 警方 十八日 仍 在 尋找 三名 嫌疑人 。,2024-03-20
波音777機型本月三事故,波音777機型本月三事故    【本報綜合報道】據香港中通社、央視新聞十九日消息：當地時間十八日，美國聯合航空公司一架原計劃飛往日本的波音777飛機出現機械故障，在跑道上滑行一個多小時後，被迫返回三藩市國際機場登機口。    乘客和機組人員已下機。美聯航在一份聲明中表示，目前該公司沒有更多信息可分享。據相關報道，涉事飛機機型為波音777-200ER。    滑行逾句鐘返回    據悉，該客機原定於當地時間十二時○五分從三藩市飛往大阪，在滑行一個多小時後返回登機口，乘客和機組人員在下午一時四十五分許下機。據該航班的一位乘客透露，飛行員說該飛機的“右發動機出現故障”，但並沒有提供任何額外信息。    今年以來，美國波音公司頻發航空安全事故。本月以來，單是波音777機型已發生多起事故。波音777是波音研製的中遠程雙引擎寬體客機，一九九四年六月首次試飛。    美航企事故多發    本月七日，美聯航一架從三藩市飛往大阪的波音777-200型客機起飛後，左側主起落架的一個輪子脫落，飛機緊急備降洛杉磯機場。十一日，美聯航一架波音777-300型客機從悉尼起飛後，右側主起落架出現明顯液壓油洩漏。但這架計劃飛往三藩市的航班仍繼續爬升至巡航高度。在飛至悉尼以東約六百三十公里的太平洋上空時，機組人員決定掉頭返回悉尼。最終，這架搭載了一百八十三名乘客和機組成員的航班在起飛約兩小時後返航着陸，據稱機上無人受傷。,http://www.macaodaily.com/html/2024-03/20/content_1742792.htm,波音777機型本月三事故    【本報綜合報道】據香港中通社、央視新聞十九日消息：當地時間十八日，美國聯合航空公司一架原計劃飛往日本的波音777飛機出現機械故障，在跑道上滑行一個多小時後，被迫返回三藩市國際機場登機口,波音 777 機型 本月 三 事故         【 本報 綜合 報道 】 據 香港 中通社 、 央視 新聞 十九日 消息 ： 當地 時間 十八日 ， 美國 聯合 航空公司 一架 原計劃 飛往 日本 的 波音 777 飛機 出現 機械 故障 ， 在 跑道 上 滑行 一個 多小時 後 ， 被迫 返回 三藩市 國際 機場 登機口 。         乘客 和 機組 人員 已 下機 。 美聯航 在 一份 聲明 中 表示 ， 目前 該 公司 沒有 更 多 信息 可 分享 。 據 相關 報道 ， 涉事 飛機 機型 為 波音 777 - 200ER 。         滑行 逾句鐘 返回         據悉 ， 該 客機 原定 於 當地 時間 十二 時 ○ 五分 從 三藩市 飛往 大阪 ， 在 滑行 一個 多小時 後 返回 登機口 ， 乘客 和 機組 人員 在 下午 一時 四十五分 許下機 。 據 該 航班 的 一位 乘客 透露 ， 飛行員 說 該 飛機 的 “ 右 發動機 出現 故障 ” ， 但並 沒有 提供 任何 額外 信息 。         今年 以來 ， 美國 波音公司 頻發 航空 安全事故 。 本月 以來 ， 單是 波音 777 機型 已 發生 多起 事故 。 波音 777 是 波音 研 製 的 中 遠 程 雙 引擎 寬體 客機 ， 一九九四年 六月 首次 試飛 。         美航 企 事故 多發         本月 七日 ， 美聯航 一架 從 三藩市 飛往 大阪 的 波音 777 - 200 型 客機 起飛 後 ， 左側 主 起落架 的 一個 輪子 脫落 ， 飛機 緊急備 降洛杉磯 機場 。 十一日 ， 美聯航 一架 波音 777 - 300 型 客機 從 悉尼 起飛 後 ， 右側 主 起落架 出現 明顯液 壓油 洩漏 。 但 這架 計劃 飛往 三藩市 的 航班 仍繼續 爬升 至 巡航 高度 。 在 飛至 悉尼 以東 約 六百 三十公里 的 太平洋 上空 時 ， 機組 人員 決定 掉頭 返回 悉尼 。 最終 ， 這架 搭載 了 一百八十 三名 乘客 和 機組 成員 的 航班 在 起 飛約 兩小時 後 返航 着 陸 ， 據稱 機上 無人 受傷 。,2024-03-20
春日掠影,春日掠影,http://www.macaodaily.com/html/2024-03/20/content_1742793.htm,,春日 掠影,2024-03-20
西卡車撼檢查點六死三傷,西卡車撼檢查點六死三傷    【據新華社馬德里十九日電】西班牙塞維利亞省一輛貨運卡車三月十九日清晨在警方設立的檢查卡點撞上多輛汽車，造成六人死亡、三人重傷。    西首相發文哀悼    事故發生在當天四時四十分許。當時，警方正在公路上設卡查毒，一輛運輸番茄的貨運卡車在接到停車指示後突然衝向路肩，並撞上了檢查卡點前停靠的幾輛警車和民用車輛。    事故中的兩名死者和三名傷者為執勤警察，另外四名死者為平民。西班牙首相桑切斯當天在社交媒體上發文，對遇難者表示哀悼。    肇事司機被逮捕    西班牙媒體說，肇事司機與卡車上的另一人均未受傷。目前，司機已被逮捕，其酒駕和毒駕測試結果呈陰性。這宗事故可能源於司機疲勞駕駛導致車輛失控。,http://www.macaodaily.com/html/2024-03/20/content_1742794.htm,西卡車撼檢查點六死三傷    【據新華社馬德里十九日電】西班牙塞維利亞省一輛貨運卡車三月十九日清晨在警方設立的檢查卡點撞上多輛汽車，造成六人死亡、三人重傷,西卡 車撼 檢查 點六死 三傷         【 據 新華 社馬 德里 十九日 電 】 西班牙 塞維利亞省 一輛 貨運卡車 三月 十九日 清晨 在 警方 設立 的 檢查 卡點 撞 上 多輛 汽車 ， 造成 六人 死亡 、 三人 重傷 。         西 首相 發文 哀悼         事故 發生 在 當天 四時 四 十分 許 。 當時 ， 警方 正在 公路 上 設卡 查毒 ， 一輛 運輸 番茄 的 貨運卡車 在 接到 停車 指示 後 突然 衝向 路肩 ， 並撞 上 了 檢查 卡點 前 停靠 的 幾輛 警車 和 民用 車輛 。         事故 中 的 兩名 死者 和 三名 傷者 為 執勤 警察 ， 另外 四名 死者 為 平民 。 西班牙 首相 桑切斯 當天 在 社交 媒體 上 發文 ， 對遇 難者 表示 哀悼 。         肇事 司機 被 逮捕         西班牙 媒體 說 ， 肇事 司機 與 卡車 上 的 另 一 人均 未 受傷 。 目前 ， 司機 已 被 逮捕 ， 其酒 駕 和 毒駕 測試 結果 呈 陰性 。 這宗 事故 可 能源 於 司機 疲勞 駕駛導致 車輛 失控 。,2024-03-20
巴西里約體感達62.3℃創紀錄,巴西里約體感達62.3℃創紀錄    【香港中通社十九日電】當地時間十八日，巴西著名城市里約熱內盧最高溫度達四十二攝氏度。而前一日，里約熱內盧綜合氣溫和濕度的體感溫度達到六十二點三攝氏度，創下十年來最高紀錄。    當地上一次體感溫度紀錄為五十九點七攝氏度，在去年十一月創下。    本周面臨強烈冷鋒    另外，十七日，氣象資訊網站MetSul警告：“由於強降雨和風暴，巴西中南部本周面臨極高風險。最令人擔憂的天氣系統是一道強烈冷鋒，屆時暴雨將隨之而來，可能還會有強風。”    巴西等南美國家近年異常天氣頻發。去年十一月，儘管南半球還有一個月才入夏，但巴西近三千個城市發佈了高溫紅色預警，許多地區的高溫打破了紀錄。    遭受厄爾尼諾現象    世界氣象組織今年二月五日指出，智利近日發生的災難性大規模野火已造成逾百人死亡，促使該國政府宣佈進入緊急狀態並展開大規模救援行動。此次災害發生之際，智利及南美其他地區正遭受厄爾尼諾現象引發的劇烈熱浪侵襲，同時氣候變化又進一步加劇了熱浪。    厄爾尼諾現象平均每兩年至七年發生一次，通常持續九至十二個月。這是一種自然發生的氣候型態，與熱帶太平洋中部和東部的海洋表面變暖有關，但人類活動造成的氣候變化也成為其發生的背景。,http://www.macaodaily.com/html/2024-03/20/content_1742795.htm,遭受厄爾尼諾現象    世界氣象組織今年二月五日指出，智利近日發生的災難性大規模野火已造成逾百人死亡，促使該國政府宣佈進入緊急狀態並展開大規模救援行動,巴西 里約體 感達 62.3 ℃ 創紀錄         【 香港 中通社 十九日 電 】 當地 時間 十八日 ， 巴西 著名 城市 里 約 熱內盧 最高 溫度 達 四十二 攝氏度 。 而前 一日 ， 里 約 熱內盧 綜合 氣溫 和 濕度 的 體感 溫度 達 到 六十二 點三 攝氏度 ， 創下 十年 來 最高 紀錄 。         當 地上 一次 體感 溫度 紀錄 為 五十九 點七 攝氏度 ， 在 去年 十一月 創下 。         本周 面臨 強烈 冷鋒         另外 ， 十七日 ， 氣象 資訊 網站 MetSul 警告 ： “ 由 於強 降雨 和 風暴 ， 巴西 中南部 本周 面臨 極高 風險 。 最 令人 擔憂 的 天氣 系統 是 一道 強烈 冷鋒 ， 屆 時 暴雨 將隨之而來 ， 可能 還會 有 強風 。 ”         巴西 等 南美 國家 近年 異常 天氣 頻發 。 去年 十一月 ， 儘 管 南半球 還有 一個 月 才 入夏 ， 但 巴西 近 三千 個 城市 發 佈 了 高 溫紅色 預警 ， 許多 地區 的 高溫 打破 了 紀錄 。         遭受 厄爾尼諾 現象         世界 氣象 組織 今年 二月 五日 指出 ， 智利 近日 發生 的 災難性 大規模 野火 已 造成 逾百人 死亡 ， 促使 該國 政府 宣 佈 進入 緊急 狀態 並展 開大規模 救援 行動 。 此次 災害 發生 之際 ， 智利 及 南美 其他 地區 正 遭受 厄爾尼諾 現象 引發 的 劇烈 熱浪 侵襲 ， 同時 氣候 變化 又 進 一步 加劇 了 熱浪 。         厄爾尼諾 現象 平均 每 兩年 至 七年 發生 一次 ， 通常 持續 九至 十二 個 月 。 這是 一種 自然 發生 的 氣候 型態 ， 與 熱帶 太平洋 中部 和 東部 的 海洋 表面 變暖 有關 ， 但人類 活動 造成 的 氣候 變化 也 成為 其 發生 的 背景 。,2024-03-20
大灣區數據逐步便捷流動,內地出台24新措吸引外資    大灣區數據逐步便捷流動    【本報綜合報道】據新華社、中新社十九日消息：日前，國務院辦公廳印發《扎實推進高水平對外開放更大力度吸引和利用外資行動方案》（以下簡稱《行動方案》）。《行動方案》提出五方面二十四條措施，其中包括將全面取消製造業領域外資准入限制措施，持續推進電信、醫療等領域擴大開放。此外，還將開展放寬科技創新領域外商投資准入試點。    政府採購一視同仁    官方明確，全面清理妨礙統一市場和公平競爭的政策措施。根據行動方案，中國將在政府採購活動中對內外資企業生產的符合標準的產品一視同仁、平等對待，破除制約各類所有制企業平等參與招標投標的不合理限制。    在要素流動方面，方案提出，促進外商投資企業研發、生產、銷售等數據跨境安全有序流動。建立港澳企業數據跨境流動機制，探索建立跨境數據流動“白名單”制度，穩步推動實現粵港澳大灣區內數據便捷流動。    便利商務人員往來    在便利商務人員往來方面，方案表示要為外商辦理來華簽證提供便利，對於外商投資企業管理人員、技術人員及其隨行配偶和未成年子女，簽證入境有效期放寬至兩年。推動北京、上海、廣州等重點航空樞紐的國際航班數量加快恢復。    方案並明確，積極推動加入《全面與進步跨太平洋夥伴關係協定》和《數字經濟夥伴關係協定》，主動對照相關規則、規制、管理、標準推進國內相關領域改革。,http://www.macaodaily.com/html/2024-03/20/content_1742710.htm,根據行動方案，中國將在政府採購活動中對內外資企業生產的符合標準的產品一視同仁、平等對待，破除制約各類所有制企業平等參與招標投標的不合理限制,內地 出台 24 新措 吸引 外資         大灣區 數據 逐步 便捷 流動         【 本報 綜合 報道 】 據 新華社 、 中新社 十九日 消息 ： 日前 ， 國務院 辦公廳 印發 《 扎實 推進 高水平 對外 開放 更 大 力度 吸引 和 利用 外資 行動 方案 》 （ 以下 簡稱 《 行動 方案 》 ） 。 《 行動 方案 》 提出 五方面 二十四 條 措施 ， 其中 包括 將 全面 取消 製 造 業 領 域外 資 准入 限制 措施 ， 持續 推進 電信 、 醫療 等 領域 擴大開 放 。 此外 ， 還將 開展 放 寬 科技 創新 領域 外商 投資 准入 試點 。         政府 採購 一視 同仁         官方 明確 ， 全面 清理 妨礙統 一市場 和 公平 競爭 的 政策措施 。 根據 行動 方案 ， 中國將 在 政府 採購 活動 中 對 內 外資 企業 生產 的 符合 標準 的 產品 一視 同仁 、 平等 對待 ， 破除 制約 各類 所有制 企業 平等 參與 招標 投標 的 不合理 限制 。         在 要素 流動 方面 ， 方案 提出 ， 促進 外商 投資 企業 研發 、 生產 、 銷售 等 數據 跨境 安全 有序 流動 。 建立 港澳 企業 數據 跨境 流動 機制 ， 探索 建立 跨境 數據 流動 “ 白名 單 ” 制度 ， 穩步 推動實 現粵 港澳 大灣區 內 數據 便捷 流動 。         便利 商務 人員往 來         在 便利 商務 人員往 來 方面 ， 方案 表示 要 為 外商 辦理 來華 簽證 提供 便利 ， 對 於 外商 投資 企業 管理 人員 、 技術 人員 及其 隨行 配偶 和 未成年 子女 ， 簽證 入境 有效期 放寬 至 兩年 。 推動 北京 、 上海 、 廣州 等 重點 航空 樞紐 的 國際 航班 數量 加快 恢 復 。         方案 並明確 ， 積極 推動 加入 《 全面 與 進步 跨 太平洋 夥 伴關 係 協定 》 和 《 數字 經濟夥 伴關 係 協定 》 ， 主動 對 照相 關規則 、 規制 、 管理 、 標準 推進 國內 相關 領域 改革 。,2024-03-20
