Title,Content,Link,Summary,Preprocessed_Content
的士即起加價一成,起錶加至廿一元    每跳縮程仍兩文    的士即起加價一成    【本報消息】的士收費今日凌晨零時調整，整體加幅約一成。起錶首一千六百米由現時的十九元加至二十一元，之後每跳由二百四十米縮至二百二十米，每跳維持兩元。停車等候亦由每分鐘跳錶縮短至每五十五秒。    昨日公佈今起生效    特區公報昨日刊登行政長官批示，修改輕型出租汽車客運服務收費（詳見附表）。當中電召的士只要接載乘客時未超過約定時間十分鐘，收電召費五元，但若未經乘客同意派出非屬其所要求的車型接載，則無須繳付。    批示並指出，按新收費檢定計程錶的日期由交通事務局訂定。檢定前應在的士計程錶旁張貼由該局發出的新舊收費對照表。批示自公佈翌日起生效。由於批示刋登於昨日的政府公報，故的士新收費於今晨零時起實施。    交通事務局今晨發新聞稿稱，的士收費今日凌晨零時調整生效後，全澳一千四百九十九輛的士已透過車載智能終端系統完成收費調整，過程穩定順暢。八輛的士因司機未啟動車輛暫未接收調整指令，待車輛啟動後自動調整收費。    交通局提醒的士司機留意車載系統的自動更新情況，倘有疑問可聯繫車載機供應商新利達與銳明聯盟（客服熱線2872-8000）或前往供應商的三個廿四小時維修點求助(https://mp.weixin.qq.com/s/hujZ1K1DRX9HZcGfcCNCRg)。緊記須領取由交通事務局提供的新收費表，並按法例規定張貼於車廂內顯眼處，以確保正常營運。    上周仍“冇時間表”    多個的士業界團體二〇一九年曾向政府提出的士加價申請，上月底稱收到當局回應，當局擬於農曆新年期間調升的士收費。交通諮詢委員會本月初舉行第一次平常大會，當時委員會主席、交通局長林衍新稱方案仍處研究階段，暫未落實，未有實施時間表。    時隔不足一周，特區公報昨刋登行政長官批示調整的士收費，交通局隨後亦發稿稱完成的士收費調整申請的分析工作。交通局表示，經聽取的士業界的訴求及建議方案，並參考二〇一七年的士收費的調整幅度，在平衡居民承受能力、的士業界的經營成本壓力等因素，經與交通諮詢委員會討論後建議調整的士收費。交諮委及業界對調整方案表示理解。    新收費表貼顯眼處    交通局稱，的士收費調整方案已獲行政長官核准，並頒佈行政長官批示，今日凌晨零時起實施。屆時的士收費將透過的士車載智能終端系統調整。交通事務局提醒居民留意新收費安排，的士司機也須注意車載機報文提示，以及須領取由交通事務局提供的新收費表，按法例規定張貼於車廂內顯眼處，確保正常營運。,http://www.macaodaily.com/html/2024-02/08/content_1734078.htm,新收費表貼顯眼處    交通局稱，的士收費調整方案已獲行政長官核准，並頒佈行政長官批示，今日凌晨零時起實施,起 錶 加至 廿一 元         每 跳 縮程 仍 兩文         的士 即起 加價 一成         【 本報 消息 】 的士 收費 今日 凌晨 零時 調整 ， 整體 加幅 約 一成 。 起 錶 首 一千六百 米 由 現時 的 十九元 加至 二十一 元 ， 之 後 每 跳 由 二百四十 米縮 至 二百 二十米 ， 每 跳維持 兩元 。 停車 等候 亦 由 每 分鐘 跳 錶 縮 短 至 每 五十五 秒 。         昨日 公 佈 今起 生效         特區 公報 昨日 刊登 行政 長 官 批示 ， 修改 輕型 出租 汽車 客運 服務 收費 （ 詳見 附表 ） 。 當中 電召 的士 只要 接載 乘客 時未 超過 約定 時間 十分 鐘 ， 收電 召費 五元 ， 但 若 未經 乘客 同意 派出 非屬 其 所 要求 的 車型 接載 ， 則無須 繳付 。         批示 並 指出 ， 按新 收費 檢定 計程 錶 的 日期 由 交通 事務局 訂定 。 檢定 前應 在 的士 計程 錶 旁 張貼 由 該局 發出 的 新 舊 收費 對 照表 。 批示 自公 佈 翌日 起 生效 。 由 於 批示 刋 登 於 昨日 的 政府 公報 ， 故 的士 新收費 於 今晨 零時 起 實施 。         交通 事務局 今晨 發新聞 稿 稱 ， 的士 收費 今日 凌晨 零時 調整 生效 後 ， 全澳 一千四百 九十九 輛 的士 已透過 車載 智能 終端 系統 完成 收費 調整 ， 過程 穩定 順暢 。 八輛 的士 因司 機未 啟動 車輛 暫未 接收 調整 指令 ， 待 車輛 啟動後自動 調整 收費 。         交通局 提醒 的士 司機 留意 車載 系統 的 自動 更新 情況 ， 倘有 疑問 可 聯 繫 車 載 機 供 應 商 新 利 達 與 銳 明 聯 盟 （ 客服 熱線 2872 - 8000 ） 或 前往 供應商 的 三個 廿四 小時 維修點 求助 ( https : / / mp . weixin . qq . com / s / hujZ1K1DRX9HZcGfcCNCRg ) 。 緊記須 領取 由 交通 事務局 提供 的 新 收費表 ， 並按 法例 規定 張貼 於 車廂 內顯 眼處 ， 以確 保 正常 營運 。         上周 仍 “ 冇 時間 表 ”         多個 的士 業界 團體 二 〇 一 九年 曾 向 政府 提出 的士 加價 申請 ， 上月底 稱 收到 當局 回應 ， 當局擬 於 農 曆 新 年期 間 調升 的士 收費 。 交通 諮 詢委員會本 月初 舉行 第一次 平常 大會 ， 當時 委員會 主席 、 交通局 長 林衍 新稱 方案 仍處 研究 階段 ， 暫未 落實 ， 未有 實施 時間 表 。         時隔 不足 一周 ， 特區 公報 昨 刋 登 行政 長 官 批示 調整 的士 收費 ， 交通局 隨後亦發 稿 稱 完成 的士 收費 調整 申請 的 分析 工作 。 交通局 表示 ， 經聽取 的士 業界 的 訴求 及 建議 方案 ， 並參考 二 〇 一 七年 的士 收費 的 調整 幅度 ， 在 平衡 居民 承受能力 、 的士 業界 的 經營 成本 壓力 等 因素 ， 經與 交通 諮 詢委員會 討論後建議 調整 的士 收費 。 交諮委及 業界 對 調整 方案 表示 理解 。         新 收費表貼 顯眼處         交通局 稱 ， 的士 收費 調整 方案 已獲 行政 長 官 核准 ， 並頒 佈 行政 長 官 批示 ， 今日 凌晨 零時 起 實施 。 屆 時 的士 收費將 透過 的士 車載 智能 終端 系統 調整 。 交通 事務局 提醒 居民 留意 新收費 安排 ， 的士 司機 也須 注意 車載機 報文 提示 ， 以及 須領 取 由 交通 事務局 提供 的 新 收費表 ， 按 法例 規定 張貼 於 車廂 內顯 眼處 ， 確保 正常 營運 。
輕軌除夕通宵營運,輕軌除夕通宵營運    【本報消息】輕軌將於除夕提供通宵服務，至年初一清晨恢復原來發車安排。同時配合春節期間舉辦的各項大型慶典活動，年初三、年初七及正月十五服務時間將至晚上十一時五十九分。    煙花三天延至午夜    輕軌公司昨日發新聞稿表示，澳門輕軌將於二月九日（年卅晚）提供通宵列車服務，為除夕出行的居民和旅客提供交通便利（班次安排詳見附表）。二月十日（年初一）清晨六時三十分後，輕軌班次恢復至約七分半至十分鐘一班。    另外，為配合春節期間舉辦各項大型慶典活動，尤其是三場煙花匯演，二月十二日（年初三）、十六日（年初七）及二十四日（正月十五）輕軌服務將至晚上十一時五十九分。春節期間，澳門輕軌會密切留意各車站的乘客情況，加派人手疏導乘客。呼籲乘客聽從現場車站職員安排，有序乘車。    充値優惠可多三成    輕軌公司昨日亦宣佈，即日起推出輕軌通增值優惠。乘客到輕軌各車站的客戶服務中心為輕軌通充值，每充值一百元可享額外三十元的預付金額。充值次數不限，每張卡的預付值額度上限為一千元。    現時持有成人輕軌通的乘客，可到各車站的客戶服務中心辦理換卡手續，以享受增值優惠。持有輕軌通紀念票及學生輕軌通的乘客，可至客戶服務中心簽署同意書，於原卡享受增值優惠。    成人輕軌通售價每張三十元。增值優惠只限於客戶服務中心辦理，不適用於自助售票機及自助增值機。    若乘客要求退回輕軌通卡內餘額需支付十元手續費。倘參與增值優惠，輕軌通卡內餘額將不可退回。自今年八月七日起，所有類型的澳門輕軌通均不設退款。,http://www.macaodaily.com/html/2024-02/08/content_1734079.htm,另外，為配合春節期間舉辦各項大型慶典活動，尤其是三場煙花匯演，二月十二日（年初三）、十六日（年初七）及二十四日（正月十五）輕軌服務將至晚上十一時五十九分,輕軌 除夕 通宵 營運         【 本報 消息 】 輕 軌將 於 除夕 提供 通宵 服務 ， 至 年初一 清晨 恢 復 原來 發車 安排 。 同時 配合 春節 期間 舉辦 的 各項 大型 慶典 活動 ， 年初三 、 年 初七 及 正月十五 服務 時間 將至 晚上 十一 時 五十九 分 。         煙花 三天 延至 午夜         輕軌 公司 昨日 發新聞稿 表示 ， 澳門輕 軌將 於 二月 九日 （ 年卅晚 ） 提供 通宵 列車 服務 ， 為 除夕 出行 的 居民 和 旅客 提供 交通 便利 （ 班次 安排 詳見 附表 ） 。 二月 十日 （ 年初一 ） 清晨 六時 三十分 後 ， 輕軌 班次 恢 復 至 約 七分 半至 十分 鐘 一班 。         另外 ， 為 配合 春節 期間 舉辦 各項 大型 慶典 活動 ， 尤其 是 三場 煙花 匯演 ， 二月 十二日 （ 年初三 ） 、 十六日 （ 年 初七 ） 及 二十四日 （ 正月十五 ） 輕軌 服務將 至 晚上 十一 時 五十九 分 。 春節 期間 ， 澳門輕 軌會 密切 留意 各車 站 的 乘客 情況 ， 加 派 人手 疏導 乘客 。 呼籲 乘客 聽 從 現場 車站 職員 安排 ， 有序 乘車 。         充 値 優惠 可多 三成         輕軌 公司 昨日 亦 宣 佈 ， 即日起 推出 輕 軌通 增值 優惠 。 乘客 到 輕軌 各車 站 的 客戶 服務 中心 為輕 軌通 充值 ， 每 充值 一百元 可享 額外 三十元 的 預付 金額 。 充值 次數 不限 ， 每張 卡 的 預付 值額度 上限 為 一千元 。         現時 持有 成人 輕 軌通 的 乘客 ， 可到 各車 站 的 客戶 服務 中心 辦理 換卡 手續 ， 以 享受 增值 優惠 。 持有 輕軌 通紀念票 及 學生輕 軌通 的 乘客 ， 可至 客戶 服務 中心 簽署 同意 書 ， 於 原卡 享受 增值 優惠 。         成人 輕軌 通售價 每張 三十元 。 增值 優惠 只限 於 客戶 服務 中心 辦理 ， 不 適用 於 自助 售票 機及 自助 增值 機 。         若 乘客 要求 退回 輕軌 通卡 內餘額 需 支付 十元 手續費 。 倘參 與 增值 優惠 ， 輕軌 通卡 內餘額將 不可 退回 。 自 今年 八月 七日 起 ， 所有 類型 的 澳門 輕軌 通均 不設 退款 。
旅局宣傳輕軌遊,東線V形地車站啟動設計    旅局宣傳輕軌遊    【本報消息】公共建設局長林煒浩回覆議員李振宇質詢表示，全國人大常委會審議通過授權澳門特別行政區管轄V形地的決定，特區政府已啟動修改輕軌東線ES1站的設計工作，在充分利用V形地的情況下，深入研究連接至關閘口岸及巴士總站的方案。此外，特區政府亦積極研究輕軌東線延伸至青茂口岸。    旅遊局表示，會持續透過印刷品、宣傳片、公交廣告等不同渠道向遊客介紹輕軌路線，推廣善用輕軌遊覽各區景點。同時透過新媒體並與網紅合作發佈旅遊攻略，串聯包裝各站點的周邊旅遊資源，宣傳輕軌遊的行程內容，吸引旅客到各區體驗。    A區建行人隧道    公共建設局另回覆議員何潤生書質表示，按照東區—2（新城A區）行人過路設施及地下商業通道規劃，現已開展的A5、A6及A11公共房屋項目，同步會設計相關地段地庫連接地下商業通道及地下過路設施。鄰近學校村的B5、B7、B8地段亦按規劃要求有序推進行人過路設施及地下商業街的工作。按照東區—2規劃，區內設有公共交通換乘中心，令巴士和輕軌可無縫銜接，提高公交的服務效益。,http://www.macaodaily.com/html/2024-02/08/content_1734081.htm,東線V形地車站啟動設計    旅局宣傳輕軌遊    【本報消息】公共建設局長林煒浩回覆議員李振宇質詢表示，全國人大常委會審議通過授權澳門特別行政區管轄V形地的決定，特區政府已啟動修改輕軌東線ES1站的設計工作，在充分利用V形地的情況下，深入研究連接至關閘口岸及巴士總站的方案,東線 V 形地車 站 啟動 設計         旅局 宣傳輕 軌遊         【 本報 消息 】 公共 建設 局長 林煒浩 回覆 議員 李振宇 質詢 表示 ， 全國 人大 常委 會 審議 通過 授權 澳門 特別 行政 區管 轄 V 形地 的 決定 ， 特區 政府 已 啟動 修改 輕軌 東線 ES1 站 的 設計 工作 ， 在 充分利用 V 形地 的 情況 下 ， 深入研究 連接 至 關閘 口岸 及 巴士 總站 的 方案 。 此外 ， 特區 政府 亦 積極 研究 輕軌 東線 延伸 至青茂 口岸 。         旅遊局 表示 ， 會持續 透過 印刷品 、 宣傳片 、 公交 廣告 等 不同 渠道 向 遊客 介紹輕 軌路線 ， 推廣 善用 輕軌 遊覽 各區 景點 。 同時 透過 新 媒體並 與 網紅 合作 發 佈 旅遊 攻略 ， 串聯 包裝 各站 點的 周邊 旅遊 資源 ， 宣傳輕 軌遊 的 行程 內容 ， 吸引 旅客 到 各區 體驗 。         A 區 建行 人 隧道         公共 建設局 另 回覆 議員 何潤 生書質 表示 ， 按照 東區 — 2 （ 新城 A 區 ） 行人 過路 設施 及 地下 商業 通道 規劃 ， 現已 開展 的 A5 、 A6 及 A11 公共 房屋 項目 ， 同步 會 設計 相關 地段 地庫 連接 地下 商業 通道 及 地下 過路 設施 。 鄰近 學校 村 的 B5 、 B7 、 B8 地段 亦 按 規劃 要求 有序 推進 行人 過路 設施 及 地下 商業 街 的 工作 。 按照 東區 — 2 規劃 ， 區內 設有 公共交通 換乘 中心 ， 令 巴士 和 輕軌 可無縫 銜接 ， 提高 公交 的 服務 效益 。
東北大馬路空中走廊招標,分三區建造    首區下月中截標    東北大馬路空中走廊招標    【本報消息】公共建設局公告，東北大馬路空中走廊建造工程昨起公開招標，下月二十日截標，翌日開標。    優化完善出行環境    東北大馬路空中走廊建造工程公開招標是為優化完善北區東北大馬路一帶的出行環境而建造，施工地點位於慕拉士大馬路至黑沙環中街的東北大馬路。    公共建設局表示，工程為興建一條長約六百米的空中走廊，並在沿路設置多個上落點（第一區），同時沿勞動節大馬路以及馬場東大馬路的黑沙環公園建造長約七百米風雨走廊（第二區），以及於勞動節大馬路及馬場東大馬路的交匯處，建造一條互通的行人天橋（第三區），空中走廊會配置無障礙設施。    最長施工期逾兩年    東北大馬路空中走廊建造工程分五個節點，最長總施工期為七百八十個工作天。公開招標於三月二十日（星期三）下午五時截止交標，交標地點爲羅理基博士大馬路南光大廈九樓公共建設局。三月二十一日（星期四）上午九時三十分公開開標，地點是南光大廈十樓公共建設局會議室。,http://www.macaodaily.com/html/2024-02/08/content_1734082.htm,公共建設局表示，工程為興建一條長約六百米的空中走廊，並在沿路設置多個上落點（第一區），同時沿勞動節大馬路以及馬場東大馬路的黑沙環公園建造長約七百米風雨走廊（第二區），以及於勞動節大馬路及馬場東大馬路的交匯處，建造一條互通的行人天橋（第三區），空中走廊會配置無障礙設施,分三區 建造         首區 下 月 中 截標         東 北大 馬 路 空中走廊 招標         【 本報 消息 】 公共 建設局 公告 ， 東 北大 馬 路 空中走廊 建造 工程 昨起 公開 招標 ， 下 月 二十日 截標 ， 翌日 開標 。         優化 完善 出行 環境         東 北大 馬 路 空中走廊 建造 工程 公開 招標 是 為 優化 完善 北區 東 北大 馬 路 一帶 的 出行 環境 而 建造 ， 施工 地點位 於 慕拉士 大馬路 至 黑沙 環 中街 的 東 北大 馬 路 。         公共 建設局 表示 ， 工程 為 興建 一條長 約 六百米 的 空中走廊 ， 並在 沿路 設置 多個 上 落點 （ 第一 區 ） ， 同時 沿勞動 節大馬路 以及 馬 場東 大馬路 的 黑沙 環公園 建造 長 約 七百 米 風雨 走廊 （ 第二 區 ） ， 以及 於 勞動節 大馬路 及馬場 東大馬路 的 交匯處 ， 建造 一條 互通 的 行人 天橋 （ 第三 區 ） ， 空中走廊 會 配置 無障礙 設施 。         最長 施工期 逾 兩年         東 北大 馬 路 空中走廊 建造 工程 分五個 節點 ， 最長 總 施工期 為 七 百八十 個 工作 天 。 公開 招標 於 三月 二十日 （ 星期三 ） 下午 五時 截止 交標 ， 交標 地點 爲 羅 理基 博士 大馬 路南 光大 廈九樓 公共 建設局 。 三月 二十一日 （ 星期四 ） 上午 九時 三十分 公開 開標 ， 地點 是 南 光大 廈十樓 公共 建設 局會 議室 。
家居垃圾近三天增三成,家居垃圾近三天增三成    大型垃圾倍增日均四十噸    【本報消息】昨日是傳統年廿八“洗邋遢”，除舊迎新，不少居民和商戶都有大掃除習慣。清潔專營公司表示，過去三天本澳家居垃圾收集量增加三成，大型垃圾升幅顯著，由每日約二十噸增加至近四十噸，主要為家私垃圾。預料昨、今日一般垃圾會進一步增至每日近一千二百噸。    設百三大型垃圾站    農曆新年將至，為保持社區環境衛生，市政署日前至明日在本澳各區設置一百卅六個大體積垃圾收集站，方便居民棄置大掃除垃圾及大體積家具，居民可於晚上八時至十一時棄置大件垃圾。    清潔專營公司總經理孔祥輝表示，過去每到農曆年尾，無論一般垃圾或大件垃圾量均會大幅增加。現時家居垃圾量平均每日有逾八百噸，預料昨、今一般垃圾會進一步增加至每日近一千二百噸；由於居民會趕於節前整理好家居或店舖，令大型垃圾量有顯著升幅，由每日約二十噸增加至近四十噸。雖然不少居民提早離澳度歲，但同時有很多旅客來澳，拉上補下，今年整體垃圾量或與去年相若。    孔祥輝稱，農曆新年前夕，清潔專營公司因應實際情況，增加收集垃圾次數。今年垃圾車出車數量較平日多三分一，由原來全日四十多車次，增加至六十車次。公司員工在此段時間已取消休假，力求做好有關工作。    籲冥鏹熄滅方傾倒    近來收集垃圾過程中，不論是壓縮式垃圾桶，或是公共垃圾房，每天均出現垃圾起火情況。經查探得知，多因夾雜在垃圾裡的冥鏹仍在燃燒所致。孔祥輝呼籲大眾祭祀後要確保火種完全熄滅，才可將灰燼傾倒在垃圾房或垃圾槽。,http://www.macaodaily.com/html/2024-02/08/content_1734080.htm,清潔專營公司表示，過去三天本澳家居垃圾收集量增加三成，大型垃圾升幅顯著，由每日約二十噸增加至近四十噸，主要為家私垃圾,家居 垃圾 近 三天 增 三成         大型 垃圾 倍增 日均 四十 噸         【 本報 消息 】 昨日 是 傳統 年 廿八 “ 洗 邋遢 ” ， 除舊 迎新 ， 不少 居民 和 商戶 都 有 大 掃除 習慣 。 清潔 專營 公司 表示 ， 過去 三天 本澳 家居 垃圾 收集量 增加 三成 ， 大型 垃圾 升幅 顯著 ， 由 每日 約 二十 噸 增加 至近 四十 噸 ， 主要 為 家私 垃圾 。 預料 昨 、 今日 一般 垃圾 會進 一步 增至 每日 近 一千二百 噸 。         設 百三 大型 垃圾站         農 曆 新年 將至 ， 為 保持 社區 環境 衛生 ， 市政 署 日前 至 明日 在 本澳 各區 設置 一百 卅六個 大體積 垃圾 收集 站 ， 方便 居民 棄置 大掃除 垃圾 及大體積 家具 ， 居民 可 於 晚上 八時 至 十一 時棄 置 大件 垃圾 。         清潔 專營 公司 總經理 孔祥輝 表示 ， 過去 每到 農 曆 年 尾 ， 無論 一般 垃圾 或 大件 垃圾 量 均 會 大幅 增加 。 現時 家居 垃圾 量 平均 每日 有 逾 八百 噸 ， 預料 昨 、 今 一般 垃圾 會進 一步 增加 至 每日 近 一千二百 噸 ； 由 於 居民 會 趕 於 節前 整理 好 家居 或店 舖 ， 令 大型 垃圾 量 有 顯著 升幅 ， 由 每日 約 二十 噸 增加 至近 四十 噸 。 雖然 不少 居民 提早 離澳度 歲 ， 但 同時 有 很多 旅客 來澳 ， 拉上 補下 ， 今年 整體 垃圾 量 或 與 去年 相若 。         孔祥輝 稱 ， 農 曆 新年 前夕 ， 清潔 專營 公司 因應 實際 情況 ， 增加 收集 垃圾 次數 。 今年 垃圾 車出 車數量 較 平日 多 三分 一 ， 由 原來 全日 四十多 車次 ， 增加 至 六十 車次 。 公司 員工 在 此段 時間 已 取消 休假 ， 力求 做好 有關 工作 。         籲冥鏹 熄滅方 傾倒         近來 收集 垃圾 過程 中 ， 不論 是 壓縮式 垃圾桶 ， 或是 公共 垃圾 房 ， 每天 均 出現 垃圾 起火 情況 。 經 查探 得知 ， 多因 夾雜 在 垃圾 裡的 冥鏹 仍 在 燃燒 所致 。 孔祥輝 呼籲 大眾 祭祀 後 要 確保火種 完全 熄滅 ， 才 可 將灰燼 傾倒 在 垃圾 房 或 垃圾 槽 。
