Title,Content,Link,Summary,Preprocessed_Content,Date
新中圖首期七企入標,先拆舊愛都建基礎地庫    二期上蓋    新中圖首期七企入標    【本報消息】公共建設局官網介紹愛都酒店舊址將改建新中央圖書館將分兩期工程，首期為拆卸舊愛都酒店、建造新圖書館的基礎及地庫，最長施工期為四百五十個工作天。當局已爲首期工程舉行詢價招標，七家被邀請公司全部入標，造價介乎六千九百七十八萬至八千九百九十八萬元不等。    地庫儲物無停車場    公建局官網介紹，新中央圖書館佔地面積約二千九百六十平方米。根據設計方案，圖書館樓高三層，設有地庫層作儲物用途，總建築面積約一萬二千七百一十平方米，設有主圖書館空間、會議室、學習區和公共閱讀區等。文化局早前已表態，新中圖將不設地庫公共停車場。    壁畫修復後移館內    公衆關注原愛都酒店外的馬賽克壁畫，文化局正進行“壁畫拆卸、修復及安裝工程——搭建工程排柵”。現場公告顯示判給“建築商李發權”，於今年二月十九日至四月三十一日期間，在舊愛都酒店局部外墻搭建施工排柵。文化局去年九月曾表示，馬賽克壁畫已有六十多年歷史，保存狀況較差及脆弱，出現大面積缺損、多處裂痕及零星剝落。當局將為馬賽克壁畫開展系列檢查、採樣及測試，在完成編制壁畫移置方案後，將按方案移置壁畫於合適的地點清理和修復。日後將配合新中圖的建造工程， 重新整合到建築的室內妥善保存和展示，讓壁畫更好地發揮連接建築過去與未來的功能。    另覓地點安放神龕    另外，高偉樂街的神龕神像，據現場通告顯示，為配合新中圖興建及相鄰一棵石牆樹（細樹榕）的支護工程，澳門街坊總會獲當局委託，已於去年十一月廿五日舉行神像遷移法事，把神像遷移至臨時地點安放及暫時保管。當局去年十月曾稱，待新中圖完工後，會在附近另覓合適位置重新安放神龕。,http://www.macaodaily.com/html/2024-03/20/content_1742796.htm,先拆舊愛都建基礎地庫    二期上蓋    新中圖首期七企入標    【本報消息】公共建設局官網介紹愛都酒店舊址將改建新中央圖書館將分兩期工程，首期為拆卸舊愛都酒店、建造新圖書館的基礎及地庫，最長施工期為四百五十個工作天,先 拆舊 愛都 建基 礎 地庫         二期 上蓋         新中圖 首期 七企入 標         【 本報 消息 】 公共 建設 局官 網介紹 愛都 酒店 舊址將 改建 新 中央 圖書館 將分 兩期 工程 ， 首期 為 拆卸 舊愛都 酒店 、 建造 新圖 書館 的 基礎 及 地庫 ， 最長 施工期 為 四百五十 個 工作 天 。 當局 已 爲 首期 工程 舉行 詢價 招標 ， 七家 被 邀 請 公司 全部 入標 ， 造價 介乎 六千 九百 七十八 萬至 八千 九百九十八 萬元 不 等 。         地庫 儲物 無停 車場         公建局 官網 介紹 ， 新 中央 圖書館 佔 地面 積約 二千 九百 六十 平方米 。 根據 設計 方案 ， 圖書館 樓 高三 層 ， 設有 地庫 層作 儲物 用途 ， 總建築 面積 約 一萬 二千 七百 一 十平方米 ， 設有 主圖 書館 空間 、 會議室 、 學習區 和 公共 閱讀區 等 。 文化局 早前 已表態 ， 新中 圖將 不設 地庫 公共 停車場 。         壁畫 修 復 後 移館 內         公 衆 關注 原愛都 酒店 外 的 馬 賽克壁畫 ， 文化局 正 進行 “ 壁畫 拆卸 、 修 復 及安裝 工程 — — 搭建 工程 排柵 ” 。 現場 公告 顯示 判給 “ 建築商 李發權 ” ， 於 今年 二月 十九日 至 四月 三十一 日期 間 ， 在 舊 愛都 酒店 局部 外 墻 搭建 施工 排柵 。 文化局 去年 九月 曾 表示 ， 馬 賽克壁畫 已有 六十多年 歷史 ， 保存 狀況 較 差及 脆弱 ， 出現 大面積 缺損 、 多處 裂痕 及 零星 剝落 。 當局 將為 馬 賽克壁畫 開展 系列 檢查 、 採樣 及 測試 ， 在 完成 編制 壁畫 移置 方案 後 ， 將按 方案 移置 壁畫 於 合適 的 地點 清理 和 修 復 。 日後將 配合 新中圖 的 建造 工程 ，   重新 整合 到 建築 的 室 內 妥善 保存 和 展示 ， 讓 壁畫 更好 地 發揮 連接 建築過 去 與 未來 的 功能 。         另 覓 地點 安放 神龕         另外 ， 高偉樂 街 的 神 龕 神像 ， 據 現場 通告 顯示 ， 為 配合 新中 圖興 建及 相鄰 一棵 石牆 樹 （ 細樹榕 ） 的 支護 工程 ， 澳門 街坊 總會 獲當 局委 託 ， 已 於 去年 十一月 廿五日 舉行 神像 遷移 法事 ， 把 神像 遷 移至 臨時 地點 安放 及 暫時 保管 。 當局 去年 十月 曾稱 ， 待 新 中圖 完工 後 ， 會 在 附近 另 覓 合適 位置 重新 安放 神龕 。,2024-03-20
新中圖建設好事多磨,新中圖建設好事多磨    新中央圖書館建設一波多折，由最初選址南灣舊法院大樓，最終“拍板”塔石舊愛都酒店。其後又有保存舊愛都酒店外墻壁畫及興建地庫公共停車場與否爭議，現一切塵埃落定。公建局昨日公佈新中圖首期工程詢價招標的開標結果，待判給後將動工。    選址南灣法院惹議    回顧新中圖選址，特區政府最早於二〇〇二年提出興建一座多設施、多功能的圖書館。〇六年底公佈的施政方針中提出“決定興建一座綜合性的大型中央圖書館，以回應居民自我增值、提升文化素養和充實閒暇時間的新需求”。    翌年，文化局獲原南灣舊法院大樓的發展權，將其與原司法警察局大樓一併發展成新中央圖書館。然而，新中圖選址原南灣法院大樓社會有不同聲音。雖然當年政府認為選址南灣舊法院最合適，但社會認為舊法院需兼顧文物建築保育以及擔憂加劇該區的交通壓力。    邀請國際團隊設計    二〇年九月，政府表示經過充分聽取社會意見後，決定調整新中圖選址為原舊愛都酒店地段，並向國內外、來自亞洲及歐洲的十五個獲國際建築設計大獎、且曾設計傑出圖書館或類似文化設施的建築設計團隊了解，並邀請其中四個有意參與項目的團隊提供概念設計方案。最終由荷蘭Mecanoo團隊的設計方案中選。其後，保留舊愛都酒店立面壁畫、保育石牆樹及處理土地神龕方式、興建公共停車場與否等，社會上有不同意見，政府逐一回應及拆解。至近日公建局官網的“規劃中”欄目披露新中圖建築工程分兩期興建，並公佈首期詢價招標結果，意味着新中圖工程即將啟動。    南灣建設終院大樓    至於新中圖前選址，南灣舊法院大樓及前司法警察局大樓已確定合建成終審法院大樓，原司警局大樓在保留特色門面、部分外牆獲支撐加固後，已基本完成拆卸，即將開展第二期的上蓋工程。    本報記者,http://www.macaodaily.com/html/2024-03/20/content_1742797.htm,邀請國際團隊設計    二〇年九月，政府表示經過充分聽取社會意見後，決定調整新中圖選址為原舊愛都酒店地段，並向國內外、來自亞洲及歐洲的十五個獲國際建築設計大獎、且曾設計傑出圖書館或類似文化設施的建築設計團隊了解，並邀請其中四個有意參與項目的團隊提供概念設計方案,新中圖 建設 好事多磨         新 中央 圖書館 建設 一波 多折 ， 由 最初 選址 南灣 舊 法院 大樓 ， 最終 “ 拍板 ” 塔石 舊愛都 酒店 。 其 後 又 有 保存 舊愛都 酒店 外 墻 壁畫 及 興建 地庫 公共 停車場 與 否爭議 ， 現 一切 塵埃 落定 。 公建局 昨日 公 佈 新 中圖 首期 工程 詢價 招標 的 開標 結果 ， 待判 給後將 動工 。         選址 南灣 法院 惹議         回顧 新 中圖 選址 ， 特區 政府 最早 於 二 〇 〇 二年 提出 興建 一座 多 設施 、 多功能 的 圖書館 。 〇 六 年底 公 佈 的 施政 方針 中 提出 “ 決定 興建 一座 綜合性 的 大型 中央 圖書館 ， 以 回應 居民 自我 增值 、 提升 文化 素養 和 充實 閒暇 時間 的 新 需求 ” 。         翌年 ， 文化局 獲原 南灣 舊 法院 大樓 的 發展權 ， 將其 與 原 司法 警察局 大樓 一 併 發展 成新 中央 圖書館 。 然而 ， 新中圖 選址 原南灣 法院 大樓 社會 有 不同 聲音 。 雖然 當年 政府 認為 選址 南灣 舊 法院 最合適 ， 但 社會 認為 舊 法院 需兼顧 文物 建築 保育 以及 擔憂 加劇 該區 的 交通 壓力 。         邀請 國際 團隊 設計         二 〇 年 九月 ， 政府 表示 經過 充分 聽取 社會 意見 後 ， 決定 調整 新 中圖 選址 為 原舊 愛都 酒店 地段 ， 並向國 內外 、 來 自亞洲 及 歐洲 的 十五 個 獲國際 建築設 計大獎 、 且 曾 設計傑 出 圖書館 或 類似 文化 設施 的 建築 設計 團隊 了解 ， 並邀 請 其中 四個 有意 參與項 目的 團隊 提供 概念 設計 方案 。 最終 由 荷蘭 Mecanoo 團隊 的 設計 方案 中選 。 其 後 ， 保留 舊愛都 酒店 立 面壁 畫 、 保育 石牆 樹及 處理 土地 神龕 方式 、 興建 公共 停車場 與 否 等 ， 社會 上 有 不 同意 見 ， 政府 逐一 回應 及 拆解 。 至 近日 公建局 官網 的 “ 規劃 中 ” 欄目 披露 新中圖 建築 工程 分兩期 興建 ， 並公 佈 首期 詢價 招標 結果 ， 意味着 新中圖 工程 即將 啟動 。         南灣 建設 終院 大樓         至於 新中 圖前 選址 ， 南灣 舊 法院 大樓 及 前 司法 警察局 大樓 已 確定合 建成 終審 法院 大樓 ， 原司 警局 大樓 在 保留 特色 門面 、 部分 外牆 獲 支撐 加固 後 ， 已 基本 完成 拆卸 ， 即將 開展 第二期 的 上 蓋 工程 。         本報 記者,2024-03-20
賀：粵澳合作向新階段發展,廣東省春茗昨舉行   豐富合作內涵意義    賀：粵澳合作向新階段發展    【本報消息】廣東省粵港澳合作促進會昨舉行“廣東省二〇二四年春茗”，行政長官賀一誠致辭表示，今年特區政府將扎實推進粵港澳大灣區各項建設工作，提升大灣區市場一體化水平，支持粵澳企業共同參與國際經濟合作與競爭。同時，進一步豐富粵澳合作的內涵和意義，推動粵澳合作向更高水平、更深層次、更多領域的新階段發展。    春茗昨晚七時假旅遊塔四樓舉行，賀一誠，廣東省長王偉中，全國政協副主席何厚鏵，澳門中聯辦主任鄭新聰，外交部駐澳特派員劉顯法，中聯辦副主任呂玉印，立法會主席高開賢，行政法務司司長張永春，經濟財政司司長李偉農，保安司司長黃少澤，社會文化司司長歐陽瑜，運輸工務司司長羅立文，廣東省領導張虎、鄧海光，全國人大代表澳門團團長劉藝良，全國政協常委崔世昌、何潤生、劉雅煌，以及粵澳兩地官員和社會各界人士出席。    鞏固經濟復甦    賀一誠致辭表示，今年是新中國成立七十五周年，澳門特區成立廿五周年，《粵港澳大灣區發展規劃綱要》公佈五周年，也是橫琴總體方案第一階段建設成效的大考之年，做好今年粵澳合作各項工作意義重大、責任重大。    特區政府將落實全國“兩會”精神，把握國家發展機遇，充分發揮“一國兩制”、國際貿易自由港、單獨關稅區等獨特優勢，按照“國家所需、澳門所長”的原則，努力提升自身在國家經濟發展和對外開放中的地位與功能，繼續實施一系列促經濟、擴客源的政策措施，鞏固經濟復甦發展的勢頭，全力建設好橫琴粵澳深度合作區和粵港澳大灣區，為粵澳兩地持續發展，不斷注入新動力，更好服務國家發展大局。    琴澳加速融合    王偉中致辭表示，當前粵港澳大灣區建設進入提速換擋、縱深推進新階段，特別是橫琴深合區“封關”運行後，琴澳加速融合，人流、物流、資金流、資訊流更加高效便捷流動，越來越多“四新”產業項目和企業佈局落戶橫琴，並有更多澳門青年到深合區創新創業、工作生活。明年粵港澳首次共同舉辦第十五屆全國運動會，相信可為粵港澳的合作注入新活力。    廣東省將始終牢記服務澳門經濟適度多元發展的初心，緊密協同澳門推進粵港澳大灣區建設，共同做好橫琴產業導入等重點工作。並加快將橫琴打造成為具有中國特色、彰顯“一國兩制”優勢的區域開發示範，確保第一階段各項目標任務如期全面實現。並持續深化與澳門的經貿產業、聯合招商、教育醫療、就業社保、會展文旅等領域的合作，推動粵港澳大灣區建設成新發展格局的戰略支點，高質量發展的示範地，中國式現代化引領地，加快建設世界級的大灣區、發展最好的灣區。    當前，廣東正深入貫徹中央決策部署，認真落實國務院《推動大規模設備更新和消費品以舊換新行動方案》，研究出台新一輪吸引和利用外資政策，大力推進產業有序轉移，這將為深化粵澳合作創造更加廣闊的空間。歡迎廣大澳企繼續投資佈局大灣區，積極拓展粵東西北地方市場空間，共用機遇、共贏發展。    此外，賀一誠昨日上午在政府總部與王偉中會面，就進一步深化粵澳合作、高質量推進粵港澳大灣區建設會談交流，雙方一致表示將以更大力度加快推進橫琴粵澳深度合作區建設。,http://www.macaodaily.com/html/2024-03/20/content_1742900.htm,特區政府將落實全國“兩會”精神，把握國家發展機遇，充分發揮“一國兩制”、國際貿易自由港、單獨關稅區等獨特優勢，按照“國家所需、澳門所長”的原則，努力提升自身在國家經濟發展和對外開放中的地位與功能，繼續實施一系列促經濟、擴客源的政策措施，鞏固經濟復甦發展的勢頭，全力建設好橫琴粵澳深度合作區和粵港澳大灣區，為粵澳兩地持續發展，不斷注入新動力，更好服務國家發展大局,廣東 省春茗 昨舉行       豐富 合作 內 涵意 義         賀 ： 粵澳 合作 向 新階段 發展         【 本報 消息 】 廣東 省粵 港澳 合作 促進會 昨舉行 “ 廣東省 二 〇 二 四年 春茗 ” ， 行政 長 官賀 一誠致 辭 表示 ， 今年 特區 政府 將扎實 推進粵 港澳 大灣區 各項 建設 工作 ， 提升 大灣區 市場 一體化 水平 ， 支持 粵澳 企業 共同 參與 國際 經濟 合作 與 競爭 。 同時 ， 進 一步 豐富粵澳 合作 的 內涵 和 意義 ， 推動粵澳 合作 向 更 高水平 、 更深 層次 、 更多 領域 的 新階段 發展 。         春茗 昨晚 七時 假 旅遊塔 四樓 舉行 ， 賀一 誠 ， 廣東 省長 王偉中 ， 全國政協 副 主席 何厚鏵 ， 澳門 中聯辦 主任 鄭新聰 ， 外交部 駐澳 特派 員 劉顯法 ， 中聯辦 副 主任 呂玉印 ， 立法 會 主席 高開賢 ， 行政法 務司 司長 張 永春 ， 經濟 財政司 司長 李偉農 ， 保安 司司 長 黃 少澤 ， 社會 文化 司司 長 歐陽瑜 ， 運輸 工務司 司長 羅 立文 ， 廣東省 領導 張虎 、 鄧 海光 ， 全國 人大代表 澳門團 團長 劉藝良 ， 全國政協 常委 崔世昌 、 何潤生 、 劉雅煌 ， 以及 粵澳 兩地 官員 和 社會 各界人士 出席 。         鞏固 經濟 復 甦         賀一誠致 辭 表示 ， 今年 是 新 中國 成立 七十五 周年 ， 澳門 特區 成立 廿五 周年 ， 《 粵 港澳 大灣區 發展 規劃 綱要 》 公 佈 五周年 ， 也 是 橫琴 總體 方案 第一 階段 建設 成效 的 大考 之 年 ， 做好 今年 粵澳 合作 各項 工作 意義 重大 、 責任 重大 。         特區 政府 將落實 全國 “ 兩會 ” 精神 ， 把握 國家 發展 機遇 ， 充分 發揮 “ 一國 兩制 ” 、 國際 貿易 自由港 、 單獨關 稅區 等 獨特 優勢 ， 按照 “ 國家 所 需 、 澳門 所長 ” 的 原則 ， 努力 提升 自身 在 國家 經濟 發展 和 對 外 開放中 的 地位 與 功能 ， 繼續 實施 一系列 促經濟 、 擴 客源 的 政策措施 ， 鞏固 經濟 復 甦 發展 的 勢頭 ， 全力 建設 好 橫琴粵澳 深度 合作 區和粵 港澳 大灣區 ， 為粵澳 兩地 持續 發展 ， 不斷 注入 新動力 ， 更好 服務國家 發展 大局 。         琴澳 加速 融合         王偉 中致 辭 表示 ， 當前粵 港澳 大灣區 建設 進入 提速 換擋 、 縱深 推進 新階段 ， 特別 是 橫琴 深合區 “ 封關 ” 運行 後 ， 琴澳 加速 融合 ， 人流 、 物流 、 資金流 、 資訊流 更加 高效 便捷 流動 ， 越來 越 多 “ 四新 ” 產業 項目 和 企業 佈 局落戶 橫琴 ， 並有 更 多 澳門 青年 到 深合區 創新 創業 、 工作 生活 。 明年 粵 港澳 首次 共同 舉辦 第十五 屆 全國 運動會 ， 相信 可為粵 港澳 的 合作 注入 新 活力 。         廣東省 將始 終牢記 服務 澳門 經濟 適度 多元 發展 的 初心 ， 緊密 協同 澳門 推進粵 港澳 大灣區 建設 ， 共同 做好 橫琴產業 導入 等 重點 工作 。 並 加快 將橫琴 打 造成 為 具有 中國 特色 、 彰顯 “ 一國 兩制 ” 優勢 的 區域 開發 示範 ， 確保 第一 階段 各項 目標 任務 如期 全面 實現 。 並持續 深化 與 澳門 的 經貿產業 、 聯合 招商 、 教育 醫療 、 就業 社保 、 會展 文旅 等 領域 的 合作 ， 推動粵 港澳 大灣區 建設 成新 發展 格局 的 戰略 支點 ， 高質量 發展 的 示範地 ， 中國式 現代化 引領 地 ， 加快 建設 世界 級 的 大灣區 、 發展 最好 的灣區 。         當前 ， 廣東 正 深入 貫徹 中央 決策 部署 ， 認真落 實國務院 《 推動 大規模 設備 更新 和 消費品 以 舊換 新行動 方案 》 ， 研究 出台 新一輪 吸引 和 利用 外資 政策 ， 大力 推進 產業 有序 轉移 ， 這將 為 深化 粵澳 合作 創造 更加 廣闊 的 空間 。 歡迎廣 大澳 企繼續 投資 佈 局大灣區 ， 積極 拓展 粵東 西北 地方 市場 空間 ， 共用 機遇 、 共贏 發展 。         此外 ， 賀一 誠 昨日 上午 在 政府 總部 與 王偉 中會面 ， 就 進 一步 深化 粵澳 合作 、 高質量 推進粵 港澳 大灣區 建設 會 談 交流 ， 雙方 一致 表示 將以 更 大 力度 加快 推進 橫琴粵澳 深度 合作 區建設 。,2024-03-20
飛灰暫存倉建造收十一標書,最高價億五萬   一不接納    飛灰暫存倉建造收十一標書    【本報消息】環境保護局訊：環境保護局昨日進行“飛灰存放區營運及飛灰暫存倉建造”公開開標，共收到十一份標書。經開標委員會的審議和確認後，十份標書獲接納，一份標書不獲接納，標書價格由七千多萬至一億五千多萬澳門元不等。    有關合同期為四十八個月，中標公司須按投標案卷要求，在現有建築廢料堆填區內設計連建造第一期至第三期飛灰暫存倉，並為建築廢料堆填區內的飛灰存放區，以及已關閉的九澳飛灰堆填區提供營運及環境監測與審核服務。,http://www.macaodaily.com/html/2024-03/20/content_1742901.htm,有關合同期為四十八個月，中標公司須按投標案卷要求，在現有建築廢料堆填區內設計連建造第一期至第三期飛灰暫存倉，並為建築廢料堆填區內的飛灰存放區，以及已關閉的九澳飛灰堆填區提供營運及環境監測與審核服務,最高 價億五萬       一不接納         飛灰暫 存倉 建造 收 十一 標書         【 本報 消息 】 環境 保護局 訊 ： 環境 保護局 昨日 進行 “ 飛灰 存放 區營 運及 飛灰暫 存倉 建造 ” 公開 開標 ， 共 收到 十 一份 標書 。 經開 標委員會 的 審議 和 確認 後 ， 十份 標書獲 接納 ， 一份 標書 不 獲 接納 ， 標書 價格 由 七千 多萬至 一 億 五千多 萬澳門 元 不 等 。         有關 合同期 為 四十八 個 月 ， 中標 公司 須按 投標 案卷 要求 ， 在 現有 建築 廢料 堆 填區 內設 計連 建造 第一期 至 第三期 飛灰暫 存倉 ， 並為 建築 廢料 堆 填區 內 的 飛灰 存放 區 ， 以及 已 關閉 的 九澳 飛灰堆 填區 提供 營運及 環境 監測 與 審核 服務 。,2024-03-20
科技基金項目資助接受申請,科技基金項目資助接受申請    【本報消息】科學技術發展基金訊：科技基金昨日在科學館會議中心舉行二○二四年“項目資助計劃說明會”，由科技基金行政委員會主席謝永強主持。本澳各高校、科技社團以及科技企業等澳門科技界的代表等約三百人參與說明會。    為精準扶助科研創新，鼓勵科技企業投入研發提升競爭力，科技基金自去年二月起，優化科研資助計劃，按資助對象將一般科研資助計劃調整為以企業為主導的“企業創新研發資助計劃”及主要面向高校的“科研及創新資助計劃”，構建遞進式的企業研發和高校的科研資助體系。    會上科技基金代表詳細介紹了資助計劃，協助申請者更清晰了解計劃的設置目的、申請項目的注意事項，以及“澳琴聯動”資助措施等。說明會還邀請了廉政公署代表出席介紹並講解有關項目資助防貪工作；同場也介紹中醫藥廣東省實驗室（橫琴實驗室）及廣東省（橫琴）智能科學與技術研究院。    今年推出的資助計劃即將接受申請，申請實體均須於科技基金網上的資助申請系統辦理申請程序。資助計劃的相關內容詳情可參閱科技基金網站(www.fdct.gov.mo)，可致電（二八七八 · 八七七七）或電郵(saf@fdct.gov.mo)查詢。,http://www.macaodaily.com/html/2024-03/20/content_1742902.htm,科技基金項目資助接受申請    【本報消息】科學技術發展基金訊：科技基金昨日在科學館會議中心舉行二○二四年“項目資助計劃說明會”，由科技基金行政委員會主席謝永強主持,科技 基金 項目 資助 接受 申請         【 本報 消息 】 科學 技術 發展 基金 訊 ： 科技 基金 昨日 在 科學館 會議 中心 舉行 二 ○ 二 四年 “ 項目 資助 計劃 說 明會 ” ， 由 科技 基金 行政 委員會 主席 謝永強 主持 。 本澳 各 高校 、 科技 社團 以及 科技 企業 等 澳門 科技界 的 代表 等 約 三百 人參 與 說 明會 。         為 精準 扶助 科研 創新 ， 鼓勵 科技 企業 投入 研發 提升 競爭力 ， 科技 基金 自 去年 二月 起 ， 優化 科研 資助 計劃 ， 按資助 對 象將 一般 科研 資助 計劃 調整 為 以 企業 為 主導 的 “ 企業 創新 研發 資助 計劃 ” 及 主要 面向 高校 的 “ 科研 及 創新 資助 計劃 ” ， 構建遞 進式 的 企業 研發 和 高校 的 科研 資助 體系 。         會上 科技 基金 代表 詳細介紹 了 資助 計劃 ， 協助 申請者 更 清晰 了解 計劃 的 設置 目的 、 申請 項 目的 注意 事項 ， 以及 “ 澳琴 聯動 ” 資助 措施 等 。 說 明會 還邀 請 了 廉政公署 代表 出席 介紹 並講 解有 關項 目資助 防 貪 工作 ； 同場 也 介紹 中 醫藥 廣東省 實驗室 （ 橫琴 實驗室 ） 及 廣東省 （ 橫琴 ） 智能 科學 與 技術 研究院 。         今年 推出 的 資助 計劃 即將 接受 申請 ， 申請 實體 均須 於 科技 基金 網上 的 資助 申請 系統 辦理 申請 程序 。 資助 計劃 的 相關 內容 詳情 可 參閱 科技 基金 網站 ( www . fdct . gov . mo ) ， 可致電 （ 二八 七八   ·   八七 七七 ） 或 電郵 ( saf @ fdct . gov . mo ) 查詢 。,2024-03-20
