Title,Content,Link,Summary,Preprocessed_Content,Date
新街坊衛生站明運作,內地首個澳衛生局直接營運管理醫療機構    新街坊衛生站明運作    【本報消息】橫琴粵澳深度合作區澳門新街坊衛生站昨日上午九時在該站大廳舉行揭幕儀式，行政長官賀一誠、中聯辦主任鄭新聰、社會文化司司長歐陽瑜、廣東省衛健委黨組書記劉利群、澳門衛生局長羅奕龍和副局長鄭成業主禮。衛生站將於本月十一日正式營運。    社區醫衛延伸橫琴    羅奕龍致辭表示，橫琴澳門新街坊衛生站是澳門落實《橫琴粵澳深度合作區建設總體方案》設立的重點民生項目，也是醫療衛生豐富“一國兩制”實踐的新示範，具有重大歷史意義。衛生站是特區政府首個在內地設立，並由衛生局直接營運和管理的醫療機構。把社區醫療衛生服務延伸到深合區，讓澳門居民在深合區享受到趨同澳門的醫療服務。衛生站順利落成離不開兩地緊密合作，共同克服了各種挑戰，做到規則銜接、機制對接、深度融合，充分體現了琴澳“共商、共建、共管、共享”的合作精神。    嘉賓隨後在衛生局負責人陪同下參觀了衛生站各項設施。出席揭幕儀式的嘉賓還包括內地、澳門特區政府部門、醫療機構及社團等共六十多名代表。    醫護直派用澳門藥    橫琴新街坊衛生站佔地一千平方米，暫時配置七名由本澳衛生中心或衛生站調派的醫療人員，分別為兩名醫生、兩名護士、兩名藥劑師和一名護理助理員。考慮到跨境服務的特殊性，會為其提供內地醫療法律和應急救護的專門培訓。    衛生站參照現行澳門衛生中心的運作模式，首階段將提供成人保健、婦女保健、兒童保健及非預約門診等服務，預計每日可服務六十至七十人次。若患者需要專科醫療跟進，會按現行模式轉介至山頂醫院或澳門協和醫院。若遇緊急醫療情況，患者會先轉送至深合區的廣州醫科大學附屬第一醫院橫琴醫院緊急救治，後續治療可根據患者意願，在病情許可下轉回澳門特區的醫院繼續治療。    廣東省藥品監督管理局已批准二百九十六種澳門特區藥物在深合區指定醫療機構使用，並已陸續運抵新街坊衛生站。未來將根據居民的醫療需求，豐富服務項目和內容，為居住在深合區的澳門居民提供更全面、更優質的醫療服務。    病歷傳輸符個資法    衛生站採用衛生局的醫療資訊系統，通過專線網絡與澳門特別行政區連接，確保資料傳輸安全。所有病歷資料均儲存於衛生局設於澳門特區的伺服器群組，並可通過電子健康紀錄平台實現醫療資訊共享，符合澳門區《個人資料保護法》規定。    橫琴澳門新街坊衛生站服務時間為周一至四，每日上午九時至下午一時、下午二時三十分至五時四十五分。周五上午九時至下午一時、下午二時三十分至五時三十分。假期與澳門特區公眾假期相同。查詢可於辦公時間內致電澳門電話六八八三 · 六〇六八、內地電話八六 · 一七二 · 〇五九四 · 六八〇八。,http://www.macaodaily.com/html/2024-11/10/content_1793078.htm,內地首個澳衛生局直接營運管理醫療機構    新街坊衛生站明運作    【本報消息】橫琴粵澳深度合作區澳門新街坊衛生站昨日上午九時在該站大廳舉行揭幕儀式，行政長官賀一誠、中聯辦主任鄭新聰、社會文化司司長歐陽瑜、廣東省衛健委黨組書記劉利群、澳門衛生局長羅奕龍和副局長鄭成業主禮,內地 首個 澳衛 生局 直接 營運 管理 醫療 機構         新 街坊 衛生 站 明運作         【 本報 消息 】 橫琴粵澳 深度 合作 區澳門 新 街坊 衛生 站 昨日 上午 九時 在 該 站 大廳 舉行 揭幕 儀式 ， 行政 長 官賀 一 誠 、 中聯辦 主任 鄭新聰 、 社會 文化 司司 長 歐陽瑜 、 廣東省 衛健委黨 組書 記劉 利群 、 澳門 衛生 局長 羅 奕 龍 和 副 局長 鄭成業 主禮 。 衛生 站將 於 本月 十一日 正式 營運 。         社區 醫衛 延伸 橫琴         羅 奕 龍致 辭 表示 ， 橫琴 澳門 新 街坊 衛生 站 是 澳門 落實 《 橫琴粵澳 深度 合作 區建設 總體 方案 》 設立 的 重點 民生 項目 ， 也 是 醫療 衛生 豐富 “ 一國 兩制 ” 實踐 的 新 示範 ， 具有 重大 歷史 意義 。 衛生 站 是 特區 政府 首個 在 內 地 設立 ， 並由衛 生局 直接 營運 和 管理 的 醫療 機構 。 把 社區 醫療 衛生 服務 延伸 到 深合區 ， 讓 澳門 居民 在 深合區 享受 到 趨同 澳門 的 醫療 服務 。 衛生 站 順 利落 成離 不開 兩地 緊密 合作 ， 共同 克服 了 各種 挑戰 ， 做到 規則 銜接 、 機制 對 接 、 深度 融合 ， 充分 體現 了 琴 澳 “ 共商 、 共建 、 共管 、 共享 ” 的 合作 精神 。         嘉賓 隨後在 衛生局 負責人 陪同 下 參觀 了 衛生 站 各項 設施 。 出席 揭幕 儀式 的 嘉賓還 包括 內地 、 澳門 特區 政府 部門 、 醫療 機構 及 社團 等 共 六 十多名 代表 。         醫護 直派 用 澳門藥         橫琴 新 街坊 衛生 站 佔 地 一 千平方米 ， 暫時 配置 七名 由本 澳衛生 中心 或衛生 站 調派 的 醫療 人員 ， 分別 為 兩名 醫生 、 兩名 護士 、 兩名 藥劑 師和 一名 護理 助理 員 。 考慮 到 跨境 服務 的 特殊性 ， 會為 其 提供 內地 醫療 法律 和 應 急救 護的 專門 培訓 。         衛生 站 參照 現行 澳門 衛生 中心 的 運作 模式 ， 首階段將 提供 成人 保健 、 婦女 保健 、 兒童 保健 及非 預約 門診 等 服務 ， 預計 每日 可服務 六十 至 七十 人次 。 若 患者 需要 專科 醫療 跟 進 ， 會 按 現行 模式 轉介至 山頂 醫院 或 澳門協 和 醫院 。 若遇 緊急 醫療 情況 ， 患者 會先 轉送 至 深合區 的 廣州醫 科大 學附屬 第一 醫院 橫琴 醫院 緊急 救治 ， 後 續 治療 可根據 患者 意願 ， 在 病情 許可下 轉回 澳門 特區 的 醫院 繼續 治療 。         廣東省 藥品 監督 管理局 已 批准 二百 九十六 種澳門 特區 藥物 在 深合區 指定 醫療 機構 使用 ， 並已 陸續 運抵 新 街坊 衛生 站 。 未來 將根據 居民 的 醫療 需求 ， 豐富 服務 項目 和 內容 ， 為 居住 在 深合區 的 澳門 居民 提供 更 全面 、 更 優質 的 醫療 服務 。         病歷 傳輸 符個 資法         衛生 站 採用 衛生局 的 醫療 資訊系統 ， 通過 專線 網絡 與 澳門 特別 行政 區連接 ， 確保資料 傳輸 安全 。 所有 病歷 資料 均 儲存 於 衛生 局設 於 澳門 特區 的 伺服器 群組 ， 並可 通過 電子 健康 紀錄 平台 實現 醫療 資訊 共享 ， 符合 澳門區 《 個 人 資料 保護法 》 規定 。         橫琴 澳門 新 街坊 衛生 站 服務 時間 為 周一 至 四 ， 每日 上午 九時 至 下午 一時 、 下午 二時 三十分 至五時 四十五分 。 周五 上午 九時 至 下午 一時 、 下午 二時 三十分 至五時 三十分 。 假期 與 澳門 特區 公眾 假期 相同 。 查詢 可 於 辦公時間 內致 電澳門 電話 六 八八 三   ·   六 〇 六八 、 內地 電話 八六   ·   一七二   ·   〇 五九 四   ·   六八 〇 八 。,2024-11-10
濠江附屬橫琴學校啓用,加快琴澳同城    學生享趨澳免費教育    濠江附屬橫琴學校啓用    【本報消息】濠江中學附屬橫琴學校昨日上午十時在該校禮堂舉行落成啟用典禮，行政長官賀一誠、澳門中聯辦主任鄭新聰、外交部駐澳特派員劉顯法、立法會主席高開賢、社會文化司司長歐陽瑜、深合區執委會副主任吳子健、廣東省橫琴辦副主任葉真、教青局長龔志明等嘉賓，在校董會董事長馬有禮、校長尤端陽陪同下，共同爲該校啓用剪綵和揭牌。    續支持建中學校舍    歐陽瑜致詞表示，“澳門新街坊”是粵澳攜手合作、深合區首個為澳門居民建設的綜合民生工程，融合優質居住空間、教育、衛生及社會服務，是加快實現琴澳一體化的重要舉措。項目配套建設的濠江中學附屬橫琴學校，是深合區第一所澳人子弟學校，隨着該校揭牌啟用，不僅寓意粵澳教育合作邁向新里程，也是琴澳一體化進程穩步前行的例證。濠江中學附屬橫琴學校不僅具有澳門課程特色，學校學歷也與澳門同等、校內的澳門學生同樣享有趨同澳門免費教育的待遇。    歐陽瑜稱，今年五月，中央港澳工作辦公室主任、國務院港澳事務辦公室主任夏寶龍考察深合區期間，充分肯定學校的環境和設施。學校自本學年投入服務以來，為澳門居民營造了趨同澳門的學習生活環境，加快琴澳同城化。隨着中央政府實施“分線管理”等便利政策，不斷吸引更多澳人、澳資、澳企在深合區聚集，為學校持續注入新生源。特區政府未來將持續與深合區執委會緊密合作，繼續支持學校開展中學校舍建設，打造從幼稚園至高中的“一條龍”教育服務，更便利澳門居民在深合區學習。    打造四個一流學校    馬有禮致詞表示，濠江中學附屬橫琴學校的成立，是澳門教育發展史的里程碑，是貫徹習近平主席推動粵港澳大灣區高質量發展的重要舉措之一。該校不僅承載着為國家和澳門培養未來愛國愛澳棟樑的使命，更象徵琴澳在教育領域深度融合與共同發展邁向新台階。    馬有禮指出，今年九月濠江中學附屬橫琴學校順利開學，將秉承“忠誠、勤奮、求實、創新”的校訓，致力打造成為“四個一流”的特色學校，為學生提供全面發展平台，培養更多具有愛國情懷、國際視野、創新能力和社會責任感的優秀人才。    後年將成“一條龍”    主禮嘉賓隨後在尤端陽、濠江中學附屬橫琴學校執行校長陳虹陪同下，先後參觀了校園、校史牆，並與師生互動交流。    濠江中學附屬橫琴學校目前是一所從幼稚園到小學的九年制學校，為澳門濠江中學的第五個校部，現有八個班合計二百五十六名學生，當中澳門學生佔九成八。現正建設中學部，預計二〇二六年落成後招收初一至高三學生，屆時將成為一所從幼稚園到高中的十五年制學校，全校最大規模可達六十六個班。,http://www.macaodaily.com/html/2024-11/10/content_1793086.htm,加快琴澳同城    學生享趨澳免費教育    濠江附屬橫琴學校啓用    【本報消息】濠江中學附屬橫琴學校昨日上午十時在該校禮堂舉行落成啟用典禮，行政長官賀一誠、澳門中聯辦主任鄭新聰、外交部駐澳特派員劉顯法、立法會主席高開賢、社會文化司司長歐陽瑜、深合區執委會副主任吳子健、廣東省橫琴辦副主任葉真、教青局長龔志明等嘉賓，在校董會董事長馬有禮、校長尤端陽陪同下，共同爲該校啓用剪綵和揭牌,加快 琴澳 同城         學生享 趨澳 免費 教育         濠江 附屬 橫琴 學校 啓 用         【 本報 消息 】 濠江 中學 附屬 橫琴 學校 昨日 上午 十時 在 該 校禮堂 舉行 落成 啟 用典 禮 ， 行政 長 官賀 一 誠 、 澳門 中聯辦 主任 鄭新聰 、 外交部 駐澳 特派 員 劉顯法 、 立法 會 主席 高開賢 、 社會 文化 司司 長 歐陽瑜 、 深合區 執委會 副 主任 吳子健 、 廣東省 橫琴辦 副 主任 葉真 、 教青局 長 龔志明 等 嘉賓 ， 在 校董 會 董事 長 馬 有禮 、 校長 尤端陽 陪同 下 ， 共同 爲 該校 啓 用 剪 綵 和 揭牌 。         續 支持 建中 學 校舍         歐陽瑜 致詞 表示 ， “ 澳門 新 街坊 ” 是 粵澳 攜手 合作 、 深合區 首個 為 澳門 居民 建設 的 綜合 民生 工程 ， 融合 優質 居住 空間 、 教育 、 衛生 及 社會 服務 ， 是 加快 實現 琴 澳一體化 的 重要 舉措 。 項目 配套 建設 的 濠江 中學 附屬 橫琴 學校 ， 是 深合區 第一所 澳人 子弟 學校 ， 隨着 該校 揭牌 啟用 ， 不僅 寓意 粵澳 教育 合作 邁向 新 里程 ， 也 是 琴 澳一體化 進程 穩步 前行 的 例證 。 濠江 中學 附屬 橫琴 學校 不僅 具有 澳門 課程 特色 ， 學校 學歷 也 與 澳門 同等 、 校內 的 澳門 學生 同樣 享有 趨同 澳門 免費 教育 的 待遇 。         歐陽瑜 稱 ， 今年 五月 ， 中央 港澳 工作 辦公 室主任 、 國務院 港澳 事務 辦公 室主任 夏寶龍 考察 深合區 期間 ， 充分肯定 學校 的 環境 和 設施 。 學校 自本學 年 投入 服務以 來 ， 為 澳門 居民 營造 了 趨同 澳門 的 學習 生活 環境 ， 加快 琴 澳同 城化 。 隨着 中央政府 實施 “ 分線 管理 ” 等 便利 政策 ， 不斷 吸引 更多 澳人 、 澳資 、 澳企在 深合區 聚集 ， 為學校 持續 注入 新 生源 。 特區 政府 未來 將持續 與 深合區 執委會 緊密 合作 ， 繼續 支持 學校 開展 中學 校舍 建設 ， 打造 從 幼稚 園至 高中 的 “ 一條 龍 ” 教育 服務 ， 更 便利 澳門 居民 在 深合區 學習 。         打造 四個 一流 學校         馬 有 禮致 詞 表示 ， 濠江 中學 附屬 橫琴 學校 的 成立 ， 是 澳門 教育 發展史 的 里程碑 ， 是 貫徹習 近平 主席 推動粵 港澳 大灣區 高質量 發展 的 重要 舉措 之一 。 該校 不僅 承載 着 為 國家 和 澳門 培養 未來 愛國 愛澳棟 樑 的 使命 ， 更象 徵琴 澳在 教育 領域 深度 融合 與 共同 發展 邁向 新 台階 。         馬 有禮 指出 ， 今年 九月 濠江 中學 附屬 橫琴 學校 順利 開學 ， 將 秉承 “ 忠 誠 、 勤奮 、 求實 、 創新 ” 的 校訓 ， 致力 打 造成 為 “ 四個 一流 ” 的 特色 學校 ， 為學生 提供 全面 發展 平台 ， 培養 更 多 具有 愛國 情懷 、 國際視野 、 創新 能力 和 社會責 任感 的 優秀 人才 。         後 年 將成 “ 一條 龍 ”         主禮嘉賓 隨後在 尤端陽 、 濠江 中學 附屬 橫琴 學校 執行 校長 陳 虹 陪同 下 ， 先後參觀 了 校園 、 校史 牆 ， 並與 師生 互動 交流 。         濠江 中學 附屬 橫琴 學校 目前 是 一所 從 幼稚 園到 小學 的 九年制 學校 ， 為 澳門 濠江 中學 的 第五 個 校部 ， 現有 八個 班合計 二百五 十六名 學生 ， 當中 澳門 學生 佔 九成 八 。 現正 建設 中學部 ， 預計 二 〇 二 六年 落成 後 招收 初一 至 高三 學生 ， 屆 時 將成 為 一所 從 幼稚 園到 高中 的 十五年 制學校 ， 全校 最大 規模 可達 六十六 個班 。,2024-11-10
學校村車位憂僧多粥少,首期四校一中心共用三百三泊位    學校村車位憂僧多粥少    【本報消息】新城A區學校村規劃建八所學校，預計提供超過一萬個學額。首期四所學校及一個教育活動中心將共用地下停車場，規劃有一百五十五個私家車位和一百七十五個電單車位，並特別設立兒童接送區，引起社會對車位不足的關注。    菜農學校校長王國英認為，初期車位數量或足夠，但隨着更多學校投入使用，預計未來車位會“僧多粥少”、車位緊張，建議政府增建車位。並倡完善學校周邊步行系統，考慮無障礙設施。    新城A區B1地段的四所學校及一個教育中心日前已舉行基礎及地庫工程開標，預料明年首季動工，最長施工期為四百三十二個工作天。公建局表示，未來學校及教育中心將共用一個地下停車場，初步規劃私家車及電單車位共三百三十個，和八個小巴位，並特別設置兒童接送專區，引起社會擔憂未來車位數量不足。    菜農學校是其中一間即將遷入A區學校村的學校，校長王國英透露，初步計劃先遷移高中生至A區，隨後逐步遷移低年級學生。高中生自理能力較強，大多數能自行乘坐公共交通或步行，因此預計初期車位數量足夠。但強調，仍存在許多不確定因素，特別是A區的公共交通和路網規劃的完善程度，將直接影響學生及家長選擇綠色出行還是駕車。    教師家長人員衆    王國英擔憂，隨着更多學校及教育中心投入使用，共用的車位將“僧多粥少”，供不應求。以菜農學校為例，即使只有一半學額遷移至A區，也將涉及過百名教職員工，雖然未必個個駕車回校，但另有三所學校的教職員工及接送學童家長，以及教育活動中心工作人員及公眾，估計未來車位將非常緊張。    儘管周邊有公屋公共停車場，但王國英指出，人們更傾向於“捨遠圖近”，選擇最近的停車場上下班或接送孩子。希望政府能再度評估並規劃，增加地下停車位，為學校教職員和接送家長帶來便利。    冀完善無障設施    他還提及，學校周邊路網設計必須更加完善，可參考氹仔基馬拉斯大馬路的空中走廊，並與輕軌站及公屋群連通，實現步行系統的無縫銜接，方便學生上下學。同時，考慮到學校中有幼稚園，或有推着嬰兒車的家長，沿途需要考慮無障礙設施，以方便出行。    籲初期派員疏導    另外，新城A區學校村規劃在地下停車場設立兒童接送區，王國英認為這是理想的構想，對澳門是新鮮事，大家是“摸着石頭過河”，因此也存在一些疑慮。如在下雨天時，大家都駕車送孩子上學，可能導致交通擁堵。預計在開學初期，由於家長不熟悉停車場內部情況，將需要加派人員指引和協助接送學生，以確保交通順暢。初期搬遷時，大多數學生將由原黑沙環區改到新城A區上學，如果多數人使用車輛，可能出現跨區返學和相應的交通擁堵問題。    問及學校能否錯峰上下學，減少路面交通擁堵？王國英表示，即使學校實施錯峰，如各校上學時間相差十分鐘，但所有學校仍將在一個小時內陸續開學。錯峰時間仍需要未來四所學校的相互協調及合作。,http://www.macaodaily.com/html/2024-11/10/content_1793079.htm,公建局表示，未來學校及教育中心將共用一個地下停車場，初步規劃私家車及電單車位共三百三十個，和八個小巴位，並特別設置兒童接送專區，引起社會擔憂未來車位數量不足,首期 四校 一 中心 共用 三百 三 泊位         學校 村車位 憂 僧多粥少         【 本報 消息 】 新城 A 區學校 村 規劃建 八所 學校 ， 預計 提供 超過 一萬個 學額 。 首期 四所 學校 及 一個 教育 活動 中心 將 共用 地下 停車場 ， 規劃 有 一百五十五 個 私家 車位 和 一百七十 五個 電單 車位 ， 並特別 設立 兒童 接送 區 ， 引起 社會 對 車位 不足 的 關注 。         菜 農學校 校長 王國英 認為 ， 初期 車位 數量 或 足夠 ， 但 隨着 更 多學校 投入使用 ， 預計 未來 車位 會 “ 僧多粥少 ” 、 車位 緊張 ， 建議 政府 增建 車位 。 並倡 完善 學校 周邊 步行 系統 ， 考慮 無障礙 設施 。         新城 A 區 B1 地段 的 四所 學校 及 一個 教育 中心 日前 已舉行 基礎 及 地庫 工程 開標 ， 預料 明年 首季 動工 ， 最長 施工期 為 四百 三十二 個 工作 天 。 公建局 表示 ， 未來 學校 及 教育 中心 將 共用 一個 地下 停車場 ， 初步 規劃 私家 車及 電單 車位 共 三百 三十 個 ， 和 八個 小巴 位 ， 並特別 設置 兒童 接送 專區 ， 引起 社會 擔憂 未來 車位 數量 不足 。         菜 農學校 是 其中 一間 即將 遷入 A 區學校 村 的 學校 ， 校長 王國英 透露 ， 初步 計劃 先遷 移 高中生 至 A 區 ， 隨後 逐步 遷移 低 年級 學生 。 高中生 自理能力 較強 ， 大多 數能 自行 乘坐 公共交通 或 步行 ， 因此 預計 初期 車位 數量 足夠 。 但 強調 ， 仍 存在 許多 不 確定 因素 ， 特別 是 A 區的 公共交通 和 路 網規劃 的 完善 程度 ， 將 直接 影響 學生 及家長 選擇 綠色 出行 還是 駕車 。         教師家長 人員 衆         王國英 擔憂 ， 隨着 更 多學校 及 教育 中心 投入使用 ， 共用 的 車位將 “ 僧多粥少 ” ， 供 不 應求 。 以菜 農學校 為例 ， 即使 只有 一半 學額 遷 移至 A 區 ， 也將 涉及 過 百名 教職員工 ， 雖然 未必 個個 駕車 回校 ， 但 另 有 三 所學校 的 教 職員 工及 接送 學童家長 ， 以及 教育 活動 中心 工作 人員及 公眾 ， 估計 未來車 位將 非常 緊張 。         儘 管 周 邊 有 公屋 公共 停車場 ， 但 王國英 指出 ， 人們 更 傾向 於 “ 捨 遠 圖近 ” ， 選擇 最近 的 停車場 上下班 或 接送 孩子 。 希望 政府 能 再度 評估 並規劃 ， 增加 地下 停車位 ， 為學校 教職員 和 接送 家長 帶來 便利 。         冀 完善 無障 設施         他還 提及 ， 學校 周邊 路網 設計 必須 更加 完善 ， 可 參考 氹 仔基馬 拉斯 大馬路 的 空中走廊 ， 並與 輕軌 站 及 公屋 群連通 ， 實現 步行 系統 的 無縫 銜接 ， 方便 學生 上下 學 。 同時 ， 考慮 到 學校 中 有 幼稚 園 ， 或 有 推着 嬰兒車 的 家長 ， 沿途 需要 考慮 無障礙 設施 ， 以 方便 出行 。         籲 初期 派員 疏導         另外 ， 新城 A 區學校 村 規劃 在 地下 停車場 設立 兒童 接送 區 ， 王國英 認為 這是 理想 的 構想 ， 對 澳門 是 新 鮮事 ， 大家 是 “ 摸 着 石頭 過河 ” ， 因此 也 存在 一些 疑慮 。 如 在 下雨天 時 ， 大家 都 駕車 送 孩子 上學 ， 可能 導致 交通 擁堵 。 預計 在 開學 初期 ， 由 於 家長 不 熟悉 停車場 內部 情況 ， 將 需要 加派 人員 指引 和 協助 接送 學生 ， 以確 保 交通 順暢 。 初期 搬遷 時 ， 大多 數學生 將由原 黑沙 環區 改到 新城 A 區上學 ， 如果 多數 人 使用 車輛 ， 可能 出現 跨區 返學 和 相應 的 交通 擁堵 問題 。         問及 學校 能否 錯峰 上下 學 ， 減少 路面 交通 擁堵 ？ 王國英 表示 ， 即使 學校 實施 錯峰 ， 如 各校 上學 時間 相差 十分 鐘 ， 但 所有 學校 仍將 在 一個 小時 內陸續 開學 。 錯峰 時間 仍 需要 未來 四所 學校 的 相互 協調 及 合作 。,2024-11-10
