Title,Content,Link,Summary,Preprocessed_Content,Date
岑昨交383選委提名,獲九成六選委支持    料成唯一新任特首候選人    岑昨交383選委提名    【本報消息】第六任行政長官選舉提名期明日結束，社會呼聲最高的參選人岑浩輝昨日已向選管會遞交壓倒性的三百八十三個提名（佔四百選委約百分之九十六）。換言之，其他人士已無法取得最少六十六個提名入閘。岑浩輝已沒有任何競爭對手，通過審核後將成爲唯一候選人。    爭取餘下選委支持    岑浩輝在競選代理人李煥江，競選辦主任葉兆佳、副主任陳家良等陪同下，昨日上午十時到公共行政大樓地下選舉事務櫃檯遞交提名表。一如外界所料，岑浩輝取得絕大部分選委的提名。他受訪時形容自己與過去幾任行政長官參選人不同，提名期間與競選團隊主動接觸各界別選委，直接與他們聯繫和交流，聽取意見，爭取支持。至前晚得到三百八十三名選委提名。之後會繼續與各界社團及各階層人士聯繫，包括未有提名他的十七位選委，以爭取支持。    全力以赴參與競選    三百八十三個提名佔總選委人數高達近百分之九十六，是否達到預期目標？岑浩輝稱，其作風是全力以赴，盡力向各界別選委爭取支持。四百位選委分佈不同行業、領域、階層，“既然我出來參選，就盡量與選委多溝通，了解他們的訴求。”    被問及取得的提名結果是否較想像中順利？岑浩輝稱，參選行政長官是重要的決定，當決定參選後，沒有仔細考慮有多少人支持、提名，而是全力以赴按照法律規定的程序，與競選團隊一步步去做，“咁多選委支持我，目前來說是很滿意。”並不存在與原來的設想作比較一說。重申之前沒有預料獲得多少選委提名，關鍵是按照選舉程序進行整個選舉工作，更多時間與社會各界硏究將來的競選綱領、施政理念。    主動聯繫接觸各界    有葡文傳媒關注岑浩輝走出原來的司法領域，以及如何加強與葡人社團聯繫？岑浩輝稱，已走出原來的司法領域，又指澳門社會將來的發展需要大家共同努力。談及以往幾屆特區政府做得很好，他會繼續主動與社會各界聯繫、溝通，包括與葡人社團接觸聯繫，特別是制訂重要政策時，牽涉面較廣時，希望他的管治團隊多聽社會各界的意見。    再無人獲足夠提名    行政長官選舉將於十月十三日舉行。按照《行政長官選舉法》規定，參選人須獲得四百名選委中的至少六十六人聯合簽署提名。沒有提名岑浩輝的僅十七名選委，意味着其餘有意參選人士即使囊括餘下的十七個提名，亦沒有機會取得入閘資格。,http://www.macaodaily.com/html/2024-09/11/content_1780506.htm,岑浩輝稱，參選行政長官是重要的決定，當決定參選後，沒有仔細考慮有多少人支持、提名，而是全力以赴按照法律規定的程序，與競選團隊一步步去做，“咁多選委支持我，目前來說是很滿意,獲 九成 六選委 支持         料成 唯一 新任 特首 候選人         岑 昨交 383 選委 提名         【 本報 消息 】 第六任 行政 長 官選舉 提名 期 明日 結束 ， 社會 呼聲 最高 的 參選人 岑浩輝 昨日 已向 選管會 遞交壓 倒性 的 三百 八十三 個 提名 （ 佔 四百 選委約 百分之九十 六 ） 。 換言 之 ， 其他 人士 已無法 取得 最少 六十六 個 提名 入閘 。 岑浩輝 已 沒 有 任何 競爭 對 手 ， 通過 審核後將 成 爲 唯一 候選人 。         爭取 餘下 選委 支持         岑浩輝 在 競選 代理人 李煥江 ， 競選辦 主任 葉兆佳 、 副 主任 陳 家良 等 陪同 下 ， 昨日 上午 十時 到 公共行政 大樓 地下 選舉 事務櫃 檯 遞交 提名 表 。 一如 外界 所 料 ， 岑浩輝 取得 絕 大部分 選委 的 提名 。 他 受訪 時 形容 自己 與 過去 幾任 行政 長 官 參選人 不同 ， 提名 期間 與 競選團隊 主動 接觸 各界 別選委 ， 直接 與 他們 聯 繫 和 交流 ， 聽取 意見 ， 爭取 支持 。 至前 晚 得到 三 百八十 三名 選委 提名 。 之後會 繼續 與 各界 社團 及 各階層 人士 聯 繫 ， 包括 未有 提名 他 的 十七位 選委 ， 以爭 取 支持 。         全力以赴 參與 競選         三百 八十三 個 提名 佔 總選委人數 高達近 百分之九十 六 ， 是否 達到 預期 目標 ？ 岑浩輝 稱 ， 其作風 是 全力以赴 ， 盡力 向 各界 別選委爭 取 支持 。 四百 位選委分 佈 不同 行業 、 領域 、 階層 ， “ 既然 我 出來 參選 ， 就 盡量 與 選委多 溝通 ， 了解 他們 的 訴求 。 ”         被 問及 取得 的 提名 結果 是否 較 想像中 順利 ？ 岑浩輝 稱 ， 參選 行政 長 官 是 重要 的 決定 ， 當決定 參選 後 ， 沒有 仔細 考慮 有 多少 人 支持 、 提名 ， 而是 全力以赴 按照 法律 規定 的 程序 ， 與 競選團隊 一步步 去 做 ， “ 咁 多 選委 支持 我 ， 目前 來 說 是 很 滿意 。 ” 並不 存在 與 原來 的 設想作 比較 一說 。 重申 之前 沒有 預料 獲得 多少 選委 提名 ， 關鍵 是 按照 選舉 程序 進行 整個 選舉 工作 ， 更多 時間 與 社會 各界 硏 究 將 來 的 競 選 綱 領 、 施政 理念 。         主動 聯 繫 接 觸 各界         有 葡文 傳媒 關注 岑浩輝 走出 原來 的 司法 領域 ， 以及 如何 加強 與 葡人 社團 聯 繫 ？ 岑浩輝 稱 ， 已 走出 原來 的 司法 領域 ， 又 指澳門 社會 將來 的 發展 需要 大家 共同努力 。 談及 以往 幾屆 特區 政府 做 得 很 好 ， 他會 繼續 主動 與 社會 各界 聯 繫 、 溝通 ， 包括 與 葡人 社團 接觸 聯 繫 ， 特別 是 制訂 重要 政策 時 ， 牽涉 面較 廣時 ， 希望 他 的 管治 團隊 多 聽 社會 各界 的 意見 。         再無人 獲足夠 提名         行政 長 官選 舉將 於 十月 十三日 舉行 。 按照 《 行政 長 官選 舉法 》 規定 ， 參選人須 獲得 四百名 選 委中 的 至少 六十六 人聯合 簽署 提名 。 沒有 提名 岑浩輝 的僅 十七名 選委 ， 意味着 其餘 有意 參選 人士 即使 囊括 餘下 的 十七 個 提名 ， 亦 沒 有 機會 取得 入閘 資格 。,2024-09-11
岑：廣納意見準備政綱,倘成候選人將與選委社會各界交流深入社區    岑：廣納意見準備政綱    【本報消息】為期十五天的行政長官選舉候選人提名期將於明（十二）日結束，行政長官參選人岑浩輝昨日上午到公共行政大樓向選管會遞交候選人提名表。    安排公聽及宣講會    岑浩輝昨日遞交提名表後接受傳媒訪問表示，若經選管會審查和核實成為行政長官候選人，將在競選活動前準備競選政綱，期間將與社會各界廣泛交流，尤其是選委，甚至會到社區了解情況。在競選活動期間，會安排公聽會、記者招待會、政綱宣講會等，將與競選團隊按法律規定有序開展工作。    聽取各界選委意見    行政長官選舉候選人提名期為八月二十九日至九月十二日。岑浩輝參選代理人李煥江在提名期首日便代表岑浩輝到公共行政大樓地庫一樓的選舉事務接待櫃檯領取《行政長官選舉候選人提名表》。    岑浩輝八月三十一日起出席由多個界別組織的選委與參選人的交流活動，分別與第一界別的工商、金融界，第二界別的文化界、教育界、專業界、體育界，第三界別的勞工界、社會服務界、宗教界，第四界別的立法會議員、澳區全國人大代表、全國政協澳區委員會晤。期間岑浩輝競選辦與第四界別的市政機構選委座談，聽取意見和建議，並爭取選委提名支持。    審查公佈候選名單    按照選舉日程，選管會將於下周三（十八日）完成對被提名候選人可接納性審查並公佈決定，倘沒有異議及上訴，選管會將於下周五（二十日）公佈被確定接納候選人名單。倘有異議及上訴，則不遲於本月二十五日公佈相關名單。行政長官候選人競選活動將由本月二十八日至十月十一日進行；十月十三日為行政長官選舉日。,http://www.macaodaily.com/html/2024-09/11/content_1780507.htm,倘成候選人將與選委社會各界交流深入社區    岑：廣納意見準備政綱    【本報消息】為期十五天的行政長官選舉候選人提名期將於明（十二）日結束，行政長官參選人岑浩輝昨日上午到公共行政大樓向選管會遞交候選人提名表,倘成候 選人將 與 選委社會 各界 交流 深入 社區         岑 ： 廣納意 見 準備 政綱         【 本報 消息 】 為期 十五天 的 行政 長 官選 舉候 選人 提名 期將 於 明 （ 十二 ） 日 結束 ， 行政 長 官 參選人 岑浩輝 昨日 上午 到 公共行政 大樓 向 選管會 遞交候 選人 提名 表 。         安排 公聽 及 宣講會         岑浩輝 昨日 遞交 提名 表 後 接受 傳媒 訪問 表示 ， 若經 選管會 審查 和 核實 成為 行政 長 官候 選人 ， 將在 競選 活動前 準備 競選政綱 ， 期間將 與 社會 各界 廣泛 交流 ， 尤其 是 選委 ， 甚至 會到 社區 了解 情況 。 在 競選 活動 期間 ， 會 安排 公聽會 、 記者 招待 會 、 政綱 宣講會 等 ， 將與 競選團隊 按 法律 規定 有序 開展 工作 。         聽取 各界 選委意 見         行政 長 官選 舉候 選人 提名 期為 八月 二十九日 至 九月 十二日 。 岑浩輝 參選 代理人 李煥江 在 提名 期 首日 便 代表 岑浩輝 到 公共行政 大樓 地庫 一樓 的 選舉 事務 接待 櫃 檯 領取 《 行政 長 官選 舉候 選人 提名 表 》 。         岑浩輝 八月 三十一日 起 出席 由多個 界別 組織 的 選委 與 參選人 的 交流 活動 ， 分別 與 第一 界別 的 工商 、 金融界 ， 第二 界別 的 文化界 、 教育界 、 專業界 、 體育界 ， 第三 界別 的 勞工界 、 社會 服務界 、 宗教界 ， 第四 界別 的 立法 會議員 、 澳區 全國 人大代表 、 全國政協 澳區 委員會晤 。 期間 岑浩輝 競選辦 與 第四 界別 的 市政 機構 選委座 談 ， 聽取 意見 和 建議 ， 並爭 取選委 提名 支持 。         審查 公 佈 候選名 單         按照 選舉 日程 ， 選管會將 於 下 周三 （ 十八日 ） 完成 對 被 提名 候選人 可 接納性 審查 並公 佈 決定 ， 倘沒有 異議 及 上訴 ， 選管會將 於 下 周五 （ 二十日 ） 公 佈 被 確定 接納候 選人 名單 。 倘有 異議 及 上訴 ， 則不遲 於 本月 二十五日 公 佈 相關 名單 。 行政 長 官候 選人 競選 活動將 由 本月 二十八日 至 十月 十一日 進行 ； 十月 十三日 為 行政 長 官選舉 日 。,2024-09-11
岑浩輝競選辦續聽各界意見,前昨續晤三團體代表    岑浩輝競選辦續聽各界意見    【本報消息】第六任行政長官參選人岑浩輝及競選團隊前昨兩日先後會見澳門高等教育發展促進會，澳門退休、退役及領取撫恤金人士協會負責人。此外，競選團隊成員昨日亦會見了澳門舞蹈家協會負責人。    建言吸引高端人才    前日下午四時半，岑浩輝在代理人李煥江、競選辦公室主任葉兆佳及副主任陳家良等陪同下，在競選辦公室會見澳門高等教育發展促進會會長莫啓明、理事長龐川、監事長邱庭彪等十人，聽取意見並交流。岑浩輝歡迎澳門高等教育發展促進會到訪。    座談期間，與會者就推動整體澳門高等教育長遠持續發展、如何打造國際高端人才集聚高地等提了多項意見，包括落實部署和深化高校在橫琴深合區建校辦學的策略；提議發揮科研平台吸引各地高端人才的作用；冀重視解決科技成果轉化產業的難點；以及合理配置“官產學研用”角色、完善教育體系、推動創新發展、增強教育競爭力等。岑浩輝感謝澳門高等教育發展促進會代表們提出的建議，表示競選辦公室將繼續廣納賢言，深入了解各界的訴求和期望。    保障養老關注住屋    岑浩輝及競選團隊昨日下午三時在競選辦公室會見澳門退休、退役及領取撫恤金人士協會會長方永強、理事長馬慈國等一行七人，深入交流長者政策、退休人士福利等。岑浩輝歡迎澳門退休、退役及領取撫恤金人士協會到訪。會上協會代表希望提升長者生活質素和福利，建議完善養老保障，關注公務員及長者住屋需求及在澳葡籍人士和土生葡人社群的權益。岑浩輝感謝與會代表提供的寶貴意見和建議，將繼續通過多種途徑廣泛聽取社會各界的意見。    交流文藝教育發展    此外，昨日上午十一時，李煥江、陳家良在競選辦公室會見澳門舞蹈家協會主席梁劍丹、理事長陳亭等一行八人，深入交流澳門文化藝術及藝術教育發展。陳家良代表競選辦歡迎澳門舞蹈家協會到訪。會上，澳門舞蹈家協會介紹了澳門與內地舞蹈藝術交流概況，當中包括文化藝術及藝術教育等發展現況，並表達意見及建議。陳家良感謝澳門舞蹈家協會提供的意見和建議。,http://www.macaodaily.com/html/2024-09/11/content_1780509.htm,建言吸引高端人才    前日下午四時半，岑浩輝在代理人李煥江、競選辦公室主任葉兆佳及副主任陳家良等陪同下，在競選辦公室會見澳門高等教育發展促進會會長莫啓明、理事長龐川、監事長邱庭彪等十人，聽取意見並交流,前 昨續晤 三團體 代表         岑浩輝 競選 辦續 聽 各界 意見         【 本報 消息 】 第六任 行政 長 官 參選人 岑浩輝 及 競選團 隊前 昨兩日 先後會 見 澳門 高等教育 發展 促進會 ， 澳門 退休 、 退役 及 領取 撫 恤金 人士 協會 負責人 。 此外 ， 競選團隊 成員 昨日 亦 會 見 了 澳門 舞蹈家 協會 負責人 。         建言 吸引 高端 人才         前日 下午 四時 半 ， 岑浩輝 在 代理人 李煥江 、 競選 辦公 室主任 葉兆佳 及 副 主任 陳 家良 等 陪同 下 ， 在 競選辦 公室 會見 澳門 高等教育 發展 促進 會會長 莫 啓 明 、 理事 長 龐川 、 監事長 邱庭彪 等 十人 ， 聽取 意見並 交流 。 岑浩輝 歡迎 澳門 高等教育 發展 促進會 到 訪 。         座談 期間 ， 與 會者 就 推動 整體 澳門 高等教育 長 遠持續 發展 、 如何 打造 國際 高端 人才 集聚 高地 等 提 了 多項 意見 ， 包括 落實 部署 和 深化 高校 在 橫琴 深合區 建校 辦學 的 策略 ； 提議 發揮 科研 平台 吸引 各地 高端 人才 的 作用 ； 冀重視 解決 科技成果 轉化產業 的 難點 ； 以及 合理配置 “ 官產學 研用 ” 角色 、 完善 教育 體系 、 推動 創新 發展 、 增強 教育 競爭力 等 。 岑浩輝 感謝 澳門 高等教育 發展 促進會 代表 們 提出 的 建議 ， 表示 競選辦 公室 將繼續 廣納賢言 ， 深入 了解 各界 的 訴 求和 期望 。         保障 養老 關注 住屋         岑浩輝 及 競選團隊 昨日 下午 三時 在 競選辦 公室 會見 澳門 退休 、 退役 及 領取 撫 恤金 人士 協會會長 方永強 、 理事 長 馬 慈國 等 一行 七人 ， 深入 交流 長 者 政策 、 退休 人士 福利 等 。 岑浩輝 歡迎 澳門 退休 、 退役 及 領取 撫 恤金 人士 協會 到 訪 。 會上 協會 代表 希望 提升 長 者 生活 質素 和 福利 ， 建議 完善 養老 保障 ， 關注 公務員及 長 者 住屋 需求 及 在 澳 葡籍 人士 和 土生 葡人 社群 的 權益 。 岑浩輝 感謝 與 會 代表 提供 的 寶貴意 見 和 建議 ， 將繼續 通過 多種 途徑 廣泛 聽取 社會 各界 的 意見 。         交流 文藝 教育 發展         此外 ， 昨日 上午 十一 時 ， 李煥江 、 陳 家良 在 競選辦 公室 會見 澳門 舞蹈家 協會 主席 梁劍丹 、 理事 長 陳 亭 等 一行 八人 ， 深入 交流 澳門 文化 藝術 及 藝術 教育 發展 。 陳 家良 代表 競選辦 歡迎 澳門 舞蹈家 協會 到 訪 。 會上 ， 澳門 舞蹈家 協會 介紹 了 澳門 與 內 地 舞蹈 藝術 交流 概況 ， 當中 包括 文化 藝術 及 藝術 教育 等 發展 現況 ， 並表達 意見 及 建議 。 陳 家良 感謝 澳門 舞蹈家 協會 提供 的 意見 和 建議 。,2024-09-11
