Title,Content,Link,Summary,Preprocessed_Content,Date
全力支持“2023幻彩耀濠江” “花影繽紛”促進夜經濟,全力支持“2023幻彩耀濠江”    “花影繽紛”促進夜經濟    為支持旅遊局主辦的“2023幻彩耀濠江”，澳娛綜合由2023年12月2日至2024年2月25日於中區（新馬路及内港一帶）呈獻“花影繽紛”光影之旅，協力促進澳門社區旅遊及夜間經濟。    澳娛綜合圍繞“璀璨遊樂場”的主題，以繁花為設計主軸，搭配繽紛色彩，帶領旅客和市民漫步遊歷中區，處處可見花影繽紛，浪漫滿載。    澳娛綜合“花影繽紛”燈光裝置分佈於十六號碼頭（鐘樓）及十六浦度假村、十月初五街、金碧文娛中心、大堂前地，以及板樟堂巷，是打卡熱點，深受歡迎。,http://www.macaodaily.com/html/2024-02/29/content_1738193.htm,全力支持“2023幻彩耀濠江”    “花影繽紛”促進夜經濟    為支持旅遊局主辦的“2023幻彩耀濠江”，澳娛綜合由2023年12月2日至2024年2月25日於中區（新馬路及内港一帶）呈獻“花影繽紛”光影之旅，協力促進澳門社區旅遊及夜間經濟,全力支持 “ 2023 幻彩 耀 濠江 ”         “ 花影 繽紛 ” 促進 夜經濟         為 支持 旅遊局 主辦 的 “ 2023 幻彩 耀 濠江 ” ， 澳娛 綜合 由 2023 年 12 月 2 日至 2024 年 2 月 25 日 於 中區 （ 新馬路 及 内港 一帶 ） 呈獻 “ 花影 繽紛 ” 光影 之旅 ， 協 力促 進澳門 社區 旅遊及 夜間 經濟 。         澳娛 綜合圍 繞 “ 璀璨 遊樂場 ” 的 主題 ， 以 繁花 為 設計 主軸 ， 搭配 繽紛 色彩 ， 帶領 旅客 和 市民 漫步 遊歷 中區 ， 處處 可見 花影 繽紛 ， 浪漫 滿載 。         澳娛 綜合 “ 花影 繽紛 ” 燈光 裝置 分 佈 於 十六 號碼頭 （ 鐘樓 ） 及 十六 浦 度假村 、 十月初 五街 、 金碧 文娛 中心 、 大堂 前地 ， 以及 板樟堂 巷 ， 是 打卡 熱點 ， 深受 歡迎 。,2024-02-29
藥監局深合區簽藥監備忘錄,保障橫琴澳人用藥安全    藥監局深合區簽藥監備忘錄    【本報消息】藥物監督管理局訊：藥監局與橫琴粵澳深度合作區商事服務局昨日在橫琴簽署《橫琴粵澳深度合作區使用澳門地區已上市部分藥品監管合作備忘錄》，並舉行工作會議，討論落實“備忘錄”相關工作安排。    藥監局長蔡炳祥表示，簽署的“備忘錄”圍繞深合區使用澳門地區已上市部分藥品的各項安全監管工作，透過對有關藥品進行全生命周期管理，保障深合區澳門居民的用藥安全，為推動澳門居民在深合區居住和工作創設良好條件。隨着《橫琴粵澳深度合作區總體發展規劃》及《關於支持橫琴粵澳深度合作區放寬市場准入特別措施的意見》的出台，為推動澳門和深合區機制協同、規則銜接提供更明確的規劃和方向。在上述政策框架下，澳門藥監局和深合區商事局將進一步探討和研究兩地藥品監管創新模式及機制，包括深入實施“澳門註冊+橫琴生產”，推動發展中醫藥等澳門品牌工業，助力大健康產業發展。    深合區商事局局長吳創偉表示，“備忘錄”的簽署是貫徹落實《橫琴粵澳深度合作區建設總體方案》中“便利澳門居民生活就業的新空間”的又一重要舉措。隨着“澳門新街坊”認購熱情高漲，在深合區生活、就業的澳門居民越來越多，為深合區澳門居民帶來趨同澳門的藥事服務，對助推琴澳民生深度融合有著重要的現實意義。接下來，深合區將繼續加強琴澳兩地藥品監管工作的交流協作，落實指定澳門藥品相關配套措施，錨定琴澳民生深度融合，建立一體化發展格局，支撐澳門經濟適度多元發展等目標任務開展系列務實合作。    為保障深合區澳門居民用藥安全、有效、可及和合法權益，內地發佈《關於支持在橫琴粵澳深度合作區使用澳門地區已上市部分藥品的工作方案》，“備忘錄”根據上述工作方案制定，內容圍繞深合區使用澳門已上市部分藥品監管工作包括藥品目錄管理、供應商監管、藥品配送、藥品日常監管、藥品檢驗、不良反應監測、藥品安全事件應急處置協作機制等。    工作會議上，雙方還探討及研究琴澳特定專用渠道便捷配送深合區澳門居民購買的合理自用非處方類藥品的可行性、深合區醫療器械安全治理等工作。    蔡炳祥一行還到深合區政務服務中心調研，與深合區商事局共同探討更方便內地企業申請澳門中藥註冊的措施；另也到深合區澳門新街坊衛生站及澳資藥房，調研澳門新街坊衛生站提供醫藥服務的設施，以及澳門藥劑專業人員在深合區執業的情況，期間藥監局代表聽取澳資藥房人員對進一步推動澳門優質藥事服務延伸到深合區的意見和建議。    出席“備忘錄”簽署儀式及工作會議人員還包括藥監局副局長吳國良、規劃及質量管理廳廳長劉雅文；深合區商事局副局長邱潤華、市場監管處處長趙金亮、副處長林栩婧等。,http://www.macaodaily.com/html/2024-02/29/content_1738184.htm,保障橫琴澳人用藥安全    藥監局深合區簽藥監備忘錄    【本報消息】藥物監督管理局訊：藥監局與橫琴粵澳深度合作區商事服務局昨日在橫琴簽署《橫琴粵澳深度合作區使用澳門地區已上市部分藥品監管合作備忘錄》，並舉行工作會議，討論落實“備忘錄”相關工作安排,保障 橫琴 澳人 用藥 安全         藥監局 深合區 簽藥 監備 忘錄         【 本報 消息 】 藥物 監督 管理局 訊 ： 藥監局 與 橫琴粵澳 深度 合作 區 商事 服務局 昨日 在 橫琴 簽署 《 橫琴粵澳 深度 合作 區 使用 澳門 地區 已 上市 部分 藥品 監管 合作 備忘錄 》 ， 並舉行 工作 會議 ， 討論 落實 “ 備忘錄 ” 相關 工作 安排 。         藥監 局長 蔡炳祥 表示 ， 簽署 的 “ 備忘錄 ” 圍繞 深合區 使用 澳門 地區 已 上市 部分 藥品 的 各項 安全 監管 工作 ， 透過 對 有 關藥品 進行 全 生命周期 管理 ， 保障 深合區 澳門 居民 的 用藥 安全 ， 為 推動 澳門 居民 在 深合區 居住 和 工作 創設 良好 條件 。 隨着 《 橫琴粵澳 深度 合作 區總體 發展 規劃 》 及 《 關於 支持 橫琴粵澳 深度 合作 區放 寬 市場 准入 特別 措施 的 意見 》 的 出台 ， 為 推動 澳門 和 深合區 機制 協同 、 規則 銜接 提供 更明確 的 規劃 和 方向 。 在 上述 政策 框架 下 ， 澳門藥 監局 和 深合區 商事 局將 進 一步 探討 和 研究 兩地 藥品 監管 創新 模式 及 機制 ， 包括 深入 實施 “ 澳 門 註 冊 + 橫琴 生產 ” ， 推動 發展 中 醫藥 等 澳門 品牌 工業 ， 助力 大 健康 產業 發展 。         深合區 商事 局局 長 吳創偉 表示 ， “ 備忘錄 ” 的 簽署 是 貫徹 落實 《 橫琴粵澳 深度 合作 區建設 總體 方案 》 中 “ 便利 澳門 居民 生活 就業 的 新 空間 ” 的 又 一 重要 舉措 。 隨着 “ 澳門 新 街坊 ” 認購 熱情 高漲 ， 在 深合區 生活 、 就業 的 澳門 居民 越來 越 多 ， 為 深合區 澳門 居民 帶來 趨同 澳門 的 藥事 服務 ， 對 助推 琴澳 民生 深度 融合 有著 重要 的 現實 意義 。 接下 來 ， 深合區 將繼續 加強琴 澳兩地 藥品 監管 工作 的 交流 協作 ， 落實 指定 澳門藥 品相 關 配套措施 ， 錨定 琴澳 民生 深度 融合 ， 建立 一體化 發展 格局 ， 支撐 澳門 經濟 適度 多元 發展 等 目標 任務 開展 系列 務實 合作 。         為 保障 深合區 澳門 居民 用藥 安全 、 有效 、 可及 和 合法 權益 ， 內地發 佈 《 關於 支持 在 橫琴粵澳 深度 合作 區 使用 澳門 地區 已 上市 部分 藥品 的 工作 方案 》 ， “ 備忘錄 ” 根據 上述 工作 方案 制定 ， 內容圍 繞 深合區 使用 澳門 已 上市 部分 藥品 監管 工作 包括 藥 品目 錄 管理 、 供應 商監管 、 藥品 配送 、 藥品 日常 監管 、 藥品 檢驗 、 不良 反應 監測 、 藥品 安全事件 應急 處置 協作 機制 等 。         工作 會議 上 ， 雙方 還探 討及 研究 琴澳 特定 專用 渠道 便捷 配送 深合區 澳門 居民 購買 的 合理 自用 非處 方類 藥品 的 可行性 、 深合區 醫療 器械 安全 治理 等 工作 。         蔡炳祥 一行 還到 深合區 政務 服務 中心 調研 ， 與 深合區 商事 局 共同 探討 更 方便 內地 企業 申請 澳門 中 藥 註 冊 的 措施 ； 另 也 到 深合區 澳門 新 街坊 衛生 站 及 澳資 藥房 ， 調研 澳門 新 街坊 衛生 站 提供 醫藥 服務 的 設施 ， 以及 澳門 藥劑 專業 人員 在 深合區 執業 的 情況 ， 期間 藥監局 代表 聽取 澳資藥 房人員 對 進 一步 推動 澳門 優質 藥事 服務 延伸 到 深合區 的 意見 和 建議 。         出席 “ 備忘錄 ” 簽署 儀式 及 工作 會議 人員還 包括 藥監局 副 局長 吳國良 、 規劃 及 質量 管理 廳廳 長 劉雅文 ； 深合區 商事 局 副 局長 邱潤華 、 市場 監管處 處長 趙 金亮 、 副 處長 林栩婧 等 。,2024-02-29
(新聞小語)完善法制 夯實愛國者治澳    夏耘,完善法制 夯實愛國者治澳    《就職宣誓法》修訂案昨獲立法會全體會議全票一般性通過。法案建議新增行政長官選舉委員會委員作為宣誓主體，增訂相應誓詞；增加以簽署聲明作出誓詞的宣誓方式；完善宣誓行為的要求及監誓制度，規定若宣誓人故意宣讀與法定誓詞不一致的內容或簽署經篡改相關誓詞的聲明書，又或以任何不真誠、不莊重的方式宣誓，將視為拒絕宣誓。    澳門特區負有維護國家安全和社會穩定的憲制責任，居民也承擔相應的責任和義務。施政報告提到，特區政府將以更高的政治站位、更強的責任擔當，堅定不移貫徹總體國家安全觀，堅定維護國家主權、安全、發展利益，堅決防範和遏制外部勢力干預澳門事務，堅決打擊任何勢力利用澳門危害國家安全。推動全體公務人員和澳門社會各界，切實增強維護國安的意識、提升維護國安的能力、確保維護國安的成效，牢牢守住“澳門不能亂”的底線。    澳門特區維護國家安全的法律制度日臻完善，執行機制不斷完善。近一年來先後完成並生效實施新修訂的《維護國家安全法》、《行政長官選舉法》修訂案、《保守國家秘密法》；《立法會選舉法》修訂案已進入細審階段。系列法律法規共同構成系統的法律體系，為維護國家安全提供堅實的法治保障，總體國家安全觀和“愛國者治澳”原則進一步貫徹落實。    行政長官選舉委員會，負責提名及選舉特首，站位高、責任重。今次修訂《就職宣誓法》，進一步完善相關程序規制，符合政治邏輯和倫理，確保澳門管治權牢牢掌握在堅定的愛國者手中，鞏固維護愛國者治澳的良好局面，從而有效維護國家安全利益，履行特區憲制責任。    按照授權原則，行政機關中的一般公務人員，其實都參與了行使憲法和基本法授予的相關職權，也均須承擔對國家和澳門特區的責任。香港在“港區國安法”後已訂明，香港公務員任職時，須依法簽署文件確認或者宣誓擁護香港基本法，效忠香港特區。本澳下一步宜研究完善公務人員的就職宣誓制度，進一步夯實愛國者治澳的根基。    夏耘,http://www.macaodaily.com/html/2024-02/29/content_1738187.htm,今次修訂《就職宣誓法》，進一步完善相關程序規制，符合政治邏輯和倫理，確保澳門管治權牢牢掌握在堅定的愛國者手中，鞏固維護愛國者治澳的良好局面，從而有效維護國家安全利益，履行特區憲制責任,完善 法制   夯實 愛國者 治澳         《 就 職 宣誓 法 》 修訂案 昨獲 立法 會 全體 會議 全票 一般性 通過 。 法案 建議 新增 行政 長 官選 舉委員會 委員作 為 宣誓 主體 ， 增訂 相應 誓詞 ； 增加 以 簽署 聲明 作出 誓詞 的 宣誓 方式 ； 完善 宣誓 行為 的 要求 及 監誓 制度 ， 規定 若 宣誓 人 故意 宣讀 與 法定 誓詞 不 一致 的 內容 或 簽署經 篡改 相關 誓詞 的 聲明書 ， 又 或 以 任何 不真 誠 、 不莊重 的 方式 宣誓 ， 將視 為 拒絕 宣誓 。         澳門 特區 負有 維護國家 安全 和 社會 穩定 的 憲制 責任 ， 居民 也 承擔 相應 的 責任 和 義務 。 施政 報告 提到 ， 特區 政府 將以 更 高 的 政治 站位 、 更強 的 責任 擔當 ， 堅定 不移 貫徹 總體 國家 安全 觀 ， 堅定 維護國 家主 權 、 安全 、 發展 利益 ， 堅決 防範 和 遏制 外部 勢力 干 預澳門 事務 ， 堅決 打擊 任何 勢力 利用 澳門 危害 國家 安全 。 推動 全體 公務人員 和 澳門 社會 各界 ， 切實 增強 維護國安 的 意識 、 提升 維護國安 的 能力 、 確保維護 國安 的 成效 ， 牢牢 守住 “ 澳門 不能 亂 ” 的 底線 。         澳門 特區 維護國家 安全 的 法律 制度 日臻完善 ， 執行 機制 不斷 完善 。 近 一年 來 先 後 完成 並 生效 實施 新 修訂 的 《 維護國家 安全法 》 、 《 行政 長 官選 舉法 》 修訂案 、 《 保守 國家 秘密 法 》 ； 《 立法 會選 舉法 》 修訂案 已 進入 細審階段 。 系列 法律 法規 共同 構成 系統 的 法律 體系 ， 為維護 國家 安全 提供 堅實 的 法治 保障 ， 總體 國家 安全 觀 和 “ 愛國者 治澳 ” 原則 進 一步 貫徹 落實 。         行政 長 官選 舉委員會 ， 負責 提名 及 選舉 特首 ， 站位 高 、 責任 重 。 今次 修訂 《 就 職 宣誓 法 》 ， 進 一步 完善 相關 程序 規制 ， 符合 政治 邏輯 和 倫理 ， 確保 澳門 管治 權 牢牢 掌握 在 堅定 的 愛國者 手中 ， 鞏固維護 愛國者 治澳 的 良好 局面 ， 從 而 有效 維護國家 安全 利益 ， 履行 特區 憲制 責任 。         按照 授權 原則 ， 行政 機關 中 的 一般 公務人員 ， 其實 都 參 與 了 行使 憲法 和 基本法 授予 的 相關 職權 ， 也 均 須承擔 對 國家 和 澳門 特區 的 責任 。 香港 在 “ 港區 國安法 ” 後 已 訂明 ， 香港 公務員任 職時 ， 須 依法 簽署 文件 確認 或者 宣誓 擁護 香港基本法 ， 效忠 香港 特區 。 本澳下 一步 宜 研究 完善 公務人員 的 就 職 宣誓 制度 ， 進 一步 夯實 愛國者 治澳 的 根基 。         夏耘,2024-02-29
周末最低降至十度,周末最低降至十度    【本報消息】氣象局預料東北季風補充今晚開始影響本澳，屆時北風將顯著增強，周末期間最低氣溫將下降至十度左右，天氣寒冷及有幾陣雨，展望下周初氣溫回升。請居民留意天氣變化，注意保暖。    今日大致多雲，有幾陣雨，日間有薄霧，吹三級東北風，後轉四至五級偏北風及有陣風，氣溫攝氏十三至十八度，相對濕度為百分之七十五至九十五。    路邊、一般性地區、高密度住宅區空氣質量水平普通，沿海地區吹三至五級北至東北風及有陣風，視野微弱至平常。    預測明日天氣寒冷，多雲，有幾陣雨，吹四至五級偏北風及有陣風，氣溫攝氏十一至十五度，相對濕度為百分之六十至九十五。    昨日大致多雲，吹三至四級北至東北風，氣溫為攝氏十四至十八度，相對濕度介乎百分之六十九至八十四。昨日錄得最高紫外線指數約為三點二，平均為一點二，強度屬於低。,http://www.macaodaily.com/html/2024-02/29/content_1738188.htm,今日大致多雲，有幾陣雨，日間有薄霧，吹三級東北風，後轉四至五級偏北風及有陣風，氣溫攝氏十三至十八度，相對濕度為百分之七十五至九十五,周末 最低 降 至 十度         【 本報 消息 】 氣象局 預料 東北季 風補充 今晚 開始 影響 本澳 ， 屆 時 北風將 顯著 增強 ， 周 末期 間 最低 氣溫將 下降 至 十度 左右 ， 天氣 寒冷 及 有 幾陣雨 ， 展望 下 周初 氣溫 回升 。 請 居民 留意 天氣 變化 ， 注意 保暖 。         今日 大致 多 雲 ， 有 幾陣雨 ， 日間 有 薄霧 ， 吹三級 東北風 ， 後轉 四至 五級 偏北 風及 有 陣風 ， 氣溫 攝氏 十三 至 十八 度 ， 相對 濕度 為 百分之七十五 至 九 十五 。         路邊 、 一般性 地區 、 高密度 住宅 區空氣 質量 水平 普通 ， 沿海 地區 吹 三至 五級 北至 東北風 及 有 陣風 ， 視野 微弱 至 平常 。         預測 明日 天氣 寒冷 ， 多 雲 ， 有 幾陣雨 ， 吹 四至 五級 偏北 風及 有 陣風 ， 氣溫 攝氏 十一 至 十五 度 ， 相對 濕度 為 百分之六十 至 九 十五 。         昨日 大致 多 雲 ， 吹三至 四級 北至 東北風 ， 氣溫 為 攝氏 十四 至 十八 度 ， 相對 濕度 介乎 百分之六十 九至 八十四 。 昨日 錄得 最高 紫外 線 指數 約 為 三點 二 ， 平均 為 一點 二 ， 強度屬 於 低 。,2024-02-29
街總兒青服務聚焦身心健康,街總兒青服務聚焦身心健康    去年各單位活動班組逾七十三萬人次參與    疫情後，兒童及青少年或需重新適應學習環境、人際社交和成長發展，街總屬下兒青服務持續關注兒童及青少年身心發展和情緒健康，開展親職教育、公民教育、藝術展覽、音樂會等多元化活動，培育和啟發兒童及青少年發展，提升自我、發揮潛能。    去年，各單位共舉辦一萬二千四百五十五次活動、三萬四千三百六十六次班組及興趣班，達七十三萬五千二百四十七人次參與。    街總兒青服務成員分別有街總社會服務辦公室服務副總監張婉思、協調主任周遠恩、小海燕托兒所主任錢正麗、孟智豪夫人托兒所主任梁泳芝、社區青年服務隊隊長江永泰、學生輔導服務主任陳啓榮、青少年及家庭綜合服務中心兼公民教育中心主任黃曉聰、栢蕙活動中心主任甄慶華、藝駿中心主任孫正琪、迎聚點助理主任鍾艷麗。    優化托所工作    其中，托兒所服務方面，街總屬下四所托兒所共提供六百四十二個托額。為確保服務質素，持續優化工作指引，以及為職工提供一系列在職培訓，藉此增進照顧嬰幼兒知識，務求提供安全和舒適的環境予入托嬰幼兒。    培養公民意識    公民教育中心續辦“樂聚公民”親子公民教育工作坊、親子義工服務等，讓學生認識公民義務及責任，培養參與社會意識；栢蕙活動中心首次與澳門栢蕙青年義務工作者協會主辦，37度藝文合作社協辦《37℃ Summer夏日音樂會》，為本地文化創意與表演藝術愛好者帶來演出機會。    推文體藝計劃    永利澳門冠名贊助的“澳門青少年文體藝孵化計劃”，設有“青少年學費津貼計劃”，至今超過一千名合資格學生接受津貼資助。去年，開展的第二階段申請共推出一千個名額，希望持續培養青少年文化、體育、藝術類興趣。,http://www.macaodaily.com/html/2024-02/29/content_1738191.htm,街總兒青服務聚焦身心健康    去年各單位活動班組逾七十三萬人次參與    疫情後，兒童及青少年或需重新適應學習環境、人際社交和成長發展，街總屬下兒青服務持續關注兒童及青少年身心發展和情緒健康，開展親職教育、公民教育、藝術展覽、音樂會等多元化活動，培育和啟發兒童及青少年發展，提升自我、發揮潛能,街 總兒 青服務 聚焦 身心健康         去年 各 單位 活動班組 逾 七十三 萬 人次 參與         疫情 後 ， 兒童 及 青少年 或 需 重新 適應 學習 環境 、 人際 社交 和 成長 發展 ， 街 總屬 下兒 青 服務持續 關注兒 童及 青少年 身心 發展 和 情緒 健康 ， 開展 親職 教育 、 公民 教育 、 藝術 展覽 、 音樂會 等 多元化 活動 ， 培育 和 啟發兒 童及 青少年 發展 ， 提升 自我 、 發揮 潛能 。         去年 ， 各單 位共舉 辦一萬 二千 四百五十 五次 活動 、 三萬 四千 三百六十 六次 班 組及 興趣 班 ， 達 七十三 萬 五千 二百四十 七 人次 參與 。         街 總兒 青服務 成員 分別 有 街 總 社會 服務辦 公室 服務 副 總監 張婉思 、 協調 主任 周遠恩 、 小 海燕 托兒 所 主任 錢 正麗 、 孟智豪 夫人 托兒 所 主任 梁泳芝 、 社區 青年 服務隊 隊長 江 永泰 、 學生 輔導 服務 主任 陳 啓 榮 、 青少年 及 家庭 綜合 服務 中心 兼 公民 教育 中心 主任 黃 曉聰 、 栢 蕙 活 動 中心 主任 甄慶華 、 藝駿 中心 主任 孫正琪 、 迎聚點 助理 主任 鍾 艷麗 。         優化托 所 工作         其中 ， 托兒 所服 務 方面 ， 街 總屬 下 四所 托兒 所 共 提供 六百 四十二 個托額 。 為 確保 服務質素 ， 持續 優化 工作 指引 ， 以及 為 職工 提供 一系列 在 職培訓 ， 藉此 增進 照顧 嬰幼兒 知識 ， 務求 提供 安全 和 舒適 的 環境予 入托 嬰幼兒 。         培養 公民 意識         公民 教育 中心 續辦 “ 樂聚 公民 ” 親子 公民 教育 工作坊 、 親子 義工 服務 等 ， 讓 學生 認識 公民 義務及 責任 ， 培養 參與 社會 意識 ； 栢 蕙 活 動 中心 首次 與 澳 門 栢 蕙 青年 義務 工作者 協會 主辦 ， 37 度藝文 合作社 協辦 《 37 ℃   Summer 夏日 音樂會 》 ， 為 本地 文化 創意 與 表演 藝術 愛好者 帶來 演出 機會 。         推文體 藝計劃         永利 澳門 冠名 贊助 的 “ 澳門 青少年 文體藝 孵化 計劃 ” ， 設有 “ 青少年 學費津 貼 計劃 ” ， 至今 超過 一千名 合資格 學生 接受 津貼 資助 。 去年 ， 開展 的 第二 階段 申請 共 推出 一千 個 名額 ， 希望 持續 培養 青少年 文化 、 體育 、 藝術類 興趣 。,2024-02-29
