Title,Content,Link,Summary,Preprocessed_Content,Date
停車場電摩托失火焚燬,兩月內第二宗惹關注    停車場電摩托失火焚燬    【本報消息】氹仔中央公園停車場昨日凌晨有電動電單車起火，管理員見狀以滅火筒將火撲熄，消防及警員接報到場跟進。消防經調查，初步懷疑是電線短路起火，事件中無人受傷。    疑電線短路釀火警    昨日凌晨三時半許，氹仔中央公園停車場電動電單車停泊區內，一輛疑充電中的電單車突然冒煙起火，消防警報響起，並觸發消防灑水系統。管理員聞訊趕至，用滅火筒將火撲熄，報警處理。消防員及警員趕抵現場，電單車火勢已被救熄，消防員繼續射水降溫。涉事電動電單車的車頭儀錶、頭盔及車尾等燒燬，現場天花被燻黑。車主隨後被通知到場了解。消防經調查，初步懷疑是電線短路所致，確切起因待查。    這是兩個月內第二宗涉及電動電單車的火警。六月二日凌晨，李寶椿街青洲坊大廈停車場內一輛電動電單車起火，波及附近停泊的另外兩車被熱熔。管理員用滅火筒將火救熄。消防同樣懷疑是充電線短路導致。    業者籲勿擅自改裝    有業者表示，目測肇事電動車疑被改裝過，包括更換了避震、貨架及增設附加物等。至於有否更換原裝電池，要檢測過才知道。呼籲電動車使用者切勿擅自更換原裝電池，畢竟原有系統及線路一旦被改動，分分鐘令電線破損。有人會在車輛前後安裝錄影設備，甚至增加照明系統，都會增加車輛的電能負荷，衍生安全隱患。近期天氣持續酷熱，基於地庫停車場較難散熱，建議車主將電動電單車停泊在室內停車場時，不妨打開頭盔箱幫助散熱，減少意外發生的風險。,http://www.macaodaily.com/html/2024-08/07/content_1773142.htm,兩月內第二宗惹關注    停車場電摩托失火焚燬    【本報消息】氹仔中央公園停車場昨日凌晨有電動電單車起火，管理員見狀以滅火筒將火撲熄，消防及警員接報到場跟進,兩月 內 第二宗 惹 關注         停車 場電 摩托 失火 焚 燬         【 本報 消息 】 氹 仔 中央 公園 停車場 昨日 凌晨 有 電動電 單車 起火 ， 管理 員見 狀 以滅 火筒 將火 撲 熄 ， 消防 及 警員接 報到場 跟 進 。 消防 經調查 ， 初步 懷疑 是 電線 短路 起火 ， 事件 中無人 受傷 。         疑電線 短路 釀 火警         昨日 凌晨 三時 半許 ， 氹 仔 中央 公園 停車場 電動電 單車 停泊 區內 ， 一輛 疑充 電中 的 電單車 突然 冒煙 起火 ， 消防 警報 響起 ， 並觸 發 消防 灑 水系 統 。 管理 員聞訊 趕至 ， 用滅 火筒 將火 撲 熄 ， 報警 處理 。 消防 員及 警員 趕抵 現場 ， 電單 車火勢 已 被 救 熄 ， 消防 員繼續 射水 降溫 。 涉事 電動電 單車 的 車頭儀 錶 、 頭盔 及 車尾 等 燒 燬 ， 現場 天花 被 燻 黑 。 車主 隨後被 通知 到場 了解 。 消防 經調查 ， 初步 懷疑 是 電線 短路 所致 ， 確切 起因 待查 。         這是 兩個 月 內 第二宗 涉及 電動電 單車 的 火警 。 六月 二日 凌晨 ， 李寶椿街 青洲 坊 大廈 停車場 內 一輛 電動電 單車 起火 ， 波及 附近 停泊 的 另外 兩車 被 熱熔 。 管理 員用 滅火筒 將火救 熄 。 消防 同樣 懷疑 是 充電線 短路 導致 。         業者籲 勿 擅自 改裝         有業者 表示 ， 目測 肇事 電動 車疑 被 改裝過 ， 包括 更換 了 避震 、 貨架 及 增設 附加物 等 。 至於 有否 更換 原裝 電池 ， 要 檢測過 才 知道 。 呼籲 電動車 使用者 切勿 擅自 更換 原裝 電池 ， 畢竟 原有 系統 及線 路 一旦 被 改動 ， 分分 鐘令 電線 破損 。 有人 會 在 車輛 前後安裝 錄影 設備 ， 甚至 增加 照明 系統 ， 都 會 增加 車輛 的 電能 負荷 ， 衍生 安全 隱患 。 近期 天氣 持續 酷熱 ， 基 於 地庫 停車場 較 難 散熱 ， 建議 車主將 電動電 單車 停泊 在 室 內 停車場 時 ， 不妨 打開頭 盔箱 幫 助散 熱 ， 減少 意外 發生 的 風險 。,2024-08-07
議員促嚴打違規改裝電動車,籲加快硏究規範室內充電範圍    議員促嚴打違規改裝電動車    【本報消息】氹仔中央公園停車場昨日有電動電單車懷疑因電線短路火警。立法議員、共建好家園協會副理事長馬耀鋒表示，近日接連發生電動車失火事件，引起社會關注電動車防火問題。促請當局加快硏究電動車停放充電範圍及規管室內充電，降低發生事故的風險。加強電動車違規改裝執法，完善前線人員的檢驗要求和指引，構建符合電動車普及發展的安全使用環境。    車輛密集增危險性    馬耀鋒表示，鋰電池燃燒時容易發生熱失控和放氧反應，導致火勢猛烈及爆炸，衍生的防火救火問題已受到國內外關注。是次事故因車輛停泊密度較低，且消防花灑及時啟動幸未蔓延。惟本澳大部分設有充電樁的公共停車場，普遍建於住宅樓宇內或附近，加上較密集的停泊模式，電動車一旦失火可能有較大的危險。    馬耀鋒過去曾多次質詢電動車消防安全，當局回覆時指出，現時《樓宇及場地防火安全的法律制度》已明確訂定包括停車場在內的特定樓宇及場地，應有一名經消防局適當培訓的防火安全負責人持續提供服務。二〇二一年至今已有超過一萬人修讀“防火安全負責人培訓課程”。此外，將聯同相關部門共同研究國家規管電動車停放充電範圍及室內充電的指引。馬耀鋒促請當局加快硏究規管指引，為電動車停泊及設置安全合理的充電空間間隔，減少意外的嚴重性和損失。    加強培訓專業檢測    是次事故與六月青洲坊大廈停車場的起火事件，同樣疑因電線短路引起，電動車零配件安全值得關注。馬耀鋒稱，有業界人士反映，現時本澳電動車改裝並不罕見，亦有車主會在網上購買非原裝的充電配件，可能導致電動車更易發生短路和自燃。電動車改裝多涉及內部零件，前線執法人員較難透過外觀及聲音判斷。建議當局加強前線驗車及執法人員的專業培訓，適時更新檢驗指引及要求，加強車主安全使用電動車的宣教，並配置必要的專業技術人員及儀器配合抽查，有效發現及打擊違規行為。,http://www.macaodaily.com/html/2024-08/07/content_1773143.htm,馬耀鋒過去曾多次質詢電動車消防安全，當局回覆時指出，現時《樓宇及場地防火安全的法律制度》已明確訂定包括停車場在內的特定樓宇及場地，應有一名經消防局適當培訓的防火安全負責人持續提供服務,籲 加快 硏 究 規 範 室 內 充 電 範 圍         議員 促嚴 打 違規 改裝 電動車         【 本報 消息 】 氹 仔 中央 公園 停車場 昨日 有 電動電 單車 懷疑 因電線 短路 火警 。 立法 議員 、 共建 好家園 協會 副 理事 長 馬 耀鋒 表示 ， 近日 接連 發生 電動車 失火 事件 ， 引起 社會 關注 電動車 防火 問題 。 促請 當局 加快 硏 究 電 動 車 停放 充電範圍 及 規管室 內 充電 ， 降低 發生 事故 的 風險 。 加強 電動車 違規 改裝 執法 ， 完善 前線 人員 的 檢驗 要求 和 指引 ， 構建 符合 電動車 普及 發展 的 安全 使用 環境 。         車輛 密集 增危險性         馬 耀鋒 表示 ， 鋰 電池 燃燒 時 容易 發生熱 失控 和 放氧反應 ， 導致 火勢 猛烈 及 爆炸 ， 衍生 的 防火 救火 問題 已 受到 國內外 關注 。 是 次 事故 因車輛 停泊 密度 較 低 ， 且 消防 花灑 及 時 啟動 幸未 蔓延 。 惟本澳 大部分 設有 充電樁 的 公共 停車場 ， 普遍 建 於 住宅 樓宇內 或 附近 ， 加上 較 密集 的 停泊 模式 ， 電動車 一旦 失火 可能 有 較 大 的 危險 。         馬 耀鋒過 去 曾多次 質詢 電動車 消防安全 ， 當局 回覆 時 指出 ， 現時 《 樓宇 及場 地 防火 安全 的 法律 制度 》 已明確 訂定 包括 停車場 在 內 的 特定 樓宇 及場 地 ， 應有 一名 經 消防局 適當 培訓 的 防火 安全 負責人 持續 提供 服務 。 二 〇 二 一年 至今已有 超過 一萬人 修讀 “ 防火 安全 負責人 培訓 課程 ” 。 此外 ， 將聯同 相關 部門 共同 研究 國家 規管 電動車 停放 充電範圍 及室 內 充電 的 指引 。 馬 耀鋒 促請 當局 加快 硏 究 規 管 指引 ， 為 電動車 停泊 及 設置 安全 合理 的 充電空間 間 隔 ， 減少 意外 的 嚴重性 和 損失 。         加強 培訓 專業 檢測         是 次 事故 與 六月 青洲 坊 大廈 停車場 的 起火 事件 ， 同樣 疑因 電線 短路 引起 ， 電動車 零配件 安全 值得 關注 。 馬 耀鋒 稱 ， 有業界 人士 反映 ， 現時本 澳電動車 改裝 並不罕見 ， 亦 有 車主會 在 網上 購買 非 原裝 的 充電 配件 ， 可能 導致 電動車 更易 發生 短路 和 自燃 。 電動車 改裝 多 涉及 內部 零件 ， 前線執 法人 員較 難 透過 外觀 及 聲音 判斷 。 建議 當局 加強 前線驗車 及執 法人 員 的 專業 培訓 ， 適時 更新 檢驗 指引 及 要求 ， 加強 車主 安全 使用 電動車 的 宣教 ， 並 配置 必要 的 專業 技術 人員及 儀器 配合 抽查 ， 有效 發現 及 打擊 違規行 為 。,2024-08-07
團體籲優化充電位消防設施,團體籲優化充電位消防設施    【本報消息】氹仔中央公園停車場昨晨有電動電單車充電期間起火燒燬，天花亦被燻黑，幸駐場人員在消防員到場前已將火撲熄。氹仔社區發展促進會副會長林家全、街總氹仔社區中心社工黃嘉橋讚揚管理公司反應迅速，把影響減至最低。促請當局優化停車場充電位的消防設施，並加強宣講，提高車主的安全意識。    加強管理人員培訓    青洲坊大廈停車場六月曾發生懷疑電動車自燃事件。隨着越來越多人選用電動車，電動車的安全意識和常識有必要提高，駕駛者和場所管理者都要格外小心。政府轄下的公共停車場皆設有消防系統，充電櫃及充電泊位旁亦配備符合消防規格的滅火筒。兩團體建議當局持續優化場內消防設施，尤要加強管理人員的培訓和危機意識，設立緊急處理機制。呼籲電動車駕駛者使用原廠合規格的充電設施，避免形成裝置過熱和損壞等風險。    設感溫鏡頭滅火毯    工程師陳桂舜指出，電器燒燬事故通常因設備過熱引起，長時間高溫悶熱後達到燃點。建議在停車場充電區域安裝智能溫度感測攝像機，這些設備已在內地廣泛使用。當充電器過熱時，溫度感測攝像機能透過紅外線感測到異常升溫，及時發出警報，通知停車場人員斷電，防患未然。鋰電池燒燬屬金屬類火警，有別於其他類型火警，建議引入鋰電池專用滅火毯。在火警發生時可以用滅火毯覆蓋火頭，阻止火勢蔓延。    他說，電動電單車改裝電池增加續航能力、使用非原廠充電器，或使用時遭受撞擊及電線磨損等，都是常見的意外原因，需要車主重視。隨着電動車輛在澳普及，應通過先進的感測設備及專用消防器材，顯著提升停車場的消防安全水平，降低事故風險。,http://www.macaodaily.com/html/2024-08/07/content_1773144.htm,團體籲優化充電位消防設施    【本報消息】氹仔中央公園停車場昨晨有電動電單車充電期間起火燒燬，天花亦被燻黑，幸駐場人員在消防員到場前已將火撲熄,團體籲 優化 充電位 消防 設施         【 本報 消息 】 氹 仔 中央 公園 停車場 昨晨 有 電動電 單車 充電期 間 起火 燒 燬 ， 天花 亦 被 燻 黑 ， 幸駐場 人員 在 消防 員到 場前 已 將火 撲 熄 。 氹 仔社區 發展 促進會 副 會長 林家 全 、 街 總 氹 仔社區 中心 社工 黃 嘉 橋 讚 揚 管理 公司 反應 迅速 ， 把 影響 減至 最低 。 促請 當局 優化 停車場 充電位 的 消防 設施 ， 並加強 宣講 ， 提高 車主 的 安全 意識 。         加強 管理 人員 培訓         青洲 坊 大廈 停車場 六月 曾 發生 懷疑 電動車 自燃 事件 。 隨着 越來 越多人 選用 電動車 ， 電動車 的 安全 意識 和 常識 有 必要 提高 ， 駕駛者 和場 所 管理者 都 要 格外 小心 。 政府 轄 下 的 公共 停車場 皆 設有 消防 系統 ， 充電櫃 及 充電 泊位 旁 亦 配備 符合 消防 規格 的 滅火筒 。 兩團體 建議 當局 持續 優化場 內 消防 設施 ， 尤要 加強 管理 人員 的 培訓 和 危機 意識 ， 設立 緊急 處理 機制 。 呼籲 電動車 駕駛者 使用 原廠 合規格 的 充電 設施 ， 避免 形成 裝置 過熱 和 損壞 等 風險 。         設感 溫鏡 頭滅 火毯         工程 師陳桂舜 指出 ， 電器 燒 燬 事故 通常 因設備 過熱 引起 ， 長 時間 高 溫悶 熱後達 到 燃點 。 建議 在 停車場 充電區域 安裝 智能 溫度 感測 攝像機 ， 這些 設備 已 在 內 地廣泛 使用 。 當充 電器 過熱時 ， 溫度 感測 攝像 機能 透過 紅外線 感測 到 異常升溫 ， 及 時發 出警 報 ， 通知 停車場 人員斷電 ， 防患未然 。 鋰 電池 燒 燬 屬 金 屬 類 火警 ， 有別 於 其他 類型 火警 ， 建議 引入 鋰 電池 專用 滅火毯 。 在 火警 發生 時 可以 用滅 火毯 覆蓋 火頭 ， 阻止 火勢 蔓延 。         他 說 ， 電動電 單車 改裝 電池 增加 續航 能力 、 使用 非原廠 充電器 ， 或 使用 時 遭受 撞擊 及 電線 磨損 等 ， 都 是 常見 的 意外 原因 ， 需要 車主 重視 。 隨着 電動 車輛 在 澳 普及 ， 應通過 先進 的 感測 設備 及 專用 消防器材 ， 顯著 提升 停車場 的 消防安全 水平 ， 降低 事故 風險 。,2024-08-07
大廈外牆紙皮石剝落毀路邊車,大廈外牆紙皮石剝落毀路邊車    【本報消息】俾利喇街近羅利老馬路交界一大廈外牆昨日下午疑有紙皮石剝落墮街，擊毀停泊咪錶位的私家車尾擋風玻璃，事件中無人受傷。消防員、治安警及工務局人員接報到場處理。    消防及治安警昨日下午近四時先後接報，俾利喇街近羅利老馬路交界疑有石屎剝落損壞車輛事件，立即派員到場。現場所見，一輛停泊在咪錶位的私家車尾擋風玻璃碎裂，車頂及車頭等位置遺留一些疑是紙皮石。消防員進入某大廈一單位露台察看，以確定紙皮石剝落位置。隨後，工務局人員到場跟進事件。,http://www.macaodaily.com/html/2024-08/07/content_1773145.htm,大廈外牆紙皮石剝落毀路邊車    【本報消息】俾利喇街近羅利老馬路交界一大廈外牆昨日下午疑有紙皮石剝落墮街，擊毀停泊咪錶位的私家車尾擋風玻璃，事件中無人受傷,大廈 外牆 紙皮石 剝落 毀路 邊車         【 本報 消息 】 俾利 喇街 近羅利 老馬路 交界 一大 廈外 牆 昨日 下午 疑有 紙皮石 剝落 墮 街 ， 擊毀 停泊 咪 錶 位 的 私家 車尾 擋 風 玻璃 ， 事件 中無人 受傷 。 消防 員 、 治安警 及 工務局 人員接 報到場 處理 。         消防 及 治安警 昨日 下午 近四時 先後接 報 ， 俾利 喇街 近羅利 老馬路 交界 疑有 石屎 剝落 損壞 車輛 事件 ， 立即 派員 到場 。 現場 所見 ， 一輛 停泊 在 咪 錶 位 的 私家 車尾 擋 風 玻璃 碎裂 ， 車頂 及 車頭 等 位置 遺留 一些 疑是 紙皮石 。 消防 員 進入 某大廈 一 單位 露台 察看 ， 以 確定 紙皮石 剝落 位置 。 隨後 ， 工務局 人員 到場 跟 進 事件 。,2024-08-07
工商金融界候選選委具代表性,近四成首次參選年輕化    工商金融界候選選委具代表性    【本報消息】第六屆行政長官選舉委員會委員選舉於本月十一日舉行，工商金融界選委候選人昨辦競選宣傳會，工商金融界選委冀透過宣傳會加強交流，與該界別法人代表加深認識，分享對未來行政長官的期望及施政建議，呼籲法人選民當日踴躍投票。    競選宣傳會昨舉行    競選宣傳會昨日下午三時半假中華總商會大廈四樓何賢先生紀念堂舉行，由中華總商會理事長馬志毅主持，會上共有一百六十名有關法人代表出席，二十名工商金融界別選委候選人發言。    馬志毅表示，在工商金融界別的一百二十名合資格參選人中，首次參選的有三成八（四十六人），其中最年輕的只有三十二歲。他們多是來自不同行業的代表，也有不少是“一加四”產業的代表，體現工商界別參選人更具代表性、更年輕化。    發揮所長出謀獻策    選委們要弘揚“愛國愛澳”優良傳統，以新時代責任擔當精神，全面貫徹“愛國者治澳”根本原則，貢獻力量，把有澳門特色的“一國兩制”事業發展得更好。更要把握好橫琴粵澳深度合作區與澳門特區經濟適度多元化發展規劃所帶來的大量機遇，融入國家深化改革和推進中國式現代化。    作為工商金融界選委，應充分發揮自身所長，在目前經濟復甦不平均的環境下，要充分反映業界訴求，按實際情況有序轉型升級，以配合政府“走出去、引進來”政策，更要在各自領域內為特區政府出謀獻策，做好配合國內國際雙循環工作，使澳門經濟更適度多元發展。,http://www.macaodaily.com/html/2024-08/07/content_1773146.htm,近四成首次參選年輕化    工商金融界候選選委具代表性    【本報消息】第六屆行政長官選舉委員會委員選舉於本月十一日舉行，工商金融界選委候選人昨辦競選宣傳會，工商金融界選委冀透過宣傳會加強交流，與該界別法人代表加深認識，分享對未來行政長官的期望及施政建議，呼籲法人選民當日踴躍投票,近 四成 首次 參選年 輕化         工商 金融界 候選 選委具 代表性         【 本報 消息 】 第六 屆 行政 長 官選 舉委員會委員 選舉 於 本月 十一日 舉行 ， 工商 金融界 選委候 選人 昨辦 競選 宣傳會 ， 工商 金融界 選委冀 透過 宣傳會 加強 交流 ， 與 該界別 法人代表 加深 認識 ， 分享 對 未來 行政 長 官 的 期望 及 施政 建議 ， 呼籲 法人 選民當 日 踴躍 投票 。         競選 宣傳會 昨舉行         競選 宣傳會 昨日 下午 三時 半假 中華 總商會 大廈 四樓 何賢 先生 紀念堂 舉行 ， 由 中華 總商會 理事 長 馬 志毅 主持 ， 會上 共有 一百六十 名有關 法人代表 出席 ， 二十名 工商 金融界 別選委候 選人 發言 。         馬 志毅 表示 ， 在 工商 金融界 別 的 一百二十名 合資格 參選人 中 ， 首次 參選 的 有 三成 八 （ 四十六 人 ） ， 其中 最年 輕 的 只有 三十二 歲 。 他們 多 是 來 自 不同 行業 的 代表 ， 也 有 不少 是 “ 一加 四 ” 產業 的 代表 ， 體現 工商界 別 參選人 更具 代表性 、 更年 輕化 。         發揮 所長 出謀獻策         選委們 要 弘揚 “ 愛國 愛澳 ” 優良 傳統 ， 以新 時代責任 擔當 精神 ， 全面 貫徹 “ 愛國者 治澳 ” 根本 原則 ， 貢獻 力量 ， 把 有 澳門 特色 的 “ 一國 兩制 ” 事業 發展 得 更好 。 更要 把握 好 橫琴粵澳 深度 合作 區與 澳門 特區 經濟 適度 多元化 發展 規劃 所 帶 來 的 大量 機遇 ， 融入 國家 深化改革 和 推進 中國式 現代化 。         作為 工商 金融界 選委 ， 應 充分 發揮 自身 所長 ， 在 目前 經濟 復 甦 不 平均 的 環境 下 ， 要 充分反映 業界 訴求 ， 按 實際 情況 有序 轉型 升級 ， 以 配合 政府 “ 走 出去 、 引進 來 ” 政策 ， 更要 在 各自 領域 內為 特區 政府 出謀獻策 ， 做好 配合 國內 國際 雙循環 工作 ， 使 澳門 經濟 更 適度 多元 發展 。,2024-08-07
