Title,Content,Link,Summary,Preprocessed_Content,Date
今有驟雨雷暴,今有驟雨雷暴    【本報消息】氣象局預測一道低壓槽持續為本澳帶來不穩定天氣，預料今日有頻密驟雨及雷暴，間中雨勢較大及有強烈陣風，並可能造成水浸，居民出門前留意最新天氣資訊，並採取適當預防措施。    今日多雲，有驟雨及雨勢有時頗大，間中有雷暴，吹二至四級南至西南風及有陣風，氣溫攝氏二十二至二十五度，相對濕度為百分之八十至九十九。路邊、一般性地區、高密度住宅區空氣質量水平良好，沿海地區吹二至四級南至西南風及有陣風，視野微弱至平常。    預測明日大致多雲，間中有驟雨，有幾陣雷暴，吹二至四級南至東南風及有陣風，氣溫攝氏二十三至二十七度，相對濕度為百分之七十五至九十八。    昨日大致多雲，間中有驟雨及雷暴，氣溫攝氏二十二至二十五度，相對濕度百分之九十至九十八，昨日錄得最高紫外線指數約為二點五，平均為一，強度屬於低。,http://www.macaodaily.com/html/2024-04/23/content_1750212.htm,今日多雲，有驟雨及雨勢有時頗大，間中有雷暴，吹二至四級南至西南風及有陣風，氣溫攝氏二十二至二十五度，相對濕度為百分之八十至九十九,今有 驟雨 雷暴         【 本報 消息 】 氣象局 預測 一道 低壓 槽 持續 為 本 澳帶 來 不 穩定 天氣 ， 預料 今日 有 頻密 驟雨及 雷暴 ， 間 中雨 勢較 大及 有 強烈 陣風 ， 並 可能 造成 水浸 ， 居民 出門前 留意 最新 天氣 資訊 ， 並採取 適當 預防 措施 。         今日 多 雲 ， 有 驟雨及 雨勢 有 時 頗 大 ， 間 中 有 雷暴 ， 吹二至 四級 南至 西南 風及 有 陣風 ， 氣溫 攝氏 二十二 至 二十五 度 ， 相對 濕度 為 百分之八十 至 九十九 。 路邊 、 一般性 地區 、 高密度 住宅 區空氣 質量 水平 良好 ， 沿海 地區 吹二至 四級 南至 西南 風及 有 陣風 ， 視野 微弱 至 平常 。         預測 明日 大致 多 雲 ， 間 中 有 驟雨 ， 有 幾陣 雷暴 ， 吹二至 四級 南至 東南風 及 有 陣風 ， 氣溫 攝氏 二十三 至 二十七 度 ， 相對 濕度 為 百分之七十五 至 九十八 。         昨日 大致 多 雲 ， 間 中 有 驟雨及 雷暴 ， 氣溫 攝氏 二十二 至 二十五 度 ， 相對 濕度 百分之九十 至 九十八 ， 昨日 錄得 最高 紫外 線 指數 約 為 二點 五 ， 平均 為 一 ， 強度屬 於 低 。,2024-04-23
《未來的希望》招募青年演奏者,《未來的希望》招募青年演奏者    【本報消息】澳門樂團每個樂季都會舉行《未來的希望》音樂會，令大眾有機會了解本澳新一代的音樂造詣，創造展藝機會，讓年輕學子與澳門樂團的樂師們同場演奏，提升個人音樂水平。音樂會今年將於七月十三日舉行，並特別公開招募青年演奏者，期望能給予本澳學生及音樂愛好者一個全面參與職業樂團的體驗，為讓參加者有整套由考試至演出的實踐經驗，參加者需參與樂團遴選。    開放報名的樂器：長笛、雙簧管、單簧管 、巴松管、圓號 、小號、長號、大號、敲擊樂 、小提琴、中提琴 、大提琴、低音提琴。    報名要求：一、需持有澳門居民身份證（包括永久及非永久）或持有澳門大專院校、澳門教育及青年發展局發出之學生證；二、年滿十二歲或以上之學生或在職青年；三、必須擁有英國皇家音樂學院八級證書或以上。    下月中通知考核    招募計劃在本月廿六日中午十二時截止，詳情及報名方法，可點擊以下連結或進入澳門樂團網頁(https://www.om-macau.org/2024future_of_classical_music/)填寫及提交，遴選方式於五月內透過現場考核進行，合資格的報名者於五月十三日或之前獲澳門樂團以電郵方式通知考核詳情。,http://www.macaodaily.com/html/2024-04/23/content_1750213.htm,下月中通知考核    招募計劃在本月廿六日中午十二時截止，詳情及報名方法，可點擊以下連結或進入澳門樂團網頁(https://www.om-macau.org/2024future_of_classical_music/)填寫及提交，遴選方式於五月內透過現場考核進行，合資格的報名者於五月十三日或之前獲澳門樂團以電郵方式通知考核詳情,《 未來 的 希望 》 招募 青年 演奏者         【 本報 消息 】 澳門樂團 每個 樂季 都 會 舉行 《 未來 的 希望 》 音樂會 ， 令大眾 有 機會 了解 本 澳新 一代 的 音樂 造詣 ， 創造展 藝機會 ， 讓 年 輕學子 與 澳門樂團 的 樂師們 同場 演奏 ， 提升 個 人 音樂 水平 。 音樂會 今年 將於 七月 十三日 舉行 ， 並特別 公開 招募 青年 演奏者 ， 期望 能給 予本 澳學生 及 音樂 愛好者 一個 全面 參與 職業樂團 的 體驗 ， 為 讓 參加者 有 整套 由 考試 至 演出 的 實踐 經驗 ， 參加者 需參 與 樂團 遴選 。         開放 報名 的 樂器 ： 長 笛 、 雙 簧管 、 單 簧管   、 巴松管 、 圓號   、 小號 、 長號 、 大號 、 敲擊樂   、 小提琴 、 中提琴   、 大提琴 、 低音提琴 。         報名 要求 ： 一 、 需 持有 澳門 居民 身份 證 （ 包括 永久 及 非 永久 ） 或 持有 澳門 大專 院校 、 澳門 教育 及 青年 發展局 發出 之學 生證 ； 二 、 年 滿 十二 歲 或 以上 之學生 或 在 職 青年 ； 三 、 必須 擁有 英國 皇家 音樂學院 八級 證書 或 以上 。         下 月 中 通知 考核         招募 計劃 在 本月 廿六日 中午 十二 時 截止 ， 詳情 及 報名 方法 ， 可點擊 以下 連結 或 進入 澳門樂團 網頁 ( https : / / www . om - macau . org / 2024future _ of _ classical _ music / ) 填寫 及 提交 ， 遴選 方式 於 五月 內透過 現場 考核 進行 ， 合資格 的 報名者 於 五月 十三日 或 之前 獲澳門樂團 以電郵 方式 通知 考核 詳情 。,2024-04-23
運輸業冀嚴懲過界司機,運輸業冀嚴懲過界司機    【本報消息】河邊新街近凱泉灣附近路段日前發生貨車撞傷途人的交通意外，貨車司機涉嫌過職工作。貨車運輸業互助會理事長鄺熾明表示十分關注，冀當局加強執法，以保障本地司機就業。    本澳不時發生涉及過職司機的交通意外，因應交通運輸業有一定隱蔽性。鄺熾明表示，外僱過界工作、黑工司機等問題歷年屢禁不止，執法力度不足和處罰力度過低是重要原因，期望勞工事務局與治安警察局加強聯合執法，及時部署加強打擊過職過界和非法工作，嚴肅處理聘用過職或黑工司機的違法僱主，適時檢討和完善法律法規、提高刑責及宣傳教育，保障本澳職業司機的就業權益。,http://www.macaodaily.com/html/2024-04/23/content_1750214.htm,鄺熾明表示，外僱過界工作、黑工司機等問題歷年屢禁不止，執法力度不足和處罰力度過低是重要原因，期望勞工事務局與治安警察局加強聯合執法，及時部署加強打擊過職過界和非法工作，嚴肅處理聘用過職或黑工司機的違法僱主，適時檢討和完善法律法規、提高刑責及宣傳教育，保障本澳職業司機的就業權益,運輸業 冀 嚴懲 過界 司機         【 本報 消息 】 河邊 新街 近凱泉灣 附近 路段 日前 發生 貨車 撞 傷途 人 的 交通 意外 ， 貨車 司機 涉嫌 過職 工作 。 貨車 運輸業 互助 會 理事 長 鄺熾明 表示 十分 關注 ， 冀當局 加強 執法 ， 以 保障 本地 司機 就業 。         本澳 不時 發生 涉及 過職 司機 的 交通 意外 ， 因應 交通 運輸業 有 一定 隱蔽性 。 鄺熾明 表示 ， 外僱 過界 工作 、 黑工 司機 等 問題 歷年 屢禁 不止 ， 執法 力度 不足 和 處罰 力度 過低 是 重要 原因 ， 期望 勞 工事 務局 與 治安 警察局 加強 聯合 執法 ， 及時 部署 加強 打擊 過職 過界 和 非法 工作 ， 嚴肅 處理 聘用 過職 或 黑工 司機 的 違法 僱主 ， 適時 檢討 和 完善 法律 法規 、 提高 刑責及 宣傳 教育 ， 保障 本澳 職業 司機 的 就業 權益 。,2024-04-23
全城共讀日啟動禮改場地,全城共讀日啟動禮改場地    【本報消息】文化局訊：因應不穩定天氣，原定於今日上午十時在大三巴牌坊舉行的“四 · 二三澳門全城共讀日”暨系列活動啟動儀式，將更改至澳門文化中心於同一時間進行。,http://www.macaodaily.com/html/2024-04/23/content_1750215.htm,全城共讀日啟動禮改場地    【本報消息】文化局訊：因應不穩定天氣，原定於今日上午十時在大三巴牌坊舉行的“四 · 二三澳門全城共讀日”暨系列活動啟動儀式，將更改至澳門文化中心於同一時間進行,全城 共讀 日 啟動禮 改場 地         【 本報 消息 】 文化局 訊 ： 因應 不 穩定 天氣 ， 原定 於 今日 上午 十時 在 大三巴牌坊 舉行 的 “ 四   ·   二三 澳門 全城 共讀 日 ” 暨 系列 活動 啟動 儀式 ， 將 更改 至 澳門 文化 中心 於 同一 時間 進行 。,2024-04-23
益隆文創展覽館暫停開放,益隆文創展覽館暫停開放    【本報消息】文化局訊：文化局於今（廿三）日起對益隆炮竹廠舊址文創禮品店及展覽館開展屋頂修繕工程，因應施工需要及保障公眾安全。施工期間，文創禮品店及展覽館將暫停開放，工程預計五月下旬完成，期間益隆炮竹廠舊址照常開放，參觀時間不受影響。查詢可於辦公時間致電：二八三六 · 六三二○。,http://www.macaodaily.com/html/2024-04/23/content_1750216.htm,益隆文創展覽館暫停開放    【本報消息】文化局訊：文化局於今（廿三）日起對益隆炮竹廠舊址文創禮品店及展覽館開展屋頂修繕工程，因應施工需要及保障公眾安全,益隆文 創展覽館 暫停 開放         【 本報 消息 】 文化局 訊 ： 文化局 於 今 （ 廿三 ） 日起 對益隆 炮竹 廠 舊址 文創 禮品 店 及 展覽館 開展 屋頂 修繕 工程 ， 因應 施工 需要 及 保障 公眾 安全 。 施工期 間 ， 文創 禮品 店 及 展覽館 將暫 停 開放 ， 工程 預計 五月 下旬 完成 ， 期間 益隆 炮竹 廠 舊址 照常 開放 ， 參觀 時間 不受 影響 。 查詢 可 於 辦公時間 致電 ： 二八 三 六   ·   六三 二 ○ 。,2024-04-23
政發局冀創研會續積極獻策,政發局冀創研會續積極獻策    澳門創新發展研究會一行五人日前拜訪政發局，獲局長張作文、廳長阮建忠等接待。    會長林志軍匯報該會人員結構和會務運作。“澳門大健康產業發展策略研究”、“澳門文旅產業新拓展策略研究”等課題進展順利，有望年底推出研究報告，作為澳門回歸廿五周年學術獻禮。    副會長尹一橋關注澳門協和醫院成功落戶對大健康事業的推進。隨着國家區域醫療中心的建設，提升澳門醫療服務水平，亦為培養本地醫護專科人才發揮積極作用。理事長劉景松指出，澳門文旅產業具廣闊發展空間，可推廣紅色旅遊，發展海上旅遊。同時以文興旅、以旅興城，得天獨厚的世遺資源，由“文藝小城”加快打造“演藝之都”。    張作文讚賞該會成立以來取得的成績，不少建議被採納。未來可進一步發揮優勢，繼續將科研成果轉化為生產力。加強與政府部門、同行及大灣區相關機構合作，積極建言獻策。    秘書長余渭恆、常務理事劉明與會。,http://www.macaodaily.com/html/2024-04/23/content_1750137.htm,政發局冀創研會續積極獻策    澳門創新發展研究會一行五人日前拜訪政發局，獲局長張作文、廳長阮建忠等接待,政發局 冀創 研會續 積極獻策         澳門 創新 發展 研究 會 一行 五人 日前 拜訪 政發局 ， 獲局 長 張 作文 、 廳長 阮建忠 等 接待 。         會長 林志軍匯 報該 會 人員 結構 和 會務運作 。 “ 澳門 大 健康 產業 發展 策略 研究 ” 、 “ 澳門文 旅產業 新 拓展 策略 研究 ” 等 課題 進展 順利 ， 有望 年底 推出 研究 報告 ， 作為 澳門 回歸 廿五 周年 學術獻禮 。         副會長 尹一橋 關注 澳門協 和 醫院 成功 落戶 對 大 健康 事業 的 推進 。 隨着 國家區域 醫療 中心 的 建設 ， 提升 澳門 醫療 服務 水平 ， 亦 為 培養 本地 醫護 專科 人才 發揮 積極 作用 。 理事 長 劉景松 指出 ， 澳門文 旅產業 具廣闊 發展 空間 ， 可 推廣紅色 旅遊 ， 發展 海上 旅遊 。 同時 以文興 旅 、 以 旅興城 ， 得天 獨厚 的 世 遺資源 ， 由 “ 文藝 小城 ” 加快 打造 “ 演藝 之 都 ” 。         張 作文 讚 賞 該 會 成立 以來 取得 的 成績 ， 不少 建議 被 採納 。 未來 可進 一步 發揮 優勢 ， 繼續將 科研成果 轉化 為 生產力 。 加強 與 政府 部門 、 同行 及大灣區 相關 機構 合作 ， 積極 建言 獻策 。         秘書長 余渭恆 、 常務 理事 劉明 與 會 。,2024-04-23
摩托車聯會七周年聯歡,摩托車聯會七周年聯歡    澳門摩托車活動聯會前晚假凱旋門酒店凱旋軒舉行慶祝成立七周年會慶聯歡，賓主歡聚一堂，場面熱鬧。負責人表示，該會將堅持創會宗旨，為電單車愛好者開拓更多安全玩樂空間，推動電單車安全騎行，以及加強與外地交流學習，宣傳澳門。    儀式於前晚八時舉行，澳區全國人大代表何敬麟，議員高天賜，議員梁安琪代表林淑源，體育委員鄭國恆、趙文杜，以及内地、港澳台嘉賓出席。創會會長鄧君發、會長黃志順、常務副會長趙崇明分別致辭。黃志順表示，去年十月該會斥資籌辦一所會員中心，除方便會務工作，更為會員提供聚會、開會，電單車清洗及輕度維修服務等。未來，該會將續堅持創會宗旨，穩中求新、穩中求發展。    隨後，該會負責人分別向永遠榮譽會長、榮譽會長、名譽會長頒發聘書。,http://www.macaodaily.com/html/2024-04/23/content_1750138.htm,負責人表示，該會將堅持創會宗旨，為電單車愛好者開拓更多安全玩樂空間，推動電單車安全騎行，以及加強與外地交流學習，宣傳澳門,摩托 車聯會 七周年 聯歡         澳門 摩托 車活動 聯會 前晚 假凱 旋門 酒店 凱旋軒 舉行慶祝 成立 七周年 會慶 聯歡 ， 賓主歡 聚 一堂 ， 場面 熱鬧 。 負責人 表示 ， 該會將 堅持 創會 宗旨 ， 為電 單車 愛好者 開拓 更 多 安全 玩樂 空間 ， 推動電 單車 安全 騎行 ， 以及 加強 與 外地 交流 學習 ， 宣傳 澳門 。         儀式 於 前 晚八時 舉行 ， 澳區 全國 人大代表 何敬麟 ， 議員 高天 賜 ， 議員 梁安琪 代表 林淑源 ， 體育委員 鄭國恆 、 趙 文杜 ， 以及 内地 、 港澳台 嘉賓 出席 。 創會會長 鄧君發 、 會長 黃 志順 、 常務 副 會長 趙 崇明 分別 致辭 。 黃 志順 表示 ， 去年 十月 該會斥 資籌辦 一所 會員 中心 ， 除 方便 會務 工作 ， 更為 會員 提供 聚會 、 開會 ， 電單車 清洗 及輕度 維修 服務 等 。 未來 ， 該會 將續 堅持 創會 宗旨 ， 穩中 求新 、 穩中求 發展 。         隨後 ， 該會 負責人 分別 向 永遠榮 譽會長 、 榮譽 會長 、 名譽 會長 頒 發聘書 。,2024-04-23
街總新濠為長者拍婚紗照,街總新濠為長者拍婚紗照    由街坊總會長者關懷服務網絡、新濠博亞娛樂、博菲婚紗、拾月婚慶策劃合辦的新濠“小善大愛”之小夢想 · 傳愛心：“永恆的愛”家庭留影活動日前在新濠影匯舉行。    街總社工劉姑娘表示，活動以幫助長者圓夢為目的，組織二十名義工及工作人員，免費為十名六十五歲以上殘疾獨居長者家團化妝，提供服裝，拍攝家庭照。期望透過是次活動，鼓勵家庭成員之間的連結和支持，喚起社會對殘疾長者及其家人的關注和關愛。    參加者歐婆婆稱，感恩是次機會讓自己終於能穿上婚紗，與丈夫拍照留念。另一名參加者朱婆婆稱丈夫很早便離世，子女一直忙於工作，很少聚在一起。現有機會穿上婚紗與家人正式合影留念，減少內心遺憾，感到開心和滿足。,http://www.macaodaily.com/html/2024-04/23/content_1750139.htm,街總新濠為長者拍婚紗照    由街坊總會長者關懷服務網絡、新濠博亞娛樂、博菲婚紗、拾月婚慶策劃合辦的新濠“小善大愛”之小夢想 · 傳愛心：“永恆的愛”家庭留影活動日前在新濠影匯舉行,街 總新濠 為 長 者 拍 婚紗照         由 街坊 總會長 者 關懷 服務 網絡 、 新濠 博亞 娛樂 、 博菲 婚紗 、 拾 月 婚慶策 劃合辦 的 新 濠 “ 小善 大愛 ” 之小夢想   ·   傳愛心 ： “ 永恆 的 愛 ” 家庭 留影 活動 日前 在 新 濠 影匯 舉行 。         街 總 社工 劉 姑娘 表示 ， 活動 以 幫助長 者 圓夢為 目的 ， 組織 二十名 義工及 工作 人員 ， 免費 為 十名 六十五 歲 以上 殘疾 獨居長 者 家 團化妝 ， 提供 服裝 ， 拍攝 家庭 照 。 期望 透過 是 次 活動 ， 鼓勵 家庭 成員之間 的 連結 和 支持 ， 喚起 社會 對 殘疾長 者 及其 家人 的 關注 和 關愛 。         參加者 歐 婆婆 稱 ， 感恩 是 次 機會 讓 自己 終於能 穿 上 婚紗 ， 與 丈夫 拍照 留念 。 另一名 參加者 朱 婆婆 稱 丈夫 很早 便 離世 ， 子女 一直 忙 於 工作 ， 很少 聚在一起 。 現有 機會 穿 上 婚紗 與 家人 正式 合影留念 ， 減少 內心 遺憾 ， 感到 開心 和 滿足 。,2024-04-23
星聲相識工作坊教聲線運用,星聲相識工作坊教聲線運用    澳門司儀及主持人協會主辦、教青局資助的“港澳業界交流及學習培訓——TVB資深配音員郭立文與您‘星聲相識’”工作坊前日舉行。活動邀請香港資深配音員及聲調導師郭立文指導，著名的粵語配音作品有耳熟能詳的多啦A夢角色，具三十年豐富業內經驗。    協會會長周啓陽表示，是次培訓共有廿四名來自不同業界人士參與，除主要來自司儀及主持人業界，還有教師及銷售從業員等。    活動籌委會主席余佩欣稱，相信透過學習如何運用聲線，定能提升行業素質及水平，為澳門培育更多專業司儀及主持人。    學員表示培訓互動性高，並提供個別化指導，協助掌握省力發聲的秘訣，並提升聲線運用，內容實用。,http://www.macaodaily.com/html/2024-04/23/content_1750140.htm,星聲相識工作坊教聲線運用    澳門司儀及主持人協會主辦、教青局資助的“港澳業界交流及學習培訓——TVB資深配音員郭立文與您‘星聲相識’”工作坊前日舉行,星聲 相識 工作坊 教聲線 運用         澳門司 儀及 主持人 協會 主辦 、 教青局 資助 的 “ 港澳 業界 交流 及學習 培訓 — — TVB 資深 配音 員 郭立文 與 您 ‘ 星聲 相識 ’ ” 工作坊 前日 舉行 。 活動 邀請 香港 資深 配音 員及 聲 調導師 郭立文 指導 ， 著名 的 粵語 配音 作品 有 耳熟 能詳 的 多 啦 A 夢 角色 ， 具 三十年 豐富業 內 經驗 。         協會會長 周 啓 陽 表示 ， 是 次 培訓 共有 廿四 名來 自 不同 業界 人士 參與 ， 除 主要 來 自司 儀及 主持人 業界 ， 還有 教師 及 銷售 從業員 等 。         活動 籌委會 主席 余佩欣稱 ， 相信 透過 學習 如何 運用 聲線 ， 定 能 提升 行業 素質 及 水平 ， 為 澳門 培育 更多 專業司 儀及 主持人 。         學員 表示 培訓 互動性 高 ， 並 提供 個 別化 指導 ， 協助 掌握 省力 發聲 的 秘訣 ， 並 提升 聲線 運用 ， 內容 實用 。,2024-04-23
教局冀澳大校友會助防騙,教局冀澳大校友會助防騙    為加強合作及匯報新屆會務工作，澳門大學校友會由主席區秉光、副主席梁錦瓊率領下，日前拜訪教青局，獲學生廳長陳旭偉、職務主管洪慧敏等接待。    區秉光表示，藉着雙慶年校友會將組織多項大型活動，為校友及在讀高校學生提供國際交流互動平台，並配合政府在“體育+旅遊”政策發展，期望教青局繼續支持及指導該會相關工作。    陳旭偉表示，在雙慶年間，期望各校友組織能發揮所長，組織不同活動支持政府節慶工作。當局將一如既往盡力協調及支持各項活動開展。此外，近年高校學生網上受騙情況嚴重，冀校友會能關注在讀學生，多加輔導及宣揚政府提供的防騙訊息，防患未然。    校友會理事長葛萬金、副理事長吳焯峰及楊嘉偉等出席。,http://www.macaodaily.com/html/2024-04/23/content_1750141.htm,區秉光表示，藉着雙慶年校友會將組織多項大型活動，為校友及在讀高校學生提供國際交流互動平台，並配合政府在“體育+旅遊”政策發展，期望教青局繼續支持及指導該會相關工作,教局 冀澳大 校友 會助 防騙         為 加強 合作 及 匯報 新屆 會務 工作 ， 澳門 大學 校友 會 由 主席 區秉光 、 副 主席 梁錦瓊率 領下 ， 日前 拜訪 教青局 ， 獲學 生廳 長 陳 旭偉 、 職務 主管 洪慧敏 等 接待 。         區秉光 表示 ， 藉 着 雙慶年 校友 會將 組織 多項 大型 活動 ， 為 校友 及 在 讀 高校 學生 提供 國際 交流 互動 平台 ， 並 配合 政府 在 “ 體育 + 旅遊 ” 政策 發展 ， 期望 教青局 繼續 支持 及 指導 該會 相關 工作 。         陳旭偉 表示 ， 在 雙慶年 間 ， 期望 各 校友 組織 能 發揮 所長 ， 組織 不同 活動 支持 政府 節慶 工作 。 當局將 一如既往 盡力 協調 及 支持 各項 活動 開展 。 此外 ， 近年 高校 學生 網上 受騙 情況 嚴重 ， 冀 校友 會能 關注 在 讀學生 ， 多加 輔導及 宣揚 政府 提供 的 防騙訊息 ， 防患未然 。         校友 會 理事 長 葛萬金 、 副 理事 長 吳焯峰 及 楊嘉偉 等 出席 。,2024-04-23
廣告學會考察肇慶文旅,廣告學會考察肇慶文旅    澳門廣告學會一行廿五人本月二十、廿一日前往大灣區肇慶市考察，探討兩地文化旅遊發展與合作。考察團由該會會長胡錦漢帶領。活動獲澳門基金會贊助。    一行到訪肇慶學院旅遊和歷史文化學院，與院長李朝軍、肇慶青年聯合會主席歐景龍就兩地文旅推廣合作議題交流。會上，胡錦漢主講《澳門文化旅遊的城巿形象》。    一行並參觀肇慶巿博物館、鼎湖山牌坊以及皇禮城裹蒸粽運營中心等，了解當地廣告業和文旅產業發展現況，並在運營中心現場觀摩銷售員線上直播售賣產品實況。    胡錦漢總結稱，大灣區建設為澳門廣告業和文旅產業提供更多發展機遇，多重政策和項目相互配合，對業界人士進入灣區發展有更大便捷性。,http://www.macaodaily.com/html/2024-04/23/content_1750142.htm,廣告學會考察肇慶文旅    澳門廣告學會一行廿五人本月二十、廿一日前往大灣區肇慶市考察，探討兩地文化旅遊發展與合作,廣告 學會 考察 肇慶文 旅         澳門 廣告 學會 一行 廿五 人 本月 二十 、 廿一日 前往 大灣區 肇慶市 考察 ， 探討 兩地 文化 旅遊 發展 與 合作 。 考察 團由該 會會長 胡錦漢 帶領 。 活動 獲澳門 基金 會 贊助 。         一行 到 訪肇慶學院 旅遊 和 歷史 文化 學院 ， 與 院長 李朝 軍 、 肇慶 青年 聯合會 主席 歐景龍 就 兩地 文旅 推廣 合作 議題 交流 。 會上 ， 胡錦漢主講 《 澳門 文化 旅遊 的 城 巿 形象 》 。         一行 並參 觀肇慶 巿 博物 館 、 鼎湖山 牌坊 以及 皇禮城 裹 蒸 粽運營 中心 等 ， 了解 當地 廣告業 和文 旅產業 發展 現況 ， 並在 運營 中心 現場 觀摩銷 售員線 上 直播 售賣 產品 實況 。         胡錦漢 總 結稱 ， 大灣區 建設 為 澳門 廣告業 和文 旅產業 提供 更多 發展 機遇 ， 多重 政策 和 項目 相互配合 ， 對業界 人士 進入灣區 發展 有 更 大 便捷性 。,2024-04-23
