Title,Content,Link,Summary,Preprocessed_Content
歲晚降溫避寒中心開放,歲晚降溫避寒中心開放    【本報消息】隨着一股冷鋒殺到，本澳昨日下午明顯降溫，下降至低溫約十二度，伴隨有雨天氣，讓人體感更冷。氣象局預料，本澳未來兩天繼續受冬季季風影響，天氣寒冷及北風較大，居民注意保暖。    氣象局預料今日年廿九氣溫下降、多雲及間中有雨，氣溫攝氏九至十二度；年卅（九日）多雲有幾陣雨，氣溫攝氏九至十三度。展望農曆新年期間，受乾燥的冬季季風影響，日間以天晴為主，氣溫逐步回升，但早晚天氣仍然寒冷，日夜溫差較大，居民留意天氣變化，注意保暖。    社工局昨表示，鑑於氣象局已發出黃色低溫提示，位於青洲東街三十四號青洲坊大廈E1的避寒中心於昨晚六時至翌日早上八時對外開放，直至天氣回暖。中心內備有棉被、食物及飲品供避寒人士使用。並呼籲居民關顧家中及獨居長者、長期病患者及體弱者的身體情況，採取適當措施預防寒冷天氣對健康造成的影響。如欲查詢避寒中心開放詳情，可於辦公時間內致電二八二七 · ○九三九，或於非辦公時間內致電六三九九 · 一九六三。,http://www.macaodaily.com/html/2024-02/08/content_1734127.htm,社工局昨表示，鑑於氣象局已發出黃色低溫提示，位於青洲東街三十四號青洲坊大廈E1的避寒中心於昨晚六時至翌日早上八時對外開放，直至天氣回暖,歲 晚 降溫 避寒 中心 開放         【 本報 消息 】 隨着 一股 冷鋒 殺 到 ， 本澳 昨日 下午 明顯 降溫 ， 下降 至 低 溫約 十二度 ， 伴 隨有 雨天 氣 ， 讓 人體 感 更 冷 。 氣象局 預料 ， 本澳 未來 兩天 繼續 受 冬季 季風 影響 ， 天氣 寒冷 及北風 較 大 ， 居民 注意 保暖 。         氣象局 預料 今日 年 廿九 氣溫 下降 、 多雲及 間 中 有 雨 ， 氣溫 攝氏九至 十二度 ； 年卅 （ 九日 ） 多雲有 幾陣雨 ， 氣溫 攝氏九至 十三 度 。 展望 農 曆 新 年期 間 ， 受 乾燥 的 冬季 季風 影響 ， 日間 以 天晴 為主 ， 氣溫 逐步 回升 ， 但 早晚 天氣 仍然 寒冷 ， 日夜 溫差 較 大 ， 居民 留意 天氣 變化 ， 注意 保暖 。         社工 局 昨 表示 ， 鑑 於 氣象局 已發 出黃色 低溫 提示 ， 位 於 青洲 東街 三十四 號 青洲 坊 大廈 E1 的 避寒 中心 於 昨晚 六時 至 翌日 早上 八時 對外 開放 ， 直至 天氣 回暖 。 中心 內備 有 棉被 、 食物 及 飲品 供 避寒 人士 使用 。 並呼籲 居民 關顧 家中 及 獨居長 者 、 長 期 病患者 及體 弱者 的 身體 情況 ， 採取 適當 措施 預防 寒冷 天氣 對 健康 造成 的 影響 。 如欲 查詢 避寒 中心 開放 詳情 ， 可 於 辦公時間 內 致電 二八 二七   ·   ○ 九 三九 ， 或 於 非辦 公時間 內 致電 六三 九九   ·   一九六 三 。
火船頭街人行橫道冀新春恢復,火船頭街人行橫道冀新春恢復    坊間倡允內港往媽閣車輛右轉鹽巷調頭    【本報消息】內港南雨水泵站箱涵渠及下水道工程現正開展。交諮委張淑玲稱，內港停車場行人過路設施缺乏鮮明標識，加上海邊新街一側行人天橋未配備升降機，許多旅客唯有拖着大件行李在臨時取消的人行橫道上隨意過馬路，險象環生。    新春在即，部分工程將暫停，張淑玲建議當局在條件允許下，考慮在春節期間臨時恢復火船頭街靠近新馬路通往十六浦的人行橫道，或增強標識指引，以便旅客和居民出行。    張淑玲引述居民指出，海邊新街一側行人天橋僅設有扶手電梯及步行台階，缺乏升降機，導致整體使用率不高。希望跨部門於新春期間作臨時調整，方便居民及旅客安全過馬路。    優化新馬路斑馬線    新馬路近大豐銀行轉角處雖設有斑馬線，但行人絡繹不絕。建議當局適時優化新馬路周邊斑馬線，可考慮在該路口適當位置加設臨時交通訊號燈，集中管理行人在一定時間內通行。另建議當局在河邊新街適當路口允許由司打口往媽閣方向的車輛右轉調頭，加速疏導車流。    中區社諮委黃萬濱表示，料春節期間到新馬路及內港一帶的客流持續增加，當局應適時調整圍封情況。關注到該路段工程仍需要一段長時間，現時由十六浦至媽閣廟的行車路段中，沒有一個可供車輛調頭的路口，很多駕駛者因誤入該路段後只能一直行駛，直至西灣大橋底位置才能調頭。    建議可在鹽巷與河邊新街的位置，供車輛轉入鹽巷，以便車輛調頭，而轉入過程可利用交通燈控制進入鹽巷的車輛時間，料可減少車輛在此路段來回堵塞的情況。,http://www.macaodaily.com/html/2024-02/08/content_1734183.htm,新春在即，部分工程將暫停，張淑玲建議當局在條件允許下，考慮在春節期間臨時恢復火船頭街靠近新馬路通往十六浦的人行橫道，或增強標識指引，以便旅客和居民出行,火船 頭街 人行 橫道 冀 新春 恢 復         坊 間 倡允 內港 往媽閣 車輛 右 轉鹽巷 調頭         【 本報 消息 】 內港南 雨水 泵站 箱涵 渠及 下水道 工程 現正 開展 。 交諮委 張淑玲 稱 ， 內港 停車場 行人 過路 設施 缺乏 鮮明 標識 ， 加 上海 邊 新街 一側 行人 天橋 未 配備 升降 機 ， 許多 旅客 唯有 拖 着 大件 行李 在 臨時 取消 的 人行 橫道 上 隨意 過馬路 ， 險象 環生 。         新春 在 即 ， 部分 工程 將暫 停 ， 張淑玲 建議 當局 在 條件 允許 下 ， 考慮 在 春節 期間 臨時 恢 復 火 船頭 街 靠近 新馬路 通往 十六 浦 的 人行 橫道 ， 或 增強 標識 指引 ， 以便 旅客 和 居民 出行 。         張淑玲 引述 居民 指出 ， 海邊 新街 一側 行人 天橋 僅設 有 扶手 電梯 及 步行 台階 ， 缺乏 升降 機 ， 導致 整體 使用率 不高 。 希望 跨部門 於 新春 期間 作臨 時 調整 ， 方便 居民 及 旅客 安全 過馬路 。         優化 新馬路 斑馬線         新馬路 近大 豐銀行 轉角處 雖設 有 斑馬線 ， 但 行人 絡繹不絕 。 建議 當局 適時 優化 新馬路 周邊 斑馬線 ， 可 考慮 在 該 路口 適當 位置 加設 臨時 交通 訊 號燈 ， 集中管理 行人 在 一定 時間 內 通行 。 另建議 當局 在 河邊 新街 適當 路口 允許 由司 打口 往媽閣 方向 的 車輛 右轉 調頭 ， 加速 疏導 車流 。         中區 社諮委黃 萬濱 表示 ， 料春節 期間 到 新馬路 及 內港 一帶 的 客流 持續 增加 ， 當局 應 適時 調整 圍封 情況 。 關注 到 該 路段 工程 仍 需要 一段 長 時間 ， 現時 由 十六 浦至 媽閣 廟 的 行車 路段 中 ， 沒有 一個 可供 車輛 調頭 的 路口 ， 很多 駕駛者 因誤 入 該 路段 後 只能 一直 行駛 ， 直至 西灣 大橋底 位置 才能 調頭 。         建議 可 在 鹽巷 與 河邊 新街 的 位置 ， 供車輛 轉入 鹽巷 ， 以便 車輛 調頭 ， 而 轉入 過程 可 利用 交通 燈 控制 進入 鹽巷 的 車輛 時間 ， 料 可 減少 車輛 在 此 路段 來 回 堵塞 的 情況 。
CTM客戶善款捐公益金,CTM客戶善款捐公益金    【本報消息】澳門電訊有限公司昨到訪澳門日報讀者公益基金會，送交去年透過客戶積分捐贈計劃及百萬行期間流動電話客戶捐贈的三萬三千七百三十五元善款。    昨日下午三時，澳門電訊商務副總裁湛寶儀、企業傳訊總監陳靜儀、企業傳訊高級經理韋旖芯代表送交三萬三千七百三十五元善款，轉達客戶心意，由澳門日報讀者公益基金會會長賀定一，理事長黃國勝、副會長許建章代表接收。    賀定一感謝澳門電訊支持百萬行。今年是公益基金會創會四十周年，殊不簡單。多年來取得的成績，與社會各界長期支持與鼓勵分不開。希望今後繼續加強合作，支援有需要家庭。    湛寶儀表示，作為與澳門共同成長的企業，澳門電訊會持續推動“數碼澳門”智慧城市基建發展，並積極配合政府、支持各界推動智慧轉型。同時，澳門電訊積極履行社會企業責任，多年來大力支持公益金百萬行活動，除協助宣傳、組織員工及家屬一同參與百萬行活動，身體力行表達對社區公益工作的支持；亦透過設立積分捐贈平台，用戶每捐出三千點積分，澳門電訊會相應捐出三十元善款，澳門電訊會把所有收集到的善款悉數轉交公益基金會。,http://www.macaodaily.com/html/2024-02/08/content_1734184.htm,昨日下午三時，澳門電訊商務副總裁湛寶儀、企業傳訊總監陳靜儀、企業傳訊高級經理韋旖芯代表送交三萬三千七百三十五元善款，轉達客戶心意，由澳門日報讀者公益基金會會長賀定一，理事長黃國勝、副會長許建章代表接收,CTM 客戶 善款 捐 公益金         【 本報 消息 】 澳門 電訊 有限公司 昨到 訪澳門 日報 讀者 公益 基金 會 ， 送交 去年 透過 客戶 積分 捐贈 計劃 及 百萬 行期 間 流動 電話 客戶 捐贈 的 三 萬 三千七百 三十五元 善款 。         昨日 下午 三時 ， 澳門 電訊 商務 副 總裁 湛寶儀 、 企業 傳訊 總監 陳 靜儀 、 企業 傳訊 高級 經理 韋旖芯 代表 送交 三萬 三千七百 三十五元 善款 ， 轉達 客戶 心意 ， 由 澳門 日報 讀者 公益 基金 會會長 賀定 一 ， 理事 長 黃 國勝 、 副會長 許 建章 代表 接收 。         賀定 一感謝 澳門 電訊 支持 百萬行 。 今年 是 公益 基金 會 創會 四十周年 ， 殊 不 簡單 。 多年 來 取得 的 成績 ， 與 社會 各界 長 期 支持 與 鼓勵 分不開 。 希望 今後繼續 加強 合作 ， 支援 有 需要 家庭 。         湛寶儀 表示 ， 作為 與 澳門 共同 成長 的 企業 ， 澳門 電訊會 持續 推動 “ 數碼 澳門 ” 智慧 城市 基建 發展 ， 並積極 配合 政府 、 支持 各界 推動 智慧 轉型 。 同時 ， 澳門 電訊 積極 履行 社會 企業 責任 ， 多年 來 大力支持 公益金 百萬行 活動 ， 除協助 宣傳 、 組織員 工及 家屬 一同 參與 百萬行 活動 ， 身體 力行 表達 對 社區 公益 工作 的 支持 ； 亦 透過 設立 積分 捐贈 平台 ， 用戶 每 捐出 三千 點積分 ， 澳門 電訊會 相應 捐出 三十元 善款 ， 澳門 電訊會 把 所有 收集 到 的 善款 悉數 轉交 公益 基金 會 。
美麗街利安重建增旅娛用途,可建設住宅安置原居民    美麗街利安重建增旅娛用途    【本報消息】城規會昨日下午通過十二份規劃條件圖草案，其中一份為美麗街利安大廈的規劃圖草案，新草案除原有商業用途外，新增“TD1類旅遊娛樂用地”（即酒店業或博彩經營場所）。有委員關注新草案沒有包括住宅用途。工務局回應時表示，旅遊娛樂用地可兼容住宅用途，只要娛樂用地建築面積佔比大於五成即可，換言之有部分空間可建設住宅安置原居住居民。    娛樂面積佔逾五成    城規會昨日下午三時在馬交石炮台馬路三十三號五樓會議舉行，首份規劃圖草案為美麗街永利大廈（南灣大馬路七〇一至七〇一號及美麗街十二至十四號），佔地八百一十平方米，樓宇最大許可度為海拔七十五米。新規劃圖草案較上一份草案增加“TD1類旅遊娛樂用地”，有委員關注該新草案建議用途沒有包括住宅用途，未來的高度設計考量，以及擔憂美麗街連排式建築物倘全部重建增高，會否造成屏風效應？    工務局城市規劃廳廳長梁耀鴻回應表示，當局因應城規會及公眾意見，新規劃圖草案增加TD1類旅遊娛樂用途，TD1類旅遊娛樂用地可兼容住宅用途，只要旅遊娛樂用途面積大於五成即可。樓宇高度需考慮地積比及覆蓋率等多項建築指標而設計，未必達到最大的建築高度，具體視乎建築設計。    他指出，目前只要求塔樓面寬超過七十米的樓宇，進行空氣流動評估及倘有緩解措施，暫時未有要求整條街（空氣評估）手段。又指未來詳細規劃會針對每個區域適當設置空隙，讓空氣流動，以減少屏風效應。    按照總規商業優先    亦有委員提醒，美麗街附近多民居，冀未來規劃為商業區時，適當考慮民居情況再發展。梁耀鴻表示，針對南灣大馬路及美麗街地段，將優先按照總規規劃為商業用途，倘收到社會或城規會意見再考慮其他用途。當局會監察商業用地的面積，以確保以商業用途為主。    旅遊局長文綺華提醒業權人，若該處未來建設成酒店，需按照《酒店業場所業務法》及《酒店業場所業務法施行細則》向當局提交申請。    亦有委員部分規劃圖草案僅建議為商業區，沒有旅遊娛樂用途，是否要有人提出才考慮其他用途，會否造成不公平？梁耀鴻表示，針對總規規劃為商業區的地段，會優先發展商業用途，以保障產業用地，倘公示期間或城規會有不同意見，局方會分析是否適合作其他用途；亦會持續監察整個區域商業用地的面積比例符合總規要求。,http://www.macaodaily.com/html/2024-02/08/content_1734185.htm,可建設住宅安置原居民    美麗街利安重建增旅娛用途    【本報消息】城規會昨日下午通過十二份規劃條件圖草案，其中一份為美麗街利安大廈的規劃圖草案，新草案除原有商業用途外，新增“TD1類旅遊娛樂用地”（即酒店業或博彩經營場所）,可建設 住宅 安置 原 居民         美麗 街利安 重建 增旅娛 用途         【 本報 消息 】 城規會 昨日 下午 通過 十二 份 規劃 條件 圖 草案 ， 其中 一份 為 美麗街 利安大廈 的 規劃 圖 草案 ， 新 草案 除 原有 商業 用途 外 ， 新增 “ TD1 類旅遊 娛樂 用地 ” （ 即 酒店 業或 博彩 經營場 所 ） 。 有委員關 注新 草案 沒有 包括 住宅 用途 。 工務局 回應 時 表示 ， 旅遊 娛樂 用地 可 兼容 住宅 用途 ， 只要 娛樂 用地 建築 面積 佔 比大 於 五成 即可 ， 換言 之 有 部分 空間 可建設 住宅 安置 原 居住 居民 。         娛樂 面積 佔 逾 五成         城規會 昨日 下午 三時 在 馬 交石 炮台 馬 路 三十三 號五樓 會議 舉行 ， 首份 規劃 圖 草案 為 美麗街 永利 大廈 （ 南灣 大馬路 七 〇 一至 七 〇 一號 及 美麗街 十二 至 十四 號 ） ， 佔地 八百 一 十平方米 ， 樓宇 最大 許可度 為 海拔 七十五 米 。 新規劃 圖 草案 較 上 一份 草案 增加 “ TD1 類旅遊 娛樂 用地 ” ， 有委員關 注該 新 草案 建議 用途 沒有 包括 住宅 用途 ， 未來 的 高度 設計 考量 ， 以及 擔憂 美麗 街連 排式 建築物 倘 全部 重建 增高 ， 會否 造成 屏風 效應 ？         工務局 城市 規劃 廳 廳 長 梁耀鴻回 應 表示 ， 當局 因應 城規會 及 公眾 意見 ， 新規劃 圖 草案 增加 TD1 類旅遊 娛樂 用途 ， TD1 類旅遊 娛樂 用地 可 兼容 住宅 用途 ， 只要 旅遊 娛樂 用途 面積 大 於 五成 即可 。 樓宇 高度 需考慮 地積 比及 覆蓋率 等 多項 建築 指標 而 設計 ， 未必 達到 最大 的 建築 高度 ， 具體 視乎 建築 設計 。         他 指出 ， 目前 只 要求 塔樓面 寬 超過 七十米 的 樓宇 ， 進 行空 氣流動 評估 及 倘有 緩解 措施 ， 暫時 未有 要求 整條 街 （ 空氣 評估 ） 手段 。 又 指未來 詳細 規劃 會針 對 每個 區域 適當 設置 空隙 ， 讓 空氣 流動 ， 以 減少 屏風 效應 。         按照 總規 商業 優先         亦 有委員 提醒 ， 美麗街 附近 多 民居 ， 冀未來 規劃 為 商業區 時 ， 適當 考慮 民居 情況 再 發展 。 梁耀鴻 表示 ， 針對 南灣 大馬路 及 美麗街 地段 ， 將優先 按照 總規 規劃 為 商業 用途 ， 倘 收到 社會 或 城規會 意見 再 考慮 其他 用途 。 當局 會 監察商業 用地 的 面積 ， 以確 保以 商業 用途 為主 。         旅遊 局長 文綺華 提醒 業權 人 ， 若該 處 未來 建設 成 酒店 ， 需 按照 《 酒店 業場 所業務法 》 及 《 酒店 業場 所業務法 施行 細則 》 向 當局 提交 申請 。         亦 有委員 部分 規劃 圖 草案 僅建議 為 商業區 ， 沒有 旅遊 娛樂 用途 ， 是否 要 有人 提出 才 考慮 其他 用途 ， 會否 造成 不 公平 ？ 梁耀鴻 表示 ， 針對 總規 規劃 為 商業區 的 地段 ， 會 優先發 展商 業 用途 ， 以 保障 產業 用地 ， 倘 公示 期間 或 城規會 有 不 同意 見 ， 局方 會 分析 是否 適 合作 其他 用途 ； 亦 會 持續 監察 整個 區域 商業 用地 的 面積 比例 符合 總規 要求 。
黃東暘書屋文物建築需保留,城規會通過十二規劃圖草案    黃東暘書屋文物建築需保留    【本報消息】城規會昨通過十二份規劃圖草案，當中包括台山公務員大廈，未來重建的樓宇許可高度為二十點五米；而美副將大馬路“黃東暘書屋”遺址，需完整保留該文物建築物，而非文物建築的C區樓高為二十點五米。    整體考量青洲馬路    台山公務員大廈的規劃圖草案內容，大致與上一份、二〇二一年規劃圖草案相同。土地面積為六百九十平方米，樓宇最大許可度為二十點五米。有委員提議將地段北移，優化行人道和交通路段。工務局城市規劃廳廳長梁耀鴻表示，北區一份詳細規劃將整體考量青洲大馬路的交通優化，目前未有考慮北移該地段，因為北移後涉及道路收窄，會影響附近建築物的街影計算。    維持中庭甬道門樓    另一份規劃圖草案為“美副將大馬路四號”，即“黃東暘書屋”遺址，建議用途包括居住、商業、旅遊娛樂及社會設施用地。地段分為三區，A區的建築物須完整保留或復原，不得增加高度；B區維持場地開敞空間特色；C區樓宇最大許可高度為二十點五米。草案亦列明，A區維持建築物中庭及甬道的空間特色，保留甬道的正門樓及後門樓；C區建築設計須與保留建築作協調處理。    新舊結合保留特徵    有委員關注A區“黃東暘書屋”遺址需完整保留，未來A區與C區的往來通道如何連結？工務局長、城規會主席黎永亮表示，私人工程需要入則審批，未來入則時要聽取文化局意見。文化局研究及計劃處處長蘇建明表示，規劃圖草案要求A區完整保留、B區維持開敞特色，C區的設計具較大彈性。現時文物建築與新建築結合時，相關的出入口荷載只要符合法規要求不會有太大限制，當局希望既保留歷史建築物特徵，也給予業權人設計的彈性。,http://www.macaodaily.com/html/2024-02/08/content_1734186.htm,城規會通過十二規劃圖草案    黃東暘書屋文物建築需保留    【本報消息】城規會昨通過十二份規劃圖草案，當中包括台山公務員大廈，未來重建的樓宇許可高度為二十點五米,城規會 通過 十二 規劃 圖 草案         黃 東 暘 書屋 文物 建築 需 保留         【 本報 消息 】 城規會 昨通過 十二 份 規劃 圖 草案 ， 當中 包括 台山 公務員大廈 ， 未來 重建 的 樓宇許 可 高度 為 二十 點 五米 ； 而 美 副 將大馬路 “ 黃 東 暘 書屋 ” 遺址 ， 需 完整 保留 該 文物 建築物 ， 而 非 文物 建築 的 C 區樓 高為 二十 點 五米 。         整體 考量 青洲 馬 路         台山 公務員大廈 的 規劃 圖 草案 內容 ， 大致 與 上 一份 、 二 〇 二 一年 規劃 圖 草案 相同 。 土地 面積 為 六百 九十 平方米 ， 樓宇 最大 許可度 為 二十 點 五米 。 有委員 提議將 地段 北移 ， 優化 行人 道 和 交通 路段 。 工務局 城市 規劃 廳 廳 長 梁耀鴻 表示 ， 北區 一份 詳細 規劃將 整體 考量 青洲 大馬路 的 交通 優化 ， 目前 未有 考慮 北移 該 地段 ， 因為 北移 後 涉及 道路 收窄 ， 會 影響 附近 建築物 的 街 影計算 。         維持 中庭 甬道 門樓         另 一份 規劃 圖 草案 為 “ 美副將 大馬路 四號 ” ， 即 “ 黃 東 暘 書屋 ” 遺址 ， 建議 用途 包括 居住 、 商業 、 旅遊 娛樂及 社會設 施用 地 。 地段 分為 三區 ， A 區的 建築物須 完整 保留 或 復 原 ， 不得 增加 高度 ； B 區維持場 地開 敞空間 特色 ； C 區樓宇 最大 許可 高度 為 二十 點 五米 。 草案 亦 列明 ， A 區維持 建築物 中庭 及 甬道 的 空間 特色 ， 保留 甬道 的 正門樓 及後門樓 ； C 區建築 設計須 與 保留 建築作 協調 處理 。         新舊 結合 保留 特徵         有委員 關注 A 區 “ 黃 東 暘 書屋 ” 遺址 需 完整 保留 ， 未來 A 區與 C 區的 往來 通道 如何 連結 ？ 工務局 長 、 城規會 主席 黎永亮 表示 ， 私人 工程 需要 入則 審批 ， 未來 入則 時要 聽取 文化局 意見 。 文化局 研究 及計劃 處 處長 蘇建明 表示 ， 規劃 圖 草案 要求 A 區 完整 保留 、 B 區維持 開敞 特色 ， C 區的 設計 具較 大彈性 。 現時 文物 建築 與 新建 築 結合時 ， 相關 的 出入口 荷載 只要 符合 法規 要求 不會 有 太大 限制 ， 當局 希望 既 保留 歷史 建築物 特徵 ， 也 給予 業權 人 設計 的 彈性 。
