Title,Content,Link,Summary,Preprocessed_Content,Date
八市旅客獲派二百元優惠券,李家超：    八市旅客獲派二百元優惠券    【香港中通社十四日電】內地二十七日起將開放八個城市赴港澳“個人遊”（自由行）。香港特區行政長官李家超十四日出席行政會議前見記者時表示，香港將以美食和盛事歡迎旅客，還有各類優惠，希望讓旅客賓至如歸，體驗國際大都會的魅力。    據公佈，香港旅發局將向八個城市的自由行旅客派發二百港元優惠券，涵蓋不同餐廳及商鋪；並透過內地社交媒體、旅遊業等，加強推廣香港多元化深度體驗和特色旅遊。香港在未來數月舉辦不同盛事及精彩活動，如六月將舉行中華文化節、香港國際龍舟邀請賽，七月有香港書展等等，旅客將滿載而歸。    上半年香港舉行超過一百項盛事，李家超透露，很快公佈下半年盛事活動名單，讓業界掌握情況、提早準備，把握商機。    李家超說，政府不會靠單一方法提振經濟，會用多元方法產生協同效應，包括發展盛事經濟、旅遊經濟、會議經濟、體育經濟等，以琳瑯滿目的活動帶來人氣及財氣。政府做好導演角色，業界演好自身角色，不怨天不尤人，香港必然是引以為傲的好客之都。,http://www.macaodaily.com/html/2024-05/15/content_1755142.htm,香港特區行政長官李家超十四日出席行政會議前見記者時表示，香港將以美食和盛事歡迎旅客，還有各類優惠，希望讓旅客賓至如歸，體驗國際大都會的魅力,李家 超 ：         八市 旅客 獲派 二百元 優惠券         【 香港 中通社 十四日 電 】 內地 二十七日 起將 開放八個 城市 赴 港澳 “ 個 人遊 ” （ 自由 行 ） 。 香港 特區 行政 長 官 李家 超 十四日 出席 行政 會議 前見 記者 時 表示 ， 香港 將以 美食 和 盛事 歡迎 旅客 ， 還有 各類 優惠 ， 希望 讓 旅客 賓至 如 歸 ， 體驗 國際 大都 會 的 魅力 。         據公 佈 ， 香港 旅發局 將向 八個 城市 的 自由 行 旅客 派發 二百 港元 優惠券 ， 涵蓋 不同 餐廳 及 商鋪 ； 並透過 內 地 社交 媒體 、 旅遊業 等 ， 加強 推廣 香港 多元化 深度 體驗 和 特色 旅遊 。 香港 在 未來 數月 舉辦 不同 盛事 及 精彩 活動 ， 如 六月 將舉行 中華 文化 節 、 香港 國際龍舟 邀請賽 ， 七月 有 香港 書展 等等 ， 旅客 將滿載 而 歸 。         上半年 香港 舉行 超過 一百 項 盛事 ， 李家 超 透露 ， 很快 公 佈 下半年 盛事 活動 名單 ， 讓 業界 掌握 情況 、 提早 準備 ， 把握 商機 。         李家 超說 ， 政府 不會 靠 單一 方法 提振經濟 ， 會用 多元 方法 產生 協同 效應 ， 包括 發展 盛事 經濟 、 旅遊 經濟 、 會議 經濟 、 體育 經濟 等 ， 以 琳瑯 滿 目的 活動 帶來 人氣 及 財氣 。 政府 做好 導演 角色 ， 業界 演好 自身 角色 ， 不 怨天 不 尤人 ， 香港 必然 是 引以 為傲 的 好客 之 都 。,2024-05-15
李：已要求英方提供詳情,回應英警起訴三人    李：已要求英方提供詳情    【新華社香港十四日電】就英國警方以涉嫌向香港特區情報部門提供協助為藉口，宣佈起訴包括香港駐倫敦經濟貿易辦事處職員在內的三名人員一事，香港特區行政長官李家超十四日出席行政會議前會見傳媒表示，特區政府已經要求英國政府公正處理，確保有關經貿辦職員權益受到保障以及經貿辦運作不受影響，重申任何對特區政府的無理指控都不能接受。    李家超說，中國駐英國大使館和特區政府已經就事件作出聲明，中國駐英國大使館已經強烈反對和譴責英國編造這個所謂案件，還有對特區的無理指控，已向英方提出嚴肅交涉，特區政府也已經要求駐港的英國總領事提供這件事情的詳細情況。    香港駐倫敦經濟貿易辦事處的日常工作是和當地不同人士進行溝通，推廣香港的經濟、貿易、文化，以及香港的優勢，讓英國當地人士更了解香港經濟和貿易的商機。李家超強調，特區政府已經要求英國政府公正處理這件事情，確保有關經貿辦職員的權益受到保障，確保經貿辦的正常運作不受影響。任何對特區政府的無理指控都不能接受。,http://www.macaodaily.com/html/2024-05/15/content_1755143.htm,回應英警起訴三人    李：已要求英方提供詳情    【新華社香港十四日電】就英國警方以涉嫌向香港特區情報部門提供協助為藉口，宣佈起訴包括香港駐倫敦經濟貿易辦事處職員在內的三名人員一事，香港特區行政長官李家超十四日出席行政會議前會見傳媒表示，特區政府已經要求英國政府公正處理，確保有關經貿辦職員權益受到保障以及經貿辦運作不受影響，重申任何對特區政府的無理指控都不能接受,回應 英警 起訴 三人         李 ： 已 要求 英方 提供 詳情         【 新華社 香港 十四日 電 】 就 英國 警方 以 涉嫌 向 香港 特區 情報 部門 提供 協助 為 藉口 ， 宣 佈 起訴 包括 香港 駐倫敦 經濟 貿易 辦事處 職員 在 內 的 三名 人員 一事 ， 香港 特區 行政 長 官 李家 超 十四日 出席 行政 會議 前會 見 傳媒 表示 ， 特區 政府 已經 要求 英國 政府 公正 處理 ， 確 保有 關經 貿辦 職員 權益 受到 保障 以及 經貿辦 運作 不受 影響 ， 重申 任何 對 特區 政府 的 無理 指控 都 不能 接受 。         李家 超說 ， 中國 駐 英國 大使 館 和 特區 政府 已經 就 事件 作出 聲明 ， 中國 駐 英國 大使 館 已經 強烈 反 對 和 譴責 英國 編造 這個 所謂 案件 ， 還有 對 特區 的 無理 指控 ， 已 向 英方 提出 嚴肅 交涉 ， 特區 政府 也 已經 要求 駐港 的 英國 總 領事 提供 這件 事情 的 詳細 情況 。         香港 駐倫敦 經濟 貿易 辦事處 的 日常 工作 是 和 當地 不同 人士 進行 溝通 ， 推廣 香港 的 經濟 、 貿易 、 文化 ， 以及 香港 的 優勢 ， 讓 英國 當地 人士 更 了解 香港 經濟 和 貿易 的 商機 。 李家 超強 調 ， 特區 政府 已經 要求 英國 政府 公正 處理 這件 事情 ， 確 保有 關經 貿辦 職員 的 權益 受到 保障 ， 確保經 貿辦 的 正常 運作 不受 影響 。 任何 對 特區 政府 的 無理 指控 都 不能 接受 。,2024-05-15
旅發局：首四月訪港旅客倍增,"增至1,462萬人次    旅發局：首四月訪港旅客倍增    【香港中通社十四日電】香港旅發局十四日公佈，四月初步訪港旅客數字為三百四十萬人次，較去年同期上升約兩成；今年首四月錄得一千四百六十二萬人次旅客，按年增加一倍。    中通社記者從旅發局獲悉，四月份訪客中，內地旅客約二百四十八萬人次，按年增百分之七點八。非內地市場訪港旅客量按年錄得逾五成增幅。短途市場方面，受齋戒月完結帶動，來自印尼的訪港旅客人次按年錄得八成多增幅；長途市場方面，如來自美國及加拿大的訪客，按年亦分別錄得逾八成的增長。    累積計算，今年一月至四月共錄得一千四百六十二萬人次旅客訪港，按年增加一倍。其中，內地旅客錄得一千一百一十七萬，按年增百分之九十七點三；非內地市場訪客數量三百四十四萬人次，按年增長超過一倍。來自新市場的旅客數量為十九萬，按年錄得將近兩倍的增長。",http://www.macaodaily.com/html/2024-05/15/content_1755144.htm,短途市場方面，受齋戒月完結帶動，來自印尼的訪港旅客人次按年錄得八成多增幅,"增至 1 , 462 萬 人次         旅發局 ： 首 四月 訪港 旅客 倍增         【 香港 中通社 十四日 電 】 香港 旅發局 十四日 公 佈 ， 四月 初步 訪港 旅客 數字 為 三百 四十 萬 人次 ， 較 去年同期 上升 約 兩成 ； 今年 首 四月 錄得 一千四百 六十二 萬 人次 旅客 ， 按年 增加一倍 。         中通 社記者 從 旅發局 獲悉 ， 四月份 訪客 中 ， 內地 旅客 約 二百四十 八萬 人次 ， 按年 增 百分之七 點八 。 非內 地 市場 訪港 旅客量 按年 錄得 逾 五成 增幅 。 短途 市場 方面 ， 受齋 戒 月 完結 帶動 ， 來 自 印尼 的 訪港 旅客 人次 按年 錄得 八成 多 增幅 ； 長 途市場 方面 ， 如來 自美國 及 加拿大 的 訪客 ， 按年 亦 分別 錄得 逾 八成 的 增長 。         累積 計算 ， 今年 一月 至 四月 共錄 得 一千四百 六十二 萬 人次 旅客 訪港 ， 按年 增加一倍 。 其中 ， 內地 旅客 錄得 一千一百 一十七 萬 ， 按年 增 百分之九十 七點 三 ； 非內 地 市場 訪客 數量 三百 四十四 萬 人次 ， 按年 增長 超過 一倍 。 來 自新 市場 的 旅客 數量 為 十九 萬 ， 按年 錄得 將近 兩倍 的 增長 。",2024-05-15
港機場保安費明年加至65元,港機場保安費明年加至65元    【香港中通社十四日電】香港機場管理局十四日公佈，香港國際機場旅客保安費計劃於二〇二五年一月一日起，由五十五港元調整至六十五港元，並視乎機場客運量增長以及當前客運需求，可於二〇二七年起分階段調整至七十五港元。    旅客保安費由航空公司代機管局向機場離港旅客收取，於二〇二五年一月一日前發出的機票，即使出發日期為一月一日或之後，都不須徵收調整後的費用；有關調整上一次為二〇二一年。    機管局表示，經調整的費用將用於進一步提升機場保安設施和系統，如安裝智能旅客安檢系統、更換寄艙行李檢查系統，以及將保安服務延伸至涵蓋三跑道系統相關範圍。調整費用旨在收回未來數年機場提升保安措施及系統的額外成本，符合香港航空保安計劃訂明的“用者自付，收回成本”原則。,http://www.macaodaily.com/html/2024-05/15/content_1755146.htm,港機場保安費明年加至65元    【香港中通社十四日電】香港機場管理局十四日公佈，香港國際機場旅客保安費計劃於二〇二五年一月一日起，由五十五港元調整至六十五港元，並視乎機場客運量增長以及當前客運需求，可於二〇二七年起分階段調整至七十五港元,港機場 保安 費 明年 加至 65 元         【 香港 中通社 十四日 電 】 香港 機場 管理局 十四日 公 佈 ， 香港 國際 機場 旅客 保安 費計劃 於 二 〇 二 五年 一月 一日 起 ， 由 五十五 港元 調整 至 六十五 港元 ， 並視乎 機場 客運量 增長 以及 當前 客運 需求 ， 可 於 二 〇 二七 年 起 分階段 調整 至 七十五 港元 。         旅客 保安 費由 航空公司 代機 管局 向 機場 離港 旅客 收取 ， 於 二 〇 二 五年 一月 一 日前 發出 的 機票 ， 即使 出發 日期 為 一月 一日 或 之 後 ， 都 不須 徵收 調整 後 的 費用 ； 有關 調整 上 一次 為 二 〇 二 一年 。         機管局 表示 ， 經調整 的 費用 將用 於 進 一步 提升 機場 保安 設施 和 系統 ， 如安裝 智能 旅客 安檢系統 、 更換 寄艙 行李 檢查 系統 ， 以及 將 保安服 務 延伸 至涵 蓋 三 跑道 系統 相關 範圍 。 調整 費用 旨在 收回 未來 數年 機場 提升 保安 措施 及系統 的 額外 成本 ， 符合 香港 航空 保安 計劃 訂明 的 “ 用 者 自付 ， 收回 成本 ” 原則 。,2024-05-15
港破赴台遠洋船走私,估計貨物市值約億六    港破赴台遠洋船走私    【香港中通社十四日電】香港海關十四日公佈，七日在葵涌貨櫃碼頭偵破一宗涉嫌利用遠洋船走私貨物往台灣的案件，在兩個貨櫃內檢獲大批未列艙單貨物，估計市值約一億六千萬港元。    檢未列艙單貨物    海關通過情報分析及風險評估，發現不法分子意圖利用遠洋船走私貨物，遂部署策略打擊有關活動，鎖定一艘準備由香港前往台灣高雄的遠洋船。    經檢查，海關人員在船上兩個貨櫃內發現大批未列艙單貨物，包括懷疑受管制乾魚翅和鯊魚皮、懷疑受管制木製家具、電子零件和電子產品。案件仍在調查中，不排除有人被捕。,http://www.macaodaily.com/html/2024-05/15/content_1755147.htm,估計貨物市值約億六    港破赴台遠洋船走私    【香港中通社十四日電】香港海關十四日公佈，七日在葵涌貨櫃碼頭偵破一宗涉嫌利用遠洋船走私貨物往台灣的案件，在兩個貨櫃內檢獲大批未列艙單貨物，估計市值約一億六千萬港元,估計 貨物 市值 約 億六         港破 赴 台遠 洋船 走私         【 香港 中通社 十四日 電 】 香港 海關 十四日 公 佈 ， 七日 在 葵涌 貨櫃 碼頭 偵破 一宗 涉嫌 利用 遠 洋船 走私 貨物往 台灣 的 案件 ， 在 兩個 貨櫃 內 檢獲 大批 未列 艙 單貨物 ， 估計 市值 約 一 億 六千 萬 港元 。         檢 未列 艙 單貨物         海關 通過 情報 分析 及風險 評估 ， 發現 不法分子 意圖 利用 遠 洋船 走私 貨物 ， 遂 部署 策略 打擊 有關 活動 ， 鎖定 一艘 準備 由 香港 前往 台灣 高雄 的 遠 洋船 。         經檢查 ， 海關 人員 在 船上 兩個 貨櫃 內 發現 大批 未列 艙 單貨物 ， 包括 懷疑 受 管制 乾魚 翅 和 鯊 魚皮 、 懷疑 受 管制 木 製 家具 、 電子 零件 和 電子 產品 。 案件 仍 在 調查 中 ， 不 排除 有人 被捕 。,2024-05-15
的士七月統一落旗加兩文,的士七月統一落旗加兩文    【香港中通社十四日電】香港特區行政長官會同行政會議十四日批准市區、新界及大嶼山的士調整收費，落旗（起步價）收費增加兩港元，落旗後首段跳錶收費每跳增加兩角，後段跳錶收費每跳增加一角。    根據加價後的情況，的士在最初兩公里或以下路程，市區、新界、大嶼山起步價分別為二十九港元、二十五點五港元以及二十四港元；之後每行駛二百米的跳錶，市區收費增至二點一港元、新界及大嶼山增至一點九港元。等候時間的收費會因落旗後跳錶收費提高而相應調整，而其他附加收費則維持不變。    運輸及物流局發言人表示，在現行的士收費水平下，的士業界確實面臨維持其營運的財務可行性的困難。業界希望的士加價有助增加前線司機收入和吸引更多新人入行，同時鼓勵的士從業員改善服務和投資更多新設備，以提升整體的士服務質素。    政府將於在今年五月二十二日向立法會提交《二〇二四年道路交通（公共服務車輛）（修訂）規例》，進行先訂立後審議程序，以調整的士收費。當程序完成後，新收費將由今年七月十四日開始生效。,http://www.macaodaily.com/html/2024-05/15/content_1755148.htm,的士七月統一落旗加兩文    【香港中通社十四日電】香港特區行政長官會同行政會議十四日批准市區、新界及大嶼山的士調整收費，落旗（起步價）收費增加兩港元，落旗後首段跳錶收費每跳增加兩角，後段跳錶收費每跳增加一角,的士 七月 統一落 旗加 兩文         【 香港 中通社 十四日 電 】 香港 特區 行政 長 官會同 行政 會議 十四日 批准 市區 、 新界 及大嶼 山 的士 調整 收費 ， 落旗 （ 起步 價 ） 收費 增加 兩 港元 ， 落旗 後 首段 跳 錶 收費 每 跳 增加 兩角 ， 後 段 跳 錶 收費 每 跳 增加 一角 。         根據 加價 後 的 情況 ， 的士 在 最初 兩 公里 或 以下 路程 ， 市區 、 新界 、 大嶼 山 起步 價分別 為 二十九 港元 、 二十五 點五 港元 以及 二十四 港元 ； 之 後 每行 駛 二百米 的 跳 錶 ， 市區 收費 增至 二點 一 港元 、 新界 及大嶼 山 增至 一點 九 港元 。 等候 時間 的 收費會 因落 旗後跳 錶 收費 提高 而 相應 調整 ， 而 其他 附加 收費則 維持 不變 。         運輸及 物流 局發言人 表示 ， 在 現行 的士 收費 水平 下 ， 的士 業界確 實面 臨維持 其營運 的 財務 可行性 的 困難 。 業界 希望 的士 加價 有助 增加 前線 司機 收入 和 吸引 更 多 新人 入 行 ， 同時 鼓勵 的士 從業員 改善 服務 和 投資 更 多 新 設備 ， 以 提升 整體 的士 服務質素 。         政府 將於在 今年 五月 二十二日 向 立法 會 提交 《 二 〇 二 四年 道路交通 （ 公共 服務車輛 ） （ 修訂 ） 規例 》 ， 進行 先訂 立後審議 程序 ， 以 調整 的士 收費 。 當 程序 完成 後 ， 新 收費將 由 今年 七月 十四日 開始 生效 。,2024-05-15
普京明訪華,普京明訪華    【本報綜合報道】據新華社、香港中通社十四日電：中國外交部發言人華春瑩十四日宣佈，應中國國家主席習近平邀請，俄羅斯總統弗拉基米爾 · 弗拉基米羅維奇 · 普京將於五月十六日至十七日對中國進行國事訪問。    俄：加強兩國協作    五月十四日，中國和俄羅斯幾乎同步公佈消息：俄羅斯總統普京將於五月十六日至十七日對中國進行國事訪問。    俄羅斯外交部長拉夫羅夫十四日在俄聯邦委員會（議會上院）全體會議上表示，俄總統普京即將對中國進行的訪問將加強兩國協作。俄羅斯願與中國一道，共同努力建立一個更加公正和民主的世界秩序。拉夫羅夫說，俄羅斯和中國在努力推動國際體系改革，促進形成多極世界秩序。    就職一周訪華罕見    中國人民大學國際事務研究所所長王義桅十四日表示，中俄關係是新型大國關係的典範，兩國元首連任後的外交首訪，通常都會選擇對方。這一次情況較特別，普京連任後僅相隔一周就訪問中國，體現了中俄關係的特殊性以及莫斯科對北京的高度重視和信任。    經貿合作料是重點    此訪有何看點？據中方介紹，訪問期間，兩國元首將就中俄建交七十五周年背景下雙邊關係、各領域合作以及共同關心的國際地區問題交換意見。    俄方消息指，普京訪華期間，兩國元首計劃簽署聯合聲明，還將簽署多份雙邊文件。兩國領導人將詳細討論全面戰略協作夥伴關係的所有問題，確定進一步發展俄中務實合作的主要方向，並就最緊迫的國際和地區問題深入交換意見。    俄方還表示，普京將在訪華期間會見中國國務院總理李強，討論經濟和人文領域的合作。    王義桅表示，經貿合作是普京此訪的一大重點。從普京新任期的人事大改組，提名了經濟學家的前第一副總理別洛烏索夫任國防部長，可見重視經濟發展的大方向。無論是傳統的經貿還是科技創新，俄羅斯都希望與中國加強合作。    外界關注中俄合作    普京七日在克里姆林宮宣誓就職時發表的演說，強調俄一定能夠有尊嚴地度過艱難時期，並實施好長遠規劃和宏大項目，實現發展目標。同時，俄將繼續加強與所有將俄視為可靠夥伴的國家的良好關係。    有媒體注意到，在普京訪華消息公佈的數個小時前，美國財長耶倫公開談到了接下來對中國的一系列措施。    分析認為，普京此時來訪，對中國來說，無疑意義重大。也正因此，外界關注中俄將如何加強合作。,http://www.macaodaily.com/html/2024-05/15/content_1755000.htm,俄羅斯外交部長拉夫羅夫十四日在俄聯邦委員會（議會上院）全體會議上表示，俄總統普京即將對中國進行的訪問將加強兩國協作,普京 明訪華         【 本報 綜合 報道 】 據 新華社 、 香港 中通社 十四日 電 ： 中國 外交部 發言 人華春瑩 十四日 宣 佈 ， 應中 國國家 主席 習近 平邀 請 ， 俄羅斯 總統 弗拉基 米爾   ·   弗拉基 米羅維奇   ·   普京 將於 五月 十六日 至 十七日 對 中國 進行 國事 訪問 。         俄 ： 加強 兩國 協作         五月 十四日 ， 中國 和 俄羅斯 幾乎 同步 公 佈 消息 ： 俄羅斯 總統 普京 將於 五月 十六日 至 十七日 對 中國 進行 國事 訪問 。         俄羅斯 外交部 長 拉夫 羅 夫 十四日 在 俄聯邦 委員會 （ 議會 上院 ） 全體 會議 上 表示 ， 俄總統 普京 即將 對 中國 進行 的 訪 問將 加強 兩國 協作 。 俄羅斯願 與 中國 一道 ， 共同努力 建立 一個 更加 公正 和 民主 的 世界秩序 。 拉夫 羅 夫 說 ， 俄羅斯 和 中國 在 努力 推動 國際 體系 改革 ， 促進 形成 多極 世界秩序 。         就 職 一周 訪華罕見         中國 人民 大學國際 事務 研究所 所長 王義桅 十四日 表示 ， 中俄關 係 是 新型 大國關 係 的 典範 ， 兩國 元首 連任 後 的 外交 首訪 ， 通常 都 會 選擇 對方 。 這 一次 情況 較 特別 ， 普京 連任後僅 相隔 一周 就 訪問 中國 ， 體現 了 中 俄關 係 的 特殊性 以及 莫斯科 對 北京 的 高度 重視 和 信任 。         經貿 合作 料 是 重點         此訪 有何 看點 ？ 據 中方 介紹 ， 訪問 期間 ， 兩國 元首 將就 中 俄 建交 七十五 周年 背景 下 雙邊關 係 、 各 領域 合作 以及 共同 關心 的 國際 地區 問題 交換 意見 。         俄方 消息 指 ， 普京 訪華期 間 ， 兩國 元首 計劃 簽署 聯合 聲明 ， 還將 簽署 多份 雙邊 文件 。 兩國 領導 人將 詳細 討論 全面 戰略 協作夥 伴關 係 的 所有 問題 ， 確定 進 一步 發展 俄 中務實 合作 的 主要 方向 ， 並就 最 緊迫 的 國際 和 地區 問題 深入 交換 意見 。         俄方 還 表示 ， 普京 將在 訪華期 間 會 見 中國 國務院 總理 李強 ， 討論 經濟 和 人文 領域 的 合作 。         王義桅 表示 ， 經貿 合作 是 普京 此訪 的 一大 重點 。 從 普京 新 任期 的 人事 大 改組 ， 提名 了 經濟 學家 的 前 第一副 總理 別洛 烏索夫 任國 防部 長 ， 可見 重視 經濟 發展 的 大方向 。 無論 是 傳統 的 經貿 還是 科技 創新 ， 俄羅斯 都 希望 與 中國 加強 合作 。         外界 關注 中 俄 合作         普京 七日 在 克里姆林 宮 宣誓 就 職時 發表 的 演說 ， 強調 俄 一定 能夠 有 尊嚴 地度過 艱難 時期 ， 並實施 好長 遠 規劃 和 宏大 項目 ， 實現 發展 目標 。 同時 ， 俄將 繼續 加強 與 所有 將俄視 為 可靠 夥伴 的 國家 的 良好 關 係 。         有 媒體 注意 到 ， 在 普京 訪華 消息 公 佈 的 數個 小時 前 ， 美國 財長 耶倫公開 談到 了 接下 來 對 中國 的 一系列 措施 。         分析 認為 ， 普京 此時 來訪 ， 對 中國來 說 ， 無 疑意 義 重大 。 也 正 因此 ， 外界 關注 中 俄將 如何 加強 合作 。,2024-05-15
