Title,Content,Link,Summary,Preprocessed_Content,Date
大潭山隧道料明年中開建,甄審資格八選五    繼後入標競投    大潭山隧道料明年中開建    【本報消息】“大潭山隧道及其連接線設計連建造工程——隧道及南連接線——預先評定資格之限制招標”候選要求公開開啟會議昨日上午九時三十分於公共建設局舉行，共收到八份申請書。當局期望工程明年第二季開展，首先開展隧道工程。    聯繫第四橋路氹城    公共建設局土木工程師余穎麟介紹，現時位於路氹城的機場圓形地與澳門大橋的直線距離被大潭山阻隔，開闢大潭山行車隧道，可直接將澳門大橋跨海通道及路氹城之間的道路聯繫起來，為澳門半島往來路氹城提供快捷的通道。除可縮減行車時間外，還減輕車輛集中行駛偉龍馬路、北安大馬路、氹仔客運碼頭、澳門國際機場等路段造成的交通壓力。    工程將分期開展，首期工程主要包括建造大潭山隧道段、南連接線及其北端出入口。隧道段全長約六百米，為雙向四車道的穿山隧道，穿越大潭山。南連接線全長約四百米，分別連接至偉龍馬路和機場大馬路；北端出入口段約一百六十米至信安馬路止。設計連施工期最長為一千一百六十五個工作天。位於北安一側的北連接線連接至澳門大橋的高架橋將適時開展，屆時天橋及隧道會一併開通使用。    承建公司須具技術    項目今年五月二十九日招標，採用預先評定資格的限制招標方式。第一階段為候選要求階段，甄審具資格的首五名候選人將進入第二階段的投標書提交階段。    余穎麟指出，大潭山隧道的建設是特區政府重要交通項目之一，且穿山隧道工程的技術含量高，技術有嚴格要求，故需要用資格預審方式甄選有資格的公司。當局已做前期鑽探、前期分析包括環評等，對山體的影響盡量減至最小。    走線須按城規要求    隧道走線爲何是轉彎而不是取直的設計？余穎麟解釋，隧道建設因應城市規劃要求，出入口在城市規劃已確定位置。南端出口要垂直於山體方向建造，以及連接到偉龍馬路、機場大馬路，兩端位置按規劃鋪排。    是否因應澳門大橋調整走線設計？余穎麟僅表示，隧道要配合周邊道路設計及交通規劃佈置，以最優的方案疏散路氹城及澳門之間的車輛。,http://www.macaodaily.com/html/2024-07/31/content_1771767.htm,甄審資格八選五    繼後入標競投    大潭山隧道料明年中開建    【本報消息】“大潭山隧道及其連接線設計連建造工程——隧道及南連接線——預先評定資格之限制招標”候選要求公開開啟會議昨日上午九時三十分於公共建設局舉行，共收到八份申請書,甄審 資格八選 五         繼後入標 競投         大潭 山 隧道 料 明年 中開建         【 本報 消息 】 “ 大潭 山 隧道 及其 連接線 設計連 建造 工程 — — 隧道 及南連 接線 — — 預先 評定 資格 之 限制 招標 ” 候選 要求 公開開 啟會議 昨日 上午 九時 三十分 於 公共 建設局 舉行 ， 共 收到 八份 申請 書 。 當局 期望 工程 明年 第二季 開展 ， 首先 開展 隧道 工程 。         聯 繫 第四 橋路 氹 城         公共 建設局 土木工程 師余穎麟 介紹 ， 現時位 於 路 氹 城 的 機場 圓形 地 與 澳門 大橋 的 直線 距離 被 大潭 山 阻隔 ， 開闢 大潭 山行車 隧道 ， 可 直接 將澳門 大橋 跨海 通道 及路 氹 城之間 的 道路 聯 繫 起 來 ， 為 澳門 半島 往來 路 氹 城 提供 快捷 的 通道 。 除可縮 減行車 時間 外 ， 還減 輕車輛 集中 行駛偉 龍馬路 、 北安 大馬路 、 氹 仔客 運碼頭 、 澳門 國際 機場 等 路段 造成 的 交通 壓力 。         工程 將 分期 開展 ， 首期 工程 主要 包括 建造 大潭 山 隧道 段 、 南連 接線 及其 北端 出入口 。 隧道 段 全長 約 六百米 ， 為 雙向 四車 道 的 穿山 隧道 ， 穿越 大潭 山 。 南連 接線 全長 約 四百米 ， 分別 連接 至偉龍馬路 和 機場 大馬路 ； 北端 出入口 段 約 一百六十 米 至 信安馬路止 。 設計連 施工期 最長 為 一千 一百六十五 個 工作 天 。 位 於 北安 一側 的 北連 接線 連接 至 澳門 大橋 的 高架 橋將 適時 開展 ， 屆 時 天橋 及 隧道 會 一 併 開通 使用 。         承建 公司 須具 技術         項目 今年 五月 二十九日 招標 ， 採用 預先 評定 資格 的 限制 招標 方式 。 第一 階段 為候 選 要求 階段 ， 甄審 具資格 的 首 五名 候選人將 進入 第二 階段 的 投標 書 提交 階段 。         余穎麟 指出 ， 大潭 山 隧道 的 建設 是 特區 政府 重要 交通 項目 之一 ， 且 穿山 隧道 工程 的 技術 含量 高 ， 技術 有 嚴格 要求 ， 故 需要 用資格 預審 方式 甄選有 資格 的 公司 。 當局 已 做 前期 鑽探 、 前期 分析 包括 環評 等 ， 對山體 的 影響 盡量 減至 最小 。         走線須 按 城規 要求         隧道 走線 爲 何是 轉彎 而 不是 取直 的 設計 ？ 余穎麟 解釋 ， 隧道 建設 因應 城市 規劃 要求 ， 出入口 在 城市 規劃 已 確定 位置 。 南端 出口 要 垂直 於 山體 方向 建造 ， 以及 連 接到 偉龍馬路 、 機場 大馬路 ， 兩端 位置 按規劃 鋪排 。         是否 因應 澳門 大橋 調整 走線 設計 ？ 余穎麟僅 表示 ， 隧道 要 配合 周邊 道路 設計及 交通 規劃 佈 置 ， 以 最優 的 方案 疏散 路 氹 城及 澳門 之間 的 車輛 。,2024-07-31
A2行車天橋料十月竣工,連新城A區黑沙環    設行人天橋通水塘    A2行車天橋料十月竣工    【本報消息】新城A區與澳門半島的第二條連接橋（A2連接橋）已完成橋樑結構，預計今年十月竣工。A2連接橋由新城A區西側連接澳門半島污水處理廠附近，設有行人天橋通往水塘。行車天橋為雙向單線行車，啟用後相信有助分流新城A區往返澳門半島的車輛。    工程如期造價微降    公共建設局網站資料顯示，“新城填海A區與澳門半島連接橋(A2)建造工程”於二〇二二年十一月委託，造價為二億一千三百七十多萬元，工期五百七十個工作天。儘管受到疫情影響，工程延期十四個工作天，但根據最新運輸工務範疇超過一億元的工程資料顯示，A2連接橋工程並未超時，如合同預計於今年十月竣工，造價則較原定計劃略有下降，降幅為百分之〇點〇二。    馬揸度一線或反向    A2連接橋工程包括建造一條全長約五百米的雙向單線行車天橋，連通新城填海區A區西側至勞動節大馬路近污水處理廠附近。同時建設一條全長約三百米、寛約五米的行人天橋，連接現有的水塘步行徑。工程並包括重整周邊路網。目前，行車天橋的橋樑結構已完工，正緊鑼密鼓建設行人天橋，進展順利。    公建局二二年公開招標工程時曾介紹，日後可由黑沙環新街往馬揸度博士大馬路（勞工局與蔡高學校之間道路），再經A2連接橋至新城A區。現時馬揸度博士大馬路為三線行車，配合連接橋開通，其中一線未來將改為反方向行車。行人天橋澳門半島一側的落腳點位於海堤，由於空間有限，未有條件建設電梯，故採用斜坡設計，方便有需要人士。行人天橋新城A區的落腳點將設有電梯。    A區多條通道在建    除A2天橋外，連接A區及澳門半島的其他交通工程亦有序推進。友誼圓形地行車天橋建造工程第二期（東方明珠行車天橋B匝道）預計明年十一月竣工。連接新城A區與澳門半島外港碼頭附近的連接橋（A3）目前已開建，工程預計二〇二七年三月竣工。另外當局還規劃在A3橋側增建一條行人通道，連接水塘與新城A區海濱綠廊，現正編制規劃。至於新城A、B區行車天橋設計連建造工程已判給，但網站未公佈具體開工及竣工日期。,http://www.macaodaily.com/html/2024-07/31/content_1771768.htm,連新城A區黑沙環    設行人天橋通水塘    A2行車天橋料十月竣工    【本報消息】新城A區與澳門半島的第二條連接橋（A2連接橋）已完成橋樑結構，預計今年十月竣工,連 新城 A 區 黑沙 環         設 行人 天橋通 水塘         A2 行車 天橋料 十月 竣工         【 本報 消息 】 新城 A 區與 澳門 半島 的 第二 條連 接橋 （ A2 連接橋 ） 已 完成 橋 樑 結構 ， 預計 今年 十月 竣工 。 A2 連接橋 由 新城 A 區西側 連接 澳門 半島 污水 處理廠 附近 ， 設有 行人 天橋 通往 水塘 。 行車 天橋 為 雙向 單線 行車 ， 啟用 後 相信 有助 分流 新城 A 區 往返 澳門 半島 的 車輛 。         工程 如期 造價 微降         公共 建設局 網站 資料 顯示 ， “ 新城 填海 A 區與 澳門 半島 連接橋 ( A2 ) 建造 工程 ” 於 二 〇 二 二年 十一月 委 託 ， 造價 為 二 億 一千三百 七十多 萬元 ， 工期 五百 七十 個 工作 天 。 儘 管 受到 疫情 影響 ， 工程 延期 十四 個 工作 天 ， 但 根據 最新 運輸 工務範疇 超過 一億元 的 工程 資料 顯示 ， A2 連接橋 工程 並未 超時 ， 如 合同 預計 於 今年 十月 竣工 ， 造價則 較 原定 計劃 略有 下降 ， 降幅 為 百分之 〇 點 〇 二 。         馬 揸 度 一線 或 反向         A2 連接橋 工程 包括 建造 一條 全長 約 五百米 的 雙向 單線 行車 天橋 ， 連通 新城 填海 區 A 區西側 至 勞動節 大馬路 近 污水 處理廠 附近 。 同時 建設 一條 全長 約 三百米 、 寛 約 五米 的 行人 天橋 ， 連接 現有 的 水塘 步行 徑 。 工程 並 包括 重整 周邊 路網 。 目前 ， 行車 天橋 的橋 樑 結構 已 完工 ， 正緊 鑼密 鼓建設 行人 天橋 ， 進展 順利 。         公建局 二 二年 公開 招標 工程 時 曾 介紹 ， 日後可 由 黑沙 環 新街 往馬 揸 度 博士 大馬路 （ 勞工局 與 蔡高學校 之間 道路 ） ， 再經 A2 連接橋 至 新城 A 區 。 現時 馬 揸 度 博士 大馬路 為 三線 行車 ， 配合 連接橋 開通 ， 其中 一線 未來將 改為 反 方向 行車 。 行人 天橋 澳門 半島 一側 的 落 腳點位 於 海堤 ， 由 於 空間 有限 ， 未有 條件 建設 電梯 ， 故 採用 斜坡 設計 ， 方便 有 需要 人士 。 行人 天橋 新城 A 區的 落腳點 將設 有 電梯 。         A 區多條 通道 在建         除 A2 天橋 外 ， 連接 A 區及 澳門 半島 的 其他 交通 工程 亦 有序 推進 。 友誼 圓形 地行車 天橋 建造 工程 第二期 （ 東方 明珠 行車 天橋 B 匝道 ） 預計 明年 十一月 竣工 。 連接 新城 A 區與 澳門 半島 外港 碼頭 附近 的 連接橋 （ A3 ） 目前 已 開建 ， 工程 預計 二 〇 二七 年 三月 竣工 。 另外 當局 還規劃 在 A3 橋側 增建 一條 行人 通道 ， 連接 水塘 與 新城 A 區海濱 綠廊 ， 現正 編制 規劃 。 至於 新城 A 、 B 區行車 天橋 設計連 建造 工程 已判給 ， 但 網站 未公 佈 具體 開工及 竣工 日期 。,2024-07-31
航海學校街周日圍封施工,配合內港南防浸工程推進    航海學校街周日圍封施工    【本報消息】公共建設局／交通事務局訊：配合內港南雨水泵站及下水道第二期工程的雨水及污水下水道施工，下環街對出的航海學校街將於八月四日臨時圍封施工，同時釋放鹹魚街對出的航海學校街路段。    “內港南雨水泵站及下水道工程”是特區政府重大防災工程之一，且具相當迫切性，現時已進入高峰施工階段。呼籲公眾提前掌握即時交通訊息，提早規劃出行路線。工程引致的不便希望駕駛者及居民諒解。,http://www.macaodaily.com/html/2024-07/31/content_1771770.htm,配合內港南防浸工程推進    航海學校街周日圍封施工    【本報消息】公共建設局／交通事務局訊：配合內港南雨水泵站及下水道第二期工程的雨水及污水下水道施工，下環街對出的航海學校街將於八月四日臨時圍封施工，同時釋放鹹魚街對出的航海學校街路段,配合 內港 南防浸 工程 推進         航海 學校 街 周日 圍封 施工         【 本報 消息 】 公共 建設局 ／ 交通 事務局 訊 ： 配合 內港南 雨水 泵站 及 下水道 第二期 工程 的 雨水 及 污水 下水道 施工 ， 下環街 對 出 的 航海 學校 街將 於 八月 四日 臨時 圍封 施工 ， 同時 釋放 鹹 魚街 對 出 的 航海 學校 街 路段 。         “ 內港南 雨水 泵站 及 下水道 工程 ” 是 特區 政府 重大 防災 工程 之一 ， 且 具相當 迫切性 ， 現時 已 進入 高峰 施工 階段 。 呼籲 公眾 提前 掌握 即時 交通 訊息 ， 提早 規劃 出 行路 線 。 工程 引致 的 不便 希望 駕駛者 及 居民 諒解 。,2024-07-31
男子掌摑持刀恐嚇店主被拘,買咖啡突情緒激動   揚言“下次攞槍”    男子掌摑持刀恐嚇店主被拘    【本報消息】一名本地男商人日前下午在東望洋新街一咖啡店購買咖啡時，疑不滿本地男店主的服務態度，涉嫌掌摑和拿刀恐嚇對方，更揚言“下次會攞把槍”。店主報案追究，治安警在接報十分鐘後，迅即拘捕涉案男商人，有人供認曾恐嚇店主，但否認掌摑對方。    被捕本地男子姓黃，三十歲，報稱商人。治安警落案控以傷人、禁用武器和恐嚇罪，案件已移送檢察院偵辦。案中本地男店主二十餘歲。治安警表示，在咖啡店檢獲的生果刀刃長約十一厘米。    案情顯示，本月廿八日下午約四時半，黃某到東望洋新街一咖啡店購買咖啡時，突然情緒激動，與男店主爭執並推撞。過程中，黃某涉嫌掌摑男店主後即離開。約五分鐘後，黃某折返咖啡店，並將一把生果刀放在櫃檯恐嚇男店主，並揚言“下次會攞把槍”便離開。男店主向治安警報案追究。    治安警接報約十分鐘後，在東望洋新街一處路上截獲涉案黃某。經查問，黃某供認買咖啡時，因店主的服務態度發生爭執，之後返回附近家中拿取生果刀再折返咖啡店恐嚇店主，但否認曾掌摑對方。治安警透過咖啡店的閉路電視監控系統，證實涉案黃某有傷人動作。,http://www.macaodaily.com/html/2024-07/31/content_1771700.htm,買咖啡突情緒激動   揚言“下次攞槍”    男子掌摑持刀恐嚇店主被拘    【本報消息】一名本地男商人日前下午在東望洋新街一咖啡店購買咖啡時，疑不滿本地男店主的服務態度，涉嫌掌摑和拿刀恐嚇對方，更揚言“下次會攞把槍”,買 咖啡 突情緒 激動       揚言 “ 下次 攞 槍 ”         男子 掌 摑 持刀 恐嚇 店主 被 拘         【 本報 消息 】 一名 本地 男 商人 日前 下午 在 東 望洋 新街 一 咖啡店 購買 咖啡 時 ， 疑不滿 本地 男 店主 的 服務態度 ， 涉嫌 掌 摑 和 拿 刀 恐嚇 對方 ， 更揚言 “ 下次 會 攞 把 槍 ” 。 店主 報案 追究 ， 治安警 在 接報 十分 鐘後 ， 迅即 拘捕 涉案 男 商人 ， 有人 供認 曾 恐嚇 店主 ， 但否 認掌 摑 對方 。         被捕 本地 男子 姓 黃 ， 三十 歲 ， 報稱 商人 。 治安警 落案 控以 傷人 、 禁用 武器 和 恐嚇 罪 ， 案件 已 移送 檢 察院 偵辦 。 案中 本地 男 店主 二十 餘歲 。 治安警 表示 ， 在 咖啡店 檢獲 的 生果 刀刃 長 約 十一 厘米 。         案情 顯示 ， 本月 廿八日 下午 約 四時 半 ， 黃 某到 東 望洋 新街 一 咖啡店 購買 咖啡 時 ， 突然 情緒 激動 ， 與 男 店主 爭執並 推撞 。 過程 中 ， 黃 某 涉嫌 掌 摑 男 店主 後 即 離開 。 約 五分 鐘後 ， 黃 某 折返 咖啡店 ， 並將 一把 生果 刀 放在 櫃 檯 恐嚇 男 店主 ， 並揚言 “ 下次 會 攞 把 槍 ” 便 離開 。 男 店主 向 治安警 報案 追究 。         治安警 接報 約 十分 鐘後 ， 在 東 望洋 新街 一處 路上 截獲 涉案 黃 某 。 經查問 ， 黃 某供 認買 咖啡 時 ， 因 店主 的 服務態度 發生 爭執 ， 之 後 返回 附近 家中 拿取 生果 刀 再 折返 咖啡店 恐嚇 店主 ， 但否 認曾 掌 摑 對方 。 治安警 透過 咖啡店 的 閉路 電視監 控系統 ， 證實 涉案 黃 某 有 傷人動作 。,2024-07-31
當局研優化特定領域反恐策略,當局研優化特定領域反恐策略    【本報消息】議員李振宇書面質詢關於《反恐法》立法，保安司司長辦公室主任張玉英回覆時透露，保安當局已就完善本澳反恐法律制度開展研究，並因應近年及近期國際恐怖主義活動的最新趨勢和特點，現正就特定領域的防治策略開展針對性優化研究，以期完善修法方案，從而能更有效地回應實際防治需要；一旦落實修法方案，將根據特區政府的立法總體規劃，適時推動修法所需的一切程序。    恐怖主義是國家安全的重大風險威脅，相關問題需要全社會加強認知重視。特區政府近年透過全民國家安全教育展，向居民展示我國反恐工作最新情況和取得的重要成果。司警局也透過社區警務和青少年培養計劃，把反恐怖主義納入國家安全宣傳教育的內容之中，未來亦根據全球反恐形勢，適時拓展宣傳所及層面，持續提升居民的相關安全意識。    她又提到，本澳一向積極參與恐怖主義問題的區域治理，相關保安部隊及保安部門根據法定職責，透過與廣東省、香港特區執法部門於二○○五年建立的協作機制，開展跨境反恐合作；並藉定期的會議、培訓和演練，加強情報互通、提升應急協作能力，未來將在現有良好的基礎上持續深化相互執法合作，更好應對更複雜的安全挑戰，鞏固並不斷提高維護國家安全和本地社會治安的能力和成效。,http://www.macaodaily.com/html/2024-07/31/content_1771701.htm,當局研優化特定領域反恐策略    【本報消息】議員李振宇書面質詢關於《反恐法》立法，保安司司長辦公室主任張玉英回覆時透露，保安當局已就完善本澳反恐法律制度開展研究，並因應近年及近期國際恐怖主義活動的最新趨勢和特點，現正就特定領域的防治策略開展針對性優化研究，以期完善修法方案，從而能更有效地回應實際防治需要,當局 研優化 特定 領域 反恐 策略         【 本報 消息 】 議員 李振宇 書面質 詢關 於 《 反恐 法 》 立法 ， 保安 司司 長 辦公 室主任 張玉英 回覆 時 透露 ， 保安 當局 已 就 完善 本澳 反恐 法律 制度 開展 研究 ， 並因 應 近年 及 近期 國際 恐怖 主義活動 的 最新 趨勢 和 特點 ， 現正 就 特定 領域 的 防治 策略 開展 針對性 優化 研究 ， 以期 完善 修法 方案 ， 從 而 能 更 有效 地 回應 實際 防治 需要 ； 一旦 落實 修法 方案 ， 將根據 特區 政府 的 立法 總體 規劃 ， 適時 推動 修法 所 需 的 一切 程序 。         恐怖 主義是 國家 安全 的 重大 風險 威脅 ， 相關 問題 需要 全社 會加強 認知 重視 。 特區 政府 近年 透過 全民 國家 安全 教育展 ， 向 居民 展示 我國 反恐 工作 最新 情況 和 取得 的 重要 成果 。 司 警局 也 透過 社區 警務 和 青少年 培養 計劃 ， 把 反恐怖 主義納入 國家 安全 宣傳 教育 的 內容 之中 ， 未來 亦 根據 全球 反恐 形勢 ， 適時 拓展 宣傳 所及 層面 ， 持續 提升 居民 的 相關 安全 意識 。         她 又 提到 ， 本澳 一向 積極 參 與 恐怖 主義問題 的 區域 治理 ， 相關 保安 部隊 及 保安 部門 根據 法定 職責 ， 透過 與 廣東省 、 香港 特區 執法 部門 於 二 ○ ○ 五年 建立 的 協作 機制 ， 開展 跨境 反恐 合作 ； 並藉 定期 的 會議 、 培訓 和 演練 ， 加強 情報 互通 、 提升 應急 協作 能力 ， 未來將 在 現有 良好 的 基礎 上 持續 深化 相互 執法 合作 ， 更好 應對 更 複 雜的 安全 挑戰 ， 鞏固 並不斷 提高 維護國家 安全 和 本地 社會 治安 的 能力 和 成效 。,2024-07-31
回收紙皮,回收紙皮    市面經濟轉趨活躍，回收業者拖着沉重紙皮前往交收。                                     周維勤   攝,http://www.macaodaily.com/html/2024-07/31/content_1771702.htm,回收紙皮    市面經濟轉趨活躍，回收業者拖着沉重紙皮前往交收,回收 紙皮         市面 經濟 轉趨 活躍 ， 回收 業者 拖 着 沉重 紙皮 前往 交收 。                                                                           周維勤       攝,2024-07-31
青年網聊遭合成裸片索萬元,青年網聊遭合成裸片索萬元    【本報消息】本地男青年網上交友遭人勒索。日前與“女網友”聊天及視像通話，隨後收到被合成的裸露影片，並勒索一萬元，事主不甘被要脅向司警報案。    案中男事主本月廿九日晚上約十一時向司警報案稱，當日中午上網期間透過交友程式認識一名女子，隨後轉至另一通訊軟件聊天。    期間，“女網友”表示可發段裸露影片，事主同意並點入對方提供的網址，但發現無法打開網頁內容，事主向“女網友”反映並視像通話，期間收到長約一分鐘的裸露片段，隨後對方中斷連線。    事主其後收對一段合成的裸露影片，對方要求事主提供一萬元“贖金”，否則將向事主親友發放相關短片。事主未有就範向司警局報案，警方正對案件展開調查。,http://www.macaodaily.com/html/2024-07/31/content_1771703.htm,期間，“女網友”表示可發段裸露影片，事主同意並點入對方提供的網址，但發現無法打開網頁內容，事主向“女網友”反映並視像通話，期間收到長約一分鐘的裸露片段，隨後對方中斷連線,青年 網聊 遭 合成 裸片 索萬元         【 本報 消息 】 本地 男青年 網上 交友 遭 人 勒索 。 日前 與 “ 女 網友 ” 聊天 及視 像 通話 ， 隨後 收到 被 合成 的 裸露 影片 ， 並 勒索 一萬元 ， 事主 不甘 被 要脅 向 司警 報案 。         案中 男 事主 本月 廿九日 晚上 約 十一 時向 司警 報案 稱 ， 當日 中午 上 網期間 透過 交友 程式 認識 一名 女子 ， 隨後轉 至 另 一通 訊 軟件 聊天 。         期間 ， “ 女 網友 ” 表示 可發段 裸露 影片 ， 事主 同意 並點入 對方 提供 的 網址 ， 但 發現 無法 打開 網頁 內容 ， 事主 向 “ 女 網友 ” 反映 並視 像 通話 ， 期間 收到 長 約 一分 鐘的 裸露 片段 ， 隨後對 方中斷 連線 。         事主 其後收 對 一段 合成 的 裸露 影片 ， 對方 要求 事主 提供 一萬元 “ 贖金 ” ， 否則 將向 事主 親友 發放 相關 短片 。 事主 未有 就 範向司 警局 報案 ， 警方正 對 案件 展開 調查 。,2024-07-31
