Title,Content,Link,Summary,Preprocessed_Content,Date
李海生演反派上位   娛翁,李海生演反派上位    昨日傳出李海生離世的消息，傳媒紛以《愛 · 回家》申叔形容，原因自是李海生三字未必有太多人認識，算是綠葉演員常見情況的一種。    李海生被封為香港先生鼻祖的肌肉照，這些年早已在網上瘋傳，不少人看過之後都嘩然，只因想像不到一位TVB前綠葉曾經如此爆肌，電視台的那些香港先生根本沒法相比。而他生前最大的遺憾可能是從沒擔正過主角，從加入電影圈之初到最後的《愛 · 回家》，大多都是綠葉角色，哪怕在劉家榮執導的《一膽二力三功夫》中已經算是第三男主角，但始終都不是真主角。    然而這位綠葉卻一直很受導演的歡迎，袁和平、馮克安、洪金寶、吳宇森、劉家良、劉家榮及成龍等導演都喜歡找李海生拍戲。原因是李海生不僅精通詠春，其他拳法亦擅長，兵器亦有造詣。從影以來他很清楚自己的定位是演員而不是明星，從沒發生過爭排名之事，且備有演員道德，絕不會遲到早退，儘管自己開館授徒人數上千，但拍戲時亦會依足導演及武術指導的指示及安排，不會以大師傅自居說這不通那不行的。    李海生早年在電影圈中也算是奇葩，絕大多數受歡迎的演員都是演正派角色，惟獨李海生是因為演反派而上位。    原因除了他是以真功夫拍攝電影而受戲迷欣賞外，其中一個原因就是他的徒弟太多，每當他的新戲在午夜場（即類近如今的首映場，其時新戲慣在午夜場首映）上映時，觀眾群中不乏他的徒弟——畢竟過去練武之人都有食夜粥的習慣，宵夜後去看午夜場更屬等閒，是以當他的徒弟在大銀幕上看到師傅的演出，報以掌聲及喝采聲回應都很平常。    娛翁,http://www.macaodaily.com/html/2024-09/11/content_1780328.htm,原因除了他是以真功夫拍攝電影而受戲迷欣賞外，其中一個原因就是他的徒弟太多，每當他的新戲在午夜場（即類近如今的首映場，其時新戲慣在午夜場首映）上映時，觀眾群中不乏他的徒弟——畢竟過去練武之人都有食夜粥的習慣，宵夜後去看午夜場更屬等閒，是以當他的徒弟在大銀幕上看到師傅的演出，報以掌聲及喝采聲回應都很平常,李 海生 演 反派 上位         昨日 傳出 李 海生 離世 的 消息 ， 傳媒紛 以 《 愛   ·   回家 》 申叔 形容 ， 原因 自是 李 海生 三字 未必 有 太多人 認識 ， 算是 綠葉 演員常見 情況 的 一種 。         李 海生 被 封為 香港 先生 鼻祖 的 肌肉 照 ， 這些 年 早已 在 網上 瘋傳 ， 不少 人 看過 之後都 嘩然 ， 只 因 想像 不到 一位 TVB 前綠葉 曾經 如此 爆肌 ， 電視台 的 那些 香港 先生 根本 沒法 相比 。 而 他 生前 最大 的 遺憾 可能 是 從 沒擔 正過 主角 ， 從 加入 電 影圈 之初 到 最 後 的 《 愛   ·   回家 》 ， 大多 都 是 綠葉 角色 ， 哪怕 在 劉家榮 執導 的 《 一膽二力 三 功夫 》 中 已經 算是 第三 男主角 ， 但始終 都 不是 真 主角 。         然而 這位 綠葉 卻 一直 很 受導演 的 歡迎 ， 袁和平 、 馮克安 、 洪金 寶 、 吳宇森 、 劉家良 、 劉家榮 及 成龍 等 導演 都 喜歡 找 李 海生 拍戲 。 原因 是 李 海生 不僅 精通 詠春 ， 其他 拳法 亦 擅長 ， 兵器 亦 有 造詣 。 從 影以 來 他 很 清楚 自己 的 定位 是 演員 而 不是 明星 ， 從 沒 發生 過爭 排名 之 事 ， 且備 有 演員 道德 ， 絕不會 遲到 早退 ， 儘 管 自己 開館 授徒 人數 上千 ， 但 拍戲 時亦會 依足導 演及 武術 指導 的 指示 及 安排 ， 不會 以大師傅 自居 說 這 不通 那 不行 的 。         李 海生 早年 在電 影圈 中 也 算是 奇葩 ， 絕 大多 數受 歡迎 的 演員 都 是 演 正派 角色 ， 惟獨 李 海生 是 因為 演 反派 而 上位 。         原因 除了 他 是 以 真功夫 拍攝 電影 而 受戲 迷欣賞 外 ， 其中 一個 原因 就是 他 的 徒弟 太 多 ， 每當 他 的 新戲 在 午夜 場 （ 即類 近 如今 的 首映 場 ， 其時 新 戲慣 在 午夜 場 首映 ） 上映 時 ， 觀眾 群中 不乏 他 的 徒弟 — — 畢竟 過去 練 武之人 都 有 食夜 粥 的 習慣 ， 宵夜 後 去 看 午夜 場更屬 等 閒 ， 是 以當 他 的 徒弟 在 大銀幕 上 看到 師傅 的 演出 ， 報以 掌聲 及 喝采 聲 回應 都 很 平常 。         娛翁,2024-09-11
蔡潔養活自己等緣份    高梁,蔡潔養活自己等緣份    每日適意攤抖時光——晩飯後嘆電視，順衆愛好，晩晩對着幾條死屍，還不止，女法醫逐條傷痕硏究，鑿開天靈蓋，開胸掏心肝，鏡頭毛骨聳然，出奇地，電檢處未接到“令人作嘔”的投訴。可能面對那位美麗儒雅的女法醫，佢都唔驚，你哋麻甩佬驚甚麼……。這角色之難，要演出這是一份“神聖的職業”，別人唯恐遠避不及，我獨愛之！“Dr范”，蔡潔演成功了，觀眾對這角色又敬又愛又憐，無絲毫恐怖生人勿近，都想親近……。    晩晩看劇集對住死屍，法醫細意解剖；又在酒吧，與黃宗澤、袁偉豪談論案情。如此美艷女子，滿腦子解剖人間罪惡，很想拍拖，希望精神有所寄託，又“遇人不淑”，竟然變態的。女法醫美麗有學識智慧，生活感情太沉重了……。“角色難脫離，一度情緒崩潰爆喊，要向媽媽求救……”母親是最大後盾，即飛來香港，陪伴女兒。有個趣味問題，母親湛江飛來麼？蔡潔出生廣東省湛江市。澳洲飛來麼？蔡潔澳洲讀書，當地選美；再回香港拍電影《香港仔》，“合演有古天樂、楊千嬅、梁詠琪：好似發夢一樣……”蔡潔初遇風雲，已非池中物——第一次演電影，蔡潔幾乎全裸，與曾志偉演出大膽情慾戲，令人印象深刻，“不會再挑戰這個尺度了”。蔡潔説：“我覺得，已過了那個年紀和階段，做了十年演員，很清楚甚麼適合自己。選擇角色，會考慮再謹愼……。今次，有機會為劇集唱插曲，我認為已是在演藝路上的成就解鎖，還有一把鎖要解：親自執導影片，希望還趁住有些少青春，做自己想做的事”……職場得意，情場……。    “感情生活未有着落”。三十五歲蔡潔笑稱：“眞是聞者傷心，有得急，遇到時就會有，未遇到就專心工作。要急也急不來，家人沒有催。”苦惱是，緋聞連綿，無端被指與好友黃宗澤相戀，二人都覺得非常搞笑。“沒有抗拒與圈中人拍拖……”蔡潔表示：“順其自然，不能硬性指定，對方一定要或不可以做甚麼工作，或對對方要幾高幾富，之類。沒有定下甚麼條件，講Feel，我少女心，只要情到濃時。現在，做好工作，養活自己，等緣份……。”    高梁,http://www.macaodaily.com/html/2024-09/11/content_1780330.htm,蔡潔養活自己等緣份    每日適意攤抖時光——晩飯後嘆電視，順衆愛好，晩晩對着幾條死屍，還不止，女法醫逐條傷痕硏究，鑿開天靈蓋，開胸掏心肝，鏡頭毛骨聳然，出奇地，電檢處未接到“令人作嘔”的投訴,蔡潔 養活 自己 等 緣份         每日 適意 攤抖 時光 — — 晩 飯後嘆 電視 ， 順 衆 愛好 ， 晩 晩 對 着 幾條 死屍 ， 還 不止 ， 女法 醫逐 條傷 痕硏 究 ， 鑿 開天 靈蓋 ， 開胸 掏 心肝 ， 鏡頭 毛骨聳然 ， 出奇 地 ， 電檢處 未 接到 “ 令人 作嘔 ” 的 投訴 。 可能 面對 那位 美麗 儒雅 的 女法醫 ， 佢 都 唔 驚 ， 你 哋 麻 甩 佬 驚 甚麼 … … 。 這 角色 之難 ， 要 演出 這是 一份 “ 神聖 的 職業 ” ， 別人 唯恐 遠避 不及 ， 我 獨愛之 ！ “ Dr 范 ” ， 蔡潔演 成功 了 ， 觀眾 對 這 角色 又 敬 又 愛又憐 ， 無絲毫 恐怖 生人 勿近 ， 都 想 親近 … … 。         晩 晩 看 劇集 對 住 死屍 ， 法醫細意 解剖 ； 又 在 酒吧 ， 與 黃 宗澤 、 袁偉豪 談論 案情 。 如此 美艷 女子 ， 滿腦子 解剖 人間 罪惡 ， 很想 拍拖 ， 希望 精神 有所 寄 託 ， 又 “ 遇人不淑 ” ， 竟然 變態 的 。 女法 醫美麗有 學識 智慧 ， 生活 感情 太沉重 了 … … 。 “ 角色 難脫 離 ， 一度 情緒 崩潰 爆喊 ， 要 向 媽媽 求救 … … ” 母親 是 最大 後 盾 ， 即 飛來 香港 ， 陪伴 女兒 。 有個 趣味 問題 ， 母親 湛江 飛來麼 ？ 蔡潔 出生 廣東省 湛江市 。 澳洲 飛來麼 ？ 蔡潔 澳洲 讀書 ， 當地 選美 ； 再 回 香港 拍電影 《 香港 仔 》 ， “ 合演 有 古天樂 、 楊千嬅 、 梁詠琪 ： 好似 發夢 一樣 … … ” 蔡潔初 遇風 雲 ， 已 非池中物 — — 第一次 演電影 ， 蔡潔 幾乎 全裸 ， 與 曾志偉 演出 大膽情 慾 戲 ， 令人 印象 深刻 ， “ 不會 再 挑戰 這個 尺度 了 ” 。 蔡 潔 説 ： “ 我覺 得 ， 已過 了 那個 年紀 和 階段 ， 做 了 十年 演員 ， 很 清楚 甚麼 適合 自己 。 選擇 角色 ， 會 考慮 再 謹 愼 … … 。 今 次 ， 有 機會 為 劇集 唱 插曲 ， 我 認為 已 是 在 演藝 路上 的 成就 解鎖 ， 還有 一把 鎖要 解 ： 親自 執導 影片 ， 希望 還趁 住 有些 少 青春 ， 做 自己 想 做 的 事 ” … … 職場 得意 ， 情場 … … 。         “ 感情生活 未有 着落 ” 。 三十五 歲 蔡潔 笑 稱 ： “ 眞 是 聞者 傷心 ， 有 得 急 ， 遇到 時 就 會 有 ， 未 遇到 就 專心 工作 。 要 急 也 急 不來 ， 家人 沒有 催 。 ” 苦惱 是 ， 緋聞 連綿 ， 無端 被 指 與 好友 黃 宗澤相戀 ， 二人 都 覺得 非常 搞笑 。 “ 沒有 抗拒 與 圈 中人 拍拖 … … ” 蔡潔 表示 ： “ 順其 自然 ， 不能 硬性 指定 ， 對方 一定 要 或 不 可以 做 甚麼 工作 ， 或 對 對 方要 幾高 幾富 ， 之類 。 沒有 定下 甚麼 條件 ， 講 Feel ， 我 少女 心 ， 只要 情到 濃時 。 現在 ， 做好 工作 ， 養活 自己 ， 等 緣份 … … 。 ”         高梁,2024-09-11
元華憶白鴿巢與李小龍對戲   文：花生仔,來澳撐老友漫畫展    元華憶白鴿巢與李小龍對戲    元華日前獲邀以嘉賓身份來澳出席在瘋堂創意園舉行的《崔成安 · 龍的傳奇紀念主題展》，為著名漫畫家好友崔成安打氣。元華表示，這次難得來澳參與活動，令他想起早年在澳門拍攝《精武門》，與李小龍對戲的往事。    現年七十四歲的元華近年逐漸減產，並已移居加拿大生活，弄孫為樂。今年初他曾來澳出席《萬千星輝頒獎典禮二〇二三》，與朱咪咪一同頒發最佳男配角獎。談到近況，他表示很享受在加拿大定居的生活，經常出外嘆茶，每日過得十分悠閒，偶爾亦會回港參與不同活動。至於演戲工作，元華表示如果遇到合適的劇本，還是願意復出，雖然仍十分熱愛，但也到了退居二線的年紀，反而想將精力支持更多有演藝夢想的年輕人。    談到對澳門的印象，元華表示難忘拍攝《精武門》時，於上世紀七十年代在澳門白鴿巢公園門口與李小龍對戲的一幕。他又談到當年《精武門》曾在澳門高園街、基督教墳場等不同地方取景，雖然自己要拍攝的戲份不多，但非常感恩能參與其中，這也是他拍攝功夫電影的其中一個起點。此後，元華不時來澳門遊玩，品嘗地道美食，非常喜歡這座小城的寧靜安逸。    這次來澳撐好友崔成安，元華表示與對方相識多年，非常欣賞其畫作。除了喜歡功夫外，元華亦坦言自己曾是“漫畫迷”，經常追看王澤《老夫子》及黃玉郎《龍虎門》等漫畫作品，令他意想不到的是，後來有機會拍攝《龍虎門》電影版，飾演武林高手王降龍一角，過足戲癮。    文：花生仔,http://www.macaodaily.com/html/2024-09/11/content_1780324.htm,元華表示，這次難得來澳參與活動，令他想起早年在澳門拍攝《精武門》，與李小龍對戲的往事,來 澳撐 老友 漫畫展         元華憶 白鴿 巢 與 李小龍 對戲         元華 日前 獲邀 以嘉賓 身份 來澳 出席 在 瘋堂 創意園 舉行 的 《 崔成安   ·   龍 的 傳奇 紀念 主題展 》 ， 為 著名 漫畫家 好友 崔成安 打氣 。 元華 表示 ， 這次 難得來 澳參 與 活動 ， 令 他 想起 早年 在 澳門 拍 攝 《 精武 門 》 ， 與 李小龍 對戲 的 往事 。         現年 七十四 歲 的 元華 近年 逐漸 減產 ， 並已 移居 加拿大 生活 ， 弄 孫為樂 。 今年初 他 曾 來 澳 出席 《 萬千星輝 頒獎 典禮 二 〇 二三 》 ， 與 朱 咪咪 一同 頒發 最佳 男配角 獎 。 談到 近況 ， 他 表示 很 享受 在 加拿大 定居 的 生活 ， 經常 出外 嘆 茶 ， 每日 過得 十分 悠閒 ， 偶爾亦會 回港 參與 不同 活動 。 至於 演戲 工作 ， 元華 表示 如果 遇到 合適 的 劇本 ， 還是 願意 復 出 ， 雖然 仍 十分 熱愛 ， 但 也 到 了 退居 二線 的 年紀 ， 反而 想將 精力 支持 更 多 有 演藝夢想 的 年 輕人 。         談到 對 澳門 的 印象 ， 元華 表示 難 忘 拍 攝 《 精武 門 》 時 ， 於 上 世紀 七十年代 在 澳門 白鴿 巢公園 門口 與 李小龍 對戲 的 一幕 。 他 又 談到 當年 《 精武 門 》 曾 在 澳門 高園 街 、 基督教 墳場 等 不同 地方 取景 ， 雖然 自己 要 拍 攝 的 戲份 不 多 ， 但 非常 感恩 能 參 與 其中 ， 這也 是 他 拍 攝 功夫 電影 的 其中 一個 起點 。 此 後 ， 元華不時 來 澳門遊 玩 ， 品嘗 地道 美食 ， 非常 喜歡 這座 小城 的 寧靜 安逸 。         這次 來 澳撐 好友 崔成安 ， 元華 表示 與 對方 相識 多年 ， 非常 欣賞 其 畫作 。 除了 喜歡 功夫 外 ， 元華 亦 坦言 自己 曾 是 “ 漫畫 迷 ” ， 經常 追 看 王澤 《 老夫子 》 及黃玉郎 《 龍虎門 》 等 漫畫 作品 ， 令 他 意想不到 的 是 ， 後 來 有 機會 拍 攝 《 龍虎門 》 電 影版 ， 飾演 武林高手 王降 龍 一角 ， 過足 戲癮 。         文 ： 花生 仔,2024-09-11
趙啟業執導收穫豐   文：三三如一,《那夜與友人》月底上演    趙啟業執導收穫豐    由趙啟業執導的《那夜與友人》本月二十八、二十九日在文化中心黑盒劇場演出三場。    近年趙啟業將精力投放在導戲上，執導了不少舞台作品。他表示：“在我心目中，導演是一個需承擔很大責任的崗位，需要懂說故事並將之呈現給觀眾，導演還是整個戲和製作團隊的核心。不論設計師、後台團隊還是演員都主要跟隨導演的想法，討論並執行，總的來說導演是具有挑戰性和燒腦的工作崗位。”    為了提升自己的導演水平，趙啟業選擇報讀澳門演藝學院戲劇學校的導演課程，跟隨導師學習各種知識。他說：“非常感謝陳斐力老師及馬淑芬老師在學校一年的教導。由於在戲劇學校期間的導演功課要求同學之間互相導戲，我更需要為自己的作業去處理佈景、音樂，以便更加了解到台位、空間、佈景的關係。其實導演最大的學問是同‘人’溝通，你的說話能夠清楚傳達給予他人，對方又真的了解而沒有落差，有時還夾雜着人情世故，所以是一門高深學問。”    趙啟業還透露此次《那夜與友人》的演員組合十分新鮮，朱健斌、吳嘉偉、鄭曉琳雖然是首次合作，但很快大家就創造出一種三人獨有的氛圍，令趙啟業感到驚喜。    文：三三如一,http://www.macaodaily.com/html/2024-09/11/content_1780331.htm,”    趙啟業還透露此次《那夜與友人》的演員組合十分新鮮，朱健斌、吳嘉偉、鄭曉琳雖然是首次合作，但很快大家就創造出一種三人獨有的氛圍，令趙啟業感到驚喜,《 那夜 與 友人 》 月底 上演         趙 啟業 執導收 穫 豐         由 趙 啟業 執導 的 《 那夜 與 友人 》 本月 二十八 、 二十九日 在 文化 中心 黑盒 劇場 演出 三場 。         近年 趙 啟業將 精力 投放 在 導戲 上 ， 執導 了 不少 舞台 作品 。 他 表示 ： “ 在 我 心目 中 ， 導演 是 一個 需承擔 很大 責任 的 崗位 ， 需要 懂 說 故事 並將 之 呈 現給 觀眾 ， 導演 還是 整個戲 和 製 作 團 隊 的 核心 。 不論 設計師 、 後 台團隊 還是 演員 都 主要 跟 隨導演 的 想法 ， 討論 並執行 ， 總 的 來 說 導演 是 具有 挑戰性 和 燒腦 的 工作 崗位 。 ”         為 了 提升 自己 的 導演 水平 ， 趙 啟業 選擇 報讀 澳門 演藝學院 戲劇 學校 的 導演 課程 ， 跟 隨導 師學習 各種 知識 。 他 說 ： “ 非常 感謝陳斐力 老師 及馬淑芬 老師 在 學校 一年 的 教導 。 由 於 在 戲劇 學校 期間 的 導演 功課 要求 同學 之間 互相 導戲 ， 我 更 需要 為 自己 的 作業 去 處理 佈 景 、 音樂 ， 以便 更加 了解 到 台位 、 空間 、 佈 景的關 係 。 其實 導演 最大 的 學問 是 同 ‘ 人 ’ 溝通 ， 你 的 說 話 能夠 清楚 傳達 給予 他人 ， 對方 又 真的 了解 而 沒 有 落差 ， 有時 還夾雜 着 人情世故 ， 所以 是 一門 高深 學問 。 ”         趙 啟業還 透露 此次 《 那夜 與 友人 》 的 演員 組合 十分 新鮮 ， 朱健斌 、 吳嘉偉 、 鄭曉琳 雖然 是 首次 合作 ， 但 很快 大家 就 創造 出 一種 三人 獨有 的 氛圍 ， 令 趙 啟業 感到 驚喜 。         文 ： 三三如 一,2024-09-11
精彩的敘事典範    小  也,精彩的敘事典範    ——談《失竊風雲》    一個垃圾桶，埋藏着尋冤計劃；一次尋垃圾桶的過程，揭開不為人知的罪惡。印度片《失竊風雲》敘事別出心裁，引人入勝，是講故事的精彩典範。    印度每年製作大量優質好戲，鮮有登錄港澳銀幕，串流平台Netflix是欣賞的上佳途徑。新上架的《失竊風雲》，從理髮師向警方報失垃圾桶開始，警方不肯接受，因為價值低，但主角賴死不走，送錢賄賂要警方追查。這前奏率先表現主角的堅持、垃圾桶的重要、貪污盛行的警隊，清晰易明。    兩個半小時的片長，不斷製造煙幕，引領觀眾聯想垃圾桶對主角的重大意義，以及尋桶的曲折。期間也加入幫派鬥爭、偷竊行為、警賊勾結等枝節，交織出與垃圾桶失竊的線索。影片的懸疑性在於運用查案片模式，一步一步追查偷桶真兇。    中段加入更多“掩眼法”，專門入屋爆竊殺人的罪犯，已被警員逮捕，為何還出現與主角肉搏？偷桶賊明明只偷了垃圾桶，為何無端端強姦主角女兒？編導很聰明，運用擾亂觀眾視線的枝節，看得人難明，最後爆發出驚人真相後，讓人驚覺難明的枝節原來是罪惡線索。偷桶背後還有嚴重罪行、主角堅持尋桶的親情因由、女兒與罪犯的特殊關係，一切一切峰迴路轉，交織出強勁的劇力。    初看簡單，漸看複雜。從表面報失到內有企圖，從眾多枝節到匯聚合一，從不同時空到互有關連，編導的說故事技巧非常高明。先把情節拆開，再慢慢重組，過程中既有跨時間的厚度，又懸疑吸引，揭開真相後更能激發石破天驚的震撼力，相當精彩。同時進一步彰顯主題，以罪惡反映印度社會的不公不義，並滲透着“人在做、天在看”的報應循環，注入希臘悲劇的色彩。    印度電影業一直很強，近年透過串流平台推廣到全球各國，影響力更大，題材更多元，劇本更紮實，不忘控訴社會弊病，形成多姿多彩的創作力。    lhaio@yahoo.com.hk    小  也,http://www.macaodaily.com/html/2024-09/11/content_1780333.htm,新上架的《失竊風雲》，從理髮師向警方報失垃圾桶開始，警方不肯接受，因為價值低，但主角賴死不走，送錢賄賂要警方追查,精彩 的 敘 事典 範         — — 談 《 失竊風 雲 》         一個 垃圾桶 ， 埋藏 着 尋冤 計劃 ； 一次 尋 垃圾桶 的 過程 ， 揭開 不為 人知 的 罪惡 。 印度 片 《 失竊風 雲 》 敘事別 出 心裁 ， 引人 入勝 ， 是講 故事 的 精彩 典範 。         印度 每年 製 作 大量 優質 好戲 ， 鮮有 登錄 港澳 銀幕 ， 串流 平台 Netflix 是 欣賞 的 上佳 途徑 。 新 上架 的 《 失竊風 雲 》 ， 從理 髮 師向 警方 報失 垃圾桶 開始 ， 警方 不肯 接受 ， 因為 價值 低 ， 但 主角 賴死 不 走 ， 送錢 賄賂 要 警方 追查 。 這 前奏 率先 表現 主角 的 堅持 、 垃圾桶 的 重要 、 貪污 盛行 的 警隊 ， 清晰 易明 。         兩個 半小時 的 片長 ， 不 斷 製 造 煙 幕 ， 引領 觀眾 聯想 垃圾桶 對 主角 的 重大 意義 ， 以及 尋桶 的 曲折 。 期間 也 加入 幫派 鬥爭 、 偷竊行 為 、 警賊 勾結 等 枝節 ， 交織 出 與 垃圾桶 失竊 的 線索 。 影片 的 懸疑性 在 於 運用 查案 片 模式 ， 一步 一步 追查 偷桶 真 兇 。         中段 加入 更 多 “ 掩眼法 ” ， 專門入 屋 爆竊 殺 人 的 罪犯 ， 已 被 警員 逮捕 ， 為何 還出現 與 主角 肉搏 ？ 偷桶 賊 明明 只 偷 了 垃圾桶 ， 為何 無端 端 強姦 主角 女兒 ？ 編導 很 聰明 ， 運用 擾亂 觀眾 視線 的 枝節 ， 看得人 難明 ， 最後爆 發出 驚人 真相 後 ， 讓 人 驚覺 難明 的 枝節 原來 是 罪 惡線索 。 偷桶 背後還 有 嚴重 罪行 、 主角 堅持 尋桶 的 親情 因由 、 女兒 與 罪犯 的 特殊 關 係 ， 一切 一切 峰 迴 路轉 ， 交織 出強 勁 的 劇力 。         初看 簡單 ， 漸看 複 雜 。 從 表面 報失 到 內 有 企圖 ， 從眾 多枝 節到 匯 聚合 一 ， 從 不同 時空到 互有 關連 ， 編導 的 說 故事 技巧 非常 高明 。 先 把 情節 拆開 ， 再 慢慢 重組 ， 過程 中 既有 跨時間 的 厚度 ， 又 懸疑 吸引 ， 揭開 真相 後 更 能 激發 石破天 驚 的 震撼力 ， 相當 精彩 。 同時 進 一步 彰 顯主題 ， 以罪 惡 反映 印度 社會 的 不公 不義 ， 並滲 透 着 “ 人 在 做 、 天在 看 ” 的 報應 循環 ， 注入 希臘 悲劇 的 色彩 。         印度 電影業 一直 很強 ， 近年 透過 串流 平台 推廣到 全球 各國 ， 影響力 更 大 ， 題材 更 多元 ， 劇本 更 紮 實 ， 不忘 控訴 社會 弊病 ， 形成 多姿多彩 的 創作力 。         lhaio @ yahoo . com . hk         小     也,2024-09-11
