Title,Content,Link,Summary,Preprocessed_Content,Date
中國進口規模近二百萬億,中國進口規模近二百萬億    中國海關總署副署長王令浚十二日在國新辦發佈會上介紹，中國進口市場規模龐大，已經連續十五年穩居全球第二大進口市場，累計進口規模接近二百萬億元人民幣。    根據初步測算，去年中國佔全球進口總值的百分之十點六，繼續保持在百分之十以上水平。今年一季度，中國進口“量價齊升”，進口規模再創新高，可以說中國的大市場為世界提供了大機遇。    王令浚表示，下一步，海關將按照今年《政府工作報告》關於積極擴大優質產品進口的決策部署，繼續抓好各項支持措施的落實，持續推動優質農食產品檢疫准入，支持關鍵零部件、重要原材料、能源資源的擴大進口，以更大的力度、更實舉措服務高質量發展和高水平開放。    “帶路”外貿增5.5%    王令浚還介紹，一季度，中國對共建“一帶一路”國家進出口四點八二萬億元，增長百分之五點五，佔進出口總值的百分之四十七點四，同比提升○點二個百分點。    一季度，中國以對外承包工程方式對共建國家出口二百點四億元，其中對東盟、中東、中亞國家的出口分別增長百分之三十一點四、百分之一百六十九點三、百分之三點六。出口光伏產品超過三百億元，太陽能、風力等可再生能源發電機組超過十二萬台，支持共建國家能源轉型和綠色低碳發展。    今年一季度，海關總署與共建“一帶一路”國家簽署十一份合作文件，其中涉及農食產品准入九份、機制性合作文件兩份。    中國海關總署新聞發言人、統計分析司司長呂大良在會上介紹，據海關統計，一季度中國對RCEP其他十四個成員國合計的進出口是三點○八萬億元，增長百分之二點七，佔中國貨物貿易進出口總值的百分之三十點三。,http://www.macaodaily.com/html/2024-04/13/content_1747944.htm,中國海關總署新聞發言人、統計分析司司長呂大良在會上介紹，據海關統計，一季度中國對RCEP其他十四個成員國合計的進出口是三點○八萬億元，增長百分之二點七，佔中國貨物貿易進出口總值的百分之三十點三,中國 進口 規模 近 二百 萬億         中國海關 總署 副署 長 王令浚 十二日 在 國新 辦發 佈 會 上 介紹 ， 中國 進口 市場 規模 龐大 ， 已經 連續 十五年 穩居 全球 第二 大進口 市場 ， 累計 進口 規模 接近 二百 萬億元 人民 幣 。         根據 初步 測算 ， 去年 中國 佔 全球 進口 總值 的 百分之十 點六 ， 繼續 保持 在 百分之十 以上 水平 。 今年 一季度 ， 中國 進口 “ 量 價齊升 ” ， 進口 規模 再 創 新高 ， 可以 說 中國 的 大 市場 為 世界 提供 了 大機遇 。         王令浚 表示 ， 下 一步 ， 海關將 按照 今年 《 政府 工作 報告 》 關於積極 擴大 優質 產品 進口 的 決策 部署 ， 繼續 抓好 各項 支持 措施 的 落實 ， 持續 推動 優質 農食 產品 檢疫 准入 ， 支持 關鍵 零部件 、 重要 原材料 、 能源 資源 的 擴大 進口 ， 以 更 大 的 力度 、 更實 舉措 服務 高質量 發展 和 高水平 開放 。         “ 帶路 ” 外貿增 5.5%         王令浚 還介紹 ， 一季度 ， 中國 對 共建 “ 一帶 一路 ” 國家進 出口 四點 八二萬 億元 ， 增長 百分之五 點五 ， 佔進 出口 總值 的 百分之四十 七點 四 ， 同比 提升 ○ 點二個 百分 點 。         一季度 ， 中國以 對 外 承包工程 方式 對 共建 國家 出口 二百 點四億元 ， 其中 對 東盟 、 中東 、 中亞國家 的 出口 分別 增長 百分之三十 一點 四 、 百分之一百 六十九 點三 、 百分之三 點六 。 出口 光伏 產品 超過 三百 億元 ， 太陽能 、 風力 等 可 再生能源 發電機 組超過 十二 萬台 ， 支持 共建 國家 能源 轉型 和 綠色 低 碳 發展 。         今年 一季度 ， 海關 總署 與 共建 “ 一帶 一路 ” 國家 簽署 十 一份 合作 文件 ， 其中 涉及 農食 產品 准入 九份 、 機制性 合作 文件 兩份 。         中國海關 總署 新聞 發言人 、 統計 分析 司司 長 呂大良 在 會 上 介紹 ， 據海關 統計 ， 一季度 中國 對 RCEP 其他 十四 個 成員國 合計 的 進 出口 是 三點 ○ 八萬 億元 ， 增長 百分之二 點七 ， 佔 中國 貨物 貿易進 出口 總值 的 百分之三十 點三 。,2024-04-13
海關總署：靠的是創新品質,中國商品在全球受歡迎    海關總署：靠的是創新品質    針對有分析認為，生産者價格較去年下降說明中國生産商産能過剩的判斷，中國海關總署副署長王令浚十二日在國新辦發佈會上回應說，我們不認為，生産者價格下跌就意味着所謂的産能過剩。    王令浚指出，産品價格下跌往往與原材料價格波動、技術更新迭代、生産商主動讓利等多種因素有關。尤其是在科技日新月異的今天，企業通過不斷地研發創新，運用新技術、新工藝，提高産品品質的同時，有力降低了生産成本，不斷拓展了向下游讓利的空間。    “中國商品在全球範圍內受到廣泛歡迎，靠的正是創新和品質。”王令浚說，比如，憑藉強大的研發生産能力，中國家電的智能化、綠色化給消費者帶來了更好的體驗，滿足了更高生活品質需求。又如，可靠耐用、性能強大、售後服務完備的中國工程機械，熱銷全球，海外重大項目建設工地上，中國工程機械可以看到比比皆是。再如，有着“中華文明重要名片”之稱的中國陶瓷，承載着中國文化、中國故事遠銷海外。這些是我們企業努力的結果，也是廣大用戶和消費者的理性選擇。    回應統計差異    另外，發佈會上有記者問，海關公佈去年中國貿易順差八千二百三十億美元，中國外匯管理局公佈的數字則是五千九百四十億美元，為甚麼會有這種差異？    對此，海關總署新聞發言人、統計分析司司長呂大良回應說，這兩種統計的統計原則是有所不同的。海關統計的貨物貿易是按照跨境原則，只要貨物產生跨境的流動，就納入到海關統計，不管貨物所有權是否轉移。外匯部門統計的國際收支的貨物貿易的收支差額，是按照所有權轉移原則作的統計，它不管貨物是否跨境移動。這是兩者的重要差別。    呂大良舉例說，現在所謂的“無廠製造”，就是跨國公司委託國內的企業來製造產品，製造完以後在國內銷售。    這種情況下，它的貨物沒有發生跨境流動，海關是不統計的。但是它的所有權發生了轉移，國際收支是要統計的。這個差別在電子產品、加工製造領域表現得是比較突出。    再如，來料加工和保稅倉儲。來料加工所有權不跨境轉移。有的保稅倉儲貨物跨境時所有權沒有轉移。這種跨境的流動在海關統計裡面是要體現的，但是在外匯收支統計裡面是不體現的，這也是造成差異的原因。    此外，海關統計和國際收支統計的計價方式也是不同的，海關統計，進口中國是按照到岸價格(CIF)來統，出口是按照離岸價格(FOB)價來統，國際收支統計中國的貨物貿易跟國際收支統計都是按照FOB價來統計，不含運保費。由於這些統計的原則和這些方法的差異，隨着形勢變化，這兩個統計差額也會呈現出一定變化。,http://www.macaodaily.com/html/2024-04/13/content_1747945.htm,中國商品在全球受歡迎    海關總署：靠的是創新品質    針對有分析認為，生産者價格較去年下降說明中國生産商産能過剩的判斷，中國海關總署副署長王令浚十二日在國新辦發佈會上回應說，我們不認為，生産者價格下跌就意味着所謂的産能過剩,中國 商品 在 全球 受歡 迎         海關 總署 ： 靠 的 是 創 新品 質         針對 有 分析 認為 ， 生 産 者 價格 較 去年 下降 說明 中國生 産 商 産 能過 剩 的 判斷 ， 中國海關 總署 副署 長 王令浚 十二日 在 國新 辦發 佈 會 上 回應 說 ， 我們 不 認為 ， 生 産 者 價格 下跌 就 意味着 所謂 的 産 能過 剩 。         王令浚 指出 ， 産 品價格 下跌 往往 與 原材料 價格 波動 、 技術 更新 迭代 、 生 産 商主 動讓 利等 多種 因素 有關 。 尤其 是 在 科技 日 新月 異 的 今天 ， 企業 通過 不斷 地 研發 創新 ， 運用 新技術 、 新工藝 ， 提高 産 品品質 的 同時 ， 有力 降低 了 生 産 成本 ， 不斷 拓展 了 向 下游 讓 利 的 空間 。         “ 中國 商品 在 全球 範圍 內 受到 廣泛 歡迎 ， 靠 的 正是 創新 和 品質 。 ” 王令浚 說 ， 比如 ， 憑 藉 強大 的 研發生 産 能力 ， 中國家電 的 智能化 、 綠色 化給 消費者 帶來 了 更好 的 體驗 ， 滿足 了 更 高 生活 品質 需求 。 又 如 ， 可靠 耐用 、 性能 強大 、 售後服務 完備 的 中國 工程 機械 ， 熱銷 全球 ， 海外 重大 項目 建設 工地 上 ， 中國 工程 機械 可以 看到 比比皆是 。 再 如 ， 有着 “ 中華 文明 重要 名片 ” 之稱 的 中國 陶瓷 ， 承載 着 中國 文化 、 中國 故事 遠銷 海外 。 這些 是 我們 企業 努力 的 結果 ， 也 是 廣大用 戶 和 消費者 的 理性 選擇 。         回應 統計 差異         另外 ， 發 佈 會 上 有 記者問 ， 海關 公 佈 去年 中國 貿易 順差 八千 二百三十 億 美元 ， 中國 外匯 管理局 公 佈 的 數字則 是 五千 九百 四十 億 美元 ， 為 甚麼 會 有 這種 差異 ？         對此 ， 海關 總署 新聞 發言人 、 統計 分析 司司 長 呂大良 回應 說 ， 這兩種 統計 的 統計 原則 是 有所不同 的 。 海關 統計 的 貨物 貿易 是 按照 跨境 原則 ， 只要 貨物產生 跨境 的 流動 ， 就 納入 到 海關 統計 ， 不管 貨物 所有 權 是否 轉移 。 外匯 部門 統計 的 國際 收支 的 貨物 貿易 的 收支 差額 ， 是 按照 所有 權轉移 原則作 的 統計 ， 它 不管 貨物 是否 跨境 移動 。 這是 兩者 的 重要 差別 。         呂大良 舉例 說 ， 現在 所謂 的 “ 無 廠 製 造 ” ， 就是 跨國 公司 委 託 國內 的 企業 來 製 造 產 品 ， 製 造 完 以 後 在 國 內 銷 售 。         這種 情況 下 ， 它 的 貨物 沒有 發生 跨境 流動 ， 海關 是 不 統計 的 。 但是 它 的 所有 權發生 了 轉移 ， 國際 收支 是 要 統計 的 。 這個 差別 在 電子 產品 、 加工 製 造 領 域 表 現 得 是 比 較 突出 。         再 如 ， 來料 加工 和 保稅 倉儲 。 來料 加工 所有 權不 跨境 轉移 。 有 的 保稅 倉 儲貨物 跨境 時 所有 權沒有 轉移 。 這種 跨境 的 流動 在 海關 統計裡面 是 要 體現 的 ， 但是 在外 匯 收支 統計裡面 是 不 體現 的 ， 這也 是 造成 差異 的 原因 。         此外 ， 海關 統計 和 國際 收支 統計 的 計價 方式 也 是 不同 的 ， 海關 統計 ， 進 口中 國是 按照 到岸 價格 ( CIF ) 來統 ， 出口 是 按照 離岸 價格 ( FOB ) 價來統 ， 國際 收支 統計 中國 的 貨物 貿易 跟 國際 收支 統計 都 是 按照 FOB 價來 統計 ， 不含 運保費 。 由 於 這些 統計 的 原則 和 這些 方法 的 差異 ， 隨着 形勢 變化 ， 這兩個 統計 差額 也 會 呈 現出 一定 變化 。,2024-04-13
光大原董事長唐雙寧被訴,光大原董事長唐雙寧被訴    【本報綜合報道】據中新社北京十二日消息：中國最高人民檢察院十二日通報中國光大集團股份公司原黨委書記、董事長唐雙寧涉嫌貪污、受賄一案進展。經最高檢依法指定，河北省唐山市人民檢察院近日已向唐山市中級人民法院提起公訴。    檢察機關起訴指控稱，唐雙寧利用擔任中國人民銀行銀行監管一司司長職務上的便利，將其保管、使用的公共財物據為己有，數額特別巨大；唐雙寧利用擔任中國人民銀行銀行監管一司司長，中國銀行業監督管理委員會黨委委員、副主席，中國光大集團股份公司黨委書記、董事長，光大銀行黨委書記、董事長等職務上的便利，在職務調整、貸款獲取等事項上為他人謀取利益，非法收受他人財物，數額特別巨大，依法應當以貪污罪、受賄罪追究其刑事責任。    值得一提的是，近年來“光大系”已有多位高管落馬。接替唐雙寧出任光大集團“一把手”的李曉鵬，已被最高檢決定逮捕，該案也在進一步辦理中。    魯原高官受審    中國最高人民法院表示，十二日，山西省大同市中級人民法院一審公開開庭審理了山東省政協原黨組成員、副主席孫述濤受賄一案。    大同市人民檢察院起訴指控稱，二○○一年至二○二三年，被告人孫述濤利用擔任山東省委組織部副部長，山東省威海市委副書記、市長、市委書記，山東省濟南市委副書記、市長，山東省政協黨組成員、副主席等職務上的便利以及職權、地位形成的便利條件，為有關單位和個人在企業經營、業務承接和職務調整等事項上提供幫助，非法收受財物共計折合人民幣一點二九億餘元，其中七千三百三十八萬餘元截至案發時尚未實際取得。檢察機關提請以受賄罪追究孫述濤的刑事責任。    庭審中，孫述濤作最後陳述，並當庭表示認罪悔罪。法庭宣佈休庭，擇期宣判。,http://www.macaodaily.com/html/2024-04/13/content_1747946.htm,唐雙寧利用擔任中國人民銀行銀行監管一司司長，中國銀行業監督管理委員會黨委委員、副主席，中國光大集團股份公司黨委書記、董事長，光大銀行黨委書記、董事長等職務上的便利，在職務調整、貸款獲取等事項上為他人謀取利益，非法收受他人財物，數額特別巨大，依法應當以貪污罪、受賄罪追究其刑事責任,光大 原 董事 長 唐 雙寧 被訴         【 本報 綜合 報道 】 據 中新社 北京 十二日 消息 ： 中國 最高 人民 檢 察院 十二日 通報 中國 光大 集團 股份公司 原黨 委書記 、 董事 長 唐 雙寧 涉嫌 貪污 、 受賄 一案 進展 。 經 最高 檢 依法 指定 ， 河北省 唐山市 人民 檢 察院 近日 已 向 唐山市 中級 人民法院 提起 公訴 。         檢察機 關起訴 指控 稱 ， 唐雙寧 利用 擔任 中國 人民 銀行 銀行 監管 一司 司長 職務上 的 便利 ， 將其 保管 、 使用 的 公共 財物據 為己 有 ， 數額 特別 巨大 ； 唐雙寧 利用 擔任 中國 人民 銀行 銀行 監管 一司 司長 ， 中國 銀行業 監督 管理 委員會 黨委委員 、 副 主席 ， 中國 光大 集團 股份公司 黨委書記 、 董事 長 ， 光大 銀行 黨委書記 、 董事 長 等 職務上 的 便利 ， 在 職務 調整 、 貸款 獲取 等 事項 上 為 他人 謀取 利益 ， 非法 收受 他人 財物 ， 數額 特別 巨大 ， 依法 應當以 貪污罪 、 受賄 罪 追究其 刑事 責任 。         值得一提的是 ， 近年 來 “ 光大 系 ” 已有 多位 高管 落馬 。 接替 唐雙寧 出任 光大 集團 “ 一把手 ” 的 李曉鵬 ， 已 被 最高 檢決定 逮捕 ， 該案 也 在 進 一步 辦理 中 。         魯原 高官 受審         中國 最高人民法院 表示 ， 十二日 ， 山西省 大同市 中級 人民法院 一審 公開 開庭 審理 了 山東 省政協 原黨 組成員 、 副 主席 孫述濤 受賄 一案 。         大同市 人民 檢 察院 起訴 指控 稱 ， 二 ○ ○ 一年 至 二 ○ 二三年 ， 被告人 孫述 濤 利用 擔任 山東 省委 組織 部副 部長 ， 山東省 威海 市委 副 書記 、 市長 、 市委 書記 ， 山東 省濟南 市委 副 書記 、 市長 ， 山東省 政協黨 組成員 、 副 主席 等 職務上 的 便利 以及 職權 、 地位 形成 的 便利 條件 ， 為 有關 單位 和 個 人 在 企業 經營 、 業務 承接 和 職務 調整 等 事項 上 提供 幫助 ， 非法 收受 財物共計 折合 人民 幣一點 二九 億餘元 ， 其中 七千 三百 三十八 萬餘元 截至 案發時 尚未 實際 取得 。 檢察機關 提請 以受 賄罪 追究 孫述 濤 的 刑事 責任 。         庭審 中 ， 孫述 濤 作 最後陳述 ， 並當庭 表示 認罪 悔罪 。 法庭 宣 佈 休庭 ， 擇期 宣判 。,2024-04-13
鵲橋二號完成在軌對通測試,鵲橋二號完成在軌對通測試    【中新社北京十二日電】中國國家航天局十二日表示，鵲橋二號中繼星已完成在軌對通測試。經評估，中繼星平台和載荷工作正常，功能和性能滿足任務要求，可為探月工程四期及後續國內外月球探測任務提供中繼通信服務，任務取得圓滿成功。    鵲橋二號中繼星自三月二十日發射升空後，經過中途修正、近月制動、環月軌道機動，於四月二日按計劃進入二十四小時周期的環月大橢圓使命軌道。四月六日，鵲橋二號中繼星成功與正在月球背面開展探測任務的嫦娥四號探測器完成對通測試。四月八日至九日，鵲橋二號中繼星與嫦娥六號探測器（地面狀態）開展對通測試。    啟通導技術驗證    此前同步搭載發射的天都一號、二號通導技術試驗星已於三月二十九日進入環月使命軌道，四月三日成功實施雙星分離，正在開展系列通導技術驗證。    鵲橋二號中繼星和天都試驗星採用環月大橢圓凍結軌道作為使命軌道。由於月球外形結構不規則，靠近月球飛行的航天器受到月球引力等因素作用，飛行軌道易產生偏差。環月大橢圓凍結軌道是處於穩定狀態的環月軌道，航天器在該軌道飛行，能够使飛行軌道的偏差最小化。    選擇環月大橢圓凍結軌道作為鵲橋二號中繼星的使命軌道具有諸多優勢。    一是提高通信速率，與鵲橋號相比，鵲橋二號中繼星的使命軌道距離月球更近，數據傳輸的通信速率將大幅提高。二是更好覆蓋月球南極通信，與圍繞地月拉格朗日L2點運行的鵲橋號相比，在環月大橢圓使命軌道的鵲橋二號中繼星對月球南極的可見性顯著提升，大幅提高對月球南極區域的通信覆蓋能力。三是節省衛星燃料，鵲橋二號中繼星可以用極少的燃料，維持在該軌道上長期駐留。    後續，鵲橋二號中繼星將按計劃為嫦娥四號和將要發射的嫦娥六號任務提供中繼通信服務，並擇機開展相應科學探測。,http://www.macaodaily.com/html/2024-04/13/content_1747947.htm,二是更好覆蓋月球南極通信，與圍繞地月拉格朗日L2點運行的鵲橋號相比，在環月大橢圓使命軌道的鵲橋二號中繼星對月球南極的可見性顯著提升，大幅提高對月球南極區域的通信覆蓋能力,鵲 橋二號 完成 在 軌對 通測試         【 中新社 北京 十二日 電 】 中國國家 航天局 十二日 表示 ， 鵲 橋二號 中繼星 已 完成 在 軌對 通測試 。 經評 估 ， 中繼星 平台 和 載 荷 工作 正常 ， 功能 和 性能 滿足 任務 要求 ， 可為 探月 工程 四期 及後續 國內外 月球 探測 任務 提供 中繼 通信 服務 ， 任務 取得 圓滿 成功 。         鵲 橋二號 中繼星 自 三月 二十日 發射 升空 後 ， 經過 中途 修正 、 近 月 制動 、 環月 軌道 機動 ， 於 四月 二日 按計劃 進入 二十四小 時 周期 的 環月 大 橢圓 使命 軌道 。 四月 六日 ， 鵲 橋二號 中繼星 成功 與 正在 月球 背面 開展 探測 任務 的 嫦娥 四號 探測器 完成 對通 測試 。 四月八 日至 九日 ， 鵲 橋二號 中繼星 與 嫦娥 六號 探測器 （ 地面 狀態 ） 開展 對 通測試 。         啟通導 技術驗證         此前 同步 搭載 發射 的 天 都 一號 、 二號 通導 技術 試驗星 已 於 三月 二十九日 進入 環月 使命 軌道 ， 四月 三日 成功 實施 雙星 分離 ， 正在 開展 系列 通導 技術驗證 。         鵲 橋二號 中繼星 和 天 都 試驗星 採用 環月 大 橢圓凍 結軌 道 作為 使命 軌道 。 由 於 月球 外形 結構 不 規則 ， 靠近 月球 飛行 的 航天器 受到 月球 引力 等 因素 作用 ， 飛行 軌道 易產生 偏差 。 環月 大 橢圓凍 結軌 道 是 處 於 穩定 狀態 的 環月 軌道 ， 航天器 在 該 軌道 飛行 ， 能够 使 飛行 軌道 的 偏差 最小化 。         選擇 環月 大 橢圓凍 結軌 道 作為 鵲 橋二號 中繼星 的 使命 軌道 具有 諸多 優勢 。         一是 提高 通信 速率 ， 與 鵲 橋號 相比 ， 鵲 橋二號 中繼星 的 使命 軌道 距離 月球 更近 ， 數據 傳輸 的 通信 速率 將 大幅提高 。 二是 更好 覆蓋 月球 南極 通信 ， 與 圍繞 地 月 拉格朗 日 L2 點運行 的 鵲 橋號 相比 ， 在 環月 大 橢圓 使命 軌道 的 鵲 橋二號 中繼星 對 月球 南極 的 可見性 顯著 提升 ， 大幅提高 對 月球 南極區域 的 通信 覆蓋 能力 。 三是 節省 衛星 燃料 ， 鵲 橋二號 中繼星 可以 用極少 的 燃料 ， 維持 在 該 軌道 上長 期 駐留 。         後 續 ， 鵲 橋二號 中 繼星將 按 計劃 為 嫦娥 四號 和 將要 發射 的 嫦娥 六號 任務 提供 中繼 通信 服務 ， 並擇 機開展 相應 科學 探測 。,2024-04-13
華夏兒女聚陝恭祭華胥,華夏兒女聚陝恭祭華胥    【本報陝西藍田十二日電】“三月三，生軒轅。”四月十一日上午，二○二四甲辰年（第十九屆）恭祭華胥氏大典在陝西藍田華胥陵廣場舉行，來自全球各地華人後裔逾千人恭祭中華民族始祖母華胥氏。    山西運城永濟分會場以及山東菏澤鄄城分會場同期舉行。    今年恭祭儀式依擊鼓鳴鐘、靜默肅立、朗誦《華胥頌》、上香、九獻禮、樂舞告祭、恭讀祭文、集體三鞠躬禮、祈福大使敬獻花籃、恭讀《中華母親節》倡議、全體獻花有序開展。    倡設中華母親節    今屆恭祭華胥氏大典主會場外，設有《設立“中華母親節”倡議書》簽名牆，眾多民眾紛紛簽名，表達對中華始祖母華胥氏的景仰、敬重、緬懷。    據悉，鄄城縣將建設中華母親祠，今年白露節還舉辦首屆“中華母親節”。    華胥氏，亦稱華胥，伏羲和女媧的生母，炎帝、黃帝、蚩尤的直系遠祖，受尊奉為“中華之根，民族之母”，中華民族始祖母。    中華的“華”源於華胥，從華胥到華夏，從華夏到中華，形成了一脈相承的中華民族文化。（紀嚴實）,http://www.macaodaily.com/html/2024-04/13/content_1747948.htm,”四月十一日上午，二○二四甲辰年（第十九屆）恭祭華胥氏大典在陝西藍田華胥陵廣場舉行，來自全球各地華人後裔逾千人恭祭中華民族始祖母華胥氏,華夏兒 女聚 陝恭 祭華胥         【 本報 陝西 藍田 十二日 電 】 “ 三月 三 ， 生軒轅 。 ” 四月 十一日 上午 ， 二 ○ 二四 甲辰 年 （ 第十九 屆 ） 恭 祭華胥 氏 大典 在 陝西 藍田華 胥陵 廣場 舉行 ， 來 自 全球 各地 華人後裔 逾千人 恭 祭 中華 民族 始 祖母 華胥氏 。         山西 運城永濟 分會場 以及 山東 菏澤 鄄城 分會場 同期 舉行 。         今年 恭 祭 儀式 依擊 鼓鳴鐘 、 靜默肅立 、 朗誦 《 華胥 頌 》 、 上 香 、 九獻禮 、 樂舞告 祭 、 恭讀 祭文 、 集體 三 鞠躬 禮 、 祈福 大使 敬獻花籃 、 恭讀 《 中華母 親節 》 倡議 、 全體獻花 有序 開展 。         倡設 中華母 親節         今屆 恭 祭華胥 氏 大典 主會場 外 ， 設有 《 設立 “ 中華母 親節 ” 倡議 書 》 簽名 牆 ， 眾多民眾 紛紛 簽名 ， 表達 對 中華始 祖母 華胥 氏 的 景仰 、 敬重 、 緬懷 。         據悉 ， 鄄城 縣將 建設 中華母 親祠 ， 今年 白露節 還舉 辦首屆 “ 中華母 親節 ” 。         華胥氏 ， 亦 稱華胥 ， 伏羲 和 女 媧 的 生母 ， 炎帝 、 黃 帝 、 蚩尤 的 直系 遠祖 ， 受 尊奉 為 “ 中華之根 ， 民族 之母 ” ， 中華 民族 始 祖母 。         中華 的 “ 華 ” 源 於 華胥 ， 從華胥 到 華夏 ， 從華夏到 中華 ， 形成 了 一脈 相承 的 中華 民族 文化 。 （ 紀嚴實 ）,2024-04-13
