Title,Content,Link,Summary,Preprocessed_Content,Date
協和二級醫療澳人七折,收費分三級    價格釐訂中    協和二級醫療澳人七折    【本報消息】澳門協和醫院副院長李偉成、副院長級人員曹國希昨日上午應邀出席電台節目探討協和醫院營運。李偉成透露，澳門協和醫院收費分爲三級，第一級爲享有免費醫療的本澳居民提供免費醫療。第二級醫療收費，費用仍在釐訂中，但本澳居民可享七折優惠。第三級爲國際醫療，屬私人醫療服務。    逐步推非轉介門診    李偉成表示，澳門協和醫院去年十二月二十日試營運，並於本周一正式開業。作為公立醫療機構，澳門協和醫院以優先滿足公共醫療衛生服務為原則。今年三月起，已陸續為由衛生局轉介的患者提供專科門診、超聲檢查、放射CT檢查和前列腺癌放射治療服務。目前已提供專科門診共二十五個，包括風濕免疫科、骨科、感染內科、神經科等，發揮分流作用。並將持續擴大免費醫療服務的專科範疇。開業後，澳門協和醫院按序逐步推出面向非轉介患者的門診，並正構建電子化專科掛號，方便居民。    完成部分專科定價    服務收費方面，澳門協和醫院將在優先滿足公共醫療衛生服務的前提下，提供私人醫療衛生服務。收費將分三級：第一級爲享有免費醫療澳門居民提供的免費醫療。第二級為收費醫療。第三級為國際醫療，屬私人醫療服務。第二級收費醫療本澳居民將享七折優惠。考慮到部分醫療收費已三十多年未調整，醫療成本等有變，未來會在本澳居民可承擔的基礎上訂出合理價格。第三級國際醫療收費將結合成本及醫療市場環境，提供具吸引力價格，確保本地居民或其他地區人士能夠接受。    目前配合醫院總體開業，已完成部分專科門診服務定價，包括醫師診金、超聲檢查、放射檢查以及部分臨床化驗項目等。後續隨着醫院拓展服務內容，將分批跟進項目訂價。    京協和32專醫駐澳    有聽眾關注無障礙設施。曹國希表示，醫院興建時根據無障礙通用設計建築指引設計，包括無障礙通道、洗手間、無障礙櫃檯等，專門設置予殘障人士使用。周邊巴士站亦有設施協助視障人士進入醫院。醫院內亦設導醫等專門人員協助有需要人士。    為配合醫院營運及有序開展醫療服務，北京協和醫院派出五十多名高級別醫療專家駐澳協助醫療服務，當中包括三十二名專科醫生，當中兩名屬醫學美容，合共三十個專科。澳門協和醫院已聘請本地醫療人員合共八十多名，非臨床醫療輔助人員約二十名。會持續於本澳招聘醫療人員，增加人力以滿足逐步開展的醫療服務。同時培養本地醫療人才，初步計劃澳門協和醫院今年底將達至四百名人員。    靈活招聘澳人優先    有聽眾關注醫院招聘及薪酬。曹國希表示，醫院未來會不斷開拓其他服務領域，目前人員遠遠不夠。醫院優先招聘本地居民。居民可以留意醫院網頁及相關招聘消息。薪酬福利會否與公務員持平？他回應稱，院方目前採用非公務人員方式招聘，希望能夠在招聘人員保持靈活，吸引更多人才為居民服務。,http://www.macaodaily.com/html/2024-09/19/content_1782196.htm,完成部分專科定價    服務收費方面，澳門協和醫院將在優先滿足公共醫療衛生服務的前提下，提供私人醫療衛生服務,收費 分三級         價格 釐 訂 中         協和二級 醫療 澳人 七折         【 本報 消息 】 澳門協 和 醫院 副 院長 李偉成 、 副 院長 級 人員 曹國希 昨日 上午 應邀 出席 電台 節目 探討協 和 醫院 營運 。 李偉成 透露 ， 澳門協 和 醫院 收費分 爲 三級 ， 第一 級 爲 享有 免費 醫療 的 本澳 居民 提供 免費 醫療 。 第二 級 醫療 收費 ， 費用 仍 在 釐 訂 中 ， 但 本澳 居民 可享 七折 優惠 。 第三 級 爲 國際 醫療 ， 屬 私人 醫療 服務 。         逐步 推非 轉介門診         李偉成 表示 ， 澳門協 和 醫院 去年 十二月 二十日 試營運 ， 並 於 本周一 正式 開業 。 作為 公立 醫療 機構 ， 澳門協 和 醫院 以 優先 滿足 公共 醫療 衛生 服務為 原則 。 今年 三月 起 ， 已陸續 為 由 衛生局 轉介 的 患者 提供 專科門診 、 超聲 檢查 、 放射 CT 檢查 和 前列腺癌 放射 治療 服務 。 目前 已 提供 專科門 診共 二十五 個 ， 包括 風濕 免疫科 、 骨科 、 感染 內科 、 神經科 等 ， 發揮 分流 作用 。 並將 持續 擴大免 費醫療 服務 的 專科範疇 。 開業 後 ， 澳門協 和 醫院 按序 逐步 推出 面向 非 轉介 患者 的 門診 ， 並正構 建電子化 專科 掛號 ， 方便 居民 。         完成 部分 專科定價         服務 收費 方面 ， 澳門協 和 醫院將 在 優先 滿足 公共 醫療 衛生 服務 的 前提 下 ， 提供 私人 醫療 衛生 服務 。 收費將 分三級 ： 第一 級 爲 享有 免費 醫療 澳門 居民 提供 的 免費 醫療 。 第二 級 為 收費 醫療 。 第三 級 為 國際 醫療 ， 屬 私人 醫療 服務 。 第二 級 收費 醫療 本澳 居民 將享 七折 優惠 。 考慮 到 部分 醫療 收費 已 三十多年 未 調整 ， 醫療 成本 等 有 變 ， 未來 會 在 本澳 居民 可承擔 的 基礎 上 訂出 合理 價格 。 第三 級國際 醫療 收費 將結 合成 本及 醫療 市場 環境 ， 提供 具 吸引力 價格 ， 確保 本地 居民 或 其他 地區 人士 能夠 接受 。         目前 配合 醫院 總體 開業 ， 已 完成 部分 專科門診 服務定價 ， 包括 醫師 診金 、 超聲 檢查 、 放射 檢查 以及 部分 臨床 化驗 項目 等 。 後 續 隨着 醫院 拓展 服務 內容 ， 將 分批 跟 進項 目訂價 。         京協 和 32 專醫 駐澳         有 聽 眾關 注無障礙 設施 。 曹國希 表示 ， 醫院 興建時 根據 無障礙 通用 設計 建築 指引 設計 ， 包括 無障礙 通道 、 洗手 間 、 無障 礙櫃 檯 等 ， 專門 設置予 殘障 人士 使用 。 周邊 巴士站 亦 有 設施 協助 視障 人士 進入 醫院 。 醫院 內 亦 設導 醫等 專門 人員 協助 有 需要 人士 。         為 配合 醫院 營運及 有序 開展 醫療 服務 ， 北京 協和醫院 派出 五十多名 高級別 醫療 專家 駐 澳協助 醫療 服務 ， 當中 包括 三十二名 專科 醫生 ， 當中 兩名屬 醫學 美容 ， 合共 三十 個 專科 。 澳門協 和 醫院 已聘 請 本地 醫療 人員 合共 八 十多名 ， 非臨床 醫療 輔 助人 員約 二十名 。 會持續 於 本澳 招聘 醫療 人員 ， 增加 人力 以滿足 逐步 開展 的 醫療 服務 。 同時 培養 本地 醫療 人才 ， 初步 計劃 澳門協 和 醫院 今年底 將達 至 四百名 人員 。         靈活 招聘 澳人 優先         有 聽眾 關注 醫院 招聘 及 薪酬 。 曹國希 表示 ， 醫院 未來會 不斷 開拓 其他 服務 領域 ， 目前 人員遠 遠不夠 。 醫院 優先 招聘 本地 居民 。 居民 可以 留意 醫院 網頁 及 相關 招聘 消息 。 薪酬 福利 會否 與 公務員 持平 ？ 他 回應 稱 ， 院方 目前 採用 非公 務人員 方式 招聘 ， 希望 能夠 在 招聘 人員 保持 靈活 ， 吸引 更 多 人才 為 居民 服務 。,2024-09-19
選管會接納岑浩輝參選特首,通過國安委資格審查昨公佈決定    選管會接納岑浩輝參選特首    【本報消息】澳門特別行政區第六任行政長官選舉將於十月十三日舉行。行政長官選舉管理委員會昨日發出告示，公佈被接納的行政長官選舉被提名人姓名及所有提名人姓名，岑浩輝為是次選舉的唯一被提名人。    成唯一被提名人    澳門特別行政區維護國家安全委員會已審查通過被提名人擁護《澳門特別行政區基本法》和效忠中華人民共和國及其澳門特別行政區的資格。選管會前日完成對被提名人的可接納審查，並按《行政長官選舉法》規定，於完成審查翌日（即昨日）公佈有關決定，在水坑尾街公共行政大樓地面張貼載有被接納的被提名人姓名及提名的三百八十六位行政長官選舉委員會委員姓名的告示，並上載至行政長官選舉網頁(www.ece.gov.mo)。    無異議明日確定    根據《行政長官選舉法》規定，被提名人及選委會委員可於選管會公佈可接納審查決定後一日內（即今日）提出異議。若在期限內沒有收到任何異議，選管會將於明（二十）日以告示公佈被確定性接納的候選人。,http://www.macaodaily.com/html/2024-09/19/content_1782197.htm,選管會前日完成對被提名人的可接納審查，並按《行政長官選舉法》規定，於完成審查翌日（即昨日）公佈有關決定，在水坑尾街公共行政大樓地面張貼載有被接納的被提名人姓名及提名的三百八十六位行政長官選舉委員會委員姓名的告示，並上載至行政長官選舉網頁(www.ece.gov.mo),通過 國安委資格 審查 昨公 佈 決定         選管會 接納 岑浩輝 參選 特首         【 本報 消息 】 澳門 特別 行政 區 第六任 行政 長 官選 舉將 於 十月 十三日 舉行 。 行政 長 官選舉 管理 委員會 昨日 發出 告示 ， 公 佈 被 接納 的 行政 長 官選舉 被 提名 人 姓名 及 所有 提名 人 姓名 ， 岑浩輝 為 是 次 選舉 的 唯一 被 提名 人 。         成 唯一 被 提名 人         澳門 特別 行政 區維護 國家 安全 委員會 已 審查 通過 被 提名 人 擁護 《 澳門 特別 行政 區 基本法 》 和 效忠 中華 人民 共和 國 及其 澳門 特別 行政 區的 資格 。 選管會 前日 完成 對 被 提名 人 的 可 接納 審查 ， 並按 《 行政 長 官選 舉法 》 規定 ， 於 完成 審查 翌日 （ 即 昨日 ） 公 佈 有關 決定 ， 在 水坑 尾街 公共行政 大樓 地面 張貼 載 有 被 接納 的 被 提名 人 姓名 及 提名 的 三百 八十六 位 行政 長 官選 舉委員會委員 姓名 的 告示 ， 並上 載 至 行政 長 官選舉 網頁 ( www . ece . gov . mo ) 。         無異議 明日 確定         根據 《 行政 長 官選 舉法 》 規定 ， 被 提名 人及 選委會委員 可 於 選管會公 佈 可 接納 審查 決定 後 一日 內 （ 即 今日 ） 提出 異議 。 若 在 期限 內 沒 有 收到 任何 異議 ， 選管會將 於 明 （ 二十 ） 日以 告示 公 佈 被確 定性 接納 的 候選人 。,2024-09-19
澳協和醫院籌設“洗腎”服務,需場地設備人員配合    澳協和醫院籌設“洗腎”服務    【本報消息】衛生局代局長鄭成業經徵詢離島醫療綜合體北京協和醫院澳門醫學中心的意見回覆議員書面質詢時稱，澳門協和醫院近期將開始為經衛生局轉介具適應症的患者提供腫瘤放射治療。待條件成熟時，可逐步提供血液透析服務。    安排輪候最短醫院    議員李良汪書面質詢澳門協和醫院服務啟用情況以及新街坊衛生站使用安排，要求當局交代醫院何時可以提供血液透析服務，以及七月開始是否能提供腫瘤治療。    鄭成業回覆稱，衛生局山頂醫院和澳門協和醫院均為本澳公立醫院，為居民提供專科醫療服務。衛生局的醫生會在評估患者情況後，以最短輪候時間為原則，透過電子轉診系統為其安排合適的醫院和專科跟進。    澳門協和醫院今年三月起已陸續為經衛生局轉介的患者提供腫瘤診療服務，包括影像檢查和專科門診等。目前亦完成腫瘤放射治療的設備調試、人員安排及流程制訂，近期將開始為經衛生局轉介具適應症的患者提供腫瘤放射治療。另外，開展血液透析服務需場地、設備設施及合資質人員配合，目前醫院正積極籌備，待條件成熟時可逐步提供相關服務。    協和籌設急診急救    離島急診服務方面，山頂醫院離島急診站為有需要的居民提供緊急醫療服務，包括化驗檢查和放射檢查等，並提供急診常規用藥，基本滿足急症需要。離島急診站醫護人員會評估患者病情，如需要專科會診或住院，會按機制將其送往山頂醫院急診部繼續接受治療，並透過部門內部協調，無需患者再次掛號登記。    目前離島急診站由山頂醫院獨立營運。未來澳門協和醫院將配合提供已經開展的輔助檢查項目。急診和急救亦是澳門協和醫院的重要服務內容，但因服務涉及面廣，需要的救護設備相對複雜，人員培訓周期較長，待條件成熟後，澳門協和醫院將按計劃提供急診和急救服務。    琴衛生站按澳設置    李良汪另質詢“澳門新街坊”衛生站能否短期內先提供西醫門診服務，以及未來會否提供產前保健服務等回應居民訴求？鄭成業回覆稱，為讓澳門居民在橫琴粵澳深度合作區享受趨同澳門的生活，“澳門新街坊”設有衛生站，將參照本澳衛生中心的設置，向居於深合區的澳門居民提供社區醫療衛生服務。首階段提供普通西醫及一般慢性病門診服務，其後將視乎實際情況優化服務內容。    衛生局正積極推進各項籌備工作，包括向廣東省相關部門申請成為“指定醫療機構”並容許使用指定澳門藥物，以及配置醫療設施設備、安排醫療人員等，待具備條件後將盡快投入運作。,http://www.macaodaily.com/html/2024-09/19/content_1782198.htm,需場地設備人員配合    澳協和醫院籌設“洗腎”服務    【本報消息】衛生局代局長鄭成業經徵詢離島醫療綜合體北京協和醫院澳門醫學中心的意見回覆議員書面質詢時稱，澳門協和醫院近期將開始為經衛生局轉介具適應症的患者提供腫瘤放射治療,需場 地 設備 人員 配合         澳協 和 醫院 籌設 “ 洗 腎 ” 服務         【 本報 消息 】 衛生 局代局 長 鄭成業 經徵詢 離島 醫療 綜合體 北京 協和醫院 澳門 醫學 中心 的 意見 回覆 議員書面 質詢 時稱 ， 澳門協 和 醫院 近期 將開始 為 經衛 生局 轉介具 適應症 的 患者 提供 腫瘤 放射 治療 。 待 條件 成熟 時 ， 可 逐步 提供 血液 透析 服務 。         安排 輪候 最 短 醫院         議員 李良 汪書面 質詢 澳門協 和 醫院 服務 啟用 情況 以及 新 街坊 衛生 站 使用 安排 ， 要求 當局 交代 醫院 何時 可以 提供 血液 透析 服務 ， 以及 七月 開始 是否 能 提供 腫瘤 治療 。         鄭成業 回覆 稱 ， 衛生 局山頂 醫院 和 澳門協 和 醫院 均 為 本澳 公立 醫院 ， 為 居民 提供 專科 醫療 服務 。 衛生局 的 醫生會 在 評估 患者 情況 後 ， 以 最 短輪候 時間 為 原則 ， 透過 電子 轉診系 統為 其 安排 合適 的 醫院 和 專科 跟 進 。         澳門協 和 醫院 今年 三月 起 已 陸續 為 經衛 生局 轉介 的 患者 提供 腫瘤 診療 服務 ， 包括 影像 檢查 和 專科門診 等 。 目前 亦 完成 腫瘤 放射 治療 的 設備 調試 、 人員 安排 及 流程 制訂 ， 近期 將開始 為 經衛 生局 轉介具 適應症 的 患者 提供 腫瘤 放射 治療 。 另外 ， 開展 血液 透析 服務 需場 地 、 設備 設施 及 合資質 人員 配合 ， 目前 醫院 正積 極籌備 ， 待 條件 成熟 時 可 逐步 提供 相關 服務 。         協和籌設 急診 急救         離島 急診 服務 方面 ， 山頂 醫院 離島 急診 站 為 有 需要 的 居民 提供 緊急 醫療 服務 ， 包括 化驗 檢查 和 放射 檢查 等 ， 並 提供 急診常 規用藥 ， 基本 滿足 急症 需要 。 離島 急 診站 醫護 人員會 評估 患者 病情 ， 如 需要 專科會診 或 住院 ， 會 按 機制 將其 送往 山頂 醫院 急 診部 繼續 接受 治療 ， 並透過 部門 內部 協調 ， 無需 患者 再次 掛號 登記 。         目前 離島 急診 站 由 山頂 醫院 獨立 營運 。 未來 澳門協 和 醫院將 配合 提供 已經 開展 的 輔助 檢查 項目 。 急診 和 急救 亦 是 澳門協 和 醫院 的 重要 服務 內容 ， 但 因 服務 涉及面 廣 ， 需要 的 救護 設備 相 對 複 雜 ， 人員 培訓 周期 較長 ， 待 條件 成熟 後 ， 澳門協 和 醫院將 按 計劃 提供 急診 和 急救 服務 。         琴衛生 站 按 澳設 置         李良 汪 另 質詢 “ 澳門 新 街坊 ” 衛生 站 能否 短期 內先 提供 西醫門診 服務 ， 以及 未來 會否 提供 產前 保健 服務 等 回應 居民 訴求 ？ 鄭成業 回覆 稱 ， 為 讓 澳門 居民 在 橫琴粵澳 深度 合作 區 享受 趨同 澳門 的 生活 ， “ 澳門 新 街坊 ” 設有 衛生 站 ， 將參照 本 澳衛生 中心 的 設置 ， 向 居 於 深合區 的 澳門 居民 提供 社區 醫療 衛生 服務 。 首階段 提供 普通 西醫及 一般 慢性病 門診 服務 ， 其後將 視乎 實際 情況 優化 服務 內容 。         衛生局 正積極 推進 各項 籌備 工作 ， 包括 向 廣東省 相關 部門 申請 成為 “ 指定 醫療 機構 ” 並容許 使用 指定 澳門 藥物 ， 以及 配置 醫療 設施 設備 、 安排 醫療 人員 等 ， 待 具備 條件後將 盡快 投入 運作 。,2024-09-19
