Title,Content,Link,Summary,Preprocessed_Content,Date
“撤辣”交立會緊急處理,房屋供應充足    外來炒風平息    穩定本澳樓市    “撤辣”交立會緊急處理    【本報消息】政府全面取消不動產需求管理措施，包括取消特別印花稅、額外印花稅及取得印花稅等。有關法案已送交立法會以緊急程序處理。財政局長容光亮稱，建議法案通過後翌日生效。    放寬置業按揭成數    行政會完成討論《取消與不動產需求管理相關的稅務措施》法案。行政會發言人、行政法務司司長張永春，財政局長容光亮，金融管理局行政管理委員會委員劉杏娟昨日下午三時出席新聞發佈會，介紹法案內容。    張永春表示，為了保持不動產市場平穩發展，自二〇一〇年起制定並實施一系列包括稅務及樓宇按揭在內的不動產需求管理措施。當中，稅務措施包括特別印花稅、額外印花稅及取得印花稅。    去年底，政府因應市場環境變化適度放寬不動產需求管理措施，提案獲立法會審議通過，並制定《修改第2／2018號法律〈取得非首個居住用途不動產的印花稅〉》法律，自今年一月一日起不再向取得第二個居住用途不動產的人士徵收樓價百分之五的取得印花稅。同時放寬樓宇按揭措施，包括本澳居民購置住宅的按揭成數上限為百分之七十，購置經濟房屋的按揭成數上限為百分之九十，不再設不同的按揭成數金額檔次上限。    有需要時再推措施    張永春指出，政府持續關注及評估不動產市場的情況，考慮到近年各類型房屋供應較充足，目前具條件制定《取消與不動產需求管理相關的稅務措施》法案，取消特別印花稅、額外印花稅及取得印花稅（附表）。樓宇按揭方面，金管局將會發出新指引，統一本澳居民及非本澳居民按揭成數上限為百分之七十（購置經濟房屋按揭成數上限維持百分之九十），並暫停按揭貸款利率上調兩個百分點的壓力測試要求。上述措施不妨礙政府因應情況再次推出不動產需求管理措施，包括採取其他如調節公共房屋及土地供應等可行手段，維持不動產市場的穩定。    取消銀行壓力測試    劉杏娟表示，政府預期未來利率上調機會輕微，故取消銀行相關壓力測試的監管要求，但不妨礙銀行從風險管理角度推行壓力測試。    劉杏娟解釋，二〇一〇年推出樓按措施是針對所有在澳購買樓宇的人士，按揭成數上限為七成。至二〇一二年，針對澳門居民及非澳門居民有不同的按揭成數上限，現時恢復非澳門居民的樓宇按揭成數上限與澳門居民同爲七成，是因外圍經濟及本地房地產市場基本沒有外來資金炒作，銀行在樓宇按揭面對的風險降低。    樓按拖欠率屬良好    至二月底住宅按揭貸款拖欠率為百分之一點一，處於哪一水平？劉杏娟回應認為該百分比屬良好水平，看不到需要變賣資產還款的情況。    據立法會網頁顯示，已收到上述法案，正待議。,http://www.macaodaily.com/html/2024-04/13/content_1748053.htm,有需要時再推措施    張永春指出，政府持續關注及評估不動產市場的情況，考慮到近年各類型房屋供應較充足，目前具條件制定《取消與不動產需求管理相關的稅務措施》法案，取消特別印花稅、額外印花稅及取得印花稅（附表）,房屋 供應 充足         外來 炒風 平息         穩定 本 澳樓 市         “ 撤辣 ” 交立會 緊急 處理         【 本報 消息 】 政府 全面 取消 不動產 需求 管理 措施 ， 包括 取消 特別 印花 稅 、 額外 印花 稅及 取得 印花 稅等 。 有關 法案 已 送交 立法 會以 緊急 程序 處理 。 財 政局 長 容 光亮 稱 ， 建議 法案 通過 後 翌日 生效 。         放寬 置業 按揭 成數         行政 會 完成 討論 《 取消 與 不動產 需求 管理 相關 的 稅務 措施 》 法案 。 行政 會 發言人 、 行政法 務司 司長 張 永春 ， 財 政局 長 容 光亮 ， 金融 管理局 行政 管理 委員會委員 劉杏娟 昨日 下午 三時 出席 新聞發 佈 會 ， 介紹 法案 內容 。         張 永春 表示 ， 為 了 保持 不動產 市場 平穩 發展 ， 自二 〇 一 〇 年 起 制定 並實施 一系列 包括 稅務及 樓宇 按揭 在 內 的 不動產 需求 管理 措施 。 當中 ， 稅務 措施 包括 特別 印花 稅 、 額外 印花 稅及 取得 印花 稅 。         去年底 ， 政府 因應 市場 環境 變化 適度 放 寬 不動產 需求 管理 措施 ， 提案 獲 立法 會 審議 通過 ， 並 制定 《 修改 第 2 ／ 2018 號 法律 〈 取得 非首個 居住 用途 不動產 的 印花 稅 〉 》 法律 ， 自 今年 一月 一日 起 不再 向 取得 第二 個 居住 用途 不動產 的 人士 徵收 樓價 百分之五 的 取得 印花 稅 。 同時 放 寬 樓宇 按揭 措施 ， 包括 本澳 居民 購置 住宅 的 按揭 成數 上限 為 百分之七十 ， 購置 經濟 房屋 的 按揭 成數 上限 為 百分之九十 ， 不再 設 不同 的 按揭 成數 金額 檔次 上限 。         有 需要 時 再 推 措施         張 永春 指出 ， 政府 持續 關注 及 評估 不動產 市場 的 情況 ， 考慮 到 近年 各類 型 房屋 供應 較 充足 ， 目前 具條件 制定 《 取消 與 不動產 需求 管理 相關 的 稅務 措施 》 法案 ， 取消 特別 印花 稅 、 額外 印花 稅及 取得 印花 稅 （ 附表 ） 。 樓宇 按揭 方面 ， 金管局 將會發 出新 指引 ， 統 一本 澳 居民 及 非本澳 居民 按揭 成數 上限 為 百分之七十 （ 購置 經濟 房屋 按揭 成數 上限 維持 百分之九十 ） ， 並暫 停 按揭 貸款 利率 上調 兩個 百分 點的 壓力 測試 要求 。 上述 措施 不妨 礙 政府 因應 情況 再次 推出 不動產 需求 管理 措施 ， 包括 採取 其他 如 調節 公共 房屋 及 土地 供應 等 可行 手段 ， 維持 不動產 市場 的 穩定 。         取消 銀行 壓力 測試         劉杏娟 表示 ， 政府 預期 未來 利率 上調 機會 輕微 ， 故 取消 銀行 相關 壓力 測試 的 監管 要求 ， 但 不妨 礙銀行 從 風險 管理 角度 推行 壓力 測試 。         劉杏娟 解釋 ， 二 〇 一 〇 年 推出 樓 按 措施 是 針對 所有 在 澳購 買 樓宇 的 人士 ， 按揭 成數 上限 為 七成 。 至 二 〇 一二年 ， 針對 澳門 居民 及非 澳門 居民 有 不同 的 按揭 成數 上限 ， 現時 恢 復 非 澳門 居民 的 樓宇 按揭 成數 上限 與 澳門 居民 同 爲 七成 ， 是 因 外圍 經濟 及 本地 房地產 市場 基本 沒有 外來 資金 炒作 ， 銀行 在 樓宇 按揭 面對 的 風險 降低 。         樓 按 拖欠 率屬 良好         至 二 月底 住宅 按揭 貸款 拖欠 率為 百分之一 點一 ， 處 於 哪 一 水平 ？ 劉杏娟 回應 認為 該 百分比 屬 良好 水平 ， 看不到 需要 變賣 資產 還款 的 情況 。         據 立法 會 網頁 顯示 ， 已 收到 上述 法案 ， 正待議 。,2024-04-13
財局：“撤辣”非托市,參考港實施後交投活躍樓價無升    財局：“撤辣”非托市    【本報消息】本澳跟隨香港全面“撤辣”。財政局長容光亮以香港全面“撤辣”為例，反映政府取消需求管理措施後可釋放購買力，需求管理措施亦非影響價格的主要原因。強調政府並非“托市”，而是因應具體市場變化作適當反應。    地產佔特區產業一成    容光亮解釋取消不動產需求管理措施的原因。表示綜合分析澳門現時經濟狀況推出措施，尤其現時住宅物業的供應量，以及自置物業（私人房屋及經屋）的住戶佔百分之七十三點四。考慮到物業是澳門家庭及企業持有的資產主要成份之一，樓市的穩定與居民、企業息息相關。    普遍居民希望地產價格穩定，不希望“大上大落”。房地產行業佔特區產業較大的份額，一般佔百分之十，疫情期間最高佔百分之十七。若房地產市場萎縮會直接影響市場流動性較低，亦影響家庭及企業的變現能力，嚴重導致資金周轉困難。因此認為有需要採取必要措施促進地產市場的活力，使資金有出路。政府認為穩住地產市場與特區總體經濟發展步伐一致，亦可穩住房地產行業僱員的就業。    疫情前後樓價變化小    容光亮稱，樓價在疫前疫後的變動不大，只是成交量變化大。二〇二一年成交量有五千多宗，而二〇二二年、二〇二三年只有二千多宗。市場萎縮，間接令居民變現流動性相對大減，影響不動產的流動，對經濟影響相應較大。    容光亮提到，今年一至三月不動產成交量與以往相比較少，為五百多宗。政府認為明顯是消費者、潛在買家對本澳持觀望態度，如因鄰近地區對樓市採取積極管理措施。故政府明確態度，配合市場變化作出反應。    炒風不存在毋須措施    參考香港全面“撤辣”至今一個多月，總體交易市場活躍，住宅物業成交量顯著增加，但一、二手樓價格無顯著上升，甚至部分下跌。總括而言無出現熾熱炒賣的跡象，甚至有大型地產發展商以低於成本價銷售新樓盤。反映政府取消需求管理措施後可釋放購買力，需求管理措施亦非影響價格的主要原因。重申政府希望透過價格機制自然調節供需關係及房地產價格。    容光亮認為，影響房地產市場因素已不存在。當年實施房地產需求管理措施，因有外來因素，如外來資金、利率、房地產供應不足，引起較為嚴重的投機出現。如今令很多居民難以買樓的市場因素已不存在，房地產價格可以透過市場機制自然調節，政府不再需要實施房地產需求管理措施。,http://www.macaodaily.com/html/2024-04/13/content_1748054.htm,如今令很多居民難以買樓的市場因素已不存在，房地產價格可以透過市場機制自然調節，政府不再需要實施房地產需求管理措施,參考港 實施 後 交投 活躍樓 價無升         財局 ： “ 撤辣 ” 非托市         【 本報 消息 】 本澳 跟 隨 香港 全面 “ 撤辣 ” 。 財 政局 長 容 光亮 以 香港 全面 “ 撤辣 ” 為例 ， 反映 政府 取消 需求 管理 措施 後 可釋 放購 買力 ， 需求 管理 措施 亦非 影響 價格 的 主要 原因 。 強調 政府 並非 “ 托市 ” ， 而是 因應 具體 市場 變 化作 適當 反應 。         地產 佔 特區 產業 一成         容 光亮 解釋 取消 不動產 需求 管理 措施 的 原因 。 表示 綜合 分析 澳門 現時 經濟 狀況 推出 措施 ， 尤其 現時 住宅 物業 的 供 應量 ， 以及 自置 物業 （ 私人 房屋 及 經屋 ） 的 住 戶 佔 百分之七十 三點 四 。 考慮 到 物業 是 澳門 家庭 及 企業 持有 的 資產 主要 成份 之一 ， 樓市 的 穩定 與 居民 、 企業息息 相關 。         普遍 居民 希望 地產價格 穩定 ， 不 希望 “ 大上 大落 ” 。 房地 產行業 佔 特區 產業 較 大 的 份額 ， 一般 佔 百分之十 ， 疫情 期間 最高 佔 百分之十七 。 若房 地產 市場 萎縮會 直接 影響 市場 流動性 較 低 ， 亦 影響 家庭 及 企業 的 變現 能力 ， 嚴重 導致 資金 周轉 困難 。 因此 認為 有 需要 採取 必要措施 促進 地產 市場 的 活力 ， 使 資金有 出路 。 政府 認為 穩住 地產 市場 與 特區 總體 經濟 發展 步伐 一致 ， 亦可 穩 住房 地產行業 僱員 的 就業 。         疫情 前後樓 價變化 小         容 光亮 稱 ， 樓價 在 疫前疫 後 的 變動 不大 ， 只是 成交量 變化 大 。 二 〇 二 一年 成交量 有 五千多 宗 ， 而 二 〇 二 二年 、 二 〇 二三年 只有 二千多 宗 。 市場 萎縮 ， 間 接令 居民 變現 流動性 相對 大減 ， 影響 不動產 的 流動 ， 對 經濟 影響 相應 較 大 。         容 光亮 提到 ， 今年 一至 三月 不動產 成交量 與 以往 相比 較少 ， 為 五百多 宗 。 政府 認為 明顯 是 消費者 、 潛在 買家 對本 澳持 觀望 態度 ， 如因 鄰 近地 區對 樓市 採取 積極 管理 措施 。 故 政府 明確 態度 ， 配合 市場 變化 作出 反應 。         炒風 不 存在 毋須 措施         參考 香港 全面 “ 撤辣 ” 至今 一個 多月 ， 總體 交易 市場 活躍 ， 住宅 物業 成交量 顯著 增加 ， 但 一 、 二手 樓價格 無 顯著 上升 ， 甚至 部分 下跌 。 總括 而言 無出 現熾熱 炒 賣 的 跡象 ， 甚至 有 大型 地產發 展商 以低 於 成本 價銷售 新樓 盤 。 反映 政府 取消 需求 管理 措施 後 可釋 放購 買力 ， 需求 管理 措施 亦非 影響 價格 的 主要 原因 。 重申 政府 希望 透過 價格 機制 自然 調節 供需 關 係 及 房地 產價格 。         容 光亮 認為 ， 影響 房地產 市場 因素 已 不 存在 。 當年 實施房 地產 需求 管理 措施 ， 因有 外來 因素 ， 如外 來 資金 、 利率 、 房地 產供 應 不足 ， 引起 較 為 嚴重 的 投機 出現 。 如今 令 很多 居民 難以 買樓 的 市場 因素 已 不 存在 ， 房地 產價格 可以 透過 市場 機制 自然 調節 ， 政府 不再 需要 實施房 地產 需求 管理 措施 。,2024-04-13
樓市“撤辣”居民靜觀成效,樓市低迷利息高未敢貿然入市    樓市“撤辣”居民靜觀成效    【本報消息】樓巿即將“撤辣”，有居民表示，已在澳置業但希望換樓，惟樓市低迷未敢貿然決定。認為“撤辣”或有助市場穩定，將觀望措施成效再決策。另有居民稱，將留意琴澳兩地住宅市場，有意置業。    居民溫女士表示，早年在澳購買了兩房一廳單位，家庭成員增加後希望轉換更寬敞的單位，故考慮換樓或添購新住宅。疫後經濟大環境仍不穩定，樓市波動大，加上高息，擔心增加供樓壓力，不敢輕舉妄動。認為政府“撤辣”有助樓市穩定，但換樓、置業還要綜合考慮，包括經濟和市場環境、供款能力等，會繼續觀望“撤辣”成效再決定。    或考慮橫琴置業    居民黃小姐表示，工作穩定未受疫情影響，故在疫情期間已有置業打算。疫下樓價未見顯著回落，仍遠超承受範圍，故擱置在澳置業計劃，轉移目標到橫琴。橫琴樓價較澳門低，且現時兩地交通日益便捷，到橫琴置業成為選擇之一。    不過，近期本澳樓價有回落趨勢，惟擔心置業後樓價續跌，資產貶值。政府公佈“撤辣”後冀能穩定樓市和樓價，將繼續密切留意兩地住宅市場，希望覓到心儀單位，早日“上車”。,http://www.macaodaily.com/html/2024-04/13/content_1748055.htm,認為政府“撤辣”有助樓市穩定，但換樓、置業還要綜合考慮，包括經濟和市場環境、供款能力等，會繼續觀望“撤辣”成效再決定,樓市 低迷 利息 高 未敢 貿然 入市         樓市 “ 撤辣 ” 居民 靜觀 成效         【 本報 消息 】 樓 巿 即將 “ 撤辣 ” ， 有 居民 表示 ， 已 在 澳置業 但 希望 換樓 ， 惟樓 市 低迷 未敢 貿然 決定 。 認為 “ 撤辣 ” 或 有助 市場 穩定 ， 將觀望 措施 成效 再 決策 。 另有 居民 稱 ， 將 留意 琴澳 兩地 住宅 市場 ， 有意 置業 。         居民 溫 女士 表示 ， 早年 在 澳購 買 了 兩房 一廳 單位 ， 家庭 成員 增加 後 希望 轉換 更 寬 敞 的 單位 ， 故 考慮 換樓 或 添購 新 住宅 。 疫後經濟 大環境 仍 不 穩定 ， 樓市 波動 大 ， 加上 高息 ， 擔心 增加 供樓 壓力 ， 不敢 輕舉 妄動 。 認為 政府 “ 撤辣 ” 有助 樓市 穩定 ， 但 換樓 、 置業 還要 綜合 考慮 ， 包括 經濟 和 市場 環境 、 供款 能力 等 ， 會繼續 觀望 “ 撤辣 ” 成效 再 決定 。         或 考慮 橫琴 置業         居民 黃 小姐 表示 ， 工作 穩定 未受 疫情 影響 ， 故 在 疫情 期間 已有 置業 打算 。 疫下樓 價未見 顯著 回落 ， 仍遠超 承受 範圍 ， 故擱 置 在 澳置業 計劃 ， 轉移 目標 到 橫琴 。 橫琴樓 價較 澳門 低 ， 且 現時 兩地 交通 日益 便捷 ， 到 橫琴 置業 成為 選擇 之一 。         不過 ， 近期 本澳樓 價有 回落 趨勢 ， 惟擔 心置 業後樓 價續 跌 ， 資產 貶值 。 政府 公 佈 “ 撤辣 ” 後 冀能 穩定 樓市 和 樓價 ， 將繼續 密切 留意 兩地 住宅 市場 ， 希望 覓 到 心儀 單位 ， 早日 “ 上車 ” 。,2024-04-13
博彩信貸法八月生效,僅賭牌承批公司可向賭客借出籌碼    博彩信貸法八月生效    【本報消息】立法會大會昨細則性通過“娛樂場幸運博彩信貸法律制度”法案，法律訂定日後僅賭牌承批公司可向賭客借出籌碼，博彩中介不能再以個人名義借出，法案將自今年八月生效。    中介可收佣接賭客    法律並建議承批公司和博彩中介可簽署代理權委任合同，博彩中介可收佣協助承批公司尋找或接待賭客等。相關代理合同、補充文件的修改均需獲經濟財政司司長批准，政府亦可基於合法及公共利益原則，要求承批公司更改合同內容。    法律又訂定，行政長官可基於重大公共利益，終止承批公司的信貸業務資格，不論承批公司有否履行相關義務，若承批公司因有關條款被終止信貸業務資格，被終止前所產生的信貸業務仍屬法定債務。    負責細審法案的立法會第二常設委員會主席陳澤武引介時並提及，當本法律生效後，承批公司與博彩中介，以及博彩中介與博彩者之間，不允許有博彩信貸的關係；但博彩信貸合同不排除在娛樂場以外訂立。    博監監管信貸資金    就承批公司及博彩中介可否從事現金信貸業務，陳澤武引述澄清，博彩信貸與金融體系的信貸，是兩套不同的制度，承批公司、博彩中介提供現金信貸，同樣受到現行其他相關法律的規範，尤其金融體系法律制度。委員會關注信貸資金的來源和監管，政府澄清，信貸的資金是屬於承批公司，必須是承批公司自有的資金，但可由承批公司直接將信貸籌碼提供於博彩者，又或由具有代理身份的博彩中介，將承批公司信貸的籌碼提供予博彩者，相對地博彩者償還的款項亦都是歸屬承批公司。    政府並表示，現行博彩法律的框架，設有監管機制，博監局有能力對有關信貸業務和資金進行監管，局方會定期審查承批公司的財力狀況，並因應防清洗黑錢指引要求承批公司對於巨額交易的博彩活動、博彩信貸或償還，必須登記相關交易的資料。,http://www.macaodaily.com/html/2024-04/13/content_1747975.htm,政府並表示，現行博彩法律的框架，設有監管機制，博監局有能力對有關信貸業務和資金進行監管，局方會定期審查承批公司的財力狀況，並因應防清洗黑錢指引要求承批公司對於巨額交易的博彩活動、博彩信貸或償還，必須登記相關交易的資料,僅賭 牌承批 公司 可向 賭客 借出 籌碼         博彩 信貸法 八月 生效         【 本報 消息 】 立法 會大會 昨細則性 通過 “ 娛樂場 幸運 博彩 信貸 法律 制度 ” 法案 ， 法律 訂 定日 後 僅賭 牌承批 公司 可向 賭客 借出 籌碼 ， 博彩 中介 不能 再 以個 人 名義 借出 ， 法案 將自 今年 八月 生效 。         中介 可收 佣接 賭客         法律 並建議 承批 公司 和 博彩 中介 可 簽署 代理 權 委任 合同 ， 博彩 中介 可收 佣 協助 承批 公司 尋找 或 接待 賭客 等 。 相關 代理 合同 、 補充 文件 的 修改 均 需獲 經濟 財政司 司長 批准 ， 政府 亦可 基 於 合法 及 公共利益 原則 ， 要求 承批 公司 更改 合同 內容 。         法律 又 訂定 ， 行政 長 官 可基 於 重大 公共利益 ， 終止 承批 公司 的 信 貸業務 資格 ， 不論 承批 公司 有否 履行 相關 義務 ， 若承批 公司 因有 關條款 被 終止 信 貸業務 資格 ， 被 終止 前 所產生 的 信 貸業務 仍屬 法定 債務 。         負責 細審 法案 的 立法 會 第二 常設 委員會 主席 陳澤武 引介 時並 提及 ， 當本 法律 生效 後 ， 承批 公司 與 博彩 中介 ， 以及 博彩 中介 與 博彩 者 之間 ， 不允許 有 博彩 信貸 的關 係 ； 但 博彩 信貸 合同 不 排除 在 娛樂場 以外 訂立 。         博監 監管 信貸 資金         就 承批 公司 及 博彩 中介 可否 從事現 金信 貸業務 ， 陳澤武 引述 澄清 ， 博彩 信貸 與 金融 體系 的 信貸 ， 是 兩套 不同 的 制度 ， 承批 公司 、 博彩 中介 提供 現 金信 貸 ， 同樣 受到 現行 其他 相關 法律 的 規範 ， 尤其 金融 體系 法律 制度 。 委員會關 注信 貸資金 的 來源 和 監管 ， 政府 澄清 ， 信貸 的 資金 是屬 於 承批 公司 ， 必須 是 承批 公司 自有 的 資金 ， 但 可 由 承批 公司 直接 將信 貸籌碼 提供 於 博彩 者 ， 又 或 由 具有 代理 身份 的 博彩 中介 ， 將承批 公司 信貸 的 籌碼 提供 予 博彩 者 ， 相對 地 博彩 者 償還 的 款項 亦 都 是 歸屬 承批 公司 。         政府 並 表示 ， 現行 博彩 法律 的 框架 ， 設有 監管 機制 ， 博監局 有 能力 對 有 關信 貸業務 和 資金 進行 監管 ， 局方 會 定期 審查 承批 公司 的 財力 狀況 ， 並因 應防 清洗 黑錢 指引 要求 承批 公司 對 於 巨額 交易 的 博彩 活動 、 博彩 信貸 或 償還 ， 必須 登記 相關 交易 的 資料 。,2024-04-13
