Title,Content,Link,Summary,Preprocessed_Content,Date
七月灣區樓市供銷下降,"七月灣區樓市供銷下降    【本報記者廣州廿一日電】克而瑞近日發佈的大灣區內地九城七月樓市月報顯示，大灣區市場熱度下滑明顯，整體供銷下降。九城商品住宅成交面積266萬平方米，環比減17%，同比減32%；每平方米成交均價27,473元，環比基本持平，同比升13%。    據克而瑞不完全統計，七月灣區五城出台7條與樓市相關政策，包括廣州放鬆港澳台及外籍人士限購、佛山落實個人住房貸款中住房套數認定工作、惠州二手房公積金貸款首付比例下調至3成等。    高溫天氣疊加市場經歷年中衝刺季、密集新政後效應衰減，七月灣區九城商品住宅供應面積152萬平方米，環比減23%，成交面積為266萬平方米，環比減17%，同比減32%。    均價方面，克而瑞數據監測每平方米成交均價27,473元，環比基本持平，同比升13%，其中深圳成交均價最高，達68,930元，環比漲16%；其次是東莞34,420元，環比微漲1%；廣州33,735元，環比跌13%。    具體看各城商品住宅成交量價走勢，七月市場進入營銷淡季，廣佛肇成交環比高位回落，但廣佛近期新政動態頻頻，拉動成交同比正增長，樓市處於弱回暖階段。    此外，克而瑞監測到，七月房企營銷力度下降，推盤力度減弱，九城推貨量為3,897套，同環比均減6成，前期需求集中釋放過後項目迎來新一輪蓄客期，整體去化率較去年仍繼續回落。",http://www.macaodaily.com/html/2024-08/22/content_1776224.htm,高溫天氣疊加市場經歷年中衝刺季、密集新政後效應衰減，七月灣區九城商品住宅供應面積152萬平方米，環比減23%，成交面積為266萬平方米，環比減17%，同比減32%,"七月 灣區 樓市 供銷 下降         【 本報 記者 廣州 廿一日 電 】 克而瑞 近日 發 佈 的 大灣區 內 地 九城 七月 樓市 月 報 顯示 ， 大灣區 市場 熱度 下滑 明顯 ， 整體 供銷 下降 。 九城 商品住宅 成交 面積 266 萬 平方米 ， 環比減 17% ， 同比 減 32% ； 每平方米 成交 均價 27 , 473 元 ， 環比 基本 持平 ， 同比 升 13% 。         據克而瑞 不 完全 統計 ， 七月 灣區 五城 出台 7 條與 樓市 相關 政策 ， 包括 廣州 放 鬆 港澳台 及 外籍人士 限購 、 佛山 落實個 人 住房 貸款 中 住房 套數 認定 工作 、 惠州 二手房 公積金 貸款 首付 比例 下調 至 3 成等 。         高溫 天氣疊加 市場 經歷 年 中衝 刺季 、 密集 新政 後 效應 衰減 ， 七月 灣區 九城 商品住宅 供應 面積 152 萬 平方米 ， 環比減 23% ， 成交 面積 為 266 萬 平方米 ， 環比減 17% ， 同比 減 32% 。         均價 方面 ， 克而瑞數 據 監測 每平方米 成交 均價 27 , 473 元 ， 環比 基本 持平 ， 同比 升 13% ， 其中 深圳 成交 均價 最高 ， 達 68 , 930 元 ， 環比漲 16% ； 其次 是 東莞 34 , 420 元 ， 環比 微漲 1% ； 廣州 33 , 735 元 ， 環比跌 13% 。         具體 看 各城 商品住宅 成交量 價走勢 ， 七月 市場 進入 營銷 淡季 ， 廣佛 肇 成交 環比 高位 回落 ， 但 廣佛 近期 新政 動態 頻頻 ， 拉動 成交 同比 正 增長 ， 樓市 處 於 弱 回暖 階段 。         此外 ， 克而瑞 監測 到 ， 七月 房企營銷 力度 下降 ， 推盤 力度 減弱 ， 九城 推貨量 為 3 , 897 套 ， 同環 比均減 6 成 ， 前期 需求 集中 釋放 過後項 目迎 來 新 一輪蓄 客期 ， 整體 去 化率 較 去年 仍繼續 回落 。",2024-08-22
次季穗二手網簽環比增逾兩成,"次季穗二手網簽環比增逾兩成    【中新社廣州電】據廣州市房地產中介協會消息，受多項重磅利好政策刺激，今年第二季廣州市二手住宅網簽27,422套，共計274.82萬平方米，環比分別增20.86%和20.85%。    數據顯示，第二季各區二手住宅網簽套數環比均有增長，其中增城區增幅較大，達32.05%；番禺區、荔灣區、黃埔區和白雲區也有較高增幅，分別為26.11%、25.44%、22.05%和21.73%。    網簽二手住宅的面積區間構成方面，60-90平方米、90-120平方米和120-144平方米所佔比例環比均有增長。此外，受購房信貸政策大幅放寬影響，按揭付款比例環比增6.01個百分點。    從中心城區十大活躍板塊來看，其中同德圍——羅沖圍和天河北板塊環比增長超過30%；珠江新城、東曉南、客村——赤崗、同和、西關和東山口等板塊環比增長均逾20%。",http://www.macaodaily.com/html/2024-08/22/content_1776225.htm,"次季穗二手網簽環比增逾兩成    【中新社廣州電】據廣州市房地產中介協會消息，受多項重磅利好政策刺激，今年第二季廣州市二手住宅網簽27,422套，共計274.82萬平方米，環比分別增20.86%和20.85%","次 季穗 二手 網簽環 比增 逾 兩成         【 中新社 廣州電 】 據廣 州市 房地產 中介 協會 消息 ， 受多項 重磅 利好 政策 刺激 ， 今年 第二季 廣 州市 二手 住宅 網簽 27 , 422 套 ， 共計 274.82 萬 平方米 ， 環 比分 別增 20.86% 和 20.85% 。         數據 顯示 ， 第二季 各區 二手 住宅 網簽 套數 環比均 有 增長 ， 其中 增城 區 增幅 較大 ， 達 32.05% ； 番禺 區 、 荔灣區 、 黃埔區 和 白雲區 也 有 較 高 增幅 ， 分別 為 26.11% 、 25.44% 、 22.05% 和 21.73% 。         網簽 二手 住宅 的 面積 區間 構成 方面 ， 60 - 90 平方米 、 90 - 120 平方米 和 120 - 144 平方米 所 佔 比例 環比均 有 增長 。 此外 ， 受購 房信貸 政策 大幅 放寬 影響 ， 按揭 付款 比例 環 比增 6.01 個 百分 點 。         從 中心 城區 十大 活躍板 塊 來 看 ， 其中 同德 圍 — — 羅 沖 圍和天 河北 板塊環 比增 長 超過 30% ； 珠江 新城 、 東曉南 、 客村 — — 赤崗 、 同 和 、 西關 和 東 山口 等 板塊環 比增 長 均 逾 20% 。",2024-08-22
穗瘋狂賣地  三個月推五十地,穗瘋狂賣地  三個月推五十地    【本報記者廣州廿一日電】廣州即將開啟瘋狂賣地模式。廣州市二四年部分擬供商品住宅用地項目清單（第三批）近日正式公佈，共50宗地塊，擬於八月十五日至十一月十四日期間陸續發佈出讓公告。    中心區樓面價破兩萬    根據清單顯示，本次推出的50宗地共涉及廣州9個區，大多分佈在中心城區，白雲區最多共10宗，其次為花都區9宗、海珠區8宗、番禺區8宗、天河區6宗、荔灣區5宗、從化區2宗，越秀區及黃埔區各1宗。增城、南沙這兩個庫存積壓的區域，缺席本次供地。    該份清單裡有不少即將掀起市場風雨的明星地塊。如金融城西區的臨江大道北側地塊和員村二橫路以西地塊，被認為是今年廣州最好的地塊。另外，越秀區的廣州大道中地塊，距離天河城和正佳商場很近，非常有潛力的地塊。海珠區的琶洲南區三宗宅地，總佔地面積逾11.5萬平方米，荔灣區的芳村大道南以西地塊，備受關注。    業內人士指出，從去年開始，中心區便摃起“供應”大旗。近一年廣州涉宅用地成交樓面價呈上升趨勢。依托於中心區高樓面價地塊的成交，今年上半年每平方米甚至破2萬元。    庫存高房企審慎拿地    引起這樣的變化，主要有兩個原因：一是外圍區庫存量較高。如增城，截至今年上半年，庫存量逾230萬平方米，消化周期近三十個月，即便不供地，現有的庫存已夠賣兩年半。由於庫存積壓，按照“盤活多少，供應多少”的原則，只能減少外圍區的供地。    二是房企“開源節流”，拿地變得越發謹慎。    在當前的市場環境下，房企拿地更追求性價比，核心城區的宅地更受關注。    據克而瑞數據顯示，今年上半年，廣州涉宅用地撤牌率刷新歷史記錄，達83%。廣州土地依賴程度較高，為提高財政收入，供地只能“投其所好”，拿出更多中心城區的“好貨”。    業內人士指出，廣州的房地產市場一直都是全國風向標，這次大規模賣地，無論是對開發商還是購房者，都是一次新的博弈。開發商需考慮市場的供需平衡和資金鏈的安全，購房者則要看準時機，選擇適合自己的項目。,http://www.macaodaily.com/html/2024-08/22/content_1776226.htm,中心區樓面價破兩萬    根據清單顯示，本次推出的50宗地共涉及廣州9個區，大多分佈在中心城區，白雲區最多共10宗，其次為花都區9宗、海珠區8宗、番禺區8宗、天河區6宗、荔灣區5宗、從化區2宗，越秀區及黃埔區各1宗,穗 瘋狂 賣 地     三個 月 推 五十 地         【 本報 記者 廣州 廿一日 電 】 廣州 即將 開啟 瘋狂 賣 地 模式 。 廣 州市 二 四年 部分 擬供 商品住宅 用地 項目 清單 （ 第三批 ） 近日 正式 公 佈 ， 共 50 宗地塊 ， 擬 於 八月 十五日 至 十一月 十四 日期 間 陸續 發 佈 出 讓 公告 。         中心 區樓 面價破 兩萬         根據 清單 顯示 ， 本次 推出 的 50 宗地 共 涉及 廣州 9 個區 ， 大多 分 佈 在 中心 城區 ， 白雲區 最 多 共 10 宗 ， 其次 為 花都 區 9 宗 、 海珠 區 8 宗 、 番禺 區 8 宗 、 天河 區 6 宗 、 荔灣區 5 宗 、 從化區 2 宗 ， 越秀 區及黃埔區 各 1 宗 。 增城 、 南沙 這兩個 庫存 積壓 的 區域 ， 缺席 本次 供地 。         該份 清 單裡 有 不少 即將 掀起 市場 風雨 的 明星 地塊 。 如 金融 城西 區的 臨江 大道北 側地塊 和員村 二橫路 以西 地塊 ， 被 認為 是 今年 廣州 最好 的 地塊 。 另外 ， 越秀 區的 廣州 大道 中地塊 ， 距離 天河城 和 正佳 商場 很 近 ， 非常 有 潛力 的 地塊 。 海珠 區的琶洲 南區 三宗 宅地 ， 總佔 地面 積 逾 11.5 萬 平方米 ， 荔灣區 的 芳村 大道 南 以西 地塊 ， 備受 關注 。         業內 人士 指出 ， 從 去年 開始 ， 中心 區便 摃 起 “ 供應 ” 大旗 。 近 一年 廣州 涉宅 用地 成交 樓面價 呈上升 趨勢 。 依托 於 中心 區高樓 面價 地塊 的 成交 ， 今年 上半年 每平方米 甚至 破 2 萬元 。         庫存 高房 企審慎 拿 地         引起 這樣 的 變化 ， 主要 有 兩個 原因 ： 一是 外圍 區庫 存量 較 高 。 如 增城 ， 截至 今年 上半年 ， 庫 存量 逾 230 萬 平方米 ， 消化 周期 近 三十 個 月 ， 即便 不供 地 ， 現有 的 庫存 已夠 賣 兩年 半 。 由 於 庫存 積壓 ， 按照 “ 盤活 多少 ， 供應 多少 ” 的 原則 ， 只能 減少外 圍區 的 供 地 。         二是 房企 “ 開源 節流 ” ， 拿 地 變得 越 發謹慎 。         在 當前 的 市場 環境 下 ， 房企拿地 更 追求 性價 比 ， 核心 城區 的 宅地 更受 關注 。         據克而瑞數 據 顯示 ， 今年 上半年 ， 廣州 涉宅 用地 撤牌 率 刷新 歷史 記錄 ， 達 83% 。 廣州 土地 依賴 程度 較 高 ， 為 提高 財政 收入 ， 供地 只能 “ 投其所好 ” ， 拿出 更 多 中心 城區 的 “ 好貨 ” 。         業內 人士 指出 ， 廣州 的 房 地產 市場 一直 都 是 全國 風向標 ， 這次 大規模 賣 地 ， 無論 是 對 開 發商 還是 購房者 ， 都 是 一次 新 的 博弈 。 開發 商需 考慮 市場 的 供需平衡 和 資金鏈 的 安全 ， 購房者則 要 看準 時機 ， 選擇 適合 自己 的 項目 。,2024-08-22
我對歐盟乳製品反補貼調查,我對歐盟乳製品反補貼調查    【本報綜合報道】據中新社北京廿一日電：中國商務部廿一日發佈公告，宣佈對原產於歐盟的進口相關乳製品發起反補貼立案調查。    根據公告，商務部於二○二四年七月廿九日收到中國國內乳製品產業正式提交的反補貼調查申請，申請人請求對原產於歐盟的進口相關乳製品進行反補貼調查。    本月曾與歐盟磋商    商務部經初步審查認為，申請書中包含了《中華人民共和國反補貼條例》第十四條、第十五條規定的反補貼調查立案所要求的內容及有關證據，故決定自二○二四年八月廿一日起對原產於歐盟的進口相關乳製品進行反補貼立案調查。    根據《中華人民共和國反補貼條例》第十六條規定，二○二四年八月七日，商務部就有關反補貼調查事項向歐盟政府發出磋商邀請，並於八月十四日與歐盟政府磋商。    此次接受調查的相關乳製品具體包括鮮乳酪（包括乳清乳酪）及凝乳，經加工的乳酪，藍紋乳酪和婁地青霉生產的帶紋理的其他乳酪等。其他未列名的乳酪，未濃縮及未加糖或其他甜物質的乳及稀奶油（按重量計脂肪含量超過百分之十）。申請調查相關乳製品接受了歐盟及其成員國政府的補貼，歐盟相關乳製品產業（企業）可能受益的補貼項目共計二十項，本次調查確定的補貼調查期為二○二三年四月一日至二○二四年三月卅一日，產業損害調查期為二○二○年一月一日至二○二四年三月卅一日。    市場價格差異較大    申請書顯示，歐盟進口相關乳製品與國內企業生產的同類產品成份、工藝和用途相同或相似，但由於可能受益的補貼因素，導致最終兩者在中國市場的價格差異較大。申請調查相關乳製品的加權平均進口價格比國內同類產品加權平均銷售價格低百分之三十到百分之五十不等，已經對國內產業同類產品造成了明顯的價格削減和壓低。海關資料顯示，二○二○年至二○二三年，申請調查相關乳製品進口累計增長百分之二十五點八，二○二四年一季度同比增長了百分之十一點三。其中稀奶油二○二三年比二○二○年進口增長百分之二十六點六，乳酪進口二○二三年比二○二○年增長了百分之二十三點五。    這一情況也導致國內相關乳製品盈利能力比二○二一年出現大幅下降或虧損，二○二○年到二○二三年國內相關產業只有一到五成的開工率，處於極低水平。    將作客觀公正裁決    本次調查自二○二四年八月廿一日起開始，通常應在二○二五年八月廿一日前結束調查，特殊情況下可延長六個月。    中國商務部貿易救濟調查局負責人當天稱，調查機關將依法開展調查，充分保障各利害關係方權利，並根據調查結果客觀公正作出裁決。,http://www.macaodaily.com/html/2024-08/22/content_1776138.htm,本月曾與歐盟磋商    商務部經初步審查認為，申請書中包含了《中華人民共和國反補貼條例》第十四條、第十五條規定的反補貼調查立案所要求的內容及有關證據，故決定自二○二四年八月廿一日起對原產於歐盟的進口相關乳製品進行反補貼立案調查,我 對 歐盟 乳 製 品 反 補 貼 調 查         【 本報 綜合 報道 】 據 中新社 北京 廿一日 電 ： 中國 商務部 廿一日 發 佈 公告 ， 宣 佈 對 原產 於 歐盟 的 進口 相關 乳 製 品 發 起 反 補 貼 立案 調查 。         根據 公告 ， 商務部 於 二 ○ 二 四年 七月 廿九日 收到 中國國 內 乳 製 品 產 業 正式 提交 的 反補 貼 調查 申請 ， 申請 人 請求 對 原產 於 歐盟 的 進口 相關 乳 製 品 進 行 反 補 貼 調 查 。         本月 曾 與 歐盟 磋商         商務部經 初步 審查 認為 ， 申請 書 中 包含 了 《 中華 人民 共和 國反 補貼 條例 》 第十四 條 、 第十五 條規定 的 反補 貼 調查 立案 所 要求 的 內容 及 有 關證據 ， 故決定 自二 ○ 二 四年 八月 廿一日 起 對 原產 於 歐盟 的 進口 相關 乳 製 品 進 行 反 補 貼 立案 調查 。         根據 《 中華 人民 共和 國反 補貼 條例 》 第十六 條規定 ， 二 ○ 二 四年 八月 七日 ， 商務部 就 有關 反補 貼 調查 事項 向 歐盟 政府 發出 磋商 邀請 ， 並 於 八月 十四日 與 歐盟 政府 磋商 。         此次 接受 調查 的 相關 乳 製 品 具 體 包括 鮮 乳酪 （ 包括 乳清 乳酪 ） 及 凝乳 ， 經 加工 的 乳酪 ， 藍紋 乳酪 和 婁地 青霉 生產 的 帶 紋理 的 其他 乳酪 等 。 其他 未 列名 的 乳酪 ， 未 濃縮 及 未 加糖 或 其他 甜物質 的 乳及 稀 奶油 （ 按 重量 計 脂肪 含量 超過 百分之十 ） 。 申請 調查 相關 乳 製 品 接受 了 歐盟 及其 成員國 政府 的 補貼 ， 歐盟 相關 乳 製 品 產 業 （ 企業 ） 可能 受益 的 補貼 項 目共計 二十 項 ， 本次 調查 確定 的 補貼 調查期 為 二 ○ 二三年 四月 一日 至 二 ○ 二 四年 三月 卅一日 ， 產業 損害 調查期 為 二 ○ 二 ○ 年 一月 一日 至 二 ○ 二 四年 三月 卅一日 。         市場 價格 差異 較 大         申請 書 顯示 ， 歐盟 進口 相關 乳 製 品 與 國 內 企 業 生 產 的 同 類 產 品 成份 、 工藝 和 用途 相同 或 相似 ， 但 由 於 可能 受益 的 補貼 因素 ， 導致 最終 兩者 在 中國 市場 的 價格 差異 較 大 。 申請 調查 相關 乳 製 品 的 加 權 平均 進口 價格 比國內 同類 產品 加權 平均 銷售 價格 低 百分之三十 到 百分之五十 不 等 ， 已經 對國 內產業 同類 產品 造成 了 明顯 的 價格削 減和壓 低 。 海關 資料 顯示 ， 二 ○ 二 ○ 年 至 二 ○ 二三年 ， 申請 調查 相關 乳 製 品 進 口 累 計 增 長 百分之二十五 點八 ， 二 ○ 二 四年 一季度 同比 增長 了 百分之十一 點三 。 其中 稀 奶油 二 ○ 二三年 比二 ○ 二 ○ 年 進口 增長 百分之二十 六點 六 ， 乳酪 進口 二 ○ 二三年 比二 ○ 二 ○ 年 增長 了 百分之二十 三點 五 。         這一 情況 也 導致 國內 相關 乳 製 品 盈利 能力 比二 ○ 二 一年 出現 大幅 下降 或 虧損 ， 二 ○ 二 ○ 年 到 二 ○ 二三年 國內 相關 產業 只有 一到 五成 的 開工率 ， 處於極 低水平 。         將 作客 觀 公正 裁決         本次 調查 自二 ○ 二 四年 八月 廿一日 起開始 ， 通常 應 在 二 ○ 二 五年 八月 廿一日 前 結束 調查 ， 特殊 情況 下 可延 長 六個 月 。         中國 商務部 貿易 救濟 調查局 負責人 當天稱 ， 調查 機關將 依法 開展 調查 ， 充分 保障 各 利害 關 係 方權利 ， 並根據 調查 結果 客觀 公正 作出 裁決 。,2024-08-22
中方：典型保護主義,歐盟將對華電動汽車徵高關稅    中方：典型保護主義    【中新社北京廿一日電】針對歐盟委員會表示將對中國電動汽車實施高關稅，中國外交部發言人毛寧廿一日在例行記者會上表示，這起調查是典型的保護主義和政治主導行為。    有記者提問，歐盟委員會表示計劃對中國電動汽車實施高達百分之三十六點三的關稅，並稱願意聽取中國提出的解決方案。中方對此有何評論？    敦促歐方立即糾錯    毛寧表示，二十日，商務部發言人已經就此闡明了中方的嚴正立場，中國的產業界和商業協會也發聲表示堅決反對。我想強調的是，這起調查是典型的保護主義和政治主導行為，無視客觀事實，罔顧世貿規則，違背歷史潮流，損害歐盟綠色轉型進程和全球應對氣候變化的努力，只會損人害己。毛寧說，我們敦促歐方立即糾正錯誤做法，停止將經貿問題政治化、工具化、武器化，切實拿出誠意同中方相向而行，加快探討妥善解決方案，避免貿易摩擦升級，避免影響中歐之間的互信與合作。中方將採取一切必要措施，堅決捍衛中國企業的正當權益。    中汽協：堅決反對    此外，針對歐盟對華電動汽車反補貼調查終裁披露，中國汽車工業協會廿一日稱，仲裁信息嚴重歪曲中國電動車產業事實，中國汽車工業協會代表中國汽車行業表示強烈不滿和堅決反對。    中汽協認為，對中國電動汽車徵收高額反補貼稅，給中國企業在歐經營及赴歐投資帶來極大風險和不確定性，損害中國企業在歐經營和赴歐投資的信心，將對帶動歐盟汽車產業發展、增加歐盟當地就業機會、實現綠色可持續發展帶來嚴重不利影響。    中汽協方面表示，希望歐方從中歐產業合作大局出發，堅持對話合作，共同維護中歐乃至全球汽車產業發展營造公平、非歧視、可預期的市場環境，共同維護全球汽車產業鏈供應鏈安全。,http://www.macaodaily.com/html/2024-08/22/content_1776139.htm,歐盟將對華電動汽車徵高關稅    中方：典型保護主義    【中新社北京廿一日電】針對歐盟委員會表示將對中國電動汽車實施高關稅，中國外交部發言人毛寧廿一日在例行記者會上表示，這起調查是典型的保護主義和政治主導行為,歐盟將 對華電動 汽車 徵高 關稅         中方 ： 典型 保護 主義         【 中新社 北京 廿一日 電 】 針對 歐 盟委 員會 表示 將對 中國 電動 汽車 實施 高 關稅 ， 中國 外交部 發言人 毛寧 廿一日 在 例行 記者 會 上 表示 ， 這起 調查 是 典型 的 保護 主義和 政治 主導行 為 。         有 記者 提問 ， 歐 盟委 員會 表示 計劃 對 中國 電動 汽車 實施 高達 百分之三十六 點三 的 關稅 ， 並稱 願意 聽取 中國 提出 的 解決 方案 。 中方 對此 有何 評論 ？         敦促 歐方 立即 糾錯         毛寧 表示 ， 二十日 ， 商務部 發言人 已經 就此 闡明 了 中方 的 嚴正立場 ， 中國 的 產業界 和 商業 協會 也 發聲 表示 堅決 反對 。 我想 強調 的 是 ， 這起 調查 是 典型 的 保護 主義和 政治 主導行 為 ， 無視 客觀 事實 ， 罔 顧世貿 規則 ， 違背 歷史 潮流 ， 損害 歐盟 綠色 轉型 進程 和 全球 應對 氣候 變化 的 努力 ， 只會 損人 害己 。 毛寧 說 ， 我們 敦促 歐方 立即 糾正 錯誤 做法 ， 停止 將經貿 問題 政治化 、 工具化 、 武器化 ， 切實 拿出 誠意同 中方 相向 而行 ， 加快 探討 妥善 解決 方案 ， 避免 貿易 摩擦 升級 ， 避免 影響 中 歐之間 的 互信 與 合作 。 中方 將採取 一切 必要措施 ， 堅決 捍衛 中國 企業 的 正當 權益 。         中汽協 ： 堅決 反對         此外 ， 針對 歐盟 對華電動 汽車 反補 貼 調查 終裁 披露 ， 中國 汽車 工業 協會 廿一日 稱 ， 仲裁 信息 嚴重 歪曲 中國 電動 車產業 事實 ， 中國 汽車 工業 協會 代表 中國 汽車 行業 表示 強烈 不滿 和 堅決 反對 。         中汽協 認為 ， 對 中國 電動 汽車 徵收 高額 反補 貼稅 ， 給中國 企業 在 歐經營 及 赴 歐 投資帶 來 極大風險 和 不確 定性 ， 損害 中國 企業 在 歐經營 和 赴 歐 投資 的 信心 ， 將對 帶動 歐盟 汽車 產業 發展 、 增加 歐盟 當地 就業 機會 、 實現 綠色 可持續 發展 帶來 嚴重 不利 影響 。         中汽協 方面 表示 ， 希望 歐方 從 中 歐產業 合作 大局 出發 ， 堅持 對 話 合作 ， 共同 維護 中歐 乃至 全球 汽車 產業 發展 營造 公平 、 非歧視 、 可 預期 的 市場 環境 ， 共同 維護 全球 汽車 產業 鏈供 應鏈 安全 。,2024-08-22
