Title,Content,Link,Summary,Preprocessed_Content,Date
醫委會談資格認可專科培訓,過渡期自動獲認可醫生交證明可投考    醫委會談資格認可專科培訓    【本報消息】衛生局訊：醫務委員會日前舉行第六屆第二次全體會議，會議由醫務委員會主席羅奕龍主持，探討本澳青年醫生的職涯發展。    培養回流引進並行    羅奕龍在會議上表示，特區政府致力持續優化醫療服務，在人才儲備方面，積極透過“人才培養、人才回流與人才引進”並行政策，以強化本澳醫療人才培養和隊伍建設工作。本地畢業或留澳發展的醫療人員，可透過資格認可制度考試及實習取得專業資格；外地進修回澳發展的醫療人員，符合相關條件者則可透過相關豁免機制或同等學歷認可制度而取得相應專業資格。希望透過是次會議釐清醫療人員在本澳的發展路徑，更好讓在外地取得相關資歷的醫療人員，銜接本澳專業資格認可制度和專科培訓制度。同時，希望借助委員作為與業界溝通的橋樑作用，更好向業界傳遞相關訊息。    醫療專業委員會秘書長梁佩珊和澳門醫學專科學院協調員林果分別介紹醫療人員資格認可考試和實習等具體情況、澳門專科醫生培訓的實施情況，尤其是豁免考試及實習的相關準則，以及參加專科培訓醫生的投考條件、專科培訓的同等學歷認可規定等。對於現時因過渡制度自動獲得資格認可證書而不具相關等同效力培訓證明的醫生、中醫生及牙科醫生，亦可參照“豁免實習全部或部分同等培訓準則”的規定，在開考的資格審查階段向典試委員會提交符合條件的工作經驗證明或畢業後培訓證明，以取得投考公職醫生、中醫生及牙科醫生的資格，醫生亦可通過上述機制取得投考專科培訓的資格。    多宣傳助規劃職涯    此外，鏡湖醫院副院長謝學斌亦分享現時鏡湖醫院有關畢業後全科實習及專科培訓情況。與會委員認為是次會議有助更清晰了解本澳資格認可和專科培訓制度，並建議多向業界宣傳，以助本澳青年醫療人員更好規劃職業生涯。委員亦就豁免資格認可考試及實習的資歷要求、過渡制度醫生投考醫學專科培訓的相關條件、外地接受的專科培訓可否申請部分同等學歷認可、持有限度執照者的居民身份轉換等問題表示關注。,http://www.macaodaily.com/html/2024-10/04/content_1785417.htm,對於現時因過渡制度自動獲得資格認可證書而不具相關等同效力培訓證明的醫生、中醫生及牙科醫生，亦可參照“豁免實習全部或部分同等培訓準則”的規定，在開考的資格審查階段向典試委員會提交符合條件的工作經驗證明或畢業後培訓證明，以取得投考公職醫生、中醫生及牙科醫生的資格，醫生亦可通過上述機制取得投考專科培訓的資格,過渡期 自動 獲認 可 醫生 交證明 可 投考         醫委會 談資格 認可 專科 培訓         【 本報 消息 】 衛生 局訊 ： 醫務委員會 日前 舉行 第六 屆 第二次 全體 會議 ， 會議 由 醫務委員會 主席 羅 奕 龍 主持 ， 探討本 澳 青年 醫生 的 職涯 發展 。         培養 回流 引進 並行         羅 奕 龍 在 會議 上 表示 ， 特區 政府 致力 持續 優化 醫療 服務 ， 在 人才 儲備 方面 ， 積極 透過 “ 人才 培養 、 人才 回流 與 人才 引進 ” 並行 政策 ， 以 強化本 澳醫療 人才 培養 和 隊伍 建設 工作 。 本地 畢業 或 留澳 發展 的 醫療 人員 ， 可透過 資格 認可 制度 考試 及 實習 取得 專業 資格 ； 外地 進修 回澳 發展 的 醫療 人員 ， 符合 相關 條件者則 可 透過 相關 豁免 機制 或 同等 學歷 認可 制度 而 取得 相應 專業 資格 。 希望 透過 是 次會議 釐 清醫療 人員 在 本澳 的 發展 路徑 ， 更好 讓 在 外地 取得 相關 資歷 的 醫療 人員 ， 銜接 本澳 專業 資格 認可 制度 和 專科 培訓 制度 。 同時 ， 希望 借助 委員作 為 與 業界溝 通的橋 樑 作用 ， 更好 向業界 傳遞 相關訊息 。         醫療 專業 委員會 秘書長 梁佩珊 和 澳門 醫學 專科學院 協調員 林果 分別 介紹 醫療 人員資格 認可 考試 和 實習 等 具體 情況 、 澳門 專科 醫生 培訓 的 實施 情況 ， 尤其 是 豁免 考試 及 實習 的 相關 準則 ， 以及 參加 專科 培訓 醫生 的 投考 條件 、 專科 培訓 的 同等 學歷 認可 規定 等 。 對 於 現時 因過 渡 制度 自動 獲得 資格 認可證 書 而 不具 相關 等同 效力 培訓 證明 的 醫生 、 中醫生 及 牙科 醫生 ， 亦可 參照 “ 豁免 實習 全部 或 部分 同等 培訓 準則 ” 的 規定 ， 在 開考 的 資格 審查 階段 向典 試委員會 提交 符合 條件 的 工作 經驗 證明 或 畢業後培訓 證明 ， 以 取得 投考 公職 醫生 、 中醫生 及 牙科 醫生 的 資格 ， 醫生 亦可 通過 上述 機制 取得 投考 專科 培訓 的 資格 。         多 宣傳助 規劃 職涯         此外 ， 鏡湖 醫院 副 院長 謝學斌 亦 分享 現時 鏡湖 醫院 有關 畢業 後 全科 實習 及 專科 培訓 情況 。 與 會委員 認為 是 次會議 有助 更 清晰 了解 本澳 資格 認可 和 專科 培訓 制度 ， 並建議 多 向業界 宣傳 ， 以助 本澳 青年 醫療 人員 更好 規劃 職業 生涯 。 委員 亦 就 豁免 資格 認可 考試 及 實習 的 資歷 要求 、 過渡 制度 醫生 投考 醫學 專科 培訓 的 相關 條件 、 外地 接受 的 專科 培訓 可否 申請 部分 同等 學歷 認可 、 持有 限度 執照者 的 居民 身份 轉換 等 問題 表示 關注 。,2024-10-04
（新聞小語）吸引青年關注 培育工業人才   夏  耘,吸引青年關注   培育工業人才    澳門工業曾有輝煌一頁，上世紀七、八十年代各類紡織品、電器、玩具、人造花等出口盛極一時，見證了小城的工業成就。到今天，工業看似淡出，但實際上是華麗轉身，契合“一加四”適度多元發展策略，澳琴四新產業都同現代工業息息相關，為澳門經濟多元、就業多元、科技創新發展提供新機遇。    第十屆澳門工展會昨揭幕。工展會其中一個重要目的，就是“工業教育”，場內設置了澳門工業綜合館，以“澳門工業新質生產力”為題，全面剖析澳門工業情況，首次展出本澳企業與中學生合作生產的潤膚膏、運動凝膠等，展現學生們創新思維與實踐能力，也是學校與企業合作的成功案例。參展學生表示，從靈感變成產品並不容易，期間學校提供平台和資源，與廠商會合作讓團隊有機會參觀工廠，親身體驗產品生產全過程，加深了對工業生產的理解，激發對大健康產業的興趣，開闊了視野。    許多人對工業仍停留於過去工廠打工、流水作業的刻板形象。然而，製造業不但沒有甩隊，而是走在時代前沿，正以數字化、網絡化、智能化加速轉型蛻變，升級發展新質生產力。澳門工業早已不是勞動密集，而是迭代更新，產品多元，從生活用品、食品製作、服裝設計，到大健康產品、芯片研發，成績可圈可點。但不少人對本澳工業發展及現況等一知半解，就業選擇變得局限，不利職業規劃及工業發展。    近年社會重視“工業教育”，業界透過舉辦“工業走進校園”等活動推廣工業。有必要多舉辦同類活動及組織學生參觀工廠、企業等，並透過產學合作，推動學生接觸多門類工業項目和產品開發過程，勾起下一代對工業的關注及興趣。    工業人才培養是系統工程，需政府、教育機構及企業各方合力。宜在院校設置更多工業相關專業課程，加強校企合作以及加強持續教育，助力工業人才培養。讓更多人認識澳門工業轉型升級的重要性，吸引年輕人投身工業，為澳門工業創新發展儲備人才，推動發展新質生產力。    夏  耘,http://www.macaodaily.com/html/2024-10/04/content_1785418.htm,工展會其中一個重要目的，就是“工業教育”，場內設置了澳門工業綜合館，以“澳門工業新質生產力”為題，全面剖析澳門工業情況，首次展出本澳企業與中學生合作生產的潤膚膏、運動凝膠等，展現學生們創新思維與實踐能力，也是學校與企業合作的成功案例,吸引 青年 關注       培育 工業 人才         澳門 工業 曾 有 輝煌 一頁 ， 上世紀 七 、 八十年代 各類 紡織品 、 電器 、 玩具 、 人造花 等 出口 盛極 一時 ， 見證 了 小城 的 工業 成就 。 到 今天 ， 工業 看似 淡出 ， 但 實際 上 是 華麗 轉身 ， 契合 “ 一加 四 ” 適度 多元 發展 策略 ， 澳琴 四新產業 都 同現 代工 業息息 相關 ， 為 澳門 經濟 多元 、 就業 多元 、 科技 創新 發展 提供 新機遇 。         第十 屆 澳門 工展 會 昨 揭幕 。 工展 會 其中 一個 重要 目的 ， 就是 “ 工業 教育 ” ， 場內 設置 了 澳門 工業 綜合館 ， 以 “ 澳門 工業 新質 生產力 ” 為題 ， 全面 剖析 澳門 工業 情況 ， 首次 展出 本澳 企業 與 中學生 合作 生產 的 潤膚膏 、 運動 凝膠 等 ， 展現 學生們 創新思維 與 實踐 能力 ， 也 是 學校 與 企業 合作 的 成功 案例 。 參展 學生 表示 ， 從靈 感變 成產品 並不 容易 ， 期間 學校 提供 平台 和 資源 ， 與 廠 商會 合作 讓 團隊 有 機會 參觀 工廠 ， 親身 體驗 產品 生產全 過程 ， 加深 了 對 工業 生產 的 理解 ， 激發 對 大 健康 產業 的 興趣 ， 開闊 了 視野 。         許多人 對 工業 仍停留 於 過去 工廠 打工 、 流水 作業 的 刻板 形象 。 然而 ， 製 造 業 不但 沒有 甩隊 ， 而是 走 在 時代 前沿 ， 正以 數字化 、 網絡化 、 智能化 加速 轉型 蛻變 ， 升級 發展 新質 生產力 。 澳門 工業 早已 不是 勞動 密集 ， 而是 迭代 更新 ， 產品 多元 ， 從 生活用品 、 食品 製 作 、 服裝 設計 ， 到 大 健康 產品 、 芯片 研發 ， 成績 可圈 可點 。 但 不少 人 對 本 澳工業 發展 及 現況 等 一知半解 ， 就業 選擇 變得 局限 ， 不利 職業 規劃 及 工業 發展 。         近年 社會 重視 “ 工業 教育 ” ， 業界 透過 舉辦 “ 工業 走 進校園 ” 等 活動 推廣工業 。 有 必要 多舉 辦同類 活動 及 組織 學生 參觀 工廠 、 企業 等 ， 並透 過產學 合作 ， 推動 學生 接觸 多門類 工業 項目 和 產品 開發 過程 ， 勾起 下一代 對 工業 的 關注 及 興趣 。         工業 人才 培養 是 系統 工程 ， 需 政府 、 教育 機構 及 企業 各方 合力 。 宜在 院校 設置 更 多 工業 相關 專業 課程 ， 加強 校企 合作 以及 加強 持續 教育 ， 助力 工業 人才 培養 。 讓 更 多 人 認識 澳門 工業 轉型 升級 的 重要性 ， 吸引 年 輕人 投身 工業 ， 為 澳門 工業 創新 發展 儲備 人才 ， 推動 發展 新質 生產力 。         夏     耘,2024-10-04
失智症友善聯盟交流會籲關注,失智症友善聯盟交流會籲關注    【本報消息】社會工作局訊：國際失智症協會把每年九月訂為“世界失智症月”，本年主題為“全民正視失智症”，呼籲全社會一起行動，讓大眾對失智症有正確認識和關注。    為了配合本年的主題，社會工作局、衛生局和澳門失智症協會於九月二十日及二十一日在市政署青洲坊活動中心禮堂合辦“二○二四年澳門特區失智症友善大聯盟交流會”，邀請長者服務機構、醫療專業團體、高等院校、青年服務機構及學校的代表擔任主講嘉賓，向出席的失智症友善大聯盟成員分享相關的失智症服務經驗及相關的研究成果，促進失智症友善大聯盟成員間的交流及合作。兩場交流會合共近二百名代表參與。    社會工作局、衛生局和澳門失智症協會在二○一七年推出“澳門特區失智症友善社區約章”計劃，以鼓勵大眾關心身邊的失智症患者及支持其家人和照顧者，減低對失智症的負面標籤，至今已有一百九十五個團體加入成為失智症友善社區大聯盟的成員。更多有關失智症的相關資訊，可瀏覽澳門特區長者服務資訊網(www.ageing.ias.gov.mo)。,http://www.macaodaily.com/html/2024-10/04/content_1785419.htm,為了配合本年的主題，社會工作局、衛生局和澳門失智症協會於九月二十日及二十一日在市政署青洲坊活動中心禮堂合辦“二○二四年澳門特區失智症友善大聯盟交流會”，邀請長者服務機構、醫療專業團體、高等院校、青年服務機構及學校的代表擔任主講嘉賓，向出席的失智症友善大聯盟成員分享相關的失智症服務經驗及相關的研究成果，促進失智症友善大聯盟成員間的交流及合作,失智症 友善 聯盟 交流 會籲 關注         【 本報 消息 】 社會 工作 局訊 ： 國際 失智症 協會 把 每年 九月 訂為 “ 世界 失智症 月 ” ， 本年 主題 為 “ 全民 正視 失智症 ” ， 呼籲 全社 會 一起 行動 ， 讓 大眾 對 失智症 有 正確 認識 和 關注 。         為 了 配合 本年 的 主題 ， 社會 工作 局 、 衛生局 和 澳門 失智症 協會 於 九月 二十日 及 二十一日 在 市政 署 青洲 坊 活動 中心 禮堂 合辦 “ 二 ○ 二 四年 澳門 特區 失智症 友善 大聯盟 交流 會 ” ， 邀請長 者 服務 機構 、 醫療 專業 團體 、 高等院校 、 青年 服務 機構 及 學校 的 代表 擔任 主講 嘉賓 ， 向 出席 的 失智症 友善 大聯盟 成員 分享 相關 的 失智症 服務 經驗 及 相關 的 研究成果 ， 促進 失智症 友善 大聯盟 成員間 的 交流 及 合作 。 兩場 交流 會 合共 近 二百名 代表 參與 。         社會 工作 局 、 衛生局 和 澳門 失智症 協會 在 二 ○ 一 七年 推出 “ 澳門 特區 失智症 友善 社區 約 章 ” 計劃 ， 以鼓勵 大眾關 心身 邊的 失智症 患者 及 支持 其 家人 和 照顧者 ， 減低 對 失智症 的 負面標 籤 ， 至今已有 一百九十 五個 團體 加入 成為 失智症 友善 社區 大聯盟 的 成員 。 更多 有關 失智症 的 相關 資訊 ， 可 瀏覽 澳門 特區長 者 服務 資訊網 ( www . ageing . ias . gov . mo ) 。,2024-10-04
今多雲空氣不良,今多雲空氣不良    【本報消息】氣象局預測今日空氣不良，天氣乾燥，天晴，部分時間多雲，吹四至五級偏北風及有陣風，氣溫攝氏二十一至二十九度，相對濕度百分之四十至七十。    路邊、高密度住宅區、一般性空氣質量水平不良，沿海地區吹四至五級偏北風及有陣風，視野良好至非常良好。    預測明日天氣乾燥，大致天晴，吹三至四級偏北風，氣溫攝氏二十二至三十度，相對濕度為百分之四十五至八十。    昨日大致天晴，氣溫攝氏二十二至二十八度，相對濕度百分之四十七至六十一，錄得最高紫外線指數八點七，平均為四點八，強度屬於中等。,http://www.macaodaily.com/html/2024-10/04/content_1785420.htm,今多雲空氣不良    【本報消息】氣象局預測今日空氣不良，天氣乾燥，天晴，部分時間多雲，吹四至五級偏北風及有陣風，氣溫攝氏二十一至二十九度，相對濕度百分之四十至七十,今多雲空氣 不良         【 本報 消息 】 氣象局 預測 今日 空氣 不良 ， 天氣 乾燥 ， 天晴 ， 部分 時間 多 雲 ， 吹 四至 五級 偏北 風及 有 陣風 ， 氣溫 攝氏 二十一 至 二十九 度 ， 相對 濕度 百分之四十 至 七十 。         路邊 、 高密度 住宅 區 、 一般性 空氣 質量 水平 不良 ， 沿海 地區 吹 四至 五級 偏北 風及 有 陣風 ， 視野 良好 至 非常 良好 。         預測 明日 天氣 乾燥 ， 大致 天晴 ， 吹三至 四級 偏北 風 ， 氣溫 攝氏 二十二 至 三十度 ， 相對 濕度 為 百分之四十 五至 八十 。         昨日 大致 天晴 ， 氣溫 攝氏 二十二 至 二十八 度 ， 相對 濕度 百分之四十 七至 六十一 ， 錄得 最高 紫外 線 指數 八點 七 ， 平均 為 四點 八 ， 強度屬 於 中等 。,2024-10-04
四男涉住宅爆格兩落網,四男涉住宅爆格兩落網    事前曾“踩點”十唐樓    【本報消息】四名內地男子上月來澳“踩點”十幢唐樓，並成功爆竊北區一高層單位，住戶報稱損失三萬二千多元現金。四人得手後逃回內地，其中兩人於國慶節當日再入境本澳被司警拘捕，均拒絕交代案情。    被捕兩名內地男子分別姓張，三十五歲，報稱酒廠負責人；姓任，三十六歲，無業。涉加重盜竊移送檢察院處理。    上月二十一日早上十時許，治安警接報北區某高層單位遇竊，經了解後通知司警跟進。司警到場調查，本地女事主報稱，上月十九日下午六時離開單位，至翌日凌晨二時許，家人回家發現單位鐵閘鎖鬆動但仍可用故不以為然。至報案當日早上八時許，女事主檢查發現房間衣櫃內的現金被竊，才醒覺可能與此前門鎖鬆動有關，報稱折合損失三萬二千澳門元。    經司警調查發現，包括被捕兩疑人在內的四名男子，上月十九日，一人在大廈外懷疑負責把風，另外三人則尾隨住客進入案發北區大廈，並巡視不同樓層，鎖定案發單位後，以硬物撬毀門鎖入內盜竊，得手後四人隨即逃回內地。司警並發現，涉案四人留澳期間，曾分別到下環、司打口、新馬路十幢唐樓踩點，司警派員訪查後住戶均表示未有遇竊。    至國慶節當晚，涉案兩人經港珠澳大橋口岸入境被截，帶返司警局調查，兩人均拒絕交代案情。司警將追查其餘涉案人士下落及贓款去向。,http://www.macaodaily.com/html/2024-10/04/content_1785421.htm,經司警調查發現，包括被捕兩疑人在內的四名男子，上月十九日，一人在大廈外懷疑負責把風，另外三人則尾隨住客進入案發北區大廈，並巡視不同樓層，鎖定案發單位後，以硬物撬毀門鎖入內盜竊，得手後四人隨即逃回內地,四男 涉 住宅 爆格 兩落網         事前 曾 “ 踩點 ” 十唐樓         【 本報 消息 】 四名 內地 男子 上 月 來 澳 “ 踩點 ” 十幢 唐樓 ， 並 成功 爆竊北區 一高層 單位 ， 住戶 報稱 損失 三萬 二千 多元 現金 。 四人 得手 後 逃回 內地 ， 其中 兩人 於 國慶節 當日 再 入境 本澳 被 司警 拘捕 ， 均 拒絕 交代 案情 。         被捕 兩名 內 地 男子 分別 姓 張 ， 三十五 歲 ， 報稱 酒廠 負責人 ； 姓任 ， 三十六 歲 ， 無業 。 涉 加重 盜竊 移送 檢 察院 處理 。         上 月 二十一日 早上 十時許 ， 治安警 接報 北區 某高層 單位 遇竊 ， 經 了解 後 通知 司警 跟 進 。 司警 到場 調查 ， 本地 女事主 報稱 ， 上 月 十九日 下午 六時 離開 單位 ， 至 翌日 凌晨 二時許 ， 家人 回家 發現 單位 鐵閘 鎖 鬆 動 但 仍 可用 故不以 為然 。 至 報案 當日 早上 八時許 ， 女事主 檢查 發現 房間 衣櫃 內 的 現金 被 竊 ， 才 醒覺 可能 與 此前 門 鎖 鬆 動 有 關 ， 報稱 折合 損失 三萬 二千 澳門元 。         經司警 調查 發現 ， 包括 被捕 兩疑 人 在 內 的 四名 男子 ， 上 月 十九日 ， 一人 在 大廈 外懷疑 負責 把 風 ， 另外 三人則 尾 隨 住客 進入案 發北區 大廈 ， 並巡視 不同 樓層 ， 鎖 定案 發單位 後 ， 以 硬物 撬毀 門鎖入 內盜 竊 ， 得手 後 四人 隨即 逃回 內地 。 司警 並發現 ， 涉案 四人留 澳期間 ， 曾 分別 到 下環 、 司打口 、 新馬路 十幢 唐樓 踩點 ， 司警 派員訪 查後住 戶 均 表示 未有 遇竊 。         至國慶節 當晚 ， 涉案 兩人 經港珠 澳大橋 口岸 入境 被 截 ， 帶 返司 警局 調查 ， 兩 人均 拒絕 交代 案情 。 司警將 追查 其餘 涉案 人士 下落 及贓款 去向 。,2024-10-04
