Title,Content,Link,Summary,Preprocessed_Content,Date
粵澳工商聯粵北考察收穫豐,昨上午訪遠光投資集團    粵澳工商聯粵北考察收穫豐    【本報消息】由粵澳工商聯會組織的“粵北經濟商務考察團”昨日結束韶關、清遠的三日考察行程，一行上午先後到訪遠光投資集團、清遠城市客廳參觀，期間與清遠市工商聯（總商會）舉行座談會，下午返回澳門。    上午九時許，考察團到訪遠光投資集團，了解該集團的基本情況及產品。遠光投資集團擁有製造、地產、旅遊、投資、金融、公益等產業，形成多領域品牌共同締造的發展格局。    清遠市委統戰部副部長何其標，清遠市委統戰部港澳台聯絡科科長梁志堅，廣東省總商會副會長、清遠市工商聯主席、市總商會會長、廣東遠光投資集團董事長蔡仲光，清遠市工商聯黨組成員、專職副主席、秘書長陳確等出席座談會。何其標、蔡仲光歡迎考察團到訪並表示，希望清遠與澳門形成合力、協同發展，相信清遠與澳門攜手必能匯聚磅礴力量，祝願此次考察活動圓滿順利，合作成果豐碩。    搭建內聯外拓橋樑    考察團副團長、粵澳工商聯會理事長黃仁民致辭表示，清遠的產業與澳門存在很多發展合作空間。該會宗旨是團結愛國愛澳力量，維護粵澳工商權益，搭建內聯外拓平台，助力國家偉大復興，商會成立以來一直立足大灣區，搭建內聯外拓的橋樑。希望通過是次考察活動與清遠市工商聯交流，加強交流合作。會上，考察團顧問、深合區經濟發展局投資促進處招商主任關少偉首先介紹粵澳深度合作區基本情況，重點講解稅務政策、國際化窗口、多功能自由貿易賬戶，以及網絡優勢。    澳清遠可優勢互補    在交流環節，考察團執行長、粵澳工商聯會科技創新委員會主任蔡淵博介紹科技創新領域的情況時稱，澳門一直在推進科技賦能澳門經濟適度多元發展，清遠在大數據算力、地理資源等方面有優勢，認為可與澳門科技創新、文化成果相結合，優勢互補，形成互利共贏的局面。    考察團統籌、粵澳工商聯會副理事長蔡健華則簡單介紹大健康項目的政策及基本情況，並指出在國家、橫琴粵澳深度合作區的政策支持下，內地與澳門雙向產品、雙向合作方面，取得一定的成果。    此外，座談會上，黃仁民與蔡仲光分別代表粵澳工商聯會與清遠市總商會簽訂合作框架協議，並互贈紀念品。    深化澳韶經濟合作    會後，清遠市政協主席姚楚旋與考察團顧問、澳門中聯辦協調部副處長辜智欽，黃仁民，關少偉，考察團副執行長、粵澳工商聯會副監事長胡丹等會晤，姚楚旋向粵澳工商聯會贈送紀念品。    黃仁民表示，是次考察活動組織三十多名業界代表到韶關，旨在通過實地考察調研，深入了解韶關市及粵北地區的經濟環境和發展潛力。今年是中華人民共和國成立七十五周年，澳門回歸祖國廿五周年，也是實現“十四五”規劃目標任務的關鍵之年。該會誠摯邀請韶關市領導和企業家走進澳門，通過增進了解，深化兩地經濟合作，共同開創兩地經濟合作的新篇章。    團員紛紛表示，是次行程收穫滿滿，通過考察活動到訪韶關、清遠，了解到當地經濟發展狀況、旅遊文化，如韶關礦產資源豐富、清遠與澳門在大健康產業上的合作空間，返澳後會多宣傳推廣，深化澳門與粵北的合作。,http://www.macaodaily.com/html/2024-11/29/content_1797418.htm,昨上午訪遠光投資集團    粵澳工商聯粵北考察收穫豐    【本報消息】由粵澳工商聯會組織的“粵北經濟商務考察團”昨日結束韶關、清遠的三日考察行程，一行上午先後到訪遠光投資集團、清遠城市客廳參觀，期間與清遠市工商聯（總商會）舉行座談會，下午返回澳門,昨 上午 訪遠光 投資 集團         粵澳 工商 聯粵北 考察 收 穫 豐         【 本報 消息 】 由粵澳 工商 聯會 組織 的 “ 粵北 經濟 商務 考察 團 ” 昨日 結束 韶關 、 清遠 的 三日 考察 行程 ， 一行 上午 先後到 訪遠光 投資 集團 、 清遠 城市 客廳 參觀 ， 期間 與 清遠市 工商 聯 （ 總商會 ） 舉行 座 談會 ， 下午 返回 澳門 。         上午 九時許 ， 考察 團到 訪遠光 投資 集團 ， 了解 該 集團 的 基本 情況 及產品 。 遠光 投資 集團 擁 有 製 造 、 地產 、 旅遊 、 投資 、 金融 、 公益 等 產業 ， 形成 多 領域 品牌 共同 締造 的 發展 格局 。         清遠 市委 統戰 部副 部長 何其 標 ， 清遠 市委 統戰部 港澳台 聯絡 科科長 梁志堅 ， 廣東省 總商會 副 會長 、 清遠市 工商 聯 主席 、 市 總商會 會長 、 廣東 遠光 投資 集團 董事 長 蔡仲光 ， 清遠市 工商 聯黨 組成員 、 專職 副 主席 、 秘書長 陳 確等 出席 座 談會 。 何其 標 、 蔡仲光 歡迎 考察 團到 訪並 表示 ， 希望 清遠 與 澳門 形成 合力 、 協同 發展 ， 相信 清遠 與 澳門 攜手 必能 匯聚 磅礴 力量 ， 祝願 此次 考察 活動 圓滿 順利 ， 合作 成果 豐碩 。         搭建 內聯外 拓橋 樑         考察 團副團長 、 粵澳 工商 聯會 理事 長 黃 仁民致 辭 表示 ， 清遠 的 產業 與 澳門 存在 很多 發展 合作 空間 。 該會 宗旨 是 團結 愛國 愛澳 力量 ， 維護粵澳 工商 權益 ， 搭建 內聯 外拓 平台 ， 助力 國家偉大 復 興 ， 商會 成立 以來 一直 立足 大灣區 ， 搭建 內聯外 拓的橋 樑 。 希望 通過 是 次 考察 活動 與 清遠市 工商 聯 交流 ， 加強 交流 合作 。 會上 ， 考察 團顧問 、 深合區 經濟 發展局 投資促 進處 招商 主任 關少偉 首先 介紹粵澳 深度 合作 區 基本 情況 ， 重點 講解 稅務 政策 、 國際化 窗口 、 多功能 自由 貿易 賬戶 ， 以及 網絡 優勢 。         澳清遠 可 優勢 互補         在 交流 環節 ， 考察 團執 行長 、 粵澳 工商 聯會 科技 創新委員會 主任 蔡淵 博介紹 科技 創新 領域 的 情況 時稱 ， 澳門 一直 在 推進 科技 賦能 澳門 經濟 適度 多元 發展 ， 清遠 在 大數 據算力 、 地理 資源 等 方面 有 優勢 ， 認為 可 與 澳門 科技 創新 、 文化 成果 相結合 ， 優勢 互補 ， 形成 互利 共贏 的 局面 。         考察 團統 籌 、 粵澳 工商 聯會 副 理事 長 蔡健華則 簡單 介紹 大 健康 項 目的 政策 及 基本 情況 ， 並 指出 在 國家 、 橫琴粵澳 深度 合作 區的 政策 支持 下 ， 內地 與 澳門 雙向 產品 、 雙向 合作 方面 ， 取得 一定 的 成果 。         此外 ， 座 談會 上 ， 黃 仁民 與 蔡仲光 分別 代表 粵澳 工商 聯會 與 清遠市 總商會 簽訂 合作 框架 協議 ， 並互 贈紀念品 。         深化 澳韶經濟 合作         會 後 ， 清遠 市政 協 主席 姚楚旋 與 考察 團顧問 、 澳門 中聯辦 協調 部副 處長 辜智欽 ， 黃 仁民 ， 關少偉 ， 考察 團副 執行長 、 粵澳 工商 聯會 副 監事長 胡丹 等 會晤 ， 姚楚 旋向粵澳 工商 聯會 贈 送 紀念品 。         黃 仁民 表示 ， 是 次 考察 活動 組織 三十多名 業界 代表 到韶關 ， 旨在 通過 實地 考察 調研 ， 深入 了解 韶關市 及粵北 地區 的 經濟 環境 和 發展 潛力 。 今年 是 中華 人民 共和 國 成立 七十五 周年 ， 澳門 回歸祖國 廿五 周年 ， 也 是 實現 “ 十四五 ” 規劃 目標 任務 的 關鍵 之 年 。 該會 誠摯 邀請 韶關市 領導 和 企業家 走 進澳門 ， 通過 增進 了解 ， 深化 兩地 經濟 合作 ， 共同 開創 兩地 經濟 合作 的 新篇章 。         團員 紛紛 表示 ， 是 次 行程 收 穫 滿滿 ， 通過 考察 活動 到 訪韶關 、 清遠 ， 了解 到 當地 經濟 發展 狀況 、 旅遊 文化 ， 如韶關 礦產資源 豐富 、 清遠 與 澳門 在 大 健康 產業 上 的 合作 空間 ， 返澳後會 多 宣傳 推廣 ， 深化 澳門 與 粵北 的 合作 。,2024-11-29
澳門有條“白粉村”?,澳門有條“白粉村”?    澳門禁毒政策嚴厲，但昔日曾有“名正言順”的“白粉村”。由於鴉片戰爭後，澳門賭業、娼妓和鴉片經營合法化，荼毒無數人。一九六○年代，澳葡海島市警察已隨街捉捕吸毒者，送往氹仔舊機場附近木棚屋，強制接受戒毒治療。    由於地方偏僻，無法逃離，戒毒者在所內得三餐溫飽，也參與勞動，醫護人員定期提供醫療服務，戒毒效果非常好。後來戒毒所改稱“復原所”，減少對戒毒者的歧視。    一九六二年，澳葡政府計劃擴建氹仔社會復原所，將戒毒成功的復原人士，從氹仔送往路環的臨時社會復原所，為讓這批復原人士安居，澳葡政府與團體合作，在路環興建新的復原所；路環石排灣“復原新村”遂於一九六五年四月十四日揭幕使用，給予復原人士及其家人居住和謀生。    中文街名甚費解    當時的“復原新村”約就是今日路環高頂公共衛生臨床中心的位置，“復原新村”的葡文名字解作“希望之村”，但令人費解的是該村的官方中文街名卻譯作“白粉村”，這個街名最終在二○一七年被撤銷，自此“查無此村”。    欲知更多詳情，立即掃碼欣賞。,http://www.macaodaily.com/html/2024-11/29/content_1797419.htm,中文街名甚費解    當時的“復原新村”約就是今日路環高頂公共衛生臨床中心的位置，“復原新村”的葡文名字解作“希望之村”，但令人費解的是該村的官方中文街名卻譯作“白粉村”，這個街名最終在二○一七年被撤銷，自此“查無此村”,澳門 有條 “ 白粉 村 ” ?         澳門 禁毒 政策 嚴厲 ， 但 昔日 曾 有 “ 名正言順 ” 的 “ 白粉 村 ” 。 由 於 鴉片 戰爭 後 ， 澳門 賭業 、 娼妓 和 鴉片 經營 合法化 ， 荼毒 無數 人 。 一九六 ○ 年代 ， 澳葡海島 市 警察 已 隨街 捉捕 吸毒者 ， 送往 氹 仔舊 機場 附近 木 棚屋 ， 強制 接受 戒毒 治療 。         由 於 地方 偏僻 ， 無法 逃離 ， 戒毒者 在 所 內 得 三餐 溫飽 ， 也 參 與 勞動 ， 醫護 人員 定期 提供 醫療 服務 ， 戒毒 效果 非常 好 。 後 來 戒毒所 改稱 “ 復 原所 ” ， 減少 對 戒毒者 的 歧視 。         一九六二年 ， 澳 葡 政府 計劃 擴建 氹 仔社會 復 原所 ， 將 戒毒 成功 的 復 原 人士 ， 從 氹 仔 送往 路環 的 臨時 社會 復 原所 ， 為 讓 這批 復 原 人士 安居 ， 澳 葡 政府 與 團體 合作 ， 在 路 環興 建新 的 復 原所 ； 路 環石 排灣 “ 復 原 新村 ” 遂 於 一九六五年 四月 十四日 揭幕 使用 ， 給予 復 原 人士 及其 家人 居住 和 謀生 。         中文 街名 甚費解         當時 的 “ 復 原 新村 ” 約 就是 今日 路 環高頂 公共 衛生 臨床 中心 的 位置 ， “ 復 原 新村 ” 的 葡文 名字 解作 “ 希望 之村 ” ， 但 令人 費解 的 是 該 村 的 官方 中文 街名 卻 譯作 “ 白粉 村 ” ， 這個 街名 最終 在 二 ○ 一 七年 被 撤銷 ， 自此 “ 查無此 村 ” 。         欲知 更 多 詳情 ， 立即 掃碼 欣賞 。,2024-11-29
澳音樂家赴京分享回歸感受,澳音樂家赴京分享回歸感受    【本報駐北京記者王維電】廿七日下午，應中央音樂學院邀請，澳門音樂家周游做客該院第四十五期知心講座，以自己的親身經歷，為母校師生深情講述了澳門回歸廿五年來，音樂事業與祖國共同繁榮發展的故事，引發在場師生的強烈共鳴，贏得熱烈掌聲。    周游以“情繫京澳”主題，首先介紹自己在中央音樂學院和澳門的學習與工作經歷，並分享澳門回歸祖國後，音樂事業發生的顯著變化。本月廿五至廿八日，周游再次踏上內地，於北京中央音樂學院、中國音樂學院和天津音樂學院開展大師班教學及學術交流活動。    周游指出，澳門的音樂教育經歷從教會唱詩班和民間社團，到全日制正規教育的轉變。不僅形成獨特的音樂生態，在國際上獲得廣泛認可。擁有全日制中學、大學本科、碩士及博士音樂課程，培養熱愛音樂的年輕人。回歸後，澳門音樂表演事業也迅速發展，出現具有較高藝術水平和影響力的職業樂團，如“澳門樂團”和“澳門中樂團”，以及社團所辦的樂團等，為青少年提供更多展示自我風采的平台。    在互動問答環節中，面對充滿朝氣的學生群體，周游耐心傾聽並給予指導，包括報考澳門樂團和澳門中樂團等問題。他還分享自己在融入澳門社會的心得體會，讓有意前往澳門發展的同學們受益匪淺。周游希望能夠加強北京和澳門在音樂領域的合作與交流，認為這不僅有助提升兩地音樂人才的培養質量，推動兩地音樂事業取得新的發展。,http://www.macaodaily.com/html/2024-11/29/content_1797420.htm,澳音樂家赴京分享回歸感受    【本報駐北京記者王維電】廿七日下午，應中央音樂學院邀請，澳門音樂家周游做客該院第四十五期知心講座，以自己的親身經歷，為母校師生深情講述了澳門回歸廿五年來，音樂事業與祖國共同繁榮發展的故事，引發在場師生的強烈共鳴，贏得熱烈掌聲,澳音樂家 赴京 分享 回歸 感受         【 本報 駐 北京 記者 王維電 】 廿七日 下午 ， 應 中央 音樂學院 邀請 ， 澳門 音樂家 周游 做客 該院 第四十五 期 知心 講座 ， 以 自己 的 親身 經歷 ， 為 母校 師生 深情 講述 了 澳門 回歸 廿五年 來 ， 音樂事業 與 祖國 共同 繁榮 發展 的 故事 ， 引發 在 場師生 的 強烈 共鳴 ， 贏得 熱烈 掌聲 。         周游 以 “ 情 繫 京 澳 ” 主題 ， 首先 介紹 自己 在 中央 音樂學院 和 澳門 的 學習 與 工作 經歷 ， 並 分享 澳門 回歸祖國 後 ， 音樂事業 發生 的 顯著 變化 。 本月 廿五 至 廿八日 ， 周游 再次 踏上 內地 ， 於 北京 中央 音樂學院 、 中國 音樂學院 和 天津 音樂學院 開展 大師班 教學及 學術 交流 活動 。         周游 指出 ， 澳門 的 音樂 教育 經歷 從 教會 唱 詩班和民間 社團 ， 到 全日制 正規 教育 的 轉變 。 不僅 形成 獨特 的 音樂 生態 ， 在 國際上 獲得 廣泛 認可 。 擁有 全日制 中學 、 大學 本科 、 碩士 及 博士 音樂 課程 ， 培養 熱愛音樂 的 年 輕人 。 回歸 後 ， 澳門 音樂 表演 事業 也 迅速 發展 ， 出現 具有 較 高藝術 水平 和 影響力 的 職業樂團 ， 如 “ 澳門樂團 ” 和 “ 澳門 中樂團 ” ， 以及 社團 所辦 的 樂團 等 ， 為 青少年 提供 更 多 展示 自我 風采 的 平台 。         在 互動 問答 環節 中 ， 面對 充滿 朝氣 的 學生 群體 ， 周游 耐心 傾聽 並給予 指導 ， 包括 報考 澳門樂團 和 澳門 中樂團 等 問題 。 他還 分享 自己 在 融入 澳門 社會 的 心得 體會 ， 讓 有意 前往 澳門 發展 的 同學們 受益 匪 淺 。 周游 希望 能夠 加強 北京 和 澳門 在 音樂 領域 的 合作 與 交流 ， 認為 這不僅 有助 提升 兩地 音樂 人才 的 培養 質量 ， 推動 兩地 音樂事業 取得 新 的 發展 。,2024-11-29
同善堂中學百年校慶續寫輝煌,凝聚各界育中醫藥科研人才    同善堂中學百年校慶續寫輝煌    【本報消息】慶祝同善堂免費教育服務一百周年聯歡晚宴昨晚七時假萬豪軒酒家舉行，行政長官賀一誠等各界嘉賓到賀。    同善堂中學校董會主席劉藝良表示，將繼續凝聚社會各界力量，攜手共促發展，務實求是，推動教育、科技和人才建設，關愛師生，為社會培育中醫藥及科研人才貢獻力量。    賀一誠，第三及第四任行政長官、同善堂永遠榮譽主席崔世安，立法會主席高開賢，社會文化司司長辦公室主任何鈺珊、中聯辦教育與青年工作部副部長李勇先，外交部駐澳特派員公署新聞和公共外交部主任高原，教育及青年發展局長龔志明，同善堂會員大會主席崔世昌、值理會主席崔世平、值理會副主席胡順謙及鄭秀明、值理兼校監莫志偉、李俊鳴主禮，多名嘉賓、值理、校友和師生等出席。    劉藝良致詞表示，百年來，學校堅持慈善辦學，積極推動中華優秀傳統文化融入校園，在教育服務不斷優化發展，積極執行及推動教青局的教育制度和指引，秉持“德、勤、誠、樸”的校訓，在教學上讓學生有系統認識中華文化、國家政治體制、法律、經濟、科技、歷史和文化等發展，增強學生民族意識，提高愛國情懷。近年來，該校學生奮發向上，連續七年升大率達百分之百，且連續七年有許多優秀的學生獲內地重點院校錄取。未來，將繼續凝聚社會各界力量，為澳門教育事業書寫輝煌篇章。同善堂中學校長黃德進致詞稱，走過光輝百年，將攜手邁向新征程。不忘初心，把握教育發展時代的脈搏，繼續努力為澳門社會培養有知識、有視野、有作為的優秀愛國、愛澳人才，為澳門社會發展出一分力。會上，向多名教職人員頒發長年服務獎。席間安排精彩舞蹈、歌唱等演出，場面熱鬧。,http://www.macaodaily.com/html/2024-11/29/content_1797421.htm,賀一誠，第三及第四任行政長官、同善堂永遠榮譽主席崔世安，立法會主席高開賢，社會文化司司長辦公室主任何鈺珊、中聯辦教育與青年工作部副部長李勇先，外交部駐澳特派員公署新聞和公共外交部主任高原，教育及青年發展局長龔志明，同善堂會員大會主席崔世昌、值理會主席崔世平、值理會副主席胡順謙及鄭秀明、值理兼校監莫志偉、李俊鳴主禮，多名嘉賓、值理、校友和師生等出席,凝聚 各界 育中 醫藥 科研 人才         同 善堂 中學 百年 校慶續 寫輝煌         【 本報 消息 】 慶祝同 善堂 免費 教育 服務 一百周年 聯歡 晚宴 昨晚 七時 假萬豪軒 酒家 舉行 ， 行政 長 官賀 一誠等 各界 嘉賓 到賀 。         同 善堂 中學 校董 會 主席 劉藝良 表示 ， 將繼續 凝聚 社會 各界 力量 ， 攜手 共促 發展 ， 務實求 是 ， 推動 教育 、 科技 和 人才 建設 ， 關愛師生 ， 為 社會 培育 中醫藥 及 科研 人才 貢獻 力量 。         賀一 誠 ， 第三 及 第四任 行政 長 官 、 同 善堂 永遠 榮譽 主席 崔世安 ， 立法 會 主席 高開賢 ， 社會 文化 司司 長 辦公 室主任 何鈺珊 、 中聯辦 教育 與 青年 工作 部副 部長 李勇 先 ， 外交部 駐澳 特派 員 公署 新聞 和 公共 外交部 主任 高原 ， 教育 及 青年 發展 局長 龔志明 ， 同 善堂 會員大會 主席 崔世昌 、 值理會 主席 崔世平 、 值理會 副 主席 胡順謙及 鄭秀明 、 值理 兼校 監莫志偉 、 李俊 鳴主禮 ， 多名 嘉賓 、 值理 、 校友 和 師生 等 出席 。         劉藝良致 詞 表示 ， 百年 來 ， 學校 堅持 慈善 辦學 ， 積極 推動 中華 優秀 傳統 文化 融入 校園 ， 在 教育 服務不斷 優化 發展 ， 積極 執行 及 推動 教青局 的 教育 制度 和 指引 ， 秉持 “ 德 、 勤 、 誠 、 樸 ” 的 校訓 ， 在 教學 上 讓 學生 有 系統 認識 中華 文化 、 國家 政治 體制 、 法律 、 經濟 、 科技 、 歷史 和 文化 等 發展 ， 增強 學生 民族 意識 ， 提高 愛國 情懷 。 近年 來 ， 該校 學生 奮發 向上 ， 連續 七年 升大率 達 百分之百 ， 且 連續 七年 有 許多 優秀 的 學生 獲內 地 重點 院校 錄取 。 未來 ， 將繼續 凝聚 社會 各界 力量 ， 為 澳門 教育 事業書 寫輝煌 篇章 。 同 善堂 中學校 長 黃 德 進致 詞稱 ， 走過 光輝 百年 ， 將攜手 邁向 新 征程 。 不忘 初心 ， 把握 教育 發展 時代 的 脈 搏 ， 繼續 努力 為 澳門 社會 培養 有 知識 、 有視野 、 有作 為 的 優秀愛國 、 愛澳 人才 ， 為 澳門 社會發 展出 一分 力 。 會上 ， 向 多 名教 職人員 頒 發長 年 服務獎 。 席間 安排 精彩 舞蹈 、 歌唱 等 演出 ， 場面 熱鬧 。,2024-11-29
教業教育協進會誕新閣,教業教育協進會誕新閣    【本報消息】教業中學教育協進會日前假聯邦酒樓召開二○二四年會員大會。會議由副會長梁勵擔任大會主席，議程包括理事長何敬麟作會務報告，理事何雅雪作財務報告及選舉新一屆行政成員等。    何敬麟指出，明年為教業中學合校五十周年暨孔教中學一百一十周年、銀業小學七十六周年的大日子，理事會將支持學校開展一系列的“校慶活動”，籌備工作即將開始，希望得到社會各界支持。    隨後，該會舉行新一屆行政人員選舉，會員大會會長尹君樂，副會長馮志強、胡順謙、崔世平、葉啟明、何浩生，秘書梁偉權；理事會理事長何敬麟，副理事長梁勵、葉兆佳、賀誠、姚汝祥、黃穗文，秘書尹一橋，理事陸永根、莫志偉、江陽、鄭冠偉、張榮顯、何雅雪、鄭榮光、李居仁、李永傑、黃懿蓮、葉繼青、黎韻；監事會監事長葉紹文，副監事長林品莊、林淑源，監事蕭彼德、尹一龍。,http://www.macaodaily.com/html/2024-11/29/content_1797422.htm,會議由副會長梁勵擔任大會主席，議程包括理事長何敬麟作會務報告，理事何雅雪作財務報告及選舉新一屆行政成員等,教業 教育 協進會 誕新閣         【 本報 消息 】 教業 中學 教育 協進會 日前 假聯邦 酒樓 召開 二 ○ 二 四年 會員大會 。 會議 由 副 會長 梁勵 擔任 大會 主席 ， 議程 包括 理事 長 何敬麟 作會務 報告 ， 理事 何雅雪作 財務報 告及 選舉 新 一屆 行政 成員 等 。         何敬麟 指出 ， 明年 為 教業 中學 合校 五十周年 暨 孔教 中學 一百一十 周年 、 銀業 小學 七十六 周年 的 大 日子 ， 理事 會將 支持 學校 開展 一系列 的 “ 校慶 活動 ” ， 籌備 工作 即將 開始 ， 希望 得到 社會 各界 支持 。         隨後 ， 該會 舉行 新 一屆 行政 人員 選舉 ， 會員大會 會長 尹君樂 ， 副會長 馮志強 、 胡順謙 、 崔世平 、 葉 啟明 、 何浩生 ， 秘書 梁偉權 ； 理事 會 理事 長 何敬麟 ， 副 理事 長 梁勵 、 葉兆佳 、 賀誠 、 姚汝祥 、 黃 穗文 ， 秘書 尹一橋 ， 理事 陸永根 、 莫志偉 、 江陽 、 鄭冠偉 、 張榮顯 、 何雅雪 、 鄭榮光 、 李居仁 、 李永傑 、 黃 懿 蓮 、 葉繼青 、 黎韻 ； 監事會 監事長 葉紹文 ， 副 監事長 林品 莊 、 林淑源 ， 監事 蕭彼德 、 尹一龍 。,2024-11-29
