Title,Content,Link,Summary,Preprocessed_Content,Date
澳客屬社團福建研習收穫豐,澳客屬社團福建研習收穫豐    【本報記者古楨輝漳州二十二日電】由澳門客屬社團聯合總會組織的“社團領袖赴閩紅色之旅研習團”，今日結束為期五日的福建之旅返澳。研習團團長、總會主席江金桐表示，本次旅程不僅參與多項客屬尋根謁祖的大型活動，也學習了福建的紅色革命歷史，更拓展了總會與福建官民合作的渠道，收穫豐富。    江金桐總結指出，本次研習團成員涵蓋了客總各屬會負責人，代表性較廣泛，旅程的收穫主要包括三大方面，一是通過參加大型活動，共同緬懷先輩的艱辛與奮鬥，深刻地理解客家人堅韌不拔、勤勞勇敢的精神品質，有助更好以客家文化為紐帶，凝聚澳門鄉親力量。    二是前往古田會議會址和紀念館參觀學習，通過豐富的歷史資料和珍貴的文物展品，深入了解古田會議的歷史背景、會議內容及會議精神，深化澳門鄉親的愛國愛澳情懷。    三是拜訪了福建省統戰部和南平市、龍巖市、漳州市和三明市寧化縣相關領導，雙方就加強閩澳交流合作、推動經濟社會發展等議題深入探討，有助開拓常態化交流合作渠道，加強與福建在經貿、文化、旅遊等領域的合作，推動兩地繁榮發展。    參觀文遺土樓王子    上午，研習團前往龍巖市永定區，參觀了有“土樓王子”之稱的振成樓。土樓是福建最為知名的文化名片之一，被列為世界文化遺產。其中，振成樓俗稱“八卦樓”，始建於一九一二年，佔地面積約五千平方米，按《易經》八卦原理佈局。在導遊帶領下，澳門團員走進了這座神奇的土樓，不僅欣賞了建築之美，還了解土樓的建造經過、客家先民遷徙歷程及客家習俗等歷史。    下午，研習團從漳州乘車前往廈門，隨後乘坐航班返澳。,http://www.macaodaily.com/html/2024-10/23/content_1789421.htm,江金桐總結指出，本次研習團成員涵蓋了客總各屬會負責人，代表性較廣泛，旅程的收穫主要包括三大方面，一是通過參加大型活動，共同緬懷先輩的艱辛與奮鬥，深刻地理解客家人堅韌不拔、勤勞勇敢的精神品質，有助更好以客家文化為紐帶，凝聚澳門鄉親力量,澳客屬 社團 福建 研習 收 穫 豐         【 本報 記者 古楨輝 漳州 二十二日 電 】 由 澳門 客屬 社團 聯合 總會 組織 的 “ 社團 領袖 赴 閩紅色 之 旅研 習團 ” ， 今日 結束 為期 五日 的 福建 之 旅返 澳 。 研習 團團長 、 總會 主席 江金桐 表示 ， 本次 旅程 不僅 參與 多項 客屬 尋根 謁 祖 的 大型 活動 ， 也 學習 了 福建 的 紅色 革命 歷史 ， 更 拓展 了 總會 與 福建 官民 合作 的 渠道 ， 收 穫 豐富 。         江金桐 總結 指出 ， 本次 研習團 成員涵 蓋 了 客 總 各屬會 負責人 ， 代表性 較廣泛 ， 旅程 的 收 穫 主要 包括 三大 方面 ， 一是 通過 參加 大型 活動 ， 共同 緬懷 先輩 的 艱辛 與 奮鬥 ， 深刻 地 理解 客家人 堅韌 不拔 、 勤勞 勇敢 的 精神 品質 ， 有助 更好 以 客家 文化 為 紐帶 ， 凝聚 澳門 鄉親 力量 。         二是 前往 古田 會議 會址 和 紀念館 參觀 學習 ， 通過 豐富 的 歷史 資料 和 珍貴 的 文物 展品 ， 深入 了解 古田 會議 的 歷史 背景 、 會議 內容 及會議 精神 ， 深化 澳門 鄉親 的 愛國 愛澳 情懷 。         三是 拜訪 了 福建省 統戰部 和 南平市 、 龍 巖 市 、 漳州市 和 三明市 寧化縣 相關 領導 ， 雙方 就 加強 閩澳 交流 合作 、 推動 經濟 社會 發展 等 議題 深入 探討 ， 有助 開拓常 態化 交流 合作 渠道 ， 加強 與 福建 在 經貿 、 文化 、 旅遊 等 領域 的 合作 ， 推動 兩地 繁榮 發展 。         參觀文 遺土樓 王子         上午 ， 研習團 前往 龍 巖 市 永定 區 ， 參觀 了 有 “ 土樓 王子 ” 之稱 的 振成樓 。 土樓 是 福建 最為 知名 的 文化 名片 之一 ， 被 列為 世界 文化 遺產 。 其中 ， 振成樓 俗稱 “ 八卦 樓 ” ， 始建 於 一九一二年 ， 佔 地面 積約 五千 平方米 ， 按 《 易經 》 八卦 原理 佈 局 。 在 導遊帶 領下 ， 澳門 團員 走 進 了 這座 神奇 的 土樓 ， 不僅 欣賞 了 建築 之美 ， 還 了解 土樓 的 建造 經過 、 客家 先民 遷徙 歷程 及 客家 習俗 等 歷史 。         下午 ， 研習團 從 漳州 乘車 前往 廈門 ， 隨後 乘坐 航班 返澳 。,2024-10-23
京澳高校足球賽競技聯誼,京澳高校足球賽競技聯誼    【本報消息】由澳門區域公共管理研究學會主辦，澳門大學、澳門科技大學、北京大學和清華大學協辦的“第二屆京澳高校足球邀請賽”本月十八至廿一日在澳門舉行。活動由澳門中聯辦北京聯絡部、北京市人民政府港澳事務辦公室、澳門教青局擔任指導單位，北京國安足球俱樂部、橫琴深合投資有限公司、同程旅行和新東方置地酒店擔任支援單位。    在開球禮上，澳門區域公共管理研究學會理事長龐欣新表示，今年適逢雙慶，比賽在澳門舉行就更有意義，來自兩地的同學不僅在賽場上切磋球技，又可以加強交流，用精彩的比賽為雙慶獻禮。    北京大學體育教研部書記陳征微表示，北京的同學們能夠實地感受“一國兩制”的成功實踐，屬難得的機會。北京國安足球俱樂部體育戰略發展部總監魏克興希望繼續發揮專業領域的經驗，以青訓教練現場教學等多種形式，為各位同學提供職業級的指導。    出席開球禮的有澳門中聯辦宣文部副部長白冰、北京聯絡部處長司晨、澳門體育局體育社團輔助處代處長陳凱風、澳門教青局中心主任雷美甜、澳門區域公共管理研究學會會長朱偉幹及來自四所高校的運動員、教練、裁判等百餘人。    活動期間，北京大學、清華大學、澳門大學和澳門科技大學四所高校足球隊分別在澳門大學和澳門科技大學開展四場友誼賽。活動邀請北京國安足球俱樂部U17梯隊教練蕭依洋在橫琴為來自四所高校的同學現場培訓，同學們受益匪淺。,http://www.macaodaily.com/html/2024-10/23/content_1789422.htm,出席開球禮的有澳門中聯辦宣文部副部長白冰、北京聯絡部處長司晨、澳門體育局體育社團輔助處代處長陳凱風、澳門教青局中心主任雷美甜、澳門區域公共管理研究學會會長朱偉幹及來自四所高校的運動員、教練、裁判等百餘人,京澳 高校 足球 賽 競技 聯誼         【 本報 消息 】 由 澳門區域 公共 管理 研究 學會 主辦 ， 澳門 大學 、 澳門 科技 大學 、 北京 大學 和 清華大學 協辦 的 “ 第二 屆京澳 高校 足球 邀請賽 ” 本月 十八 至 廿一日 在 澳門 舉行 。 活動 由 澳門 中聯辦 北京 聯絡部 、 北京市人民政府 港澳 事務辦 公室 、 澳門 教青局 擔任 指導 單位 ， 北京 國安 足球 俱樂部 、 橫琴 深合 投資 有限公司 、 同程 旅行 和 新 東方置 地 酒店 擔任 支援 單位 。         在 開球 禮上 ， 澳門區域 公共 管理 研究 學會 理事 長 龐欣新 表示 ， 今年 適逢 雙慶 ， 比賽 在 澳門 舉行 就 更 有意 義 ， 來 自 兩地 的 同學 不僅 在 賽場 上 切磋 球技 ， 又 可以 加強 交流 ， 用 精彩 的 比賽 為 雙慶獻禮 。         北京 大學 體育 教研部 書記 陳 征微 表示 ， 北京 的 同學們 能夠 實地 感受 “ 一國 兩制 ” 的 成功 實踐 ， 屬難 得 的 機會 。 北京 國安 足球 俱樂部 體育 戰略 發展部 總監 魏克興 希望 繼續 發揮 專業 領域 的 經驗 ， 以青訓 教練 現場 教學 等 多種 形式 ， 為 各位 同學 提供 職業級 的 指導 。         出席 開球禮 的 有 澳門 中聯辦 宣文 部副 部長 白冰 、 北京 聯絡部 處長 司晨 、 澳門 體育局 體育 社團 輔助 處代處 長 陳 凱風 、 澳門 教青局 中心 主任 雷美甜 、 澳門區域 公共 管理 研究 學會會長 朱偉 幹及 來 自 四所 高校 的 運動員 、 教練 、 裁判 等 百餘人 。         活動 期間 ， 北京 大學 、 清華大學 、 澳門 大學 和 澳門 科技 大學 四所 高校 足球 隊分別 在 澳門 大學 和 澳門 科技 大學 開展 四場 友誼賽 。 活動 邀請 北京 國安 足球 俱樂部 U17 梯隊 教練 蕭依洋 在 橫琴 為 來 自 四所 高校 的 同學 現場 培訓 ， 同學們 受益 匪 淺 。,2024-10-23
十六浦周年紀念裝置亮燈,十六浦周年紀念裝置亮燈    【本報消息】澳門十六浦度假村成立十六周年以及索菲特酒店品牌六十周年“16×60”紀念裝置亮燈儀式，昨晚七時在十六浦戶外廣場舉行。澳娛綜合度假股份有限公司常務董事何超鳳表示，十六浦在內港為澳門歷史城區起引流作用，促進周邊中小企業的經濟活動。    何超鳳稱，在十六浦戶外廣場舉辦的各項活動，為旅客和居民帶來珍貴回憶，助力推動文化旅遊和社區旅遊發展。未來，十六浦沿岸將是澳娛綜合“新馬路片區活化計劃”的核心，將結合金碧坊及該區“    一河兩岸”的優勢，續寫內港輝煌篇章。    澳門十六浦副行政總裁馬浩文指出，多年來，十六浦一直致力於推廣本地藝術及文化活動，為鞏固澳門世界旅遊休閒中心貢獻一己之力，積極向大眾展示澳門的人文精神、獨特地標和文化。展望未來，將立足長遠發展，期待成就下一個精彩十六年。    另外，澳門十六浦與澳門攝影學會合辦“與澳門同行十六周年有獎徵相活動”，邀請參賽者捕捉澳門的精彩瞬間，展示澳門豐富的文化底蘊和充滿活力的精神特質，展示澳門不斷變化的多樣性，宣傳充滿活力的澳門。,http://www.macaodaily.com/html/2024-10/23/content_1789423.htm,澳門十六浦副行政總裁馬浩文指出，多年來，十六浦一直致力於推廣本地藝術及文化活動，為鞏固澳門世界旅遊休閒中心貢獻一己之力，積極向大眾展示澳門的人文精神、獨特地標和文化,十六 浦 周年 紀念 裝置 亮燈         【 本報 消息 】 澳門 十六 浦 度假村 成立 十六 周年 以及 索菲特 酒店 品牌 六十周年 “ 16 × 60 ” 紀念 裝置 亮燈 儀式 ， 昨晚 七時 在 十六 浦戶 外廣場 舉行 。 澳娛 綜合 度假 股份 有限公司 常務 董事 何超鳳 表示 ， 十六 浦在 內港 為 澳門 歷史 城區 起 引流 作用 ， 促進 周邊 中小 企業 的 經濟 活動 。         何超鳳稱 ， 在 十六 浦戶 外廣場 舉辦 的 各項 活動 ， 為 旅客 和 居民 帶來 珍貴 回憶 ， 助力 推動 文化 旅遊 和 社區 旅遊 發展 。 未來 ， 十六 浦 沿岸 將是 澳娛 綜合 “ 新馬路 片區 活化 計劃 ” 的 核心 ， 將結 合金 碧坊 及 該區 “         一河 兩岸 ” 的 優勢 ， 續寫 內港 輝煌 篇章 。         澳門 十六 浦 副 行政 總裁馬浩文 指出 ， 多年 來 ， 十六 浦 一直 致力 於 推廣 本地 藝術 及 文化 活動 ， 為 鞏固 澳門 世界 旅遊 休閒 中心 貢獻 一己 之力 ， 積極 向 大眾 展示 澳門 的 人文精神 、 獨 特地 標 和 文化 。 展望 未來 ， 將 立足 長 遠 發展 ， 期待 成就 下一個 精彩 十六年 。         另外 ， 澳門 十六 浦 與 澳門 攝 影學會 合辦 “ 與 澳門 同行 十六 周年 有獎 徵相 活動 ” ， 邀請 參賽者 捕捉 澳門 的 精彩 瞬間 ， 展示 澳門 豐富 的 文化 底蘊 和 充滿 活力 的 精神 特質 ， 展示 澳門 不斷 變化 的 多樣 性 ， 宣傳 充滿 活力 的 澳門 。,2024-10-23
粵澳北斗產業學院成立,粵澳北斗產業學院成立    冀促進北斗系統跨境及國際化應用    【本報消息】由澳門中西創新學院、廣東科技學院、廣東南粵集團有限公司、航空航天科技工作委員會共同發起組建的粵澳北斗產業學院（中心）昨舉行成立儀式，同場舉行澳門北斗導航應用協會成立暨北斗應用交流會，期望藉此促進北斗系統的跨境及國際化應用，加强粵澳兩地北斗領域合作，推進北斗走向世界。    活動昨日下午三時在中西創新學院研發基地舉行，中國工程院院士楊善林線上參與，中聯辦教育與青年工作部副部長石書正、中西創新學院校長仲偉合、教青局高教合作交流處長譚兆華、中聯辦教育與青年部四級調研員李詠樂、澳門科學技術發展基金技術員鄭浩志，南粵集團董事長趙春曉、副總經理喬梁，航空航天科技工作委員會秘書長荊宇虹等出席。    加速科技成果轉化    仲偉合致詞稱，期望透過搭建校企合作平台，促進學術界與產業界的緊密合作，加速科技成果向現實生產力轉化，推動北斗技術在智慧城市、智慧交通、精準農業、緊急管理等領域的廣泛應用，為粵港澳大灣區的經濟社會發展注入新的活力。    楊善林視頻致詞稱，期望通過系統性規劃與資源整合，構建產學研一體化人才培養模式，充分利用澳門作為內地和葡語系國家橋樑的獨特優勢，培養具國際視野、創新機制及實踐能力的高素質北斗產業人才，推動北斗衛星導航系統的國際化應用與發展。    喬梁致詞稱，期望透過與學院合作共同開展科研項目，推動產學研深度融合，培養出更多具有國際視野和專業技能的人才，積極推動北斗技術在澳門乃至葡語系國家的應用，深入探索北斗技術在智慧城市、通信系統、智能交通、公共安全等領域的應用和潛力，為澳門的可持續發展貢獻力量。    培養北斗國際人才    荊宇虹致詞稱，粵澳北斗產業學院在中國北斗走向世界的歷史階段應運而生，也邁出了北斗國際人才培養的堅實一步。航空航天科技工作委員會將積極履行自身職責，攜手粵澳兩地共同建設粵澳北斗產業學院，以學院為北斗國際交流平台，培養北斗國際人才，通過學院的窗口走出國門、走向世界。,http://www.macaodaily.com/html/2024-10/23/content_1789424.htm,喬梁致詞稱，期望透過與學院合作共同開展科研項目，推動產學研深度融合，培養出更多具有國際視野和專業技能的人才，積極推動北斗技術在澳門乃至葡語系國家的應用，深入探索北斗技術在智慧城市、通信系統、智能交通、公共安全等領域的應用和潛力，為澳門的可持續發展貢獻力量,粵澳 北斗 產業 學院 成立         冀促 進 北斗 系統 跨境 及國際化 應用         【 本報 消息 】 由 澳門 中西 創新學院 、 廣東 科技 學院 、 廣東 南粵 集團 有限公司 、 航空航天 科技 工作 委員會 共同 發起 組建 的 粵澳 北斗 產業 學院 （ 中心 ） 昨舉行 成立 儀式 ， 同場 舉行 澳門 北斗 導航 應用 協會 成立 暨 北斗 應用 交流 會 ， 期望 藉此 促進 北斗 系統 的 跨境 及國際化 應用 ， 加强 粵澳 兩地 北斗 領域 合作 ， 推進 北斗 走向世界 。         活動 昨日 下午 三時 在 中西 創新學院 研發 基地 舉行 ， 中國 工程院 院士 楊善 林線 上 參 與 ， 中聯辦 教育 與 青年 工作 部副 部長 石書正 、 中西 創新學 院校 長 仲偉合 、 教青局 高教 合作 交流 處長 譚兆華 、 中聯辦 教育 與 青年 部四級 調 研員 李詠樂 、 澳門 科學 技術 發展 基金 技術員 鄭浩志 ， 南粵 集團 董事 長 趙 春曉 、 副 總經理 喬梁 ， 航空航天 科技 工作 委員會 秘書長 荊宇虹 等 出席 。         加速 科技成果 轉化         仲偉合致 詞稱 ， 期望 透過 搭建 校企 合作 平台 ， 促進 學術界 與 產業界 的 緊密 合作 ， 加速 科技成果 向 現實 生產力 轉化 ， 推動 北斗 技術 在 智慧 城市 、 智慧 交通 、 精準 農業 、 緊急 管理 等 領域 的 廣泛 應用 ， 為粵 港澳 大灣區 的 經濟 社會 發展 注入 新 的 活力 。         楊善 林視 頻致 詞稱 ， 期望 通過 系統性 規劃 與 資源 整合 ， 構建產學 研一體化 人才 培養 模式 ， 充分利用 澳門作 為 內 地 和 葡語 系國家橋 樑 的 獨特 優勢 ， 培養 具國際 視野 、 創新機 制及 實踐 能力 的 高素質 北斗 產業 人才 ， 推動 北斗 衛星導 航系統 的 國際化 應用 與 發展 。         喬梁致 詞稱 ， 期望 透過 與 學院 合作 共同 開展 科研 項目 ， 推動 產學研 深度 融合 ， 培養 出 更 多 具有 國際視野 和 專業 技能 的 人才 ， 積極 推動 北斗 技術 在 澳門 乃至 葡語 系國家 的 應用 ， 深入 探索 北斗 技術 在 智慧 城市 、 通信 系統 、 智能 交通 、 公共安全 等 領域 的 應用 和 潛力 ， 為 澳門 的 可持續 發展 貢獻 力量 。         培養 北斗 國際 人才         荊宇虹致 詞稱 ， 粵澳 北斗 產業 學院 在 中國 北斗 走向世界 的 歷史 階段 應運而生 ， 也 邁出 了 北斗 國際 人才 培養 的 堅實 一步 。 航空航天 科技 工作 委員會 將積極 履行 自身 職責 ， 攜手 粵澳 兩地 共同 建設 粵澳 北斗 產業 學院 ， 以學院 為 北斗 國際 交流平台 ， 培養 北斗 國際 人才 ， 通過 學院 的 窗口 走出 國門 、 走向世界 。,2024-10-23
（新聞小語）宣傳賽車文化擦亮金名片    夏  耘,宣傳賽車文化擦亮金名片    第七十一屆澳門格蘭披治大賽車下月舉行，世界各地頂尖車手將雲集本澳一較高下。大賽車作為澳門一張歷史悠久、成色十足的“金名片”，賽事要越辦越好，須不斷破舊立新，助建“盛事之都”、“體育之城”。    澳門東望洋賽道是世界著名的城市賽車跑道，更是一代代賽車新星的搖籃，多位世界級“車神”都以澳門為起步點、成名地。今屆已吸引三十五個國家及地區逾一百八十名賽車手報名參與，參賽國區及車手數量超過疫前，可見澳門大賽車受到國際車壇的認可，在賽車界的地位無可動搖。    適逢“雙慶”之年，組委會期望賽事能為“雙慶”增添熱鬧和歡樂，豐富持份者特別是觀賽旅客的體驗。大賽車每年除了賽事，亦有眾多延伸活動，如親子嘉年華、攝影比賽、車展等。今年內容與過往相若。澳門賽車不僅僅是一場賽事，更是一次宣傳推廣澳門的機會。世界各地的賽車迷及遊客屆時將如期而至，感受賽車的速度與激情。如何保持澳門這張體育名片的新鮮感及熱度，需要不斷創新思維、革新項目。    在現有的基礎上，可考慮與企業加強合作，設置更多的互動區域，優化賽事周邊商品攤位、豐富主題餐飲等；增加賽車的打卡點，以增強觀眾的參與感和樂趣體驗。利用現代科技，如增設賽車的虛擬實景，為觀眾提供更多沉浸式的觀賽體驗，讓他們認識賽車文化，更深入地了解賽車的技術和策略。    戰車更新換代，賽車運動因時因地制宜、持續演進。澳門大賽車也經歷過太平洋方程式被淘汰，至一九八三年引入三級方程式。今年五月國際汽聯決定三級方程式賽事不再落戶澳門，取而代之的是區域方程式賽事。對此外界有不同看法。現應更好地辦好賽事，用事實說話。許多人不認識區域方程式，當局大可因應新賽事，結合線上線下，邀請網絡紅人、直播主等齊齊加入宣傳，讓大眾透過更多渠道了解賽制、戰車性能、車手背景等，讓澳門賽事不斷煥發新活力，非車迷也進一步認識賽車和賽車文化。    夏  耘,http://www.macaodaily.com/html/2024-10/23/content_1789425.htm,許多人不認識區域方程式，當局大可因應新賽事，結合線上線下，邀請網絡紅人、直播主等齊齊加入宣傳，讓大眾透過更多渠道了解賽制、戰車性能、車手背景等，讓澳門賽事不斷煥發新活力，非車迷也進一步認識賽車和賽車文化,宣傳 賽車 文化 擦亮 金 名片         第七十一 屆 澳門格蘭 披治大賽 車下 月 舉行 ， 世界各地 頂尖 車手 將雲集本 澳一較 高下 。 大賽 車作 為 澳門 一張 歷史 悠久 、 成色 十足 的 “ 金 名片 ” ， 賽事要 越 辦越 好 ， 須不斷 破舊 立新 ， 助建 “ 盛事 之 都 ” 、 “ 體育 之城 ” 。         澳門東 望洋 賽道 是 世界 著名 的 城市 賽車 跑道 ， 更是 一代代 賽車 新星 的 搖籃 ， 多位 世界 級 “ 車神 ” 都 以 澳門 為 起步 點 、 成名 地 。 今屆 已 吸引 三十五 個國家 及 地區 逾 一百八十 名賽 車手 報名 參 與 ， 參賽 國區 及 車手 數量 超過 疫前 ， 可見 澳門 大賽車 受到 國際 車壇 的 認可 ， 在 賽車界 的 地位 無可動搖 。         適逢 “ 雙慶 ” 之 年 ， 組委會 期望 賽事能 為 “ 雙慶 ” 增添 熱鬧 和 歡樂 ， 豐富 持份者 特別 是 觀賽 旅客 的 體驗 。 大賽車 每年 除了 賽事 ， 亦 有 眾多 延伸 活動 ， 如親子 嘉年華 、 攝影 比賽 、 車展 等 。 今年 內容 與 過往 相若 。 澳門 賽車 不僅僅 是 一場 賽事 ， 更是 一次 宣傳 推廣澳門 的 機會 。 世界各地 的 賽車 迷及 遊客 屆 時將 如期而至 ， 感受 賽車 的 速度 與 激情 。 如何 保持 澳門 這張 體育 名片 的 新鮮 感及 熱度 ， 需要 不斷 創新思維 、 革新 項目 。         在 現有 的 基礎 上 ， 可 考慮 與 企業 加強 合作 ， 設置 更 多 的 互動區域 ， 優化賽 事 周邊 商品 攤位 、 豐富 主題 餐 飲 等 ； 增加 賽車 的 打卡 點 ， 以 增強 觀眾 的 參 與 感和樂趣 體驗 。 利用 現代 科技 ， 如 增設 賽車 的 虛擬 實景 ， 為 觀眾 提供 更 多 沉浸 式 的 觀賽 體驗 ， 讓 他們 認識 賽車 文化 ， 更 深入 地 了解 賽車 的 技術 和 策略 。         戰車 更新 換代 ， 賽車 運動 因時 因地制宜 、 持續 演進 。 澳門 大賽車 也 經歷過 太平洋 方程式 被 淘汰 ， 至 一九八三年 引入 三級 方程式 。 今年 五月 國際 汽聯 決定 三級 方程式 賽事 不再 落戶 澳門 ， 取而代之 的 是 區域 方程式 賽事 。 對此 外界 有 不同 看法 。 現應 更好 地辦 好賽 事 ， 用事實 說 話 。 許多人 不 認識區域 方程式 ， 當局 大 可 因應 新賽 事 ， 結合線 上線 下 ， 邀請 網絡 紅人 、 直播 主等 齊齊 加入 宣傳 ， 讓 大眾 透過 更 多渠道 了解 賽制 、 戰車 性能 、 車手 背景 等 ， 讓 澳門賽 事不斷 煥發 新 活力 ， 非車 迷 也 進 一步 認識 賽車 和 賽車 文化 。         夏     耘,2024-10-23
