Title,Content,Link,Summary,Preprocessed_Content,Date
新華夜中師生學習兩會精神,新華夜中師生學習兩會精神    新華夜中學日前邀請澳區全國人大代表、澳門中華教育會會長陳虹到校舉行“全國人大、全國政協會議”精神分享會。    分享會上，陳虹先回顧國家發展在過去一年中所獲得的佳績來之不易，其後以“提振信心”、“新質生產力”、“高質量發展”等熱門關鍵詞向師生分享了“兩會”所聚焦的議題、會議成果及國家領導的重要發言等。最後，陳虹分享她在“兩會”期間的個人體會和向全國人大所提出的建議，通過圖片展示“兩會”會議盛況和澳區全國人大代表的工作情況。    與會師生們認真聆聽，用心領會“兩會”精神。    陳虹深入淺出地為大家上了一節精彩的國情教育課，大家獲益良多。,http://www.macaodaily.com/html/2024-04/16/content_1748605.htm,分享會上，陳虹先回顧國家發展在過去一年中所獲得的佳績來之不易，其後以“提振信心”、“新質生產力”、“高質量發展”等熱門關鍵詞向師生分享了“兩會”所聚焦的議題、會議成果及國家領導的重要發言等,新華 夜中 師生 學習 兩會 精神         新華 夜中 學 日前 邀請 澳區 全國 人大代表 、 澳門 中華 教育 會會長 陳 虹 到校 舉行 “ 全國 人大 、 全國政 協會議 ” 精神 分享 會 。         分享 會上 ， 陳 虹 先回 顧國家 發展 在 過去 一年 中所 獲得 的 佳績 來 之 不易 ， 其後以 “ 提振 信心 ” 、 “ 新質 生產力 ” 、 “ 高質量 發展 ” 等 熱門 關鍵 詞向 師生 分享 了 “ 兩會 ” 所 聚焦 的 議題 、 會議 成果 及國家 領導 的 重要 發言 等 。 最 後 ， 陳 虹 分享 她 在 “ 兩會 ” 期間 的 個 人 體會 和 向 全國 人大 所 提出 的 建議 ， 通過 圖片 展示 “ 兩會 ” 會議 盛況 和 澳區 全國 人大代表 的 工作 情況 。         與 會師 生們 認真 聆 聽 ， 用心 領會 “ 兩會 ” 精神 。         陳 虹 深入 淺出 地為 大家 上 了 一節 精彩 的 國情 教育 課 ， 大家 獲益 良多 。,2024-04-16
保險中介擬改金管局監管,保險中介擬改金管局監管    涉洗錢恐怖主義犯罪不設“洗底”    【本報消息】立法會第二常設委員會昨日下午三時舉行會議，分析及討論《保險中介業務法》法案，經濟財政司司長李偉農等官員列席會議。    文本建議新增因清洗黑錢、恐怖主義或資助恐怖主義的犯罪而正被控訴或起訴，又或已被判罪者，以後均不得擔任保險中介人的職務。政府解釋保險金融業務講求誠信，不少地方均有類似規定。    會議閉門審議約兩小時。    提升工作效率    會後，小組會主席陳澤武、秘書林倫偉總結表示，政府代表回應了委員會關於法案問題清單的全部內容。    當中，委員會關注過去保險中介業務主要由監督實體經濟財政司司長許可，為何改由金融管理局負責？政府解釋，有關保險內容和申請文件繁瑣，加上普通違法情況屬輕微，為提升工作效率，因此將中介業務的相關處罰等，改由金融管理局決定。認為做法符合國際保險監理官協會的原則，香港、內地同樣由相關部門監管。    適當資格審查方面，文本建議從事保險中介業務者曾被裁判判處三年或以上徒刑，視為不具備適當資格，但依法已獲恢復權利者除外。    至於因搶劫、盜竊、信任的濫用、簽發空頭支票、詐騙、偽造等而正被控訴或起訴，又或已被判罪者，以後均不得擔任保險中介人的職務。    陳澤武表示，文本建議新增因清洗黑錢、恐怖主義或資助恐怖主義的犯罪同樣不設“洗底”，委員會關注不設“洗底”情況較少出現，問為何有此考慮。政府解釋保險金融業務講求誠信，但之後會再充分考慮是否可以恢復資格。    硏深合區簽保    關於未來隨着越來越多澳人前往深合區發展，在深合區工作或居住的澳門居民，簽署保險合同是否同樣有效？陳澤武引述政府回應稱，有關工作將分兩階段推進，首階段政府正爭取在深合區的保險服務中心作為試點，希望在深合區的澳門居民及內地居民，均可以在橫琴獲得保險的續保、理賠及退保等服務；第二階段再探索能否在深合區簽署保險合同。    陳澤武表示，下一步政府及委員會的法律顧問再開會，理順條文。,http://www.macaodaily.com/html/2024-04/16/content_1748645.htm,保險中介擬改金管局監管    涉洗錢恐怖主義犯罪不設“洗底”    【本報消息】立法會第二常設委員會昨日下午三時舉行會議，分析及討論《保險中介業務法》法案，經濟財政司司長李偉農等官員列席會議,保險 中介 擬改 金管局 監管         涉洗 錢 恐怖 主義 犯罪 不設 “ 洗底 ”         【 本報 消息 】 立法 會 第二 常設 委員會 昨日 下午 三時 舉行 會議 ， 分析 及 討論 《 保險 中介 業務法 》 法案 ， 經濟 財政司 司長 李偉 農等 官員 列席 會議 。         文本 建議 新增 因 清洗 黑錢 、 恐怖 主義或 資助 恐怖 主義的 犯罪 而 正 被控 訴 或 起訴 ， 又 或 已 被 判罪 者 ， 以後均 不得 擔任 保險 中介人 的 職務 。 政府 解釋 保險 金融 業務 講求 誠信 ， 不少 地方 均 有 類似 規定 。         會議 閉門 審議 約 兩小時 。         提升 工作效率         會 後 ， 小組會 主席 陳澤武 、 秘書林倫偉 總結 表示 ， 政府 代表 回應 了 委員會關 於 法案 問題 清單 的 全部 內容 。         當中 ， 委員會關 注過 去 保險 中介 業務 主要 由 監督 實體 經濟 財政司 司長 許可 ， 為何 改由 金融 管理局 負責 ？ 政府 解釋 ， 有關 保險 內容 和 申請 文件 繁瑣 ， 加上 普通 違法 情況 屬輕微 ， 為 提升 工作效率 ， 因此 將 中介 業務 的 相關 處罰 等 ， 改由 金融 管理局 決定 。 認為 做法 符合 國際 保險 監理 官協會 的 原則 ， 香港 、 內地 同樣 由 相關 部門 監管 。         適當 資格 審查 方面 ， 文本 建議 從 事 保險 中介 業務者 曾 被 裁判 判處 三年 或 以上 徒刑 ， 視為 不具 備適 當資格 ， 但 依法 已獲 恢 復 權利者 除外 。         至於 因 搶 劫 、 盜竊 、 信任 的 濫用 、 簽發 空頭 支票 、 詐騙 、 偽造 等 而 正 被控 訴 或 起訴 ， 又 或 已 被 判罪 者 ， 以後均 不得 擔任 保險 中介人 的 職務 。         陳澤武 表示 ， 文本 建議 新增 因 清洗 黑錢 、 恐怖 主義或 資助 恐怖 主義的 犯罪 同樣 不設 “ 洗底 ” ， 委員會 關注 不設 “ 洗底 ” 情況 較少 出現 ， 問為 何有 此 考慮 。 政府 解釋 保險 金融 業務 講求 誠信 ， 但 之後會 再 充分 考慮 是否 可以 恢 復 資格 。         硏 深 合 區 簽 保         關於未來 隨着 越來 越 多 澳人 前往 深合區 發展 ， 在 深合區 工作 或 居住 的 澳門 居民 ， 簽署 保險 合同 是否 同樣 有效 ？ 陳澤武 引述 政府 回應 稱 ， 有關 工作 將分 兩階段 推進 ， 首階段 政府 正爭 取 在 深合區 的 保險 服務 中心 作為 試點 ， 希望 在 深合區 的 澳門 居民 及 內 地 居民 ， 均 可以 在 橫琴 獲得 保險 的 續保 、 理賠 及 退保 等 服務 ； 第二 階段 再 探索 能否 在 深合區 簽署 保險 合同 。         陳澤武 表示 ， 下 一步 政府 及委員會 的 法律 顧問 再 開會 ， 理順 條文 。,2024-04-16
（新聞小語）增公寓服務  研以老養老    夏  耘,增公寓服務    研以老養老    由於申請反應佳，特區政府宣佈長者公寓首階段推出的住宿單位較初期增加一倍至一千五百多個，首批入住者可享首三年使用費八折優惠。長者公寓受歡迎，反映本澳不少長者希望改善居住環境和享受相應的養老服務。    位於黑沙環東北大馬路的長者公寓佔地面積六千八百多平方米，三十七層公寓及三層地庫停車場，提供約一千八百個開放式單位。將於年底安排入住的首推七百五十九個單位，去年底接受申請，至今收到約一千五百份申請，涉及近二千人。因應申請較初期超額一倍，當局加推單位，單看申請數字，幾乎有求必應。    本澳人口老齡化加深，加上社會小家庭的普及，長者與家人分開居住情況普遍。部分租住公屋，亦有不少老友記居於唐樓。隨着年紀漸長，上落樓梯都成困擾，亦衍生社交和生活質量等問題。現屆政府決定興建長者公寓，為相對有自理和經濟能力的長者提供多一個養老選擇。也因長者公寓有一系列的配套設施，方便老友記出行、飲食、購物及休閒運動，並引入智慧養老、智能家居及無障礙環境等，確定籌設長者健康中心，提供衛生護理等支援服務，對獨居或雙老長者的居家安全和日常社交生活加強保障。    隨着本澳人口老齡化問題日益凸顯，當局須持續檢視社會對長者公寓的需求，預留土地規劃未來興建更多長者公寓。完善長者公寓各項配套服務和設施。尤其是入住長者年齡逐漸增加，衰退加劇，一旦他們的自理能力轉差，應該有相關機制和服務可以銜接或轉介。長遠而言，長者公寓的醫療、護理服務還需要相應提升。    長者公寓落成和入伙，是本澳嶄新養老模式的開始。除了照顧和服務長者，當局也可以考慮引入企業、機構、社團參與營運的社企單位，研發相應的銀髮產品，或參與長者公寓內的各項工作和服務，既滿足老友記的需求，也可合理規劃善用晚晴資源，讓更多有能力長者繼續服務社會，以老養老。    夏  耘,http://www.macaodaily.com/html/2024-04/16/content_1748647.htm,除了照顧和服務長者，當局也可以考慮引入企業、機構、社團參與營運的社企單位，研發相應的銀髮產品，或參與長者公寓內的各項工作和服務，既滿足老友記的需求，也可合理規劃善用晚晴資源，讓更多有能力長者繼續服務社會，以老養老,增 公寓 服務         研以 老養 老         由 於 申請 反應佳 ， 特區 政府 宣 佈 長 者 公寓 首階段 推出 的 住宿 單位 較 初期 增加一倍 至 一千五百多 個 ， 首批 入住 者 可 享首 三年 使用 費 八折 優惠 。 長 者 公寓 受歡 迎 ， 反映 本澳 不少 長 者 希望 改善 居住 環境 和 享受 相應 的 養 老 服務 。         位 於 黑沙 環東 北大 馬 路 的 長 者 公寓 佔 地面 積六 千八百 多平方米 ， 三十七 層 公寓 及三層 地庫 停車場 ， 提供 約 一千八百 個 開放式 單位 。 將於 年底 安排 入住 的 首推 七百 五十九 個 單位 ， 去年底 接受 申請 ， 至今 收到 約 一千五百 份 申請 ， 涉及 近 二千人 。 因應 申請 較 初期 超額 一倍 ， 當局 加 推 單位 ， 單看 申請 數字 ， 幾乎 有求 必應 。         本澳 人口 老齡化 加深 ， 加上 社會 小家庭 的 普及 ， 長 者 與 家人 分開 居住 情況 普遍 。 部分 租住 公屋 ， 亦 有 不少 老友 記居 於 唐樓 。 隨着 年紀 漸長 ， 上落 樓梯 都 成 困擾 ， 亦 衍生 社交 和 生活 質量 等 問題 。 現屆 政府 決定 興建長 者 公寓 ， 為 相 對 有 自理 和 經濟 能力 的 長 者 提供 多一個 養 老選擇 。 也 因長 者 公寓 有 一系列 的 配套 設施 ， 方便 老友 記 出行 、 飲食 、 購物 及 休閒 運動 ， 並 引入 智慧 養老 、 智能家居 及 無 障礙 環境 等 ， 確定 籌設 長 者 健康 中心 ， 提供 衛生護理 等 支援 服務 ， 對 獨居 或 雙老長 者 的 居家 安全 和 日常 社交生活 加強 保障 。         隨着 本澳 人口 老齡化 問題 日益 凸顯 ， 當局 須持續 檢視 社會 對長 者 公寓 的 需求 ， 預留 土地 規劃 未來 興建 更 多長 者 公寓 。 完善 長 者 公寓 各項 配套 服務 和 設施 。 尤其 是 入住 長 者 年齡 逐漸 增加 ， 衰退 加劇 ， 一旦 他們 的 自理能力 轉差 ， 應該 有 相關 機制 和服 務 可以 銜接 或 轉介 。 長 遠 而言 ， 長 者 公寓 的 醫療 、 護理 服務還 需要 相應 提升 。         長 者 公寓 落成 和 入伙 ， 是 本澳 嶄 新養 老 模式 的 開始 。 除了 照顧 和服 務長 者 ， 當局 也 可以 考慮 引入 企業 、 機構 、 社團 參與 營運 的 社企 單位 ， 研發 相應 的 銀 髮 產品 ， 或 參與長 者 公寓 內 的 各項 工作 和服 務 ， 既 滿足 老友 記的 需求 ， 也 可 合理 規劃 善用 晚晴 資源 ， 讓 更 多 有 能力 長 者 繼續 服務 社會 ， 以老養 老 。         夏     耘,2024-04-16
終院：兩涉歐案土地歸政府所有,判林偉夫婦終極敗訴    終院：兩涉歐案土地歸政府所有    【本報消息】終審法院院長辦公室訊：二○二二年一月二十日初級法院刑事法庭合議庭作出裁判，根據《刑法典》第一○一條第一款裁定，將建有亞婆井斜巷二號樓宇、龍頭里三號及亞婆井斜巷五號樓宇的兩幅土地宣告歸澳門特區所有。    被告林偉及其配偶梁麗卿不服，向中級法院先後提起上訴及聲明異議，均被裁定為理由不成立。林偉及梁麗卿仍不服，認為中級法院不能以終審法院在前司長歐文龍涉貪案（第五十三／二○○八號案）中認定的事實為依據宣告上述土地歸澳門特區所有，向終審法院提起上訴。    換地干預行政審批    終審法院合議庭對上訴案作出審理。根據終審法院第五十三／二○○八號案中認定的事實，二○○三年林偉向澳門特區政府申請以換地方式批給一幅鄰近西望洋馬路的土地及在其上興建一幢別墅。為達到該申請及其以後提出的其他申請能順利獲得批准目的，林偉以主教山別墅用地的權利給予歐文龍作為回報，以便後者利用其職權和影響干預有關申請的行政審批程序。二○○六年歐文龍作出第二一○／二○○六號運輸工務司司長批示，接受林偉以建有亞婆井斜巷二號樓宇、龍頭里三號及亞婆井斜巷五號樓宇的土地所有權交換一幅鄰近西望洋馬路的土地，以興建一幢獨立式別墅。    合議庭指本案與終審法院第五十三／二○○八號案有相同的來源，均源自前司長歐文龍涉貪案，而基於案發時生效的《司法組織綱要法》，歐文龍在終審法院受審，而林偉則在初級法院受審，兩個案件相互牽連，因有關法院管轄權的法律規定而於不同的法院接受審判。初級法院認定的部分事實與終審法院在第五十三／二○○八號案認定的事實在重要的實質內容方面完全一致。    因此，合議庭認為以終審法院認定的事實宣告土地喪失的爭議點顯得沒有必要，即使答案是否定也不妨礙法院根據本案被認定的事實而作出相關決定。合議庭指雖然在本案中初級法院作出有罪裁判時並未宣告土地喪失，但這屬於應予彌補的遺漏，不妨礙法院在有罪裁判之後作出宣告喪失的決定。    涉案地屬犯罪工具    針對林偉提出的終審法院在第五十三／二○○八號案中並未宣告土地喪失，但初級法院卻在本案作出宣告，這違反了已確定裁判的權威。對此，合議庭認為由於林偉並非第五十三／二○○八號案的訴訟當事人，故終審法院決定將相關的問題留待具管轄權的初級法院在針對林偉等人的刑事案件中處理，因此不存在違反已確定裁判的瑕疵。    合議庭亦認同中級法院的見解，認為涉案的土地是林偉用以行賄歐文龍的犯罪工具，且極有可能被再次用於犯罪，故不應將有關土地歸還予林偉。合議庭續指雖然對林偉的刑事追訴時效期間已屆滿，但根據《刑法典》第一○一條第二款規定，即使沒有人因犯罪事實而受處罰，亦不妨礙法院將用於或預備用於犯罪的物件或不法事實所產生的物件宣告喪失並歸澳門特區所有。    行賄利益惠及配偶    另外，梁麗卿指案中沒有已證事實顯示其曾參與行賄行為並從中獲得具體的利益，其不應對財產的喪失負有責任。對此，合議庭強調梁麗卿與林偉的婚姻財產制度為取得共同財產制，基於該制度涉案土地屬夫妻的共同財產，林偉以共同財產行賄歐文龍而獲得的利益毫無疑問亦惠及其配偶梁麗卿，故應適用《刑法典》第一○二條第二款的規定作出宣告喪失的決定。    綜上所述，合議庭裁定林偉及梁麗卿提起的上訴敗訴。,http://www.macaodaily.com/html/2024-04/16/content_1748649.htm,林偉及梁麗卿仍不服，認為中級法院不能以終審法院在前司長歐文龍涉貪案（第五十三／二○○八號案）中認定的事實為依據宣告上述土地歸澳門特區所有，向終審法院提起上訴,判林偉夫 婦終 極敗訴         終院 ： 兩涉 歐案 土地 歸 政府 所有         【 本報 消息 】 終審 法院 院長 辦 公室 訊 ： 二 ○ 二 二年 一月 二十日 初級 法院 刑事法庭 合議庭 作出 裁判 ， 根據 《 刑法典 》 第一 ○ 一條 第一款 裁定 ， 將 建有 亞婆井 斜巷 二號 樓宇 、 龍頭 里 三號 及 亞婆井 斜巷 五號 樓宇 的 兩幅 土地 宣告 歸澳門 特區 所有 。         被告 林偉 及其 配偶 梁麗卿 不服 ， 向 中級 法院 先 後 提起 上訴 及 聲明 異議 ， 均 被 裁定 為 理由 不 成立 。 林偉及 梁麗卿 仍 不服 ， 認為 中級 法院 不能 以終 審 法院 在 前 司長 歐文龍涉 貪案 （ 第五十三 ／ 二 ○ ○ 八號案 ） 中 認定 的 事 實為 依據 宣告 上述 土地 歸澳門 特區 所有 ， 向 終審 法院 提起 上訴 。         換地 干預 行政 審批         終審 法院 合議庭 對 上 訴案 作出 審理 。 根據 終審 法院 第五十三 ／ 二 ○ ○ 八號案 中 認定 的 事實 ， 二 ○ ○ 三年 林偉向 澳門 特區 政府 申請 以換 地 方式 批給 一幅 鄰近 西 望洋 馬 路 的 土地 及 在 其 上 興建 一幢 別墅 。 為 達 到 該 申請 及其 以 後 提出 的 其他 申請 能 順利 獲得 批准 目的 ， 林偉以 主教 山別墅 用地 的 權利 給予 歐文龍 作為 回報 ， 以便 後 者 利用 其 職權 和 影響 干 預有 關申 請 的 行政 審批 程序 。 二 ○ ○ 六年 歐文龍 作出 第二 一 ○ ／ 二 ○ ○ 六號 運輸 工務司 司長 批示 ， 接受 林偉以 建有 亞婆井 斜巷 二號 樓宇 、 龍頭 里 三號 及 亞婆井 斜巷 五號 樓宇 的 土地 所有 權交換 一幅 鄰近 西 望洋 馬 路 的 土地 ， 以興建 一幢 獨 立式 別墅 。         合議庭 指 本案 與 終審 法院 第五十三 ／ 二 ○ ○ 八號案 有 相同 的 來源 ， 均 源自 前司 長 歐文龍涉 貪案 ， 而基 於 案 發時 生效 的 《 司法 組織 綱要 法 》 ， 歐文龍 在 終審 法院 受審 ， 而林偉則 在 初級 法院 受審 ， 兩個 案件 相互 牽連 ， 因有關 法院 管轄權 的 法律 規定 而 於 不同 的 法院 接受 審判 。 初級 法院 認定 的 部分 事實 與 終審 法院 在 第五十三 ／ 二 ○ ○ 八號案 認定 的 事實 在 重要 的 實質 內容 方面 完全一致 。         因此 ， 合議庭 認為 以 終審 法院 認定 的 事實 宣告 土地 喪失 的 爭議點 顯得 沒有 必要 ， 即使 答案 是 否定 也 不妨 礙 法院 根據 本案 被 認定 的 事實 而 作出 相關 決定 。 合議庭 指 雖然 在 本案 中 初級 法院 作出 有罪 裁判 時並 未 宣告 土地 喪失 ， 但 這屬 於 應予 彌補 的 遺漏 ， 不妨 礙 法院 在 有罪 裁判 之 後 作出 宣告 喪失 的 決定 。         涉案 地屬 犯罪 工具         針對 林偉 提出 的 終審 法院 在 第五十三 ／ 二 ○ ○ 八號案 中 並未 宣告 土地 喪失 ， 但 初級 法院 卻 在 本案 作出 宣告 ， 這違 反 了 已 確定 裁判 的 權威 。 對此 ， 合議庭 認為 由 於 林偉 並非 第五十三 ／ 二 ○ ○ 八號案 的 訴訟 當事人 ， 故終 審 法院 決定 將相關 的 問題 留待 具管轄權 的 初級 法院 在 針對 林偉 等 人 的 刑事案件 中處理 ， 因此 不 存在 違反 已 確定 裁判 的 瑕疵 。         合議庭 亦 認同 中級 法院 的 見解 ， 認為 涉案 的 土地 是 林偉 用以 行賄 歐文龍 的 犯罪 工具 ， 且 極有 可能 被 再次 用 於 犯罪 ， 故不應 將有關 土地 歸 還予 林偉 。 合議庭續 指 雖然 對林偉 的 刑事 追訴 時 效期 間 已屆 滿 ， 但 根據 《 刑法典 》 第一 ○ 一條 第二款 規定 ， 即使 沒 有人 因 犯罪 事實 而 受 處罰 ， 亦 不妨 礙 法院 將用 於 或 預備 用 於 犯罪 的 物件 或 不 法事 實所產生 的 物件 宣告 喪失 並歸 澳門 特區 所有 。         行賄 利益 惠及 配偶         另外 ， 梁麗卿 指案 中 沒 有 已 證事實 顯示 其 曾 參與行 賄行 為 並從 中 獲得 具體 的 利益 ， 其不應 對 財產 的 喪失 負有 責任 。 對此 ， 合議庭 強調 梁麗卿 與 林偉 的 婚姻 財產 制度 為 取得 共同 財產制 ， 基 於 該 制度 涉案 土地 屬 夫妻 的 共同 財產 ， 林偉以 共同 財產行賄 歐文龍 而 獲得 的 利益 毫無疑 問亦惠 及其 配偶 梁麗卿 ， 故應 適用 《 刑法典 》 第一 ○ 二條 第二款 的 規定 作出 宣告 喪失 的 決定 。         綜上 所述 ， 合議庭 裁定 林偉及 梁麗卿 提起 的 上訴 敗訴 。,2024-04-16
周四起多雲驟雨,周四起多雲驟雨    【本報消息】氣象局預測本澳未來數日天氣不穩，據當局未來七日天氣預報顯示，周四、周五多雲及驟雨，周末有幾陣驟雨及雷暴，居民外出宜帶備雨具。預測今日多雲，部分時間有陽光，初時有薄霧，吹二至四級偏南風，氣溫攝氏二十五至三十度，相對濕度為百分之七十至九十八。    路邊、一般性地區、高密度住宅區空氣質量水平良好，沿海地區吹二至四級偏南風，視野微弱至良好。    預測明日多雲，短暫時間有陽光，有一兩陣驟雨，吹三至五級南至西南風及有陣風，氣溫攝氏二十五至三十度，相對濕度為百分之七十至九十五。    昨日多雲，部分時間有陽光，氣溫為攝氏二十五至三十度，相對濕度為百分之七十二至九十七，昨日錄得最高紫外線指數約為七點一，平均為三點一，強度屬於中等。,http://www.macaodaily.com/html/2024-04/16/content_1748651.htm,預測今日多雲，部分時間有陽光，初時有薄霧，吹二至四級偏南風，氣溫攝氏二十五至三十度，相對濕度為百分之七十至九十八,周四 起多雲驟 雨         【 本報 消息 】 氣象局 預測本 澳未來 數日 天氣 不穩 ， 據 當局 未來 七日 天氣 預報 顯示 ， 周四 、 周五 多雲及 驟雨 ， 周末 有 幾陣 驟雨及 雷暴 ， 居民 外出 宜帶備 雨具 。 預測 今日 多 雲 ， 部分 時間 有陽光 ， 初時 有 薄霧 ， 吹二至 四級 偏南 風 ， 氣溫 攝氏 二十五 至 三十度 ， 相對 濕度 為 百分之七十 至 九十八 。         路邊 、 一般性 地區 、 高密度 住宅 區空氣 質量 水平 良好 ， 沿海 地區 吹二至 四級 偏南 風 ， 視野 微弱 至 良好 。         預測 明日 多 雲 ， 短暫 時間 有陽光 ， 有 一 兩陣 驟雨 ， 吹三至 五級 南至 西南 風及 有 陣風 ， 氣溫 攝氏 二十五 至 三十度 ， 相對 濕度 為 百分之七十 至 九 十五 。         昨日 多 雲 ， 部分 時間 有陽光 ， 氣溫 為 攝氏 二十五 至 三十度 ， 相對 濕度 為 百分之七十 二至 九十七 ， 昨日 錄得 最高 紫外 線 指數 約 為 七點 一 ， 平均 為 三點 一 ， 強度屬 於 中等 。,2024-04-16
