Title,Content,Link,Summary,Preprocessed_Content,Date
王燦患腸躁症暴瘦,王燦患腸躁症暴瘦    內地男星杜淳的妻子王燦，因演出真人騷《婆婆和媽媽2》受到粉絲喜愛，擁有甜美外貌和苗條身材。然而，她近日因健康問題引發網友關注，尤其是確診為腸躁症導致體重驟降至三十九點二公斤。對此，昨日王燦發文感謝外界關心。王燦昨天發文，感謝大家的關心並分享自身的健康狀況。她說目前已在積極服藥並調整飲食，努力增重，希望盡快恢復健康，並強調“沒有甚麼比健康更重要”。    隨着孩子日漸成長，近年王燦在家庭和工作間分身乏術，她解釋：“操心的事情愈來愈多，工作上也時常內耗，所以忽略了情緒方面也會引起身體的不適。”她以自己經歷提醒粉絲，在忙碌生活中別忘了關注自身健康，尤其是腸胃保養，並提到身體的不適，有時也源自於情緒壓力的影響。王燦呼籲“對又要工作又要帶娃的媽媽們多一些包容”，並以愛心符號表達了對粉絲的感謝之情。她同時又強調，要照顧好自己的健康，才能更好地陪伴家人和孩子，也希望大家在追求生活目標的同時，記得按時愛護自己的身體。,http://www.macaodaily.com/html/2024-11/10/content_1793192.htm,”她以自己經歷提醒粉絲，在忙碌生活中別忘了關注自身健康，尤其是腸胃保養，並提到身體的不適，有時也源自於情緒壓力的影響,王燦 患腸躁 症暴 瘦         內地 男星 杜淳 的 妻子 王燦 ， 因 演出 真人 騷 《 婆婆 和 媽媽 2 》 受到 粉絲喜 愛 ， 擁有 甜美 外貌 和 苗條 身材 。 然而 ， 她 近日 因 健康 問題 引發 網友 關注 ， 尤其 是 確診 為 腸躁 症導 致體 重驟 降至 三十九 點二 公斤 。 對此 ， 昨日 王燦 發文 感謝 外界 關心 。 王燦 昨天 發文 ， 感謝 大家 的 關心並 分享 自身 的 健康 狀況 。 她 說 目前 已 在 積極 服藥並 調整 飲食 ， 努力 增重 ， 希望 盡快 恢 復 健康 ， 並強 調 “ 沒有 甚麼 比 健康 更 重要 ” 。         隨着 孩子 日漸 成長 ， 近年 王燦 在 家庭 和 工作 間 分身 乏術 ， 她 解釋 ： “ 操心 的 事情 愈來 愈 多 ， 工作 上 也 時常 內耗 ， 所以 忽略 了 情緒 方面 也 會 引起 身體 的 不適 。 ” 她 以 自己 經歷 提醒 粉絲 ， 在 忙碌 生活 中別 忘 了 關注 自身 健康 ， 尤其 是 腸胃 保養 ， 並 提到 身體 的 不適 ， 有時 也 源自 於 情緒 壓力 的 影響 。 王燦呼籲 “ 對 又 要 工作 又 要 帶 娃 的 媽媽們 多一些 包容 ” ， 並以 愛心 符號 表達 了 對 粉絲 的 感謝 之情 。 她 同時 又 強調 ， 要照 顧好 自己 的 健康 ， 才能 更好 地 陪伴 家人 和 孩子 ， 也 希望 大家 在 追求 生活 目標 的 同時 ， 記得 按時 愛護 自己 的 身體 。,2024-11-10
李宓發相親餵雙胞胎,李宓發相親餵雙胞胎    台灣“資生堂千金”李宓婚後育有一對雙胞胎兒子和一個女兒，十月又生下雙胞胎女兒，正式成為五寶媽。最近拍攝全家福的同時，她還被拍了哺乳照當作紀念，“這是我第一次同時親餵兩個雙胞胎。”照片中，可以看到李宓解開襯衫的鈕扣，將雙胞胎女兒放在大腿上親餵，她低頭看着兩個孩子，露出幸福的笑容，眼神完全藏不住愛意，畫面十分溫馨。    這也是李宓第一次同時親餵兩個小孩，“因爲平常沒有人幫忙很難同時做抱兩個寶寶的姿勢”，加上其中一個兒子之前不願喝奶，“所以無法兩兄弟一起親餵。”接着前往頂樓拍攝全家福，由於另外一個女兒萱萱待在阿公家，所以遺憾沒有入鏡，李宓說：“之後會再去拍個一家七口的全家福”，她認為這次哺乳寫真絕對是一輩子的紀念，“畢竟人生中哺乳的時間我也才短短幾個月而已，可惜我不是個奶水多的母親，沒辦法改變，但我想當個讓小孩們都幸福的母親。”,http://www.macaodaily.com/html/2024-11/10/content_1793193.htm,”接着前往頂樓拍攝全家福，由於另外一個女兒萱萱待在阿公家，所以遺憾沒有入鏡，李宓說：“之後會再去拍個一家七口的全家福”，她認為這次哺乳寫真絕對是一輩子的紀念，“畢竟人生中哺乳的時間我也才短短幾個月而已，可惜我不是個奶水多的母親，沒辦法改變，但我想當個讓小孩們都幸福的母親,李宓 發相親 餵雙 胞胎         台灣 “ 資生堂 千金 ” 李宓 婚後育 有 一對雙 胞胎 兒子 和 一個 女兒 ， 十月 又 生下雙 胞胎 女兒 ， 正式 成為 五寶媽 。 最近 拍攝 全家福 的 同時 ， 她 還被 拍 了 哺乳 照當 作紀念 ， “ 這是 我 第一次 同時親 餵 兩個雙 胞胎 。 ” 照片 中 ， 可以 看到 李宓 解開 襯衫 的 鈕扣 ， 將雙 胞胎 女兒 放在 大腿 上親 餵 ， 她 低頭 看着 兩個 孩子 ， 露出 幸福 的 笑容 ， 眼神 完全 藏不住 愛意 ， 畫面 十分 溫馨 。         這也 是 李宓 第一次 同時親 餵 兩個 小孩 ， “ 因 爲 平常 沒 有人 幫忙 很 難 同時 做 抱 兩個 寶寶的 姿勢 ” ， 加上 其中 一個 兒子 之前 不願 喝奶 ， “ 所以 無法 兩 兄弟 一起 親餵 。 ” 接着 前往 頂樓 拍 攝 全家福 ， 由 於 另外 一個 女兒 萱 萱 待 在 阿公 家 ， 所以 遺憾 沒有 入鏡 ， 李宓 說 ： “ 之後會 再 去 拍個 一家 七口 的 全家福 ” ， 她 認為 這次 哺乳 寫 真絕 對 是 一輩子 的 紀念 ， “ 畢竟 人生 中 哺乳 的 時間 我 也 才 短短 幾個 月 而已 ， 可惜 我 不是 個 奶水 多 的 母親 ， 沒辦法 改變 ， 但 我 想 當個 讓 小孩 們 都 幸福 的 母親 。 ”,2024-11-10
陳怡蓉夜酺夫女上街撈人,陳怡蓉夜酺夫女上街撈人    女星陳怡蓉過去因演出《薰衣草》走紅，有“偶像劇女王”的封號。她二○一六年和醫美名醫薛博仁結婚後，育有一個女兒，不時會分享家庭生活。昨日她上傳一張母女照，並寫下“半夜十一點與忘記穿褲子就出門的女兒在信義區的約會”，背後原因逗樂大批粉絲。她透露，每當她和朋友約好出門放風時，老公最後都不忘帶女兒來接她回家，“這樣的運作會讓我覺得我真是一個壞女人，怎麼半夜不哄睡卻辣辣的在外面遊戲人間呢？”    逗趣的是，老公前日晚間依然帶女兒來接陳怡蓉回家，但因為匆忙出門的關係，導致孩子下衣失蹤，“最後下身失蹤的我們只好一起連袂辣翻信義區”，陳怡蓉笑道。照片中，可以看到陳怡蓉放下一頭及胸長髮，身穿淺灰色激短洋裝，搭配灰黑色西裝外套和靴子顏色相呼應，露出白皙纖細的長腿；女兒則穿着白點黑底短洋裝，同步騷出可愛長腿，母女互動可愛有趣。,http://www.macaodaily.com/html/2024-11/10/content_1793194.htm,她透露，每當她和朋友約好出門放風時，老公最後都不忘帶女兒來接她回家，“這樣的運作會讓我覺得我真是一個壞女人，怎麼半夜不哄睡卻辣辣的在外面遊戲人間呢,陳 怡蓉夜 酺 夫女 上街 撈 人         女星 陳 怡蓉過 去 因 演出 《 薰衣草 》 走紅 ， 有 “ 偶像 劇 女王 ” 的 封號 。 她 二 ○ 一 六年 和醫 美名 醫薛博仁 結婚 後 ， 育有 一個 女兒 ， 不時會 分享 家庭 生活 。 昨日 她 上 傳一張 母女 照 ， 並寫 下 “ 半夜 十一 點與 忘記 穿 褲子 就 出門 的 女兒 在 信義區 的 約 會 ” ， 背 後 原因 逗樂 大批 粉絲 。 她 透露 ， 每當 她 和 朋友 約 好 出門 放風時 ， 老公 最後都 不 忘 帶 女兒 來 接 她 回家 ， “ 這樣 的 運作會 讓 我 覺得 我 真是 一個 壞 女人 ， 怎麼 半夜 不 哄 睡 卻 辣辣的 在 外面 遊戲 人間 呢 ？ ”         逗趣 的 是 ， 老公 前日 晚間 依然 帶 女兒 來 接陳怡蓉 回家 ， 但 因為 匆忙 出門的關 係 ， 導致 孩子 下衣 失 蹤 ， “ 最 後 下身 失 蹤 的 我 們 只好 一起 連袂辣 翻 信義區 ” ， 陳 怡蓉 笑 道 。 照片 中 ， 可以 看到 陳 怡蓉 放下 一頭 及 胸長 髮 ， 身穿 淺 灰色 激短洋裝 ， 搭配 灰黑色 西裝 外套 和 靴子 顏 色相 呼應 ， 露出 白皙 纖細 的 長 腿 ； 女兒則 穿着 白點 黑底 短洋裝 ， 同步 騷出 可愛長 腿 ， 母女 互動 可 愛 有趣 。,2024-11-10
蒙嘉慧生活圈日常   娛翁,蒙嘉慧生活圈日常    在一個星期前，本以為《戰場上》必可力壓同時段播出的《呢度住吓 嗰度住吓》，原因是後者的拍攝地點福岡剛被杜如風在《解風福岡》介紹過、會失去新鮮感，而另一節目則深入戰場拍攝定有吸睛之處。但有誰估到只是相隔一個星期，《戰場上》已成為了炮灰。    最初本以為《呢度住吓 嗰度住吓》是一個旅遊節目，只不過將主持由杜如風換成在地人蒙嘉慧。然而當看完五集之後，才確定這並不是一個旅遊節目，因為節目內完全沒有杜如風介紹的食買玩，而是蒙嘉慧在福岡的生活圈。難得的是蒙嘉慧完全不介意以幸福肥狀態亮相，且還在鏡頭前照飲照食，也不介意公開想買地起樓自住但遭老公不同意的事，令觀眾覺得她在福岡的生活就如鏡頭前表現的一樣。    之所以說《呢度住吓 嗰度住吓》是蒙嘉慧在福岡生活圈的節目，原因不僅是節目內容全圍繞她的生活日常，而且還可以十分的無謂，如第二集中，蒙嘉慧與夥伴帶領香港兩位主持駕車到郊外取山水、買農家食材、食靚景豆腐料理、農場買即日鮮雞蛋……就差不多花了足足一日，這種行程完全不是任何遊客會有興趣的。而且亦不會有電視台如此拍旅遊節目，但偏偏這就蒙嘉慧的生活日常。    撇開欣賞旅遊節目心態看《呢度住吓 嗰度住吓》，可以看到蒙嘉慧在節目中顯示了她的真，反倒是其中一個主持保錡的表現實在太過失禮。雖然明白真人騷節目就是要求真實，是以他毫不掩飾地在鏡頭前爆粗也就算了，反正播出時都會加以消音，但他在節目中的無分寸態度實在有點令人反感，總是自以為表現很風趣，總是不停重複他從AV學來的幾句不堪的日語，而且還要不分對象，在成年人與小學生面前都是重複那幾句話，着實嚇呆了劍道場上那些小學生，直可以說是辱了整個節目。也許在他的角度可能是節目效果，但這樣效果實不可取，反倒是拖累了節目的可看性。    娛翁,http://www.macaodaily.com/html/2024-11/10/content_1793195.htm,蒙嘉慧生活圈日常    在一個星期前，本以為《戰場上》必可力壓同時段播出的《呢度住吓 嗰度住吓》，原因是後者的拍攝地點福岡剛被杜如風在《解風福岡》介紹過、會失去新鮮感，而另一節目則深入戰場拍攝定有吸睛之處,蒙嘉慧 生活圈 日常         在 一個 星期 前 ， 本以 為 《 戰場 上 》 必可力 壓同 時段 播出 的 《 呢 度 住 吓   嗰 度 住 吓 》 ， 原因 是後者 的 拍 攝 地點 福岡剛 被 杜如風 在 《 解風福岡 》 介紹過 、 會 失去 新鮮感 ， 而 另 一節 目則 深入 戰場 拍 攝定 有 吸睛 之處 。 但 有 誰 估到 只是 相隔 一個 星期 ， 《 戰場 上 》 已成 為 了 炮灰 。         最初 本以 為 《 呢 度 住 吓   嗰 度 住 吓 》 是 一個 旅遊 節目 ， 只 不 過將 主持 由 杜如風 換成 在 地人 蒙嘉慧 。 然而 當看 完 五集 之 後 ， 才 確定 這並 不是 一個 旅遊 節目 ， 因為 節目 內 完全 沒有 杜如風 介紹 的 食 買 玩 ， 而是 蒙嘉慧 在 福岡 的 生活圈 。 難得 的 是 蒙嘉慧 完全 不介意 以 幸福 肥狀態 亮相 ， 且 還在 鏡頭 前照 飲照 食 ， 也 不介意 公開 想 買 地 起樓 自住 但 遭 老公 不 同意 的 事 ， 令觀 眾覺 得 她 在 福岡 的 生活 就 如鏡頭 前表現 的 一樣 。         之所以 說 《 呢 度 住 吓   嗰 度 住 吓 》 是 蒙嘉慧 在 福岡 生活圈 的 節目 ， 原因 不僅 是 節目 內容 全圍 繞 她 的 生活 日常 ， 而且 還 可以 十分 的 無謂 ， 如 第二 集中 ， 蒙嘉慧 與 夥伴 帶領 香港 兩位 主持 駕車 到 郊外 取 山水 、 買 農家 食材 、 食靚景 豆腐 料理 、 農場 買 即日 鮮雞蛋 … … 就 差不多 花 了 足足 一日 ， 這種 行程 完全 不是 任何 遊客 會 有 興趣 的 。 而且 亦 不會 有 電視台 如此 拍 旅遊 節目 ， 但 偏偏 這就 蒙嘉慧 的 生活 日常 。         撇開 欣賞 旅遊節 目心態 看 《 呢 度 住 吓   嗰 度 住 吓 》 ， 可以 看到 蒙嘉慧 在 節目 中 顯示 了 她 的 真 ， 反倒 是 其中 一個 主持 保 錡 的 表現 實在 太過 失禮 。 雖然 明白 真人 騷節目 就是 要求 真實 ， 是 以 他 毫不 掩飾 地 在 鏡頭 前 爆粗 也 就算 了 ， 反正 播出 時 都 會 加以 消音 ， 但 他 在 節目 中 的 無 分寸 態度 實在 有點 令人 反感 ， 總是 自以 為 表現 很 風趣 ， 總是 不停 重 複 他 從 AV 學來 的 幾句 不堪 的 日語 ， 而且 還要 不分 對象 ， 在 成年人 與 小學生 面前 都 是 重 複 那 幾句 話 ， 着 實嚇 呆 了 劍 道場 上 那些 小學生 ， 直 可以 說 是 辱 了 整個 節目 。 也 許在 他 的 角度 可能 是 節目 效果 ， 但 這樣 效果 實不 可取 ， 反倒 是 拖累 了節 目的 可看性 。         娛翁,2024-11-10
黃翠如奉旨綠老公   高梁,黃翠如奉旨綠老公    TVB台慶，蕭正楠黃翠如今年又同框，夫妻再次大鬧會場麼？五年前，翠如當衆“綠老公”，送上一頂無影綠帽，議論至今——    綠色笑話，耐人尋味。二〇一九年台慶玩遊戲，黃翠如爆料：“外景時，在土耳其浴場，看過洪永城全相，佢嘅私穩部位Size……。”黃翠如蠱蠱惑惑舉起手指尾……簡單動作，惹起風波。洪永城大喝“唔好亂講。”蕭正楠笑得非常尷尬……。    曹永廉打圓場，問蕭正楠：“信唔信黃翠如睇過洪永城全相？”“信！”蕭正楠連聲答。曹永廉一窒：“你眞係大方。”    黃翠如愈講愈開放：“我就係睇過洪永城，先至鍾意蕭正楠。”    器官鬧劇，網民圍轟，紛紛留言狠批，指該環節唔好笑又低質；認為這個劇本，非常不尊重男性，狠指黃翠如當衆“綠老公”，替阿蕭感到不値。“眞係好唔尊重，如果，男女角色調轉，大談女性器官的話，輿論已駡到這個人死咗，點解可以咁樣對男仔？當面綠老公呢種女人要來做乜”……，“點解冇人投訴？呢的唔係叫性騒擾係乜嘢？”“吓？可以出街咩？”等等……。有這樣節目，才有這樣觀眾，倘若沒有“嗜腥”觀眾，TVB台慶，便絕迹性器官笑話了。今年，《黑色月光》有黃翠如；《巾幗袅雄之懸崖》有蕭正楠，兩劇大熱，旗鼓相當。蕭正楠與黃翠如同台，舊話重提，或深度的“耍花槍”話題，切不可浪費。可以預料黃翠如的肚腩，將是一個話題……請拭目以待。    睇全相，當時網友亦有平反，認為只係節目效果，毋須過份認真：“佢哋幾個，台下都是好朋友，這些地踎話題，老早傾過啦。幕前情緒反應，根本係節目效果。”“希望只係劇本。”    後記：肯定係劇本！任何聰明才智的藝員，都不得現場臨時發揮，此屬犯天條，一時生草藥，整個劇情亂了套，對手也不知所措。最敏感的，或犯了電管條例，藝員不自知的，公司要負法例責任，一次、兩次，可以釘牌。“不得隨意發揮，依足劇本，依足編導命令，必然的”。天才周星馳，許多新演繹，創新風，必須先得監製批准，劇本多年籌備，容不下半粒老鼠屎。    高梁,http://www.macaodaily.com/html/2024-11/10/content_1793196.htm,”    黃翠如愈講愈開放：“我就係睇過洪永城，先至鍾意蕭正楠,黃 翠 如 奉旨 綠 老公         TVB 台慶 ， 蕭正楠 黃 翠 如今 年 又 同框 ， 夫妻 再次 大鬧會 場麼 ？ 五年 前 ， 翠如當 衆 “ 綠 老公 ” ， 送上 一頂 無影 綠帽 ， 議論 至今 — —         綠色 笑 話 ， 耐人 尋味 。 二 〇 一 九年 台慶 玩遊戲 ， 黃 翠 如 爆料 ： “ 外景 時 ， 在 土耳其 浴場 ， 看過 洪 永城 全相 ， 佢 嘅 私 穩 部位 Size … … 。 ” 黃 翠 如 蠱 蠱惑惑 舉起 手指 尾 … … 簡單 動作 ， 惹起 風波 。 洪 永城 大喝 “ 唔 好 亂講 。 ” 蕭正楠 笑 得 非常 尷尬 … … 。         曹永廉 打圓場 ， 問蕭正楠 ： “ 信 唔 信黃翠如 睇 過洪 永城 全相 ？ ” “ 信 ！ ” 蕭正楠 連聲 答 。 曹永廉 一 窒 ： “ 你 眞 係 大方 。 ”         黃 翠 如愈 講愈 開放 ： “ 我 就 係 睇 過洪 永城 ， 先至 鍾 意 蕭正楠 。 ”         器官 鬧劇 ， 網民圍 轟 ， 紛紛 留言 狠批 ， 指該 環節 唔 好笑 又 低質 ； 認為 這個 劇本 ， 非常 不 尊重 男性 ， 狠 指黃翠 如當 衆 “ 綠 老公 ” ， 替 阿 蕭 感到 不 値 。 “ 眞 係 好 唔 尊重 ， 如果 ， 男女 角色 調轉 ， 大談 女性 器官 的 話 ， 輿論 已 駡 到 這 個 人 死 咗 ， 點解 可以 咁 樣 對 男仔 ？ 當面 綠 老公 呢種 女人 要來 做 乜 ” … … ， “ 點解 冇 人 投訴 ？ 呢 的 唔 係 叫 性 騒 擾 係 乜嘢 ？ ” “ 吓 ？ 可以 出街 咩 ？ ” 等等 … … 。 有 這樣 節目 ， 才 有 這樣 觀眾 ， 倘若 沒有 “ 嗜腥 ” 觀眾 ， TVB 台慶 ， 便 絕迹 性器官 笑 話 了 。 今年 ， 《 黑色 月光 》 有黃翠如 ； 《 巾幗袅雄 之 懸崖 》 有 蕭正楠 ， 兩劇 大熱 ， 旗鼓 相當 。 蕭正楠 與 黃 翠 如同 台 ， 舊話 重提 ， 或 深度 的 “ 耍花槍 ” 話題 ， 切不可 浪費 。 可以 預料 黃 翠 如 的 肚腩 ， 將是 一個 話題 … … 請 拭目以待 。         睇 全相 ， 當時 網友 亦 有 平反 ， 認為 只 係 節目 效果 ， 毋須 過份 認真 ： “ 佢 哋 幾 個 ， 台下 都 是 好 朋友 ， 這些 地 踎 話 題 ， 老早 傾過 啦 。 幕前 情緒 反應 ， 根本 係 節目 效果 。 ” “ 希望 只 係 劇本 。 ”         後記 ： 肯定 係 劇本 ！ 任何 聰明 才智 的 藝員 ， 都 不得 現場 臨時 發揮 ， 此屬 犯天條 ， 一時 生草藥 ， 整個 劇情 亂 了 套 ， 對手 也 不知所措 。 最 敏感 的 ， 或犯 了 電管 條例 ， 藝員 不 自知 的 ， 公司 要負 法例 責任 ， 一次 、 兩次 ， 可以 釘牌 。 “ 不得 隨意 發揮 ， 依足 劇本 ， 依足 編導 命令 ， 必然 的 ” 。 天才 周星馳 ， 許多 新 演繹 ， 創新風 ， 必須 先得 監 製 批准 ， 劇本 多年 籌備 ， 容不下 半粒 老鼠屎 。         高梁,2024-11-10
李芯怡促戲劇交流   文：花生仔,台灣演講分享從藝經歷    李芯怡促戲劇交流    本地劇場工作者李芯怡（小小）早前獲台灣魚池戲劇團邀請，在台灣暨大附中船山雅集舉行“胡搞瞎搞⁈場域特定藝術與創作講座”及工作坊，與當地一眾戲劇愛好者深入交流，讓大家認識在不同場域中進行藝術創作。    小小表示：“非常榮幸獲魚池戲劇團的邀請參與這次活動。劇團創辦人巫明如是我大學的好友。在學期間，我們是合作無間的戰友，畢業後仍有一直聯繫，互相支持。今年初，她得知我即將計劃到台灣生活及創作，便立即邀請我到她的家鄉南投縣作戲劇交流，希望能把我在澳門的創作介紹給當地熱愛戲劇的青年，藉此加深大家對藝術創作的了解，促進兩地戲劇藝術文化交流和發展。”    據小小介紹，魚池戲劇團是由台灣南投縣魚池鄉一群對表演藝術十分有熱誠的青年組成，其好友巫明如便是其中一位致力推動青年返鄉、“地方創生”的有志青年。談到參與這次活動的感受，小小分享道：“在澳門多年來以於特定場域作戲劇創作，這次來到台灣分享創作心得，希望激勵當地青年將南投縣觀光景點的特色與戲劇創作相結合，並帶到不同的場域之中撞出新的火花。印象最深刻的是，整個工作坊課程與講座從早上十時到晚上八點才結束，一整天下來仍能看到各位學員及戲劇愛好者的熱情與活力。在提問環節上，他們對於特定場域藝術創作的有趣想像，也令我感到十分驚喜。”    小小認為，參與交流分享，也是一個實現教學相長的過程。“從他們完成課程後的分享，亦能令我想起當初還是新鮮人時，那個對於探索自我最鮮活的狀態。我深信，無論作為哪類型的教學導師，在教學的過程中最寶貴的時刻，就是能與學員之間彼此學習及共同成長。希望大家一直保持好奇心，未來在藝術創作上實現更大的突破。”    文：花生仔,http://www.macaodaily.com/html/2024-11/10/content_1793197.htm,台灣演講分享從藝經歷    李芯怡促戲劇交流    本地劇場工作者李芯怡（小小）早前獲台灣魚池戲劇團邀請，在台灣暨大附中船山雅集舉行“胡搞瞎搞⁈場域特定藝術與創作講座”及工作坊，與當地一眾戲劇愛好者深入交流，讓大家認識在不同場域中進行藝術創作,台灣 演講 分享 從藝 經歷         李芯怡 促戲劇 交流         本地 劇場 工作者 李芯怡 （ 小小 ） 早前 獲台灣 魚池 戲劇團 邀請 ， 在 台灣 暨大 附中 船山 雅集 舉行 “ 胡搞 瞎搞 ⁈ 場域 特定 藝術 與 創作 講座 ” 及 工作坊 ， 與 當地 一眾 戲劇 愛好者 深入 交流 ， 讓 大家 認識 在 不同 場域 中 進行 藝術 創作 。         小小 表示 ： “ 非常 榮幸 獲魚 池戲 劇團 的 邀 請 參 與 這次 活動 。 劇團 創辦 人 巫明 如是 我大學 的 好友 。 在 學期間 ， 我們 是 合作 無間 的 戰友 ， 畢業 後 仍 有 一直 聯 繫 ， 互相支持 。 今年初 ， 她 得知 我 即 將計劃 到 台灣 生活 及 創作 ， 便 立即 邀請 我 到 她 的 家 鄉 南投 縣作 戲劇 交流 ， 希望 能 把 我 在 澳門 的 創作 介紹給 當地 熱愛戲劇 的 青年 ， 藉此 加深 大家 對藝術 創作 的 了解 ， 促進 兩地 戲劇 藝術 文化交流 和 發展 。 ”         據 小小 介紹 ， 魚池 戲劇團 是 由 台灣 南投 縣魚 池鄉 一群 對 表演 藝術 十分 有熱 誠 的 青年 組成 ， 其 好友 巫明 如 便是 其中 一位 致力 推動 青年 返鄉 、 “ 地方 創生 ” 的 有志 青年 。 談到 參與 這次 活動 的 感受 ， 小小 分享 道 ： “ 在 澳門 多年 來 以 於 特定 場域 作戲劇 創作 ， 這次 來 到 台灣 分享 創作 心得 ， 希望 激勵 當地 青年 將 南投 縣觀 光景 點的 特色 與 戲劇 創作 相結合 ， 並帶 到 不同 的 場域 之中 撞 出新 的 火花 。 印象 最 深刻 的 是 ， 整個 工作坊 課程 與 講座 從 早上 十時 到 晚上 八點 才 結束 ， 一整天 下來 仍 能 看到 各位 學員及 戲劇 愛好者 的 熱情 與 活力 。 在 提問 環節 上 ， 他們 對 於 特定 場域 藝術 創作 的 有趣 想像 ， 也 令 我 感到 十分 驚喜 。 ”         小小 認為 ， 參與 交流 分享 ， 也 是 一個 實現 教學 相長 的 過程 。 “ 從 他們 完成 課程 後 的 分享 ， 亦 能 令 我 想起 當初 還是 新鮮 人時 ， 那個 對 於 探索 自我 最鮮活 的 狀態 。 我 深信 ， 無論 作為 哪類 型 的 教學導師 ， 在 教學 的 過程 中 最寶貴 的 時刻 ， 就是 能 與 學員之間 彼此 學習 及 共同 成長 。 希望 大家 一直 保持 好奇心 ， 未來 在 藝術 創作 上 實現 更 大 的 突破 。 ”         文 ： 花生 仔,2024-11-10
