Title,Content,Link,Summary,Preprocessed_Content,Date
福青87:81反勝紅藍,福青87:81反勝紅藍    【本報消息】本地高級組籃球聯賽昨晚假望廈體育中心續燃戰火，福青迎戰紅藍。福青克服一度落後超過十五分的困境，下半場憑防守及籃下優勢咬緊兼反超，最終以八十七比八十一反勝紅藍，拿下兩連勝。    福青上仗擊敗藍英開齋，今仗由茹鵬宇主控，釋放聶釗華的火力，陳焯華、尼路及奧格斯丁正選披甲；紅藍由呂良海領軍，首節火力大爆發，呂良海射入三分後，打開這場三分大戰序幕，韓承峻單節命中四球三分，福青陳焯華雖在中距離及籃下回應，但紅藍的三分好戲仍未停歇，洪藝俊也加入三分大軍，助球隊領先三十比廿二。福青不斷變化陣容衝擊對方陣地外，更嘗試以半場盯人阻止紅藍，但紅藍陳子浪及呂良海以“不講道理”的三分波為球隊擴大領先優勢，干拔、後撤步三分等令福青無計可施，但紅藍亦未能限制福青在中距離的表現，半場領先五十六比四十四。    福青半場大反擊    易邊後，福青的防守及陣容深度開始見效，單節回敬廿五比十七外，尼路在第三節尾段及第四節表現活躍，埋伏在籃下附近“食餅”兼硬扛紅藍內線許熙絡後得分，助球隊逆轉比分。福青一度反領先八分，但紅藍有韓承峻挺身而出射入底角三分後，使用犯規戰術暫停時間。聶釗華受壓下兩罰全中，最終助球隊拉開安全分差，反勝八十七比八十一取得兩連勝。,http://www.macaodaily.com/html/2024-11/25/content_1796304.htm,福青不斷變化陣容衝擊對方陣地外，更嘗試以半場盯人阻止紅藍，但紅藍陳子浪及呂良海以“不講道理”的三分波為球隊擴大領先優勢，干拔、後撤步三分等令福青無計可施，但紅藍亦未能限制福青在中距離的表現，半場領先五十六比四十四,福青 87 : 81 反勝紅 藍         【 本報 消息 】 本地 高級 組籃球 聯賽 昨晚 假望 廈體育 中心 續燃 戰火 ， 福青迎 戰紅藍 。 福青 克服 一度 落後超過 十五分 的 困境 ， 下半場 憑 防守 及 籃下 優勢 咬 緊 兼 反超 ， 最終 以 八十七 比 八十一 反勝紅 藍 ， 拿下 兩連勝 。         福青上 仗 擊敗 藍英 開齋 ， 今仗 由 茹鵬宇 主控 ， 釋放 聶釗華 的 火力 ， 陳 焯 華 、 尼路 及 奧 格斯 丁正選 披甲 ； 紅藍 由 呂良 海領 軍 ， 首節 火力 大 爆發 ， 呂良海 射入 三分 後 ， 打開 這場 三分 大戰 序幕 ， 韓承峻 單節 命中 四球 三分 ， 福青陳焯 華 雖 在 中距 離及 籃 下回 應 ， 但紅 藍 的 三分 好戲 仍 未 停歇 ， 洪藝俊 也 加入 三分 大 軍 ， 助球隊 領先 三十 比 廿二 。 福青 不斷 變化 陣容 衝擊 對 方陣 地外 ， 更嘗試 以半場 盯人 阻止 紅藍 ， 但紅 藍陳子 浪及 呂良 海以 “ 不講 道理 ” 的 三分 波為 球隊 擴大領 先 優勢 ， 干拔 、 後 撤步 三分 等 令福 青無計 可施 ， 但紅 藍 亦 未能 限制 福青 在 中 距離 的 表現 ， 半場 領先 五十六 比 四十四 。         福青半場 大 反擊         易邊 後 ， 福青 的 防守 及陣容 深度 開始 見效 ， 單節 回敬 廿五 比 十七 外 ， 尼路 在 第三 節 尾段 及 第四 節表現 活躍 ， 埋伏 在 籃下 附近 “ 食餅 ” 兼 硬 扛 紅藍 內線 許熙絡 後 得分 ， 助球隊 逆轉 比分 。 福青 一度 反領 先 八分 ， 但紅 藍有 韓承峻 挺身而出 射入 底角 三分 後 ， 使用 犯規 戰術 暫停 時間 。 聶釗 華受 壓下 兩罰 全中 ， 最終 助球 隊拉開 安全 分差 ， 反勝 八十七 比 八十一 取得 兩連勝 。,2024-11-25
黃嘉銘林嘉泳越野跑登頂,黃嘉銘林嘉泳越野跑登頂    【本報消息】第四十六屆學界越野跑昨假松山健康徑舉行，設男、女共十組，吸引四十間學校五百七十八名運動員參加。濠江黃嘉銘及鏡平林嘉泳分奪男、女A冠軍。男、女子D及E組則因天雨關係，田總與學校教練經技術會議後，宣佈延期並擇日重賽。    賽事昨上午八點半起舉行，率先登場的男A獲五十五人報名參與，選手需賽五個大圈，全長六千八百五十米，在多條斜坡及不同路面的加持下，越野跑成為本地極具特色的長跑比賽之一。濠江黃嘉銘、粵華洪子樂及濠江李宇軒等逐漸拉開與其他選手的距離，分配體能及在不同坡段採取不同策略成為爭勝關鍵，黃嘉銘在最後一圈發力，衝過終點前的“奪命斜坡”後，以二十分四十二秒奪得冠軍，洪子樂慢十三秒獲亞軍，李宇軒季軍。    男女DE組擇日重賽    受天雨影響，山路更容易產生安全問題，加上偶爾滂沱大雨，令賽事暫停半小時。經田總與學校教練在現場的技術會議商討後，宣佈男、女子D及E組延期，擇日重賽。    女A亦獲多家學校派出精英參賽，鏡平林嘉泳與同校兼力爭衛冕的林泳妍鬥足全場，最終林嘉泳跑出二十分○九秒奪冠，林泳妍慢十七秒獲亞，濠江梁穎怡得第三。團體賽方面，濠江包辦男、女子A組團體冠軍，粵華得男B冠軍，聖羅撒女子中學中文部在女B登頂。培道及勞校則分奪男、女子C組團體冠軍。,http://www.macaodaily.com/html/2024-11/25/content_1796305.htm,濠江黃嘉銘、粵華洪子樂及濠江李宇軒等逐漸拉開與其他選手的距離，分配體能及在不同坡段採取不同策略成為爭勝關鍵，黃嘉銘在最後一圈發力，衝過終點前的“奪命斜坡”後，以二十分四十二秒奪得冠軍，洪子樂慢十三秒獲亞軍，李宇軒季軍,黃 嘉銘林嘉泳 越野跑 登頂         【 本報 消息 】 第四十六 屆學界 越野跑 昨假 松山 健康 徑舉行 ， 設 男 、 女共十組 ， 吸引 四十 間學校 五百 七 十八名 運動員 參加 。 濠江 黃 嘉銘 及鏡 平林嘉泳 分奪 男 、 女 A 冠 軍 。 男 、 女子 D 及 E 組則 因天雨關 係 ， 田 總 與 學校 教練 經技術 會議 後 ， 宣 佈 延期 並擇 日 重賽 。         賽事 昨 上午 八點 半起 舉行 ， 率先 登場 的 男 A 獲 五十五 人報 名參 與 ， 選手 需賽 五個 大圈 ， 全長 六 千八百 五十米 ， 在 多條 斜坡 及 不同 路面 的 加持 下 ， 越野跑 成為 本地 極具 特色 的 長 跑 比賽 之一 。 濠江 黃 嘉銘 、 粵華洪子 樂及 濠江 李宇軒 等 逐漸 拉開 與 其他 選手 的 距離 ， 分配 體能 及 在 不同 坡段 採取 不同 策略 成為 爭勝 關鍵 ， 黃 嘉銘 在 最 後 一圈 發力 ， 衝過 終點 前 的 “ 奪命 斜坡 ” 後 ， 以 二十分 四十二 秒 奪得 冠 軍 ， 洪子 樂慢 十三 秒 獲亞 軍 ， 李宇 軒季 軍 。         男女 DE 組擇 日 重賽         受天 雨影 響 ， 山路 更 容易 產生 安全 問題 ， 加上 偶爾 滂沱大雨 ， 令賽 事 暫停 半小時 。 經田 總 與 學校 教練 在 現場 的 技術會議 商討 後 ， 宣 佈 男 、 女子 D 及 E 組 延期 ， 擇日 重賽 。         女 A 亦 獲 多家 學校 派出 精英 參賽 ， 鏡平 林嘉泳 與 同校 兼力 爭衛冕 的 林泳妍 鬥足 全場 ， 最終 林嘉泳 跑 出 二十分 ○ 九秒 奪冠 ， 林泳妍慢 十七 秒 獲亞 ， 濠江 梁穎怡 得 第三 。 團體賽 方面 ， 濠江 包辦 男 、 女子 A 組團 體冠 軍 ， 粵華得 男 B 冠 軍 ， 聖羅撒 女子 中學 中文 部在 女 B 登頂 。 培道 及 勞校則 分奪 男 、 女子 C 組團 體冠 軍 。,2024-11-25
動力衝浪板世錦賽激戰落幕,動力衝浪板世錦賽激戰落幕    【本報消息】由新濠博亞娛樂、澳門動力衝浪板協會合辦，“新濠風尚呈獻：二○二四UIM澳門格蘭披治動力衝浪板世界錦標賽總決賽”昨日中午在黑沙海灘展開多個組別決賽激戰。    七組別決出冠軍    賽事首度落戶澳門，吸引一百二十名來自中國、韓國、捷克及中國澳門等廿二個國家及地區的選手，齊集黑沙海灘，踏浪馳騁。賽事自上周五起一連三日舉行，昨先後進行七個組別的決賽。    壓軸上演的標準男子組總決賽鬥十圈，韓國的金敏成以由頭帶落尾姿態，率先以十一分○一秒一一○衝線，以逾四秒優勢成功封王。精英組總決賽鬥十二圈，最終由同屬Rocket Racing的捷克Novotny及Zahorsky包辦冠、亞軍。女子組冠軍亦由來自捷克的Matouskova以十分十二秒六一○力壓一眾對手奪冠，並獲得明年四川的世界運動會參賽資格。    其餘組別冠軍分別為：大師組冠軍金丹（韓國），標準R男子Dusilek（捷克），青少年男子組鄭靖浩（中國）及青少年女子組Zuborova（斯洛伐克）。,http://www.macaodaily.com/html/2024-11/25/content_1796306.htm,七組別決出冠軍    賽事首度落戶澳門，吸引一百二十名來自中國、韓國、捷克及中國澳門等廿二個國家及地區的選手，齊集黑沙海灘，踏浪馳騁,動力衝 浪板 世錦賽 激戰 落幕         【 本報 消息 】 由新濠 博亞 娛樂 、 澳門動 力衝 浪板 協會 合辦 ， “ 新濠 風尚 呈 獻 ： 二 ○ 二四 UIM 澳門格蘭 披治動 力衝 浪板 世界 錦標賽 總 決賽 ” 昨日 中午 在 黑 沙海 灘展 開多個 組別 決賽 激戰 。         七組別 決出 冠 軍         賽事 首度 落戶 澳門 ， 吸引 一百二十名 來 自中國 、 韓國 、 捷克 及 中國 澳門 等 廿二 個國家 及 地區 的 選手 ， 齊集 黑 沙海 灘 ， 踏浪 馳騁 。 賽事 自 上周五 起一連 三日 舉行 ， 昨先後進 行七個 組別 的 決賽 。         壓軸 上演 的 標準 男子 組總決 賽鬥 十圈 ， 韓國 的 金敏成 以由頭 帶 落尾 姿態 ， 率先 以 十一分 ○ 一秒 一一 ○ 衝線 ， 以 逾 四秒 優勢 成功 封王 。 精英 組總決 賽鬥 十二 圈 ， 最終 由 同屬 Rocket   Racing 的 捷克 Novotny 及 Zahorsky 包辦 冠 、 亞軍 。 女子 組冠 軍 亦 由 來 自 捷克 的 Matouskova 以 十分 十二 秒 六一 ○ 力壓 一眾 對 手奪冠 ， 並獲 得 明年 四川 的 世界 運動會 參賽 資格 。         其餘 組別 冠軍分別 為 ： 大師 組冠 軍 金丹 （ 韓國 ） ， 標準 R 男子 Dusilek （ 捷克 ） ， 青少年 男子 組鄭靖 浩 （ 中國 ） 及 青少年 女子 組 Zuborova （ 斯洛伐克 ） 。,2024-11-25
與水同行環山跑參與者眾,與水同行環山跑參與者眾    【本報消息】由誠樸勤集主辦的“慶祝中華人民共和國成立七十五周年暨澳門特別行政區成立廿五周年——與水同行環山跑二○二四”，昨日早上九時在路環黑沙水庫舉行。    活動由誠樸勤集主辦，新濠博亞娛樂有限公司冠名贊助，今年踏入第七屆續設有十公里挑戰組、體驗組及親子組三大組別，在嘉賓主持起跑儀式後展開。參加者需要負重指定重量的樽裝水，圍繞路環步行徑、九澳高頂家樂徑、黑沙水庫家樂徑進行環山跑。    誠樸勤集副理事長、活動籌委會主任高俊雄表示，“與水同行”進行環山跑、慈善行，多年來將善款先後捐贈內地及尼泊爾等地，為當地興建不同供應食水的設施，並為當地居民提供禦寒衣物及生活、衛生用品；期望透過活動讓參加者及大眾了解及響應珍惜食水，提倡下一代節約用水，以及關注偏遠地區人士缺乏乾淨食水的問題。,http://www.macaodaily.com/html/2024-11/25/content_1796307.htm,誠樸勤集副理事長、活動籌委會主任高俊雄表示，“與水同行”進行環山跑、慈善行，多年來將善款先後捐贈內地及尼泊爾等地，為當地興建不同供應食水的設施，並為當地居民提供禦寒衣物及生活、衛生用品,與 水 同行 環山 跑 參與者眾         【 本報 消息 】 由誠樸勤 集主辦 的 “ 慶祝 中華 人民 共和 國 成立 七十五 周年 暨 澳門 特別 行政 區 成立 廿五 周年 — — 與 水 同行 環山 跑 二 ○ 二四 ” ， 昨日 早上 九時 在 路環 黑沙 水庫 舉行 。         活動 由 誠樸勤 集主辦 ， 新濠 博亞 娛樂 有限公司 冠名 贊助 ， 今年 踏入 第七 屆續 設有 十公里 挑戰組 、 體驗 組及 親子 組三大 組別 ， 在 嘉賓 主持 起跑 儀式後展 開 。 參加者 需要 負重 指定 重量 的 樽 裝水 ， 圍繞 路環 步行 徑 、 九澳高 頂家樂徑 、 黑沙 水庫 家樂徑 進行 環山 跑 。         誠樸 勤集 副 理事 長 、 活動 籌委會 主任 高俊雄 表示 ， “ 與 水 同行 ” 進行 環山 跑 、 慈善 行 ， 多年 來將 善款 先後捐 贈內 地 及尼泊爾 等 地 ， 為 當地 興建 不同 供應 食水 的 設施 ， 並為 當地 居民 提供 禦寒 衣物 及 生活 、 衛生 用品 ； 期望 透過 活動 讓 參加者 及 大眾 了解 及響 應 珍惜 食水 ， 提倡 下一代 節約 用水 ， 以及 關注 偏遠 地區 人士 缺乏 乾淨 食水 的 問題 。,2024-11-25
橄欖油酢涼拌真鯛   社  長,橄欖油酢涼拌真鯛    真鯛自古以來為日本所愛，素有“鯛中之王”的稱號。在日本，鯛魚的種類有很多種，但其中真鯛幾乎是日本最重要的魚類之一，因魚身呈華麗的紅豔顏色，傳統被尊為吉祥魚。牠通常在百日宴、婚宴等慶典或節日中，被原條烹飪及披上慶典背景裝飾展示後食用。而頭尾俱全的鯛魚被認為富有吉祥的寓意，這一風俗仍延續至今。    口感淡麗優雅的優質肉身，可以跟各種菜餚搭配，在日本菜裡可用上烤魚、燉魚及鯛魚飯等烹飪方式外，鮮吃刺身可以品味真鯛特有的脆彈口感和濃郁鮮味。而在西餐中，因其平易近人的淡雅風味，被採用製作“Carpaccio”涼拌菜式。後來日本菜也跟隨這種做法，並發揚光大，把日本食材以這種涼拌手法烹調，並以日文片仮名拼出“カルパッチョ”這菜式名，中文就譯做“橄欖油酢涼拌真鯛”。    天然真鯛的肥美季節有兩個，一個是產卵期的春季，另一個是為了過冬而儲存營養的秋季。這兩個季節，是真鯛脂肪最多、最美味的時候。    今期給大家介紹的“橄欖油酢涼拌真鯛”，亦是以“カルパッチョ”手法烹調，並以和洋調味料製作這道冷開胃菜。首先介紹一下製作材料，一條大概二點二公斤左右的養殖真鯛，處理乾淨魚鱗內臟後，切除魚頭並用牙刷徹底刷走一丁點血漬，尤其是嵌入魚中骨的地方。然後進行一天冷藏熟成，方法是用廚房紙吸乾魚身及腹腔水分，用吸水紙及保鮮膜包裹，放入保鮮袋並進行水壓法真空，放入冰塊水中並移到冷藏櫃冷凍廿四小時至三十小時備用。另外，準備香草橄欖油、白酒酢、青檸、紅莓、萬能蔥及刺山柑等材料。    製作步驟先找來一隻圓碟，在碟上先撒一丁點鹽花，把熟成一天的真鯛拿出切薄片，放在鹽花上並火炙，另外撒上一丁點鹽花，刷入青檸皮碎，用保鮮膜包好醃漬二十分鐘備用。與此同時，準備油酢汁，先將紅莓每粒開二，刺山柑切碎，萬能蔥切碎粒，準備一個玻璃碗，碗中撒上少許鹽，加入白酒醋、少許柚子胡椒茸，然後加入紅莓並攪爛，加入蔥碎及刺山柑碎，輕輕攪勻，再加入香草橄欖油攪勻，放入半個青檸榨汁，攪勻並試味。這時，把醃漬的真鯛魚片拿出，並用廚房紙吸乾水份，放入另一個適合的圓碟上盤，加入紅莓欖油酢，放上小花裝飾並完成。此菜式適合配上法棍包一齊吃，並配上果香大吟釀享用，更是一樂也！    材料：    真鯛二十片（二百克）    刺山柑十五粒（十五克）    紅莓十粒    萬能蔥十克    青檸一個    調味料：    橄欖油三十毫升    羅勒（如需要自己浸油）五克    白油酢十毫升    鹽十克    柚子胡椒五克    社  長,http://www.macaodaily.com/html/2024-11/25/content_1796308.htm,與此同時，準備油酢汁，先將紅莓每粒開二，刺山柑切碎，萬能蔥切碎粒，準備一個玻璃碗，碗中撒上少許鹽，加入白酒醋、少許柚子胡椒茸，然後加入紅莓並攪爛，加入蔥碎及刺山柑碎，輕輕攪勻，再加入香草橄欖油攪勻，放入半個青檸榨汁，攪勻並試味,橄欖油 酢 涼 拌 真 鯛         真 鯛 自古 以來 為 日本 所愛 ， 素有 “ 鯛 中之王 ” 的 稱號 。 在 日本 ， 鯛魚 的 種類 有 很多 種 ， 但 其中 真 鯛 幾乎 是 日本 最 重要 的 魚類 之一 ， 因魚 身 呈 華麗的紅 豔 顏色 ， 傳統 被 尊為 吉祥 魚 。 牠 通常 在 百日 宴 、 婚宴 等慶典 或 節日 中 ， 被 原條 烹飪 及 披上 慶典 背景 裝飾 展示 後 食用 。 而頭 尾 俱全 的 鯛魚 被 認為 富有 吉祥 的 寓意 ， 這一風俗 仍 延續 至今 。         口感 淡麗 優雅 的 優質 肉身 ， 可以 跟 各種 菜餚 搭配 ， 在 日本 菜裡 可用 上 烤魚 、 燉 魚及 鯛 魚飯 等 烹飪 方式 外 ， 鮮吃 刺身 可以 品味 真 鯛 特有 的 脆彈 口感 和 濃郁 鮮味 。 而 在 西餐 中 ， 因 其 平易近人 的 淡雅 風味 ， 被採 用 製 作 “ Carpaccio ” 涼拌 菜式 。 後 來 日本 菜 也 跟 隨 這種 做法 ， 並發揚 光大 ， 把 日本 食材 以 這種 涼 拌 手法 烹調 ， 並以 日文 片 仮 名 拼出 “ カ ル パ ッ チ ョ ” 這菜式 名 ， 中文 就譯 做 “ 橄欖油 酢 涼 拌 真 鯛 ” 。         天然 真 鯛 的 肥美 季節 有 兩個 ， 一個 是 產卵期 的 春季 ， 另 一個 是 為 了 過冬 而 儲存 營養 的 秋季 。 這兩個 季節 ， 是 真 鯛 脂肪 最 多 、 最 美味 的 時候 。         今期 給 大家 介紹 的 “ 橄欖油 酢 涼 拌 真 鯛 ” ， 亦 是 以 “ カ ル パ ッ チ ョ ” 手法 烹調 ， 並以 和 洋 調味 料 製 作 這 道 冷 開 胃 菜 。 首先 介紹 一下 製 作 材料 ， 一條 大概 二點 二 公斤 左右 的 養殖 真 鯛 ， 處理 乾淨 魚鱗內臟 後 ， 切除 魚頭 並用 牙刷 徹底 刷 走 一丁 點血漬 ， 尤其 是 嵌入 魚中骨 的 地方 。 然後進行 一天 冷藏 熟成 ， 方法 是 用 廚房紙 吸乾魚 身及 腹腔 水分 ， 用 吸水 紙及 保鮮膜 包裹 ， 放入 保鮮袋 並進 行水 壓法 真空 ， 放入 冰塊 水中 並移 到 冷藏 櫃冷凍 廿四 小時 至 三十 小時備 用 。 另外 ， 準備 香草 橄欖油 、 白酒 酢 、 青檸 、 紅莓 、 萬能 蔥 及 刺山柑 等 材料 。         製 作 步 驟 先 找 來 一 隻 圓 碟 ， 在 碟 上 先 撒 一丁 點鹽花 ， 把 熟成 一天 的 真 鯛 拿出 切 薄片 ， 放在 鹽花 上 並火 炙 ， 另外 撒上 一丁 點鹽花 ， 刷入 青 檸皮碎 ， 用 保鮮膜 包好 醃 漬 二十分 鐘備 用 。 與 此 同時 ， 準備 油 酢 汁 ， 先將 紅莓 每粒 開二 ， 刺山柑 切碎 ， 萬能 蔥 切碎 粒 ， 準備 一個 玻璃碗 ， 碗 中 撒 上 少 許鹽 ， 加入 白酒 醋 、 少許 柚子 胡椒 茸 ， 然 後 加入 紅莓 並攪爛 ， 加入 蔥碎 及 刺山柑 碎 ， 輕輕 攪勻 ， 再 加入 香草 橄欖油 攪勻 ， 放入 半個 青檸 榨汁 ， 攪勻 並試味 。 這時 ， 把 醃 漬 的 真 鯛 魚片 拿出 ， 並用 廚房紙 吸乾 水份 ， 放入 另 一個 適合 的 圓碟 上盤 ， 加入 紅莓欖油 酢 ， 放 上 小花 裝飾並 完成 。 此菜式 適合配 上 法棍 包一齊 吃 ， 並配 上 果香 大吟釀 享用 ， 更是 一樂 也 ！         材料 ：         真 鯛 二十 片 （ 二百克 ）         刺山柑 十五 粒 （ 十五 克 ）         紅莓 十粒         萬能 蔥 十克         青檸 一個         調味料 ：         橄欖油 三十 毫升         羅 勒 （ 如 需要 自己 浸油 ） 五克         白油 酢 十 毫升         鹽 十克         柚子 胡椒 五克         社     長,2024-11-25
