Title,Content,Link,Summary,Preprocessed_Content,Date
鄭秀文許志安同遊日本,兩人十指緊扣幸福甜蜜    鄭秀文許志安同遊日本    鄭秀文和許志安同遊日本被網友巧遇，二人十指緊扣，感情非常穩定。之前男方被爆出軌後形象受創，兩人婚姻備受關注，不過事隔五年兩人仍維持婚姻關係。    許志安與黃心穎在的士激吻事件後，男方曾受訪說這是一輩子的傷疤，並坦言對未來的演藝事業不敢抱有期望。儘管出軌事件對他們的婚姻造成了衝擊，但鄭秀文選擇原諒丈夫，並在對方復出後給予支持。    許多網友在日本銀座街頭巧遇鄭秀文、許志安，並上傳到社交平台，從他們分享的照片中，可見兩人穿着休閒，享受度假時光逛街，手也是一直十指緊扣。網友們對此表示欣慰，並祝福他們能夠“一直十指緊扣牽手到老”。    許志安也認為能成功走出來，要感謝妻子的鼓勵與寬恕。而鄭秀文曾在社交網站寫過：“有時看似不好的事，其實是一場祝福”，並以自己去年的重病經歷為例，表示要化危機為轉機，這番話也讓外界聯想到她對許志安出軌事件的看法。,http://www.macaodaily.com/html/2024-08/07/content_1773030.htm,許多網友在日本銀座街頭巧遇鄭秀文、許志安，並上傳到社交平台，從他們分享的照片中，可見兩人穿着休閒，享受度假時光逛街，手也是一直十指緊扣,兩人 十指 緊扣 幸福 甜蜜         鄭秀文 許志安同遊 日本         鄭秀文 和 許志安同遊 日本 被 網友 巧遇 ， 二人 十指 緊扣 ， 感情 非常 穩定 。 之前 男方 被 爆出 軌 後 形象 受創 ， 兩人 婚姻 備受 關注 ， 不過 事隔 五年 兩人 仍維持 婚姻 關 係 。         許志安 與 黃 心穎 在 的士 激吻 事件 後 ， 男方 曾 受訪 說 這是 一輩子 的 傷疤 ， 並 坦言 對 未來 的 演藝事業 不敢 抱 有 期望 。 儘 管 出 軌 事件 對 他們 的 婚姻 造成 了 衝擊 ， 但 鄭秀文 選擇 原諒 丈夫 ， 並在 對方 復 出後給予 支持 。         許多 網友 在 日本 銀座 街頭 巧遇 鄭秀文 、 許志安 ， 並上 傳到 社交 平台 ， 從 他們 分享 的 照片 中 ， 可見 兩人 穿着 休閒 ， 享受 度假 時光 逛街 ， 手 也 是 一直 十指 緊扣 。 網友們 對 此 表示 欣慰 ， 並 祝福 他們 能夠 “ 一直 十指 緊扣 牽手 到 老 ” 。         許志安 也 認為 能 成功 走出 來 ， 要 感謝 妻子 的 鼓勵 與 寬 恕 。 而 鄭秀文 曾 在 社交 網站 寫過 ： “ 有時 看似 不好 的 事 ， 其實 是 一場 祝福 ” ， 並以 自己 去年 的 重病 經歷 為例 ， 表示 要化 危機 為 轉機 ， 這番 話 也 讓 外界 聯 想到 她 對 許志安出 軌 事件 的 看法 。,2024-08-07
炎亞綸直播賣中秋禮盒,炎亞綸直播賣中秋禮盒    炎亞綸帶自家品牌快閃髮品平台，聯手直播推銷旗下中秋節禮盒等產品。但早前台灣女星謝金燕控告該髮品公司侵權，品牌老闆現身大罵“花在她身上兩、三億還被告”，炎亞綸即時十分尷尬。    七月初謝金燕透過社交平台譴責某美髮品牌，合約到期後還非法使用她的肖像進行宣傳。    當日卡氛老闆直播時，就以謝金燕作例子說她不感恩。又強調與炎亞綸雙方是廣告交換的合作，意思是互惠的，炎亞綸只能在旁苦笑，超級尷尬。而炎亞綸商品直播快結束時，廠商促銷自家髮品，當成中秋禮盒贈品，炎亞綸也陪着賣了十二分鐘。    炎亞綸因拍攝持有少年私密片被起訴，五月底緩刑，他因此陸續準備復出。上周在台東參加熱氣球嘉年華，又出席自創選物一日店長活動，之後更為《Q18量子預言》出席記者會造勢。不過他可能急着想促銷自家品牌的中秋禮盒，昨晚就低調現身直播，讓直播主叫賣他的商品，不過他自己就安靜站在一旁，偶爾配合作效果。,http://www.macaodaily.com/html/2024-08/07/content_1773032.htm,但早前台灣女星謝金燕控告該髮品公司侵權，品牌老闆現身大罵“花在她身上兩、三億還被告”，炎亞綸即時十分尷尬,炎亞綸 直播 賣 中秋 禮盒         炎亞綸 帶 自家 品牌 快 閃 髮 品 平台 ， 聯手 直播 推銷 旗下 中秋 節禮盒 等 產品 。 但 早 前台 灣 女星 謝金燕 控告 該 髮 品 公司 侵權 ， 品牌 老 闆 現身 大 罵 “ 花 在 她 身上 兩 、 三億還 被告 ” ， 炎亞綸 即 時 十分 尷尬 。         七月 初謝 金燕 透過 社交 平台 譴責 某美 髮 品牌 ， 合約 到期 後還 非法 使用 她 的 肖像 進行 宣傳 。         當日 卡氛 老 闆 直播 時 ， 就 以 謝金燕作 例子 說 她 不 感恩 。 又 強調 與 炎亞綸 雙方 是 廣告 交換 的 合作 ， 意思 是 互惠 的 ， 炎亞綸 只能 在 旁 苦笑 ， 超級 尷尬 。 而 炎亞綸 商品 直播 快 結束 時 ， 廠商 促銷 自家 髮 品 ， 當成 中秋 禮盒 贈品 ， 炎亞綸 也 陪 着 賣 了 十二分 鐘 。         炎亞綸 因 拍 攝 持有 少年 私密 片 被 起訴 ， 五月 底 緩刑 ， 他 因此 陸續 準備 復 出 。 上周 在 台東 參加 熱氣球 嘉年華 ， 又 出席 自創 選物 一日 店長 活動 ， 之 後 更 為 《 Q18 量子 預言 》 出席 記者 會 造勢 。 不過 他 可能 急 着想 促銷 自家 品牌 的 中秋 禮盒 ， 昨晚 就 低調 現身 直播 ， 讓 直播 主叫 賣 他 的 商品 ， 不過 他 自己 就安靜 站 在 一旁 ， 偶爾 配合 作 效果 。,2024-08-07
李純認愛民謠歌手馬頔,李純認愛民謠歌手馬頔    日前，內地女星李純終於認愛民謠歌手馬頔。消息指，二人去年被拍到親密互動，近日李純上綜藝節目，被問及緋聞男友，她毫不掩飾坦言目前感情狀態是戀愛中，大方坦承戀情，獲得大批粉絲的祝福。    錄影期間，被主持王菊問：“最近跟馬老師怎麼樣”，李純回答“挺好的”，王菊追問“結婚嗎？”她也毫不避諱表示：“看他吧，看他求不求吧。”讓王菊不禁笑說：“壓力給到馬老師這邊”。    憑着《如懿傳》飾演魏嬿婉一角，李純逐漸走紅，此外，她還演出出《慶餘年》、《愛很美味》、《花千骨》等多部流量劇集，是許多觀眾熟悉的面孔。她近日登上實境節目《我家那閨女》，被問到感情狀態，大方坦承：“談戀愛的狀態。”,http://www.macaodaily.com/html/2024-08/07/content_1773035.htm,消息指，二人去年被拍到親密互動，近日李純上綜藝節目，被問及緋聞男友，她毫不掩飾坦言目前感情狀態是戀愛中，大方坦承戀情，獲得大批粉絲的祝福,李純 認愛民謠 歌手 馬頔         日前 ， 內地 女星 李純終 於 認愛民謠 歌手 馬頔 。 消息 指 ， 二人 去年 被 拍 到 親密 互動 ， 近日 李純上 綜藝 節目 ， 被 問及 緋聞 男友 ， 她 毫不 掩飾 坦言 目前 感情 狀態 是 戀愛中 ， 大方 坦承 戀情 ， 獲得 大批 粉絲 的 祝福 。         錄影 期間 ， 被 主持 王菊問 ： “ 最近 跟 馬 老師 怎麼樣 ” ， 李純 回答 “ 挺 好 的 ” ， 王菊 追問 “ 結婚 嗎 ？ ” 她 也 毫不 避諱 表示 ： “ 看 他 吧 ， 看 他求 不求 吧 。 ” 讓 王菊 不禁 笑 說 ： “ 壓力 給到 馬 老師 這邊 ” 。         憑 着 《 如懿傳 》 飾演 魏嬿婉 一角 ， 李純 逐漸 走紅 ， 此外 ， 她還 演出 出 《 慶餘年 》 、 《 愛 很 美味 》 、 《 花千骨 》 等 多部 流量 劇集 ， 是 許多 觀眾 熟悉 的 面孔 。 她 近日 登上 實境 節目 《 我家 那閨女 》 ， 被 問到 感情 狀態 ， 大方 坦承 ： “ 談戀 愛的 狀態 。 ”,2024-08-07
星女郎逐個數   高梁,星女郎逐個數    “你現在個女朋友係邊個？”當年老友鬼鬼的王晶問周星馳，“梗係阿娟啦！”兩個大男人坦言拍拖情況，該是兄弟層次了，而且王晶一直目擊周星馳的情海翻波……    周星馳與羅慧娟，因合作《蓋世豪俠》撻着，地下情三年，圈內人早知道了，稱羅慧娟為“星妹”！她亦會甜笑回應，本以為此情會一帆風順……    朋友透露，羅慧娟很純情，自言嚮往婚姻生仔組織家庭。言之鑿鑿阿娟曾經主動向周星馳求婚，卻換來對方一句：“你神經病？”我本一片芳心向明月，無奈明月似的星星向了溝渠……娟妹離開傷心地，異地他鄉找到了歸宿，至死沒有返香港。    據知情人目擊，因周星馳戀上了朱茵，才與羅慧娟分手的。王晶透露，周星馳初見朱茵的情景：“當時，我同陳嘉上都見到，周星馳見到朱茵，隻眼好似跌咗出來咁滯，睇到佢實㗎，睇住佢對朱茵出手……！”後來傳聞因莫文蔚介入，周星馳才與朱茵分手。周星馳作為偶像，非常自我珍惜，每部戲都與女主角有緋聞，支支吾吾疑幻疑眞，最後不了了之，只留下星女郎閒話。獨是有一位香港小姐，承認與周星馳拍過拖。王晶“笑傲江湖”網站開張之際，書展有個座談會——三十五年前的港姐季軍——林疑嫺，著書立説，講育兒心得……講美國的奮鬥史……    “我同星仔識於微時……”故地重遊，開場白先與周星馳扯上“親密關係”，又說“老友鬼鬼，我叫佢星仔，叫星爺反而唔習慣”，又笑言回味拍劇時捱餓，搞到胃痛，收工後，星仔陪她入院並送她返家的往事。問到當時是否被周星馳力追，她又說：“佢好好人，佢好Nice，對個個都好嘅……而且，當年套套劇都係女主角，朝朝開工都六點半，瞓都冇得瞓，食飯都無時間，點會有時間拍拖！”    只要沾到星爺的戲都會紅！書展上，出版育兒書的前輩港姐，面對一大班圍觀者，一講周星馳，就立地生根了。“當年，我在TVB好忙，一夜之間，決定去美國，走得咁急，旁人以為我‘有咗’，清者自清，當年冇回應，因大學突然通知。現在特此澄清。”    知星爺者，王晶也，大爆過氣老友的錢銀女人，太敏感不能盡錄……如果朋友是用來出賣的，好戲仍在後頭。    （王晶解剖星爺 · 三之三）    高梁,http://www.macaodaily.com/html/2024-08/07/content_1773036.htm,”故地重遊，開場白先與周星馳扯上“親密關係”，又說“老友鬼鬼，我叫佢星仔，叫星爺反而唔習慣”，又笑言回味拍劇時捱餓，搞到胃痛，收工後，星仔陪她入院並送她返家的往事,星女郎 逐個數         “ 你現 在 個 女朋友 係 邊個 ？ ” 當年 老友 鬼鬼 的 王晶問 周星馳 ， “ 梗 係 阿娟 啦 ！ ” 兩個 大 男人 坦言 拍拖 情況 ， 該 是 兄弟 層次 了 ， 而且 王晶 一直 目擊 周星 馳 的 情海 翻波 … …         周星馳 與羅慧娟 ， 因 合作 《 蓋世豪俠 》 撻 着 ， 地下 情 三年 ， 圈內 人 早 知道 了 ， 稱羅慧娟 為 “ 星妹 ” ！ 她 亦 會 甜 笑 回應 ， 本以 為 此情 會 一帆 風順 … …         朋友 透露 ， 羅 慧娟 很 純情 ， 自言 嚮 往 婚姻 生仔 組織 家庭 。 言 之 鑿 鑿 阿娟 曾 經主動 向 周星馳 求婚 ， 卻 換來 對方 一句 ： “ 你 神經病 ？ ” 我本 一片 芳心 向 明月 ， 無奈 明月 似的 星星 向 了 溝渠 … … 娟 妹離 開傷 心地 ， 異地 他 鄉 找到 了 歸宿 ， 至死 沒有 返 香港 。         據 知情人 目擊 ， 因周星 馳戀 上 了 朱茵 ， 才 與羅慧娟 分手 的 。 王晶 透露 ， 周星馳 初見 朱茵 的 情景 ： “ 當時 ， 我 同陳嘉上 都 見 到 ， 周星 馳見 到 朱茵 ， 隻 眼 好似 跌 咗 出來 咁 滯 ， 睇 到 佢 實 㗎 ， 睇 住 佢 對 朱 茵 出手 … … ！ ” 後 來 傳聞 因 莫文蔚 介入 ， 周星 馳 才 與 朱茵 分手 。 周星 馳作 為 偶像 ， 非常 自我 珍惜 ， 每部 戲都 與 女主角 有 緋聞 ， 支支吾吾 疑幻疑 眞 ， 最 後 不了了之 ， 只 留下 星女郎 閒話 。 獨是 有 一位 香港 小姐 ， 承認 與 周星馳 拍過 拖 。 王晶 “ 笑傲江湖 ” 網站 開張 之際 ， 書展 有 個 座 談會 — — 三十五年 前 的 港姐 季 軍 — — 林 疑 嫺 ， 著書 立 説 ， 講育兒 心得 … … 講美國 的 奮鬥史 … …         “ 我 同星 仔識 於 微時 … … ” 故地 重遊 ， 開場 白先 與 周星 馳 扯 上 “ 親密關 係 ” ， 又 說 “ 老友 鬼鬼 ， 我 叫 佢 星 仔 ， 叫星爺 反而 唔 習慣 ” ， 又 笑 言 回味 拍劇 時 捱 餓 ， 搞 到 胃痛 ， 收工 後 ， 星仔 陪 她 入院 並送 她 返家 的 往事 。 問到 當時 是否 被 周星 馳力 追 ， 她 又 說 ： “ 佢 好好 人 ， 佢 好 Nice ， 對個 個 都 好 嘅 … … 而且 ， 當年 套套 劇都 係 女主角 ， 朝朝 開工 都 六點 半 ， 瞓 都 冇 得 瞓 ， 食飯 都 無 時間 ， 點會 有 時間 拍拖 ！ ”         只要 沾到 星爺 的 戲都會紅 ！ 書展 上 ， 出版 育兒 書 的 前輩 港姐 ， 面對 一大 班圍 觀者 ， 一講 周星馳 ， 就 立地 生根 了 。 “ 當年 ， 我 在 TVB 好忙 ， 一夜 之間 ， 決定 去 美國 ， 走 得 咁 急 ， 旁人 以為 我 ‘ 有 咗 ’ ， 清者自清 ， 當年 冇 回應 ， 因大學 突然 通知 。 現在 特此 澄清 。 ”         知星 爺者 ， 王晶 也 ， 大爆 過氣 老友 的 錢 銀 女人 ， 太 敏感 不能 盡錄 … … 如果 朋友 是 用 來 出 賣 的 ， 好戲 仍 在後頭 。         （ 王晶 解剖 星爺   ·   三 之三 ）         高梁,2024-08-07
憶五台山台長   娛翁,憶五台山台長    葛民輝等兩位兩位軟硬天師，上周六舉行了只此一場《拉闊音樂會 軟硬廣播道3號FANS殺人事件》，宣傳海報上的葛民輝與拍檔相當年輕，但這並不是以AI改圖的虛構圖，而是三十年前的照片，海報的出現更引起當日邀約兩人拍攝的記者在社交平台分享回憶。    該前記者憶述當時正是一九九三年尾，按上司指示邀約軟硬拍攝一九九四年第一期雜誌封面，望兩人分別手執九三及九四字樣的紙板，以示從九三年踏入九四年。    當軟硬到場後，不知是因不和還是為了搞鬼，總是一個企街頭一個企街尾，當記者再三要求兩人站在一起拍攝時，結果企街頭的去了街尾、企街尾的去了街頭。    正當束手無策之際，終有救星出現，正正就是當年先後擁有五台山台長、四台山台長或廣播道台長稱號的人剛巧路過，記者靈機一觸邀請台長跟軟硬合照，結果軟硬終乖乖地並排站立，該記者亦成功交差。    關於台長，現今的年輕人、新一代的藝人都未必認識，甚少知道他的存在。但無可否認的是，台長確實是當年的奇人，他雖然被稱為台長，但並不屬於任何一家電台或電視台。之所以用台長作稱呼，只因他長期在廣播道露宿“打躉”。在廣播道最鼎盛的歲月，曾有TVB、亞視、佳視、港台及商台共存，是以才有五台山的稱號，正如藍潔瑛的外號靚絕五台山一樣。    只不過台長應該是位輕度智障人士，他每日不時會出現在不同的電台或電視台門口，總是幫忙看位泊車，又會代為入咪錶（停車收費錶），藉此換取打賞。有傳當年的藝人明星是否走紅，台長就是一個指標，只要台長能說得出此藝人名字，就代表該藝人已經走紅，但要是台長說不出名字，便代表該藝人仍需努力。    而當日葛民輝與拍檔因台長的出現變得合作，足以說明台長確具有不一樣的影響力。    娛翁,http://www.macaodaily.com/html/2024-08/07/content_1773037.htm,憶五台山台長    葛民輝等兩位兩位軟硬天師，上周六舉行了只此一場《拉闊音樂會 軟硬廣播道3號FANS殺人事件》，宣傳海報上的葛民輝與拍檔相當年輕，但這並不是以AI改圖的虛構圖，而是三十年前的照片，海報的出現更引起當日邀約兩人拍攝的記者在社交平台分享回憶,憶 五台山 台長         葛民輝 等 兩位 兩位 軟硬 天師 ， 上 周六 舉行 了 只 此 一場 《 拉闊 音樂會   軟硬 廣播 道 3 號 FANS 殺人 事件 》 ， 宣傳海報 上 的 葛民輝 與 拍 檔 相當 年 輕 ， 但 這並 不是 以 AI 改圖 的 虛構 圖 ， 而是 三十年 前 的 照片 ， 海報 的 出現 更 引起 當日 邀約 兩人 拍 攝 的 記者 在 社交 平台 分享 回憶 。         該前 記者 憶述 當時 正是 一九九三年 尾 ， 按 上司 指示 邀約 軟 硬 拍 攝 一九九四年 第一期 雜誌 封面 ， 望 兩人 分別 手執 九三 及 九四 字樣 的 紙板 ， 以示 從 九三年 踏入 九四年 。         當軟 硬 到場 後 ， 不知 是 因 不 和 還是 為 了 搞鬼 ， 總是 一個 企街頭 一個 企街 尾 ， 當記者 再三 要求 兩人 站 在 一起 拍 攝時 ， 結果 企街頭 的 去 了 街尾 、 企街 尾 的 去 了 街頭 。         正當 束手 無策 之際 ， 終有 救星 出現 ， 正 正 就是 當年 先後擁 有 五台山 台長 、 四 台山 台長 或 廣播 道 台長 稱號 的 人 剛巧路過 ， 記者 靈機 一觸 邀請 台長 跟 軟 硬 合照 ， 結果 軟硬終 乖乖 地 並排 站立 ， 該 記者 亦 成功 交差 。         關於台 長 ， 現今 的 年 輕人 、 新一代 的 藝人 都 未必 認識 ， 甚 少 知道 他 的 存在 。 但 無 可否 認 的 是 ， 台長 確實 是 當年 的 奇人 ， 他 雖然 被 稱 為 台長 ， 但 並不屬 於 任何 一家 電台 或 電視台 。 之所以 用 台長 作稱 呼 ， 只 因 他 長 期 在 廣播 道 露宿 “ 打 躉 ” 。 在 廣播 道 最 鼎盛 的 歲 月 ， 曾 有 TVB 、 亞視 、 佳視 、 港台 及 商台 共存 ， 是 以 才 有 五台山 的 稱號 ， 正如 藍潔瑛 的 外號 靚絕 五台山 一樣 。         只不過 台長 應該 是 位輕度 智障 人士 ， 他 每日 不時會 出現 在 不同 的 電台 或 電視 台門口 ， 總是 幫忙 看位 泊車 ， 又 會代為 入 咪 錶 （ 停車 收費 錶 ） ， 藉此 換取 打賞 。 有 傳當 年 的 藝人 明星 是否 走紅 ， 台長 就是 一個 指標 ， 只要 台長 能 說 得出 此藝人 名字 ， 就 代表 該藝人 已經 走紅 ， 但 要是 台長 說 不出 名字 ， 便 代表 該藝人 仍 需 努力 。         而 當日 葛民輝 與 拍 檔 因台長 的 出現 變得 合作 ， 足以 說明 台長確 具有 不一樣 的 影響力 。         娛翁,2024-08-07
《森中甜夢》親近大自然    文：花生仔,為寶寶提供戲劇初體驗    《森中甜夢》親近大自然    澳門國際兒童藝術節節目之一、由本澳製作人陳詩琪及本澳編舞家伍淑華共同創作的嬰兒劇場《森中甜夢》，於今日起至本月十一日假澳門文化中心黑盒一舉行。創作人透過以“森林”為主題的感官劇場，為四至十五個月的寶寶帶來獨一無二的戲劇初體驗。    嬰兒劇場《森中甜夢》去年於澳門文化中心首演，取得不俗成績，今年於首屆澳門國際兒童藝術節上再度呈獻。對此，陳詩琪與伍淑華表示：“這不僅是對我們創作團隊的肯定，也是對本地劇場作品的認可，期待與觀眾見面時能有更多的火花。”    陳詩琪說：“每次參與嬰兒劇場的創作及製作，都希望藉表演藝術之美，滋養小寶寶成長。澳門小朋友較少機會接觸到森林及感受大自然，於是我們就萌生了以‘森林’為主題的構思，希望透過劇場的夢幻魔法，讓小朋友能感受森林裡綻放的生命百態。”    談到對推動嬰兒劇場的想法，陳詩琪稱，“本澳家庭對嬰兒劇場有一定需求，每次相關節目一開售，總是一票難求。卻礙於場地、資源等不同因素，限制了嬰兒劇場的發展。如能持續地為嬰幼兒提供享受表演藝術的機會，可讓小朋友在不同成長階段更好參與藝術活動，亦有助促進親子關係。”    伍淑華表示：“《森中甜夢》是一個專為嬰幼兒設計，傾向於無語言、純粹着重於感官刺激的劇場。在劇場中，嬰幼兒可在我們設計好的空間安全及任意地遊走，探索自身感興趣的事物，以及享受獨特的親子時光。”此外，她亦鼓勵家長嘗試放手，讓孩子在劇場中自由探索，並透過觀察、支持、陪伴、鼓勵去建立一套新的親子相處模式。    文：花生仔,http://www.macaodaily.com/html/2024-08/07/content_1773033.htm,為寶寶提供戲劇初體驗    《森中甜夢》親近大自然    澳門國際兒童藝術節節目之一、由本澳製作人陳詩琪及本澳編舞家伍淑華共同創作的嬰兒劇場《森中甜夢》，於今日起至本月十一日假澳門文化中心黑盒一舉行,為 寶寶 提供 戲劇 初體驗         《 森中 甜 夢 》 親近 大自然         澳門 國際兒 童藝術節 節目 之一 、 由本 澳 製 作 人 陳 詩 琪 及 本 澳 編 舞 家 伍 淑 華 共同 創作 的 嬰兒 劇場 《 森中 甜 夢 》 ， 於 今日 起 至 本月 十一日 假澳門 文化 中心 黑盒 一舉行 。 創作 人 透過 以 “ 森林 ” 為主題 的 感官 劇場 ， 為 四至 十五 個 月 的 寶寶帶 來 獨一無二 的 戲劇 初體驗 。         嬰兒 劇場 《 森中 甜 夢 》 去年 於 澳門 文化 中心 首演 ， 取得 不俗 成績 ， 今年 於 首屆 澳門 國際兒 童藝術 節上 再度 呈獻 。 對此 ， 陳 詩琪 與 伍淑華 表示 ： “ 這不僅 是 對 我們 創作 團隊 的 肯定 ， 也 是 對 本地 劇場 作品 的 認可 ， 期待 與 觀眾 見 面時 能 有 更 多 的 火花 。 ”         陳 詩琪 說 ： “ 每次 參與 嬰兒 劇場 的 創作 及 製 作 ， 都 希望 藉 表演 藝術 之美 ， 滋養 小寶寶成長 。 澳門 小朋友 較少 機會 接觸 到 森林 及 感受 大自然 ， 於 是 我們 就 萌生 了 以 ‘ 森林 ’ 為主題 的 構思 ， 希望 透過 劇場 的 夢幻 魔法 ， 讓 小朋友 能 感受 森林 裡綻 放 的 生命 百態 。 ”         談到 對 推動 嬰兒 劇場 的 想法 ， 陳 詩琪 稱 ， “ 本澳 家庭 對 嬰兒 劇場 有 一定 需求 ， 每次 相關 節目 一開售 ， 總是 一票 難求 。 卻礙 於 場地 、 資源 等 不同 因素 ， 限制 了 嬰兒 劇場 的 發展 。 如能 持續 地為 嬰幼兒 提供 享受 表演 藝術 的 機會 ， 可 讓 小朋友 在 不同 成長 階段 更好 參與 藝術 活動 ， 亦 有助 促進 親子關 係 。 ”         伍淑華 表示 ： “ 《 森中 甜 夢 》 是 一個 專為 嬰幼兒 設計 ， 傾向 於 無 語言 、 純粹 着重 於 感官 刺激 的 劇場 。 在 劇場 中 ， 嬰幼兒 可 在 我們 設計 好 的 空間 安全 及 任意 地遊 走 ， 探索 自身 感興趣 的 事物 ， 以及 享受 獨特 的 親子 時光 。 ” 此外 ， 她 亦 鼓勵 家長 嘗試 放手 ， 讓 孩子 在 劇場 中 自由 探索 ， 並透過 觀察 、 支持 、 陪伴 、 鼓勵 去 建立 一套 新 的 親子 相處 模式 。         文 ： 花生 仔,2024-08-07
