Title,Content,Link,Summary,Preprocessed_Content,Date
黎瑞恩與眾藝人送溫暖,黎瑞恩與眾藝人送溫暖    香港藝人高爾夫協會日前拉隊到梨木樹邨參與“同心為公益端午節愛心禮包贈長者”活動，向長者們派發端午糭及福袋，並上門探訪獨居長者送溫暖。有藝人黎瑞恩、譚玉瑛、區永權、李思雅、關曜儁、黃穎君，而黎諾懿更帶同仔仔小春雞、鄭希怡亦與老公帶同女兒梁浸浸齊行善，將愛心傳承。    眾藝人派糭之餘，亦跟老友記們聊天問好。小恩子黎瑞恩則充當領隊，安排大家到不同單位派糭，十分落力。譚玉瑛亦被長者們大讚靚女，笑逐顏開。當見到區永權時，一班公公婆婆又鬼馬笑言要“報東張”。關耀儁更化身保安隊長，安排公公婆婆們排隊取禮物包，又參扶他們出入。小春雞雖然年紀小，但亦主動跟長者們問好，祝大家端午節快樂。諾懿大受長者們歡迎，爭相合照，又叫他做廚神。身為廚神的黎諾懿，親身教小春雞包糭，場面温馨。鄭希怡一家三口平時較少全家亮相，轉眼間已九歲的梁浸浸變得害羞，拍照時以水樽遮面，一副少女心事的樣子。,http://www.macaodaily.com/html/2024-06/12/content_1761271.htm,黎瑞恩與眾藝人送溫暖    香港藝人高爾夫協會日前拉隊到梨木樹邨參與“同心為公益端午節愛心禮包贈長者”活動，向長者們派發端午糭及福袋，並上門探訪獨居長者送溫暖,黎瑞恩 與 眾藝人 送 溫暖         香港 藝人 高爾夫 協會 日前 拉隊 到 梨木 樹 邨 參 與 “ 同心 為 公益 端午 節愛心 禮包 贈長 者 ” 活動 ， 向長 者 們 派 發 端午 糭 及 福 袋 ， 並上門 探訪 獨居長 者 送 溫暖 。 有藝人 黎瑞恩 、 譚玉瑛 、 區永權 、 李思雅 、 關曜 儁 、 黃 穎 君 ， 而黎諾懿 更 帶同 仔仔 小春 雞 、 鄭希怡 亦 與 老公 帶同 女兒 梁浸 浸齊 行善 ， 將愛心 傳承 。         眾藝人 派 糭 之 餘 ， 亦 跟 老友 記們 聊天 問好 。 小恩子 黎瑞恩 則充 當領隊 ， 安排 大家 到 不同 單位 派 糭 ， 十分 落力 。 譚玉瑛 亦 被 長 者 們 大 讚 靚 女 ， 笑 逐顏開 。 當見 到 區永權 時 ， 一班 公公 婆婆 又 鬼 馬 笑言要 “ 報東張 ” 。 關耀 儁 更 化身 保安 隊長 ， 安排 公公 婆婆 們 排隊 取禮物 包 ， 又 參扶 他們 出入 。 小春 雞 雖然 年紀 小 ， 但 亦 主動 跟 長 者 們 問好 ， 祝 大家 端午 節快 樂 。 諾懿大 受長 者 們 歡迎 ， 爭 相合 照 ， 又 叫 他 做 廚神 。 身為 廚神 的 黎諾懿 ， 親 身教 小春 雞 包 糭 ， 場面 温馨 。 鄭希怡 一家 三口 平時 較 少 全家 亮相 ， 轉眼間 已九歲 的 梁浸 浸變 得 害羞 ， 拍照 時以 水 樽 遮面 ， 一副 少女 心事 的 樣子 。,2024-06-12
張靜汶台北開唱兼拜月老,自彈自唱宣傳專輯    張靜汶台北開唱兼拜月老    馬來西亞歌手張靜汶(Jasmine)日前在台北開唱，以專輯同名主打《王美的一天》開場，接連帶來專輯中的多首好歌，以一把結他自彈自唱，襯托乾淨甜美的嗓音。這是她在台灣的第一次個人專場演出，專輯製作團隊特地從大馬來台支持。    張靜汶在去年底發行自己的首張專輯《王美的一天 One Fine Day》，以網絡虛擬世界為主題，每一首歌彷彿象徵着每一天所經歷的事情，透過“王美”這位虛擬人物的視角，體驗看似美好卻虛華的日常。    張靜汶這次為了宣傳專輯來了台灣快一個月，她坦承已經開始想家。之前每次來台灣都很努力早起，出門到處逛，就算晚上也捨不得回飯店，總是喜歡在路上看街頭藝人演出到最後一刻，“我現在感覺自己已經是半個台北人，最大的改變就是整天都懶得出門。”    她透露每次來台灣都會去拜月老，希望月老在一年內能幫她找到對象。上次來台灣的時候跟朋友一起去了大稻埕霞海城隍廟，朋友許願在一個月內得到好姻緣，沒想到還真的在期限最後一天願望成真。    張靜汶笑說：“我之前覺得朋友這樣對月老施壓很不應該，但這次我去了龍山寺，就跟月老說了半年內，一起來對月老施壓！”    張靜汶演出日期正好在端午節的前一天，歌迷特地送上特色的客家肉粽讓她品嘗，讓身為客家人的她非常開心。    她感謝歌迷陪伴在異鄉度過端午節，更預告周六將在北海岸演出，作為此次台灣宣傳行的完美句點。,http://www.macaodaily.com/html/2024-06/12/content_1761260.htm,之前每次來台灣都很努力早起，出門到處逛，就算晚上也捨不得回飯店，總是喜歡在路上看街頭藝人演出到最後一刻，“我現在感覺自己已經是半個台北人，最大的改變就是整天都懶得出門,自彈 自唱 宣傳 專輯         張靜汶 台北 開唱 兼 拜 月 老         馬 來 西亞 歌手 張靜汶 ( Jasmine ) 日前 在 台北 開唱 ， 以 專輯 同名 主打 《 王 美的 一天 》 開場 ， 接連帶 來 專輯 中 的 多首 好歌 ， 以 一把 結他 自彈 自唱 ， 襯托 乾淨 甜美 的 嗓音 。 這是 她 在 台灣 的 第一次 個 人 專場 演出 ， 專 輯 製 作 團 隊 特地 從大馬來 台 支持 。         張靜汶 在 去年底 發行 自己 的 首張 專輯 《 王 美的 一天   One   Fine   Day 》 ， 以 網絡 虛擬 世界 為主題 ， 每 一首歌 彷 彿 象徵着 每 一天 所經歷 的 事情 ， 透過 “ 王美 ” 這位 虛擬 人物 的 視角 ， 體驗 看似 美好 卻 虛華 的 日常 。         張靜汶 這次 為 了 宣傳 專輯 來 了 台灣快 一個 月 ， 她 坦承 已經 開始 想家 。 之前 每次 來 台灣 都 很 努力 早起 ， 出門 到 處 逛 ， 就算 晚上 也 捨 不得 回飯 店 ， 總是 喜歡 在 路上 看街頭 藝人 演出 到 最 後 一刻 ， “ 我現 在 感覺 自己 已經 是 半個 台北人 ， 最大 的 改變 就是 整天 都 懶 得出 門 。 ”         她 透露 每次 來 台灣 都 會 去 拜 月 老 ， 希望 月 老 在 一年 內能 幫 她 找到 對象 。 上次 來 台灣 的 時候 跟 朋友 一起 去 了 大稻 埕 霞海 城隍 廟 ， 朋友 許願 在 一個 月 內 得到 好姻 緣 ， 沒 想到 還 真的 在 期限 最 後 一天 願望 成真 。         張靜汶笑 說 ： “ 我 之前 覺得 朋友 這樣 對 月 老施壓 很 不 應該 ， 但 這次 我 去 了 龍 山寺 ， 就 跟 月 老 說 了 半年 內 ， 一起 來 對 月 老施壓 ！ ”         張靜汶 演出 日期 正好 在 端午 節的 前一天 ， 歌迷 特地 送上 特色 的 客家 肉 粽 讓 她 品嘗 ， 讓 身為 客家人 的 她 非常 開心 。         她 感謝 歌迷 陪伴 在 異 鄉度過 端午 節 ， 更 預告 周六 將在 北海岸 演出 ， 作為 此次 台灣 宣傳行 的 完美 句點 。,2024-06-12
劉亦菲新劇惡評反創高收視,劉亦菲新劇惡評反創高收視    由劉亦菲領銜主演的都市情感劇《玫瑰的故事》正在各大平台熱播，成為多個內地影視評論網站收視統計榜首，更成為騰訊年度都市劇集第一位，大受歡迎。這部劇以獨特的視角展現了都市女性的生活百態，劉亦菲飾演的女主角更是圈粉無數。    然而，就在該劇人氣不斷攀升之際，某知名評分網站上卻出現了大量惡意差評，試圖通過刷低分來影響劇集口碑。    但該劇集卻絲毫未受影響，口碑反而愈發高漲，出現了“逆跌”的趨勢，全網熱度牢牢地穩居第一。    近日，韓國MOA平台宣佈《玫瑰的故事》將於本月播出，不少韓國網友都紛紛表示非常期待。,http://www.macaodaily.com/html/2024-06/12/content_1761262.htm,劉亦菲新劇惡評反創高收視    由劉亦菲領銜主演的都市情感劇《玫瑰的故事》正在各大平台熱播，成為多個內地影視評論網站收視統計榜首，更成為騰訊年度都市劇集第一位，大受歡迎,劉亦菲 新劇 惡評 反 創高 收視         由 劉亦菲 領銜 主演 的 都市 情感 劇 《 玫瑰 的 故事 》 正在 各大 平台 熱播 ， 成為 多個 內地 影視 評論 網站 收視 統計 榜首 ， 更成 為 騰訊 年度 都市 劇集 第一位 ， 大受 歡迎 。 這部 劇以 獨特 的 視角 展現 了 都市女性 的 生活 百態 ， 劉亦菲飾 演 的 女主角 更是 圈粉 無數 。         然而 ， 就 在 該 劇人氣 不斷 攀升 之際 ， 某 知名 評分網 站上 卻 出現 了 大量 惡意 差評 ， 試圖 通過 刷 低分 來 影響 劇集 口碑 。         但 該 劇集 卻 絲 毫未受 影響 ， 口碑 反而 愈發 高漲 ， 出現 了 “ 逆跌 ” 的 趨勢 ， 全網 熱度 牢牢地 穩居 第一 。         近日 ， 韓國 MOA 平台 宣 佈 《 玫瑰 的 故事 》 將於 本月 播出 ， 不少 韓國 網友 都 紛紛 表示 非常 期待 。,2024-06-12
田曦薇新劇演女警,田曦薇新劇演女警    田曦薇主演的劇集《低智商犯罪》近日開機，她在劇中飾演一名女警，首次搭檔王驍，也是她首次出演懸疑題材。該劇改編自紫金陳的同名小說，小說中在一城市的角落，兩個愚蠢的盜賊為了江湖地位，要做一樁揚名立萬的大案；名利場中，一群老謀深算的大人物各懷鬼胎，展開了不可告人的交鋒；公安局裡，一個運氣超好的警官臨危受命，開始了秘密調查。一場啼笑皆非的誤會讓他們交織在了一起，展開了燒腦而又滑稽的爭鬥。    田曦薇最近新戲連連。她搭擋男星許凱的古裝劇作品《子夜歸》上月剛殺青，待播劇集還有《半熟男女》、《大奉打更人》、《子夜歸》，待播綜藝還有《忙忙碌碌尋寶藏》等。,http://www.macaodaily.com/html/2024-06/12/content_1761263.htm,田曦薇新劇演女警    田曦薇主演的劇集《低智商犯罪》近日開機，她在劇中飾演一名女警，首次搭檔王驍，也是她首次出演懸疑題材,田曦 薇 新 劇演 女警         田曦 薇 主演 的 劇集 《 低 智商 犯罪 》 近日 開機 ， 她 在 劇中飾 演 一名 女警 ， 首次 搭檔 王驍 ， 也 是 她 首次 出演 懸疑 題材 。 該劇 改編 自 紫金 陳 的 同名 小說 ， 小說 中 在 一 城市 的 角落 ， 兩個 愚蠢 的 盜 賊 為 了 江湖 地位 ， 要 做 一樁 揚名立 萬 的 大案 ； 名利 場中 ， 一群 老謀 深算 的 大人物 各懷 鬼胎 ， 展開 了 不可告人 的 交鋒 ； 公安局 裡 ， 一個 運氣 超好 的 警官 臨危 受命 ， 開始 了 秘密 調查 。 一場 啼笑皆非 的 誤會 讓 他們 交織 在 了 一起 ， 展開 了 燒腦 而 又 滑稽 的 爭鬥 。         田曦 薇 最近 新戲 連連 。 她 搭 擋 男星 許凱 的 古裝劇 作品 《 子夜 歸 》 上 月 剛殺 青 ， 待播 劇集 還有 《 半熟 男女 》 、 《 大奉 打更 人 》 、 《 子夜 歸 》 ， 待播 綜藝 還有 《 忙忙碌碌 尋寶藏 》 等 。,2024-06-12
謝金燕嘆缺父愛冇童年,謝金燕嘆缺父愛冇童年    台灣女藝人謝金燕參加內地綜藝《乘風2024》（浪姐5），目前已經闖入節目總決賽。謝金燕近日在節目中當聽到其他來賓稱讚她有童心時，突然感慨說：“我是沒有童年的傢伙。”同場陳昊宇一聽顯得十分不捨，趕緊打圓場表示：“姐姐你不要這樣講，講得我突然有一點心酸。”萬妮達則試圖轉移話題，談起自己童年時的補習生活，“我的童年一直在補習，也不知道補到哪裡去。”    事實上，謝金燕與父親豬哥亮的關係曾長達十八年時間處於疏遠狀態，直到二○一六年在小巨蛋演唱會上，她公開家庭內的矛盾，讓豬哥亮感到非常心寒表示：“女兒好毒喔。”然而，當豬哥亮因大腸癌病重時，父女關係終於得到和解，謝金燕在父親的病榻前重修舊好，她形容那段時光：“每天我們互相道愛、道歉、道謝、道晚安。”,http://www.macaodaily.com/html/2024-06/12/content_1761265.htm,”    事實上，謝金燕與父親豬哥亮的關係曾長達十八年時間處於疏遠狀態，直到二○一六年在小巨蛋演唱會上，她公開家庭內的矛盾，讓豬哥亮感到非常心寒表示：“女兒好毒喔,謝金燕嘆 缺父 愛 冇 童年         台灣 女藝人 謝金燕 參加 內地 綜藝 《 乘風 2024 》 （ 浪姐 5 ） ， 目前 已經 闖入 節目 總 決賽 。 謝金燕 近日 在 節目 中當 聽 到 其他 來賓 稱 讚 她 有 童心 時 ， 突然 感慨 說 ： “ 我 是 沒 有 童年 的 傢 伙 。 ” 同場陳昊宇 一 聽 顯得 十分 不 捨 ， 趕緊 打圓場 表示 ： “ 姐姐 你 不要 這樣講 ， 講得 我 突然 有 一點 心酸 。 ” 萬妮 達則 試圖 轉移 話題 ， 談起 自己 童年 時 的 補習 生活 ， “ 我 的 童年 一直 在 補習 ， 也 不 知道 補到 哪裡 去 。 ”         事實 上 ， 謝金燕 與 父親 豬哥亮 的關 係 曾長 達 十八年 時間 處 於 疏遠 狀態 ， 直到 二 ○ 一 六年 在 小 巨蛋 演唱 會上 ， 她 公開 家庭 內 的 矛盾 ， 讓 豬哥亮 感到 非常 心寒 表示 ： “ 女兒 好 毒 喔 。 ” 然而 ， 當豬 哥亮 因大腸癌 病重 時 ， 父女 關 係 終於 得到 和解 ， 謝金燕 在 父親 的 病榻 前 重修 舊好 ， 她 形容 那段 時光 ： “ 每天 我們 互相 道 愛 、 道歉 、 道謝 、 道 晚安 。 ”,2024-06-12
張學友周四抵台再唱三場,張學友周四抵台再唱三場    張學友因感染呼吸道融合病毒(RSV)，本月七至九日原定三場台北小巨蛋演唱會宣佈延期至明年，主辦單位開放觀眾退票，也公佈張學友將於二○二五年返場，提醒歌迷可以保留票券。關於有傳張學友將於明年三、四月重返台北小巨蛋開唱，主辦單位表示：“確定明年三月在台北小巨蛋舉辦安可場，會把上周停辦的三場補完，再進行安哥場。”至於延期三場的退票數僅七十八張。    另外也重申本周演出（十四至十六日）目前一切正常，“沒有接獲停辦的通知”。     據報道張學友將會在周四抵達台灣，依照慣例會在演出前一天彩排，目前他的身體狀況有逐漸好轉。,http://www.macaodaily.com/html/2024-06/12/content_1761267.htm,張學友周四抵台再唱三場    張學友因感染呼吸道融合病毒(RSV)，本月七至九日原定三場台北小巨蛋演唱會宣佈延期至明年，主辦單位開放觀眾退票，也公佈張學友將於二○二五年返場，提醒歌迷可以保留票券,張學友 周四 抵台 再 唱 三場         張學友 因 感染 呼吸道 融合 病毒 ( RSV ) ， 本月 七至 九日 原定 三場 台北 小 巨蛋 演唱 會 宣 佈 延期 至 明年 ， 主辦 單位 開放 觀眾 退票 ， 也 公 佈 張學友將 於 二 ○ 二 五年 返場 ， 提醒 歌迷 可以 保留 票券 。 關於有 傳張 學友將 於 明年 三 、 四月 重返 台北 小 巨蛋 開唱 ， 主辦 單位 表示 ： “ 確定 明年 三月 在 台北 小 巨蛋 舉辦 安可場 ， 會 把 上周 停辦 的 三場 補 完 ， 再 進行 安哥 場 。 ” 至於 延期 三場 的 退票 數僅 七十八 張 。         另外 也 重申 本周 演出 （ 十四 至 十六日 ） 目前 一切正常 ， “ 沒有 接獲 停辦 的 通知 ” 。           據 報道 張學友 將會 在 周四 抵達 台灣 ， 依照 慣例 會 在 演出 前一天 彩排 ， 目前 他 的 身體 狀況 有 逐漸 好轉 。,2024-06-12
重建城寨原汁原味？    高梁,重建城寨原汁原味？    《九龍城寨之圍城》，票房一億，平了《飯氣攻心》紀錄，極可能，爬頭升上有史以來最高票房紀錄。因為仍在興頭上，宣佈拍攝《前傳》、《後傳》，並計劃保存佈景吸引遊客。一片收得，刺激經濟藝術大豐收了……奇謀妙算？還是妙想天開？歷史是一面鏡子——李小龍升天，即有六位眞名叫“小龍”的功夫演員湧現；《少林足球》狂收，《太極足球》、《少林乒乓》，《娥眉籃球》的拍片計劃精彩紛呈。查實我們粵劇界最善於繼承和開創。紅伶之後，實實在在出現再世紅伶：新馬師曾、新薛覺先、新廖俠懷、新紅線女、新芳艷芬……還有新羅劍郎，都名重一時。江山代有才人出，各領風騒五百年。任劍輝、白雪仙、李寶瑩、陳笑風、羅家寶、陳小茶……林家聲、龍貫天、蓋鳴暉、曾小慧等等，都自成一家，不僅固守傳統藝術，且更“取其精華，棄其糟粕”，將粵劇推陳出新！《九龍城寨》越搞越大件事了，有關當局見獵心喜，硏究在“砦城公園（原石碑字樣）”重建一座城寨，點只電影佈景咁簡單，揚言要原汁原味，雄才偉略之至，卻迎來一聲：大鑊！    《城》片影評，讚好不輟，個別自我不良好感覺的：影片失敗之處——由頭到尾不見老鼠橫行，也不見周街周巷“污糟邋遢，烏烟瘴氣”，也拍不出味道……“未到城寨，已聞惡臭攻鼻。”香港娛樂圈老行尊，陳欣健，退休多年，請出來話說當年：他曾任“香港皇家警察”的偵緝警司，入行已是幫辦，第一個駐地，就是九龍城寨。“三不管地帶，盛傳警察也不能進去，錯的。我第一天上任，帶着兩名警員進城，好難頂，陣陣惡臭，污水滿地橫流，周圍污糟邋遢……”“菲臘陳”大笑起來，“當時，有兩三個妓女圍着我，‘呢個幫辦仔都幾靚仔，幫襯下啦，一鷄三味’。這些妓女已經五、六十歲了，唉……人世間……”“原來，城寨的妓女，與警察好熟的。那時，為了社區健康，定期派出醫療隊入城打針，鷄飛狗走，就要逐個捉來強行打針，需要警隊協助；許多時在溝渠邊發現道友屍體，警員到場立案才搬走；我們巡更不走地下，走四樓的天台四通八達。”陳欣建如今説來猶搖頭三嘆。若原汁原味重現城寨，遊客會以為誤飛“臭港”？    高梁,http://www.macaodaily.com/html/2024-06/12/content_1761269.htm,《九龍城寨》越搞越大件事了，有關當局見獵心喜，硏究在“砦城公園（原石碑字樣）”重建一座城寨，點只電影佈景咁簡單，揚言要原汁原味，雄才偉略之至，卻迎來一聲：大鑊,重建 城寨 原汁原味 ？         《 九龍 城寨 之圍 城 》 ， 票房 一億 ， 平了 《 飯氣 攻心 》 紀錄 ， 極 可能 ， 爬頭 升上 有史 以來 最高 票房 紀錄 。 因為 仍 在 興頭 上 ， 宣 佈 拍 攝 《 前傳 》 、 《 後 傳 》 ， 並計劃 保存 佈 景 吸引 遊客 。 一片 收 得 ， 刺激 經濟 藝術 大 豐收 了 … … 奇謀 妙算 ？ 還是 妙 想 天開 ？ 歷史 是 一面 鏡子 — — 李小龍 升天 ， 即 有 六位 眞 名叫 “ 小龍 ” 的 功夫 演員 湧現 ； 《 少林足球 》 狂收 ， 《 太極 足球 》 、 《 少林 乒乓 》 ， 《 娥眉 籃球 》 的 拍片 計劃 精彩 紛呈 。 查實 我們 粵劇界 最善 於 繼承 和 開創 。 紅伶 之 後 ， 實實 在 在 出現 再世 紅伶 ： 新馬師 曾 、 新 薛覺 先 、 新 廖俠 懷 、 新紅線 女 、 新芳艷芬 … … 還有 新羅劍郎 ， 都 名重 一時 。 江山 代有 才 人出 ， 各領 風 騒 五百年 。 任劍輝 、 白雪 仙 、 李寶瑩 、 陳 笑 風 、 羅 家 寶 、 陳 小 茶 … … 林家 聲 、 龍貫天 、 蓋鳴暉 、 曾小慧 等等 ， 都 自成一家 ， 不僅 固守 傳統 藝術 ， 且 更 “ 取其 精華 ， 棄其 糟粕 ” ， 將粵劇 推 陳 出新 ！ 《 九龍 城寨 》 越 搞 越 大件 事 了 ， 有關 當局 見 獵心 喜 ， 硏 究 在 “ 砦 城公園 （ 原 石碑 字樣 ） ” 重建 一座 城寨 ， 點只 電影 佈 景 咁 簡單 ， 揚言要 原汁原味 ， 雄才 偉略 之 至 ， 卻 迎來 一聲 ： 大 鑊 ！         《 城 》 片影評 ， 讚 好 不 輟 ， 個別 自我 不良 好感 覺 的 ： 影片 失敗 之處 — — 由頭 到 尾 不見 老鼠 橫行 ， 也 不見 周街 周巷 “ 污糟 邋遢 ， 烏 烟瘴 氣 ” ， 也 拍 不出 味道 … … “ 未到 城寨 ， 已聞惡 臭攻 鼻 。 ” 香港 娛樂圈 老 行尊 ， 陳 欣健 ， 退休 多年 ， 請 出來 話 說 當年 ： 他 曾任 “ 香港 皇家 警察 ” 的 偵緝 警司 ， 入行 已 是 幫辦 ， 第一 個 駐 地 ， 就是 九龍 城寨 。 “ 三不管 地帶 ， 盛傳 警察 也 不能 進去 ， 錯 的 。 我 第一天 上任 ， 帶 着 兩名 警員 進城 ， 好 難頂 ， 陣陣 惡 臭 ， 污水 滿地 橫流 ， 周圍 污糟 邋遢 … … ” “ 菲臘 陳 ” 大笑 起來 ， “ 當時 ， 有 兩三個 妓女 圍着 我 ， ‘ 呢 個 幫辦 仔 都 幾靚 仔 ， 幫襯 下 啦 ， 一 鷄 三味 ’ 。 這些 妓女 已經 五 、 六十 歲 了 ， 唉 … … 人世 間 … … ” “ 原來 ， 城寨 的 妓女 ， 與 警察 好熟 的 。 那時 ， 為 了 社區 健康 ， 定期 派出 醫療 隊入 城 打針 ， 鷄 飛 狗 走 ， 就要 逐個 捉 來 強行 打針 ， 需要 警隊 協助 ； 許多時 在 溝渠邊 發現 道友 屍體 ， 警員 到場 立案 才 搬走 ； 我們 巡更 不 走 地下 ， 走四樓 的 天台 四通 八達 。 ” 陳 欣建 如今 説 來 猶 搖 頭 三 嘆 。 若 原汁原味 重現 城寨 ， 遊客 會 以 為 誤飛 “ 臭港 ” ？         高梁,2024-06-12
