Title,Content,Link,Summary,Preprocessed_Content,Date
物流業訪民眾建澳反映困境,物流業訪民眾建澳反映困境    【本報消息】澳門空運暨物流業協會、澳門跨境汽車貨運從業員協會、澳門航運業同業公會、澳門船務物流協會、中澳物流派送協會、澳門航空快遞貨運協會、澳門物流商會一行昨日上午十時三十分到訪民眾建澳聯盟，與主席施家倫、理事長李良汪交流本澳物流業發展現狀、困境及提出建議。    監管打擊過職司機    會上，航運業代表表示，近年本澳海運經營壓力日益增加，加上政府公佈臨時佔用准照費用較以往大幅增加，使業界營運成本大增，屆時恐進一步影響本澳民生環境；對於政府多次提出對內港碼頭的發展規劃，但具體前景仍較迷茫，期望有關部門能進一步關注船務運輸的困境，並與業界建立定期溝通渠道，持續優化內港碼頭及九澳碼頭細則，考慮於人工島搭建新的貨運碼頭，進一步推動船務運輸發展。    汽車貨運業代表直言，當前跨境運輸競爭大，建議可以進一步縮短申請獲許可暫時進口之車輛的識別牌至兩天完成，以提高貨運效率，同時需進一步加強對“特別駕照”司機的監管，嚴格規範其行駛路線圖，並實施“專車專運”，從根源打擊“過職司機”等違規情況。另外，亦期望當局能重新推動於人工島興建“物流中心”。    培訓吸引新人入行    航空運輸業代表則建議進一步擴大本澳航運業界可自行處理貨運的情況，以擴展業界的生存空間，並因應當前物流業難有青年願意入行，導致“青黃不接”的情況，期望加大對業界發展的重視，灌輸行業正確的發展前景，並設立專業培訓課程，吸引青年入行。    倡重設物流委員會    另有物流商會代表建議當局能重新設立物流業發展委員會，加強業界與各部門的溝通聯繫，以推動本澳整體物流行業的發展，助力本澳經濟適度多元發展，並呼籲關注重型或半掛車及拖架的停泊問題等。    施家倫指出，物流業興衰與本澳經濟、居民生活息息相關，然而由於當局對物流業發展的重視程度不足，有關措施亦未能有效帶動行業發展，導致物流業無法持續提升貨運量、貨運時效等，使行業整體難以進一步發展，影響本澳社會民生環境。他將敦促當局重視物流業發展，主動與業界加強溝通，避免困境不斷惡化，為業界持續發展提供有利條件。    李良汪表示，透過是次交流深入了解本澳物流業發展過程中遇到的困難與訴求，未來將持續跟進業界提出的問題及建議，收集意見並撰寫意見書向特區政府反映，讓當局了解業界情況，回應業界訴求，推動物流業整體發展，助力經濟適度多元。    參與是次交流成員還有澳門空運暨物流業協會主席陳智良、理事長李賢德、副理事長林廣彪、理事黃玉常、顧問彭偉樂，澳門跨境汽車貨運從業員協會理事長劉偉光、常務副理事長袁增禄、副理事長寧乃成、黎循智、楊顯輝，澳門航運業同業公會理事長梁永佳、秘書長歐陽慧珊，澳門船務物流協會理事李永康，中澳物流派送協會會長翁文慶、理事長楊興、副會長及秘書長鄔梁，澳門航空快遞貨運協會副理事長吳文傑，澳門物流商會理事長代表蘇瑩榮、會務秘書盧琦琦，以及民建聯副理事長許治煒等。,http://www.macaodaily.com/html/2024-06/27/content_1764573.htm,李良汪表示，透過是次交流深入了解本澳物流業發展過程中遇到的困難與訴求，未來將持續跟進業界提出的問題及建議，收集意見並撰寫意見書向特區政府反映，讓當局了解業界情況，回應業界訴求，推動物流業整體發展，助力經濟適度多元,物流 業訪民眾 建澳 反映 困境         【 本報 消息 】 澳門 空運 暨 物流 業協會 、 澳門 跨境 汽車 貨運 從業員 協會 、 澳門 航運業 同業 公會 、 澳門 船務 物流 協會 、 中澳 物流 派送 協會 、 澳門 航空 快遞 貨運協會 、 澳門 物流 商會 一行 昨日 上午 十時 三十分 到 訪民眾 建澳 聯盟 ， 與 主席 施家倫 、 理事 長 李良 汪 交流 本澳 物流 業發展 現狀 、 困境 及 提出 建議 。         監管 打擊過 職司機         會上 ， 航運業 代表 表示 ， 近年 本澳海 運經營 壓力 日益 增加 ， 加上 政府 公 佈 臨時 佔 用 准照 費用 較 以往 大幅 增加 ， 使業界 營運 成本 大增 ， 屆 時 恐進 一步 影響 本澳 民生 環境 ； 對 於 政府 多次 提出 對 內港 碼頭 的 發展 規劃 ， 但 具體 前景 仍 較 迷茫 ， 期望 有 關部門 能進 一步 關注 船務運輸 的 困境 ， 並與業界 建立 定期 溝通 渠道 ， 持續 優化 內港 碼頭 及 九 澳碼 頭細則 ， 考慮 於 人工 島 搭建 新 的 貨運 碼頭 ， 進 一步 推動 船務運輸 發展 。         汽車 貨運業 代表 直言 ， 當前 跨境 運輸 競爭 大 ， 建議 可以 進 一步 縮短 申請 獲許 可 暫時 進口 之 車輛 的 識 別牌 至 兩天 完成 ， 以 提高 貨運 效率 ， 同時 需進 一步 加強 對 “ 特別 駕照 ” 司機 的 監管 ， 嚴格 規範其 行駛路線 圖 ， 並實施 “ 專車 專運 ” ， 從 根源 打擊 “ 過職 司機 ” 等 違規 情況 。 另外 ， 亦 期望 當局 能 重新 推動 於 人工 島興建 “ 物流 中心 ” 。         培訓 吸引 新人 入 行         航空 運輸業 代表 則建議 進 一步 擴大本 澳航 運業界 可 自行 處理 貨運 的 情況 ， 以 擴展 業界 的 生存 空間 ， 並因 應 當前 物流 業難 有 青年 願意 入行 ， 導致 “ 青黃 不接 ” 的 情況 ， 期望 加大 對業界 發展 的 重視 ， 灌輸 行業 正確 的 發展 前景 ， 並設立 專業 培訓 課程 ， 吸引 青年 入 行 。         倡重設 物流 委員會         另有 物流 商會 代表 建議 當局 能 重新 設立 物流 業發展 委員會 ， 加強 業界 與 各部 門的 溝通 聯 繫 ， 以 推動本 澳整 體物 流行 業的 發展 ， 助力 本澳 經濟 適度 多元 發展 ， 並呼籲關 注重 型 或 半掛 車及 拖架 的 停泊 問題 等 。         施家倫 指出 ， 物流 業興衰 與 本 澳經濟 、 居民 生活 息息 相關 ， 然而 由 於 當局 對 物流 業發展 的 重視 程度 不足 ， 有關 措施 亦 未能 有效 帶動 行業 發展 ， 導致 物流 業無法 持續 提升 貨運量 、 貨運 時效 等 ， 使行業 整體 難 以進 一步 發展 ， 影響 本澳 社會 民生 環境 。 他將 敦促 當局 重視 物流 業發展 ， 主動 與 業界 加強 溝通 ， 避免 困境 不斷 惡化 ， 為業界 持續 發展 提供 有利 條件 。         李良 汪 表示 ， 透過 是 次 交流 深入 了解 本澳 物流 業發展 過程 中 遇到 的 困難 與 訴求 ， 未來 將持續 跟 進業界 提出 的 問題 及 建議 ， 收集 意見 並撰 寫 意見 書 向 特區 政府 反映 ， 讓 當局 了解 業界 情況 ， 回應業界 訴求 ， 推動 物流 業整體 發展 ， 助力 經濟 適度 多元 。         參與 是 次 交流 成員 還有 澳門 空運 暨 物流 業協會 主席 陳 智良 、 理事 長 李賢德 、 副 理事 長 林廣彪 、 理事 黃 玉常 、 顧問 彭偉樂 ， 澳門 跨境 汽車 貨運 從業員 協會 理事 長 劉偉光 、 常務 副 理事 長 袁 增禄 、 副 理事 長 寧乃成 、 黎循智 、 楊顯輝 ， 澳門 航運業 同業 公會 理事 長 梁永佳 、 秘書長 歐陽慧 珊 ， 澳門 船務 物流 協會 理事 李 永康 ， 中澳 物流 派送 協會會長 翁文慶 、 理事 長 楊興 、 副會長 及 秘書長 鄔梁 ， 澳門 航空 快遞 貨運協會 副 理事 長 吳文傑 ， 澳門 物流 商會 理事 長 代表 蘇瑩榮 、 會務 秘書 盧琦琦 ， 以及 民建 聯副 理事 長 許治煒 等 。,2024-06-27
科大醫院師生訪長者中心送暖,科大醫院師生訪長者中心送暖    在科大醫院副院長兼行政總監曾致慧帶領下，科大醫院義工隊聯合澳門科技大學醫學院師生一行二十人，昨日到明愛恩暉長者綜合服務中心探訪，期望通過活動關懷該中心長者，宣揚關愛長者精神。    義工隊一行獲恩暉長者綜合服務中心院長關小萍熱情接待，義工隊透過互動趣味遊戲和分享日常健康小知識，與長者交流互動，現場氣氛溫馨歡樂。    副院長曾致慧表示，院方一直鼓勵員工參與社會義務活動，秉持助人自助精神，發揮仁愛之心、關懷長者的美德，弘揚澳門社會守望相助的優良傳統，希望讓長者們感受到社會關懷的同時，也能提升醫院員工的社會責任感和團隊凝聚力。    科大醫院義工隊成立逾四年，每年均走進社區，關注老幼。未來，科大醫院將繼續致力加強與社區互動。,http://www.macaodaily.com/html/2024-06/27/content_1764575.htm,科大醫院師生訪長者中心送暖    在科大醫院副院長兼行政總監曾致慧帶領下，科大醫院義工隊聯合澳門科技大學醫學院師生一行二十人，昨日到明愛恩暉長者綜合服務中心探訪，期望通過活動關懷該中心長者，宣揚關愛長者精神,科大 醫院 師生 訪長 者 中心 送暖         在 科大 醫院 副 院長 兼 行政 總監 曾 致慧帶 領下 ， 科大 醫院 義工隊 聯合 澳門 科技 大學 醫學院 師生 一行 二十 人 ， 昨日 到 明愛恩暉長 者 綜合 服務 中心 探訪 ， 期望 通過 活動關 懷該 中心 長 者 ， 宣揚 關愛長 者 精神 。         義工隊 一行 獲恩暉長 者 綜合 服務 中心 院長 關小萍 熱情 接待 ， 義工隊 透過 互動 趣味 遊戲 和 分享 日常 健康 小知識 ， 與 長 者 交流 互動 ， 現場 氣氛 溫馨 歡樂 。         副 院長 曾 致慧 表示 ， 院方 一直 鼓勵員 工參 與 社會義務 活動 ， 秉持 助人 自助 精神 ， 發揮仁 愛之心 、 關懷長 者 的 美德 ， 弘揚 澳門 社會 守望相助 的 優良 傳統 ， 希望 讓 長 者 們 感受 到 社會 關懷 的 同時 ， 也 能 提升 醫院員工 的 社會責 任感 和 團隊 凝聚力 。         科大 醫院 義工隊 成立 逾 四年 ， 每年 均 走 進 社區 ， 關注 老幼 。 未來 ， 科大 醫院 將繼續 致力 加強 與 社區 互動 。,2024-06-27
科大畢業生獲英高校獎學金,科大畢業生獲英高校獎學金    澳門科技大學國際學院英語專業二○二二屆畢業生王博鈞、王紫煜獲得多間世界頂尖學府博士課程錄取，並斬獲高額獎學金。這兩位畢業生將於九月分別赴英國牛津大學沃弗森學院和英國華威大學商學院就讀，且均表示未來將持續致力於學術與實踐發展，為社會做出新質貢獻。    王博鈞表示，十分感恩澳科大拓展其國際視野，堅定其心志；同時感謝國際學院對其學術能力、創新思維、多元文化等方面的培養，尤其是在學術寫作方面獨到的教育方式，使他在科研中受益匪淺，為在世界頂尖學府繼續深造奠定堅實基礎。    王紫煜感謝國際學院老師們的悉心教導，尤其得益於老師們給予她獨立完成研究項目的機會，為其未來站在學術的前沿創造新知提供知識、思維、見識。,http://www.macaodaily.com/html/2024-06/27/content_1764578.htm,王紫煜感謝國際學院老師們的悉心教導，尤其得益於老師們給予她獨立完成研究項目的機會，為其未來站在學術的前沿創造新知提供知識、思維、見識,科大 畢業生 獲英 高校 獎學金         澳門 科技 大學國際 學院 英語 專業 二 ○ 二二屆 畢業生 王博鈞 、 王紫煜 獲得 多間 世界 頂 尖學府 博士 課程 錄取 ， 並斬 獲高額 獎學金 。 這兩位 畢業 生將 於 九月 分別 赴英 國 牛津 大學沃 弗森學院 和 英國華 威大學 商學院 就 讀 ， 且 均 表示 未來 將持續 致力 於 學術 與 實踐 發展 ， 為 社會 做出 新質 貢獻 。         王博鈞 表示 ， 十分 感恩 澳 科大 拓展 其國際 視野 ， 堅定 其 心志 ； 同時 感謝 國際學院 對 其學術 能力 、 創新思維 、 多元 文化 等 方面 的 培養 ， 尤其 是 在 學術 寫作 方面 獨到 的 教育 方式 ， 使 他 在 科研 中 受益 匪 淺 ， 為 在 世界 頂 尖學府 繼續 深造 奠定 堅實 基礎 。         王紫煜感 謝國際 學院 老師們 的 悉心 教導 ， 尤其 得益 於 老師們 給予 她 獨立 完成 研究 項 目的 機會 ， 為 其 未來 站 在 學術 的 前沿 創造 新知 提供 知識 、 思維 、 見識 。,2024-06-27
中學生立體藝術賽展獲獎作品,中學生立體藝術賽展獲獎作品    由澳門雕塑學會主辦，獲澳門文化發展基金贊助、教青局場地支持的“全澳中學生立體藝術創作比賽二○二四”獲獎作品展，於六月二十五日下午六時半假塔石廣場青少年展藝館展覽廳舉行開幕式及頒獎禮。    主辦單位澳門雕塑學會表示，本屆比賽共收到八十一件（組）參賽作品，今年的參賽作品不再圍繞疫情的陰霾或困局，換來的是對未來生活的期盼，和青年人的奇思妙想。    是次展覽合共展出二十三件（組）由本澳中學生創作的立體藝術獲獎作品，主辦單位冀藉展出本澳中學生的優秀立體藝術作品，增加學生們交流學習的機會，並增加社會大眾對雕塑藝術的認識。    展覽展出日期由即日起至七月七日，開放時間為中午十二時至晚上八時（星期一及強制性假期休館），免費入場，歡迎有興趣人士前往參觀。,http://www.macaodaily.com/html/2024-06/27/content_1764581.htm,中學生立體藝術賽展獲獎作品    由澳門雕塑學會主辦，獲澳門文化發展基金贊助、教青局場地支持的“全澳中學生立體藝術創作比賽二○二四”獲獎作品展，於六月二十五日下午六時半假塔石廣場青少年展藝館展覽廳舉行開幕式及頒獎禮,中學生 立體 藝術 賽展 獲獎 作品         由 澳門 雕塑 學會 主辦 ， 獲澳門 文化 發展 基金 贊助 、 教青 局場 地 支持 的 “ 全澳 中學生 立體 藝術 創作 比賽 二 ○ 二四 ” 獲獎 作品展 ， 於 六月 二十五日 下午 六時 半假塔 石廣場 青少年 展藝館 展覽廳 舉行 開幕式 及 頒 獎禮 。         主辦 單位 澳門 雕塑 學會 表示 ， 本屆 比賽 共 收到 八十 一件 （ 組 ） 參賽 作品 ， 今年 的 參賽 作品 不再 圍繞 疫情 的 陰霾 或 困局 ， 換來 的 是 對 未來 生活 的 期盼 ， 和 青年人 的 奇思妙想 。         是 次 展覽 合共 展出 二十三 件 （ 組 ） 由本 澳中學生 創作 的 立體 藝術 獲獎 作品 ， 主辦 單位 冀藉 展出 本澳 中學生 的 優秀立 體藝術 作品 ， 增加 學生們 交流 學習 的 機會 ， 並 增加 社會 大眾 對 雕塑 藝術 的 認識 。         展覽 展出 日期 由 即日起 至 七月 七日 ， 開放 時間 為 中午 十二 時至 晚上 八時 （ 星期一 及強 制性 假期 休館 ） ， 免費 入場 ， 歡迎 有 興趣 人士 前往 參觀 。,2024-06-27
全國學生藝術展演理大獲三獎,全國學生藝術展演理大獲三獎    以“厚植家國情懷，涵養進取品格”為主題的全國第七屆大學生藝術展演活動日前在湖北襄陽舉行。澳門理工大學藝術及設計學院報送三個項目參展，均獲獎項，展現了澳理大在促進科藝融合及培養多元人才的成果。    作品《絲綢之路》獲得繪畫二等獎；《澳門高校傳統藝術教育之社會實踐——以澳門理工大學中國畫教學案例》獲得高校美育改革創新優秀案例二等獎；“無所不在AI（人工智能）藝術體驗工作坊”獲得學生藝術實踐工作坊二等獎。    全國大學生藝術展演每三年舉辦一屆，是全國教育系統舉辦規模最大、規格最高、影響最廣的藝術實踐活動。活動有來自全國三十一省、新疆生產建設兵團、香港及澳門的七千多位大學生參加，共計二百八十二個項目參與評選。,http://www.macaodaily.com/html/2024-06/27/content_1764582.htm,《澳門高校傳統藝術教育之社會實踐——以澳門理工大學中國畫教學案例》獲得高校美育改革創新優秀案例二等獎,全國學生 藝術 展演 理大 獲三獎         以 “ 厚植家國 情懷 ， 涵養 進取 品格 ” 為主題 的 全國 第七 屆 大學生 藝術 展演 活動 日前 在 湖北 襄陽 舉行 。 澳門 理工大 學藝術 及 設計 學院 報送 三個 項目 參展 ， 均 獲獎 項 ， 展現 了 澳理 大 在 促進 科藝 融合 及 培養 多元 人才 的 成果 。         作品 《 絲綢 之路 》 獲得 繪畫 二等 獎 ； 《 澳門 高校 傳統 藝術 教育 之 社會 實踐 — — 以澳門 理工大 學中國畫 教學 案例 》 獲得 高校 美育 改革 創新 優秀 案例 二等 獎 ； “ 無所 不 在 AI （ 人工智能 ） 藝術 體驗 工作坊 ” 獲得 學生 藝術 實踐 工作坊 二等 獎 。         全國 大學生 藝術 展演 每 三年 舉辦 一屆 ， 是 全國 教育系 統舉 辦規模 最大 、 規格 最高 、 影響 最廣 的 藝術 實踐 活動 。 活動 有 來 自全國 三十一 省 、 新疆 生產建 設兵團 、 香港 及 澳門 的 七千 多位 大學生 參加 ， 共計 二百八十 二個 項目 參與 評選 。,2024-06-27
Pecking Order——繼承順序   李啟文,"Pecking Order——繼承順序    ** order of importance // rank in a group of people // hierarchy of authority in a group // hierarchical order of seniority in any social group    ~~長幼尊卑次序；繼承順序；群體中的尊卑秩序，權能等級；社會等級；強弱次序    ~~ chain of command; power structure; social hierarchy/ladder; hierarchical structure; hierarchy of authority/command/dominance/status; order of importance; law of the jungle; law of the strongest    !! The term “pecking order” was invented by biologist W. C. Allee in the 1920s to characterize the behavior of domestic fowl with one bird pecking another of lower status.  That rigid social structure shows that bird A could peck B, but not vice versa; bird C might be pecked by either A or B, but could itself peck only D and others lower down in the ""pecking order.""    生物學家阿利在二十世紀二十年代發明了“啄食順序”一詞來描述家禽的行為，其中一隻鳥啄另一隻較低地位的鳥。這種嚴格的社會結構表明，鳥A可以啄鳥B，但不能反過來；鳥C可能被鳥A或鳥B啄，但在“啄食順序”中，它自己只會啄鳥D和其他啄序中比較低的鳥。    >> In a formal dining reception, the pecking order is that the seniors sit at the head of the table facing the exit.    在一個正式的餐飲招待會，長幼尊卑次序是前輩坐在面向出口的桌頭。    >> There should be an established pecking order of succession at any organization. After the Chief Executive Officer (CEO) are: e.g., Chief Operations Officer, Group Director, then Branch Manager.    任何組織都應該設有既定的繼承順序。例如執行長(CEO)之後是：營運長、集團經理，然後是分行主任。    學勤進修教育中心    英語專科導師    李啟文教授",http://www.macaodaily.com/html/2024-06/27/content_1764584.htm,Pecking Order——繼承順序    ** order of importance // rank in a group of people // hierarchy of authority in a group // hierarchical order of seniority in any social group    ~~長幼尊卑次序,"Pecking   Order — — 繼承順序         * *   order   of   importance   / /   rank   in   a   group   of   people   / /   hierarchy   of   authority   in   a   group   / /   hierarchical   order   of   seniority   in   any   social   group         ~ ~ 長 幼 尊卑 次序 ； 繼承順序 ； 群體 中 的 尊卑 秩序 ， 權能 等級 ； 社會 等級 ； 強弱 次序         ~ ~   chain   of   command ;   power   structure ;   social   hierarchy / ladder ;   hierarchical   structure ;   hierarchy   of   authority / command / dominance / status ;   order   of   importance ;   law   of   the   jungle ;   law   of   the   strongest         ! !   The   term   “ pecking   order ”   was   invented   by   biologist   W .   C .   Allee   in   the   1920s   to   characterize   the   behavior   of   domestic   fowl   with   one   bird   pecking   another   of   lower   status .     That   rigid   social   structure   shows   that   bird   A   could   peck   B ,   but   not   vice   versa ;   bird   C   might   be   pecked   by   either   A   or   B ,   but   could   itself   peck   only   D   and   others   lower   down   in   the   "" pecking   order . ""         生物 學家 阿利 在 二十 世紀 二十年代 發明 了 “ 啄食 順序 ” 一詞 來 描述 家禽 的 行為 ， 其中 一 隻 鳥 啄 另 一 隻 較 低 地位 的 鳥 。 這種 嚴格 的 社會 結構 表明 ， 鳥 A 可以 啄 鳥 B ， 但 不能 反過 來 ； 鳥 C 可能 被 鳥 A 或 鳥 B 啄 ， 但 在 “ 啄食 順序 ” 中 ， 它 自己 只會 啄 鳥 D 和 其他 啄序 中 比 較 低 的 鳥 。         > >   In   a   formal   dining   reception ,   the   pecking   order   is   that   the   seniors   sit   at   the   head   of   the   table   facing   the   exit .         在 一個 正式 的 餐 飲 招待 會 ， 長 幼 尊卑 次序 是 前輩 坐在 面向 出口 的 桌頭 。         > >   There   should   be   an   established   pecking   order   of   succession   at   any   organization .   After   the   Chief   Executive   Officer   ( CEO )   are :   e . g . ,   Chief   Operations   Officer ,   Group   Director ,   then   Branch   Manager .         任何 組織 都 應該 設有 既定 的 繼承順序 。 例如 執行長 ( CEO ) 之後是 ： 營運長 、 集團 經理 ， 然後是 分行 主任 。         學勤 進修 教育 中心         英語 專科導師         李啟 文 教授",2024-06-27
兩局防騙講座千四學生參與,兩局防騙講座千四學生參與    教青局與司法警察局在過去一個月內走訪了澳門各區，為應屆高中畢業生進行防騙禁毒宣教工作，進行全面的守法防騙教育。共舉辦了三場“守法防騙講座”，分別為五月廿四日在澳門聖保祿學校、卅一日在澳門聖若瑟教區中學第六校，六月八日在氹仔濠江中學附屬英才學校。講座得到師生反應熱烈，參與的高中三年級學生約一千四百多名。    講座期間司法警察局人員向學生展示“反詐程式”的使用方法，學生可以透過相關的小程式功能對網絡偽連結進行識別，透過輸入網址即時區別高、中、低風險情況。另外，因應近年各類新型毒品和涉毒犯罪趨勢，司警局人員向學生介紹毒品的禍害，以及最新的禁毒資訊，提醒準備出外升學及旅遊的學生提高警覺，以免誤墮法網及影響身體健康。,http://www.macaodaily.com/html/2024-06/27/content_1764586.htm,兩局防騙講座千四學生參與    教青局與司法警察局在過去一個月內走訪了澳門各區，為應屆高中畢業生進行防騙禁毒宣教工作，進行全面的守法防騙教育,兩局 防騙 講座 千四 學生 參 與         教青局 與 司法 警察局 在 過去 一個 月 內 走訪 了 澳門 各區 ， 為 應屆 高中 畢業生 進行 防騙 禁毒 宣教 工作 ， 進行 全面 的 守法 防騙 教育 。 共舉 辦 了 三場 “ 守法 防騙 講座 ” ， 分別 為 五月 廿四日 在 澳門 聖保祿 學校 、 卅一日 在 澳門 聖 若瑟 教區 中學 第六 校 ， 六月 八日 在 氹 仔 濠江 中學 附屬 英才 學校 。 講座 得到 師生 反應 熱烈 ， 參與 的 高中 三年 級學生 約 一千四百多 名 。         講座 期間 司法 警察局 人員向 學生 展示 “ 反詐 程式 ” 的 使用 方法 ， 學生 可以 透過 相關 的 小 程式 功能 對 網絡 偽連 結進 行識別 ， 透過 輸入 網址 即 時區 別高 、 中 、 低風險 情況 。 另外 ， 因應 近年 各類 新型 毒品 和 涉毒 犯罪 趨勢 ， 司 警局 人員向 學生 介紹 毒品 的 禍害 ， 以及 最新 的 禁毒 資訊 ， 提醒 準備 出外 升學及 旅遊 的 學生 提高 警覺 ， 以免 誤墮法 網及 影響 身體 健康 。,2024-06-27
