Title,Content,Link,Summary,Preprocessed_Content,Date
李家超：不遺餘力培訓體育人才,港府舉行儀式歡迎巴黎奧運代表團返港    李家超：不遺餘力培訓體育人才    【香港中通社廿一日電】香港特區政府與中國香港體育協會暨奧林匹克委員會廿一日在政府總部舉行二○二四巴黎奧運會中國香港代表團返港歡迎儀式。一眾港隊運動健兒出席，特首李家超為他們頒發表揚狀。    健兒為港注正能量    李家超致辭指出，港隊成員在奧運的世界舞台上，全面發揮拼搏精神和專業態度，展示拼搏進取、遇強越強的香港精神。政府會繼續不遺餘力培訓本地體育人才，全力支持體育盛事。    港協暨奧委會會長霍震霆表示，奧委會正積極籌備不同活動，如運動員分享等，繼續回饋社會對運動員的支持。他希望，運動員的故事，可以啟發更多人為社會注入正能量。    今屆奧運會，香港共派出三十五位運動員參加十三項賽事。港隊分別在擊劍和游泳項目奪得兩金兩銅；乒乓、羽毛球和跆拳道項目則創歷史佳績，分別躋身四強及八強。同時，在賽艇、柔道、體操、帆船等多個賽事表現出色。    當日，多名運動員上台分享心得。    女子重劍金牌得主江旻憓表示，決賽在同對手打成十二平手，加時“決一劍”時只想着要珍惜這一劍，好好報答團隊和巿民。港乒代表黃鎮廷則指出，今屆巴黎奧運未能一圓獎牌夢，希望能堅持到四年後的洛杉磯奧運，繼續為港爭光，已經感受到市民的認可、支持和熱情。    巴士巡遊追星者眾    港隊奧運健兒巴士巡遊  市民冒雨“追星”另外，特區政府與中國香港體育協會暨奧林匹克委員會當日安排巴士巡遊及歡迎儀式，讓運動員與市民見面。    上午十一時，車身掛有“健兒凱旋歸港，我們深以為傲”橫額的兩輛藍色巴士先後駛至尖沙咀，等待已久的市民紛紛高聲歡呼，舉起手機、相機拍照記錄，氣氛歡樂。    巴士途經尖沙咀鐘樓後，前往中環天星碼頭和添馬公園。有依依不捨的市民跑步追車，也有市民乘坐天星小輪趕往中環繼續“追星”。記者在添馬公園看到，現場同樣聚集大批“奧運迷”，撐着雨傘耐心等候。    運動員抵達添馬公園後，在立法會大樓前與立法會主席梁君彥和議員等合照。梁君彥表示，為港隊運動員感到自豪，希望他們繼續突破自己，為港爭光。運動員其後與學生交流，分享參與奧運的經驗。,http://www.macaodaily.com/html/2024-08/22/content_1776173.htm,巴士巡遊追星者眾    港隊奧運健兒巴士巡遊  市民冒雨“追星”另外，特區政府與中國香港體育協會暨奧林匹克委員會當日安排巴士巡遊及歡迎儀式，讓運動員與市民見面,港府 舉行 儀式 歡迎 巴黎 奧運 代表 團返 港         李家 超 ： 不 遺餘力 培訓 體育 人才         【 香港 中通社 廿一日 電 】 香港 特區 政府 與 中國 香港 體育 協會 暨 奧林匹克委員會 廿一日 在 政府 總部 舉行 二 ○ 二四 巴黎 奧運會 中國 香港 代表 團返 港 歡迎 儀式 。 一眾 港隊 運動 健兒 出席 ， 特首 李家 超為 他們 頒 發表揚 狀 。         健兒 為 港 注正 能量         李家 超致 辭 指出 ， 港隊 成員 在 奧運 的 世界舞台 上 ， 全面 發揮 拼搏精神 和 專業 態度 ， 展示 拼搏 進取 、 遇強 越強 的 香港 精神 。 政府 會繼續 不 遺餘力 培訓 本地 體育 人才 ， 全力支持 體育 盛事 。         港協 暨 奧委會 會長 霍震霆 表示 ， 奧委會 正積 極籌備 不同 活動 ， 如運動員 分享 等 ， 繼續 回饋 社會 對 運動員 的 支持 。 他 希望 ， 運動員 的 故事 ， 可以 啟發 更 多 人 為 社會 注入 正 能量 。         今屆 奧運會 ， 香港 共 派出 三十五 位運動員 參加 十三 項賽 事 。 港隊 分別 在 擊劍 和 游泳 項目 奪得 兩金 兩銅 ； 乒乓 、 羽毛球 和 跆拳道 項目則 創歷 史佳績 ， 分別 躋身 四強 及八強 。 同時 ， 在 賽艇 、 柔道 、 體操 、 帆船 等 多個 賽事表現 出色 。         當日 ， 多名 運動員 上台 分享 心得 。         女子 重劍 金牌得主 江 旻 憓 表示 ， 決賽 在 同 對 手 打成 十二 平手 ， 加時 “ 決一劍 ” 時 只 想着 要 珍惜 這一劍 ， 好好 報答 團隊 和 巿 民 。 港 乒 代表 黃 鎮廷則 指出 ， 今屆 巴黎 奧運 未能 一圓 獎牌 夢 ， 希望 能 堅持 到 四年 後 的 洛杉磯 奧運 ， 繼續 為 港 爭光 ， 已經 感受 到 市民 的 認可 、 支持 和 熱情 。         巴士 巡遊 追星 者眾         港隊 奧運健兒 巴士 巡遊     市民 冒雨 “ 追星 ” 另外 ， 特區 政府 與 中國 香港 體育 協會 暨 奧林匹克委員會 當日 安排 巴士 巡遊及 歡迎 儀式 ， 讓 運動員 與 市民 見面 。         上午 十一 時 ， 車身 掛有 “ 健兒 凱旋 歸港 ， 我們 深以 為傲 ” 橫額 的 兩輛 藍色 巴士 先後駛 至 尖沙咀 ， 等待 已久 的 市民 紛紛 高聲 歡呼 ， 舉起 手機 、 相機 拍照 記錄 ， 氣氛 歡樂 。         巴士 途經 尖沙咀 鐘樓 後 ， 前往 中環 天星 碼頭 和 添馬公園 。 有 依依 不 捨 的 市民 跑步 追車 ， 也 有 市民 乘坐 天星 小輪 趕往 中 環繼續 “ 追星 ” 。 記者 在 添馬公園 看到 ， 現場 同樣 聚集 大批 “ 奧運迷 ” ， 撐 着 雨傘 耐心 等候 。         運動員 抵達 添馬公園 後 ， 在 立法 會大樓 前 與 立法 會 主席 梁君彥 和 議員 等 合照 。 梁君彥 表示 ， 為 港隊 運動員 感到 自豪 ， 希望 他們 繼續 突破 自己 ， 為港 爭光 。 運動員 其 後 與 學生 交流 ， 分享 參與 奧運 的 經驗 。,2024-08-22
公屋加租首三月寬免加幅,公屋加租首三月寬免加幅    【香港中通社廿一日電】香港房屋協會廿一日宣佈，房協轄下二十個出租屋邨的租金將於今年十月一日起上調百分之十，新租金會維持至二○二六年九月三十日。考慮到社會目前的經濟狀況，房協決定向租戶提供特別紓緩措施，寬免首三個月的額外租金，房協因而少收接近二千四百萬港元的租金收入。    房協表示，經調整後，房協甲類及乙類出租屋邨租戶將會分別每月平均多繳約二百三十港元及六百四十港元租金。至於“富戶”，則須由今年十月起繳交新租金，以維護資源合理分配。另外，房協設有租金援助計劃，有短暫經濟困難的合資格租戶可獲減免四分之一或一半租金。    房協表示，作為自負盈虧的非牟利機構，轄下出租屋邨的營運賬目獨立於其他業務，並按其既定機制每兩年檢討租金一次。有關安排已平衡居民的負擔能力及房協屋邨營運的持續發展。    面對出租屋邨老化，房協會繼續優化屋邨設施，過去兩年出租屋邨營運開支亦因而上升，營運賬目錄得虧損。未來兩年，房協預計出租屋邨將持續錄得營運虧損。,http://www.macaodaily.com/html/2024-08/22/content_1776174.htm,公屋加租首三月寬免加幅    【香港中通社廿一日電】香港房屋協會廿一日宣佈，房協轄下二十個出租屋邨的租金將於今年十月一日起上調百分之十，新租金會維持至二○二六年九月三十日,公屋 加租 首 三月 寬免 加幅         【 香港 中通社 廿一日 電 】 香港 房屋 協會 廿一日 宣 佈 ， 房協轄下 二十 個 出租屋 邨 的 租金 將於 今年 十月 一日 起上 調 百分之十 ， 新 租金 會維持 至 二 ○ 二 六年 九月 三十日 。 考慮 到 社會 目前 的 經濟 狀況 ， 房協決 定向 租戶 提供 特別 紓 緩 措施 ， 寬免 首三個 月 的 額外 租金 ， 房協 因而 少收 接近 二千 四百 萬 港元 的 租金 收入 。         房協 表示 ， 經調整 後 ， 房協甲類 及 乙類 出租屋 邨 租戶 將會 分別 每月 平均 多繳 約 二百三十 港元 及 六百 四十 港元 租金 。 至於 “ 富戶 ” ， 則須 由 今年 十月 起繳 交新 租金 ， 以維護 資源 合理 分配 。 另外 ， 房協設 有 租金 援助 計劃 ， 有 短 暫經濟 困難 的 合資格 租戶 可 獲 減免 四分之一 或 一半 租金 。         房協 表示 ， 作為 自負 盈虧 的 非 牟利 機構 ， 轄 下 出租屋 邨 的 營運賬 目獨立 於 其他 業務 ， 並按 其 既定 機制 每 兩年 檢討 租金 一次 。 有關 安排 已 平衡 居民 的 負擔 能力 及房 協屋 邨 營運 的 持續 發展 。         面對 出租屋 邨 老化 ， 房協會 繼續 優化屋 邨 設施 ， 過去 兩年 出租屋 邨 營運 開支 亦 因而 上升 ， 營運賬 目錄 得 虧損 。 未來 兩年 ， 房協 預計 出租屋 邨 將持續 錄得 營運 虧損 。,2024-08-22
參考日韓促熊貓經濟    易言,參考日韓促熊貓經濟    中央再贈港一對大熊貓即將到來，“盈盈”高齡誕龍鳳胎，香港近日掀起大熊貓熱，社會各界熱議“熊貓經濟”。旅遊業界建議港府借鑒日本、韓國經驗，提升“大熊貓家族”知名度，吸引各地訪客，帶動經濟，活躍社會及旅業氛圍。    一向以來，“熊貓經濟”在香港發展似乎欠缺先天動力，甚至看不到相關的產業發展，為人所詬病。同樣獲中國大陸送贈大熊貓的日本和韓國，則把熊貓經濟發揮得淋漓盡致。在日本出生的大熊貓“香香”及在韓國出生的“福寶”均成為當地的“大明星”，非常受民眾喜歡，不少人不惜排隊數小時只為一睹風采。日本塑造了愛乾淨、優雅的“香香公主”，韓國打造了淘氣的“寶家族”，對經濟起到提振作用。    據悉“香香”在日本誕生頭三年，在當地的推動下，帶動超過逾四億美元的經濟效益；韓國因為“福寶”的高人氣，衍生出周邊玩偶、寫真集等被搶購一空，電視台更爭相製作電視節目、紀錄片等，收視可觀，“福寶”帶來的經濟效益惠及多個行業。“熊貓經濟”威力可見一斑。    香港即將擁有六隻大熊貓，發展“熊貓經濟”機不可失，港府及業界應參考日本、韓國經驗，打造獨樹一幟的大熊貓形象及相閞產業鏈，相信可惠及文創、餐飲、酒店等，提振經濟。    易言,http://www.macaodaily.com/html/2024-08/22/content_1776175.htm,香港即將擁有六隻大熊貓，發展“熊貓經濟”機不可失，港府及業界應參考日本、韓國經驗，打造獨樹一幟的大熊貓形象及相閞產業鏈，相信可惠及文創、餐飲、酒店等，提振經濟,參考 日 韓促 熊貓 經濟         中央 再 贈港 一 對 大熊 貓即 將到 來 ， “ 盈盈 ” 高齡 誕龍鳳胎 ， 香港 近日 掀起 大熊 貓熱 ， 社會 各界 熱議 “ 熊貓 經濟 ” 。 旅遊業界 建議 港府 借 鑒 日本 、 韓國 經驗 ， 提升 “ 大熊 貓 家族 ” 知名度 ， 吸引 各地 訪客 ， 帶動 經濟 ， 活躍社會 及 旅業 氛圍 。         一向 以來 ， “ 熊貓 經濟 ” 在 香港 發展 似乎 欠缺 先天 動力 ， 甚至 看不到 相關 的 產業 發展 ， 為 人 所 詬病 。 同樣 獲中 國大陸 送 贈 大熊 貓的 日本 和 韓國 ， 則把 熊貓 經濟 發揮 得 淋漓 盡致 。 在 日本 出生 的 大熊 貓 “ 香香 ” 及 在 韓國 出生 的 “ 福寶 ” 均 成為 當地 的 “ 大 明星 ” ， 非常 受民眾 喜歡 ， 不少 人 不惜 排隊 數小時 只 為 一睹 風采 。 日本 塑造 了 愛乾淨 、 優雅 的 “ 香香公主 ” ， 韓國 打造 了 淘氣 的 “ 寶 家族 ” ， 對 經濟 起到 提振 作用 。         據悉 “ 香香 ” 在 日本 誕生頭 三年 ， 在 當地 的 推動 下 ， 帶動 超過 逾 四 億 美元 的 經濟 效益 ； 韓國 因為 “ 福寶 ” 的 高人氣 ， 衍生 出周邊 玩偶 、 寫 真集 等 被 搶購 一空 ， 電視台 更爭 相 製 作 電 視 節 目 、 紀錄片 等 ， 收視 可觀 ， “ 福寶 ” 帶來 的 經濟 效益 惠及 多個 行業 。 “ 熊貓 經濟 ” 威力 可見 一斑 。         香港 即將 擁有 六 隻 大熊 貓 ， 發展 “ 熊貓 經濟 ” 機 不可 失 ， 港府 及業界 應 參考 日本 、 韓國 經驗 ， 打造 獨樹 一幟 的 大熊 貓 形象 及 相 閞 產 業 鏈 ， 相信 可 惠及 文創 、 餐飲 、 酒店 等 ， 提振經濟 。         易言,2024-08-22
海關檢五千萬元走私電腦零件,藏兩出口馬來西亞貨櫃    海關檢五千萬元走私電腦零件    【香港中通社廿一日電】香港海關廿一日表示，近日偵破一宗海路走私案，在兩個出口到馬來西亞的貨櫃中，檢獲市值約五千萬港元的電腦服務器、存儲器和電子零件。    海關港口及海域科貨櫃貨物檢查組根據風險評估和情報分析，十四日鎖定兩個出口到馬來西亞的四十呎貨櫃，分別報稱載有銅物料、電線、電路板、碳粉盒、金屬物料和電線等。經X光掃描後，發現櫃內有可疑影像，並非報稱的金屬為主的物品，相信載有走私貨物。    其後，案件交由有組織罪案調查科跟進，並在兩個貨櫃中檢獲大批電腦服務器、存儲器和電子零件。兩個貨櫃以申報貨物作掩飾，不排除不法分子故意將未列艙單貨物混雜其中，試圖逃避偵查。付貨人為海外人士，登記公司亦在海外。    案件仍在調查中，不排除有涉案人士被捕。,http://www.macaodaily.com/html/2024-08/22/content_1776176.htm,藏兩出口馬來西亞貨櫃    海關檢五千萬元走私電腦零件    【香港中通社廿一日電】香港海關廿一日表示，近日偵破一宗海路走私案，在兩個出口到馬來西亞的貨櫃中，檢獲市值約五千萬港元的電腦服務器、存儲器和電子零件,藏 兩 出口 馬 來 西亞 貨櫃         海關檢 五千 萬元 走私 電腦 零件         【 香港 中通社 廿一日 電 】 香港 海關 廿一日 表示 ， 近日 偵破 一宗 海路 走私案 ， 在 兩個 出口 到馬來 西亞 的 貨櫃 中 ， 檢獲 市值 約 五千 萬 港元 的 電腦 服務器 、 存儲器 和 電子 零件 。         海關 港口 及 海域 科貨櫃 貨物 檢查 組根據 風險 評估 和 情報 分析 ， 十四日 鎖定 兩個 出口 到馬來 西亞 的 四十 呎 貨櫃 ， 分別 報稱 載 有銅 物料 、 電線 、 電路板 、 碳 粉盒 、 金屬 物料 和 電線 等 。 經 X光 掃描 後 ， 發現 櫃內 有 可疑 影像 ， 並非 報稱 的 金屬 為 主 的 物品 ， 相信 載有 走私 貨物 。         其 後 ， 案件 交由 有 組織 罪案 調查科 跟 進 ， 並在 兩個 貨櫃 中檢獲 大批 電腦 服務器 、 存儲器 和 電子 零件 。 兩個 貨櫃 以 申報 貨物作 掩飾 ， 不 排除 不法分子 故意 將 未列 艙 單貨物 混雜 其中 ， 試圖 逃避 偵查 。 付貨人 為 海外 人士 ， 登記 公司 亦 在 海外 。         案件 仍 在 調查 中 ， 不 排除 有 涉案 人士 被捕 。,2024-08-22
海關檢五千冒牌貨拘八人,海關檢五千冒牌貨拘八人    【香港中通社廿一日電】香港海關廿一日表示，於本月八日至二十日期間，在全港多區採取特別執法行動，打擊冒牌物品活動，檢獲約五千件懷疑冒牌物品及一批營運設備，估計市值約三十三萬港元。    海關早前接獲舉報，指有零售店舖、藥房及夾公仔店售賣或在業務過程中提供懷疑冒牌香水。    經深入調查及在商標持有人的協助下，海關人員於上述期間採取執法行動，突擊搜查十家間分別位於旺角、葵涌、荃灣、東涌及西貢的店舖，並檢獲一批懷疑冒牌香水和化妝護膚品、六部夾公仔機及三部硬幣兌換機。    行動中，海關拘捕四男四女，年齡介乎二十歲至四十六歲，包括三名店舖負責人和五名員工。案件仍在調查中，不排除會有更多人被捕。,http://www.macaodaily.com/html/2024-08/22/content_1776177.htm,經深入調查及在商標持有人的協助下，海關人員於上述期間採取執法行動，突擊搜查十家間分別位於旺角、葵涌、荃灣、東涌及西貢的店舖，並檢獲一批懷疑冒牌香水和化妝護膚品、六部夾公仔機及三部硬幣兌換機,海關檢 五千 冒牌 貨拘八人         【 香港 中通社 廿一日 電 】 香港 海關 廿一日 表示 ， 於 本月 八日 至 二十 日期 間 ， 在 全港 多區 採取 特別 執法 行動 ， 打擊 冒牌 物品 活動 ， 檢獲 約 五千 件 懷疑 冒牌 物品 及 一批 營運 設備 ， 估計 市值 約 三十三 萬 港元 。         海關 早前 接獲 舉報 ， 指有 零售店 舖 、 藥房 及夾 公仔 店售 賣 或 在 業務 過程 中 提供 懷疑 冒牌 香水 。         經 深入 調查 及 在 商標 持有人 的 協助 下 ， 海關 人員 於 上述 期間 採取 執法 行動 ， 突擊 搜查 十家 間 分別位 於 旺角 、 葵涌 、 荃灣 、 東涌 及 西貢 的 店 舖 ， 並檢獲 一批 懷疑 冒牌 香水 和 化妝護膚品 、 六部 夾 公仔 機及 三部 硬幣 兌換機 。         行動 中 ， 海關 拘捕 四男 四女 ， 年齡 介乎 二十 歲 至 四十六 歲 ， 包括 三名 店 舖 負責人 和 五名 員工 。 案件 仍 在 調查 中 ， 不 排除 會 有 更 多 人 被捕 。,2024-08-22
Mclntosh ML1 MK2首款揚聲器再現    清  泉,"Mclntosh ML1 MK2首款揚聲器再現    Mclntosh Lab創於1949年，是美國歷史悠久的音響品牌，由Frank H. Mclntosh與工程師Gordon Gow聯合創辦。    1949年開始以Mclntosh(麥堅圖)品牌製造高級真空管放大器，60年代轉為製造晶體管機，產品設計豪華典雅，透光玻璃面板襯托大型湖水藍VU錶，成為Mclntosh標誌造型。    Mclntosh經歷大半世紀，無可改變其製造音響的傳統觀念，但市道改變了其經營。1977年麥堅圖退休，Gordon Gow任總裁兼首席執行官，並向全球擴展業務，公司開始陷入困境。1990年被日本汽車音響製造商Clarion收購，日方總裁無意改變Mclntosh現狀，但將其業務擴至汽車音響及家庭影音。2003年將Mclntosh轉售予D&M Holdings，但Mclntosh設計部仍獨立營運，並推出新款及復刻60年代經典型號，至2012年被意大利米蘭的Fine Sounds集團收購，該公司改為Mclntosh集團，並從意大利遷回紐約。    Mclntosh在音響發展領域中，擁殿堂級地位，其金漆招牌引垂涎，故被投資者買入又賣出。2022年夏季，德州的達拉斯(Dallas)一個私募基金Highlander Partners收購了Mclntosh集團，包括Mclntosh Lab，作其股票投資組合一部分。從過去到現在，Mclntosh每被收購後，必會調整市場策略，最常見是推出周年紀念版，或將昔日經典名器重出江湖，過去便有復刻膽機，今回是揚聲器。Mclntosh在1970年曾推出其首個揚聲器系列，包括ML1、ML2及ML4型號，於1977年停產，其中ML1是其首款揚聲器。    Mclntosh在70年代開始進入揚聲器市場，ML1是大型書架揚聲器 ，外形古典，前板裝上胡桃木柵網罩，頗具貴氣。ML1裝有12吋低音、8吋中低音、1 1/2吋球頂中高音、1 5/8吋同軸幅射式高音，是四路分頻四單元設計，效率達89db，當年是具出色音量輸出及出色低頻反應的揚聲器，大受音樂愛好者歡迎。Mclntosh基於ML1的設計，於去年推出了ML1 MK2，將原本四單元改為五單元，仍維持四路分頻，同時亦更新各個單元，聲箱保留本世紀中葉風格，前障板保護網罩取消木柵，聲音更暢通無阻，亦提供一對新腳架。    ML1 MK2裝有12吋低音、兩個4吋中低音，其振膜由聚丙烯製造；另有2吋軟布圓頂中高音、3/4吋鈦圓頂高音，分頻點改為較低頻率，上一代低音是250Hz，MK2是180Hz，故其低頻更顯深沉，而頻應27Hz–45kHz，比上代更寬頻，靈敏度稍降至85db，但承受功率達600    W。現代音響製造今時不同往日，不同時代有不同聲音，但聽音樂只有不變的感情，一對參考價12,000美元。    □清    泉",http://www.macaodaily.com/html/2024-08/22/content_1776178.htm,Mclntosh基於ML1的設計，於去年推出了ML1 MK2，將原本四單元改為五單元，仍維持四路分頻，同時亦更新各個單元，聲箱保留本世紀中葉風格，前障板保護網罩取消木柵，聲音更暢通無阻，亦提供一對新腳架,"Mclntosh   ML1   MK2 首款 揚聲器 再現         Mclntosh   Lab 創 於 1949 年 ， 是 美國 歷史 悠久 的 音響 品牌 ， 由 Frank   H .   Mclntosh 與 工程 師 Gordon   Gow 聯合 創辦 。         1949 年 開始 以 Mclntosh ( 麥堅圖 ) 品牌 製 造 高 級 真空管 放大器 ， 60 年代 轉 為 製 造 晶 體 管 機 ， 產品 設計 豪華 典雅 ， 透光 玻璃 面板 襯托 大型 湖水 藍 VU 錶 ， 成為 Mclntosh 標誌 造型 。         Mclntosh 經歷 大 半世 紀 ， 無可 改變 其 製 造 音 響 的 傳 統 觀 念 ， 但市 道 改變 了 其 經營 。 1977 年麥 堅圖 退休 ， Gordon   Gow 任總裁 兼 首席 執行 官 ， 並向 全球 擴展 業務 ， 公司 開始 陷入困境 。 1990 年 被 日本 汽車音 響 製 造 商 Clarion 收購 ， 日方 總裁 無意 改變 Mclntosh 現狀 ， 但將 其業務 擴至 汽車 音響 及 家庭 影音 。 2003 年將 Mclntosh 轉 售予 D & M   Holdings ， 但 Mclntosh 設計部 仍 獨立 營運 ， 並 推出 新款 及 復 刻 60 年代 經 典型 號 ， 至 2012 年 被 意大利 米蘭 的 Fine   Sounds 集團 收購 ， 該 公司 改為 Mclntosh 集團 ， 並從 意大利 遷回 紐約 。         Mclntosh 在 音響 發展 領域 中 ， 擁 殿堂 級 地位 ， 其金漆 招牌 引 垂涎 ， 故 被 投資者 買入 又 賣 出 。 2022 年 夏季 ， 德州 的 達 拉斯 ( Dallas ) 一個 私募 基金 Highlander   Partners 收購 了 Mclntosh 集團 ， 包括 Mclntosh   Lab ， 作其 股票 投資 組合 一部分 。 從過 去 到 現在 ， Mclntosh 每 被 收購 後 ， 必會 調整 市場 策略 ， 最常見 是 推出 周年 紀念版 ， 或將 昔日 經典 名器 重出江湖 ， 過去 便 有 復 刻 膽機 ， 今回 是 揚聲器 。 Mclntosh 在 1970 年 曾 推出 其首個 揚聲器 系列 ， 包括 ML1 、 ML2 及 ML4 型號 ， 於 1977 年 停產 ， 其中 ML1 是 其 首款 揚聲器 。         Mclntosh 在 70 年代 開始 進入 揚聲器 市場 ， ML1 是 大型 書架揚 聲器   ， 外形 古典 ， 前板 裝上 胡桃木 柵網 罩 ， 頗 具貴氣 。 ML1 裝有 12 吋 低音 、 8 吋 中 低音 、 1   1 / 2 吋 球頂 中高音 、 1   5 / 8 吋 同軸 幅射 式 高音 ， 是 四路 分頻 四 單元 設計 ， 效率 達 89db ， 當年 是 具 出色 音量 輸出 及 出色 低頻 反應 的 揚聲器 ， 大受 音樂 愛好者 歡迎 。 Mclntosh 基 於 ML1 的 設計 ， 於 去年 推出 了 ML1   MK2 ， 將 原本 四單 元 改為 五 單元 ， 仍維持 四路 分頻 ， 同時 亦 更新 各個 單元 ， 聲箱 保留 本世紀 中葉 風格 ， 前障 板 保護 網罩 取消 木柵 ， 聲音 更 暢通 無阻 ， 亦 提供 一對 新 腳架 。         ML1   MK2 裝有 12 吋 低音 、 兩個 4 吋 中 低音 ， 其振膜 由 聚丙烯 製 造 ； 另有 2 吋 軟布 圓頂 中高音 、 3 / 4 吋 鈦 圓頂 高音 ， 分頻點 改為 較 低 頻率 ， 上 一代 低音 是 250Hz ， MK2 是 180Hz ， 故其 低頻 更顯 深沉 ， 而 頻應 27Hz – 45kHz ， 比 上代 更 寬頻 ， 靈 敏度 稍降 至 85db ， 但 承受 功率 達 600         W 。 現代音 響 製 造 今 時 不同 往日 ， 不同 時代有 不同 聲音 ， 但 聽 音樂 只有 不變 的 感情 ， 一對 參考價 12 , 000 美元 。         □ 清         泉",2024-08-22
