Title,Content,Link,Summary,Preprocessed_Content
長者公寓擬設復康中心,醫療設施受關注  當局續了解需求    長者公寓擬設復康中心    【本報消息】政府預計長者公寓可於今年第四季入住。該項目會否配置醫療設施，備受關注。社工局去年底曾表示，考慮到入住公寓的長者多具日常自理能力，可以使用區內的醫療服務。預留空間予衛生局提供服務，但並非衛生中心。衛生局副局長郭昌宇昨日出席公開場合表示，長者公寓內的設施將針對長者需要的語言治療、職業治療等復康服務，也會持續了解長者需求設置項目，目前正密鑼緊鼓籌備，會配合長者公寓運作投入服務。    千五申請超倍    長者公寓是五階梯房策之一，也是澳門拓展銀髮服務的新試點。起初有配置長者健康監測中心的考量，後來當局澄清不設衛生醫療站點。社工局長韓衛在去年底回覆議員書質指出，對於入住的長者有其他服務需要，公寓會與相關社會照顧服務連結，爲他們提供包括家居照護、日間護理、日間暫托、院舍暫住及護送服務等個別支援服務。    長者公寓首階段推出七百五十九個住宅單位，於去年十一月六日至十二月卅一日接受申請，政府合共收到一千五百多份申請，涉及二千二百人，單人申請七百八十人、雙人申請一千四百二十人，另有四千九百人諮詢情況。目前正審核資格，當局預計合資格者今年第四季可以入住。    長者公寓提供基本家具及配置，當長者攜帶物品入住時，須適當存放好由當局提供的物品，未來倘因不同原因遷出公寓時須還原單位。    餐廳下旬截標    政府長者公寓地下至三樓設有商舖、會所和平台花園。會所和平台花園樓層設置健身室、卡拉OK室、粵劇室、閱覽室、戶外器械和乒乓球室等文娛康體設施，為長者提供各類型活動，豐富耆年生活。    一樓A1商舖已公開招租，實用面積約三千平方米，以營辦中式餐廳為主，飲食店（茶餐廳）為輔，具備智能化設備及管理的餐廳，日後可以為長者公寓的住戶及區內居民供應價格合理的中西式早餐、午餐、茶點及晚餐等服務。上月卅一日，當局安排有意者實地視察現場環境，首天有十一家公司代表到場。截標日期爲本月廿三日，並於本月廿六日開標。地下還設有四間商舖，其後也將招標。,http://www.macaodaily.com/html/2024-02/05/content_1733418.htm,醫療設施受關注  當局續了解需求    長者公寓擬設復康中心    【本報消息】政府預計長者公寓可於今年第四季入住,醫療 設施 受 關注     當局續 了解 需求         長 者 公寓 擬設 復 康 中心         【 本報 消息 】 政府 預計長 者 公寓 可 於 今年 第四季 入住 。 該項 目會否 配置 醫療 設施 ， 備受 關注 。 社工 局 去年底 曾 表示 ， 考慮 到 入住 公寓 的 長 者 多具 日常 自理能力 ， 可以 使用 區內 的 醫療 服務 。 預 留空 間予 衛生局 提供 服務 ， 但 並非 衛生 中心 。 衛生局 副 局長 郭昌宇 昨日 出席 公開 場合 表示 ， 長 者 公寓 內 的 設施 將針 對長 者 需要 的 語言 治療 、 職業 治療 等 復 康服務 ， 也 會 持續 了解 長 者 需求 設置 項目 ， 目前 正密 鑼緊 鼓籌備 ， 會 配合 長 者 公寓 運作 投入 服務 。         千五 申請 超倍         長 者 公寓 是 五階梯 房策 之一 ， 也 是 澳門 拓展 銀 髮 服務 的 新 試點 。 起初 有 配置 長 者 健康 監測 中心 的 考量 ， 後 來 當局 澄清 不設 衛生 醫療 站點 。 社工 局長 韓衛 在 去年底 回覆 議員書質 指出 ， 對 於 入住 的 長 者 有 其他 服務 需要 ， 公寓 會 與 相關 社會 照顧 服務連結 ， 爲 他們 提供 包括 家居 照護 、 日間 護理 、 日間 暫托 、 院舍 暫住 及護 送 服務 等 個 別 支援 服務 。         長 者 公寓 首階段 推出 七百 五十九 個 住宅 單位 ， 於 去年 十一月 六日 至 十二月 卅一日 接受 申請 ， 政府 合共 收到 一千五百多 份 申請 ， 涉及 二千 二百人 ， 單人 申請 七 百八十 人 、 雙人 申請 一千四百 二十 人 ， 另有 四千 九百 人諮詢 情況 。 目前 正審 核資格 ， 當局 預計合 資格者 今年 第四季 可以 入住 。         長 者 公寓 提供 基本 家具 及 配置 ， 當長 者 攜帶 物品 入住 時 ， 須適當 存放 好 由 當局 提供 的 物品 ， 未來 倘因 不同 原因 遷出 公寓 時須 還原 單位 。         餐廳 下旬 截標         政府 長 者 公寓 地下 至三樓 設有商 舖 、 會 所 和 平台 花園 。 會 所 和 平台 花園 樓層 設置 健身 室 、 卡拉 OK 室 、 粵劇室 、 閱覽室 、 戶外 器械 和 乒乓球室 等文 娛康體 設施 ， 為長 者 提供 各類 型 活動 ， 豐富耆 年 生活 。         一樓 A1 商 舖 已 公開 招租 ， 實用 面積 約 三千 平方米 ， 以營辦 中式 餐廳 為 主 ， 飲食店 （ 茶餐 廳 ） 為輔 ， 具備 智能化 設備 及 管理 的 餐廳 ， 日 後 可以 為長 者 公寓 的 住戶 及區 內 居民 供應 價格 合理 的 中 西式早餐 、 午餐 、 茶點 及 晚餐 等 服務 。 上 月 卅一日 ， 當局 安排 有意者 實地 視察 現場 環境 ， 首天 有 十一家 公司 代表 到場 。 截標 日期 爲 本月 廿三日 ， 並 於 本月 廿六日 開標 。 地下 還設 有 四間 商 舖 ， 其後也將 招標 。
A區共同管道附屬系統動工安裝,料區內最高電荷達澳門整體一成三    A區共同管道附屬系統動工安裝    【本報消息】澳電為配合特區政府“鞏固提升、多元發展”總體方向，進一步滿足中長期城市發展的用電需求，上周五為新城A區共同管道附屬系統設計、供應及安裝服務舉行動工儀式，為澳門經濟多元發展提供電力保障。    澳電受權管理管道    公共建設局長林煒浩、環境保護局副局長許志樑、澳電執行委員會主席梁華權及中國港灣工程有限公司副總經理劉寶河主禮動工儀式。    梁華權致詞表示，澳電具有三十多年建造和維護地下設施的經驗，早於二〇一七年已成立共同管道跨部門工作小組，研究有關技術和營運。於二〇一九年獲澳門特區政府授予“共同管道管理公共服務”專營權。去年簽署“新城A區共同管道附屬系統設計、供應及安裝服務”合同，服務內容主要包括主、微型共同管道和控制中心的附屬系統設計、採購和安裝。    收納公共設施管網    按照特區政府“新城A區供電規劃及發展”，預計區內最高電力負荷將達到目前整體澳門負荷約百分之十三點二。為此，澳電須做好充分準備。新城A區將建造總長約六點六公里的共同管道，圍繞新城填海A區形成環形平面佈局，將公用設施包括供電、自來水管、中水管及通訊網絡等鋪設於地下共同管道內，方便日後維護、維修及擴容等工作，減少重複開挖路面對交通造成的影響。,http://www.macaodaily.com/html/2024-02/05/content_1733419.htm,料區內最高電荷達澳門整體一成三    A區共同管道附屬系統動工安裝    【本報消息】澳電為配合特區政府“鞏固提升、多元發展”總體方向，進一步滿足中長期城市發展的用電需求，上周五為新城A區共同管道附屬系統設計、供應及安裝服務舉行動工儀式，為澳門經濟多元發展提供電力保障,料區 內 最高 電荷 達 澳門 整體 一成 三         A 區 共同 管道 附屬系 統動 工安裝         【 本報 消息 】 澳電為 配合 特區 政府 “ 鞏固 提升 、 多元 發展 ” 總體 方向 ， 進 一步 滿足 中長 期 城市 發展 的 用電 需求 ， 上周五 為 新城 A 區 共同 管道 附屬 系統 設計 、 供應 及安裝 服務舉 行動工 儀式 ， 為 澳門 經濟 多元 發展 提供 電力 保障 。         澳電 受權 管理 管道         公共 建設 局長 林煒浩 、 環境 保護局 副 局長 許志 樑 、 澳電 執行 委員會 主席 梁華權 及 中國 港灣 工程 有限公司 副 總經理 劉寶河 主禮動 工儀式 。         梁華權 致詞 表示 ， 澳電 具有 三十多年 建造 和 維護 地下 設施 的 經驗 ， 早 於 二 〇 一 七年 已 成立 共同 管道 跨部門 工作 小組 ， 研究 有關 技術 和 營運 。 於 二 〇 一 九年 獲澳門 特區 政府 授予 “ 共同 管道 管理 公共 服務 ” 專營權 。 去年 簽署 “ 新城 A 區 共同 管道 附屬 系統 設計 、 供應 及安裝 服務 ” 合同 ， 服務 內容 主要 包括 主 、 微型 共同 管道 和 控制中心 的 附屬 系統 設計 、 採購 和 安裝 。         收納 公共 設施 管網         按照 特區 政府 “ 新城 A 區供 電規劃 及 發展 ” ， 預計區 內 最高 電力 負荷 將達 到 目前 整體 澳門 負荷 約 百分之十三 點二 。 為 此 ， 澳電須 做好 充分 準備 。 新城 A 區將 建造 總長 約 六點 六公里 的 共同 管道 ， 圍繞 新城 填海 A 區 形成 環形 平面 佈 局 ， 將 公用 設施 包括 供電 、 自來 水管 、 中 水管 及 通訊 網絡 等 鋪 設 於 地下 共同 管道 內 ， 方便 日後維護 、 維修及 擴容 等 工作 ， 減少重 複 開 挖 路面 對 交通 造成 的 影響 。
西側道路開通稍緩A區交通,配合下階段共同管道及道路施工    西側道路開通稍緩A區交通    【本報消息】新城A區西側道路昨日上午十時半開通，車輛由珠澳口岸人工島進入A區及澳門半島，須由豚城大馬路後繞過濠江圓形地使用西側道路。連接黑沙環的A區馬萬祺博士大馬路則擴闊了路面，並改爲往豚城大馬路單向行車。    入區主幹單向行車    新城A區西側道路開通後，由珠澳口岸人工島往新城A區及澳門半島的車輛需使用西側道路，用作往來黑沙環及新城A區的馬萬祺博士大馬路改作單向行車。據當局早前公佈，是次交通通行措施主要配合新城A區的規劃及發展，同時為A區北區及中區下一階段在馬萬祺博士大馬路及豚城大馬路開展共同管道及道路施工創造條件。駕駛者需留意現場交通指示及改道後的行車路線。    有駕駛者表示，新城A區馬萬祺博士大馬路兩傍皆是地盤。過去雙向行車時，當有工程車進出地盤，對交通有一定影響。現在擴闊了路面及單向行車，可大大改善。西側道路開通亦可起分流。然而，今次改道對改善進出A區的交通作用不大。原因是車流高峰時堵塞點仍是進出A區的東方明珠迴旋處，以及通往口岸人工島的豚城大馬路。沒有新路進出A區難以解決塞車問題。同時A區現缺乏行人管理及過路設施，步行進出A區的工人亦影響交通安全。    多措求破“天花板”    目前進出A區僅有黑沙環東方明珠的連接橋，A區往黑沙環的B匝道仍在建設中。連接黑沙環污水處理廠附近的A2連接橋正如火如荼建設。還有正待判標的連接友誼大馬路和外港碼頭道路的A3連接橋、第四條跨海大橋等。惟在上述通道建成前，相信甚難解決新城A區外連的交通問題。    A區是“北上澳車”必經之路。社會曾多次要求增加“北上澳車”名額，但當局以A區交通超負荷，行政長官更形容是到達交通負荷的“天花板”，暫不擬增加名額。即使今次交通改道以及將來各條連接線竣工，倘進出口岸人工島仍僅得豚城大馬路又無擴闊舉措，相信很難突破“天花板”。,http://www.macaodaily.com/html/2024-02/05/content_1733420.htm,配合下階段共同管道及道路施工    西側道路開通稍緩A區交通    【本報消息】新城A區西側道路昨日上午十時半開通，車輛由珠澳口岸人工島進入A區及澳門半島，須由豚城大馬路後繞過濠江圓形地使用西側道路,配合 下階段 共同 管道 及 道路 施工         西側 道路 開通 稍緩 A 區 交通         【 本報 消息 】 新城 A 區西側 道路 昨日 上午 十時 半開通 ， 車輛 由 珠澳 口岸 人工 島進入 A 區及 澳門 半島 ， 須由豚 城大馬路 後 繞過 濠江 圓形 地 使用 西側 道路 。 連接 黑沙 環的 A 區馬 萬祺 博士 大馬路則 擴闊 了 路面 ， 並改 爲 往豚 城大馬路 單向 行車 。         入區 主幹 單向 行車         新城 A 區西側 道路 開通 後 ， 由珠澳 口岸 人工 島往 新城 A 區及 澳門 半島 的 車輛 需 使用 西側 道路 ， 用作 往來 黑沙 環及 新城 A 區的 馬 萬祺 博士 大馬路 改作 單向 行車 。 據 當局 早前 公 佈 ， 是 次 交通 通行 措施 主要 配合 新城 A 區的 規劃 及 發展 ， 同時 為 A 區北區 及 中區 下 一階段 在 馬 萬祺 博士 大馬路 及豚 城大馬路 開展 共同 管道 及 道路 施工 創造 條件 。 駕駛者 需 留意 現場 交通 指示 及 改道 後 的 行車 路線 。         有 駕駛者 表示 ， 新城 A 區馬 萬祺 博士 大馬路 兩傍皆是 地盤 。 過去 雙向 行車 時 ， 當有 工程 車進 出 地盤 ， 對 交通 有 一定 影響 。 現在 擴闊 了 路面 及 單向 行車 ， 可 大大 改善 。 西側 道路 開通 亦可 起 分流 。 然而 ， 今 次 改道 對 改善 進出 A 區的 交通 作用 不 大 。 原因 是 車流 高峰 時 堵塞 點仍 是 進出 A 區的 東方 明珠 迴 旋處 ， 以及 通往 口岸 人工 島的豚 城大馬路 。 沒有 新路 進出 A 區難 以解 決塞車 問題 。 同時 A 區現 缺乏 行人 管理 及 過路 設施 ， 步行 進出 A 區的 工人 亦 影響 交通安全 。         多 措求 破 “ 天花板 ”         目前 進出 A 區僅 有 黑沙 環東方 明珠 的 連接橋 ， A 區往 黑沙 環的 B 匝道 仍 在建 設中 。 連接 黑沙 環 污水 處理廠 附近 的 A2 連接橋 正 如火如荼 建設 。 還有 正待 判標 的 連接 友誼 大馬路 和 外港 碼頭 道路 的 A3 連接橋 、 第四 條 跨海 大橋 等 。 惟 在 上述 通道 建成 前 ， 相信 甚難 解決 新城 A 區外連 的 交通 問題 。         A 區是 “ 北上 澳車 ” 必經 之路 。 社會 曾多次 要求 增加 “ 北上 澳車 ” 名額 ， 但 當局 以 A 區 交通 超負 荷 ， 行政 長 官 更 形容 是 到 達 交通 負荷 的 “ 天花板 ” ， 暫不擬 增加 名額 。 即使 今 次 交通 改道 以及 將來 各條 連接線 竣工 ， 倘進 出 口岸 人工 島仍 僅得豚 城大馬路 又 無 擴闊 舉措 ， 相信 很難 突破 “ 天花板 ” 。
新交通法今立會引介,暫未列表決時間   爭議多料有排拗    新交通法今立會引介    【本報消息】爭議點多、預計有排拗的新《道路交通法》法案排上議會日程。立法會全體會議今日將討論及表決多項法案與決議案，據議程所示，壓軸的新《道路交通法》法案罕見地只編列為引介，未列明一般性討論及表決，暫時未知表決時間。    新《道路交通法》法案的理由陳述指出，現行澳門特區與道路交通相關法規大部分已實施多年，其中《道路交通法》生效至今已超過十六年。由於現行規範有部分規定已難以配合本澳現時實際環境及交通狀況，故有必要全面檢討和完善，以滿足社會實際需要。為此，經綜合考慮本澳實際交通情況、執法需要和充分聽取公眾及社會各界意見後，政府草擬新的《道路交通法》法案，旨在加強打擊影響交通安全或阻礙交通的違法行為，以及完善有關道路交通規範。    引扣分制可停牌    法案破天荒引入“扣分制”，駕駛員因違規被扣減至指定分值時，將引致在法定期間內禁止駕駛的法律後果，被禁止駕駛的駕駛員另須自費修讀駕駛進修課程及通過駕駛理論測驗。法案亦加強對若干違法行為的懲處，如醉駕、毒駕、酒駕和超速駕駛，建議提高有關不遵守“禁止於駕駛時使用流動電話、其他電信工具及影視設備”、“車輛間的安全距離”及“使用聲響信號”等規定的行政違法行為的罰款金額。此外，亦擴大強制使用安全帶的範圍；禁止於駕駛時使用流動電話、其他電信工具及影視設備；禁止平衡車、滑板、滑板車或其他類似的機動或非機動通行工具在公共道路上通行；訂定輪椅及其他類似的行動輔助設備在公共道路上的通行規則。    禁過馬路用電話    完善駕駛員及行人的其他通行規則，包括規定行人橫過車行道時，禁止使用流動電話、其他電信工具及影視設備，但使用免提功能通話者除外。    行政會去年十二月十一日已公佈完成討論新《道路交通法》法案，但至今才呈上立法會全體會議引介。法案公佈後，當中擬引入的“扣分制”、禁止行人過馬路時使用手機等，爭議聲音較大。從政府送交立法會第一文本顯示，新《道路交通法》法案並非《道路交通法》修訂案，而是一部新的法案，條文多達一百五十三條，亦會廢止現行多達三十九條的法律、法令、行政法規、行政命令批示等。運輸工務司司長羅立文早前就形容《道路交通法》“好難傾，因為交通問題人人都係博士，人人都有意見。”,http://www.macaodaily.com/html/2024-02/05/content_1733404.htm,法案亦加強對若干違法行為的懲處，如醉駕、毒駕、酒駕和超速駕駛，建議提高有關不遵守“禁止於駕駛時使用流動電話、其他電信工具及影視設備”、“車輛間的安全距離”及“使用聲響信號”等規定的行政違法行為的罰款金額,暫未 列表 決時間       爭議 多料 有 排拗         新 交通 法今 立會 引介         【 本報 消息 】 爭議點 多 、 預計 有 排拗 的 新 《 道路交通 法 》 法案 排上 議會 日程 。 立法 會 全體 會議 今日 將討論 及表決 多項 法案 與 決議案 ， 據議程 所示 ， 壓軸 的 新 《 道路交通 法 》 法案 罕見 地 只 編列 為 引介 ， 未 列明 一般性 討論 及表決 ， 暫時 未知 表決 時間 。         新 《 道路交通 法 》 法案 的 理由 陳 述 指出 ， 現行 澳門 特區 與 道路交通 相關 法規 大部分 已 實施 多年 ， 其中 《 道路交通 法 》 生效 至今 已 超過 十六年 。 由 於 現行 規範有 部分 規定 已 難以 配合 本澳現 時 實際 環境 及 交通 狀況 ， 故有 必要 全面 檢討 和 完善 ， 以滿足 社會 實際 需要 。 為 此 ， 經綜合 考慮 本澳 實際 交通 情況 、 執法 需要 和 充分 聽取 公眾 及 社會 各界 意見 後 ， 政府 草擬 新 的 《 道路交通 法 》 法案 ， 旨在 加強 打擊 影響 交通安全 或 阻礙 交通 的 違法行 為 ， 以及 完善 有關 道路交通 規範 。         引 扣分 制可 停牌         法案 破天荒 引入 “ 扣分 制 ” ， 駕駛員因 違規 被扣 減至 指定 分值 時 ， 將 引致 在 法 定期 間 內 禁止 駕駛 的 法律 後 果 ， 被 禁止 駕駛 的 駕駛員 另須 自費 修讀 駕駛 進修 課程 及 通過 駕駛理論 測驗 。 法案 亦 加強 對 若干 違法行 為 的 懲處 ， 如醉駕 、 毒駕 、 酒駕 和 超速 駕駛 ， 建議 提高 有關 不 遵守 “ 禁止 於 駕駛時 使用 流動 電話 、 其他 電信 工具 及 影視 設備 ” 、 “ 車輛 間 的 安全 距離 ” 及 “ 使用 聲響 信號 ” 等 規定 的 行政 違法行 為 的 罰款 金額 。 此外 ， 亦 擴大 強制 使用 安全 帶 的 範圍 ； 禁止 於 駕駛時 使用 流動 電話 、 其他 電信 工具 及 影視 設備 ； 禁止 平衡 車 、 滑板 、 滑板 車或 其他 類 似的 機動 或非 機動 通行 工具 在 公共 道路 上 通行 ； 訂定 輪椅 及其 他類 似的 行動 輔助 設備 在 公共 道路 上 的 通行 規則 。         禁過 馬 路用 電話         完善 駕駛員及 行人 的 其他 通行 規則 ， 包括 規定 行人 橫過 車行 道 時 ， 禁止 使用 流動 電話 、 其他 電信 工具 及 影視 設備 ， 但 使用 免提 功能 通話者 除外 。         行政 會 去年 十二月 十一日 已公 佈 完成 討論 新 《 道路交通 法 》 法案 ， 但 至今 才 呈 上 立法 會 全體 會議 引介 。 法案 公 佈 後 ， 當中擬 引入 的 “ 扣分 制 ” 、 禁止 行人 過馬路 時 使用 手機 等 ， 爭議 聲音 較 大 。 從 政府 送交 立法 會 第一 文本 顯示 ， 新 《 道路交通 法 》 法案 並非 《 道路交通 法 》 修訂案 ， 而是 一部 新 的 法案 ， 條文多達 一百五十三 條 ， 亦 會 廢止 現行 多 達 三十九 條的 法律 、 法令 、 行政法 規 、 行政命令 批示 等 。 運輸 工務司 司長 羅 立文 早前 就 形容 《 道路交通 法 》 “ 好難 傾 ， 因為 交通 問題 人人 都 係 博士 ， 人人 都 有意 見 。 ”
如火如荼   林嘉慧  攝,如火如荼    林茂海邊大馬路蘭花前地行人天橋近日完成鋼結構橋身吊裝。該天橋為三十年前提出的“林茂空中走廊”組成部分。    林嘉慧   攝,http://www.macaodaily.com/html/2024-02/05/content_1733405.htm,如火如荼    林茂海邊大馬路蘭花前地行人天橋近日完成鋼結構橋身吊裝,如火如荼         林茂海邊 大馬路蘭花 前 地 行人 天橋 近日 完成 鋼結構 橋身 吊裝 。 該 天橋 為 三十年 前 提出 的 “ 林茂 空中走廊 ” 組成 部分 。         林嘉慧       攝
