Title,Content,Link,Summary,Preprocessed_Content,Date
穆熙妍低調為母小孩兩歲,穆熙妍低調為母小孩兩歲    四十五歲台灣藝人穆熙妍十年前與學長史天威結婚，日前她傳出好消息，表示自己已為人母，但沒有透露詳情。據悉，穆熙妍的小孩已經兩歲多，但關於性別、實際年齡等細節，她都低調不願公開。經紀人稍早時證實，“現在的生活很忙碌，也很充實，謝謝關心。唯一的遺憾就是，小孩沒有讓爸爸（穆熙妍父親）看到。”經紀人表示她不願多透露細節：“她比較想維持自己的生活步調，也不希望大家再過多延伸小孩的相關問題。”    穆熙妍是身家百億的台灣太陽能大廠富商的千金，曾透露在結婚第一年就曾懷孕，但不到三個月胎兒就沒有了心跳，夫妻倆只能忍痛引產。如今終於成為人母，實在令人開心。,http://www.macaodaily.com/html/2024-05/26/content_1757623.htm,穆熙妍低調為母小孩兩歲    四十五歲台灣藝人穆熙妍十年前與學長史天威結婚，日前她傳出好消息，表示自己已為人母，但沒有透露詳情,穆熙妍 低調 為母 小孩 兩歲         四十五 歲 台灣 藝人 穆熙妍 十年 前 與 學長 史 天威 結婚 ， 日前 她 傳出 好消息 ， 表示 自己 已為 人母 ， 但 沒 有 透露 詳情 。 據悉 ， 穆熙妍 的 小孩 已經 兩歲 多 ， 但關 於 性別 、 實際 年齡 等 細節 ， 她 都 低 調不願 公開 。 經紀 人 稍早 時證實 ， “ 現在 的 生活 很 忙碌 ， 也 很 充實 ， 謝謝 關心 。 唯一 的 遺憾 就是 ， 小孩 沒有 讓 爸爸 （ 穆熙妍 父親 ） 看到 。 ” 經紀 人 表示 她 不願 多 透露 細節 ： “ 她 比 較 想維持 自己 的 生活 步調 ， 也 不 希望 大家 再過 多 延伸 小孩 的 相關 問題 。 ”         穆熙妍 是 身家 百億 的 台灣 太陽能 大廠 富商 的 千金 ， 曾 透露 在 結婚 第一年 就 曾 懷孕 ， 但 不到 三個 月 胎兒 就 沒 有 了 心跳 ， 夫妻 倆 只能 忍痛 引產 。 如今 終於成 為 人母 ， 實在 令人 開心 。,2024-05-26
黃宣《歌手》挑戰成功排第二,黃宣《歌手》挑戰成功排第二    台灣歌手黃宣（Yellow）近日登上內地綜藝《歌手2024》出賽，表現亮眼。《歌手》前日播出第三集最新排名出爐，上一集才初次登場的黃宣排第二名挑戰成功，超越排名第四的歌后那英，讓不少粉絲感到意外。    黃宣當晚拋棄豪華的交響樂團陣容，僅用一把結他自彈自唱，以深情的方式演繹蔡健雅的歌曲《思念》，展現全然不同的風格，讓觀眾相當驚喜。黃宣精湛表現也吸引觀眾狂讚，“黃宣真的太牛了”、“敢在直播上結他solo，基本上就挑戰了這個節目的上限了”、“真的很大膽”、“希望他能留下來”、“這實力太扯”。,http://www.macaodaily.com/html/2024-05/26/content_1757625.htm,黃宣精湛表現也吸引觀眾狂讚，“黃宣真的太牛了”、“敢在直播上結他solo，基本上就挑戰了這個節目的上限了”、“真的很大膽”、“希望他能留下來”、“這實力太扯”,黃 宣 《 歌手 》 挑戰 成功 排 第二         台灣 歌手 黃 宣 （ Yellow ） 近日 登上 內地 綜藝 《 歌手 2024 》 出賽 ， 表現 亮眼 。 《 歌手 》 前日 播出 第三集 最新 排名 出爐 ， 上 一集 才 初次 登場 的 黃 宣排 第二名 挑戰 成功 ， 超越 排名 第四 的 歌后 那英 ， 讓 不少 粉絲 感到 意外 。         黃 宣當晚 拋棄 豪華 的 交響 樂團 陣容 ， 僅用 一把 結他 自彈 自唱 ， 以 深情 的 方式 演繹 蔡健雅 的 歌曲 《 思念 》 ， 展現 全然不同 的 風格 ， 讓 觀眾 相當 驚喜 。 黃 宣 精湛 表現 也 吸引 觀眾 狂 讚 ， “ 黃 宣 真的 太牛 了 ” 、 “ 敢 在 直播 上結 他 solo ， 基本上 就 挑戰 了 這個節 目的 上限 了 ” 、 “ 真的 很大 膽 ” 、 “ 希望 他 能 留下 來 ” 、 “ 這實力 太 扯 ” 。,2024-05-26
黃志瑋楊冪再演對手戲,黃志瑋楊冪再演對手戲    四十三歲的台灣藝人黃志瑋近年將工作重心轉往內地，已經有三年沒有在台劇中現身。他近期演出內地劇集《狐妖小紅娘月紅篇》，飾演反派“金人鳳”。在社群平台宣傳新劇時，也喊話女主角楊冪“老朋友”，二人私下交情隨之曝光。原來他們在二○○九年時，就曾經在《仙劍奇俠傳3》中合作，當時黃志瑋飾演魔尊“重樓”，與楊冪飾演的“唐雪見”有過對手戲，隨即在網上帶起一波回憶殺。    黃志瑋去年五月曾返台為流浪動物籌款，意外被拍到與一名女子當街相擁，並做出疑似親吻的動作，被猜測有了新戀情。不過他也隨即發文回應“生活很累，工作很忙，自己一個人很好”，間接澄清自己仍是單身。,http://www.macaodaily.com/html/2024-05/26/content_1757627.htm,原來他們在二○○九年時，就曾經在《仙劍奇俠傳3》中合作，當時黃志瑋飾演魔尊“重樓”，與楊冪飾演的“唐雪見”有過對手戲，隨即在網上帶起一波回憶殺,黃 志瑋 楊 冪 再演 對 手戲         四十三 歲 的 台灣 藝人黃志瑋 近年 將 工作 重心 轉往 內 地 ， 已經 有 三年 沒有 在 台劇 中 現身 。 他 近期 演出 內地 劇集 《 狐 妖 小紅娘 月 紅篇 》 ， 飾演 反派 “ 金人鳳 ” 。 在 社群 平台 宣傳 新劇 時 ， 也 喊 話 女主角 楊冪 “ 老朋友 ” ， 二人 私下 交情 隨之 曝光 。 原來 他們 在 二 ○ ○ 九年 時 ， 就 曾經 在 《 仙劍 奇俠 傳 3 》 中 合作 ， 當時 黃 志瑋飾 演魔尊 “ 重樓 ” ， 與 楊 冪飾演 的 “ 唐雪見 ” 有過 對 手戲 ， 隨即 在 網上 帶起 一波 回憶 殺 。         黃 志瑋 去年 五月 曾 返台 為 流浪 動物 籌款 ， 意外 被 拍 到 與 一名 女子 當街 相擁 ， 並 做出 疑似 親吻 的 動作 ， 被 猜測 有 了 新戀情 。 不過 他 也 隨即 發文 回應 “ 生活 很累 ， 工作 很 忙 ， 自己 一個 人 很 好 ” ， 間接 澄清 自己 仍 是 單身 。,2024-05-26
吳京談塑造中國英雄新形象,吳京談塑造中國英雄新形象    著名演員、導演吳京近日在論壇上談“在新時代塑造中國電影英雄新形象”，他表示，“在和平年代裡捍衛英雄情懷，在平凡生活中追隨英雄足跡。自己將和更多的年輕人一起塑造英雄形象，用電影技術手段和表達方式講述中國英雄故事。”    二○二四文化強國建設高峰論壇電影業高品質發展分論壇前日在深圳舉行。吳京稱，對於電影人來說，要怎麼塑造出新時代特色的中國英雄新形象，創作上，最重要的是“信”，首先創作者自己得相信英雄故事，更得相信英雄的精神。吳京認為，要實現高效、高品質的創新，應該追求“精”。    動作片的發展同樣離不開產業的基礎規模，科技的精密運算。,http://www.macaodaily.com/html/2024-05/26/content_1757629.htm,吳京稱，對於電影人來說，要怎麼塑造出新時代特色的中國英雄新形象，創作上，最重要的是“信”，首先創作者自己得相信英雄故事，更得相信英雄的精神,吳京談 塑造 中國 英雄 新 形象         著名 演員 、 導演 吳京 近日 在 論壇 上 談 “ 在 新 時代 塑造 中國 電影 英雄 新 形象 ” ， 他 表示 ， “ 在 和平 年代 裡捍衛 英雄 情懷 ， 在 平凡 生活 中 追 隨 英雄 足跡 。 自己 將和 更 多 的 年 輕人 一起 塑造 英雄形象 ， 用電影 技術 手段 和 表達 方式 講述 中國 英雄 故事 。 ”         二 ○ 二四 文化 強國 建設 高峰 論壇 電影業 高品質 發展 分論壇 前日 在 深圳 舉行 。 吳京稱 ， 對 於 電影 人來 說 ， 要 怎麼 塑造 出新 時代 特色 的 中國 英雄 新 形象 ， 創作 上 ， 最 重要 的 是 “ 信 ” ， 首先 創 作者 自己 得 相信 英雄 故事 ， 更得 相信 英雄 的 精神 。 吳京 認為 ， 要 實現 高效 、 高品質 的 創新 ， 應該 追求 “ 精 ” 。         動作片 的 發展 同樣 離 不 開產業 的 基礎 規模 ， 科技 的 精密 運算 。,2024-05-26
鄭世豪外闖不回家   娛  翁,鄭世豪外闖不回家    這個世界，向來都係人來人往，一家公司有人手增減也沒甚麼大不了。然而鄭世豪離開TVB卻獲得了許多人的關注，原因大概是他近年主力演出《愛 · 回家之開心速遞》的角色太深入民心，是以當這回“細龍生”不再回家、前往“睇我唔島”的新聞出現時，大受觀眾及網民關注。    有傳鄭世豪離巢的主因是雙方在薪酬上有分歧。真實情況是否如此不得而知，但值得注意的是他在離巢後並沒有口出惡言、如其他人般細數前公司的不是，反倒是留下前往“睇我唔島”的登機牌作為告別。這P圖實在很適合他在這個時刻所用，畢竟他加入TVB初期的演出就是古裝版處境劇《皆大歡喜》，而他的告別作同樣是處境劇的《開心速遞》，尤其是《開心速遞》中也經常出現古里梧島、橙不忍島及厄里吾島等虛構地方，如今正式告別，用上虛構的“睇我唔島”也算是應景。    回望鄭世豪入行經歷，在參加全球華人新秀歌唱大賽複賽後止步，隨後為加入演藝圈投考電視藝員訓練班。也許他視藝訓班為踏腳石，希望藉此認識人脈完成他的歌手夢。某程度而言他也算是圓夢了，因為在《星夢傳奇》中得到了亞軍後已獲賞識，唱過多部電視劇的主題曲、唱過廣告歌、出過EP唱片、跟張智霖及鄭欣宜參與過雲頂五十周年演唱會，也獲得過一些樂壇獎項，已經比許多失意歌手夢的人幸運得多。平心而論，鄭世豪人品不俗、沒半點架子（也可以說是未具擺架子的資格），但他的歌藝真的很有水準，絕對是職業歌手級別，奈何因樣貌平庸而星運欠奉。說到底現時觀眾對歌手的要求，不只求靚聲及有技巧，要是包裝欠奉，哪管擁有天籟之音都是徒然。    娛  翁,http://www.macaodaily.com/html/2024-05/26/content_1757630.htm,然而鄭世豪離開TVB卻獲得了許多人的關注，原因大概是他近年主力演出《愛 · 回家之開心速遞》的角色太深入民心，是以當這回“細龍生”不再回家、前往“睇我唔島”的新聞出現時，大受觀眾及網民關注,鄭世豪外 闖 不 回家         這個 世界 ， 向 來 都 係 人來 人往 ， 一家 公司 有人 手 增減 也 沒 甚麼 大不了 。 然而 鄭世豪 離開 TVB 卻 獲得 了 許多人 的 關注 ， 原因 大概 是 他 近年 主力 演出 《 愛   ·   回家 之開 心速 遞 》 的 角色 太 深入 民心 ， 是 以當 這回 “ 細龍生 ” 不再 回家 、 前往 “ 睇 我 唔 島 ” 的 新聞出 現時 ， 大受 觀眾 及 網民關 注 。         有傳 鄭世豪 離巢 的 主因 是 雙方 在 薪酬 上 有 分歧 。 真實 情況 是否 如此 不得而知 ， 但 值得注意 的 是 他 在 離巢後並 沒有 口出 惡言 、 如 其他人 般細數 前 公司 的 不是 ， 反倒 是 留下 前往 “ 睇 我 唔 島 ” 的 登機牌 作為 告別 。 這 P 圖實 在 很 適合 他 在 這個 時刻 所用 ， 畢竟 他 加入 TVB 初期 的 演出 就是 古裝版處 境劇 《 皆 大歡 喜 》 ， 而 他 的 告別 作同樣 是 處 境劇 的 《 開心速 遞 》 ， 尤其 是 《 開心速 遞 》 中 也 經常 出現 古里 梧島 、 橙 不忍 島及 厄里 吾島 等 虛構 地方 ， 如今 正式 告別 ， 用上 虛構 的 “ 睇 我 唔 島 ” 也 算是 應景 。         回望 鄭世豪入 行經歷 ， 在 參加 全球 華人 新秀 歌唱 大賽 複 賽 後 止步 ， 隨後為 加入 演藝圈 投考 電視 藝員 訓練班 。 也 許他 視藝 訓班為 踏腳石 ， 希望 藉此 認識 人脈 完成 他 的 歌手 夢 。 某 程度 而言 他 也 算是 圓夢 了 ， 因為 在 《 星夢傳奇 》 中 得到 了 亞軍後已 獲賞識 ， 唱過 多部 電視劇 的 主題 曲 、 唱過 廣告 歌 、 出過 EP 唱片 、 跟 張智霖 及 鄭欣宜 參與 過雲頂 五十周年 演唱 會 ， 也 獲得過 一些 樂壇 獎項 ， 已經 比許 多 失意 歌手 夢 的 人 幸運得 多 。 平心 而論 ， 鄭世豪 人品 不俗 、 沒半點 架子 （ 也 可以 說 是 未具 擺 架子 的 資格 ） ， 但 他 的 歌藝 真的 很 有 水準 ， 絕對 是 職業 歌手 級別 ， 奈何 因樣 貌 平庸 而星 運欠 奉 。 說 到底 現時 觀眾 對 歌手 的 要求 ， 不 只求 靚聲 及 有 技巧 ， 要是 包裝 欠 奉 ， 哪管 擁有 天籟之音 都 是 徒然 。         娛     翁,2024-05-26
宣萱不平凡的主僕情    高  梁,宣萱不平凡的主僕情    五十三歲宣萱，一臉稚氣，笑容天眞，貼臉老婆婆合照。留言：“永遠無法感謝英姐對我的愛與撫養。如果沒有她，不知道我會怎麼樣。今天是英姐一百○一歲生日！祝她生日快樂，最重要身體健康，開開心心！”    照片所見，英姐非常精神，不像一百○一歲。網民送上祝福，大讚宣萱很孝順。宣萱回應窩心的祝福，再次感謝英姐，説——“她，把我當她自己的女兒養大。”    英姐，宣萱家中的工人。這份不平凡的主僕情，二〇一九年曾搬上熒幕。    當年，接受好朋友陳慧珊(Flora)於Hoy Tv主持的《放學後》訪問，並邀請了英姐一同出鏡。談及英姐對她人生的影響，宣萱說：英姐視我如親生女兒！    宣萱自言：“小時候，英姐教我做家務，我留學外國時能夠自立，事無大小，包括熨衫、摺衫，都是英姐教我。雖然，她不是我們的親生媽媽，不過，她是無條件疼惜我們。她説的話，對我們心靈有好大啟發……。她教我們‘知足常樂’，人都會開心些。我們年幼時，她已經這樣説，要珍惜當下擁有的事物。以前，有點不理解，到了我這年紀，做到了。”    “長大後，閒時，我和哥哥、大嫂帶英姐外出飮茶。”宣萱表示：“我們談天説地，英姐説話不多，但一聽到‘要唔要可樂’就會點晒頭，很開心，像個小孩子。”原來，住老人院的英姐，不能飮可樂的。所以，宣萱帶她外出時，會偷偷請英姐飮可樂。    宣萱，她人生是否知足快樂？只有她知道。她出生香港，祖籍上海，父親富商，母親大企業高管，出生即贏在起跑線上，全家人的掌上明珠。父母對子女教育及前途極為看重，宣萱十三歲便送到外國留學，性格開朗，自顧能力相當強，乃拜英姐自幼訓練的好處。宣萱在校，氣質出眾，且是個學霸，學歷與家世，許多人可望而不可及。學成返港，被星探挖掘。    感情事方面，宣萱與羅嘉良傳過緋聞，澳洲外景，共處十三天，但兩人感情未曾發酵。當時“撈家”已有妻子，不了了之。宣萱似有揭示：人生一半在於我，另外一半聽自然。    高  梁,http://www.macaodaily.com/html/2024-05/26/content_1757632.htm,”宣萱表示：“我們談天説地，英姐説話不多，但一聽到‘要唔要可樂’就會點晒頭，很開心，像個小孩子,宣萱 不 平凡 的 主僕情         五十三 歲 宣萱 ， 一臉 稚氣 ， 笑容 天 眞 ， 貼臉 老婆婆 合照 。 留言 ： “ 永遠 無法 感謝 英姐 對 我 的 愛與 撫養 。 如果 沒有 她 ， 不 知道 我會 怎麼樣 。 今天 是 英姐 一百 ○ 一歲 生日 ！ 祝 她 生日 快樂 ， 最 重要 身體 健康 ， 開開 心心 ！ ”         照片 所見 ， 英姐 非常 精神 ， 不像 一百 ○ 一歲 。 網民送 上 祝福 ， 大 讚 宣萱 很孝順 。 宣萱 回應 窩心 的 祝福 ， 再次 感謝 英姐 ， 説 — — “ 她 ， 把 我當 她 自己 的 女兒 養大 。 ”         英姐 ， 宣萱 家中 的 工人 。 這份 不 平凡 的 主僕情 ， 二 〇 一 九年 曾 搬 上 熒幕 。         當年 ， 接受 好 朋友 陳 慧珊 ( Flora ) 於 Hoy   Tv 主持 的 《 放學 後 》 訪問 ， 並邀 請 了 英姐 一同 出鏡 。 談及 英姐 對 她 人生 的 影響 ， 宣萱 說 ： 英姐視 我 如 親生 女兒 ！         宣萱 自言 ： “ 小時候 ， 英姐 教 我 做家務 ， 我 留學 外國時 能夠 自立 ， 事 無 大小 ， 包括 熨衫 、 摺 衫 ， 都 是 英姐 教 我 。 雖然 ， 她 不是 我們 的 親生 媽媽 ， 不過 ， 她 是 無 條件 疼惜 我們 。 她 説 的 話 ， 對 我們 心靈 有 好 大 啟發 … … 。 她 教 我們 ‘ 知足 常樂 ’ ， 人 都 會 開心些 。 我們 年幼 時 ， 她 已經 這 樣 説 ， 要 珍惜 當下 擁有 的 事物 。 以前 ， 有點 不 理解 ， 到 了 我 這年紀 ， 做到 了 。 ”         “ 長 大 後 ， 閒時 ， 我 和 哥哥 、 大嫂 帶英姐 外出 飮 茶 。 ” 宣萱 表示 ： “ 我們 談 天 説 地 ， 英 姐 説 話 不 多 ， 但 一 聽 到 ‘ 要 唔 要 可樂 ’ 就會點 晒頭 ， 很 開心 ， 像 個 小孩子 。 ” 原來 ， 住 老人院 的 英姐 ， 不能 飮 可 樂 的 。 所以 ， 宣萱 帶 她 外出 時 ， 會 偷偷 請英 姐 飮 可 樂 。         宣萱 ， 她 人生 是否 知足 快樂 ？ 只有 她 知道 。 她 出生 香港 ， 祖籍 上海 ， 父親 富商 ， 母親 大 企業 高管 ， 出生 即贏 在 起跑 線上 ， 全家人 的 掌上明珠 。 父母 對 子女教育 及 前途 極為 看重 ， 宣萱 十三 歲 便 送到 外國 留學 ， 性格 開朗 ， 自顧 能力 相當強 ， 乃拜 英姐 自幼 訓練 的 好 處 。 宣萱 在校 ， 氣質 出眾 ， 且 是 個 學霸 ， 學歷 與 家世 ， 許多人 可望而不可及 。 學成 返港 ， 被 星探 挖掘 。         感情 事 方面 ， 宣萱 與羅嘉良 傳過 緋聞 ， 澳洲 外景 ， 共處 十三天 ， 但 兩人 感情 未曾 發酵 。 當時 “ 撈家 ” 已有 妻子 ， 不了了之 。 宣萱 似有 揭示 ： 人生 一半 在 於 我 ， 另外 一半 聽 自然 。         高     梁,2024-05-26
盧靜儀爵士到機械舞轉型    文：瑪姬里妮,澳門街舞新星    盧靜儀爵士到機械舞轉型    十六歲的澳門少女盧靜儀，以其從爵士舞到機械舞的“跨界”才華，成為了街舞潮流中的耀眼新星。今年，她已先後在紫禁之巔ⅢFREESTYLE Battle比賽贏得冠軍，亦在亞洲中學生校際嘻哈舞蹈大賽分別在All Style Battle個人賽贏得冠軍，Choreography齊舞中與隊友獲亞軍，更有機會代表澳門參加重慶舉行的大國少年BDS世界青少年街舞大賽Vol.4總決賽，開闊眼界和視野。    從小就對舞蹈充滿熱情的盧靜儀，最初接觸並熱衷於爵士舞。隨着對舞蹈世界的深入探索，她對機械舞(Popping)這一充滿力量感和獨特風格的舞蹈形式產生濃厚興趣。靜儀坦言，正是對不同舞蹈風格的好奇心和渴望挑戰自我的精神，促使她做出了從爵士到機械舞的轉變。    轉型之路並非一帆風順。機械舞強調細緻的肌肉控制和動作技巧，對舞者來說是一個全新的挑戰。然而，靜儀並未因此而退縮，反而更加努力地投入練習。她堅持不懈的努力和對舞蹈的熱情，最終讓她克服了轉型過程中的種種困難，並以出色的表現征服了觀眾和評委。    在舞蹈比賽中，靜儀不僅參與了團隊齊舞的比賽，更在個人競技(Battle)中展現了自己的獨特風格和技巧。她表示，雖然兩種比賽形式各有魅力，但她更享受個人競技的挑戰和刺激。在競技中，她可以充分展現自己的風格和水準，與對手進行交流和切磋，從而不斷提升自己的舞蹈水平。    面對即將到來的大學生活，靜儀已經有了明確的規劃。她希望能夠繼續深造舞蹈相關的專業課程，進一步提升自己的舞蹈技巧和理論知識。她夢想在將來將舞蹈融入個人職業生涯，為舞蹈事業的發展貢獻自己力量。    在靜儀的舞蹈道路上，家人的支持也是她堅持下去的重要動力。她的母親表示，支持女兒跳舞是因為相信舞蹈能夠培養女兒的自信心、表達能力和創造力。她期待女兒能在舞蹈領域取得更好的成績，並會一直陪伴在她身邊，給予她所需要的支援和鼓勵。此外，在學習路途上，盧靜儀亦感恩遇上TDSM的PP老師、龍哥哥及Loumeng姐姐等一直以來的悉心教導，讓她能取得優異成績。    隨着澳門舞蹈文化的蓬勃發展，相信這位從爵士到機械舞的跨界舞者，將在未來的道路上繼續閃耀，為街舞文化注入更多活力和創新。    文：瑪姬里妮,http://www.macaodaily.com/html/2024-05/26/content_1757626.htm,隨着澳門舞蹈文化的蓬勃發展，相信這位從爵士到機械舞的跨界舞者，將在未來的道路上繼續閃耀，為街舞文化注入更多活力和創新,澳門 街舞 新星         盧靜儀 爵士 到 機械舞 轉型         十六 歲 的 澳門 少女 盧靜儀 ， 以其 從 爵士舞 到 機械舞 的 “ 跨界 ” 才華 ， 成為 了 街舞 潮流 中 的 耀眼 新星 。 今年 ， 她 已 先後在 紫禁 之巔 Ⅲ FREESTYLE   Battle 比賽 贏得 冠 軍 ， 亦 在 亞洲 中學生 校際嘻哈 舞蹈 大賽 分別 在 All   Style   Battle 個 人賽 贏得 冠 軍 ， Choreography 齊舞 中 與 隊友 獲亞 軍 ， 更 有 機會 代表 澳門 參 加重 慶舉行 的 大國 少年 BDS 世界 青少年 街舞 大賽 Vol.4 總決賽 ， 開闊 眼界 和 視野 。         從 小 就 對 舞蹈 充滿 熱情 的 盧靜儀 ， 最初 接觸 並熱衷 於 爵士舞 。 隨着 對 舞蹈 世界 的 深入 探索 ， 她 對 機械舞 ( Popping ) 這一 充滿 力量感 和 獨特風格 的 舞蹈 形式 產生 濃厚 興趣 。 靜儀 坦言 ， 正是 對 不同 舞蹈 風格 的 好奇心 和 渴望 挑戰 自我 的 精神 ， 促使 她 做出 了 從 爵士 到 機械舞 的 轉變 。         轉型 之路 並非 一帆 風順 。 機械舞 強調 細 緻 的 肌肉 控制 和 動作 技巧 ， 對 舞者 來 說 是 一個 全新 的 挑戰 。 然而 ， 靜儀 並未 因此 而 退縮 ， 反而 更加 努力 地 投入 練習 。 她 堅持 不懈 的 努力 和 對 舞蹈 的 熱情 ， 最終 讓 她 克服 了 轉型 過程 中 的 種種 困難 ， 並以 出色 的 表現 征服 了 觀眾 和 評委 。         在 舞蹈 比賽 中 ， 靜儀 不僅 參 與 了 團隊 齊舞 的 比賽 ， 更 在 個 人 競技 ( Battle ) 中展現 了 自己 的 獨特風格 和 技巧 。 她 表示 ， 雖然 兩種 比賽 形式 各有 魅力 ， 但 她 更 享受 個 人 競技 的 挑戰 和 刺激 。 在 競技中 ， 她 可以 充分 展現 自己 的 風格 和 水準 ， 與 對 手 進行 交流 和 切磋 ， 從 而 不斷 提升 自己 的 舞蹈 水平 。         面對 即 將到 來 的 大學 生活 ， 靜儀 已經 有 了 明確 的 規劃 。 她 希望 能夠 繼續 深造 舞蹈 相關 的 專業 課程 ， 進 一步 提升 自己 的 舞蹈 技巧 和 理論 知識 。 她 夢 想 在 將來將 舞蹈 融入 個 人 職業 生涯 ， 為 舞蹈 事業 的 發展 貢獻 自己 力量 。         在 靜儀 的 舞蹈 道路 上 ， 家人 的 支持 也 是 她 堅持 下去 的 重要 動力 。 她 的 母親 表示 ， 支持 女兒 跳舞 是 因為 相信 舞蹈 能夠 培養 女兒 的 自信心 、 表達 能力 和 創造力 。 她 期待 女兒 能 在 舞蹈 領域 取得 更好 的 成績 ， 並會 一直 陪伴 在 她 身邊 ， 給予 她 所 需要 的 支援 和 鼓勵 。 此外 ， 在 學習 路途 上 ， 盧靜儀 亦 感恩 遇上 TDSM 的 PP 老師 、 龍 哥哥 及 Loumeng 姐姐 等 一直 以來 的 悉心 教導 ， 讓 她 能 取得 優異 成績 。         隨着 澳門 舞蹈 文化 的 蓬勃 發展 ， 相信 這位 從 爵士 到 機械舞 的 跨界 舞者 ， 將在 未來 的 道路 上繼續 閃耀 ， 為 街舞 文化 注入 更 多 活力 和 創新 。         文 ： 瑪姬 里 妮,2024-05-26
