Title,Content,Link,Summary,Preprocessed_Content,Date
（幸福魔法）莫名其妙的恐懼    祁  淇,莫名其妙的恐懼    我無法解釋，為什麼我會對某些事物產生莫名其妙的恐懼，找不到源頭，也毫無根據，只是打從心底感到害怕。    我特別怕狗，不管大狗小狗都害怕極了，小時候在街頭看到一頭狗從街尾迎面而來，我會立即走到對面馬路避開，長大後告訴自己冷靜，狗才不會無緣無故襲擊我，於是面對一頭懶洋洋趴着的大狗，或是有主人拉着狗繩的犬隻，我可以戰戰兢兢地在旁邊走過，當然還是得保持安全距離，確保牠不會碰到我。然而，我絕對不會說我對狗的恐懼有所減少，試過有小狗熱情地衝過來，把我嚇得當場哭起來，那一刻連我自己也嚇一跳，沒想過會被嚇哭，但眼淚就是這樣不請自來，完全不受控。小狗的主人用難以理解的眼神瞪着我，彷彿我冒犯了他的心肝寶貝。我受驚嚇卻像做錯事的人，滿腹委屈讓我從此更怕狗，大概已經到了無可救藥的地步。    事實上我不單怕狗，幾乎害怕所有動物，總覺得牠們會突如其來做出超乎想像的行為，而那些行為可能會傷害到我，所以根本不敢接近任何動物。    另外一個無法解釋的恐懼是掉落的頭髮。    不管在任何地方，但凡看到一條（或多條）頭髮我都會覺得十分噁心，不敢再多看一眼，更不敢自行清理。如果那條頭髮是濕的，甚至會產生反胃的生理反應，因此在飯菜上看到一條頭髮之後，我便無法再進食。    偏偏啊，我掉頭髮掉得很兇，家裏常見散落各處的頭髮，真是無處可逃，只希望我的頭髮不要隨便掉落。    恐懼如此莫名其妙，旁人總是無法理解，這有什麼好怕呢？我討厭別人的質疑，所以從來不會懷疑別人的恐懼，有些事情自己不懂或不理解，沒有必要質疑對方，那只顯得自己連基本禮貌也欠奉，尊重別人也是尊重自己的表現。    祁    淇,http://www.macaodaily.com/html/2024-05/15/content_1755047.htm,我特別怕狗，不管大狗小狗都害怕極了，小時候在街頭看到一頭狗從街尾迎面而來，我會立即走到對面馬路避開，長大後告訴自己冷靜，狗才不會無緣無故襲擊我，於是面對一頭懶洋洋趴着的大狗，或是有主人拉着狗繩的犬隻，我可以戰戰兢兢地在旁邊走過，當然還是得保持安全距離，確保牠不會碰到我,莫名其妙 的 恐懼         我無法 解釋 ， 為 什麼 我會 對 某些 事物 產生 莫名其妙 的 恐懼 ， 找 不到 源頭 ， 也 毫無根據 ， 只是 打 從 心底 感到 害怕 。         我 特別 怕 狗 ， 不管 大狗 小狗 都 害怕 極了 ， 小時候 在 街頭 看到 一頭 狗 從 街尾 迎面 而來 ， 我會 立即 走到 對 面馬路 避開 ， 長 大後告訴 自己 冷靜 ， 狗 才 不會 無緣 無故 襲擊 我 ， 於 是 面 對 一頭 懶 洋洋 趴着 的 大狗 ， 或是 有 主人 拉 着 狗 繩 的 犬 隻 ， 我 可以 戰戰兢兢地 在 旁邊 走過 ， 當然 還是 得 保持 安全 距離 ， 確保 牠 不會 碰到 我 。 然而 ， 我絕 對 不會 說 我 對 狗 的 恐懼 有所 減少 ， 試過 有 小狗 熱情 地衝 過來 ， 把 我 嚇得 當場 哭 起來 ， 那一刻 連我 自己 也 嚇一 跳 ， 沒想 過會 被 嚇哭 ， 但 眼淚 就是 這樣 不 請 自來 ， 完全 不 受控 。 小狗 的 主人 用難 以 理解 的 眼神 瞪 着 我 ， 彷 彿 我 冒犯 了 他 的 心肝 寶貝 。 我受 驚嚇 卻 像 做 錯事 的 人 ， 滿腹 委屈 讓 我 從 此 更 怕 狗 ， 大概 已經 到 了 無 可救藥 的 地步 。         事實 上 我 不 單怕 狗 ， 幾乎 害怕 所有 動物 ， 總覺 得 牠 們 會 突 如其 來 做出 超乎想像 的 行為 ， 而 那些 行為 可能 會 傷害 到 我 ， 所以 根本 不敢 接近 任何 動物 。         另外 一個 無法 解釋 的 恐懼 是 掉落 的頭 髮 。         不管 在 任何 地方 ， 但凡 看到 一條 （ 或多條 ） 頭 髮 我 都 會 覺得 十分 噁 心 ， 不敢 再 多 看 一眼 ， 更 不敢 自行 清理 。 如果 那條頭 髮 是 濕 的 ， 甚至 會產生 反胃 的 生理 反應 ， 因此 在 飯 菜 上 看到 一條頭 髮 之 後 ， 我 便 無法 再 進食 。         偏偏 啊 ， 我 掉頭 髮 掉 得 很 兇 ， 家 裏 常見 散落 各處 的頭 髮 ， 真是 無處 可 逃 ， 只 希望 我的頭 髮 不要 隨便 掉落 。         恐懼 如此 莫名其妙 ， 旁人 總是 無法 理解 ， 這有 什麼 好 怕 呢 ？ 我 討厭別 人 的 質疑 ， 所以 從來 不會 懷疑別 人 的 恐懼 ， 有些 事情 自己 不 懂 或 不 理解 ， 沒有 必要 質疑 對方 ， 那 只 顯得 自己 連 基本 禮貌 也 欠 奉 ， 尊重 別人 也 是 尊重 自己 的 表現 。         祁         淇,2024-05-15
（尋樂人生）車上遇到談吐有禮的小孩……    沈尚青,車上遇到談吐有禮的小孩……    在巴士上遇到個穿校服的男孩，我們同一座位。甫坐下他就把一個圓形軟枕放到膝上，拿出個大屏幕手機，就打起遊戲來。像所有打機的孩子一樣，他鼻樑上當然地架着副眼鏡。日常在公交上如遇到鄰座的年輕父母或祖母用手機湊仔，主動給孩子看手機畫面，或對幼童拿手機玩遊戲視若無睹，我一定會婉轉勸喻他們不要這樣做。對我而言，講這些話自身沒任何成本，反正落車後就不再相見，無論對方討厭又好感恩又好，有一天他們總會記得在公交上曾經有個好管閒事的老太婆勸他／她不要太早給孩子接觸手機，免他們提早進入一個無法設防的邪惡世界。    但面對小孩，你就不能說同樣的話。因為他不會聽，並且感到受冒犯。一個人如果覺得受到冒犯，無論你說的話多有道理，他都會抗拒，甚至反其道而行。青春期的孩子，十居其九都會這樣。於是我就從他膝下的軟枕作搭訕話題：“帶個軟枕上學有何用？”“用來墊着頸部，舒服啲。”對我的提問他只回答了一半。我還有兩個站就下車，馬上轉入正題：“平日有看書嗎？”完全不談打機。孩子馬上就意會到我其實想說些什麼。“我每天中午都會去圖書館，平日只在乘車時候玩手機遊戲。我玩的遊戲有些是學習式的，例如學英文，可以通過遊戲來學習英文字。”我當下笑了。這孩子真聰明，似有備而來，可能曾被無數長輩問過同樣問題。如此淡定而巧妙的回答，令我有些意外。我以為他是小學生，原來已經初中二。我選擇相信他的所有話，因為他彬彬有禮，對答如流。這些應該是有閱讀素養的孩子才會有的談吐素質。    和孩子道別後我下了車，回家路上竟樂了一陣子。希望這孩子真能抗拒手機的虛擬及現實世界的不良誘惑，親近書本，在成長的路上，有底氣，有力量，一路平安。    （親己閱讀 · 一）    沈尚青,http://www.macaodaily.com/html/2024-05/15/content_1755048.htm,對我而言，講這些話自身沒任何成本，反正落車後就不再相見，無論對方討厭又好感恩又好，有一天他們總會記得在公交上曾經有個好管閒事的老太婆勸他／她不要太早給孩子接觸手機，免他們提早進入一個無法設防的邪惡世界,車上 遇到 談吐 有禮 的 小孩 … …         在 巴士 上 遇到 個 穿 校服 的 男孩 ， 我們 同一 座位 。 甫 坐下 他 就 把 一個 圓形 軟 枕 放到 膝上 ， 拿出 個 大屏幕 手機 ， 就 打 起遊 戲來 。 像 所有 打機 的 孩子 一樣 ， 他 鼻 樑 上 當然 地架 着 副 眼鏡 。 日常 在 公交 上 如 遇到 鄰座 的 年 輕 父母 或 祖母 用 手機 湊 仔 ， 主動給 孩子 看手 機畫面 ， 或 對 幼童 拿手 機玩遊 戲視 若 無睹 ， 我 一定 會婉轉 勸喻 他們 不要 這樣 做 。 對 我 而言 ， 講這些 話 自身 沒 任何 成本 ， 反正 落車 後 就 不再 相見 ， 無論 對方 討厭 又 好 感恩 又 好 ， 有 一天 他們 總會 記得 在 公交 上 曾 經有 個 好 管閒事 的 老太婆 勸 他 ／ 她 不要 太 早給 孩子 接觸 手機 ， 免 他們 提早 進入 一個 無法 設防 的 邪 惡 世界 。         但面 對 小孩 ， 你 就 不能 說 同樣 的 話 。 因為 他 不會 聽 ， 並且 感到 受 冒犯 。 一個 人 如果 覺得 受到 冒犯 ， 無論 你 說 的 話 多 有 道理 ， 他 都 會 抗拒 ， 甚至 反其道 而行 。 青春期 的 孩子 ， 十居 其 九 都 會 這樣 。 於 是 我 就 從 他 膝下 的 軟 枕作 搭 訕 話題 ： “ 帶個 軟 枕上 學有 何用 ？ ” “ 用來 墊 着 頸部 ， 舒服 啲 。 ” 對 我 的 提問 他 只 回答 了 一半 。 我 還有 兩個 站 就 下車 ， 馬 上 轉入 正題 ： “ 平日 有 看書 嗎 ？ ” 完全 不談 打機 。 孩子 馬 上 就 意會 到 我 其 實想 說些 什麼 。 “ 我 每天 中午 都 會 去 圖書館 ， 平日 只 在 乘車 時候 玩手 機遊戲 。 我 玩 的 遊戲 有些 是 學習式 的 ， 例如 學 英文 ， 可以 通過 遊戲來 學習 英文字 。 ” 我 當下 笑 了 。 這 孩子 真聰明 ， 似有備 而 來 ， 可能 曾 被 無數長 輩 問過 同樣 問題 。 如此 淡定 而 巧妙 的 回答 ， 令 我 有些 意外 。 我 以 為 他 是 小學生 ， 原來 已經 初中 二 。 我 選擇 相信 他 的 所有 話 ， 因為 他 彬彬 有禮 ， 對答 如流 。 這些 應該 是 有 閱讀 素養 的 孩子 才 會 有 的 談吐素質 。         和 孩子 道別 後 我 下 了車 ， 回家路上 竟樂 了 一陣子 。 希望 這 孩子 真能 抗拒 手機 的 虛擬 及 現實 世界 的 不良 誘惑 ， 親近 書本 ， 在 成長 的 路上 ， 有 底氣 ， 有 力量 ， 一路平安 。         （ 親己 閱讀   ·   一 ）         沈尚青,2024-05-15
（筆雯集）從肥婆肥佬說到肥仔   冬春軒,從肥婆肥佬說到肥仔    “肥仔肥豚豚，捉到肥仔去拜神。點着蠟燭唔見人。”這是我輩童年時代戲弄肥仔的童謠。“豚豚”兩字其實是小肥豬，以之喻人，猶言人瘦而曰“瘦雞”，一理也。    肥字作為人的體態相當廣泛，不論男女老幼都有肥胖的。肥婆、肥佬、肥妹、肥仔，隨處可見，有人說肥頭耷耳是福相，這是必然的。難道憂柴憂米之輩會肥嗎？肥胖是大亨的象徵，毋須找甚麼理據，只要聽一下舞廳的音樂，聲聲都是“肥闊、肥闊，肥下闊的”這樣的節奏和旋律，未聞“瘦下闊的”之聲。    上面說過“肥仔肥豚豚”。豚，《說文》謂小豕也。即是廣府語的“豬仔”。《廣韻 · 魂韻》，音徒渾切。而形容肥胖的詞語還有“肥腯腯”，都是在“肥”字之後加上叠字，藉此加強語氣。查《廣韻 · 沒韻》：“腯，陀骨切。”說得更近似應為“地屹切”第一聲。肥，也曰腯，不過也有點區別，《說文》謂牛羊曰肥；豕曰腯。不過把它移用於人，便說成“肥腯腯”。    有一種肥與胖無關，那是“肥”。《集韻 · 勘韻》作“奴紺切”，音近於“林”，形容肉之肥膩。坊間有句民諺曰：“人怕出名豬怕肥。”《糊塗世界》卷九：“這些差役個個磨拳擦掌，擇肥而噬。到得次日一早，果然捉了七個人來。”    打麻將賭術最差者被人稱之為“魚腩”，蓋魚之中最肥美可口的部位正是魚腩。人們喜與他攻打四方城，實在覬準那魚腩部分，擇肥而噬也。    今古的觀念不同，昔日人們認為肥才美，才健康，尤以唐代為最，楊玉環是一例。今日似乎畏肥，主張纖體。美人猶如美饌，我喜歡半肥瘦的“五花腩”，飲得杯落。    冬春軒,http://www.macaodaily.com/html/2024-05/15/content_1755049.htm,“豚豚”兩字其實是小肥豬，以之喻人，猶言人瘦而曰“瘦雞”，一理也,從 肥婆 肥佬說 到 肥仔         “ 肥仔 肥豚 豚 ， 捉到 肥 仔去 拜神 。 點着 蠟燭 唔 見 人 。 ” 這是 我輩 童年 時代戲 弄 肥仔 的 童謠 。 “ 豚豚 ” 兩字 其實 是 小肥豬 ， 以之喻 人 ， 猶言人 瘦 而 曰 “ 瘦雞 ” ， 一理 也 。         肥字作 為 人 的 體態 相當 廣泛 ， 不論 男女老幼 都 有 肥胖 的 。 肥婆 、 肥佬 、 肥妹 、 肥仔 ， 隨處 可見 ， 有人 說 肥頭 耷耳是 福相 ， 這是 必然 的 。 難道 憂 柴憂米 之輩會 肥 嗎 ？ 肥胖 是 大亨 的 象 徵 ， 毋須 找 甚麼 理據 ， 只要 聽 一下 舞廳 的 音樂 ， 聲聲 都 是 “ 肥闊 、 肥闊 ， 肥下闊 的 ” 這樣 的 節奏 和 旋律 ， 未聞 “ 瘦下闊 的 ” 之聲 。         上面 說過 “ 肥仔 肥豚 豚 ” 。 豚 ， 《 說文 》 謂 小 豕 也 。 即 是 廣府語 的 “ 豬仔 ” 。 《 廣韻   ·   魂韻 》 ， 音徒 渾切 。 而 形容 肥胖 的 詞語 還有 “ 肥 腯 腯 ” ， 都 是 在 “ 肥 ” 字 之 後 加上 叠字 ， 藉此 加強 語氣 。 查 《 廣韻   ·   沒韻 》 ： “ 腯 ， 陀骨切 。 ” 說 得 更 近似 應為 “ 地屹切 ” 第一 聲 。 肥 ， 也 曰 腯 ， 不過 也 有 點區別 ， 《 說文 》 謂 牛羊 曰 肥 ； 豕 曰 腯 。 不過 把 它 移用 於 人 ， 便 說 成 “ 肥 腯 腯 ” 。         有 一種 肥 與 胖無關 ， 那 是 “ 肥 ” 。 《 集韻   ·   勘韻 》 作 “ 奴紺切 ” ， 音近 於 “ 林 ” ， 形容 肉 之 肥膩 。 坊 間 有 句民諺 曰 ： “ 人怕 出名 豬怕 肥 。 ” 《 糊塗 世界 》 卷 九 ： “ 這些 差役 個個 磨拳擦掌 ， 擇肥 而 噬 。 到 得 次日 一早 ， 果然 捉 了 七個 人來 。 ”         打麻將 賭術 最差 者 被 人稱 之 為 “ 魚腩 ” ， 蓋魚 之中 最 肥美 可口 的 部位 正是 魚腩 。 人們 喜 與 他 攻打 四方 城 ， 實在 覬準 那魚 腩 部分 ， 擇肥 而 噬 也 。         今古 的 觀念 不同 ， 昔日 人們 認為 肥 才 美 ， 才 健康 ， 尤 以 唐代 為 最 ， 楊玉環 是 一例 。 今日 似乎 畏肥 ， 主張 纖體 。 美人 猶如美 饌 ， 我 喜歡 半 肥瘦 的 “ 五花 腩 ” ， 飲得杯 落 。         冬春 軒,2024-05-15
陳思圻願繼續拍檔搵銀,常與“衰佬”鄭世豪碰面    陳思圻願繼續拍檔搵銀    日前舉行的“HOY TV 轉播2024巴黎奧運會啟動禮”，公佈旗下三條電視頻道全力轉播奧運精彩賽事，多位前無線藝人陳思圻（陳偉琪）、蘇韻姿、朱智賢、孫慧雪等，到場出席支持活動。蘇韻姿與朱智賢先後離開無線娘家回復自由身，當日齊亮相HOY台活動，二人說以前除了台慶節目以外均未有合作機會，不過私下二人頗老友，笑言是“姿朱”組合。    當日出席活動的陳思圻指，近期忙於設計有關餐廳的手機應用程式，並即將會推出，此外她有接主持和唱歌的演出，又分別為HOY TV及ViuTV拍過綜藝節目。談及《愛·回家之開心速遞》拍檔“細龍生”鄭世豪亦已離巢，她透露經常在公眾場合碰面：“上次我在拳賽上見到個‘衰佬’，都有傾開一齊合作。”會否延續“細龍生”、“細龍太”的熒屏拍檔形象？她笑言可以繼續做CP，但不一定要以過往形象出現，可以組合不同的新角色。    孫慧雪朱智賢說二人同樣愛狗而結緣，對方的狗狗是她“契仔”。今次參與HOY TV又是否朱智賢給牽線？蘇韻姿說現屬自由身，亦的確有傾合作，是主持還是演出要拭目以待。無線也有奧運宣傳，現為友台站台會否怕大台生氣？兩人說不會擔心，即使無線有適合工作一樣會參與，抱歡迎態度去接工作。    蘇韻姿近日搬新屋，她將《愛·回家之開心速遞》超過一千八百集劇本鋪出來留個紀念，但由於裝滿幾大箱不捨都要斷捨離，只保留自己較重戲和重要集數的劇本：“人生要向前行！”朱智賢說想向蘇韻姿學唱歌，自認唱歌不上不下，反而做“魔音”更有市場。為何不叫男友謝東閔教？她笑說：“我不會聽他講，太熟也教不到，他一講我會話他。”    蘇韻姿指自己教唱歌收生反應不錯，主要是小朋友粉絲想來學。這次也是朱智賢為她牽線與謝東閔的音樂學校合作？蘇韻姿說世界很細，她跟吳業坤傾起合作，才知他與謝東閔一同拍檔。,http://www.macaodaily.com/html/2024-05/15/content_1754981.htm,蘇韻姿與朱智賢先後離開無線娘家回復自由身，當日齊亮相HOY台活動，二人說以前除了台慶節目以外均未有合作機會，不過私下二人頗老友，笑言是“姿朱”組合,常 與 “ 衰佬 ” 鄭世豪 碰面         陳 思圻 願繼續 拍 檔 搵 銀         日前 舉行 的 “ HOY   TV   轉播 2024 巴黎 奧運會 啟動禮 ” ， 公 佈 旗下 三條 電視 頻道 全力 轉播 奧運 精彩 賽事 ， 多位 前無線 藝人 陳 思圻 （ 陳 偉琪 ） 、 蘇韻姿 、 朱智賢 、 孫慧雪 等 ， 到場 出席 支持 活動 。 蘇韻姿 與 朱智賢 先後離 開無線 娘家 回 復 自由 身 ， 當日齊 亮相 HOY 台 活動 ， 二人 說 以前 除了 台慶 節目 以外 均 未有 合作 機會 ， 不過 私下 二人 頗 老友 ， 笑言 是 “ 姿朱 ” 組合 。         當日 出席 活動 的 陳 思圻 指 ， 近期 忙 於 設計 有 關餐 廳 的 手機 應用 程式 ， 並即 將會 推出 ， 此外 她 有 接 主持 和 唱歌 的 演出 ， 又 分別 為 HOY   TV 及 ViuTV 拍過 綜藝 節目 。 談及 《 愛 · 回家 之開 心速 遞 》 拍檔 “ 細龍生 ” 鄭世豪 亦 已 離巢 ， 她 透露 經常 在 公眾 場合 碰面 ： “ 上次 我 在 拳賽 上 見 到 個 ‘ 衰佬 ’ ， 都 有 傾開 一齊 合作 。 ” 會否 延續 “ 細龍生 ” 、 “ 細龍 太 ” 的 熒屏 拍 檔 形象 ？ 她 笑 言 可以 繼續 做 CP ， 但 不 一定 要 以過 往 形象 出現 ， 可以 組合 不同 的 新 角色 。         孫慧雪 朱智賢 說 二人 同樣 愛狗 而 結緣 ， 對方 的 狗狗 是 她 “ 契仔 ” 。 今次 參 與 HOY   TV 又 是否 朱智賢給 牽線 ？ 蘇韻姿 說 現屬 自由 身 ， 亦 的 確有 傾 合作 ， 是 主持 還是 演出 要 拭目以待 。 無線 也 有 奧運 宣傳 ， 現為 友台 站台 會否 怕 大台 生氣 ？ 兩人 說 不會 擔心 ， 即使 無線 有 適合 工作 一樣 會 參 與 ， 抱歡 迎態度 去 接 工作 。         蘇韻姿 近日 搬 新屋 ， 她將 《 愛 · 回家 之開 心速 遞 》 超過 一千八百 集劇本 鋪 出來 留個 紀念 ， 但 由 於 裝滿 幾 大箱 不 捨 都 要 斷 捨 離 ， 只 保留 自己 較 重戲 和 重要 集數 的 劇本 ： “ 人生 要 向前 行 ！ ” 朱智賢 說 想 向 蘇韻 姿學 唱歌 ， 自認 唱歌 不上不下 ， 反而 做 “ 魔音 ” 更 有 市場 。 為 何不 叫 男友 謝東 閔教 ？ 她 笑 說 ： “ 我 不會 聽 他講 ， 太熟 也 教 不到 ， 他 一講 我會 話 他 。 ”         蘇韻 姿指 自己 教 唱歌 收生 反應 不錯 ， 主要 是 小朋友 粉絲想 來學 。 這次 也 是 朱智賢 為 她 牽線 與 謝東 閔 的 音樂學校 合作 ？ 蘇韻姿 說 世界 很細 ， 她 跟 吳業 坤 傾起 合作 ， 才 知 他 與 謝東 閔 一同 拍檔 。,2024-05-15
陳法拉新片講澳門故事,陳法拉新片講澳門故事    進軍荷里活的陳法拉，即將加盟電影《The Ballad of a Small Player》，並擔任女主角，男主角則是金球獎影帝哥連費路(Colin Farrell)。電影由德國導演愛德華伯格 (Edward Berge)執導，二○二二年，他執導的戰爭片《西線無戰事》，榮獲奧斯卡最佳外語片丶最佳攝影丶最佳配樂及最佳美術指導，他更憑此片贏得英國電影學院獎最佳導演及最佳改編劇本，此片亦於同一頒獎禮贏得最佳影片等共七大獎項。    《The Ballad Of A Small Player》改編自同名暢銷小說，故事講述一名賭徒飽歷滄桑和面對債務困擾，於是決定在澳門生活，卻遇到一位有機會拯救到他的人。電影預計暑假正式開拍，在亞洲取景。該片還有奧斯卡金像獎最佳女配角泰達史雲頓(Tilda Swinton) 特別演出，三人在電影中互相切磋演技。  此乃陳法拉演出全球大賣的《尚氣與十環幫傳奇》及《哥斯拉 ✕ 金剛：新帝國》之後，又一部參與荷里活之作。,http://www.macaodaily.com/html/2024-05/15/content_1754984.htm,電影由德國導演愛德華伯格 (Edward Berge)執導，二○二二年，他執導的戰爭片《西線無戰事》，榮獲奧斯卡最佳外語片丶最佳攝影丶最佳配樂及最佳美術指導，他更憑此片贏得英國電影學院獎最佳導演及最佳改編劇本，此片亦於同一頒獎禮贏得最佳影片等共七大獎項,陳 法拉 新片 講澳門 故事         進 軍 荷里活 的 陳 法拉 ， 即將 加盟 電影 《 The   Ballad   of   a   Small   Player 》 ， 並擔 任 女主角 ， 男主角 則是 金球 獎 影帝 哥連費路 ( Colin   Farrell ) 。 電影 由德國導 演愛德華 伯格   ( Edward   Berge ) 執導 ， 二 ○ 二 二年 ， 他 執導 的 戰爭片 《 西線 無戰事 》 ， 榮獲 奧斯卡 最佳 外語片 丶 最佳 攝影 丶 最佳 配樂及 最佳 美術 指導 ， 他 更 憑 此片 贏得 英國 電影 學院獎 最佳 導演 及 最佳 改編 劇本 ， 此片 亦 於 同一 頒獎 禮贏 得 最佳影片 等 共七大獎 項 。         《 The   Ballad   Of   A   Small   Player 》 改編 自 同名 暢銷 小 說 ， 故事 講述 一名 賭徒 飽 歷滄桑和面 對 債務 困擾 ， 於 是 決定 在 澳門 生活 ， 卻 遇到 一位 有 機會 拯救 到 他 的 人 。 電影 預計 暑假 正式 開拍 ， 在 亞洲 取景 。 該片 還有 奧斯卡 金像 獎 最佳 女配角 泰達史 雲頓 ( Tilda   Swinton )   特別 演出 ， 三人 在 電影 中 互相切磋 演技 。     此 乃 陳 法拉 演出 全球 大賣 的 《 尚氣 與 十環幫 傳奇 》 及 《 哥斯拉   ✕   金剛 ： 新帝國 》 之 後 ， 又 一部 參與 荷里活 之作 。,2024-05-15
