Title,Content,Link,Summary,Preprocessed_Content,Date
A區地盤大面積路陷,疑暴雨水土流失導致    A區地盤大面積路陷    【本報消息】氣象局昨日上午九時二十五分發出黃色暴雨警告信號，十五分鐘後改發紅色暴雨警告信號，持續至十一時改發“黃雨”信號。“紅雨”信號下，本澳和路氹廣泛地區持續強降雨，其中新城A區一處封閉路段及路環黑沙差不多同一時間分別發生大面積路陷及塌樹事件，兩宗事件均無人受傷。    非開放冇人車落坑    昨日上午近十一時，“紅雨”信號仍然生效期間，新城A區馬萬祺博士大馬路及濠江圓形地封閉路段突然出現大面積路陷。路陷深度約三米，面積約六米乘六米。路陷引致多個“水馬”跌入坑洞內，多條管道外露。    消防局接受本報查詢上述路陷事件時表示，沒有收到求助。但自氣象局發出“紅雨”信號後，消防局派員到各區巡查時發現事件。經消防員了解，現場屬於封閉路段，無人及車輛跌落坑洞內。    施工人員回塡沙坭    治安警接受本報查詢同樣表示沒有收到報案，但知悉情況後曾派警員到場了解。證實現場並非開放路段，沒有影響行車。現場所見，工程人員下午忙於用挖泥車向坑洞回塡沙泥，以填平坑洞。    共同管道工程範圍    公共建設局昨日下午發出新聞稿稱，昨早紅色暴雨訊號發出期間，新城A區濠江圓形地及馬萬祺博士大馬路已圍封並正進行共同管道工程的工地內，一處路面出現泥土坍塌。該局高度重視事件，即時派員到現場了解情況。經初步排查，事發位置旁正開挖路面，懷疑在開挖過程中因大雨導致旁邊位置水土流失引致坍塌。事件中無人受傷，無施工機械受損，亦沒有影響公共道路行車。承建商已採取必要措施確保工地安全，公共建設局同時要求承建公司及監理公司開展工作時加強留意天氣情況。,http://www.macaodaily.com/html/2024-08/16/content_1775002.htm,非開放冇人車落坑    昨日上午近十一時，“紅雨”信號仍然生效期間，新城A區馬萬祺博士大馬路及濠江圓形地封閉路段突然出現大面積路陷,疑 暴雨 水土流失 導致         A 區地 盤大面 積路陷         【 本報 消息 】 氣象局 昨日 上午 九時 二十五分 發出 黃 色 暴雨 警告 信號 ， 十五分 鐘後改 發紅色 暴雨 警告 信號 ， 持續 至 十一 時 改發 “ 黃 雨 ” 信號 。 “ 紅雨 ” 信號 下 ， 本澳 和 路 氹 廣泛 地區 持續強 降雨 ， 其中 新城 A 區一處 封閉 路段 及路環 黑沙 差不多 同一 時間 分別 發生 大面 積路 陷及 塌 樹 事件 ， 兩宗 事件 均 無人 受傷 。         非開 放 冇 人車 落坑         昨日 上午 近 十一 時 ， “ 紅雨 ” 信號 仍然 生效 期間 ， 新城 A 區馬 萬祺 博士 大馬路 及 濠江 圓形 地 封閉 路段 突然 出現 大面 積路陷 。 路陷 深度 約 三米 ， 面積 約 六米 乘 六米 。 路陷 引致 多個 “ 水馬 ” 跌入 坑洞 內 ， 多條 管道 外露 。         消防局 接受 本報 查詢 上述 路陷 事件 時 表示 ， 沒有 收到 求助 。 但 自氣 象局 發出 “ 紅雨 ” 信號 後 ， 消防局 派員到 各區 巡查 時 發現 事件 。 經 消防 員 了解 ， 現場屬 於 封閉 路段 ， 無人及 車輛 跌落 坑洞 內 。         施工 人員 回 塡 沙 坭         治安警 接受 本報 查詢 同樣 表示 沒有 收到 報案 ， 但 知悉 情況 後 曾 派 警員 到場 了解 。 證實 現場 並非 開放 路段 ， 沒有 影響 行車 。 現場 所見 ， 工程 人員 下午 忙 於 用 挖泥 車向 坑洞 回 塡 沙泥 ， 以 填平 坑洞 。         共同 管道工程 範圍         公共 建設局 昨日 下午 發 出新 聞稿 稱 ， 昨早 紅色 暴雨 訊號 發出 期間 ， 新城 A 區 濠江 圓形 地及 馬 萬祺 博士 大馬路 已圍 封 並正 進行 共同 管道工程 的 工地 內 ， 一處 路面 出現 泥土 坍塌 。 該局 高度 重視 事件 ， 即時 派員到 現場 了解 情況 。 經 初步 排查 ， 事發 位置 旁正開 挖 路面 ， 懷疑 在 開 挖 過程 中 因 大雨 導致 旁邊 位置 水土流失 引致 坍塌 。 事件 中無人 受傷 ， 無 施工 機械 受損 ， 亦 沒 有 影響 公共 道路 行車 。 承建商 已 採取 必要措施 確保 工地 安全 ， 公共 建設局 同時 要求 承建 公司 及 監理 公司 開展 工作 時加強 留意 天氣 情況 。,2024-08-16
議員倡科學檢測地下沙土狀況,新城A區路面紅雨下地陷惹關注    議員倡科學檢測地下沙土狀況    【本報消息】新城A區濠江圓形地附近昨日在“紅雨”下發生路陷。立法議員、共建好家園協會副理事長馬耀鋒表示，是次路陷的面積較大，且在本澳未來新城區的交通道路範圍，引起社會及居民的廣泛關注和討論。促請當局盡早確保地下的安全狀況，並透過科學儀器和手段檢測新城A區路面下的沙土情況。建議檢查路陷有否影響周邊建成樓宇及地下空間結構安全，提高安全保障，排解風險。    檢查周邊經屋結構    馬耀鋒表示，新城A區作為本澳新建設的重要城區，人口密集且設有學校村等重點城市建設項目，釋放地下空間資源潛力是其規劃重點，以容納大量地下共同管道、人行通道以及商業街道。且輕軌東線部分線段亦預計通過地下行駛，可謂是A區的“生命線”。是次路陷引起社會關注城區及地下設施等一系列“生命線”的安全。    路陷的原因多樣，參考其他地區的經驗，一般常見為強烈降雨造成沙土流失、地下水管爆裂，又或周邊施工造成。根據公建局提供的資訊，是次路陷初步懷疑因工程開挖加上大雨導致。馬耀鋒促請當局盡早採取補救措施，要求優化後續工程的準備工作，並應檢查周邊新建成經濟房屋的結構安全，保證樓宇安全不受事件影響。同時建議當局用科學檢測（如透地雷達）等技術及手段，協助短時間內初步探測地下結構，搜集資料分析及評估周邊區域及各交通主要幹道的地下沙土情況，防患未然。    A區頻水浸惹關注    本澳氣候高溫多雨，加上近年強降雨等極端天氣頻發，高效的排水系統對於保護地下沙土至關重要。馬耀鋒表示，A區的雨水管道按二十年一遇的標準建設。惟接獲不少意見反映，過去區內及交通幹道大雨下經常出現排水不及。昨日交通局提供的路面實況中亦可見區內路面出現明顯積水。期望當局進一步檢視A區現時雨水管道及排水泵的作用，找出排水不及的原因，必要時採取針對性強化工程，確保雨水管道發揮應有效果。,http://www.macaodaily.com/html/2024-08/16/content_1775003.htm,同時建議當局用科學檢測（如透地雷達）等技術及手段，協助短時間內初步探測地下結構，搜集資料分析及評估周邊區域及各交通主要幹道的地下沙土情況，防患未然,新城 A 區 路面 紅雨下 地陷 惹 關注         議員倡 科學 檢測 地下 沙土 狀況         【 本報 消息 】 新城 A 區 濠江 圓形 地 附近 昨日 在 “ 紅雨 ” 下發 生路 陷 。 立法 議員 、 共建 好家園 協會 副 理事 長 馬 耀鋒 表示 ， 是 次 路陷 的 面積 較 大 ， 且 在 本 澳未來 新城 區的 交通 道路 範圍 ， 引起 社會 及 居民 的 廣泛 關注 和 討論 。 促請 當局 盡早 確保 地下 的 安全 狀況 ， 並透過 科學 儀器 和 手段 檢測 新城 A 區 路面 下 的 沙土 情況 。 建議 檢查 路陷 有否 影響 周邊 建成 樓宇及 地下 空間 結構 安全 ， 提高 安全 保障 ， 排解 風險 。         檢查 周邊 經屋 結構         馬 耀鋒 表示 ， 新城 A 區作 為 本澳 新建 設 的 重要 城區 ， 人口 密集 且 設有 學校 村 等 重點 城市 建設 項目 ， 釋放 地下 空間 資源 潛力 是 其 規劃 重點 ， 以容納 大量 地下 共同 管道 、 人行 通道 以及 商業 街道 。 且 輕軌 東線 部分 線段 亦 預計 通過 地下 行駛 ， 可謂 是 A 區的 “ 生命 線 ” 。 是 次 路陷 引起 社會關 注城區 及 地下 設施 等 一系列 “ 生命 線 ” 的 安全 。         路陷 的 原因 多樣 ， 參考 其他 地區 的 經驗 ， 一般 常見 為 強烈 降雨 造成 沙土 流失 、 地下水 管 爆裂 ， 又 或 周邊 施工 造成 。 根據 公建局 提供 的 資訊 ， 是 次 路陷 初步 懷疑 因 工程 開挖 加上 大雨 導致 。 馬 耀鋒 促請 當局 盡早 採取 補救 措施 ， 要求 優化後續 工程 的 準備 工作 ， 並應 檢查 周邊 新 建成 經濟 房屋 的 結構 安全 ， 保證 樓宇 安全 不 受 事件 影響 。 同時 建議 當局 用 科學 檢測 （ 如透 地雷 達 ） 等 技術 及 手段 ， 協助 短 時間 內 初步 探測 地下 結構 ， 搜集 資料 分析 及 評估 周邊 區域 及 各 交通 主要 幹道 的 地下 沙土 情況 ， 防患未然 。         A 區頻 水浸 惹 關注         本澳氣候 高溫 多雨 ， 加上 近年 強 降雨 等 極端 天氣 頻發 ， 高效 的 排水 系統 對 於 保護 地下 沙土 至關 重要 。 馬 耀鋒 表示 ， A 區的 雨水 管道 按 二十年 一遇 的 標準 建設 。 惟接 獲 不少 意見 反映 ， 過去 區內 及 交通 幹道 大雨 下經常 出現 排水 不及 。 昨日 交通局 提供 的 路面 實況 中 亦可 見區 內 路面 出現 明顯 積水 。 期望 當局 進 一步 檢視 A 區現 時 雨水 管道 及 排水泵 的 作用 ， 找出 排水 不及 的 原因 ， 必要 時採 取針 對性 強化 工程 ， 確保 雨水 管道 發揮應 有 效果 。,2024-08-16
黑沙塌樹消防處理,黑沙塌樹消防處理    昨日上午十一時許，路環黑沙馬路近鷺環海天度假酒店附近一處山坡有樹木倒塌，部分枝葉及樹幹橫亙馬路上，無人受傷或引致損毀。消防員及治安警先後接報到場處理。期間，消防員用電鋸鋸斷橫亙馬路的枝葉及樹幹，再移至路旁。治安警在場指揮交通。    “紅雨”信號昨早生效後，治安警呼籲居民應盡量留在安全地方，避免外出。駕駛人士應小心駕駛，時刻留意水浸情況，避免前往低窪地區或進入地庫停車場。消防局亦呼籲居民盡量避免停留在低窪地區及戶外，應逗留在安全的室內空間，警惕因暴雨和雷暴可能出現的風險。倘遇事故，盡快致電該局求助。,http://www.macaodaily.com/html/2024-08/16/content_1775004.htm,黑沙塌樹消防處理    昨日上午十一時許，路環黑沙馬路近鷺環海天度假酒店附近一處山坡有樹木倒塌，部分枝葉及樹幹橫亙馬路上，無人受傷或引致損毀,黑沙 塌樹 消防 處理         昨日 上午 十一 時許 ， 路環 黑沙 馬 路 近鷺環 海天 度假 酒店 附近 一處 山坡 有樹木 倒塌 ， 部分 枝葉及 樹幹 橫亙 馬 路上 ， 無人 受傷 或 引致 損毀 。 消防 員及 治安警 先後接 報到場 處理 。 期間 ， 消防 員用 電鋸 鋸斷 橫亙 馬 路 的 枝 葉及 樹幹 ， 再 移至 路旁 。 治安警 在場 指揮 交通 。         “ 紅雨 ” 信號 昨早 生效 後 ， 治安警 呼籲 居民 應盡量 留在 安全 地方 ， 避免 外出 。 駕駛 人士 應 小心 駕駛 ， 時刻 留意 水浸 情況 ， 避免 前往 低窪 地區 或 進入 地庫 停車場 。 消防局 亦 呼籲 居民 盡量 避免 停留 在 低窪 地區 及戶 外 ， 應 逗留 在 安全 的 室 內 空間 ， 警惕 因 暴雨 和 雷暴 可能 出現 的 風險 。 倘遇 事故 ， 盡快 致電該 局 求助 。,2024-08-16
天后廟冧古樹幸無傷,壓毀神龕   主體建築未受損    天后廟冧古樹幸無傷    【本報消息】文化局/ 市政署訊：漁翁街天后古廟古樹昨日早上塌樹枝，壓到廟宇戶外空間一個混凝土神龕，文化局與市政署隨即派員到現場了解情況，經初步檢查，懷疑因古樹日漸轉弱，加上多場強降雨所致，事件中無人受傷，廟宇主體建築未有受損。    該古榕樹於二○二○年十一月納入《古樹名木保護名錄》，健康狀況一直屬於瀕危。去年，文化局按樹木檢查報告以及養護意見，曾對該樹木局部位置加固。市政署在恆常檢查中，發現古樹有進一步轉弱的跡象，感染褐根病、樹幹有菌菇等情況，早前已發函通知相關單位，要求業權人對古樹養護。    文化局及市政署將持續監測、跟進古樹，後續文化局亦會為受損的神龕和扶手安排修復工作。    按《文化遺產保護法》相關規定，私人地方的古樹由持有人管護，持有人或業權人代表應定期檢查及跟進古樹的情況。市政署呼籲業界、私人庭園及土地擁有者和使用者，定期檢查、跟進樹木的情況，尤其在風雨季來臨前做好預防措施，減少事故發生。居民日常如發現樹木生長及健康情況異常，可透過“市政在線”或致電市民服務熱線：二八三三 · 七六七六反映。,http://www.macaodaily.com/html/2024-08/16/content_1775005.htm,壓毀神龕   主體建築未受損    天后廟冧古樹幸無傷    【本報消息】文化局/ 市政署訊：漁翁街天后古廟古樹昨日早上塌樹枝，壓到廟宇戶外空間一個混凝土神龕，文化局與市政署隨即派員到現場了解情況，經初步檢查，懷疑因古樹日漸轉弱，加上多場強降雨所致，事件中無人受傷，廟宇主體建築未有受損,壓毀 神 龕       主體 建築 未 受損         天后 廟 冧 古樹 幸無傷         【 本報 消息 】 文化局 /   市政 署訊 ： 漁翁 街 天后 古廟 古樹 昨日 早上 塌樹枝 ， 壓到 廟 宇戶 外空 間 一個 混凝土 神龕 ， 文化局 與 市政 署 隨即 派員到 現場 了解 情況 ， 經 初步 檢查 ， 懷疑 因古樹 日漸 轉弱 ， 加上 多場強 降雨 所致 ， 事件 中無人 受傷 ， 廟宇主體 建築 未有 受損 。         該古榕 樹 於 二 ○ 二 ○ 年 十一月 納入 《 古樹 名木 保護 名錄 》 ， 健康 狀況 一直 屬 於 瀕危 。 去年 ， 文化局 按樹木 檢查 報告 以及 養護 意見 ， 曾 對 該 樹木 局部 位置 加固 。 市政 署 在 恆常 檢查 中 ， 發現 古樹 有 進 一步 轉弱 的 跡象 ， 感染 褐根病 、 樹幹 有菌菇 等 情況 ， 早前 已 發函 通知 相關 單位 ， 要求 業權 人 對 古樹 養護 。         文化局 及 市政 署將 持續 監測 、 跟 進古樹 ， 後 續 文化局 亦 會 為 受損 的 神 龕 和 扶手 安排 修 復 工作 。         按 《 文化 遺產 保護法 》 相關 規定 ， 私人 地方 的 古樹 由 持有人 管護 ， 持有人 或業 權人 代表 應 定期 檢查 及 跟 進古樹 的 情況 。 市政 署 呼籲業界 、 私人 庭園 及 土地 擁有者 和 使用者 ， 定期 檢查 、 跟 進樹木 的 情況 ， 尤其 在 風 雨季 來 臨前 做好 預防 措施 ， 減少 事故 發生 。 居民 日常 如發 現樹木 生長 及 健康 情況 異常 ， 可透過 “ 市政 在 線 ” 或 致電 市民 服務 熱線 ： 二八 三 三   ·   七 六七六 反映 。,2024-08-16
結婚出生一件事昨推出   本報記者 蔡小姍  楊夏怡  報 道,“一戶通”線上完成登記等多項行政手續    結婚出生一件事昨推出    特區政府昨日在“一戶通”平台推出“結婚一件事”和“出生一件事”服務。居民可在線完成結婚或新生兒出生登記等多項行政手續，無須親自前往多個部門或重複提交文件。    昨日下午三時，相關的七個部門和機構代表在法務局中航大廈六樓舉行記者會，行政公職局長吳惠嫻、法務局副局長盧瑞祥、身份證明局副局長羅翩卿、衛生局副局長郭昌宇、社會保障基金行政管理委員會副主席袁凱清、民事登記局登記官王玉梅，以及鏡湖醫院副院長黎啟盛出席，介紹服務詳情。    “結婚一件事”服務包括結婚申請、預約結婚日期、更新身份證婚姻狀況，以及申請結婚津貼。居民還可以選擇由民事登記局登記官、教堂的司祭或私人公證員主持婚禮。“出生一件事”服務涵蓋出生登記、辦理新生兒身份證、更新衛生局掛號卡（俗稱“金卡”）個人資料、申請出生津貼，以及預約辦理回鄉證。    吳惠嫻表示，為推動民事登記服務的電子化，特區政府總結經驗，改革相關登記及公證法律制度，並結合流程優化等措施，加強民事登記局與醫院及公共部門之間的資料互聯，從而簡化申請流程及減少所需提交的文件，最大程度便利居民辦理登記服務。    隨時申請查詢進度    居民可隨時透過“一戶通”線上申請服務，不受假期限制。提交申請後，工作人員將於辦公時間內依法嚴謹審核。申請人可隨時登入“一戶通”“我的辦事”頁面查詢進度、接收部門通知，以及下載電子證明和津貼等文件。    電子證明統一收費    此外，“一戶通”和“商社通”平台合共提供二十六種電子證明的申請，包括婚姻登記證明、查屋紙、查公司紙等，相關線上文件自推出至今已累計發出十四萬五千份。配合新電子政務法將於九月一日生效，所有電子證明書將統一按份收費十五元，取代逐頁收費的方式，該局冀有助促進更多人使用電子證明，節省輪候服務時間。    未來，特區政府將繼續秉持“服務創新、便民利民”策略，推動更多與居民生活、業界營商息息相關的服務落實電子化。    本報記者  蔡小姍  楊夏怡  報 道,http://www.macaodaily.com/html/2024-08/16/content_1775006.htm,吳惠嫻表示，為推動民事登記服務的電子化，特區政府總結經驗，改革相關登記及公證法律制度，並結合流程優化等措施，加強民事登記局與醫院及公共部門之間的資料互聯，從而簡化申請流程及減少所需提交的文件，最大程度便利居民辦理登記服務,“ 一戶通 ” 線上 完成 登記 等 多項 行政 手續         結婚 出生 一件 事 昨 推出         特區 政府 昨日 在 “ 一戶通 ” 平台 推出 “ 結婚 一件 事 ” 和 “ 出生 一件 事 ” 服務 。 居民 可在線 完成 結婚 或 新生 兒 出生 登記 等 多項 行政 手續 ， 無須 親自 前往 多個 部門 或 重 複 提交 文件 。         昨日 下午 三時 ， 相關 的 七個 部門 和 機構 代表 在 法務局 中航 大廈 六樓 舉行 記者 會 ， 行政 公職 局長 吳惠嫻 、 法務局 副 局長 盧瑞祥 、 身份 證明局 副 局長 羅 翩卿 、 衛生局 副 局長 郭昌宇 、 社會 保障 基金 行政 管理 委員會 副 主席 袁凱 清 、 民事 登記局 登記官 王玉梅 ， 以及 鏡湖 醫院 副 院長 黎啟 盛 出席 ， 介紹 服務 詳情 。         “ 結婚 一件 事 ” 服務 包括 結婚 申請 、 預約 結婚 日期 、 更新 身份 證 婚姻 狀況 ， 以及 申請 結婚津 貼 。 居民 還 可以 選擇 由 民事 登記局 登記官 、 教堂 的 司祭 或 私人 公證員 主持 婚禮 。 “ 出生 一件 事 ” 服務涵 蓋 出生 登記 、 辦理 新生 兒 身份 證 、 更新 衛生局 掛號 卡 （ 俗稱 “ 金卡 ” ） 個 人 資料 、 申請 出生 津貼 ， 以及 預約 辦理 回鄉證 。         吳惠嫻 表示 ， 為 推動 民事 登記 服務 的 電子化 ， 特區 政府 總結 經驗 ， 改革 相關 登記 及 公證 法律 制度 ， 並結合 流程 優化 等 措施 ， 加強 民事 登記局 與 醫院 及 公共 部門 之間 的 資料 互聯 ， 從 而 簡化 申請 流程 及 減少 所 需提交 的 文件 ， 最大 程度 便利 居民 辦理 登記 服務 。         隨時 申請 查詢 進度         居民 可 隨時 透過 “ 一戶通 ” 線上 申請 服務 ， 不 受 假期 限制 。 提交 申請 後 ， 工作 人員將 於 辦公時間 內 依法 嚴謹 審核 。 申請 人 可 隨時 登入 “ 一戶通 ” “ 我 的 辦事 ” 頁 面查詢 進度 、 接收 部門 通知 ， 以及 下載 電子 證明 和 津 貼 等 文件 。         電子 證明統 一收費         此外 ， “ 一戶通 ” 和 “ 商社 通 ” 平台 合共 提供 二十六 種電子 證明 的 申請 ， 包括 婚姻 登記 證明 、 查屋紙 、 查 公司 紙等 ， 相關線 上 文件 自 推出 至今 已累計 發出 十四 萬 五千 份 。 配合 新電 子政 務法將 於 九月 一日 生效 ， 所有 電子 證明書 將統 一 按份 收費 十五元 ， 取代 逐頁 收費 的 方式 ， 該局 冀 有助 促進 更 多 人 使用 電子 證明 ， 節省 輪候 服務 時間 。         未來 ， 特區 政府 將繼續 秉持 “ 服務 創新 、 便民利民 ” 策略 ， 推動 更 多 與 居民 生活 、 業界營 商息息 相關 的 服務落 實電子化 。         本報 記者     蔡小姍     楊夏怡     報   道,2024-08-16
兩津貼一併申請免遺漏,兩津貼一併申請免遺漏    社保基金行政管理委員會副主席袁凱清表示，根據法律規定，合資格申請結婚津貼或出生津貼的人士，須在結婚日或子女出生日起計六十天內提出申請，現在透過“一件事”的操作，讓其在申請結婚登記又或辦理子女出生登記時一併提交津貼申請，從而避免遺漏或逾期申請的出現。    無須提交證明    袁凱清昨在“結婚一件事”、“出生一件事”發佈會上介紹，當啟動“一件事”操作時，系統會自動檢測申請人是否符合結婚或出生津貼的申請資格，無須自行查核。倘符合資格，當前置登記部分完成後即可接續處理社保的申請，且資料已互聯互通，無須申請人再提交證明文件。    她稱，值得一提的是，結婚津貼和出生津貼會在結婚登記或子女出生登記完成後才會啟動審批程序，申請人亦可透過“一戶通”查詢和了解審批進度。,http://www.macaodaily.com/html/2024-08/16/content_1775007.htm,兩津貼一併申請免遺漏    社保基金行政管理委員會副主席袁凱清表示，根據法律規定，合資格申請結婚津貼或出生津貼的人士，須在結婚日或子女出生日起計六十天內提出申請，現在透過“一件事”的操作，讓其在申請結婚登記又或辦理子女出生登記時一併提交津貼申請，從而避免遺漏或逾期申請的出現,兩津 貼 一 併 申請免 遺漏         社保 基金 行政 管理 委員會 副 主席 袁凱 清 表示 ， 根據 法律 規定 ， 合資格 申請 結婚津 貼 或 出生 津貼 的 人士 ， 須在 結婚 日 或 子女 出生 日起計 六十天 內 提出 申請 ， 現在 透過 “ 一件 事 ” 的 操作 ， 讓 其 在 申請 結婚 登記 又 或 辦理 子女 出生 登記 時 一 併 提交 津貼 申請 ， 從 而 避免 遺漏 或 逾期 申請 的 出現 。         無須 提交 證明         袁凱 清 昨在 “ 結婚 一件 事 ” 、 “ 出生 一件 事 ” 發 佈 會 上 介紹 ， 當啟 動 “ 一件 事 ” 操作 時 ， 系統會 自動 檢測 申請 人 是否 符合 結婚 或 出生 津貼 的 申請 資格 ， 無須 自行 查核 。 倘 符合 資格 ， 當 前置 登記 部分 完成 後 即可 接續 處理 社保 的 申請 ， 且 資料 已 互聯 互通 ， 無須 申請 人 再 提交 證明 文件 。         她 稱 ， 值得一提的是 ， 結婚津 貼 和 出生 津貼 會 在 結婚 登記 或 子女 出生 登記 完成 後 才 會 啟動 審批 程序 ， 申請 人 亦可 透過 “ 一戶通 ” 查詢 和 了解 審批 進度 。,2024-08-16
