Title,Content,Link,Summary,Preprocessed_Content,Date
夏寶龍：擦亮國際大都市金名片,"昨續調硏勉勵工商企業及社會各界    夏寶龍：擦亮國際大都市金名片    【本報消息】港澳辦訊：中央港澳工作辦公室主任、國務院港澳事務辦公室主任夏寶龍昨日考察澳門中華總商會並與企業家代表座談，聽取大家對澳門經濟發展的意見建議，雙方互動交流。    夏寶龍指出，習近平主席高度重視澳門發展，十分關心澳門同胞的福祉。中央始終全面準確、堅定不移貫徹“一國兩制”方針，全面落實“愛國者治澳”原則，全力支持行政長官和特區政府團結帶領社會各界，抓住國家發展帶來的歷史機遇，不斷推進具有澳門特色“一國兩制”成功實踐。回歸祖國廿五年來，澳門經濟實現跨越發展，社會保持長期穩定，居民生活持續改善，多元文化交相輝映，城市面貌獨具特色，國際影響力和國際知名度大幅提升，已發展成為國際大都市。    夏寶龍表示，澳門始終與祖國血脈相連、休戚與共，在我國革命、建設、改革各個歷史時期都作出獨特而重要的貢獻，包括澳門中華總商會在內的澳門工商界是其中的一支重要力量。回歸以來，在中央的全力支持下，澳門開創歷史上最好的發展局面，形成具有澳門特色的獨特地位和優勢，為可持續發展打下堅實基礎。    具有“一國兩制”的最大制度優勢     “一國兩制”是澳門保持長期繁榮穩定的最佳制度安排。澳門既保留資本主義制度和生活方式不變，又能夠分享內地的廣闊市場和發展機遇，獲得國家的鼎力支持。我國超大規模的市場、完整的產業體系、完備的基礎設施、制度和人才優勢突出，發展的根基穩固、韌性十足、前景光明。澳門是祖國的“掌上明珠”，澳門有求，祖國必應，祖國永遠是澳門的堅強後盾。    具有充足的發展空間優勢    澳門回歸祖國時，只有21.45平方公里，中央多次批准澳門填海造地，並劃定陸地邊界，澳門的陸地面積增至33.3平方公里；一五年，中央將澳門的海域面積明確為85平方公里；二一年中央正式把106.46平方公里的橫琴島作為粵澳深度合作區，粵澳雙方實行共商共建共管共享的新管理體制，使澳門的發展空間擴大到224.76平方公里。澳門已經不再是“小澳門”，發展空間已經增至回歸時的十倍多。    具有國際化程度高的營商環境優勢    澳門與一百二十多個國家和地區建立穩定的經貿關係，是一百九十多個國際組織和機構的成員，獲得一百四十五個國家和地區的免簽或落地簽待遇。澳門營商環境不斷改善提升，保持單獨關稅區和自由港地位，實施簡單低稅制，是全球企業所得稅最低的地區之一，是世界貿易組織認定的全球最開放的貿易和投資經濟體之一。澳門與葡語國家聯繫緊密，是中國與葡語國家交流合作的重要平台。在澳門設立的中葡論壇是我國目前唯一以語言為紐帶的多邊合作機制，已覆蓋所有以葡語為官方語言的國家，設立以來，中國與葡語國家貿易增長約二十倍。    具有實力雄厚的經濟基礎優勢    澳門GDP由一九九九年的519億澳門元增長到二○一九年的4,445億澳門元，保持年均11％的增長率，在發達經濟體中位居前列。疫情防控平穩轉段後，澳門去年GDP增長高達80.5%，按購買力平價計算的人均GDP排名世界第五，財政儲備達5,800多億澳門元。去年特區政府公佈首個經濟適度多元發展規劃，明確“1+4”產業發展方向，為經濟增長注入新動能。今年來，澳門經濟開局良好，一季度就有887.5萬人次旅客湧入澳門；中央先後公佈開通十個內地城市赴香港、澳門的“個人遊”，更多惠澳政策措施還將陸續有來。    具有中西文化薈萃的人文優勢    澳門具有東西文化交融的歷史，多元共存的宗教、豐富多樣的語言、千姿百態的建築，各族群友好共處，體現出澳門中西方多元文化交匯的鮮明特色和獨特價值。澳門大三巴等在內的二十多座中西式建築及廣場前地連接而成的“澳門歷史建築群”列入世界文化遺產名錄，成為澳門旅遊的靚麗名片；澳門“格蘭披治大賽車”連續舉辦七十年，是公認的世界上最佳的街道賽事之一；“澳門國際音樂節”已舉辦卅五屆；澳門擁有世界級的表演和會展場地，全球國際會議城市排名亞太區第二十位；澳門還是全球擁有福布斯五星級酒店數量最多的城市，有四十八家米芝蓮餐廳，被聯合國教科文組織評為“創意城市美食之都”。這些都是澳門吸引四方來賓的獨特魅力。    具有愛國愛澳的傳統情感優勢    澳門同胞素有愛國傳統，有強烈的國家認同感、歸屬感和民族自豪感。回歸以來，澳門特區政府高度重視弘揚愛國傳統，堅定落實“愛國者治澳”原則。愛國愛澳力量長期以來服務居民、深耕厚植，國家意識和愛國精神在青少年心田中深深扎根，愛國愛澳核心價值在澳門社會居於主導地位，促進社會和諧穩定。澳門是世界上最安全的城市之一，免費教育、免費醫療、雙層式社會保障等一系列政策惠及全社會，人均預期壽命位居世界前列，民生福祉水平不斷提升，居民的獲得感、幸福感、安全感越來越強。    四個多作貢獻    一、在推動經濟適度多元發展上多作貢獻聚焦特區政府確定的“1+4”多元發展方向，加快推動經濟適度多元發展規劃落地見效。    二、在融入國家發展大局上多作貢獻主動對接粵港澳大灣區、高質量共建“一帶一路”等國家戰略，積極支持特區政府做好橫琴開發這篇大文章。    三、在提升澳門國際影響力上多作貢獻拓寬與歐盟、東南亞國家等的聯繫，特別是着力提升中葡商貿合作服務平台的功能，推動中國與葡語國家開展更廣泛更深層次的務實合作。    四、在弘揚愛國愛澳優良傳統上多作貢獻繼續支持愛國愛澳力量發展壯大，進一步弘揚愛國愛澳核心價值、凝聚共建澳門的社會共識。    夏寶龍強調，今年是中華人民共和國成立七十五周年，是澳門回歸廿五周年。澳門站在了新發展起點上，大家要全力支持行政長官和特區政府依法施政，更好發揮澳門的獨特地位和優勢，推動經濟社會高質量發展，齊心協力把澳門國際大都市“金名片”擦得更亮，在強國建設、民族復興中更好發揮澳門作用。他並提出“四個多作貢獻”（見上表）。    夏寶龍最後表示，站在新起點的澳門，正迎來建設、發展的最好時期。堅信有偉大祖國作堅強後盾，有全體澳門同胞的共同奮鬥，具有澳門特色的“一國兩制”成功實踐之路一定會越走越寬廣，新時代列車“澳門號”一定會行駛得又快又穩。",http://www.macaodaily.com/html/2024-05/15/content_1755201.htm,中央始終全面準確、堅定不移貫徹“一國兩制”方針，全面落實“愛國者治澳”原則，全力支持行政長官和特區政府團結帶領社會各界，抓住國家發展帶來的歷史機遇，不斷推進具有澳門特色“一國兩制”成功實踐,"昨續 調硏 勉勵 工商 企業 及 社會 各界         夏寶龍 ： 擦亮 國際 大都市 金 名片         【 本報 消息 】 港澳 辦訊 ： 中央 港澳 工作 辦公 室主任 、 國務院 港澳 事務 辦公 室主任 夏寶龍 昨日 考察 澳門 中華 總商會並 與 企業家 代表 座談 ， 聽取 大家 對 澳門 經濟 發展 的 意見 建議 ， 雙方 互動 交流 。         夏寶龍 指出 ， 習近 平 主席 高度 重視 澳門 發展 ， 十分 關心 澳門 同胞 的 福祉 。 中央 始終 全面 準確 、 堅定 不移 貫徹 “ 一國 兩制 ” 方針 ， 全面 落實 “ 愛國者 治澳 ” 原則 ， 全力支持 行政 長 官 和 特區 政府 團結 帶領 社會 各界 ， 抓住 國家 發展 帶來 的 歷史 機遇 ， 不斷 推進 具有 澳門 特色 “ 一國 兩制 ” 成功 實踐 。 回歸祖國 廿五年 來 ， 澳門 經濟 實現 跨越 發展 ， 社會 保持 長 期 穩定 ， 居民 生活 持續 改善 ， 多元 文化 交相 輝映 ， 城市 面貌 獨具 特色 ， 國際 影響力 和 國際 知名度 大幅 提升 ， 已 發展 成為 國際 大都市 。         夏寶龍 表示 ， 澳門 始終 與 祖國 血脈 相連 、 休戚 與 共 ， 在 我國 革命 、 建設 、 改革 各個 歷史 時期 都 作出 獨特 而 重要 的 貢獻 ， 包括 澳門 中華 總商會 在 內 的 澳門 工商界 是 其中 的 一支 重要 力量 。 回歸以 來 ， 在 中央 的 全力支持 下 ， 澳門 開創 歷史 上 最好 的 發展 局面 ， 形成 具有 澳門 特色 的 獨特 地位 和 優勢 ， 為 可持續 發展 打下 堅實 基礎 。         具有 “ 一國 兩制 ” 的 最大 制度 優勢           “ 一國 兩制 ” 是 澳門 保持 長 期 繁榮 穩定 的 最佳 制度 安排 。 澳門 既 保留 資本 主義 制度 和 生活 方式 不變 ， 又 能夠 分享 內地 的 廣闊 市場 和 發展 機遇 ， 獲得 國家 的 鼎力支持 。 我國 超大 規模 的 市場 、 完整 的 產業 體系 、 完備 的 基礎 設施 、 制度 和 人才 優勢 突出 ， 發展 的 根基 穩固 、 韌性 十足 、 前景 光明 。 澳門 是 祖國 的 “ 掌上明珠 ” ， 澳門 有求 ， 祖國 必應 ， 祖國永遠 是 澳門 的 堅強後盾 。         具有 充足 的 發展 空間 優勢         澳門 回歸 祖國時 ， 只有 21.45 平方公里 ， 中央 多次 批准 澳門 填海造地 ， 並劃定 陸地 邊界 ， 澳門 的 陸 地面 積 增至 33.3 平方公里 ； 一 五年 ， 中央 將澳門 的 海域 面積 明確 為 85 平方公里 ； 二 一年 中央 正式 把 106.46 平方公里 的 橫琴島 作為 粵澳 深度 合作 區 ， 粵澳 雙方 實行 共商 共建 共管 共享 的 新 管理 體制 ， 使 澳門 的 發展 空間 擴大到 224.76 平方公里 。 澳門 已經 不再 是 “ 小澳門 ” ， 發展 空間 已經 增至 回歸時 的 十倍 多 。         具有 國際化 程度 高 的 營商 環境 優勢         澳門 與 一百二十多 個國家 和 地區 建立 穩定 的 經貿關 係 ， 是 一百九十 多個 國際 組織 和 機構 的 成員 ， 獲得 一百四十 五個 國家 和 地區 的 免簽 或 落地 簽 待遇 。 澳門 營商 環境 不斷 改善 提升 ， 保持 單獨關 稅區 和 自由港 地位 ， 實施 簡單 低稅制 ， 是 全球 企業 所得 稅 最低 的 地區 之一 ， 是 世界 貿易 組織 認定 的 全球 最開 放 的 貿易 和 投資 經濟體 之一 。 澳門 與 葡語 國家 聯 繫 緊 密 ， 是 中國 與 葡語 國家 交流 合作 的 重要 平台 。 在 澳門 設立 的 中葡 論壇 是 我國 目前 唯一 以 語言為 紐帶 的 多邊 合作 機制 ， 已覆蓋 所有 以 葡語 為 官方 語言 的 國家 ， 設立 以來 ， 中國 與 葡語 國家 貿易 增長 約 二十倍 。         具有 實力 雄厚 的 經濟 基礎 優勢         澳門 GDP 由 一九九九年 的 519 億澳門元 增長 到 二 ○ 一 九年 的 4 , 445 億澳門 元 ， 保持 年均 11 ％ 的 增長 率 ， 在 發達 經濟體 中 位居 前列 。 疫情 防控 平穩 轉段 後 ， 澳門 去年 GDP 增長 高達 80.5% ， 按購 買力 平價 計算 的 人均 GDP 排名 世界 第五 ， 財政儲備 達 5 , 800 多 億澳門 元 。 去年 特區 政府 公 佈 首個 經濟 適度 多元 發展 規劃 ， 明確 “ 1 + 4 ” 產業 發展 方向 ， 為 經濟 增長 注入 新動能 。 今年 來 ， 澳門 經濟 開局 良好 ， 一季度 就 有 887.5 萬 人次 旅客 湧入 澳門 ； 中央 先後公 佈 開通十個 內 地 城市 赴 香港 、 澳門 的 “ 個 人遊 ” ， 更多惠澳 政策措施 還將 陸續 有 來 。         具有 中西文化 薈萃 的 人文 優勢         澳門 具有 東西 文化 交融 的 歷史 ， 多元 共存 的 宗教 、 豐富 多樣 的 語言 、 千姿百態 的 建築 ， 各族 群 友好 共處 ， 體現 出 澳門 中 西方 多元 文化 交匯 的 鮮明 特色 和 獨特價值 。 澳門 大三巴 等 在 內 的 二十 多座 中 西式 建築及 廣場 前 地連接 而 成 的 “ 澳門 歷史 建築群 ” 列入 世界 文化 遺產 名錄 ， 成為 澳門 旅遊 的 靚麗 名片 ； 澳門 “ 格蘭 披治大賽車 ” 連續 舉辦 七十年 ， 是 公認 的 世界 上 最佳 的 街道 賽事 之一 ； “ 澳門 國際 音樂節 ” 已舉 辦卅五屆 ； 澳門 擁有 世界 級 的 表演 和 會 展場 地 ， 全球 國際會議 城市 排名 亞太區 第二十位 ； 澳門 還是 全球 擁有 福布斯 五星 級 酒店 數量 最 多 的 城市 ， 有 四十八 家米 芝蓮餐 廳 ， 被 聯合國 教科文 組織 評為 “ 創意 城市 美食 之 都 ” 。 這些 都 是 澳門 吸引 四方 來賓 的 獨特 魅力 。         具有 愛國 愛澳 的 傳統 情感 優勢         澳門 同胞 素有 愛國 傳統 ， 有 強烈 的 國家認 同感 、 歸屬 感 和 民族 自豪感 。 回歸以 來 ， 澳門 特區 政府 高度 重視 弘揚 愛國 傳統 ， 堅定 落實 “ 愛國者 治澳 ” 原則 。 愛國 愛澳 力量 長 期以 來 服務 居民 、 深耕 厚植 ， 國家 意識 和 愛國 精神 在 青少年 心田 中 深深 扎根 ， 愛國 愛澳 核心 價值 在 澳門 社會 居 於 主導 地位 ， 促進 社會和諧 穩定 。 澳門 是 世界 上 最 安全 的 城市 之一 ， 免費 教育 、 免費 醫療 、 雙層式 社會 保障 等 一系列 政策 惠及 全社 會 ， 人均 預期 壽命 位居 世界 前列 ， 民生 福祉 水平 不斷 提升 ， 居民 的 獲得感 、 幸福感 、 安全感 越來 越強 。         四個 多作 貢獻         一 、 在 推動 經濟 適度 多元 發展 上 多作 貢獻 聚焦 特區 政府 確定 的 “ 1 + 4 ” 多元 發展 方向 ， 加快 推動 經濟 適度 多元 發展 規劃 落地 見效 。         二 、 在 融入 國家 發展 大局 上多作 貢獻主動 對 接粵 港澳 大灣區 、 高質量 共建 “ 一帶 一路 ” 等 國家 戰略 ， 積極 支持 特區 政府 做好 橫琴 開發 這篇大 文章 。         三 、 在 提升 澳門 國際 影響力 上 多作 貢獻拓 寬 與 歐盟 、 東南亞國家 等 的 聯 繫 ， 特別 是 着力 提升 中葡 商貿 合作 服務 平台 的 功能 ， 推動 中國 與 葡語 國家 開展 更 廣泛 更深 層次 的 務實 合作 。         四 、 在 弘揚 愛國 愛澳 優良 傳統 上 多作 貢獻 繼續 支持 愛國 愛澳 力量 發展 壯大 ， 進 一步 弘揚 愛國 愛澳 核心 價值 、 凝聚 共建 澳門 的 社會共識 。         夏寶龍 強調 ， 今年 是 中華 人民 共和 國 成立 七十五 周年 ， 是 澳門 回歸 廿五 周年 。 澳門 站 在 了 新 發展 起點 上 ， 大家 要 全力支持 行政 長 官 和 特區 政府 依法 施政 ， 更好 發揮 澳門 的 獨特 地位 和 優勢 ， 推動 經濟 社會 高質量 發展 ， 齊心 協力 把 澳門 國際 大都市 “ 金 名片 ” 擦 得 更亮 ， 在 強國 建設 、 民族 復 興中 更好 發揮 澳門 作用 。 他並 提出 “ 四個 多作 貢獻 ” （ 見 上表 ） 。         夏寶龍 最 後 表示 ， 站 在 新 起點 的 澳門 ， 正迎 來 建設 、 發展 的 最好 時期 。 堅信 有偉大 祖國作 堅強後盾 ， 有 全體 澳門 同胞 的 共同 奮鬥 ， 具有 澳門 特色 的 “ 一國 兩制 ” 成功 實踐 之路 一定 會越 走 越 寬廣 ， 新時 代列車 “ 澳門號 ” 一定 會行駛 得 又 快 又 穩 。",2024-05-15
李偉農：夏寶龍對澳經濟復甦有信心,李偉農：夏寶龍對澳經濟復甦有信心    【本報消息】出席座談活動的經濟財政司司長李偉農在會後接受訪問時表示，即將公佈的首季本地生產總值（GDP）初算錄得25.7%的按年增長，這主要是得到中央支持、社會各界共同努力的成果，旅客量恢復、產業發展取得新的開局。    首季GDP增25.7%    感謝夏寶龍及港澳辦團隊組織考察團，到澳門聆聽社會各界意見，讓業界有更大信心、動力開展經濟適度多元發展的工作。    座談會上，大健康、科技、現代金融、會展、體育等行業代表圍繞“1+4”行業發展提出相關建議。夏寶龍聽取意見後表示，對澳門經濟復甦充滿信心，認為澳門擁有良好開局，特別是再次強調“1+4”經濟適度多元發展的重要性，除了特區政府，社會各界要共同參與，只有進一步推進經濟適度多元發展，未來才可享受發展成果。在融入國家發展大局方面，鼓勵商界積極參與橫琴深合區建設，並指出深合區成立的目的就是為澳門經濟適度多元發展提供支撐，為未來澳門“一國兩制”行穩致遠提供良好條件。,http://www.macaodaily.com/html/2024-05/15/content_1755202.htm,李偉農：夏寶龍對澳經濟復甦有信心    【本報消息】出席座談活動的經濟財政司司長李偉農在會後接受訪問時表示，即將公佈的首季本地生產總值（GDP）初算錄得25.7%的按年增長，這主要是得到中央支持、社會各界共同努力的成果，旅客量恢復、產業發展取得新的開局,李偉農 ： 夏寶龍 對 澳經濟 復 甦 有 信心         【 本報 消息 】 出席 座談 活動 的 經濟 財政司 司長 李偉農 在 會 後 接受 訪問 時 表示 ， 即 將公 佈 的 首季 本地 生產 總值 （ GDP ） 初算錄 得 25.7% 的 按 年 增長 ， 這 主要 是 得到 中央 支持 、 社會 各界 共同努力 的 成果 ， 旅客量 恢 復 、 產業 發展 取得 新 的 開局 。         首季 GDP 增 25.7%         感謝 夏寶龍 及 港澳 辦團隊 組織 考察 團 ， 到 澳門 聆 聽 社會 各界 意見 ， 讓 業界 有 更 大 信心 、 動力 開展 經濟 適度 多元 發展 的 工作 。         座 談會 上 ， 大 健康 、 科技 、 現代 金融 、 會展 、 體育 等 行業 代表 圍繞 “ 1 + 4 ” 行業 發展 提出 相關 建議 。 夏寶龍 聽 取意 見 後 表示 ， 對 澳門 經濟 復 甦 充滿 信心 ， 認為 澳門 擁有 良好 開局 ， 特別 是 再次 強調 “ 1 + 4 ” 經濟 適度 多元 發展 的 重要性 ， 除了 特區 政府 ， 社會 各界 要 共同 參與 ， 只有 進 一步 推進 經濟 適度 多元 發展 ， 未來 才 可 享受 發展 成果 。 在 融入 國家 發展 大局 方面 ， 鼓勵 商界 積極 參與 橫琴 深合區 建設 ， 並 指出 深合區 成立 的 目的 就是 為 澳門 經濟 適度 多元 發展 提供 支撐 ， 為 未來 澳門 “ 一國 兩制 ” 行穩致 遠 提供 良好 條件 。,2024-05-15
