Title,Content,Link,Summary,Preprocessed_Content,Date
再談Python中的Class   周柏堅,"再談Python中的Class    一、創建一個Class（類別）：Class 的名稱慣常做法是將名稱的第一個英文字母為大寫，方便與其它程式內的變數(variables)區分，我們用製造月餅作解釋。    例子：    Class Moon_Cake:    注意：這是個空的類別(empty class)，是一個製造月餅的模具。    二、如何從Class造出物件(object) ：Class只是一個模具，還要透過製造(constructor)，製造(constructor)其實是一個函式(function)，之後加入餡料的屬性(attributes)，屬性可理解為物件的特徵。    例子：    Class Moon_Cake:    def __init__（self, lotus_seed_paste):    self.lotus_seed_paste = lotus_seed_paste    解釋：我們要造一個淨蓮蓉月餅，lotus_seed_paste〈蓮蓉〉就是物件的屬性或特徵，__init__是指定的函式(function)的名稱，透過Class Moon_Cake模造出來的淨蓮蓉月餅，這個物件（指造出來的淨蓮蓉月餅），是獨立的物件，可以加減修改，例如可以加入鹹蛋黃，物件就成為蛋黃蓮蓉月餅。    三、方法(Method)在Class內的功能：Class內的Method本身就是一個函式(function)， Method是可以理解為所有物件造出來的共通功能，例如所有月餅都是“美味好吃”，平常一般函式是可以在任何程式內被執行〈被call〉，但Method(方法)的函式則要與Class（類別）的物件綁定，需要指明物件裡的Method才能執行。    例子：    Class Moon_Cake:    def __init__（self, lotus_seed_paste):    self.lotus_seed_paste = lotus_seed_paste    def delicious(self):    return(self.lotus_seed_paste,  + ‘月餅好好食’）    # 正式造餅    new_cake = Moon_Cake(‘蓮蓉’)    print(new_cake.delicious)    列印結果：    蓮蓉月餅好好食    那麼，物件繼承(Inheritance) 又是甚麼一回事？留待下回分解。    學勤進修教育中心電腦專科導師    周柏堅",http://www.macaodaily.com/html/2024-02/22/content_1736606.htm,"例子：    Class Moon_Cake:    def __init__（self, lotus_seed_paste):    self.lotus_seed_paste = lotus_seed_paste    解釋：我們要造一個淨蓮蓉月餅，lotus_seed_paste〈蓮蓉〉就是物件的屬性或特徵，__init__是指定的函式(function)的名稱，透過Class Moon_Cake模造出來的淨蓮蓉月餅，這個物件（指造出來的淨蓮蓉月餅），是獨立的物件，可以加減修改，例如可以加入鹹蛋黃，物件就成為蛋黃蓮蓉月餅","再談 Python 中 的 Class         一 、 創建 一個 Class （ 類別 ） ： Class   的 名稱 慣常 做法 是 將名 稱 的 第一 個 英文字母 為大寫 ， 方便 與 其它 程式 內 的 變數 ( variables ) 區分 ， 我們 用 製 造 月 餅 作 解 釋 。         例子 ：         Class   Moon _ Cake :         注意 ： 這是 個 空 的 類別 ( empty   class ) ， 是 一 個 製 造 月 餅 的 模具 。         二 、 如何 從 Class 造出 物件 ( object )   ： Class 只是 一個 模具 ， 還要 透 過 製 造 ( constructor ) ， 製 造 ( constructor ) 其實 是 一個 函式 ( function ) ， 之 後 加入 餡料 的 屬性 ( attributes ) ， 屬性 可 理解 為 物件 的 特徵 。         例子 ：         Class   Moon _ Cake :         def   __ init __ （ self ,   lotus _ seed _ paste ) :         self . lotus _ seed _ paste   =   lotus _ seed _ paste         解釋 ： 我們 要造 一個 淨蓮蓉 月餅 ， lotus _ seed _ paste 〈 蓮蓉 〉 就是 物件 的 屬性 或 特徵 ， __ init __ 是 指定 的 函式 ( function ) 的 名稱 ， 透過 Class   Moon _ Cake 模造 出來 的 淨蓮蓉 月餅 ， 這個 物件 （ 指造 出來 的 淨蓮蓉 月餅 ） ， 是 獨立 的 物件 ， 可以 加減 修改 ， 例如 可以 加入 鹹 蛋 黃 ， 物件 就 成為 蛋黃蓮蓉 月餅 。         三 、 方法 ( Method ) 在 Class 內 的 功能 ： Class 內 的 Method 本身 就是 一個 函式 ( function ) ，   Method 是 可以 理解 為 所有 物件 造出 來 的 共通 功能 ， 例如 所有 月餅 都 是 “ 美味 好吃 ” ， 平常 一般 函式 是 可以 在 任何 程式 內 被 執行 〈 被 call 〉 ， 但 Method ( 方法 ) 的 函式則 要 與 Class （ 類別 ） 的 物件 綁定 ， 需要 指明 物件 裡的 Method 才能 執行 。         例子 ：         Class   Moon _ Cake :         def   __ init __ （ self ,   lotus _ seed _ paste ) :         self . lotus _ seed _ paste   =   lotus _ seed _ paste         def   delicious ( self ) :         return ( self . lotus _ seed _ paste ,     +   ‘ 月餅 好好 食 ’ ）         #   正式 造餅         new _ cake   =   Moon _ Cake ( ‘ 蓮蓉 ’ )         print ( new _ cake . delicious )         列印 結果 ：         蓮蓉月餅 好好 食         那麼 ， 物件 繼承 ( Inheritance )   又 是 甚麼 一 回事 ？ 留待 下回分解 。         學勤 進修 教育 中心 電腦 專科導師         周柏堅",2024-02-22
引進世界級盛事落戶助力澳門成為「體育之城」,世界矚目的澳門文娛新地標——銀河國際會議中心    引進世界級盛事落戶助力澳門成為「體育之城」    銀河娛樂集團極配合澳門特別行政區政府「1+4」經濟適度多元發展政策中的推動文化及體育兩大範疇發展的施政方針，以多元舉措包括贊助及舉辦本地體育活動如澳門大賽車及澳門國際馬拉松，以及引進國際體壇盛事如「WTT 澳門冠軍賽」、世界女排大獎賽等活動落戶澳門，深化「旅遊＋體育」的跨界融合，助力澳門體育事業發展。旗下銀河國際會議中心（GICC）為矚目亞洲的嶄新會展娛樂新地標，除了致力於提升澳門會展業的國際知名度和競爭力外，亦積極引進如「2023姚基金慈善賽」的世界級盛事活動，共同推進澳門建成「體育之城」。,http://www.macaodaily.com/html/2024-02/22/content_1736604.htm,世界矚目的澳門文娛新地標——銀河國際會議中心    引進世界級盛事落戶助力澳門成為「體育之城」    銀河娛樂集團極配合澳門特別行政區政府「1+4」經濟適度多元發展政策中的推動文化及體育兩大範疇發展的施政方針，以多元舉措包括贊助及舉辦本地體育活動如澳門大賽車及澳門國際馬拉松，以及引進國際體壇盛事如「WTT 澳門冠軍賽」、世界女排大獎賽等活動落戶澳門，深化「旅遊＋體育」的跨界融合，助力澳門體育事業發展,世界 矚 目的 澳門文 娛新 地標 — — 銀河 國際會議 中心         引進 世界 級 盛事 落戶 助力 澳門 成為 「 體育 之城 」         銀河 娛樂 集團極 配合 澳門 特別 行政 區 政府 「 1 + 4 」 經濟 適度 多元 發展 政策 中 的 推動 文化 及 體育 兩大範疇 發展 的 施政 方針 ， 以 多元 舉措 包括 贊助 及 舉辦 本地 體育 活動 如 澳門 大賽 車及 澳門 國際馬拉松 ， 以及 引進 國際 體壇 盛事 如 「 WTT   澳門 冠軍賽 」 、 世界 女排 大獎賽 等 活動 落戶 澳門 ， 深化 「 旅遊 ＋ 體育 」 的 跨界 融合 ， 助力 澳門 體育 事業 發展 。 旗下 銀河 國際會議 中心 （ GICC ） 為 矚目 亞洲 的 嶄 新會展 娛樂新 地標 ， 除了 致力 於 提升 澳門會 展業 的 國際 知名度 和 競爭 力外 ， 亦 積極 引進 如 「 2023 姚 基金 慈善 賽 」 的 世界 級 盛事 活動 ， 共同 推進 澳門 建成 「 體育 之城 」 。,2024-02-22
全球體壇數百菁英,全球體壇數百菁英    將於2月23及24日匯聚銀河    共創澳門體育大未来    首屆大灣區國際體育商業峰會將於本月23日至24日於澳門銀河國際會議中心（GICC）舉行，活動由Realeague、懶熊體育和澳門通共同主辦，銀河國際會議中心贊助，並獲澳門特別行政區政府體育局和澳門貿易投資促進局支持。作為龍年首個大型體育峰會，將為中國，乃至世界的體育產業提供一個知識分享、溝通交流的平台，建立協作，並展望行業未來的多元化持續發展，發揮連接中國與亞洲及世界的橋樑作用。    是次峰會匯聚了海內外體育業界翹楚，首次齊聚中國澳門共議體育商業的發展之道。其中，阿里巴巴集團主席、NBA布魯克林籃網隊老闆蔡崇信將發表《體育影響力以及如何定義成功》的爐邊對話；超級巨星、籃球名人堂成員德懷恩?韋德（Dwyane Wade）將主講《籃球、商業和培養下一代》；以及李寧品牌創始人、集團董事長李寧將於個人議程環節與參會者分享其經驗。同場還有國際奧委會電視與營銷服務總經理Anne-Sophie Voumard；女排奧運冠軍、國際奧委會數字化互動與營銷傳播委員會委員惠若琪；西甲聯盟（LALIGA）大中華區總經理SFCM公司CEO Sergi Torrents，以及更多其他行業領袖出席峰會並進行交流，就體育投資、職業比賽、粉絲經濟、體育營銷、女性體育等關鍵主題深入討論，以增進粵港澳大灣區與國際業內發展的相互瞭解，並為整個地區體育產業協同發展積極作出貢獻。,http://www.macaodaily.com/html/2024-02/22/content_1736607.htm,西甲聯盟（LALIGA）大中華區總經理SFCM公司CEO Sergi Torrents，以及更多其他行業領袖出席峰會並進行交流，就體育投資、職業比賽、粉絲經濟、體育營銷、女性體育等關鍵主題深入討論，以增進粵港澳大灣區與國際業內發展的相互瞭解，並為整個地區體育產業協同發展積極作出貢獻,全球 體壇 數百 菁英         將於 2 月 23 及 24 日匯 聚銀河         共創 澳門 體育 大 未来         首屆 大灣區 國際 體育 商業峰 會將 於 本月 23 日至 24 日 於 澳門 銀河 國際會議 中心 （ GICC ） 舉行 ， 活動 由 Realeague 、 懶熊 體育 和 澳門通 共同 主辦 ， 銀河 國際會議 中心 贊助 ， 並獲 澳門 特別 行政 區 政府 體育局 和 澳門 貿易 投資促 進局 支持 。 作為 龍年 首個 大型 體育峰 會 ， 將為 中國 ， 乃至 世界 的 體育 產業 提供 一個 知識 分享 、 溝通 交流 的 平台 ， 建立 協作 ， 並 展望 行業 未來 的 多元化 持續 發展 ， 發揮 連接 中國 與 亞洲 及 世界 的橋 樑 作用 。         是 次峰會 匯聚 了 海內外 體育業界 翹楚 ， 首次 齊聚 中國 澳門共議 體育 商業 的 發展 之道 。 其中 ， 阿里巴巴 集團 主席 、 NBA 布魯克林籃 網隊 老 闆 蔡 崇信 將發表 《 體育 影響力 以及 如何 定義 成功 》 的 爐邊 對 話 ； 超級 巨星 、 籃球 名人堂 成員德 懷恩 ? 韋德 （ Dwyane   Wade ） 將主講 《 籃球 、 商業 和 培養 下一代 》 ； 以及 李寧 品牌 創始 人 、 集團 董事 長 李寧將 於 個 人議程 環節 與 參會者 分享 其經驗 。 同場 還有 國際 奧委會 電視 與 營銷 服務 總經理 Anne - Sophie   Voumard ； 女排 奧運冠 軍 、 國際 奧委會 數字化 互動 與 營銷 傳播 委員會 委員惠若琪 ； 西甲 聯盟 （ LALIGA ） 大中華區 總經理 SFCM 公司 CEO   Sergi   Torrents ， 以及 更 多 其他 行業 領袖 出席 峰會並 進行 交流 ， 就 體育 投資 、 職業 比賽 、 粉絲 經濟 、 體育 營銷 、 女性 體育 等 關鍵 主題 深入 討論 ， 以增 進粵 港澳 大灣區 與 國際業 內 發展 的 相互 瞭解 ， 並為 整個 地區 體育 產業 協同 發展 積極 作出 貢獻 。,2024-02-22
銀河國際會議中心 世界級先進設備　領先會展體驗,"銀河國際會議中心    世界級先進設備　領先會展體驗    銀河國際會議中心與「澳門銀河」完美融合，提供一站式的綜合會展服務和設施，多元化的綜合度假城提供豪華的住宿及服務體驗，能滿足各種商務活動需求。會展空間總面積達40,000平方米，中心內包括位於地面層面積達10,000平方米的無柱式展覽館；其靈活多樣的活動空間，設計獨到，技術先進，無論舉行大型展覽、大型研討會、會議、演唱會、體育賽事或晚宴，都能為賓客提供頂級及極具靈活性的會展及活動體驗。作為全球首屈一指的綜合旅遊休閒企業銀河娛樂集團的重要成員，銀河國際會議中心將助力實現澳門特別行政區政府「1+4」多元發展規劃，持續引入不同類型的交流活動，推動「旅遊＋」的跨界發展及豐富「世界旅遊休閒中心」定位的內涵。",http://www.macaodaily.com/html/2024-02/22/content_1736608.htm,銀河國際會議中心    世界級先進設備　領先會展體驗    銀河國際會議中心與「澳門銀河」完美融合，提供一站式的綜合會展服務和設施，多元化的綜合度假城提供豪華的住宿及服務體驗，能滿足各種商務活動需求,"銀河 國際會議 中心         世界 級 先進 設備 　 領先會展 體驗         銀河 國際會議 中心 與 「 澳門 銀河 」 完美 融合 ， 提供 一站式 的 綜合會展 服務 和 設施 ， 多元化 的 綜合 度假 城 提供 豪華 的 住宿 及 服務體驗 ， 能 滿足 各種 商務 活動 需求 。 會展 空間 總面 積達 40 , 000 平方米 ， 中心 內 包括 位 於 地面 層面 積達 10 , 000 平方米 的 無柱式 展覽館 ； 其靈活 多樣 的 活動 空間 ， 設計 獨到 ， 技術 先進 ， 無論 舉行 大型 展覽 、 大型 研討會 、 會議 、 演唱 會 、 體育賽 事 或 晚宴 ， 都 能 為 賓客 提供 頂級 及極 具靈 活性 的 會展 及 活動 體驗 。 作為 全球 首屈一指 的 綜合 旅遊 休閒 企業 銀河 娛樂 集團 的 重要 成員 ， 銀河 國際會議 中心 將 助力 實現 澳門 特別 行政 區 政府 「 1 + 4 」 多元 發展 規劃 ， 持續 引入 不同 類型 的 交流 活動 ， 推動 「 旅遊 ＋ 」 的 跨界 發展 及 豐富 「 世界 旅遊 休閒 中心 」 定位 的 內涵 。",2024-02-22
首屆國際短片節下月舉行,設展映工作坊講座等推廣澳影視    首屆國際短片節下月舉行    【本報消息】文化局及銀河娛樂集團主辦，第一屆澳門國際短片節將於三月廿三至三十日舉行，設開幕式暨開幕放映、展映活動、主題工作坊、大師講座及閉幕頒獎典禮等，冀推廣本澳影視作品，並向觀眾介紹多元化的國際和亞洲電影，展示短片多元性和活力。項目總預算九百四十八萬元，預計可售出約一千七百張門票。    新聞發佈會昨日下午三時半於澳門悅榕莊多功能廳舉行，文化局長梁惠敏、副局長鄭繼明，銀河娛樂集團董事程裕昇、總辦事處行政副總裁林志成出席介紹。梁惠敏、程裕昇向短片節“澳門短打”單元各入圍項目頒發證書。    澳影視作品穩增長    梁惠敏表示，特區政府高度重視文化建設，並將建設“以中華文化為主流，多元文化共存的交流合作基地”作為核心理念納入施政方針。去年公佈《澳門特別行政區經濟適度多元發展規劃（二○二四至二○二八年）》，為推動澳門文化產業發展，重點完善影視產業部署，增強澳門文化傳播力，積極促進本地影視界及關聯行業的發展。    近年，本澳影視產業持續發展，已累積一定作品數量及從業人員，劇情長片、短片及紀錄片等作品每年穩步增長，題材多樣化，部分作品於世界各地獲得獎項或參展機會。在推動短片製作方面，“澳門影像新勢力”作為鼓勵澳門獨立影片製作人創作更多本地劇情短片、動畫及紀錄片的項目，自二○○七年以來已有一百四十多份計劃書化為真實。    程裕昇稱，銀娛積極支持特區政府建設澳門“一基地”的施政方針，投入及參與不同類型本地文化藝術發展與推廣工作，以深化澳門社區文化藝術底蘊，增添“文化之城”氛圍。是次活動匯聚多位來自世界各地的著名電影人，展示多部澳門本地及不同國家與地區優秀影片，配合豐富多元系列活動，如工作坊、講座等，相信能進一步培育本地影視人才，以及助力推動澳門“演藝之都”建設。    四單元放映多作品    據介紹，首屆短片節設“澳門短打”、“短片新銳”、“焦點影人”及“特別展映”四單元，三月廿三日起在戀愛‧電影館及“銀河影院”放映多部不同類型短片作品。閉幕頒獎典禮將於三月廿九日在銀河國際會議中心之銀河演講廳舉行。    短片節設組織委員會，由威尼斯電影節獨立單元“威尼斯日”藝術總監Gaia Furrer任主席，成員包括多倫多國際電影節短片策展人Jason Anderson、中國內地策展人及監製沈暘，以及泰國演員茱蒂蒙翠莎容素欣，以及各地專業電影人任評審。    “澳門短打”單元展映本地徵集短片作品，體現澳門獨特的文化風貌和創新視角，面向國際推介本地人才。主辦單位早前徵集澳門短片，並選出十部入圍作品競逐大獎，包括陳庭婷《阿姐的假期》、黃美玲《瀏海》、陳俊先《海》、鄭冠洋《同途步履》、陳雅莉《陪你走到世界末日的盡頭》、侯婕《最佳禮物》、李卓媚《棉花》、何烱麟《出土》、何卓斌《紙飛機》及余志雲《同路——哪吒信俗文化紀錄片》。    展示新生代廿短片    “短片新銳”為主競賽單元，展示約二十部來自世界各地，呈現新生代電影人的思考，反映全球電影敘事的多樣性和豐富性。“焦點影人”單元將放映指定導演的短片及長片，標誌着他們對電影藝術的重大貢獻，首屆將獻映日本著名導演岩井俊二作品。“特別展映”單元呈現一系列非競賽類傑出電影，放映具藝術性、創新性及深刻社會洞察的作品。    短片節各場門票自三月十日起於澳門售票網公開發售，活動詳情可瀏覽“澳門國際短片節”專題網頁www.macaoisff.com。,http://www.macaodaily.com/html/2024-02/22/content_1736609.htm,設展映工作坊講座等推廣澳影視    首屆國際短片節下月舉行    【本報消息】文化局及銀河娛樂集團主辦，第一屆澳門國際短片節將於三月廿三至三十日舉行，設開幕式暨開幕放映、展映活動、主題工作坊、大師講座及閉幕頒獎典禮等，冀推廣本澳影視作品，並向觀眾介紹多元化的國際和亞洲電影，展示短片多元性和活力,設 展映 工作坊 講座 等 推廣澳 影視         首屆 國際 短片 節下 月 舉行         【 本報 消息 】 文化局 及 銀河 娛樂 集團 主辦 ， 第一 屆 澳門 國際 短片 節將 於 三月 廿三 至 三十日 舉行 ， 設開 幕式 暨 開幕 放映 、 展映 活動 、 主題 工作坊 、 大師 講座 及 閉幕 頒獎 典禮 等 ， 冀 推廣本 澳影視 作品 ， 並向 觀眾 介紹 多元化 的 國際 和 亞洲 電影 ， 展示 短片 多元性 和 活力 。 項目 總 預算 九百 四十八 萬元 ， 預計 可 售出 約 一千七百 張門票 。         新聞發 佈 會 昨日 下午 三時 半 於 澳門悅 榕莊 多功能 廳 舉行 ， 文化局 長 梁惠敏 、 副 局長 鄭繼明 ， 銀河 娛樂 集團 董事 程裕 昇 、 總辦 事處 行政 副 總裁 林志成 出席 介紹 。 梁惠敏 、 程裕 昇 向 短片 節 “ 澳門 短打 ” 單元 各入 圍 項目 頒 發證書 。         澳影視 作品 穩增長         梁惠敏 表示 ， 特區 政府 高度 重視 文化 建設 ， 並將 建設 “ 以中華 文化 為 主流 ， 多元 文化 共存 的 交流 合作 基地 ” 作為 核心理念 納入 施政 方針 。 去年 公 佈 《 澳門 特別 行政 區經濟 適度 多元 發展 規劃 （ 二 ○ 二 四至 二 ○ 二 八年 ） 》 ， 為 推動 澳門 文化 產業 發展 ， 重點 完善 影視產業 部署 ， 增強 澳門 文化 傳播力 ， 積極 促進 本地 影視界 及 關聯行業 的 發展 。         近年 ， 本澳 影視產業 持續 發展 ， 已累積 一定 作品 數量 及 從業 人員 ， 劇情 長 片 、 短片 及紀 錄片 等 作品 每年 穩步 增長 ， 題材 多樣化 ， 部分 作品 於 世界各地 獲得 獎項 或 參展 機會 。 在 推動 短片 製 作 方面 ， “ 澳門 影像 新勢力 ” 作為 鼓勵 澳門 獨立 影片 製 作 人 創 作 更 多 本地 劇情 短片 、 動畫 及紀 錄片 的 項目 ， 自二 ○ ○ 七年 以來 已有 一百四十 多份 計劃 書化 為 真實 。         程裕 昇 稱 ， 銀娛 積極 支持 特區 政府 建設 澳門 “ 一 基地 ” 的 施政 方針 ， 投入 及 參 與 不同 類型 本地 文化 藝術 發展 與 推廣 工作 ， 以 深化 澳門 社區 文化 藝術底 蘊 ， 增添 “ 文化 之 城 ” 氛圍 。 是 次 活動 匯聚 多位 來 自 世界各地 的 著名 電影 人 ， 展示 多部 澳門 本地 及 不同 國家 與 地區 優秀 影片 ， 配合 豐富 多元 系列 活動 ， 如 工作坊 、 講座 等 ， 相信 能進 一步 培育 本地 影視 人才 ， 以及 助力 推動 澳門 “ 演藝 之 都 ” 建設 。         四單 元 放映 多 作品         據介紹 ， 首屆 短片 節設 “ 澳門 短打 ” 、 “ 短片 新銳 ” 、 “ 焦點 影人 ” 及 “ 特別 展映 ” 四單 元 ， 三月 廿三日 起 在 戀愛 ‧ 電影館 及 “ 銀河 影院 ” 放映 多部 不同 類型 短片 作品 。 閉幕 頒獎 典禮將 於 三月 廿九日 在 銀河 國際會議 中心 之銀河演 講廳 舉行 。         短片 節設 組織 委員會 ， 由 威尼斯 電影節 獨立 單元 “ 威尼斯 日 ” 藝術 總監 Gaia   Furrer 任 主席 ， 成員 包括 多倫多國際 電影節 短片 策展 人 Jason   Anderson 、 中國內 地策 展人及 監 製 沈 暘 ， 以及 泰國 演員茱蒂蒙翠莎容 素欣 ， 以及 各地 專業 電影 人任 評審 。         “ 澳門 短打 ” 單元 展映 本地 徵集 短片 作品 ， 體現 澳門 獨特 的 文化 風貌 和 創新視角 ， 面向 國際 推介 本地 人才 。 主辦 單位 早前 徵集 澳門 短片 ， 並選出 十部 入圍 作品 競逐大獎 ， 包括 陳 庭婷 《 阿姐 的 假期 》 、 黃 美玲 《 瀏海 》 、 陳 俊 先 《 海 》 、 鄭冠洋 《 同途 步履 》 、 陳 雅莉 《 陪你走 到 世界末日 的 盡頭 》 、 侯婕 《 最佳 禮物 》 、 李卓媚 《 棉花 》 、 何 烱 麟 《 出土 》 、 何卓斌 《 紙飛機 》 及余志 雲 《 同路 — — 哪吒 信俗 文化 紀錄片 》 。         展示 新生代 廿 短片         “ 短片 新銳 ” 為主 競賽 單元 ， 展示 約 二十部 來 自 世界各地 ， 呈現 新生代 電影 人 的 思考 ， 反映 全球 電影 敘事 的 多樣 性 和 豐富性 。 “ 焦點 影人 ” 單元將 放映 指定 導演 的 短片 及長 片 ， 標誌 着 他們 對 電影 藝術 的 重大 貢獻 ， 首屆 將獻映 日本 著名 導演岩 井俊二 作品 。 “ 特別 展映 ” 單元 呈現 一系列 非 競賽 類傑 出電影 ， 放映 具藝術性 、 創新性 及 深刻 社會 洞察 的 作品 。         短片 節各場 門票 自 三月 十日 起 於 澳門 售票 網公開 發售 ， 活動 詳情 可 瀏覽 “ 澳門 國際 短片 節 ” 專題 網頁 www . macaoisff . com 。,2024-02-22
