Title,Content,Link,Summary,Preprocessed_Content,Date
“高才通”四萬四人已抵港,“高才通”四萬四人已抵港    料每年帶來三百四十億經濟貢獻    【中新社香港十三日電】香港特區政府勞工及福利局長孫玉菡十三日表示，截至今年二月底，特區政府已收到逾七點二萬宗“高端人才通行證計劃”申請，其中近五點九萬宗獲批，約四點四萬人已來港。    香港特區立法會當天召開大會，孫玉菡書面回覆議員質詢時作上述表示。他指出，“高才通計劃”旨在吸納高收入、高學歷、富工作經驗的優質人才來港發展。合資格的外來人才無須先獲香港僱主聘用，便可通過“高才通計劃”申請為期兩年的簽證來港探索機會，但在其獲批簽證有效期屆滿前提出延長逗留期限申請時，必須已獲得聘用或已在香港開辦、參與業務。    據介紹，特區政府近期對已通過“高才通計劃”簽證抵港超過六個月的人士進行首輪跟進調查，了解他們落戶香港的情況或計劃，包括他們在港就業、居住及子女教育狀況。    孫玉菡表示，基於“高才通計劃”人才及其配偶的就業和收入數據，特區政府估算該計劃每年可為香港帶來約三百四十億港元的直接經濟貢獻，約為本地生產總值的百分之一點二。除經濟貢獻外，“高才通計劃”人才及其配偶普遍較為年輕，其中過半年齡為四十歲以下，加上他們也會帶年幼子女定居香港，為本地勞動力增添生力軍，給香港人口結構帶來正面影響。    孫玉菡還提到，“高才通計劃”自二○二二年底推出以來反應踴躍。加上獲批的其他人才入境計劃申請，自去年至今已有約十點八萬名人才抵港。,http://www.macaodaily.com/html/2024-03/14/content_1741565.htm,“高才通”四萬四人已抵港    料每年帶來三百四十億經濟貢獻    【中新社香港十三日電】香港特區政府勞工及福利局長孫玉菡十三日表示，截至今年二月底，特區政府已收到逾七點二萬宗“高端人才通行證計劃”申請，其中近五點九萬宗獲批，約四點四萬人已來港,“ 高才通 ” 四萬四人 已 抵港         料 每年 帶來 三百 四十 億經濟 貢獻         【 中新社 香港 十三日 電 】 香港 特區 政府 勞工及 福利 局長 孫玉菡 十三日 表示 ， 截至 今年 二 月底 ， 特區 政府 已 收到 逾七點 二萬宗 “ 高端 人才 通行 證計劃 ” 申請 ， 其中 近五點 九萬宗 獲批 ， 約 四點 四萬人 已來 港 。         香港 特區 立法 會 當天 召開 大會 ， 孫玉菡 書面 回覆 議員質詢 時作 上述 表示 。 他 指出 ， “ 高才 通計劃 ” 旨在 吸納高 收入 、 高學歷 、 富 工作 經驗 的 優質 人才 來港 發展 。 合資格 的 外來 人才 無須 先獲 香港 僱主 聘用 ， 便 可 通過 “ 高才 通計劃 ” 申請 為期 兩年 的 簽證 來 港 探索 機會 ， 但 在 其 獲批 簽證 有效期 屆 滿前 提出 延長 逗留 期限 申請 時 ， 必須 已 獲得 聘用 或 已 在 香港 開辦 、 參與業務 。         據介紹 ， 特區 政府 近期 對 已 通過 “ 高才 通計劃 ” 簽證 抵港 超過 六個 月 的 人士 進行 首輪 跟 進 調查 ， 了解 他們 落戶 香港 的 情況 或 計劃 ， 包括 他們 在 港 就業 、 居住 及 子女教育 狀況 。         孫玉菡 表示 ， 基 於 “ 高才 通計劃 ” 人才 及其 配偶 的 就業 和 收入 數據 ， 特區 政府 估算 該計劃 每年 可為 香港 帶來 約 三百 四十 億 港元 的 直接 經濟 貢獻 ， 約 為 本地 生產 總值 的 百分之一 點二 。 除經濟 貢獻外 ， “ 高才 通計劃 ” 人才 及其 配偶 普遍 較 為 年 輕 ， 其中 過 半年 齡為 四十 歲 以下 ， 加上 他們 也 會 帶 年幼 子女 定居 香港 ， 為 本地 勞動力 增添 生力 軍 ， 給 香港 人口 結構 帶來 正面 影響 。         孫玉 菡還 提到 ， “ 高才 通計劃 ” 自二 ○ 二 二 年底 推出 以來 反應 踴躍 。 加上 獲批 的 其他 人才 入境 計劃 申請 ， 自 去年 至今已有 約十點 八萬名 人才 抵港 。,2024-03-14
振興影視再創高峰   易言,振興影視再創高峰    阿里巴巴旗下大文娛集團宣佈，將聯同多家香港文娛公司發起“港藝振興計劃”，未來五年投入不少於五十億港元，用於投資培養劇集、電影、演出和人才，同時在港建設第二總部影視基地。外界認為，計劃將有助重新振興影視，讓香港再次閃耀世界。    曾幾何時，香港影視蜚聲國際，港產影星耀目全球，尤其在內地，“港星”大受歡迎，成為受追捧一族，風光無限，香港國際影視娛樂中心之名當之無愧。然而隨着內地近年持續開放及經濟發展，影視業迅速發展並迎頭趕上。相反香港近年影視發展卻因青黃不接而停滯不前，與以前“巨星”輩出的日子更是不可同日而語。    從影視製作方面來看，內地影視票房收入近年動輒以億、甚至十億元計，與港產片千萬、百萬元票房相比，可謂天淵之別。今年新春檔期，內地多齣賀歲影片皆取得可觀票房，但由劉德華主演的《紅毯先生》卻疑因票房不佳，於上映七日後宣佈撤檔。由此可見，“港星”的受歡迎程度亦下降。    香港影視漸走下波，亟待振興，“港藝振興計劃”無疑是一支強心針。憑着阿里大文娛的創新影視和發行經驗，相信有助香港影視娛樂業在國際舞台上再創高峰，讓香港重啟影視“黃金年代”，對香港建設中外文化藝術交流中心及亞洲盛事之都亦有重大裨益。    易言,http://www.macaodaily.com/html/2024-03/14/content_1741566.htm,振興影視再創高峰    阿里巴巴旗下大文娛集團宣佈，將聯同多家香港文娛公司發起“港藝振興計劃”，未來五年投入不少於五十億港元，用於投資培養劇集、電影、演出和人才，同時在港建設第二總部影視基地,振興 影視 再 創 高峰         阿里巴巴 旗下 大文娛 集團 宣 佈 ， 將聯同 多家 香港 文娛 公司 發起 “ 港藝振興 計劃 ” ， 未來 五年 投入 不少 於 五十 億 港元 ， 用 於 投資 培養 劇集 、 電影 、 演出 和 人才 ， 同時 在 港 建設 第二 總部 影視 基地 。 外界 認為 ， 計劃將 有助 重新 振興 影視 ， 讓 香港 再次 閃耀 世界 。         曾 幾何 時 ， 香港 影視 蜚聲 國際 ， 港產 影星 耀目 全球 ， 尤其 在 內 地 ， “ 港星 ” 大受 歡迎 ， 成為 受 追捧 一 族 ， 風光 無限 ， 香港 國際 影視 娛樂 中心 之名 當之無愧 。 然而 隨着 內 地 近年 持續 開放及 經濟 發展 ， 影視業 迅速 發展 並迎頭 趕上 。 相反 香港 近年 影視 發展 卻 因青 黃 不接 而 停滯 不前 ， 與 以前 “ 巨星 ” 輩出 的 日子 更是 不可 同日 而語 。         從影 視 製 作 方面 來 看 ， 內地 影視 票房 收入 近年 動輒 以 億 、 甚至 十億元計 ， 與 港產片 千萬 、 百萬元 票房 相比 ， 可謂 天淵之別 。 今年 新春 檔期 ， 內地 多 齣 賀歲 影片 皆 取得 可觀 票房 ， 但 由 劉德華 主演 的 《 紅毯 先生 》 卻疑 因 票房 不佳 ， 於 上映 七日 後 宣 佈 撤檔 。 由此 可見 ， “ 港星 ” 的 受 歡迎 程度 亦 下降 。         香港 影視漸 走 下波 ， 亟待 振興 ， “ 港藝振興 計劃 ” 無疑 是 一支 強心針 。 憑 着 阿里 大文娛 的 創新 影視 和 發行 經驗 ， 相信 有助 香港 影視 娛樂業 在 國際 舞台 上 再 創 高峰 ， 讓 香港 重啟 影視 “ 黃 金 年代 ” ， 對 香港 建設 中外 文化 藝術 交流中心 及亞洲 盛事 之 都 亦 有 重大 裨益 。         易言,2024-03-14
海關檢八百卅萬元毒品,海關檢八百卅萬元毒品    【本報消息】據香港新聞處消息：香港海關三月十一日和十二日在元朗採取緝毒行動，檢獲共約二十八公斤懷疑毒品，估計市值共約八百三十萬元，並拘捕一名男子。    海關三月十一日晚上在元朗截停一名正在步出一輛計程車的男子，並在計程車的車尾箱內搜出兩個藏有約十九點二公斤懷疑大麻花的行李箱。該名三十六歲男子隨即被捕。    跟進調查後，海關人員昨日押解該名男子到元朗一個住宅單位進行搜查，在單位內檢獲約三公斤懷疑大麻精、約二點三公斤懷疑冰毒、約四百八十克懷疑氯胺酮、約三公斤其他不同類型懷疑毒品及一批毒品包裝工具。    案件仍在調查中。    根據《條例》，販運危險藥物屬嚴重罪行，一經定罪，最高可被判罰款五百萬元及終身監禁。,http://www.macaodaily.com/html/2024-03/14/content_1741567.htm,跟進調查後，海關人員昨日押解該名男子到元朗一個住宅單位進行搜查，在單位內檢獲約三公斤懷疑大麻精、約二點三公斤懷疑冰毒、約四百八十克懷疑氯胺酮、約三公斤其他不同類型懷疑毒品及一批毒品包裝工具,海關檢 八百 卅萬元 毒品         【 本報 消息 】 據 香港 新聞處 消息 ： 香港 海關 三月 十一日 和 十二日 在 元朗 採取 緝毒 行動 ， 檢獲共約 二十八 公斤 懷疑 毒品 ， 估計 市值 共約 八百 三十 萬元 ， 並 拘捕 一名 男子 。         海關 三月 十一日 晚上 在 元朗 截停 一名 正在 步出 一輛 計程車 的 男子 ， 並在 計程車 的 車尾箱 內 搜出 兩個 藏有 約 十九 點二 公斤 懷疑 大 麻花 的 行李箱 。 該名 三十六 歲 男子 隨即 被捕 。         跟進 調查 後 ， 海關 人員 昨日 押解 該名 男子 到 元朗 一個 住宅 單位 進行 搜查 ， 在 單位 內 檢獲 約 三 公斤 懷疑 大麻 精 、 約二點 三 公斤 懷疑 冰毒 、 約 四百八十 克懷疑 氯胺酮 、 約 三 公斤 其他 不同 類型 懷疑 毒品 及 一批 毒品 包裝 工具 。         案件 仍 在 調查 中 。         根據 《 條例 》 ， 販運 危險 藥物屬 嚴重 罪行 ， 一經 定罪 ， 最高 可 被判 罰款 五百 萬元及 終身 監禁 。,2024-03-14
未來五年公屋單位增9%,未來五年公屋單位增9%    【香港中通社十三日電】香港特區政府房屋局長何永賢十三日回應立法會議員質詢時表示，政府一直全方位推動土地及房屋供應，預計未來五年（二○二四/二○二五至二○二八/二○二九年度）整體公營房屋建屋量將增加至約十七萬二千個單位，較上一個五年期的十五萬八千個增加約百分之九。    何永賢指出，特區政府透過各項提速、提效、提量的措施，加快造地建屋。預計未來五年傳統公營房屋的建屋量約十四萬二千個單位，再加上額外興建約三萬個“簡約公屋”單位，整體公營房屋建屋量將增加至約十七萬二千個單位。同時，亦加強打擊濫用，以確保珍貴的公屋資源能給予最有需要的人士。    供應方面，房委會的資助出售單位建屋量由二○一六/一七年度的約三千個，大幅提升至二○二二/二三年度的約九千七百個。近期推出的“居屋二○二三”便有約九千二百個單位，數目是近年新高。    何永賢表示，理解大家都希望增加資助出售單位的供應，但在現時公屋平均輪候時間仍較長的情況下，認為現階段的重點目標是盡量增加公屋供應，讓有需要的申請者盡快上樓。,http://www.macaodaily.com/html/2024-03/14/content_1741568.htm,未來五年公屋單位增9%    【香港中通社十三日電】香港特區政府房屋局長何永賢十三日回應立法會議員質詢時表示，政府一直全方位推動土地及房屋供應，預計未來五年（二○二四/二○二五至二○二八/二○二九年度）整體公營房屋建屋量將增加至約十七萬二千個單位，較上一個五年期的十五萬八千個增加約百分之九,未來 五年 公屋 單位 增 9%         【 香港 中通社 十三日 電 】 香港 特區 政府 房屋 局長 何永賢 十三日 回應 立法 會議員質 詢時 表示 ， 政府 一直 全方位 推動 土地 及 房屋 供應 ， 預計 未來 五年 （ 二 ○ 二四 / 二 ○ 二五 至 二 ○ 二八 / 二 ○ 二九 年度 ） 整體 公營 房屋 建屋 量將 增加 至約 十七 萬 二千 個 單位 ， 較 上 一個 五年期 的 十五 萬 八千 個 增加 約 百分之九 。         何永賢 指出 ， 特區 政府 透過 各項 提速 、 提效 、 提量 的 措施 ， 加快 造地 建屋 。 預計 未來 五年 傳統 公營 房屋 的 建屋量 約 十四 萬 二千 個 單位 ， 再 加上 額外 興建約 三萬個 “ 簡約 公屋 ” 單位 ， 整體 公營 房屋 建屋 量將 增加 至約 十七 萬 二千 個 單位 。 同時 ， 亦 加強 打擊 濫用 ， 以確 保珍貴 的 公屋 資源 能 給予 最 有 需要 的 人士 。         供應 方面 ， 房委會 的 資助 出售 單位 建屋量 由 二 ○ 一 六 / 一 七 年度 的 約 三千 個 ， 大幅 提升 至 二 ○ 二 二 / 二三 年度 的 約 九千 七百 個 。 近期 推出 的 “ 居屋 二 ○ 二三 ” 便 有 約 九千 二百 個 單位 ， 數目 是 近年 新高 。         何永賢 表示 ， 理解 大家 都 希望 增加 資助 出售 單位 的 供應 ， 但 在 現時 公屋 平均 輪候 時間 仍 較 長 的 情況 下 ， 認為 現階段 的 重點 目標 是 盡量 增加 公屋 供應 ， 讓 有 需要 的 申請者 盡快 上樓 。,2024-03-14
冀炸雞店爆燃塌樓2死26傷,冀炸雞店爆燃塌樓2死26傷    【本報駐北京記者王維十三日電】今天早上七時五十四分，河北省廊坊三河市燕郊小張各莊村一老小區底商餐飲店發生爆炸。目前，事故造成兩人死亡，廿六人受傷。爆炸亦導致周邊居民住宅和商戶不同程度受損。    疑似燃氣洩露    爆炸疑似燃氣洩露引發。據三河市應急管理局隨後通告，二○二四年三月十三日七時五十四分，三河市燕郊一炸雞店發生疑似燃氣洩露引發的爆燃事故，應急、消防、衛健等有關部門第一時間趕赴現場全力救援處置。下午二時許，央視新聞報道，據三河市應急管理局局長紀宏圖稱，截至目前，事故造成兩人死亡，廿六人受傷，傷患已被送醫救治。目前明火已被撲滅，五百米附近的居民已經轉移。    上午九時四十分左右，本報記者趕到現場看到，火勢基本已被控制，煙霧少了很多，可以聞到些許焦糊味，聽到工程機械發出的轟鳴聲。周邊各個路口已經拉起了警戒線，實施交通管制，不允許行人和社會車輛通行。不時有參與救援的車輛駛入駛出。現場一名負責警戒的警員說，早上八時正在執勤，接到通知後，馬上趕到了現場。隨後大批救援人員和車輛陸續趕來。    周邊建築受損    爆炸威力較大，波及面較廣，附近社區建築玻璃被震碎，路面多輛汽車受損。有住在爆炸對面的居民說，他所住的地方叫文化大廈，距離爆炸地點只有一路之隔。他早上出門不久，就聽到爆炸聲，社區微信群立馬活躍起來，他急忙趕回家查看，好在他家是在西南側，沒有受到太大影響。    但這名居民說，有住在東側的居民在微信群裡表示，家裡受損比較嚴重，臨街的窗玻璃大部分震碎，也有住戶表示家裡已經不能住人了。從他展示的多段爆炸視頻顯示，爆炸發生時，對面樓房冒出耀眼火光，煙霧很大，揚起高高的煙塵，不僅現場及附近的建築受損，很多路上的車輛都受損嚴重。    僅剩殘垣骨架    上午十時許，在文化大廈內看到，很多樓層的天花板被震碎或掉落。其中一戶正對爆炸現場的住宅內，碎玻璃、吸頂燈罩、廚房門等散落一地。透過空蕩蕩的窗戶俯看，爆炸所在樓體僅剩殘垣骨架，滿目狼藉。現場除了有應急、消防、醫護等救援人員仍在施救外，還有環衛工人在清理散落在地上的建築碎片。    距離爆炸現場斜對面，一個不足兩百米遠的另一個社區裡，一名居民說，爆炸地點位於海油大街與漢王路相交的路口，是一棟四層樓建築，臨街有幾家美食店舖，樓上兩層是一家招待所。今天早上七時五十分左右，他聽到一聲巨響，當時他正在曬鞋子，隨着爆炸聲，“剛擺放好的鞋子被震得跳起來。”在社區裡，記者看到很多南向的窗玻璃被震碎，碎玻璃散落一地。有居民的車輛前擋風玻璃被爆炸損壞，車主正在查看受損情況。所幸社區裡的居民和附近商戶都安全。    兩重傷者脫險    中午十一時許，不遠處的一所小學放學，很多家長焦急在外面等待。一名小學生說，早上聽到爆炸聲，沒感到很恐懼，班裡的其他同學也都安然無恙。    此外，爆燃事故發生以後，當地部分區域的天然氣停止供應。停氣區域包括爆炸點附近的文化大廈、北歐小鎮、小張莊、百花家園、銀燕等。當晚三河市應急管理局表示，搜救已接近尾聲，要對現場進行安全排查，預計今晚可以恢復天然氣供應。    針對河北省三河市燕郊鎮今晨發生的爆燃事故，國家衛健委當日通報稱，截至三月十三日十三時，本次事故目前在院傷患十四人，其中重傷兩人，主要為顱腦損傷、氣胸，目前無生命危險；普通傷十二人，主要為軟組織損傷、骨折，生命體徵平穩。輕傷人員經急診處置後離院。,http://www.macaodaily.com/html/2024-03/14/content_1741378.htm,距離爆炸現場斜對面，一個不足兩百米遠的另一個社區裡，一名居民說，爆炸地點位於海油大街與漢王路相交的路口，是一棟四層樓建築，臨街有幾家美食店舖，樓上兩層是一家招待所,冀炸 雞店 爆燃 塌樓 2 死 26 傷         【 本報 駐 北京 記者 王維 十三日 電 】 今天 早上 七時 五十四 分 ， 河北省 廊坊 三河市 燕郊 小張 各莊村 一 老小 區底 商餐 飲店 發生 爆炸 。 目前 ， 事故 造成 兩人 死亡 ， 廿六 人 受傷 。 爆炸 亦 導致 周邊 居民 住宅 和 商戶 不同 程度 受損 。         疑似 燃氣 洩露         爆炸 疑似 燃氣 洩露 引發 。 據 三河市 應急 管理局 隨後 通告 ， 二 ○ 二 四年 三月 十三日 七時 五十四 分 ， 三河市 燕郊 一炸 雞店 發生 疑似 燃氣 洩露 引發 的 爆燃 事故 ， 應急 、 消防 、 衛健 等 有 關部門 第一 時間 趕 赴 現場 全力 救援 處置 。 下午 二時許 ， 央視 新聞 報道 ， 據 三河市 應急 管理局 局長 紀宏圖 稱 ， 截至 目前 ， 事故 造成 兩人 死亡 ， 廿六 人 受傷 ， 傷患 已 被 送醫 救治 。 目前 明火 已 被 撲滅 ， 五百米 附近 的 居民 已經 轉移 。         上午 九時 四 十分 左右 ， 本報 記者 趕到 現場 看到 ， 火勢 基本 已 被 控制 ， 煙霧 少 了 很多 ， 可以 聞到 些許 焦糊 味 ， 聽到 工程 機械 發出 的 轟鳴聲 。 周邊 各個 路口 已 經拉起 了 警戒 線 ， 實施 交通管制 ， 不允許 行人 和 社會 車輛 通行 。 不時 有 參 與 救援 的 車輛 駛入 駛出 。 現場 一名 負責 警戒 的 警員 說 ， 早上 八時 正在 執勤 ， 接到 通知 後 ， 馬 上 趕到 了 現場 。 隨後 大批 救援 人員 和 車輛 陸續 趕來 。         周邊 建築 受損         爆炸 威力 較大 ， 波及面 較廣 ， 附近 社區 建築 玻璃 被 震碎 ， 路面 多輛 汽車 受損 。 有 住 在 爆炸 對面 的 居民 說 ， 他 所 住 的 地方 叫 文化 大廈 ， 距離 爆炸 地點 只有 一路 之隔 。 他 早上 出門 不久 ， 就 聽 到 爆炸 聲 ， 社區 微信 群立 馬 活躍起 來 ， 他 急忙 趕 回家 查看 ， 好 在 他家 是 在 西南 側 ， 沒有 受到 太大 影響 。         但 這名 居民 說 ， 有 住 在 東側 的 居民 在 微信 群裡 表示 ， 家裡 受 損比較 嚴重 ， 臨街 的 窗玻璃 大部分 震碎 ， 也 有 住戶 表示 家裡 已經 不能 住 人 了 。 從 他 展示 的 多 段 爆炸 視頻 顯示 ， 爆炸 發生 時 ， 對面 樓房 冒出 耀眼 火光 ， 煙霧 很大 ， 揚起 高高的 煙塵 ， 不僅 現場 及 附近 的 建築 受損 ， 很多 路上 的 車輛 都 受損 嚴重 。         僅剩 殘垣 骨架         上午 十時許 ， 在 文化 大廈 內 看到 ， 很多 樓層 的 天花板 被 震碎 或 掉落 。 其中 一戶 正 對 爆炸 現場 的 住宅 內 ， 碎玻璃 、 吸頂 燈罩 、 廚房門 等 散落 一地 。 透過 空 蕩 蕩 的 窗戶 俯看 ， 爆炸 所在 樓體僅 剩殘垣 骨架 ， 滿目 狼藉 。 現場 除了 有應 急 、 消防 、 醫護 等 救援 人員 仍 在 施救 外 ， 還有 環衛 工人 在 清理 散落 在 地上 的 建築 碎片 。         距離 爆炸 現場 斜 對面 ， 一個 不足 兩 百米 遠 的 另 一個 社區裡 ， 一名 居民 說 ， 爆炸 地點位 於 海油 大街 與 漢 王路 相交 的 路口 ， 是 一棟 四層 樓 建築 ， 臨街 有 幾家 美食 店 舖 ， 樓上 兩層 是 一家 招待所 。 今天 早上 七時 五 十分 左右 ， 他 聽 到 一聲 巨響 ， 當時 他 正在 曬 鞋子 ， 隨着 爆炸 聲 ， “ 剛擺放 好 的 鞋子 被 震 得 跳 起來 。 ” 在 社區裡 ， 記者 看到 很多 南向 的 窗玻璃 被 震碎 ， 碎玻璃 散落 一地 。 有 居民 的 車輛 前 擋 風 玻璃 被 爆炸 損壞 ， 車主 正在 查看 受損 情況 。 所幸 社區裡 的 居民 和 附近 商戶 都 安全 。         兩重 傷者 脫險         中午 十一 時許 ， 不遠處 的 一所 小學放學 ， 很多 家長 焦急 在 外面 等待 。 一名 小學生 說 ， 早上 聽到 爆炸 聲 ， 沒 感到 很 恐懼 ， 班裡 的 其他 同學 也 都 安然 無恙 。         此外 ， 爆燃 事故 發生 以 後 ， 當地 部分 區域 的 天然 氣 停止 供應 。 停氣區域 包括 爆炸 點 附近 的 文化 大廈 、 北歐 小鎮 、 小 張莊 、 百花 家園 、 銀燕 等 。 當晚 三河市 應急 管理局 表示 ， 搜救 已 接近 尾聲 ， 要 對 現場 進行 安全 排查 ， 預計 今晚 可以 恢 復 天然 氣供 應 。         針對 河北省 三河市 燕郊 鎮 今晨 發生 的 爆燃 事故 ， 國家衛 健委當 日通 報稱 ， 截至 三月 十三日 十三 時 ， 本次 事故 目前 在 院傷 患 十四 人 ， 其中 重傷 兩人 ， 主要 為 顱腦 損傷 、 氣胸 ， 目前 無 生命 危險 ； 普通 傷 十二 人 ， 主要 為 軟 組織 損傷 、 骨折 ， 生命 體徵平 穩 。 輕傷 人員經 急 診處 置後離院 。,2024-03-14
