Title,Content,Link,Summary,Preprocessed_Content,Date
A3車橋旁擬設行人通道,連接A區濱海綠廊和水塘步行徑    A3車橋旁擬設行人通道    【本報消息】連接新城A區至外港碼頭一帶的A3行車天橋即將動工，公共建設局規劃，在A3行車天橋旁增設行人天橋，連接新城A區濱海綠廊及澳門半島水塘步行徑。另外，新城A區連接至近黑沙環污水廠的連接橋(A2)工程，已施工一年多，預計於今年十月完工。    編製行人天橋計劃    公建局表示，為滿足澳門半島與新城A區之間的行人往來需求，計劃沿即將興建的A3行車天橋旁邊增設行人通道，以連接澳門半島水塘步行徑及新城A區的濱海綠廊。據公建局官網顯示，“新城填海A區與澳門半島連接橋(A3)之行人通道”編製計劃已外判予奧雅納工程顧問，價格為二百六十八萬元，工期為一百二十五個工作天。    公建局表示，A3橋的行人通道，將跨越A區與澳門半島之間的水道、友誼大橋和友誼大馬路，兩側落腳點分別設於A區西側近岸濱海綠廊內及澳門半島一側的水塘步行區域。行人通道全長約三百七十米，橋面通行寬度約四米，落腳點均設有無障礙設施。    A3橋四匝道通澳    新城A區與澳氹之間尚有多條出入通道，除已投入使用、連接東方明珠圓形地的A1橋外，尚有兩條通道正在施工，其中澳氹第四條跨海大橋預計下月竣工，而連接至勞動節大馬路近污水處理廠的A2連接橋，具有行車天橋及行人天橋，於二○二二年十一月委託的工程，預計於今年十月竣工。“運輸工務範疇超過一億之工程的狀況”列表顯示，兩項工程均沒有超時，進度理想。    按照規劃，A3行車天橋其中一側落腳點為新城A區中部，另一側澳門落腳點分成四條匝道，與友誼大橋、友誼大橋匝道、友誼大馬路和外港碼頭道路銜接。工程已於去年十二月招標，預計今年第二季動工，造價為六億○八百八十一萬八千八百元，設計連施工總工期為八百五十五工作天。今年度施政報告顯示，工程預計二○二八年上半年完工。    AB區天橋正招標    此外，友誼圓形地行車天橋建造工程第二期（B匝道），爭取今年首季動工，施工期為四百九十五個工作天。今年度施政報告顯示，工程預計二○二八年上半年完工。新城A、B區行車天橋設計連建造工程現仍在招投標階段，當局預計設計連施工期為一千個工作天。今年度施政報告顯示，工程預計二○二八年上半年完工。,http://www.macaodaily.com/html/2024-02/25/content_1737188.htm,A3橋四匝道通澳    新城A區與澳氹之間尚有多條出入通道，除已投入使用、連接東方明珠圓形地的A1橋外，尚有兩條通道正在施工，其中澳氹第四條跨海大橋預計下月竣工，而連接至勞動節大馬路近污水處理廠的A2連接橋，具有行車天橋及行人天橋，於二○二二年十一月委託的工程，預計於今年十月竣工,連接 A 區濱 海綠廊 和 水塘 步行 徑         A3 車橋 旁擬 設 行人 通道         【 本報 消息 】 連接 新城 A 區至 外港 碼頭 一帶 的 A3 行車 天橋 即 將動工 ， 公共 建設局 規劃 ， 在 A3 行車 天橋 旁 增設 行人 天橋 ， 連接 新城 A 區濱 海綠廊 及 澳門 半島 水塘 步行 徑 。 另外 ， 新城 A 區連接 至 近 黑沙 環 污水 廠 的 連接橋 ( A2 ) 工程 ， 已 施工 一年 多 ， 預計 於 今年 十月 完工 。         編 製 行人 天橋 計劃         公建局 表示 ， 為 滿足 澳門 半島 與 新城 A 區之間 的 行人 往來 需求 ， 計劃 沿即 將興建 的 A3 行車 天橋 旁邊 增設 行人 通道 ， 以連接 澳門 半島 水塘 步行 徑及 新城 A 區的濱 海綠廊 。 據 公建局 官網 顯示 ， “ 新城 填海 A 區與 澳門 半島 連接橋 ( A3 ) 之 行人 通道 ” 編 製 計 劃 已 外 判 予 奧 雅 納 工程 顧問 ， 價格 為 二百六十 八萬元 ， 工期 為 一百二十五 個 工作 天 。         公建局 表示 ， A3 橋的 行人 通道 ， 將 跨越 A 區與 澳門 半島 之間 的 水道 、 友誼 大橋 和 友誼 大馬路 ， 兩側 落腳點 分別 設 於 A 區西側 近岸 濱海 綠廊 內及 澳門 半島 一側 的 水塘 步行 區域 。 行人 通道 全長 約 三百 七十米 ， 橋面 通行 寬度 約 四米 ， 落腳點 均 設有 無障礙 設施 。         A3 橋四 匝道 通澳         新城 A 區與 澳氹之間 尚有 多條 出入 通道 ， 除 已 投入使用 、 連接 東方 明珠 圓形 地 的 A1 橋外 ， 尚有 兩條 通道 正在 施工 ， 其中 澳 氹 第四 條 跨海 大橋 預計 下 月 竣工 ， 而 連接 至 勞動節 大馬路 近 污水 處理廠 的 A2 連接橋 ， 具有 行車 天橋 及 行人 天橋 ， 於 二 ○ 二 二年 十一月 委 託 的 工程 ， 預計 於 今年 十月 竣工 。 “ 運輸 工務範疇 超過 一 億 之 工程 的 狀況 ” 列表 顯示 ， 兩項 工程 均 沒 有 超時 ， 進度 理想 。         按照 規劃 ， A3 行車 天橋 其中 一側 落腳點 為 新城 A 區 中部 ， 另 一側 澳門落 腳點 分成 四條 匝道 ， 與 友誼 大橋 、 友誼 大橋 匝道 、 友誼 大馬路 和 外港 碼頭 道路 銜接 。 工程 已 於 去年 十二月 招標 ， 預計 今年 第二季 動工 ， 造價 為 六 億 ○ 八百 八十一 萬 八千 八百元 ， 設計連 施工 總 工期 為 八百 五十五 工作 天 。 今 年度 施政 報告 顯示 ， 工程 預計 二 ○ 二 八年 上半年 完工 。         AB 區天橋 正 招標         此外 ， 友誼 圓形 地行車 天橋 建造 工程 第二期 （ B 匝道 ） ， 爭取 今年 首季 動工 ， 施工期 為 四百 九 十五 個 工作 天 。 今 年度 施政 報告 顯示 ， 工程 預計 二 ○ 二 八年 上半年 完工 。 新城 A 、 B 區行車 天橋 設計連 建造 工程 現 仍 在 招 投標 階段 ， 當局 預計 設計連 施工期 為 一千 個 工作 天 。 今 年度 施政 報告 顯示 ， 工程 預計 二 ○ 二 八年 上半年 完工 。,2024-02-25
澳氹第四橋下月竣工,澳氹第四橋下月竣工    兩落腳點路網建設須延期完成    【本報消息】澳氹第四條跨海大橋，連接澳門新城A區東側至新城填海E1區，並預留與大潭山隧道對接高架橋。第四大橋主體預計下月竣工，但第四大橋在新城A區及口岸人工島的落腳點路網，原定同步下月完工，但受到A區共同管道工程施工影響，須待完成相關共同管道工程後，才具條件繼續施工，因此路網工程需延期完成。    八號波期間能通車    第四條大橋全長三點○八五公里，為澳門首條雙向八車道跨海大橋，其中兩車道為摩托車專用道，並設有風障使懸掛八號風球時大橋上的對應風速能保持與陸地一致，確保八號風球或以上懸掛期間澳氹交通不會中斷。大橋跨越內港航道及外港航道，北連新城A區，並設匝道連接珠澳口岸人工島及新城A區至B區通道橋；南接北安填海區，建設時已預留介面連接大潭山隧道。其中，第四大橋北主橋已於今月一日凌晨順利合龍，只餘下一段吊裝工程，運輸工務司司長羅立文稱將於短期完成。    管道工程影響進度    第四條大橋有起止點三項路網工程，其中氹仔偉龍馬路連接線已於去年十二月竣工，“口岸人工島連接線”工程及“A區東軸線——第一期工程”，分別由“通利建築”及 “得寶國際——得寶建築合作經營”承接，兩工程原定下月完工。但根據“運輸工務範疇超過一億之工程的狀況”列表顯示，兩項工程分別超時兩成八及兩成三。因為受到新城A區共同管道工程施工影響，須待完成施工範圍內的共同管道工程後，才具條件繼續施工，故延長施工期。,http://www.macaodaily.com/html/2024-02/25/content_1737189.htm,第四大橋主體預計下月竣工，但第四大橋在新城A區及口岸人工島的落腳點路網，原定同步下月完工，但受到A區共同管道工程施工影響，須待完成相關共同管道工程後，才具條件繼續施工，因此路網工程需延期完成,澳 氹 第四 橋下 月 竣工         兩落 腳點 路 網建 設須 延期 完成         【 本報 消息 】 澳 氹 第四 條 跨海 大橋 ， 連接 澳門 新城 A 區東側 至 新城 填海 E1 區 ， 並預 留 與 大潭 山 隧道 對接 高架 橋 。 第四 大橋 主體 預計 下 月 竣工 ， 但 第四 大橋 在 新城 A 區及 口岸 人工 島的 落腳點 路網 ， 原定 同步 下 月 完工 ， 但 受到 A 區 共同 管道工程 施工 影響 ， 須待 完成 相關 共同 管道工程 後 ， 才 具條件 繼續 施工 ， 因此 路網 工程 需 延期 完成 。         八號 波期 間 能 通車         第四 條大橋 全長 三點 ○ 八五 公里 ， 為 澳門 首條 雙向 八車 道 跨海 大橋 ， 其中 兩車 道 為 摩托 車專用 道 ， 並設 有 風障 使 懸掛 八號 風球 時大橋 上 的 對 應風速 能 保持 與 陸地 一致 ， 確保八號 風球 或 以上 懸掛 期間 澳 氹 交通 不會 中斷 。 大橋 跨越 內港 航道 及 外港 航道 ， 北連 新城 A 區 ， 並設 匝道 連接 珠澳 口岸 人工 島及 新城 A 區至 B 區 通道 橋 ； 南接 北安 填海 區 ， 建設 時 已 預留 介面 連接 大潭 山 隧道 。 其中 ， 第四 大橋 北主橋 已 於 今 月 一日 凌晨 順利合龍 ， 只餘下 一段 吊裝 工程 ， 運輸 工務司 司長 羅 立文 稱將 於 短期 完成 。         管道工程 影響 進度         第四 條大橋 有 起止 點三項 路網 工程 ， 其中 氹 仔偉龍馬路 連接線 已 於 去年 十二月 竣工 ， “ 口岸 人工 島連 接線 ” 工程 及 “ A 區東軸線 — — 第一期 工程 ” ， 分別 由 “ 通利 建築 ” 及   “ 得 寶國際 — — 得 寶建築 合作 經營 ” 承接 ， 兩 工程 原定 下 月 完工 。 但 根據 “ 運輸 工務範疇 超過 一 億 之 工程 的 狀況 ” 列表 顯示 ， 兩項 工程 分別 超時 兩成 八及 兩成 三 。 因為 受到 新城 A 區 共同 管道工程 施工 影響 ， 須待 完成 施工 範圍 內 的 共同 管道工程 後 ， 才 具條件 繼續 施工 ， 故延長 施工期 。,2024-02-25
市署：日後運作將關燈,紅街市設發光時鐘影響美觀？    市署：日後運作將關燈    【本報消息】現進行整治工程的紅街市，爭取下季重開。近日有網民拍攝到紅街市塔樓時鐘發出亮光，認為“格格不入”，影響美觀。市政署回應時表示，街市整治工程按計劃正有序推進，近日承判商按原圖則對中間塔樓設置的時鐘設備進行測試，日後運作時會關閉發光功能。    按原圖則復設時鐘    市政署指出，整治工程須兼顧對紅街市的保育，市政署與文化局等部門一直緊密溝通，制訂整治方案，包括保留外牆、屋面及以上部分、中間十字形塔樓及樓梯等，並按原圖則恢復設置時鐘，在保育建築物的同時延續紅街市服務民生的功能。    昔日塔樓有鐘報時    另有網上意見指出，紅街市塔樓在整治前並沒有時鐘。    文化局回應時表示，紅街市為本澳文物建築，文化局早前已就紅街市修復工程計劃發表意見。當時計劃內提出了計劃在塔樓上掛設時鐘的構想及預留位置，經參考昔日紅街市設計方案、歷史照片及口述歷史資料等，考慮紅街市塔樓昔日亦具有報時功能，故對有關設置時鐘的構想不持反對意見；然而就時鐘的具體式樣及設計，文化局現階段未接獲相關資料。,http://www.macaodaily.com/html/2024-02/25/content_1737190.htm,按原圖則復設時鐘    市政署指出，整治工程須兼顧對紅街市的保育，市政署與文化局等部門一直緊密溝通，制訂整治方案，包括保留外牆、屋面及以上部分、中間十字形塔樓及樓梯等，並按原圖則恢復設置時鐘，在保育建築物的同時延續紅街市服務民生的功能,紅 街市 設發光 時鐘 影響 美觀 ？         市署 ： 日後運 作將 關燈         【 本報 消息 】 現進行 整治 工程 的紅 街市 ， 爭取 下季 重開 。 近日 有 網民拍 攝到紅 街市 塔樓 時鐘 發出 亮光 ， 認為 “ 格格不入 ” ， 影響 美觀 。 市政 署回 應時 表示 ， 街市 整治 工程 按計劃 正 有序 推進 ， 近日 承判商 按原 圖則 對 中間 塔樓 設置 的 時鐘 設備 進行 測試 ， 日後運作 時會 關閉 發光 功能 。         按原 圖則 復 設時鐘         市政 署 指出 ， 整治 工程 須兼顧 對紅 街市 的 保育 ， 市政 署 與 文化局 等 部門 一直 緊密 溝通 ， 制訂 整治 方案 ， 包括 保留 外牆 、 屋面 及 以上 部分 、 中間 十字形 塔樓 及 樓梯 等 ， 並按 原圖則 恢 復 設置 時鐘 ， 在 保育 建築物 的 同時 延續紅 街市 服務 民生 的 功能 。         昔日 塔樓 有鐘 報時         另有 網上 意見 指出 ， 紅 街市 塔樓 在 整治 前並 沒有 時鐘 。         文化局 回應 時 表示 ， 紅 街市 為 本澳 文物 建築 ， 文化局 早前 已就紅 街市 修 復 工程 計劃發 表意 見 。 當時 計劃 內 提出 了 計劃 在 塔樓 上 掛設 時鐘 的 構想 及 預留 位置 ， 經參考 昔日 紅 街市 設計 方案 、 歷史 照片 及 口述 歷史 資料 等 ， 考慮紅 街市 塔樓 昔日 亦 具有 報時 功能 ， 故對 有關 設置 時鐘 的 構想 不持 反對 意見 ； 然而 就 時鐘 的 具體式 樣及 設計 ， 文化局 現階段 未接 獲相關 資料 。,2024-02-25
去年近七百二十萬港客訪澳,旅局與港業界合作促客源互送拓市場    去年近七百二十萬港客訪澳    【本報消息】旅遊局訊：旅遊局前（二十三）日於香港設春茗，答謝香港旅遊業界對澳門旅遊業發展的貢獻及支持。旅遊局長文綺華及副局長程衛東率領一眾旅遊局人員出席，逾百名香港旅遊業界代表參加。出席春茗嘉賓還包括亞洲旅遊交流中心主任張棟、香港旅遊發展局主席彭耀佳、旅遊事務署旅遊事務專員沈鳳君及香港旅遊業議會主席徐王美倫等。    持續促進“旅遊＋”    文綺華於春茗上感謝香港業界對澳門旅遊業的支持，並祝願所有嘉賓新年進步、更上一層樓。二〇二三年澳門整體入境旅客逾二千八百萬人次，香港是澳門的第二大客源市場，去年有接近七百二十萬香港旅客人次到訪澳門，已恢復至接近二〇一九年疫情前的水平。    旅遊局持續促進“旅遊＋”，豐富澳門作為“世界旅遊休閒中心”的內涵。二〇二四年是澳門特別行政區成立廿五周年，旅遊局陸續推出一連串慶祝活動及節慶盛事，吸引世界各地旅客來澳體驗，同時鼓勵旅客探索社區，為社區經濟注入新動力。配合粵港澳大灣區發展，旅遊局持續深化“旅遊＋”跨界融合、着力發展多元旅遊元素、推動區域聯動發展，宣傳澳門這個多元化的旅遊目的地。    定期辦產品簡報會    旅遊局配合澳門特區政府“1+4”經濟適度多元發展策略，聯同業界積極推動與優化綜合旅遊休閒業發展，同時加大力度開拓國際客源市場，包括發揮香港市場優勢，透過業界及不同渠道，鼓勵訪港之國際旅客延伸行程至澳門，例如推出“賞飛澳門”車船優惠活動，亦會與航空公司、郵輪公司、主要入境旅行社等助力推動更多國際旅客到澳門旅遊。旅遊局駐香港代表繼續加強與旅遊業界的溝通及協作，定期舉辦產品簡報會、主題考察團、聯合推廣及消費者推廣等活動，並按不同市場旅客的需要推出各項宣傳活動，讓更多旅客前往感受澳門，體驗“創意城市美食之都”的魅力。,http://www.macaodaily.com/html/2024-02/25/content_1737126.htm,定期辦產品簡報會    旅遊局配合澳門特區政府“1+4”經濟適度多元發展策略，聯同業界積極推動與優化綜合旅遊休閒業發展，同時加大力度開拓國際客源市場，包括發揮香港市場優勢，透過業界及不同渠道，鼓勵訪港之國際旅客延伸行程至澳門，例如推出“賞飛澳門”車船優惠活動，亦會與航空公司、郵輪公司、主要入境旅行社等助力推動更多國際旅客到澳門旅遊,旅局 與 港業界 合作 促 客源 互送 拓市場         去年 近 七百 二十 萬 港客 訪澳         【 本報 消息 】 旅遊局 訊 ： 旅遊局 前 （ 二十三 ） 日 於 香港 設春茗 ， 答謝 香港 旅遊業界 對 澳門 旅遊業 發展 的 貢獻及 支持 。 旅遊 局長 文綺華及 副 局長 程衛 東率 領一眾 旅遊局 人員 出席 ， 逾 百名 香港 旅遊業界 代表 參加 。 出席 春茗嘉賓還 包括 亞洲 旅遊 交流中心 主任 張棟 、 香港 旅遊 發展 局主席 彭耀佳 、 旅遊 事務署 旅遊 事務 專員 沈鳳君 及 香港 旅遊業 議會 主席 徐王 美倫 等 。         持續 促進 “ 旅遊 ＋ ”         文綺華 於 春茗 上 感謝 香港 業界 對 澳門 旅遊業 的 支持 ， 並祝願 所有 嘉賓 新年 進步 、 更上 一層 樓 。 二 〇 二三年 澳門 整體 入境 旅客 逾 二 千八百 萬 人次 ， 香港 是 澳門 的 第二 大 客源 市場 ， 去年 有 接近 七百 二十 萬 香港 旅客 人次 到訪 澳門 ， 已 恢 復 至 接近 二 〇 一 九年 疫情 前 的 水平 。         旅遊局 持續 促進 “ 旅遊 ＋ ” ， 豐富 澳門作 為 “ 世界 旅遊 休閒 中心 ” 的 內涵 。 二 〇 二 四年 是 澳門 特別 行政 區 成立 廿五 周年 ， 旅遊局 陸續 推出 一連 串慶祝 活動 及 節慶 盛事 ， 吸引 世界各地 旅客 來 澳體驗 ， 同時 鼓勵 旅客 探索 社區 ， 為 社區 經濟 注入 新動力 。 配合 粵 港澳 大灣區 發展 ， 旅遊局 持續 深化 “ 旅遊 ＋ ” 跨界 融合 、 着力 發展 多元 旅遊 元素 、 推動區域 聯動 發展 ， 宣傳 澳門 這個 多元化 的 旅遊 目的地 。         定期 辦產品 簡報 會         旅遊局 配合 澳門 特區 政府 “ 1 + 4 ” 經濟 適度 多元 發展 策略 ， 聯同業界 積極 推動 與 優化 綜合 旅遊 休閒業 發展 ， 同時 加大力度 開拓國際 客源 市場 ， 包括 發揮 香港 市場 優勢 ， 透過 業界 及 不同 渠道 ， 鼓勵 訪港 之國際 旅客 延伸 行程 至 澳門 ， 例如 推出 “ 賞飛 澳門 ” 車船 優惠 活動 ， 亦 會 與 航空公司 、 郵輪 公司 、 主要 入境 旅行社 等 助力 推動 更 多國際 旅客 到 澳門 旅遊 。 旅遊局 駐 香港 代表 繼續 加強 與 旅遊業界 的 溝通及 協作 ， 定期 舉辦 產品 簡報 會 、 主題 考察 團 、 聯合 推廣及 消費者 推廣等 活動 ， 並按 不同 市場 旅客 的 需要 推出 各項 宣傳 活動 ， 讓 更 多 旅客 前往 感受 澳門 ， 體驗 “ 創意 城市 美食 之 都 ” 的 魅力 。,2024-02-25
文綺華：增兩地合作促旅業發展,新增西安青島赴港澳個人遊    文綺華：增兩地合作促旅業發展    【本報消息】內地新增西安和青島赴港澳個人遊。旅遊局長文綺華表示，相信未來能有更多機會增加兩地合作，對澳門旅遊業發展有很大的支撐。    西安青島有直航機    文綺華昨日上午受訪稱，西安和青島本身有直航機往返澳門，青島每周五班、西安三班，相信這是一個很好的基礎，亦期待未來增加個人遊之後，航空公司可考慮增加相應的航班。她稱局方去年曾在青島舉辦澳門周活動，取得不錯的成效，青島本身亦有在澳門舉辦啤酒節，兩地每年都會有不少的交往，就青島而言已有不錯的合作機會。至於西安因為其本身是非常大的旅遊城市，近年亦有不少澳門的學生團到當地考察，相信未來藉此機會能增加更多合作，亦對澳門旅遊業發展有很大的支撐。    針對國際旅客（大中華地區除外），旅遊局再推出廿五萬份旅遊優惠禮品。她表示，因為去年海外市場旅客復甦的速度，始終未及內地和香港旅客量，故局方今年的優惠政策主要針對海外客源，相信未來亦有不同優惠措施吸引海外市場的旅客，期望藉由優惠政策和旅遊宣傳推廣，吸引更多海外國際客源來澳。    日均十七萬人抵澳    文綺華昨日下午出席活動時受訪指出，今年內地春節黃金周八天假期，本澳入境旅客情況非常理想，日均有近十七萬人次抵澳，與一九年情況相近，而假期過後回落至日均約八萬人次。    局方今年將主力開拓海外客源市場，如下周將赴葡萄牙推廣，下月初會到日本作海外路演，料為期三日，並於期間舉辦商務推介會等，坦言海外路演規模難與內地的澳門周活動相比。不過，未來亦計劃逐步開展亞洲其他地區的路演。下月一日起，橫琴深合區“封關”運行，屆時會邀請橫琴當局參與推介活動，方便海外業界更深入了解深合區旅遊資源，有助聯動橫琴和灣區等地。,http://www.macaodaily.com/html/2024-02/25/content_1737127.htm,至於西安因為其本身是非常大的旅遊城市，近年亦有不少澳門的學生團到當地考察，相信未來藉此機會能增加更多合作，亦對澳門旅遊業發展有很大的支撐,新增 西安 青島 赴 港澳 個 人遊         文綺華 ： 增兩地 合作 促旅業 發展         【 本報 消息 】 內地 新增 西安 和 青島 赴 港澳 個 人遊 。 旅遊 局長 文綺華 表示 ， 相信 未來 能 有 更 多 機會 增加 兩地 合作 ， 對 澳門 旅遊業 發展 有 很大 的 支撐 。         西安 青島 有 直航 機         文綺華 昨日 上午 受訪 稱 ， 西安 和 青島 本身 有 直航 機 往返 澳門 ， 青島 每周五 班 、 西安 三班 ， 相信 這是 一個 很 好 的 基礎 ， 亦 期待 未來 增加 個 人遊 之 後 ， 航空公司 可 考慮 增加 相應 的 航班 。 她 稱 局方 去年 曾 在 青島 舉辦 澳門 周活動 ， 取得 不錯 的 成效 ， 青島 本身 亦 有 在 澳門 舉辦 啤酒 節 ， 兩地 每年 都 會 有 不少 的 交往 ， 就 青島 而言 已有 不錯 的 合作 機會 。 至於 西安 因為 其 本身 是 非常 大 的 旅遊 城市 ， 近年 亦 有 不少 澳門 的 學生 團到 當地 考察 ， 相信 未來 藉此 機會 能 增加 更 多 合作 ， 亦 對 澳門 旅遊業 發展 有 很大 的 支撐 。         針對 國際 旅客 （ 大中華 地區 除外 ） ， 旅遊局 再 推出 廿五 萬份 旅遊 優惠禮品 。 她 表示 ， 因為 去年 海外 市場 旅客 復 甦 的 速度 ， 始終 未及 內地 和 香港 旅客量 ， 故 局方 今年 的 優惠 政策 主要 針對 海外 客源 ， 相信 未來 亦 有 不同 優惠 措施 吸引 海外 市場 的 旅客 ， 期望 藉由 優惠 政策 和 旅遊 宣傳 推廣 ， 吸引 更 多 海外 國際 客源 來澳 。         日均 十七 萬人 抵澳         文綺華 昨日 下午 出席 活動時 受訪 指出 ， 今年 內 地春節 黃 金周 八天 假期 ， 本澳 入境 旅客 情況 非常 理想 ， 日均 有近 十七 萬 人次 抵澳 ， 與 一 九年 情況 相近 ， 而 假期 過後 回落 至 日均 約八萬 人次 。         局方 今年 將 主力 開拓 海外 客源 市場 ， 如下 周將 赴 葡萄牙 推廣 ， 下月初 會到 日本 作 海外 路演 ， 料為期 三日 ， 並於期 間 舉辦 商務 推介 會 等 ， 坦言 海外 路演 規模 難 與 內 地 的 澳門 周活動 相比 。 不過 ， 未來 亦 計劃 逐步 開展 亞洲 其他 地區 的 路演 。 下 月 一日 起 ， 橫琴 深合區 “ 封關 ” 運行 ， 屆 時會 邀請 橫琴 當局 參 與 推介 活動 ， 方便 海外 業界 更 深入 了解 深合區 旅遊 資源 ， 有助 聯動 橫琴和灣區 等 地 。,2024-02-25
