Title,Content,Link,Summary,Preprocessed_Content,Date
深合區午夜“封關”,琴澳融合發展里程碑    深合區午夜“封關”    【本報消息】橫琴粵澳深度合作區今晚午夜十二時正式“封關”運行。“一線”橫琴口岸的“新家園”便捷通道已率先啟用，“二線”五條通道共六個查驗場亦已準備就緒，迎接歷史時刻。    一線專道便琴澳人    深合區實施“一線”放開、“二線”管住的稅收政策。從橫琴口岸進入深合區的“一線”，符合條件的貨物免稅，其他情形保稅。個人行李和寄遞物品以自用、合理數量且符合規定免稅，可在區內消費使用。在橫琴學習、創業、就業、生活的澳門居民可按規定攜帶七類動植物產品進入深合區。    昨日“一線”所見，入境深合區的居民旅客絡繹不絕，海關設施和人員已全部就位。現場增設兩條“新家園”通道已率先啟用，供在橫琴學習、創業、就業、生活的澳門居民快速通關，拓展澳門居民的優質生活空間。    出島車受檢須落客    設在橫琴口岸旅檢大廳四樓的智慧口岸公共服務平台運營中心已完成測試投入運作，在中心可透過監控視頻實時查看“一線”和“二線”各通道查驗作業現場，實時調度工作場所和人手。在“二線”橫琴大橋查驗場所，昨日仍在測試全流程綜合壓力。深合區七成以上的人車流經該通道離島。    出島小客車、出租車、網約車和大中型客車進入橫琴大橋“二線”通道後，按各自的專用通道通行。未被抽檢的車輛可直接上橋出島，被抽檢的車輛須按指引進入查驗場，經查驗後出島。被抽檢的大中型客車須落客後進入查驗場，完成查驗及候客。乘客須攜帶行李物品經出島大廳查驗後上車出島。常規公交車和通勤車，需經琴海東路停靠“大橋二線通道南”站，若被抽檢，所有乘客須攜帶行李物品下車，步行往出島大廳查驗，再至“大橋二線通道北”站登車出島。    出島通道設施備妥    深合區“二線”通道海關作業有五個通道共六個場所，分別位於橫琴大橋、橫琴隧道、十字門隧道、深井通道、橫琴碼頭，以及珠機城際軌道橫琴站、珠海長隆站。十字門隧道臨時建設的“二線”通道已配備查驗設施和車道欄杆。珠機城際橫琴站、珠海長隆站已配備關員及乘客進站安檢查驗設施。    深合區“封關”運作後，經“二線”進入內地的貨物按規定徵收進口稅，符合條件的可享受加工增值免關稅。個人行李和寄遞物品經“二線”進入內地參照澳門進入內地的進境物品適用的規定監管、徵稅。,http://www.macaodaily.com/html/2024-02/29/content_1738139.htm,出島車受檢須落客    設在橫琴口岸旅檢大廳四樓的智慧口岸公共服務平台運營中心已完成測試投入運作，在中心可透過監控視頻實時查看“一線”和“二線”各通道查驗作業現場，實時調度工作場所和人手,琴澳 融合 發展 里程碑         深合區 午夜 “ 封關 ”         【 本報 消息 】 橫琴粵澳 深度 合作 區 今晚 午夜 十二 時 正式 “ 封關 ” 運行 。 “ 一線 ” 橫琴 口岸 的 “ 新家園 ” 便捷 通道 已 率先 啟用 ， “ 二線 ” 五條 通道 共六個 查驗場 亦 已 準備 就緒 ， 迎接 歷史 時刻 。         一線 專道 便琴 澳人         深合區 實施 “ 一線 ” 放開 、 “ 二線 ” 管住 的 稅收 政策 。 從 橫琴 口岸 進入 深合區 的 “ 一線 ” ， 符合 條件 的 貨物 免稅 ， 其他 情形 保稅 。 個 人 行李 和 寄遞 物品 以 自用 、 合理 數量 且 符合 規定 免稅 ， 可在區 內 消費 使用 。 在 橫琴 學習 、 創業 、 就業 、 生活 的 澳門 居民 可 按 規定 攜帶 七 類動 植物 產品 進入 深合區 。         昨日 “ 一線 ” 所見 ， 入境 深合區 的 居民 旅客 絡繹不絕 ， 海關 設施 和 人員 已 全部 就位 。 現場 增設 兩條 “ 新家園 ” 通道 已 率先 啟用 ， 供 在 橫琴 學習 、 創業 、 就業 、 生活 的 澳門 居民 快速 通關 ， 拓展 澳門 居民 的 優質 生活 空間 。         出島 車受 檢須 落客         設在 橫琴 口岸 旅檢大廳 四樓 的 智慧 口岸 公共 服務 平台 運營 中心 已 完成 測試 投入 運作 ， 在 中心 可透 過監 控視頻 實時 查看 “ 一線 ” 和 “ 二線 ” 各 通道 查驗 作業 現場 ， 實時 調度 工作 場所 和 人手 。 在 “ 二線 ” 橫琴 大橋 查驗場 所 ， 昨日 仍 在 測試 全 流程 綜合 壓力 。 深合區 七成 以上 的 人車 流經 該 通道 離島 。         出島 小 客車 、 出租 車 、 網約車 和 大中型 客車 進入 橫琴 大橋 “ 二線 ” 通道 後 ， 按 各自 的 專用 通道 通行 。 未 被 抽檢 的 車輛 可 直接 上橋 出島 ， 被 抽檢 的 車輛須 按 指引 進入 查驗場 ， 經查驗 後 出島 。 被 抽檢 的 大中型 客車須 落客 後 進入 查驗場 ， 完成 查驗 及候 客 。 乘客 須攜帶 行李物品 經出 島大廳 查驗 後 上車 出島 。 常規 公交 車和 通勤 車 ， 需經琴 海東路 停靠 “ 大橋 二線 通道 南 ” 站 ， 若 被 抽檢 ， 所有 乘客 須攜帶 行李物品 下車 ， 步行 往出 島大廳 查驗 ， 再 至 “ 大橋 二線 通道 北 ” 站 登車 出島 。         出島 通道 設施備 妥         深合區 “ 二線 ” 通道 海關 作業 有 五個 通道 共六個場 所 ， 分別位 於 橫琴 大橋 、 橫琴 隧道 、 十字 門 隧道 、 深井 通道 、 橫琴 碼頭 ， 以及 珠機 城際 軌道 橫琴 站 、 珠海 長 隆站 。 十字 門 隧道 臨時 建設 的 “ 二線 ” 通道 已 配備 查驗 設施 和 車道 欄杆 。 珠機 城際 橫琴 站 、 珠海 長 隆站 已 配備 關員及 乘客 進站 安檢查驗 設施 。         深合區 “ 封關 ” 運作 後 ， 經 “ 二線 ” 進入 內 地 的 貨物 按 規定 徵收 進口稅 ， 符合 條件 的 可 享受 加工 增值 免關稅 。 個 人 行李 和 寄遞 物品 經 “ 二線 ” 進入 內地 參照 澳門 進入 內 地 的 進境 物品 適用 的 規定 監管 、 徵稅 。,2024-02-29
李司：確保封關順利社會穩定,執委會視察二線通道壓力測試配套設施    李司：確保封關順利社會穩定    【本報消息】深合區行政事務局訊：橫琴粵澳深度合作區執行委員會主任李偉農前日帶隊實地了解深合區“二線”通道全流程綜合壓力測試，並視察深合區智慧口岸公共服務平台（公服平台）建設進度，確保“封關”運行如期落實。    李偉農一行在橫琴海關副關長聶林杉等陪同下，先後實地視察十字門隧道、橫琴大橋、橫琴隧道以及深井通道，了解“二線”通道海關監管及配套交通設施設備的整體裝設及使用情況，以及各條“二線”通道在全流程綜合壓力測試期間的運作概況，包括各類車輛出區行進流線、車輛查驗流程、查驗平均耗時、通道系統對各種場景分別作出的不同指令等內容。    李偉農一行隨後前往公服平台運營指揮中心，了解設施設備特別是“二線”通道實時監測系統的運作調試，聽取單位負責人匯報“封關”運行各項工作的籌備進展。    李偉農表示，橫琴即將正式迎來分線管理“封關”運行，確保如期落實是深合區當前的首要任務，深合區上下要圍繞既定工作目標，倒排工期、掛圖作戰，加強統一部署和協調聯動，強化政策機制協同配合，確保全要素全流程壓力測試順利完成，持續優化提升通道運行效率，保障“封關”運行全過程社會穩定。各單位要加強宣傳推廣，持續做好熱線和現場諮詢服務，最大程度為公眾答疑解惑。,http://www.macaodaily.com/html/2024-02/29/content_1738144.htm,執委會視察二線通道壓力測試配套設施    李司：確保封關順利社會穩定    【本報消息】深合區行政事務局訊：橫琴粵澳深度合作區執行委員會主任李偉農前日帶隊實地了解深合區“二線”通道全流程綜合壓力測試，並視察深合區智慧口岸公共服務平台（公服平台）建設進度，確保“封關”運行如期落實,執委會 視察二線 通道 壓力 測試 配套 設施         李司 ： 確保 封關 順利 社會 穩定         【 本報 消息 】 深合區 行政 事務局 訊 ： 橫琴粵澳 深度 合作 區執行 委員會 主任 李偉農 前日 帶隊 實地 了解 深合區 “ 二線 ” 通道 全 流程 綜合 壓力 測試 ， 並視察 深合區 智慧 口岸 公共 服務 平台 （ 公服 平台 ） 建設 進度 ， 確保 “ 封關 ” 運行 如期 落實 。         李偉農 一行 在 橫琴 海關 副 關長 聶林杉 等 陪同 下 ， 先後實 地視察 十字 門 隧道 、 橫琴 大橋 、 橫琴 隧道 以及 深井 通道 ， 了解 “ 二線 ” 通道 海關 監管 及 配套 交通 設施 設備 的 整體 裝設 及 使用 情況 ， 以及 各條 “ 二線 ” 通道 在 全 流程 綜合 壓力 測試 期間 的 運作 概況 ， 包括 各類 車輛 出區行 進流線 、 車輛 查驗 流程 、 查驗 平均 耗時 、 通道 系統 對 各種 場景 分別 作出 的 不同 指令 等 內容 。         李偉農 一行 隨後 前往 公服 平台 運營 指揮 中心 ， 了解 設施 設備 特別 是 “ 二線 ” 通道 實時 監測 系統 的 運作 調試 ， 聽取 單位 負責人 匯報 “ 封關 ” 運行 各項 工作 的 籌備 進展 。         李偉農 表示 ， 橫琴 即將 正式 迎來 分線 管理 “ 封關 ” 運行 ， 確保 如期 落實 是 深合區 當前 的 首要 任務 ， 深合區 上下 要圍 繞 既定 工作 目標 ， 倒排 工期 、 掛圖 作戰 ， 加強 統一 部署 和 協調 聯動 ， 強化 政策 機制 協同 配合 ， 確 保全 要素 全 流程 壓力 測試 順利 完成 ， 持續 優化 提升 通道 運行 效率 ， 保障 “ 封關 ” 運行 全過程 社會 穩定 。 各單 位要 加強 宣傳 推廣 ， 持續 做好 熱線 和 現場 諮 詢服務 ， 最大 程度 為 公眾 答疑 解惑 。,2024-02-29
琴智慧口岸公共服務平台今上線,琴智慧口岸公共服務平台今上線    【本報消息】深合區經濟發展局長李子蔚表示，今（廿九）日推出智慧口岸公共服務平台系統，設網頁版、微信小程序，手機應用程式版本於稍後推出。個人攜帶及貨物進出深合區等手續可在平台系統內辦理。    李子蔚指出，首階段系統涵蓋八個應用項目。包括個人三項、企業五項。平台廿四小時服務，推出初期在橫琴口岸出入境大堂澳門側及橫琴經濟發展局企業和人才服務中心，設諮詢櫃位協助操作。    硏設寵物通關專區    針對本澳居民攜帶寵物往返深合區，市政署動物檢疫監管處長蔡淑儀表示，適用人員名單庫的貓主或狗主，寵物應植入有效電子晶片及持有效檢疫證書、往返深合區簽註等。在簽註有效內可攜同符合免檢條件的寵物犬貓經橫琴口岸返澳。    澳門海關關檢處代處長余展強表示，合資格的澳門居民可經旅檢大廳或車道攜帶寵物通關。現時橫琴口岸未有供寵物通行的特別通道，寵物在旅檢大廳行走時，飼主需牽繩或用籠等工具攜帶。現正研究在橫琴口岸旅檢大廳設置供寵物通關的專區。,http://www.macaodaily.com/html/2024-02/29/content_1738147.htm,琴智慧口岸公共服務平台今上線    【本報消息】深合區經濟發展局長李子蔚表示，今（廿九）日推出智慧口岸公共服務平台系統，設網頁版、微信小程序，手機應用程式版本於稍後推出,琴 智慧 口岸 公共 服務 平台 今上線         【 本報 消息 】 深合區 經濟 發展 局長 李子 蔚 表示 ， 今 （ 廿九 ） 日 推出 智慧 口岸 公共 服務 平台 系統 ， 設網 頁 版 、 微信 小 程序 ， 手機 應用 程式 版本 於 稍 後 推出 。 個 人 攜帶 及 貨物 進出 深合區 等 手續 可 在 平台 系統 內 辦理 。         李子 蔚 指出 ， 首階段 系統 涵蓋八個 應用 項目 。 包括 個 人三項 、 企業 五項 。 平台 廿四 小時 服務 ， 推出 初期 在 橫琴 口岸 出入境 大堂 澳門側 及 橫琴 經濟 發展局 企業 和 人才 服務 中心 ， 設諮詢 櫃位 協助 操作 。         硏 設 寵 物 通 關 專 區         針對 本澳 居民 攜帶 寵物 往返 深合區 ， 市政 署動物 檢疫 監管 處長 蔡淑儀 表示 ， 適 用人 員名 單庫 的 貓主 或 狗主 ， 寵物應 植入 有效 電子 晶片 及持 有效 檢疫 證書 、 往返 深合區 簽 註 等 。 在 簽 註 有效 內 可 攜同 符合 免檢條件 的 寵物犬貓 經橫琴 口岸 返澳 。         澳門海 關關 檢處代 處長 余展強 表示 ， 合資格 的 澳門 居民 可經 旅檢大廳 或 車道 攜帶 寵物 通關 。 現時 橫琴 口岸 未有 供寵物 通行 的 特別 通道 ， 寵物 在 旅檢大廳 行走 時 ， 飼主需 牽繩 或 用 籠 等 工具 攜帶 。 現正 研究 在 橫琴 口岸 旅檢大廳 設置 供 寵物 通關 的 專區 。,2024-02-29
放寬自用動植物入琴便澳人生活,每天不超五公斤    倘運行好硏擴大開放    放寬自用動植物入琴便澳人生活    【本報消息】深合區今晩午夜起“封關”運行，合資格的本澳居民每天可攜帶一次特定動植物產品經“一線”進入深合區，總重量不超過五公斤。深合區法律事務局長鍾頴儀表示，政策是內地便利澳門居民在深合區生活發展的特別措施，相關產品進入內地後，廢棄物處理等有嚴格監管，故對數量、重量、頻次及人員有規範。待實行和評估一段時間後，倘政策運行好、沒有損害國家風險防控，再探討有否條件申請更大開放。    一線續驗人員檢疫    鍾頴儀、深合區經濟發展局長李子蔚、市政署食品安全廳長張桂達、市政署動物檢疫監管處長蔡淑儀、澳門海關關檢處代處長余展強，昨日上午出席電台時事節目《澳門講場》，探討深合區“封關”運行。    鍾頴儀指出，深合區實行分線管理後，一線繼續查驗人員及檢驗檢疫，海關在一線仍要履行法定職能，進出貨物在一線根據“自用、合理數量”免稅放開。期望藉此把深合區構建為澳門居民生活、就業的新空間，方便兩地往來。    經其他口岸須申報    張桂達指出，三月一日起在深合區學習、就業、創業或生活，且已納入“允許澳門居民攜帶相關動植物產品進入橫琴粵澳深度合作區的適用人員名單庫”的澳門居民，可攜帶供自用、且符合特定種類及數量的動植物產品經橫琴口岸返回澳門，毋需申請進口准照或申報。其他澳門居民及已登記的澳人，倘於其他口岸通關，要按現行法律法規申報進口貨物及預約檢疫。    余展強提到，澳琴海關將對進出貨物車輛落實“各自機檢，圖像共享”創新監管模式，車輛在出境檢驗貨場掃瞄後，圖像會兩地共享，減少重覆查檢，提升通關便利。並持續與橫琴海關實時通報可疑行為，共同打擊跨境犯罪。    煙酒不在放寬範圍    有聽眾關注措施未有放開煙酒。鍾頴儀指出，煙酒入境在很多國家和地區都是限制物品，且不少地區都不太鼓勵使用煙酒，現行政策主要針對日常物品。至於“自用、合理數量”原則在內地各口岸沿用多年，饋贈及自用都屬於此範圍。合理數量則視乎旅程的目的及時間，留有彈性予海關查驗。若被海關定義超出範圍，要按內地規定繳稅。,http://www.macaodaily.com/html/2024-02/29/content_1738150.htm,經其他口岸須申報    張桂達指出，三月一日起在深合區學習、就業、創業或生活，且已納入“允許澳門居民攜帶相關動植物產品進入橫琴粵澳深度合作區的適用人員名單庫”的澳門居民，可攜帶供自用、且符合特定種類及數量的動植物產品經橫琴口岸返回澳門，毋需申請進口准照或申報,每天 不超 五公斤         倘運行 好硏 擴大開 放         放寬 自用 動 植物 入琴 便 澳人 生活         【 本報 消息 】 深合區 今 晩 午夜 起 “ 封關 ” 運行 ， 合資格 的 本澳 居民 每天 可攜帶 一次 特定 動 植物 產品經 “ 一線 ” 進入 深合區 ， 總 重量 不超過 五公斤 。 深合區 法律 事務局 長 鍾 頴 儀 表示 ， 政策 是 內 地 便利 澳門 居民 在 深合區 生活 發展 的 特別 措施 ， 相關 產品 進入 內 地 後 ， 廢棄物 處理 等 有 嚴格 監管 ， 故對 數量 、 重量 、 頻次 及 人員有 規範 。 待 實行 和 評估 一段 時間 後 ， 倘 政策 運行 好 、 沒有 損害 國家 風險 防控 ， 再 探討 有否 條件 申請 更 大 開放 。         一線續驗 人員 檢疫         鍾 頴 儀 、 深合區 經濟 發展 局長 李子 蔚 、 市政 署 食品安全 廳長 張桂達 、 市政 署動物 檢疫 監管 處長 蔡淑儀 、 澳門海 關關 檢處代 處長 余展強 ， 昨日 上午 出席 電台 時事 節目 《 澳門 講場 》 ， 探討 深合區 “ 封關 ” 運行 。         鍾 頴 儀 指出 ， 深合區 實行 分線 管理 後 ， 一線 繼續 查驗 人員及 檢驗 檢疫 ， 海關 在 一線 仍 要 履行 法定 職能 ， 進出 貨物 在 一線 根據 “ 自用 、 合理 數量 ” 免稅 放開 。 期望 藉此 把 深合區 構建為 澳門 居民 生活 、 就業 的 新 空間 ， 方便 兩地 往來 。         經 其他 口岸 須申報         張桂達 指出 ， 三月 一日 起 在 深合區 學習 、 就業 、 創業 或 生活 ， 且 已納入 “ 允許 澳門 居民 攜帶 相關動 植物 產品 進入 橫琴粵澳 深度 合作 區的適 用人 員名 單庫 ” 的 澳門 居民 ， 可攜帶 供 自用 、 且 符合 特定 種類 及 數量 的 動 植物 產品 經橫琴 口岸 返回 澳門 ， 毋需 申請 進口 准照 或 申報 。 其他 澳門 居民 及 已 登記 的 澳人 ， 倘 於 其他 口岸 通關 ， 要 按 現行 法律 法規 申報 進口 貨物 及 預約 檢疫 。         余展強 提到 ， 澳琴海 關將 對 進出 貨物 車輛 落實 “ 各自 機檢 ， 圖像 共享 ” 創新 監管 模式 ， 車輛 在 出境 檢驗 貨場 掃 瞄 後 ， 圖像會 兩地 共享 ， 減少 重覆 查檢 ， 提升 通關 便利 。 並持續 與 橫琴 海關 實時 通報 可疑 行為 ， 共同 打擊 跨境 犯罪 。         煙酒 不 在 放 寬 範圍         有 聽眾 關注 措施 未有 放開 煙酒 。 鍾 頴 儀 指出 ， 煙酒 入境 在 很多 國家 和 地區 都 是 限制 物品 ， 且 不少 地區 都 不 太 鼓勵 使用 煙酒 ， 現行 政策 主要 針對 日常 物品 。 至於 “ 自用 、 合理 數量 ” 原則 在 內 地 各口岸 沿用 多年 ， 饋贈 及 自用 都屬 於 此範圍 。 合理 數量則 視乎 旅程 的 目的 及 時間 ， 留有 彈性 予海關 查驗 。 若 被 海關 定義 超出 範圍 ， 要 按 內 地 規定 繳稅 。,2024-02-29
經夾屋用地擬毋須批給,小業主權利不變   須繼續支付地租    經夾屋用地擬毋須批給    【本報消息】再度提交立法會討論的《經濟房屋及夾心房屋的樓宇獨立單位的移轉制度》法案，昨獲立法會大會一般性通過。運輸工務司司長羅立文重申，法案通過後，小業主權利不變，亦要繼續支付地租。    “經夾屋單位移轉制度”於二月五日曾在立法會大會一般性討論，當時由於政府代表及部分議員對法案內容，尤其執行方面有不同見解，爭持不下，最後在議員動議下，大會表決通過押後再審。    議員關注執行細節    昨日立法會大會討論時，仍有多名議員關注法案執行細節，林宇滔擔憂小業主權益會否受損，李靜儀問及與土地法的銜接，王世民則關注日後房屋局不再擔任發展商的衍生執行問題。    優化程序加快做契    馬志成及黃顯輝表態支持立法方向，冀未來小組會討論時能進一步完善法案技術及法律銜接問題。馬志成指出，立法原意是優化政府內部批地程序，簡化及加快經夾屋興建及做契程序，同時政府強調修法不會影響小業主權益，因此支持法案的立法方向。    列席會議的羅立文重申法案通過後，小業主權利不變，“將來和以往一樣”，亦要繼續支付地租。強調立法目的簡單，即政府日後決定興建經屋或夾屋的土地後，不再需要經批給程序。指以往土地批給發展商，由發展商負責樓宇的分層登記，再把相應（單位）權利轉給小業主，日後經屋及夾屋沒有中間批地步驟，是次修法主要解決中間的衍生權利如何轉給小業主。    林宇滔問及經屋法規定，經屋售價由批地溢價金、建築成本及行政成本三項組成，倘日後沒有批地程序，是否經屋毋須再計批地溢價金？羅立文回應稱，經屋價格和質量問題與是次法案內容“完全是兩回事”。最終法案在三十一票贊成、一票反對（林宇滔）下，獲一般性通過。,http://www.macaodaily.com/html/2024-02/29/content_1738140.htm,小業主權利不變   須繼續支付地租    經夾屋用地擬毋須批給    【本報消息】再度提交立法會討論的《經濟房屋及夾心房屋的樓宇獨立單位的移轉制度》法案，昨獲立法會大會一般性通過,小業 主權 利不變       須繼續 支付 地租         經夾屋 用地 擬毋須 批給         【 本報 消息 】 再度 提交 立法 會 討論 的 《 經濟 房屋 及 夾心 房屋 的 樓宇 獨立 單位 的 移轉 制度 》 法案 ， 昨獲 立法 會大會 一般性 通過 。 運輸 工務司 司長 羅 立文 重申 ， 法案 通過 後 ， 小業 主權 利不變 ， 亦 要 繼續 支付 地租 。         “ 經夾 屋單 位移 轉 制度 ” 於 二月 五日 曾 在 立法 會大會 一般性 討論 ， 當時 由 於 政府 代表 及 部分 議員 對 法案 內容 ， 尤其 執行 方面 有 不同 見解 ， 爭持 不下 ， 最後在 議員動議 下 ， 大會表決 通過 押 後 再 審 。         議員 關注 執行 細節         昨日 立法 會大會 討論 時 ， 仍 有 多名 議員 關注 法案 執行 細節 ， 林宇滔擔 憂小業 主權益 會否 受損 ， 李靜儀 問及 與 土地法 的 銜接 ， 王 世民 則關 注日 後 房屋 局 不再 擔任 發 展商 的 衍生 執行 問題 。         優化 程序 加快 做契         馬 志成 及 黃 顯輝表態 支持 立法 方向 ， 冀未來 小 組會 討論 時能 進 一步 完善 法案 技術 及 法律 銜接 問題 。 馬 志成 指出 ， 立法 原意 是 優化 政府 內部 批地 程序 ， 簡化 及 加快 經夾屋 興建及 做 契 程序 ， 同時 政府 強調 修法 不會 影響 小業 主權益 ， 因此 支持 法案 的 立法 方向 。         列席 會議 的 羅 立文 重申 法案 通過 後 ， 小業 主權 利不變 ， “ 將來 和 以往 一樣 ” ， 亦 要 繼續 支付 地租 。 強調 立法 目的 簡單 ， 即 政府 日後決定 興建 經屋 或 夾屋 的 土地 後 ， 不再 需要 經批給 程序 。 指 以往 土地 批給 發 展商 ， 由發 展商 負責 樓宇 的 分層 登記 ， 再 把 相應 （ 單位 ） 權利 轉給 小業主 ， 日後經 屋及 夾屋 沒有 中間 批 地步 驟 ， 是 次 修法 主要 解決 中間 的 衍生 權利 如何 轉給 小業主 。         林宇滔 問及 經屋 法規定 ， 經屋售 價由批 地溢 價金 、 建築 成本 及 行政 成本 三項 組成 ， 倘日 後 沒 有 批地 程序 ， 是否 經屋 毋須 再 計批 地溢 價金 ？ 羅 立文回 應稱 ， 經屋 價格 和 質量 問題 與 是 次 法案 內容 “ 完全 是 兩 回事 ” 。 最終 法案 在 三十一 票贊成 、 一票 反對 （ 林宇滔 ） 下 ， 獲 一般性 通過 。,2024-02-29
