Title,Content,Link,Summary,Preprocessed_Content,Date
（衆藝館）共時的聲音   踱  迢,共時的聲音    劇場演出常常強調臨場感，但現在觀眾戴着耳機看演出，已成為另一種臨場儀式。到達現場時，工作人員總不忙跟你叮囑使用耳機的方式，記得交還耳機，遇問題舉手求助等等，甚至有些耳機還會發光，觀眾在演出現場走動時，一堆青線光圈在漆黑中移動，本身就具備了一種表演性、劇場感。    我最早一次用耳機看戲，應該是二○一三年由文物大使協會主辦的“遺城詩路”中，那次演出觀眾需跟隨導覽員和工作人員的指引，在大三巴一帶的新舊建築、大街小巷中行走，同時在一些定點如大三巴背後、聖安多尼堂前、永福圍的石級等觀看演出，導覽和演出中的人聲和音樂都透過無線耳機接收，故此活動雖在貼近民居的路線中進行，也盡可能將因此造成的噪音減少。這種透過同一播放器發射到觀眾耳機裝置的方式，令所有觀眾都同步接收到一樣的聲音訊息，具有共時性的特點。事實上後來亦經常看到一些社區導覽活動使用到這種技術，例如夢劇社在澳門藝術節上演的《路 · 遊 · 戲》一劇就利用了這種共時導覽耳機，結合現場演出的技術，帶領觀眾遊走在路環的海岸線到荔枝碗船廠一帶。    第十屆澳門文學節中，足跡的《題目待定》在葡國領事官邸的花園上演，也用上了這種導覽耳機。該劇完全沒有台詞，只有音樂、形體與物件演出，但由於是戶外環境，又靠近民居，使用這種音響播放方式，一方面不怕聲音干擾到周遭的居民，也令觀眾更容易沉浸在具私密性的音效與環境氛圍中，減少周遭環境聲、汽車經過的聲音干擾，一舉兩得。可是，演出者如何得知觀眾耳朵裡聽見的聲音呢？演出如何與聲音同步？有些演出會讓演員跟觀眾戴同樣的耳機，知道聲音播放情況。有些則會在演出範圍藏了音量較小的小喇叭，令表演者也同時聽見觀眾聽到的。    （耳機劇場 · 二）    踱    迢,http://www.macaodaily.com/html/2024-10/20/content_1788631.htm,我最早一次用耳機看戲，應該是二○一三年由文物大使協會主辦的“遺城詩路”中，那次演出觀眾需跟隨導覽員和工作人員的指引，在大三巴一帶的新舊建築、大街小巷中行走，同時在一些定點如大三巴背後、聖安多尼堂前、永福圍的石級等觀看演出，導覽和演出中的人聲和音樂都透過無線耳機接收，故此活動雖在貼近民居的路線中進行，也盡可能將因此造成的噪音減少,共時 的 聲音         劇場 演出 常常 強調 臨場 感 ， 但現 在 觀眾 戴 着 耳機 看 演出 ， 已成 為 另 一種 臨場 儀式 。 到 達 現場 時 ， 工作 人員 總不忙 跟 你 叮囑 使用 耳機 的 方式 ， 記得交 還耳機 ， 遇 問題 舉手 求助 等等 ， 甚至 有些 耳機 還會 發光 ， 觀眾 在 演出 現場 走動時 ， 一堆 青線 光圈 在 漆黑 中移動 ， 本身 就 具備 了 一種 表演性 、 劇場 感 。         我 最早 一次 用耳機 看戲 ， 應該 是 二 ○ 一 三年 由 文物 大使 協會 主辦 的 “ 遺城 詩路 ” 中 ， 那次 演出 觀眾 需 跟 隨導覽員 和 工作 人員 的 指引 ， 在 大三巴 一帶 的 新 舊 建築 、 大街小巷 中 行走 ， 同時 在 一些 定點 如 大三巴 背 後 、 聖安 多尼 堂前 、 永福 圍 的 石級 等 觀看 演出 ， 導覽 和 演出 中 的 人聲 和 音樂 都 透過 無線 耳機 接收 ， 故此 活動 雖 在 貼 近 民居 的 路線 中 進行 ， 也 盡 可能 將 因此 造成 的 噪音 減少 。 這種 透過 同一 播放器 發射到 觀眾 耳機 裝置 的 方式 ， 令 所有 觀眾 都 同步 接收 到 一樣 的 聲 音訊息 ， 具有 共時性 的 特點 。 事實 上後來 亦經 常看到 一些 社區 導覽 活動 使用 到 這種 技術 ， 例如 夢劇 社在 澳門 藝術節 上演 的 《 路   ·   遊   ·   戲 》 一劇 就 利用 了 這種 共時 導覽耳機 ， 結合 現場 演出 的 技術 ， 帶 領觀 眾遊 走 在 路環 的 海岸 線到 荔枝 碗 船廠 一帶 。         第十 屆 澳門 文學節 中 ， 足跡 的 《 題目 待定 》 在 葡國 領事 官邸 的 花園 上演 ， 也 用 上 了 這種 導覽耳機 。 該劇 完全 沒有 台詞 ， 只有 音樂 、 形體 與 物件 演出 ， 但 由 於 是 戶外 環境 ， 又 靠近 民居 ， 使用 這種 音響 播放 方式 ， 一方面 不怕 聲音 干擾 到 周遭 的 居民 ， 也 令 觀眾 更 容易 沉浸 在 具 私密性 的 音效 與 環境 氛圍 中 ， 減少 周遭 環境聲 、 汽車 經過 的 聲音 干擾 ， 一舉 兩得 。 可是 ， 演出者 如何 得知 觀眾 耳朵 裡聽 見 的 聲音 呢 ？ 演出 如何 與 聲音 同步 ？ 有些 演出 會 讓 演員 跟 觀眾 戴 同樣 的 耳機 ， 知道 聲音 播放 情況 。 有些 則會 在 演出 範圍 藏 了 音量 較 小 的 小喇叭 ， 令 表演者 也 同時 聽 見 觀眾 聽 到 的 。         （ 耳機 劇場   ·   二 ）         踱         迢,2024-10-20
（時光迴輪）時間碎片   店員丁,時間碎片    把時間切割成半，對切，再對切，一直切下去，直至把時間切成一小塊又一小塊，那麼小巧，以至於足以把那麼一點點的時間放進扭蛋殼，扭蛋殼把它套起來，好好保護，如此重複。好多好多的時間小分，被好多好多七彩的扭蛋殼保護起來，然後，所有顏色，所有泡泡，一股腦兒都倒進，填滿扭蛋機。那麼你就可以，興高采烈，為自己儲起一點點零用錢，每天跑到扭蛋機前，投幣，轉動滑輪，非常驚喜地收穫今日份的時間碎片。    大學一年級的時候，因為是創意課程的通識課，所以就在圖書館讀了很多與概念有關的事。創造，創意，從猶如虛空的地方抓出第一個念頭。世上有許多最重要的發明，例如，創造“時間”的概念。事實上如果沒有“時間”這個概念，我們的現代世界，絕對會崩解。如果“時間”的概念瓦解了，生活各種構成，將必面臨翻天覆地的重組。那麼簡單而明顯的事，讓我站在圖書館的地板上，感到動搖、地基不穩。好像突然有日你發現，砌了幾年的樂高模型，最基本最初的幾片卻有可能砌錯了。    時間啊時間，既是魔法也是魔王。我把扭蛋殼轉開，倒出塗了閃粉矽膠、麻雀大小切分，沒甚麼確切的實際用途，可是放着又令人愉悅。今天扭過了這個款式的，時間，沒有甚麼不甘，明天帶着不多但還就是那麼一點點的期待，投幣再扭一次。    有朋友每扭到新的，他的人生碎片，就立即來拍照，給我分享一次。一如既往的貌似“唔等使”，一如既往的零碎，可是他卻一如既往的愉快、興奮、欣賞。讓你在逛街的時候，不自覺地也走向排滿扭蛋機的店舖。    把我所渴望的切割成半，對切再對切，一直切下去，直至把想要體驗的，切成一小塊又一小塊，放進彩色的蛋殼。OK，來抽吧。    www.dawncheong.com    店員丁,http://www.macaodaily.com/html/2024-10/20/content_1788632.htm,時間碎片    把時間切割成半，對切，再對切，一直切下去，直至把時間切成一小塊又一小塊，那麼小巧，以至於足以把那麼一點點的時間放進扭蛋殼，扭蛋殼把它套起來，好好保護，如此重複,時間 碎片         把 時間 切割成 半 ， 對切 ， 再 對切 ， 一直 切下去 ， 直至 把 時間 切成 一小 塊 又 一小 塊 ， 那麼 小巧 ， 以至 於 足以 把 那麼 一點點 的 時間 放進 扭蛋殼 ， 扭蛋殼 把 它 套 起來 ， 好好 保護 ， 如此 重 複 。 好多好多 的 時間 小分 ， 被 好多好多 七彩 的 扭蛋殼 保護 起來 ， 然 後 ， 所有 顏色 ， 所有 泡泡 ， 一股 腦兒 都 倒 進 ， 填滿 扭蛋機 。 那麼 你 就 可以 ， 興高 采烈 ， 為 自己 儲起 一點點 零用 錢 ， 每天 跑 到 扭蛋 機前 ， 投幣 ， 轉動 滑輪 ， 非常 驚喜 地收 穫 今日 份 的 時間 碎片 。         大學 一年 級 的 時候 ， 因為 是 創意 課程 的 通識 課 ， 所以 就 在 圖書館 讀 了 很多 與 概念 有關 的 事 。 創造 ， 創意 ， 從 猶 如虛空 的 地方 抓 出 第一 個念頭 。 世上 有 許多 最 重要 的 發明 ， 例如 ， 創造 “ 時間 ” 的 概念 。 事實 上 如果 沒有 “ 時間 ” 這個 概念 ， 我們 的 現代 世界 ， 絕對會 崩解 。 如果 “ 時間 ” 的 概念 瓦解 了 ， 生活 各種 構成 ， 將必 面臨 翻天覆地 的 重組 。 那麼 簡單 而 明顯 的 事 ， 讓 我 站 在 圖書館 的 地板 上 ， 感到 動搖 、 地基 不穩 。 好像 突然 有 日 你 發現 ， 砌 了 幾年 的 樂高 模型 ， 最 基本 最初 的 幾片 卻 有 可能 砌 錯 了 。         時間 啊 時間 ， 既 是 魔法 也 是 魔王 。 我 把 扭蛋殼 轉開 ， 倒 出塗 了 閃粉 矽膠 、 麻雀 大小 切分 ， 沒 甚麼 確切 的 實際 用途 ， 可是 放着 又 令人 愉悅 。 今天 扭過 了 這個 款式 的 ， 時間 ， 沒有 甚麼 不甘 ， 明天 帶 着 不 多 但還 就是 那麼 一點點 的 期待 ， 投幣 再 扭 一次 。         有 朋友 每扭 到 新 的 ， 他 的 人生 碎片 ， 就 立即 來 拍照 ， 給我 分享 一次 。 一如既往 的 貌似 “ 唔 等 使 ” ， 一如既往 的 零碎 ， 可是 他 卻 一如既往 的 愉快 、 興奮 、 欣賞 。 讓 你 在 逛街 的 時候 ， 不自覺 地 也 走向 排滿 扭蛋機 的 店 舖 。         把 我 所 渴望 的 切割成 半 ， 對切 再 對切 ， 一直 切下去 ， 直至 把 想要 體驗 的 ， 切成 一小 塊 又 一小 塊 ， 放進 彩色 的 蛋殼 。 OK ， 來 抽 吧 。         www . dawncheong . com         店員丁,2024-10-20
（胭脂齋）博弈    古  吉,博弈    國慶前，大A突然一騎絕塵讓國內、外不少資金盤都精神抖擻，被橫盤下跌折磨得幾乎要銷戶的股民們都來不及反應，更別說那些踏空和未進場的。於是，各證券公司放假也要為人民服務——為群情洶湧的新股民們開戶——多麼熟悉的一幕。    ○七年，大A一度站上六千點，欣欣向榮得就像全民提款機一樣，什麼也不懂的小白不怕買錯，就怕沒搶先上車，於是就被套了。歷史總在重複、輪迴……    節後一個幾乎漲停的高開之後就開始哀鴻遍野。節後進場的新韭菜們為股市灌注新鮮血液，這些年，一茬接着一茬……聞不到血腥味但割得淋漓斑駁。    經過早幾年的經驗，人們得出結論：當你身邊啥也不懂的人都提起股票就是離場的時間，而股票話題無人問津的時候就是入場的時候。新韭菜們哪來的膽子衝進去妄想分一杯羹呢？有人四天虧了三十二萬；有人貸款幾十萬放入股市被追回，人為財死的另一面是匱乏疊加貪婪。    一個在○七年入市就被割的朋友分享，不交“學費”在A股市場裏想獲利那是癡人說夢。她的學費一部分是讓她成為金融消費者（虧損），一部分是付費跟隨“專業人士”操作，結果一樣無利可獲。因為拿捏買賣股票的時機非常考驗一個人的心性，太貪或者太怕都不會讓人操作成功，“踢飛”和“站崗”是老手也無法逃避的狀況，何況是根本沒有技術和經驗的投機股民。    她在股市裏如滾刀肉一般的翻來覆去，唯一略有收穫的就是心態。每次操作失誤都觀察一下自己的內心，發現自己緊張忐忑，或者煩躁遺憾，就知道心態波動了。盡量復盤，盡快穩定，盈不得意忘形，虧不如喪考妣，有或者沒有，他都在那裏；來或者不來，他也在那裏。她說，不貪不懼，慢慢將虧損的學費平回來就已經是贏了。    成人的金錢遊戲就是和自己博弈，玩好了是自我修行的一個考核工具，玩不好就是修羅場，最好不要踏入。    古    吉,http://www.macaodaily.com/html/2024-10/20/content_1788633.htm,因為拿捏買賣股票的時機非常考驗一個人的心性，太貪或者太怕都不會讓人操作成功，“踢飛”和“站崗”是老手也無法逃避的狀況，何況是根本沒有技術和經驗的投機股民,博弈         國慶前 ， 大 A 突然 一騎 絕塵 讓 國內 、 外 不少 資金盤 都 精神 抖擻 ， 被 橫盤 下跌 折磨 得 幾乎 要 銷戶 的 股民 們 都 來 不及 反應 ， 更別 說 那些 踏空 和 未 進場 的 。 於 是 ， 各證券 公司 放假 也 要 為 人民 服務 — — 為 群情 洶湧 的 新 股民 們 開戶 — — 多麼 熟悉 的 一幕 。         ○ 七年 ， 大 A 一度 站上 六千 點 ， 欣欣 向榮 得 就 像 全民 提款 機一樣 ， 什麼 也 不 懂 的 小白 不怕 買錯 ， 就 怕 沒 搶 先 上車 ， 於 是 就 被套 了 。 歷史 總 在 重 複 、 輪 迴 … …         節後一個 幾乎 漲 停 的 高開 之 後 就 開始 哀鴻 遍野 。 節後進場 的 新 韭菜 們 為 股市 灌注 新鮮 血液 ， 這些 年 ， 一茬 接着 一茬 … … 聞 不到 血腥味 但 割 得 淋漓 斑駁 。         經過 早 幾年 的 經驗 ， 人們 得出 結論 ： 當你 身邊 啥 也 不 懂 的 人 都 提起 股票 就是 離場 的 時間 ， 而 股票 話題 無人 問津 的 時候 就是 入場 的 時候 。 新 韭菜 們 哪來 的 膽子 衝進 去 妄想 分一杯羹 呢 ？ 有人 四天 虧 了 三十二 萬 ； 有人 貸款 幾十萬 放入 股市 被 追回 ， 人為 財死 的 另一面 是 匱乏 疊加 貪婪 。         一個 在 ○ 七年 入市 就 被 割 的 朋友 分享 ， 不 交 “ 學費 ” 在 A股 市場 裏 想 獲利 那 是 癡 人 說 夢 。 她 的 學費 一部分 是 讓 她 成為 金融 消費者 （ 虧損 ） ， 一部分 是 付費 跟 隨 “ 專業 人士 ” 操作 ， 結果 一樣 無利 可 獲 。 因為 拿捏 買賣 股票 的 時機 非常 考驗 一個 人 的 心性 ， 太 貪 或者 太怕 都 不會 讓 人 操作 成功 ， “ 踢 飛 ” 和 “ 站崗 ” 是 老手 也 無法 逃避 的 狀況 ， 何況 是 根本 沒有 技術 和 經驗 的 投機 股民 。         她 在 股市 裏 如 滾 刀 肉 一般 的 翻來 覆去 ， 唯一 略有 收 穫 的 就是 心態 。 每次 操作 失誤 都 觀察 一下 自己 的 內心 ， 發現 自己 緊張 忐忑 ， 或者 煩躁 遺憾 ， 就 知道 心態 波動 了 。 盡量 復 盤 ， 盡快 穩定 ， 盈 不 得意忘形 ， 虧 不如 喪考 妣 ， 有 或者 沒有 ， 他 都 在 那 裏 ； 來 或者 不來 ， 他 也 在 那 裏 。 她 說 ， 不 貪不懼 ， 慢慢 將虧損 的 學費平 回來 就 已經 是 贏了 。         成人 的 金錢 遊戲 就是 和 自己 博弈 ， 玩好 了 是 自我 修行 的 一個 考核 工具 ， 玩 不好 就是 修羅場 ， 最好 不要 踏入 。         古         吉,2024-10-20
（世相雜議）雙刃直播   婁勝華,雙刃直播    如果沒有直播，或許董宇輝還是一名英語教師，即使有些知名度，肯定不如時下那麼火爆出圈。董宇輝的名氣來自於其二○二二年六月開始擔任東方甄選主播，其在直播時，吟詩作賦、講段子，張口就是雞湯文，甚至雙語直播帶貨牛排，其以獨特直播方式迅速刷屏，走紅網絡，也成功地塑造了博學多才的“文化學者”直播人設，宛若一股網絡清流而受人追捧。可以說，正是直播在極短時間內為董宇輝吸引了千萬粉絲，聚積起極高人氣，說直播成就了董宇輝是不為過的。    然而，董宇輝在近期直播中卻稱居里夫人發現了鐳，並發明了X光機，以及獲得諾貝爾文學獎，錯得簡直離譜，反映了其對居里夫人生平知識的貧乏。其實，董宇輝的錯誤，若非在直播間，而是在私人場合，也沒有什麼大不了的，畢竟每個人都有知識盲區，又或是口誤。然而，在直播間作出如此錯誤的表述，則一時引得全網討伐，其精心塑造的文化人設也瞬間坍塌。    可見，作為大眾傳播工具的網絡直播具有雙面刃特性，直播因其傳播力與影響力能夠產生巨大的放大效應，既可以瞬間成就與捧紅一名主播，使之名利雙收，也可以一夜毀壞與唾棄一名主播，令其身敗名裂。    具有類似網絡遭遇的主播並非董宇輝一人，尤其是直播帶貨者。例如，“三隻羊”直播間大賣的“香港美誠月餅”與“澳洲穀飼牛肉卷”被認定為虛假宣傳，全網粉絲過億的網紅“小楊哥”也從一位頭部主播瞬間落馬。如果說董宇輝的人設坍塌傷害的還是其本人，而直播帶貨者利用直播進行虛假宣傳，則給消費者帶來直接損害。    因此，若想利用網絡直播積攢人氣並從中獲取利益者，必須如履薄冰，潛心修煉真功，避免信口開河，更不能在直播間營造苦情、劇本擺拍、虛假宣傳，否則，最終必然“爆雷”、“翻車”，黯然退場。    婁勝華,http://www.macaodaily.com/html/2024-10/20/content_1788634.htm,董宇輝的名氣來自於其二○二二年六月開始擔任東方甄選主播，其在直播時，吟詩作賦、講段子，張口就是雞湯文，甚至雙語直播帶貨牛排，其以獨特直播方式迅速刷屏，走紅網絡，也成功地塑造了博學多才的“文化學者”直播人設，宛若一股網絡清流而受人追捧,雙刃 直播         如果 沒有 直播 ， 或許 董宇輝 還是 一名 英語 教師 ， 即使 有些 知名度 ， 肯定 不如 時下 那麼 火爆 出 圈 。 董宇輝 的 名氣來 自 於 其二 ○ 二 二年 六月 開始 擔任 東方 甄選主播 ， 其 在 直播 時 ， 吟 詩作 賦 、 講 段子 ， 張口 就是 雞 湯文 ， 甚至 雙語 直播 帶貨 牛排 ， 其以 獨特 直播 方式 迅速 刷屏 ， 走紅 網絡 ， 也 成功 地 塑造 了 博學 多 才 的 “ 文化 學者 ” 直播 人設 ， 宛若 一股 網絡 清流 而 受 人 追捧 。 可以 說 ， 正是 直播 在 極短 時間 內為 董宇輝 吸引 了 千萬粉 絲 ， 聚積 起極 高人氣 ， 說 直播 成就 了 董宇輝 是 不 為過 的 。         然而 ， 董宇輝 在 近期 直播 中 卻 稱 居里夫人 發現 了 鐳 ， 並發明 了 X光 機 ， 以及 獲得諾 貝爾文學獎 ， 錯得 簡直 離譜 ， 反映 了 其 對 居里夫人 生平 知識 的 貧乏 。 其實 ， 董宇輝 的 錯誤 ， 若非 在 直播 間 ， 而是 在 私人 場合 ， 也 沒 有 什麼 大不了 的 ， 畢竟 每個 人 都 有 知識 盲區 ， 又 或是 口誤 。 然而 ， 在 直播 間 作出 如此 錯誤 的 表述 ， 則一時 引得 全網 討伐 ， 其 精心 塑造 的 文化 人設 也 瞬間 坍塌 。         可見 ， 作為 大眾 傳播 工具 的 網絡 直播 具有 雙面 刃 特性 ， 直播 因其 傳播力 與 影響力 能夠 產生 巨大 的 放大 效應 ， 既 可以 瞬間 成就 與捧紅 一名 主播 ， 使 之 名利 雙收 ， 也 可以 一夜 毀壞 與 唾棄 一名 主播 ， 令其 身敗 名裂 。         具有 類似 網絡 遭遇 的 主播 並非 董宇輝 一人 ， 尤其 是 直播 帶貨者 。 例如 ， “ 三 隻 羊 ” 直播 間大賣 的 “ 香港 美誠月餅 ” 與 “ 澳洲 穀 飼 牛肉 卷 ” 被 認定 為 虛假 宣傳 ， 全網 粉絲過 億 的 網紅 “ 小 楊哥 ” 也 從 一位 頭部 主播 瞬間 落馬 。 如果 說 董宇輝 的 人設 坍塌 傷害 的 還是 其 本人 ， 而 直播 帶貨者 利用 直播 進行 虛假 宣傳 ， 則給 消費者 帶來 直接 損害 。         因此 ， 若想 利用 網絡 直播 積攢人 氣並 從 中 獲取 利益者 ， 必須 如履薄冰 ， 潛心 修煉 真功 ， 避免 信口 開河 ， 更 不能 在 直播 間 營造 苦情 、 劇本 擺 拍 、 虛假 宣傳 ， 否則 ， 最終 必然 “ 爆雷 ” 、 “ 翻車 ” ， 黯然 退場 。         婁勝華,2024-10-20
（筆雯集）夜醉西浦月 宵釣南溪雪    冬春軒,夜醉西浦月    宵釣南溪雪    由造船工藝文化協會主辦，兄弟班藝術會合辦、旅遊局資助的“周遊列澳”社區旅遊資助計劃“快閃列車遊世界”即將舉行。其實就是“周遊列澳感受漁村魅力”。    澳門現代的文明建設，隨處可見，反而古老漁村風貌付諸闕如，要鑒古知今，追源溯本，莫過於採訪“白髮漁樵江渚上”的前輩。    洪適寫過一闋《漁家傲引》，詞云：    子月水寒風又烈，巨魚漏網成虛設。圉圉從它歸丙穴。謀自拙。空歸不管旁人說。    昨夜醉眠西浦月。今宵獨釣南溪雪。妻子一船衣百結。長歡悅。不知人世多離別。    子月，即農曆十一月；圉圉，是困而未舒的樣子；丙穴，地名，在今陝西略陽縣東南；西浦，在今江蘇鎮江西；南溪在今河南登封西北。這闋詞描寫漁人生活的艱難及其一生的艱辛，雖然如此，但漁民在窘迫的生活中是如何在精神上解脫了自己，在苦中作樂。    “昨夜醉眠西浦月，今宵獨釣南溪雪。”頗有“孤舟蓑笠翁，獨釣寒江雪”的影子，其實漁人幾乎都是這種苦況。有人說柳宗元《江雪》是釣中的隱者，在政治上不得意而悟徹人生的歸隱者，而洪詞的“醉眠”與“獨釣”，是藉釣而解決生活的困難，從苦中作樂，不失其人生意義。    有人說，在困境中不因你愁眉苦臉便可以改變命運，那麼何不開開心心過一日呢。話雖如此，而如斯豁達的能有幾人呢？要是天塌下來作被蓋，則沒有“杞人憂天”的故事了。    冬春軒,http://www.macaodaily.com/html/2024-10/20/content_1788635.htm,有人說柳宗元《江雪》是釣中的隱者，在政治上不得意而悟徹人生的歸隱者，而洪詞的“醉眠”與“獨釣”，是藉釣而解決生活的困難，從苦中作樂，不失其人生意義,夜醉 西浦 月         宵 釣 南溪 雪         由 造船 工藝 文化 協會 主辦 ， 兄弟 班藝術會 合辦 、 旅遊局 資助 的 “ 周遊列 澳 ” 社區 旅遊 資助 計劃 “ 快 閃列 車遊 世界 ” 即將 舉行 。 其實 就是 “ 周遊列 澳 感受 漁村 魅力 ” 。         澳門 現代 的 文明 建設 ， 隨處 可見 ， 反而 古老 漁村 風貌 付 諸闕 如 ， 要 鑒 古知 今 ， 追源溯 本 ， 莫過 於 採訪 “ 白 髮 漁樵江 渚 上 ” 的 前輩 。         洪適 寫過 一闋 《 漁家傲 引 》 ， 詞云 ：         子 月 水寒風 又 烈 ， 巨魚 漏 網成 虛設 。 圉 圉 從 它 歸丙穴 。 謀自拙 。 空歸 不管 旁人 說 。         昨夜 醉眠 西浦 月 。 今宵 獨釣 南溪 雪 。 妻子 一船 衣百結 。 長 歡悅 。 不知 人世 多離別 。         子 月 ， 即農 曆 十一月 ； 圉 圉 ， 是 困而 未 舒 的 樣子 ； 丙穴 ， 地名 ， 在 今 陝西略陽縣 東南 ； 西浦 ， 在 今江 蘇鎮 江西 ； 南溪 在 今 河南 登封 西北 。 這闋 詞 描寫 漁人 生活 的 艱難 及其 一生 的 艱辛 ， 雖然 如此 ， 但 漁民 在 窘迫 的 生活 中是 如何 在精神上 解脫 了 自己 ， 在 苦 中作樂 。         “ 昨夜 醉眠 西浦 月 ， 今宵 獨釣 南溪 雪 。 ” 頗 有 “ 孤舟 蓑笠 翁 ， 獨釣 寒江雪 ” 的 影子 ， 其實 漁人 幾乎 都 是 這種 苦況 。 有人 說 柳宗元 《 江雪 》 是 釣 中 的 隱者 ， 在政治上 不 得意 而悟徹 人生 的 歸 隱者 ， 而洪詞 的 “ 醉眠 ” 與 “ 獨釣 ” ， 是 藉 釣 而 解決 生活 的 困難 ， 從苦 中作樂 ， 不失 其 人 生意 義 。         有人 說 ， 在 困境 中不因 你 愁眉 苦臉 便 可以 改變 命運 ， 那麼 何不 開開心 心過 一日 呢 。 話 雖 如此 ， 而 如斯 豁達 的 能 有 幾人 呢 ？ 要是 天 塌下 來作 被 蓋 ， 則沒有 “ 杞人 憂天 ” 的 故事 了 。         冬春 軒,2024-10-20
