Title,Content,Link,Summary,Preprocessed_Content,Date
中歐班列累計開行九萬列,中歐班列累計開行九萬列    【據新華社西安二十五日電】古有絲綢之路駝鈴聲聲，今有中歐班列車輪滾滾。二十五日上午八時四十分，伴隨着汽笛聲在西安國際港站響起，X8157次中歐班列緩緩啟動，一路向西駛向波蘭馬拉舍維奇。至此，中歐班列“跑”出開行新紀錄：累計開行九萬列！發送貨物超八百七十萬標箱，貨值超過三千八百億美元。這一紀錄，是中歐班列成長為亞歐陸路運輸新幹道的有力見證，也是中國與世界經貿往來愈發緊密的生動縮影。    基本覆蓋歐亞全境    國鐵集團貨運部負責人介紹，近年來，國鐵集團持續提升中歐班列運行品質和效率，着力打造具有強大輻射力、帶動力和影響力的國際物流品牌，有力保障了國際產業鏈供應鏈穩定，為服務高質量共建“一帶一路”、促進中歐經貿往來注入新動能。    二○一六年至二○二三年，中歐班列年開行數量由一千七百○二列增加到超過一點七萬列，年運輸貨值由八十億美元提升至五百六十七億美元；開行萬列所需時間由開行之初的九十個月縮短為現在的七個月。    在國內，經阿拉山口、霍爾果斯、二連浩特、滿洲里、綏芬河、同江北六大口岸出境的西、中、東三條運輸主通道運輸能力大幅提升，時速一百二十公里圖定運行線已達八十七條，聯通中國境內一百二十二個城市。    在境外，鞏固和穩定既有入歐主要通道的基礎上，跨裏海、黑海的南通道新徑路成功開闢，目前已通達歐洲二十五個國家二百二十三個城市，以及十一個亞洲國家超過一百個城市，服務網絡基本覆蓋歐亞全境。    運輸貨物品類擴大    打開第九萬列的貨箱：鎳鈷錳酸鋰、汽車配件、百貨、液晶顯示板等貨物裝得滿滿當當。    從開行初期的筆記本電腦、打印機等IT產品，中歐班列的運輸貨物品類目前已逐步擴大到服裝鞋帽、汽車及配件、日用百貨、食品、木材、家具、化工品、機械設備等五萬餘種。    “帶貨”種類日益豐富，更多定製化班列不斷推出，郵政物資、木材、茶葉、食用油、新能源汽車等特色專列提供着高品質的國際物流服務。二○二三年以來，電動汽車、鋰電池、光伏產品“新三樣”成為中歐班列運量新的增長點。    運得多還得跑得好，中歐班列的運行品質也在邁上新台階。    當前，時速一百二十公里中歐班列最大編組輛數和牽引質量分別提高到五十五輛、三千噸，單列平均運量較開行之初提升百分之三十四以上，中國與歐洲間鐵路運輸時間較開行之初普遍壓縮五天以上。依靠鐵路快速通關業務模式，中歐班列全程通關效率和便利化水平明顯提升。    帶動沿線國家發展    看看沿線國家的變化：中歐班列讓更多電子產品、家電、新能源汽車等“中國製造”以更快速度、更優價格到達歐洲的同時，許多新的物流、工業、商貿中心和產業園區隨之湧現。    因為中歐班列的開行，德國杜伊斯堡港吸引了上百家物流企業落戶，創造了兩萬多個就業機會；波蘭馬拉舍維奇口岸站業務量成倍增長，極大促進了當地經濟社會發展。    與此同時，義烏小商品通過中歐班列銷往世界各地，黃山茶葉、永康五金等地方特色產品也走出國門。    中歐班列還帶動了中國內陸城市對外開放，一些不靠海不沿邊的城市依託中歐班列，逐步發展成為對外開放新高地。例如，重慶外向型產業產值實現年均百分之三十增長，鄭州現代國際物流中心建設得到有力支撐。    中歐班列的開行為沿線國家的百姓帶去實實在在的獲得感，也為國內企業“    角逐”海外市場打開了一條便捷通途。    未來，“鋼鐵駝隊”越織越密和越鋪越廣的線路圖，將擴展越來越大的“朋友圈”，創造更多新機遇。,http://www.macaodaily.com/html/2024-05/26/content_1757680.htm,基本覆蓋歐亞全境    國鐵集團貨運部負責人介紹，近年來，國鐵集團持續提升中歐班列運行品質和效率，着力打造具有強大輻射力、帶動力和影響力的國際物流品牌，有力保障了國際產業鏈供應鏈穩定，為服務高質量共建“一帶一路”、促進中歐經貿往來注入新動能,中歐 班列 累計 開行 九萬列         【 據 新華社 西安 二十五日 電 】 古有 絲綢 之路 駝鈴聲 聲 ， 今有 中歐 班列 車輪 滾 滾 。 二十五日 上午 八時 四 十分 ， 伴 隨着 汽笛 聲 在 西安 國際港 站 響 起 ， X8157 次 中歐 班列 緩緩 啟動 ， 一路 向 西駛向 波蘭馬拉舍 維奇 。 至此 ， 中歐 班列 “ 跑 ” 出開行 新紀錄 ： 累計 開行 九萬列 ！ 發送 貨物超 八百 七十 萬標箱 ， 貨值 超過 三千八百 億 美元 。 這一紀錄 ， 是 中歐 班列 成長 為亞 歐陸路 運輸 新 幹道 的 有力 見證 ， 也 是 中國 與 世界 經貿往 來 愈發 緊密 的 生動 縮影 。         基本 覆蓋 歐亞 全境         國鐵 集團 貨運部 負責人 介紹 ， 近年 來 ， 國鐵集 團持續 提升 中歐 班列 運行 品質 和 效率 ， 着力 打造 具有 強大輻射力 、 帶動力 和 影響力 的 國際 物流 品牌 ， 有力 保障 了 國際產業 鏈供 應鏈 穩定 ， 為 服務 高質量 共建 “ 一帶 一路 ” 、 促進 中 歐經 貿往 來 注入 新動能 。         二 ○ 一 六年 至 二 ○ 二三年 ， 中歐 班列 年 開行 數量 由 一千七百 ○ 二列 增加 到 超過 一點 七萬列 ， 年 運輸 貨值 由 八十 億 美元 提升 至 五百 六十七 億 美元 ； 開行 萬列 所 需時間 由 開行 之 初 的 九十 個 月 縮 短 為現 在 的 七個 月 。         在 國內 ， 經 阿拉山口 、 霍爾果 斯 、 二連 浩特 、 滿洲 里 、 綏芬河 、 同 江北 六大 口岸 出境 的 西 、 中 、 東三條 運輸 主通道 運輸 能力 大幅 提升 ， 時速 一百二十 公里 圖定 運行線 已 達 八十七 條 ， 聯通 中國境 內 一百二十 二個 城市 。         在 境外 ， 鞏固 和 穩定 既有 入歐 主要 通道 的 基礎 上 ， 跨 裏 海 、 黑海 的 南通 道 新徑 路 成功 開闢 ， 目前 已通達 歐洲 二十五 個國家 二百 二十三 個 城市 ， 以及 十一 個亞洲 國家 超過 一百 個 城市 ， 服務 網絡 基本 覆蓋 歐亞 全境 。         運輸貨 物品 類擴 大         打開 第九 萬列 的 貨箱 ： 鎳 鈷 錳 酸 鋰 、 汽車 配件 、 百貨 、 液晶 顯示 板 等 貨物 裝得 滿滿 當當 。         從 開行 初期 的 筆記本 電腦 、 打印 機等 IT 產品 ， 中歐 班列 的 運輸貨 物品 類 目前 已 逐步 擴大到 服裝 鞋帽 、 汽車 及 配件 、 日用 百貨 、 食品 、 木材 、 家具 、 化工品 、 機械 設備 等 五萬餘種 。         “ 帶貨 ” 種類 日益 豐富 ， 更 多 定 製 化 班列 不斷 推出 ， 郵政物資 、 木材 、 茶葉 、 食用油 、 新能源 汽車 等 特色 專列 提供 着 高品質 的 國際 物流 服務 。 二 ○ 二三年 以來 ， 電動 汽車 、 鋰 電池 、 光伏 產品 “ 新三樣 ” 成為 中歐 班列 運量 新 的 增長點 。         運得 多 還得 跑 得 好 ， 中歐 班列 的 運行 品質 也 在 邁上 新 台階 。         當前 ， 時速 一百二十 公里 中歐 班列 最大 編組輛數 和 牽 引質量 分別 提高 到 五十五 輛 、 三千 噸 ， 單列 平均 運量 較 開行 之 初 提升 百分之三十 四 以上 ， 中國 與 歐洲間 鐵路 運輸 時間 較 開行 之 初 普遍 壓縮 五天 以上 。 依靠 鐵路 快速 通關業務 模式 ， 中歐 班列 全程 通關 效率 和 便利化 水平 明顯 提升 。         帶動 沿線 國家 發展         看看 沿線 國家 的 變化 ： 中歐 班列 讓 更 多 電子 產品 、 家電 、 新能源 汽車 等 “ 中 國 製 造 ” 以 更 快 速度 、 更 優價格 到 達 歐洲 的 同時 ， 許多 新 的 物流 、 工業 、 商貿 中心 和 產業 園區 隨之湧現 。         因為 中歐 班列 的 開行 ， 德國 杜伊斯堡 港 吸引 了 上 百家 物流 企業 落戶 ， 創造 了 兩萬多個 就業 機會 ； 波蘭馬拉舍 維奇 口岸 站業務量 成 倍增 長 ， 極大 促進 了 當地 經濟 社會 發展 。         與 此 同時 ， 義烏 小商品 通過 中歐 班列 銷往 世界各地 ， 黃 山茶 葉 、 永康 五金 等 地方 特色 產品 也 走出 國門 。         中歐 班列 還帶動 了 中國 內陸 城市 對外 開放 ， 一些 不靠 海不 沿邊 的 城市 依 託 中歐 班列 ， 逐步 發展 成為 對外 開放 新高 地 。 例如 ， 重慶 外向型 產業 產值 實現 年均 百分之三十 增長 ， 鄭州 現代國際 物流 中心 建設 得到 有力 支撐 。         中歐 班列 的 開行 為 沿線 國家 的 百姓 帶去 實實 在 在 的 獲得感 ， 也 為 國內 企業 “         角逐 ” 海外 市場 打開 了 一條 便捷 通途 。         未來 ， “ 鋼鐵 駝隊 ” 越織 越密 和 越 鋪 越廣 的 線路 圖 ， 將擴展 越來 越 大 的 “ 朋友圈 ” ， 創造 更 多 新 機遇 。,2024-05-26
“華龍一號”示範工程全面建成,“華龍一號”示範工程全面建成    【中新社深圳二十五日電】二十五日上午八時，隨着一百六十八小時試運行試驗圓滿完成，總部位於深圳的中國廣核集團宣佈廣西防城港核電站四號機組正式具備商業運行條件。該機組的投產發電標誌着中廣核“華龍一號”示範工程全面建成。    防城港核電站二期工程三、四號機組採用中國自主三代核電技術“華龍一號”。其中，防城港核電站三號機組已於二○二三年三月二十五日投產發電，從裝料到商運“零”非計劃停機停堆，首循能力因子達百分之九十八點三六。    防城港核電站四號機組於二○一六年十二月開工建設，過程中全面落實中廣核“華龍一號”首堆經驗反饋，在設計、安全管控、施工管理等方面不斷提升，實現了“華龍一號”示範機組“一台比一台好”的建設目標。    “防城港核電站四號機組的投產發電，進一步驗證了中廣核‘華龍一號’技術的安全性、成熟性、先進性，為‘華龍一號’批量化建設積累了可借鑒、可複製的寶貴經驗。”廣西防城港核電有限公司董事長蔡振介紹說，中廣核實現了“華龍一號”從技術研發、工程轉化到項目投產的全面落地，帶動上下游五千四百多家核電設備企業實現四百多項關鍵設備自主化，已具備核電整機設備百分百國產化能力，有力促進中國核電產業鏈韌性和實力的提升。    中廣核“華龍一號”示範工程兩台機組年發電量可達一百八十億千瓦時，能滿足二百萬人口的生產生活年度用電需求，每年可減少標煤消耗超五百四十三點六萬噸，減少二氧化碳排放約一千四百八十三點二萬噸，環保效益相當於植樹造林超過四萬公頃。,http://www.macaodaily.com/html/2024-05/26/content_1757681.htm,”廣西防城港核電有限公司董事長蔡振介紹說，中廣核實現了“華龍一號”從技術研發、工程轉化到項目投產的全面落地，帶動上下游五千四百多家核電設備企業實現四百多項關鍵設備自主化，已具備核電整機設備百分百國產化能力，有力促進中國核電產業鏈韌性和實力的提升,“ 華龍 一號 ” 示範 工程 全面 建成         【 中新社 深圳 二十五日 電 】 二十五日 上午 八時 ， 隨着 一百六十 八小時 試運行 試驗 圓滿 完成 ， 總 部位 於 深圳 的 中國 廣核 集團 宣 佈 廣西 防城港 核電站 四號 機組 正式 具備 商業 運行 條件 。 該 機組 的 投產 發電 標誌 着 中廣核 “ 華龍 一號 ” 示範 工程 全面 建成 。         防城港 核電站 二期工程 三 、 四號 機組 採用 中國 自主 三代 核電技術 “ 華龍 一號 ” 。 其中 ， 防城港 核電站 三號 機組 已 於 二 ○ 二三年 三月 二十五日 投產 發電 ， 從裝 料到 商運 “ 零 ” 非計劃 停機 停堆 ， 首循 能力 因子 達 百分之九十八 點三六 。         防城港 核電站 四號 機組 於 二 ○ 一 六年 十二月 開工 建設 ， 過程 中 全面 落實 中廣核 “ 華龍 一號 ” 首堆 經驗 反饋 ， 在 設計 、 安全 管控 、 施工 管理 等 方面 不斷 提升 ， 實現 了 “ 華龍 一號 ” 示範 機組 “ 一台 比 一台 好 ” 的 建設 目標 。         “ 防城港 核電站 四號 機組 的 投產 發電 ， 進 一步 驗證 了 中廣核 ‘ 華龍 一號 ’ 技術 的 安全性 、 成熟性 、 先 進性 ， 為 ‘ 華龍 一號 ’ 批量 化建設 積累 了 可 借 鑒 、 可 複 製 的 寶 貴 經 驗 。 ” 廣西 防城港 核電 有限公司 董事 長 蔡振介紹 說 ， 中廣核 實現 了 “ 華龍 一號 ” 從技術 研發 、 工程 轉化 到 項目 投產 的 全面 落地 ， 帶動 上下游 五千 四百多 家 核電 設備 企業 實現 四百多 項關鍵 設備 自主化 ， 已 具備 核電 整機 設備 百分百 國產化 能力 ， 有 力促 進中國 核電產業 鏈韌性 和 實力 的 提升 。         中廣核 “ 華龍 一號 ” 示範 工程 兩台機 組年 發電量 可達 一百八十 億 千瓦 時 ， 能 滿足 二百 萬 人口 的 生產 生活 年度 用電 需求 ， 每年 可 減少標 煤 消耗 超 五百四十 三點 六萬噸 ， 減少 二氧化碳 排放 約 一千四百 八十三 點二萬噸 ， 環保 效益 相當 於 植樹 造林 超過 四萬公頃 。,2024-05-26
浙民宅火災四死,浙民宅火災四死    【香港中通社二十五日電】浙江省嘉興市一民宅二十四日晚發生火災，造成四人遇難。    嘉興市秀洲區消防救援大隊二十五日通報，二十四日晚上九時五十六分，秀洲區王店鎮一民宅發生火災。接報後，公安、消防、應急管理、一二○急救等部門迅速前往處置救援。當晚十時二十八分，明火被撲滅。    經初步了解，起火物質為家具，過火面積約五十平方米。火災現場造成三人死亡，一人受傷。後傷員經搶救無效死亡。    目前，事故調查及善後工作正在進行中。,http://www.macaodaily.com/html/2024-05/26/content_1757682.htm,浙民宅火災四死    【香港中通社二十五日電】浙江省嘉興市一民宅二十四日晚發生火災，造成四人遇難,浙 民宅 火災 四死         【 香港 中通社 二十五日 電 】 浙江省 嘉興市 一 民宅 二十四日 晚發 生火 災 ， 造成 四人 遇難 。         嘉興 市秀洲區 消防 救援 大隊 二十五日 通報 ， 二十四日 晚上 九時 五十六 分 ， 秀洲區 王店 鎮一 民宅 發 生火 災 。 接報 後 ， 公安 、 消防 、 應急 管理 、 一二 ○ 急救 等 部門 迅速 前往 處置 救援 。 當晚 十時 二十八分 ， 明火 被 撲滅 。         經 初步 了解 ， 起火 物質 為 家具 ， 過火面 積約 五十 平方米 。 火災 現場 造成 三人 死亡 ， 一人 受傷 。 後 傷員經 搶 救無效 死亡 。         目前 ， 事故 調查 及 善 後 工作 正在 進行 中 。,2024-05-26
江西煤礦事故三人遇難,江西煤礦事故三人遇難    【本報綜合報道】據央視網、封面新聞二十五日消息：二十五日，江西新余花鼓山煤業山南井發生煤礦安全事故，三人遇難。    公開資料顯示，江西省新余市花鼓山煤礦前身江西省花鼓山煤礦，始建於一九五八年，二○○八年被新余市中級人民法院宣告政策性破產，二○○九年六月新公司掛牌成立，是新余礦業公司主力礦井。    二十五日下午，江西花鼓山煤業有限公司一名工作人員向媒體表示，江西局將對該事故進行調查，以調查分析報告為準。    媒體隨後致電江西局，工作人員表示，確實會介入調查該事故，“我們事故調查處的人已經在現場去了，信息已經作了報送，具體的情況還要跟現場進行聯繫，我們值班室還沒有得到，後續怎麼做領導已經在安排了，事故調查報告都會進行公佈的。”,http://www.macaodaily.com/html/2024-05/26/content_1757683.htm,媒體隨後致電江西局，工作人員表示，確實會介入調查該事故，“我們事故調查處的人已經在現場去了，信息已經作了報送，具體的情況還要跟現場進行聯繫，我們值班室還沒有得到，後續怎麼做領導已經在安排了，事故調查報告都會進行公佈的,江西 煤礦 事故 三人 遇難         【 本報 綜合 報道 】 據央視網 、 封面 新聞 二十五日 消息 ： 二十五日 ， 江西 新余 花鼓 山煤業 山南 井發 生煤 礦 安全事故 ， 三人 遇難 。         公開 資料 顯示 ， 江西省 新余市 花鼓 山煤礦 前身 江西省 花鼓 山煤礦 ， 始建 於 一九五八年 ， 二 ○ ○ 八年 被 新余市 中級 人民法院 宣告 政策性 破產 ， 二 ○ ○ 九年 六月 新 公司 掛牌 成立 ， 是 新余 礦業 公司 主力 礦井 。         二十五日 下午 ， 江西 花鼓 山煤業 有限公司 一名 工作 人員向 媒體 表示 ， 江西 局將 對 該 事故 進行 調查 ， 以 調查 分析 報告 為準 。         媒體 隨後致電 江西 局 ， 工作 人員 表示 ， 確實會 介入 調查 該 事故 ， “ 我們 事故 調查 處 的 人 已經 在 現場 去 了 ， 信息 已經作 了 報送 ， 具體 的 情況 還要 跟 現場 進行 聯 繫 ， 我們 值班室 還沒有 得到 ， 後 續 怎麼 做 領導 已經 在 安排 了 ， 事故 調查 報告 都 會 進行公 佈 的 。 ”,2024-05-26
內蒙礦區塌陷四人下落不明,內蒙礦區塌陷四人下落不明    【據新華社呼和浩特二十五日電】二十五日從內蒙古自治區赤峰市應急管理、消防救援等部門獲悉，二十四日晚上七時四十五分，赤峰市林西縣金源礦業開發有限公司治理塌陷區進行充填作業時地表發生塌陷，四人墜入塌陷坑，下落不明。    事故發生後，內蒙古自治區應急管理廳立即成立工作組，趕赴事故現場指導救援。現場已制定救援方案，出動挖掘機八台、鏟車四台、翻斗汽車四台、吊車一台、鑽機兩台，救援工作正在推進。,http://www.macaodaily.com/html/2024-05/26/content_1757684.htm,內蒙礦區塌陷四人下落不明    【據新華社呼和浩特二十五日電】二十五日從內蒙古自治區赤峰市應急管理、消防救援等部門獲悉，二十四日晚上七時四十五分，赤峰市林西縣金源礦業開發有限公司治理塌陷區進行充填作業時地表發生塌陷，四人墜入塌陷坑，下落不明,內蒙 礦區 塌陷 四人 下落不明         【 據 新華社 呼和浩特 二十五日 電 】 二十五日 從 內 蒙古 自治 區 赤峰市 應急 管理 、 消防 救援 等 部門 獲悉 ， 二十四日 晚上 七時 四十五分 ， 赤峰市 林西 縣 金源 礦業 開發 有限公司 治理 塌陷 區進行 充填 作業 時 地表 發生 塌陷 ， 四人 墜入 塌陷 坑 ， 下落不明 。         事故 發生 後 ， 內 蒙古 自治 區應 急 管理 廳 立即 成立 工作 組 ， 趕赴 事故 現場 指導 救援 。 現場 已 制定 救援 方案 ， 出動 挖掘 機 八台 、 鏟車 四台 、 翻斗 汽車 四台 、 吊車 一台 、 鑽機 兩台 ， 救援 工作 正在 推進 。,2024-05-26
贛公交墜露天平台九傷,贛公交墜露天平台九傷    【本報訊】據央視網二十五日消息：江西贛州市公安局交警支隊二十五日發佈警情通報稱，當日下午，一公交車在轉盤處車輛失控衝破轉盤圍欄，墜至負一層露天平台，致車內九人受傷。    通報稱，二十五日下午四時四十八分，一輛車牌為贛B00779D的公交車（駕駛員李某，四十九歲，車內乘客十二人）行駛至贛州市章貢區文清路南門口轉盤處，車輛失控衝破轉盤圍欄，墜落至負一層露天平台，致車內九人受傷（多為磕碰和刮擦傷），傷者已送醫院救治，均無生命危險。    目前，事故處置工作正在進行中。,http://www.macaodaily.com/html/2024-05/26/content_1757685.htm,通報稱，二十五日下午四時四十八分，一輛車牌為贛B00779D的公交車（駕駛員李某，四十九歲，車內乘客十二人）行駛至贛州市章貢區文清路南門口轉盤處，車輛失控衝破轉盤圍欄，墜落至負一層露天平台，致車內九人受傷（多為磕碰和刮擦傷），傷者已送醫院救治，均無生命危險,贛 公交 墜 露天 平台 九傷         【 本報 訊 】 據央視網 二十五日 消息 ： 江西 贛 州市 公安局 交警 支隊 二十五日 發 佈 警情 通報 稱 ， 當日 下午 ， 一 公交 車在 轉盤 處車輛 失控 衝破 轉盤 圍欄 ， 墜至 負一層 露天 平台 ， 致車 內九人 受傷 。         通報 稱 ， 二十五日 下午 四時 四十八 分 ， 一輛 車牌 為 贛 B00779D 的 公交 車 （ 駕駛員 李某 ， 四十九 歲 ， 車內 乘客 十二 人 ） 行駛至 贛 州市 章 貢區 文清 路南 門口 轉盤 處 ， 車輛 失控 衝破 轉盤 圍欄 ， 墜落 至 負一層 露天 平台 ， 致車 內九人 受傷 （ 多為 磕碰 和 刮 擦傷 ） ， 傷者 已 送 醫院 救治 ， 均 無 生命 危險 。         目前 ， 事故 處置 工作 正在 進行 中 。,2024-05-26
