Title,Content,Link,Summary,Preprocessed_Content,Date
財爺：港創科生態圈更活躍,港投公司將簽約港產“獨角獸”科企    財爺：港創科生態圈更活躍    【中新社香港九日電】香港特區政府財政司司長陳茂波九日表示，香港投資管理有限公司將與一家港產“獨角獸”科企簽訂戰略合作協議。隨着港投公司合作夥伴數量增加，香港的創科生態圈必定更為活躍。    好消息陸續有來    港投公司由特區政府全資擁有，旨在通過物色投資機遇，策略性推動目標產業發展，長遠提升香港的競爭力和經濟活力，並賺取投資回報。    陳茂波當天發表網誌稱，助力構建蓬勃的創科生態圈及推動科企與產業的高效協作，為價值創造提供更有利環境，正是港投公司首階段的工作目標之一。    他表示，經過調研和仔細的策略考量，港投公司將與一家聚焦工業AI大模型及智能製造的港產“獨角獸”（一般指成立不超過十年，市場估值十億美元以上）科企簽訂戰略合作協議，包括擴大在港的研發投入及人才培訓；推進大模型在粵港澳大灣區更深入落地應用，加快推進區域經濟的數字化、智能化轉型等。    他指出，可以預期，隨着港投公司的合作夥伴數量逐步增加，植根香港且加大在本地投入的科企數目亦會增多，香港的創科生態圈必定更為活躍，發揮的匯聚力將更為明顯。相信港投公司的好消息將陸續有來。    初創企業逾四千    陳茂波稱，香港近年大力投資創科發展，已積累了一定的成績。香港科學園和數碼港的“獨角獸”企業，總市場估值達數百億美元。而去年香港的初創企業數目超過四千二百五十家，按年上升約百分之七，當中約兩成創辦人來自歐美等地區。    他表示，特區政府正通過不同方法和政策工具，希望催生新產業、新模式、新動能，因地制宜培育和發展新質生產力，推動經濟高質量發展。,http://www.macaodaily.com/html/2024-06/10/content_1761004.htm,港投公司將簽約港產“獨角獸”科企    財爺：港創科生態圈更活躍    【中新社香港九日電】香港特區政府財政司司長陳茂波九日表示，香港投資管理有限公司將與一家港產“獨角獸”科企簽訂戰略合作協議,港 投 公司 將簽 約 港產 “ 獨角獸 ” 科企         財爺 ： 港 創科 生態 圈 更 活躍         【 中新社 香港 九日 電 】 香港 特區 政府 財政司 司長 陳 茂波 九日 表示 ， 香港 投資 管理 有限公司 將與 一家 港產 “ 獨角獸 ” 科企 簽訂 戰略 合作 協議 。 隨着 港 投 公司 合作 夥伴 數量 增加 ， 香港 的 創科 生態 圈 必定 更為 活躍 。         好消息 陸續 有 來         港 投 公司 由特區 政府 全資 擁有 ， 旨在 通過 物色 投資 機遇 ， 策略性 推動目 標產業 發展 ， 長 遠 提升 香港 的 競爭力 和 經濟 活力 ， 並賺取 投資 回報 。         陳 茂波 當天 發表 網誌 稱 ， 助力 構建 蓬勃 的 創科 生態 圈 及 推動科 企與產業 的 高效 協作 ， 為 價值 創造 提供 更 有利 環境 ， 正是 港 投 公司 首階段 的 工作 目標 之一 。         他 表示 ， 經過 調研 和 仔細 的 策略 考量 ， 港 投 公司 將與 一家 聚焦 工業 AI 大 模型 及 智能 製 造 的 港 產 “ 獨角獸 ” （ 一般 指 成立 不超過 十年 ， 市場 估值 十億 美元 以上 ） 科企 簽訂 戰略 合作 協議 ， 包括 擴大 在 港 的 研發 投入 及 人才 培訓 ； 推進 大 模型 在粵 港澳 大灣區 更 深入 落地 應用 ， 加快 推進 區域 經濟 的 數字化 、 智能化 轉型 等 。         他 指出 ， 可以 預期 ， 隨着 港 投 公司 的 合作 夥伴 數量 逐步 增加 ， 植根 香港 且 加大 在 本地 投入 的 科企數 目亦會 增多 ， 香港 的 創科 生態 圈 必定 更為 活躍 ， 發揮 的 匯聚力將 更 為 明顯 。 相信 港 投 公司 的 好消息 將陸續 有 來 。         初創 企業 逾 四千         陳 茂波稱 ， 香港 近年 大力 投資 創科 發展 ， 已積 累 了 一定 的 成績 。 香港 科學園 和 數碼 港 的 “ 獨角獸 ” 企業 ， 總市場 估值 達數 百億 美元 。 而 去年 香港 的 初 創企業 數目 超過 四千 二百五十 家 ， 按年 上升 約 百分之七 ， 當中約 兩成 創辦 人來 自歐 美 等 地區 。         他 表示 ， 特區 政府 正通過 不同 方法 和 政策 工具 ， 希望 催生 新產業 、 新 模式 、 新動能 ， 因地制宜 培育 和 發展 新質 生產力 ， 推動 經濟 高質量 發展 。,2024-06-10
女子墮“公檢法”騙局失卅二萬,被指涉非法購槍須審查資金    女子墮“公檢法”騙局失卅二萬    【本報消息】一名本地女子月前疑墮“公檢法”騙局，誤信騙徒指其使用信用卡在網上非法購買槍械，須接受資金審查，因而被詐騙四萬美元、折合逾三十二萬澳門元。司警接報調查案件。    身處美國被指買槍    案中事主為女青年。今年四月十日下午，當時身處美國的事主接獲一來電，對方自稱是某信用卡公司的女職員，並能說出事主姓名，有人指事主透過信用卡公司在網上非法購買七支槍械，由於事主沒有使用相關公司的信用卡，即時否認。    此時，對方指懷疑事主身份被盜用，須轉線至“上級”及“內地公安”跟進處理。不久，一名自稱“公安”的男子與事主對話，並要求事主下載一個軟件。隨後，事主透過剛下載的軟件與自稱“公安”的男子視像對話，“公安”隨即向事主出示通緝和拘捕令，要求每日報告行蹤，也不可以將案件通知其他人。同月十九日上午，“公安”要求徹查事主個人的銀行帳戶資金是否涉及不法，要求帳戶內的金錢轉賬到指定的銀行帳戶。事主信以為真，按指示轉賬了四萬美元。    近日，事主與家人談及上述情況，才知悉懷疑受騙，向司警報案求助，報稱損失四萬美元。,http://www.macaodaily.com/html/2024-06/10/content_1761044.htm,今年四月十日下午，當時身處美國的事主接獲一來電，對方自稱是某信用卡公司的女職員，並能說出事主姓名，有人指事主透過信用卡公司在網上非法購買七支槍械，由於事主沒有使用相關公司的信用卡，即時否認,被 指涉 非法 購槍須 審查 資金         女子 墮 “ 公檢法 ” 騙局 失卅二萬         【 本報 消息 】 一名 本地 女子 月 前疑 墮 “ 公檢法 ” 騙局 ， 誤信 騙徒 指其 使用 信用卡 在 網上 非法 購買 槍械 ， 須 接受 資金 審查 ， 因而 被 詐騙 四萬 美元 、 折合 逾 三十二 萬澳門 元 。 司警 接報 調查 案件 。         身處 美國 被 指買槍         案中 事主 為 女 青年 。 今年 四月 十日 下午 ， 當時 身處 美國 的 事主 接獲 一來電 ， 對方 自稱 是 某 信用卡 公司 的 女 職員 ， 並能 說 出事 主 姓名 ， 有人 指 事主 透過 信用卡 公司 在 網上 非法 購買 七支 槍械 ， 由 於 事主 沒有 使用 相關 公司 的 信用卡 ， 即時 否認 。         此時 ， 對方 指懷疑 事主 身份 被 盜用 ， 須轉線 至 “ 上級 ” 及 “ 內地 公安 ” 跟 進處理 。 不久 ， 一名 自稱 “ 公安 ” 的 男子 與 事主 對話 ， 並 要求 事主 下載 一個 軟件 。 隨後 ， 事主 透過 剛下載 的 軟件 與 自稱 “ 公安 ” 的 男子 視像 對 話 ， “ 公安 ” 隨即 向 事主 出示 通緝 和 拘捕 令 ， 要求 每日 報告 行 蹤 ， 也 不 可以 將 案件 通知 其他人 。 同月 十九日 上午 ， “ 公安 ” 要求 徹查 事主 個 人 的 銀行 帳戶 資金 是否 涉及 不法 ， 要求 帳戶 內 的 金錢 轉賬 到 指定 的 銀行 帳戶 。 事主 信以 為 真 ， 按 指示 轉賬 了 四萬 美元 。         近日 ， 事主 與 家人 談及 上述 情況 ， 才 知悉 懷疑 受 騙 ， 向 司警 報案 求助 ， 報稱 損失 四萬 美元 。,2024-06-10
(新聞小語)新能源車安全增認知助推廣   夏耘,新能源車安全增認知助推廣    環境保護是全球發展大趨勢，我國承諾力爭在二○三○年前實現碳達峰，以及二○六○年前實現碳中和。澳門特別行政區積極配合國家的發展方向，大力推進環保減廢，加強生態環境的保護，先後出台多項環保規劃和政策。    本澳機動車密度居世界前列，交通運輸是本澳碳排放的主要來源。要有效改善空氣質素，鼓勵綠色出行、控制燃油汽車增加及普及新能源汽車等，是有效減碳手段。特區政府近年積極推廣使用新能源車，政策頻出，例如增發純電動的士牌照、新巴士合同規定所有屬首次註冊的營運車輛應為環保車輛、電單車汰換補貼等，但新能源車使用比例相對鄰近地區仍偏低，推廣工作要給力。    統計暨普查局資料顯示，今年首季新登記機動車按年上升百分之三至三千○八十五輛（電動車佔九百六十輛），其中輕型汽車增加百分之四十四點八至一千五百八十三輛（電動車佔四百輛），重型電單車則減少百分之三十二點八至一千一百四十三輛（電動車佔二百四十四輛）。今年以來數據顯示，電動車整體增幅平穩，其中電動電單車增幅較大，料是受汰換補貼政策所刺激。消費者選擇新車仍以燃油車佔多數。    政府近年已加強增設新能源車基礎設施，不少公共停車場建有充電設施。新能源汽車的普及率低，究其原因，公眾認為新能源的使用成本並不便宜，即使電動車已豁免機動車輛稅，電動輕型客車及電動摩托車無需繳納年度車輛使用牌照稅等。但車價較高，充電成本高於鄰近地區，對電動車安全亦有所顧慮等，加上車型選擇有限，未能滿足不同消費者的需求，影響了新能源汽車在本澳的應用。    政府完善相關基礎設施建設，亦要考慮到公眾對新能源汽車使用成本、安全及認知等方面的了解，尤其安全指引要普及到位。在政策支持上繼續提供誘因，鼓勵消費者購置新能源車；拆牆鬆綁，更積極推動私人車場安裝充電樁。豐富車型選擇，推動新能源汽車在澳門的廣泛應用，才能更好地配合國家的碳減排目標。    夏耘,http://www.macaodaily.com/html/2024-06/10/content_1761045.htm,特區政府近年積極推廣使用新能源車，政策頻出，例如增發純電動的士牌照、新巴士合同規定所有屬首次註冊的營運車輛應為環保車輛、電單車汰換補貼等，但新能源車使用比例相對鄰近地區仍偏低，推廣工作要給力,新能源 車 安全 增認 知 助推 廣         環境 保護 是 全球 發展 大 趨勢 ， 我國 承諾力爭 在 二 ○ 三 ○ 年前 實現 碳達峰 ， 以及 二 ○ 六 ○ 年前 實現 碳 中 和 。 澳門 特別 行政 區積極 配合 國家 的 發展 方向 ， 大力 推進 環保減 廢 ， 加強 生態 環境 的 保護 ， 先 後 出台 多項 環保 規劃 和 政策 。         本澳 機動車 密度 居 世界 前列 ， 交通 運輸 是 本 澳碳 排放 的 主要 來源 。 要 有效 改善 空氣 質素 ， 鼓勵 綠色 出行 、 控制 燃油 汽車 增加 及 普及 新能源 汽車 等 ， 是 有效 減碳 手段 。 特區 政府 近年 積極 推廣 使用 新能源 車 ， 政策 頻出 ， 例如 增發 純電動 的士 牌照 、 新 巴士 合同 規定 所有 屬 首次 註 冊 的 營 運 車 輛 應 為 環 保 車 輛 、 電單 車汰換 補貼 等 ， 但 新能源 車 使用 比例 相對 鄰 近地 區仍 偏低 ， 推廣 工作 要 給力 。         統計 暨 普查局 資料 顯示 ， 今年 首季 新登記 機動車 按 年 上升 百分之三 至 三千 ○ 八十五 輛 （ 電動車 佔 九百 六十 輛 ） ， 其中 輕型 汽車 增加 百分之四十四 點八至 一千五百 八十三 輛 （ 電動車 佔 四百 輛 ） ， 重型 電單 車則 減少 百分之三十 二點 八至 一千一百 四十三 輛 （ 電動車 佔 二百四十 四輛 ） 。 今年 以來 數據 顯示 ， 電動車 整體 增幅 平穩 ， 其中 電動電 單車 增幅 較大 ， 料 是 受汰換 補貼 政策 所 刺激 。 消費者 選擇 新車 仍 以 燃油 車佔 多數 。         政府 近年 已加強 增設 新能源 車基礎 設施 ， 不少 公共 停車場 建有 充電 設施 。 新能源 汽車 的 普及率 低 ， 究其原因 ， 公眾 認為 新能源 的 使用 成本 並不 便宜 ， 即使 電動車 已 豁免 機動 車輛稅 ， 電動 輕型 客車 及 電動 摩托 車無需 繳納 年度 車輛 使用 牌照 稅等 。 但車 價較 高 ， 充電 成本 高 於 鄰 近地 區 ， 對 電動車 安全 亦 有所 顧慮 等 ， 加上 車型 選擇 有限 ， 未能 滿足 不同 消費者 的 需求 ， 影響 了 新能源 汽車 在 本澳 的 應用 。         政府 完善 相關 基礎 設施 建設 ， 亦 要 考慮 到 公眾 對 新能源 汽車 使用 成本 、 安全 及 認知 等 方面 的 了解 ， 尤其 安全 指引 要 普及 到位 。 在 政策 支持 上繼續 提供 誘因 ， 鼓勵 消費者 購置 新能源 車 ； 拆 牆 鬆 綁 ， 更積極 推動 私人 車場 安裝 充電樁 。 豐富 車型 選擇 ， 推動 新能源 汽車 在 澳門 的 廣泛 應用 ， 才能 更好 地 配合 國家 的 碳 減排 目標 。         夏耘,2024-06-10
粵法院致力保障未成年人權益,粵法院致力保障未成年人權益    【本報記者廣州九日電】廣東省高級法院近日發佈《廣東法院未成年人司法保護及犯罪防治工作白皮書（二○一九至二○二三）》，展示廣東法院發揮審判職能作用，持續加強新時代未成年人審判，落實司法保護職責，多方位、全流程保護未成年人合法權益，打擊和防治未成年人犯罪的成效。    未成年犯罪新特點    白皮書透露，五年以來廣東未成年人犯罪呈現涉侵犯財產、妨害社會管理秩序、侵犯公民人身權利和民主權利等犯罪相對集中，低齡未成年犯罪佔比上升、在校學生犯罪人數增多、幫助信息網絡犯罪人數陡增等特點。    廣東法院針對未成年被告人普遍涉世不深、法律意識淡薄、滋生犯意受外部環境影響大的情況，通過持續強化社會調查、開展未成年人的心理疏導和測評、做實法庭教育、聘請合適成年人到場參與訴訟等方式，全面維護未成年人合法權益。    五年來，廣東法院先後對二千九百多名涉案未成年人開展社會調查，為二千二百多名未成年提供心理疏導和測評工作，先後邀請五百四十五名合適成年人參與未成年人刑事案件審理。    廣東法院始終將從嚴懲治侵害未成年人權益犯罪作為工作的重點，始終保持對殺害、傷害、強姦、猥褻、虐待、拐賣等嚴重侵害未成年人權益犯罪保持高壓打擊態勢。五年來先後開展了“春雷”、打擊拐賣婦女兒童及性侵犯罪等專項行動，並且對“梅姨拐賣兒童案”主犯張維平、周容平判處死刑。    未成年重刑百分六    同時廣東高院積極探索推行未成年人刑事案件提級管轄改革，明確將具有“刑法規定有關已滿十二周歲不滿十四周歲的人犯罪，經最高檢察院核准需要追究刑事責任的”、“性侵或以其他方式侵害未成年人合法權益，情節惡劣，社會影響較大”等一審案件，可由中級法院審理，實現審判資源重點傾斜。    五年來，廣東法院對一千二百多名未成年人罪犯判處五年以上有期徒刑、重刑率為百分之六點五三，其中對九十七名實施嚴重犯罪的未成年被告人判處十五年以上有期徒刑或無期徒刑，同時對三千一百名輕罪未成年人適用了非監禁刑。    白皮書顯示，廣東法院注重將審判職能和未成年人家庭支持、社會關愛力量進行整合，通過嚴格落實犯罪記錄封存、建立搭建判後復學就業平台、發出家庭教育令和司法建議等方式，保護未成年人權利。,http://www.macaodaily.com/html/2024-06/10/content_1761046.htm,未成年重刑百分六    同時廣東高院積極探索推行未成年人刑事案件提級管轄改革，明確將具有“刑法規定有關已滿十二周歲不滿十四周歲的人犯罪，經最高檢察院核准需要追究刑事責任的”、“性侵或以其他方式侵害未成年人合法權益，情節惡劣，社會影響較大”等一審案件，可由中級法院審理，實現審判資源重點傾斜,粵 法院 致力 保障 未成年人 權益         【 本報 記者 廣州 九日 電 】 廣東省 高級 法院 近日 發 佈 《 廣東 法院 未成年人 司法 保護及 犯罪 防治 工作 白皮 書 （ 二 ○ 一九至 二 ○ 二三 ） 》 ， 展示 廣東 法院 發揮 審判 職能 作用 ， 持續 加強 新 時代 未成年人 審判 ， 落實 司法 保護 職責 ， 多方位 、 全 流程 保護 未成年人 合法 權益 ， 打擊 和 防治 未成年人 犯罪 的 成效 。         未成年 犯罪 新特點         白皮 書 透露 ， 五年 以來 廣東 未成年人 犯罪 呈 現涉 侵犯 財產 、 妨害 社會 管理 秩序 、 侵犯 公民 人身 權利 和 民主 權利 等 犯罪 相對 集中 ， 低齡 未成年 犯罪 佔 比 上升 、 在校 學生 犯罪人 數 增多 、 幫助 信息 網絡 犯罪人 數 陡增 等 特點 。         廣東 法院 針對 未成年 被告人 普遍 涉世不深 、 法律 意識 淡薄 、 滋生 犯意 受 外部 環境 影響 大 的 情況 ， 通過 持續 強化 社會 調查 、 開展 未成年人 的 心理 疏導 和 測評 、 做實 法庭 教育 、 聘請 合適 成年人 到場 參與 訴訟 等 方式 ， 全面 維護 未成年人 合法 權益 。         五年 來 ， 廣東 法院 先後對 二千 九百多 名 涉案 未成年人 開展 社會 調查 ， 為 二千 二百多名 未成年 提供 心理 疏導 和 測評 工作 ， 先後邀 請 五百四十 五名 合適 成年人 參與 未成年人 刑事案件 審理 。         廣東 法院 始 終將 從嚴 懲治 侵害 未成年人 權益 犯罪 作為 工作 的 重點 ， 始終 保持 對 殺害 、 傷害 、 強姦 、 猥褻 、 虐待 、 拐賣 等 嚴重 侵害 未成年人 權益 犯罪 保持 高壓 打擊 態勢 。 五年 來 先後開展 了 “ 春雷 ” 、 打擊 拐 賣婦 女兒 童及 性侵犯 罪 等 專項 行動 ， 並且 對 “ 梅姨拐 賣兒 童案 ” 主犯 張維平 、 周容 平判處 死刑 。         未成年 重刑 百分 六         同時 廣東 高院 積極 探索 推行 未成年人 刑事案件 提級 管轄 改革 ， 明確將 具有 “ 刑法 規定 有關 已滿 十二周 歲 不 滿十 四周 歲 的 人 犯罪 ， 經 最高 檢 察院 核准 需要 追究 刑事 責任 的 ” 、 “ 性侵 或 以 其他 方式 侵害 未成年人 合法 權益 ， 情節 惡劣 ， 社會 影響 較 大 ” 等 一審 案件 ， 可由 中級 法院 審理 ， 實現 審判 資源 重點 傾斜 。         五年 來 ， 廣東 法院 對 一千二百多 名 未成年人 罪犯 判處 五年 以上 有期徒刑 、 重刑 率為 百分之六 點五三 ， 其中 對 九十七 名實施 嚴重 犯罪 的 未成年 被告人 判處 十五年 以上 有期徒刑 或 無期 徒刑 ， 同時 對 三千 一百名 輕罪 未成年人 適用 了 非 監禁刑 。         白皮 書 顯示 ， 廣東 法院 注重 將審判 職能 和 未成年人 家庭 支持 、 社會關 愛 力量 進行 整合 ， 通過 嚴格 落實 犯罪 記錄 封存 、 建立 搭建 判 後 復 學就業 平台 、 發出 家庭教育 令 和 司法 建議 等 方式 ， 保護 未成年人 權利 。,2024-06-10
前科漢車內盜竊十萬被拘,前科漢車內盜竊十萬被拘    【本報消息】一名有盜竊前科的無業男子疑再犯案，涉在祐漢偷取一部停泊路邊私家車內的手提包，車主報稱損失逾十萬港元。司警調查拘捕疑人，有人承認犯案及賭輸大部分贓款。    被捕本澳男子姓王，五十九歲，無業，曾有車內盜竊前科，是次涉加重盜竊送交檢察院處理。    大部分贓款已賭輸    本月二日，司警接到一名車主報案稱，當日早上十一時許將私家車停泊在祐漢路邊，忘記取手提包便到附近茶餐廳用膳，約四十分鐘折返發現手提包不翼而飛，報稱損失十萬多港元及證件。司警調查並鎖定目標，發現涉案王某案發前曾在座駕附近徘徊，未幾偷走車內手提包離開。王某得手後再四處遊走，最後進入中區某賭場。同日稍後時間，司警在黑沙環區拘捕王某，在其身上起出一萬五千多元，有人承認犯案及輸掉大部分贓款。案件仍待偵辦。,http://www.macaodaily.com/html/2024-06/10/content_1761047.htm,大部分贓款已賭輸    本月二日，司警接到一名車主報案稱，當日早上十一時許將私家車停泊在祐漢路邊，忘記取手提包便到附近茶餐廳用膳，約四十分鐘折返發現手提包不翼而飛，報稱損失十萬多港元及證件,前科 漢車 內盜 竊十萬 被 拘         【 本報 消息 】 一名 有 盜 竊 前科 的 無業 男子 疑再 犯案 ， 涉在 祐 漢 偷取 一部 停泊 路邊 私家 車內 的 手提包 ， 車主報 稱 損失 逾十萬 港元 。 司警 調查 拘捕 疑人 ， 有人 承認 犯案 及 賭輸 大部分 贓款 。         被捕 本澳 男子 姓王 ， 五十九 歲 ， 無業 ， 曾 有車 內盜 竊 前科 ， 是 次涉 加重 盜竊 送交 檢 察院 處理 。         大部分 贓款 已 賭輸         本月 二日 ， 司警 接到 一名 車主 報案 稱 ， 當日 早上 十一 時 許將 私家 車 停泊 在 祐 漢路邊 ， 忘 記取 手提包 便 到 附近 茶餐 廳 用膳 ， 約 四 十分 鐘 折返 發現 手提包 不翼 而 飛 ， 報稱 損失 十萬多 港元 及 證件 。 司警 調查 並鎖定 目標 ， 發現 涉案 王 某案 發前 曾 在座 駕 附近 徘徊 ， 未 幾 偷走 車內 手提包 離開 。 王某 得手 後 再 四處遊 走 ， 最後進入 中區 某 賭場 。 同日 稍後時間 ， 司警 在 黑沙 環區 拘捕 王某 ， 在 其 身上 起出 一萬 五千 多元 ， 有人 承認 犯案 及輸 掉 大部分 贓款 。 案件 仍待 偵辦 。,2024-06-10
女子網購演唱會票被騙六千六,女子網購演唱會票被騙六千六    【本報消息】本地女墮門票詐騙，過數後被對方以不同理由索款，事後被賣家拉黑，報稱損失六千六百人民幣向司警報案，警方正調查案件，暫未有人被捕。    司警上月卅一日接獲報案，案中本地中年女子透過電話看到出售演唱會門票的帖文，與對方聯絡後同意以三千八百人民幣購買三張本月十五日在本澳舉行的演唱會門票，並透過賣家提供的二維碼轉賬票款。事後對方多次以不同理由索款，事主按要求照做仍無法收到門票，要求取消交易被對方拉黑，懷疑被騙向司警報案，報稱損失六千六百人民幣。,http://www.macaodaily.com/html/2024-06/10/content_1761048.htm,女子網購演唱會票被騙六千六    【本報消息】本地女墮門票詐騙，過數後被對方以不同理由索款，事後被賣家拉黑，報稱損失六千六百人民幣向司警報案，警方正調查案件，暫未有人被捕,女子 網購 演唱 會票 被 騙 六千 六         【 本報 消息 】 本地 女 墮門票 詐騙 ， 過數 後 被 對 方以 不同 理由 索款 ， 事後被 賣家拉黑 ， 報稱 損失 六千 六百 人民 幣向 司警 報案 ， 警方正 調查 案件 ， 暫未 有人 被捕 。         司警 上 月 卅一日 接獲 報案 ， 案中 本地 中年 女子 透過 電話 看到 出售 演唱 會門票 的 帖 文 ， 與 對 方聯絡 後 同意 以 三千八百 人民 幣購 買 三張 本月 十五日 在 本 澳舉行 的 演唱 會門票 ， 並透過 賣家 提供 的 二維碼 轉賬 票款 。 事後對方 多次 以 不同 理由 索款 ， 事主 按 要求 照 做 仍 無法 收到 門票 ， 要求 取消 交易 被 對 方拉黑 ， 懷疑 被 騙 向 司警 報案 ， 報稱 損失 六千 六百 人民 幣 。,2024-06-10
