Title,Content,Link,Summary,Preprocessed_Content
展藝館辦雙人藝術聯展,展藝館辦雙人藝術聯展    教育及青年發展局轄下青少年展藝館於二月六日至廿九日展出“心 · 相”—— 林智勇、梁思婷藝術作品聯展。是次展覽將展出自由藝術創作者梁思婷和林智勇的作品。作者認為畫作能反映內心的想法，所以把展覽命名為“心.相”。展品透過水彩、工筆、裝置和綜合媒材的表現手法，展示內心的畫面。作者冀觀眾欣賞作品過程中，看到工筆和水彩畫在表現方式的多樣性，感受不一樣的美和了解作品的含義。    展覽免費入場，歡迎有興趣者前往參觀。如需查詢，請於辦公時間致電（二八五六 · 二八○一／二八五六 · 五四六三），或瀏覽青少年展藝館網頁(www.dsedj.gov.mo/peeaj)。,http://www.macaodaily.com/html/2024-01/26/content_1731311.htm,展藝館辦雙人藝術聯展    教育及青年發展局轄下青少年展藝館於二月六日至廿九日展出“心 · 相”—— 林智勇、梁思婷藝術作品聯展,展藝館 辦 雙人 藝術 聯展         教育 及 青年 發展 局轄下 青少年 展藝館 於 二月 六日 至 廿九日 展出 “ 心   ·   相 ” — —   林 智勇 、 梁思婷 藝術 作品 聯展 。 是 次 展覽將 展出 自由 藝術 創 作者 梁思婷 和 林 智勇 的 作品 。 作者 認為 畫作 能 反映 內心 的 想法 ， 所以 把 展覽 命名 為 “ 心 . 相 ” 。 展品 透過 水彩 、 工筆 、 裝置 和 綜合 媒材 的 表現 手法 ， 展示 內心 的 畫面 。 作者 冀觀 眾欣賞 作品 過程 中 ， 看到 工筆 和 水彩 畫在 表現 方式 的 多樣 性 ， 感受 不一樣 的 美 和 了解 作品 的 含義 。         展覽 免費 入場 ， 歡迎 有 興趣 者 前往 參觀 。 如 需查詢 ， 請 於 辦公時間 致電 （ 二八 五六   ·   二八 ○ 一 ／ 二八 五六   ·   五四 六三 ） ， 或 瀏覽 青少年 展藝館 網頁 ( www . dsedj . gov . mo / peeaj ) 。
理大工商管理博士招生,理大工商管理博士招生    為助力澳門世界旅遊休閒中心建設，配合“一加四”經濟適度多元發展，澳門理工大學推出工商管理博士學位課程，為澳門及海內外地區培養行業領導及決策人才，報名期由即日起至五月十五日，歡迎海內外高級管理人員及精英報讀。    配合粵港澳大灣區科技金融、澳門會展文旅等發展重心，課程為學生提供跨界商業專題的精研機會，研究專題涵蓋管理經濟學、財務人資管理、人工智能與技術應用、休閒旅遊、會展貿易等，幫助學生善用學術知識和領導力，以創新思維和深度思考，解決工商管理前沿問題，掌握當前新興企業管理模式。    課程修讀期為三年，學生將在修讀期內完成修讀九門學科，當中包括核心學科四門、選修學科五門，完成博士論文並通過答辯，以滿足畢業要求。    課程將於《澳門特別行政區公報》公佈後正式運作，首屆學生於二○二四／二○二五學年開課。    報名手續及文件提交於澳理大招生專頁(mpu.mo/admission)線上辦理，可於辦公時間致電理工大學招生註冊處（電話: 八五九九 · 六一一一）。另獎學金資訊詳見(mpu.mo/pgscholarships)。,http://www.macaodaily.com/html/2024-01/26/content_1731312.htm,理大工商管理博士招生    為助力澳門世界旅遊休閒中心建設，配合“一加四”經濟適度多元發展，澳門理工大學推出工商管理博士學位課程，為澳門及海內外地區培養行業領導及決策人才，報名期由即日起至五月十五日，歡迎海內外高級管理人員及精英報讀,理大 工商管理 博士 招生         為 助力 澳門 世界 旅遊 休閒 中心 建設 ， 配合 “ 一加 四 ” 經濟 適度 多元 發展 ， 澳門 理工大 學 推出 工商管理 博士 學位 課程 ， 為 澳門 及 海內 外地 區培養 行業 領導及 決策 人才 ， 報名期 由 即日起 至 五月 十五日 ， 歡迎 海內外 高級 管理 人員及 精英 報讀 。         配合 粵 港澳 大灣區 科技 金融 、 澳門會展 文旅 等 發展 重心 ， 課程 為 學生 提供 跨界 商業 專題 的 精研 機會 ， 研究 專題 涵蓋 管理 經濟學 、 財務人資 管理 、 人工智能 與 技術 應用 、 休閒 旅遊 、 會展 貿易 等 ， 幫助 學生 善用 學術 知識 和 領導力 ， 以 創新思維 和 深度 思考 ， 解決 工商管理 前沿 問題 ， 掌握 當前 新興 企業 管理模式 。         課程 修讀 期為 三年 ， 學生將 在 修讀 期內 完成 修讀 九門 學科 ， 當中 包括 核心 學科四門 、 選修學 科五門 ， 完成 博士 論文並 通過 答辯 ， 以滿足 畢業 要求 。         課程將 於 《 澳門 特別 行政 區公報 》 公 佈 後 正式 運作 ， 首屆 學生 於 二 ○ 二四 ／ 二 ○ 二五 學年 開課 。         報 名手 續及 文件 提交 於 澳理 大 招生 專頁 ( mpu . mo / admission ) 線上 辦理 ， 可 於 辦公時間 致電 理工大 學 招生 註 冊 處 （ 電話 :   八五 九九   ·   六一 一一 ） 。 另獎 學金 資訊 詳見 ( mpu . mo / pgscholarships ) 。
學者談海洋產業拓澳多元,學者談海洋產業拓澳多元    由山東臨沂大學主辦的“臨沂如何抓住粵港澳大灣區發展機遇”講座，前日下午於該校校友中心會議室順利舉行。澳門城市大學副校長、澳門社會經濟發展研究中心主任葉桂平應邀主講。    葉桂平表示，《粵港澳大灣區發展規劃綱要》提出灣區要構建具有國際競爭力的現代海洋經濟產業體系，拓展藍色經濟空間，共同建設現代海洋產業基地。山東則是我國海洋大省，近年在實施“海上山東”戰略以來，海洋經濟綜合實力得到不斷提升。在經濟全球化背景下，海洋成為世界經濟發展的新領域，澳門應當積極參與建設海洋強國戰略，在灣區建設、“一帶一路”倡議及海洋強國戰略中主動推進海洋經濟發展，加強與其他灣區城市及內地的協同合作，推進澳門經濟適度多元化發展，為區域及國家經濟高質量發展注入源源不斷的“藍色動力”。    是次講座由臨沂大學副校長張立富主持，黨委書記王煥良參與會見，澳門城市大學澳門“一帶一路”研究中心主任周平等人與會。,http://www.macaodaily.com/html/2024-01/26/content_1731313.htm,在經濟全球化背景下，海洋成為世界經濟發展的新領域，澳門應當積極參與建設海洋強國戰略，在灣區建設、“一帶一路”倡議及海洋強國戰略中主動推進海洋經濟發展，加強與其他灣區城市及內地的協同合作，推進澳門經濟適度多元化發展，為區域及國家經濟高質量發展注入源源不斷的“藍色動力”,學者 談 海洋 產業 拓澳 多元         由山東 臨沂大學 主辦 的 “ 臨沂 如何 抓住 粵 港澳 大灣區 發展 機遇 ” 講座 ， 前日 下午 於 該校 校友 中心 會議室 順利 舉行 。 澳門 城市 大學 副 校長 、 澳門 社會 經濟 發展 研究 中心 主任 葉 桂平 應 邀主講 。         葉 桂平 表示 ， 《 粵 港澳 大灣區 發展 規劃 綱要 》 提出 灣區 要 構建 具有 國際 競爭力 的 現代 海洋 經濟產業 體系 ， 拓展 藍色 經濟 空間 ， 共同 建設 現代 海洋 產業 基地 。 山東則 是 我國 海洋 大省 ， 近年 在 實施 “ 海上 山東 ” 戰略 以來 ， 海洋 經濟 綜合 實力 得到 不斷 提升 。 在 經濟 全球化 背景 下 ， 海洋 成為 世界 經濟 發展 的 新 領域 ， 澳門應 當積 極參 與 建設 海洋 強國 戰略 ， 在灣區 建設 、 “ 一帶 一路 ” 倡議 及 海洋 強國 戰略 中主動 推進 海洋 經濟 發展 ， 加強 與 其他 灣區 城市 及 內 地 的 協同 合作 ， 推進 澳門 經濟 適度 多元化 發展 ， 為區域 及 國家 經濟 高質量 發展 注入 源源 不斷 的 “ 藍色 動力 ” 。         是 次 講座 由 臨沂大學 副 校長 張立富 主持 ， 黨委書記 王煥良 參與會 見 ， 澳門 城市 大學 澳門 “ 一帶 一路 ” 研究 中心 主任 周 平等 人 與 會 。
城大研討澳音樂學科發展,城大研討澳音樂學科發展    澳門城市大學創新設計學院日前舉辦音樂學學科發展線上專家論壇，多位重量級音樂學家應邀出席，包括中央音樂學院前院長、博士生導師樊祖蔭，國務院藝術評議組前成員、博士生導師王耀華，中央音樂學院博士生導師俞人豪，上海師範大學二級教授劉正國，華南師範大學音樂學院博士生導師黃漢華，台灣藝術大學教授簡巧珍等，創新設計學院藝術學課程主任任玉潔、教授戴定澄、副教授謝聖明、助理教授劉嫿嫿、督導王璐等一併線下出席，會議圍繞澳門城市大學的音樂學科建設及澳門音樂學科的發展前景交流觀點，深入討論。    專家們認為，澳門作為中西音樂文化的匯聚點，音樂課程具有文化交流地域上的特色，又具有國際視野和境外辦學的優勢，城市大學的音樂學學科的發展不僅對澳門、對大灣區以及國內外而言都具有十分重要的意義。,http://www.macaodaily.com/html/2024-01/26/content_1731314.htm,城大研討澳音樂學科發展    澳門城市大學創新設計學院日前舉辦音樂學學科發展線上專家論壇，多位重量級音樂學家應邀出席，包括中央音樂學院前院長、博士生導師樊祖蔭，國務院藝術評議組前成員、博士生導師王耀華，中央音樂學院博士生導師俞人豪，上海師範大學二級教授劉正國，華南師範大學音樂學院博士生導師黃漢華，台灣藝術大學教授簡巧珍等，創新設計學院藝術學課程主任任玉潔、教授戴定澄、副教授謝聖明、助理教授劉嫿嫿、督導王璐等一併線下出席，會議圍繞澳門城市大學的音樂學科建設及澳門音樂學科的發展前景交流觀點，深入討論,城 大研 討澳音 樂學科 發展         澳門 城市 大學 創新設 計學院 日前 舉辦 音樂學 學科 發展線 上 專家 論壇 ， 多位 重量 級 音樂學家 應邀 出席 ， 包括 中央 音樂學院 前院 長 、 博士生 導師 樊祖蔭 ， 國務院 藝術 評議 組前 成員 、 博士生 導師 王耀華 ， 中央 音樂學院 博士生 導師 俞人豪 ， 上海 師範大學二級 教授 劉正國 ， 華南師 範大學 音樂學院 博士生 導師 黃 漢華 ， 台灣 藝術 大學 教授 簡巧珍 等 ， 創新設 計學院 藝術學 課程 主任 任玉潔 、 教授 戴定 澄 、 副教授 謝聖明 、 助理 教授 劉 嫿 嫿 、 督導 王璐 等 一 併 線 下 出席 ， 會議 圍繞 澳門 城市 大學 的 音樂學 科建設 及 澳門 音樂學科 的 發展 前景 交流 觀點 ， 深入 討論 。         專家們 認為 ， 澳門作 為 中西 音樂 文化 的 匯聚點 ， 音樂 課程 具有 文化交流 地域 上 的 特色 ， 又 具有 國際視野 和 境外 辦學 的 優勢 ， 城市 大學 的 音樂學 學科 的 發展 不僅 對 澳門 、 對大灣區 以及 國內外 而言 都 具有 十分 重要 的 意義 。
青年科技村AI賽澳生獲佳績,青年科技村AI賽澳生獲佳績    由教育及青年發展局、澳門科學館及銀河娛樂集團合辦的“青年科技村”科創人才培養計劃較早前組織部分學員參加“大灣區青少年人工智能及網絡安全挑戰賽”，以提高青少年應用人工智能的能力及網絡安全意識。本月二十日，該賽事的總決賽在香港灣仔海濱休閒站圓滿舉行。    當中三支由“青年科技村”學員組成的聯隊，從二十支決賽隊伍中脫穎而出並獲得佳績。在觀眾投票的環節中，培正中學、慈幼中學及教業中學的聯隊獲第五名；聖羅撒女子英文中學、澳門大學附屬應用學校及花地瑪聖母女子學校的聯隊獲得第三名。聖保祿學校、培正中學及廣大中學的聯隊更榮獲澳門區冠軍。,http://www.macaodaily.com/html/2024-01/26/content_1731315.htm,青年科技村AI賽澳生獲佳績    由教育及青年發展局、澳門科學館及銀河娛樂集團合辦的“青年科技村”科創人才培養計劃較早前組織部分學員參加“大灣區青少年人工智能及網絡安全挑戰賽”，以提高青少年應用人工智能的能力及網絡安全意識,青年 科技 村 AI 賽澳生 獲佳績         由 教育 及 青年 發展局 、 澳門 科學館 及 銀河 娛樂 集團 合辦 的 “ 青年 科技 村 ” 科創 人才 培養 計劃 較 早前 組織 部分 學員 參加 “ 大灣區 青少年 人工智能 及 網絡 安全 挑戰賽 ” ， 以 提高 青少年 應用 人工智能 的 能力 及 網絡 安全 意識 。 本月 二十日 ， 該賽 事 的 總 決賽 在 香港 灣仔海濱 休閒 站 圓滿 舉行 。         當中 三支 由 “ 青年 科技 村 ” 學員 組成 的 聯隊 ， 從 二十支 決賽 隊伍 中 脫穎 而 出並 獲得佳績 。 在 觀眾 投票 的 環節 中 ， 培 正中 學 、 慈幼 中學及 教業 中學 的 聯隊 獲 第五名 ； 聖羅撒 女子 英文 中學 、 澳門 大學 附屬 應用 學校 及花 地瑪聖母 女子 學校 的 聯隊 獲得 第三名 。 聖保祿 學校 、 培 正中 學及 廣大中學 的 聯隊 更榮 獲 澳門區 冠 軍 。
澳大生參與匹克球培訓,澳大生參與匹克球培訓    為促進匹克球運動在澳門的發展，中國澳門匹克球總會前日下午與澳門大學體育事務部合辦“大學生匹克球培訓班”，獲八十多位大學生出席參加，場面熱鬧。    活動前，匹總教練譚注文、梁志堅、Joao Lei、Americo Carvalho 為參加者講解匹克球的條例、打法及現時世界匹克球的發展狀況，各教練指導學員及培訓參加者在發球、擊球、回球、出板姿態及動作，並作分組雙打培訓，參加者充分體驗匹克球的玩法及樂趣。    澳門大學體育事務部總監周桂慈感謝匹總的支持及致送紀念品，由理事長葛萬金接受，相約於稍後時間繼續為學生提供同類的活動，加強校內學生對匹克球的興趣。中國澳門匹克球總會顧問林成添，理事許仲泉出席了培訓活動。,http://www.macaodaily.com/html/2024-01/26/content_1731316.htm,澳門大學體育事務部總監周桂慈感謝匹總的支持及致送紀念品，由理事長葛萬金接受，相約於稍後時間繼續為學生提供同類的活動，加強校內學生對匹克球的興趣,澳 大生 參與 匹克球 培訓         為 促進 匹克球 運動 在 澳門 的 發展 ， 中國 澳門 匹克球 總會 前日 下午 與 澳門 大學 體育 事務部 合辦 “ 大學 生匹克球 培訓班 ” ， 獲八 十多位 大學生 出席 參加 ， 場面 熱鬧 。         活動前 ， 匹 總教練譚 注文 、 梁志堅 、 Joao   Lei 、 Americo   Carvalho   為 參加者 講解 匹克球 的 條例 、 打法 及 現時 世界 匹克球 的 發展 狀況 ， 各教練 指導 學員及 培訓 參加者 在 發球 、 擊球 、 回球 、 出板 姿態 及動作 ， 並作分 組雙 打培訓 ， 參加者 充分 體驗 匹克球 的 玩法 及樂趣 。         澳門 大學 體育 事務部 總監 周桂 慈感 謝匹 總 的 支持 及 致送 紀念品 ， 由 理事 長 葛萬金 接受 ， 相約 於 稍後時間 繼續 為 學生 提供 同類 的 活動 ， 加強校 內學生 對 匹克球 的 興趣 。 中國 澳門 匹克球 總會顧 問林成 添 ， 理事 許仲泉 出席 了 培訓 活動 。
菜農師生種蔬菜義賣送暖,菜農師生種蔬菜義賣送暖    菜農子弟學校現代生物園日前在校內義賣蔬菜，得到家長及師生踴躍支持，瞬間收成產品售罄，收益將撥作慈善用途。    是次義賣的收成品以蔬菜為主，是來自該校天台生物園水耕閣的產品。水耕閣是師生無土種植研學的地方，是中學部生物科學班及小學種植組合作耕耘。在栽種前，師生首先研究按蔬菜需要添加營養份量，尋找減低蟲害的方法等。同時觀察種植過程，並不斷的優化方案，包括調整營養液的份量。經過近兩個月的努力，終於種出了成果。義賣活動當天的中午，師生齊集到水耕閣收割。收穫的品種包括青瓜、芹菜、生菜、茼蒿和芥蘭，超過二十斤。經過清洗及包裝後，下午放學後移師到地下操場義賣。    義賣以現金捐款形式，每份蔬菜售二十元。師生家長反應十分踴躍，瞬間搶購一空，籌得逾九百元善款，將撥作援助弱勢群體。,http://www.macaodaily.com/html/2024-01/26/content_1731317.htm,菜農師生種蔬菜義賣送暖    菜農子弟學校現代生物園日前在校內義賣蔬菜，得到家長及師生踴躍支持，瞬間收成產品售罄，收益將撥作慈善用途,菜 農師 生種 蔬菜 義賣 送暖         菜農 子弟 學校 現代 生物 園 日前 在校 內義賣 蔬菜 ， 得到 家長 及 師生 踴躍 支持 ， 瞬間 收成 產品 售罄 ， 收益 將撥作 慈善 用途 。         是 次義賣 的 收 成品 以 蔬菜 為主 ， 是 來 自該 校 天台 生物 園水 耕閣 的 產品 。 水耕閣 是 師生 無土種 植研學 的 地方 ， 是 中學部 生物 科學班及 小學種 植組 合作 耕耘 。 在 栽種 前 ， 師生 首先 研究 按 蔬菜 需要 添加 營養 份量 ， 尋找 減低蟲害 的 方法 等 。 同時 觀察種 植過程 ， 並不斷 的 優化 方案 ， 包括 調整 營養液 的 份量 。 經過 近 兩個 月 的 努力 ， 終於種 出 了 成果 。 義賣 活動 當天 的 中午 ， 師生 齊集 到 水耕閣 收割 。 收 穫 的 品種 包括 青瓜 、 芹菜 、 生菜 、 茼蒿 和 芥蘭 ， 超過 二十斤 。 經過 清洗 及 包裝 後 ， 下午 放學後移 師到 地下 操場 義賣 。         義賣 以 現金 捐款 形式 ， 每份 蔬菜 售 二十元 。 師生家長 反應 十分 踴躍 ， 瞬間 搶購 一空 ， 籌得 逾 九百 元 善款 ， 將撥作 援助 弱勢 群體 。
司警廿六人升二等督察副督察,司警廿六人升二等督察副督察    【本報消息】司法警察局訊：司法警察局於昨日先後舉行二等督察及副督察就職儀式。是次人員晉升，將強化司警局刑事偵查的領導和指揮力量，有助提高預防和打擊犯罪、強化內部管理和運作的能力。    在局長薛仲明主禮及監誓下，賴文威、岑錦榮、陳仲賢、賴釗洪、陳麗貞、蔡昕暉、陳煥文、謝炳權、梁國晞、鄔志良等十位副督察宣誓就任二等督察，呂志斌、張韶強、譚敏堅、鍾錦良、郭彬彬、劉永權、林弋、龍漢威、伍志剛、趙朱惠敏、曾志輝、黎尚文、何棣明、許惠斌、劉鎮威及鄭志輝等十六位首席刑事偵查員宣誓就任副督察。    因應近年本澳治安環境的變化，司警局持續優化管理運作、強化各項配備和調整警務策略，全面提升整體應急處突能力和執法效率，預防和打擊各類犯罪。司警局致力提升人員執法水平，透過在職專業培訓和內部晉升制度，嚴格考核擇優選拔，以充實刑偵領導力量，有力應對社會形勢變化帶來的治安風險，維護本澳安全、穩定的治安環境。    是次十位新晉二等督察均具備豐富的刑偵工作和指揮管理經驗，在各自的工作崗位上表現傑出，深受上級及同事的認同和讚許；他們分別管理或隸屬司警局國家安全、刑事偵查、情報及警務聯絡等部門，充分運用其專業知識和工作經驗，協助局方高效運作和執法。七人具備法學碩士、法學學士或法學本科學歷。多人曾於司警局危機應變指揮中心履職並獲政府頒授英勇獎章，各人曾獲授卓越功績獎、個人嘉獎及集體嘉獎，執法成績備受肯定。    十六位新晉副督察分別具有十四至廿八年執法經驗，各人現職於司警局的刑偵、情報、社區警務等不同部門，部分人員目前擔任主管職位。各人均具有碩士、學士學位或本科學歷。多人在所屬單位履職期間，曾獲特區政府頒授英勇獎章，以及獲授卓越功績獎、個人嘉獎或集體嘉獎。    該等人員分別接受並通過了為期六個月的培訓課程，在法律、刑偵、警務策略、領導技巧、紀律、職業道德及社區警務等領域深化學習，前往中國人民公安大學接受為期一周的專業培訓，提升警務領導及執法指揮的知識和技巧，具備晉升至新職位所必需的專業素質和能力。    司警局期望各新晉督察及副督察在工作崗位上繼續發揮各自的專長，切實履行法定職責，領導工作團隊敢於執法、精於執法和高效執法，為維護國家安全、澳門社會穩定和市民安居樂業作出更有力承擔。,http://www.macaodaily.com/html/2024-01/26/content_1731318.htm,十六位新晉副督察分別具有十四至廿八年執法經驗，各人現職於司警局的刑偵、情報、社區警務等不同部門，部分人員目前擔任主管職位,司警 廿六 人升 二等 督察 副 督察         【 本報 消息 】 司法 警察局 訊 ： 司法 警察局 於 昨日 先後舉行 二等 督察 及 副 督察 就 職儀式 。 是 次 人員 晉升 ， 將強 化司 警局 刑事 偵查 的 領導 和 指揮 力量 ， 有助 提高 預防 和 打擊 犯罪 、 強化 內部 管理 和 運作 的 能力 。         在 局長 薛仲 明主 禮及 監誓 下 ， 賴文威 、 岑錦榮 、 陳 仲賢 、 賴釗 洪 、 陳 麗貞 、 蔡昕暉 、 陳 煥文 、 謝炳權 、 梁國 晞 、 鄔志良 等 十位 副 督察 宣誓 就任 二等 督察 ， 呂志斌 、 張韶強 、 譚敏堅 、 鍾 錦良 、 郭 彬彬 、 劉永權 、 林弋 、 龍漢威 、 伍志剛 、 趙 朱惠敏 、 曾志輝 、 黎尚文 、 何棣明 、 許惠斌 、 劉鎮 威及 鄭志輝 等 十六位 首席 刑事 偵查員 宣誓 就任 副 督察 。         因應 近年 本澳 治安 環境 的 變化 ， 司 警局 持續 優化 管理 運作 、 強化 各項 配備 和 調整 警務 策略 ， 全面 提升 整體 應急 處突 能力 和 執法 效率 ， 預防 和 打擊 各類 犯罪 。 司 警局 致力 提升 人員 執法 水平 ， 透過 在 職 專業 培訓 和 內部 晉升 制度 ， 嚴格 考核 擇 優選拔 ， 以充 實刑 偵領導 力量 ， 有力 應對 社會 形勢 變化 帶來 的 治安 風險 ， 維護 本澳 安全 、 穩定 的 治安 環境 。         是 次 十位 新晉 二等 督察 均 具備 豐富 的 刑 偵 工作 和 指揮 管理 經驗 ， 在 各自 的 工作 崗位 上表 現傑 出 ， 深受 上級 及 同事 的 認同 和 讚 許 ； 他們 分別 管理 或隸 屬司 警局 國家 安全 、 刑事 偵查 、 情報 及 警務聯絡 等 部門 ， 充分 運用 其 專業 知識 和 工作 經驗 ， 協助 局方 高效 運作 和 執法 。 七人 具備 法學 碩士 、 法學學士 或 法學 本科 學歷 。 多人 曾 於 司 警局 危機 應變 指揮 中心 履職 並獲 政府 頒授 英勇 獎章 ， 各人 曾 獲授 卓越 功績獎 、 個 人嘉獎 及 集體 嘉獎 ， 執法 成績 備受 肯定 。         十六位 新晉 副 督察 分別 具有 十四 至 廿八年 執法 經驗 ， 各人 現職 於 司 警局 的 刑 偵 、 情報 、 社區 警務 等 不同 部門 ， 部分 人員 目前 擔任 主管 職位 。 各 人均 具有 碩士 、 學士 學位 或 本科 學歷 。 多人 在 所屬 單位 履職 期間 ， 曾 獲特區 政府 頒授 英勇 獎章 ， 以及 獲授 卓越 功績獎 、 個 人嘉獎 或 集體 嘉獎 。         該 等 人員 分別 接受 並通過 了 為 期六個 月 的 培訓 課程 ， 在 法律 、 刑偵 、 警務 策略 、 領導 技巧 、 紀律 、 職業 道德 及 社區 警務 等 領域 深化 學習 ， 前往 中國 人民 公安 大學 接受 為期 一周 的 專業 培訓 ， 提升 警務 領導及 執法 指揮 的 知識 和 技巧 ， 具備 晉 升至 新 職位 所 必需 的 專業 素質 和 能力 。         司 警局 期望 各新晉 督察 及 副 督察 在 工作 崗位 上 繼續 發揮 各自 的 專長 ， 切實 履行 法定 職責 ， 領導 工作 團隊 敢 於 執法 、 精 於 執法 和 高效 執法 ， 為維護 國家 安全 、 澳門 社會 穩定 和 市民 安居 樂業 作出 更 有力 承擔 。
