Title,Content,Link,Summary,Preprocessed_Content,Date
張惠妹演唱會驚喜回饋歌迷,張惠妹演唱會驚喜回饋歌迷    前日，張惠妹在大巨蛋舉辦的“ASMR Maxxx”第二場演唱會，湧入四萬位歌迷到場。她還準備了“專屬紀念品大禮包”，總價超過二千萬元。其內放入手扇、螢光棒、場刊等紀念物品，場刊的封面每天均不一樣，可見是相當用心。昨日唱完壓軸歌曲《三天三夜》後，在安可曲部分張惠妹帶來三首經典情歌《如果你也聽說》、《我最親愛的》，以及小小唱了一段《連名帶姓》，再次把現場變成大型KTV，讓歌迷意猶未盡，完全不想回家。    張惠妹的經紀人陳鎮川表示，一份成本大約一元以上，特別為了歌迷訂製。主辦方聲動娛樂盛讚粉絲素質超水準，第一場四萬份的禮包報失民眾僅十二位，安放在座位上的大禮包幾乎沒有遭竊或誤拿，且散場時也沒甚麼垃圾，張惠妹聽聞也相當開心，稱讚大家都是好寶寶。,http://www.macaodaily.com/html/2024-12/24/content_1802795.htm,主辦方聲動娛樂盛讚粉絲素質超水準，第一場四萬份的禮包報失民眾僅十二位，安放在座位上的大禮包幾乎沒有遭竊或誤拿，且散場時也沒甚麼垃圾，張惠妹聽聞也相當開心，稱讚大家都是好寶寶,張惠妹 演唱 會 驚喜 回饋 歌迷         前日 ， 張惠妹 在 大 巨蛋 舉辦 的 “ ASMR   Maxxx ” 第二 場 演唱 會 ， 湧入 四萬位 歌迷 到場 。 她 還準備 了 “ 專屬 紀念品 大禮包 ” ， 總價 超過 二千 萬元 。 其內 放入 手扇 、 螢光 棒 、 場刊 等 紀念 物品 ， 場刊 的 封面 每天 均 不 一樣 ， 可見 是 相當 用心 。 昨日 唱 完壓軸 歌曲 《 三天三夜 》 後 ， 在 安可曲 部分 張惠妹 帶來 三首 經典 情歌 《 如果 你 也 聽 說 》 、 《 我 最親 愛的 》 ， 以及 小小 唱 了 一段 《 連名 帶姓 》 ， 再次 把 現場 變成 大型 KTV ， 讓 歌迷 意猶未 盡 ， 完全 不想 回家 。         張惠妹 的 經紀 人 陳 鎮川 表示 ， 一份 成本 大約 一元 以上 ， 特別 為 了 歌迷 訂 製 。 主辦 方聲動 娛樂 盛 讚 粉 絲 素 質 超 水 準 ， 第一 場四萬份 的 禮包報 失民眾僅 十二位 ， 安放 在 座位 上 的 大禮 包幾乎 沒有 遭竊 或誤 拿 ， 且 散場 時 也 沒 甚麼 垃圾 ， 張惠妹 聽聞 也 相當 開心 ， 稱 讚 大家 都 是 好 寶寶 。,2024-12-24
親妹陪產檢歐陽妮妮哽咽,親妹陪產檢歐陽妮妮哽咽    藝人歐陽龍與傅娟夫妻倆的大女兒歐陽妮妮，今年六月被男友演員張書豪求婚成功。九月再證實懷孕喜訊，近期舉行“性別趴”揭曉腹中的寶寶是個男孩。歐陽妮妮日前在個人抖音帳號上傳影片，分享懷孕三十一周時做產檢的過程，歐陽娜娜、歐陽娣娣也都現身鏡頭前，陪伴在姐姐身邊。畫面曝光後，讓網友直呼“人跟人之間的懷孕是不一樣的”、“三姐妹這麼和諧”、“姐妹幸福具像化咯”。    影片中眾人抵達醫院後，護理師先向歐陽妮妮確認胎動，她透露兒子“踢得很兇”，似乎相當有活力，隨後醫師以超音波為她做檢查，歐陽娜娜、歐陽娣娣則興奮用手機拍下珍貴畫面。檢查過程中，醫師從頭型判斷寶寶“比較聰明”，並看出寶寶有雙大長腿，不禁表示“三十一周就那麼長”，聽到寶寶健全發展，歐陽妮妮忍不住鼻酸哽咽。一旁的歐陽娣娣也嗨喊“跟我一樣腿很長”。,http://www.macaodaily.com/html/2024-12/24/content_1802796.htm,影片中眾人抵達醫院後，護理師先向歐陽妮妮確認胎動，她透露兒子“踢得很兇”，似乎相當有活力，隨後醫師以超音波為她做檢查，歐陽娜娜、歐陽娣娣則興奮用手機拍下珍貴畫面,親妹 陪產檢 歐陽妮妮 哽咽         藝人 歐陽龍 與 傅娟 夫妻 倆 的 大 女兒 歐陽妮妮 ， 今年 六月 被 男友 演員 張書豪 求婚 成功 。 九月 再證 實懷孕 喜訊 ， 近期 舉行 “ 性別 趴 ” 揭曉 腹中 的 寶寶是 個 男孩 。 歐陽妮妮 日前 在 個 人 抖音 帳號 上 傳 影片 ， 分享 懷孕 三十 一周 時 做 產檢 的 過程 ， 歐陽 娜娜 、 歐陽娣 娣 也 都 現身 鏡頭 前 ， 陪伴 在 姐姐 身邊 。 畫面 曝光 後 ， 讓 網友 直呼 “ 人 跟 人 之間 的 懷孕 是 不 一樣 的 ” 、 “ 三 姐妹 這麼 和諧 ” 、 “ 姐妹 幸福 具像化 咯 ” 。         影片 中眾 人 抵達 醫院 後 ， 護理師 先向 歐陽妮妮 確認 胎動 ， 她 透露 兒子 “ 踢 得 很 兇 ” ， 似乎 相當 有 活力 ， 隨後醫師 以 超音波 為 她 做 檢查 ， 歐陽 娜娜 、 歐陽娣娣則 興奮用 手機 拍下 珍貴 畫面 。 檢查 過程 中 ， 醫師 從 頭型 判斷 寶寶 “ 比較 聰明 ” ， 並 看出 寶寶有 雙大長 腿 ， 不禁 表示 “ 三十 一周 就 那麼 長 ” ， 聽到 寶寶 健全 發展 ， 歐陽妮妮 忍不住 鼻酸 哽咽 。 一旁 的 歐陽娣 娣 也 嗨 喊 “ 跟 我 一樣 腿 很長 ” 。,2024-12-24
郭雪芙陳柏霖新劇登三冠王,郭雪芙陳柏霖新劇登三冠王    郭雪芙、陳柏霖主演的治癒系愛情影集《不如海邊吹吹風》播出後，在AXN頻道、Hami Video台劇榜和Rakuten Viki 都登上冠軍。憑藉鄰里相扶、親情相伴與戀人守護，成功觸動觀眾內心深處的柔軟。    劇中，陳柏霖透過“鹿園談心”和“並肩聆聽”兩度溫柔接住郭雪芙，陪伴安撫對方想念雙親的傷痛，彼此愛火漸燃。因不小心弄壞郭雪芙雙親留下的錄音帶，陳柏霖為了彌補對方，他費盡心思找到一捲錄音帶，有網友耳尖發現該曲與劇情十分貼合，尤其歌詞“乘着風，我可以靠近妳的臉，我可以感覺到妳”，他們彼此間的在乎如同觸電般溫暖觀眾。    影集中，小鎮人情味令觀眾印象深刻，鄰里間的相處就像一個大家族，這種把小鎮村民都當作自家人的親近感，讓郭雪芙戲外也感性說“整個海風裡都很有向心力，有誰發生了甚麼問題，大家都會一起去解決！”,http://www.macaodaily.com/html/2024-12/24/content_1802797.htm,因不小心弄壞郭雪芙雙親留下的錄音帶，陳柏霖為了彌補對方，他費盡心思找到一捲錄音帶，有網友耳尖發現該曲與劇情十分貼合，尤其歌詞“乘着風，我可以靠近妳的臉，我可以感覺到妳”，他們彼此間的在乎如同觸電般溫暖觀眾,郭雪 芙 陳 柏霖 新劇 登三 冠王         郭雪 芙 、 陳 柏霖 主演 的 治 癒 系愛情 影集 《 不如 海邊 吹 吹 風 》 播出 後 ， 在 AXN 頻道 、 Hami   Video 台劇 榜 和 Rakuten   Viki   都 登上 冠 軍 。 憑 藉 鄰里 相扶 、 親情 相伴 與 戀人守護 ， 成功 觸動 觀眾 內心 深處 的 柔軟 。         劇中 ， 陳 柏霖 透過 “ 鹿園 談心 ” 和 “ 並肩 聆 聽 ” 兩度 溫柔 接住 郭雪 芙 ， 陪伴 安撫 對方 想念 雙親 的 傷痛 ， 彼此 愛火漸 燃 。 因 不 小心 弄壞 郭雪 芙 雙親 留下 的 錄音 帶 ， 陳 柏霖 為 了 彌補 對方 ， 他費 盡 心思 找到 一 捲 錄音 帶 ， 有 網友 耳尖 發現 該曲 與 劇情 十分 貼合 ， 尤其 歌詞 “ 乘着 風 ， 我 可以 靠近 妳 的 臉 ， 我 可以 感覺 到 妳 ” ， 他們 彼此 間 的 在乎 如同 觸電般 溫暖 觀眾 。         影 集中 ， 小鎮 人情味 令觀眾 印象 深刻 ， 鄰里間 的 相處 就 像 一個 大家族 ， 這種 把 小鎮 村民 都 當作 自家人 的 親近 感 ， 讓 郭雪 芙 戲外 也 感性 說 “ 整個 海風裡 都 很 有 向心力 ， 有 誰 發生 了 甚麼 問題 ， 大家 都 會 一起 去 解決 ！ ”,2024-12-24
葉珂“自導自演”挺孕肚現身,葉珂“自導自演”挺孕肚現身    今年九月黃曉明公開認愛網紅葉珂，但隨即葉珂過去的黑歷史、失言以及整形和炫富傳聞，也遭到廣泛關注。近日傳出兩人分手消息，葉珂卻又被拍到挺着大肚子現身。不過有博主爆料這其實是葉珂“自導自演”，營造出兩人感情如昔的假象。    內地娛樂博主“妖怪”在二十二日的直播中爆料，稱葉珂的孕肚照並非偶然曝光，而是精心策劃。當天她是特意前往黃曉明的拍攝地點進行談判，並且疑似找了攝影組來營造出兩人未分手的假象。為了讓孕肚更明顯，她特意穿上緊身洋裝，並在拍攝後將照片發布到網上。博主分析此舉的目的在於營造出與黃曉明仍有聯繫的假象，不僅能自我宣傳，還可能吸引到投資和商機。    妖怪公開與葉珂的錄音檔，質疑葉珂有意詐騙黃曉明，並利用黃曉明的名氣來達成個人目的。他強調如果自己所言不實，願意承擔法律責任。目前當事人葉珂和黃曉明均未對此事發表回應。,http://www.macaodaily.com/html/2024-12/24/content_1802798.htm,當天她是特意前往黃曉明的拍攝地點進行談判，並且疑似找了攝影組來營造出兩人未分手的假象,葉珂 “ 自導 自演 ” 挺孕肚 現身         今年 九月 黃 曉明 公開 認愛網 紅葉 珂 ， 但 隨即 葉珂過 去 的 黑 歷史 、 失言 以及 整形 和 炫富 傳聞 ， 也 遭到 廣泛 關注 。 近日 傳出 兩人 分手 消息 ， 葉珂 卻 又 被 拍 到 挺 着 大肚子 現身 。 不過 有 博主 爆料 這其實 是 葉 珂 “ 自導 自演 ” ， 營造 出 兩人 感情 如昔 的 假象 。         內地 娛樂博主 “ 妖怪 ” 在 二十二日 的 直播 中 爆料 ， 稱葉 珂 的 孕肚照 並非 偶然 曝光 ， 而是 精心 策劃 。 當天 她 是 特意 前往 黃 曉明 的 拍 攝 地點 進行 談判 ， 並且 疑似 找 了 攝影 組來 營造 出 兩人 未 分手 的 假象 。 為 了 讓 孕肚 更 明顯 ， 她 特意 穿 上 緊 身洋裝 ， 並在 拍 攝後將 照片 發布 到 網上 。 博主 分析 此舉 的 目的 在 於 營造 出 與 黃 曉明 仍 有 聯 繫 的 假象 ， 不僅 能 自我 宣傳 ， 還 可能 吸引 到 投資 和 商機 。         妖怪 公開 與 葉 珂 的 錄音 檔 ， 質疑 葉 珂 有意 詐 騙黃曉明 ， 並 利用 黃 曉明 的 名氣來 達 成個 人 目的 。 他 強調 如果 自己 所言 不實 ， 願意 承擔 法律 責任 。 目前 當事 人葉 珂 和 黃 曉明 均 未 對 此事 發表 回應 。,2024-12-24
又到聖誕！    娛  翁,又到聖誕！    不經不覺，今天原來已經是平安夜，香港及澳門都是華洋雜處之地，聖誕節是港澳人士生活的一部分，不少創作亦跟聖誕相關。其中陳奕迅的《Lonely Christmas》及普通話版的《聖誕結》最多人認識，還有郭富城《戰場上的最後聖誕》、麥浚龍《平安夜》、Dear Jane《Dear Christmas》、許志安《今年沒聖誕》、Cookies《曲奇聖誕歌》、MC張天賦洪嘉豪《聖誕很忙》、Rubberband《零度聖誕》和衛蘭《伯利恆的主角》等。    電影方面雖未必一定以聖誕做主題，但當中出現經典場景與聖誕節相關的亦不少，一九九二年《家有囍事》雖是賀歲片，故事重心卻在聖誕節，一九八八年《富貴再逼人》故事以加拿大的聖誕節來取景。一九八七年《秋天的童話》雖然看似跟聖誕無關，但戲中周潤發賣掉二手車買錶帶送給鍾楚紅配襯其手錶機芯，卻發現她將手錶機芯送了給自己的情節，明顯是出自美國短篇小說《麥琪的禮物》。    惟要數最顧名思義又最經典的，莫過於日前港視三十一剛播完一九八四年的新藝城電影《聖誕快樂》，距首播剛好已經四十年，憑藉二千五百萬元成為當年年度票房第二位，電影雖有陳百強、張國榮及李麗珍等年輕偶像演出，但主線卻是落在麥嘉、徐小鳳及袁和平的三角關係之上。戲中出現的歌曲亦備受矚目，除有徐小鳳的《這是真愛》及《獻君千闋歌》之外，陳百強為該片所作的插曲《等》，亦成為香港樂壇最著名的原創情歌之一。除此以外，其時適值有氧健身操Aerobics熱潮，戲中亦有李麗珍穿上緊身衣跳健身舞的情景，健身舞同學中更有青澀的林憶蓮客串……雖已是四十年前的舊作，但恰到好處的青春與性感，一點都不過時！    娛  翁,http://www.macaodaily.com/html/2024-12/24/content_1802799.htm,惟要數最顧名思義又最經典的，莫過於日前港視三十一剛播完一九八四年的新藝城電影《聖誕快樂》，距首播剛好已經四十年，憑藉二千五百萬元成為當年年度票房第二位，電影雖有陳百強、張國榮及李麗珍等年輕偶像演出，但主線卻是落在麥嘉、徐小鳳及袁和平的三角關係之上,又 到 聖誕 ！         不經 不覺 ， 今天 原來 已經 是 平安夜 ， 香港 及 澳門 都 是 華洋 雜處 之 地 ， 聖誕節 是 港澳 人士 生活 的 一部分 ， 不少 創作 亦 跟 聖誕 相關 。 其中 陳 奕 迅 的 《 Lonely   Christmas 》 及 普通 話 版 的 《 聖誕結 》 最多人 認識 ， 還有 郭富城 《 戰場 上 的 最後聖誕 》 、 麥浚龍 《 平安夜 》 、 Dear   Jane 《 Dear   Christmas 》 、 許志安 《 今年 沒聖誕 》 、 Cookies 《 曲奇 聖誕歌 》 、 MC 張天 賦洪嘉豪 《 聖誕 很 忙 》 、 Rubberband 《 零度 聖誕 》 和 衛蘭 《 伯利恆 的 主角 》 等 。         電影 方面 雖 未必 一定 以聖誕 做主 題 ， 但 當中 出現 經典 場景 與 聖誕節 相關 的 亦 不少 ， 一九九二年 《 家有 囍 事 》 雖是 賀歲 片 ， 故事 重心 卻 在 聖誕節 ， 一九八八年 《 富貴 再 逼人 》 故事 以 加拿大 的 聖誕節 來 取景 。 一九八七年 《 秋天 的 童話 》 雖然 看似 跟 聖 誕無關 ， 但戲 中 周潤 發賣 掉 二手 車買 錶 帶 送給 鍾 楚紅配 襯其手 錶 機芯 ， 卻 發現 她 將手 錶 機芯 送 了給 自己 的 情節 ， 明顯 是 出自 美國 短篇 小說 《 麥琪 的 禮物 》 。         惟要數 最 顧名 思義又 最經典 的 ， 莫過 於 日前 港視 三十一 剛播 完 一九八四年 的 新藝城 電影 《 聖誕 快樂 》 ， 距 首播 剛好 已經 四十年 ， 憑 藉 二千五百 萬元成 為 當年 年度 票房 第二位 ， 電影 雖 有 陳 百強 、 張國榮 及 李麗珍 等 年 輕 偶像 演出 ， 但主線 卻 是 落 在 麥嘉 、 徐小鳳及 袁和平 的 三角 關 係 之上 。 戲中 出現 的 歌曲 亦備 受矚目 ， 除有 徐小鳳 的 《 這是 真愛 》 及 《 獻君千闋 歌 》 之外 ， 陳 百強 為 該片 所作 的 插曲 《 等 》 ， 亦 成為 香港 樂壇 最 著名 的 原創 情歌 之一 。 除此以外 ， 其時 適值 有氧 健身操 Aerobics 熱潮 ， 戲中 亦 有 李麗珍 穿 上 緊身 衣 跳 健身 舞 的 情景 ， 健身 舞同學 中 更 有 青澀 的 林憶蓮 客串 … … 雖 已 是 四十年 前 的 舊作 ， 但 恰到 好 處 的 青春 與 性感 ， 一點 都 不過 時 ！         娛     翁,2024-12-24
李嘉欣母性澎湃    高  梁,李嘉欣母性澎湃    澳門出生的香港小姐：“大美人”李嘉欣，大難不死，必有後福。年前，急病送ICU……此時此際，李嘉欣與夫婿，甜蜜出現英國，送十五歲兒子入貴族學校，出席新生家長宴會，出盡鋒頭。網站紛傳：李嘉欣眞人仲靚；雖然經專家最精緻的打扮，畢竟五十三歲了，徐娘風韻“小姐”晉級慈母，且母性澎湃，聲言要長居英國，陪兒子讀書。又盛傳：抛夫愛子，讓許晉亨留在香港，照顧“這個家”！    香港船王第二代許世勳，五年前過世，留下約四百二十億港元遺產，交家族信託基金管理。船王的第三代——許晉亨夫婦每月可領取二百萬港元生活費。    許晉亨與李嘉欣及兒子Jayden，住在家族持有的東半山司徒拔道豪宅“曉廬”。另外，許晉亨或相關人士持有何文田“半山壹號”頂層複式天池屋。今年七月，原以七千萬元放售，其後減至六千萬元，較二○○八年五月購入價八千二百○七萬八千元，足足低了二千二百○七萬八千元。此複式天池屋，四房間隔，連私人天台及泳池。二○一八年中叫價一億一千萬元；每月放租收十三萬二千元……。人生另階段，李嘉欣日日親子陪讀，不辭長居英國不願返。    金錢不是萬能，沒有金錢萬萬不能。離開銀幕十多年，李嘉欣專心相夫教子，保養得宜，明艷照人之際，人算不如天算……。李嘉欣自爆——“兩年前，忽然感到心跳加速和呼吸困難，醫生要我立即到醫院，送入ICU搶救……。”李嘉欣憶述：“醫生告訴我，遲一點搶救，‘呢個世界差少少就無咗李嘉欣’。”世事無絕對完美；據傳大美人有“先天心臟病”，曾走過鬼門關，今天這條命是執返來的。    生死一刹，李嘉欣上帖病危床照，插滿喉管，病容憔悴，有圖有眞相……岔開一筆，近日有巨星自言！拍戲墮地，扭傷頸椎，半夜四點送院，緊急手術……。但，聽者無動於中，幾年前的事，如何危急，現在觀衆只覺無驚無險無事。但，可視作“為藝術犧牲”，但，沒有“醫院病床”照，沒有送院照、搶救照，“你話傷得好緊要”，講吓之外，還要有照片，旁人佐證，宣傳入信要套裝，勞心勞力㗎。    高  梁,http://www.macaodaily.com/html/2024-12/24/content_1802800.htm,許晉亨與李嘉欣及兒子Jayden，住在家族持有的東半山司徒拔道豪宅“曉廬”,李嘉欣 母性 澎湃         澳門 出生 的 香港 小姐 ： “ 大美人 ” 李嘉欣 ， 大難 不 死 ， 必有後福 。 年前 ， 急病 送 ICU … … 此時 此際 ， 李嘉欣 與 夫婿 ， 甜蜜 出現 英國 ， 送 十五 歲 兒子入 貴族 學校 ， 出席 新生 家長 宴會 ， 出盡鋒頭 。 網站 紛傳 ： 李嘉欣 眞 人仲靚 ； 雖然經 專家 最 精 緻 的 打扮 ， 畢竟 五十三 歲 了 ， 徐娘 風韻 “ 小姐 ” 晉級 慈母 ， 且 母性 澎湃 ， 聲言要 長 居英國 ， 陪兒子 讀書 。 又 盛傳 ： 抛夫 愛子 ， 讓 許晉 亨 留在 香港 ， 照顧 “ 這個 家 ” ！         香港 船王 第二代 許世勳 ， 五年 前過 世 ， 留下 約 四百 二十 億 港元 遺產 ， 交 家族 信 託 基金 管理 。 船王 的 第三代 — — 許晉 亨夫婦 每月 可 領取 二百 萬 港元 生活 費 。         許晉 亨 與 李嘉欣 及兒子 Jayden ， 住 在 家族 持有 的 東 半山 司徒 拔道 豪宅 “ 曉廬 ” 。 另外 ， 許晉 亨 或 相關 人士 持有 何文田 “ 半山 壹號 ” 頂層 複 式 天池 屋 。 今年 七月 ， 原 以 七千 萬元放售 ， 其後減 至 六千 萬元 ， 較 二 ○ ○ 八年 五月 購入價 八千 二百 ○ 七萬 八千元 ， 足足 低 了 二千 二百 ○ 七萬 八千元 。 此 複 式 天池 屋 ， 四房間 隔 ， 連 私人 天台 及 泳池 。 二 ○ 一 八年 中叫 價一 億 一千 萬元 ； 每月 放租收 十三 萬 二千元 … … 。 人生 另階段 ， 李嘉欣 日日 親子 陪讀 ， 不辭長 居英國 不願 返 。         金錢 不是 萬能 ， 沒有 金錢 萬萬 不能 。 離開 銀幕 十多年 ， 李嘉欣 專心 相夫教子 ， 保養 得宜 ， 明艷照 人之際 ， 人算不如 天算 … … 。 李嘉欣 自爆 — — “ 兩 年前 ， 忽然 感到 心跳 加速 和 呼吸 困難 ， 醫生 要 我 立即 到 醫院 ， 送入 ICU 搶救 … … 。 ” 李嘉欣 憶述 ： “ 醫生 告訴 我 ， 遲一點 搶 救 ， ‘ 呢 個 世界 差少少 就 無 咗 李嘉欣 ’ 。 ” 世事 無絕 對 完美 ； 據 傳大美人 有 “ 先天 心臟病 ” ， 曾 走過 鬼門關 ， 今天 這條命 是 執返 來 的 。         生死 一刹 ， 李嘉欣 上 帖 病危 床照 ， 插滿 喉管 ， 病容 憔悴 ， 有圖 有眞相 … … 岔開 一筆 ， 近日 有 巨星 自言 ！ 拍戲 墮 地 ， 扭傷 頸 椎 ， 半夜 四點 送院 ， 緊急 手術 … … 。 但 ， 聽者 無動 於 中 ， 幾 年前 的 事 ， 如何 危急 ， 現在觀 衆 只 覺無驚 無險 無事 。 但 ， 可視作 “ 為 藝術 犧牲 ” ， 但 ， 沒有 “ 醫院 病床 ” 照 ， 沒有 送 院照 、 搶救照 ， “ 你 話 傷得 好 緊要 ” ， 講吓 之外 ， 還要 有 照片 ， 旁人 佐證 ， 宣傳入 信要 套裝 ， 勞心 勞力 㗎 。         高     梁,2024-12-24
