Title,Content,Link,Summary,Preprocessed_Content,Date
琴澳跨境網約車擬年底上線,推動兩地企業攻關打通系統數據共享    琴澳跨境網約車擬年底上線    【本報消息】橫琴正推動智慧交通網建設，為琴澳居民創造更舒適便捷的跨境出行環境。橫琴粵澳深度合作區城市規劃建設局交通運輸處處長郝晉昨日參加首屆（廣州）國際公共交通新能源和數字科技產業博覽會受訪表示，琴澳交通科技企業正聯合攻關，打造聯通兩地地圖的網約車平台，力爭年底前上線。澳門居民未來可實現一鍵下單，一次付費，直接實現往返橫琴與澳門目的地。    終站可選琴澳市內    郝晉昨日在廣州首屆（廣州）國際公共交通新能源和數字科技產業博覽會分論壇上介紹深合區網約動態公交開展背景及初衷。會後受訪表示，目前澳門居民在橫琴或澳門通過網約車往來，在網絡平台選擇目的地終點站只能是橫琴口岸，即乘客要先打車到橫琴口岸，過關後再次下單打車到目的地。    爲回應澳門居民的訴求，橫琴現正研究一次下單，兩邊接通的便利措施。相關部門正推動澳門的電召車、的士企業與橫琴的網約車或公交企業聯合攻關，打通網絡系統實現數據共享，在平台上直接把橫琴的地圖和澳門連起來。“比如在橫琴澳門新街坊到澳門銀河或葡京，屆時終點就不再跟現在一樣是橫琴口岸，可以直接選擇銀河或葡京。”    一鍵下單一次付費    郝晉說，通過該平台，不管在澳門或橫琴打車，只需要一次下單、一次付費，免去其他繁瑣手續，“如在橫琴網約車下單時，是聯通澳門的平台的，這邊一下單立即就把數據傳過去，司機把乘客送到口岸，過關時澳門已有電召車等候，無需再次下單。平台會告知車在哪裡等，車牌號多少。過關後即可再上車，且是一次付費。”    助新街坊便利出行    郝晉表示，目前已有橫琴企業與澳門企業嘗試研究，力爭年底前推出。該平台推出後，會鼓勵橫琴這類企業整合放在上面，實現一鍵下單，兩邊車輛對接好，一次付費，直接實現從橫琴到澳門島內地址，真正便利澳門居民。    郝晉指出，澳門新街坊已經入住，橫琴城市規劃建設局交通運輸處重點圍繞新街坊周邊的各種交通出行方式整理優化，並於近日梳理。目前新街坊周邊有多種交通方式，包括多條公交線，也有動態公交車分佈，更有專門從新街坊到橫琴口岸的無人駕駛小巴供澳門居民免費乘坐。,http://www.macaodaily.com/html/2024-07/26/content_1770672.htm,”    一鍵下單一次付費    郝晉說，通過該平台，不管在澳門或橫琴打車，只需要一次下單、一次付費，免去其他繁瑣手續，“如在橫琴網約車下單時，是聯通澳門的平台的，這邊一下單立即就把數據傳過去，司機把乘客送到口岸，過關時澳門已有電召車等候，無需再次下單,推動 兩地 企業 攻關 打通 系統 數據 共享         琴澳 跨境 網約 車擬 年底 上線         【 本報 消息 】 橫琴 正 推動 智慧 交通 網建設 ， 為琴澳 居民 創造 更 舒適 便捷 的 跨境 出行 環境 。 橫琴粵澳 深度 合作 區 城市 規劃 建設局 交通 運輸處 處長 郝晉 昨日 參加 首屆 （ 廣州 ） 國際 公共交通 新能源 和 數字 科技 產業 博覽會 受訪 表示 ， 琴澳 交通 科技 企業 正聯合 攻關 ， 打造 聯通 兩地 地圖 的 網約車 平台 ， 力爭 年底 前 上線 。 澳門 居民 未來 可 實現 一鍵 下單 ， 一次 付費 ， 直接 實現 往返 橫琴 與 澳門 目的地 。         終站 可選琴 澳市 內         郝晉 昨日 在 廣州 首屆 （ 廣州 ） 國際 公共交通 新能源 和 數字 科技 產業 博覽會 分論壇 上 介紹 深合區 網約 動態 公交 開展 背景 及 初衷 。 會後受 訪 表示 ， 目前 澳門 居民 在 橫琴 或 澳門 通過 網約車 往來 ， 在 網絡 平台 選擇 目的地 終點 站 只能 是 橫琴 口岸 ， 即 乘客 要 先 打車 到 橫琴 口岸 ， 過關 後 再次 下單 打車 到 目的地 。         爲 回應 澳門 居民 的 訴求 ， 橫琴 現正 研究 一次 下單 ， 兩邊 接通 的 便利 措施 。 相關 部門 正 推動 澳門 的 電召車 、 的士 企業 與 橫琴 的 網約車 或 公交 企業 聯合 攻關 ， 打通 網絡 系統 實現 數據 共享 ， 在 平台 上 直接 把 橫琴 的 地圖 和 澳門 連起 來 。 “ 比如 在 橫琴 澳門 新 街坊 到 澳門 銀河 或 葡京 ， 屆 時 終點 就 不再 跟現 在 一樣 是 橫琴 口岸 ， 可以 直接 選擇 銀河 或 葡京 。 ”         一鍵 下單 一次 付費         郝晉 說 ， 通過 該 平台 ， 不管 在 澳門 或 橫琴 打車 ， 只 需要 一次 下單 、 一次 付費 ， 免去 其他 繁瑣 手續 ， “ 如 在 橫琴 網約 車下 單時 ， 是 聯通 澳門 的 平台 的 ， 這邊 一下 單 立即 就 把 數據 傳過 去 ， 司機 把 乘客 送到 口岸 ， 過關 時 澳門 已有 電召車 等候 ， 無需 再次 下單 。 平台 會 告知 車在 哪裡 等 ， 車牌號 多少 。 過關 後 即可 再 上車 ， 且 是 一次 付費 。 ”         助新 街坊 便利 出行         郝晉 表示 ， 目前 已有 橫琴 企業 與 澳門 企業 嘗試 研究 ， 力爭 年底 前 推出 。 該 平台 推出 後 ， 會 鼓勵 橫琴 這類 企業 整合 放在 上面 ， 實現 一鍵 下單 ， 兩邊 車輛 對 接好 ， 一次 付費 ， 直接 實現 從 橫琴 到 澳門島 內 地址 ， 真正 便利 澳門 居民 。         郝晉 指出 ， 澳門 新 街坊 已經 入住 ， 橫琴 城市 規劃 建設局 交通 運輸處 重點 圍繞 新 街坊 周邊 的 各種 交通 出行 方式 整理 優化 ， 並 於 近日 梳理 。 目前 新 街坊 周邊 有 多種 交通 方式 ， 包括 多條 公交 線 ， 也 有動態 公交 車分 佈 ， 更 有 專門 從 新 街坊 到 橫琴 口岸 的 無人 駕駛 小巴 供澳門 居民 免費 乘坐 。,2024-07-26
琴動態公交擬聯動會展經貿,未來將設計琴澳路線    琴動態公交擬聯動會展經貿    【本報消息】橫琴動態公交上月底正式上線運營。作為全國範圍內首創最大規模的全域動態公交，橫琴動態公交有效解決深合區內零散的快速出行需求，進一步完善合作區內多元公交出行模式。統計數據顯示，正式開通以來，動態公交下單人次和響應率都在提升，每周末更有逾千澳門居民選擇該方式到橫琴露營、旅遊。目前，橫琴正推動動態公交在更多場景應用，如即將推出琴澳聯動會展經貿，未來還將設計橫琴到澳門的線路。    周末逾千澳人使用    橫琴動態公交是合作區城市規劃和建設局推出的全新公共交通出行方式，投放廿五輛動態公交，採用“網約”模式運營，具有快速直達、按需發班、高效利用公交資源、經濟節能等優點。根據用戶即時需求實行動態發班、沿途同向拼車的服務模式。自三月十八日試運營到六月廿六日正式上線，累計服務乘客近十萬人次，註冊用戶超兩萬人。服務人次單日最高可達近二千人次，拼單率達百分之七十以上，已經成為橫琴島內“網紅”出行方式。    負責運營的明智惠行（北京）科技有限公司董事長孟偉昨日在廣州受訪表示，動態公交六月底正式上線至今，下單人次和響應率都在提升。目前每天呼單量接近三千人次，周末也基本達到每天運營的平均數，約千二到千三人次，當中大部分是從澳門過來。認為動態公交原來平峰期的業務不多，現在平峰期總數已經超過高峰期，說明已經深入民心，成為橫琴出行的基本服務之一。    計劃實現無人駕駛    時下無人駕駛備受關注。孟偉表示，未來動態公交力爭實現結合無人駕駛技術，行程中既沒有司機又沒有線路，又能滿足市民個性化需求，真正實現低成本出行。目前正與國內無人駕駛公司談合作，按照橫琴的計劃和安排推進。此外，動態公交正在推進公交車小型化服務，希望把車輛規劃到十座、低於六米以下的小車。同時針對服務一些比較核心的熱門站點，如機場到橫琴、橫琴到澳門、橫琴到港珠澳大橋等，分擔大型集散點輸送旅客的任務。    採訂製化便會展客    隨着“團進團出”政策實施，琴澳會展和旅遊業迎來新的發展機遇。橫琴粵澳深度合作區城市規劃建設局交通運輸處長郝晉表示，得益於“團進團出”政策，澳琴採取“會展+旅遊+招商”的聯動方式，部分人在澳門參展，住在橫琴，必定產生交通需求。為讓參展商往來更便利，可採取訂製化的交通出行方式，動態公交將是選擇之一。,http://www.macaodaily.com/html/2024-07/26/content_1770673.htm,周末逾千澳人使用    橫琴動態公交是合作區城市規劃和建設局推出的全新公共交通出行方式，投放廿五輛動態公交，採用“網約”模式運營，具有快速直達、按需發班、高效利用公交資源、經濟節能等優點,未來 將設 計琴 澳路線         琴動態 公交 擬聯動 會展 經貿         【 本報 消息 】 橫琴動態 公交 上月底 正式 上線 運營 。 作為 全國範圍 內首創 最大 規模 的 全域 動態 公交 ， 橫琴動態 公交 有效 解決 深合區 內 零散 的 快速 出行 需求 ， 進 一步 完善 合作 區內 多元 公交 出行 模式 。 統計 數據 顯示 ， 正式 開通 以來 ， 動態 公交 下單 人次 和 響 應率 都 在 提升 ， 每 周末 更 有 逾 千澳門 居民 選擇 該 方式 到 橫琴 露營 、 旅遊 。 目前 ， 橫琴 正 推動動態 公交 在 更 多場 景應用 ， 如 即將 推出 琴 澳聯動 會展 經貿 ， 未來 還將 設計 橫琴 到 澳門 的 線路 。         周末 逾千澳人 使用         橫琴動態 公交 是 合作 區 城市 規劃 和 建設局 推出 的 全新 公共交通 出行 方式 ， 投放 廿五 輛動態 公交 ， 採用 “ 網約 ” 模式 運營 ， 具有 快速 直達 、 按 需 發班 、 高效 利用 公交 資源 、 經濟節 能 等 優點 。 根據 用戶 即 時 需求 實行 動態 發班 、 沿途 同向 拼車 的 服務 模式 。 自 三月 十八日 試運營 到 六月 廿六日 正式 上線 ， 累計 服務 乘客 近十萬 人次 ， 註 冊 用 戶 超 兩 萬 人 。 服務 人次 單日 最高 可達近 二千 人次 ， 拼 單率 達 百分之七十 以上 ， 已經成 為 橫琴島 內 “ 網紅 ” 出行 方式 。         負責 運營 的 明智 惠行 （ 北京 ） 科技 有限公司 董事 長 孟偉 昨日 在 廣州 受訪 表示 ， 動態 公交 六月 底 正式 上線 至今 ， 下單 人次 和 響 應率 都 在 提升 。 目前 每天 呼 單量 接近 三千 人次 ， 周末 也 基本 達到 每天 運營 的 平均 數 ， 約千二到 千三 人次 ， 當中 大部分 是 從 澳門 過來 。 認為 動態 公交 原來 平峰期 的 業務 不 多 ， 現在 平峰期 總數 已經 超過 高峰期 ， 說明 已經 深入 民心 ， 成為 橫琴 出行 的 基本 服務 之一 。         計劃 實現 無人 駕駛         時下 無人 駕駛備 受 關注 。 孟偉 表示 ， 未來 動態 公交 力爭 實現 結合 無人 駕駛技術 ， 行程 中 既 沒 有 司機 又 沒 有線 路 ， 又 能 滿足 市民 個 性化 需求 ， 真正 實現 低成本 出行 。 目前 正 與 國內 無人 駕駛 公司 談 合作 ， 按照 橫琴 的 計劃 和 安排 推進 。 此外 ， 動態 公交 正在 推進 公交 車 小型化 服務 ， 希望 把 車輛 規劃 到 十座 、 低 於 六米 以下 的 小車 。 同時針 對 服務 一些 比較 核心 的 熱門 站點 ， 如機場 到 橫琴 、 橫琴 到 澳門 、 橫琴 到 港珠 澳大橋 等 ， 分擔 大型 集散 點輸 送 旅客 的 任務 。         採 訂 製 化 便 會 展 客         隨着 “ 團進 團出 ” 政策 實施 ， 琴 澳會展 和 旅遊業 迎來 新 的 發展 機遇 。 橫琴粵澳 深度 合作 區 城市 規劃 建設局 交通 運輸 處長 郝晉 表示 ， 得益 於 “ 團進 團出 ” 政策 ， 澳琴 採取 “ 會展 + 旅遊 + 招商 ” 的 聯動 方式 ， 部分 人 在 澳門 參展 ， 住 在 橫琴 ， 必定 產生 交通 需求 。 為 讓 參 展商 往來 更 便利 ， 可 採取 訂 製 化 的 交通 出行 方式 ， 動態 公交 將是 選擇 之一 。,2024-07-26
空客直升機中國總部落戶橫琴,空客直升機中國總部落戶橫琴    【本報消息】空客直升機中國總部入駐深合區簽約儀式前日在橫琴舉行，標誌着該世界五百強公司的中國總部正式入駐橫琴國際金融中心。    穩佔全球市場首位    簽約儀式前日下午在橫琴國際金融中心舉行，深合區執委會副主任符永革、空中客車直升機中國公司董事總經理柯霖(Colin James)、華發股份珠海大區聯席總經理胡雨波、深合區經發局投資促進處副處長張升等出席。    空中客車直升機作為空中客車集團的重要組成部分，是全球領先的直升機製造商。數據顯示，空客直升機去年共獲得四百一十架訂單，全年累計交付三百四十六架直升機，佔全球民用及公共服務直升機市場份額五成四，穩居全球首位。    帶動低空經濟發展    符永革致辭表示，空客直升機中國總部落戶深合區，相信可帶動直升機領域及低空經濟等上下游行業在橫琴聚集發展，帶來橫琴產業新格局。深合區執委會將一如既往為落地企業提供保障與支持。    柯霖表示，空客直升機中國總部入駐橫琴，不僅會為橫琴的航空產業帶來新的發展機遇，亦將完善和升級整個產業鏈。粵港澳大灣區是世界上大型經濟區之一，在通用航空、特別是直升機領域極具潛力，作為戰略合作的一部分，空客直升機中國公司很高興把總部遷至橫琴國際金融中心。    吸引資本人才集聚    深合區經濟發展局強調，此次空客直升機中國總部進駐，為推動橫琴產業在前沿技術的研發應用、產業投資合作及市場渠道拓展等迎來新的突破發展，有助吸引全球各地的資本、技術與人才匯聚，為粵港澳大灣區的經濟發展注入新動力。深合區將以空中客車直升機中國總部落戶為契機，推動直升機培訓、維修、航材物流、直升機交付等上下游行業在深合區聚集發展，推動深合區發展通用航空、低空經濟等產業生態。    橫琴國際金融中心位於橫琴金融島，是目前島內最高建築，與旅遊塔遙相呼應，屬於華發股份公司物業。此前已引入一批金融、科技、城建、現代服務、會展服務等領域企業進駐，助力深合區“四新”產業發展。,http://www.macaodaily.com/html/2024-07/26/content_1770674.htm,吸引資本人才集聚    深合區經濟發展局強調，此次空客直升機中國總部進駐，為推動橫琴產業在前沿技術的研發應用、產業投資合作及市場渠道拓展等迎來新的突破發展，有助吸引全球各地的資本、技術與人才匯聚，為粵港澳大灣區的經濟發展注入新動力,空客 直升 機中國 總 部落 戶橫琴         【 本報 消息 】 空客 直升 機中國 總部入 駐 深合區 簽約 儀式 前日 在 橫琴 舉行 ， 標誌 着 該 世界 五百 強 公司 的 中國 總部 正式 入 駐 橫琴 國際 金融中心 。         穩佔 全球 市場 首位         簽約 儀式 前日 下午 在 橫琴 國際 金融中心 舉行 ， 深合區 執委會 副 主任 符永革 、 空中 客車 直升 機中國 公司 董事 總經理 柯霖 ( Colin   James ) 、 華發 股份 珠海 大區 聯席 總經理 胡雨波 、 深合區 經發局 投資促 進處 副 處長 張升 等 出席 。         空中 客車 直升 機作 為 空中 客車 集團 的 重要 組成 部分 ， 是 全球 領先 的 直升 機 製 造 商 。 數據 顯示 ， 空客 直升 機 去年 共 獲得 四百 一 十架 訂單 ， 全年 累計 交付 三 百四十六 架 直升 機 ， 佔 全球 民用 及 公共 服務 直升 機市 場份額 五成 四 ， 穩居 全球 首位 。         帶動 低空 經濟 發展         符永革致 辭 表示 ， 空客 直升 機中國 總 部落 戶 深合區 ， 相信 可帶動 直升 機領域 及 低空 經濟 等 上下 游行 業在 橫琴 聚集 發展 ， 帶來 橫琴產業 新格局 。 深合區 執委會將 一如既往 為 落地 企業 提供 保障 與 支持 。         柯霖 表示 ， 空客 直升 機中國 總部入 駐 橫琴 ， 不僅會 為 橫琴 的 航空 產業 帶來 新 的 發展 機遇 ， 亦將 完善 和 升級 整個 產業 鏈 。 粵 港澳 大灣區 是 世界 上 大型 經濟區 之一 ， 在 通用 航空 、 特別 是 直升 機領域 極具 潛力 ， 作為 戰略 合作 的 一部分 ， 空客 直升 機中國 公司 很 高興 把 總部 遷 至 橫琴 國際 金融中心 。         吸引 資本 人才 集聚         深合區 經濟 發展局 強調 ， 此次 空客 直升 機中國 總部 進駐 ， 為 推動 橫琴產業 在 前沿 技術 的 研發 應用 、 產業 投資 合作 及 市場 渠道 拓展 等 迎來 新 的 突破 發展 ， 有助 吸引 全球 各地 的 資本 、 技術 與 人才 匯聚 ， 為粵 港澳 大灣區 的 經濟 發展 注入 新動力 。 深合區 將以 空中 客車 直升 機中國 總 部落 戶為 契機 ， 推動 直升 機培訓 、 維修 、 航材 物流 、 直升 機 交付 等 上下 游行 業在 深合區 聚集 發展 ， 推動 深合區 發展 通用 航空 、 低空 經濟 等 產業 生態 。         橫琴 國際 金融中心 位 於 橫琴 金融 島 ， 是 目前 島內 最高 建築 ， 與 旅遊塔遙 相呼應 ， 屬於華發 股份公司 物業 。 此前 已 引入 一批 金融 、 科技 、 城建 、 現代 服務 、 會展 服務 等 領域 企業 進駐 ， 助力 深合區 “ 四新 ” 產業 發展 。,2024-07-26
逾期納稅擬加徵欠款百分三,延遲利息為每月百分之一    逾期納稅擬加徵欠款百分三    【本報消息】立法會第三常設委員會昨早續與政府代表審議《稅務法典》法案，財政局長容光亮列席。三常會主席黃顯輝會後表示，納稅人在法定繳納期間仍未繳納應交稅項，將面臨欠繳稅款百分之三的罰款，以及每個月百分之一的延遲利息。    三常會議於昨上午十時舉行，主要討論法案工作文本的第九十四至一百七十九條，持續超過兩小時。黃顯輝、三常會秘書梁孫旭會後向傳媒總結。黃顯輝表示，稅項的繳納期間由有關稅務法律訂定，如稅務法律未訂定繳納期間，則候補適用法案所建議的三十日繳納期間。納稅人若在法定繳納期間未繳納稅款，稅務當局將向納稅人徵收欠稅金額百分之三的罰款及每月百分之一的延遲利息。    設六十日緩衝期    此外，納稅人還享有六十日緩衝期，在緩衝期屆滿前十五日，稅務當局將發出通知提醒納稅人。    若緩衝期結束後仍未繳納拖欠稅款、欠稅金額百分之三和遲延利息，則構成滯納，當局將啟動稅務執行程序。委員會關注有關通知方式，政府表示現行做法是透過單掛信和手機短訊通知納稅人，並在法案通過後允許使用電子通知。    黃顯輝續稱，法案建議，若納稅人對稅務行政程序的決定有異議，可先向作出決定的部門提出聲明異議，如仍不服，可進一步向上級機關（司長或特首）提出必要訴願，再不滿可向法院上訴。但對於特別稅種，如有關稅務法律規定納稅人需向複評委員會提出聲明異議，之後當事人仍不服複評委員會的決定，只可向法院提出司法上訴，因為複評委員會的決定屬於確定決定。有委員提議參考一般規定，對複評委員會的決定可向司長或特首提出必要訴願，但政府決定維持法案原建議。    司法上訴三十日    法案並建議，司法上訴期限為必要訴願被駁回的通知日後三十日內（法案原文本為兩個月），與行政程序法所規定的有關期限一致。此外，法案工作文本建議司法上訴的期間不可延期，即使納稅人居於或身處澳門以外地方，即排除行政程序法對利害關係人給予延期的一般制度。    政府監察部門在查核納稅人賬簿時，法案工作文本明確訂明，查核賬簿須至少提前一日通知納稅人。,http://www.macaodaily.com/html/2024-07/26/content_1770588.htm,三常會主席黃顯輝會後表示，納稅人在法定繳納期間仍未繳納應交稅項，將面臨欠繳稅款百分之三的罰款，以及每個月百分之一的延遲利息,延遲 利息 為 每月 百分之一         逾期 納稅擬 加徵 欠款 百分 三         【 本報 消息 】 立法 會 第三 常設 委員會 昨早續 與 政府 代表 審議 《 稅務 法典 》 法案 ， 財 政局 長 容 光亮 列席 。 三常會 主席 黃 顯輝會 後 表示 ， 納稅 人 在 法定 繳納期 間 仍 未 繳納應 交稅項 ， 將面 臨欠 繳稅款 百分之三 的 罰款 ， 以及 每個 月 百分之一 的 延遲 利息 。         三常會議 於 昨 上午 十時 舉行 ， 主要 討論 法案 工作 文本 的 第九 十四 至 一百七十 九條 ， 持續 超過 兩小時 。 黃 顯輝 、 三常會 秘書梁 孫旭會後向 傳媒 總結 。 黃 顯輝 表示 ， 稅項 的 繳納期 間 由 有 關稅務 法律 訂定 ， 如稅務 法律 未訂定 繳納期 間 ， 則候 補 適用 法案 所建議 的 三十日 繳納期 間 。 納稅 人 若 在 法定 繳納期 間 未 繳納 稅款 ， 稅務 當局 將向 納稅 人 徵收 欠稅 金額 百分之三 的 罰款 及 每月 百分之一 的 延遲 利息 。         設 六十日 緩衝期         此外 ， 納稅 人還 享有 六十日 緩衝期 ， 在 緩衝期 屆 滿前 十五日 ， 稅務當 局將 發出 通知 提醒 納稅 人 。         若緩 衝期 結束 後 仍 未 繳納 拖欠 稅款 、 欠稅 金額 百分之三 和 遲延 利息 ， 則構 成滯納 ， 當局 將啟 動稅務 執行 程序 。 委員會 關注 有關 通知 方式 ， 政府 表示 現行 做法 是 透過 單掛 信 和 手機 短訊 通知 納稅 人 ， 並在 法案 通過 後 允許 使用 電子 通知 。         黃 顯輝續 稱 ， 法案 建議 ， 若納稅 人 對 稅務 行政 程序 的 決定 有 異議 ， 可先 向 作出 決定 的 部門 提出 聲明 異議 ， 如 仍 不服 ， 可進 一步 向上 級 機關 （ 司長 或 特首 ） 提出 必要 訴願 ， 再 不滿 可 向 法院 上訴 。 但 對 於 特別 稅種 ， 如有 關稅務 法律 規定 納稅 人 需向 複 評委員會 提出 聲明 異議 ， 之後當 事人 仍 不服 複 評委員會 的 決定 ， 只 可 向 法院 提出 司法 上訴 ， 因為 複 評委員會 的 決定屬 於 確定 決定 。 有委員 提議 參考 一般 規定 ， 對 複 評委員會 的 決定 可 向 司長 或 特首 提出 必要 訴願 ， 但 政府 決定 維持 法案 原建議 。         司法 上訴 三十日         法案 並建議 ， 司法 上訴 期限 為 必要 訴願 被 駁 回 的 通知 日 後 三十日 內 （ 法案 原文 本為 兩個 月 ） ， 與 行政 程序法 所規定 的 有關 期限 一致 。 此外 ， 法案 工作 文本 建議 司法 上訴 的 期間 不可 延期 ， 即使 納稅 人居 於 或 身處 澳門 以外 地方 ， 即 排除 行政 程序法 對 利害 關 係 人 給予 延期 的 一般 制度 。         政府 監察部門 在 查核 納稅 人賬 簿 時 ， 法案 工作 文本 明確 訂明 ， 查核 賬簿須 至少 提前 一日 通知 納稅 人 。,2024-07-26
