Title,Content,Link,Summary,Preprocessed_Content,Date
新華小學籃球賽展活力,新華小學籃球賽展活力    新華學校小學日前舉行第二屆班際籃球比賽，共吸引小四至小六共十個班的同學積極參與。在比賽中，同學們展現了卓越的運動精神與團隊合作，同學們不僅展現了出色的球技，洋溢青春活力。    經過一個下午激烈的比賽，隨即揭曉了獲獎班級。此次比賽充分展示了新華學校學生永不放棄的精神，期待未來能有更多這樣的活動，促進同學們的健康成長，提升團隊精神。,http://www.macaodaily.com/html/2025-01/10/content_1806376.htm,此次比賽充分展示了新華學校學生永不放棄的精神，期待未來能有更多這樣的活動，促進同學們的健康成長，提升團隊精神,新華小學 籃球 賽展 活力         新華學校 小學 日前 舉行 第二 屆班際 籃球 比賽 ， 共 吸引 小 四至 小六共十個 班 的 同學積 極參 與 。 在 比賽 中 ， 同學們 展現 了 卓越 的 運動 精神 與 團隊 合作 ， 同學們 不僅 展現 了 出色 的 球技 ， 洋溢 青春活力 。         經過 一個 下午 激烈 的 比賽 ， 隨即 揭曉 了 獲 獎班級 。 此次 比賽 充分 展示 了 新華學校 學生 永不 放棄 的 精神 ， 期待 未來 能 有 更 多 這樣 的 活動 ， 促進 同學們 的 健康 成長 ， 提升 團隊 精神 。,2025-01-10
培正港中大深附校締結姊妹,培正港中大深附校締結姊妹    澳門培正中學、深圳市龍崗區香港中文大學（深圳）附屬道遠學校昨締結姊妹學校，攜手推動大灣區教育資源共享與協同創新。簽約儀式昨日下午三時半在澳門培正中學舉行，在香港中文大學（深圳）校長助理陳恒等見證下，培正中學校長高錦輝與香港中文大學（深圳）基礎教育處處長兼基礎教育集團總校長裘建浩簽署合作文件。    此次協議簽訂，是兩校促進教育資源互補與深化合作交流的一項重要實踐。未來雙方將通過人員互訪、觀課評課、課程研討及文化體育交流等，共同探索教育合作的新方向，如在課程創新、學生素質提升等領域展開更深入的合作。    簽約儀式前，兩校代表深入交流辦學理念、教育特色及教研經驗等，對未來合作的具體方向達成了初步共識。隨後，與會嘉賓參觀該校多個特色教學空間，肯定培正中學在中華文化傳承、科技教育及閱讀素養培育等方面的努力。,http://www.macaodaily.com/html/2025-01/10/content_1806378.htm,簽約儀式昨日下午三時半在澳門培正中學舉行，在香港中文大學（深圳）校長助理陳恒等見證下，培正中學校長高錦輝與香港中文大學（深圳）基礎教育處處長兼基礎教育集團總校長裘建浩簽署合作文件,培正港 中大深 附校 締結 姊妹         澳門培 正中 學 、 深圳市 龍崗區 香港中文 大學 （ 深圳 ） 附屬 道 遠學校 昨締結 姊妹 學校 ， 攜 手推 動大灣區 教育 資源 共享 與 協同 創新 。 簽約 儀式 昨日 下午 三時 半 在 澳門培 正中 學舉行 ， 在 香港中文 大學 （ 深圳 ） 校長 助理 陳 恒等 見證 下 ， 培 正中 學校 長 高錦輝 與 香港中文 大學 （ 深圳 ） 基礎 教育 處處長 兼 基礎 教育 集團 總校 長 裘 建浩 簽署 合作 文件 。         此次 協議 簽訂 ， 是 兩校 促進 教育 資源 互補 與 深化 合作 交流 的 一項 重要 實踐 。 未來 雙方將 通過 人員 互訪 、 觀課 評課 、 課程 研討及 文化 體育 交流 等 ， 共同 探索 教育 合作 的 新 方向 ， 如 在 課程 創新 、 學生 素質 提升 等 領域 展開 更 深入 的 合作 。         簽約 儀式 前 ， 兩校 代表 深入 交流 辦學 理念 、 教育 特色 及 教研 經驗 等 ， 對 未來 合作 的 具體 方向 達成 了 初步 共識 。 隨後 ， 與 會嘉賓 參觀 該校 多個 特色 教學 空間 ， 肯定 培 正中 學在 中華 文化 傳承 、 科技 教育 及 閱讀 素養 培育 等 方面 的 努力 。,2025-01-10
菜農幼園親子訪長者送暖,菜農幼園親子訪長者送暖    菜農幼稚園（威龍分校）趁新一年來臨之際，日前組織師生代表探訪菜農合群社康年之家，向長者表達問候和祝福。是次探訪活動中，該校幼稚園威龍分校組織幼低、幼中、幼高三級的小朋友代表，一行逾四十多人，在老師和義工家長的帶領下向長者們問好。菜農校長王國英向大家送上新一年祝福，隨後小朋友們分別表演，包括K1級齊聲朗讀《三字經》、K2級的舞蹈“咕咕雞舞蹈嘉年華”以及K3級表演英語故事“The kindest  giant  in  town”。長者看後笑逐顏開，報以熱烈掌聲。校方通過探訪活動，讓小朋友學會尊敬、關愛身邊長者，培養懂得感恩之心。,http://www.macaodaily.com/html/2025-01/10/content_1806380.htm,是次探訪活動中，該校幼稚園威龍分校組織幼低、幼中、幼高三級的小朋友代表，一行逾四十多人，在老師和義工家長的帶領下向長者們問好,菜 農幼園 親子 訪長 者 送暖         菜農 幼稚 園 （ 威龍 分校 ） 趁新 一年 來 臨之際 ， 日前 組織 師生 代表 探訪 菜農 合群 社康 年 之家 ， 向長 者 表達 問候 和 祝福 。 是 次 探訪 活動 中 ， 該校 幼稚 園威龍 分校 組織 幼低 、 幼中 、 幼 高三 級 的 小朋友 代表 ， 一行 逾 四十多 人 ， 在 老師 和 義工家長 的 帶 領下 向 長 者 們 問好 。 菜 農校 長 王國 英向 大家 送上 新 一年 祝福 ， 隨後 小朋友 們 分別 表演 ， 包括 K1 級齊 聲朗讀 《 三字經 》 、 K2 級 的 舞蹈 “ 咕咕 雞 舞蹈 嘉年華 ” 以及 K3 級 表演 英語 故事 “ The   kindest     giant     in     town ” 。 長 者 看後笑 逐顏開 ， 報以 熱烈 掌聲 。 校方 通過 探訪 活動 ， 讓 小朋友 學會 尊敬 、 關愛身 邊長 者 ， 培養 懂得 感恩 之心 。,2025-01-10
教局陽光義工培訓報名,教局陽光義工培訓報名    教育及青年發展局每年均舉辦不同的青年義工活動，其中教青局外港活動中心將舉辦“二○二五陽光義工基礎培訓”，活動對象為十三至廿五歲學生及青年，活動名額為二十名。活動納入“義工FUN，你我都有份計劃”。    活動包括義工基礎培訓及實踐活動，培訓內容包括認識澳門社會福利團體、義務工作初探、自我認識、人際關係、團隊精神、活動策劃執行、活動管理及活動評估，舉行時間為三月八日至六月廿八日逢周六下午五時三十分至晚上七時。參加者完成培訓後，將於七月至十二月期間開展實踐義務工作及督導會議，各活動由義工策劃，將以探訪、戶外活動、交流或社區活動等形式進行，以培養學生及青年的領導才能。    報名日期由即日起至三月一日，費用全免。有興趣者可在一戶通、教青局網頁及手機應用程式進行網上報名登記手續。如欲了解活動的詳細內容，可瀏覽教青局網頁的服務資訊“活動查詢/登記”，或於辦公時間致電：二八七○ · 一三八五／二八七○ · 一三八六查詢。,http://www.macaodaily.com/html/2025-01/10/content_1806382.htm,活動包括義工基礎培訓及實踐活動，培訓內容包括認識澳門社會福利團體、義務工作初探、自我認識、人際關係、團隊精神、活動策劃執行、活動管理及活動評估，舉行時間為三月八日至六月廿八日逢周六下午五時三十分至晚上七時,教局 陽光義工 培訓 報名         教育 及 青年 發展局 每年 均 舉辦 不同 的 青年 義工 活動 ， 其中 教青 局外 港 活動 中心 將舉 辦 “ 二 ○ 二五 陽光義工 基礎 培訓 ” ， 活動 對象 為 十三 至 廿五 歲 學生 及 青年 ， 活動 名額 為 二十名 。 活動 納入 “ 義工 FUN ， 你 我 都 有份 計劃 ” 。         活動 包括 義工 基礎 培訓 及 實踐 活動 ， 培訓 內容 包括 認識 澳門 社會 福利 團體 、 義務 工作 初探 、 自我 認識 、 人際關 係 、 團隊 精神 、 活動 策劃 執行 、 活動 管理 及 活動 評估 ， 舉行 時間 為 三月 八日 至 六月 廿八日 逢 周六 下午 五時 三十分 至 晚上 七時 。 參加者 完成 培訓 後 ， 將於 七月 至 十二月 期間 開展 實踐 義務 工作 及督導會議 ， 各活動 由義工 策劃 ， 將以 探訪 、 戶外 活動 、 交流 或 社區 活動 等 形式 進行 ， 以培養 學生 及 青年 的 領導 才能 。         報名 日期 由 即日起 至 三月 一日 ， 費用 全免 。 有興趣 者 可 在 一戶通 、 教青局 網頁 及 手機 應用 程式 進行 網上 報名 登記 手續 。 如 欲了解 活動 的 詳細 內容 ， 可 瀏覽 教青局 網頁 的 服務資訊 “ 活動 查詢 / 登記 ” ， 或 於 辦公時間 致電 ： 二 八七 ○   ·   一 三 八五 ／ 二 八七 ○   ·   一 三八 六查詢 。,2025-01-10
澳坊幼兒呈英語學習成果,澳坊幼兒呈英語學習成果    澳門坊眾學校日前為幼稚園K3學生舉辦一場別開生面的“English Day”活動。活動以“I Love China”為主題，讓幼兒認識中國的著名景點和傳統節日，將趣味英語融入到日常生活，寓教於樂，增強幼兒了解國家文化。活動當天，各班的小司儀以英語介紹節目，展現學習成果。活動形式豐富多彩，包括：歌唱《Welcome to China》、朗誦《Let’s Go to Beijing》、劇場《We Like the Show》、律動《Chinese Festival》，最後由外籍英語老師Mr. Tim帶領孩子們參與一個充滿創意的“China Craft Market”（中式藝墟）環節。幼兒將自己親手製作的中式手工藝品，包括面譜和剪紙擺放在“藝墟”中模擬售賣。    孩子們透過角色扮演，運用實用的英語句式，展開買賣交流，在模擬情境中學習英語。,http://www.macaodaily.com/html/2025-01/10/content_1806383.htm,活動形式豐富多彩，包括：歌唱《Welcome to China》、朗誦《Let’s Go to Beijing》、劇場《We Like the Show》、律動《Chinese Festival》，最後由外籍英語老師Mr. Tim帶領孩子們參與一個充滿創意的“China Craft Market”（中式藝墟）環節,澳坊 幼兒 呈 英語 學習 成果         澳門坊 眾學校 日前 為 幼稚 園 K3 學生 舉辦 一場 別開 生面 的 “ English   Day ” 活動 。 活動 以 “ I   Love   China ” 為主題 ， 讓 幼兒 認識 中國 的 著名 景點 和 傳統 節日 ， 將 趣味 英語 融入 到 日常生活 ， 寓教 於 樂 ， 增強 幼兒 了解 國家 文化 。 活動 當天 ， 各班 的 小司 儀以 英語 介紹 節目 ， 展現 學習 成果 。 活動 形式 豐富 多彩 ， 包括 ： 歌唱 《 Welcome   to   China 》 、 朗誦 《 Let ’ s   Go   to   Beijing 》 、 劇場 《 We   Like   the   Show 》 、 律動 《 Chinese   Festival 》 ， 最後由 外籍 英語 老師 Mr .   Tim 帶領 孩子 們 參 與 一個 充滿 創意 的 “ China   Craft   Market ” （ 中式 藝墟 ） 環節 。 幼兒將 自己 親 手 製 作 的 中式 手工 藝品 ， 包括 面譜 和 剪紙 擺 放在 “ 藝墟 ” 中模 擬售 賣 。         孩子 們 透過 角色扮演 ， 運用 實用 的 英語 句式 ， 展開 買 賣 交流 ， 在 模擬 情境 中學習 英語 。,2025-01-10
教區聯會助師生知法守法,教區聯會助師生知法守法    天主教學校聯會近日在聖羅撒英文中學舉辦“知法守法”專題講座，澳門大學法學院高級講師江華應邀擔任主講嘉賓。是次講座旨在增強參與者理解國家安全、憲法和澳門基本法，並理解作為中國公民和澳門居民所擁有的權利與義務。    江華在講座中通過介紹和解釋澳門基本法第二十三條的內容，強調國家安全與日常生活息息相關。他指出 “一國”是“兩制”的前提和基礎，因此澳門特區必須堅持“一國”的原則。在享有中央授予的高度自治權時，須履行相應的責任和義務。特別強調維護國家安全的重要性，認為法律知識和法治精神是社會穩定的關鍵基礎，並呼籲天主教學校聯會各屬校的學生、家長及老師積極參與，共同提升法律意識。在講座第二部分，江華通過例子提醒參與者關注容易被忽視的守法意識，並探討法律與日常生活的關係。,http://www.macaodaily.com/html/2025-01/10/content_1806384.htm,是次講座旨在增強參與者理解國家安全、憲法和澳門基本法，並理解作為中國公民和澳門居民所擁有的權利與義務,教區 聯會助 師生 知法 守法         天主教 學校 聯會 近日 在 聖羅撒 英文 中學 舉辦 “ 知法 守法 ” 專題 講座 ， 澳門 大學法 學院 高級 講師 江華應 邀擔 任主 講嘉賓 。 是 次 講座 旨在 增強 參與者 理解 國家 安全 、 憲法 和 澳門 基本法 ， 並 理解 作為 中國 公民 和 澳門 居民 所擁 有 的 權利 與 義務 。         江華 在 講座 中 通過 介紹 和解 釋澳門 基本法 第二十三 條的 內容 ， 強調 國家 安全 與 日常生活 息息 相關 。 他 指出   “ 一國 ” 是 “ 兩制 ” 的 前提 和 基礎 ， 因此 澳門 特區 必須 堅持 “ 一國 ” 的 原則 。 在 享有 中央 授予 的 高度 自治 權時 ， 須 履行 相應 的 責任 和 義務 。 特別 強調 維護國家 安全 的 重要性 ， 認為 法律 知識 和 法治 精神 是 社會 穩定 的 關鍵 基礎 ， 並呼籲 天主教 學校 聯會 各屬校 的 學生 、 家長 及 老師 積極 參 與 ， 共同 提升 法律 意識 。 在 講座 第二 部分 ， 江華通過 例子 提醒 參與者 關注 容易 被 忽視 的 守法 意識 ， 並探 討 法律 與 日常生活 的關 係 。,2025-01-10
鏡平幼園親子運動溫馨,鏡平幼園親子運動溫馨    為慶祝澳門回歸廿五周年、創校一百三十二周年暨合校七十五周年，鏡平學校幼稚園日前於小學部禮堂舉辦兩場“幼稚園K2、K3級親子運動會”，有助提升幼兒身體素質，使幼兒得到全面的發展。    當天兩場運動會，幼兒精神抖擻，在表演體操時節奏整齊合拍且情緒高漲。第一場由K3級幼兒首先體操表演“孩子的天空”，第二場則由K2級幼兒體操表演“快樂的歌”。各班幼兒開展多個競技比賽項目，學生們都積極投入各項遊戲。兩場運動會近八百名幼兒及家長參加，場面熱鬧。運動會在所有家長、幼兒、老師共同參與的大型親子律動“Hokey Pokey”的高潮中圓滿結束。,http://www.macaodaily.com/html/2025-01/10/content_1806385.htm,鏡平幼園親子運動溫馨    為慶祝澳門回歸廿五周年、創校一百三十二周年暨合校七十五周年，鏡平學校幼稚園日前於小學部禮堂舉辦兩場“幼稚園K2、K3級親子運動會”，有助提升幼兒身體素質，使幼兒得到全面的發展,鏡平 幼園 親子 運動 溫馨         為慶祝 澳門 回歸 廿五 周年 、 創校 一百三十 二 周年 暨 合校 七十五 周年 ， 鏡平學校 幼稚 園 日前 於 小學部 禮堂 舉辦 兩場 “ 幼稚 園 K2 、 K3 級 親子 運動會 ” ， 有助 提升 幼兒 身體 素質 ， 使幼兒 得到 全面 的 發展 。         當天 兩場 運動會 ， 幼兒 精神 抖擻 ， 在 表演 體操 時節 奏 整齊 合拍 且 情緒 高漲 。 第一 場由 K3 級 幼兒 首先 體操 表演 “ 孩子 的 天空 ” ， 第二 場則 由 K2 級 幼兒 體操 表演 “ 快樂 的 歌 ” 。 各班 幼兒 開展 多個 競技 比賽 項目 ， 學生們 都 積極 投入 各項 遊戲 。 兩場 運動會 近 八百名 幼兒 及家長 參加 ， 場面 熱鬧 。 運動會 在 所有 家長 、 幼兒 、 老師 共同 參與 的 大型 親子律動 “ Hokey   Pokey ” 的 高潮 中圓滿 結束 。,2025-01-10
折衷中外澳門的畫壇新風,折衷中外澳門的畫壇新風    澳門作為西學東漸的窗口，為傳統文化帶來許多西方思潮的衝擊。其中以“折衷中外，融匯古今”為藝術主張的“嶺南畫派”，其開山始祖之一、“二高一陳”中的高劍父，就與澳門有深厚淵源。    高劍父名崙，字爵廷，號劍父，一八七九年生於廣東番禺，他在一九○三年來澳門讀書，向法國傳教士學習素描技巧，在當時已萌生改革國畫的想法。翌年，他返回廣州教書並繼續作畫。一九〇六年，他已在畫壇小有名氣，即轉赴日本東京美術學校學習，期間與同樣來自嶺南的胞弟高奇峰及陳樹人，主張融合中西繪畫之長，改良國畫，故被稱為“嶺南畫派”。    這段時期，他也加入了同盟會，及後輾轉於廣州與日本投身革命，亦不忘精進畫技。至一九二〇年後，他才淡出政壇潛心繪畫，後在一九二四年於廣州創辦春睡畫院，傳揚新派國畫理念。    嶺南畫派移師澳    一九三八年，為避侵華日軍，高劍父從廣州來到澳門，寓居於普濟禪院，後來他的十多名弟子亦陸續來澳尋師及暫居，逐漸在禪院重組起不掛牌的“春睡畫院”，澳門因此成為嶺南畫派在抗戰時期的重要活動場所。    他們在澳期間，曾為支援抗戰而舉行義賣畫展，亦繪製了一些具澳門元素的作品，將“嶺南畫派”從廣州帶到澳門，為澳門藝壇帶來欣賞國畫的全新視角。    欲知更多詳情，立即掃碼欣賞。,http://www.macaodaily.com/html/2025-01/10/content_1806390.htm,嶺南畫派移師澳    一九三八年，為避侵華日軍，高劍父從廣州來到澳門，寓居於普濟禪院，後來他的十多名弟子亦陸續來澳尋師及暫居，逐漸在禪院重組起不掛牌的“春睡畫院”，澳門因此成為嶺南畫派在抗戰時期的重要活動場所,折衷 中外 澳門 的 畫壇 新風         澳門 作為 西學 東漸 的 窗口 ， 為 傳統 文化 帶來 許多 西方 思潮 的 衝擊 。 其中 以 “ 折衷 中外 ， 融匯 古今 ” 為 藝術 主張 的 “ 嶺南畫 派 ” ， 其開山 始祖 之一 、 “ 二 高一 陳 ” 中 的 高劍父 ， 就 與 澳門 有 深厚 淵源 。         高劍父 名崙 ， 字爵廷 ， 號劍父 ， 一八 七九年 生 於 廣東 番禺 ， 他 在 一九 ○ 三年 來 澳門 讀書 ， 向 法國傳 教士 學習 素描 技巧 ， 在 當時 已 萌生 改革 國畫 的 想法 。 翌年 ， 他 返回 廣州 教書 並繼續 作畫 。 一 九 〇 六年 ， 他 已 在 畫壇 小 有名 氣 ， 即轉 赴 日本 東京 美術 學校 學習 ， 期間 與 同樣 來 自嶺 南 的 胞弟 高奇峰 及 陳 樹人 ， 主張 融合 中西 繪畫 之長 ， 改良 國畫 ， 故 被 稱 為 “ 嶺南畫 派 ” 。         這段 時期 ， 他 也 加入 了 同盟 會 ， 及 後 輾轉 於 廣州 與 日本 投身 革命 ， 亦 不 忘 精進 畫技 。 至 一九二 〇 年 後 ， 他 才 淡出 政壇 潛心 繪畫 ， 後 在 一九二四年 於 廣州 創辦 春 睡 畫院 ， 傳揚 新派 國畫 理念 。         嶺南畫 派 移師 澳         一九三八年 ， 為 避 侵華日 軍 ， 高劍父 從 廣州來 到 澳門 ， 寓居 於 普濟 禪院 ， 後 來 他 的 十多名 弟子 亦 陸續 來 澳尋師 及 暫居 ， 逐漸 在 禪院 重組起 不 掛牌 的 “ 春睡 畫院 ” ， 澳門 因此 成為 嶺 南畫 派 在 抗戰 時期 的 重要 活動場 所 。         他們 在 澳期間 ， 曾 為 支援 抗戰 而 舉行 義賣 畫展 ， 亦 繪 製 了 一些 具澳門 元素 的 作品 ， 將 “ 嶺南畫 派 ” 從廣州 帶 到 澳門 ， 為 澳門 藝壇 帶來 欣賞 國畫 的 全新 視角 。         欲知 更 多 詳情 ， 立即 掃碼 欣賞 。,2025-01-10
青進協：習講話勉青年銳意進取,青進協：習講話勉青年銳意進取    【本報消息】中華青年進步協會日前在會址舉行“學習習近平主席視察澳門重要講話精神座談會”，全面理解其對澳門提出的“三點期許”和“四點希望”。    與會者期望通過是次活動，凝聚澳門青年共識，提升他們對國家發展和澳門未來的認識與信心。座談會由執行會長許治煒主持，理事長施逸、副會長施俊忠、盧樹棟等理監事及青年骨幹出席。    許治煒表示，作為澳門青年，應當心繫澳門與國家，志存高遠且腳踏實地，成為“一國兩制”事業的建設者和接班人。    他鼓勵青年站在全球視角看待澳門發展，把握中華民族偉大復興的戰略機遇，以及世界百年未有之大變局帶來的挑戰，積極投身於粵港澳大灣區建設和橫琴粵澳深度合作區等國家戰略中，為澳門的長遠發展貢獻青春力量。    施逸指出，作為澳門未來的建設者，要踐行習主席提出的“銳意進取”精神，傳承拼搏創新傳統美德。    出席座談會的主要代表還有劉嘉琪、陳銳鋒、施子濤、馬文靜、梁小琳、黃麗婷、呂思婷等青年骨幹。,http://www.macaodaily.com/html/2025-01/10/content_1806391.htm,他鼓勵青年站在全球視角看待澳門發展，把握中華民族偉大復興的戰略機遇，以及世界百年未有之大變局帶來的挑戰，積極投身於粵港澳大灣區建設和橫琴粵澳深度合作區等國家戰略中，為澳門的長遠發展貢獻青春力量,青進協 ： 習講 話 勉 青年 銳意 進取         【 本報 消息 】 中華 青年 進步 協會 日前 在 會址 舉行 “ 學習習 近平 主席 視察 澳門 重要 講話 精神 座 談會 ” ， 全面 理解 其 對 澳門 提出 的 “ 三點 期許 ” 和 “ 四點 希望 ” 。         與 會者 期望 通過 是 次 活動 ， 凝聚 澳門 青年 共識 ， 提升 他們 對 國家 發展 和 澳門 未來 的 認識 與 信心 。 座 談會 由 執行 會長 許治煒 主持 ， 理事 長 施逸 、 副會長 施俊忠 、 盧樹棟 等理 監事及 青年 骨幹 出席 。         許治煒 表示 ， 作為 澳門 青年 ， 應當 心 繫 澳 門 與 國 家 ， 志存 高遠且 腳踏實 地 ， 成為 “ 一國 兩制 ” 事業 的 建設者 和 接班人 。         他 鼓勵 青年 站 在 全球 視角 看待 澳門 發展 ， 把握 中華 民族 偉大 復 興 的 戰略 機遇 ， 以及 世界 百年 未有 之大 變局 帶來 的 挑戰 ， 積極 投身 於 粵 港澳 大灣區 建設 和 橫琴粵澳 深度 合作 區等國家 戰略 中 ， 為 澳門 的 長 遠 發展 貢獻 青春 力量 。         施逸 指出 ， 作為 澳門 未來 的 建設者 ， 要踐 行習 主席 提出 的 “ 銳意 進取 ” 精神 ， 傳承 拼搏 創新 傳統 美德 。         出席 座 談會 的 主要 代表 還有 劉嘉琪 、 陳 銳鋒 、 施子濤 、 馬 文靜 、 梁小琳 、 黃 麗婷 、 呂思婷 等 青年 骨幹 。,2025-01-10
