Title,Content,Link,Summary,Preprocessed_Content,Date
威廉斯布雷迪帆船對抗八全勝,威廉斯布雷迪帆船對抗八全勝    【本報消息】“二○二五美高梅澳門國際帆船賽”昨進行第二個比賽日，伊恩威廉斯及加文布雷迪在“澳門對抗賽”齊齊八連勝並列領先地位；蓮花盃首日則由韓國“Team Tisunsin”排第一。    主辦單住昨日九時在漁人碼頭舉行鳴笛儀式及船隊巡遊，出席嘉賓包括體育局長張子軒、中國澳門體育暨奧委會主席陳澤武、美高梅總裁及執行董事馮小峰、北斗星航海賽事管理董事長馬文偉、世界帆船對抗巡迴賽執行董事普萊曾斯、海事及水務局海事服務處處長陳元盛、澳門風帆船總會副理事長李鉞、珠海文化廣電旅遊體育局副局長袁熊。    船隊在鳴笛儀式後昨日由漁人碼頭出發，經科學館、觀音蓮花苑、嘉樂庇總督大橋，在澳門旅遊塔前折返前往黑沙海灘以南水域賽場，進行首日的“蓮花盃帆船賽”及“粵港澳大灣區盃帆船賽”。    澳門對抗賽進入第二日，由英國伊恩威廉斯領軍“Pindar By Manuport Logistics”在次日只鬥三場，同樣交出好表現三戰全勝；美國加文布雷迪的“True Blur Racing”則賽五場並五戰全勝，連同首日的三勝後，與伊恩威廉斯同樣累計八戰全勝，並列領先。    韓國船隊領先蓮花盃    今屆“蓮花盃”有九支隊伍參賽，共鬥八回合，昨首日先賽兩回合。由一二年倫敦奧運帆船金牌得主徐莉佳領軍的中國寧波一號帆船隊，首回合發揮一般排第五，第二回合則以第二名完成，以七分升上第四。首日表現最好為韓國“Team Tisunsin”，分別以第一及第三名完成後，暫以四分居首位。澳門國際帆船賽二四年總冠軍“Canados Sailing Team”及二三年總冠軍“老男孩夢之隊”分別積八分及十三分暫排五、六位。    CAPITANO灣區盃拔頭籌    大灣區盃帆船賽則有十一支船隊角逐，同樣賽八回合。首日賽兩回合，香港“CAPITANO”在兩回合均獲第一居榜首；連奪中國海岸帆船賽冠軍的“RAMPAGE”隊在兩回合列第二，暫居次席；奪得二四年中國盃帆船賽的H3O以第三及第六名完成，總分排第四。由鄺穎瑩領軍的“澳門老閘船隊”則以第七及九名完成，暫積十六分排第八。,http://www.macaodaily.com/html/2025-01/10/content_1806296.htm,主辦單住昨日九時在漁人碼頭舉行鳴笛儀式及船隊巡遊，出席嘉賓包括體育局長張子軒、中國澳門體育暨奧委會主席陳澤武、美高梅總裁及執行董事馮小峰、北斗星航海賽事管理董事長馬文偉、世界帆船對抗巡迴賽執行董事普萊曾斯、海事及水務局海事服務處處長陳元盛、澳門風帆船總會副理事長李鉞、珠海文化廣電旅遊體育局副局長袁熊,威廉斯 布雷 迪 帆船 對 抗八全勝         【 本報 消息 】 “ 二 ○ 二五 美高梅 澳門 國際 帆船 賽 ” 昨進行 第二 個 比賽 日 ， 伊恩 威廉斯 及 加文 布雷 迪在 “ 澳門 對 抗賽 ” 齊齊 八連勝 並列 領先 地位 ； 蓮花 盃 首日 則由 韓國 “ Team   Tisunsin ” 排 第一 。         主辦 單住 昨日 九時 在 漁人 碼頭 舉行鳴 笛 儀式 及 船隊 巡遊 ， 出席 嘉賓 包括 體育 局長 張子軒 、 中國 澳門 體育 暨 奧委會 主席 陳澤武 、 美高梅 總裁 及 執行 董事 馮小峰 、 北斗星 航海 賽事 管理 董事 長 馬 文偉 、 世界 帆船 對 抗巡 迴 賽 執行 董事 普萊 曾斯 、 海事 及 水務局 海事 服務處 處長 陳 元盛 、 澳門風 帆船 總會 副 理事 長 李鉞 、 珠海 文化 廣電 旅遊 體育局 副 局長 袁熊 。         船隊 在 鳴笛 儀式 後 昨日 由漁人 碼頭 出發 ， 經科學館 、 觀音 蓮花苑 、 嘉樂 庇 總督大橋 ， 在 澳門 旅遊 塔前 折返 前往 黑 沙海 灘 以南 水域 賽場 ， 進行 首日 的 “ 蓮花 盃 帆船 賽 ” 及 “ 粵 港澳 大灣區 盃 帆船 賽 ” 。         澳門 對 抗賽 進入 第二日 ， 由 英國 伊恩 威廉斯 領軍 “ Pindar   By   Manuport   Logistics ” 在 次日 只鬥三場 ， 同樣 交出 好表現 三戰 全勝 ； 美國 加文 布雷 迪 的 “ True   Blur   Racing ” 則賽 五場 並五戰 全勝 ， 連同 首日 的 三勝 後 ， 與 伊恩 威廉斯 同樣 累計八戰 全勝 ， 並列 領先 。         韓國 船隊 領先蓮花 盃         今屆 “ 蓮花 盃 ” 有 九支 隊伍 參賽 ， 共鬥八 回合 ， 昨 首日 先賽 兩 回合 。 由 一二年 倫敦 奧運 帆船 金牌得主 徐莉佳領 軍 的 中國寧波 一號 帆船 隊 ， 首回合 發揮 一般 排 第五 ， 第二 回合 則以 第二名 完成 ， 以 七分 升 上 第四 。 首日 表現 最好 為 韓國 “ Team   Tisunsin ” ， 分別 以 第一 及 第三名 完成 後 ， 暫以 四分 居首位 。 澳門 國際 帆船 賽二 四年 總冠 軍 “ Canados   Sailing   Team ” 及 二三年 總冠 軍 “ 老 男孩 夢之隊 ” 分別積 八分 及 十三分 暫排 五 、 六位 。         CAPITANO 灣區 盃 拔頭 籌         大灣區 盃 帆船 賽則 有 十 一支 船隊 角逐 ， 同樣 賽八 回合 。 首日 賽 兩 回合 ， 香港 “ CAPITANO ” 在 兩 回合 均 獲 第一 居 榜首 ； 連奪 中國 海岸 帆船 賽冠 軍 的 “ RAMPAGE ” 隊 在 兩 回合 列 第二 ， 暫居 次席 ； 奪得 二 四年 中國 盃 帆船 賽 的 H3O 以 第三 及 第六名 完成 ， 總 分排 第四 。 由 鄺穎瑩領 軍 的 “ 澳門 老閘 船隊 ” 則以 第七 及 九名 完成 ， 暫積 十六分 排 第八 。,2025-01-10
營造主場優勢還需努力   賈大廚,營造主場優勢還需努力    主場優勢對主客制的體育項目尤其重要，有時甚至可翻盤反勝。但本澳運動員要真正享有主場優勢，仍有很長的路。    主場一詞常見於足球、籃球等團體運動項目，通常是指職業球隊的訓練及比賽場地，場地可以是自家財産或向外租賃。主場固然有“優勢”，在於客隊需舟車勞頓前往主隊場地作賽，且主隊更熟悉比賽場地環境，加上獲大多球迷支援，因而獲更多助威，向對手施加更大壓力。然而本澳運動員想得到主場之利，卻是困難重重。    近年本澳足球及籃球等都有以主、客場作賽，但在本澳業餘體育環境下，球隊要擁有“主場”可說是天方夜譚。球員大多在公共體育場練習及比賽，但現時有部分賽事獲休閒企業贊助，若檔期合適便會在休企的場館作賽，不過因球員甚少在該場地練習，根本毫無主場的“環境之利”，甚至會增添壓力。另外本地雖有不少球迷，但即使免費派飛，會親身到場支持者亦不多，過去亦出現過代表隊在主場應戰，對手的支持者比主隊更多，氣氛更一面倒。    站在資方角度，支持者買票入場屬正常，雖有半價優惠或邀請居民觀賽，但名額不多，對代表隊是杯水車薪。場地等硬件優勢暫較難改變，只能從支持者落手。要吸引支持者，周邊配套、嘉年華等活動要做好，讓他們有到場的動力。長遠要向學校着手，加強學生對代表隊的支持及關注，培養學生到場打氣的意願，為未來代表隊建立忠實支持者。    賈大廚,http://www.macaodaily.com/html/2025-01/10/content_1806297.htm,主場固然有“優勢”，在於客隊需舟車勞頓前往主隊場地作賽，且主隊更熟悉比賽場地環境，加上獲大多球迷支援，因而獲更多助威，向對手施加更大壓力,營造 主場 優勢 還需 努力         主場 優勢 對 主客 制 的 體育 項目 尤其 重要 ， 有時 甚至 可 翻盤 反勝 。 但本 澳運動員要 真正 享有 主場 優勢 ， 仍有 很長 的 路 。         主場 一詞 常見 於 足球 、 籃球 等 團體 運動 項目 ， 通常 是 指 職業 球隊 的 訓練 及 比賽場 地 ， 場地 可以 是 自家 財 産 或 向 外租賃 。 主場 固然 有 “ 優勢 ” ， 在 於 客隊 需舟車 勞頓 前往 主隊場 地作賽 ， 且 主隊 更 熟悉 比賽場 地 環境 ， 加上 獲 大多 球迷 支援 ， 因而 獲 更 多 助威 ， 向 對 手 施加 更大 壓力 。 然而 本澳 運動員 想得到 主場 之利 ， 卻 是 困難 重重 。         近年 本澳 足球 及 籃球 等 都 有 以主 、 客場 作賽 ， 但 在 本 澳業 餘體育 環境 下 ， 球隊 要 擁有 “ 主場 ” 可說 是 天方夜 譚 。 球員 大多 在 公共 體育場 練習 及 比賽 ， 但 現時 有 部分 賽事 獲 休閒 企業 贊助 ， 若檔 期合 適便 會 在 休企 的 場館 作賽 ， 不過 因球員 甚少 在 該場 地練習 ， 根本 毫無主場 的 “ 環境 之利 ” ， 甚至 會 增添 壓力 。 另外 本地 雖有 不少 球迷 ， 但 即使 免費 派 飛 ， 會親 身到場 支持者 亦 不 多 ， 過去 亦 出 現過 代表 隊 在 主場 應戰 ， 對手 的 支持者 比主隊 更 多 ， 氣氛 更 一面倒 。         站 在 資方 角度 ， 支持者 買票 入場屬 正常 ， 雖有 半價 優惠 或 邀 請 居民 觀賽 ， 但 名額 不 多 ， 對 代表 隊 是 杯水 車薪 。 場地 等 硬件 優勢 暫較 難 改變 ， 只能 從 支持者 落手 。 要 吸引 支持者 ， 周邊 配套 、 嘉年華 等 活動 要 做好 ， 讓 他們 有 到場 的 動力 。 長 遠 要 向 學校 着手 ， 加強 學生 對 代表 隊 的 支持 及 關注 ， 培養 學生 到場 打氣 的 意願 ， 為 未來 代表 隊 建立 忠實 支持者 。         賈大廚,2025-01-10
琴澳網球共同成長,琴澳網球共同成長    【本報消息】網球作為一項世界性的運動，吸引多個國家的運動員參與及投入巨大資金去培養運動員，如網傳鄭欽文的父親為了培養鄭欽文而花費兩千萬人民幣，澳門在培養網球員方面一直都投入不少資源，未來可期。    陽光網球會會長楊啓豐表示，香港亦已培養出黃澤林，其最高排名一百多，帶起整個香港的網球運動，刷亮香港的網球金名片。澳門雖仍未能培養出像黃澤林這樣的網球員，但網球的培訓仍未停止。    去年在橫琴國際網球中心，橫琴粵澳深度合作區體育聯合會、華發體育主辦的“二○二四華金資管橫琴粵澳深度合作區青少年網球積分系列賽CTJ-C200第一站，澳門球手包攬男子U12組別前三名，由澳門網校集訓隊的莫焯文奪冠。男子U10組共有卅二名小球員參賽，來自橫琴、中山、珠海、深圳和澳門等地，最後由澳門網球學校的鄺泓洋奪得冠軍；賽事雖由早上打到黃昏，但球員的參賽熱誠絲毫未減，賽後舉行簡單的祝捷會，在球員心中留下快樂的網球種子，期待未來茁壯成長。    近年政府大力推動琴澳一體化，上述賽事由橫琴粵澳深度合作區體育聯合會及華發體育主辦，別具意義。澳門政府為支持各體育總會根據自身的發展制訂整體性的發展規劃，去年投入約一點三二億澳門元，包括《二○二四年精英及集訓隊運動員培訓資助計劃》等。,http://www.macaodaily.com/html/2025-01/10/content_1806298.htm,去年在橫琴國際網球中心，橫琴粵澳深度合作區體育聯合會、華發體育主辦的“二○二四華金資管橫琴粵澳深度合作區青少年網球積分系列賽CTJ-C200第一站，澳門球手包攬男子U12組別前三名，由澳門網校集訓隊的莫焯文奪冠,琴澳 網球 共同 成長         【 本報 消息 】 網球 作為 一項 世界性 的 運動 ， 吸引 多個 國家 的 運動員 參 與 及 投入 巨大 資金去 培養 運動員 ， 如網 傳 鄭欽文 的 父親 為 了 培養 鄭欽文 而 花費 兩千萬 人民 幣 ， 澳門 在 培養 網球員 方面 一直 都 投入 不少 資源 ， 未來 可期 。         陽光 網球 會會長 楊 啓 豐 表示 ， 香港 亦 已 培養 出黃澤林 ， 其 最高 排名 一百多 ， 帶起 整個 香港 的 網球 運動 ， 刷亮 香港 的 網球金 名片 。 澳門 雖 仍 未能 培養 出像黃澤林 這樣 的 網球員 ， 但 網球 的 培訓 仍 未 停止 。         去年 在 橫琴 國際 網球 中心 ， 橫琴粵澳 深度 合作 區體育 聯合會 、 華發 體育 主辦 的 “ 二 ○ 二四 華金 資管 橫琴粵澳 深度 合作 區 青少年 網球 積分 系列 賽 CTJ - C200 第一站 ， 澳門 球手 包攬 男子 U12 組別 前三名 ， 由 澳門 網校 集訓隊 的 莫焯 文奪冠 。 男子 U10 組 共有 卅 二名 小球 員 參賽 ， 來 自橫琴 、 中山 、 珠海 、 深圳 和 澳門 等 地 ， 最後由 澳門 網球 學校 的 鄺泓洋 奪得 冠 軍 ； 賽事 雖 由 早上 打到 黃 昏 ， 但球員 的 參賽 熱誠絲 毫未減 ， 賽後舉行 簡單 的 祝捷 會 ， 在 球員 心中 留下 快樂 的 網球 種子 ， 期待 未來 茁壯 成長 。         近年 政府 大力 推動琴 澳一體化 ， 上述 賽 事由 橫琴粵澳 深度 合作 區體育 聯合會 及華發 體育 主辦 ， 別具 意義 。 澳門 政府 為 支持 各體育 總會 根據 自身 的 發展 制訂 整體性 的 發展 規劃 ， 去年 投入 約 一點 三二億 澳門元 ， 包括 《 二 ○ 二 四年 精英 及集 訓隊 運動員 培訓 資助 計劃 》 等 。,2025-01-10
迪祖八強或碰艾卡拉斯,澳網抽籤    迪祖八強或碰艾卡拉斯    【本報消息】新一季首項大滿貫的澳網將於下周一開鑼，並在昨日進行抽籤。卅七歲老將迪祖高域要爭第十一冠將遇極大阻力，預計八強已有機會遇上艾卡拉斯；“一哥”辛拿抽得好籤，在上半場避開不少強敵。    澳網進行抽籤，下半區被視為今屆的“死亡半區”，同區有二號種子施華利夫在首圈鬥持外卡的普利；更有十屆冠軍的迪祖高域，首圈遇上外卡球員巴沙華列迪，不過今屆只列七號種子的迪祖高域要爭第十一冠將困難重重，下半區高手林立，包括只剩澳網未贏過的艾卡拉斯，兩人有機會在八強相遇上演“前一哥”大戰；同區還有六號種子魯特、迪米洛夫及復出的東道主基治奧斯等。    梅利教迪祖機會難得    迪祖高域在新季聘用上季掛拍的老友梅利擔任教練，兩人亦首次作公開訓練。梅利與迪祖高域其實年齡只相差一周，不過梅利受傷患困擾要掛拍，迪祖高域成為昔日四大天王唯一仍征戰沙場的球員。兩人由場上敵對變合作關係，梅利坦言是不可錯過的機會：“迪祖問我有冇興趣協助他，我與家人商量後，認為這是唯一的機會及經驗，是個很好的主意，我樂意去嘗試。”    力爭衛冕的“一哥”辛拿籤運不俗，首圈鬥智利的查利，而同區最大對手只有“前一哥”的五號種子麥維迪夫及四號種子費斯，相較下半區好打得多；辛拿在八強則有機碰上薛斯柏斯。    鄭欽文有機遇上一姐    女單的“一姐”莎芭蘭卡要爭取衛冕，首圈已受考驗，碰上前美網冠軍史堤芬絲，不過史堤芬絲近年狀態急滑，近五年有四次在澳網首圈出局，莎芭蘭卡仍有望過關。不過與莎芭蘭卡同處上半區的還有三號種子嘉奧芙，首圈要撼二○年冠軍姬蓮上演美國同鄉內戰，十六強亦可能碰上“前一姐”大坂直美；而中國金花鄭欽文亦在上半區，有機在八強惡鬥莎芭蘭卡。    二號種子施韋迪在下半區的主要對手有拉芭堅娜及柏奧蓮妮，第三圈則有機會遇上英國的拉杜簡露。,http://www.macaodaily.com/html/2025-01/10/content_1806299.htm,更有十屆冠軍的迪祖高域，首圈遇上外卡球員巴沙華列迪，不過今屆只列七號種子的迪祖高域要爭第十一冠將困難重重，下半區高手林立，包括只剩澳網未贏過的艾卡拉斯，兩人有機會在八強相遇上演“前一哥”大戰,澳網 抽 籤         迪祖八強 或 碰艾 卡拉斯         【 本報 消息 】 新一季 首項 大滿貫 的 澳網將 於 下周一 開鑼 ， 並在 昨日 進行 抽 籤 。 卅七歲 老 將迪祖 高域 要爭 第十一 冠將 遇極大 阻力 ， 預計八強 已有 機會 遇上 艾 卡拉斯 ； “ 一哥 ” 辛拿 抽得 好 籤 ， 在 上半 場避開 不少 強敵 。         澳網 進行 抽 籤 ， 下半區 被 視為 今屆 的 “ 死亡 半區 ” ， 同區 有二號 種子 施華 利夫 在 首圈 鬥持 外卡 的 普利 ； 更 有 十屆 冠 軍 的 迪祖 高域 ， 首圈 遇上 外卡 球員 巴沙 華列迪 ， 不過 今屆 只 列七號 種子 的 迪祖 高域 要爭 第十一 冠將 困難 重重 ， 下半區 高手林立 ， 包括 只 剩澳網 未 贏過 的 艾 卡拉斯 ， 兩人 有 機會 在 八強 相遇 上演 “ 前一哥 ” 大戰 ； 同區 還有 六號 種子 魯特 、 迪米 洛夫 及 復 出 的 東道 主基治 奧斯 等 。         梅利 教迪祖 機會 難得         迪祖 高域 在 新季 聘用 上 季掛 拍 的 老友 梅利擔 任教 練 ， 兩人 亦 首次 作公開 訓練 。 梅利 與 迪祖 高域 其實 年齡 只 相差 一周 ， 不過 梅利受 傷患 困擾 要掛 拍 ， 迪祖 高域 成為 昔日 四大 天王 唯一 仍征 戰沙場 的 球員 。 兩人 由場 上 敵 對 變 合作 關 係 ， 梅利 坦言 是 不可 錯過 的 機會 ： “ 迪祖問 我 有 冇 興趣 協助 他 ， 我 與 家人 商量 後 ， 認為 這是 唯一 的 機會 及 經驗 ， 是 個 很 好 的 主意 ， 我樂意 去 嘗試 。 ”         力爭 衛冕 的 “ 一哥 ” 辛拿 籤 運 不俗 ， 首圈鬥 智利 的 查利 ， 而 同區 最大 對手 只有 “ 前一哥 ” 的 五號 種子 麥維迪夫 及 四號 種子 費斯 ， 相較 下半區 好 打 得 多 ； 辛拿在 八 強則 有機 碰上 薛斯 柏斯 。         鄭欽文 有機 遇上 一姐         女單 的 “ 一姐 ” 莎 芭蘭卡要 爭取 衛冕 ， 首圈 已受 考驗 ， 碰上 前美網 冠軍史 堤芬絲 ， 不過 史堤 芬絲 近年 狀態 急 滑 ， 近 五年 有 四次 在 澳網 首圈 出局 ， 莎 芭蘭卡 仍 有望 過關 。 不過 與 莎 芭蘭卡 同處 上半 區的 還有 三號 種子 嘉奧 芙 ， 首圈 要撼 二 ○ 年 冠軍姬蓮 上演 美國 同鄉 內戰 ， 十六 強亦 可能 碰上 “ 前一姐 ” 大坂直 美 ； 而 中國 金花 鄭欽文 亦 在 上半 區 ， 有機 在 八強 惡鬥莎 芭蘭卡 。         二號 種子施 韋迪 在 下半區 的 主要 對手 有 拉 芭 堅娜 及 柏奧蓮妮 ， 第三圈 則有 機會 遇上 英國 的 拉 杜 簡露 。,2025-01-10
艾拉治達喀爾分段首勝,艾拉治達喀爾分段首勝    【本報消息】東道主的沙特車手艾拉治在達喀爾拉力賽第四段最快完成，首奪分段冠軍；拿迪根得第二續在總成績領跑，並將優勢擴大。    達喀爾第四段由艾希拿基耶前往歐拉，全長五百八十八公里，其中特殊路段四百一十五公里。繼衛冕的辛斯及路比先後退出後，五屆冠軍艾迪耶在今段亦遇麻煩，後懸掛損壞讓他損失逾半小時，最終只能以十九名過終點，總成績由次席跌至第七，已落後逾卅五分鐘。    艾迪耶坦言已盡力收復失地：“車修好後很好，我們只能接受，由明天開始到下周的賽事，我唯一要做就是進攻。”    主場的艾拉治在今段未遇任何問題，以四小時廿六分四十秒最快抵達終點，贏得生涯首個分段冠軍；拿迪根雖慢四分五十一秒完成，不過藉艾迪耶成績大跌，他在總成績將優勢增至六分五十四秒，艾拉治升上第二。    辛達斯在電單車組回復強勢，以十五秒擊敗舒亞連拿，開賽四段贏得第三個分段冠軍，總成績已握有逾十三分鐘的優勢。,http://www.macaodaily.com/html/2025-01/10/content_1806300.htm,繼衛冕的辛斯及路比先後退出後，五屆冠軍艾迪耶在今段亦遇麻煩，後懸掛損壞讓他損失逾半小時，最終只能以十九名過終點，總成績由次席跌至第七，已落後逾卅五分鐘,艾拉 治達 喀爾 分段 首勝         【 本報 消息 】 東道 主 的 沙特 車手 艾拉 治在 達喀爾 拉力 賽 第四段 最快 完成 ， 首奪 分段 冠 軍 ； 拿迪 根得 第二 續 在 總成績 領跑 ， 並將 優勢 擴大 。         達喀爾 第四段 由 艾希 拿 基耶 前往 歐拉 ， 全長 五百 八十八 公里 ， 其中 特殊 路段 四百 一 十五公里 。 繼衛冕 的 辛斯及 路 比 先 後 退出 後 ， 五屆 冠 軍 艾迪 耶在 今段 亦 遇麻煩 ， 後 懸掛 損壞 讓 他 損失 逾 半小時 ， 最終 只能 以 十九 名過 終點 ， 總成績 由 次席 跌至 第七 ， 已 落後逾卅 五分 鐘 。         艾迪 耶 坦言 已 盡力 收 復 失地 ： “ 車 修好 後 很 好 ， 我們 只能 接受 ， 由 明天 開始 到 下周 的 賽事 ， 我 唯一 要 做 就是 進攻 。 ”         主場 的 艾拉 治在 今段 未遇 任何 問題 ， 以四小時 廿六 分 四十 秒 最快 抵達 終點 ， 贏得 生涯 首個 分段 冠 軍 ； 拿迪根 雖慢 四分 五十 一秒 完成 ， 不過 藉 艾迪 耶成績 大跌 ， 他 在 總成績 將優勢 增至 六分 五十四 秒 ， 艾拉 治升 上 第二 。         辛達斯 在 電單車 組回 復 強勢 ， 以 十五秒 擊敗 舒亞連 拿 ， 開賽 四段 贏得 第三 個 分段 冠 軍 ， 總成績 已 握有 逾 十三分 鐘的 優勢 。,2025-01-10
騎士掃“雷”11連勝,騎士掃“雷”11連勝    【本報消息】NBA常規賽上演東、西一哥對決，騎士在主場撼雷霆曾三十次互換領先，騎士憑七人得分上雙，贏一百廿九比一百廿二，中斷雷霆的十五連勝兼收下十一連勝，續做東岸一哥。    騎士迎戰挾十五連勝到訪的西岸一哥雷霆，被視為今季的“總決賽前哨戰”。雷霆首節在阿歷山大火力全開下領先七分，但騎士在次節反撲，莫比利、T阿倫、加蘭特等得分悉數上雙，雖然米切爾全場十六投僅三中，僅得十一分及六籃板，但全民皆兵仍保持火力輸出，半場反超三分。    兩隊在下半場仍勢均力敵，全場多達三十次互換領先，三節後僅差一分。雷霆有阿歷山大最高的卅一分；但騎士表現更頑強，加蘭特及米切爾接連得分穩定戰局，全隊七人得分上雙，J阿倫與莫比利各得雙雙，最終小勝後豪取十一連勝，並中斷雷霆的十五連勝走勢，坐穩東岸第一。    莫比利無人能擋    騎士教練艾傑臣透露在更衣室與球員溝通的內容：“我告訴他們，就對手今仗的表現，我們去年根本不可能贏。我們要繼續努力，向全世界證明球隊的實力。”T阿倫大讚莫比利：“莫比利今日在內線無人能擋，他們終於知道莫比利是誰，他以強硬的低位單打協助我們贏得這場關鍵戰。”,http://www.macaodaily.com/html/2025-01/10/content_1806301.htm,雷霆首節在阿歷山大火力全開下領先七分，但騎士在次節反撲，莫比利、T阿倫、加蘭特等得分悉數上雙，雖然米切爾全場十六投僅三中，僅得十一分及六籃板，但全民皆兵仍保持火力輸出，半場反超三分,騎士 掃 “ 雷 ” 11 連勝         【 本報 消息 】 NBA 常規賽 上演 東 、 西一哥 對決 ， 騎士 在 主場 撼 雷霆 曾 三十次 互換 領先 ， 騎士 憑七人 得分 上雙 ， 贏 一百 廿九 比 一百 廿二 ， 中斷 雷霆 的 十五 連勝 兼收 下 十一 連勝 ， 續 做 東岸 一哥 。         騎士 迎戰挾 十五 連勝到 訪 的 西岸 一哥 雷霆 ， 被 視為 今季 的 “ 總決賽 前哨 戰 ” 。 雷霆 首節 在 阿 歷山大 火力 全開 下 領先 七分 ， 但 騎士 在 次節 反 撲 ， 莫 比利 、 T 阿倫 、 加蘭 特等 得分 悉數 上雙 ， 雖然 米 切爾 全場 十六 投僅 三中 ， 僅得 十一分 及六籃板 ， 但 全民皆兵 仍 保持 火力 輸出 ， 半場 反超 三分 。         兩隊 在 下半場 仍勢 均力 敵 ， 全場 多 達 三十次 互換 領先 ， 三節後僅 差 一分 。 雷霆 有 阿 歷山大 最高 的 卅 一分 ； 但 騎士表現 更 頑強 ， 加蘭 特及 米 切爾 接連 得分 穩定 戰局 ， 全隊 七人 得分 上雙 ， J 阿倫 與 莫 比利 各得 雙雙 ， 最終 小勝後豪取 十一 連勝 ， 並中斷 雷霆 的 十五 連勝 走勢 ， 坐 穩東岸 第一 。         莫 比利 無人能 擋         騎士 教練 艾傑臣 透露 在 更衣室 與 球員 溝通 的 內容 ： “ 我 告訴 他們 ， 就 對 手 今仗 的 表現 ， 我們 去年 根本 不 可能 贏 。 我們 要 繼續 努力 ， 向 全世界 證明 球隊 的 實力 。 ” T 阿倫 大 讚 莫 比利 ： “ 莫 比利 今日 在 內線 無人能 擋 ， 他們終 於 知道 莫 比利 是 誰 ， 他 以強 硬 的 低位 單打 協助 我們 贏得 這場 關鍵戰 。 ”,2025-01-10
