Title,Content,Link,Summary,Preprocessed_Content,Date
警破三案拘六“換錢黨”,扣押總値逾三百萬現金及籌碼    警破三案拘六“換錢黨”    【本報消息】司警日前破獲三宗經營不法兌換案，拘捕六名涉案男女，扣押現金和籌碼總値逾三百萬。另外查獲一名賭客逾期逗留。六名“兌換黨”經調查後移交檢察院處理。其中一名“兌換黨”涉偷渡，另案處理。逾期逗留者則移交出入境部門跟進。    男嫌違令偷渡來澳    首宗經營不法兌換案兩男兩女內地居民涉案，兩男分別姓曹、劉，兩女姓范、胡。年齡卅五及卅七歲。其中劉某於二〇二三年二月因涉非法兌換案，被法院判決禁止入境三年。上月偷渡來澳從事非法兌換。另三人分別在前年十一月至今年一月開始從事不法兌換。    一嫌收留逾期賭仔    案情透露，司警接獲線報，發現有多人在澳門娛樂場從事不法兌換。經搜證後認為時機成熟，前日下午四時許到路氹某酒店房間調查，在房內截獲正在商議兌換細節的六人，包括四名嫌犯及兩名賭客。當中一名應姓內地男賭客涉嫌逾期逗留。司警了解獲悉，應某向曹嫌以每日二百港元租住涉案房間，聯同四名“兌換黨”在該房間居住。    司警於胡某、曹某及范某身上搜出懷疑用作兌換的合共二百三十五萬二千一百港元現金、六萬六千七百港元籌碼及三千三百元人民幣，並在四人電話中發現多筆兌換記錄，並在多個兌換群組留有訊息。司警以“經營為賭博之不法匯兌”將四人落案，首嫌加控“收留非法入境或非法逗留人”，移送檢察院跟進。    兩男賭場搭訕賭客    次案嫌犯爲五十一歲鄺姓本地男子。司警前日中午於路氹某娛樂場發現鄺某與人交易，期間疑對方超出轉帳上限無法完成，司警隨即上前截查。有人供稱當日上午在娛樂場周邊被鄺某答訕借錢及換錢，商議後以四萬七千八百元人民幣兌換五萬港元，但未能完成交易。司警於鄺某身上搜出兩部電話、十萬籌碼及五千九百港元現金。    第三宗案件嫌犯姓孫，卅七歲，內地無業男子。司警同日中午在皇朝區娛樂場針對不法兌換巡查，發現孫某與一名內地女賭客形跡可疑。孫某出示二維碼，賭客即用電話掃描。孫某確定收到轉帳後將三千港元交給對方。司警隨即上前截獲兩人。孫某承認較早前搭訕事主換錢，並以二千八百九十五元人民幣兌換三千港元。司警在孫某身上搜獲五十二萬六千港元及八千元人民幣現金，聯同是次交易的三千港元一併扣押，相信孫某從事非法兌換不少於兩個月。,http://www.macaodaily.com/html/2025-01/24/content_1809334.htm,司警在孫某身上搜獲五十二萬六千港元及八千元人民幣現金，聯同是次交易的三千港元一併扣押，相信孫某從事非法兌換不少於兩個月,扣押 總 値 逾 三百 萬現 金及 籌碼         警破 三案 拘六 “ 換錢 黨 ”         【 本報 消息 】 司警 日前 破獲 三宗 經營 不法 兌換案 ， 拘捕 六名 涉案 男女 ， 扣押 現金 和 籌碼 總 値 逾 三百 萬 。 另外 查獲 一名 賭客 逾期 逗留 。 六名 “ 兌換 黨 ” 經調查 後 移交 檢 察院 處理 。 其中 一名 “ 兌換 黨 ” 涉 偷渡 ， 另案 處理 。 逾期 逗留 者則 移交 出入境 部門 跟 進 。         男嫌 違令 偷渡 來澳         首宗 經營 不法 兌換案 兩 男 兩女 內 地 居民 涉案 ， 兩男分 別姓 曹 、 劉 ， 兩女 姓范 、 胡 。 年齡卅五 及卅七歲 。 其中 劉某 於 二 〇 二三年 二月 因涉 非法 兌換案 ， 被 法院 判決 禁止 入境 三年 。 上 月 偷渡 來澳 從 事 非法 兌換 。 另三人 分別 在 前年 十一月 至今 年 一月 開始 從 事 不法 兌換 。         一嫌 收留 逾期 賭仔         案情 透露 ， 司警接 獲線 報 ， 發現 有 多 人 在 澳門 娛樂場 從 事 不法 兌換 。 經搜證 後 認為 時機 成熟 ， 前日 下午 四時 許到 路 氹 某 酒店 房間 調查 ， 在 房內 截獲 正在 商議 兌換 細節 的 六人 ， 包括 四名 嫌犯 及 兩名 賭客 。 當中 一名 應姓 內 地 男 賭客 涉嫌 逾期 逗留 。 司警 了解 獲悉 ， 應某 向 曹嫌 以 每日 二百 港元 租住 涉案 房間 ， 聯同 四名 “ 兌換 黨 ” 在 該 房間 居住 。         司警 於 胡某 、 曹某 及 范某 身上 搜出 懷疑 用作 兌換 的 合共 二百三十五 萬 二千 一百 港元 現金 、 六萬 六千 七百 港元 籌碼 及 三千 三百元 人民 幣 ， 並在 四人 電話 中 發現 多筆 兌換 記錄 ， 並在 多個 兌換 群組 留有 訊息 。 司警 以 “ 經營 為 賭博 之 不法 匯兌 ” 將四人 落案 ， 首嫌 加控 “ 收留 非法 入境 或 非法 逗留 人 ” ， 移送 檢 察院 跟 進 。         兩 男 賭場 搭 訕 賭客         次案 嫌犯 爲 五十一 歲 鄺姓 本地 男子 。 司警 前日 中午 於 路 氹 某 娛樂場 發現 鄺某 與 人 交易 ， 期間 疑對方 超出 轉帳 上限 無法 完成 ， 司警 隨即 上前 截查 。 有人 供稱 當日 上午 在 娛樂場 周邊 被 鄺 某答 訕 借 錢 及換 錢 ， 商議後以 四萬 七千 八百元 人民 幣兌 換五萬 港元 ， 但 未能 完成 交易 。 司警 於 鄺 某 身上 搜出 兩部 電話 、 十萬籌碼 及 五千 九百 港元 現金 。         第三 宗 案件 嫌犯 姓孫 ， 卅七歲 ， 內地 無業 男子 。 司警 同日 中午 在 皇朝 區娛 樂場 針對 不法 兌換 巡查 ， 發現 孫某 與 一名 內地 女 賭客 形跡 可疑 。 孫某 出示 二維碼 ， 賭客 即用 電話 掃描 。 孫某 確定 收到 轉帳後將 三千 港元 交給 對方 。 司警 隨即 上前 截獲 兩人 。 孫某 承 認較 早前 搭訕 事主 換錢 ， 並以 二 千八百 九 十五元 人民 幣兌換 三千 港元 。 司警 在 孫某 身上 搜獲 五十二 萬 六千 港元 及 八千元 人民 幣現 金 ， 聯同 是 次 交易 的 三千 港元 一 併 扣押 ， 相信 孫某 從 事 非法 兌換 不少 於 兩個 月 。,2025-01-24
印尼情侶涉販吸毒就逮,警檢逾百克値廿一萬毒品    印尼情侶涉販吸毒就逮    【本報消息】印尼外僱情侶活躍中區，向同鄉出售毒品圖利。司警分析線報，經調查後鎖定疑人身份，本月廿一日採取行動，於新橋區截獲男嫌犯，隨後在區內一單位拘捕女嫌犯，搜出一百〇五克可卡因及〇點七三克冰毒，市値約二十一萬澳門元。    涉案男嫌犯姓Edi，四十五歲，報稱清潔員；女嫌犯姓Muchidatun，卅九歲，報稱家傭。兩人情侶關係。    司警日前接獲線報獲悉有人販毒，經調查發現男嫌犯在中區販毒多時，主要對象是同鄕。經鎖定其身份及住處後於本月廿一日採取行動，在新橋區將其截獲，並帶返區內的住所搜查。司警在單位內拘捕女嫌犯，並搜出一大包及卅六小包可卡因，還有一小包冰毒。另外檢獲一萬五千澳門元懷疑毒資及吸毒工具。    兩嫌承認有吸毒習慣。經檢驗，證實兩人對毒品呈陽性反應。警方相信兩人在本澳販毒不少於兩星期，毒品來源有待調查。司警將兩人落案，控以販毒、吸毒及藏有吸毒工具等罪，移交檢察院偵辦。,http://www.macaodaily.com/html/2025-01/24/content_1809335.htm,司警分析線報，經調查後鎖定疑人身份，本月廿一日採取行動，於新橋區截獲男嫌犯，隨後在區內一單位拘捕女嫌犯，搜出一百〇五克可卡因及〇點七三克冰毒，市値約二十一萬澳門元,警檢 逾 百克 値 廿一 萬 毒品         印尼 情侶 涉販 吸毒 就 逮         【 本報 消息 】 印尼 外僱 情侶 活躍中區 ， 向 同鄉 出售 毒品 圖利 。 司警 分析 線報 ， 經調 查後鎖定 疑人 身份 ， 本月 廿一日 採取 行動 ， 於 新橋區 截獲 男 嫌犯 ， 隨後在區 內 一 單位 拘捕 女 嫌犯 ， 搜 出 一百 〇 五克 可卡因 及 〇 點七三克 冰毒 ， 市 値 約 二十一 萬澳門 元 。         涉案 男 嫌犯 姓 Edi ， 四十五 歲 ， 報稱 清潔員 ； 女 嫌犯 姓 Muchidatun ， 卅九歲 ， 報稱 家傭 。 兩 人情 侶關 係 。         司警 日前 接獲線 報 獲悉 有人 販毒 ， 經調查 發現 男 嫌犯 在 中區 販毒 多時 ， 主要 對 象是 同 鄕 。 經鎖定 其 身份 及 住 處 後 於 本月 廿一日 採取 行動 ， 在 新橋區 將其 截獲 ， 並帶 返區 內 的 住所 搜查 。 司警 在 單位 內 拘捕 女 嫌犯 ， 並搜出 一 大包 及卅六 小包 可卡因 ， 還有 一小包 冰毒 。 另外 檢獲 一萬 五千 澳門元 懷疑 毒資及 吸毒 工具 。         兩嫌 承 認有 吸毒 習慣 。 經檢驗 ， 證實 兩人 對 毒品 呈陽性 反應 。 警方 相信 兩人 在 本 澳販毒 不少 於 兩 星期 ， 毒品 來源 有待 調查 。 司警將 兩人 落案 ， 控以 販毒 、 吸毒 及 藏有 吸毒 工具 等 罪 ， 移交 檢 察院 偵辦 。,2025-01-24
內地女騙六人萬九人幣,藉詞出售澳演唱會門票收錢後失聯    內地女騙六人萬九人幣    【本報消息】一名內地女子去年八月下旬涉嫌以出售本澳演唱會門票，詐騙六名內地女子合共一萬九千元人民幣。各事主向治安警報案。嫌犯上周六經關閘口岸入境時被治安警拘捕，有人供認犯案。    被捕女子姓王，二十餘歲，持通行證，報稱無業。治安警落案控以詐騙罪，已移送檢察院偵辦。六名事主年齡十九至廿二歲，報稱損失二千至四千元人民幣不等。    案情顯示，各事主上周六向治安警報稱，去年八月二十四日，各事主透過手機應用程式看到王女出售當晚在本澳舉辦的演唱會門票，遂聯絡對方購買。隨後，王女通知各人到路氹某酒店大堂交易。雙方到場後，事主們按指示先轉帳。轉帳後，王女沒有即時交付演唱會門票，並訛稱須到別處接人，伺機離開。不久，王女以訊息通知各事主到演唱會場館外等候。事主不虞有詐，在場館外等候，但遲遲不見王女現身，亦聯絡不到對方，懷疑受騙。    治安警上周六接報調查，透過各事主提供的線索及“天眼”系統錄像資料，鎖定王女的身份。當日在關閘口岸截獲剛入境的王女。有人供認透過手機應用程式以出售演唱會門票詐騙，犯案當日拿取騙款後已即時返回內地。,http://www.macaodaily.com/html/2025-01/24/content_1809336.htm,案情顯示，各事主上周六向治安警報稱，去年八月二十四日，各事主透過手機應用程式看到王女出售當晚在本澳舉辦的演唱會門票，遂聯絡對方購買,藉 詞 出售 澳 演唱 會門票 收錢 後 失聯         內地 女騙 六人 萬九人幣         【 本報 消息 】 一名 內地 女子 去年 八月 下旬 涉嫌 以 出售 本澳 演唱 會門票 ， 詐騙 六名 內地 女子 合共 一萬 九千元 人民 幣 。 各 事主 向 治安警 報案 。 嫌犯 上 周六 經關閘 口岸 入境 時 被 治安警 拘捕 ， 有人 供認 犯案 。         被捕 女子 姓王 ， 二十 餘歲 ， 持 通行 證 ， 報稱 無業 。 治安警 落案 控以 詐騙 罪 ， 已 移送 檢 察院 偵辦 。 六名 事主 年齡 十九 至 廿二 歲 ， 報稱 損失 二千 至 四千元 人民 幣不等 。         案情 顯示 ， 各 事主 上 周六 向 治安警 報稱 ， 去年 八月 二十四日 ， 各 事主 透過 手機 應用 程式 看到 王女 出售 當晚 在 本 澳舉 辦 的 演唱 會門票 ， 遂 聯絡 對 方購 買 。 隨後 ， 王女 通知 各人 到 路 氹 某 酒店 大堂 交易 。 雙方 到場 後 ， 事主 們 按 指示 先轉帳 。 轉帳 後 ， 王女 沒 有 即 時 交付 演唱 會門票 ， 並訛稱 須到 別處 接人 ， 伺機 離開 。 不久 ， 王女 以訊息 通知 各 事主 到 演唱 會場館 外 等候 。 事主 不虞有 詐 ， 在 場館 外 等候 ， 但 遲遲 不見 王女 現身 ， 亦 聯絡 不到 對方 ， 懷疑 受 騙 。         治安警 上 周六 接報 調查 ， 透過 各 事主 提供 的 線索 及 “ 天眼 ” 系統 錄像 資料 ， 鎖定 王女 的 身份 。 當日 在 關閘 口岸 截獲剛 入境 的 王女 。 有人 供認 透過 手機 應用 程式 以 出售 演唱 會門票 詐騙 ， 犯案 當日 拿取 騙款 後 已 即 時 返回 內地 。,2025-01-24
賀年食品檢測無異常,賀年食品檢測無異常    當局籲注意網代購食安風險    【本報消息】市政署及消費者委員會訊：農曆新年在即，為保障居民食用安全，市政署與消費者委員會於本澳食肆、超市及零售店舖等地點，共抽取一百個賀年食品樣本檢驗，所有樣本檢測結果均未見異常。    是次於本澳各零售點合共抽取一百個賀年食品，包括中式及西式糖果、瓜子果仁、賀年糕點和油器食品，並進行微生物學或化學檢驗。微生物學檢驗項目包括沙門氏菌屬、金黃色葡萄球菌和蠟樣芽孢桿菌；化學檢驗項目則包括黃曲霉毒素B1、防腐劑及重金屬等。根據化驗結果，所有樣本均未見異常。    籲業界嚴遵標準    市政署提醒食品業界，應向可靠的供應商選取貨源，保存來貨及銷售記錄，以便在有需要時追查來源；製作食品前須確保原材料安全衛生，並嚴格遵守食品安全標準，避免超範圍、超劑量使用食品添加劑；須將食品及食材妥善包好及貯存於適當溫度下。同時，提醒居民購買賀年食品時應留意食品的食用期限及貯存方法，如散裝的糖蓮子、果仁及瓜子，應注意食品容器是否清潔及店舖員工的個人衛生情況；選購時留意食品色澤，以自然為要，避免選購色澤過於鮮艷或亮白的食品。    網購食品受監管    近年網購越趨流行，市政署特別提醒食品業界，根據《食品安全法》，不論以何種形式進行食品的生產經營，均受法律監管。在本地從事網購、代購食品經營活動屬市政署恆常監察範圍，業者必須配合巡查、抽檢及按照相關標準與指引生產經營。消費者網購食品亦要格外留神，尤其是一些預製即食賀年食品如年糕等，下單前須了解配送及貯存條件等情況，保障食用安全。,http://www.macaodaily.com/html/2025-01/24/content_1809290.htm,賀年食品檢測無異常    當局籲注意網代購食安風險    【本報消息】市政署及消費者委員會訊：農曆新年在即，為保障居民食用安全，市政署與消費者委員會於本澳食肆、超市及零售店舖等地點，共抽取一百個賀年食品樣本檢驗，所有樣本檢測結果均未見異常,賀年 食品 檢測 無異常         當局籲 注意 網代購 食安風險         【 本報 消息 】 市政 署及 消費者 委員會 訊 ： 農 曆 新年 在 即 ， 為 保障 居民 食用 安全 ， 市政 署 與 消費者 委員會 於 本澳 食肆 、 超市 及 零售店 舖 等 地點 ， 共 抽取 一百 個 賀年 食品 樣本 檢驗 ， 所有 樣本 檢測 結果 均 未見 異常 。         是 次 於 本澳 各 零售 點 合共 抽取 一百 個 賀年 食品 ， 包括 中式 及 西式 糖果 、 瓜子 果仁 、 賀 年糕 點和油器 食品 ， 並進行 微生物 學或化 學檢驗 。 微生物 學檢驗 項目 包括 沙門氏菌屬 、 金黃色 葡萄球菌 和 蠟樣 芽孢 桿菌 ； 化學 檢驗項 目則 包括 黃 曲霉 毒素 B1 、 防腐 劑及 重金 屬等 。 根據 化驗 結果 ， 所有 樣本 均 未見 異常 。         籲業界嚴 遵標準         市政 署 提醒 食品 業界 ， 應向 可靠 的 供應 商選取 貨源 ， 保存 來 貨及 銷售 記錄 ， 以便 在 有 需要 時 追查 來源 ； 製 作 食品 前須 確保 原材料 安全 衛生 ， 並嚴格 遵守 食品安全 標準 ， 避免 超範圍 、 超劑 量 使用 食品 添加 劑 ； 須將 食品 及 食材 妥善 包好 及 貯存 於 適當 溫度 下 。 同時 ， 提醒 居民 購買 賀年 食品 時應 留意 食品 的 食用 期限 及 貯存 方法 ， 如散裝 的 糖蓮子 、 果仁 及 瓜子 ， 應 注意 食品容器 是否 清潔 及 店 舖 員工 的 個 人衛生 情況 ； 選購 時 留意 食品 色澤 ， 以 自然 為 要 ， 避免 選購 色澤過 於 鮮艷 或亮 白 的 食品 。         網購 食品 受 監管         近年 網購 越 趨 流行 ， 市政 署特別 提醒 食品 業界 ， 根據 《 食品 安全法 》 ， 不論 以 何種 形式 進行 食品 的 生產 經營 ， 均 受 法律 監管 。 在 本地 從事 網購 、 代購 食品 經營 活動屬 市政 署恆常 監察範圍 ， 業者 必須 配合 巡查 、 抽檢及 按照 相關 標準 與 指引 生產 經營 。 消費者 網購 食品 亦 要 格外 留神 ， 尤其 是 一些 預 製 即食 賀年 食品 如 年糕 等 ， 下單 前須 了解 配送 及 貯存 條件 等 情況 ， 保障 食用 安全 。,2025-01-24
譚司：積極回應居民關切,運輸工務範疇一行訪京晤夏寶龍    譚司：積極回應居民關切    【本報消息】運輸工務司司長辦公室訊：為積極融入國家發展大局，致力推動澳門高質量發展，運輸工務司司長譚偉文於本月廿一至廿三日期間率團前往北京，就城市建設、可持續發展、區域合作等議題，拜訪中央相關部委進行交流並聽取指導意見。中央港澳工作辦公室、國務院港澳事務辦公室主任夏寶龍昨日在京會見譚偉文一行，中央港澳工作辦公室、國務院港澳事務辦公室分管日常工作的副主任周霽參加會見。    譚偉文向夏寶龍匯報了運輸工務範疇推進落實國家主席習近平對澳門特區發展建設提出的“三點期許”，以及對新一屆政府提出的“四點希望”的跟進情況，在行政長官的領導下，將全力結合發展需要和市民需求，加強交通、能源、環保、信息、城市安全等公共基礎設施建設，改善市民生活環境，提升市民生活質量，積極回應市民所關切的議題。    訪部委商環保合作    譚偉文亦率團拜訪國家生態環境部，按照澳門特別行政區政府與國家生態環境部已簽訂的《內地與澳門特別行政區環境保護合作安排》，舉行了第三次部際聯繫工作會議，以總結並推動各項環保合作計劃及措施，配合國家落實“雙碳”目標。    代表團成員包括公共建設局長林煒浩、海事及水務局長黃穗文、環境保護局長葉擴林、運輸工務司司長辦公室顧問阮燕蓮等。,http://www.macaodaily.com/html/2025-01/24/content_1809291.htm,運輸工務範疇一行訪京晤夏寶龍    譚司：積極回應居民關切    【本報消息】運輸工務司司長辦公室訊：為積極融入國家發展大局，致力推動澳門高質量發展，運輸工務司司長譚偉文於本月廿一至廿三日期間率團前往北京，就城市建設、可持續發展、區域合作等議題，拜訪中央相關部委進行交流並聽取指導意見,運輸 工務範疇 一行 訪京晤 夏寶龍         譚司 ： 積極 回應 居民 關切         【 本報 消息 】 運輸 工務司 司長 辦 公室 訊 ： 為 積極 融入 國家 發展 大局 ， 致力 推動 澳門 高質量 發展 ， 運輸 工務司 司長 譚偉文 於 本月 廿一 至 廿三 日期 間 率團 前往 北京 ， 就 城市 建設 、 可持續 發展 、 區域 合作 等 議題 ， 拜訪 中央 相關 部委 進行 交流 並聽取 指導 意見 。 中央 港澳 工作 辦 公室 、 國務院 港澳 事務 辦公 室主任 夏寶龍 昨日 在 京會 見 譚偉文 一行 ， 中央 港澳 工作 辦 公室 、 國務院 港澳 事務辦 公室 分管 日常 工作 的 副 主任 周霽 參加會 見 。         譚偉文 向 夏寶龍 匯報 了 運輸 工務範疇 推進 落 實國家 主席 習近 平對 澳門 特區 發展 建設 提出 的 “ 三點 期許 ” ， 以及 對 新 一屆 政府 提出 的 “ 四點 希望 ” 的 跟 進情況 ， 在 行政 長 官 的 領導下 ， 將 全力 結合 發展 需要 和 市民 需求 ， 加強 交通 、 能源 、 環保 、 信息 、 城市 安全 等 公共 基礎 設施 建設 ， 改善 市民 生活 環境 ， 提升 市民 生活 質量 ， 積極 回應 市民 所關切 的 議題 。         訪 部委 商環保 合作         譚偉 文亦率 團拜 訪國家 生態 環境部 ， 按照 澳門 特別 行政 區 政府 與 國家 生態 環境部 已 簽訂 的 《 內地 與 澳門 特別 行政 區環境 保護 合作 安排 》 ， 舉行 了 第三次 部際 聯 繫 工作 會議 ， 以 總 結並 推動 各項 環保 合作 計劃 及 措施 ， 配合 國家 落實 “ 雙碳 ” 目標 。         代表 團成員 包括 公共 建設 局長 林煒浩 、 海事 及 水務局 長 黃 穗文 、 環境 保護 局長 葉 擴林 、 運輸 工務司 司長 辦 公室 顧問 阮燕蓮 等 。,2025-01-24
迎春花車,迎春花車    今年新春花車匯演共有十七輛不同造型花車參與，多輛花車正在起步點附近“妝扮”。      周維勤   攝,http://www.macaodaily.com/html/2025-01/24/content_1809292.htm,迎春花車    今年新春花車匯演共有十七輛不同造型花車參與，多輛花車正在起步點附近“妝扮”,迎春花 車         今年 新春 花車 匯演 共有 十七 輛 不同 造型 花車 參 與 ， 多輛 花車 正在 起步 點 附近 “ 妝扮 ” 。             周維勤       攝,2025-01-24
