Title,Content,Link,Summary,Preprocessed_Content,Date
夏：集中精力拼經濟,冀港澳牢記習主席囑託    不斷打開發展新天地    夏：集中精力拼經濟    【本報消息】國務院港澳辦訊：一月九日上午，全國港澳研究會在北京舉行“學習貫徹習近平主席在慶祝澳門回歸祖國二十五周年大會暨澳門特別行政區第六屆政府就職典禮上重要講話精神”專題研討會。中共中央港澳工作辦公室、國務院港澳事務辦公室主任夏寶龍出席研討會並致辭。    “一國兩制”里程碑    夏寶龍表示，習近平主席出席慶祝澳門回歸祖國二十五周年大會暨澳門特別行政區第六屆政府就職典禮，並視察澳門特別行政區，極大增強了港澳和國際社會對“一國兩制”制度優勢和發展前景的信心，極大鼓舞了澳門新一屆特別行政區政府打開發展新天地、不斷創造新輝煌的鬥志，極大激發了港澳社會各界推動香港、澳門實現更好發展，爲強國建設、民族復興作出更大貢獻的豪情壯志。習近平主席發表的重要講話，高度肯定具有澳門特色的“一國兩制”成功實踐，深刻總結“一國兩制”實踐經驗，科學擘畫“一國兩制”事業發展藍圖，向世界莊嚴宣示全面準確、堅定不移貫徹“一國兩制”方針的堅定立場，爲香港、澳門未來發展領航指向，爲做好當前和今後一個時期港澳工作提供了根本遵循和行動指南，在“一國兩制”發展進程中具有重要里程碑意義。    好制度須長期堅持    夏寶龍表示，習近平主席重要講話回望澳門滄桑巨變，用“一國兩制”實踐取得的輝煌成就，向世人雄辯證明“一國兩制”這一好制度具有強大生命力。習近平主席強調，“澳門回歸祖國以來取得的輝煌成就向世人證明，‘一國兩制’具有顯著制度優勢和強大生命力，是保持香港、澳門長期繁榮穩定的好制度，是服務強國建設、民族復興偉業的好制度，是實現不同社會制度和平共處、合作共贏的好制度，必須長期堅持”。我們要深刻領會其精神實質和豐富內涵。這一好制度好就好在，符合香港、澳門的根本利益，得到香港、澳門居民衷心擁護；符合國家、民族根本利益，得到十四億多祖國人民鼎力支持；符合各國投資者的利益，得到國際社會普遍贊同。    貢獻人類政治文明    夏寶龍表示，習近平主席重要講話立足宏闊的時空經緯，鮮明提出“一國兩制”蘊含的和平、包容、開放、共享的價值理念，極大彰顯了“一國兩制”的時代意義和世界意義。習近平主席指出，“‘一國兩制’蘊含的和平、包容、開放、共享的價值理念，是中國的，也是世界的，值得共同守護。”這一重要論斷，深刻揭示了“一國兩制”的時代意義和世界意義，爲推動全球治理提供了中國智慧和中國方案，愈發彰顯“一國兩制”的感召力，是對人類政治文明的一大貢獻。“和平”，意味着以和爲貴、和諧共存，用協商對話方式解决爭端和分歧，這是“一國兩制”的題中之義。“包容”，意味着海納百川、有容乃大，充分尊重制度差異和多元特色，這是“一國兩制”的必然要求。“開放”，意味着擁抱世界、携手並進，不斷爲經濟社會發展注入新活力，這是“一國兩制”的鮮明標識。“共享”，意味着合作共贏、互利互惠，分享制度紅利和發展成果，這是“一國兩制”的實踐使然。    把握四條規律認識    夏寶龍表示，習近平主席重要講話貫通歷史、現在、未來，深刻揭示“一國兩制”的實踐規律，開闢了新時代“一國兩制”理論新境界。習近平主席重要講話在總結香港、澳門回歸以來實踐經驗的基礎上，精闢概括了繼續推進“一國兩制”實踐行穩致遠必須把握好的四條規律性認識，科學回答了“一國兩制”重大理論和實踐問題。這些重要論述，進一步豐富和發展了“一國兩制”理論體系，把對“一國兩制”實踐規律的認識和把握提升到新的歷史高度。“堅守‘一國’之本、善用‘兩制’之利”，這是推進“一國兩制”實踐必須牢牢把握的正確方向。“一國”與“兩制”是有機統一的，“一國”是“兩制”的根和本，“兩制”讓“一國”更豐富、更精彩。“維護高水平安全、推動高質量發展”，這是推進“一國兩制”實踐必須統籌好的兩件大事。    安全發展缺一不可    把安全這個頭等大事和發展這個第一要務結合起來，具有很強的現實針對性。維護安全要堅定不移，聚焦發展也要堅定不移，二者缺一不可。“發揮獨特優勢、强化內聯外通”，這是推進“一國兩制”實踐必須鞏固提升的功能作用。港澳“內聯”、“外通”兩頭都要到位，最大限度對內對外釋放“一國兩制”制度紅利，把香港、澳門國際品牌擦得更亮，在國際舞台上展現更大作爲。“弘揚核心價值、促進包容和諧”，這是推進“一國兩制”實踐必須不斷夯實的政治社會基礎。在“一國兩制”實踐中，既要弘揚愛國愛港、愛國愛澳的核心價值，又要求同存異，增進多元文化交流融合，團結一切可以團結的力量，形成更廣泛的國內外支持“一國兩制”的統一戰線。    深刻領會“三要看”    夏寶龍表示，習近平主席重要講話爲橫琴合作區發展把脈指向，對粵港澳大灣區建設具有重大指導意義，必將不斷豐富“一國兩制”事業發展的新實踐。習近平主席重要講話，專門重申開發橫琴的初心，強調“中央决定開發橫琴，目的就是促進澳門經濟適度多元發展、便利澳門居民生活就業。這個定位要把握好，不能發展一些與這個定位不一致的產業項目”。要深刻領會關於“三個要看”的重要論述（即：檢驗合作區開發建設成效要看在促進澳門經濟適度多元發展、便利澳門居民生活就業上，有沒有實實在在的舉措和成果；要看在發揮‘兩制’之利、推進兩地規則銜接和機制對接上，有沒有創造新的制度性成果；要看在以琴澳一體化推進粵港澳大灣區市場一體化建設上，有沒有發揮先行先試的作用），把握好香港、澳門在粵港澳大灣區建設中的定位和作用。要深刻領會關於銳意改革、聚力攻堅的重要論述，推動香港、澳門在粵港澳大灣區建設中展現更大作爲。要深刻領會關於保持戰略定力、堅持久久爲功的重要論述，支持香港、澳門以更加務實的舉措投身粵港澳大灣區建設。    銳意改革擔當作爲    夏寶龍表示，習近平主席重要講話明確提出新時代“一國兩制”實踐的重要使命，殷切期望特別行政區政府搶抓機遇、銳意改革、擔當作爲，對不斷開創“一國兩制”事業高質量發展新局面具有很強的現實指導作用。習近平主席重要講話，明確指出“實現香港、澳門更好發展，爲強國建設、民族復興作出更大貢獻，是新時代‘一國兩制’實踐的重要使命”。這一重要論述，在以中國式現代化全面推進強國建設、民族復興偉業的歷史卷軸上標注了“一國兩制”實踐的時代坐標，飽含着對香港、澳門的殷切期待。    主動識變應變求變    習近平主席對澳門特別行政區政府和社會各界提出“三點期許”和“四點希望”，這些重要指示精神同樣適用於香港。希望香港、澳門特別行政區政府和社會各界牢記囑託，順應時代發展潮流，主動識變應變求變，更好發揮“一國兩制”制度優勢，加強港澳兩地互學互鑒、交流合作，不斷打開香港、澳門發展新天地。要把關於推動港澳經濟發展的重要論述落到實處，集中精力拼經濟、謀發展、搞建設；要把關於提升特別行政區治理效能的重要論述落到實處，下大力氣建設高效、有爲的服務型政府；要把關於打造更高水平對外開放平台的重要論述落到實處，不斷強化香港、澳門國際化優勢和特色；要把關於維護社會祥和穩定的重要論述落到實處，必須團結凝聚社會各界力量把香港、澳門建設得更加美好。    夏寶龍最後表示，習近平主席滿懷深情的囑託一定會激勵、鼓舞全體港澳居民銳意進取、奮發有爲，爲香港、澳門飛得更高、走得更遠、實現更好發展注入強大動力。有偉大祖國作堅强後盾，有特別行政區政府和社會各界團結奮鬥，乘着強國建設、民族復興的浩蕩東風，香港、澳門一定能夠再創新輝煌、再續新傳奇。    （講話全文刋A13版）,http://www.macaodaily.com/html/2025-01/10/content_1806400.htm,“一國兩制”里程碑    夏寶龍表示，習近平主席出席慶祝澳門回歸祖國二十五周年大會暨澳門特別行政區第六屆政府就職典禮，並視察澳門特別行政區，極大增強了港澳和國際社會對“一國兩制”制度優勢和發展前景的信心，極大鼓舞了澳門新一屆特別行政區政府打開發展新天地、不斷創造新輝煌的鬥志，極大激發了港澳社會各界推動香港、澳門實現更好發展，爲強國建設、民族復興作出更大貢獻的豪情壯志,冀 港澳 牢記習 主席 囑 託         不斷 打開 發展 新天地         夏 ： 集中精力 拼經濟         【 本報 消息 】 國務院 港澳 辦訊 ： 一月 九日 上午 ， 全國 港澳 研究 會 在 北京 舉行 “ 學習 貫徹習 近平 主席 在 慶祝 澳門 回歸祖國 二十五 周年 大會 暨 澳門 特別 行政 區 第六 屆 政府 就 職典 禮上 重要 講話 精神 ” 專題 研討會 。 中共中央 港澳 工作 辦 公室 、 國務院 港澳 事務 辦公 室主任 夏寶龍 出席 研討會 並致 辭 。         “ 一國 兩制 ” 里程碑         夏寶龍 表示 ， 習近 平 主席 出席 慶祝 澳門 回歸祖國 二十五 周年 大會 暨 澳門 特別 行政 區 第六 屆 政府 就 職典禮 ， 並視察 澳門 特別 行政 區 ， 極 大增 強了 港澳 和 國際 社會 對 “ 一國 兩制 ” 制度 優勢 和 發展 前景 的 信心 ， 極大 鼓舞 了 澳門 新 一屆 特別 行政 區 政府 打開 發展 新天地 、 不斷 創造 新輝煌 的 鬥志 ， 極大 激發 了 港澳 社會 各界 推動 香港 、 澳門 實現 更好 發展 ， 爲 強國 建設 、 民族 復 興 作出 更大 貢獻 的 豪情 壯志 。 習近 平 主席 發表 的 重要 講話 ， 高度肯定 具有 澳門 特色 的 “ 一國 兩制 ” 成功 實踐 ， 深刻 總結 “ 一國 兩制 ” 實踐 經驗 ， 科學 擘畫 “ 一國 兩制 ” 事業 發展 藍圖 ， 向 世界 莊嚴 宣示 全面 準確 、 堅定 不移 貫徹 “ 一國 兩制 ” 方針 的 堅定 立場 ， 爲 香港 、 澳門 未來 發展 領航 指向 ， 爲 做好 當前 和 今後一個 時期 港澳 工作 提供 了 根本 遵循 和 行動 指南 ， 在 “ 一國 兩制 ” 發展 進程 中 具有 重要 里程碑 意義 。         好 制度 須長 期 堅持         夏寶龍 表示 ， 習近 平 主席 重要 講話 回望 澳門 滄桑 巨變 ， 用 “ 一國 兩制 ” 實踐 取得 的 輝煌 成就 ， 向 世人 雄辯 證明 “ 一國 兩制 ” 這一好 制度 具有 強大 生命力 。 習近 平 主席 強調 ， “ 澳門 回歸祖國 以來 取得 的 輝煌 成就 向 世人 證明 ， ‘ 一國 兩制 ’ 具有 顯著 制度 優勢 和 強大 生命力 ， 是 保持 香港 、 澳門長 期 繁榮 穩定 的 好 制度 ， 是 服務 強國 建設 、 民族 復 興偉業 的 好 制度 ， 是 實現 不同 社會 制度 和平 共處 、 合作 共贏 的 好 制度 ， 必須 長 期 堅持 ” 。 我們 要 深刻 領會 其 精神 實質 和 豐富 內涵 。 這一好 制度 好 就 好 在 ， 符合 香港 、 澳門 的 根本利益 ， 得到 香港 、 澳門 居民 衷心 擁護 ； 符合 國家 、 民族 根本利益 ， 得到 十四 億多 祖國 人民 鼎力支持 ； 符合 各國 投資者 的 利益 ， 得到 國際 社會 普遍 贊同 。         貢獻人類 政治文明         夏寶龍 表示 ， 習近 平 主席 重要 講話 立足 宏闊 的 時空 經緯 ， 鮮明 提出 “ 一國 兩制 ” 蘊含 的 和平 、 包容 、 開放 、 共享 的 價值 理念 ， 極大彰 顯 了 “ 一國 兩制 ” 的 時代意 義和 世界 意義 。 習近 平 主席 指出 ， “ ‘ 一國 兩制 ’ 蘊含 的 和平 、 包容 、 開放 、 共享 的 價值 理念 ， 是 中國 的 ， 也 是 世界 的 ， 值得 共同 守護 。 ” 這一 重要 論斷 ， 深刻 揭示 了 “ 一國 兩制 ” 的 時代意 義和 世界 意義 ， 爲 推動 全球 治理 提供 了 中國 智慧 和 中國 方案 ， 愈 發彰顯 “ 一國 兩制 ” 的 感召力 ， 是 對 人類 政治文明 的 一大 貢獻 。 “ 和平 ” ， 意味着 以 和 爲 貴 、 和諧 共存 ， 用協商 對 話 方式 解决 爭端 和 分歧 ， 這是 “ 一國 兩制 ” 的 題 中之義 。 “ 包容 ” ， 意味着 海納 百川 、 有容乃大 ， 充分 尊重 制度 差異 和 多元 特色 ， 這是 “ 一國 兩制 ” 的 必然 要求 。 “ 開放 ” ， 意味着 擁抱 世界 、 携手 並進 ， 不斷 爲 經濟 社會 發展 注入 新 活力 ， 這是 “ 一國 兩制 ” 的 鮮明 標識 。 “ 共享 ” ， 意味着 合作 共贏 、 互利互惠 ， 分享 制度 紅利 和 發展 成果 ， 這是 “ 一國 兩制 ” 的 實踐 使然 。         把握 四條 規律 認識         夏寶龍 表示 ， 習近 平 主席 重要 講話 貫通 歷史 、 現在 、 未來 ， 深刻 揭示 “ 一國 兩制 ” 的 實踐 規律 ， 開闢 了 新 時代 “ 一國 兩制 ” 理論 新 境界 。 習近 平 主席 重要 講話 在 總結 香港 、 澳門 回歸 以來 實踐 經驗 的 基礎 上 ， 精闢 概括 了 繼續 推進 “ 一國 兩制 ” 實踐行 穩致 遠 必須 把握 好 的 四條 規律性 認識 ， 科學 回答 了 “ 一國 兩制 ” 重大 理論 和 實踐 問題 。 這些 重要 論述 ， 進 一步 豐富 和 發展 了 “ 一國 兩制 ” 理論 體系 ， 把 對 “ 一國 兩制 ” 實踐 規律 的 認識 和 把握 提升 到 新 的 歷史 高度 。 “ 堅守 ‘ 一國 ’ 之 本 、 善用 ‘ 兩制 ’ 之 利 ” ， 這是 推進 “ 一國 兩制 ” 實踐 必須 牢牢 把握 的 正確 方向 。 “ 一國 ” 與 “ 兩制 ” 是 有 機統 一 的 ， “ 一國 ” 是 “ 兩制 ” 的 根和本 ， “ 兩制 ” 讓 “ 一國 ” 更 豐富 、 更 精彩 。 “ 維護 高水平 安全 、 推動 高質量 發展 ” ， 這是 推進 “ 一國 兩制 ” 實踐 必須 統籌 好 的 兩件 大事 。         安全 發展 缺一不可         把 安全 這個頭 等 大事 和 發展 這個 第一 要務 結合 起來 ， 具有 很強 的 現實針 對性 。 維護 安全 要 堅定 不移 ， 聚焦 發展 也 要 堅定 不移 ， 二者 缺一不可 。 “ 發揮 獨特 優勢 、 强化 內聯 外通 ” ， 這是 推進 “ 一國 兩制 ” 實踐 必須 鞏固 提升 的 功能 作用 。 港澳 “ 內聯 ” 、 “ 外通 ” 兩頭 都 要 到位 ， 最大 限度 對 內 對 外釋 放 “ 一國 兩制 ” 制度 紅利 ， 把 香港 、 澳門 國際 品牌 擦 得 更亮 ， 在 國際 舞台 上展現 更 大作 爲 。 “ 弘揚 核心 價值 、 促進 包容 和諧 ” ， 這是 推進 “ 一國 兩制 ” 實踐 必須 不斷 夯實 的 政治 社會 基礎 。 在 “ 一國 兩制 ” 實踐 中 ， 既要 弘揚 愛國 愛港 、 愛國 愛澳 的 核心 價值 ， 又 要求 同存異 ， 增進 多元 文化交流 融合 ， 團結 一切 可以 團結 的 力量 ， 形成 更廣泛 的 國內外 支持 “ 一國 兩制 ” 的 統一戰線 。         深刻 領會 “ 三要 看 ”         夏寶龍 表示 ， 習近 平 主席 重要 講話 爲 橫琴 合作 區發展 把 脈 指向 ， 對粵 港澳 大灣區 建設 具有 重大 指導 意義 ， 必將 不斷 豐富 “ 一國 兩制 ” 事業 發展 的 新 實踐 。 習近 平 主席 重要 講話 ， 專門 重申 開發 橫琴 的 初心 ， 強調 “ 中央 决定 開發 橫琴 ， 目的 就是 促進 澳門 經濟 適度 多元 發展 、 便利 澳門 居民 生活 就業 。 這個 定位 要 把握 好 ， 不能 發展 一些 與 這個 定位 不 一致 的 產業 項目 ” 。 要 深刻 領會關 於 “ 三個 要 看 ” 的 重要 論述 （ 即 ： 檢驗 合作 區開 發建設 成效 要 看 在 促進 澳門 經濟 適度 多元 發展 、 便利 澳門 居民 生活 就業 上 ， 有 沒 有 實實 在 在 的 舉措 和 成果 ； 要 看 在 發揮 ‘ 兩制 ’ 之 利 、 推進 兩地 規則 銜接 和 機制 對 接上 ， 有 沒 有 創造 新 的 制度性 成果 ； 要 看 在 以琴 澳一體化 推進粵 港澳 大灣區 市場 一體化 建設 上 ， 有 沒 有 發揮 先行 先試 的 作用 ） ， 把握 好 香港 、 澳門 在粵 港澳 大灣區 建設 中 的 定位 和 作用 。 要 深刻 領會關 於 銳意 改革 、 聚 力攻 堅的 重要 論述 ， 推動 香港 、 澳門 在粵 港澳 大灣區 建設 中展現 更 大作 爲 。 要 深刻 領會關 於 保持 戰略 定力 、 堅 持久 久 爲 功 的 重要 論述 ， 支持 香港 、 澳門 以 更加 務實 的 舉措 投身 粵 港澳 大灣區 建設 。         銳意 改革 擔當作 爲         夏寶龍 表示 ， 習近 平 主席 重要 講話 明確 提出 新時代 “ 一國 兩制 ” 實踐 的 重要 使命 ， 殷切期望 特別 行政 區 政府 搶 抓 機遇 、 銳意 改革 、 擔當作 爲 ， 對 不斷 開創 “ 一國 兩制 ” 事業 高質量 發展 新 局面 具有 很強 的 現實 指導 作用 。 習近 平 主席 重要 講話 ， 明確 指出 “ 實現 香港 、 澳門 更好 發展 ， 爲 強國 建設 、 民族 復 興 作出 更大 貢獻 ， 是 新 時代 ‘ 一國 兩制 ’ 實踐 的 重要 使命 ” 。 這一 重要 論述 ， 在 以 中國式 現代化 全面 推進 強國 建設 、 民族 復 興偉業 的 歷史 卷軸上 標注 了 “ 一國 兩制 ” 實踐 的 時代 坐標 ， 飽含 着 對 香港 、 澳門 的 殷切 期待 。         主動識 變應 變求 變         習近 平 主席 對 澳門 特別 行政 區 政府 和 社會 各界 提出 “ 三點 期許 ” 和 “ 四點 希望 ” ， 這些 重要 指示精神 同樣 適用 於 香港 。 希望 香港 、 澳門 特別 行政 區 政府 和 社會 各界 牢記囑 託 ， 順應 時代 發展 潮流 ， 主動識 變應 變求 變 ， 更好 發揮 “ 一國 兩制 ” 制度 優勢 ， 加強 港澳 兩地 互學互 鑒 、 交流 合作 ， 不斷 打開 香港 、 澳門 發展 新天地 。 要 把關 於 推動 港澳 經濟 發展 的 重要 論述 落到 實處 ， 集中精力 拼經濟 、 謀發展 、 搞 建設 ； 要 把關 於 提升 特別 行政 區 治理 效能 的 重要 論述 落到 實處 ， 下大力 氣建設 高效 、 有 爲 的 服務型 政府 ； 要 把關 於 打造 更 高水平 對外 開放 平台 的 重要 論述 落到 實處 ， 不斷 強化 香港 、 澳門 國際化 優勢 和 特色 ； 要 把關 於 維護 社會 祥和 穩定 的 重要 論述 落到 實處 ， 必須 團結 凝聚 社會 各界 力量 把 香港 、 澳門 建設 得 更加 美好 。         夏寶龍 最 後 表示 ， 習近 平 主席 滿懷 深情 的 囑 託 一定 會 激勵 、 鼓舞 全體 港澳 居民 銳意 進取 、 奮發 有 爲 ， 爲 香港 、 澳門 飛得 更 高 、 走 得 更 遠 、 實現 更好 發展 注入 強大動力 。 有偉大 祖國作 堅强後盾 ， 有 特別 行政 區 政府 和 社會 各界 團結 奮鬥 ， 乘着 強國 建設 、 民族 復 興 的 浩 蕩 東風 ， 香港 、 澳門 一定 能夠 再 創新輝煌 、 再續 新 傳奇 。         （ 講話 全文 刋 A13 版 ）,2025-01-10
