Title,Content,Link,Summary,Preprocessed_Content,Date
西藏定日強震126死,西藏定日強震126死    【本報綜合報道】據新華社、中新社拉薩七日電：一月七日九時五分，西藏自治區日喀則市定日縣措果鄉附近（東經八十七點四五度，北緯二十八點五度）發生六點八級地震。日喀則市官方最新消息稱，定日縣地震已造成一百二十六人遇難、一百八十八人受傷，廿八名重症人員轉移到市人民醫院救治；倒塌房屋三千六百○九戶。    藏啟二級響應機制    中國西藏日喀則市定日縣“一·○七”地震受災救援工作新聞發佈會七日進行，發佈會現場，全體人員起立，向遇難人員默哀。    西藏自治區已迅速啟動二級響應機制，全力投入到抗震救災工作中。自治區主要領導親自帶隊趕赴震區，指導救援行動。    日喀則地震發生後，西藏軍區迅速啟動應急預案，派出前進指揮組前往災區，組織兵力展開救援。    七日九時五分，西藏自治區日喀則市定日縣發生六點八級地震，震中位於定日縣措果鄉，震中二十公里範圍內人口數約六千九百人，震中二十公里範圍內有三個鄉（鎮、街道）駐地、廿七個村。    據地震監測數據顯示，截至七日十二時，共記錄到餘震四十九次。    遊客跑出酒店避險    此次地震影響鄉鎮有定日縣措果鄉、曲洛鄉、長所鄉、尼轄鄉、加措鄉、協格爾鎮，定結縣郭加鄉、江嘎鎮，薩迦縣雄麥鄉，拉孜縣曲下鎮、查務鄉、芒普鄉、錫欽鄉、拉孜鎮。    定日縣居民拉巴平措介紹，地震發生後當地民眾紛紛出門避險。他看到有房子開裂，在縣城廣場還感覺到很多餘震。    定日縣扎西宗鄉是中國境內距離世界第一高峰珠峰山體最近的行政鄉。有入住在定日縣扎西宗鄉酒店的遊客表示，地震發生時震感強烈，有遊客裹着大衣跑出酒店避險。    珠峰景區暫停開放    此外，目前定日縣措果鄉、長所鄉、曲洛鄉三地受地震影響，信號暫時中斷，定日縣其他城區信號未受影響。中國移動已啟動應急預案，出動應急搶險隊伍攜帶搶險物資奔赴震中地區開展抗震救災通信保障工作。    多位定日縣內酒店的工作人員告訴媒體，珠峰景區位於定日縣境內，但一般在八月到十月旅遊旺季遊客才比較多，目前是淡季，遊客數量較少。據悉，為了保障遊客及工作人員生命財產安全，珠峰景區於七日十時開始暫停對外開放，開放時間另行通知。    尼泊爾有明顯震感    此次地震，與西藏毗鄰的尼泊爾亦有震感。地震發生時，記者在加德滿都居住房屋地面明顯晃動，屋內窗框門框等吱吱作響，記者感覺到明顯眩暈感。震感持續約兩至三分鐘，部分當地民眾從屋內至街上避險。,http://www.macaodaily.com/html/2025-01/08/content_1805929.htm,藏啟二級響應機制    中國西藏日喀則市定日縣“一·○七”地震受災救援工作新聞發佈會七日進行，發佈會現場，全體人員起立，向遇難人員默哀,西藏 定日 強震 126 死         【 本報 綜合 報道 】 據 新華社 、 中新社 拉薩 七日 電 ： 一月 七日 九時 五分 ， 西藏自治 區日 喀則 市 定日 縣 措果 鄉 附近 （ 東經 八十七 點 四五 度 ， 北緯 二十八 點 五度 ） 發生 六點 八級 地震 。 日喀則 市 官方 最新消息 稱 ， 定日 縣 地震 已 造成 一百二十六 人遇 難 、 一百八十 八人 受傷 ， 廿八 名 重症 人員 轉移 到 市 人民 醫院 救治 ； 倒塌 房屋 三千六百 ○ 九戶 。         藏 啟二級 響應 機制         中國 西藏 日喀則 市 定日 縣 “ 一 · ○ 七 ” 地震 受災 救援 工作 新聞發 佈 會 七日 進行 ， 發 佈 會 現場 ， 全體 人員 起立 ， 向 遇難 人員 默哀 。         西藏自治 區已 迅速 啟動二級 響應 機制 ， 全力 投入 到 抗震 救災 工作 中 。 自治 區 主要 領導親 自帶隊 趕 赴 震區 ， 指導 救援 行動 。         日喀則 地震 發生 後 ， 西藏 軍區 迅速 啟動 應急 預案 ， 派出 前進 指揮組 前往 災區 ， 組織 兵力 展開 救援 。         七日 九時 五分 ， 西藏自治 區日 喀則 市 定日 縣發 生六點 八級 地震 ， 震中 位 於 定日 縣 措果 鄉 ， 震中 二十公里 範圍 內 人口 數約 六千 九百 人 ， 震中 二十公里 範圍 內 有 三個 鄉 （ 鎮 、 街道 ） 駐地 、 廿七 個村 。         據 地震 監測 數據 顯示 ， 截至 七日 十二 時 ， 共記錄 到 餘震 四十九 次 。         遊客 跑 出 酒店 避險         此次 地震 影響 鄉鎮 有 定日 縣 措果 鄉 、 曲洛鄉 、 長 所 鄉 、 尼轄鄉 、 加措 鄉 、 協格爾鎮 ， 定 結縣 郭加 鄉 、 江嘎鎮 ， 薩迦縣 雄麥 鄉 ， 拉孜 縣曲 下鎮 、 查務鄉 、 芒 普鄉 、 錫欽鄉 、 拉孜 鎮 。         定日 縣 居民 拉巴 平措 介紹 ， 地震 發生後當 地民眾 紛紛 出門 避險 。 他 看到 有 房子 開裂 ， 在 縣 城廣場 還感覺 到 很多 餘震 。         定日 縣 扎西 宗鄉 是 中國境 內 距離 世界 第一 高峰 珠峰 山體 最近 的 行政 鄉 。 有 入住 在 定日 縣 扎西 宗鄉 酒店 的 遊客 表示 ， 地震 發生 時 震感 強烈 ， 有遊客 裹 着 大衣 跑 出 酒店 避險 。         珠峰 景區 暫停 開放         此外 ， 目前 定日 縣 措果 鄉 、 長 所 鄉 、 曲洛鄉 三地 受 地震 影響 ， 信號 暫時 中斷 ， 定日 縣 其他 城區 信號 未受 影響 。 中國 移動 已 啟動 應急 預案 ， 出動 應急 搶險 隊伍 攜帶 搶險 物資 奔赴 震中 地區 開展 抗震 救災 通信 保障 工作 。         多位 定日 縣內 酒店 的 工作 人員 告訴 媒體 ， 珠峰 景區位 於 定日 縣境 內 ， 但 一般 在 八月 到 十月 旅遊 旺季 遊客 才 比 較 多 ， 目前 是 淡季 ， 遊客 數量 較 少 。 據悉 ， 為 了 保障 遊客 及 工作 人員 生命 財產 安全 ， 珠峰 景區 於 七日 十時 開始 暫停 對外 開放 ， 開放 時間 另行通知 。         尼泊爾有 明顯 震感         此次 地震 ， 與 西藏 毗鄰 的 尼泊爾 亦 有 震感 。 地震 發生 時 ， 記者 在 加德 滿 都 居住 房屋 地面 明顯晃動 ， 屋內 窗框 門框 等 吱吱 作響 ， 記者 感覺 到 明顯 眩暈感 。 震感 持續 約 兩至 三分 鐘 ， 部分 當地民眾 從 屋內 至 街上 避險 。,2025-01-08
習：最大限度減人員傷亡,習：最大限度減人員傷亡    【本報綜合報道】據新華社北京七日電：北京時間一月七日九時五分，西藏日喀則市定日縣發生六點八級地震，造成重大人員傷亡，大量房屋倒塌。    地震發生後，中共中央總書記、國家主席、中央軍委主席習近平高度重視並作出重要指示。    習近平指出，西藏日喀則市定日縣發生六點八級地震，造成重大人員傷亡。要全力開展人員搜救，全力救治受傷人員，最大限度減少人員傷亡，防止發生次生災害，妥善安置受災群眾，做好善後等工作。要加強震情監測預警，及時調撥搶險救援物資，抓緊搶修損毀基礎設施，安排好群眾基本生活，確保安全溫暖過冬。    李強批示    中共中央政治局常委、國務院總理李強作出批示指出，要抓緊核實災情和人員傷亡情況，全力以赴組織搶險救援，並加強震情監測，防範各類次生災害，盡最大努力減少傷亡。地震災區位於高原高寒地區，正值冬季，要千方百計保障災區群眾基本生活和溫暖過冬。    根據習近平重要指示以及李強要求，中共中央政治局委員、國務院副總理張國清率有關部門負責同志趕赴現場指導救援處置工作，國務院抗震救災指揮部辦公室、應急管理部啟動國家地震三級應急響應，西藏自治區組織力量全力開展搶險救災，妥善安置受災群眾。抗震救災各項工作正在緊張有序進行。    多國慰問    據悉，俄羅斯、巴基斯坦、韓國、丹麥等向中方表示慰問。    俄羅斯克里姆林宮官網七日消息，俄羅斯總統普京就中國西藏日喀則市定日縣地震向中方表示慰問。普京說，俄方與在這場自然災害中失去至親的人一樣悲痛，並希望所有受影響的民眾早日康復。,http://www.macaodaily.com/html/2025-01/08/content_1805930.htm,根據習近平重要指示以及李強要求，中共中央政治局委員、國務院副總理張國清率有關部門負責同志趕赴現場指導救援處置工作，國務院抗震救災指揮部辦公室、應急管理部啟動國家地震三級應急響應，西藏自治區組織力量全力開展搶險救災，妥善安置受災群眾,習 ： 最大 限度 減人員 傷亡         【 本報 綜合 報道 】 據 新華社 北京 七日 電 ： 北京 時間 一月 七日 九時 五分 ， 西藏 日喀則 市 定日 縣發 生六點 八級 地震 ， 造成 重大 人員 傷亡 ， 大量 房屋 倒塌 。         地震 發生 後 ， 中共中央 總書記 、 國家 主席 、 中央 軍委 主席 習近 平 高度 重視並 作出 重要 指示 。         習近 平 指出 ， 西藏 日喀則 市 定日 縣發 生六點 八級 地震 ， 造成 重大 人員 傷亡 。 要 全力 開展 人員 搜救 ， 全力 救治 受傷 人員 ， 最大 限度 減少 人員 傷亡 ， 防止 發生 次生 災害 ， 妥善安置 受災 群眾 ， 做好 善後等 工作 。 要 加強 震情 監測 預警 ， 及時 調撥 搶險 救援 物資 ， 抓緊 搶修 損毀 基礎 設施 ， 安排 好 群眾 基本 生活 ， 確保 安全 溫暖過 冬 。         李強 批示         中共 中央政治局常委 、 國務院 總理 李強 作出 批示 指出 ， 要 抓 緊核 實災情 和 人員 傷亡 情況 ， 全力以赴 組織 搶險 救援 ， 並加強 震情 監測 ， 防範 各類 次生 災害 ， 盡 最大 努力 減少 傷亡 。 地震 災區位 於 高原 高寒 地區 ， 正值 冬季 ， 要 千方 百計 保障 災區 群眾 基本 生活 和 溫暖過 冬 。         根據習 近平 重要 指示 以及 李強 要求 ， 中共中央政治局 委員 、 國務院 副 總理 張國 清率 有 關部門 負責 同志 趕赴 現場 指導 救援 處置 工作 ， 國務院 抗震 救災 指揮部 辦 公室 、 應急 管理部 啟動 國家 地震 三級 應急響 應 ， 西藏自治 區組織 力量 全力 開展 搶險 救災 ， 妥善安置 受災 群眾 。 抗震 救災 各項 工作 正在 緊張 有序 進行 。         多國 慰問         據悉 ， 俄羅斯 、 巴基斯坦 、 韓國 、 丹麥 等 向 中方 表示 慰問 。         俄羅斯 克里姆林 宮官網 七日 消息 ， 俄羅斯 總統 普京 就 中國 西藏 日喀則 市 定日 縣 地震 向 中方 表示 慰問 。 普京 說 ， 俄方 與 在 這場 自然 災害 中 失去 至親 的 人 一樣 悲痛 ， 並 希望 所有 受影響 的 民眾 早日 康 復 。,2025-01-08
岑：願盡力提供支援,致函慰問西藏受災同胞    岑：願盡力提供支援    【本報消息】新聞局訊：行政長官岑浩輝昨致函西藏自治區黨委書記王君正及西藏自治區人民政府代理主席嘎瑪澤登，對西藏日喀則市定日縣發生六點八級地震，造成重大人員傷亡和大量房屋倒塌表示深切的慰問。全文如下：    西藏日喀則市定日縣於一月七日清晨發生強烈地震，造成人員傷亡與房屋倒塌，我代表澳門特別行政區政府及全體居民，向受災同胞致以深切的慰問。我們與你們一同哀悼罹難者，並關心所有受影響的同胞。    地震發生後，中共中央總書記、國家主席習近平高度重視並作出重要指示，中共中央政治局常委、國務院總理李強作出批示，副總理張國清率領工作組趕往災區，現場指導救援處置工作。西藏自治區組織力量全力投入搶險救災，我們相信在中央政府的領導下，災區幹部和民眾同心協力，定能度過難關。    澳門同胞心繫災區，血濃於水，願與內地同胞共同面對這場自然災害，我們願盡力提供必要支援，積極支持各項救援工作。    祝願救援工作順利，災區人民的生活早日復常，平安度過冬季。,http://www.macaodaily.com/html/2025-01/08/content_1805931.htm,致函慰問西藏受災同胞    岑：願盡力提供支援    【本報消息】新聞局訊：行政長官岑浩輝昨致函西藏自治區黨委書記王君正及西藏自治區人民政府代理主席嘎瑪澤登，對西藏日喀則市定日縣發生六點八級地震，造成重大人員傷亡和大量房屋倒塌表示深切的慰問,致函 慰問 西藏 受災 同胞         岑 ： 願盡力 提供支援         【 本報 消息 】 新聞局 訊 ： 行政 長 官 岑浩輝 昨 致函 西藏自治 區黨 委書記 王君 正及 西藏自治 區 人民政府 代理 主席 嘎瑪澤登 ， 對 西藏 日喀則 市 定日 縣發 生六點 八級 地震 ， 造成 重大 人員 傷亡 和 大量 房屋 倒塌 表示 深切 的 慰問 。 全文如下 ：         西藏 日喀則 市 定日 縣 於 一月 七日 清晨 發生 強烈 地震 ， 造成 人員 傷亡 與 房屋 倒塌 ， 我 代表 澳門 特別 行政 區 政府 及 全體 居民 ， 向 受災 同胞 致以 深切 的 慰問 。 我們 與 你 們 一同 哀悼 罹難者 ， 並關心 所有 受影響 的 同胞 。         地震 發生 後 ， 中共中央 總書記 、 國家 主席 習近 平 高度 重視並 作出 重要 指示 ， 中共 中央政治局常委 、 國務院 總理 李強 作出 批示 ， 副 總理 張國清 率領 工作 組趕 往 災區 ， 現場 指導 救援 處置 工作 。 西藏自治 區組織 力量 全力 投入 搶險 救災 ， 我們 相信 在 中央政府 的 領導下 ， 災區 幹部 和 民眾 同心 協力 ， 定能度 過難關 。         澳門 同胞 心 繫 災 區 ， 血濃 於 水 ， 願 與 內 地 同胞 共同 面對 這場 自然 災害 ， 我們 願 盡力 提供 必要 支援 ， 積極 支持 各項 救援 工作 。         祝願 救援 工作 順利 ， 災區 人民 的 生活 早日 復 常 ， 平安 度過 冬季 。,2025-01-08
澳紅會廿萬緊急援災區,澳紅會廿萬緊急援災區    【本報消息】一月七日，西藏日喀則市定日縣遭遇六點八級強烈地震，震中周邊二百公里內為近五年來最大烈度的地震。澳門紅十字會對災情迅速反應，向當地紅十字會了解災情，立即在賑災基金調撥人民幣二十萬元匯去災區以支援緊急救援工作，送上澳門人民的關心和慰問。    地震發生後，中國紅十字會總會迅速啟動應急響應，緊急調撥棉帳篷、棉被、保暖衝鋒衣、折疊床等救災物資四千六百件（套），用於支持災區做好群眾轉移安置和生活保障工作，於七日下午派出工作組及救援隊員趕赴震區，現場開展災情需求評估及救援救助工作。    澳紅會迅速反應，緊急向災區匯出二十萬元人民幣作為緊急救災款，用於支援災區開展應急救援工作及採購救災物資，以解決災民燃眉之急，幫助他們度過嚴冬。    澳門紅十字會將持續關注災情動態，與西藏自治區紅十字會保持緊密溝通，隨時因應災情變化作出相應行動。,http://www.macaodaily.com/html/2025-01/08/content_1805932.htm,地震發生後，中國紅十字會總會迅速啟動應急響應，緊急調撥棉帳篷、棉被、保暖衝鋒衣、折疊床等救災物資四千六百件（套），用於支持災區做好群眾轉移安置和生活保障工作，於七日下午派出工作組及救援隊員趕赴震區，現場開展災情需求評估及救援救助工作,澳紅會 廿萬緊 急援 災區         【 本報 消息 】 一月 七日 ， 西藏 日喀則 市 定日 縣 遭遇 六點 八級 強烈 地震 ， 震中 周邊 二百 公里 內為 近 五年 來 最大 烈度 的 地震 。 澳門紅 十字 會 對 災情 迅速 反應 ， 向 當地紅 十字 會 了解 災情 ， 立即 在 賑災 基金 調撥 人民 幣 二十 萬元 匯去 災區 以 支援 緊急 救援 工作 ， 送上 澳門 人民 的 關心 和 慰問 。         地震 發生 後 ， 中國紅 十字 會 總會 迅速 啟動應 急響 應 ， 緊急調 撥 棉 帳篷 、 棉被 、 保暖 衝鋒衣 、 折疊床 等 救 災物資 四千 六百 件 （ 套 ） ， 用 於 支持 災區 做好 群眾 轉移 安置 和 生活 保障 工作 ， 於 七日 下午 派出 工作 組及 救援 隊員 趕 赴 震區 ， 現場 開展 災情 需求 評估 及 救援 救助 工作 。         澳紅會 迅速 反應 ， 緊急 向 災區 匯出 二十 萬元 人民 幣作 為 緊 急救 災款 ， 用 於 支援 災區 開展 應急 救援 工作 及 採購 救 災物資 ， 以解 決災民 燃眉之急 ， 幫助 他們 度過 嚴冬 。         澳門紅 十字 會將 持續 關注災 情動態 ， 與 西藏自治 區紅 十字 會 保持 緊密 溝通 ， 隨時 因應 災情 變化 作出 相應 行動 。,2025-01-08
大潭山隧道第三季動工,五標書競投隧道及南連接線    工期四年    大潭山隧道第三季動工    【本報消息】大潭山隧道及其連接線設計連建造工程——隧道及南連接線——預先評定資格之限制招標昨舉行第二階段公開開標。經開標程序後，全部五份標書均被接納，工程造價介乎七億九千多萬元至十一億一千多萬元。當局爭取今年第三季動工，工期約四年。    最高競價逾十一億    大潭山隧道及其連接線分兩個標段招標建設，第一標段為隧道及南連接線，第二標段為北連接線。北連接線已於上月公開開標，爭取今年第二季動工。    大潭山隧道及南連接線去年五月二十九日招標，採用預先評定資格之限制招標方式。首階段已甄選出五個具資格的競投單位進入第二階段的投標書提交階段。稍後評審及判給。    大潭山隧道及南連接線設計連建造工程——預先評定資格之限制招標昨日上午九時三十分於公共建設局會議室公開開標，五家獲邀競投者全部遞交標書。經開標程序後，全部標書被接納。工程造價介乎七億九千多萬元至十一億一千多萬元，工期為一千〇四十八個工作天至一千〇四十九個工作天（附表）。    方便半島往路氹城    公建局高級技術員馮志昌介紹工程時稱，是次工程為大潭山隧道及其連接線設計連建造工程第一期工程，包括建造大潭山隧道段、南連接線及其北端出入口。隧道段全長約六百米，為雙向四車道的穿山隧道，穿越大潭山。南連接線全長約四百米，分別連接偉龍馬路和機場大馬路，北端出入口段約一百六十米至信安馬路止。預計今年下半年動工，當局爭取第三季動工，工期約四年。    建設大潭山隧道是特區政府重要交通項目之一，建成後可直接連繫澳門大橋及路氹城之間的道路，為澳門半島往來路氹城提供快捷通道，減輕車輛因集中行駛偉龍馬路、北安大馬路、氹仔客運碼頭及機場等路段造成的交通負荷。    11標書競北連接線    公建局網站顯示，大潭山隧道及其連接線設計連建造工程——北連接線已於上月公開開標，共收到十一份標書。經開標程序後，全部標書被接納，工程造價介乎四億一千三百萬元至四億三千八百萬元，施工期均為五百四十個工作天（附表）。暫未判給。    該工程將建造行車天橋連接澳門大橋及隧道北側出入口，全長約八百九十米，為雙向四車道設計。擬建行車天橋需橫越北安多處交通要道及經過輕軌上方，最高處距離地面約二十三米。招標案卷已要求提交詳盡的施工方案，確保施工嚴謹及安全作業，減少影響周邊交通。,http://www.macaodaily.com/html/2025-01/08/content_1806018.htm,五標書競投隧道及南連接線    工期四年    大潭山隧道第三季動工    【本報消息】大潭山隧道及其連接線設計連建造工程——隧道及南連接線——預先評定資格之限制招標昨舉行第二階段公開開標,五標 書 競投 隧道 及南連 接線         工期 四年         大潭 山 隧道 第三季 動工         【 本報 消息 】 大潭 山 隧道 及其 連接線 設計連 建造 工程 — — 隧道 及南連 接線 — — 預先 評定 資格 之 限制 招標 昨舉行 第二 階段 公開 開標 。 經開標 程序 後 ， 全部 五份 標書均 被 接納 ， 工程 造價 介乎 七 億 九千多 萬元 至 十一 億 一千多 萬元 。 當局 爭取 今年 第三季 動工 ， 工期 約 四年 。         最高 競價 逾 十一 億         大潭 山 隧道 及其 連接 線分 兩個 標段 招標 建設 ， 第一 標段 為 隧道 及南連 接線 ， 第二 標段 為 北連 接線 。 北連 接線 已 於 上 月 公開 開標 ， 爭取 今年 第二季 動工 。         大潭 山 隧道 及南連 接線 去年 五月 二十九日 招標 ， 採用 預先 評定 資格 之 限制 招標 方式 。 首階段 已 甄選出 五個 具資格 的 競投 單位 進入 第二 階段 的 投標 書 提交 階段 。 稍後評 審及 判給 。         大潭 山 隧道 及南連 接線 設計連 建造 工程 — — 預先 評定 資格 之 限制 招標 昨日 上午 九時 三十分 於 公共 建設 局會 議室 公開 開標 ， 五家 獲邀 競 投者 全部 遞交標 書 。 經開標 程序 後 ， 全部 標書 被 接納 。 工程 造價 介乎 七 億 九千多 萬元 至 十一 億 一千多 萬元 ， 工期 為 一千 〇 四十八 個 工作 天至 一千 〇 四十九 個 工作 天 （ 附表 ） 。         方便 半島 往路 氹 城         公建局 高級 技術員 馮志昌 介紹 工程 時稱 ， 是 次 工程 為 大潭 山 隧道 及其 連接線 設計連 建造 工程 第一期 工程 ， 包括 建造 大潭 山 隧道 段 、 南連 接線 及其 北端 出入口 。 隧道 段 全長 約 六百米 ， 為 雙向 四車 道 的 穿山 隧道 ， 穿越 大潭 山 。 南連 接線 全長 約 四百米 ， 分別 連接 偉龍馬路 和 機場 大馬路 ， 北端 出入口 段 約 一百六十 米 至 信安馬路止 。 預計 今年 下半年 動工 ， 當局 爭取 第三季 動工 ， 工期 約 四年 。         建設 大潭 山 隧道 是 特區 政府 重要 交通 項目 之一 ， 建成 後 可 直接 連 繫 澳 門 大 橋 及 路 氹 城 之 間 的 道路 ， 為 澳門 半島 往來 路 氹 城 提供 快捷 通道 ， 減輕 車輛 因 集中 行駛偉 龍馬路 、 北安 大馬路 、 氹 仔客 運碼 頭及 機場 等 路段 造成 的 交通 負荷 。         11 標書 競北連 接線         公建局 網站 顯示 ， 大潭 山 隧道 及其 連接線 設計連 建造 工程 — — 北連 接線 已 於 上 月 公開 開標 ， 共 收到 十 一份 標書 。 經開標 程序 後 ， 全部 標書 被 接納 ， 工程 造價 介乎 四億 一千三百 萬元 至 四 億 三千八百 萬元 ， 施工期 均 為 五百四十 個 工作 天 （ 附表 ） 。 暫 未判 給 。         該 工程 將 建造 行車 天橋 連接 澳門 大橋 及 隧道 北側 出入口 ， 全長 約 八百 九十 米 ， 為 雙向 四車 道 設計 。 擬 建行 車天橋 需橫越 北安 多處 交通要道 及 經過 輕軌 上方 ， 最高 處距離 地面 約 二十三 米 。 招標 案卷 已 要求 提交 詳盡 的 施工 方案 ， 確保 施工 嚴謹 及 安全 作業 ， 減少 影響 周邊 交通 。,2025-01-08
