Title,Content,Link,Summary,Preprocessed_Content,Date
灣區首開京津冀快捷物流班列,灣區首開京津冀快捷物流班列    【本報記者廣州電】裝有糖果、枇杷膏等粵港澳大灣區優質產品的X8508次快捷物流示範班列，近日從廣鐵集團增城鐵路物流園緩緩駛出，這是粵港澳大灣區開往京津冀地區的首趟快捷物流示範班列。    粵港澳大灣區至京津冀地區開行增城西至大畢莊快捷物流示範班列，將按照旅客列車一樣進行精細化管理，具有“定時、定線、定點、定價、定編”的“五定”優勢。    該趟快捷物流示範班列將實現常態化運行，全程採取一站直達運輸模式，沿途不停站，班列運行時速最高達一百二十公里，每周三至周日各開行一列，按照班列運行圖定時間發車。據測算，快捷物流示範班列的站到站運輸時效比普通貨物列車提升百分之七十以上。    深圳市雲川物流有限公司相關負責人表示，增城西至大畢莊快捷物流示範班列一站直達，速度比以前快了，發車和到站時間都很準點，還能提前七天在鐵路九五三○六網站上提報訂艙需求，能準確預測物流時間，合理安排生產計劃和貨源組織，生產與運輸環節銜接更緊密、更可控，整個運輸過程我們心裡更有底氣。    該班列使用鐵路五十英尺大白箱裝貨，該箱最大容積相比四十英尺普通箱增加百分之五十，最大載重量提升了百分之十六，一個箱能裝更多的貨，節省更多物流成本。    廣鐵集團介紹，客戶可通過鐵路九五三○六網站查詢班列實時艙位和價格，按照“敞開受理、先到先得、訂完為止”的原則預定艙位，每個艙位明碼標價，更便於客戶進行費用核算。,http://www.macaodaily.com/html/2025-01/24/content_1809288.htm,深圳市雲川物流有限公司相關負責人表示，增城西至大畢莊快捷物流示範班列一站直達，速度比以前快了，發車和到站時間都很準點，還能提前七天在鐵路九五三○六網站上提報訂艙需求，能準確預測物流時間，合理安排生產計劃和貨源組織，生產與運輸環節銜接更緊密、更可控，整個運輸過程我們心裡更有底氣,灣區 首開 京津冀 快捷 物流 班列         【 本報 記者 廣州電 】 裝有 糖果 、 枇杷膏 等粵 港澳 大灣區 優質 產品 的 X8508 次 快捷 物流 示範 班列 ， 近日 從廣鐵 集團 增城 鐵路 物流 園緩 緩駛出 ， 這是粵 港澳 大灣區 開往 京津冀 地區 的 首趟 快捷 物流 示範 班列 。         粵 港澳 大灣區 至 京津冀 地區 開行 增 城西 至大 畢莊 快捷 物流 示範 班列 ， 將 按照 旅客 列車 一樣 進行 精細化 管理 ， 具有 “ 定時 、 定線 、 定點 、 定價 、 定編 ” 的 “ 五定 ” 優勢 。         該趟 快捷 物流 示範 班列 將實 現常態 化運行 ， 全程 採取 一站 直達 運輸 模式 ， 沿途 不停 站 ， 班列 運行 時速 最高 達 一百二十 公里 ， 每周三 至 周日 各開行 一列 ， 按照 班列 運行 圖定 時間 發車 。 據 測算 ， 快捷 物流 示範 班列 的 站 到 站 運輸 時效 比 普通 貨物 列車 提升 百分之七十 以上 。         深圳市 雲川 物流 有限公司 相關 負責人 表示 ， 增 城西 至大 畢莊 快捷 物流 示範 班列 一站 直達 ， 速度 比 以前 快 了 ， 發車 和 到 站 時間 都 很 準點 ， 還能 提前 七天 在 鐵路 九五 三 ○ 六網 站上 提報 訂艙 需求 ， 能 準確 預測 物流 時間 ， 合理安排 生產計劃 和 貨源 組織 ， 生產 與 運輸 環節 銜接 更 緊密 、 更 可控 ， 整個 運輸 過程 我們 心裡 更 有 底氣 。         該 班列 使用 鐵路 五十 英尺 大 白箱 裝貨 ， 該箱 最大 容積 相比 四十 英尺 普通 箱 增加 百分之五十 ， 最大 載 重量 提升 了 百分之十六 ， 一個 箱 能裝 更 多的貨 ， 節省 更 多 物流 成本 。         廣鐵 集團 介紹 ， 客戶 可 通過 鐵路 九五 三 ○ 六網 站 查詢 班列 實時 艙位 和 價格 ， 按照 “ 敞開 受理 、 先到 先得 、 訂 完為止 ” 的 原則 預定 艙位 ， 每個 艙位 明碼 標價 ， 更 便 於 客戶 進行 費用 核算 。,2025-01-24
珠江遊去年客量創新高,珠江遊去年客量創新高    【本報記者廣州電】廣州港務局公佈，二○二四年廣州珠江遊全年客流量超四百二十三萬人，同比增加百分之二點九一，創歷史新高。    中國經濟信息社發佈《國際都市遊船活力指數報告（二○二四）》指出，廣州珠江遊船活力指數位列全球第一，其中市場活力、品質提升、文化魅力、文旅融合、綠色低碳等重要指標均引領國際遊船發展。二○二四年廣州珠江遊精品航線被國家交通運輸部評為國內水路旅客客運精品航線典型案例。    廣州市港務局堅持綠色安全發展理念，持續開展珠江遊品質提升工程，將珠江遊老舊遊船納入大規模設施設備更新改造工作，採用“退一進一”政策加快純電動遊船建造。目前，珠江遊純電動船共十艘二千九百八十七客位，運力規模全國第一。    同時，廣州大力推動十六個客運泊位開展改擴建工作，不斷提升碼頭基礎設施功能，總投資約兩億元人民幣。目前已陸續完成海心沙東區碼頭、芳村碼頭、大沙頭碼頭等改擴建工程，市中心城區珠江遊碼頭靠泊能力提升至二千噸級。新遊船、新碼頭設施提升，為豐富珠江遊航線產品創造了有利條件。    為打造珠江遊世界級旅遊品牌，廣州市港務局以創意“廣州故事”主題航班、創新“嶺南文化”專屬航線，為珠江遊注入更多廣州元素。,http://www.macaodaily.com/html/2025-01/24/content_1809289.htm,廣州市港務局堅持綠色安全發展理念，持續開展珠江遊品質提升工程，將珠江遊老舊遊船納入大規模設施設備更新改造工作，採用“退一進一”政策加快純電動遊船建造,珠江 遊 去年 客量 創 新高         【 本報 記者 廣州電 】 廣州 港務局 公 佈 ， 二 ○ 二 四年 廣州 珠江 遊 全年 客流量 超 四百 二十三 萬人 ， 同比增加 百分之二 點九一 ， 創歷史 新高 。         中國 經濟 信息 社發 佈 《 國際 都市 遊船 活力 指數 報告 （ 二 ○ 二四 ） 》 指出 ， 廣州 珠江 遊船 活力 指數 位列 全球 第一 ， 其中 市場 活力 、 品質 提升 、 文化 魅力 、 文旅 融合 、 綠色 低 碳 等 重要 指標 均 引 領國際 遊船 發展 。 二 ○ 二 四年 廣州 珠江 遊 精品 航線 被 國家 交通 運輸部 評為 國內 水路 旅客 客運 精品 航線 典型 案例 。         廣 州市 港務局 堅持 綠色 安全 發展 理念 ， 持續 開展 珠江 遊品質 提升 工程 ， 將 珠江 遊老 舊遊 船納入 大規模 設施 設備 更新改造 工作 ， 採用 “ 退一進 一 ” 政策 加快 純電動 遊船 建造 。 目前 ， 珠江 遊純 電動 船 共 十艘 二千 九百 八十七 客位 ， 運力 規模 全國 第一 。         同時 ， 廣州 大力 推動 十六 個 客運 泊位 開展 改 擴建 工作 ， 不斷 提升 碼頭 基礎 設施 功能 ， 總 投資約 兩 億元 人民 幣 。 目前 已陸續 完成 海心 沙東區 碼頭 、 芳村 碼頭 、 大沙頭 碼頭 等 改 擴建 工程 ， 市中心 城區 珠江 遊碼頭 靠泊 能力 提升 至 二千 噸級 。 新遊船 、 新碼頭 設施 提升 ， 為 豐富 珠江 遊航線 產品 創造 了 有利 條件 。         為 打造 珠江 遊 世界 級 旅遊 品牌 ， 廣 州市 港務局 以 創意 “ 廣州 故事 ” 主題 航班 、 創新 “ 嶺南 文化 ” 專屬 航線 ， 為 珠江 遊 注入 更多 廣州 元素 。,2025-01-24
公安部長：跨境賭博零容忍,公安部長：跨境賭博零容忍    【據新華社北京一月廿三日電】全國打擊治理跨境賭博工作視頻會議廿三日召開，中共中央書記處書記、國務委員、公安部長王小洪出席並講話。    亂象得到有效遏制    王小洪指出，近年來，在以習近平同志為核心的黨中央堅強領導下，各地區、各有關部門統籌推進打擊治理各項措施落實，防控治理體系不斷完善，跨境賭博亂象得到有效遏制。    打防並舉多管齊下    王小洪強調，要以習近平新時代中國特色社會主義思想為指導，全面貫徹黨的二十大和二十屆二中、三中全會精神，深入貫徹落實黨中央決策部署，進一步提高政治站位，準確把握當前跨境賭博違法犯罪的新特點、新變化，始終保持“零容忍”態度，堅持打防並舉、多管齊下，強化系統施策、綜合治理，整合多種資源力量，統籌推進執法、金融、宣傳、法律等各項措施落實，切實做到標本兼治。要加強工作組織推進，充分發揮政治優勢和制度優勢，進一步強化責任落實、機制建設、法治保障，努力推動打擊治理跨境賭博工作取得新成績、新突破。,http://www.macaodaily.com/html/2025-01/24/content_1809184.htm,打防並舉多管齊下    王小洪強調，要以習近平新時代中國特色社會主義思想為指導，全面貫徹黨的二十大和二十屆二中、三中全會精神，深入貫徹落實黨中央決策部署，進一步提高政治站位，準確把握當前跨境賭博違法犯罪的新特點、新變化，始終保持“零容忍”態度，堅持打防並舉、多管齊下，強化系統施策、綜合治理，整合多種資源力量，統籌推進執法、金融、宣傳、法律等各項措施落實，切實做到標本兼治,公安部 長 ： 跨境 賭博零 容忍         【 據 新華社 北京 一月 廿三日 電 】 全國 打擊 治理 跨境 賭博 工作 視頻 會議 廿三日 召開 ， 中共中央 書記 處書記 、 國務委員 、 公安部 長 王小洪 出席 並講話 。         亂象 得到 有效 遏制         王小洪 指出 ， 近年 來 ， 在 以習 近平 同志 為 核心 的 黨 中央 堅強 領導下 ， 各地 區 、 各有 關部門 統籌 推進 打擊 治理 各項 措施 落實 ， 防控 治理 體系 不斷 完善 ， 跨境 賭博亂象 得到 有效 遏制 。         打防 並舉 多管 齊下         王小洪 強調 ， 要 以習 近平 新 時代 中國 特色 社會 主義 思想 為 指導 ， 全面 貫徹 黨 的 二十大 和 二十 屆 二中 、 三中 全會 精神 ， 深入 貫徹落 實黨 中央 決策 部署 ， 進 一步 提高 政治 站位 ， 準確 把握 當前 跨境 賭博 違法 犯罪 的 新 特點 、 新 變化 ， 始終 保持 “ 零 容忍 ” 態度 ， 堅持 打防 並舉 、 多管 齊下 ， 強化系 統施策 、 綜合 治理 ， 整合 多種 資源 力量 ， 統籌 推進 執法 、 金融 、 宣傳 、 法律 等 各項 措施 落實 ， 切實 做到 標本 兼治 。 要 加強 工作 組織 推進 ， 充分 發揮 政治 優勢 和 制度 優勢 ， 進 一步 強化責任 落實 、 機制 建設 、 法治 保障 ， 努力 推動 打擊 治理 跨境 賭博 工作 取得 新成績 、 新 突破 。,2025-01-24
中方反對違市場經濟做法,美要TikTok一半股份    中方反對違市場經濟做法    【本報駐北京記者王維廿三日電】中國商務部新聞發言人何亞東廿三日在北京稱，希望美方多傾聽企業和民眾的呼聲，為包括中資企業在內的各國企業在美發展提供公平、公正的營商環境。    促美提供公平環境    廿三日，中國商務部召開的例行發佈會上，有記者問，近日，美國最高法院裁定支持TikTok在美禁令，TikTok應用程序在美國下架又恢復服務。同時，特朗普簽署行政令推遲短視頻社交媒體平台TikTok禁令生效時間，並表示TikTok需要出讓其百分之五十的股份給美國公司和美國政府。請問發言人對此有何評論？    商務部新聞發言人何亞東回應說，中方一貫尊重和維護企業正當合法權益，反對違背市場經濟基本原則、損害企業正當利益的做法。希望美方多傾聽企業和民眾的呼聲，為包括中資企業在內的各國企業在美發展提供公平、公正的營商環境，多做有利於中美兩國經貿合作和人民福祉的事情。    中美經貿互利共贏    美國總統特朗普上任首日簽署的行政令未包含對華加徵關稅，但據媒體報道，他令聯邦機構“調查和補救”貿易赤字問題，並將評估中美第一階段貿易協議的執行情況，針對中方同美方經貿團隊是否已經開始了溝通？何亞東同時表示，中美經貿關係的本質是互利共贏，中國商務部與美方相關主管部門一直保持溝通。    何亞東強調，中方希望在兩國元首的戰略引領下，雙方本着相互尊重、和平共處、合作共贏的原則，加強對話溝通，妥善管控分歧，拓展互利合作，推動中美經貿關係穩定健康發展。    關稅措施不利雙方    對於有報道稱特朗普有可能在二月一日開始對中國徵收百分之十關稅一事，何亞東表示，中方在關稅問題上的立場是一貫的。關稅措施不利於中美雙方，也不利於整個世界。中方願按照相互尊重、和平共處、合作共贏的原則，與美方共同推動中美經貿關係朝着穩定健康、可持續的方向發展。,http://www.macaodaily.com/html/2025-01/24/content_1809185.htm,美要TikTok一半股份    中方反對違市場經濟做法    【本報駐北京記者王維廿三日電】中國商務部新聞發言人何亞東廿三日在北京稱，希望美方多傾聽企業和民眾的呼聲，為包括中資企業在內的各國企業在美發展提供公平、公正的營商環境,美要 TikTok 一半 股份         中方 反對 違市場 經濟 做法         【 本報 駐 北京 記者 王維 廿三日 電 】 中國 商務部 新聞 發言人 何亞東 廿三日 在 北京 稱 ， 希望 美方 多 傾 聽 企業 和 民眾 的 呼聲 ， 為 包括 中資 企業 在 內 的 各國 企業 在 美 發展 提供 公平 、 公正 的 營商 環境 。         促美 提供 公平 環境         廿三日 ， 中國 商務部 召開 的 例行 發 佈 會 上 ， 有 記者問 ， 近日 ， 美國 最高法院 裁定 支持 TikTok 在 美 禁令 ， TikTok 應用 程序 在 美國 下架 又 恢 復 服務 。 同時 ， 特朗普 簽署 行政 令 推遲 短視頻 社交 媒體 平台 TikTok 禁令 生效 時間 ， 並 表示 TikTok 需要 出 讓 其 百分之五十 的 股份 給美國 公司 和 美國 政府 。 請問 發言人 對 此 有何 評論 ？         商務部 新聞 發言人 何亞東 回應 說 ， 中方 一貫 尊重 和 維護 企業 正當 合法 權益 ， 反對 違背 市場 經濟 基本 原則 、 損害 企業 正當 利益 的 做法 。 希望 美方 多 傾 聽 企業 和 民眾 的 呼聲 ， 為 包括 中資 企業 在 內 的 各國 企業 在 美 發展 提供 公平 、 公正 的 營商 環境 ， 多 做 有利於 中美 兩國 經貿 合作 和 人民 福祉 的 事情 。         中美經貿 互利 共贏         美國 總統 特朗普 上任 首日 簽署 的 行政 令未 包含 對華加 徵關稅 ， 但據 媒體 報道 ， 他令 聯邦 機構 “ 調查 和 補救 ” 貿易 赤字 問題 ， 並將 評估 中美 第一 階段 貿易 協議 的 執 行情 況 ， 針對 中方 同 美方 經貿 團隊 是否 已經 開始 了 溝通 ？ 何亞東 同時 表示 ， 中美經 貿關 係 的 本質 是 互利 共贏 ， 中國 商務部 與 美方 相關 主管 部門 一直 保持 溝通 。         何亞東 強調 ， 中方 希望 在 兩國 元首 的 戰略 引領 下 ， 雙方 本着 相互尊重 、 和平 共處 、 合作 共贏 的 原則 ， 加強 對 話 溝通 ， 妥善 管控 分歧 ， 拓展 互利 合作 ， 推動 中美經 貿關 係 穩定 健康 發展 。         關稅 措施 不利 雙方         對 於 有 報道 稱 特朗普 有 可能 在 二月 一日 開始 對 中國 徵收 百分之十 關稅 一事 ， 何亞東 表示 ， 中方 在 關稅 問題 上 的 立場 是 一貫 的 。 關稅 措施 不利 於 中美 雙方 ， 也 不利 於 整個 世界 。 中方 願 按照 相互尊重 、 和平 共處 、 合作 共贏 的 原則 ， 與 美方 共同 推動 中美經 貿關 係 朝着 穩定 健康 、 可持續 的 方向 發展 。,2025-01-24
我進口規模創新高,我進口規模創新高    【本報駐北京記者王維廿三日電】中國商務部新聞發言人何亞東今日在例行發佈會上介紹，二○二四年，中國進口總額十八萬億元人民幣，同比增長百分之二點三，進口規模創歷史新高，預計將連續十六年穩居全球第二大進口市場，充分展示了中國超大規模市場機遇和擴大開放的決心。    “積極擴大進口是中國作為負責任大國的主動擔當，是對世界經濟發展的重要貢獻，也是中國推進高水平對外開放的重要內容。”何亞東說，中國市場容量大、層次多、潛力巨大的特點沒有變，實施積極有效進口政策的態度沒有變。    對於今年商務部將如何支持進口？何亞東表示，中國將有序擴大商品市場對外開放，落實好對所有已建交的最不發達國家百分之一百稅目產品零關稅待遇，繼續發揮進博會、消博會以及廣交會進口展這些重要展會平台促進作用，推動培育國家進口貿易促進創新示範區，不斷提升進口貿易便利化水平，挖掘進口潛力，把中國超大規模市場打造成為世界共享大市場，為全球經濟發展注入新動能。,http://www.macaodaily.com/html/2025-01/24/content_1809186.htm,何亞東表示，中國將有序擴大商品市場對外開放，落實好對所有已建交的最不發達國家百分之一百稅目產品零關稅待遇，繼續發揮進博會、消博會以及廣交會進口展這些重要展會平台促進作用，推動培育國家進口貿易促進創新示範區，不斷提升進口貿易便利化水平，挖掘進口潛力，把中國超大規模市場打造成為世界共享大市場，為全球經濟發展注入新動能,我 進口 規模 創 新高         【 本報 駐 北京 記者 王維 廿三日 電 】 中國 商務部 新聞 發言人 何亞東 今日 在 例行 發 佈 會 上 介紹 ， 二 ○ 二 四年 ， 中國 進口 總額 十八 萬億元 人民 幣 ， 同比 增長 百分之二 點三 ， 進口 規模 創歷史 新高 ， 預計 將連續 十六年 穩居 全球 第二 大進口 市場 ， 充分 展示 了 中國 超大 規模 市場 機遇 和 擴大開 放 的 決心 。         “ 積極 擴大 進口 是 中國作 為 負責 任大國 的 主動 擔當 ， 是 對 世界 經濟 發展 的 重要 貢獻 ， 也 是 中國 推進 高水平 對外 開放 的 重要 內容 。 ” 何亞東 說 ， 中國 市場 容量 大 、 層次 多 、 潛力 巨大 的 特點 沒 有 變 ， 實施 積極 有效 進口 政策 的 態度 沒 有 變 。         對 於 今年 商務部將 如何 支持 進口 ？ 何亞東 表示 ， 中國將 有序 擴大 商品 市場 對外 開放 ， 落實 好 對 所有 已 建交 的 最 不 發達國家 百分之一百 稅目 產品 零關稅 待遇 ， 繼續 發揮 進博會 、 消博會 以及 廣交會 進口展 這些 重要 展會 平台 促進 作用 ， 推動 培育 國家 進口 貿易 促進 創新示 範區 ， 不斷 提升 進口 貿易 便利化 水平 ， 挖掘 進口 潛力 ， 把 中國 超大 規模 市場 打 造成 為 世界 共享 大市場 ， 為 全球 經濟 發展 注入 新動能 。,2025-01-24
字節跳動：最快本周達成方案,字節跳動：最快本周達成方案    【本報訊】據觀察者網廿三日消息：在特朗普放話“美國擁有Tik Tok的百分之五十所有權”、給予其七十五天寬限期後，Tik Tok成了眾多美國企業家和資本家眼中的“香餑餑”。儘管知情人士向觀察者網透露，Tik Tok母公司字節跳動方面尚未與美國政府達成任何協議，但這兩天圍繞該應用程式未來歸屬的討論傳得滿城風雨。    當地時間一月廿二日，字節跳動董事會成員、泛大西洋資本集團首席執行官比爾 · 福特在瑞士達沃斯舉行的一場活動上表示，最快在本周末，他們將達成一致，以確保Tik Tok能夠繼續在美國使用。    美國新聞網站Axios問福特Tik Tok是否會達成交易時，他回答“是的”，“這符合每個人的利益”。    “我們會繼續進行，也許最快在本周末就討論可能有效的方法……中國政府、美國政府、公司和董事會都必須參與這場對話。”福特說，“除了資產剝離”之外，可能會有解決方案。福特還認為，局勢發展成現在這樣，拜登政府應該負責，“他們沒有與我們進行真正的對話”。而與此同時，特朗普改變了他在第一個任期期間試圖禁止Tik Tok的態度，轉向“必須使用它”。    兩種方式處理    據美國有線電視新聞網(CNN)廿二日報道，Tik Tok的技術合作夥伴採取了兩種截然不同的方式處理當前的混亂：甲骨文恢復了對Tik Tok數據服務的支援，承擔了不遵守聯邦“不賣就禁”法律所帶來的風險。而截至廿二日下午，Tik Tok在谷歌和蘋果應用商店中仍然不可用，這反映出這些公司不願讓自己面臨法律風險的審慎決定。    根據美國法律，字節跳動要麼將Tik Tok出售給新買家，要麼特朗普政府需要頒佈一項新的法律來推翻之前的法律。CNN稱，鑒於現有立法在國會獲得了兩黨的大力支持，這種情況不太可能。,http://www.macaodaily.com/html/2025-01/24/content_1809187.htm,當地時間一月廿二日，字節跳動董事會成員、泛大西洋資本集團首席執行官比爾 · 福特在瑞士達沃斯舉行的一場活動上表示，最快在本周末，他們將達成一致，以確保Tik Tok能夠繼續在美國使用,字節 跳動 ： 最快 本周 達成 方案         【 本報 訊 】 據 觀察者網 廿三日 消息 ： 在 特朗普 放話 “ 美國 擁有 Tik   Tok 的 百分之五十 所有 權 ” 、 給予 其 七十五 天寬 限期 後 ， Tik   Tok 成 了 眾多 美國 企業 家和資 本家 眼中 的 “ 香餑 餑 ” 。 儘 管 知情 人士 向 觀察者網 透露 ， Tik   Tok 母公司 字節 跳動 方面 尚未 與 美國 政府 達成 任何 協議 ， 但 這兩天 圍繞 該 應用 程式 未來 歸屬 的 討論 傳得 滿城 風雨 。         當地 時間 一月 廿二日 ， 字節 跳動 董事 會 成員 、 泛 大西洋 資本 集團 首席 執行 官比爾   ·   福特 在 瑞士 達沃斯 舉行 的 一場 活動 上 表示 ， 最快 在 本 周末 ， 他們 將達成 一致 ， 以確 保 Tik   Tok 能夠 繼續 在 美國 使用 。         美國 新聞 網站 Axios 問 福特 Tik   Tok 是否 會達成 交易 時 ， 他 回答 “ 是 的 ” ， “ 這 符合 每個 人 的 利益 ” 。         “ 我們 會 繼續 進行 ， 也許 最快 在 本 周末 就 討論 可能 有效 的 方法 … … 中國 政府 、 美國 政府 、 公司 和 董事 會 都 必須 參與 這場 對 話 。 ” 福特 說 ， “ 除了 資產 剝離 ” 之外 ， 可能 會有 解決 方案 。 福特 還認 為 ， 局勢 發展 成現 在 這樣 ， 拜登 政府 應該 負責 ， “ 他們 沒 有 與 我們 進行 真正 的 對 話 ” 。 而 與 此 同時 ， 特朗普 改變 了 他 在 第一 個 任期 期間 試圖 禁止 Tik   Tok 的 態度 ， 轉向 “ 必須 使用 它 ” 。         兩種 方式 處理         據美國 有線 電視 新聞網 ( CNN ) 廿二日 報道 ， Tik   Tok 的 技術 合作 夥伴 採取 了 兩種 截然不同 的 方式 處理 當前 的 混亂 ： 甲骨文 恢 復 了 對 Tik   Tok 數據 服務 的 支援 ， 承擔 了 不 遵守 聯邦 “ 不賣 就 禁 ” 法律 所帶 來 的 風險 。 而 截至 廿二日 下午 ， Tik   Tok 在 谷歌 和 蘋果 應用 商店 中 仍然 不可 用 ， 這 反映 出 這些 公司 不願 讓 自己 面臨 法律 風險 的 審慎 決定 。         根據 美國 法律 ， 字節 跳動 要麼將 Tik   Tok 出售 給新 買家 ， 要麼 特朗普 政府 需要 頒 佈 一項 新 的 法律 來 推翻 之前 的 法律 。 CNN 稱 ， 鑒 於 現有 立法 在 國會 獲得 了 兩黨 的 大力支持 ， 這種 情況 不太可能 。,2025-01-24
