Title,Content,Link,Summary,Preprocessed_Content,Date
日青森大雪釀三死十二傷,日青森大雪釀三死十二傷    【本報訊】據中央社東京七日消息：日本青森縣近期受到破紀錄大雪侵襲，已知造成三死十二傷災情，連知名景點弘前城瞭望樓外壁都因大雪壓倒樹木受損。青森縣政府已宣佈包括弘前市在內的十個地區適用災害救助法。    綜合日本《讀賣新聞》、朝日電視台及日本放送協會報道，青森縣知事宮下宗一郎七日表示，受到這次大雪成災，包括青森市、弘前市等縣內十個市町村將適用災害救助法。    在這十個對象市町村，包括為有受困或倒塌之虞的民宅等進行除雪或排雪、開設避難所等費用，都由中央或縣府負擔。    除雪排雪導致傷亡    青森縣受到去年底開始降下的破紀錄大雪影響，時隔十二年再度成立“大雪對策本部”，把主要幹道除雪排雪及生活支援視為最優先工作。    連日大雪除造成部分鐵道運輸停擺外，已知至今有三人在除雪排雪時不幸罹難，另有十二人因在積雪道路摔倒等原因受傷。    多地積雪超過一米    根據日本氣象廳數據，青森縣六日凌晨○時到下午三時積雪最多的地方為青森市區，高度約一百二十六厘米；弘前市與五所川原市積雪一百○一厘米，青森縣內十六處觀測點中有六處積雪達往年三倍以上。    青森縣弘前市弘前公園內的“弘前城二之丸未申櫓”，受到大雪壓倒樹木的影響部分受損。二之丸是外城之意，櫓為瞭望樓。二之丸未申櫓建於一六一○年。    弘前市政府接下來將跟中央政府文化廳商議後着手修復，但預估約需數年才能完成修復。市府將待積雪融化後開始移除倒木並正式調查受損狀況。    古樹傾倒壓壞古蹟    古蹟受損意外發生在四日上午，一棵高約二十米、樹齡約兩百年的松樹傾倒壓在未申櫓外壁上，造成樓高三層的兩樓部分屋簷與外壁受損。,http://www.macaodaily.com/html/2025-01/08/content_1805928.htm,日青森大雪釀三死十二傷    【本報訊】據中央社東京七日消息：日本青森縣近期受到破紀錄大雪侵襲，已知造成三死十二傷災情，連知名景點弘前城瞭望樓外壁都因大雪壓倒樹木受損,日 青森 大雪 釀三死 十二 傷         【 本報 訊 】 據 中央社 東京 七日 消息 ： 日本 青森 縣 近期 受到 破紀錄 大雪 侵襲 ， 已知 造成 三死 十二 傷災情 ， 連 知名 景點 弘前 城 瞭望 樓 外壁 都 因 大雪 壓倒 樹木 受損 。 青森 縣 政府 已宣 佈 包括 弘前 市 在 內 的 十個 地區 適用 災害 救助 法 。         綜合 日本 《 讀賣 新聞 》 、 朝日 電視 台及 日本 放送 協會 報道 ， 青森 縣 知事 宮下 宗一郎 七日 表示 ， 受到 這次 大雪 成災 ， 包括 青森 市 、 弘前 市 等 縣 內十個 市 町 村將 適用 災害 救助 法 。         在 這十個 對象 市町村 ， 包括 為 有 受困 或 倒塌 之 虞 的 民宅 等 進行 除雪 或 排雪 、 開設 避難 所 等 費用 ， 都 由 中央 或 縣府 負擔 。         除雪 排雪導致 傷亡         青森 縣 受到 去年底 開始 降下 的 破紀錄 大雪 影響 ， 時隔 十二年 再度 成立 “ 大雪 對策 本部 ” ， 把 主要 幹道 除雪 排雪及 生活 支援 視為 最 優先 工作 。         連日 大雪 除 造成 部分 鐵道 運輸 停 擺外 ， 已知 至今 有三人 在 除雪 排雪時 不幸 罹難 ， 另有 十二 人因 在 積雪 道路 摔倒 等 原因 受傷 。         多地 積雪 超過 一米         根據 日本 氣象 廳 數據 ， 青森 縣 六日 凌晨 ○ 時到 下午 三時 積雪 最 多 的 地方 為 青森 市區 ， 高度 約 一百二十六 厘米 ； 弘前 市 與 五所 川原 市積 雪 一百 ○ 一 厘米 ， 青森 縣內 十六 處觀 測點 中 有 六處 積雪達 往年 三倍 以上 。         青森 縣弘前 市弘前 公園 內 的 “ 弘前 城二之丸 未 申櫓 ” ， 受到 大雪 壓倒 樹木 的 影響 部分 受損 。 二之丸 是 外城 之意 ， 櫓 為 瞭望 樓 。 二之丸 未 申櫓建 於 一 六一 ○ 年 。         弘前 市政府 接下 來將 跟 中央政府 文化 廳 商議 後 着手 修 復 ， 但 預估 約 需數 年 才能 完成 修 復 。 市府 將待 積雪 融化 後 開始 移除 倒木並 正式 調查 受 損狀況 。         古樹 傾倒 壓壞 古 蹟         古 蹟 受損 意外 發生 在 四日 上午 ， 一棵 高約 二十米 、 樹齡 約 兩 百年 的 松樹 傾倒 壓 在 未 申櫓外 壁上 ， 造成 樓 高三 層 的 兩樓 部分 屋簷 與 外壁 受損 。,2025-01-08
印尼成金磚成員國,印尼成金磚成員國    【據新華社北京七日電】中國外交部發言人郭嘉昆七日表示，中方願與金磚各國一道，秉持開放包容、合作共贏的精神，促進“大金磚合作”高質量發展，共同倡導平等有序的世界多極化和普惠包容的經濟全球化，推動構建人類命運共同體。    中方歡迎印尼加入    當日例行記者會上，有記者問：六日晚，二○二五年金磚主席國巴西表示，印度尼西亞已成為金磚正式成員。本月一日，哈薩克斯坦、馬來西亞、古巴、玻利維亞等多國成為金磚夥伴國。不少媒體認為金磚國家邁入“大金磚合作”的新時代，對下步全球南方團結合作、完善全球治理發揮重要影響。發言人對此有何評論？    “中方熱烈歡迎新成員加入金磚大家庭。”郭嘉昆說。    郭嘉昆說，金磚合作機制誕生於新興市場國家和發展中國家群體性崛起的歷史大潮中，符合國際社會對維護世界和平、促進共同發展、完善全球治理的期待。成立近二十年來，金磚國家人口已佔全球近一半，經濟總量佔比超三成，對世界經濟增長貢獻率超過百分之五十。金磚合作機制代表性、感召力、影響力不斷提升，已經成為促進全球南方團結合作的重要平台、推動全球治理體系變革的重要力量。    大有可為未來可期    “中方願與金磚各國一道，秉持開放包容、合作共贏的精神，促進‘大金磚合作’高質量發展，共同倡導平等有序的世界多極化和普惠包容的經濟全球化，推動構建人類命運共同體。”郭嘉昆說，“‘大金磚合作’大有可為、未來可期！”    作為金磚國家輪值主席國，巴西外交部六日宣佈印尼成為金磚正式成員，並對印尼正式加入金磚合作機制表示歡迎。    巴西外交部當天發佈公報說，印尼是東南亞人口最多的國家，也是該地區最大經濟體，與金磚其他成員一樣，印尼一貫支持全球治理改革，並願為深化“全球南方”合作作貢獻，這與巴西今年確定的主題理念一致。金磚國家按照二○二三年八月在南非約翰內斯堡舉行的金磚國家領導人第十五次會晤商定的擴員進程指導原則、標準和程序，一致同意印尼加入金磚機制。,http://www.macaodaily.com/html/2025-01/08/content_1805886.htm,印尼成金磚成員國    【據新華社北京七日電】中國外交部發言人郭嘉昆七日表示，中方願與金磚各國一道，秉持開放包容、合作共贏的精神，促進“大金磚合作”高質量發展，共同倡導平等有序的世界多極化和普惠包容的經濟全球化，推動構建人類命運共同體,印尼 成金磚 成員國         【 據 新華社 北京 七日 電 】 中國 外交部 發言人 郭嘉昆 七日 表示 ， 中方 願 與 金磚 各國 一道 ， 秉持 開放 包容 、 合作 共贏 的 精神 ， 促進 “ 大金磚 合作 ” 高質量 發展 ， 共同 倡導 平等 有序 的 世界 多極化 和 普惠 包容 的 經濟 全球化 ， 推動構 建人類 命運 共同 體 。         中方 歡迎 印尼 加入         當日 例行 記者 會 上 ， 有 記者問 ： 六日 晚 ， 二 ○ 二 五年 金磚 主席 國 巴西 表示 ， 印度 尼西 亞 已成 為 金磚 正式 成員 。 本月 一日 ， 哈薩 克斯 坦 、 馬 來 西亞 、 古巴 、 玻利維亞 等 多國成 為 金 磚夥 伴國 。 不少 媒體 認為 金磚 國家 邁入 “ 大金磚 合作 ” 的 新 時代 ， 對 下步 全球 南方 團結 合作 、 完善 全球 治理 發揮 重要 影響 。 發言人 對 此 有何 評論 ？         “ 中方 熱烈歡 迎新 成員 加入 金磚 大家庭 。 ” 郭嘉昆 說 。         郭嘉昆 說 ， 金磚 合作 機制 誕生 於 新興 市場 國家 和 發展 中國家 群體性 崛起 的 歷史 大潮 中 ， 符合 國際 社會 對維護 世界 和平 、 促進 共同 發展 、 完善 全球 治理 的 期待 。 成立 近 二十年 來 ， 金磚 國家 人口 已 佔 全球 近一半 ， 經濟 總量 佔 比超 三成 ， 對 世界 經濟 增長 貢獻率 超過 百分之五十 。 金磚 合作 機制 代表性 、 感召力 、 影響力 不斷 提升 ， 已經成 為 促進 全球 南方 團結 合作 的 重要 平台 、 推動 全球 治理 體系 變革 的 重要 力量 。         大有 可為 未來 可期         “ 中方 願 與 金磚 各國 一道 ， 秉持 開放 包容 、 合作 共贏 的 精神 ， 促進 ‘ 大金磚 合作 ’ 高質量 發展 ， 共同 倡導 平等 有序 的 世界 多極化 和 普惠 包容 的 經濟 全球化 ， 推動構 建人類 命運 共同 體 。 ” 郭嘉昆 說 ， “ ‘ 大金磚 合作 ’ 大有 可為 、 未來 可期 ！ ”         作為 金磚 國家 輪值 主席 國 ， 巴西 外交部 六日 宣 佈 印尼 成為 金磚 正式 成員 ， 並對 印尼 正式 加入 金磚 合作 機制 表示 歡迎 。         巴西 外交部 當天發 佈 公報 說 ， 印尼 是 東南亞 人口 最多 的 國家 ， 也 是 該 地區 最大 經濟體 ， 與 金磚 其他 成員 一樣 ， 印尼 一貫 支持 全球 治理 改革 ， 並願 為 深化 “ 全球 南方 ” 合作 作 貢獻 ， 這與 巴西 今年 確定 的 主題 理念 一致 。 金磚 國家 按照 二 ○ 二三年 八月 在 南非 約翰 內斯堡 舉行 的 金 磚國家 領導人 第十五次 會 晤商 定 的 擴員 進程 指導 原則 、 標準 和 程序 ， 一致同意 印尼 加入 金磚 機制 。,2025-01-08
何立峰：關切對華經貿限制措施,與美財長耶倫視頻通話    何立峰：關切對華經貿限制措施    【據新華社北京七日電】中美經貿中方牽頭人、國務院副總理何立峰與美方牽頭人、財政部部長耶倫於七日舉行視頻通話，雙方圍繞落實中美元首重要共識，回顧總結近年來中美經濟領域交往合作經歷，積極評價中美經濟、金融工作組等對話機制的重要作用，同意在過渡期內保持溝通、管控分歧，繼續穩定中美經濟關係。中方就美對華經貿限制措施表達關切，特別是就美近期實施的貿易調查等闡明立場。    此次視頻通話坦誠、深入、富有建設性，雙方同意保持溝通聯繫的重要性。,http://www.macaodaily.com/html/2025-01/08/content_1805887.htm,與美財長耶倫視頻通話    何立峰：關切對華經貿限制措施    【據新華社北京七日電】中美經貿中方牽頭人、國務院副總理何立峰與美方牽頭人、財政部部長耶倫於七日舉行視頻通話，雙方圍繞落實中美元首重要共識，回顧總結近年來中美經濟領域交往合作經歷，積極評價中美經濟、金融工作組等對話機制的重要作用，同意在過渡期內保持溝通、管控分歧，繼續穩定中美經濟關係,與 美 財長 耶倫視 頻通話         何立峰 ： 關切 對華經貿 限制 措施         【 據 新華社 北京 七日 電 】 中美經貿 中方 牽頭 人 、 國務院 副 總理 何立峰 與 美方 牽頭 人 、 財政部 部長 耶倫 於 七日 舉行 視頻 通話 ， 雙方圍 繞落 實中 美元 首 重要 共識 ， 回顧 總結 近年 來 中 美經濟 領域 交往 合作 經歷 ， 積極 評價 中美經濟 、 金融 工作 組等 對 話 機制 的 重要 作用 ， 同意 在 過渡期 內 保持 溝通 、 管控 分歧 ， 繼續 穩定 中美 經濟關 係 。 中方 就 美 對華經貿 限制 措施 表達 關切 ， 特別 是 就 美 近期 實施 的 貿易 調查 等 闡明 立場 。         此次 視頻 通話坦 誠 、 深入 、 富有 建設性 ， 雙方 同意 保持 溝通 聯 繫 的 重要性 。,2025-01-08
我外交部促美糾錯,騰訊寧德時代等遭美列黑名單    我外交部促美糾錯    【中新社北京七日電】 針對美方將騰訊和寧德時代列入黑名單，中國外交部發言人郭嘉昆七日在例行記者會上稱，中方敦促美方立即糾正錯誤做法，立即解除對中國企業的非法單邊制裁和“長臂管轄”。    郭嘉昆表示，中方一貫堅決反對美方泛化國家安全概念，劃設各類名目的歧視性清單，無理打壓中國企業，遏制中國高質量發展。中國人民的發展權利不可剝奪、不容無視。    郭嘉昆說，我們敦促美方立即糾正錯誤做法，立即解除對中國企業的非法單邊制裁和“長臂管轄”。中方將採取必要措施堅決維護中國企業的合法權益，維護自身正當發展權利。    將採必要措施維權    針對美將多家中國實體列入出口管制“實體清單”，中國商務部新聞發言人七日稱，中方將採取必要措施，堅決維護中國實體的合法權益。    美東時間一月三日，美商務部宣佈將多家中國實體列入出口管制“實體清單”。    對此，發言人在答記者問時表示，美方以所謂涉軍為由，將十一家中國實體列入出口管制“實體清單”，中方對此堅決反對。    發言人指，長期以來，美方泛化國家安全概念，濫用出口管制措施，打壓遏制他國實體，嚴重損害相關實體合法權益，破壞全球產業鏈供應鏈安全穩定，阻礙世界經濟復甦和發展。    發言人稱，中方敦促美方立即停止錯誤做法，並將採取必要措施，堅決維護中國實體的合法權益。    針對美商務部宣佈對中國等國家無人機系統啟動信息通信技術與服務國家安全風險調查，中國商務部新聞發言人七日稱，中方對此強烈不滿，堅決反對，將密切關注事態進展。    發言人指出，美方在缺乏事實依據的情況下，無端懷疑中國等國家無人機系統存在信息安全風險，極其不負責任。這是赤裸裸地泛化國家安全概念、濫用國家力量對他國產業實施打壓，將干擾全球產業鏈供應鏈穩定暢通，並損害包括美國用戶在內的消費者的正當權益。    發言人表示，中方將密切關注事態進展，敦促美方尊重客觀事實，立即停止錯誤做法。,http://www.macaodaily.com/html/2025-01/08/content_1805888.htm,騰訊寧德時代等遭美列黑名單    我外交部促美糾錯    【中新社北京七日電】 針對美方將騰訊和寧德時代列入黑名單，中國外交部發言人郭嘉昆七日在例行記者會上稱，中方敦促美方立即糾正錯誤做法，立即解除對中國企業的非法單邊制裁和“長臂管轄”,騰訊寧德 時代 等 遭美列 黑名 單         我 外交部 促美 糾錯         【 中新社 北京 七日 電 】   針對 美方 將騰 訊 和 寧德 時代 列入 黑名 單 ， 中國 外交部 發言人 郭嘉昆 七日 在 例行 記者 會 上 稱 ， 中方 敦促 美方 立即 糾正 錯誤 做法 ， 立即 解除 對 中國 企業 的 非法 單邊 制裁 和 “ 長 臂 管轄 ” 。         郭嘉昆 表示 ， 中方 一貫 堅決 反對 美方 泛化 國家 安全 概念 ， 劃設 各類 名 目的 歧視性 清單 ， 無理 打壓 中國 企業 ， 遏制 中國 高質量 發展 。 中國 人民 的 發展 權利 不可 剝奪 、 不容 無視 。         郭嘉昆 說 ， 我們 敦促 美方 立即 糾正 錯誤 做法 ， 立即 解除 對 中國 企業 的 非法 單邊 制裁 和 “ 長 臂 管轄 ” 。 中方 將採取 必要措施 堅決 維護 中國 企業 的 合法 權益 ， 維護 自身 正當 發展 權利 。         將採 必要措施 維權         針對 美將 多家 中國 實體 列入 出口 管制 “ 實體 清單 ” ， 中國 商務部 新聞 發言人 七日 稱 ， 中方 將採取 必要措施 ， 堅決 維護 中國 實體 的 合法 權益 。         美東 時間 一月 三日 ， 美商 務部 宣 佈 將 多家 中國 實體 列入 出口 管制 “ 實體 清單 ” 。         對此 ， 發言人 在 答 記者 問時 表示 ， 美方 以所謂 涉軍為 由 ， 將 十一 家中 國實體 列入 出口 管制 “ 實體 清單 ” ， 中方 對此 堅決 反對 。         發言人 指 ， 長 期以 來 ， 美方 泛化 國家 安全 概念 ， 濫用 出口 管制 措施 ， 打壓 遏制 他國 實體 ， 嚴重 損害 相關 實體 合法 權益 ， 破壞 全球 產業 鏈供 應鏈 安全 穩定 ， 阻礙 世界 經濟 復 甦 和 發展 。         發言人稱 ， 中方 敦促 美方 立即 停止 錯誤 做法 ， 並將 採取 必要措施 ， 堅決 維護 中國 實體 的 合法 權益 。         針對 美商 務部 宣 佈 對 中國 等 國家 無人 機系統 啟動 信息 通信 技術 與 服務國家 安全 風險 調查 ， 中國 商務部 新聞 發言人 七日 稱 ， 中方 對此 強烈 不滿 ， 堅決 反對 ， 將 密切 關注 事態 進展 。         發言人 指出 ， 美方 在 缺乏 事實 依據 的 情況 下 ， 無端 懷疑 中國 等 國家 無人 機系統 存在 信息安全 風險 ， 極其 不 負責任 。 這是 赤裸裸 地 泛化 國家 安全 概念 、 濫用 國家 力量 對 他 國產業 實施 打壓 ， 將干擾 全球 產業 鏈供 應鏈 穩定 暢通 ， 並損害 包括 美國 用戶 在 內 的 消費者 的 正當 權益 。         發言人 表示 ， 中方 將 密切 關注 事態 進展 ， 敦促 美方 尊重 客觀 事實 ， 立即 停止 錯誤 做法 。,2025-01-08
和田玉文化特展故宮登場,和田玉文化特展故宮登場    【本報駐北京記者鐵怡七日電】“玉出昆岡——清代宮廷和田玉文化特展”六日在故宮博物院開幕。本次展覽以和田玉文化為切入點，立體展現中華文明以玉為媒、交融互鑒的發展歷程。    故宮博物院黨委書記、副院長都海江在開幕式上致辭時表示，新疆作為多民族聚居地，自古以來就是我國領土不可分割的一部分，新疆各民族是中華民族大家庭血脈相連、命運與共的重要成員。此次展覽以玉為媒，通過陳列具有代表性的清代宮廷和田玉文物，為觀眾們帶來一場玉文化盛宴，也是講好新疆故事、講好中國故事，進一步鑄牢中華民族共同體意識的重要嘗試。    展覽遴選二百五十八件具有代表性的清代宮廷和田玉精品，展品包括故宮博物院藏已知最早的漢代和田子料玉辟邪、乾隆皇帝欽定為二十五寶之首的“大清受命之寶”、反映清朝與域外地區交往的痕都斯坦玉器等重要展品，其中一百三十件珍貴文物為首次展出。,http://www.macaodaily.com/html/2025-01/08/content_1805889.htm,展覽遴選二百五十八件具有代表性的清代宮廷和田玉精品，展品包括故宮博物院藏已知最早的漢代和田子料玉辟邪、乾隆皇帝欽定為二十五寶之首的“大清受命之寶”、反映清朝與域外地區交往的痕都斯坦玉器等重要展品，其中一百三十件珍貴文物為首次展出,和田玉 文化 特展 故宮 登場         【 本報 駐 北京 記者 鐵怡 七日 電 】 “ 玉出 昆岡 — — 清代 宮廷 和田玉 文化 特展 ” 六日 在 故宮 博物院 開幕 。 本次 展覽以 和田玉 文化 為 切入 點 ， 立體 展現 中華 文明 以玉為 媒 、 交融 互 鑒 的 發展 歷程 。         故宮 博物院 黨委書記 、 副 院長 都 海江 在 開幕式 上致 辭時 表示 ， 新疆 作為 多 民族 聚居地 ， 自古 以來 就是 我國 領土 不可分割 的 一部分 ， 新疆 各 民族 是 中華 民族 大家庭 血脈 相連 、 命運 與 共 的 重要 成員 。 此次 展覽 以玉為 媒 ， 通過 陳 列 具有 代表性 的 清代 宮廷 和田玉 文物 ， 為 觀眾們 帶來 一場 玉 文化 盛宴 ， 也 是 講好 新疆 故事 、 講好 中國 故事 ， 進 一步 鑄牢 中華 民族 共同 體意識 的 重要 嘗試 。         展覽 遴選 二百五十 八件 具有 代表性 的 清代 宮廷 和田玉 精品 ， 展品 包括 故宮 博物院 藏 已知 最早 的 漢代 和田 子料 玉 辟邪 、 乾隆皇帝 欽定 為 二十五 寶之首 的 “ 大清 受命 之 寶 ” 、 反映 清朝 與 域外 地區 交往 的 痕 都 斯坦 玉器 等 重要 展品 ， 其中 一百三十 件 珍貴 文物 為 首次 展出 。,2025-01-08
