Title,Content,Link,Summary,Preprocessed_Content,Date
灣區燈會譜寫城市壯麗史詩,照耀南沙上空    持續至三月底    灣區燈會譜寫城市壯麗史詩    【本報記者廣州廿三日電】“光耀神州 · 華彩灣區”二○二五年粵港澳大灣區燈會亮燈儀式，昨晚在廣州南沙開啟，將持續至三月三十日。大灣區燈會以燈為媒，講述香港、澳門、廣州等“九加二”城市融合發展的壯麗史詩，譜寫灣區蓬勃發展的新篇章。    大灣區燈會得到包括澳門在內的大灣區“九加二”城市支持，融合中國春節、傳統綵燈“兩大非遺”，融入大灣區城市和“一帶一路”國際文化元素，運用現代科技與光影藝術，呈現灣區開拓進取、開放合作的精神風貌。    本月廿二日傍晚六時，在觀眾倒數中，南沙蒲洲花園、南沙天后宮景區、南沙濱海公園三個園區燈組同時亮起，璀璨燈光點亮整片夜空。    亮燈儀式現場，執飛珠海航展的飛行團隊帶來精彩的飛行表演，拉開亮燈儀式序幕。表演環節，《醒 · 獅》選段《祥獅送吉》熱鬧喜慶，醒獅靈活矯健，在雄渾的鼓點中轉變身形，吸引遊客的目光。歌舞節目《南沙歡迎你》、《花開新時代》輪番上演。    大灣區燈會以喜（禧）粵大道為軸，一千多名非遺工匠精心打造二百一十八組燈景，超過一萬盞綵燈，逾三公里主遊線路，全方位展示大灣區十一座城市的文化魅力。為迎接全國第十五屆運動會在廣州舉辦，魅力全運會燈組以二○二五年為時空紐帶，連接激情全運會與活力大灣區。IP形象“喜洋洋”與“樂融融”首次以綵燈形式呈現，展現全運會的昂揚風采。    大灣區燈會三大園區、五大主題，步步皆美景，景景皆不同。本次燈會精心設計了九個演藝舞台、千場特色演藝活動，涵蓋飄色、英歌、粵劇、武術、雜耍、木偶戲等傳統民俗活動，策劃空中飛機表演、紅韻 · 摩登秀、智造先鋒、星空夜巡等新穎表演，為公眾打造傳統與現代、古典與時尚相結合的文藝盛宴。,http://www.macaodaily.com/html/2025-01/24/content_1809339.htm,大灣區燈會得到包括澳門在內的大灣區“九加二”城市支持，融合中國春節、傳統綵燈“兩大非遺”，融入大灣區城市和“一帶一路”國際文化元素，運用現代科技與光影藝術，呈現灣區開拓進取、開放合作的精神風貌,照耀 南沙 上空         持續 至 三月底         灣區 燈會 譜 寫 城市 壯麗史詩         【 本報 記者 廣州 廿三日 電 】 “ 光耀 神州   ·   華彩灣區 ” 二 ○ 二 五年 粵 港澳 大灣區 燈會亮 燈 儀式 ， 昨晚 在 廣州 南沙 開啟 ， 將持續 至 三月 三十日 。 大灣區 燈會 以燈 為 媒 ， 講述 香港 、 澳門 、 廣州 等 “ 九加 二 ” 城市 融合 發展 的 壯麗史詩 ， 譜 寫灣區 蓬勃 發展 的 新篇章 。         大灣區 燈會 得到 包括 澳門 在 內 的 大灣區 “ 九加 二 ” 城市 支持 ， 融合 中國春節 、 傳統 綵 燈 “ 兩大非 遺 ” ， 融入 大灣區 城市 和 “ 一帶 一路 ” 國際 文化 元素 ， 運用 現代 科技 與 光影 藝術 ， 呈 現灣區 開拓 進取 、 開放 合作 的 精神 風貌 。         本月 廿二日 傍晚 六時 ， 在 觀眾 倒 數中 ， 南沙 蒲洲 花園 、 南沙 天后 宮景區 、 南沙 濱海公園 三個 園區 燈 組同 時亮 起 ， 璀璨 燈光 點亮 整片 夜空 。         亮燈 儀式 現場 ， 執飛 珠海航展 的 飛行 團隊 帶來 精彩 的 飛行 表演 ， 拉開亮 燈 儀式 序幕 。 表演 環節 ， 《 醒   ·   獅 》 選段 《 祥獅 送 吉 》 熱鬧 喜慶 ， 醒獅 靈活 矯健 ， 在 雄 渾 的 鼓點 中 轉變 身形 ， 吸引 遊客 的 目光 。 歌舞 節目 《 南沙 歡迎 你 》 、 《 花開 新 時代 》 輪番 上演 。         大灣區 燈會 以喜 （ 禧 ） 粵 大道 為軸 ， 一千多名 非遺 工匠 精心 打造 二百一十 八組 燈景 ， 超過 一萬盞 綵 燈 ， 逾 三 公里 主遊線 路 ， 全方位 展示 大灣區 十一座 城市 的 文化 魅力 。 為 迎接 全國 第十五 屆 運動會 在 廣州 舉辦 ， 魅力 全運會 燈 組以 二 ○ 二 五年 為 時空 紐帶 ， 連接 激情 全運會 與 活力 大灣區 。 IP 形象 “ 喜洋洋 ” 與 “ 樂 融融 ” 首次 以 綵 燈 形式 呈現 ， 展現 全運會 的 昂揚 風采 。         大灣區 燈會 三大園區 、 五大 主題 ， 步步 皆 美景 ， 景景 皆 不同 。 本次 燈會 精心 設計 了 九個 演藝 舞台 、 千場 特色 演藝 活動 ， 涵蓋 飄色 、 英歌 、 粵劇 、 武術 、 雜耍 、 木偶 戲等 傳統 民俗 活動 ， 策劃 空中 飛機 表演 、 紅韻   ·   摩登 秀 、 智造 先鋒 、 星空 夜巡 等 新穎 表演 ， 為 公眾 打造 傳統 與 現代 、 古典 與 時 尚相 結合 的 文藝 盛宴 。,2025-01-24
律師公會座談悟習重要講話,律師公會座談悟習重要講話    【本報消息】澳門律師公會日前在會址舉辦“學習習近平主席視察澳門重要講話精神座談會”。由律師公會秘書長潘愛儀主持，理事會主席黃顯輝、大會主席歐安利、監事會主席石立炘、律師業高等委員會委員李煥江及大會主席團前秘書歐頌成主講，公會架構成員及律師界同仁逾五十人與會，澳門中聯辦法律部副部長黃文軍受邀出席。    主講者分別分享對習主席重要講話的體會，指澳門律師公會在“一國兩制”成功實踐中，特別是在完善特區維護國家安全的法律制度和執行機制、宣傳推廣憲法和澳門基本法、參與粵港澳大灣區建設，在“一帶一路”國家戰略上加強與葡語系國家的聯繫和法律服務人員培養等方面，作出積極貢獻。澳門律師將深入學習、宣傳和貫徹習主席在澳門發表的系列重要講話，充分發揮法律專業優勢，參與横琴粵澳深度合作區發展，擴大及提升涉外法律服務，協助推動澳門的法律及司法改革，支持政府依法施政，與社會各界共同努力。    黃文軍總結指出，澳門律師公會組織業界集體學習和領會習近平主席視察澳門重要講話精神，體現律師界的政治擔當和家國情懷，公會作為法律專業團體，應當緊密結合自身實際，把學習宣傳貫徹習近平主席系列重要講話精神作為一項長期任務，發揮自身專業優勢，作出律師界的更大貢獻。,http://www.macaodaily.com/html/2025-01/24/content_1809340.htm,黃文軍總結指出，澳門律師公會組織業界集體學習和領會習近平主席視察澳門重要講話精神，體現律師界的政治擔當和家國情懷，公會作為法律專業團體，應當緊密結合自身實際，把學習宣傳貫徹習近平主席系列重要講話精神作為一項長期任務，發揮自身專業優勢，作出律師界的更大貢獻,律師 公會座 談悟習 重要 講話         【 本報 消息 】 澳門律 師公會 日前 在 會址 舉辦 “ 學習習 近平 主席 視察 澳門 重要 講話 精神 座 談會 ” 。 由律 師公會 秘書長 潘愛儀 主持 ， 理事 會 主席 黃 顯輝 、 大會 主席 歐 安利 、 監事會 主席 石 立 炘 、 律師業 高等 委員會委員 李煥江及 大會 主席 團前 秘書 歐頌 成主講 ， 公會 架構 成員 及律 師界 同仁 逾 五十 人 與 會 ， 澳門 中聯辦 法律 部副 部長 黃 文 軍 受邀 出席 。         主講者 分別 分享 對習 主席 重要 講話 的 體會 ， 指澳門律 師公會 在 “ 一國 兩制 ” 成功 實踐 中 ， 特別 是 在 完善 特區 維護國家 安全 的 法律 制度 和 執行 機制 、 宣傳 推廣憲法 和 澳門 基本法 、 參與粵 港澳 大灣區 建設 ， 在 “ 一帶 一路 ” 國家 戰略 上 加強 與 葡語 系國家 的 聯 繫 和 法律 服務人員 培養 等 方面 ， 作出 積極 貢獻 。 澳門律 師將 深入 學習 、 宣傳 和 貫徹習 主席 在 澳門 發表 的 系列 重要 講話 ， 充分 發揮 法律 專業 優勢 ， 參與 横琴 粵澳 深度 合作 區發展 ， 擴大及 提升 涉外 法律 服務 ， 協 助推 動澳門 的 法律 及 司法 改革 ， 支持 政府 依法 施政 ， 與 社會 各界 共同努力 。         黃 文軍總結 指出 ， 澳門律 師公會 組織業界 集體 學習 和 領會習 近平 主席 視察 澳門 重要 講話 精神 ， 體現律 師界 的 政治 擔當 和 家國 情懷 ， 公會 作為 法律 專業 團體 ， 應當 緊密 結合 自身 實際 ， 把 學習 宣傳貫 徹習 近平 主席 系列 重要 講話 精神 作為 一項 長 期 任務 ， 發揮 自身 專業 優勢 ， 作出 律師界 的 更 大 貢獻 。,2025-01-24
五地青聯分享習重要講話,五地青聯分享習重要講話    【本報消息】江蘇省青年聯合會、廣東省青年聯合會、上海市青年聯合會、四川省青年聯合會、珠海市青年聯合會的澳區委員前日假馬交大排檔，聯合組織座談會，學習貫徹習近平主席視察澳門重要講話精神，約三十人出席活動。    座談會由江蘇省青年聯合會副主席何嘉慈、廣東省青年聯合會副主席羅頌輝、上海市青年聯合會副主席張子軒共同主持，澳門中聯辦教育與青年工作部綜合處副處長馮子銘出席指導。    何嘉慈、羅頌輝、張子軒分享習主席重要講話內容，精細解讀和深入分析其核心精神和重大意義。他們認為，習主席重要講話意義深遠、高屋建瓴，當中對澳門提出“四點希望”和“三點期許”，為澳門未來發展指明了方向。呼籲與會者應當深刻貫徹習主席重要講話精神，勇於擔當，發揮青聯委員的作用，聯絡各界，共同推動澳門更好融入國家發展大局。    座談會上，多名澳區委員分別圍繞經濟、教育、青年、社會服務等領域發言。他們表示，習主席在澳門回歸二十五周年親臨澳門視察，肯定特區的發展，社會各界備受鼓舞。作為澳門青年，將發揮自身專業優勢，推動澳門經濟適度多元化發展，加快建設橫琴粵澳深度合作區，打造國際高端人才集聚高地，擦亮澳門國際大都市“金名片”。,http://www.macaodaily.com/html/2025-01/24/content_1809341.htm,五地青聯分享習重要講話    【本報消息】江蘇省青年聯合會、廣東省青年聯合會、上海市青年聯合會、四川省青年聯合會、珠海市青年聯合會的澳區委員前日假馬交大排檔，聯合組織座談會，學習貫徹習近平主席視察澳門重要講話精神，約三十人出席活動,五地 青聯 分享 習 重要 講話         【 本報 消息 】 江蘇省 青年 聯合會 、 廣東省 青年 聯合會 、 上海市 青年 聯合會 、 四川省 青年 聯合會 、 珠海市 青年 聯合會 的 澳區 委員 前日 假馬 交大 排檔 ， 聯合 組織 座 談會 ， 學習 貫徹習 近平 主席 視察 澳門 重要 講話 精神 ， 約 三十 人 出席 活動 。         座 談會 由江 蘇省 青年 聯合會 副 主席 何嘉慈 、 廣東省 青年 聯合會 副 主席 羅 頌輝 、 上海市 青年 聯合會 副 主席 張子軒 共同 主持 ， 澳門 中聯辦 教育 與 青年 工作部 綜合處 副 處長 馮子銘 出席 指導 。         何嘉慈 、 羅 頌輝 、 張子軒 分享 習 主席 重要 講話 內容 ， 精細 解讀 和 深入分析 其 核心 精神 和 重大 意義 。 他們 認為 ， 習 主席 重要 講話 意義深 遠 、 高屋建瓴 ， 當中 對 澳門 提出 “ 四點 希望 ” 和 “ 三點 期許 ” ， 為 澳門 未來 發展 指明 了 方向 。 呼籲 與 會者 應當 深刻 貫徹習 主席 重要 講話 精神 ， 勇 於 擔當 ， 發揮 青聯委員 的 作用 ， 聯絡 各界 ， 共同 推動 澳門 更好 融入 國家 發展 大局 。         座 談會 上 ， 多名 澳區 委員分 別圍 繞 經濟 、 教育 、 青年 、 社會 服務 等 領域 發言 。 他們 表示 ， 習 主席 在 澳門 回歸 二十五 周年 親臨 澳門 視察 ， 肯定 特區 的 發展 ， 社會 各界 備受 鼓舞 。 作為 澳門 青年 ， 將發揮 自身 專業 優勢 ， 推動 澳門 經濟 適度 多元化 發展 ， 加快 建設 橫琴粵澳 深度 合作 區 ， 打造 國際 高端 人才 集聚 高地 ， 擦亮 澳門 國際 大都市 “ 金 名片 ” 。,2025-01-24
城大生感悟習講話精神,城大生感悟習講話精神    【本報消息】澳門城市大學學生幹部日前舉辦“學習貫徹習近平主席視察澳門重要講話精神座談會”，於城大文化中心展覽廳順利舉行。教育及青年發展局學生廳長陳旭偉，澳門中聯辦教育與青年工作部高校處四級主任科員褚志文，城市大學副校長葉桂平、學生事務處長鄒辰寵，以及研究生會、學生會內閣成員與幹事出席。    葉桂平表示，特區政府應繼續推動青年工作穩步發展，與廣大青年保持密切聯絡，關心其現實需要及長遠發展，充分信任青年、關注青年願望、幫助青年發展、支持青年創業，為青年多搭台、多搭梯，全面支持青年積極向上。澳門青年工作既要重視薪火相傳，亦要關注基層青年的向上流動，還要注重不斷改善本澳行業發展環境，吸引外地求學及旅居的澳門本地青年人才回流。    會上，城市大學研究生會主席牟凌彤、理事長周柏含、監事長何炳昊、副主席黎俊滔，澳門城市大學學生會主席葉沐曦、理事長劉梓珩、監事長朱浩東、副主席吳嘉煜、副理事長李鶴翔及副監事長黃俊銘分享講話體會。    陳旭偉總結指出，學生們更應該把握良機，珍惜當下。增強國家認同，身份認同，做好“接班人”工作，不斷開創“一國兩制”事業新局面。,http://www.macaodaily.com/html/2025-01/24/content_1809342.htm,教育及青年發展局學生廳長陳旭偉，澳門中聯辦教育與青年工作部高校處四級主任科員褚志文，城市大學副校長葉桂平、學生事務處長鄒辰寵，以及研究生會、學生會內閣成員與幹事出席,城 大生 感悟 習講話 精神         【 本報 消息 】 澳門 城市 大學學生 幹部 日前 舉辦 “ 學習 貫徹習 近平 主席 視察 澳門 重要 講話 精神 座 談會 ” ， 於 城大 文化 中心 展覽廳 順利 舉行 。 教育 及 青年 發展 局學 生廳 長 陳 旭偉 ， 澳門 中聯辦 教育 與 青年 工作部 高校 處四級 主任 科員 褚志文 ， 城市 大學 副 校長 葉 桂平 、 學 生事 務處長 鄒辰寵 ， 以及 研究生 會 、 學生會 內閣 成員 與 幹事 出席 。         葉 桂平 表示 ， 特區 政府 應繼續 推動 青年 工作 穩步 發展 ， 與 廣大 青年 保持 密切 聯絡 ， 關心 其 現實 需要 及長 遠 發展 ， 充分 信任 青年 、 關注 青年 願望 、 幫助 青年 發展 、 支持 青年 創業 ， 為 青年 多 搭台 、 多 搭梯 ， 全面 支持 青年 積極 向上 。 澳門 青年 工作 既要 重視 薪火 相傳 ， 亦 要 關注 基層 青年 的 向 上流 動 ， 還要 注重 不斷 改善 本澳 行業 發展 環境 ， 吸引 外地 求學及 旅居 的 澳門 本地 青年 人才 回流 。         會上 ， 城市 大學 研究生 會 主席 牟凌彤 、 理事 長 周柏含 、 監事長 何炳昊 、 副 主席 黎俊滔 ， 澳門 城市 大學學 生會 主席 葉沐曦 、 理事 長 劉梓珩 、 監事長 朱浩東 、 副 主席 吳嘉煜 、 副 理事 長 李鶴翔 及 副 監事長 黃 俊銘 分享 講話 體會 。         陳旭偉 總結 指出 ， 學生們 更 應該 把握 良機 ， 珍惜 當下 。 增強 國家 認同 ， 身份 認同 ， 做好 “ 接班人 ” 工作 ， 不斷 開創 “ 一國 兩制 ” 事業 新 局面 。,2025-01-24
《編織和平》門票今發售,《編織和平》門票今發售    【本報消息】文化局訊：文化局將於三月廿一日及廿二日在澳門文化中心綜合劇院上演當代馬戲作品《編織和平》，瑞典心之馬戲團將重臨澳門，以令人嘆為觀止的雜技動作配以現場音樂演奏，呈現當代藝術奇觀。節目門票於今日上午十時起於澳門售票網公開發售。    《編織和平》的創作靈感來自突破界限的欲望，將團結、和平與期望的主題與棉線、繩結結合，舞台上五位雜技演員以驚人的肢體力量挑戰萬有引力，優雅展現飛躍、旋轉等極限動作，結合靈感來自編織針碰撞時輕響的現場音樂效果，恍如一幅動態畫卷。該劇是心之馬戲團的代表作，亦是其最受歡迎的作品，凝聚了馬戲團勇於創新的精神。    心之馬戲團由藝術總監及創意導師狄露特 · 碧約科斯於一九九五年創立，常年在世界各地巡演，例如與美國當代作曲家菲利普 · 格拉斯合作，為觀眾帶來耳目一新的跨界藝術體驗。藝團擅長創作糅合馬戲傳統和歌劇元素的作品，曾於二○○五年在澳門上演節目《九十九個巴仙不知道》。    除演出外，心之馬戲團的表演者亦將帶來一系列工作坊。節目詳情可瀏覽文化局網頁(www.icm.gov.mo)或澳門文化中心網頁(www.ccm.gov.mo)，查詢可致電：二八四○ · ○五五五。,http://www.macaodaily.com/html/2025-01/24/content_1809343.htm,《編織和平》門票今發售    【本報消息】文化局訊：文化局將於三月廿一日及廿二日在澳門文化中心綜合劇院上演當代馬戲作品《編織和平》，瑞典心之馬戲團將重臨澳門，以令人嘆為觀止的雜技動作配以現場音樂演奏，呈現當代藝術奇觀,《 編織 和平 》 門票 今 發售         【 本報 消息 】 文化局 訊 ： 文化局 將於 三月 廿一日 及 廿二日 在 澳門 文化 中心 綜合 劇院 上演 當代馬戲 作品 《 編織 和平 》 ， 瑞典 心之馬 戲團將 重臨 澳門 ， 以 令人 嘆 為 觀止 的 雜技動 作配 以 現場 音樂 演奏 ， 呈現 當代藝術 奇觀 。 節目 門票 於 今日 上午 十時 起 於 澳門 售票 網公開 發售 。         《 編織 和平 》 的 創作靈 感來 自 突破 界限 的 欲望 ， 將團結 、 和平 與 期望 的 主題 與 棉線 、 繩結 結合 ， 舞台 上 五位 雜技 演員以 驚人 的 肢體 力量 挑戰 萬有 引力 ， 優雅展 現飛躍 、 旋轉 等 極限動作 ， 結合靈 感來 自 編織針 碰撞 時輕響 的 現場 音樂 效果 ， 恍如 一幅 動態 畫卷 。 該劇 是 心之馬 戲團 的 代表作 ， 亦 是 其 最受 歡迎 的 作品 ， 凝聚 了 馬 戲團勇 於 創新 的 精神 。         心之馬 戲團 由 藝術 總監 及 創意 導師 狄露 特   ·   碧約 科斯 於 一九九五年 創立 ， 常年 在 世界各地 巡演 ， 例如 與 美國 當代 作曲家 菲利普   ·   格拉斯 合作 ， 為 觀眾 帶來 耳目一新 的 跨界 藝術 體驗 。 藝團 擅長 創作 糅合 馬 戲傳統 和歌 劇 元素 的 作品 ， 曾 於 二 ○ ○ 五年 在 澳門 上演 節目 《 九十九 個巴仙 不 知道 》 。         除 演出 外 ， 心之馬 戲團 的 表演者 亦 將帶 來 一系列 工作坊 。 節目 詳情 可 瀏覽 文化局 網頁 ( www . icm . gov . mo ) 或 澳門 文化 中心 網頁 ( www . ccm . gov . mo ) ， 查詢 可致電 ： 二八 四 ○   ·   ○ 五五 五 。,2025-01-24
街總離島辦倡重新規劃上落客區,利用官也街旁國有土地    街總離島辦倡重新規劃上落客區    【本報消息】街總離島辦事處主任江旭純表示，因應氹仔舊區客流持續增長，建議政府利用官也街旁邊的國有土地，重新規劃巴士、的士和旅遊巴上落客區，完善配套硬件提升旅客接待能力，鞏固世界旅遊休閒中心地位。    去年跟進近百六案    街總離島辦事處主任江旭純、街總離島工作委員會主任林偉雄、街總離島辦事處副主任張郁文、石排灣居民互助會會長林家全、氹仔社區發展促進會副理事長余致力、黑沙村民互助會副理事長吳子龍總結二○二四年該辦事處及離島區坊會工作時稱，去年全年離島辦與區內坊會合共協助居民跟進一百五十九宗個案，主要涉及交通、環境衛生、醫療、社會保障等方面。另外因應居民需要，開展二百四十七場社區活動。    為加強居民的個人和家居安全意識，離島辦與區內坊會持續派員參加社區警務聯絡主任和消防安全主任的培訓活動，交流社區警務和消防訊息，共建安全社區。今年初，離島辦接獲黑沙村民反映深夜常有懷疑改裝車輛在竹灣馬路、黑沙馬路一帶來回飛馳，影響作息，離島辦聯絡有關部門到村民會收集意見，其後政府部署行動加強打擊非法改裝車輛，保障交通安全和社會安寧。    為百七戶檢查爐具    針對本澳不時發生不當使用燃氣爐具引致一氧化碳中毒和家居爆炸等事件，辦事處自二三年十一月起，與消防局燃料安全廳合作開展燃氣設備入戶檢查工作，為濠景花園、日暉大廈、華寶花園和樂群樓，合共一百七十五戶檢查爐具，通過活動提高居民使用爐具的安全意識，防患於未“燃”。    離島近年發展迅速，區內一些民生配套設施未能跟上社會發展，離島辦與區內坊會通過問卷調查、座談會等形式收集居民意見，適時向政府反映，推動政府完善社區建設。,http://www.macaodaily.com/html/2025-01/24/content_1809236.htm,去年跟進近百六案    街總離島辦事處主任江旭純、街總離島工作委員會主任林偉雄、街總離島辦事處副主任張郁文、石排灣居民互助會會長林家全、氹仔社區發展促進會副理事長余致力、黑沙村民互助會副理事長吳子龍總結二○二四年該辦事處及離島區坊會工作時稱，去年全年離島辦與區內坊會合共協助居民跟進一百五十九宗個案，主要涉及交通、環境衛生、醫療、社會保障等方面,利用 官 也 街 旁國 有 土地         街 總離島 辦倡 重新 規劃 上 落 客區         【 本報 消息 】 街 總離島 辦事處 主任 江旭純 表示 ， 因應 氹 仔舊區 客流 持續 增長 ， 建議 政府 利用 官 也 街 旁邊 的 國有 土地 ， 重新 規劃 巴士 、 的士 和 旅遊 巴上 落 客區 ， 完善 配套 硬件 提升 旅客 接待 能力 ， 鞏固 世界 旅遊 休閒 中心 地位 。         去年 跟 進 近百 六案         街 總離島 辦事處 主任 江旭純 、 街 總離島 工作 委員會 主任 林偉雄 、 街 總離島 辦事處 副 主任 張郁文 、 石排灣 居民 互助 會會長 林家 全 、 氹 仔社區 發展 促進會 副 理事 長 余 致力 、 黑沙 村民 互助 會 副 理事 長 吳子龍 總結 二 ○ 二 四年 該 辦事處 及 離島 區坊 會 工作 時稱 ， 去年 全年 離島 辦與區 內坊 會 合共 協助 居民 跟 進 一百五十 九宗個 案 ， 主要 涉及 交通 、 環境 衛生 、 醫療 、 社會 保障 等 方面 。 另外 因應 居民 需要 ， 開展 二百四十 七場 社區 活動 。         為 加強 居民 的 個 人 和 家居 安全 意識 ， 離島 辦與區 內坊 會 持續 派員 參加 社區 警務聯絡 主任 和 消防安全 主任 的 培訓 活動 ， 交流 社區 警務 和 消防 訊息 ， 共建 安全 社區 。 今年初 ， 離島 辦接 獲 黑沙 村民 反映 深夜 常有 懷疑 改裝 車輛 在 竹灣馬路 、 黑沙 馬 路 一帶 來 回飛馳 ， 影響 作息 ， 離島 辦聯絡 有 關部門 到 村民 會 收集 意見 ， 其 後 政府 部署 行動 加強 打擊 非法 改裝 車輛 ， 保障 交通安全 和 社會安寧 。         為 百七戶 檢查 爐具         針對本 澳不時 發生 不當 使用 燃氣 爐具 引致 一氧化碳 中毒 和 家居 爆炸 等 事件 ， 辦事處 自 二三年 十一月 起 ， 與 消防局 燃料 安全 廳 合作 開展 燃氣 設備 入戶 檢查 工作 ， 為 濠 景花園 、 日暉 大廈 、 華寶花園 和 樂 群樓 ， 合共 一百七十 五戶 檢查 爐具 ， 通過 活動 提高 居民 使用 爐具 的 安全 意識 ， 防患 於 未 “ 燃 ” 。         離島 近年 發展 迅速 ， 區內 一些 民生 配套 設施 未能 跟上 社會 發展 ， 離島 辦與區 內坊 會 通過 問卷 調查 、 座 談會 等 形式 收集 居民 意見 ， 適時 向 政府 反映 ， 推動 政府 完善 社區 建設 。,2025-01-24
