Title,Content,Link,Summary,Preprocessed_Content,Date
“多元迴響”展藝術家豐富媒材,“多元迴響”展藝術家豐富媒材    澳門作為對外文化交流的窗口，為青年創作者提供了多樣化的平台。早前，澳門藝術聯盟舉辦了以“多元迴響”為主題的展覽，澳視澳門（91台）今晚九時播映的《澳門人 · 澳門事》，將帶觀眾欣賞這些藝術家的精彩作品。    今次展覽為當代青年藝術家提供了包容而全面的視角，展示了多元化的媒材創作，也反映了地區性的獨特文化景觀。展出三十位國內和澳門藝術家七十三件作品，並體現多元文化的“包容性”、“多元性”與“創新性”。藝術家各自展出在生活中體驗到的多元情緒，並把它化成的視覺圖像，讓觀眾可以體驗多元主題，參展作品之間互相呼應，激發觀眾更深層的思考。,http://www.macaodaily.com/html/2025-01/08/content_1805843.htm,早前，澳門藝術聯盟舉辦了以“多元迴響”為主題的展覽，澳視澳門（91台）今晚九時播映的《澳門人 · 澳門事》，將帶觀眾欣賞這些藝術家的精彩作品,“ 多元 迴 響 ” 展藝術家 豐富 媒材         澳門作 為 對 外 文化交流 的 窗口 ， 為 青年 創 作者 提供 了 多樣化 的 平台 。 早前 ， 澳門 藝術 聯盟 舉辦 了 以 “ 多元 迴 響 ” 為主題 的 展覽 ， 澳視 澳門 （ 91 台 ） 今晚 九時 播映 的 《 澳門 人   ·   澳門事 》 ， 將帶 觀眾 欣賞 這些 藝術家 的 精彩 作品 。         今次 展覽為 當代 青年 藝術家 提供 了 包容 而 全面 的 視角 ， 展示 了 多元化 的 媒材 創作 ， 也 反映 了 地區性 的 獨特 文化 景觀 。 展出 三十位 國內 和 澳門 藝術家 七十 三件 作品 ， 並體現 多元 文化 的 “ 包容性 ” 、 “ 多元性 ” 與 “ 創新性 ” 。 藝術家 各自 展出 在生活中 體驗 到 的 多元 情緒 ， 並把 它 化成 的 視覺 圖 像 ， 讓 觀眾 可以 體驗 多元 主題 ， 參展 作品 之間 互相 呼應 ， 激發 觀眾 更深 層 的 思考 。,2025-01-08
澳門光華曲藝會今永樂響鑼,澳門光華曲藝會今永樂響鑼    由澳門光華曲藝會主辦，澳門音樂曲藝粵劇總會協辦，澳門特區政府文化發展基金、霍英東基金會贊助的“光華戲曲展演會——賀新春光華戲曲演唱會”，今日下午二時假永樂戲院演出。    演出內容：一、折子戲《紅鸞喜》（王寶安）；二、《悲怨別重臺》（何少芬、伍美容）；三、折子戲《狄青闖三關》（龍振飛、劉采姫）；四、《禪院鐘聲、光緒皇夜祭珍妃、絕代雙嬌、平湖秋月、水中情》等（江靜華、甘連崧、李煥生、小雨、廖聯斌、許富雁）；五、《幾度悔情慳》（胡棟榮、伍美容）；六、折子戲《幻覺離恨天》（龍振飛、劉采姫）、七、《潞安洲》（龍振飛、甘連崧、鄭家和）；八、折子戲《再進沈園》（鄭家和）。,http://www.macaodaily.com/html/2025-01/08/content_1805844.htm,六、折子戲《幻覺離恨天》（龍振飛、劉采姫）、七、《潞安洲》（龍振飛、甘連崧、鄭家和）,澳門 光華曲 藝會 今永樂 響鑼         由 澳門 光華曲 藝會 主辦 ， 澳門 音樂曲 藝粵劇 總會 協辦 ， 澳門 特區 政府 文化 發展 基金 、 霍英東 基金 會 贊助 的 “ 光華戲曲 展演 會 — — 賀新 春光 華戲曲 演唱 會 ” ， 今日 下午 二時 假永樂 戲院 演出 。         演出 內容 ： 一 、 折子 戲 《 紅鸞 喜 》 （ 王寶安 ） ； 二 、 《 悲怨 別重 臺 》 （ 何少芬 、 伍 美容 ） ； 三 、 折子 戲 《 狄青 闖三關 》 （ 龍振飛 、 劉采姫 ） ； 四 、 《 禪院 鐘聲 、 光緒 皇夜 祭珍 妃 、 絕代 雙嬌 、 平湖 秋月 、 水中 情 》 等 （ 江靜華 、 甘連 崧 、 李煥生 、 小雨 、 廖聯斌 、 許富雁 ） ； 五 、 《 幾度 悔情 慳 》 （ 胡棟榮 、 伍 美容 ） ； 六 、 折子 戲 《 幻覺 離恨 天 》 （ 龍振飛 、 劉采姫 ） 、 七 、 《 潞安 洲 》 （ 龍振飛 、 甘連 崧 、 鄭家 和 ） ； 八 、 折子 戲 《 再進 沈園 》 （ 鄭家 和 ） 。,2025-01-08
澳門詠芝曲藝會永樂派票,澳門詠芝曲藝會永樂派票    由澳門詠芝曲藝會主辦，澳門粵劇曲藝總會合辦，澳門文化發展基金、澳門霍英東基金會、澳門粵劇曲藝總會等單位仝贊助的“詠芝永樂粵韻耀濠江”折子戲曲藝會二〇二五，一月九日下午二時假永樂戲院演出。    演出內容：一、《漢宮秋夜雨》（程國容、霍慧儀）；二、折子戲《梁紅玉之計議》（梁春蘭、蘇超芳）；三、《雷鳴金鼓戰笳聲》（陳鴻暉、余美彩）；四、《花園對駡》（王善松、劉麗影）；五、《洛水夢會》（陳玉燕、李麗娟）；六、《別館盟心》（黃冠翹、張淑霞）；七、《鼓舞傾情》（    譚光林、梁美美）；八、《狄青闖三關》（陳偉林、張婉薇）。現主辦單位預留一百張門票，今午一時在永樂戲院大堂免費派發，歡迎居民到場索取。,http://www.macaodaily.com/html/2025-01/08/content_1805846.htm,澳門詠芝曲藝會永樂派票    由澳門詠芝曲藝會主辦，澳門粵劇曲藝總會合辦，澳門文化發展基金、澳門霍英東基金會、澳門粵劇曲藝總會等單位仝贊助的“詠芝永樂粵韻耀濠江”折子戲曲藝會二〇二五，一月九日下午二時假永樂戲院演出,澳門 詠 芝曲 藝會永樂 派票         由 澳門 詠 芝曲 藝會 主辦 ， 澳門粵劇 曲藝 總會 合辦 ， 澳門 文化 發展 基金 、 澳門 霍英東 基金 會 、 澳門粵劇 曲藝 總會 等 單位 仝贊助 的 “ 詠 芝永樂粵韻耀 濠江 ” 折子 戲曲 藝會 二 〇 二五 ， 一月 九日 下午 二時 假永樂 戲院 演出 。         演出 內容 ： 一 、 《 漢宮 秋夜 雨 》 （ 程國容 、 霍慧儀 ） ； 二 、 折子 戲 《 梁紅玉 之 計議 》 （ 梁春蘭 、 蘇超芳 ） ； 三 、 《 雷鳴 金鼓 戰笳聲 》 （ 陳鴻暉 、 余美彩 ） ； 四 、 《 花園 對 駡 》 （ 王善松 、 劉麗影 ） ； 五 、 《 洛水 夢會 》 （ 陳 玉燕 、 李麗娟 ） ； 六 、 《 別館 盟心 》 （ 黃 冠 翹 、 張淑霞 ） ； 七 、 《 鼓舞 傾情 》 （         譚光林 、 梁 美美 ） ； 八 、 《 狄青 闖三關 》 （ 陳 偉林 、 張婉薇 ） 。 現主辦 單位 預留 一百 張門票 ， 今午 一時 在 永樂 戲院 大堂 免費 派發 ， 歡迎 居民 到場 索取 。,2025-01-08
薛達亞高雯金球獎高調曬鑽戒,湯荷倫疑求婚成功    薛達亞高雯金球獎高調曬鑽戒    青春女星薛達亞高雯(Zendaya Coleman)及蜘蛛仔湯荷倫(Tom Holland)是很受戲迷歡迎的銀幕及現實中的情侶，最近有傳湯荷倫在聖誕節至元旦期間求婚成功。鷹眼的網民早在薛達亞參加日前金球獎頒獎禮時，發現她在無名指戴住價值四十萬美元（約三百二十萬澳門元）的超巨型超閃的鑽戒。    珠寶商Laura Taylor估計，該枚戒指分分鐘價值五十萬美元（約四百萬澳門元），她說：“它本身鑲有一顆相當大的鑽石，可能在五至六卡範圍內，鑲嵌在簡單的黃金圈戒上。”知情人士透露，湯荷倫是在某天兩人獨處時，突然拿着戒指向薛達亞求婚，周遭沒有親友，這場求婚被形容為浪漫但不過分，非常溫馨。薛達亞在感動之餘，亦火速回應了湯荷倫的求婚，笑住答應做Mrs Holland。    根據TMZ報道，湯荷倫在求婚前幾個月就得到了薛達亞父親Kazembe Ajamu Coleman的祝福，問準了“岳父大人”的首肯。據說薛達亞的家人對他們即將結婚感到非常興奮，並對湯荷倫評價很高。爆料者稱薛達亞的所有親友都十分認同及喜歡湯荷倫，視他為荷里活一流的演員。然而，湯荷倫為了向女神求婚，處心積慮等了幾個月才尋找到合適的時機“單膝下跪”，得到的回應是皆大歡喜。    其實，薛達亞和湯荷倫是雙向奔赴的愛情，早前湯荷倫高調向薛達亞示愛，薛達亞也會“低調”地回應他的愛情。在金球獎時，網民就發現到薛達亞的左胸腔附近似乎有一個“t”字的小紋身，網上迅即展開熱烈討論，無不為他們的戀情鼓掌叫好。,http://www.macaodaily.com/html/2025-01/08/content_1805841.htm,湯荷倫疑求婚成功    薛達亞高雯金球獎高調曬鑽戒    青春女星薛達亞高雯(Zendaya Coleman)及蜘蛛仔湯荷倫(Tom Holland)是很受戲迷歡迎的銀幕及現實中的情侶，最近有傳湯荷倫在聖誕節至元旦期間求婚成功,湯荷倫疑 求婚 成功         薛達亞 高雯 金球 獎高調 曬 鑽戒         青春 女星 薛達亞 高雯 ( Zendaya   Coleman ) 及 蜘蛛 仔湯 荷倫 ( Tom   Holland ) 是 很 受戲 迷歡 迎 的 銀幕 及 現實 中 的 情侶 ， 最近 有 傳湯 荷倫 在 聖誕節 至 元旦 期間 求婚 成功 。 鷹眼 的 網民早 在 薛達亞 參加 日前 金球 獎頒獎 禮時 ， 發現 她 在 無名 指戴住 價值 四十 萬 美元 （ 約 三百 二十 萬澳門 元 ） 的 超巨型 超閃 的 鑽戒 。         珠寶商 Laura   Taylor 估計 ， 該枚 戒指 分分鐘 價值 五十 萬 美元 （ 約 四百 萬澳門 元 ） ， 她 說 ： “ 它 本身 鑲有 一顆 相當 大 的 鑽石 ， 可能 在 五至 六卡範圍 內 ， 鑲嵌 在 簡單 的 黃 金圈 戒上 。 ” 知情 人士 透露 ， 湯荷倫 是 在 某天 兩人 獨處 時 ， 突然 拿 着 戒指 向 薛達亞 求婚 ， 周遭 沒有 親友 ， 這場 求婚 被 形容 為 浪漫 但 不 過分 ， 非常 溫馨 。 薛達亞 在 感動 之餘 ， 亦 火速 回應 了 湯荷倫 的 求婚 ， 笑 住 答應 做 Mrs   Holland 。         根據 TMZ 報道 ， 湯荷倫 在 求婚 前 幾個 月 就 得到 了 薛達亞 父親 Kazembe   Ajamu   Coleman 的 祝福 ， 問準 了 “ 岳父 大人 ” 的 首肯 。 據 說 薛達亞 的 家人 對 他們 即將 結婚 感到 非常 興奮 ， 並對 湯荷倫 評價 很 高 。 爆料 者 稱 薛達亞 的 所有 親友 都 十分 認同 及 喜歡 湯荷倫 ， 視 他 為 荷里活 一流 的 演員 。 然而 ， 湯荷倫為 了 向 女神 求婚 ， 處心 積慮 等 了 幾個 月 才 尋 找到 合適 的 時機 “ 單 膝下 跪 ” ， 得到 的 回應 是 皆 大歡 喜 。         其實 ， 薛達亞 和 湯荷倫 是 雙向 奔赴 的 愛情 ， 早前 湯荷倫 高調 向 薛達亞示 愛 ， 薛達亞 也 會 “ 低調 ” 地 回應 他 的 愛情 。 在 金球 獎時 ， 網民 就 發現 到 薛達亞 的 左 胸腔 附近 似乎 有 一個 “ t ” 字 的 小紋身 ， 網上 迅即 展開 熱烈 討論 ， 無不為 他們 的 戀情 鼓掌 叫好 。,2025-01-08
山田裕貴短髮新造型獲讚,山田裕貴短髮新造型獲讚    前日，日本男星山田裕貴受邀出席日本生命的新保險產品發佈會，為該產品作宣傳。當日他身穿淺棕色襯衫，外搭一件深棕色西裝外套，一頭清爽俐落的黑色短髮十分吸睛，他更把臉上的鬍鬚剃掉，露出白淨的臉頰。    事實上，他早前也驚喜現身熱門劇《爆上戰隊BoonBoomger》中，扮演喬 · 基布肯，協助主角完成任務後就瀟灑離場，他的出現馬上引起熱議。不過，其在電視劇中造型就被人說“老餅”，皆因他留着長長的劉海。而今次出席活動時，他透露剪頭髮的原因，他說：“我想在新的一年裡看起來明亮、清爽。”而粉絲就大讚他短髮帥氣又有活力，讓三十四歲的他看上去也年輕了好幾歲。,http://www.macaodaily.com/html/2025-01/08/content_1805845.htm,當日他身穿淺棕色襯衫，外搭一件深棕色西裝外套，一頭清爽俐落的黑色短髮十分吸睛，他更把臉上的鬍鬚剃掉，露出白淨的臉頰,山田 裕貴 短 髮 新造型 獲 讚         前日 ， 日本 男星 山田 裕貴 受邀 出席 日本 生命 的 新 保險 產品 發 佈 會 ， 為 該 產品 作宣傳 。 當日 他 身穿 淺 棕色 襯衫 ， 外 搭 一件 深棕色 西裝 外套 ， 一頭 清爽 俐落 的 黑色 短 髮 十分 吸睛 ， 他 更 把 臉 上 的 鬍 鬚 剃 掉 ， 露出 白淨 的 臉頰 。         事實 上 ， 他 早前 也 驚喜 現身 熱門劇 《 爆上 戰隊 BoonBoomger 》 中 ， 扮演 喬   ·   基布 肯 ， 協助 主角 完成 任務 後 就 瀟灑 離場 ， 他 的 出現 馬 上 引起 熱議 。 不過 ， 其 在 電視劇 中 造型 就 被 人 說 “ 老餅 ” ， 皆 因 他 留 着 長 長 的 劉海 。 而今 次 出席 活動時 ， 他 透露 剪頭 髮 的 原因 ， 他 說 ： “ 我 想 在 新 的 一年 裡看 起來 明亮 、 清爽 。 ” 而 粉絲 就 大 讚 他 短 髮 帥 氣 又 有 活力 ， 讓 三十四 歲 的 他 看上去 也 年 輕 了 好 幾歲 。,2025-01-08
朴勝賢猝逝享年三十四歲,朴勝賢猝逝享年三十四歲    日前，韓國知名健身網紅朴勝賢因健康問題突然離世，由家屬證實死訊，享年三十四歲。朴勝賢在YouTube頻道上有八十三萬粉絲，擁有健壯身材的他，經常分享自己的健身歷程和心得。朴勝賢的家屬亦在社交平台公開靈堂照片，目前因雙親過度悲痛不接受採訪，靈堂也不開放弔唁。    朴勝賢的健身生涯也並非一帆風順，他曾因健康問題消失在社交平台上近十個月，二四年回歸YouTube頻道後，他在影片中表示自己罹患憂鬱症，而他在離世前一天曾發帖文，寫道：“今天的二頭肌健身……體重剛下降至一百一十公斤，因為努力控制飲食，熱情和目標都消失了，感覺到孤獨……”現在，粉絲紛紛在社交平台上留言悼念，希望他一路好走。,http://www.macaodaily.com/html/2025-01/08/content_1805847.htm,朴勝賢的健身生涯也並非一帆風順，他曾因健康問題消失在社交平台上近十個月，二四年回歸YouTube頻道後，他在影片中表示自己罹患憂鬱症，而他在離世前一天曾發帖文，寫道：“今天的二頭肌健身,朴勝賢 猝逝 享年 三十四 歲         日前 ， 韓國 知名 健身 網紅朴 勝賢因 健康 問題 突然 離世 ， 由家屬 證實 死 訊 ， 享年 三十四 歲 。 朴勝賢 在 YouTube 頻道 上 有 八十三 萬粉 絲 ， 擁有 健壯 身材 的 他 ， 經常 分享 自己 的 健身 歷程 和 心得 。 朴勝賢 的 家屬 亦 在 社交 平台 公開 靈堂 照片 ， 目前 因雙親 過度 悲痛 不 接受 採訪 ， 靈堂 也 不 開放 弔 唁 。         朴勝賢 的 健身 生涯 也 並非 一帆 風順 ， 他 曾 因 健康 問題 消失 在 社交 平台 上 近十個 月 ， 二 四年 回歸 YouTube 頻道 後 ， 他 在 影片 中 表示 自己 罹患 憂鬱症 ， 而 他 在 離世 前一天 曾 發帖文 ， 寫道 ： “ 今天 的 二頭 肌 健身 … … 體重剛 下降 至 一百一十 公斤 ， 因為 努力 控制 飲食 ， 熱情 和 目標 都 消失 了 ， 感覺 到 孤獨 … … ” 現在 ， 粉絲 紛紛 在 社交 平台 上 留言 悼念 ， 希望 他 一路 好 走 。,2025-01-08
妮琪美納涉襲擊前經理人惹官非,妮琪美納涉襲擊前經理人惹官非    四十二歲的黑人饒舌天后妮琪美納(Nicki Minaj)向來容易惹官非，早前她被前經理人Brandon Garrett提告，Brandon向妮琪提出襲擊起訴。據媒體TMZ報道，妮琪未有任何被拘留的風險，檢方發言人稱現在沒有足夠的犯罪證據逮捕妮琪。    消息指，Brandon聲稱原名Onika Tanya Maraj的妮琪曾在去年四月於Little Caesars Arena體育館的後台對他進行了人身攻擊並威脅他，Brandon自稱對此無法理解，並感到非常震驚。在妮琪向《每日郵報》提供的聲明中，她的律師Judd Burstein猛烈抨擊該訴訟是“虛假且無聊”，Judd還暗示Brandon只是妮琪的“前助理”，而不是前經理人。,http://www.macaodaily.com/html/2025-01/08/content_1805848.htm,妮琪美納涉襲擊前經理人惹官非    四十二歲的黑人饒舌天后妮琪美納(Nicki Minaj)向來容易惹官非，早前她被前經理人Brandon Garrett提告，Brandon向妮琪提出襲擊起訴,妮琪 美納涉 襲擊前 經理 人 惹 官非         四十二 歲 的 黑人 饒舌天 后妮琪 美納 ( Nicki   Minaj ) 向 來 容易 惹 官非 ， 早前 她 被 前 經理 人 Brandon   Garrett 提告 ， Brandon 向妮琪 提出 襲擊 起訴 。 據 媒體 TMZ 報道 ， 妮琪 未有 任何 被 拘留 的 風險 ， 檢方 發言人 稱現 在 沒 有 足夠 的 犯罪 證據 逮捕 妮琪 。         消息 指 ， Brandon 聲稱 原名 Onika   Tanya   Maraj 的 妮琪 曾 在 去年 四月 於 Little   Caesars   Arena 體育館 的 後 台 對 他 進行 了 人身 攻擊 並威脅 他 ， Brandon 自稱 對 此無法 理解 ， 並 感到 非常 震驚 。 在 妮琪 向 《 每日 郵報 》 提供 的 聲明 中 ， 她 的 律師 Judd   Burstein 猛烈 抨擊 該 訴訟 是 “ 虛假且 無聊 ” ， Judd 還 暗示 Brandon 只是 妮琪 的 “ 前 助理 ” ， 而 不是 前經理 人 。,2025-01-08
賓艾弗力籮霸達成離婚協議,賓艾弗力籮霸達成離婚協議    相對結婚時的高調，“Bennifer”荷里活型男賓艾弗力(Ben Affleck)以及“籮霸”女星珍妮花露柏絲(Jennifer Lopez)近日就低調地達成離婚協議。據DailyMail.com證實，兩人就共同購買的價值六千一百萬美元（約四億八千八百萬澳門元）的比華利山莊豪宅達成協議，不過具體條款仍是保密。    當時，Bennifer的復合到決定結婚，或者他們是因愛情衝昏了頭腦，又有可能從來沒有想過會離婚，所以坐擁巨資的他們沒有簽訂婚前協議。兩人的共同財產高達五億五千萬美元（約四十四億澳門元），其中，籮霸的身家佔多數，估計高達四億美元（約卅二億澳門元）。,http://www.macaodaily.com/html/2025-01/08/content_1805849.htm,據DailyMail.com證實，兩人就共同購買的價值六千一百萬美元（約四億八千八百萬澳門元）的比華利山莊豪宅達成協議，不過具體條款仍是保密,賓艾弗力 籮 霸達成 離婚 協議         相對 結婚 時 的 高調 ， “ Bennifer ” 荷里活 型 男賓 艾弗力 ( Ben   Affleck ) 以及 “ 籮霸 ” 女星 珍妮花 露柏絲 ( Jennifer   Lopez ) 近日 就 低調 地達成 離婚 協議 。 據 DailyMail . com 證實 ， 兩人 就 共同 購買 的 價值 六千 一百 萬 美元 （ 約 四 億八 千八百 萬澳門 元 ） 的 比華利山莊 豪宅 達成 協議 ， 不過 具體 條款 仍 是 保密 。         當時 ， Bennifer 的 復 合到 決定 結婚 ， 或者 他們 是 因愛情 衝昏 了 頭腦 ， 又 有 可能 從來 沒 有 想 過會 離婚 ， 所以 坐擁 巨資 的 他們 沒有 簽訂 婚前 協議 。 兩人 的 共同 財產 高達 五 億 五千 萬 美元 （ 約 四十四 億澳門 元 ） ， 其中 ， 籮霸 的 身家 佔多數 ， 估計 高達 四 億 美元 （ 約卅二 億澳門 元 ） 。,2025-01-08
《超音鼠大電影3》票房大賣,《超音鼠大電影3》票房大賣    自去年十二月二十日上映以來，電影《超音鼠大電影3》(Sonic the Hedgehog 3)的全球票房收入已有三億三千六百五十萬美元（約二十六億九百二十萬澳門元），使《超》系列總計票房突破十億美元（約八十億澳門元）的大關。    《超》電影系列成為荷里活史上最賺錢的電玩遊戲改編電影之一，與《超級瑪利歐兄弟大電影》、《POKéMON 神探Pikachu》和《生化危機》等電影系列齊名。派拉蒙影業(Paramount)在《超3》上映後，已經計劃開拍《超4》，預計將在二七年上映。網民揶揄諧星占基利(Jim Carrey)金口一開，自認等錢使的他都不愁片約，單是《超3》都讓他賺到笑。,http://www.macaodaily.com/html/2025-01/08/content_1805851.htm,《超音鼠大電影3》票房大賣    自去年十二月二十日上映以來，電影《超音鼠大電影3》(Sonic the Hedgehog 3)的全球票房收入已有三億三千六百五十萬美元（約二十六億九百二十萬澳門元），使《超》系列總計票房突破十億美元（約八十億澳門元）的大關,《 超音鼠 大電影 3 》 票房 大賣         自 去年 十二月 二十日 上映 以來 ， 電影 《 超音鼠 大電影 3 》 ( Sonic   the   Hedgehog   3 ) 的 全球 票房 收入 已有 三億 三千 六百五十 萬 美元 （ 約 二十六 億 九百 二十 萬澳門 元 ） ， 使 《 超 》 系列 總計 票房 突破 十億 美元 （ 約 八十 億澳門 元 ） 的 大關 。         《 超 》 電影 系列 成為 荷里活 史上 最 賺 錢 的 電玩遊戲 改編 電影 之一 ， 與 《 超級 瑪利歐 兄弟 大電影 》 、 《 POK é MON   神探 Pikachu 》 和 《 生化 危機 》 等 電影 系列 齊名 。 派拉蒙 影業 ( Paramount ) 在 《 超 3 》 上映 後 ， 已經 計劃 開 拍 《 超 4 》 ， 預計將 在 二七 年 上映 。 網民 揶揄 諧星 占 基利 ( Jim   Carrey ) 金口 一開 ， 自認 等 錢 使 的 他 都 不愁 片 約 ， 單是 《 超 3 》 都 讓 他 賺 到 笑 。,2025-01-08
視事關心,視事關心    極限釣魚大挑戰：2    有線(51)BBC EARTH今晚十時五十分播映。羅伯森葛林又回來了，這次他將與那些每天為我們提供食物的漁民一起工作，測試自己的極限。    黃金48小時    有線(64)罪案偵緝頻道今晚八時十五分播映。在土爾沙，年輕的父親讓一歲的女兒入睡後，在車道上被開了好幾槍。警探傑森希望現場發現的藥瓶將有助於警方找到兇手。    澳洲頂級廚師    有線(68)高清生活時光今晚八時半播映。來自悉尼傳奇日本餐廳的寺崎美紀子，在本集展示製作蛋包飯的技巧，而一眾參賽者將在七十五分鐘內創造一道以雞蛋為主角的菜餚。,http://www.macaodaily.com/html/2025-01/08/content_1805854.htm,來自悉尼傳奇日本餐廳的寺崎美紀子，在本集展示製作蛋包飯的技巧，而一眾參賽者將在七十五分鐘內創造一道以雞蛋為主角的菜餚,視事 關心         極限 釣魚 大 挑戰 ： 2         有線 ( 51 ) BBC   EARTH 今晚 十時 五 十分 播映 。 羅 伯森葛林 又 回來 了 ， 這次 他將 與 那些 每天 為 我們 提供 食物 的 漁民 一起 工作 ， 測試 自己 的 極限 。         黃 金 48 小時         有線 ( 64 ) 罪案 偵緝頻 道 今晚 八時 十五分 播映 。 在 土爾沙 ， 年 輕 的 父親 讓 一歲 的 女兒 入睡 後 ， 在 車道 上 被 開 了 好 幾槍 。 警探 傑森 希望 現場 發現 的 藥瓶將 有助 於 警方 找到 兇手 。         澳洲 頂級 廚師         有線 ( 68 ) 高清 生活 時光 今晚 八時 半 播映 。 來 自 悉尼 傳奇 日本 餐廳 的 寺崎美紀子 ， 在 本集 展示 製 作 蛋包 飯 的 技巧 ， 而 一眾 參賽者 將在 七十五 分鐘 內 創造 一道 以雞 蛋 為 主角 的 菜餚 。,2025-01-08
