Title,Content,Link,Summary,Preprocessed_Content,Date
韶關乳源聯誼會首屆就職,韶關乳源聯誼會首屆就職    【本報消息】澳門韶關乳源聯誼會日前假萬豪軒酒家蓮花廳舉行第一屆理監事就職典禮。    副理事長兼就職典禮司儀謝天賜先介紹乳源基本情況，並邀請會長陳慶嫦致就任詞。陳慶嫦致詞承諾，首任理監事堅定落實“愛國愛澳，廣泛聯繫和團結鄉親”之核心宗旨，讓居民深入認識祖國，並於促進澳乳兩地經貿往來及文化交流方面作出貢獻。    理事長李勝欣表示，將推動會務健康有序發展，期望聯誼會往後能招募更多來自社會各界人士，尤其是澳門本地青年，以更好向澳門介紹乳源，為澳乳兩地的持續和諧發展做出應有貢獻。    韶關市乳源瑤族自治縣縣委書紀陳大川介紹，現時乳源立足國家重點生態功能區、粵北生態屏障定位，積極發展文化旅遊、生態特色農業，捉緊大灣區產業有序轉移機遇，乳源經濟社會發展及各項事業高品質發展均取得新進步新成效。    陳大川期許澳門韶關乳源聯誼會堅持實持落實“一國兩制”偉大實踐，支持特區政府依法施政，傳承愛國愛澳核心價值，凝聚一切積極力量，愛國愛澳力量不斷發展壯大。澳門韶關乳源聯誼會作為聯繫澳門乳源的平台，對推進兩地交流交往，助推兩地經濟建設發展具有重要作用。    會上，陳慶嫦帶領首屆全體理監事於中聯辦協調部副部長劉冠宇，陳大川，澳門韶關地區聯誼會會長盧德基監誓下宣誓就職。,http://www.macaodaily.com/html/2025-01/10/content_1806361.htm,陳大川期許澳門韶關乳源聯誼會堅持實持落實“一國兩制”偉大實踐，支持特區政府依法施政，傳承愛國愛澳核心價值，凝聚一切積極力量，愛國愛澳力量不斷發展壯大,韶關 乳源 聯誼會 首屆 就 職         【 本報 消息 】 澳門韶關 乳源 聯誼會 日前 假萬豪軒 酒家 蓮花廳 舉行 第一 屆理 監事 就 職典禮 。         副 理事 長 兼 就 職典 禮司 儀謝 天賜 先介紹 乳源 基本 情況 ， 並邀 請會長 陳 慶嫦致 就任 詞 。 陳 慶嫦致 詞承諾 ， 首任 理監事 堅定 落實 “ 愛國 愛澳 ， 廣泛 聯 繫 和 團 結 鄉 親 ” 之 核心 宗旨 ， 讓 居民 深入 認識 祖國 ， 並於促 進澳乳 兩地 經貿往 來 及 文化交流 方面 作出 貢獻 。         理事 長 李勝欣 表示 ， 將推動 會務 健康 有序 發展 ， 期望 聯誼會 往後能 招募 更多來 自社會 各界人士 ， 尤其 是 澳門 本地 青年 ， 以 更好 向 澳門 介紹 乳源 ， 為 澳乳 兩地 的 持續 和諧 發展 做出 應有 貢獻 。         韶關市 乳源 瑤族 自治 縣縣 委書紀 陳 大川 介紹 ， 現時 乳源 立足 國家 重點 生態 功能 區 、 粵北 生態 屏障 定位 ， 積極 發展 文化 旅遊 、 生態 特色 農業 ， 捉 緊大灣區 產業 有序 轉移 機遇 ， 乳源 經濟 社會 發展 及 各項 事業 高品質 發展 均 取得 新 進步 新 成效 。         陳 大川 期許 澳門韶關 乳源 聯誼會 堅持 實持 落實 “ 一國 兩制 ” 偉大 實踐 ， 支持 特區 政府 依法 施政 ， 傳承愛國 愛澳 核心 價值 ， 凝聚 一切 積極 力量 ， 愛國 愛澳 力量 不斷 發展 壯大 。 澳門韶關 乳源 聯誼會 作為 聯 繫 澳 門 乳源 的 平台 ， 對 推進 兩地 交流 交往 ， 助推 兩地 經濟 建設 發展 具有 重要 作用 。         會上 ， 陳 慶嫦帶 領首屆 全體理 監事 於 中聯辦 協調 部副 部長 劉冠宇 ， 陳 大川 ， 澳門韶關 地區 聯誼 會會長 盧德 基監 誓 下 宣誓 就 職 。,2025-01-10
傢俬建材裝修協會新閣就職,傢俬建材裝修協會新閣就職    【本報消息】澳門傢俬建材裝修協會昨舉行“第二屆澳門傢俬建材裝修協會就職典禮”。創會會長兼會長侯沐天表示，該會過去積極促進行業交流及宣傳，積極關心社群。期望在新屆特區政府帶領下，會務持續發展，並支持澳門經濟多元發展。    活動昨日下午三點假澳門皇冠假日酒店二樓明珠殿舉行，協會新一屆理監事宣誓就職，由澳區全國人大代表、立法議員施家倫，澳區全國人大代表、工聯總會會長何雪卿共同監誓。澳門消費者委員會活動投訴及監察處長黃枝昌，澳區全國人大代表吳小麗，全國政協常委何潤生，行政會委員陳家良、陳澤武，立法議員宋碧琪、李良汪、李靜儀、林倫偉、謝誓宏、高天賜、梁孫旭、鄭安庭，以及多名各界友好社團負責人到賀。侯沐天、理事長林靜儀、監事長李悅創等迎迓。    侯沐天致詞表示，協會成立第四年，旨在團結愛國愛澳人士，開拓、指導、協調和推動行業專業化、程序化、標準化，促進行業內專業人員交流、推廣、宣傳，包括免費幫助居民驗窗、免費為居民提供裝修培訓課程自以及為會員提供維修保養服務。同時積極關心社群，參與澳門各項公益及社會活動，並積極扶持社會低下層。    隨後，該會向永遠榮譽會長、榮譽會長、名譽會長、會務顧問等頒發聘書，還向第三屆裝修培訓班的學員頒發結業證書。,http://www.macaodaily.com/html/2025-01/10/content_1806362.htm,澳門消費者委員會活動投訴及監察處長黃枝昌，澳區全國人大代表吳小麗，全國政協常委何潤生，行政會委員陳家良、陳澤武，立法議員宋碧琪、李良汪、李靜儀、林倫偉、謝誓宏、高天賜、梁孫旭、鄭安庭，以及多名各界友好社團負責人到賀,傢俬 建材 裝修 協會 新閣 就 職         【 本報 消息 】 澳門 傢俬 建材 裝修 協會 昨舉行 “ 第二 屆 澳門 傢俬 建材 裝修 協會 就 職典禮 ” 。 創會會長 兼會長 侯沐天 表示 ， 該會過 去 積極 促進 行業 交流 及 宣傳 ， 積極 關心 社群 。 期望 在 新屆 特區 政府 帶 領下 ， 會務持續 發展 ， 並 支持 澳門 經濟 多元 發展 。         活動 昨日 下午 三點 假 澳門 皇冠 假日酒店 二樓 明珠 殿 舉行 ， 協會 新 一屆理 監事 宣誓 就 職 ， 由 澳區 全國 人大代表 、 立法 議員施 家倫 ， 澳區 全國 人大代表 、 工聯 總會會長 何雪卿 共同 監誓 。 澳門 消費者 委員會 活動 投訴 及 監察處 長 黃 枝昌 ， 澳區 全國 人大代表 吳小麗 ， 全國政協 常委 何潤生 ， 行政 會委員陳家良 、 陳澤武 ， 立法 議員 宋碧琪 、 李良 汪 、 李靜儀 、 林倫偉 、 謝誓宏 、 高天 賜 、 梁孫旭 、 鄭安庭 ， 以及 多名 各界 友好 社團 負責人 到賀 。 侯沐天 、 理事 長 林靜儀 、 監事長 李悅 創等迎 迓 。         侯沐天 致詞 表示 ， 協會 成立 第四年 ， 旨在 團結 愛國 愛澳 人士 ， 開拓 、 指導 、 協調 和 推動 行業 專業化 、 程序化 、 標準化 ， 促進 行業 內 專業 人員 交流 、 推廣 、 宣傳 ， 包括 免費 幫助 居民 驗窗 、 免費 為 居民 提供 裝修 培訓 課程 自 以及 為會員 提供 維修 保養 服務 。 同時 積極 關心 社群 ， 參與 澳門 各項 公益 及 社會 活動 ， 並積極 扶持 社會 低下 層 。         隨後 ， 該會 向 永遠榮 譽會長 、 榮譽 會長 、 名譽 會長 、 會務 顧問 等 頒 發聘書 ， 還向 第三 屆 裝修 培訓班 的 學員 頒發 結業 證書 。,2025-01-10
華：美盟友配合散佈虛假信息,日聲稱中國黑客攻擊日企    華：美盟友配合散佈虛假信息    【本報綜合報道】據中新社、外媒九日消息：中國外交部發言人郭嘉昆一月九日在例行記者會上表示，中方注意到一些美國的盟友近來開始配合美方散佈關於中國的虛假信息，希望各方以客觀、公正、專業態度處理網絡安全問題。    既不專業也不負責    有記者提問，日本警察廳八日宣佈，中國政府涉嫌參與的黑客組織對日本二百多家企業、機構和團體發動了網絡攻擊。發言人對此有何評論？    郭嘉昆表示，中方注意到有關報道。中方堅決反對並依法打擊黑客攻擊行為，更反對將網絡安全問題政治化，這一立場是一貫的、明確的。眾所周知，網絡空間虛擬性強、溯源難、行為體多樣，日本相關機構僅憑黑客攻擊的目標和方法就作出有關判斷，不專業、不負責任。    “我們注意到，一些美國的盟友近來開始配合美方散佈關於中國的虛假信息，我們希望各方都能以事實為基礎，以國際規則為準繩，以客觀、公正、專業的態度處理網絡安全問題，而不是在政治鬧劇中扮演配角。”郭嘉昆說。    據日媒報道，日本警察廳周三（八日）表示，由二○一九年至二○二四年，Mirror Face針對日本的安全保障、尖端技術資訊的網絡攻擊個案達二百一十宗。    美是最大黑客帝國    本月三日，美國財政部發佈公告，指控“來自中國的惡意網絡行為者”近期攻擊了財政部的電腦系統。此外，為了佐證“中國對美國網絡安全構成嚴重威脅”這一說法，財政部還宣佈對一家總部位於北京的網絡安全公司實施制裁，指責該公司幫助中國駭客滲透美國通信系統。《華爾街日報》一月四日援引“知情人士”消息報道稱，“中國駭客”對美國電信公司攻擊的規模超出此前所知。    據報道，美國國家安全顧問沙利文在二○二三年秋的一次秘密會議上向電信和科技行業高管描述稱，這些所謂的“中國黑客”擁有驚人的技術水平，能夠“隨意關閉美國數十個港口、電網和其他基礎設施”，具有強大破壞力。    眾所周知，美國是世界上最大的“黑客帝國”，利用其技術優勢對其他國家政府甚至是本國公民進行長期監控和竊密，但一些對中國抱有偏見的美國政客卻無視事實，指責中國是美國網絡安全的最大威脅。,http://www.macaodaily.com/html/2025-01/10/content_1806263.htm,日聲稱中國黑客攻擊日企    華：美盟友配合散佈虛假信息    【本報綜合報道】據中新社、外媒九日消息：中國外交部發言人郭嘉昆一月九日在例行記者會上表示，中方注意到一些美國的盟友近來開始配合美方散佈關於中國的虛假信息，希望各方以客觀、公正、專業態度處理網絡安全問題,日聲 稱 中國 黑客 攻擊 日企         華 ： 美 盟友 配合 散 佈 虛假 信息         【 本報 綜合 報道 】 據 中新社 、 外媒 九日 消息 ： 中國 外交部 發言人 郭嘉昆 一月 九日 在 例行 記者 會 上 表示 ， 中方 注意 到 一些 美國 的 盟友 近來 開始 配合 美方 散 佈 關於中國 的 虛假 信息 ， 希望 各方 以 客觀 、 公正 、 專業 態度 處理 網絡 安全 問題 。         既 不 專業 也 不 負責         有 記者 提問 ， 日本 警察 廳 八日 宣 佈 ， 中國 政府 涉嫌 參與 的 黑客 組織 對 日本 二百多 家 企業 、 機構 和 團體 發動 了 網絡 攻擊 。 發言人 對 此 有何 評論 ？         郭嘉昆 表示 ， 中方 注意 到 有 關報 道 。 中方 堅決 反對並 依法 打擊 黑客 攻擊行 為 ， 更反 對將 網絡 安全 問題 政治化 ， 這一立場 是 一貫 的 、 明確 的 。 眾所 周知 ， 網絡 空間 虛擬 性強 、 溯源 難 、 行為 體多樣 ， 日本 相關 機構僅 憑 黑客 攻擊 的 目標 和 方法 就 作出 有關 判斷 ， 不 專業 、 不 負責任 。         “ 我們 注意 到 ， 一些 美國 的 盟友 近來 開始 配合 美方 散 佈 關於中國 的 虛假 信息 ， 我們 希望 各方 都 能 以事 實為 基礎 ， 以國際 規則 為 準繩 ， 以 客觀 、 公正 、 專業 的 態度 處理 網絡 安全 問題 ， 而 不是 在 政治 鬧劇 中 扮演 配角 。 ” 郭嘉昆 說 。         據 日 媒報 道 ， 日本 警察 廳 周三 （ 八日 ） 表示 ， 由 二 ○ 一 九年 至 二 ○ 二 四年 ， Mirror   Face 針對 日本 的 安全 保障 、 尖端 技術 資訊 的 網絡 攻擊個 案達 二百一十 宗 。         美是 最大 黑客 帝國         本月 三日 ， 美國 財政部發 佈 公告 ， 指控 “ 來 自中國 的 惡意 網絡行 為者 ” 近期 攻擊 了 財政部 的 電腦 系統 。 此外 ， 為 了 佐證 “ 中國 對 美國 網絡 安全 構成 嚴重 威脅 ” 這一 說法 ， 財政部 還宣 佈 對 一家 總 部位 於 北京 的 網絡 安全 公司 實施 制裁 ， 指責該 公司 幫助 中國 駭客 滲透 美國 通信 系統 。 《 華爾街 日報 》 一月 四日 援引 “ 知情 人士 ” 消息 報道 稱 ， “ 中國 駭客 ” 對美國 電信 公司 攻擊 的 規模 超出 此前 所知 。         據 報道 ， 美國國家 安全 顧問 沙利文 在 二 ○ 二三年 秋 的 一次 秘密 會議 上 向 電信 和 科技 行業 高管 描述 稱 ， 這些 所謂 的 “ 中國 黑客 ” 擁有 驚人 的 技術 水平 ， 能夠 “ 隨意 關閉 美國 數十個 港口 、 電網 和 其他 基礎 設施 ” ， 具有 強大破 壞力 。         眾所 周知 ， 美國 是 世界 上 最大 的 “ 黑客 帝國 ” ， 利用 其技術 優勢 對 其他 國家 政府 甚至 是 本國 公民 進行長 期 監控 和 竊密 ， 但 一些 對 中國 抱 有 偏見 的 美國 政客 卻 無視 事實 ， 指責 中國 是 美國 網絡 安全 的 最大 威脅 。,2025-01-10
中日重啟執政黨交流機制,中日重啟執政黨交流機制    【本報綜合報道】據新華社、中新社、外媒九日電：據日本共同社報道，九日，日本首相石破茂在首相官邸與即將訪華的日本自民黨幹事長森山裕、公明黨幹事長西田實仁會面，表示希望二人推進日中在各層面進行溝通，深化黨際交流。    石破茂冀盡早訪華    據悉，森山裕、西田實仁將於一月十三日至十五日率日本執政黨代表團訪華。雙方將共同舉行中日執政黨交流機制第九次會議。    綜合共同社和時事通訊社報道，森山裕向石破茂彙報他將率日本執政黨代表團訪華，參加中日執政黨交流機制第九次會議的相關事宜，石破茂則表示希望兩人“積累各種層面的交流”並深化黨際交流。    森山裕在會後表示，石破茂稱希望自己能夠盡早訪華，對中日執政黨交流機制會議成果表示期待，並希望能夠通過會議的重啟，推進各級別中日間交流。    料帶石破茂親筆信    森山裕預計將帶着石破茂的親筆信訪華，當中提及關於朝鮮發射彈道導彈等問題，他表示：“日中發揮怎樣的作用十分重要，有很多協商事項”。西田實仁則表示：“該主張的就主張，相互合作的地方就相互合作”。    日經中文網報道，由於新冠疫情等原因，日中執政黨交流機制在二○一八年十月之後中斷，直到中方官員去年五月訪問日本時，雙方才就重啟這一磋商機制達成一致。本次重啟日中執政黨交流機制，也說明兩國政府間的對話將擴展到政黨，政黨間的溝通可能成為解決問題的關鍵，或者對安全保障方面的緊張局勢起到制約作用。    重視與日各界交流    中共中央對外聯絡部發言人近日宣佈，應中國共產黨邀請，日本自民黨幹事長森山裕、公明黨幹事長西田實仁將於一月十三日至十五日率日本執政黨代表團訪華。雙方將共同舉行中日執政黨交流機制第九次會議。    發言人郭嘉昆九日在外交部例行記者會上就此訪應詢指出，政黨交流是中日關係的重要組成部分，中方重視同日本朝野政黨及各界人士開展對話交流，共同推動中日關係改善發展。,http://www.macaodaily.com/html/2025-01/10/content_1806264.htm,中日重啟執政黨交流機制    【本報綜合報道】據新華社、中新社、外媒九日電：據日本共同社報道，九日，日本首相石破茂在首相官邸與即將訪華的日本自民黨幹事長森山裕、公明黨幹事長西田實仁會面，表示希望二人推進日中在各層面進行溝通，深化黨際交流,中日 重啟 執政黨 交流 機制         【 本報 綜合 報道 】 據 新華社 、 中新社 、 外媒 九日 電 ： 據 日本共同社 報道 ， 九日 ， 日本首相 石破茂 在 首相 官邸 與 即 將訪華 的 日本 自民黨 幹事長 森山 裕 、 公明 黨 幹事長 西田 實仁會面 ， 表示 希望 二人 推進 日 中 在 各層面 進行 溝通 ， 深化 黨際 交流 。         石破茂 冀盡早 訪華         據悉 ， 森山 裕 、 西田 實仁將 於 一月 十三日 至 十五日 率 日本 執政黨 代表 團訪華 。 雙方將 共同 舉行 中日 執政黨 交流 機制 第九次 會議 。         綜合 共同社 和 時事 通訊 社報 道 ， 森山 裕 向 石破茂 彙 報 他 將率 日本 執政黨 代表 團訪華 ， 參加 中日 執政黨 交流 機制 第九次 會議 的 相關 事宜 ， 石破茂 則 表示 希望 兩人 “ 積累 各種 層面 的 交流 ” 並 深化 黨際 交流 。         森山 裕 在 會 後 表示 ， 石破茂 稱 希望 自己 能夠 盡早 訪華 ， 對 中日 執政黨 交流 機制 會議 成果 表示 期待 ， 並 希望 能夠 通過 會議 的 重啟 ， 推進 各級別 中日 間 交流 。         料帶 石破茂 親筆信         森山 裕 預計 將帶 着 石破茂 的 親筆 信訪華 ， 當中 提及 關於朝鮮 發射彈 道 導彈 等 問題 ， 他 表示 ： “ 日中 發揮 怎樣 的 作用 十分 重要 ， 有 很多 協 商事 項 ” 。 西田 實仁則 表示 ： “ 該主張 的 就 主張 ， 相互合作 的 地方 就 相互合作 ” 。         日經 中文 網報 道 ， 由 於 新冠 疫情 等 原因 ， 日中 執政黨 交流 機制 在 二 ○ 一 八年 十月 之後中斷 ， 直到 中方 官員 去年 五月 訪問 日本 時 ， 雙 方才 就 重啟 這一 磋商 機制 達成 一致 。 本次 重啟 日 中 執政黨 交流 機制 ， 也 說明 兩國 政府 間 的 對 話將 擴展 到 政黨 ， 政黨間 的 溝通 可能 成為 解決 問題 的 關鍵 ， 或者 對 安全 保障 方面 的 緊張 局勢 起到 制約 作用 。         重視 與 日 各界 交流         中共中央 對外 聯絡部 發言人 近日 宣 佈 ， 應中 國共產黨 邀請 ， 日本 自民黨 幹事長 森山 裕 、 公明 黨 幹事長 西田 實仁將 於 一月 十三日 至 十五日 率 日本 執政黨 代表 團訪華 。 雙方將 共同 舉行 中日 執政黨 交流 機制 第九次 會議 。         發言人 郭嘉昆 九日 在 外交部 例行 記者 會 上 就此 訪應詢 指出 ， 政黨 交流 是 中日 關 係 的 重要 組成 部分 ， 中方 重視同 日本 朝野 政黨 及 各界人士 開展 對 話 交流 ， 共同 推動 中日 關 係 改善 發展 。,2025-01-10
乍得總理會見王毅,乍得總理會見王毅    【據新華社恩賈梅納八日電】當地時間一月八日，乍得總理哈里納在恩賈梅納會見中共中央政治局委員、外交部長王毅。    王毅說，閣下是中國人民的老朋友、好朋友，擔任駐華大使期間，為促進中乍友好發揮了橋樑和紐帶作用。期待你在新的重要崗位上，繼續支持兩國互利合作，推動兩國關係取得更大發展。    中乍關係邁新台階    王毅表示，去年九月，穆罕默德總統專程赴華出席中非合作論壇北京峰會，兩國元首將雙邊關係提升為戰略伙伴關係，推動中乍關係邁上新台階。在兩國元首戰略引領下，雙邊合作呈現快速發展勢頭。中方願同乍方加強全方位合作，繼續在重大問題上堅定相互支持，共同反對強權霸凌，維護雙方正當權益，維護國際公平正義。習近平主席在北京峰會上提出中非攜手實現現代化十大伙伴行動，每一項行動都符合包括乍得在內非洲各國的發展需要，都契合非洲人民的共同願望，都將為乍得發展振興提供實實在在的助力。中方願同乍方加強對接，推動十大伙伴行動在乍得落地見效。    歡迎中企來乍投資    哈里納說，去年九月，穆罕默德總統與習近平主席舉行富有成果的會談，決定將兩國友好合作提升到新的水平。乍得政府將積極落實兩國元首共識，把對華關係置於外交政策最優先位置，做中國最堅定、最可靠的伙伴。世界上只有一個中國，台灣是中國不可分割的一部分，乍得堅定奉行一個中國政策。乍方高度讚賞、完全認同習近平主席提出的人類命運共同體理念和攜手實現世界現代化的願景，期待同中方深化互利合作，實現共同發展。歡迎更多中國企業來乍得投資興業。我雖已不再擔任駐華大使，但要繼續發揮友好使者的作用，致力於擴大對華合作，為乍中關係發展不懈努力。,http://www.macaodaily.com/html/2025-01/10/content_1806265.htm,中乍關係邁新台階    王毅表示，去年九月，穆罕默德總統專程赴華出席中非合作論壇北京峰會，兩國元首將雙邊關係提升為戰略伙伴關係，推動中乍關係邁上新台階,乍得 總理會 見 王毅         【 據 新華 社恩 賈梅納 八日 電 】 當地 時間 一月 八日 ， 乍得 總理 哈里 納在 恩 賈梅 納會 見 中共中央政治局 委員 、 外交部 長 王毅 。         王毅 說 ， 閣下 是 中國 人民 的 老朋友 、 好 朋友 ， 擔任 駐華 大使 期間 ， 為 促進 中 乍 友好 發揮 了橋 樑 和 紐帶 作用 。 期待 你 在 新 的 重要 崗位 上 ， 繼續 支持 兩國 互利 合作 ， 推動 兩國關 係 取得 更大 發展 。         中乍關 係 邁新台 階         王毅 表示 ， 去年 九月 ， 穆罕默德 總統 專程 赴 華 出席 中非 合作 論壇 北京 峰會 ， 兩國 元首 將雙 邊關 係 提升 為 戰略 伙伴 關 係 ， 推動 中乍關 係 邁上 新 台階 。 在 兩國 元首 戰略 引領 下 ， 雙邊 合作 呈現 快速 發展 勢頭 。 中方 願同 乍 方加強 全方位 合作 ， 繼續 在 重大 問題 上 堅定 相互支持 ， 共同 反對 強權 霸凌 ， 維護雙 方正 當權益 ， 維護國際 公平 正義 。 習近 平 主席 在 北京 峰會 上 提出 中非 攜手 實現 現代化 十大 伙伴 行動 ， 每一項 行動 都 符合 包括 乍得 在 內 非洲 各國 的 發展 需要 ， 都 契合 非洲 人民 的 共同 願望 ， 都 將為 乍得 發展 振興 提供 實實 在 在 的 助力 。 中方 願同 乍 方加強 對 接 ， 推動 十大 伙伴 行動 在 乍得 落地 見效 。         歡迎 中企 來 乍 投資         哈里 納說 ， 去年 九月 ， 穆罕默德 總統 與 習近 平 主席 舉行 富有成果 的 會 談 ， 決定將 兩國 友好合作 提升 到 新 的 水平 。 乍得 政府 將積 極落實 兩國 元首 共識 ， 把 對華關 係 置 於 外交政策 最 優先 位置 ， 做 中國 最 堅定 、 最 可靠 的 伙伴 。 世界 上 只有 一個 中國 ， 台灣 是 中國 不可分割 的 一部分 ， 乍得 堅定 奉行 一個 中國 政策 。 乍方 高度 讚 賞 、 完全 認同習 近平 主席 提出 的 人類 命運 共同 體 理念 和 攜手 實現 世界 現代化 的 願景 ， 期待 同 中方 深化 互利 合作 ， 實現 共同 發展 。 歡迎 更 多 中國 企業 來 乍得 投資興業 。 我 雖 已 不再 擔任 駐華 大使 ， 但要 繼續 發揮 友好使者 的 作用 ， 致力 於 擴大 對華 合作 ， 為 乍 中關 係 發展 不懈努力 。,2025-01-10
